"1207.0164","Matthias Beck","Matthias Beck, Pallavi Jayawant, and Tyrrell B. McAllister","Lattice-point generating functions for free sums of convex sets","17 pages, 2 figures, to appear in Journal of Combinatorial Theory
  Series A","Journal of Combinatorial Theory Series A 120 (2013), 1246-1262",,,"math.CO","http://arxiv.org/licenses/nonexclusive-distrib/1.0/","  Let $\J$ and $\K$ be convex sets in $\R^{n}$ whose affine spans intersect at
a single rational point in $\J \cap \K$, and let $\J \oplus \K = \conv(\J \cup
\K)$. We give formulas for the generating function {equation*} \sigma_{\cone(\J
\oplus \K)}(z_1,..., z_n, z_{n+1}) = \sum_{(m_1,..., m_n) \in t(\J \oplus \K)
\cap \Z^{n}} z_1^{m_1}... z_n^{m_n} z_{n+1}^{t} {equation*} of lattice points
in all integer dilates of $\J \oplus \K$ in terms of $\sigma_{\cone \J}$ and
$\sigma_{\cone \K}$, under various conditions on $\J$ and $\K$. This work is
motivated by (and recovers) a product formula of B.\ Braun for the Ehrhart
series of $\P \oplus \Q$ in the case where $\P$ and $\Q$ are lattice polytopes
containing the origin, one of which is reflexive. In particular, we find
necessary and sufficient conditions for Braun's formula and its multivariate
analogue.
","[{""version"":""v1"",""created"":""Sat, 30 Jun 2012 22:56:55 GMT""},{""version"":""v2"",""created"":""Fri, 8 Mar 2013 00:50:20 GMT""}]","2016-06-07"
"1207.0165","Luca Parisi Ph.D.","Iv\'an Dur\'an and Luca Parisi","Holographic dark energy described at the Hubble length","15 pages, 6 figures","Phys. Rev. D 85, 123538 (2012)","10.1103/PhysRevD.85.123538",,"astro-ph.CO gr-qc hep-ph hep-th","http://arxiv.org/licenses/nonexclusive-distrib/1.0/","  We consider holographic cosmological models of dark energy in which the
infrared cutoff is set by the Hubble's radius. We show that any interacting
dark energy model with a matter like term able to alleviate the coincidence
problem (i.e., with a positive interaction term, regardless of its detailed
form) can be recast as a noninteracting model in which the holographic
parameter evolves slowly with time. Two specific cases are analyzed. First, the
interacting model presented in [1] is considered, and its corresponding
noninteracting version found. Then, a new noninteracting model, with a specific
expression of the time-dependent holographic parameter, is proposed and
analyzed along with its corresponding interacting version. We constrain the
parameters of both models using observational data, and show that they can be
told apart at the perturbative level.
","[{""version"":""v1"",""created"":""Sat, 30 Jun 2012 23:01:12 GMT""}]","2012-07-03"
"1207.0166","Claudio Gentile","Claudio Gentile and Francesco Orabona","On Multilabel Classification and Ranking with Partial Feedback",,,,,"cs.LG","http://arxiv.org/licenses/nonexclusive-distrib/1.0/","  We present a novel multilabel/ranking algorithm working in partial
information settings. The algorithm is based on 2nd-order descent methods, and
relies on upper-confidence bounds to trade-off exploration and exploitation. We
analyze this algorithm in a partial adversarial setting, where covariates can
be adversarial, but multilabel probabilities are ruled by (generalized) linear
models. We show O(T^{1/2} log T) regret bounds, which improve in several ways
on the existing results. We test the effectiveness of our upper-confidence
scheme by contrasting against full-information baselines on real-world
multilabel datasets, often obtaining comparable performance.
","[{""version"":""v1"",""created"":""Sat, 30 Jun 2012 23:07:03 GMT""},{""version"":""v2"",""created"":""Tue, 20 Nov 2012 16:48:22 GMT""},{""version"":""v3"",""created"":""Wed, 16 Jan 2013 19:19:34 GMT""}]","2013-01-17"
"1207.0167","Phani Motamarri","Phani Motamarri, Michael R Nowak, Kenneth Leiter, Jaroslaw Knap,
  Vikram Gavini","Higher-order adaptive finite-element methods for Kohn-Sham density
  functional theory","arXiv admin note: text overlap with arXiv:1110.1280",,"10.1016/j.jcp.2013.06.042",,"physics.comp-ph","http://arxiv.org/licenses/nonexclusive-distrib/1.0/","  We present an efficient computational approach to perform real-space
electronic structure calculations using an adaptive higher-order finite-element
discretization of Kohn-Sham density-functional theory (DFT). To this end, we
develop an a-priori mesh adaption technique to construct a close to optimal
finite-element discretization of the problem. We further propose an efficient
solution strategy for solving the discrete eigenvalue problem by using spectral
finite-elements in conjunction with Gauss-Lobatto quadrature, and a Chebyshev
acceleration technique for computing the occupied eigenspace. The proposed
approach has been observed to provide a staggering 100-200 fold computational
advantage over the solution of a generalized eigenvalue problem. Using the
proposed solution procedure, we investigate the computational efficiency
afforded by higher-order finite-element discretization of the Kohn-Sham DFT
problem. Our studies suggest that staggering computational savings of the order
of 1000 fold relative to linear finite-elements can be realized, for both
all-electron and local pseudopotential calculations. On all the benchmark
systems studied, we observe diminishing returns in computational savings beyond
the sixth-order for accuracies commensurate with chemical accuracy. A
comparative study of the computational efficiency of the proposed higher-order
finite-element discretizations suggests that the performance of finite-element
basis is competing with the plane-wave discretization for non-periodic local
pseudopotential calculations, and compares to the Gaussian basis for
all-electron calculations within an order of magnitude. Further, we demonstrate
the capability of the proposed approach to compute the electronic structure of
a metallic system containing 1688 atoms using modest computational resources,
and good scalability of the present implementation up to 192 processors.
","[{""version"":""v1"",""created"":""Sat, 30 Jun 2012 23:56:07 GMT""},{""version"":""v2"",""created"":""Tue, 3 Jul 2012 14:23:12 GMT""},{""version"":""v3"",""created"":""Sun, 29 Jul 2012 17:36:35 GMT""},{""version"":""v4"",""created"":""Wed, 12 Dec 2012 16:12:06 GMT""},{""version"":""v5"",""created"":""Thu, 4 Jul 2013 04:59:31 GMT""}]","2015-06-05"
"1207.0168","Fu-Guo Deng","Bao-Cang Ren, Hai-Rui Wei, Ming Hua, Tao Li, Fu-Guo Deng","Complete hyperentangled-Bell-state analysis for photon systems assisted
  by quantum-dot spins in optical microcavities","11 pages (in one column), 5 figures","Optics Express 20, 24664-24677 (2012)","10.1364/OE.20.024664",,"quant-ph","http://arxiv.org/licenses/nonexclusive-distrib/1.0/","  Bell-state analysis (BSA) is essential in quantum communication, but it is
impossible to distinguish unambiguously the four Bell states in the
polarization degree of freedom (DOF) of two-photon systems with only linear
optical elements, except for the case in which the BSA is assisted with
hyperentangled states, the simultaneous entanglement in more than one DOF.
Here, we propose a scheme to distinguish completely the 16 hyperentangled Bell
states in both the polarization and the spatial-mode DOFs of two-photon
systems, by using the giant nonlinear optics in quantum dot-cavity systems.
This scheme can be applied to increase the channel capacity of long-distance
quantum communication based on hyperentanglement, such as entanglement
swapping, teleportation, and superdense coding. We use hyperentanglement
swapping as an example to show the application of this HBSA.
","[{""version"":""v1"",""created"":""Sun, 1 Jul 2012 00:25:51 GMT""},{""version"":""v2"",""created"":""Mon, 15 Oct 2012 03:32:56 GMT""}]","2015-06-05"
"1207.0169","Isaac Goldbring","Isaac Goldbring, Bradd Hart, Thomas Sinclair","The theory of tracial von Neumann algebras does not have a model
  companion","6 pages; this version no longer relies on the Connes Embedding
  Problem to establish the main result",,,,"math.LO math.OA","http://arxiv.org/licenses/nonexclusive-distrib/1.0/","  In this note, we show that the theory of tracial von Neumann algebras does
not have a model companion. This will follow from the fact that the theory of
any locally universal, McDuff II_1 factor does not have quantifier elimination.
We also show how a positive solution to the Connes Embedding Problem implies
that there can be no model-complete theory of II_1 factors.
","[{""version"":""v1"",""created"":""Sun, 1 Jul 2012 00:28:16 GMT""},{""version"":""v2"",""created"":""Fri, 6 Jul 2012 20:26:58 GMT""},{""version"":""v3"",""created"":""Thu, 26 Jul 2012 16:05:41 GMT""}]","2012-07-30"
"1207.0170","M Taghizadeh-Popp","M. Taghizadeh-Popp, S. Heinis and A. S. Szalay","Single parameter galaxy classification: The Principal Curve through the
  multi-dimensional space of galaxy properties","Full abstract in downloadable version",,"10.1088/0004-637X/755/2/143",,"astro-ph.CO cs.CV stat.ML","http://arxiv.org/licenses/nonexclusive-distrib/1.0/","  We propose to describe the variety of galaxies from SDSS by using only one
affine parameter. To this aim, we build the Principal Curve (P-curve) passing
through the spine of the data point cloud, considering the eigenspace derived
from Principal Component Analysis of morphological, physical and photometric
galaxy properties. Thus, galaxies can be labeled, ranked and classified by a
single arc length value of the curve, measured at the unique closest projection
of the data points on the P-curve. We find that the P-curve has a ""W"" letter
shape with 3 turning points, defining 4 branches that represent distinct galaxy
populations. This behavior is controlled mainly by 2 properties, namely u-r and
SFR. We further present the variations of several galaxy properties as a
function of arc length. Luminosity functions variate from steep Schechter fits
at low arc length, to double power law and ending in Log-normal fits at high
arc length. Galaxy clustering shows increasing autocorrelation power at large
scales as arc length increases. PCA analysis allowed to find peculiar galaxy
populations located apart from the main cloud of data points, such as small red
galaxies dominated by a disk, of relatively high stellar mass-to-light ratio
and surface mass density. The P-curve allows not only dimensionality reduction,
but also provides supporting evidence for relevant physical models and
scenarios in extragalactic astronomy: 1) Evidence for the hierarchical merging
scenario in the formation of a selected group of red massive galaxies. These
galaxies present a log-normal r-band luminosity function, which might arise
from multiplicative processes involved in this scenario. 2) Connection between
the onset of AGN activity and star formation quenching, which appears in green
galaxies when transitioning from blue to red populations. (Full abstract in
downloadable version)
","[{""version"":""v1"",""created"":""Sun, 1 Jul 2012 00:32:15 GMT""}]","2015-06-05"
"1207.0171","Xi Dong","Ning Bao, Xi Dong, Sarah Harrison, Eva Silverstein","The Benefits of Stress: Resolution of the Lifshitz Singularity","16 pages; v2: new references added","Phys.Rev.D86:106008,2012","10.1103/PhysRevD.86.106008","SLAC-PUB-15119; SU-ITP-12/18","hep-th cond-mat.str-el gr-qc","http://arxiv.org/licenses/nonexclusive-distrib/1.0/","  Through the AdS/CFT correspondence, Lifshitz spacetimes describe field
theories with dynamical scaling ($z \neq 1$). Although curvature invariants are
small, the Lifshitz metric exhibits a null singularity in the IR with a large
tidal force that excites string oscillator modes. However, Lifshitz is not a
vacuum solution of the Einstein equations -- the metric is supported by
nontrivial matter content which must be taken into account in analyzing the
propagation of test objects. In this paper, we consider the interaction of a
string with a D0-brane density in the IR which supports a class of UV-complete
$z=2$ Lifshitz constructions. We show that string/D-brane scattering in the
Regge limit slows the string significantly, preventing divergent mode
production and resolving the would-be singularity in string propagation.
","[{""version"":""v1"",""created"":""Sun, 1 Jul 2012 00:38:43 GMT""},{""version"":""v2"",""created"":""Tue, 15 Jan 2013 20:53:22 GMT""}]","2013-01-16"
"1207.0172","Eugen J. Ionascu Dr","Eugen J. Ionascu and Jeff Patterson","Primes of the form \pm a^2\pm qb^2","12 pages, 1 figure",,,,"math.NT","http://arxiv.org/licenses/nonexclusive-distrib/1.0/","  Representations of primes by simple quadratic forms, such as $\pm a^2\pm
qb^2$, is a subject that goes back to Fermat, Lagrange, Legendre, Euler, Gauss
and many others. We are interested in a comprehensive list of such results, for
$q\le 20$. Some of the results can be established with elementary methods and
we put them at work on some instances. We are introducing new relationships
between various representations.
","[{""version"":""v1"",""created"":""Sun, 1 Jul 2012 01:45:50 GMT""},{""version"":""v2"",""created"":""Sun, 14 Apr 2013 03:48:45 GMT""}]","2013-04-16"
"1207.0173","Ross Springell","S. Boseggia, R Springell, H C Walker, A T Boothroyd, D Prabhakaran, S
  P Collins and D F McMorrow","On the magnetic structure of Sr3Ir2O7: an x-ray resonant scattering
  study","5 pages, 6 figures","2012 J. Phys.: Condens. Matter 24 312202","10.1088/0953-8984/24/31/312202",,"cond-mat.str-el","http://arxiv.org/licenses/nonexclusive-distrib/1.0/","  This report presents azimuthal dependent and polarisation dependent x-ray
resonant magnetic scattering at the Ir L3 edge for the bilayered iridate
compound, Sr3Ir2O7. Two magnetic wave vectors, k1=(1/2,1/2,0) and
k2=(1/2,-1/2,0), result in domains of two symmetry-related G-type
antiferromagnetic structures, noted A and B, respectively. These domains are
approximately 0.02 mm^2 and are independent of the thermal history. An
understanding of this key aspect of the magnetism is necessary for an overall
picture of the magnetic behaviour in this compound. Azimuthal and polarisation
dependence of magnetic reflections, relating to both magnetic wave vectors,
show that the Ir magnetic moments in the bilayer compound are oriented along
the c axis. This contrasts with single layer Sr2IrO4 where the moments are
confined to the ab plane.
","[{""version"":""v1"",""created"":""Sun, 1 Jul 2012 01:48:39 GMT""}]","2012-08-31"
"1207.0174","Quan Zhou","Quan Zhou, Bo-Fang Liu, Chun-Mei Li and Bao-Chang Zhong","Aspect ratio dependence of heat transport by turbulent
  Rayleigh-B\'{e}nard convection in rectangular cells","15 pages, 7 figures, Accepted by Journal of Fluid Mechanics",,"10.1017/jfm.2012.363",,"physics.flu-dyn","http://creativecommons.org/licenses/by/3.0/","  We report high-precision measurements of the Nusselt number $Nu$ as a
function of the Rayleigh number $Ra$ in water-filled rectangular
Rayleigh-B\'{e}nard convection cells. The horizontal length $L$ and width $W$
of the cells are 50.0 cm and 15.0 cm, respectively, and the heights $H=49.9$,
25.0, 12.5, 6.9, 3.5, and 2.4 cm, corresponding to the aspect ratios
$(\Gamma_x\equiv L/H,\Gamma_y\equiv W/H)=(1,0.3)$, $(2,0.6)$, $(4,1.2)$,
$(7.3,2.2)$, $(14.3,4.3)$, and $(20.8,6.3)$. The measurements were carried out
over the Rayleigh number range $6\times10^5\lesssim Ra\lesssim10^{11}$ and the
Prandtl number range $5.2\lesssim Pr\lesssim7$. Our results show that for
rectangular geometry turbulent heat transport is independent of the cells'
aspect ratios and hence is insensitive to the nature and structures of the
large-scale mean flows of the system. This is slightly different from the
observations in cylindrical cells where $Nu$ is found to be in general a
decreasing function of $\Gamma$, at least for $\Gamma=1$ and larger. Such a
difference is probably a manifestation of the finite plate conductivity effect.
Corrections for the influence of the finite conductivity of the top and bottom
plates are made to obtain the estimates of $Nu_{\infty}$ for plates with
perfect conductivity. The local scaling exponents $\beta_l$ of $Nu_{\infty}\sim
Ra^{\beta_l}$ are calculated and found to increase from 0.243 at
$Ra\simeq9\times10^5$ to 0.327 at $Ra\simeq4\times10^{10}$.
","[{""version"":""v1"",""created"":""Sun, 1 Jul 2012 02:26:58 GMT""}]","2015-06-05"
"1207.0175","Vianney Combet","Vianney Combet, Tai-Peng Tsai, Ian Zwiers","Local Dynamics Near Unstable Branches of NLS Solitons","22 pages, 2 figures, v2: comments and references added",,,,"math.AP","http://arxiv.org/licenses/nonexclusive-distrib/1.0/","  Consider a branch of unstable solitons of NLS whose linearized operators have
one pair of simple real eigenvalues in addition to the zero eigenvalue. Under
radial symmetry and standard assumptions, solutions to initial data from a
neighbourhood of the branch either converge to a soliton, or exit a larger
neighbourhood of the branch transversally. The qualitative dynamic near a
branch of unstable solitons is irrespective of whether blowup eventually
occurs, which has practical implications for the description of blowup of NLS
with supercritical nonlinearity.
","[{""version"":""v1"",""created"":""Sun, 1 Jul 2012 03:06:59 GMT""},{""version"":""v2"",""created"":""Sat, 5 Jan 2013 17:06:38 GMT""}]","2013-01-08"
"1207.0176","Yoichi Takeda","Yoichi Takeda, Akito Tajitsu, Satoshi Honda, Satoshi Kawanomoto,
  Hiroyasu Ando, and Takashi Sakurai","Detection of Low-Level Activities in Solar-Analog Stars from the
  Emission Strengths of Ca II 3934 Line","12 pages, 7 figures, 1 table; acccepted for publication in Publ.
  Astron. Soc. Japan",,,,"astro-ph.SR","http://arxiv.org/licenses/nonexclusive-distrib/1.0/","  Activity studies of solar-type stars, especially with reference to the status
of our current Sun among them, have exposed the importance of (1) homogeneously
selecting the sample stars and (2) reliably evaluating their activities down to
a considerably low level. Motivated by these requirements, we conducted an
extensive study on the activities of 118 solar-analog stars (of sufficiently
similar properties to each other) by measuring the emission strength at the
core of Ca II 3933.663 line (K line) on the high-dispersion spectrogram
obtained by Subaru/HDS, where special attention was paid to correctly detecting
the chromospheric emission by removing the wing-fitted photospheric profile
calculated from the classical solar model atmosphere. This enabled us to detect
low-level activities down to log R' ~ -5.4 (R' is the ratio of the
chromospheric core emission flux to the total bolometric flux), by which we
could detect subtle activity differences which were indiscernible in previous
studies. Regarding the Sun, we found log R'sun = -5.33 near to the low end of
the distribution, which means that it belongs to the distinctly low activity
group among solar analogs. This excludes the once-suggested possibility for the
high frequency of Maunder-minimum stars showing appreciably lower activities
than the minimum-Sun.
","[{""version"":""v1"",""created"":""Sun, 1 Jul 2012 03:23:50 GMT""}]","2012-07-03"
"1207.0177","Yoichi Takeda","Yoichi Takeda and Satoru Ueno","Detection of Gravitational Redshift on the Solar Disk by Using
  Iodine-Cell Technique","28 pages, 12 figures, electronic materials as ancillary data (table3,
  table 4, ReadMe); accepted for publication in Solar Physics",,"10.1007/s11207-012-0068-8",,"astro-ph.SR","http://arxiv.org/licenses/nonexclusive-distrib/1.0/","  With an aim to examine whether the predicted solar gravitational redshift can
be observationally confirmed under the influence of the convective Doppler
shift due to granular motions, we attempted measuring the absolute spectral
line-shifts on a large number of points over the solar disk based on an
extensive set of 5188-5212A region spectra taken through an iodine-cell with
the Solar Domeless Telescope at Hida Observatory. The resulting heliocentric
line shifts at the meridian line (where no rotational shift exists), which were
derived by finding the best-fit parameterized model spectrum with the observed
spectrum and corrected for the earth's motion, turned out to be weakly
position-dependent as ~ +400 m/s near the disk center and increasing toward the
limb up to ~ +600 m/s (both with a standard deviation of sigma ~ 100 m/s).
Interestingly, this trend tends to disappear when the convectiveshift due to
granular motions (~-300 m/s at the disk center and increasing toward the limb;
simulated based on the two-component model along with the empirical
center-to-limb variation) is subtracted, finally resulting in the averaged
shift of 698 m/s (sigma = 113 m/s). Considering the ambiguities involved in the
absolute wavelength calibration or in the correction due to convective Doppler
shifts (at least several tens m/s, or more likely up to <~100 m/s), we may
regard that this value is well consistent with the expected gravitational
redshift of 633 m/s.
","[{""version"":""v1"",""created"":""Sun, 1 Jul 2012 03:53:10 GMT""}]","2015-06-05"
"1207.0178","Walter R. Johnson","W. R. Johnson and J. Nilsen and K. T. Cheng","Thomson scattering in the average-atom approximation","9 pages, 9 figures","Physical Review E 86, 036410 (2012)","10.1103/PhysRevE.86.036410",,"physics.plasm-ph","http://arxiv.org/licenses/nonexclusive-distrib/1.0/","  The average-atom model is applied to study Thomson scattering of x-rays from
warm-dense matter with emphasis on scattering by bound electrons. Parameters
needed to evaluate the dynamic structure function (chemical potential, average
ionic charge, free electron density, bound and continuum wave-functions and
occupation numbers) are obtained from the average-atom model. The resulting
analysis provides a relatively simple diagnostic for use in connection with
x-ray scattering measurements. Applications are given to dense hydrogen,
beryllium, aluminum and titanium plasmas. In the case of titanium, bound states
are predicted to modify the spectrum significantly.
","[{""version"":""v1"",""created"":""Sun, 1 Jul 2012 04:38:04 GMT""},{""version"":""v2"",""created"":""Sun, 8 Jul 2012 21:00:18 GMT""},{""version"":""v3"",""created"":""Sun, 26 Aug 2012 21:50:45 GMT""},{""version"":""v4"",""created"":""Mon, 1 Oct 2012 18:37:28 GMT""}]","2015-06-05"
"1207.0179","Koji Tsumura","Hiroaki Sugiyama, Koji Tsumura, Hiroshi Yokoya","Discrimination of models including doubly charged scalar bosons by using
  tau lepton decay distributions","13 pages, 8 eps files; published in Physics Letter B",,"10.1016/j.physletb.2012.09.044","UT-HET 070","hep-ph","http://arxiv.org/licenses/nonexclusive-distrib/1.0/","  The doubly charged scalar boson (H^{\pm\pm}) is introduced in several models
of the new physics beyond the standard model. The H^{\pm\pm} has Yukawa
interactions with two left-handed charged leptons or two right-handed charged
leptons depending on the models. We study kinematical properties of H^{\pm\pm}
decay products through tau leptons in order to discriminate the chiral
structures of the new Yukawa interaction. The chirality of tau leptons can be
measured by the energy distributions of the tau decay products, and thus the
chiral structure of the new Yukawa interaction can be traced in the
invariant-mass distributions of the H^{\pm\pm} decay products. We perform
simulation studies for the typical decay patterns of the H^{\pm\pm} with simple
event selections and tau-tagging procedures, and show that the chiral structure
of the Yukawa interactions of H^{\pm\pm} can be distinguished by measuring the
invariant-mass distributions.
","[{""version"":""v1"",""created"":""Sun, 1 Jul 2012 05:31:46 GMT""},{""version"":""v2"",""created"":""Fri, 5 Oct 2012 07:05:44 GMT""}]","2015-06-05"
"1207.0180","Sivasankar M","M. Sivasankar","Generation of Efficient Key Bit-Streams","another version is updated so this is withdrawn",,,,"cs.CR","http://arxiv.org/licenses/nonexclusive-distrib/1.0/","  Stream ciphers play important role in cryptography. In this paper we do a
survey on stream ciphers.Various possible attacks are analyzed.
","[{""version"":""v1"",""created"":""Sun, 1 Jul 2012 05:35:37 GMT""},{""version"":""v2"",""created"":""Sat, 21 Jul 2012 11:55:15 GMT""}]","2012-07-24"
"1207.0181","Hiroyuki Kamano","H. Kamano, T.-S. H. Lee","Pion-Exchange and Fermi-Motion Effects on the Proton-Deuteron Drell-Yan
  Process","27 pages, 10 figures. A couple of new numerical results are added.
  arXiv admin note: substantial text overlap with arXiv:1106.5564","Phys. Rev. D 86, 094037 (2012)","10.1103/PhysRevD.86.094037",,"hep-ph hep-ex nucl-ex nucl-th","http://arxiv.org/licenses/nonexclusive-distrib/1.0/","  Within a nuclear model that the deuteron has NN and \pi NN components, we
derive convolution formula for investigating the Drell-Yan process in
proton-deuteron (pd) reactions. The contribution from the \pi NN component is
expressed in terms of a pion momentum distribution that depends sensitively on
the \pi NN form factor. With a \pi NN form factor determined by fitting the \pi
N scattering data up to invariant mass W = 1.3 GeV, we find that the
pion-exchange and nucleon Fermi-motion effects can change significantly the
ratios between the proton-deuteron and proton-proton Drell-Yan cross sections,
R_{pd/pp} = \sigma^{pd}/(2\sigma^{pp}), in the region where the partons emitted
from the target deuteron are in the Bjorken x_2 > 0.4 region. The calculated
ratios R_{pd/pp} at 800 GeV agree with the available data. Predictions at 120
GeV for analyzing the forthcoming data from Fermilab are presented.
","[{""version"":""v1"",""created"":""Sun, 1 Jul 2012 05:50:03 GMT""},{""version"":""v2"",""created"":""Wed, 19 Sep 2012 04:14:22 GMT""}]","2012-11-28"
