"1207.0145","Martina-Cezara Albutiu","Martina-Cezara Albutiu, Alfons Kemper, Thomas Neumann","Massively Parallel Sort-Merge Joins in Main Memory Multi-Core Database
  Systems","VLDB2012","Proceedings of the VLDB Endowment (PVLDB), Vol. 5, No. 10, pp.
  1064-1075 (2012)",,,"cs.DB","http://arxiv.org/licenses/nonexclusive-distrib/1.0/","  Two emerging hardware trends will dominate the database system technology in
the near future: increasing main memory capacities of several TB per server and
massively parallel multi-core processing. Many algorithmic and control
techniques in current database technology were devised for disk-based systems
where I/O dominated the performance. In this work we take a new look at the
well-known sort-merge join which, so far, has not been in the focus of research
in scalable massively parallel multi-core data processing as it was deemed
inferior to hash joins. We devise a suite of new massively parallel sort-merge
(MPSM) join algorithms that are based on partial partition-based sorting.
Contrary to classical sort-merge joins, our MPSM algorithms do not rely on a
hard to parallelize final merge step to create one complete sort order. Rather
they work on the independently created runs in parallel. This way our MPSM
algorithms are NUMA-affine as all the sorting is carried out on local memory
partitions. An extensive experimental evaluation on a modern 32-core machine
with one TB of main memory proves the competitive performance of MPSM on large
main memory databases with billions of objects. It scales (almost) linearly in
the number of employed cores and clearly outperforms competing hash join
proposals - in particular it outperforms the ""cutting-edge"" Vectorwise parallel
query engine by a factor of four.
","[{""version"":""v1"",""created"":""Sat, 30 Jun 2012 20:23:09 GMT""}]","2012-07-03"
"1207.0146","Douglas J. Durian","A. E. Roth, C. D. Jones, D. J. Durian","Bubble statistics and coarsening dynamics for quasi-two dimensional
  foams with increasing liquid content",,"Phys. Rev. E 87, 042304 (2013)","10.1103/PhysRevE.87.042304",,"cond-mat.soft","http://arxiv.org/licenses/nonexclusive-distrib/1.0/","  We report on the statistics of bubble size, topology, and shape and on their
role in the coarsening dynamics for foams consisting of bubbles compressed
between two parallel plates. The design of the sample cell permits control of
the liquid content, through a constant pressure condition set by the height of
the foam above a liquid reservoir. We find that in the scaling state, all
bubble distributions are independent not only of time but also of liquid
content. For coarsening, the average rate decreases with liquid content due to
the blocking of gas diffusion by Plateau borders inflated with liquid. By
observing the growth rate of individual bubbles, we find that von Neumann's law
becomes progressively violated with increasing wetness and with decreasing
bubble size. We successfully model this behavior by explicitly incorporating
the border blocking effect into the von Neumann argument. Two dimensionless
bubble shape parameters naturally arise, one of which is primarily responsible
for the violation of von Neumann's law for foams that are not perfectly dry.
","[{""version"":""v1"",""created"":""Sat, 30 Jun 2012 20:23:50 GMT""},{""version"":""v2"",""created"":""Mon, 4 Feb 2013 17:46:07 GMT""},{""version"":""v3"",""created"":""Tue, 26 Mar 2013 19:36:44 GMT""}]","2013-04-16"
"1207.0147","Tian Luo","Tian Luo, Rubao Lee, Michael Mesnier, Feng Chen, Xiaodong Zhang","hStorage-DB: Heterogeneity-aware Data Management to Exploit the Full
  Capability of Hybrid Storage Systems","VLDB2012","Proceedings of the VLDB Endowment (PVLDB), Vol. 5, No. 10, pp.
  1076-1087 (2012)",,,"cs.DB","http://arxiv.org/licenses/nonexclusive-distrib/1.0/","  As storage systems become increasingly heterogeneous and complex, it adds
burdens on DBAs, causing suboptimal performance even after a lot of human
efforts have been made. In addition, existing monitoring-based storage
management by access pattern detections has difficulties to handle workloads
that are highly dynamic and concurrent. To achieve high performance by best
utilizing heterogeneous storage devices, we have designed and implemented a
heterogeneity-aware software framework for DBMS storage management called
hStorage-DB, where semantic information that is critical for storage I/O is
identified and passed to the storage manager. According to the collected
semantic information, requests are classified into different types. Each type
is assigned a proper QoS policy supported by the underlying storage system, so
that every request will be served with a suitable storage device. With
hStorage-DB, we can well utilize semantic information that cannot be detected
through data access monitoring but is particularly important for a hybrid
storage system. To show the effectiveness of hStorage-DB, we have implemented a
system prototype that consists of an I/O request classification enabled DBMS,
and a hybrid storage system that is organized into a two-level caching
hierarchy. Our performance evaluation shows that hStorage-DB can automatically
make proper decisions for data allocation in different storage devices and make
substantial performance improvements in a cost-efficient way.
","[{""version"":""v1"",""created"":""Sat, 30 Jun 2012 20:41:39 GMT""}]","2012-07-03"
"1207.0148","David J. Rowe","D. J. Rowe, M. J. Carvalho, and J. Repka","Dual pairing of symmetry groups and dynamical groups in physics","51 pages, 5 figures and 5 tables","Rev. Mod. Phys. 84 (2012) 711-757","10.1103/RevModPhys.84.711",,"nucl-th math-ph math.MP","http://arxiv.org/licenses/nonexclusive-distrib/1.0/","  This article reviews many manifestations and applications of dual
representations of pairs of groups, primarily in atomic and nuclear physics.
Examples are given to show how such paired representations are powerful aids in
understanding the dynamics associated with shell-model coupling schemes and in
identifying the physical situations for which a given scheme is most
appropriate. In particular, they suggest model Hamiltonians that are diagonal
in the various coupling schemes. The dual pairing of group representations has
been applied profitably in mathematics to the study of invariant theory. We
show that parallel applications to the theory of symmetry and dynamical groups
in physics are equally valuable. In particular, the pairing of the
representations of a discrete group with those of a continuous Lie group or
those of a compact Lie with those of a non-compact Lie group makes it possible
to infer many properties of difficult groups from those of simpler groups. This
review starts with the representations of the symmetric and unitary groups,
which are used extensively in the many-particle quantum mechanics of bosonic
and fermionic systems. It gives a summary of the many solutions and
computational techniques for solving problems that arise in applications of
symmetry methods in physics and which result from the famous Schur-Weyl duality
theorem for the pairing of these representations. It continues to examine many
chains of symmetry groups and dual chains of dynamical groups associated with
the several coupling schemes in atomic and nuclear shell models and the
valuable insights and applications that result from this examination.
","[{""version"":""v1"",""created"":""Sat, 30 Jun 2012 20:43:24 GMT""}]","2012-07-03"
"1207.0149","Matthew Kahle","Matthew Kahle","Sharp vanishing thresholds for cohomology of random flag complexes","20 pages, revised. This paper has been accepted to appear in Annals
  of Mathematics",,,,"math.AT math.CO math.PR","http://arxiv.org/licenses/nonexclusive-distrib/1.0/","  For every $k \ge 1$, the $k$th cohomology group $H^k(X, \Q)$ of the random
flag complex $X \sim X(n,p)$ passes through two phase transitions: one where it
appears, and one where it vanishes. We describe the vanishing threshold and
show that it is sharp. Using the same spectral methods, we also find a sharp
threshold for the fundamental group $\pi_1(X)$ to have Kazhdan's property (T).
Combining with earlier results, we obtain as a corollary that for every $k \ge
3$ there is a regime in which the random flag complex is rationally homotopy
equivalent to a bouquet of $k$-dimensional spheres.
","[{""version"":""v1"",""created"":""Sat, 30 Jun 2012 20:45:23 GMT""},{""version"":""v2"",""created"":""Tue, 25 Jun 2013 21:04:11 GMT""},{""version"":""v3"",""created"":""Wed, 2 Oct 2013 21:58:17 GMT""}]","2013-10-04"
"1207.0150","Hui Zhang","Hui Zhang, A. O. Govorov","Giant circular dichroism of a molecule in a region of strong plasmon
  resonances between two neighboring gold nanocrystals","Manuscript: 4+pages, 4 figures; Supplemental_Material: 10 pages, 7
  figures",,"10.1103/PhysRevB.87.075410",,"cond-mat.mes-hall","http://arxiv.org/licenses/nonexclusive-distrib/1.0/","  We report on giant circular dichroism (CD) of a molecule inserted into a
plasmonic hot spot. Naturally occurring molecules and biomolecules have
typically CD signals in the UV range, whereas plasmonic nanocrystals exhibit
strong plasmon resonances in the visible spectral interval. Therefore,
excitations of chiral molecules and plasmon resonances are typically
off-resonant. Nevertheless, we demonstrate theoretically that it is possible to
create strongly-enhanced molecular CD utilizing the plasmons. This task is
doubly challenging since it requires both creation and enhancement of the
molecular CD in the visible region. We demonstrate this effect within the model
which incorporates a chiral molecule and a plasmonic dimer. The associated
mechanism of plasmonic CD comes from the Coulomb interaction which is greatly
amplified in a plasmonic hot spot.
","[{""version"":""v1"",""created"":""Sat, 30 Jun 2012 20:46:20 GMT""},{""version"":""v2"",""created"":""Fri, 28 Sep 2012 19:08:24 GMT""}]","2015-06-05"
"1207.0151","Matthew Zeiler","Matthew D. Zeiler and Rob Fergus","Differentiable Pooling for Hierarchical Feature Learning","12 pages",,,,"cs.CV cs.LG","http://arxiv.org/licenses/nonexclusive-distrib/1.0/","  We introduce a parametric form of pooling, based on a Gaussian, which can be
optimized alongside the features in a single global objective function. By
contrast, existing pooling schemes are based on heuristics (e.g. local maximum)
and have no clear link to the cost function of the model. Furthermore, the
variables of the Gaussian explicitly store location information, distinct from
the appearance captured by the features, thus providing a what/where
decomposition of the input signal. Although the differentiable pooling scheme
can be incorporated in a wide range of hierarchical models, we demonstrate it
in the context of a Deconvolutional Network model (Zeiler et al. ICCV 2011). We
also explore a number of secondary issues within this model and present
detailed experiments on MNIST digits.
","[{""version"":""v1"",""created"":""Sat, 30 Jun 2012 21:04:13 GMT""}]","2012-07-03"
"1207.0152","Valerii Salov","Valerii Salov","Notation for Iteration of Functions, Iteral","23 pages",,,,"math.DS","http://arxiv.org/licenses/nonexclusive-distrib/1.0/","  A new mathematical notation is proposed for the iteration of functions. It
facilitates the application of the iteration of functions in mathematical and
logical expressions, definitions of sets, and formulations of algorithms.
Illustrations of the notation include definitions of constant points, periodic
points, a filled-in Julia set, the Mandelbrot set, iterations of a logistic
map, the double-approximating procedure for solving the Lorenz equations, a
description of a financial time series, and reordering nonnegative integers
useful for the investigation of the Collatz's (3x+1)/2 convergence problem. The
terms iteral and iteral of function are suggested to name the new denomination.
","[{""version"":""v1"",""created"":""Sat, 30 Jun 2012 21:13:15 GMT""}]","2012-07-03"
"1207.0153","Nemanja Jovanovic","Nemanja Jovanovic, Izabela Spaleniak, Simon Gross, Michael Ireland,
  Jon S. Lawrence, Christopher Miese, Alexander Fuerbach, and Michael J.
  Withford","Integrated photonic building blocks for next-generation astronomical
  instrumentation I: the multimode waveguide","15 pages, 11 figures, accepted to Optics Express","Optics Express, 2012","10.1364/OE.20.017029",,"astro-ph.IM physics.optics","http://arxiv.org/licenses/nonexclusive-distrib/1.0/","  We report on the fabrication and characterization of composite multimode
waveguide structures that consist of a stack of single-mode waveguides
fabricated by ultrafast laser inscription. We explore 2 types of composite
structures; those that consist of overlapping single-mode waveguides which
offer the maximum effective index contrast and non overlapped structures which
support multiple modes via strong evanescent coupling. We demonstrate that both
types of waveguides have negligible propagation losses (to within experimental
uncertainty) for light injected with focal ratios >8, which corresponds to the
cutoff of the waveguides. We also show that right below cutoff, there is a
narrow region where the injected focal ratio is preserved (to within
experimental uncertainty) at the output. Finally, we outline the major
application of these highly efficient waveguides; in a device that is used to
reformat the light in the focal plane of a telescope to a slit, in order to
feed a diffraction-limited spectrograph.
","[{""version"":""v1"",""created"":""Sat, 30 Jun 2012 21:23:47 GMT""}]","2015-06-05"
"1207.0154","Ying-Qing Wu","Ying-Qing Wu","Seifert fibered surgery on Montesinos knots","20 pages, 8 figures",,,,"math.GT","http://arxiv.org/licenses/nonexclusive-distrib/1.0/","  Exceptional Dehn surgeries on arborescent knots have been classified except
for Seifert fibered surgeries on Montesinos knots of length 3. There are
infinitely many of them as it is known that 4n+6 and 4n+7 surgeries on a (-2,
3, 2n+1) pretzel knot are Seifert fibered. It will be shown that there are only
finitely many others. A list of 20 surgeries will be given and proved to be
Seifert fibered. We conjecture that this is a complete list.
","[{""version"":""v1"",""created"":""Sat, 30 Jun 2012 21:26:59 GMT""}]","2012-07-03"
"1207.0155","Martin Ostoja-Starzewski","Jun Li, Martin Ostoja-Starzewski","Saturn's Rings are Fractal",,,,,"astro-ph.EP","http://arxiv.org/licenses/nonexclusive-distrib/1.0/","  Over the past few decades, various conjectures were advanced that Saturn's
rings are Cantor-like sets, although no convincing fractal analysis of actual
images has ever appeared. We focus on the images sent by the Cassini spacecraft
mission: slide #42 ""Mapping Clumps in Saturn's Rings"" and slide #54 ""Scattered
Sunshine"". Using the box-counting method, we determine the fractal dimension of
rings seen here (and in several other images from the same source) to be
consistently about 1.6~1.7. This supports many conjectures put forth over
several decades that Saturn's rings are indeed fractal.
","[{""version"":""v1"",""created"":""Sat, 30 Jun 2012 21:48:39 GMT""}]","2012-07-03"
"1207.0156","Jambul Gegelia","J. Gegelia","Why gauge symmetry?","23 pages, 2 figures",,,,"hep-ph hep-th","http://arxiv.org/licenses/nonexclusive-distrib/1.0/","  It is argued that the Weinberg-Salam model is the way it is because the most
general self-consistent effective field theory of massive vector bosons
interacting with fermions and photons at leading order coincides with the
Weinberg-Salam model in unitary gauge where the scalar field is replaced by its
vacuum expectation value. To support this argument the most general
Lorentz-invariant effective Lagrangian of massive vector bosons coupled to
massless fermions is considered. Restrictions imposed on the interaction terms
following from the consistency with the constraints of the second class and the
perturbative renormalizability in the sense of effective field theories is
analyzed. It is shown that the leading order effective Lagrangian containing
interaction terms with dimensionless coupling constants coincides with the
leading order effective Lagrangian of the locally invariant Yang-Mills theory
up to globally invariant mass term of the vector bosons. Including the fermion
masses and mixings and the interaction with the electromagnetic field leads to
an effective field theory which at leading order looks like as if it was an
$SU(2)\times U(1)$ gauge invariant theory with spontaneous symmetry breaking in
unitary gauge with the scalar field replaced by its vacuum expectation value.
","[{""version"":""v1"",""created"":""Sat, 30 Jun 2012 21:57:35 GMT""}]","2012-07-05"
"1207.0157","George Athanasiou","George Athanasiou","Green Traffic Engineering for Future Core Networks",,,,,"cs.NI","http://arxiv.org/licenses/nonexclusive-distrib/1.0/","  An important goal towards the design of Future Networks is to achieve the
best ratio of performance to energy consumption and at the same time assure
manageability. This paper presents a general problem formulation for
Energy-Aware Traffic Engineering and proposes a distributed, heuristic
Energy-Aware Traffic Engineering scheme (ETE) that provides load balancing and
energy-awareness in accordance with the operator's needs. Simulation results of
ETE compared to the optimal network performance confirm the capability of ETE
to meeting the needs of Future Networks.
","[{""version"":""v1"",""created"":""Sat, 30 Jun 2012 22:06:13 GMT""}]","2012-07-03"
"1207.0158","Dimitri Hendriks","Joerg Endrullis, Dimitri Hendriks and Rena Bakhshi","On the Complexity of Equivalence of Specifications of Infinite Objects",,,,,"cs.LO cs.CC","http://arxiv.org/licenses/nonexclusive-distrib/1.0/","  We study the complexity of deciding the equality of infinite objects
specified by systems of equations, and of infinite objects specified by
lambda-terms. For equational specifications there are several natural notions
of equality: equality in all models, equality of the sets of solutions, and
equality of normal forms for productive specifications. For lambda-terms we
investigate Boehm-tree equality and various notions of observational equality.
We pinpoint the complexity of each of these notions in the arithmetical or
analytical hierarchy. We show that the complexity of deciding equality in all
models subsumes the entire analytical hierarchy. This holds already for the
most simple infinite objects, viz. streams over {0,1}, and stands in sharp
contrast to the low arithmetical Pi^0_2-completeness of equality of
equationally specified streams derived in [Rosu 2006] employing a different
notion of equality.
","[{""version"":""v1"",""created"":""Sat, 30 Jun 2012 22:06:21 GMT""}]","2012-07-03"
"1207.0159","George Athanasiou","George Athanasiou","Energy-efficient traffic engineering for future core networks",,,,,"cs.NI","http://arxiv.org/licenses/nonexclusive-distrib/1.0/","  A general problem formulation for energy-efficient traffic engineering for
future core networks is presented. Moreover, a distributed heuristic algorithm
that provides jointly load balancing and energy efficiency is proposed,
approaching in this way the optimal network operation in terms of throughput
and energy consumption.
","[{""version"":""v1"",""created"":""Sat, 30 Jun 2012 22:15:05 GMT""}]","2012-07-03"
"1207.0160","George Athanasiou","George Athanasiou, Leandros Tassiulas","Design and Implementation of Distributed Resource Management Mechanisms
  for Wireless Mesh Networks",,,,,"cs.NI","http://arxiv.org/licenses/nonexclusive-distrib/1.0/","  In this paper we design and implement a resource management scheme based on
cooperative association, where the STAs can share useful information in order
to improve the performance of the association/handoff procedures. The
cooperative association mechanism is inspired by the rapidly designed
cooperative protocols in the field of wireless networks. Furthermore, we
introduce a load balancing mechanism that operates in a cross-layer manner
taking into account uplink and downlink channel conditions, routing performance
and congestion control. The iterative heuristic algorithms that we propose,
control the communication load of each mesh AP in a distributed manner. We
evaluate the performance of our mechanisms through OPNET simulations and
testbed experiments.
","[{""version"":""v1"",""created"":""Sat, 30 Jun 2012 22:42:10 GMT""}]","2012-07-03"
"1207.0161","Mark Bell","Mark Bell","The monodromies of homogeneous links","12 pages, 7 figures",,,,"math.GT","http://arxiv.org/licenses/nonexclusive-distrib/1.0/","  We show that there are only finitely many homogeneous links whose Conway
polynomial has any given degree. Using this we give an example of an
inhomogeneous, fibred knot. Secondly, we show how to compute the monodromy of a
homogeneous link complement from a homogeneous braid word representative.
","[{""version"":""v1"",""created"":""Sat, 30 Jun 2012 22:48:07 GMT""}]","2012-07-03"
"1207.0162","George Athanasiou","Marios Logothetis, George Athanasiou, Kostas Tsagkaris, Panagiotis
  Demestichas","Green Footprint by Cognitive Management of Opportunistic Networks",,,,,"cs.NI","http://arxiv.org/licenses/nonexclusive-distrib/1.0/","  The existing characteristics of the wireless networks nowadays, urgently
impose the exploitation of flexible networking solutions that will offer
increased efficiency in resource utilization and application Quality of Service
(QoS) provisioning and at the same time will reduce the energy consumption and
achieve green targets. In this respect, Operator-governed Opportunistic
Networks (ONs), which are dynamically created, temporary, coordinated
extensions of the infrastructure, are the basic constituents in the proposed
approach. In addition, Cognitive Management Systems (CMSs), which comprise
self-management and learning capabilities, can be exploited for ensuring fast
and reliable establishment of ONs, achieving efficiently the desired goals.
This paper presents the concept of ONs and their representative scenarios, as
well as an evaluation of indicative test cases as a proof of concept of the
aforementioned approach. Indicative simulation results are presented, which
yield the conditions in which the adoption of such a solution can lead to lower
costs and management decisions with a ""greener"" footprint.
","[{""version"":""v1"",""created"":""Sat, 30 Jun 2012 22:48:20 GMT""}]","2012-07-03"
"1207.0163","George Athanasiou","Domenico Giustiniano, Eduard Goma, Alberto Lopez Toledo, George
  Athanasiou","Optimizing TCP Performance in Multi-AP Residential Broadband Connections
  via Mini-Slot Access",,,,,"cs.NI","http://arxiv.org/licenses/nonexclusive-distrib/1.0/","  The high bandwidth demand of Internet applications has recently driven the
need of increasing the residential download speed. A practical solution to the
problem has been proposed aggregating the bandwidth of 802.11 Access Points
(APs) backhauls in range via 802.11 connections. Since 802.11 devices are
usually single-radio, the communication to multiple APs on different
radio-channels requires the introduction of a time-division multiple access
(TDMA) policy at the client station. Current investigation in this area
supposes that there is a sufficient number of TCP flows to saturate the
Asymmetric Digital Subscriber Line (ADSL) behind the APs. However, this may be
not guaranteed according to the user traffic pattern. As a consequence, a TDMA
policy introduces additional delays in the end-to-end transmissions that will
cause degradation of the TCP throughput and an under-utilization of the AP
backhauls. In this paper, we first perform an in-depth experimental analysis
with a customized 802.11 driver of how the usage of multi-AP TDMA affects the
observed Round-Trip-Time (RTT) of TCP flows. Then, we introduce a simple
analytical model that accurately predicts the TCP RTT when accessing the
wireless medium with a Multi-AP TDMA policy. Based on this model, we propose a
resource allocation algorithm that runs locally at the station and it greatly
reduces the observed TCP RTT with a very low computational cost. Our proposed
scheme can improve up to 1:5 times the aggregate throughput observed by the
station compared to state-of-the-art multi-AP TDMA allocations. We also show
that the throughput performance of the algorithm is very close to the
theoretical upper-bound in key simulation scenarios.
","[{""version"":""v1"",""created"":""Sat, 30 Jun 2012 22:55:49 GMT""},{""version"":""v2"",""created"":""Wed, 7 Nov 2012 14:45:48 GMT""},{""version"":""v3"",""created"":""Wed, 3 Apr 2013 07:27:38 GMT""}]","2013-04-04"
