"1207.0182","Carl Lian","Carl Lian","Representations of Cherednik Algebras Associated to Symmetric and
  Dihedral Groups in Positive Characteristic","added PBW theorem in section 2",,,,"math.RT","http://arxiv.org/licenses/nonexclusive-distrib/1.0/","  We consider irreducible lowest-weight representations of Cherednik algebras
associated to certain classes of complex reflection groups in characteristic p.
In particular, we study maximal graded submodules of Verma modules associated
to these algebras. Various results and conjectures are presented concerning
generators of these maximal submodules, which are found by computing singular
polynomials of Dunkl operators.
","[{""version"":""v1"",""created"":""Sun, 1 Jul 2012 06:04:08 GMT""},{""version"":""v2"",""created"":""Mon, 14 Jul 2014 12:53:17 GMT""},{""version"":""v3"",""created"":""Tue, 15 Jul 2014 23:46:29 GMT""}]","2014-07-17"
"1207.0183","Berthold-Georg Englert","Hui Khoon Ng, Kia Tan Benjamin Phuah, and Berthold-Georg Englert","Minimax mean estimator for the trine","18 pages, 3 figures","New J. Phys. 14, 085007 (2012)","10.1088/1367-2630/14/8/085007",,"quant-ph","http://arxiv.org/licenses/nonexclusive-distrib/1.0/","  We explore the question of state estimation for a qubit restricted to the
$x$-$z$ plane of the Bloch sphere, with the trine measurement. In our earlier
work [H. K. Ng and B.-G. Englert, eprint arXiv:1202.5136[quant-ph] (2012)],
similarities between quantum tomography and the tomography of a classical die
motivated us to apply a simple modification of the classical estimator for use
in the quantum problem. This worked very well. In this article, we adapt a
different aspect of the classical estimator to the quantum problem. In
particular, we investigate the mean estimator, where the mean is taken with a
weight function identical to that in the classical estimator but now with
quantum constraints imposed. Among such mean estimators, we choose an optimal
one with the smallest worst-case error-the minimax mean estimator-and compare
its performance with that of other estimators. Despite the natural
generalization of the classical approach, this minimax mean estimator does not
work as well as one might expect from the analogous performance in the
classical problem. While it outperforms the often-used maximum-likelihood
estimator in having a smaller worst-case error, the advantage is not
significant enough to justify the more complicated procedure required to
construct it. The much simpler adapted estimator introduced in our earlier work
is still more effective. Our previous work emphasized the similarities between
classical and quantum state estimation; in contrast, this paper highlights how
intuition gained from classical problems can sometimes fail in the quantum
arena.
","[{""version"":""v1"",""created"":""Sun, 1 Jul 2012 06:11:36 GMT""}]","2015-06-05"
"1207.0184","Shouhei Ma","Shouhei Ma","The rationality of the moduli spaces of trigonal curves","to appear in IMRN",,,,"math.AG","http://arxiv.org/licenses/nonexclusive-distrib/1.0/","  The moduli spaces of trigonal curves are proven to be rational when the genus
is divisible by 4.
","[{""version"":""v1"",""created"":""Sun, 1 Jul 2012 06:14:30 GMT""},{""version"":""v2"",""created"":""Thu, 12 Jun 2014 10:36:21 GMT""}]","2014-06-13"
"1207.0185","Samuel Moukouri","S. Moukouri and Eitan Eidelstein","On the universality class of the Mott transition in two dimensions","9 pages, 8 figures",,"10.1103/PhysRevB.86.155112",,"cond-mat.str-el","http://arxiv.org/licenses/nonexclusive-distrib/1.0/","  We use the two-step density-matrix renormalization group method to elucidate
the long-standing issue of the universality class of the Mott transition in the
Hubbard model in two dimensions. We studied a spatially anisotropic
two-dimensional Hubbard model with a non-perfectly nested Fermi surface at
half-filling. We find that unlike the pure one-dimensional case where there is
no metallic phase, the quasi one-dimensional modeldisplays a genuine
metal-insulator transition at a finite value of the interaction. The critical
exponent of the correlation length is found to be $\nu \approx 1.0$. This
implies that the fermionic Mott transition, belongs to the universality class
of the 2D Ising model. The Mott insulator is the 'ordered' phase whose order
parameter is given by the density of singly occupied sites minus that of holes
and doubly occupied sites.
","[{""version"":""v1"",""created"":""Sun, 1 Jul 2012 06:50:38 GMT""}]","2015-06-05"
"1207.0186","Claude Duhr","Lance J. Dixon, Claude Duhr, Jeffrey Pennington","Single-valued harmonic polylogarithms and the multi-Regge limit","71 pages, 2 figures, plus 10 ancillary files containing analytic
  expressions in Mathematica format. V2: Typos corrected and references added.
  V3: Typos corrected; assumption about single-Reggeon exchange made explicit",,"10.1007/JHEP10(2012)074","SLAC-PUB-15132","hep-th hep-ph","http://arxiv.org/licenses/nonexclusive-distrib/1.0/","  We argue that the natural functions for describing the multi-Regge limit of
six-gluon scattering in planar N=4 super Yang-Mills theory are the
single-valued harmonic polylogarithmic functions introduced by Brown. These
functions depend on a single complex variable and its conjugate, (w,w*). Using
these functions, and formulas due to Fadin, Lipatov and Prygarin, we determine
the six-gluon MHV remainder function in the leading-logarithmic approximation
(LLA) in this limit through ten loops, and the next-to-LLA (NLLA) terms through
nine loops. In separate work, we have determined the symbol of the four-loop
remainder function for general kinematics, up to 113 constants. Taking its
multi-Regge limit and matching to our four-loop LLA and NLLA results, we fix
all but one of the constants that survive in this limit. The multi-Regge limit
factorizes in the variables (\nu,n) which are related to (w,w*) by a
Fourier-Mellin transform. We can transform the single-valued harmonic
polylogarithms to functions of (\nu,n) that incorporate harmonic sums,
systematically through transcendental weight six. Combining this information
with the four-loop results, we determine the eigenvalues of the BFKL kernel in
the adjoint representation to NNLLA accuracy, and the MHV product of impact
factors to NNNLLA accuracy, up to constants representing beyond-the-symbol
terms and the one symbol-level constant. Remarkably, only derivatives of the
polygamma function enter these results. Finally, the LLA approximation to the
six-gluon NMHV amplitude is evaluated through ten loops.
","[{""version"":""v1"",""created"":""Sun, 1 Jul 2012 06:50:46 GMT""},{""version"":""v2"",""created"":""Sat, 21 Jul 2012 11:16:05 GMT""},{""version"":""v3"",""created"":""Wed, 10 Oct 2012 15:45:30 GMT""}]","2015-06-05"
"1207.0187","Ruth Heller","Marina Bogomolov and Ruth Heller","Discovering findings that replicate from a primary study of high
  dimension to a follow-up study",,"Journal of the American Statistical Association Volume 108, Issue
  504, 2013","10.1080/01621459.2013.829002","arXiv:1207.0187v3","stat.ME math.ST stat.AP stat.TH","http://arxiv.org/licenses/nonexclusive-distrib/1.0/","  We consider the problem of identifying whether findings replicate from one
study of high dimension to another, when the primary study guides the selection
of hypotheses to be examined in the follow-up study as well as when there is no
division of roles into the primary and the follow-up study. We show that
existing meta-analysis methods are not appropriate for this problem, and
suggest novel methods instead. We prove that our multiple testing procedures
control for appropriate error-rates. The suggested FWER controlling procedure
is valid for arbitrary dependence among the test statistics within each study.
A more powerful procedure is suggested for FDR control. We prove that this
procedure controls the FDR if the test statistics are independent within the
primary study, and independent or have dependence of type PRDS in the follow-up
study. For arbitrary dependence within the primary study, and either arbitrary
dependence or dependence of type PRDS in the follow-up study, simple
conservative modifications of the procedure control the FDR. We demonstrate the
usefulness of these procedures via simulations and real data examples.
","[{""version"":""v1"",""created"":""Sun, 1 Jul 2012 07:02:29 GMT""},{""version"":""v2"",""created"":""Wed, 26 Dec 2012 14:49:35 GMT""},{""version"":""v3"",""created"":""Fri, 24 May 2013 05:49:51 GMT""}]","2014-01-28"
"1207.0188","Duy Q. Vu","Duy Q. Vu, David R. Hunter, Michael Schweinberger","Model-based clustering of large networks","Published in at http://dx.doi.org/10.1214/12-AOAS617 the Annals of
  Applied Statistics (http://www.imstat.org/aoas/) by the Institute of
  Mathematical Statistics (http://www.imstat.org)","Annals of Applied Statistics 2013, Vol. 7, No. 2, 1010-1039","10.1214/12-AOAS617","IMS-AOAS-AOAS617","stat.CO cs.SI physics.soc-ph stat.AP","http://arxiv.org/licenses/nonexclusive-distrib/1.0/","  We describe a network clustering framework, based on finite mixture models,
that can be applied to discrete-valued networks with hundreds of thousands of
nodes and billions of edge variables. Relative to other recent model-based
clustering work for networks, we introduce a more flexible modeling framework,
improve the variational-approximation estimation algorithm, discuss and
implement standard error estimation via a parametric bootstrap approach, and
apply these methods to much larger data sets than those seen elsewhere in the
literature. The more flexible framework is achieved through introducing novel
parameterizations of the model, giving varying degrees of parsimony, using
exponential family models whose structure may be exploited in various
theoretical and algorithmic ways. The algorithms are based on variational
generalized EM algorithms, where the E-steps are augmented by a
minorization-maximization (MM) idea. The bootstrapped standard error estimates
are based on an efficient Monte Carlo network simulation idea. Last, we
demonstrate the usefulness of the model-based clustering framework by applying
it to a discrete-valued network with more than 131,000 nodes and 17 billion
edge variables.
","[{""version"":""v1"",""created"":""Sun, 1 Jul 2012 08:06:40 GMT""},{""version"":""v2"",""created"":""Sun, 18 Nov 2012 21:15:28 GMT""},{""version"":""v3"",""created"":""Tue, 10 Dec 2013 06:46:57 GMT""}]","2020-03-13"
"1207.0189","Jan Gregorovi\v{c}","Jan Gregorovi\v{c}","Local reflexion spaces","8 pages, submitted to Archivum Mathematicum","Archivum Mathematicum, Brno, 48/5, 323-332, 2012","10.5817/AM2012-5-323",,"math.DG","http://arxiv.org/licenses/nonexclusive-distrib/1.0/","  A reflexion space is generalization of a symmetric space introduced by O.
Loos. We generalize locally symmetric spaces to local reflexion spaces in the
similar way. We investigate, when local reflexion spaces are equivalently given
by a locally flat Cartan connection of certain type.
","[{""version"":""v1"",""created"":""Sun, 1 Jul 2012 08:39:21 GMT""}]","2013-01-23"
"1207.0190","Jan Gregorovi\v{c}","Jan Gregorovi\v{c}","General construction of symmetric parabolic structures","38 pages, to be published in Differential Geometry and Its
  Applications (Elsevier)","Differential Geometry and its Applications 30 (2012) pp. 450-476","10.1016/j.difgeo.2012.06.006",,"math.DG","http://arxiv.org/licenses/nonexclusive-distrib/1.0/","  First we introduce a generalization of symmetric spaces to parabolic
geometries. We provide construction of such parabolic geometries starting with
classical symmetric spaces and we show that all regular parabolic geometries
with smooth systems of involutive symmetries can be obtained this way. Further,
we investigate the case of parabolic contact geometries in great detail and we
provide the full classification of those with semisimple groups of symmetries
without complex factors. Finally, we explicitly construct all non-trivial
contact geometries with non-complex simple groups of symmetries. We also
indicate geometric interpretations of some of them.
","[{""version"":""v1"",""created"":""Sun, 1 Jul 2012 08:48:22 GMT""}]","2012-07-30"
"1207.0191","Amir Khamseh","Amir Khamseh and Gholam Reza Omidi","Large stars with few colors",,,,,"math.CO","http://arxiv.org/licenses/nonexclusive-distrib/1.0/","  A recent question in generalized Ramsey theory is that for fixed positive
integers $s\leq t$, at least how many vertices can be covered by the vertices
of no more than $s$ monochromatic members of the family $\cal F$ in every edge
coloring of $K_n$ with $t$ colors. This is related to an old problem of Chung
and Liu: for graph $G$ and integers $1\leq s<t$ what is the smallest positive
integer $n=R_{s,t}(G)$ such that every coloring of the edges of $K_n$ with $t$
colors contains a copy of $G$ with at most $s$ colors. We answer this question
when $G$ is a star and $s$ is either $t-1$ or $t-2$ generalizing the well-known
result of Burr and Roberts.
","[{""version"":""v1"",""created"":""Sun, 1 Jul 2012 08:57:11 GMT""}]","2012-07-03"
"1207.0192","Yihao Yin","Eric A. Bergshoeff, Marija Kovacevic, Jan Rosseel, Yihao Yin","On Topologically Massive Spin-2 Gauge Theories beyond Three Dimensions","14 pages. v2: minor changes - published version","JHEP 1210 (2012) 055","10.1007/JHEP10(2012)055",,"hep-th","http://arxiv.org/licenses/nonexclusive-distrib/1.0/","  We investigate in which sense, at the linearized level, one can extend the 3D
topologically massive gravity theory beyond three dimensions. We show that, for
each k=1,2,3... a free topologically massive gauge theory in 4k-1 dimensions
can be defined describing a massive ""spin-2"" particle provided one uses a
non-standard representation of the massive ""spin-2"" state which makes use of a
two-column Young tableau where each column is of height 2k-1. We work out the
case of k=2, i.e. 7D, and show, by canonical analysis, that the model
describes, unitarily, 35 massive ""spin-2"" degrees of freedom. The issue of
interactions is discussed and compared with the three-dimensional situation.
","[{""version"":""v1"",""created"":""Sun, 1 Jul 2012 09:03:08 GMT""},{""version"":""v2"",""created"":""Mon, 15 Oct 2012 20:44:46 GMT""}]","2012-10-17"
"1207.0193","Jan Gregorovi\v{c}","Jan Gregorovi\v{c}","Geometric structures invariant to symmetries","90 pages, Ph.D. Dissertation (Masaryk university Brno), 2012",,,,"math.DG","http://arxiv.org/licenses/nonexclusive-distrib/1.0/","  We introduce and discuss (local) symmetries of geometric structures. These
symmetries generalize the classical (locally) symmetric spaces to various other
geometries. Our main tools are homogeneous Cartan geometries and their explicit
description. This allows us to describe the structure of symmetric geometric
structures and to provide a general construction of such structures. Since we
can view the classical (locally) symmetric spaces as special case, this allows
us to classify various geometric structures on semisimple symmetric spaces.
Then we investigate the case of symmetric parabolic geometries in detail and
obtain classification of symmetric AHS-structures and symmetric parabolic
contact geometries in the semisimple cases.
","[{""version"":""v1"",""created"":""Sun, 1 Jul 2012 09:03:24 GMT""}]","2012-07-03"
"1207.0194","Hasan Ali Dal","O. \""Ozdarcan, E. Sipahi, H. A. Dal","BD+36 3317: An algol type eclipsing binary in Delta Lyrae cluster","18 pages, 4 figures, 5 tables","2012NewA...17..483O","10.1016/j.newast.2011.12.002",,"astro-ph.SR","http://creativecommons.org/licenses/by/3.0/","  In this paper, we present standard Johnson UBV photometry of the eclipsing
binary BD+36 3317 which is known as a member of Delta Lyrae (Stephenson 1)
cluster. We determined colors and brightness of the system, calculated E(B - V)
color excess. We discovered that the system shows total eclipse in secondary
minimum. Using this advantage, we found that the primary component of the
system has B9 - A0 spectral type. Although there is no published orbital
solution, we tried to estimate the physical properties of the system from
simultaneous analysis of UBV light curves with 2003 version of Wilson-Devinney
code. Then we considered photometric solution results together with
evolutionary models and estimated the masses of the components as M1 = 2.5 Msun
and M2 = 1.6 Msun. Those estimations gave the distance of the system as 353 pc.
Considering the uncertainties in distance estimation, resulting distance is in
agreement with the distance of Delta Lyrae cluster.
","[{""version"":""v1"",""created"":""Sun, 1 Jul 2012 09:14:46 GMT""}]","2012-07-03"
"1207.0195","Loecherbach Eva","Reinhard H\""opfner, Eva L\""ocherbach, Mich\`ele Thieullen","Transition densities for stochastic Hodgkin-Huxley models","2 figures",,,,"math.PR","http://arxiv.org/licenses/nonexclusive-distrib/1.0/","  We consider a stochastic Hodgkin-Huxley model driven by a periodic signal as
model for the membrane potential of a pyramidal neuron. The associated five
dimensional diffusion process is a time inhomogeneous highly degenerate
diffusion for which the weak Hoermander condition holds only locally. Using a
technique which is based on estimates of the Fourier transform, inspired by
Fournier 2008, Bally 2007 and De Marco 2011, we show that the process admits
locally a strictly positive continuous transition density. Moreover, we show
that the presence of noise enables the stochastic system to imitate any
possible deterministic spiking behavior, i.e. mixtures of regularly spiking and
non-spiking time periods are possible features of the stochastic model. This is
a fundamental difference between stochastic and deterministic Hodgkin-Huxley
models.
","[{""version"":""v1"",""created"":""Sun, 1 Jul 2012 09:19:48 GMT""}]","2012-07-03"
"1207.0196","Dusan Zorica","Teodor M. Atanackovic, Stevan Pilipovic, Dusan Zorica","Forced oscillations of a body attached to a viscoelastic rod of
  fractional derivative type",,"International Journal of Engineering Science 64 (2013) 54-65","10.1016/j.ijengsci.2012.12.006",,"math-ph math.MP","http://arxiv.org/licenses/nonexclusive-distrib/1.0/","  We study forced oscillations of a rod with a body attached to its free end so
that the motion of a system is described by two sets of equations, one of
integer and the other of the fractional order. To the constitutive equation we
associate a single function of complex variable that plays a key role in
finding the solution of the system and in determining its properties. This
function could be defined for a linear viscoelastic bodies of
integer/fractional derivative type.
","[{""version"":""v1"",""created"":""Sun, 1 Jul 2012 09:51:57 GMT""}]","2013-02-04"
"1207.0197","Andreas Ipp","Andreas Ipp, Peter Somkuti","Yoctosecond metrology through HBT correlations from a quark-gluon plasma","5 pages, 3 figures",,"10.1103/PhysRevLett.109.192301","TUW-12-12","hep-ph nucl-th","http://arxiv.org/licenses/nonexclusive-distrib/1.0/","  Expansion dynamics at the yoctosecond timescale affect the evolution of the
quark gluon plasma (QGP) created in heavy ion collisions. We show how these
dynamics are accessible through Hanbury Brown and Twiss (HBT) intensity
interferometry of direct photons emitted from the interior of the QGP. A
detector placed close to the beam axis is particularly sensitive to early polar
momentum anisotropies of the QGP. Observing a modification of the HBT signal at
the proposed FoCal detector of the LHC ALICE experiment would allow to measure
the isotropization time of the plasma and could provide first experimental
evidence for photon double pulses at the yoctosecond timescale.
","[{""version"":""v1"",""created"":""Sun, 1 Jul 2012 10:16:07 GMT""}]","2013-05-30"
"1207.0198","Hisa-Aki Kawamura","Hisa-aki Kawamura","A semi-ordinary $p$-stabilization of Siegel Eisenstein series for
  symplectic groups and its $p$-adic interpolation","16 pages",,,,"math.NT","http://arxiv.org/licenses/nonexclusive-distrib/1.0/","  For any rational prime $p$, we define a certain $p$-stabilization of
holomorphic Siegel Eisenstein series for the symplectic group ${\rm
Sp}(2n)_{/\mathbb{Q}}$ of an arbitrary genus $n \ge 1$. In addition, we derive
an explicit formula for the Fourier coefficients and conclude their $p$-adic
interpolation problems. Consequently, for any odd prime $p$, we deduce the
existence of a $\Lambda$-adic form (in the sense of A. Wiles, H. Hida and R.L.
Taylor) such that after taking a suitable constant multiple, it interpolates
$p$-adic analytic families of the above-mentioned $p$-stabilized Siegel
Eisenstein series with nebentypus characters locally trivial at $p$ and Siegel
Eisenstein series with nebentypus characters locally non-trivial at $p$
simultaneously. This can be viewed as a quite natural generalization of the
ordinary $\Lambda$-adic Eisenstein series for ${\rm GL}(2)$.
","[{""version"":""v1"",""created"":""Sun, 1 Jul 2012 10:52:17 GMT""},{""version"":""v2"",""created"":""Wed, 27 Feb 2013 11:15:05 GMT""},{""version"":""v3"",""created"":""Thu, 28 Mar 2013 14:51:48 GMT""},{""version"":""v4"",""created"":""Thu, 11 Oct 2018 17:40:12 GMT""}]","2018-10-12"
"1207.0199","Wang Yong","Yong Wang","Multiply twisted products","45pages","Abstract and Applied Analysis, 2014, Article ID 742371",,,"math.DG","http://arxiv.org/licenses/nonexclusive-distrib/1.0/","  In this paper, we compute the index form of the multiply twisted products. We
study the Killing vector fields on the multiply twisted product manifolds and
determine the Killing vector fields in some cases. We compute the curvature of
the multiply twisted products with a semi-symmetric metric connection and show
that the mixed Ricci-flat multiply twisted products with a semi-symmetric
metric connection can be expressed as multiply warped products. We also study
the Einstein multiply warped products with a semi-symmetric metric connection
and the multiply warped products with a semi-symmetric metric connection with
constant scalar curvature, we apply our results to generalized Robertson-Walker
spacetimes with a semi-symmetric metric connection and generalized Kasner
spacetimes with a semi-symmetric metric connection and find some new examples
of Einstein affine manifolds and affine manifolds with constant scalar
curvature. We also consider the multiply twisted product Finsler manifolds and
we get some interesting properties of these spaces.
","[{""version"":""v1"",""created"":""Sun, 1 Jul 2012 11:45:08 GMT""}]","2014-07-29"
"1207.0200","Kouzou Nishida","Kouzou Nishida","A Vacuum Solution with Torsion in Higher-Derivative Gravity","This paper has been withdrawn by the author",,,,"hep-th","http://arxiv.org/licenses/nonexclusive-distrib/1.0/","  In this paper, we provide a vacuum solution with torsion in quadratic
Riemann-curvature gravity. Physically, the solution means that vacuum can have
a nonzero vacuum field with large torsion. We show that the Einstein-Hilbert
action can be derived if we expand the quadratic curvature of the Lagrangian in
a torsion-free Riemannian space-time around a nonzero vacuum field. We also
show that the cosmological constant caused by a nonzero vacuum field is equal
to zero.
","[{""version"":""v1"",""created"":""Sun, 1 Jul 2012 12:07:16 GMT""},{""version"":""v2"",""created"":""Sun, 2 Sep 2012 16:13:03 GMT""}]","2012-09-04"
"1207.0201","WooCheol Choi","Woocheol Choi","Maximal multipliers on compact manifolds without boundary","18 pages",,,,"math.AP","http://arxiv.org/licenses/nonexclusive-distrib/1.0/","  Hormander-Mihklin type multiplier theorem on compacts manifolds withour
boundary has been obtained by using the wave kernels. We consider maximal
multiplies on this setting. To obtain the result, we carefully deal with the
remainder terms and find an additional information on the wave kernels.
","[{""version"":""v1"",""created"":""Sun, 1 Jul 2012 12:16:25 GMT""},{""version"":""v2"",""created"":""Thu, 20 Mar 2014 06:58:50 GMT""}]","2014-03-21"
"1207.0202","Leonid Koralov","Leonid Koralov, Stanislav Molchanov","Branching diffusion in the super-critical regime","arXiv admin note: substantial text overlap with arXiv:1107.1159",,,,"math.PR","http://arxiv.org/licenses/nonexclusive-distrib/1.0/","  We investigate the long-time evolution of branching diffusion processes
(starting with a single particle) in inhomogeneous media. The qualitative
behavior of the processes depends on the intensity of the branching. We analyze
the super-critical case, when the total number of particles growing
exponentially with positive probability. We study the asymptotics of the number
of particles in different regions of space and describe the growth of the
region occupied by the particles.
","[{""version"":""v1"",""created"":""Sun, 1 Jul 2012 12:24:26 GMT""}]","2012-07-03"
