"1207.0113","Elisabeth Bouchaud","Gael Pallares and Cindy L. Rountree and Ludovic Douillard and Fabrice
  Charra and Elisabeth Bouchaud","Fractoluminescence characterization of the energy dissipated during fast
  fracture of glass","Accepted for publication in Europhysics Letters; 5 pages; 4 figures",,"10.1209/0295-5075/99/28003",,"cond-mat.mtrl-sci","http://arxiv.org/licenses/nonexclusive-distrib/1.0/","  Fractoluminescence experiments are performed on two kinds of silicate
glasses. All the light spectra collected during dynamic fracture reveal a black
body radiator behaviour, which is interpreted as a crack velocity-dependent
temperature rise close to the crack tip. Crack velocities are estimated to be
of the order of 1300 m.s$^{-1}$ and fracture process zones are shown to extend
over a few nanometers.
","[{""version"":""v1"",""created"":""Sat, 30 Jun 2012 16:07:53 GMT""}]","2015-06-05"
"1207.0114","Juan Gerardo Alcazar Arribas","Juan G. Alcazar","Efficient Detection of Symmetries of Polynomially Parametrized Curves",,,,,"math.AG","http://arxiv.org/licenses/nonexclusive-distrib/1.0/","  We present efficient algorithms for detecting central and mirror symmetry for
the case of algebraic curves defined by means of polynomial parametrizations.
The algorithms are based on the existence of a linear relationship between two
proper polynomial parametrizations of the curve, which leads to a triangular
polynomial system (with complex unknowns) that can be solved in a very fast
way; in particular, curves parametrized by polynomials of serious degrees can
be analyzed in a few seconds. In our analysis we provide a good number of
theoretical results on symmetries of polynomial curves, algorithms for
detecting rotation and mirror symmetry, and closed formulae to determine the
symmetry center and the symmetry axis, when they exist. A complexity analysis
of the algorithms is also given.
","[{""version"":""v1"",""created"":""Sat, 30 Jun 2012 16:11:08 GMT""},{""version"":""v2"",""created"":""Sun, 23 Dec 2012 19:15:02 GMT""}]","2012-12-27"
"1207.0115","Norman Metzner","Norman Metzner","Twistor Theory of Higher-Dimensional Black Holes","DPhil Thesis (University of Oxford, submitted February 2012), 119
  pages, 15 figures",,,,"gr-qc math-ph math.DG math.MP","http://arxiv.org/licenses/nonexclusive-distrib/1.0/","  The correspondence of stationary, axisymmetric, asymptotically flat
space-times and bundles over a reduced twistor space has been established in
four dimensions. The main impediment for an application of this correspondence
to examples in higher dimensions is the lack of a higher-dimensional equivalent
of the Ernst potential. This thesis will propose such a generalized Ernst
potential, point out where the rod structure of the space-time can be found in
the twistor picture and thereby provide a procedure for generating solutions to
the Einstein field equations in higher dimensions from the rod structure, other
asymptotic data, and the requirement of a regular axis. Examples in five
dimensions are studied and necessary tools are developed, in particular rules
for the transition between different adaptations of the patching matrix and
rules for the elimination of conical singularities.
","[{""version"":""v1"",""created"":""Sat, 30 Jun 2012 16:32:02 GMT""}]","2012-07-03"
"1207.0116","David Craven","David A. Craven","Perverse Equivalences and Brou\'e's Conjecture II: The Cyclic Case","56 pages, plus appendix",,,,"math.RT math.GR","http://arxiv.org/licenses/nonexclusive-distrib/1.0/","  We study Brou\'e's abelian defect group conjecture for groups of Lie type
using the recent theory of perverse equivalences and Deligne--Lusztig
varieties. Our approach is to analyze the perverse equivalence induced by
certain Deligne--Lusztig varieties (the geometric form of Brou\'e's conjecture)
directly; this uses the cohomology of these varieties, together with
information from the cyclotomic Hecke algebra. We start with a conjecture on
the cohomology of these Deligne--Lusztig varieties, prove various desirable
properties about it, and then use this to prove the existence of the perverse
equivalences predicted by the geometric form of Brou\'e's conjecture whenever
the defect group is cyclic (except possibly for two blocks whose Brauer tree is
unknown). This is a necessary first step to proving Brou\'e's conjecture in
general, as perverse equivalences are built up inductively from various Levi
subgroups.
  This article is the latest in a series by Raphael Rouquier and the author
with the eventual aim of proving Brou\'e's conjecture for unipotent blocks of
groups of Lie type.
","[{""version"":""v1"",""created"":""Sat, 30 Jun 2012 16:41:37 GMT""}]","2012-07-03"
"1207.0117","Rajdeep Borgohain","Rajdeep Borgohain and Sugata Sanyal","Rule Based Expert System for Cerebral Palsy Diagnosis","4 pages, 1 figure, 1 table",,,,"cs.AI","http://arxiv.org/licenses/nonexclusive-distrib/1.0/","  The use of Artificial Intelligence is finding prominence not only in core
computer areas, but also in cross disciplinary areas including medical
diagnosis. In this paper, we present a rule based Expert System used in
diagnosis of Cerebral Palsy. The expert system takes user input and depending
on the symptoms of the patient, diagnoses if the patient is suffering from
Cerebral Palsy. The Expert System also classifies the Cerebral Palsy as mild,
moderate or severe based on the presented symptoms.
","[{""version"":""v1"",""created"":""Sat, 30 Jun 2012 16:52:12 GMT""}]","2012-07-03"
"1207.0118","Joseph Van Name","Joseph Van Name","Constructing Ultrapowers from Elementary Extensions of Full Clones",,,,,"math.LO","http://arxiv.org/licenses/nonexclusive-distrib/1.0/","  Let $A$ be an infinite set. Let $\Omega(A)$ be the algebra over $A$ where
every constant is a fundamental constant and every finitary function is a
fundamental operation. We shall give a method of representing any algebra
$\mathcal{L}$ in the variety generated by $\Omega(A)$ as limit reduced powers
and even direct limits of limit reduced powers of $\mathcal{L}$. If the algebra
$\mathcal{L}$ is elementarily equivalent to $\Omega(A)$, then this construction
represents $\Omega(A)$ as a limit ultrapower and also as direct limits of limit
ultrapowers of $\Omega(A)$. This method therefore gives a method of
representing Boolean ultrapowers and other generalizations of the ultrapower
construction as limit ultrapowers and direct limits of limit ultrapowers.
","[{""version"":""v1"",""created"":""Sat, 30 Jun 2012 17:20:03 GMT""}]","2012-07-03"
"1207.0119","Joseph Van Name","Joseph Van Name","A Duality Between Non-Archimedean Uniform Spaces and Subdirect Powers of
  Full Clones",,,,,"math.GN","http://arxiv.org/licenses/nonexclusive-distrib/1.0/","  A uniform space is said to be non-Archimedean if it is generated by
equivalence relations. If $\lambda$ is a cardinal, then a non-Archimedean
uniform space $(X,\mathcal{U})$ is $\lambda$-totally bounded if each
equivalence relation in $\mathcal{U}$ partitions $X$ into less than $\lambda$
blocks. If $A$ is an infinite set, then let $\Omega(A)$ be the algebra with
universe $A$ and where each $a\in A$ is a fundamental constant and every
finitary function is a fundamental operation. We shall give a duality between
complete non-Archimedean $|A|^{+}$-totally bounded uniform spaces and subdirect
powers of $\Omega(A)$. We shall apply this duality to characterize the algebras
dual to supercomplete non-Archimedean uniform spaces.
","[{""version"":""v1"",""created"":""Sat, 30 Jun 2012 17:39:22 GMT""}]","2012-07-03"
"1207.0120","Nihar Shah","Nihar B. Shah, K. V. Rashmi, Kannan Ramchandran","Distributed Secret Dissemination Across a Network","Extended version of a paper presented at the International Symposium
  on Information Theory (ISIT) 2013",,,,"cs.CR cs.IT math.IT","http://arxiv.org/licenses/nonexclusive-distrib/1.0/","  Shamir's (n, k) threshold secret sharing is an important component of several
cryptographic protocols, such as those for secure multiparty-computation and
key management. These protocols typically assume the presence of direct
communication links from the dealer to all participants, in which case the
dealer can directly pass the shares of the secret to each participant. In this
paper, we consider the problem of secret sharing when the dealer does not have
direct communication links to all the participants, and instead, the dealer and
the participants form a general network. Existing methods are based on secure
message transmissions from the dealer to each participant requiring
considerable coordination in the network. In this paper, we present a
distributed algorithm for disseminating shares over a network, which we call
the SNEAK algorithm, requiring each node to know only the identities of its
one-hop neighbours. While SNEAK imposes a stronger condition on the network by
requiring the dealer to be what we call k-propagating rather than k-connected
as required by the existing solutions, we show that in addition to being
distributed, SNEAK achieves significant reduction in the communication cost and
the amount of randomness required.
","[{""version"":""v1"",""created"":""Sat, 30 Jun 2012 18:01:31 GMT""},{""version"":""v2"",""created"":""Thu, 12 Jul 2012 18:56:51 GMT""},{""version"":""v3"",""created"":""Tue, 27 Nov 2012 00:30:05 GMT""},{""version"":""v4"",""created"":""Thu, 4 Jul 2013 01:17:41 GMT""},{""version"":""v5"",""created"":""Wed, 22 Oct 2014 19:07:14 GMT""}]","2014-10-23"
"1207.0121","Marek Zawadowski","Stanis{\l}aw Szawiel, Marek Zawadowski","Monads of regular theories","36 pages",,,,"math.CT","http://arxiv.org/licenses/nonexclusive-distrib/1.0/","  We characterize the category of monads on $Set$ and the category of Lawvere
theories that are equivalent to the category of regular equational theories.
","[{""version"":""v1"",""created"":""Sat, 30 Jun 2012 18:02:56 GMT""}]","2016-08-14"
"1207.0122","Manoj Rameshchandra Thakur","Manoj Rameshchandra Thakur","A Distributed and Cooperative Approach to Botnet Detection Using Gossip
  Protocol","8 pages, 1 figure",,,,"cs.CR","http://arxiv.org/licenses/nonexclusive-distrib/1.0/","  Bots, in recent times, have posed a major threat to enterprise networks. With
the distributed nature of the way in which botnets operate, the problems faced
by enterprises have become acute. A bot is a program that operates as an agent
for a user and runs automated tasks over the internet, at a much higher rate
than would be possible for a human alone. A collection of bots in a network,
used for malicious purposes, is referred to as a botnet. In this paper we
suggested a distributed, co-operative approach towards detecting botnets is a
given network which is inspired by the gossip protocol. Each node in a given
network runs a standalone agent that computes a suspicion value for that node
after regular intervals. Each node in the network exchanges its suspicion
values with every other node in the network at regular intervals. The use of
gossip protocol ensures that if a node in the network is compromised, all other
nodes in the network are informed about it as soon as possible. Each node also
ensures that at any instance, by means of the gossip protocol, it maintains the
latest suspicion values of all the other nodes in the network.
","[{""version"":""v1"",""created"":""Sat, 30 Jun 2012 18:12:45 GMT""}]","2012-07-03"
"1207.0123","Adam Massey","Adam Massey","The KH-Theory of Complete Simplicial Toric Varieties and the Algebraic
  K-Theory of Weighted Projective Spaces","14 pages. Updated version, strengthening the proofs to hold true over
  any regular ring. To appear in the Journal of Pure and Applied Algebra",,"10.1016/j.jpaa.2013.02.002",,"math.KT math.AG","http://arxiv.org/licenses/nonexclusive-distrib/1.0/","  We show that, for a complete simplicial toric variety $X$, we can determine
its homotopy $\KH$-theory entirely in terms of the torus pieces of open sets
forming an open cover of $X$. We then construct conditions under which, given
two complete simplicial toric varieties, the two spectra $\KH(X) \otimes \Q$
and $\KH(Y) \otimes \Q$ are weakly equivalent. We apply this result to
determine the rational $\KH$-theory of weighted projective spaces. We next
examine $\K$-regularity for complete toric surfaces; in particular, we show
that complete toric surfaces are $\K_{0}$-regular. We then determine conditions
under which our approach for dimension 2 works in arbitrary dimensions, before
demonstrating that weighted projective spaces are not $\K_{1}$-regular, and for
dimensions bigger than 2 are also not in general $\K_{0}$-regular.
","[{""version"":""v1"",""created"":""Sat, 30 Jun 2012 18:17:13 GMT""},{""version"":""v2"",""created"":""Tue, 3 Jul 2012 08:49:36 GMT""},{""version"":""v3"",""created"":""Mon, 14 Jan 2013 07:51:37 GMT""},{""version"":""v4"",""created"":""Sat, 26 Jan 2013 19:28:21 GMT""}]","2013-03-12"
"1207.0124","Daniel M. Pellegrino","Daniel Nunez-Alarcon, Daniel Pellegrino, Juan Seoane-Sepulveda and
  Diana M. Serrano-Rodriguez","There exist multilinear Bohnenblust-Hille constants
  $(C_{n})_{n=1}^{\infty}$ with $\displaystyle \lim_{n\rightarrow
  \infty}(C_{n+1}-C_{n}) =0.$","An Appendix was added","Journal of Functional Analysis, v. 264, p. 429-463, 2013",,,"math.FA","http://arxiv.org/licenses/nonexclusive-distrib/1.0/","  The $n$-linear Bohnenblust-Hille inequality asserts that there is a constant
$C_{n}\in\lbrack1,\infty)$ such that the $\ell_{\frac{2n}{n+1}}$-norm of
$(U(e_{i_{^{1}}},...,e_{i_{n}}))_{i_{1},...i_{n}=1}^{N}$is bounded above by
$C_{n}$ times the supremum norm of $U,$ regardless of the $n$-linear form
$U:\mathbb{C}^{N}\times...\times\mathbb{C}^{N}% \rightarrow\mathbb{C}$ and the
positive integer $N$ (the same holds for real scalars). The power $2n/(n+1)$ is
sharp but the values and asymptotic behavior of the optimal constants remain a
mystery. The first estimates for these constants had exponential growth. Very
recently, a new panorama emerged and the importance, for many applications, of
the knowledge of the optimal constants (denoted by $(K_{n})_{n=1}^{\infty}$)
was stressed. The title of this paper is part of our Fundamental Lemma, one of
the novelties presented here. It brings surprising new (and precise)
information on the optimal constants (for both real and complex scalars). For
instance, [K_{n+1}-K_{n}<\frac{0.87}{n^{0.473}}] for infinitely many $n$'s. In
the case of complex scalars we present a curious formula, where $\pi,e$ and the
famous Euler--Mascheroni constant $\gamma$ appear together:
[K_{n}<1+(\frac{4}{\sqrt{\pi}}(1-e^{\gamma/2-1/2})
{\sum\limits_{j=1}^{n-1}}j^{^{\log_{2}(e^{-\gamma/2+1/2}) -1}%})] for all
$n\geq2$. Numerically, the above formula shows a surprising low growth,
[K_{n}<1.41(n-1)^{0.305}-0.04] for every integer $n \geq2$. We also provide a
brief discussion on the interplay between the Kahane-Salem-Zygmund and the
Bohnenblust-Hille (polynomial and multilinear) inequalities.
","[{""version"":""v1"",""created"":""Sat, 30 Jun 2012 18:46:20 GMT""},{""version"":""v2"",""created"":""Thu, 12 Jul 2012 11:09:11 GMT""},{""version"":""v3"",""created"":""Sat, 14 Jul 2012 22:48:11 GMT""},{""version"":""v4"",""created"":""Tue, 17 Jul 2012 15:00:42 GMT""},{""version"":""v5"",""created"":""Fri, 14 Sep 2012 15:16:47 GMT""}]","2015-10-01"
"1207.0125","Sneha Subramanian","Sneha Dey Subramanian","On the Distribution of Critical Points of a Polynomial",,,,,"math.PR","http://arxiv.org/licenses/nonexclusive-distrib/1.0/","  This paper proves that if points $Z_1,Z_2,...$ are chosen independently and
identically using some measure $\mu$ from the unit circle in the complex plane,
with $p_n(z) = (z-Z_1)(z-Z_2)...(z-Z_n)$, then the empirical distribution of
the critical points of $p_n$ converges weakly to $\mu$.
","[{""version"":""v1"",""created"":""Sat, 30 Jun 2012 19:03:30 GMT""},{""version"":""v2"",""created"":""Fri, 19 Oct 2012 19:32:37 GMT""}]","2012-10-22"
"1207.0126","David J. Rowe","D. J. Rowe","Vector coherent state representations and their inner products","28 pages, 1 figure","J. Phys. A: Math, Theor. 45 (2012) 24003","10.1088/1751-8113/45/24/244003",,"math-ph math.MP nucl-th","http://arxiv.org/licenses/nonexclusive-distrib/1.0/","  Several advances have extended the power and versatility of coherent state
theory to the extent that it has become a vital tool in the representation
theory of Lie groups and their Lie algebras. Representative applications are
reviewed and some new developments are introduced. The examples given are
chosen to illustrate special features of the scalar and vector coherent state
constructions and how they work in practical situations. Comparisons are made
with Mackey's theory of induced representations. For simplicity, we focus on
square integrable (discrete series) unitary representations although many of
the techniques apply more generally, with minor adjustment.
","[{""version"":""v1"",""created"":""Sat, 30 Jun 2012 19:07:54 GMT""}]","2012-07-03"
"1207.0127","J\'er\'emy Hure","J. Hure, B. Roman, J. Bico","Stamping and wrinkling of elastic plates",,"Phys. Rev. Lett 109, 054302 (2012)","10.1103/PhysRevLett.109.054302",,"cond-mat.soft","http://arxiv.org/licenses/nonexclusive-distrib/1.0/","  We study the peculiar wrinkling pattern of an elastic plate stamped into a
spherical mold. We show that the wavelength of the wrinkles decreases with
their amplitude, but reaches a maximum when the amplitude is of the order of
the thickness of the plate. The force required for compressing the wrinkled
plate presents a maximum independent of the thickness. A model is derived and
verified experimentally for a simple one-dimensional case. This model is
extended to the initial situation through an effective Young modulus
representing the mechanical behavior of wrinkled state. The theoretical
predictions are shown to be in good agreement with the experiments. This
approach provides a complement to the ""tension field theory"" developed for
wrinkles with unconstrained amplitude.
","[{""version"":""v1"",""created"":""Sat, 30 Jun 2012 19:09:53 GMT""}]","2015-06-05"
"1207.0128","A. Rod Gover","A.Cap, A.R. Gover, and H.R. Macbeth","Einstein metrics in projective geometry","10 pages. Adapted to published version. In addition corrected a minor
  sign error","Geom. Dedicata 168 (2014), 235-244","10.1007/s10711-013-9828-3",,"math.DG gr-qc math-ph math.MP","http://arxiv.org/licenses/nonexclusive-distrib/1.0/","  It is well known that pseudo-Riemannian metrics in the projective class of a
given torsion free affine connection can be obtained from (and are equivalent
to) the solutions of a certain overdetermined projectively invariant
differential equation. This equation is a special case of a so-called first BGG
equation. The general theory of such equations singles out a subclass of
so-called normal solutions. We prove that non-degerate normal solutions are
equivalent to pseudo-Riemannian Einstein metrics in the projective class and
observe that this connects to natural projective extensions of the Einstein
condition.
","[{""version"":""v1"",""created"":""Sat, 30 Jun 2012 19:17:31 GMT""},{""version"":""v2"",""created"":""Wed, 18 Jun 2014 01:18:20 GMT""}]","2015-09-29"
"1207.0129","Dayan Liu","Dayan Liu (KAUST-MCSE), Olivier Gibaru (INRIA Lille - Nord Europe,
  LSIS), Wilfrid Perruquetti (INRIA Lille - Nord Europe, LAGIS)","Non-asymptotic fractional order differentiators via an algebraic
  parametric method",,"1st International Conference on Systems and Computer Science
  (2012)",,,"math.NA","http://arxiv.org/licenses/nonexclusive-distrib/1.0/","  Recently, Mboup, Join and Fliess [27], [28] introduced non-asymptotic integer
order differentiators by using an algebraic parametric estimation method [7],
[8]. In this paper, in order to obtain non-asymptotic fractional order
differentiators we apply this algebraic parametric method to truncated
expansions of fractional Taylor series based on the Jumarie's modified
Riemann-Liouville derivative [14]. Exact and simple formulae for these
differentiators are given where a sliding integration window of a noisy signal
involving Jacobi polynomials is used without complex mathematical deduction.
The efficiency and the stability with respect to corrupting noises of the
proposed fractional order differentiators are shown in numerical simulations.
","[{""version"":""v1"",""created"":""Sat, 30 Jun 2012 19:21:57 GMT""}]","2012-07-03"
"1207.0130","Domenico Ditto","Adriano Orefice, Raffaele Giovanelli, Domenico Ditto","The Helmholtz Wave Potential: a non-probabilistic insight into Wave
  Mechanics","23 pages, 5 figures. Title modified and text revised. arXiv admin
  note: text overlap with arXiv:1202.6225",,,,"quant-ph","http://arxiv.org/licenses/nonexclusive-distrib/1.0/","  The behavior of classical monochromatic waves in stationary media is shown to
be ruled by a novel, frequency-dependent function which we call Wave Potential,
and which we show to be encoded in the structure of the Helmholtz equation. An
exact, Hamiltonian, ray-based kinematical treatment, reducing to the usual
eikonal approximation in the absence of Wave Potential, shows that its presence
induces a mutual, perpendicular ray-coupling, which is the one and only cause
of wave-like phenomena such as diffraction and interference. The Wave
Potential, whose discovery does already constitute a striking novelty in the
case of classical waves, turns out to play an even more important role in the
quantum case. Recalling, indeed, that the time-independent Schroedinger
equation (associating the motion of mono-energetic particles with stationary
monochromatic matter waves) is itself a Helmholtz-like equation, the exact,
ray-based treatment developed in the classical case is extended - without
resorting to statistical concepts - to the exact, trajectory-based Hamiltonian
dynamics of mono-energetic point-like particles. Exact, classical-looking
particle trajectories may be defined, contrary to common belief, and turn out
to be perpendicularly coupled by an exact, energy-dependent Wave Potential,
similar in the form, but not in the physical meaning, to the statistical,
energy-independent ""Quantum Potential"" of Bohm's theory, which is affected, as
is well known, by the practical necessity of representing particles by means of
statistical wave packets, moving along probability flux lines. This result,
together with the connection shown to exist between Wave Potential and
Uncertainty Principle, allows a novel, non-probabilistic interpretation of Wave
Mechanics.
","[{""version"":""v1"",""created"":""Sat, 30 Jun 2012 19:53:13 GMT""},{""version"":""v2"",""created"":""Sat, 7 Jul 2012 13:35:19 GMT""},{""version"":""v3"",""created"":""Tue, 4 Sep 2012 11:47:12 GMT""},{""version"":""v4"",""created"":""Thu, 4 Oct 2012 07:49:43 GMT""},{""version"":""v5"",""created"":""Wed, 16 Jan 2013 12:37:32 GMT""},{""version"":""v6"",""created"":""Wed, 30 Jan 2013 13:05:02 GMT""},{""version"":""v7"",""created"":""Mon, 4 Feb 2013 11:20:30 GMT""},{""version"":""v8"",""created"":""Tue, 16 Apr 2013 12:08:57 GMT""}]","2013-04-17"
"1207.0131","Vadim Guzey","V. Guzey, L. Zhu, C. Keppel, M.Eric Christy (Hampton U.), D. Gaskell,
  P. Solvignon (Jefferson Lab), A. Accardi (Hampton U. & Jefferson Lab)","Impact of nuclear dependence of R=\sigma_L/\sigma_T on antishadowing in
  nuclear structure functions","9 pages, 8 figures, 1 table",,"10.1103/PhysRevC.86.045201",,"hep-ph hep-ex nucl-ex nucl-th","http://arxiv.org/licenses/nonexclusive-distrib/1.0/","  We study the impact of the nuclear dependence of R=\sigma_L/\sigma_T on the
extraction of the F_2^A/F_2^D and F_1^A/F_1^D structure function ratios from
the data on the \sigma^A/\sigma^D cross section ratios. Guided by indications
of the nuclear dependence of R from the world data, we examine selected sets of
EMC, BCDMS, NMC and SLAC data and find that F_1^A/F_1^D < \sigma^A/\sigma^D
\leq F_2^A/F_2^D. In particular, we observe that the nuclear enhancement
(antishadowing) for F_1^A/F_1^D in the interval 0.1 < x < 0.3 becomes
significantly reduced or even disappears, which indicates that antishadowing is
dominated by the longitudinal structure function F_L. We also argue that
precise measurements of nuclear modifications of R and F_L^A have the potential
to constrain the poorly known gluon distribution in nuclei over a wide range of
x.
","[{""version"":""v1"",""created"":""Sat, 30 Jun 2012 19:57:45 GMT""}]","2013-05-30"
