"1207.2039","Bradley James Kavanagh","Bradley J. Kavanagh, Anne M. Green","Improved determination of the WIMP mass from direct detection data","15 pages, 16 figures. VL-2 benchmark velocity distribution modified
  slightly; corrected typo in XENON1T exposure time; conclusions unchanged.
  Matches version published in PRD","Phys. Rev. D 86, 065027 (2012)","10.1103/PhysRevD.86.065027",,"astro-ph.CO hep-ph","http://arxiv.org/licenses/nonexclusive-distrib/1.0/","  Direct detection experiments searching for weakly interacting massive
particle (WIMP) dark matter typically use a simplified model of the Galactic
halo to derive parameter constraints. However, there is strong evidence that
this Standard Halo Model is not a good approximation to our Galaxy. We discuss
previous attempts to extract the WIMP mass, cross-section and speed
distribution from direct detection data and show that these lead to significant
biases in the reconstructed parameter values. We develop and test an
alternative model-independent method based on parametrising the momentum
distribution of the WIMPs. This allows us to limit the analysis only to those
regions of momentum space to which the experiments are sensitive. The method
can be applied to a single experiment to extract information about the
distribution function, as well as information on the degenerate WIMP mass and
interaction cross-section combined in a single parameter. This degeneracy can
be broken by including data from additional experiments, meaning that the WIMP
mass and speed distribution can be recovered. We test the momentum
parametrisation method using mock datasets from proposed ton-scale direct
detection experiments, showing that it exhibits improved coverage properties
over previous methods, as well as significantly reduced bias. We are also able
to accurately reconstruct the shape of the WIMP speed distribution but
distinguishing between different underlying distributions remains difficult.
","[{""version"":""v1"",""created"":""Mon, 9 Jul 2012 13:20:38 GMT""},{""version"":""v2"",""created"":""Fri, 16 Nov 2012 10:53:42 GMT""}]","2012-11-19"
"1207.2040","Michael McGuire","Michael A. McGuire, Andrew F. May, Brian C. Sales","Structural and physical properties of layered oxy-arsenides LnRuAsO (Ln
  = La, Nd, Sm, Gd)",,"Journal of Solid State Chemistry 191, 71 (2012)","10.1016/j.jssc.2012.03.010",,"cond-mat.str-el cond-mat.supr-con","http://arxiv.org/licenses/nonexclusive-distrib/1.0/","  Polycrystalline samples of LaRuAsO, NdRuAsO, SmRuAsO, and GdRuAsO have been
synthesized and studied using powder x-ray diffraction, electrical transport,
magnetization, and heat capacity measurements. Variations in structural
properties across the series reveal a trend toward more ideal tetrahedral
coordination around Ru as the size of the rare earth element is reduced. The
lattice parameters of these Ru compounds show a more anisotropic response to
variation in Ln than their Fe analogues, and significant anisotropy in thermal
expansion is also observed. Transport measurements show metallic behavior, and
carrier concentrations near 10^21 - 10^22 electrons per cm^3 are inferred from
simple analysis of Hall effect measurements. Anomalies in resistivity,
magnetization, and heat capacity indicate antiferromagnetic ordering of rare
earth moments at 5 K for GdRuAsO, 4.5 K for SmRuAsO, and <2 K for NdRuAsO.
Magnetization measurements on LaRuAsO show no evidence of a magnetic moment on
Ru. Observed behaviors are compared to those reported for similar Fe and Ru
compounds.
","[{""version"":""v1"",""created"":""Mon, 9 Jul 2012 13:33:54 GMT""}]","2012-07-10"
"1207.2041","Robert Heath Jr.","Robert W. Heath Jr, Marios Kountouris, and Tianyang Bai","Modeling Heterogeneous Network Interference Using Poisson Point
  Processes","Submitted to the IEEE Transactions on Signal Processing, July 2012,
  Revised December 2012",,,,"cs.IT math.IT","http://arxiv.org/licenses/nonexclusive-distrib/1.0/","  Cellular systems are becoming more heterogeneous with the introduction of low
power nodes including femtocells, relays, and distributed antennas.
Unfortunately, the resulting interference environment is also becoming more
complicated, making evaluation of different communication strategies
challenging in both analysis and simulation. Leveraging recent applications of
stochastic geometry to analyze cellular systems, this paper proposes to analyze
downlink performance in a fixed-size cell, which is inscribed within a weighted
Voronoi cell in a Poisson field of interferers. A nearest out-of-cell
interferer, out-of-cell interferers outside a guard region, and cross-tier
interference are included in the interference calculations. Bounding the
interference power as a function of distance from the cell center, the total
interference is characterized through its Laplace transform. An equivalent
marked process is proposed for the out-of-cell interference under additional
assumptions. To facilitate simplified calculations, the interference
distribution is approximated using the Gamma distribution with second order
moment matching. The Gamma approximation simplifies calculation of the success
probability and average rate, incorporates small-scale and large-scale fading,
and works with co-tier and cross-tier interference. Simulations show that the
proposed model provides a flexible way to characterize outage probability and
rate as a function of the distance to the cell edge.
","[{""version"":""v1"",""created"":""Mon, 9 Jul 2012 13:34:28 GMT""},{""version"":""v2"",""created"":""Fri, 26 Apr 2013 13:20:47 GMT""}]","2013-04-29"
"1207.2042","Eduardo Guerras","E. Guerras, E. Mediavilla, J. Jimenez-Vicente, C. S. Kochanek, J. A.
  Mu\~noz, E. Falco, V. Motta","Microlensing of Quasar Broad Emission Lines: Constraints on Broad Line
  Region Size",,,"10.1088/0004-637X/764/2/160",,"astro-ph.CO","http://arxiv.org/licenses/nonexclusive-distrib/1.0/","  We measure the differential microlensing of the broad emission lines between
18 quasar image pairs in 16 gravitational lenses. We find that high ionization
lines such as CIV are more strongly microlensed than low ionization lines,
indicating that the high ionization line emission regions are more compact. If
we statistically model the distribution of microlensing magnifications, we
obtain estimates for the broad line region radius of 24 (-15/+22) and 55
(-35/+150) light-days (90% confidence) for the high and low ionization lines,
respectively. When the sample is divided attending to quasar luminosity, we
find that the line emission regions of more luminous quasars are larger, with a
slope consistent with the expected scaling from photoionization models. Our
estimates also agree well with the results from local reveberation mapping
studies.
","[{""version"":""v1"",""created"":""Mon, 9 Jul 2012 13:46:18 GMT""},{""version"":""v2"",""created"":""Wed, 30 Jan 2013 11:30:52 GMT""}]","2015-06-05"
"1207.2043","Timothy Dubois","Alex Skvortsov, Milan Jamriska and Timothy C DuBois","Tracer dispersion in the turbulent convective layer","4 pages, 2 figures, 1 table","J. Atmos. Sci., 70, 4112-4121 (2013)","10.1175/JAS-D-12-0268.1",,"nlin.CD physics.ao-ph physics.flu-dyn","http://arxiv.org/licenses/nonexclusive-distrib/1.0/","  Experimental results for passive tracer dispersion in the turbulent surface
layer under convective conditions are presented. In this case, the dispersion
of tracer particles is determined by the interplay of two mechanisms: buoyancy
and advection. In the atmospheric surface layer under stable stratification the
buoyancy mechanism dominates when the distance from the ground is greater than
the Monin-Obukhov length, resulting in a different exponent in the scaling law
of relative separation of lagrangian particles (deviation from the celebrated
Richardson's law). This conclusion is supported by our extensive atmospheric
observations. Exit-time statistics are derived from our experimental dataset,
which demonstrates a significant difference between tracer dispersion in the
convective and neutrally stratified surface layers.
","[{""version"":""v1"",""created"":""Mon, 9 Jul 2012 13:47:13 GMT""}]","2014-08-26"
"1207.2044","Audrey Thirouin Miss","A. Thirouin, J. L. Ortiz, A. Campo Bagatin, P. Pravec, N. Morales, O.
  Hainaut, R. Duffard","Short-term variability of 10 trans-Neptunian objects","30 pages, 25 figures, Accepted for publication in MNRAS",,"10.1111/j.1365-2966.2012.21477.x",,"astro-ph.EP","http://arxiv.org/licenses/nonexclusive-distrib/1.0/","  We present our latest results about the short-term variability of
trans-Neptunian objects (TNOs). We performed broad-band CCD photometric
observations using several telescopes in Spain and Chile. We present results
based on three years of observations and report the short-term variability of
10 TNOs. Our sample of studied targets contains classical objects: (275809)
2001 QY297, (307251) 2002 KW14, (55636) 2002 TX300, 2004 NT33, (230965) 2004
XA192, and (202421) 2005 UQ513, a resonant body: (84522) 2002 TC302, a
scattered target: (44594) 1999 OX3, and two detached objects: (145480) 2005
TB190, and (40314) 1999 KR16. For each target, light curves as well as possible
rotation periods and photometric amplitudes are reported. The majority of the
observed objects present a low peak-to-peak amplitude, <0.15mag. Only two
objects exhibit light curve amplitudes higher than 0.15mag: (275809) 2001
QY297, and (307251) 2002 KW14. We remark two biases in the literature,
previously studied in Thirouin et al. (2010) and confirmed by this new study: a
bias towards objects with a small amplitude light curve and a second one
against objects with a long rotational period in the data base of published
rotational periods. We derived constraints on physical properties of some
targets. We also report the solar phase curves of (40314) 1999 KR16, and
(44594) 1999 OX3 for solar phase angles from 0 degree to around 2 degrees. Part
of our discussion is focused on the study of (275809) 2001 QY297 which turned
out to be an asynchronous binary system.
","[{""version"":""v1"",""created"":""Mon, 9 Jul 2012 13:50:41 GMT""}]","2015-06-05"
"1207.2045","Alexei Kanel-Belov Prof.","Alexei Kanel-Belov, Jie-Tai Yu and Andrey Elishev","On The Zariski Topology Of Automorphism Groups Of Affine Spaces And
  Algebras","Added, reworked some proofs; several clarification remarks added
  under the suggestion of the referee",,,,"math.RA math-ph math.AC math.AG math.AT math.MP","http://arxiv.org/licenses/nonexclusive-distrib/1.0/","  We study the Zariski topology of the ind-groups of polynomial and free
associative algebras $\Aut(K[x_1,...,x_n])$ (which is equivalent to the
automorphism group of the affine space $\Aut(K^n))$) and $\Aut(K< x_1,...,
x_n>$ via $\Ind$-schemes, toric varieties, approximations and singularities.
  We obtain some nice properties of $\Aut(\Aut(A))$, where $A$ is polynomial or
free associative algebra over a field $K$. We prove that all $\Ind$-scheme
automorphisms of $\Aut(K[x_1,...,x_n])$ are inner for $n\ge 3$, and all
$\Ind$-scheme automorphisms of $\Aut(K< x_1,..., x_n>)$ are semi-inner. We also
establish that any effective action of torus $T^n$ on $\Aut(K< x_1,..., x_n>)$
is linearizable provided $K$ is infinity. That is, it is conjugated to a
standard one.
  As an application, we prove that $\Aut(K[x_1,...,x_n])$ cannot be embedded
into $\Aut(K< x_1,...,x_n>)$ induced by the natural abelianization. In other
words, the {\it Automorphism Group Lifting Problem} has a negative solution.
  We explore the close connection between the above results and the Jacobian
conjecture, and Kontsevich-Belov conjecture, and formulate the Jacobian
conjecture for fields of any characteristic.
","[{""version"":""v1"",""created"":""Mon, 9 Jul 2012 13:53:22 GMT""},{""version"":""v2"",""created"":""Mon, 29 Oct 2012 18:17:45 GMT""},{""version"":""v3"",""created"":""Wed, 2 Jan 2013 02:06:59 GMT""},{""version"":""v4"",""created"":""Fri, 4 Jan 2013 13:05:04 GMT""},{""version"":""v5"",""created"":""Mon, 1 Apr 2013 01:35:06 GMT""},{""version"":""v6"",""created"":""Tue, 13 Dec 2016 19:59:54 GMT""}]","2017-10-12"
"1207.2046","Mehmet Firat Arikan","M. Firat Arikan, Hyunjoo Cho, Sema Salur","Contact Structures on G_2-Manifolds and Spin 7-Manifolds","7 pages",,,,"math.DG math.GT math.SG","http://arxiv.org/licenses/nonexclusive-distrib/1.0/","  We show that there exist infinitely many pairwise distinct non-closed
G_2-manifolds (some of which have holonomy full G_2) such that they admit
co-oriented contact structures and have co-oriented contact submanifolds which
are also associative. Along the way, we prove that there exists a tubular
neighborhood N of every orientable three-submanifold Y of an orientable
seven-manifold with spin structure such that for every co-oriented contact
structure on Y, N admits a co-oriented contact structure such that Y is a
contact submanifold of N. Moreover, we construct infinitely many pairwise
distinct non-closed seven-manifolds with spin structures which admit
co-oriented contact structures and retract onto co-oriented contact
submanifolds of co-dimension four.
","[{""version"":""v1"",""created"":""Mon, 9 Jul 2012 13:58:15 GMT""}]","2012-07-10"
"1207.2047","Marta Strani","Corrado Mascia and Marta Strani","Metastability for nonlinear parabolic equations with application to
  scalar viscous conservation laws","27 pages, 1 figure",,,,"math.AP","http://arxiv.org/licenses/nonexclusive-distrib/1.0/","  The aim article is to contribute to the definition of a versatile language
for metastability in the context of partial differential equations of evolutive
type. A general framework suited for parabolic equations in one dimensional
bounded domains is proposed, based on choosing a family of approximate steady
states, and on the spectral properties of the linearized operators at such
states. The slow motion for solutions belonging to a cylindrical neighborhood
of the family of approximate steady states is analyzed by means of a system of
an ODE for the parameter $\xi$ that describes the family, coupled with a PDE
describing the evolution of the perturbation $v$.
  We state and prove a general result concerning the reduced system for the
couple $(\xi,v)$, called quasi-linearized system, obtained by disregarding the
nonlinear term in $v$, and we show how such approach suits to the prototypical
example of scalar viscous conservation laws with Dirichlet boundary condition
in a bounded one-dimensional interval with convex flux.
","[{""version"":""v1"",""created"":""Mon, 9 Jul 2012 13:59:04 GMT""},{""version"":""v2"",""created"":""Fri, 22 Mar 2013 11:10:33 GMT""}]","2013-03-25"
"1207.2048","Padeli P. Papadopoulos Dr","Padelis P. Papadopoulos, Wing-Fai Thi","The initial conditions of star formation: cosmic rays as the fundamental
  regulators","21 pages, 8 figures, Invited contribution to the Sant Cugat Forum on
  Astrophysics: Workshop on Cosmic-ray induced phenomenology in star-forming
  environments (April 16-19, 2012) (Version 3, with final, minor, corrections)",,"10.1007/978-3-642-35410-6_5",,"astro-ph.HE astro-ph.GA","http://arxiv.org/licenses/nonexclusive-distrib/1.0/","  Cosmic rays (CRs) control the thermal, ionization and chemical state of the
dense H_2 gas regions that otherwise remain shielded from far-UV and optical
stellar radiation propagating through the dusty ISM of galaxies. It is in such
CR-dominated regions (CRDRs) rather than Photon-dominated regions (PDRs) of H_2
clouds where the star formation initial conditions are set, making CRs the
ultimate star-formation feedback factor in galaxies, able to operate even in
their most deeply dust-enshrouded environments. CR-controlled star formation
initial conditions naturally set the stage for a near-invariant stellar Initial
Mass Function (IMF) in galaxies as long as their average CR energy density
U_{CR} permeating their molecular ISM remains within a factor of ~10 of its
Galactic value. Nevertheless, in the extreme environments of the compact
starbursts found in merging galaxies, where U_{CR}\sim(few)x10^{3}U_{CR,Gal},
CRs dramatically alter the initial conditions of star formation. In the
resulting extreme CRDRs H_2 cloud fragmentation will produce far fewer low mass
(<8 M_{sol}) stars, yielding a top-heavy stellar IMF. This will be a generic
feature of CR-controlled star-formation initial conditions, lending a physical
base for a bimodal IMF during galaxy formation, with a top-heavy one for
compact merger-induced starbursts, and an ordinary IMF preserved for star
formation in isolated gas-rich disks. In this scheme the integrated galactic
IMFs (IGIMF) are expected to be strong functions of the star formation history
of galaxies.
","[{""version"":""v1"",""created"":""Mon, 9 Jul 2012 14:00:04 GMT""},{""version"":""v2"",""created"":""Wed, 11 Jul 2012 08:38:41 GMT""},{""version"":""v3"",""created"":""Mon, 6 Aug 2012 10:11:34 GMT""}]","2015-06-05"
"1207.2049","Ibrahim Inanc","Canan Atilgan, Ibrahim Inanc, Ali Rana Atilgan","On modifying properties of polymeric melts by nanoscopic particles","25 pages, 7 figures",,"10.1002/polb.23179",,"cond-mat.soft","http://arxiv.org/licenses/nonexclusive-distrib/1.0/","  We study geometric and energetic factors that partake in modifying properties
of polymeric melts via inserting well-dispersed nanoscopic particles (NP).
Model systems are polybutadiene melts including 10-150 atom atomic clusters
(0.1-1.5% v/v). We tune interactions between chains and particle by van der
Waals terms. Using molecular dynamics we study equilibrium fluctuations and
dynamical properties at the interface. Effect of bead size and interaction
strength both on volume and volumetric fluctuations is manifested in mechanical
properties, quantified here by bulk modulus, K. Tuning NP size and non-bonded
interactions results in ~15% enhancement in K by addition of a maximum of 1.5%
v/v NP.
","[{""version"":""v1"",""created"":""Mon, 9 Jul 2012 14:00:15 GMT""}]","2015-06-05"
"1207.2050","Pietro Faccioli","Pietro Faccioli","Questions and prospects in quarkonium polarization measurements from
  proton-proton to nucleus-nucleus collisions","Invited brief review, reflecting seminars and presentations made at
  CERN, Fermilab, Brookhaven, DESY, HEPHY, etc. Published in Modern Physics
  Letters A. 23 pages, 11 figures","Modern Physics Letters A Vol. 27, No. 23 (2012) 1230022","10.1142/S0217732312300224",,"hep-ph","http://arxiv.org/licenses/nonexclusive-distrib/1.0/","  Polarization measurements are the best instrument to understand how quark and
antiquark combine into the different quarkonium states, but no model has so far
succeeded in explaining the measured J/psi and Upsilon polarizations. On the
other hand, the experimental data in proton-antiproton and proton-nucleus
collisions are inconsistent, incomplete and ambiguous. New analyses will have
to properly address often underestimated issues: the existence of azimuthal
anisotropies, the dependence on the reference frame, the influence of the
experimental acceptance on the comparison with other measurements and with
theory. Additionally, a recently developed frame-invariant formalism will
provide an alternative and often more immediate physical viewpoint and, at the
same time, will help probing systematic effects due to experimental biases. The
role of feed-down decays from heavier states, a crucial missing piece in the
current experimental knowledge, will have to be investigated. Ultimately,
quarkonium polarization measurements will also offer new possibilities in the
study of the properties of the quark-gluon plasma.
","[{""version"":""v1"",""created"":""Mon, 9 Jul 2012 14:04:09 GMT""},{""version"":""v2"",""created"":""Thu, 23 Aug 2012 13:41:48 GMT""}]","2015-03-20"
"1207.2051","Lan Zhou","Jing Lu, Lan Zhou","Non-Abelian geometrical control of a qubit in an NV center in diamond","5 pages","Eur. Phys. Lett. 102, 30006 (2013)","10.1209/0295-5075/102/30006",,"quant-ph","http://arxiv.org/licenses/nonexclusive-distrib/1.0/","  We propose an approach for an optical qubit rotation in the negatively
charged nitrogen-vacancy (NV) center in diamond. The qubit is encoded in the
ground degenerate states at the relatively low temperature limit. The basic
idea of the rotation procedure is the non-Abelian geometric phase in an
adiabatic passage, which is produced by the nonadiabatic transition between the
two degenerate dark states. The feasibility is based on the success of modeling
the NV center as an excited-doublet four-level atom.
","[{""version"":""v1"",""created"":""Mon, 9 Jul 2012 14:04:42 GMT""}]","2015-06-05"
"1207.2052","Sergei Lukyanets P","O. V. Kliushnychenko and S. P. Lukyanets","Induced long-time correlations in a two-component lattice gas","4 pages, 1 figure","Eur. Phys. J. Special Topics 216, 127-132 (2013)","10.1140/epjst/e2013-01735-1",,"cond-mat.stat-mech","http://arxiv.org/licenses/nonexclusive-distrib/1.0/","  The distinguishability of at least two species of particles in the classical
lattice gas with no interactions except hard-core exclusion entails additional
interparticle correlations. A nonlinear mixing flow appears and manifests
itself most pronounced in the case of significant difference between mobilities
of species. It may result in the induced correlations for the slow component
mediated by the fast one. In the quasi-one-dimensional case, the long-time
correlations are demonstrated to take place in the slow component, that is
similar to the hydrodynamic correlations between colloidal particles. In the
adiabatic approximation, these correlations may come into play only in the
non-equilibrium case with the flow of the fast component present in the system.
","[{""version"":""v1"",""created"":""Mon, 9 Jul 2012 14:07:22 GMT""},{""version"":""v2"",""created"":""Fri, 28 Sep 2012 12:35:46 GMT""}]","2013-02-07"
"1207.2053","Adam Rancon","A. Rancon and N. Dupuis","Thermodynamics of a Bose gas near the superfluid--Mott-insulator
  transition","15 pages, 11 figures","Phys. Rev. A 86, 043624 (2012)","10.1103/PhysRevA.86.043624",,"cond-mat.quant-gas","http://arxiv.org/licenses/nonexclusive-distrib/1.0/","  We study the thermodynamics near the generic (density-driven)
superfluid--Mott-insulator transition in the three-dimensional Bose-Hubbard
model using the nonperturbative renormalization-group approach. At low energy
the physics is controlled by the Gaussian fixed point and becomes universal.
Thermodynamic quantities can then be expressed in terms of the universal
scaling functions of the dilute Bose gas universality class while the
microscopic physics enters only {\it via} two nonuniversal parameters, namely
the effective mass $m^*$ and the ""scattering length"" $a^*$ of the elementary
excitations at the quantum critical point between the superfluid and
Mott-insulating phase. A notable exception is the condensate density in the
superfluid phase which is proportional to the quasi-particle weight $\Zqp$ of
the elementary excitations. The universal regime is defined by $m^*a^*{}^2 T\ll
1$ and $m^*a^*{}^2|\delta\mu|\ll 1$, or equivalently $|\bar n-\bar
n_c|a^*{}^3\ll 1$, where $\delta\mu=\mu-\mu_c$ is the chemical potential shift
from the quantum critical point $(\mu=\mu_c,T=0)$ and $\bar n-\bar n_c$ the
doping with respect to the commensurate density $\bar n_c$ of the T=0 Mott
insulator. We compute $\Zqp$, $m^*$ and $a^*$ and find that they vary strongly
with both the ratio $t/U$ between hopping amplitude and on-site repulsion and
the value of the (commensurate) density $\bar n_c$. Finally, we discuss the
experimental observation of universality and the measurement of $\Zqp$, $m^*$
and $a^*$ in a cold atomic gas in an optical lattice.
","[{""version"":""v1"",""created"":""Mon, 9 Jul 2012 14:08:18 GMT""}]","2012-11-28"
"1207.2054","Jeffrey Morton","Jeffrey C. Morton, Jamie Vicary","The Categorified Heisenberg Algebra I: A Combinatorial Representation","37 pages; v2 adds new theorems, examples, improved proofs",,,,"math.QA math.CT","http://arxiv.org/licenses/nonexclusive-distrib/1.0/","  We give an introductory account of Khovanov's categorification of the
Heisenberg algebra, and construct a combinatorial model for it in a 2-category
of spans of groupoids. We also treat a categorification of $U(sl_n)$ in a
similar way. These give rise to standard representations on vector spaces
through a linearization process.
","[{""version"":""v1"",""created"":""Mon, 9 Jul 2012 14:11:38 GMT""},{""version"":""v2"",""created"":""Wed, 13 Nov 2013 14:50:42 GMT""}]","2013-11-14"
"1207.2055","Zurab Silagadze","Z. K. Silagadze","Comment on the sums $S(n)=\sum\limits_{k=-\infty}^\infty
  \frac{1}{(4k+1)^n}$","11 pages, to be published in Georgian Mathematical Journal.
  arXiv:1003.3602 is more extended version of this short note","Georgian Math. J. 19 (2012), 587-595","10.1515/gmj-2012-0023",,"math.CA","http://arxiv.org/licenses/nonexclusive-distrib/1.0/","  This is a comment on the papers N. D. Elkies, Amer. Math. Monthly 110 (2003),
561-573 and Cvijovic and J. Klinowski, J. Comput. Appl. Math. 142 (2002),
435-439. We provide an explicit expression for the kernel of the integral
operator introduced in the first paper. This explicit expression considerably
simplifies the calculation of S(n) and enables a simple derivation of Cvijovic
and Klinowski's integral representation for $\zeta(2n+1)$.
","[{""version"":""v1"",""created"":""Mon, 9 Jul 2012 14:15:33 GMT""}]","2012-09-11"
