"1207.1998","David Sibley","David N. Sibley, Nikos Savva, and Serafim Kalliadasis","Slip or not slip? A methodical examination of the interface formation
  model using two-dimensional droplet spreading on a horizontal planar
  substrate as a prototype system","45 pages, 18 figures","Phys. Fluids 24, 082105 (2012)","10.1063/1.4742895",,"physics.flu-dyn math-ph math.MP","http://arxiv.org/licenses/nonexclusive-distrib/1.0/","  We consider the spreading of a thin two-dimensional droplet on a planar
substrate as a prototype system to compare the contemporary model for contact
line motion based on interface formation of Shikhmurzaev [Int. J. Multiphas.
Flow 19, 589 (1993)], to the more commonly used continuum fluid dynamical
equations augmented with the Navier-slip condition. Considering quasistatic
droplet evolution and using the method of matched asymptotics, we find that the
evolution of the droplet radius using the interface formation model reduces to
an equivalent expression for a slip model, where the prescribed microscopic
dynamic contact angle has a velocity dependent correction to its static value.
This result is found for both the original interface formation model
formulation and for a more recent version, where mass transfer from bulk to
surface layers is accounted for through the boundary conditions. Various
features of the model, such as the pressure behaviour and rolling motion at the
contact line, and their relevance, are also considered in the prototype system
we adopt.
","[{""version"":""v1"",""created"":""Mon, 9 Jul 2012 09:45:18 GMT""}]","2012-08-17"
"1207.1999","Kazimierz   {\L}akomy","Kazimierz {\L}akomy, Rejish Nath, Luis Santos","Faraday patterns in coupled one-dimensional dipolar condensates",,"Phys. Rev. A 86, 023620 (2012)","10.1103/PhysRevA.86.023620",,"cond-mat.quant-gas physics.atom-ph quant-ph","http://arxiv.org/licenses/nonexclusive-distrib/1.0/","  We study Faraday patterns in quasi-one-dimensional dipolar Bose-Einstein
condensates with parametrically driven dipolar interactions. We show that in
the presence of a roton minimum in the excitation spectrum, the emergent
Faraday waves differ substantially in two- and one-dimensional geometries,
providing a clear example of the key role of confinement dimensionality in
dipolar gases. Moreover, Faraday patterns constitute an excellent tool to study
non-local effects in polar gases, as we illustrate for two parallel
quasi-one-dimensional dipolar condensates. Non-local interactions between the
condensates give rise to an excitation spectrum characterized by symmetric and
anti-symmetric modes, even in the absence of hopping. We show that this
feature, absent in non-dipolar gases, results in a critical driving frequency
at which a marked transition occurs between correlated and anti-correlated
Faraday patterns in the two condensates. Interestingly, at this critical
frequency, the emergent Faraday pattern stems from a spontaneous symmetry
breaking mechanism.
","[{""version"":""v1"",""created"":""Mon, 9 Jul 2012 10:21:40 GMT""},{""version"":""v2"",""created"":""Tue, 10 Jul 2012 13:50:36 GMT""},{""version"":""v3"",""created"":""Thu, 12 Jul 2012 16:10:32 GMT""}]","2012-08-24"
"1207.2000","Stefano Riverso","S. Riverso, G. Ferrari-Trecate","Hycon2 Benchmark: Power Network System",,,,,"cs.SY","http://arxiv.org/licenses/nonexclusive-distrib/1.0/","  As a benchmark exercise for testing software and methods developed in Hycon2
for decentralized and distributed control, we address the problem of designing
the Automatic Generation Control (AGC) layer in power network systems. In
particular, we present three different scenarios and discuss performance levels
that can be reached using Centralized Model Predictive Control (MPC). These
results can be used as a milestone for comparing the performance of alternative
control schemes. Matlab software for simulating the scenarios is also provided
in an accompanying file.
","[{""version"":""v1"",""created"":""Mon, 9 Jul 2012 10:28:04 GMT""}]","2012-07-10"
"1207.2001","Jakub Zakrzewski","Dominique Delande, Krzysztof Sacha, Marcin Plodzien, Sanat K.
  Avazbaev, Jakub Zakrzewski","Many-body Anderson localization in one dimensional systems","12pp, 5 fig, version accepted in NJP",,"10.1088/1367-2630/15/4/045021",,"quant-ph cond-mat.dis-nn cond-mat.quant-gas nlin.PS","http://arxiv.org/licenses/nonexclusive-distrib/1.0/","  We show, using quasi-exact numerical simulations, that Anderson localization
of one-dimensional particles in a disordered potential survives in the presence
of attractive interaction between particles. The localization length of the
composite particle can be computed analytically for weak disorder and is in
good agreement with the quasi-exact numerical observations using Time Evolving
Block Decimation. Our approach allows for simulation of the entire experiment
including the final measurement of all atom positions.
","[{""version"":""v1"",""created"":""Mon, 9 Jul 2012 10:30:23 GMT""},{""version"":""v2"",""created"":""Mon, 18 Mar 2013 10:04:35 GMT""}]","2015-06-05"
"1207.2002","Hui-gen Liu","J.-L. Zhou, J.-W. Xie, H.-G. Liu, H. Zhang, Y.-S. Sun","Forming Different Planetary Systems","27 pages, 2 figures, 1 table, published in ""Research in Astron.
  Astrophysics."" 2012, 12,1081",,"10.1088/1674-4527/12/8/010",,"astro-ph.EP","http://creativecommons.org/licenses/by/3.0/","  With the increasing number of detected exoplanet samples, the statistical
properties of planetary systems have become much clearer. In this review, we
summarize the major statistics that have been revealed mainly by radial
velocity and transiting observations, and try to interpret them within the
scope of the classical core-accretion scenario of planet formation, especially
in the formation of different orbital architectures for planetary systems
around main sequence stars. Based on the different possible formation routes
for different planet systems, we tentatively classify them into three major
catalogs: hot Jupiter systems, standard systems and distant giant planet
systems. The standard system can be further categorized into three sub-types
under different circumstances: solar-like systems, hot Super-Earth systems,
sub-giant planet systems. We also review the planet detection and formation in
binary systems as well as planets in star clusters.
","[{""version"":""v1"",""created"":""Mon, 9 Jul 2012 10:31:51 GMT""},{""version"":""v2"",""created"":""Wed, 11 Jul 2012 07:41:09 GMT""},{""version"":""v3"",""created"":""Sat, 4 Aug 2012 08:36:51 GMT""}]","2015-06-05"
"1207.2003","Bernard Nowakowski","B. Nowakowski","Long-time behavior of micropolar fluid equations in cylindrical domains",,,,,"math.AP","http://arxiv.org/licenses/nonexclusive-distrib/1.0/","  In this paper we investigate the existence of $H^1$-uniform attractor and
long-time behavior of solutions to non-autonomous micropolar fluid equations in
three dimensional cylindrical domains. In our considerations we take into
account that existence of global and strong solutions is proved under the
assumption on smallness of change of the initial and the external data along
the axis of the cylinder. Therefore, we refine the concept of uniform attractor
by adopting the idea which was proposed by J.W. Cholewa and T. D{\l}otko in
\cite{chol1}.
","[{""version"":""v1"",""created"":""Mon, 9 Jul 2012 10:42:30 GMT""}]","2012-07-10"
"1207.2004","Thomas Denis","T. Denis, B. Reijnders, J. H. H. Lee, P. J. M. van der Slot, W. L.
  Vos, and K.-J. Boller","Mapping individual electromagnetic field components inside a photonic
  crystal","12 pages, 7 figures","Optics Express, Vol. 20, Issue 20, pp. 22902-22913 (2012)","10.1364/OE.20.022902",,"physics.optics","http://arxiv.org/licenses/nonexclusive-distrib/1.0/","  We present a method to map the absolute electromagnetic field strength inside
photonic crystals. We apply the method to map the electric field component Ez
of a two-dimensional photonic crystal slab at microwave frequencies. The slab
is placed between two mirrors to select Bloch standing waves and a
subwavelength spherical scatterer is scanned inside the resulting resonator.
The resonant Bloch frequencies shift depending on the electric field at the
position of the scatterer. To map the electric field component Ez we measure
the frequency shift in the reflection and transmission spectrum of the slab
versus the scatterer position. Very good agreement is found between
measurements and calculations without any adjustable parameters.
","[{""version"":""v1"",""created"":""Mon, 9 Jul 2012 10:52:49 GMT""}]","2013-02-08"
"1207.2005","Maciej Zapior","Maciej Zapi\'or and Pawe{\l} Rudawy","Estimation of solar prominence magnetic fields based on the
  reconstructed 3D trajectories of prominence knots","14 pages, 12 figures, 1 table",,"10.1007/s11207-012-0072-z",,"astro-ph.SR","http://arxiv.org/licenses/nonexclusive-distrib/1.0/","  We present an estimation of the lower limits of local magnetic fields in
quiescent, activated, and active (surges) promineces, based on reconstructed
3-dimensional (3D) trajectories of individual prominence knots. The 3D
trajectories, velocities, tangential and centripetal accelerations of the knots
were reconstructed using observational data collected with a single
ground-based telescope equipped with a Multi-channel Subtractive Double Pass
imaging spectrograph. Lower limits of magnetic fields channeling observed
plasma flows were estimated under assumption of the equipartition principle.
Assuming approximate electron densities of the plasma n_e = 5*10^{11} cm^{-3}
in surges and n_e = 5*10^{10} cm^{-3} in quiescent/activated prominences, we
found that the magnetic fields channeling two observed surges range from 16 to
40 Gauss, while in quiescent and activated prominences they were less than 10
Gauss. Our results are consistent with previous detections of weak local
magnetic fields in the solar prominences.
","[{""version"":""v1"",""created"":""Mon, 9 Jul 2012 10:54:19 GMT""}]","2015-06-05"
"1207.2006","Simone Hamerla","Simone A. Hamerla and G\""otz S. Uhrig","One-dimensional fermionic systems after interaction quenches and their
  description by bosonic field theories","This is a distinctly revised version which is focussed on the
  description of the dynamics by bosonization techniques","New Journal of Physics 15 (2013) 073012","10.1088/1367-2630/15/7/073012",,"cond-mat.str-el cond-mat.quant-gas quant-ph","http://arxiv.org/licenses/nonexclusive-distrib/1.0/","  We show that the dynamics of quenches in one dimension far off equilibrium
can be described by power laws, but with exponents differing from the fully
renormalized ones at lowest energies. Instead they depend on the initial state
and its excitation energy. Furthermore, we found that for quenches to strong
interactions unexpected similarities between systems in one and in infinite
dimensions occur, indicating the dominance of local processes.
","[{""version"":""v1"",""created"":""Mon, 9 Jul 2012 11:19:11 GMT""},{""version"":""v2"",""created"":""Thu, 4 Jul 2013 11:23:31 GMT""}]","2013-07-05"
"1207.2007","Daryl Cooper","Daryl Cooper and William Goldman","A 3-Manifold with no Real Projective Structure","Minor corrections suggested by referee",,,,"math.GT math.DG","http://arxiv.org/licenses/nonexclusive-distrib/1.0/","  We show that the connected sum of two copies of real projective 3-space does
not admit a real projective structure. This is the first known example of a
connected 3-manifold without a real projective structure.
","[{""version"":""v1"",""created"":""Mon, 9 Jul 2012 11:23:28 GMT""},{""version"":""v2"",""created"":""Sun, 4 Jan 2015 16:25:38 GMT""}]","2015-01-06"
"1207.2008","Sergey Kitaev","Sergey Kitaev and Jeffrey Remmel","Quadrant marked mesh patterns in alternating permutations II",,,,,"math.CO","http://arxiv.org/licenses/nonexclusive-distrib/1.0/","  This paper is continuation of the systematic study of distribution of
quadrant marked mesh patterns initiated in ""S. Kitaev and J. Remmel, Quadrant
marked mesh patterns, J. Integer Sequences 12, Issue 4 (2012), Article
12.4.7."". We study quadrant marked mesh patterns on up-down and down-up
permutations.
","[{""version"":""v1"",""created"":""Mon, 9 Jul 2012 11:23:56 GMT""}]","2012-07-10"
"1207.2009","Josep Gonzalez Rovira","Josep Gonz\'alez","Equations of Bielliptic Modular Curves",,,,,"math.NT","http://arxiv.org/licenses/nonexclusive-distrib/1.0/","  We give a procedure to determine equations for the modular curves $X_0(N)$
which are bielliptic and equations for the 30 values of $N$ such that $X_0(N)$
is bielliptic and nonhyperelliptic are presented.
","[{""version"":""v1"",""created"":""Mon, 9 Jul 2012 11:24:44 GMT""}]","2012-07-10"
"1207.2010","Frank Riedel","Frederik Herzberg and Frank Riedel","Existence of Financial Equilibria in Continuous Time with Potentially
  Complete Markets",,,,,"q-fin.GN","http://arxiv.org/licenses/nonexclusive-distrib/1.0/","  We prove that in smooth Markovian continuous-time economies with potentially
complete asset markets, Radner equilibria with endogenously complete markets
exist.
","[{""version"":""v1"",""created"":""Mon, 9 Jul 2012 11:35:41 GMT""}]","2012-07-10"
"1207.2011","Imed Feki","Imed Feki","Estimates in the Hardy-Sobolev space of the annulus and stability result","14 pages. To be published in Czechoslovak Mathematical Journal",,,,"math.CA math.CV","http://arxiv.org/licenses/nonexclusive-distrib/1.0/","  The main purpose of this work is to establish some logarithmic estimates of
optimal type in the Hardy-Sobolev space $H^{k, \infty}; k \in {\mathbb{N}}^*$
of an annular domain. These results are considered as a continuation of a
previous study in the setting of the unit disk by L. Baratchart and M. Zerner:
On the recovery of functions from pointwise boundary values in a Hardy-sobolev
class of the disk. J.Comput.Apll.Math 46(1993), 255-69 and by S. Chaabane and
I. Feki: Logarithmic stability estimates in Hardy-Sobolev spaces
$H^{k,\infty}$. C.R. Acad. Sci. Paris, Ser. I 347(2009), 1001-1006.
  As an application, we prove a logarithmic stability result for the inverse
problem of identifying a Robin parameter on a part of the boundary of an
annular domain starting from its behavior on the complementary boundary part.
","[{""version"":""v1"",""created"":""Mon, 9 Jul 2012 11:36:55 GMT""}]","2012-07-10"
"1207.2012","Weihua Deng Professor","Minghua Chen, Weihua Deng, Yujiang Wu","Second order finite difference approximations for the two-dimensional
  time-space Caputo-Riesz fractional diffusion equation","27 pages","Applied Numerical Mathematics, 2013, 70 (2013) 22--41","10.1016/j.apnum.2013.03.006",,"math.NA","http://arxiv.org/licenses/nonexclusive-distrib/1.0/","  In this paper, we discuss the time-space Caputo-Riesz fractional diffusion
equation with variable coefficients on a finite domain. The finite difference
schemes for this equation are provided. We theoretically prove and numerically
verify that the implicit finite difference scheme is unconditionally stable
(the explicit scheme is conditionally stable with the stability condition
$\frac{\tau^{\gamma}}{(\Delta x)^{\alpha}}+\frac{\tau^{\gamma}}{(\Delta
y)^{\beta}} <C$) and 2nd order convergent in space direction, and
$(2-\gamma)$-th order convergent in time direction, where $\gamma \in(0,1]$.
","[{""version"":""v1"",""created"":""Mon, 9 Jul 2012 11:42:01 GMT""}]","2013-04-16"
"1207.2013","Fabio Bagarello","Fabio Bagarello","(Regular) pseudo-bosons versus bosons","arXiv admin note: substantial text overlap with arXiv:1106.0112","Journal of Physics A, 44, 015205 (2011)",,,"math-ph math.MP quant-ph","http://arxiv.org/licenses/nonexclusive-distrib/1.0/","  We discuss in which sense the so-called {\em regular pseudo-bosons}, recently
introduced by Trifonov and analyzed in some details by the author, are related
to ordinary bosons. We repeat the same analysis also for {\em pseudo-bosons},
and we analyze the role played by certain intertwining operators, which may be
bounded or not.
","[{""version"":""v1"",""created"":""Mon, 9 Jul 2012 11:54:08 GMT""}]","2012-07-10"
"1207.2014","Dagmar Henrich","D. Henrich, S. D\""orner, M. Hofherr, K. Il'in, A. Semenov, E. Heintze,
  M. Scheffler, M. Dressel, and M. Siegel","Broadening of hot-spot response spectrum of superconducting NbN nanowire
  single-photon detector with reduced nitrogen content","15 pages, 6 figures","Journal of Applied Physics, AIP, 2012, 112, 074511","10.1063/1.4757625",,"cond-mat.supr-con physics.ins-det","http://arxiv.org/licenses/nonexclusive-distrib/1.0/","  The spectral detection efficiency and the dark count rate of superconducting
nanowire single-photon detectors (SNSPD) has been studied systematically on
detectors made from thin NbN films with different chemical compositions.
Reduction of the nitrogen content in the 4 nm thick NbN films results in a more
than two orders of magnitude decrease of the dark count rates and in a red
shift of the cut-off wavelength of the hot-spot SNSPD response. The observed
phenomena are explained by an improvement of uniformity of NbN films that has
been confirmed by a decrease of resistivity and an increase of the ratio of the
measured critical current to the depairing current. The latter factor is
considered as the most crucial for both the cut-off wavelength and the dark
count rates of SNSPD. Based on our results we propose a set of criteria for
material properties to optimize SNSPD in the infrared spectral region.
","[{""version"":""v1"",""created"":""Mon, 9 Jul 2012 11:56:04 GMT""}]","2015-06-05"
"1207.2015","Fabio Bagarello Dr.","Fabio Bagarello, Maria Fragoulopoulou, Atsushi Inoue, Camillo TRapani","Locally convex quasi $C^*$-normed algebras",,"Journal of Mathematical Analysis and Applications, 366, 593-606,
  2010",,,"math-ph math.MP math.OA","http://arxiv.org/licenses/nonexclusive-distrib/1.0/","  If $\ca_0[|\cdot|_0]$ is a $\cs$-normed algebra and $\tau$ a locally convex
topology on $\ca_0$ making its multiplication separately continuous, then
$\widetilde{\ca_0}[\tau]$ (completion of $\ca_0[\tau]$) is a locally convex
quasi *-algebra over $\ca_0$, but it is not necessarily a locally convex quasi
*-algebra over the $\cs$-algebra $\widetilde{\ca_0}[|\cdot|_0]$ (completion of
$\ca_0[|\cdot|_0]$). In this article, stimulated by physical examples, we
introduce the notion of a locally convex quasi $\cs$-normed algebra, aiming at
the investigation of $\widetilde{\ca_0}[\tau]$; in particular, we study its
structure, *-representation theory and functional calculus.
","[{""version"":""v1"",""created"":""Mon, 9 Jul 2012 11:59:27 GMT""}]","2012-07-10"
"1207.2016","Helge Kragh","Helge Kragh","A Sense of Crisis: Physics in the fin-de-siecle Era","31 pages. Contribution to Michael Saler, ed., The Fin-de-Siecle
  World, to be published by Routledge in 2014",,,,"physics.hist-ph","http://arxiv.org/licenses/nonexclusive-distrib/1.0/","  Whereas physics in the period from about 1880 to 1910 experienced a steady
growth, it was also a revolutionary period in which the foundations of the
physical world picture were criticized and reconsidered. Generally speaking,
from about 1890 mechanics and materialism came under increasing attack and
sought replaced by new formulations based on either energy, the ether, or the
electromagnetic field. Fin-de-siecle physics was in many ways a chapter of
turmoil in the history of science. I review the main developments and
alternatives to the established physics, in particular energetics, ether
physics, the electromagnetic world view, and also the role played by
radioactivity and other new rays discovered in the years around 1900. In the
end the anticipated revolution based on the ""matter is dead"" catchword did not
succeed. A revolution did take place in the period, but it was a different one
that did not derive from the Zeitgeist of fin de siecle.
","[{""version"":""v1"",""created"":""Mon, 9 Jul 2012 12:03:13 GMT""}]","2012-07-10"
"1207.2017","Joachim Breitner","Joachim Breitner","dup -- Explicit un-sharing in Haskell","9 pages, 9 figures",,,,"cs.PL","http://arxiv.org/licenses/nonexclusive-distrib/1.0/","  We propose two operations to prevent sharing in Haskell that do not require
modifying the data generating code, demonstrate their use and usefulness, and
compare them to other approaches to preventing sharing. Our claims are
supported by a formal semantics and a prototype implementation.
","[{""version"":""v1"",""created"":""Mon, 9 Jul 2012 12:05:25 GMT""}]","2012-07-10"
"1207.2018","Alexey Mazur K","Alexey K. Mazur","The torque transfer coefficient in DNA under torsional stress","5 pages, 4 figures. To appear in Phys. Rev. E",,"10.1103/PhysRevE.86.011914",,"q-bio.BM cond-mat.soft","http://arxiv.org/licenses/nonexclusive-distrib/1.0/","  In recent years, significant progress in understanding the properties of
supercoiled DNA has been obtained due to nanotechniques that made stretching
and twisting of single molecules possible. Quantitative interpretation of such
experiments requires accurate knowledge of torques inside manipulated DNA. This
paper argues that it is not possible to transfer the entire magnitudes of
external torques to the twisting stress of the double helix, and that a
reducing torque transfer coefficient (TTC<1) should always be assumed. This
assertion agrees with simple physical intuition and is supported by the results
of all-atom molecular dynamics (MD) simulations. According to MD, the TTCs
around 0.8 are observed in nearly optimal conditions. Reaching higher values
requires special efforts and it should be difficult in practice. The TTC can be
partially responsible for the persistent discrepancies between the twisting
rigidity of DNA measured by different methods.
","[{""version"":""v1"",""created"":""Mon, 9 Jul 2012 12:06:28 GMT""}]","2015-06-05"
"1207.2019","Fabio Bagarello Dr.","Fabio Bagarello, Atsushi Inoue, Camillo Trapani","Representable linear functionals on partial *-algebras",,"Mediterranean Journal of Mathematics, 9, 1, 153-163, 2012",,,"math-ph math.MP math.OA","http://arxiv.org/licenses/nonexclusive-distrib/1.0/","  A GNS - like *-representation of a \pa\ $\A$ defined by certain representable
linear functionals on $\A$ is constructed. The study of the interplay with the
GNS construction associated with invariant positive sesquilinear forms (ips)
leads to the notions of pre-core and of singular form. It is shown that a
positive sesquilinear form with pre-core always decomposes into the sum of an
ips form and a singular one.
","[{""version"":""v1"",""created"":""Mon, 9 Jul 2012 12:10:04 GMT""}]","2012-07-10"
"1207.2020","Valentyna Sheminova","V. A. Sheminova","The wings of Ca II H and K as photospheric diagnostics and the
  reliability of one-dimensional photosphere modeling","22 pages, 16 figures, Accepted for publication in Solar Physics",,"10.1007/s11207-012-0066-x",,"astro-ph.SR","http://arxiv.org/licenses/nonexclusive-distrib/1.0/","  The extended wings of the Ca II H and K lines provide excellent diagnostics
of the temperature stratification of the photosphere of the Sun and of other
cool stars, thanks to their LTE opacities and source functions and their large
span in formation height. The aim of this study is to calibrate the usage of
the H and K wings in one-dimensional interpretation of spatially averaged
spectra and in deriving per-pixel stratifications from resolved spectra. I use
multi-dimensional simulations of solar convection to synthesize the H and K
wings, derive one-dimensional models from these wings as if they were observed,
and compare the resulting models to the actual simulation input. I find that
spatially-averaged models constructed from the synthesized wings generally
match the simulation averages well, except for the deepest layers of the
photosphere where large thermal inhomogeneities and Planck-function
nonlinearity gives large errors. The larger the inhomogeneity, the larger the
latter. The presence of strong network fields increases such inhomogeneity. For
quiet photospheric conditions the temperature excesses reach about 200 K.
One-dimensional stratification fits of discrete structures such as granulation
and small-scale magnetic concentrations give satisfactory results with errors
that are primarily due to steep temperature gradients and abrupt changes of
temperature with depth. I conclude that stratification modeling using the H and
K wings is a useful technique for the interpretation of solar high-resolution
observations.
","[{""version"":""v1"",""created"":""Mon, 9 Jul 2012 12:13:15 GMT""}]","2015-06-05"
"1207.2021","Fabio Bagarello Dr.","Fabio Bagarello, Atsushi Inoue, Camillo Trapani","Induced and reduced unbounded operator algebras",,"Annali di Matematica pura ed applicata, 191, 2, 285-292, 2012",,,"math-ph math.MP math.OA","http://arxiv.org/licenses/nonexclusive-distrib/1.0/","  The induction and reduction precesses of an O*-vector space $\M$ obtained by
means of a projection taken, respectively, in $\M$ itself or in its weak
bounded commutant $\M'_\w$ are studied. In the case where $\M$ is a partial
GW*-algebra, sufficient conditions are given for the induced and the reduced
spaces to be partial GW*-algebras again.
","[{""version"":""v1"",""created"":""Mon, 9 Jul 2012 12:15:52 GMT""}]","2012-07-10"
