"1207.1940","Paul Steinhardt","Itzhak Bars, Shih-Hung Chen, Paul J. Steinhardt, and Neil Turok","Complete Set of Homogeneous Isotropic Analytic Solutions in
  Scalar-Tensor Cosmology with Radiation and Curvature","38 pages, 29 figures",,"10.1103/PhysRevD.86.083542",,"hep-th astro-ph.CO gr-qc","http://arxiv.org/licenses/nonexclusive-distrib/1.0/","  We study a model of a scalar field minimally coupled to gravity, with a
specific potential energy for the scalar field, and include curvature and
radiation as two additional parameters. Our goal is to obtain analytically the
complete set of configurations of a homogeneous and isotropic universe as a
function of time. This leads to a geodesically complete description of the
universe, including the passage through the cosmological singularities, at the
classical level. We give all the solutions analytically without any
restrictions on the parameter space of the model or initial values of the
fields. We find that for generic solutions the universe goes through a singular
(zero-size) bounce by entering a period of antigravity at each big crunch and
exiting from it at the following big bang. This happens cyclically again and
again without violating the null energy condition. There is a special subset of
geodesically complete non-generic solutions which perform zero-size bounces
without ever entering the antigravity regime in all cycles. For these, initial
values of the fields are synchronized and quantized but the parameters of the
model are not restricted. There is also a subset of spatial curvature-induced
solutions that have finite-size bounces in the gravity regime and never enter
the antigravity phase. These exist only within a small continuous domain of
parameter space without fine tuning initial conditions. To obtain these
results, we identified 25 regions of a 6-parameter space in which the complete
set of analytic solutions are explicitly obtained.
","[{""version"":""v1"",""created"":""Mon, 9 Jul 2012 04:16:01 GMT""}]","2013-05-30"
"1207.1941","Soumyajit Roy","Soumyajit Roy","`Soft-Oxo-Metalates' (SOMs): A Very Short Introduction","17 pages, 2 figures, A review article","Comments on Inorganic Chemistry, Vol. 32, Pages 113 - 126 (2012)","10.1080/02603594.2011.608443",,"cond-mat.soft","http://arxiv.org/licenses/nonexclusive-distrib/1.0/","  The field of polyoxometalates (POMs), in recent times, has entered a new
arena of 'soft'-supramolecular interactions, crossing the molecular regime of
covalent bonds. The structures resulting from such 'soft'-supramolecular
interactions are much larger (~10-500 nm in diameter) showing soft-matter
properties. This comment proposes to name them 'Soft' Oxometalates. The comment
after introducing and archiving seminal examples of Soft Oxometalates, gives
few examples from the author's work where Soft Oxometalates are generated
spontaneously and those designed by deliberate chemical reactions (also
followed by very few selected examples from the literature). The comment ends
with an open question: are all POMs soft?
","[{""version"":""v1"",""created"":""Mon, 9 Jul 2012 04:17:15 GMT""}]","2012-07-10"
"1207.1942","Shijun Yoshida","Shijun Yoshida, Kenta Kiuchi, Masaru Shibata","Stably stratified magnetized stars in general relativity","18 pages, 5 figures, accepted for publication in Physical Review D",,"10.1103/PhysRevD.86.044012",,"gr-qc astro-ph.HE","http://arxiv.org/licenses/nonexclusive-distrib/1.0/","  We construct magnetized stars composed of a fluid stably stratified by
entropy gradients in the framework of general relativity, assuming ideal
magnetohydrodynamics and employing a barotropic equation of state. We first
revisit basic equations for describing stably-stratified stationary
axisymmetric stars containing both poloidal and toroidal magnetic fields. As
sample models, the magnetized stars considered by Ioka and Sasaki (2004),
inside which the magnetic fields are confined, are modified to the ones stably
stratified. The magnetized stars newly constructed in this study are believed
to be more stable than the existing relativistic models because they have both
poloidal and toroidal magnetic fields with comparable strength, and magnetic
buoyancy instabilities near the surface of the star, which can be stabilized by
the stratification, are suppressed.
","[{""version"":""v1"",""created"":""Mon, 9 Jul 2012 04:17:25 GMT""}]","2015-06-05"
"1207.1943","Archana Pai","Archana Pai and K. G. Arun","Singular value decomposition in parametrised tests of post-Newtonian
  theory","17 pages, 6 figures, Accepted for publication in Classical and
  Quantum Gravity (Matches with the published version)","Class.Quant.Grav. 30 (2013) 025011","10.1088/0264-9381/30/2/025011","LIGO Document P1200075","gr-qc","http://arxiv.org/licenses/nonexclusive-distrib/1.0/","  Various coefficients of the 3.5 post-Newtonian (PN) phasing formula of
non-spinning compact binaries moving in circular orbits is fully characterized
by the two component masses. If two of these coefficients are independently
measured, the masses can be estimated. Future gravitational wave observations
could measure many of the 8 independent PN coefficients calculated to date.
These additional measurements can be used to test the PN predictions of the
underlying theory of gravity. Since all of these parameters are functions of
the two component masses, there is strong correlation between the parameters
when treated independently. Using Singular Value Decomposition of the Fisher
information matrix, we remove this correlations and obtain a new set of
parameters which are linear combinations of the original phasing coefficients.
We show that the new set of parameters can be estimated with significantly
improved accuracies which has implications for the ongoing efforts to implement
parametrised tests of PN theory in the data analysis pipelines.
","[{""version"":""v1"",""created"":""Mon, 9 Jul 2012 04:25:17 GMT""},{""version"":""v2"",""created"":""Tue, 16 Apr 2013 11:43:16 GMT""}]","2015-06-05"
"1207.1944","Xiaoling Zhang","Xiaoling Zhang and Yi-Bing Shen","On Einstein Kropina metrics",,,,,"math.DG","http://arxiv.org/licenses/nonexclusive-distrib/1.0/","  In this paper, a characteristic condition of Einstein Kropina metrics is
given. By the characteristic condition, we prove that a non-Riemannian Kropina
metric $F=\frac{\alpha^2}{\beta}$ with constant Killing form $\beta$ on an
n-dimensional manifold $M$, $n\geq 2$, is an Einstein metric if and only if
$\alpha$ is also an Einstein metric. By using the navigation data $(h,W)$, it
is proved that an n-dimensional ($n\geq2$) Kropina metric
$F=\frac{\alpha^2}{\beta}$ is Einstein if and only if the Riemannian metric $h$
is Einstein and $W$ is a unit Killing vector field with respect to $h$.
Moreover, we show that every Einstein Kropina metric must have vanishing
S-curvature, and any conformal map between Einstein Kropina metrics must be
homothetic.
","[{""version"":""v1"",""created"":""Mon, 9 Jul 2012 04:35:23 GMT""}]","2012-07-10"
"1207.1945","Yogesh N. Joglekar","Derek D. Scott and Yogesh N. Joglekar","PT-symmetry breaking and maximal chirality in a nonuniform PT-symmetric
  ring","11 pages, 5 figures, preprint","J. Phys. A: Math. Theor. 45, 444030 (2012)","10.1088/1751-8113/45/44/444030",,"quant-ph physics.optics","http://arxiv.org/licenses/nonexclusive-distrib/1.0/","  We study the properties of an N-site tight-binding ring with parity and
time-reversal (PT) symmetric, Hermitian, site-dependent tunneling and a pair of
non-Hermitian, PT-symmetric, loss and gain impurities $\pm i\gamma$. The
properties of such lattices with open boundary conditions have been intensely
explored over the past two years. We numerically investigate the PT-symmetric
phase in a ring with a position-dependent tunneling function
$t_\alpha(k)=[k(N-k)]^{\alpha/2}$ that, in an open lattice, leads to a
strengthened PT-symmetric phase, and study the evolution of the PT-symmetric
phase from the open chain to a ring. We show that, generally, periodic boundary
conditions weaken the PT-symmetric phase, although for experimentally relevant
lattice sizes $N \sim 50$, it remains easily accessible. We show that the
chirality, quantified by the (magnitude of the) average transverse momentum of
a wave packet, shows a maximum at the PT-symmetric threshold. Our results show
that although the wavepacket intensity increases monotonically across the
PT-breaking threshold, the average momentum decays monotonically on both sides
of the threshold.
","[{""version"":""v1"",""created"":""Mon, 9 Jul 2012 04:38:21 GMT""}]","2012-10-24"
"1207.1946","Brian Pepper","Brian Pepper, Evan Jeffrey, Roohollah Ghobadi, Christoph Simon, Dirk
  Bouwmeester","Macroscopic superpositions via nested interferometry: finite temperature
  and decoherence considerations","12 pages, 2 figures","New J. Phys. 14, 115025 (2012)","10.1088/1367-2630/14/11/115025",,"quant-ph","http://arxiv.org/licenses/nonexclusive-distrib/1.0/","  Recently there has been much interest in optomechanical devices for the
production of macroscopic quantum states. Here we focus on a proposed scheme
for achieving macroscopic superpositions via nested interferometry. We consider
the effects of finite temperature on the superposition produced. We also
investigate in detail the scheme's feasibility for probing various novel
decoherence mechanisms.
","[{""version"":""v1"",""created"":""Mon, 9 Jul 2012 04:40:35 GMT""}]","2012-12-20"
"1207.1947","Anil Kumar Karn","Anil Kumar Karn and Deba Prasad Sinha","Compactness and an approximation property related to an operator ideal","23 pages",,,,"math.FA","http://arxiv.org/licenses/nonexclusive-distrib/1.0/","  For an operator ideal $\mathcal A$, we study the composition operator ideals
${\mathcal A}\circ{\mathcal K}$, ${\mathcal K}\circ{\mathcal A}$ and ${\mathcal
K}\circ{\mathcal A}\circ{\mathcal K}$, where $\mathcal K$ is the ideal of
compact operators. We introduce a notion of an $\mathcal A$-approximation
property on a Banach space and characterise it in terms of the density of
finite rank operators in ${\mathcal A}\circ{\mathcal K}$ and ${\mathcal
K}\circ{\mathcal A}$.
  We propose the notions of $\ell_{\infty}$-extension and $\ell_{1}$-lifting
properties for an operator ideal $\mathcal A$ and study ${\mathcal
A}\circ{\mathcal K}$, ${\mathcal}\circ{\mathcal A}$ and the $\mathcal
A$-approximation property where $\mathcal A$ is injective or surjective and/or
with the $\ell_{\infty}$-extension or $\ell_{1}$-lifting property. In
particular, we show that if $\mathcal A$ is an injective operator ideal with
the $\ell_\infty$-extension property, then we have: (a) $X$ has the $\mathcal
A$-approximation property if and only if $({\mathcal
A}^{min})^{inj}(Y,X)={\mathcal A}^{min}(Y,X)$, for all Banach spaces $Y$. (b)
The dual space $X^*$ has the $\mathcal A$-approximation property if and only if
$(({\mathcal A}^{dual})^{min})^{sur}(X,Y)=({\mathcal A}^{dual})^{min}(X,Y)$,
for all Banach spaces $Y$.}For an operator ideal $\mathcal A$, we study the
composition operator ideals ${\mathcal A}\circ{\mathcal K}$,
","[{""version"":""v1"",""created"":""Mon, 9 Jul 2012 04:48:48 GMT""}]","2012-07-10"
"1207.1948","L. Andrew Wray","L. Andrew Wray, Wanli Yang, Hiroshi Eisaki, Zahid Hussain, and Yi-De
  Chuang","Multiplet resonance lifetimes in resonant inelastic X-ray scattering
  involving shallow core levels","6 pages, 3 figures",,"10.1103/PhysRevB.86.195130",,"cond-mat.str-el cond-mat.mtrl-sci","http://arxiv.org/licenses/nonexclusive-distrib/1.0/","  Resonant inelastic X-ray scattering (RIXS) spectra of model copper- and
nickel-based transition metal oxides are measured over a wide range of energies
near the M-edge (h$\nu$=60-80eV) to better understand the properties of
resonant scattering involving shallow core levels. Standard multiplet RIXS
calculations are found to deviate significantly from the observed spectra.
However, by incorporating the self consistently calculated decay lifetime for
each intermediate resonance state within a given resonance edge, we obtain
dramatically improved agreement between data and theory. Our results suggest
that these textured lifetime corrections can enable a quantitative
correspondence between first principles predictions and RIXS data on model
multiplet systems. This accurate model is also used to analyze resonant elastic
scattering, which displays the elastic Fano effect and provides a rough upper
bound for the core hole shake-up response time.
","[{""version"":""v1"",""created"":""Mon, 9 Jul 2012 05:22:35 GMT""},{""version"":""v2"",""created"":""Mon, 19 Nov 2012 18:22:03 GMT""}]","2012-11-20"
"1207.1949","Delfim F. M. Torres","Helena Sofia Rodrigues, M. Teresa T. Monteiro, Delfim F. M. Torres","Modeling and Optimal Control Applied to a Vector Borne Disease",,"Proc. 12th Int. Conf. Comp. Math. Meth. Sci. Eng. (CMMSE'2012),
  Murcia 02-05 July 2012 (Ed: J. Vigo-Aguiar), Vol. III (2012), 1063--1070",,,"math.OC q-bio.PE","http://arxiv.org/licenses/nonexclusive-distrib/1.0/","  A model with six mutually-exclusive compartments related to Dengue disease is
presented. In this model there are three vector control tools: insecticides
(larvicide and adulticide) and mechanical control. The problem is studied using
an Optimal Control (OC) approach. The human data for the model is based on the
Cape Verde Dengue outbreak. Some control measures are simulated and their
consequences analyzed.
","[{""version"":""v1"",""created"":""Mon, 9 Jul 2012 05:36:36 GMT""}]","2012-07-10"
"1207.1950","Warren Reid Dr","Warren A. Reid, Quentin A. Parker","Emission-line stars discovered in the UKST H-alpha survey of the Large
  Magellanic Cloud; Part 1: Hot stars","24 pages (main paper) 36 figures, 6 tables; Appendix Tables: 22
  pages, MNRAS, 2012",,"10.1111/j.1365-2966.2012.21471.x",,"astro-ph.SR","http://arxiv.org/licenses/nonexclusive-distrib/1.0/","  We present new, accurate positions, spectral classifications, radial and
rotational velocities, H-alpha fluxes, equivalent widths and B,V,I,R magnitudes
for 579 hot emission-line stars (classes B0 - F9) in the Large Magellanic Cloud
which include 469 new discoveries. Candidate emission line stars were
discovered using a deep, high resolution H-alpha map of the central 25 deg2 of
the LMC obtained by median stacking a dozen 2 hour H-alpha exposures taken with
the UK Schmidt Telescope. Spectroscopic follow-up observations on the AAT,
UKST, VLT, the SAAO 1.9m and the MSSSO 2.3m telescope have established the
identity of these faint sources down to magnitude R~23 for H-alpha (4.5 x
10^-17 ergs cm^2 s^-1 Ang). Confirmed emission-line stars have been assigned an
underlying spectral classification through cross-correlation against 131
absorption line template spectra covering the range O1 to F8. We confirm 111
previously identified emission line stars and 64 previously known variable
stars with spectral types hotter than F8. The majority of hot stars identified
(518 stars or 89%) are class B. Of all the hot emission-line stars in classes
B-F, 130 or 22% are type B[e], characterised by the presence of forbidden
emission lines such as [SII], [NII] and [OII]. We report on the physical
location of these stars with reference to possible contamination from ambient
HII emission. Along with flux calibration of the H-alpha emission we provide
the first H-alpha luminosity function for selected sub-samples after correction
for any possible nebula or ambient contamination. We find a moderate
correlation between the intensity of H-alpha emission and the V magnitude of
the central star based on SuperCOSMOS magnitudes and OGLE-II photometry where
possible. Cool stars from classes G-S, with and without strong H-alpha
emission, will be the focus of part 2 in this series.
","[{""version"":""v1"",""created"":""Mon, 9 Jul 2012 05:41:33 GMT""},{""version"":""v2"",""created"":""Thu, 12 Jul 2012 05:16:20 GMT""}]","2015-06-05"
"1207.1951","Michael Roizner","Michael Roizner","Elementary equivalence of the automorphism groups of reduced Abelian
  p-groups",,,,,"math.GR math.LO","http://arxiv.org/licenses/nonexclusive-distrib/1.0/","  Consider unbounded reduced Abelian p-groups (p > 2) A and A'. In this paper,
we prove that if the automorphism groups Aut A and Aut A' are elementary
equivalent then the groups A and A' are equivalent in the second order logic
bounded by the final rank of the basic subgroups of A and A'.
","[{""version"":""v1"",""created"":""Mon, 9 Jul 2012 05:45:26 GMT""}]","2012-07-10"
"1207.1952","Kavan Modi","Akihito Soeda, Pawel Kurzynski, Ravishankar Ramanathan, Kavan Modi,
  Dagomir Kaszlikowski","The relation between nonlocality and contextuality for a biphoton","Close to the published version","Phys. Rev. A 87, 022120 (2013)","10.1103/PhysRevA.87.022120",,"quant-ph","http://arxiv.org/licenses/nonexclusive-distrib/1.0/","  We investigate the set of qutrit states in terms of symmetric states of two
qubits that violate the minimal contextual inequality, namely the
Klyachko-Can-Binicoglu-Shumovsky (KCBS) inequality. The physical system that
provides a natural framework for this problem is a biphoton which consists of
two photons in the same spatio-temporal mode and whose effective polarization
behaves as a three-level quantum system. The relationship between the KCBS
contextual inequality and the Clauser-Horne-Shimony-Holt (CHSH) inequality is
investigated. We find that every biphotonic state that is contextual with
respect to KCBS is nonlocal as per the CHSH test when the two photons are
apart, but the converse is not true.
","[{""version"":""v1"",""created"":""Mon, 9 Jul 2012 05:57:11 GMT""},{""version"":""v2"",""created"":""Thu, 1 Nov 2012 05:04:37 GMT""},{""version"":""v3"",""created"":""Tue, 26 Feb 2013 14:34:37 GMT""}]","2013-02-27"
"1207.1953","Valentin Zagrebnov","Hiroshi Tamura, Valentin A. Zagrebnov (CPT)","Random point field approach to analysis of anisotropic Bose-Einstein
  condensations",,,,,"math-ph math.MP","http://arxiv.org/licenses/nonexclusive-distrib/1.0/","  Position distributions of constituent particles of the perfect Bose-gas
trapped in exponentially and polynomially anisotropic boxes are investigated by
means of the boson random point fields (processes) and by the spatial random
distribution of particle density. Our results include the case of
\textit{generalised} Bose-Einstein Condensation. For exponentially anisotropic
quasi two-dimensional system (SLAB), we obtain \textit{three} qualitatively
different particle density distributions. They correspond to the
\textit{normal} phase, the quasi-condensate phase (type III generalised
condensation) and to the phase when the type III and the type I Bose
condensations co-exist. An interesting feature is manifested by the type II
generalised condensation in one-directional polynomially anisotropic system
(BEAM). In this case the particle density distribution rests truly random even
in the \textit{macroscopic} scaling limit.
","[{""version"":""v1"",""created"":""Mon, 9 Jul 2012 06:13:42 GMT""}]","2012-07-10"
"1207.1954","Delphine Moussard","Delphine Moussard (IF)","Rational Blanchfield forms, S-equivalence, and null LP-surgeries",,"Bulletin de la Soci\'et\'e Math\'ematique de France vol.143 (2),
  p.403-431 (2015)",,,"math.AT math.GT","http://arxiv.org/licenses/nonexclusive-distrib/1.0/","  Null Lagrangian-preserving surgeries are a generalization of the Garoufalidis
and Rozansky null-moves, that these authors introduced to study the Kricker
lift of the Kontsevich integral, in the setting of pairs (M,K) composed of a
rational homology sphere M and a null-homologous knot K in M. They are defined
as replacements of null-homologous rational homology handlebodies of M\K by
other such handlebodies with identical Lagrangian. A null Lagrangian-preserving
surgery induces a canonical isomorphism between the rational Alexander modules
of the involved pairs, which preserves the Blanchfield form. Conversely, we
prove that a fixed isomorphism between rational Alexander modules which
preserves the Blanchfield form can be realized, up to multiplication by a power
of t, by a finite sequence of null Lagrangian-preserving surgeries. We also
prove that such classes of isomorphisms can be realized by rational
S-equivalences. In the case of integral homology spheres, we prove similar
realization results for a fixed isomorphism between integral Alexander modules.
","[{""version"":""v1"",""created"":""Mon, 9 Jul 2012 06:14:56 GMT""},{""version"":""v2"",""created"":""Tue, 26 Mar 2013 19:34:06 GMT""}]","2017-11-29"
"1207.1955","Frederic Le Roux","Fr\'ed\'eric Le Roux (IMJ)","On closed subgroups of the group of homeomorphisms of a manifold",,,,,"math.DS","http://arxiv.org/licenses/nonexclusive-distrib/1.0/","  Let $M$ be a triangulable compact manifold. We prove that, among closed
subgroups of $\homeo_{0}(M)$ (the identity component of the group of
homeomorphisms of $M$), the subgroup consisting of volume preserving elements
is maximal.
","[{""version"":""v1"",""created"":""Mon, 9 Jul 2012 06:15:27 GMT""}]","2012-07-10"
"1207.1956","Stephanie Deboeuf","Stephanie Deboeuf, Eytan Katzav, Arezki Boudaoud (RDP), Daniel Bonn
  (Van Der WAALS-ZEEMAN Institute), Mokhtar Adda-Bedia (LPS)","A comparative study of crumpling and folding of thin sheets","5 pages",,"10.1103/PhysRevLett.110.104301",,"cond-mat.soft cond-mat.mtrl-sci cond-mat.stat-mech","http://arxiv.org/licenses/nonexclusive-distrib/1.0/","  Crumpling and folding of paper are at rst sight very di erent ways of con
ning thin sheets in a small volume: the former one is random and stochastic
whereas the latest one is regular and deterministic. Nevertheless, certain
similarities exist. Crumpling is surprisingly ine cient: a typical crumpled
paper ball in a waste-bin consists of as much as 80% air. Similarly, if one
folds a sheet of paper repeatedly in two, the necessary force becomes so large
that it is impossible to fold it more than 6 or 7 times. Here we show that the
sti ness that builds up in the two processes is of the same nature, and
therefore simple folding models allow to capture also the main features of
crumpling. An original geometrical approach shows that crumpling is
hierarchical, just as the repeated folding. For both processes the number of
layers increases with the degree of compaction. We nd that for both processes
the crumpling force increases as a power law with the number of folded layers,
and that the dimensionality of the compaction process (crumpling or folding)
controls the exponent of the scaling law between the force and the compaction
ratio.
","[{""version"":""v1"",""created"":""Mon, 9 Jul 2012 06:16:46 GMT""},{""version"":""v2"",""created"":""Thu, 4 Oct 2012 19:10:02 GMT""},{""version"":""v3"",""created"":""Tue, 5 Feb 2013 19:52:47 GMT""}]","2015-06-05"
"1207.1957","Thierry Rabilloud","Sophie Richert (IPHC), Sylvie Luche (BECP), Mireille Chevallet (BECP),
  Alain Van Dorsselaer (IPHC), Emmanuelle Leize-Wagner (IPHC), Thierry
  Rabilloud (BECP, LCBM)","About the mechanism of interference of silver staining with peptide mass
  spectrometry",,"PROTEOMICS 4, 4 (2004) 909-16","10.1002/pmic.200300642",,"q-bio.GN","http://arxiv.org/licenses/nonexclusive-distrib/1.0/","  The mechanism by which silver staining of proteins in polyacrylamide gels
interferes with mass spectrometry of peptides produced by proteolysis has been
investigated. It was demonstrated that this interference increases with time
between silver staining and gel processing, although the silver image is
constant. This suggested an important role of the formaldehyde used in silver
staining development in this interference process. Consequently, a
formaldehyde-free staining protocol has been devised, using carbohydrazide as
the developing agent. This protocol showed much increased peptide coverage and
retained the sensitivity of silver staining. These results were however
obtained at the expense of an increased background in the stained gels and of a
reduced staining homogeneity.
","[{""version"":""v1"",""created"":""Mon, 9 Jul 2012 06:18:53 GMT""}]","2012-07-10"
"1207.1958","Marco Caponigro","Nabile Boussaid (LM-Besan\c{c}on), Marco Caponigro (CCIB), Thomas
  Chambrion (INRIA Lorraine / IECN / MMAS, IECN)","Small time reachable set of bilinear quantum systems",,,"10.1109/CDC.2012.6426208",,"math.OC","http://arxiv.org/licenses/nonexclusive-distrib/1.0/","  This note presents an example of bilinear conservative system in an infinite
dimensional Hilbert space for which approximate controllability in the Hilbert
unit sphere holds for arbitrary small times. This situation is in contrast with
the finite dimensional case and is due to the unboundedness of the drift
operator.
","[{""version"":""v1"",""created"":""Mon, 9 Jul 2012 06:30:37 GMT""}]","2013-02-14"
"1207.1959","Andre Leroy","Adel Alahmadi, S. K. Jain, Andr\'e Leroy (LML)","ADS modules","7 pages","Journal of Algebra 352, 1 (2012) 215-222",,,"math.RA","http://arxiv.org/licenses/nonexclusive-distrib/1.0/","  We study the class of ADS rings and modules introduced by Fuchs. We give some
connections between this notion and classical notions such as injectivity and
quasi-continuity. A simple ring R such that R is ADS as a right R-module must
be either right self-injective or indecomposable as a right R-module. Under
certain conditions we can construct a unique ADS hull up to isomorphism. We
introduce the concept of completely ADS modules and characterize completely ADS
semiperfect right modules as direct sum of semisimple and local modules.
","[{""version"":""v1"",""created"":""Mon, 9 Jul 2012 06:33:18 GMT""}]","2012-07-10"
