"1207.2929","M. Cristina Marchetti","M. C. Marchetti, J.-F. Joanny, S. Ramaswamy, T. B. Liverpool, J.
  Prost, Madan Rao and R. Aditi Simha","Soft Active Matter","50 pages, 33 figures",,,,"cond-mat.soft q-bio.OT","http://arxiv.org/licenses/nonexclusive-distrib/1.0/","  In this review we summarize theoretical progress in the field of active
matter, placing it in the context of recent experiments. Our approach offers a
unified framework for the mechanical and statistical properties of living
matter: biofilaments and molecular motors in vitro or in vivo, collections of
motile microorganisms, animal flocks, and chemical or mechanical imitations. A
major goal of the review is to integrate the several approaches proposed in the
literature, from semi-microscopic to phenomenological. In particular, we first
consider ""dry"" systems, defined as those where momentum is not conserved due to
friction with a substrate or an embedding porous medium, and clarify the
differences and similarities between two types of orientationally ordered
states, the nematic and the polar. We then consider the active hydrodynamics of
a suspension, and relate as well as contrast it with the dry case. We further
highlight various large-scale instabilities of these nonequilibrium states of
matter. We discuss and connect various semi-microscopic derivations of the
continuum theory, highlighting the unifying and generic nature of the continuum
model. Throughout the review, we discuss the experimental relevance of these
theories for describing bacterial swarms and suspensions, the cytoskeleton of
living cells, and vibrated granular materials. We suggest promising extensions
towards greater realism in specific contexts from cell biology to ethology, and
remark on some exotic active-matter analogues. Lastly, we summarize the outlook
for a quantitative understanding of active matter, through the interplay of
detailed theory with controlled experiments on simplified systems, with living
or artificial constituents.
","[{""version"":""v1"",""created"":""Thu, 12 Jul 2012 11:38:28 GMT""}]","2012-07-13"
"1207.2930","Claudio Coriano","Claudio Coriano, Luigi Delle Rose, Carlo Marzo, Mirko Serino","Higher Order Dilaton Interactions in the Nearly Conformal Limit of the
  Standard Model","11 pages, 1 Figure. Accepted for publication on Phys. Lett. B",,"10.1016/j.physletb.2012.08.054",,"hep-ph hep-th","http://arxiv.org/licenses/nonexclusive-distrib/1.0/","  We investigate the Standard Model in the nearly conformal limit, in which
conformal symmetry is broken only by the dilatation anomaly, through a
hierarchy of anomalous Ward identities for the divergence of its dilatation
current. In this approximation, the identities allow to extract the coupling of
the dilaton to the trace anomaly, which we compute up to the quartic order in
the conformal breaking scale. Our approach can be easily extended to discuss
the anomaly contributions to the dilaton effective action to an arbitrarily
high order. They allow to make a distinction between the Higgs and a dilaton at
a phenomenological level.
","[{""version"":""v1"",""created"":""Thu, 12 Jul 2012 11:48:30 GMT""},{""version"":""v2"",""created"":""Fri, 31 Aug 2012 08:26:39 GMT""}]","2015-06-05"
"1207.2931","Robert Martin","R. T. W. Martin","Near invariance and symmetric operators",,,,,"math.FA","http://arxiv.org/licenses/nonexclusive-distrib/1.0/","  Let $S$ be a subspace of $L^2 (\bm{R})$. We show that the operator $M$ of
multiplication by the independent variable has a simple symmetric regular
restriction to $S$ with deficiency indices $(1,1)$ if and only if $S = u h
K^{2}_\theta$ is a nearly invariant subspace, with $\theta$ a meromorphic inner
function vanishing at $i$. Here $u$ is unimodular, $h$ is an isometric
multiplier of $K^{2}_\theta$ into $H^2$ and $H^2$ is the Hardy space of the
upper half plane. Our proof uses the dilation theory of completely positive
maps.
","[{""version"":""v1"",""created"":""Thu, 12 Jul 2012 12:05:06 GMT""}]","2012-07-13"
"1207.2932","Silvia Raino'","M. Ackermann, M. Ajello, J. Ballet, G. Barbiellini, D. Bastieri, R.
  Bellazzini, R. D. Blandford, E. D. Bloom, E. Bonamente, A. W. Borgland, E.
  Bottacini, J. Bregeon, M. Brigida, P. Bruel, R. Buehler, S. Buson, G. A.
  Caliandro, R. A. Cameron, P. A. Caraveo, J. M. Casandjian, E. Cavazzuti, C.
  Cecchi, E. Charles, A. Chekhtman, J. Chiang, S. Ciprini, R. Claus, J.
  Cohen-Tanugi, S. Cutini, F. D'Ammando, F. de Palma, C. D. Dermer, E. do Couto
  e Silva, P. S. Drell, A. Drlica-Wagner, R. Dubois, C. Favuzzi, S. J. Fegan,
  E. C. Ferrara, W. B. Focke, P. Fortin, L. Fuhrmann, Y. Fukazawa, P. Fusco, F.
  Gargano, D. Gasparrini, N. Gehrels, S. Germani, N. Giglietto, P. Giommi, F.
  Giordano, M. Giroletti, T. Glanzman, G. Godfrey, I. A. Grenier, S. Guiriec,
  D. Hadasch, M. Hayashida, R. E. Hughes, R. Itoh, G. Johannesson, A. S.
  Johnson, H. Katagiri, J. Kataoka, J. Knodlseder, M. Kuss, J. Lande, S.
  Larsson, S.-H. Lee, F. Longo, F. Loparco, B. Lott, M. N. Lovellette, P.
  Lubrano, G. M. Madejski, M. N. Mazziotta, J. E. McEnery, J. Mehault, P. F.
  Michelson, W. Mitthumsiri, T. Mizuno, C. Monte, M. E. Monzani, A. Morselli,
  I. V. Moskalenko, S. Murgia, M. Naumann-Godo, S. Nishino, J. P. Norris, E.
  Nuss, T. Ohsugi, A. Okumura, N. Omodei, E. Orlando, M. Ozaki, D. Paneque, J.
  H. Panetta, V. Pelassa, M. Pesce-Rollins, M. Pierbattista, F. Piron, G.
  Pivato, T. A. Porter, S. Raino, R. Rando, D. Rastawicki, M. Razzano, A.
  Readhead, A. Reimer, O. Reimer, L. C. Reyes, J. L. Richards, C. Sbarra, C.
  Sgro, E. J. Siskind, G. Spandre, P. Spinelli, A. Szostek, H. Takahashi, T.
  Tanaka, J. G. Thayer, J. B. Thayer, D. J. Thompson, M. Tinivella, D. F.
  Torres, G. Tosti, E. Troja, T. L. Usher, J. Vandenbroucke, V. Vasileiou, G.
  Vianello, V. Vitale, A. P. Waite, B. L. Winer, K. S. Wood, Z. Yang, S. Zimmer
  (the Fermi-LAT Collaboration) and R. Moderski, K. Nalewajko, M. Sikora and M.
  Villata, C. M. Raiteri, H. D. Aller, M. F. Aller, A. A. Arkharov, E. Benitez,
  A. Berdyugin, D. A. Blinov, M. Boettcher, O. J. A. Bravo Calle, C. S. Buemi,
  D. Carosati, W. P. Chen, C. Diltz, A. Di Paola, M. Dolci, N. V. Efimova, E.
  Forn\', M. A. Gurwell, J. Heidt, D. Hiriart, B. Jordan, G. Kimeridze, T. S.
  Konstantinova, E. N. Kopatskaya, E. Koptelova, O. M. Kurtanidze, A.
  Lahteenmaki, E. G. Larionova, L. V. Larionova, V. M. Larionov, P. Leto, E.
  Lindfors, H. C. Lin, D. A. Morozova, M. G. Nikolashvili, K. Nilsson, M.
  Oksman, P. Roustazadeh, A. Sievers, L. A. Sigua, A. Sillanpaa, T. Takahashi,
  L. O. Takalo, M. Tornikoski, C. Trigilio, I. S. Troitsky, G. Umana (the
  GASP-WEBT consortium) and E. Angelakis, T. P. Krichbaum, I. Nestoras, D.
  Riquelme (F-GAMMA) and M. Krips, S. Trippe (Iram-PdBI) and A. Arai, K. S.
  Kawabata, K. Sakimoto, M. Sasada, S. Sato, M. Uemura, M. Yamanaka, M. Yoshida
  (Kanata) and T. Belloni, G. Tagliaferri (RXTE) and E. W. Bonning, J. Isler,
  C. M. Urry (SMARTS) and E. Hoversten, A. Falcone, C. Pagani, M. Stroh
  (Swift-XRT)","Multi-wavelength observations of blazar AO 0235+164 in the 2008-2009
  flaring state","48 pages, 8 figures","ApJ 751, 159 (2012)","10.1088/0004-637X/751/2/159",,"astro-ph.HE","http://arxiv.org/licenses/nonexclusive-distrib/1.0/","  The blazar AO 0235+164 (z = 0.94) has been one of the most active objects
observed by Fermi Large Area Telescope (LAT) since its launch in Summer 2008.
In addition to the continuous coverage by Fermi, contemporaneous observations
were carried out from the radio to {\gamma} -ray bands between 2008 September
and 2009 February. In this paper, we summarize the rich multi-wavelength data
collected during the campaign (including F-GAMMA, GASP- WEBT, Kanata, OVRO,
RXTE, SMARTS, Swift, and other instruments), examine the cross-correlation
between the light curves measured in the different energy bands, and interpret
the resulting spectral energy distributions in the context of well-known blazar
emission models. We find that the {\gamma} -ray activity is well correlated
with a series of near-IR/optical flares, accompanied by an increase in the
optical polarization degree. On the other hand, the X-ray light curve shows a
distinct 20 day high state of unusually soft spectrum, which does not match the
extrapolation of the optical/UV synchrotron spectrum. We tentatively interpret
this feature as the bulk Compton emission by cold electrons contained in the
jet, which requires an accretion disk corona with an effective covering factor
of 19% at a distance of 100 Rg . We model the broadband spectra with a leptonic
model with external radiation dominated by the infrared emission from the dusty
torus.
","[{""version"":""v1"",""created"":""Thu, 12 Jul 2012 12:06:28 GMT""}]","2012-07-13"
"1207.2933","Monique Lassaut","A. Bachkhaznadji and M. Lassaut","Extending the four-body problem of Wolfes to non-translationally
  invariant interactions","15 pages","Few-Body Systems 54 (2013) 1945","10.1007/s00601-013-0696-z",,"math-ph math.MP","http://arxiv.org/licenses/nonexclusive-distrib/1.0/","  We propose and solve exactly the Schr\""odinger equation of a bound quantum
system consisting in four particles moving on a real line with both
translationally invariant four particles interactions of Wolfes type
\cite{Wolf74} and additional non translationally invariant four-body
potentials. We also generalize and solve exactly this problem in any
$D$-dimensional space by providing full eigensolutions and the corresponding
energy spectrum. We discuss the domain of the coupling constant where the
irregular solutions becomes physically acceptable
","[{""version"":""v1"",""created"":""Thu, 12 Jul 2012 12:07:48 GMT""},{""version"":""v2"",""created"":""Fri, 8 Mar 2013 13:29:09 GMT""},{""version"":""v3"",""created"":""Thu, 14 Mar 2013 13:35:07 GMT""}]","2013-09-18"
"1207.2934","Sergey Kozyrev","Sergey M. Kozyrev, Rinat A. Daishev","""Gauge"" freedom and relationship between the Einstein and Jordan
  conformal frames","7 pages",,,,"physics.gen-ph","http://arxiv.org/licenses/nonexclusive-distrib/1.0/","  The issue of the physical equivalence between the Einstein and Jordan
conformal frames in Jordan-Brans-Dicke (JBD) theory is revised. Scalar-tensor
theories equations are not invariant with respect to conformal transformations
if one uses the same ""gauge"" fixing in Jordan and Einstein frames. We hope to
have clarified some eventual obscure issues associated to the concept of
conformal invariance of relativistic theories appearing in the literature, in
particular the relationship between Jordan and Einstein frames.
","[{""version"":""v1"",""created"":""Thu, 12 Jul 2012 12:13:50 GMT""}]","2012-12-26"
"1207.2935","Michael J. Graf","R. C. Johnson, B. Z. Malkin, J. S. Lord, S. R. Giblin, A. Amato, C.
  Baines, A. Lascialfari, B. Barbara, and M. J. Graf","Evolution of spin relaxation processes in LiY$_{1-x}$Ho$_x$F$_4$ with
  increasing x studied via AC-susceptibility and muon spin relaxation","33 pages, 9 figures; accepted for publication, Physical Review B","Phys. Rev. B 86, 014427 (2012)","10.1103/PhysRevB.86.014427",,"cond-mat.str-el cond-mat.other","http://arxiv.org/licenses/nonexclusive-distrib/1.0/","  We present measurements of magnetic field and frequency dependences of the
low temperature (T = 1.8 K) AC-susceptibility, and temperature and field
dependences of the longitudinal field positive muon spin relaxation ({\mu}SR)
for LiY$_{1-x}$Ho$_x$F$_4$ with x = 0.0017, 0.0085, 0.0408, and 0.0855. The
fits of numerical simulations to the susceptibility data for the x = 0.0017,
0.0085 and 0.0408 show that Ho-Ho cross-relaxation processes become more
important at higher concentrations, signaling the crossover from single-ion to
correlated behavior. We simulate the muon spin depolarization using the
parameters extracted from the susceptibility, and the simulations agree well
with our data for samples with x = 0.0017 and 0.0085. The {\mu}SR data for
samples with x = 0.0408 and 0.0855 at low temperatures (T < 10 K) cannot be
described within a single-ion picture of magnetic field fluctuations and give
evidence for additional mechanisms of depolarization due to Ho$^{3+}$
correlations. We also observe an unusual peak in the magnetic field dependence
of the muon relaxation rate in the temperature interval 10 - 20 K that we
ascribe to a modification of the Ho$^{3+}$ fluctuation rate due to a field
induced shift of the energy gap between the ground and the first excited
doublet crystal field states relative to a peak in the phonon density of states
centered near 63 cm$^{-1}$.
","[{""version"":""v1"",""created"":""Thu, 12 Jul 2012 12:18:06 GMT""}]","2015-06-05"
"1207.2936","Ignacio Cascudo","Ignacio Cascudo, Ronald Cramer, Chaoping Xing","Torsion Limits and Riemann-Roch Systems for Function Fields and
  Applications","Accepted for publication in IEEE Transactions on Information Theory.
  This is an extended version of our paper in Proceedings of 31st Annual IACR
  CRYPTO, Santa Barbara, Ca., USA, 2011. The results in Sections 5 and 6 did
  not appear in that paper. A first version of this paper has been widely
  circulated since November 2009",,"10.1109/TIT.2014.2314099",,"math.AG cs.CR math.CO math.NT","http://arxiv.org/licenses/nonexclusive-distrib/1.0/","  The Ihara limit (or -constant) $A(q)$ has been a central problem of study in
the asymptotic theory of global function fields (or equivalently, algebraic
curves over finite fields). It addresses global function fields with many
rational points and, so far, most applications of this theory do not require
additional properties. Motivated by recent applications, we require global
function fields with the additional property that their zero class divisor
groups contain at most a small number of $d$-torsion points. We capture this by
the torsion limit, a new asymptotic quantity for global function fields. It
seems that it is even harder to determine values of this new quantity than the
Ihara constant. Nevertheless, some non-trivial lower- and upper bounds are
derived. Apart from this new asymptotic quantity and bounds on it, we also
introduce Riemann-Roch systems of equations. It turns out that this type of
equation system plays an important role in the study of several other problems
in areas such as coding theory, arithmetic secret sharing and multiplication
complexity of finite fields etc. Finally, we show how our new asymptotic
quantity, our bounds on it and Riemann-Roch systems can be used to improve
results in these areas.
","[{""version"":""v1"",""created"":""Thu, 12 Jul 2012 12:20:14 GMT""},{""version"":""v2"",""created"":""Mon, 28 Apr 2014 11:27:22 GMT""}]","2014-04-29"
"1207.2937","Chirashree Lahiri Miss","Chirashree Lahiri, G. Gangopadhyay","Neutron rich nuclei in a new binding energy formula and the
  astrophysical $r-$process",,"Int. J. Mod. Phys. E 21 (2012) 1250042","10.1142/S0218301312500425",,"nucl-th","http://arxiv.org/licenses/nonexclusive-distrib/1.0/","  Neutron rich nuclei has been studied with a new phenomenological mass
formula. Predictions of different mass formulas for the location of the neutron
dripline are compared with those from the present calculation. The implications
of the new mass formula for r-process nucleosynthesis are discussed. It is
found that though the neutron drip line obtained from this formula differs
substantially from other formulas, the r-process abundance upto mass 200 are
unlikely to be significantly different. The errors inherent in the mass formula
are found to play an insignificant role beyond mass A = 80.
","[{""version"":""v1"",""created"":""Thu, 12 Jul 2012 12:29:54 GMT""}]","2012-07-13"
"1207.2938","W. LiMing Dr","W. LiMing, Jiayun Luo, Xiaoxue Cai, Ke Sha, Liangbin Hu","Andreev reflection and tunneling spectrum in a superlattice of
  metal-superconductor junctions","4 pages,9 figures","Frontiers of Physics 8,50-54(2013)","10.1007/s11467-013-0291-2",,"cond-mat.supr-con quant-ph","http://arxiv.org/licenses/nonexclusive-distrib/1.0/","  The tunneling spectrum of an electron and a hole in a superlattice of NS
junctions is computed using the BTK approach and the transfer matrix method. It
shows sharp resonances at some energies above the superconducting gap. The
sharper the resonance is the more layers the superlattice has. We find for the
first time a mechanism to balance the incident and outgoing currents on the
superlattice by averaging over the phase between the incident electron and the
incident hole. This mechanism is more natural and physical than those in
literatures.
","[{""version"":""v1"",""created"":""Thu, 12 Jul 2012 12:33:27 GMT""}]","2014-08-20"
"1207.2939","Franco Fagnola","Franco Fagnola, Carlos M. Mora","Stochastic Schroedinger equations and applications to Ehrenfest-type
  theorems",,"ALEA, Lat. Am. J. Probab. Math. Stat. 10 (1), 191--223 (2013)",,,"quant-ph math.PR","http://arxiv.org/licenses/nonexclusive-distrib/1.0/","  We study stochastic evolution equations describing the dynamics of open
quantum systems. First, using resolvent approximations, we obtain a sufficient
condition for regularity of solutions to linear stochastic Schroedinger
equations driven by cylindrical Brownian motions applying to many physical
systems. Then, we establish well-posedness and norm conservation property of a
wide class of open quantum systems described in position representation.
Moreover, we prove Ehrenfest-type theorems that describe the evolution of the
mean value of quantum observables in open systems. Finally, we give a new
criterion for existence and uniqueness of weak solutions to non-linear
stochastic Schroedinger equations. We apply our results to physical systems
such as fluctuating ion traps and quantum measurement processes of position.
","[{""version"":""v1"",""created"":""Thu, 12 Jul 2012 12:36:05 GMT""},{""version"":""v2"",""created"":""Tue, 19 Mar 2013 12:35:48 GMT""}]","2014-05-27"
"1207.2940","Marc Deisenroth","Marc Peter Deisenroth and Shakir Mohamed","Expectation Propagation in Gaussian Process Dynamical Systems: Extended
  Version",,"Advances in Neural Information Processing Systems 25 (NIPS), pp.
  2609-2617, 2012",,,"stat.ML cs.LG cs.SY","http://arxiv.org/licenses/nonexclusive-distrib/1.0/","  Rich and complex time-series data, such as those generated from engineering
systems, financial markets, videos or neural recordings, are now a common
feature of modern data analysis. Explaining the phenomena underlying these
diverse data sets requires flexible and accurate models. In this paper, we
promote Gaussian process dynamical systems (GPDS) as a rich model class that is
appropriate for such analysis. In particular, we present a message passing
algorithm for approximate inference in GPDSs based on expectation propagation.
By posing inference as a general message passing problem, we iterate
forward-backward smoothing. Thus, we obtain more accurate posterior
distributions over latent structures, resulting in improved predictive
performance compared to state-of-the-art GPDS smoothers, which are special
cases of our general message passing algorithm. Hence, we provide a unifying
approach within which to contextualize message passing in GPDSs.
","[{""version"":""v1"",""created"":""Thu, 12 Jul 2012 12:37:57 GMT""},{""version"":""v2"",""created"":""Fri, 13 Jul 2012 14:45:28 GMT""},{""version"":""v3"",""created"":""Mon, 12 Nov 2012 06:45:30 GMT""},{""version"":""v4"",""created"":""Fri, 25 Jul 2014 10:25:19 GMT""},{""version"":""v5"",""created"":""Wed, 17 Aug 2016 13:23:57 GMT""}]","2016-08-18"
"1207.2941","Andrzej Jarynowski","Andrzej Jarynowski, Marta Klis","Socio-economic models of divorces in different societies","Proceedings of 18th National Conference","Applications of mathematics in biology and medicine, Krynica
  Morska, 23-27.09.2012",,,"nlin.AO physics.data-an physics.soc-ph stat.AP","http://arxiv.org/licenses/nonexclusive-distrib/1.0/","  Population dynamic of getting divorced depends on many global factors,
including social norms, economy, law or demographics as well as individual
factors like the level of interpersonal or problem-solving skills of the
spouses. We sought to find such a relationship incorporating only quantitative
variables and test theoretical model considering phase transition between
coupling (pairs) and free (single) preferential states as a function of social
and economic. The analyzed data has been collected by UN across almost all the
countries since 1948. Our first approach is followed by Bouchaud's model of
social network of opinions, which works well with dynamics of fertility rates
in postwar Europe. Unfortunately, we postulate that this pure sociological and
pure economic approach fail in general. Thus, we did some observation about why
it went wrong and where economy (e. g. Poland) or law (e. g. Portugal) has
bigger impact on getting divorce than social pressure.
","[{""version"":""v1"",""created"":""Thu, 12 Jul 2012 12:38:28 GMT""}]","2012-10-02"
"1207.2942","Ido Braslavsky Dr.","Jun Jie Liu, Yangzong Qin, Maya Bar Dolev, Yeliz Celik, J. S.
  Wettlaufer, and Ido Braslavsky","Modeling the Influence of Antifreeze Proteins on Three-Dimensional Ice
  Crystal Melt Shapes using a Geometric Approach","15 pages, 5 figures; Proc. R. Soc. A, Published online before print
  June 27, 2012",,"10.1098/rspa.2011.0720",,"physics.bio-ph cond-mat.mtrl-sci math-ph math.MP","http://arxiv.org/licenses/nonexclusive-distrib/1.0/","  The melting of pure axisymmetric ice crystals has been described previously
by us within the framework of so-called geometric crystal growth.
Nonequilibrium ice crystal shapes evolving in the presence of hyperactive
antifreeze proteins (hypAFPs) are experimentally observed to assume ellipsoidal
geometries (""lemon"" or ""rice"" shapes). To analyze such shapes we harness the
underlying symmetry of hexagonal ice Ih and extend two-dimensional geometric
models to three-dimensions to reproduce the experimental dissolution process.
The geometrical model developed will be useful as a quantitative test of the
mechanisms of interaction between hypAFPs and ice.
","[{""version"":""v1"",""created"":""Thu, 12 Jul 2012 12:42:01 GMT""}]","2012-07-13"
"1207.2943","Norihiro Iizuka","Norihiro Iizuka, Kengo Maeda","Towards the Lattice Effects on the Holographic Superconductor","24 pages, 24 figures. v2: minor corrections",,"10.1007/JHEP11(2012)117",,"hep-th cond-mat.supr-con","http://arxiv.org/licenses/nonexclusive-distrib/1.0/","  We study the lattice effects on the simple holographic toy model; massive
U(1) gauge theory for the bulk action. The mass term is for the U(1) gauge
symmetry breaking in the bulk. Without the lattice, the AC conductivity of this
model shows similar results to the holographic superconductor with the energy
gap. On this model, we introduce the lattice effects, which induce the periodic
potential and break the translational invariance of the boundary field theory.
Without the lattice, due to the translational invariance and the mass term,
there is a delta function peak at zero frequency on the AC conductivity. We
study how this delta function peak is influenced by the lattice effects, which
we introduce perturbatively. In the probe limit, we evaluate the perturbative
corrections to the conductivities at very small frequency limit. We find that
the delta function peak remains, even after the lattice effects are introduced,
although its weight reduces perturbatively. We also study the lattice
wavenumber dependence of this weight. Our result suggests that in the U(1)
symmetry breaking phase, the delta function peak is stable against the lattice
effects at least perturbatively.
","[{""version"":""v1"",""created"":""Thu, 12 Jul 2012 12:46:16 GMT""},{""version"":""v2"",""created"":""Tue, 31 Jul 2012 20:22:45 GMT""}]","2015-06-05"
"1207.2944","Diego Rist\`e","D. Rist\`e, C. C. Bultink, K. W. Lehnert, L. DiCarlo","Feedback control of a solid-state qubit using high-fidelity projective
  measurement","5 pages, 4 figures, and Supplementary Information (5 figures)","Phys. Rev. Lett. 109, 240502 (2012)","10.1103/PhysRevLett.109.240502",,"cond-mat.mes-hall quant-ph","http://arxiv.org/licenses/nonexclusive-distrib/1.0/","  We demonstrate feedback control of a superconducting transmon qubit using
discrete, projective measurement and conditional coherent driving. Feedback
realizes a fast and deterministic qubit reset to a target state with 2.4% error
averaged over input superposition states, and cooling of the transmon from 16%
spurious excitation to 3%. This closed-loop qubit control is necessary for
measurement-based protocols such as quantum error correction and teleportation.
","[{""version"":""v1"",""created"":""Thu, 12 Jul 2012 12:57:05 GMT""}]","2012-12-11"
