"1207.2835","Daisuke Nakauchi","Daisuke Nakauchi, Yudai Suwa, Takanori Sakamoto, Kazumi Kashiyama, and
  Takashi Nakamura","Long Duration X-Ray Flash and X-Ray Rich Gamma Ray Burst from Low Mass
  Population III Star","27 pages, 7 figures, Accepted to the Astrophysical Journal",,"10.1088/0004-637X/759/2/128",,"astro-ph.HE","http://arxiv.org/licenses/nonexclusive-distrib/1.0/","  Recent numerical simulations suggest that Population III (Pop III) stars were
born with masses not larger than $\sim 100 M_{\odot}$ but typically $\sim
40M_{\odot}$. By self-consistently considering the jet generation and
propagation in the envelope of these low mass Pop III stars, we find that a Pop
III blue super giant star has the possibility to raise a gamma-ray burst (GRB)
even though it keeps a massive hydrogen envelope. We evaluate observational
characters of Pop III GRBs and predict that Pop III GRBs have the duration of
$\sim 10^5$ sec in the observer frame and the peak luminosity of $\sim 5 \times
10^{50} {\rm erg} {\rm sec}^{-1}$. Assuming that the $E_p-L_p$ (or
$E_p-E_{\gamma, \rm iso}$) correlation holds for Pop III GRBs, we find that the
spectrum peak energy falls $\sim$ a few keV (or $\sim 100$ keV) in the observer
frame. We discuss the detectability of Pop III GRBs by future satellite
missions such as EXIST and Lobster. If the $E_p-E_{\gamma, \rm iso}$
correlation holds, we have the possibility to detect Pop III GRBs at $z \sim 9$
as long duration X-ray rich GRBs by EXIST. On the other hand, if the $E_p-L_p$
correlation holds, we have the possibility to detect Pop III GRBs up to $z \sim
19$ as long duration X-ray flashes by Lobster.
","[{""version"":""v1"",""created"":""Thu, 12 Jul 2012 03:27:33 GMT""},{""version"":""v2"",""created"":""Wed, 26 Sep 2012 12:01:23 GMT""}]","2015-06-05"
"1207.2836","B. Svaiter F.","B. F. Svaiter","Geometric properties of maximal monotone operators and convex functions
  which may represent them","15 pages",,,,"math.FA","http://arxiv.org/licenses/nonexclusive-distrib/1.0/","  We study the relations between some geometric properties of maximal monotone
operators and generic geometric and analytical properties of the functions on
the associate Fitzpatrick family of convex representations. We also investigate
under which conditions a convex function represents a maximal monotone operator
with bounded range and provide an example of a non type (D) operator on this
class.
","[{""version"":""v1"",""created"":""Thu, 12 Jul 2012 03:29:53 GMT""}]","2012-07-13"
"1207.2837","Abdurashid Mamadolimov Ph.D.","Abdurashid Mamadolimov","Search Algorithms for Conceptual Graph Databases",,,,,"cs.DS cs.DB cs.DM math.CO","http://arxiv.org/licenses/nonexclusive-distrib/1.0/","  We consider a database composed of a set of conceptual graphs. Using
conceptual graphs and graph homomorphism it is possible to build a basic
query-answering mechanism based on semantic search. Graph homomorphism defines
a partial order over conceptual graphs. Since graph homomorphism checking is an
NP-Complete problem, the main requirement for database organizing and managing
algorithms is to reduce the number of homomorphism checks. Searching is a basic
operation for database manipulating problems. We consider the problem of
searching for an element in a partially ordered set. The goal is to minimize
the number of queries required to find a target element in the worst case.
First we analyse conceptual graph database operations. Then we propose a new
algorithm for a subclass of lattices. Finally, we suggest a parallel search
algorithm for a general poset. Keywords. Conceptual Graph, Graph Homomorphism,
Partial Order, Lattice, Search, Database.
","[{""version"":""v1"",""created"":""Thu, 12 Jul 2012 03:32:16 GMT""}]","2012-07-13"
"1207.2838","Takuya Okabe","Takuya Okabe","Vascular phyllotaxis transition and an evolutionary mechanism of
  phyllotaxis",,"Scientific Reports 5, 15358 (2015)",,,"physics.bio-ph q-bio.TO","http://creativecommons.org/licenses/by/3.0/","  Leaves of vascular plants are arranged regularly around stems, a phenomenon
known as phyllotaxis. A constant angle between two successive leaves is called
divergence angle. On the one side, the divergence angle $\alpha_0$ of an
initial pattern of leaf primordia at a shoot apex is most commonly an
irrational number of about 137.5 degrees, called limit divergence. On the other
side, the divergence $\alpha$ of a final pattern of leaf traces in the vascular
system of a mature stem is expressed in terms of a sequence of rational
numbers, 1/2, 1/3, 2/5, 3/8, 5/13, 8/21, called phyllotactic fractions. The
mathematical relationship between the initial divergence $\alpha_0$, the final
divergence $\alpha$, and the number of internodes traversed by the leaf traces
$n_c$ is investigated by means of a theoretical model of vascular phyllotaxis.
It is shown that continuous changes of the trace length $n_c$ induce
transitions between the fractional orders in the vascular structure. The
vascular phyllotaxis transition suggests an evolutionary mechanism for the
phenomenon of phyllotaxis. To provide supporting evidence for the model and
mechanism, available experimental results for fossil remains of Lepidodendron
and the vascular structure of Linum and Populus are analyzed with the model.
","[{""version"":""v1"",""created"":""Thu, 12 Jul 2012 03:52:11 GMT""}]","2017-07-19"
"1207.2839","Lior M. Burko","Lior M. Burko and Kristen A. Lackeos","Self Force Orbit-Integrated gravitational waveforms for E(I)MRIs","Talk given at the 9th LISA Symposium, 21-25 May 2012, BnF-Paris; To
  be published in the conference proceedings; 6 pages, 8 figures",,,,"gr-qc astro-ph.CO","http://arxiv.org/licenses/nonexclusive-distrib/1.0/","  We present the first orbit-integrated self force effects for an IMRI or EMRI
source, specifically the effects of its conservative piece on the orbit and on
the waveform. We consider the quasi-circular motion of a particle in the
spacetime of a Schwarzschild black hole, find the orbit and the corresponding
gravitational waveform, and discuss the importance of the conservative piece of
the self force in detection and parameter estimation. We also show the effect
of the conservative piece of the self force on gauge invariant quantities,
specifically $u^t$ as a function of the angular frequency $\Omega$. For long
templates the inclusion of the conservative piece is crucial for
gravitational-wave astronomy, yet may be ignored for short templates with
little effect on detection rate.
","[{""version"":""v1"",""created"":""Thu, 12 Jul 2012 03:56:49 GMT""}]","2012-07-13"
"1207.2840","Rajkumar Sarma","Rajkumar Sarma and Veerati Raju","Design and Performance Analysis of hybrid adders for high speed
  arithmetic circuit","12 PAGES, 10 FIGURES",,,,"cs.AR","http://arxiv.org/licenses/nonexclusive-distrib/1.0/","  Adder cells using Gate Diffusion Technique (GDI) & PTL-GDI technique are
described in this paper. GDI technique allows reducing power consumption,
propagation delay and low PDP (power delay product) whereas Pass Transistor
Logic (PTL) reduces the count of transistors used to make different logic
gates, by eliminating redundant transistors. Performance comparison with
various Hybrid Adder is been presented. In this paper, we propose two new
designs based on GDI & PTL techniques, which is found to be much more power
efficient in comparison with existing design technique. Only 10 transistors are
used to implement the SUM & CARRY function for both the designs. The SUM and
CARRY cell are implemented in a cascaded way i.e. firstly the XOR cell is
implemented and then using XOR as input SUM as well as CARRY cell is
implemented. For Proposed GDI adder the SUM as well as CARRY cell is designed
using GDI technique. On the other hand in Proposed PTL-GDI adder the SUM cell
is constructed using PTL technique and the CARRY cell is designed using GDI
technique. The advantages of both the designs are discussed. The significance
of these designs is substantiated by the simulation results obtained from
Cadence Virtuoso 180nm environment.
","[{""version"":""v1"",""created"":""Thu, 12 Jul 2012 03:57:37 GMT""}]","2012-07-13"
"1207.2841","Zhi-Yong Wang","Zhi-Yong Wang, Cai-Dong Xiong, and Qi Qiu","Comment on ""Uncertainty Relation for Photons""","Detailed version of a Comment, 11 pages, no figure","Phys. Rev. Lett. 109, 188901 (2012)","10.1103/PhysRevLett.109.188901",,"quant-ph physics.optics","http://arxiv.org/licenses/nonexclusive-distrib/1.0/","  In a recent interesting Letter [Phys. Rev. Lett. 108, 140401 (2012)] I.
Bialynicki-Birula and his coauthor have derived the uncertainty relation for
the photons in three dimensions. However, some of their arguments are
problematical, and this impacts their conclusion.
","[{""version"":""v1"",""created"":""Thu, 12 Jul 2012 04:10:36 GMT""},{""version"":""v2"",""created"":""Wed, 18 Jul 2012 01:45:01 GMT""},{""version"":""v3"",""created"":""Mon, 23 Jul 2012 10:59:55 GMT""},{""version"":""v4"",""created"":""Mon, 3 Sep 2012 07:28:54 GMT""},{""version"":""v5"",""created"":""Tue, 25 Sep 2012 08:12:54 GMT""}]","2015-06-05"
"1207.2842","Orang Alem","Orang Alem, Karen L. Sauer, Mike V. Romalis","Spin Damping in an RF Atomic Magnetometer","24 pages, 7 figures",,"10.1103/PhysRevA.87.013413",,"physics.atom-ph","http://arxiv.org/licenses/nonexclusive-distrib/1.0/","  Under negative feedback, the quality factor Q of a radio-frequency
magnetometer can be decreased by more than two orders of magnitude, so that any
initial perturbation of the polarized spin system can be rapidly damped,
preparing the magnetometer for detection of the desired signal. We find that
noise is also suppressed under such spin-damping, with a characteristic
spectral response corresponding to the type of noise; therefore magnetic,
photon-shot, and spin-projection noise can be measured distinctly. While the
suppression of resonant photon-shot noise implies the closed-loop production of
polarization-squeezed light, the suppression of resonant spin-projection noise
does not imply spin-squeezing, rather simply the broadening of the noise
spectrum with Q. Furthermore, the application of spin-damping during
phase-sensitive detection suppresses both signal and noise in such a way as to
increase the sensitivity bandwidth. We demonstrate a three-fold increase in the
magnetometer's bandwidth while maintaining 0.3 fT/\surdHz sensitivity.
","[{""version"":""v1"",""created"":""Thu, 12 Jul 2012 04:22:21 GMT""}]","2015-06-05"
"1207.2843","Constanze Liaw","Constanze Liaw","A new numerical approach to Anderson (de)localization","15 pages, 8 figures","J. Stat. Phys. (2013) 153, p. 1022-1038","10.1007/s10955-013-0879-5",,"math-ph math.MP math.SP","http://arxiv.org/licenses/nonexclusive-distrib/1.0/","  We develop a new approach for the Anderson localization problem. The
implementation of this method yields strong numerical evidence leading to a
(surprising to many) conjecture: The two dimensional discrete random
Schroedinger operator with small disorder allows states that are dynamically
delocalized with positive probability. This approach is based on a recent
result by Abakumov-Liaw-Poltoratski which is rooted in the study of spectral
behavior under rank-one perturbations, and states that every non-zero vector is
almost surely cyclic for the singular part of the operator.
  The numerical work presented is rather simplistic compared to other numerical
approaches in the field. Further, this method eliminates effects due to
boundary conditions.
  While we carried out the numerical experiment almost exclusively in the case
of the two dimensional discrete random Schroedinger operator, we include the
setup for the general class of Anderson models called Anderson-type
Hamiltonians.
  We track the location of the energy when a wave packet initially located at
the origin is evolved according to the discrete random Schroedinger operator.
  This method does not provide new insight on the energy regimes for which
diffusion occurs.
","[{""version"":""v1"",""created"":""Thu, 12 Jul 2012 05:08:30 GMT""}]","2013-12-17"
"1207.2844","Alfredo Perez","Alfredo Perez, David Tempo, Ricardo Troncoso","Higher spin gravity in 3D: black holes, global charges and
  thermodynamics","14 pages. Minor changes and references added",,"10.1016/j.physletb.2013.08.038","CECS-PHY-12/02; ESI-2372","hep-th gr-qc","http://arxiv.org/licenses/nonexclusive-distrib/1.0/","  Global charges and thermodynamic properties of three-dimensional higher spin
black holes that have been recently found in the literature are revisited.
Since these solutions possess a relaxed asymptotically AdS behavior, following
the canonical approach, it is shown that the global charges, and in particular
the mass, acquire explicit nontrivial contributions given by nonlinear terms in
the deviations with respect to the reference background. It is also found that
there are cases for which the first law of thermodynamics is fulfilled in the
canonical ensemble, i.e., without work terms associated to the presence of
higher spin fields, and remarkably, the semiclassical higher spin black hole
entropy is exactly reproduced from Cardy formula.
","[{""version"":""v1"",""created"":""Thu, 12 Jul 2012 05:17:54 GMT""},{""version"":""v2"",""created"":""Thu, 5 Sep 2013 04:35:14 GMT""}]","2013-09-06"
"1207.2845","Wonseok Kang","Wonseok Kang (1,2) and Sang-Gak Lee (2) ((1) Kyung Hee University, (2)
  Seoul National University)","Tool for Automatic Measurement of Equivalent width (TAME)","27 pages, 10 figures, and 1 table",,"10.1111/j.1365-2966.2012.21613.x",,"astro-ph.SR","http://arxiv.org/licenses/nonexclusive-distrib/1.0/","  We present a tool for measuring the equivalent width (EW) in high-resolution
spectra. The Tool for Automatic Measurement of Equivalent width (TAME)provides
the EWs of spectral lines by profile fitting in the automatic or the
interactive mode, which can yield a more precise result through the adjustment
of the local continuum and fitting parameters. The automatic EW results of TAME
have been verified by comparing them with the manual EW measurements by IRAF
splot task using the high-resolution spectrum of the Sun, and measuring EWs in
the synthetic spectra with different spectral resolutions and S/N ratios. The
EWs measured by TAME agree well with manually measured values, with a
dispersion of less than 2 mA. By comparing the input EWs for synthetic spectra
and EWs measured by TAME, we conclude that it is reliable for measuring the EWs
in a spectrum with a spectral resolution, R > 20000 and find that the errors in
EWs is less than 1 mA for a S/N ratio > 100.
","[{""version"":""v1"",""created"":""Thu, 12 Jul 2012 05:19:05 GMT""}]","2015-06-05"
"1207.2846","Francesco Morandin","David Barbato and Luigi Amedeo Bianchi and Franco Flandoli and
  Francesco Morandin","A dyadic model on a tree",,"Journal of Mathematical Physics 54, 021507 (2013)","10.1063/1.4792488",,"math.AP","http://arxiv.org/licenses/nonexclusive-distrib/1.0/","  We study an infinite system of non-linear differential equations coupled in a
tree-like structure. This system was previously introduced in the literature
and it is the model from which the dyadic shell model of turbulence was
derived. It mimics 3d Euler and Navier-Stokes equations in a rough
approximation of a wavelet decomposition. We prove existence of finite energy
solutions, anomalous dissipation in the inviscid unforced case, existence and
uniqueness of stationary solutions (either conservative or not) in the forced
case.
","[{""version"":""v1"",""created"":""Thu, 12 Jul 2012 05:21:48 GMT""}]","2015-10-15"
"1207.2847","Kai Liu","Kai Liu, Hock Beng Lim","Positioning Accuracy Improvement via Distributed Location Estimate in
  Cooperative Vehicular Networks","To appear in Proc. of the 15th International IEEE Conference on
  Intelligent Transportation Systems (IEEE ITSC'12)",,"10.1109/ITSC.2012.6338743",,"cs.DC cs.DS","http://arxiv.org/licenses/nonexclusive-distrib/1.0/","  The development of cooperative vehicle safety (CVS) applications, such as
collision warnings, turning assistants, and speed advisories, etc., has
received great attention in the past few years. Accurate vehicular localization
is essential to enable these applications. In this study, motivated by the
proliferation of the Global Positioning System (GPS) devices, and the
increasing sophistication of wireless communication technologies in vehicular
networks, we propose a distributed location estimate algorithm to improve the
positioning accuracy via cooperative inter-vehicle distance measurement. In
particular, we compute the inter-vehicle distance based on raw GPS pseudorange
measurements, instead of depending on traditional radio-based ranging
techniques, which usually either suffer from high hardware cost or have
inadequate positioning accuracy. In addition, we improve the estimation of the
vehicles' locations only based on the inaccurate GPS fixes, without using any
anchors with known exact locations. The algorithm is decentralized, which
enhances its practicability in highly dynamic vehicular networks. We have
developed a simulation model to evaluate the performance of the proposed
algorithm, and the results demonstrate that the algorithm can significantly
improve the positioning accuracy.
","[{""version"":""v1"",""created"":""Thu, 12 Jul 2012 05:27:16 GMT""},{""version"":""v2"",""created"":""Sat, 14 Jul 2012 06:32:37 GMT""},{""version"":""v3"",""created"":""Fri, 20 Jul 2012 08:33:23 GMT""}]","2016-11-15"
"1207.2848","Yunjian Xu","John N. Tsitsiklis and Yunjian Xu","Pricing of Fluctuations in Electricity Markets",,,,,"math.OC math.DS","http://arxiv.org/licenses/nonexclusive-distrib/1.0/","  In an electric power system, demand fluctuations may result in significant
ancillary cost to suppliers. Furthermore, in the near future, deep penetration
of volatile renewable electricity generation is expected to exacerbate the
variability of demand on conventional thermal generating units. We address this
issue by explicitly modeling the ancillary cost associated with demand
variability. We argue that a time-varying price equal to the suppliers'
instantaneous marginal cost may not achieve social optimality, and that
consumer demand fluctuations should be properly priced. We propose a dynamic
pricing mechanism that explicitly encourages consumers to adapt their
consumption so as to offset the variability of demand on conventional units.
Through a dynamic game-theoretic formulation, we show that (under suitable
convexity assumptions) the proposed pricing mechanism achieves social
optimality asymptotically, as the number of consumers increases to infinity.
Numerical results demonstrate that compared with marginal cost pricing, the
proposed mechanism creates a stronger incentive for consumers to shift their
peak load, and therefore has the potential to reduce the need for long-term
investment in peaking plants.
","[{""version"":""v1"",""created"":""Thu, 12 Jul 2012 05:29:15 GMT""}]","2012-07-13"
"1207.2849","Bipul Bhuyan","T. Allmendinger, B. Bhuyan, D. N. Brown, H. Choi, S. Christ, R.
  Covarelli, M. Davier, A. G. Denig, M. Fritsch, A. Hafner, R. Kowalewski, O.
  Long, A. M. Lutz, M. Martinelli, D. R. Muller, I. M. Nugent, D. Lopes Pegna,
  M. V. Purohit, E. Prencipe, J. M. Roney, G. Simi, E. P. Solodov, A. V.
  Telnov, E. Varnes, R. Waldi, W. F. Wang, R. M. White","Track Finding Efficiency in BaBar","20 pages, 30 figures, Submitted to Nuclear Instruments and Methods in
  Physics Research A","Nucl. Instr. Methods Phys. Res., Sect. A 704, 44 (2013)","10.1016/j.nima.2012.11.184","SLAC-PUB-15095","hep-ex","http://arxiv.org/licenses/nonexclusive-distrib/1.0/","  We describe several studies to measure the charged track reconstruction
efficiency and asymmetry of the BaBar detector. The first two studies measure
the tracking efficiency of a charged particle using $\tau$ and initial state
radiation decays. The third uses the $\tau$ decays to study the asymmetry in
tracking, the fourth measures the tracking efficiency for low momentum tracks,
and the last measures the reconstruction efficiency of $K_S^0$ particles. The
first section also examines the stability of the measurements vs BaBar running
periods.
","[{""version"":""v1"",""created"":""Thu, 12 Jul 2012 05:37:10 GMT""}]","2015-06-05"
"1207.2850","Truong Thi Hong Thanh","Le Van Dinh, Nguyen Tien Manh, Truong Thi Hong Thanh","A Survey of Some Results for Mixed Multiplicities","9 pages",,,,"math.AC","http://arxiv.org/licenses/nonexclusive-distrib/1.0/","  The paper proves that the superficial sequences in [13, 15, 16, 25] are the
weak-(FC)-sequences in [18]. This follows that [18, Theorem 3.4] of Viet in
2000 covers the results of Risler and Teissier [13] in 1973; Trung [15, Theorem
3.4] in 2001; Trung and Verma [16, Theorem 1.4] in 2007. The paper unified the
results for mixed multiplicities of ideals in [13, 15, 16, 17, 18, 25].
","[{""version"":""v1"",""created"":""Thu, 12 Jul 2012 05:40:13 GMT""},{""version"":""v2"",""created"":""Sun, 22 Jul 2012 13:56:20 GMT""},{""version"":""v3"",""created"":""Mon, 22 Jul 2013 10:46:01 GMT""},{""version"":""v4"",""created"":""Fri, 20 Sep 2013 02:22:56 GMT""}]","2013-09-23"
"1207.2851","Adam Micolich","A. M. Burke, D. Waddington, D. Carrad, R. Lyttleton, H. H. Tan, P. J.
  Reece, O. Klochan, A. R. Hamilton, A. Rai, D. Reuter, A. D. Wieck and A. P.
  Micolich","The origin of gate hysteresis in p-type Si-doped AlGaAs/GaAs
  heterostructures","15 pages, 11 figures; Accepted for Physical Review B",,"10.1103/PhysRevB.86.165309",,"cond-mat.mes-hall cond-mat.mtrl-sci","http://arxiv.org/licenses/nonexclusive-distrib/1.0/","  Gate instability/hysteresis in modulation-doped p-type AlGaAs/GaAs
heterostructures impedes the development of nanoscale hole devices, which are
of interest for topics from quantum computing to novel spin physics. We present
an extended study conducted using custom-grown, matched modulation-doped n-type
and p-type heterostructures, with/without insulated gates, aimed at
understanding the origin of the hysteresis. We show the hysteresis is not due
to the inherent `leakiness' of gates on p-type heterostructures, as commonly
believed. Instead, hysteresis arises from a combination of GaAs surface-state
trapping and charge migration in the doping layer. Our results provide insights
into the physics of Si acceptors in AlGaAs/GaAs heterostructures, including
widely-debated acceptor complexes such as Si-X. We propose methods for
mitigating the gate hysteresis, including poisoning the modulation-doping layer
with deep-trapping centers (e.g., by co-doping with transition metal species),
and replacing the Schottky gates with degenerately-doped semiconductor gates to
screen the conducting channel from GaAs surface-states.
","[{""version"":""v1"",""created"":""Thu, 12 Jul 2012 05:57:47 GMT""},{""version"":""v2"",""created"":""Sat, 15 Sep 2012 20:54:40 GMT""}]","2015-06-05"
"1207.2852","G\""unter M. Ziegler","Pavle V. M. Blagojevi\'c, Wolfgang L\""uck, G\""unter M. Ziegler","Equivariant Topology of Configuration Spaces","40 pages; J. Topology, to appear",,"10.1112/jtopol/jtu029",,"math.AT math.CO","http://arxiv.org/licenses/nonexclusive-distrib/1.0/","  We study the Fadell-Husseini index of the configuration space F(R^d,n) with
respect to different subgroups of the symmetric group S_n. For p prime and d>0,
we completely determine Index_{Z/p}(F(R^d,p);F_p) and partially describe
Index{(Z/p)^k}(F(R^d,p^k);F_p). In this process we obtain results of
independent interest, including:
  (1) an extended equivariant Goresky-MacPherson formula,
  (2) a complete description of the top homology of the partition lattice Pi_p
as an F_p[Z_p]-module, and
  (3) a generalized Dold theorem for elementary abelian groups.
  The results on the Fadell-Husseini index yield a new proof of the Nandakumar
& Ramana Rao conjecture for a prime. For n=p^k a prime power, we compute the
Lusternik-Schnirelmann category cat(F(R^d,n)/S_n)=(d-1)(n-1). Moreover, we
extend coincidence results related to the Borsuk-Ulam theorem, as obtained by
Cohen & Connett, Cohen & Lusk, and Karasev & Volovikov.
","[{""version"":""v1"",""created"":""Thu, 12 Jul 2012 06:15:29 GMT""},{""version"":""v2"",""created"":""Mon, 10 Sep 2012 12:59:11 GMT""},{""version"":""v3"",""created"":""Mon, 3 Nov 2014 14:16:37 GMT""}]","2017-05-17"
"1207.2853","Federico Ricci-Tersenghi","Maria Chiara Angelini, Federico Ricci-Tersenghi, Yoshiyuki Kabashima","Compressed sensing with sparse, structured matrices","7 pages, 6 figures","Proc. Fiftieth Annual Allerton Conference, p. 808 (2012)","10.1109/Allerton.2012.6483301",,"cs.IT cond-mat.dis-nn cond-mat.stat-mech math.IT","http://arxiv.org/licenses/nonexclusive-distrib/1.0/","  In the context of the compressed sensing problem, we propose a new ensemble
of sparse random matrices which allow one (i) to acquire and compress a
{\rho}0-sparse signal of length N in a time linear in N and (ii) to perfectly
recover the original signal, compressed at a rate {\alpha}, by using a message
passing algorithm (Expectation Maximization Belief Propagation) that runs in a
time linear in N. In the large N limit, the scheme proposed here closely
approaches the theoretical bound {\rho}0 = {\alpha}, and so it is both optimal
and efficient (linear time complexity). More generally, we show that several
ensembles of dense random matrices can be converted into ensembles of sparse
random matrices, having the same thresholds, but much lower computational
complexity.
","[{""version"":""v1"",""created"":""Thu, 12 Jul 2012 06:16:33 GMT""},{""version"":""v2"",""created"":""Fri, 12 Apr 2013 11:12:16 GMT""}]","2013-04-15"
