"1207.2766","Sebastian C. Kraus","Arthur Hebecker, Sebastian C. Kraus, Moritz Kuntzler, Dieter Lust, and
  Timo Weigand","Fluxbranes: Moduli Stabilisation and Inflation","In section 3 an improved model is discussed","JHEP 01 (2013) 095","10.1007/JHEP01(2013)095","MPP-2012-113; LMU-ASC 47/12","hep-th","http://arxiv.org/licenses/nonexclusive-distrib/1.0/","  Fluxbrane inflation is a stringy version of D-term inflation in which two
fluxed D7-branes move towards each other until their (relative) gauge flux
annihilates. Compared to brane-antibrane inflation, the leading-order
inflationary potential of this scenario is much flatter. In the present paper
we first discuss a new explicit moduli stabilisation procedure combining the F-
and D-term scalar potentials: It is based on fluxed D7-branes in a geometry
with three large four-cycles of hierarchically different volumes. Subsequently,
we combine this moduli stabilisation with the fluxbrane inflation idea,
demonstrating in particular that CMB data (including cosmic string constraints)
can be explained within our setup of hierarchical large volume CY
compactifications. We also indicate how the eta-problem is expected to
re-emerge through higher-order corrections and how it might be overcome by
further refinements of our model. Finally, we explain why recently raised
concerns about constant FI terms do not affect the consistent, string-derived
variant of D-term inflation discussed in this paper.
","[{""version"":""v1"",""created"":""Wed, 11 Jul 2012 20:00:02 GMT""},{""version"":""v2"",""created"":""Thu, 24 Jan 2013 16:52:59 GMT""}]","2013-01-25"
"1207.2767","Yara L. Jaffe","Yara L. Jaff\'e, Bianca M. Poggianti, M. A. W. Verheijen, Boris Z.
  Deshev, Jacqueline H. van Gorkom","Gas reservoirs and star formation in a forming galaxy cluster at z=0.2","6 pages, 4 figures. Accepted for publication in ApJL. An animated
  version of Figure 2 is available at:
  http://www.nottingham.ac.uk/~ppxyj/Jaffe_ApJL_2012_Fig2_movie.mpeg. (v2.
  minor corrections/typos added)",,"10.1088/2041-8205/756/2/L28",,"astro-ph.CO astro-ph.GA","http://arxiv.org/licenses/nonexclusive-distrib/1.0/","  We present first results from the Blind Ultra Deep HI Environmental Survey
(BUDHIES) of the Westerbork Synthesis Radio Telescope (WSRT). Our survey is the
first direct imaging study of neutral atomic hydrogen gas in galaxies at a
redshift where evolutionary processes begin to show. In this letter we
investigate star formation, HI-content, and galaxy morphology, as a function of
environment in Abell 2192 (at z=0.1876). Using a 3-dimensional visualization
technique, we find that Abell 2192 is a cluster in the process of forming, with
significant substructure in it. We distinguish 4 structures that are separated
in redshift and/or space. The richest structure is the baby cluster itself,
with a core of elliptical galaxies that coincides with (weak) X-ray emission,
almost no HI-detections, and suppressed star formation. Surrounding the
cluster, we find a compact group where galaxies pre-process before falling into
the cluster, and a scattered population of ""field-like"" galaxies showing more
star formation and HI-detections. This cluster proves to be an excellent
laboratory to understand the fate of the HI gas in the framework of galaxy
evolution. We clearly see that the HI gas and the star formation correlate with
morphology and environment at z=0.2. In particular, the fraction of
HI-detections is significantly affected by the environment. The effect starts
to kick in in low mass groups that pre-process the galaxies before they enter
the cluster. Our results suggest that by the time the group galaxies fall into
the cluster, they are already devoid of HI.
","[{""version"":""v1"",""created"":""Wed, 11 Jul 2012 20:00:04 GMT""},{""version"":""v2"",""created"":""Tue, 14 Aug 2012 14:40:46 GMT""}]","2015-06-05"
"1207.2768","Maureen Teyssier","Maureen Teyssier, Kathryn V. Johnston, Michael Kuhlen","Identifying Local Group Field Galaxies which have interacted with the
  Milky Way","12 pages, 7 figures",,"10.1111/j.1365-2966.2012.21793.x",,"astro-ph.GA","http://arxiv.org/licenses/nonexclusive-distrib/1.0/","  We distinguish between Local Group field galaxies which may have passed
through the virial volume of the Milky Way, and those which have not, via a
statistical compari- son against populations of dark matter haloes in the Via
Lactea II (VLII) simulation with known orbital histories. Analysis of VLII
provides expectations for this escaped population: they contribute 13 per cent
of the galactic population between 300 and 1500 kpc from the Milky Way, and
hence we anticipate that about 7 of the 54 known Local Group galaxies in that
distance range are likely to be Milky Way escapees. These objects can be of any
mass below that of the Milky Way, and they are expected to have positive radial
velocities with respect to the Milky Way. Comparison of the radius-velocity
distributions of VLII populations and measurements of Local Group galaxies
presents a strong likelihood that Tucana, Cetus, NGC3109, SextansA, SextansB,
Antlia, NGC6822, Phoenix, LeoT, and NGC185 have passed through the Milky Way.
Most of these dwarfs have a lower HI mass fraction than the majority of dwarfs
lying at similar distances to either the Milky Way or M31. Indeed, several of
these galaxies - especially those with lower masses - contain signatures in
their morphology, star formation history and/or gas content indicative of
evolution seen in simulations of satellite/parent galactic interactions. Our
results offer strong support for scenarios in which dwarfs of different types
form a sequence in morphology and gas content, with evolution along the
sequence being driven by interaction history.
","[{""version"":""v1"",""created"":""Wed, 11 Jul 2012 20:00:05 GMT""}]","2015-06-05"
"1207.2769","Steve Flammia","Dave Bacon, Steven T. Flammia, Gregory M. Crosswhite","Adiabatic Quantum Transistors","18 pages, 10 figures; v2 improved clarity and other (mostly) minor
  changes; published version","Phys. Rev. X 3, 021015 (2013)","10.1103/PhysRevX.3.021015",,"quant-ph","http://creativecommons.org/licenses/by-nc-sa/3.0/","  We describe a many-body quantum system which can be made to quantum compute
by the adiabatic application of a large applied field to the system. Prior to
the application of the field quantum information is localized on one boundary
of the device, and after the application of the field this information has
propagated to the other side of the device with a quantum circuit applied to
the information. The applied circuit depends on the many-body Hamiltonian of
the material, and the computation takes place in a degenerate ground space with
symmetry-protected topological order. Such adiabatic quantum transistors are
universal adiabatic quantum computing devices which have the added benefit of
being modular. Here we describe this model, provide arguments for why it is an
efficient model of quantum computing, and examine these many-body systems in
the presence of a noisy environment.
","[{""version"":""v1"",""created"":""Wed, 11 Jul 2012 20:00:07 GMT""},{""version"":""v2"",""created"":""Tue, 18 Jun 2013 10:51:33 GMT""}]","2013-06-19"
"1207.2770","David Spiegel","David S. Spiegel, Nikku Madhusudhan","Jupiter will become a hot Jupiter: Consequences of Post-Main-Sequence
  Stellar Evolution on Gas Giant Planets","11 pages, 6 figures, accepted by ApJ",,"10.1088/0004-637X/756/2/132",,"astro-ph.EP","http://arxiv.org/licenses/nonexclusive-distrib/1.0/","  When the Sun ascends the red giant branch (RGB), its luminosity will increase
and all the planets will receive much greater irradiation than they do now.
Jupiter, in particular, might end up more highly irradiated than the hot
Neptune GJ 436b and, hence, could appropriately be termed a ""hot Jupiter."" When
their stars go through the RGB or asymptotic giant branch (AGB) stages, many of
the currently known Jupiter-mass planets in several-AU orbits will receive
levels of irradiation comparable to the hot Jupiters, which will transiently
increase their atmospheric temperatures to ~1000 K or more. Furthermore,
massive planets around post-main-sequence stars could accrete a non-negligible
amount of material from the enhanced stellar winds, thereby significantly
altering their atmospheric chemistry as well as causing a significant accretion
luminosity during the epochs of most intense stellar mass loss. Future
generations of infrared observatories might be able to probe the thermal and
chemical structure of such hot Jupiters' atmospheres. Finally, we argue that,
unlike their main-sequence analogs (whose zonal winds are thought to be
organized in only a few broad, planetary-scale jets), red-giant hot Jupiters
should have multiple, narrow jets of zonal winds and efficient day-night
redistribution.
","[{""version"":""v1"",""created"":""Wed, 11 Jul 2012 20:00:08 GMT""}]","2015-06-05"
"1207.2771","Kohei Kamada","Tetsutaro Higaki, Kohei Kamada, Fuminobu Takahashi","Higgs, Moduli Problem, Baryogenesis and Large Volume Compactifications","46 pages; v2: Comments and references added; v3: dilution factor in
  the published version corrected, conclusion unchanged","JHEP09(2012)043","10.1007/JHEP09(2012)043","RIKEN-MP-50; DESY 12-124; TU-915","hep-ph astro-ph.CO hep-th","http://arxiv.org/licenses/nonexclusive-distrib/1.0/","  We consider the cosmological moduli problem in the context of high-scale
supersymmetry breaking suggested by the recent discovery of the standard-model
like Higgs boson. In order to solve the notorious moduli-induced gravitino
problem, we focus on the LARGE volume scenario, in which the modulus decay into
gravitinos can be kinematically forbidden. We then consider the Affleck-Dine
mechanism with or without an enhanced coupling with the inflaton, taking
account of possible Q-ball formation. We show that the baryon asymmetry of the
present Universe can be generated by the Affleck-Dine mechanism in LARGE volume
scenario, solving the moduli and gravitino problems. We also find that the
overall volume modulus decays into a pair of the axionic superpartners, which
contribute to the extra relativistic degrees of freedom.
","[{""version"":""v1"",""created"":""Wed, 11 Jul 2012 20:00:46 GMT""},{""version"":""v2"",""created"":""Mon, 20 Aug 2012 08:14:36 GMT""},{""version"":""v3"",""created"":""Sun, 23 Sep 2012 14:29:26 GMT""}]","2015-06-05"
"1207.2772","Jorge Penarrubia","Jorge Pe\~narrubia, Andrew Pontzen, Matthew G. Walker, Sergey E.
  Koposov","The coupling between the core/cusp and missing satellite problems","Accepted for publication in ApJ Letters. Minor changes to match
  published version",,"10.1088/2041-8205/759/2/L42",,"astro-ph.GA","http://arxiv.org/licenses/nonexclusive-distrib/1.0/","  We calculate the energy that baryons must inject in cold dark matter (CDM)
haloes in order to remove centrally-divergent DM cusps on scales relevant to
observations of dwarf spheroidal galaxies (dSphs). We estimate that the CDM
haloes often associated with the Milky Way's dSphs (M_vir/M_\odot \sim
10^{9-10}) require \Delta E/erg \sim 10^{53-55} in order to form cores on
scales comparable to the luminous size of these galaxies. While supernova type
II (SNeII) explosions can in principle generate this energy, the actual
contribution is limited by the low star formation efficiency implied by the
abundance of luminous satellites. Considering that CDM's well-known `core/cusp'
and `missing satellite' problems place opposing demands on star formation
efficiencies, existing observational evidences for large cores in the most
luminous dSphs require that CDM models invoke some combination of the
following: (i) efficient (of order unity) coupling of SNeII energy into dark
matter particles, (ii) star formation histories peaking at unexpectedly high
redshifts (z>6), (iii) a top-heavy stellar IMF, and/or (iv) substantial
satellite disruption or other stochastic effects to ease the substructure
abundance constraints. Our models show that the tension between CDM problems on
small scales would increase if cored DM profiles were to be found in fainter
dwarves.
","[{""version"":""v1"",""created"":""Wed, 11 Jul 2012 20:01:52 GMT""},{""version"":""v2"",""created"":""Wed, 19 Sep 2012 17:08:09 GMT""}]","2015-06-05"
"1207.2773","Philip Hackney","Philip Hackney and Marcy Robertson","On the category of props",,"Appl. Categ. Structures 23 (2015), no. 4, 543-573","10.1007/s10485-014-9369-4",,"math.CT math.AT","http://arxiv.org/licenses/nonexclusive-distrib/1.0/","  The category of (colored) props is an enhancement of the category of colored
operads, and thus of the category of small categories. The titular category has
nice formal properties: it is bicomplete and is a symmetric monoidal category,
with monoidal product closely related to the Boardman-Vogt tensor product of
operads. Tools developed in this article, which is the first part of a larger
work, include a generalized version of multilinearity of functors, a free prop
construction defined on certain ""generalized graphs"", and the relationship
between the category of props and the categories of permutative categories and
of operads.
","[{""version"":""v1"",""created"":""Wed, 11 Jul 2012 20:06:15 GMT""},{""version"":""v2"",""created"":""Tue, 28 Jan 2014 18:13:04 GMT""}]","2017-01-03"
"1207.2774","Mansi Dhuria","Mansi Dhuria, Aalok Misra","(N)LSP Decays and Gravitino Dark Matter Relic Abundance in Big Divisor
  (nearly) SLagy D3/D7 mu-Split SUSY","v3: 1+109 pages, LaTeX; 31 Figures and 2 Tables, minor corrections
  and changes in slepton annihilation c.s. in subsection 5.2, no changes in
  overall result","Nucl.Phys.B867:636-748,2013","10.1016/j.nuclphysb.2012.10.009",,"hep-ph hep-th","http://arxiv.org/licenses/nonexclusive-distrib/1.0/","  Using the (nearly) Ricci-flat Swiss-Cheese metric of [1], in the context of a
mobile space-time filling D3-brane restricted to a nearly special Lagrangian
sub-manifold (in the large volume limit, the pull-back of the Kaehler form
close to zero and the real part of the pull-back of e^{-i theta},theta=pi/2
times the nowhere-vanishing holomorphic three-form providing the volume form on
the three-cycle) of the ""big"" divisor with (fluxed stacks of) space-time
filling D7-branes also wrapping the ""big"" divisor (corresponding to a local
minimum), we provide an explicit identification of the electron and the
u-quark, as well as their SU(2)_L-singlet cousins, with fermionic
super-partners of four Wilson line moduli; their superpartners turn out to be
very heavy, the Higgsino-mass parameter turns out to be large, one obtains one
light (with a mass of 125 GeV) and one heavy Higgs and the gluino is long lived
(from a collider point of view) providing a possible realization of ""mu-Split
Supersymmetry"". By explicitly calculating the lifetimes of decays of the
co-NLSPs - the first generation squark/slepton and a neutralino - to the LSP -
the gravitino - as well as gravitino decays, we verify that BBN constraints
relevant to the former as well as the requirement of the latter to be (more
than) the age of the universe, are satisfied. For the purpose of calculation of
the gravitino relic abundance in terms of the neutralino/slepton relic
abundance, we evaluate the latter by evaluating the netralino/slepton
(co-)annihilation cross sections and hence show that the former satisfies the
requirement for a Dark Matter candidate.
","[{""version"":""v1"",""created"":""Wed, 11 Jul 2012 20:18:09 GMT""},{""version"":""v2"",""created"":""Mon, 15 Oct 2012 13:08:40 GMT""},{""version"":""v3"",""created"":""Sat, 24 Aug 2013 07:22:35 GMT""}]","2015-06-05"
"1207.2775","Paola Gori-Giorgi","Francesc Malet and Paola Gori-Giorgi","Strong correlation in Kohn-Sham density functional theory","5 pages, 4 figures; new version largely rewritten to clarify many
  points, and with one new figure showing the exchange-correlation potentials.
  Final version accepted in Phys. Rev. Lett","Phys. Rev. Lett. 109, 246402 (2012)","10.1103/PhysRevLett.109.246402",,"cond-mat.str-el physics.chem-ph","http://arxiv.org/licenses/nonexclusive-distrib/1.0/","  We use the exact strong-interaction limit of the Hohenberg-Kohn energy
density functional to approximate the exchange-correlation energy of the
restricted Kohn-Sham scheme. Our approximation corresponds to a highly
non-local density functional whose functional derivative can be easily
constructed, thus transforming exactly, in a physically transparent way, an
important part of the electron-electron interaction into an effective local
one-body potential. We test our approach on quasi-one-dimensional systems,
showing that it captures essential features of strong correlation that
restricted Kohn-Sham calculations using the currently available approximations
cannot describe.
","[{""version"":""v1"",""created"":""Wed, 11 Jul 2012 20:18:13 GMT""},{""version"":""v2"",""created"":""Wed, 18 Jul 2012 13:02:33 GMT""},{""version"":""v3"",""created"":""Sat, 22 Sep 2012 13:36:56 GMT""},{""version"":""v4"",""created"":""Tue, 13 Nov 2012 09:05:13 GMT""}]","2012-12-12"
"1207.2776","Emil Bj\""ornson","Emil Bj\""ornson, Marios Kountouris, Mats Bengtsson, Bj\""orn Ottersten","Receive Combining vs. Multi-Stream Multiplexing in Downlink Systems with
  Multi-Antenna Users","Published in IEEE Transactions on Signal Processing, 16 pages, 11
  figures. The results can be reproduced using the following Matlab code:
  https://github.com/emilbjornson/one-or-multiple-streams","IEEE Transactions on Signal Processing, vol. 61, no. 13, pp.
  3431-3446, July 2013","10.1109/TSP.2013.2260331",,"cs.IT math.IT","http://arxiv.org/licenses/nonexclusive-distrib/1.0/","  In downlink multi-antenna systems with many users, the multiplexing gain is
strictly limited by the number of transmit antennas $N$ and the use of these
antennas. Assuming that the total number of receive antennas at the
multi-antenna users is much larger than $N$, the maximal multiplexing gain can
be achieved with many different transmission/reception strategies. For example,
the excess number of receive antennas can be utilized to schedule users with
effective channels that are near-orthogonal, for multi-stream multiplexing to
users with well-conditioned channels, and/or to enable interference-aware
receive combining. In this paper, we try to answer the question if the $N$ data
streams should be divided among few users (many streams per user) or many users
(few streams per user, enabling receive combining). Analytic results are
derived to show how user selection, spatial correlation, heterogeneous user
conditions, and imperfect channel acquisition (quantization or estimation
errors) affect the performance when sending the maximal number of streams or
one stream per scheduled user---the two extremes in data stream allocation.
  While contradicting observations on this topic have been reported in prior
works, we show that selecting many users and allocating one stream per user
(i.e., exploiting receive combining) is the best candidate under realistic
conditions. This is explained by the provably stronger resilience towards
spatial correlation and the larger benefit from multi-user diversity. This
fundamental result has positive implications for the design of downlink systems
as it reduces the hardware requirements at the user devices and simplifies the
throughput optimization.
","[{""version"":""v1"",""created"":""Wed, 11 Jul 2012 20:19:16 GMT""},{""version"":""v2"",""created"":""Tue, 25 Jun 2013 18:53:46 GMT""},{""version"":""v3"",""created"":""Thu, 24 Jul 2014 09:09:51 GMT""}]","2014-07-25"
"1207.2777","Joannah L. Hinz","J. L. Hinz, C. W. Engelbracht, R. Skibba, A. Crocker, J. Donovan
  Meyer, K. Sandstrom, F. Walter, E. Montiel, B. D. Johnson, L. Hunt, G.
  Aniano, L. Armus, D. Calzetti, D. A. Dale, B. Draine, M. Galametz, B. Groves,
  R. C. Kennicutt, S. E. Meidt, E. J. Murphy, F. Tabatabaei","Cool Dust in the Outer Ring of NGC 1291","Accepted to ApJ, 9 pages, 6 figures",,"10.1088/0004-637X/756/1/75",,"astro-ph.CO","http://arxiv.org/licenses/nonexclusive-distrib/1.0/","  We examine Herschel Space Observatory images of one nearby prototypical outer
ring galaxy, NGC 1291, and show that the ring becomes more prominent at
wavelengths longer than 160um. The mass of cool dust in the ring dominates the
total dust mass of the galaxy, accounting for at least 70% of it. The
temperature of the emitting dust in the ring (T=19.5+/-0.3K) is cooler than
that of the inner galaxy (T=25.7+/-0.7K). We discuss several explanations for
the difference in dust temperature, including age and density differences in
the stellar populations of the ring versus the bulge.
","[{""version"":""v1"",""created"":""Wed, 11 Jul 2012 20:19:58 GMT""}]","2015-06-05"
"1207.2778","Carlos Meni\~no Coton","Carlos Meni\~no Cot\'on","Tangential category and critical point theory","10 pages",,,,"math.DG math.FA","http://arxiv.org/licenses/nonexclusive-distrib/1.0/","  Classical Ljusternik-Schnirelmann category is upper bounded by the number of
critical points of any bounded from below differentiable functions of
Palais-Smale type. Here we achieve an adaptation of this result for the
tangential category of foliations. We introduce a weaker type of Palais-Smale
function, obtaining a slight improvement in the classical theorem of critical
points.
","[{""version"":""v1"",""created"":""Wed, 11 Jul 2012 20:26:34 GMT""}]","2016-11-26"
"1207.2779","Daniel Green","Siavosh R. Behbahani and Daniel Green","Collective Symmetry Breaking and Resonant Non-Gaussianity","19 pages, 3 figures; v2: improved appendix",,"10.1088/1475-7516/2012/11/056",,"hep-th astro-ph.CO hep-ph","http://arxiv.org/licenses/nonexclusive-distrib/1.0/","  We study inflationary models that produce a nearly scale-invariant power
spectrum while breaking scale invariance significantly in the bispectrum. Under
most circumstances, such models are finely-tuned, as radiative corrections
generically induce a larger signal in the power spectrum. However, when scale
invariance is broken collectively (i.e., it requires more than one coupling to
break the symmetry), these radiative corrections may be suppressed. We
illustrate the features and limitations of collective symmetry breaking in the
context of resonant non-gaussianity. We discuss two examples where oscillatory
features can arise predominantly in the bispectrum.
","[{""version"":""v1"",""created"":""Wed, 11 Jul 2012 20:27:07 GMT""},{""version"":""v2"",""created"":""Wed, 5 Sep 2012 01:55:39 GMT""}]","2015-06-05"
"1207.2780","Markus Aschwanden","Markus J. Aschwanden","A Nonlinear Force-Free Magnetic Field Approximation Suitable for Fast
  Forward-Fitting to Coronal Loops. I. Theory","Solar Physics (in press), 26 pages, 11 figures","Solar Physics (2012) VOo. 287, 323-344","10.1007/s11207-012-0069-7",,"astro-ph.SR","http://arxiv.org/licenses/nonexclusive-distrib/1.0/","  We derive an analytical approximation of nonlinear force-free magnetic field
solutions (NLFFF) that can efficiently be used for fast forward-fitting to
solar magnetic data, constrained either by observed line-of-sight magnetograms
and stereoscopically triangulated coronal loops, or by 3D vector-magnetograph
data. The derived NLFFF solutions provide the magnetic field components
$B_x({\bf x})$, $B_y({\bf x})$, $B_z({\bf x})$, the force-free parameter
$\alpha({\bf x})$, the electric current density ${\bf j}({\bf x})$, and are
accurate to second-order (of the nonlinear force-free $\alpha$-parameter). The
explicit expressions of a force-free field can easily be applied to modeling or
forward-fitting of many coronal phenomena.
","[{""version"":""v1"",""created"":""Wed, 11 Jul 2012 20:29:33 GMT""}]","2014-03-27"
"1207.2781","Rohit  Deshpande","R. Deshpande, E. L. Mart\'in, M. M. Montgomery, M. R. Zapatero Osorio,
  F. Rodler, C. del Burgo, N. Phan Bao, Y. Lyubchik, R. Tata, H. Bouy, Y.
  Pavlenko","Intermediate Resolution Near-Infrared Spectroscopy of 36 late-M Dwarfs","accepted in Astronomical Journal. 30 pages, 7 tables, and 7 figures",,"10.1088/0004-6256/144/4/99",,"astro-ph.SR","http://arxiv.org/licenses/nonexclusive-distrib/1.0/","  We present observations of 36 late-M dwarfs obtained with the KeckII/NIRSPEC
in the J-band at a resolution of \sim20,000. We have measured projected
rotational velocities, absolute radial velocities, and pseudo-equivalent widths
of atomic lines. 12 of our targets did not have previous measurements in the
literature.
  For the other 24 targets, we confirm previously reported measurements. We
find that 13 stars from our sample have vsini below our measurement threshold
(12 km/s) whereas four of our targets are fast rotators (vsini > 30 km/s). As
fast rotation causes spectral features to be washed out, stars with low
projected rotational velocities are sought for radial velocity surveys.
  At our intermediate spectral resolution we have confirmed the identification
of neutral atomic lines reported in Mclean et al. 2007. We also calculated
pseudo-equivalent widths (p-EW) of 12 atomic lines. Our results confirm that
the p-EW of K I lines are strongly dependent on spectral types. We observe that
the p-EW of Fe I and Mn I lines remain fairly constant with later spectral
type. We suggest that those lines are particularly suitable for deriving
metallicities for late-M dwarfs.
","[{""version"":""v1"",""created"":""Wed, 11 Jul 2012 20:33:16 GMT""}]","2015-06-05"
