"1207.3473","Gang Chen","Yun Zhang and Gang Chen","Ward Identity Implies Recursion Relation at Tree and Loop Level","23 pages, 10 figures",,,,"hep-th","http://arxiv.org/licenses/nonexclusive-distrib/1.0/","  In this article, we use Ward identity to calculate tree and one loop level
off shell amplitudes in pure Yang-Mills theory with a pair of external lines
complexified. We explicitly prove Ward identity at tree and one loop level
using Feynman rules, and then give recursion relations for the off shell
amplitudes. We find that the cancellation details in the proof of Ward identity
simplifies our derivation of the recursion relations. Then we calculate three
and four point one loop off shell amplitudes as examples of our method.
","[{""version"":""v1"",""created"":""Sun, 15 Jul 2012 02:38:29 GMT""},{""version"":""v2"",""created"":""Wed, 29 Aug 2012 12:06:52 GMT""},{""version"":""v3"",""created"":""Sat, 9 Feb 2013 18:47:20 GMT""}]","2015-03-20"
"1207.3474","Subhasish Chatterjee","Subhasish Chatterjee, Markrete Krikorian, Harry D. Gafney, Bonnie
  Gersten","Synthesis and self-assembly of lipid (DMPC)-conjugated gold
  nanoparticles","7 pages, 5 Figures","Mater Res Soc Symp Proc 1061, 1061-MM09-08(2007)","10.1557/PROC-1061-MM09-08",,"cond-mat.mtrl-sci cond-mat.soft physics.bio-ph physics.chem-ph","http://arxiv.org/licenses/nonexclusive-distrib/1.0/","  Bio-conjugated nanomaterials play a promising role in the development of
novel supramolecular structures, molecular machines, and biosensing devices. In
this study, lipid-conjugated gold nanoparticles were synthesized and allowed to
form a self-assembled monolayer structure. The nanoparticles were prepared by a
phase transfer method, which involved the reduction of potassium
tetrachloroaurate (III) by sodium citrate in an aqueous solution and the
simultaneous transfer of the reduced species to an organic medium containing
DMPC (1,2-dimyristoyl-sn-glycero-3-phosphocholine). The gold nanoparticles were
characterized using UV-Vis spectroscopy and dynamic light scattering (DLS)
particle-size analysis. In addition, the resulting nanoparticles were examined
using transmission electron microscopy (TEM). The Langmuir-Blodgett (LB)
technique was used to assemble the DMPC-capped nanoparticles onto a water
subphase at room temperature. The measurement of the compression isotherm
confirmed the assemblage of lipid capped gold nanoparticles. This method of
synthesis of ordered structures utilizing molecular interactions of lipids will
be useful in developing novel metamaterials and nanocircuits.
","[{""version"":""v1"",""created"":""Sun, 15 Jul 2012 03:19:30 GMT""},{""version"":""v2"",""created"":""Wed, 18 Jul 2012 14:57:33 GMT""}]","2012-07-24"
"1207.3475","Zhongzhi Zhang","Bin Wu, Yuan Lin, Zhongzhi Zhang, and Guanrong Chen","Trapping in dendrimers and regular hyperbranched polymers","Definitive version accepted for publication in The Journal of
  Chemical Physics","J. Chem. Phys. 137, 044903 (2012)","10.1063/1.4737635",,"physics.chem-ph","http://arxiv.org/licenses/nonexclusive-distrib/1.0/","  Dendrimers and regular hyperbranched polymers are two classic families of
macromolecules, which can be modeled by Cayley trees and Vicsek fractals,
respectively. In this paper, we study the trapping problem in Cayley trees and
Vicsek fractals with different underlying geometries, focusing on a particular
case with a perfect trap located at the central node. For both networks, we
derive the exact analytic formulas in terms of the network size for the average
trapping time (ATT)---the average of node-to-trap mean first-passage time over
the whole networks. The obtained closed-form solutions show that for both
Cayley trees and Vicsek fractals, the ATT display quite different scalings with
various system sizes, which implies that the underlying structure plays a key
role on the efficiency of trapping in polymer networks. Moreover, the
dissimilar scalings of ATT may allow to differentiate readily between
dendrimers and hyperbranched polymers.
","[{""version"":""v1"",""created"":""Sun, 15 Jul 2012 03:36:05 GMT""}]","2012-08-02"
"1207.3476","Constanze Liaw","Constanze Liaw","Conductance for the two dimensional discrete random Schroedinger
  operator with small disorder","5 pages, 2 figures",,,,"math-ph math.MP","http://arxiv.org/licenses/nonexclusive-distrib/1.0/","  As part of condensed-matter physics, the field of Anderson localization
concerns the study of conductance of electrons in a random medium. We summarize
and explain the results obtained in ""A new numerical approach to Anderson
(de)localization"" from a physics perspective. Further, we discover a
relationship with the so-called Thouless criterion - a dimensionless scaling
parameter often used as the sole indicator whether or not the system exhibits
Anderson localization.
","[{""version"":""v1"",""created"":""Sun, 15 Jul 2012 03:56:39 GMT""}]","2012-07-17"
"1207.3477","HongWei Ke","Hong-Wei Ke, Xu-Hao Yuan, Xue-Qian Li, Zheng-Tao Wei and Yan-Xi Zhang","$\Sigma_{b}\to\Sigma_c$ and $\Omega_b\to\Omega_c$ weak decays in the
  light-front quark model","17 pages 3 figures. To avoid overlap with our previous work, we have
  deleted most repeated and unnecessary parts. The whole version is re-written","Physical Review D 86, 114005 (2012)","10.1103/PhysRevD.86.114005",,"hep-ph hep-ex","http://arxiv.org/licenses/nonexclusive-distrib/1.0/","  The successful operation of LHC provides a great opportunity to study the
processes where heavy baryons are involved. {In this work we mainly study} the
weak transitions of $\Sigma_b\to \Sigma_c$. Assuming the reasonable
quark-diquark structure where the two light quarks constitute an axial vector,
we calculate the widths of semi-leptonic decay $\Sigma_{b}\to\Sigma_c e\nu_e$
and non-leptonic decay modes $\Sigma_{b}\to\Sigma_c +M$ (light mesons) in terms
of the light front quark model. We first construct the vertex function for the
concerned baryons and then deduce the form factors which are related to two
Isgur-Wise functions for the $\Sigma_{b}\to\Sigma_c$ transition under the heavy
quark limit. Our numerical results indicate that $\Gamma(\Sigma_{b}\to\Sigma_c
e\nu_e)$ is about $1.38\times10^{10}{\rm s}^{-1}$ and
$\Gamma(\Sigma_{b}\to\Sigma_c +M)$ is slightly below $1\times10^{10}{\rm
s}^{-1}$ which may be accessed at the LHCb detector. By the flavor SU(3)
symmetry we estimate the rates of $\Omega_b\to\Omega_c$. We suggest to measure
weak decays of $\Omega_b\to\Omega_c$, because $\Omega_b$ does not decay via
strong interaction, the advantage is obvious.
","[{""version"":""v1"",""created"":""Sun, 15 Jul 2012 04:44:16 GMT""},{""version"":""v2"",""created"":""Tue, 7 Aug 2012 13:31:24 GMT""}]","2012-12-05"
"1207.3478","Paolo Castorina","Paolo Castorina","Holographic Bound in Quantum Field Energy Density and Cosmological
  Constant","Submitted to PRD, more accurate references","Journal of Modern Physics 4,807 (2013)","10.4236/jmp.2013.46110",,"hep-th gr-qc","http://arxiv.org/licenses/nonexclusive-distrib/1.0/","  The cosmological constant problem is reanalyzed by imposing the limitation of
the number of degrees of freedom (d.o.f.) due to entropy bounds directly in the
calculation of the energy density of a field theory. It is shown that if a
quantum field theory has to be consistent with gravity and holography, i.e.
with an upper limit of storing information in a given area, the ultraviolet
momentum cut-off is not the Planck mass, M_p, as naively expected, but
M_p/N_U^(1/4) where N_U is the number of d.o.f. of the universe. The energy
density evaluation turns out completely consistent with Bousso's bound on the
cosmological constant value. The scale M_p/N_U^(1/4), that in the ""fat
graviton"" theory corresponds to the graviton size, originates by a selfsimilar
rearrangement of the elementary d.o.f. at different scales that can be seen as
an infrared-ultraviolet connection.
","[{""version"":""v1"",""created"":""Sun, 15 Jul 2012 06:22:31 GMT""},{""version"":""v2"",""created"":""Sat, 21 Jul 2012 18:37:10 GMT""}]","2015-06-05"
"1207.3479","Ferydon Babaei","A. Azariana, F. Babaei","Surface plasmon resonance of Cu nanowires in polycarbonate template","10 figures",,,,"cond-mat.mes-hall cond-mat.mtrl-sci","http://arxiv.org/licenses/nonexclusive-distrib/1.0/","  The Cu nanowires were electrodeposited in polycarbonate track-etched (PCT)
membrane. SEM, TEM and XPS techniques were used to characterize the morphology,
structure and size of nanowires as well as chemical Composition. The absorption
spectrum of copper nanowires embedded in PCT was measured and calculated for
different incident angles and wavelengths. Our results showed that there is a
broad peak due to excitation surface plasmon at {\theta} = 70\degree for
wavelength {\lambda}= 730 nm. We applied the transfer matrix method and
Bruggeman homogenization formalism for optical modeling. The results of
absorption spectra showed that exist good agreement between the experimental
and our used model. The results of this work may be useful in study of surface
plasmon resonance of copper nanowires.
","[{""version"":""v1"",""created"":""Sun, 15 Jul 2012 06:30:18 GMT""}]","2012-07-17"
"1207.3480","Alexandru Ghitza","Alexandru Ghitza and Angus McAndrew","Experimental evidence for Maeda's conjecture on modular forms","14 pages, 1 figure",,,,"math.NT","http://arxiv.org/licenses/nonexclusive-distrib/1.0/","  We describe a computational approach to the verification of Maeda's
conjecture for the Hecke operator T2 on the space of cusp forms of level one.
We provide experimental evidence for all weights less than 12000, as well as
some applications of these results. The algorithm was implemented using the
mathematical software Sage, and the code and resulting data were made freely
available.
","[{""version"":""v1"",""created"":""Sun, 15 Jul 2012 07:14:51 GMT""},{""version"":""v2"",""created"":""Sat, 3 Nov 2012 12:51:58 GMT""}]","2012-11-06"
"1207.3481","Katanaev","M. O. Katanaev","Point massive particle in General Relativity","15 pages, references added, 1 figure","Gen. Rel. Grav. 45 (2013) 1861-1875","10.1007/s10714-013-1564-3",,"gr-qc","http://arxiv.org/licenses/nonexclusive-distrib/1.0/","  It is well known that the Schwarzschild solution describes the gravitational
field outside compact spherically symmetric mass distribution in General
Relativity. In particular, it describes the gravitational field outside a point
particle. Nevertheless, what is the exact solution of Einstein's equations with
$\delta$-type source corresponding to a point particle is not known. In the
present paper, we prove that the Schwarzschild solution in isotropic
coordinates is the asymptotically flat static spherically symmetric solution of
Einstein's equations with $\delta$-type energy-momentum tensor corresponding to
a point particle. Solution of Einstein's equations is understood in the
generalized sense after integration with a test function. Metric components are
locally integrable functions for which nonlinear Einstein's equations are
mathematically defined. The Schwarzschild solution in isotropic coordinates is
locally isometric to the Schwarzschild solution in Schwarzschild coordinates
but differs essentially globally. It is topologically trivial neglecting the
world line of a point particle. Gravity attraction at large distances is
replaced by repulsion at the particle neighbourhood.
","[{""version"":""v1"",""created"":""Sun, 15 Jul 2012 07:49:42 GMT""},{""version"":""v2"",""created"":""Mon, 6 Aug 2012 16:43:43 GMT""},{""version"":""v3"",""created"":""Fri, 7 Dec 2012 12:18:31 GMT""},{""version"":""v4"",""created"":""Tue, 3 Sep 2013 06:54:56 GMT""}]","2013-09-04"
"1207.3482","Saperstein Eduard","S. V. Tolokonnikov, S. Kamerdzhiev, S. Krewald, E. E. Saperstein, and
  D. Voitenkov","The first quadrupole excitations in spherical nuclei and nuclear pairing","Presented at International Conference on Nuclear Structure and
  Related Topics, Dubna, July 2 - 7, 2012",,"10.1051/epjconf/20123804002",,"nucl-th nucl-ex","http://arxiv.org/licenses/nonexclusive-distrib/1.0/","  Excitation energies and transition probabilities of the first 2+ excitations
in even lead, tin and nickel isotopes are calculated within the self-consistent
Theory of Finite Fermi Systems based on the Energy Density Functional by Fayans
et al. A reasonable agreement with available experimental data is obtained. The
effect of the density dependence of the effective pairing interaction is
analyzed in detail by comparing results obtained with volume and surface
pairing. The effect is found to be noticeable, especially for the 2+ energies
which are systematically higher at 200-300 keV for the volume paring as
compared with the surface pairing case, the latter being in a better agreement
with the data.
","[{""version"":""v1"",""created"":""Sun, 15 Jul 2012 07:53:50 GMT""}]","2015-06-05"
"1207.3483","Angelo B. Mingarelli","Mervis Kikonko and Angelo B. Mingarelli","On non-definite Sturm-Liouville problems with two turning points","13 pages, To appear in Applied Math. and Computation",,,,"math.CA","http://arxiv.org/licenses/nonexclusive-distrib/1.0/","  This is an inaugural study of the Dirichlet problem associated with a regular
non-definite Sturm-Liouville equation in the case of two turning points. We
give a priori lower bounds on the Richardson numbers associated with this
problem thereby complementing pioneering results by Atkinson and Jabon (1984)
in the one turning point case
","[{""version"":""v1"",""created"":""Sun, 15 Jul 2012 08:01:20 GMT""},{""version"":""v2"",""created"":""Tue, 5 Mar 2013 13:55:27 GMT""}]","2013-03-06"
"1207.3484","Haiping Fang","Haiping Fang and Rongzheng Wan","Demonstration of the existence of biased transportation in the
  asymmetric nanoscale systems induced by thermal noise from a simple
  mathematics perspective","4 pages without any figure",,,,"cond-mat.stat-mech physics.class-ph","http://arxiv.org/licenses/nonexclusive-distrib/1.0/","  The existence of net flux across the nanochannels under the asymmetrical
static electric fields obtained at room temperature from molecular dynamics
(MD) simulations [Nat. Nanotechnol. 2, 709 (2007); Phys. Rev. Lett. 101, 064502
(2008)] has been extensively queried on whether the second law of the
thermodynamics holds, and whether the observations result from the numerical
artifacts. Here we use a simple mathematics to demonstrate the existence of
biased-directional transportation (net flux across the channel) in those
asymmetrical nanoscale systems at room temperature, at least in the MD
simulations. We find that the key to the existence of biased-directional
transportation is that the thermal noise is not white anymore at nanoscale; it
includes the color noise with an autocorrelation time length (for MD
simulation, this length is of ~10 ps).
","[{""version"":""v1"",""created"":""Sun, 15 Jul 2012 08:25:12 GMT""}]","2012-07-17"
"1207.3485","EPTCS","Sebastian Bauer (Ludwig-Maximilians-Universit\""at M\""unchen, Germany),
  Jean-Baptiste Raclet (University Paul Sabatier-Toulouse III, France)","Proceedings Fourth Workshop on Foundations of Interface Technologies",,"EPTCS 87, 2012","10.4204/EPTCS.87",,"cs.LO cs.SE","http://arxiv.org/licenses/nonexclusive-distrib/1.0/","  This volume contains the proceedings of the 4th workshop on Foundations of
Interface Technologies (FIT 2012) which was collocated with ETAPS 2012 in
Tallinn, Estonia, and took place on March 25, 2012. The aim of this workshop is
to bring together researchers who are interested in the formal underpinnings of
interface technologies.
","[{""version"":""v1"",""created"":""Sun, 15 Jul 2012 09:03:08 GMT""}]","2012-07-17"
"1207.3486","Elia Razzoli","E. Razzoli, G. Drachuck, A. Keren, M. Radovic, N. C. Plumb, J. Chang,
  J. Mesot, and M. Shi","Evolution from a nodeless gap to d(x2-y2) form in underdoped
  La(2-x)SrxCuO4","5 pages, 4 figures","Phys. Rev. Lett. 110, 047004 (2013)","10.1103/PhysRevLett.110.047004",,"cond-mat.supr-con cond-mat.str-el","http://arxiv.org/licenses/nonexclusive-distrib/1.0/","  Using angle-resolved photoemission (ARPES), it is revealed that the
low-energy electronic excitation spectra of highly underdoped superconducting
and non-superconducting La(2-x)SrxCuO4 cuprates are gapped along the entire
underlying Fermi surface at low temperatures. We show how the gap function
evolves to a d(x2-y2) form as increasing temperature or doping, consistent with
the vast majority of ARPES studies of cuprates. Our results provide essential
information for uncovering the symmetry of the order parameter(s) in strongly
underdoped cuprates, which is a prerequisite for understanding the pairing
mechanism and how superconductivity emerges from a Mott insulator.
","[{""version"":""v1"",""created"":""Sun, 15 Jul 2012 09:12:02 GMT""}]","2013-01-29"
"1207.3487","Zur Izhakian","Zur Izhakian, Manfred Knebusch, Louis Rowen","Categorical notions of layered tropical algebra and geometry","34 pages",,,,"math.RA math.CT","http://arxiv.org/licenses/nonexclusive-distrib/1.0/","  This paper supplements [17], showing that categorically the layered theory is
the same as the theory of ordered monoids (e.g. the max-plus algebra) used in
tropical mathematics. A layered theory is developed in the context of
categories, together with a ""tropicalization functor"" which permits us to pass
from usual algebraic geometry to the tropical world. We consider tropical
varieties from this categorical viewpoint, with emphasis on polynomial
functions and their roots.
","[{""version"":""v1"",""created"":""Sun, 15 Jul 2012 09:48:31 GMT""}]","2012-07-17"
"1207.3488","Zur Izhakian","Zur Izhakian, Manfred Knebusch, Louis Rowen","Categories of layered semirings","23 pages",,,,"math.RA math.CT","http://arxiv.org/licenses/nonexclusive-distrib/1.0/","  We generalize the constructions of [17,19] to layered semirings, in order to
enrich the structure and provide finite examples for applications in arithmetic
(including finite examples). The layered category theory of [19] is extended
accordingly, to cover noncancellative monoids.
","[{""version"":""v1"",""created"":""Sun, 15 Jul 2012 09:54:13 GMT""}]","2012-07-17"
"1207.3489","Julie Grollier","Julie Grollier, Andre Chanthbouala, Rie Matsumoto, Abdelmadjid Anane,
  Vincent Cros, Frederic Nguyen van Dau, Albert Fert","Magnetic domain wall motion by spin transfer",,"C. R. Physique 12 (2011) 309-317","10.1016/j.crhy.2011.03.007",,"cond-mat.mtrl-sci","http://arxiv.org/licenses/nonexclusive-distrib/1.0/","  The discovery that a spin polarized current can exert a large torque on a
ferromagnet through a transfusion of spin angular momentum, offers a new way to
control a magnetization by simple current injection, without the help of an
applied external field. Spin transfer can be used to induce magnetization
reversals and oscillations, or to control the position of a magnetic domain
wall. In this review, we focus on this last mechanism, which is today the
subject of an extensive research, both because the microscopic details for its
origin are still debated, but also because promising applications are at stake
for non-volatile magnetic memories.
","[{""version"":""v1"",""created"":""Sun, 15 Jul 2012 10:23:33 GMT""}]","2015-06-05"
"1207.3490","Majid Hashemi","Majid Hashemi","Enhancement of Charged Higgs Production in Association With W at Muon
  Colliders in General Two Higgs Doublet Models","15 pages, 9 figures","Int. J. M. Phys. A 27 (2012) 1250165","10.1142/S0217751X12501655",,"hep-ph","http://arxiv.org/licenses/nonexclusive-distrib/1.0/","  The charged Higgs associated production with a W boson has a smooth cross
section as a function of the charged Higgs mass at muon colliders. The cross
section in Minimal Supersymmetric Standard Model is about 25fb in the range 200
GeV < mH < 400 GeV with tanbeta = 50. This is much larger than the
corresponding cross section at an e+e- collider which reaches a fraction of
femtobarn. The observability of this channel at a muon collider has been
recently studied in an earlier work leading to the result that with 1 ab-1, a
5sigma signal can be observed throughout the aforementioned mass range. In this
paper, results of a study based on a general two Higgs doublet model (type II
and III) are presented and the cross section of this process in the most
sensitive parameter space is evaluated. It is concluded that the cross section
of this process increases with increasing neutral Higgs boson masses involved
in the s-channel diagram and can be as large as several picobarn with tanbeta =
50. The region of ""physical Higgs boson mass"" parameter space which could lead
to a 5 sigma signal at 50fb-1 is specified.
","[{""version"":""v1"",""created"":""Sun, 15 Jul 2012 10:33:07 GMT""},{""version"":""v2"",""created"":""Tue, 17 Jul 2012 10:19:23 GMT""},{""version"":""v3"",""created"":""Sun, 23 Sep 2012 10:01:02 GMT""},{""version"":""v4"",""created"":""Sun, 11 Jan 2015 09:44:54 GMT""}]","2015-01-13"
"1207.3491","Jovo Vranjes","J. Vranjes, B. P. Pandey, S. Poedts","On quantum plasma: a plea for a common sense","EPL, to be published 2012","EPL 99, 25001 (2012)","10.1209/0295-5075/99/25001",,"physics.plasm-ph","http://arxiv.org/licenses/nonexclusive-distrib/1.0/","  The quantum plasma theory has flourished in the past few years without much
regard to the physical validity of the formulation or its connection to any
real physical system. It is argued here that there is a very limited physical
ground for the application of such a theory.
","[{""version"":""v1"",""created"":""Sun, 15 Jul 2012 11:09:48 GMT""}]","2012-07-27"
"1207.3492","Sanjib Kumar Agarwalla","Sanjib Kumar Agarwalla, Francesco Lombardi, Tatsu Takeuchi","Constraining Non-Standard Interactions of the Neutrino with Borexino","21 pages, 16 pdf figures, 2 tables. Analysis updated including the
  uncertainty in sin^2\theta_{23}. Accepted in JHEP",,"10.1007/JHEP12(2012)079","EURONU-WP6-12-52, IFIC/12-49","hep-ph hep-ex","http://arxiv.org/licenses/nonexclusive-distrib/1.0/","  We use the Borexino 153.6 ton.year data to place constraints on non-standard
neutrino-electron interactions, taking into account the uncertainty in the 7Be
solar neutrino flux, and backgrounds due to 85Kr and 210Bi beta-decay. We find
that the bounds are comparable to existing bounds from all other experiments.
Further improvement can be expected in Phase II of Borexino due to the
reduction in the 85Kr background.
","[{""version"":""v1"",""created"":""Sun, 15 Jul 2012 11:14:19 GMT""},{""version"":""v2"",""created"":""Mon, 3 Dec 2012 21:44:15 GMT""}]","2015-06-05"
"1207.3493","Kuo-Chiang Tan","Kuo-Chiang Tan","Codes for Square-Tiled Surfaces",,,,,"math.DS","http://arxiv.org/licenses/nonexclusive-distrib/1.0/","  In this paper, we use permutation elements to record cylinder decompositions
of a square-tiled surface $X$. Collecting all such possible permutation
elements that record cylinder decompositions, we can enumerate the
$SL_2(\mathbb{Z})$ orbit of a given surface $X$ and give a method to determine
whether or not a matrix $A\in SL_2(\mathbb{Z})$ is the differential of an
affine diffeomorphism of $X$.
","[{""version"":""v1"",""created"":""Sun, 15 Jul 2012 11:19:54 GMT""}]","2012-07-17"
"1207.3494","Ilya Kapovich","Ilya Kapovich and Martin Lustig","Cannon-Thurston fibers for iwip automorphisms of $F_N$","final version; to appear in J. London Math. Soc.; 22 pages",,,,"math.GR math.GT","http://arxiv.org/licenses/nonexclusive-distrib/1.0/","  For any atoroidal iwip $\phi \in Out(F_N)$ the mapping torus group
$G_\phi=F_N\rtimes_\phi <t>e$ is hyperbolic, and the embedding $\iota: F_N
\overset{\lhd}{\longrightarrow} G_\phi$ induces a continuous, $F_N$-equivariant
and surjective {\em Cannon-Thurston map} $\hat \iota: \partial F_N \to \partial
G_\phi$.
  We prove that for any $\phi$ as above, the map $\hat \iota$ is finite-to-one
and that the preimage of every point of $\partial G_\phi$ has cardinality $\le
2N$.
  We also prove that every point $S\in \partial G_\phi$ with $\ge 3$ preimages
in $\partial F_N$ has the form $(wt^m)^\infty$ where $w\in F_N, m\ne 0$, and
that there are at most $4N-5$ distinct $F_N$-orbits of such {\em singular}
points in $\partial G_\phi$ (for the translation action of $F_N$ on $\partial
G_\phi$).
  By contrast, we show that for $k=1,2$ there are uncountably many points $S\in
\partial G_\phi$ (and thus uncountably many $F_N$-orbits of such $S$) with
exactly $k$ preimages in $\partial F_N$.
","[{""version"":""v1"",""created"":""Sun, 15 Jul 2012 11:29:32 GMT""},{""version"":""v2"",""created"":""Wed, 11 Dec 2013 09:10:37 GMT""},{""version"":""v3"",""created"":""Tue, 14 Oct 2014 20:13:33 GMT""}]","2014-10-16"
"1207.3495","Andrew Cohen","Andrew G. Cohen and Martin Schmaltz","New Charged Particles from Higgs Couplings","10 pages, 2 figures",,,,"hep-ph","http://arxiv.org/licenses/nonexclusive-distrib/1.0/","  The recently reported observation of a new particle with mass about 125 GeV
and couplings generally resembling those of the Standard Model Higgs boson
provides a potential probe of the physics of electroweak symmetry breaking.
Although the current data only provides hints, we suggest a particular
combination of Higgs couplings as an assay for new charged particles connected
with electroweak symmetry breaking, and construct a simple model with charge
5/3 quarks as a demonstration of its use.
","[{""version"":""v1"",""created"":""Sun, 15 Jul 2012 11:48:15 GMT""}]","2012-07-17"
