"1207.3496","Michal Macek","M. Macek and A. Leviatan","Regular and chaotic classical dynamics in the U(5)-SU(3) quantum phase
  transition of the IBM","4 pages, 2 figures, Proc. Beauty in Physics: Theory and Experiment,
  in honor of Francesco Iachello's 70th birthday, May 14-18, 2012, Cocoyoc,
  Mexico","AIP Conf. Proc. 1488: 441-444, 2012","10.1063/1.4759429",,"nucl-th nlin.CD quant-ph","http://arxiv.org/licenses/nonexclusive-distrib/1.0/","  We study the classical dynamics in a generic first-order quantum phase
transition between the U(5) and SU(3) limits of the interacting boson model.
The dynamics is chaotic, of H\'enon-Heiles type, in the spherical phase and is
regular, yet sensitive to local degeneracies, in the deformed phase. Both types
of dynamics persist in the coexistence region resulting in a divided phase
space.
","[{""version"":""v1"",""created"":""Sun, 15 Jul 2012 12:06:42 GMT""}]","2013-04-17"
"1207.3497","Yuji Tachikawa","Yuji Tachikawa","4d partition function on S^1 x S^3 and 2d Yang-Mills with nonzero area","10 pages. v2: additional references",,"10.1093/ptep/pts048","IPMU 12-0141; UT-12-24","hep-th","http://arxiv.org/licenses/nonexclusive-distrib/1.0/","  We argue that 6d N=(2,0) theory on S^1 x S^3 x C_2 reduces to the 2d
q-deformed Yang-Mills on C_2 at finite area, as a small extension to the result
of Gadde, Rastelli, Razamat and Yan. This is done by computing the partition
function on S^1 x S^3 of 4d N=2 supersymmetric non-linear sigma model on
T^*G_C, which gives the propagator of the 2d Yang-Mills.
","[{""version"":""v1"",""created"":""Sun, 15 Jul 2012 12:09:56 GMT""},{""version"":""v2"",""created"":""Mon, 23 Jul 2012 08:31:25 GMT""}]","2016-06-21"
"1207.3498","Alexey Kurnosenko","Alexey Kurnosenko","On tractrices of planar curves","16 pages, 13 figures",,,,"math.DG","http://arxiv.org/licenses/nonexclusive-distrib/1.0/","  Tractrices of planar curves, in particular, a family of tractrices of a
circle, are considered. Some new observations (including arc-length
parametrization, Chezaro equation) and corrected reference informations are
provided.
  The article is written in Russian.
","[{""version"":""v1"",""created"":""Sun, 15 Jul 2012 12:43:10 GMT""}]","2012-07-17"
"1207.3499","Riccardo Mannella Dr.","Riccardo Mannella and Paolo Rossi","On the time dependence of the $h$-index",,,,,"physics.soc-ph cs.DL","http://arxiv.org/licenses/nonexclusive-distrib/1.0/","  The time dependence of the $h$-index is analyzed by considering the average
behaviour of $h$ as a function of the academic age $A_A$ for about 1400 Italian
physicists, with career lengths spanning from 3 to 46 years. The individual
$h$-index is strongly correlated with the square root of the total citations
$N_C$: $h \approx 0.53 \sqrt{N_C}$. For academic ages ranging from 12 to 24
years, the distribution of the time scaled index $h/\sqrt{A_A}$ is
approximately time-independent and it is well described by the Gompertz
function. The time scaled index $h/\sqrt{A_A}$ has an average approximately
equal to 3.8 and a standard deviation approximately equal to 1.6. Finally, the
time scaled index $h/\sqrt{A_A}$ appears to be strongly correlated with the
contemporary $h$-index $h_c$.
","[{""version"":""v1"",""created"":""Sun, 15 Jul 2012 12:46:15 GMT""}]","2012-07-17"
"1207.3500","Arup Chattopadhyay","Arup Chattopadhyay and Kalyan B. Sinha","Third Order Trace Formula","26 pages",,,,"math.FA","http://arxiv.org/licenses/nonexclusive-distrib/1.0/","  In (J. Funct. Anal. 257, 1092-1132 (2009)), Dykema and Skripka showed the
existence of higher order spectral shift functions when the unperturbed
self-adjoint operator is bounded and the perturbations is Hilbert-Schmidt. In
this article, we give a different proof for the existence of spectral shift
function for the third order when the unperturbed operator is self-adjoint
(bounded or unbounded, but bounded below).
","[{""version"":""v1"",""created"":""Sun, 15 Jul 2012 12:46:22 GMT""}]","2012-07-17"
"1207.3501","Jens Eisert","L. Zhang, A. Datta, H. B. Coldenstrodt-Ronge, X.-M. Jin, J. Eisert, M.
  B. Plenio, I. A. Walmsley","Recursive quantum detector tomography","23 pages, 5 figures. Minor changes","New Journal of Physics 14, 115005 (2012)","10.1088/1367-2630/14/11/115005",,"quant-ph","http://arxiv.org/licenses/nonexclusive-distrib/1.0/","  Conventional tomographic techniques are becoming increasingly infeasible for
reconstructing the operators of quantum devices of growing sophistication. We
describe a novel tomographic procedure using coherent states which begins by
reconstructing the diagonals of the operator, and then each successive
off-diagonal in a recursive manner. Each recursion is considerably more
efficient than reconstructing the operator in its entirety, and each successive
recursion involves fewer parameters. We apply our technique to reconstruct the
positive-operator-valued measure (POVM) corresponding to a recently developed
coherent optical detector with phase sensitivity and number resolution. We
discuss the effect of various parameters on the reconstruction accuracy. The
results show the efficiency of the method and its robustness to experimental
noise.
","[{""version"":""v1"",""created"":""Sun, 15 Jul 2012 12:48:33 GMT""},{""version"":""v2"",""created"":""Thu, 19 Jul 2012 21:23:30 GMT""},{""version"":""v3"",""created"":""Tue, 4 Sep 2012 11:47:51 GMT""}]","2012-11-08"
"1207.3502","Patrick O. Glauner","Michael Galetzka, Patrick O. Glauner","A Simple and Correct Even-Odd Algorithm for the Point-in-Polygon Problem
  for Complex Polygons","Proceedings of the 12th International Joint Conference on Computer
  Vision, Imaging and Computer Graphics Theory and Applications (VISIGRAPP
  2017), Volume 1: GRAPP",,,,"cs.CG","http://arxiv.org/licenses/nonexclusive-distrib/1.0/","  Determining if a point is in a polygon or not is used by a lot of
applications in computer graphics, computer games and geoinformatics.
Implementing this check is error-prone since there are many special cases to be
considered. This holds true in particular for complex polygons whose edges
intersect each other creating holes. In this paper we present a simple even-odd
algorithm to solve this problem for complex polygons in linear time and prove
its correctness for all possible points and polygons. We furthermore provide
examples and implementation notes for this algorithm.
","[{""version"":""v1"",""created"":""Sun, 15 Jul 2012 13:06:26 GMT""},{""version"":""v2"",""created"":""Sat, 22 Jul 2017 22:23:49 GMT""}]","2017-07-25"
"1207.3503","Sofoklis Makridis","N.G. Anagnostou, S.S. Makridis, E.S. Kikkinides, C.N. Christodoulou
  and A.K. Stubos","Synthesis and Characterization of TiFe0.7-xMn0.3Vx (x=0.05, and 0.1) and
  Ti1-yTayFe0.7Mn0.3 (y=0.2, and 0.4) Nanostructured Metal Hydrides for Low
  Temperature Applications","This work has been accepted for publication in Journal of Nanoscience
  and Nanotechnology, to appear in 2013",,,,"cond-mat.mtrl-sci","http://arxiv.org/licenses/nonexclusive-distrib/1.0/","  Metal hydrides (MH) are often preferred to absorb and desorb hydrogen at
ambient temperature and pressure with a high volumetric density. These hydrogen
storage alloys create promising prospects for hydrogen storage and can solve
the energetic and environmental issues. In the present research work, the goal
of our studies is to find the influence of partial substitution of small
amounts of vanadium and tantalum on the hydrogenation properties of
TiFe0.7-xMn0.3Vx (x=0.05, and 0.1) and Ti1-yTayFe0.7Mn0.3 (y=0.2, and 0.4)
alloys, respectively. The nominal compositions of these materials are
TiFe0.65Mn0.3V0.05, TiFe0.6Mn0.3V0.1, Ti0.8Ta0.2Fe0.7Mn0.3, and
Ti0.6Ta0.4Fe0.7Mn0.3. All samples were synthesized by arc-melting high purity
elements under argon atmosphere. The structural and microstructural properties
of the samples were studied by using XRD and SEM, respectively, while the
corresponding microchemistry was determined by obtaining EDS measurements at
specific regions of the samples. Mapping was obtained in order to investigate
atomic distribution in microstructure. Moreover, to ensure the associations
between the properties and structure, all samples were examined by an optical
microscope for accessional characterization. From all these microscopic
examinations a variety of photomicrographs were taken with different
magnifications. The hydrogenation properties were obtained by using a Magnetic
Suspension Balance (Rubotherm). In this equipment, the hydrogen desorption and
re-absorption, can be investigated at constant hydrogen pressures in the range
of 1 to 20 MPa (flow-through mode). At least 3.43 wt. % of absorbed hydrogen
amount was measured while the effect of substitutions was investigated at the
same temperature.
","[{""version"":""v1"",""created"":""Sun, 15 Jul 2012 13:08:11 GMT""}]","2012-07-17"
"1207.3504","Amelia Carolina Sparavigna","Amelia Carolina Sparavigna","The play of colours of prisms",,,,,"physics.pop-ph","http://arxiv.org/licenses/nonexclusive-distrib/1.0/","  A short history of prisms from Lucius Anneus Seneca to George Ravenscroft.
","[{""version"":""v1"",""created"":""Sun, 15 Jul 2012 13:21:42 GMT""}]","2012-07-17"
"1207.3505","Guido Germano","Enrico Scalas, Adrian T. Gabriel, Edgar Martin, Guido Germano","Velocity and energy distributions in microcanonical ensembles of hard
  spheres","11 pages, 3 figures","Physical Review E 92 (2), 022140, 2015","10.1103/PhysRevE.92.022140",,"cond-mat.stat-mech math-ph math.MP math.PR","http://arxiv.org/licenses/nonexclusive-distrib/1.0/","  In a microcanonical ensemble (constant $NVE$, hard reflecting walls) and in a
molecular dynamics ensemble (constant $NVE\mathbf{PG}$, periodic boundary
conditions) with a number $N$ of smooth elastic hard spheres in a
$d$-dimensional volume $V$ having a total energy $E$, a total momentum
$\mathbf{P}$, and an overall center of mass position $\mathbf{G}$, the
individual velocity components, velocity moduli, and energies have transformed
beta distributions with different arguments and shape parameters depending on
$d$, $N$, $E$, the boundary conditions, and possible symmetries in the initial
conditions. This can be shown marginalizing the joint distribution of
individual energies, which is a symmetric Dirichlet distribution. In the
thermodynamic limit the beta distributions converge to gamma distributions with
different arguments and shape or scale parameters, corresponding respectively
to the Gaussian, i.e., Maxwell-Boltzmann, Maxwell, and Boltzmann or
Boltzmann-Gibbs distribution. These analytical results agree with molecular
dynamics and Monte Carlo simulations with different numbers of hard disks or
spheres and hard reflecting walls or periodic boundary conditions. The
agreement is perfect with our Monte Carlo algorithm, which acts only on
velocities independently of positions with the collision versor sampled
uniformly on a unit half sphere in $d$ dimensions, while slight deviations
appear with our molecular dynamics simulations for the smallest values of $N$.
","[{""version"":""v1"",""created"":""Sun, 15 Jul 2012 13:44:06 GMT""},{""version"":""v2"",""created"":""Sat, 29 Aug 2015 00:56:40 GMT""}]","2015-09-01"
"1207.3506","Boris Bellalta Dr.","Boris Bellalta, Azadeh Faridi, Jaume Barcelo, Vanesa Daza, Miquel
  Oliver","Performance Analysis of a Multiuser Multi-Packet Transmission System for
  WLANs in Non-Saturation Conditions",,,,,"cs.NI","http://arxiv.org/licenses/nonexclusive-distrib/1.0/","  Multiuser Multi-Packet Transmission (MPT) from an Access Point (AP) equipped
with multiple antennas to multiple single-antenna nodes can be achieved by
exploiting the spatial dimension of the channel. In this paper we present a
queueing model to analytically study such systems from the link-layer
perspective, in presence of random packet arrivals, heterogeneous channel
conditions and packet errors. The analysis relies on a blind estimation of the
number of different destinations among the packets waiting in the queue, which
allows for building a simple, but general model for MPT systems with per-node
First-In First-Out (FIFO) packet scheduling. Simulation results validate the
accuracy of the analytical model and provide further insights on the
cross-relations between the channel state, the number of antennas, and the
number of active users, as well as how they affect the system performance. The
simplicity and accuracy of the model makes it suitable for the evaluation of
Medium Access Control (MAC) protocols for Ad-Hoc or Wireless Local Area
Networks supporting multiuser MPT in non-saturation conditions, where the
queueing dynamics play an important role on the achieved performance, and
simple user selection algorithms are required.
","[{""version"":""v1"",""created"":""Sun, 15 Jul 2012 13:48:06 GMT""},{""version"":""v2"",""created"":""Sun, 20 Oct 2013 11:22:54 GMT""}]","2013-10-22"
"1207.3507","Jean-Philippe Lansberg","J.P. Lansberg, V. Chambert, J.P. Didelez, B. Genolini, C. Hadjidakis,
  P. Rosier, R. Arnaldi, E. Scomparin, S.J. Brodsky, E.G. Ferreiro, F. Fleuret,
  A. Rakotozafindrabe, U.I. Uggerh{\o}j","A Fixed-Target ExpeRiment at the LHC (AFTER@LHC) : luminosities, target
  polarisation and a selection of physics studies","6 pages. Proceedings of the Sixth International Conference on Quarks
  and Nuclear Physics QNP2012 (16-20 April 2012, Ecole Polytechnique,
  Palaiseau,France)","PoS(QNP2012)049",,"SLAC-PUB-15175","hep-ex hep-ph nucl-ex nucl-th","http://arxiv.org/licenses/nonexclusive-distrib/1.0/","  We report on a future multi-purpose fixed-target experiment with the proton
or lead ion LHC beams extracted by a bent crystal. The multi-TeV LHC beams
allow for the most energetic fixed-target experiments ever performed. Such an
experiment, tentatively named AFTER for ""A Fixed-Target ExperRiment"", gives
access to new domains of particle and nuclear physics complementing that of
collider experiments, in particular at RHIC and at the EIC projects. The
instantaneous luminosity at AFTER using typical targets surpasses that of RHIC
by more than 3 orders of magnitude. Beam extraction by a bent crystal offers an
ideal way to obtain a clean and very collimated high-energy beam, without
decreasing the performance of the LHC. The fixed-target mode also has the
advantage of allowing for spin measurements with a polarised target and for an
access over the full backward rapidity domain up to xF ~ - 1. Here, we
elaborate on the reachable luminosities, the target polarisation and a
selection of measurements with hydrogen and deuterium targets.
","[{""version"":""v1"",""created"":""Sun, 15 Jul 2012 14:05:02 GMT""}]","2012-07-17"
"1207.3508","Boris Bellalta Dr.","Boris Bellalta, Azadeh Faridi, Dirk Staehle, Jaume Barcelo, Alexey
  Vinel, Miquel Oliver","Performance Analysis of CSMA/CA Protocols with Multi-packet Transmission","Computer Networks, 2013",,,,"cs.NI","http://arxiv.org/licenses/nonexclusive-distrib/1.0/","  Wireless objects equipped with multiple antennas are able to simultaneously
transmit multiple packets by exploiting the channel's spatial dimensions. In
this paper, we study the benefits of such Multiple Packet Transmission (MPT)
approach, when it is used in combination with a Carrier Sense Multiple Access
with Collision Avoidance (CSMA/CA) protocol for fully interconnected networks,
addressing the interactions between the two mechanisms and showing the
performance gains that can be achieved. To this end, a very simple Media Access
Control (MAC) protocol that captures the fundamental properties and tradeoffs
of a CSMA/CA channel access protocol supporting MPT is introduced. Using this
protocol as a reference, a new analytical model is presented for the case of
non-saturated traffic sources with finite buffer space. Simulation results show
that the analytical model is able to accurately characterize the steady-state
behaviour of the reference protocol for different number of antennas and
different traffic loads, providing a useful tool for understanding the
performance gains achieved by MAC protocols supporting MPT.
","[{""version"":""v1"",""created"":""Sun, 15 Jul 2012 14:20:19 GMT""},{""version"":""v2"",""created"":""Tue, 12 Feb 2013 10:41:49 GMT""},{""version"":""v3"",""created"":""Mon, 24 Jun 2013 15:08:04 GMT""}]","2013-06-25"
"1207.3509","Pavel Kurilkin","P.K.Kurilkin, V.P.Ladygin, T.Uesaka, K.Suda, Yu.V.Gurchin,
  A.Yu.Isupov, K.Itoh, M.Janek, J.-T.Karachuk, T.Kawabata, A.N.Khrenov,
  A.S.Kiselev, V.A.Kizka, V.A.Krasnov, N.B.Ladygina, A.N.Livanov, Y.Maeda,
  A.I.Malakhov, S.M.Piyadin, S.G.Reznikov, S.Sakaguchi, H.Sakai, Y.Sasamoto,
  K.Sekiguchi, M.A.Shikhalev, T.A.Vasiliev and H.Witala","Measurement of the vector and tensor analyzing powers for dp- elastic
  scattering at 880 MeV","5 pages,3 figures",,"10.1016/j.physletb.2012.07.022",,"nucl-ex","http://arxiv.org/licenses/nonexclusive-distrib/1.0/","  The vector Ay and tensor analyzing powers Ayy and Axx for dp- elastic
scattering were measured at Td = 880 MeV over the c.m. angular range from 60 to
140 degrees at the JINR Nuclotron. The data are compared with predictions of
different theoretical models based on the use of nucleon-nucleon forces only.
The observed discrepancies of the measured analyzing powers from the
calculations require the consideration of additional mechanisms.
","[{""version"":""v1"",""created"":""Sun, 15 Jul 2012 14:24:33 GMT""}]","2015-06-05"
"1207.3510","Quan Wang","Quan Wang","HMRF-EM-image: Implementation of the Hidden Markov Random Field Model
  and its Expectation-Maximization Algorithm","This work originally appears as the final project of Prof. Birsen
  Yazici's course Detection and Estimation Theory at RPI",,,,"cs.CV","http://arxiv.org/licenses/nonexclusive-distrib/1.0/","  In this project, we study the hidden Markov random field (HMRF) model and its
expectation-maximization (EM) algorithm. We implement a MATLAB toolbox named
HMRF-EM-image for 2D image segmentation using the HMRF-EM framework. This
toolbox also implements edge-prior-preserving image segmentation, and can be
easily reconfigured for other problems, such as 3D image segmentation.
","[{""version"":""v1"",""created"":""Sun, 15 Jul 2012 14:50:17 GMT""},{""version"":""v2"",""created"":""Tue, 18 Dec 2012 22:15:36 GMT""}]","2012-12-20"
"1207.3511","Amiram Leviatan","A. Leviatan","From Exact to Partial Dynamical Symmetries: Lessons From the Interacting
  Boson Model","8 pages, 4 figures, Proc. Int. Conf. on ""Beauty in Physics: Theory
  and Experiment"", May 14-18, 2012, Cocoyoc, Mexico","AIP Conf. Proc. 1488: 61-68, 2012","10.1063/1.4759383",,"nucl-th","http://arxiv.org/licenses/nonexclusive-distrib/1.0/","  We exploit the rich algebraic structure of the interacting boson model to
explain the notion of partial dynamical symmetry (PDS), and present a procedure
for constructing Hamiltonians with this property. We demonstrate the relevance
of PDS to various topics in nuclear spectroscopy, including K-band splitting,
odd-even staggering in the gamma-band and anharmonicity of excited vibrational
bands. Special emphasis in this construction is paid to the role of
higher-order terms.
","[{""version"":""v1"",""created"":""Sun, 15 Jul 2012 14:51:25 GMT""}]","2013-04-16"
"1207.3512","Oleg Velichko","O. I. Velichko and A. P. Kavaliova","Simulation of boron diffusion during low-temperature annealing of
  implanted silicon","16 pages, 3 figures",,"10.1007/s00339-012-7378-4",,"cond-mat.mtrl-sci math-ph math.MP","http://arxiv.org/licenses/nonexclusive-distrib/1.0/","  Modeling of ion-implanted boron redistribution in silicon crystals during
low-temperature annealing with a small thermal budget has been carried out. It
was shown that formation of ""tails""' in the low-concentration region of
impurity profiles occurs due to the long-range migration of boron interstitials
","[{""version"":""v1"",""created"":""Sun, 15 Jul 2012 14:51:37 GMT""}]","2015-06-05"
"1207.3513","Amin Gohari","Amin Gohari, Mohammad Hossein Yassaee and Mohammad Reza Aref","Secure Channel Simulation","Short version to appear at ITW 2012. This will be replaced by a
  longer version soon",,,,"cs.IT math.IT","http://arxiv.org/licenses/nonexclusive-distrib/1.0/","  In this paper the Output Statistics of Random Binning (OSRB) framework is
used to prove a new inner bound for the problem of secure channel simulation.
Our results subsume some recent results on the secure function computation. We
also provide an achievability result for the problem of simultaneously
simulating a channel and creating a shared secret key. A special case of this
result generalizes the lower bound of Gohari and Anantharam on the source model
to include constraints on the rates of the public discussion.
","[{""version"":""v1"",""created"":""Sun, 15 Jul 2012 14:52:38 GMT""}]","2012-07-17"
"1207.3514","Jean-Marie Lescure","Paulo Carrillo Rouse (IMT), Jean-Marie Lescure, Bertrand Monthubert
  (IMT)","A cohomological formula for the Atiyah-Patodi-Singer index on manifolds
  with boundary","39 pages",,,,"math.OA math.DG math.KT","http://arxiv.org/licenses/nonexclusive-distrib/1.0/","  We give a cohomological formula for the index of a fully elliptic
pseudodifferential operator on a manifold with boundary. As in the classic case
of Atiyah-Singer, we use an embedding into an euclidean space to express the
index as the integral of a cohomology class depending in this case on a
noncommutative symbol, the integral being over a $C^\infty$-manifold called the
singular normal bundle associated to the embedding. The formula is based on a
K-theoretical Atiyah-Patodi-Singer theorem for manifolds with boundary that is
drawn from Connes' tangent groupoid approach.
","[{""version"":""v1"",""created"":""Sun, 15 Jul 2012 14:52:51 GMT""},{""version"":""v2"",""created"":""Fri, 14 Sep 2012 15:03:22 GMT""},{""version"":""v3"",""created"":""Fri, 13 Dec 2013 12:31:33 GMT""}]","2013-12-16"
"1207.3515","Yu-Xiao Liu","Ke Yang, Yu-Xiao Liu, Yong-Qiang Wang","Emergence of Cosmic Space and the Generalized Holographic Equipartition","8 pages, no figures, published version","Phys. Rev. D 86, 104013 (2012)","10.1103/PhysRevD.86.104013",,"hep-th gr-qc","http://arxiv.org/licenses/nonexclusive-distrib/1.0/","  Recently, a novel idea about our expanding Universe was proposed by T.
Padmanabhan [arXiv:1206.4916]. He suggested that the expansion of our Universe
can be thought of as the emergence of space as cosmic time progresses. The
emergence is governed by the basic relation that the increase rate of Hubble
volume is linearly determined by the difference between the number of degrees
of freedom on the horizon surface and the one in the bulk. In this paper,
following this idea, we generalize the basic relation to derive the Friedmann
equations of an $(n+1)$-dimensional Friedmann-Robertson-Walker universe
corresponding to general relativity, Gauss-Bonnet gravity, and Lovelock
gravity.
","[{""version"":""v1"",""created"":""Sun, 15 Jul 2012 14:55:21 GMT""},{""version"":""v2"",""created"":""Mon, 12 Nov 2012 08:42:51 GMT""}]","2012-11-13"
"1207.3516","Sylvain Golenia","Sylvain Golenia (IMB), Tristan Haugomat (ENS Cachan Bretagne)","On the a.c. spectrum of 1D discrete Dirac operator","Small changes. The article will be published in Methods of Functional
  Analysis and Topology",,,,"math-ph math.MP math.SP","http://arxiv.org/licenses/nonexclusive-distrib/1.0/","  In this paper, under some integrability condition, we prove that an
electrical perturbation of the discrete Dirac operator has purely absolutely
continuous spectrum for the one dimensional case. We reduce the problem to a
non-self-adjoint Laplacian-like operator by using a spin up/down decomposition
and rely on a transfermatrices technique.
","[{""version"":""v1"",""created"":""Sun, 15 Jul 2012 14:59:09 GMT""},{""version"":""v2"",""created"":""Thu, 6 Feb 2014 15:39:56 GMT""}]","2014-02-07"
"1207.3517","Laurent Decreusefond","Laure Coutin, Laurent Decreusefond (LTCI)","Stein's method for Brownian approximations","Communications on Stochastic Analysis (2013)","Communications on stochastic analysis, vol. 7(3), 2013",,,"math.PR","http://arxiv.org/licenses/nonexclusive-distrib/1.0/","  Motivated by a theorem of Barbour, we revisit some of the classical limit
theorems in probability from the viewpoint of the Stein method. We setup the
framework to bound Wasserstein distances between some distributions on infinite
dimensional spaces. We show that the convergence rate for the Poisson
approximation of the Brownian motion is as expected proportional to
$\lambda^{-1/2}$ where $\lambda$ is the intensity of the Poisson process. We
also exhibit the speed of convergence for the Donsker Theorem and for the
linear interpolation of the Brownian motion. By iterating the procedure, we
give Edgeworth expansions with precise error bounds.
","[{""version"":""v1"",""created"":""Sun, 15 Jul 2012 14:59:57 GMT""},{""version"":""v2"",""created"":""Fri, 20 Sep 2013 16:42:13 GMT""}]","2018-07-30"
