"1207.3455","Katherine Rawlins","IceCube Collaboration: R. Abbasi, Y. Abdou, M. Ackermann, J. Adams, J.
  A. Aguilar, M. Ahlers, D. Altmann, K. Andeen, J. Auffenberg, X. Bai, M.
  Baker, S. W. Barwick, V. Baum, R. Bay, K. Beattie, J. J. Beatty, S. Bechet,
  J. Becker Tjus, K.-H. Becker, M. Bell, M. L. Benabderrahmane, S. BenZvi, J.
  Berdermann, P. Berghaus, D. Berley, E. Bernardini, D. Bertrand, D. Z. Besson,
  D. Bindig, M. Bissok, E. Blaufuss, J. Blumenthal, D. J. Boersma, C. Bohm, D.
  Bose, S. B\""oser, O. Botner, L. Brayeur, A. M. Brown, R. Bruijn, J. Brunner,
  S. Buitink, K. S. Caballero-Mora, M. Carson, J. Casey, M. Casier, D. Chirkin,
  B. Christy, F. Clevermann, S. Cohen, D. F. Cowen, A. H. Cruz Silva, M.
  Danninger, J. Daughhetee, J. C. Davis, C. De Clercq, F. Descamps, P. Desiati,
  G. de Vries-Uiterweerd, T. DeYoung, J. C. D\'iaz-V\'elez, J. Dreyer, J. P.
  Dumm, M. Dunkman, R. Eagan, J. Eisch, R. W. Ellsworth, O. Engdeg{\aa}rd, S.
  Euler, P. A. Evenson, O. Fadiran, A. R. Fazely, A. Fedynitch, J. Feintzeig,
  T. Feusels, K. Filimonov, C. Finley, T. Fischer-Wasels, S. Flis, A.
  Franckowiak, R. Franke, K. Frantzen, T. Fuchs, T. K. Gaisser, J. Gallagher,
  L. Gerhardt, L. Gladstone, T. Gl\""usenkamp, A. Goldschmidt, J. A. Goodman, D.
  G\'ora, D. Grant, A. Gro{\ss}, S. Grullon, M. Gurtner, C. Ha, A. Haj Ismail,
  A. Hallgren, F. Halzen, K. Hanson, D. Heereman, P. Heimann, D. Heinen, K.
  Helbing, R. Hellauer, S. Hickford, G. C. Hill, K. D. Hoffman, R. Hoffmann, A.
  Homeier, K. Hoshina, W. Huelsnitz, P. O. Hulth, K. Hultqvist, S. Hussain, A.
  Ishihara, E. Jacobi, J. Jacobsen, G. S. Japaridze, O. Jlelati, H. Johansson,
  A. Kappes, T. Karg, A. Karle, J. Kiryluk, F. Kislat, J. Kl\""as, S. R. Klein,
  J.-H. K\""ohne, G. Kohnen, H. Kolanoski, L. K\""opke, C. Kopper, S. Kopper, D.
  J. Koskinen, M. Kowalski, M. Krasberg, G. Kroll, J. Kunnen, N. Kurahashi, T.
  Kuwabara, M. Labare, K. Laihem, H. Landsman, M. J. Larson, R. Lauer, M.
  Lesiak-Bzdak, J. L\""unemann, J. Madsen, R. Maruyama, K. Mase, H. S. Matis, F.
  McNally, K. Meagher, M. Merck, P. M\'esz\'aros, T. Meures, S. Miarecki, E.
  Middell, N. Milke, J. Miller, L. Mohrmann, T. Montaruli, R. Morse, S. M.
  Movit, R. Nahnhauer, U. Naumann, S. C. Nowicki, D. R. Nygren, A. Obertacke,
  S. Odrowski, A. Olivas, M. Olivo, A. O'Murchadha, S. Panknin, L. Paul, J. A.
  Pepper, C. P\'erez de los Heros, D. Pieloth, N. Pirk, J. Posselt, P. B.
  Price, G. T. Przybylski, L. R\""adel, K. Rawlins, P. Redl, E. Resconi, W.
  Rhode, M. Ribordy, M. Richman, B. Riedel, J. P. Rodrigues, F. Rothmaier, C.
  Rott, T. Ruhe, D. Rutledge, B. Ruzybayev, D. Ryckbosch, S. M. Saba, T.
  Salameh, H.-G. Sander, M. Santander, S. Sarkar, K. Schatto, M. Scheel, F.
  Scheriau, T. Schmidt, M. Schmitz, S. Schoenen, S. Sch\""oneberg, L.
  Sch\""onherr, A. Sch\""onwald, A. Schukraft, L. Schulte, O. Schulz, D. Seckel,
  S. H. Seo, Y. Sestayo, S. Seunarine, M. W. E. Smith, M. Soiron, D. Soldin, G.
  M. Spiczak, C. Spiering, M. Stamatikos, T. Stanev, A. Stasik, T.
  Stezelberger, R. G. Stokstad, A. St\""o{\ss}l, E. A. Strahler, R. Str\""om, G.
  W. Sullivan, H. Taavola, I. Taboada, A. Tamburro, S. Ter-Antonyan, S. Tilav,
  P. A. Toale, S. Toscano, M. Usner, N. van Eijndhoven, D. van der Drift, A.
  Van Overloop, J. van Santen, M. Vehring, M. Voge, C. Walck, T. Waldenmaier,
  M. Wallraff, M. Walter, R. Wasserman, Ch. Weaver, C. Wendt, S. Westerhoff, N.
  Whitehorn, K. Wiebe, C. H. Wiebusch, D. R. Williams, H. Wissing, M. Wolf, T.
  R. Wood, K. Woschnagg, C. Xu, D. L. Xu, X. W. Xu, J. P. Yanez, G. Yodh, S.
  Yoshida, P. Zarzhitsky, J. Ziemann, A. Zilles, M. Zoll","Cosmic Ray Composition and Energy Spectrum from 1-30 PeV Using the
  40-String Configuration of IceTop and IceCube","33 pages; accepted to Astroparticle Physics","Astropart.Phys. 42:15,2013","10.1016/j.astropartphys.2012.11.003",,"astro-ph.HE astro-ph.IM","http://arxiv.org/licenses/nonexclusive-distrib/1.0/","  The mass composition of high energy cosmic rays depends on their production,
acceleration, and propagation. The study of cosmic ray composition can
therefore reveal hints of the origin of these particles. At the South Pole, the
IceCube Neutrino Observatory is capable of measuring two components of cosmic
ray air showers in coincidence: the electromagnetic component at high altitude
(2835 m) using the IceTop surface array, and the muonic component above ~1 TeV
using the IceCube array. This unique detector arrangement provides an
opportunity for precision measurements of the cosmic ray energy spectrum and
composition in the region of the knee and beyond. We present the results of a
neural network analysis technique to study the cosmic ray composition and the
energy spectrum from 1 PeV to 30 PeV using data recorded using the
40-string/40-station configuration of the IceCube Neutrino Observatory.
","[{""version"":""v1"",""created"":""Sat, 14 Jul 2012 19:54:15 GMT""},{""version"":""v2"",""created"":""Tue, 6 Nov 2012 18:45:19 GMT""}]","2016-02-23"
"1207.3456","Maria Eulalia Vares","Enrique D. Andjel, Maria Eulalia Vares","First passage percolation and escape strategies",,,,,"math.PR","http://arxiv.org/licenses/nonexclusive-distrib/1.0/","  Consider first passage percolation on $\mathbb{Z}^d$ with passage times given
by i.i.d. random variables with common distribution $F$. Let $t_\pi(u,v)$ be
the time from $u$ to $v$ for a path $\pi$ and $t(u,v)$ the minimal time among
all paths from $u$ to $v$. We ask whether or not there exist points $x,y \in
\mathbb{Z}^d$ and a semi-infinite path $\pi=(y_0=y,y_1,\dots)$ such that
$t_\pi(y, y_{n+1})<t(x,y_n)$ for all $n$. Necessary and sufficient conditions
on $F$ are given for this to occur. When the support of $F$ is unbounded, we
also obtain results on the number of edges with large passage time used by
geodesics.
","[{""version"":""v1"",""created"":""Sat, 14 Jul 2012 20:01:54 GMT""},{""version"":""v2"",""created"":""Thu, 26 Dec 2013 18:07:42 GMT""}]","2013-12-30"
"1207.3457","ZhenGang Zhu","Zhen-Gang Zhu and Jamal Berakdar","Comment on ""Single-parameter quantum charge and spin pumping in armchair
  graphene nanoribbons"" (arXiv:1206.3435v1, by Zhou and Wu)",,,,,"cond-mat.mes-hall","http://arxiv.org/licenses/nonexclusive-distrib/1.0/","  In their recent submission arXiv:1206.3435v1 Zhou and Wu addressed the charge
and spin pumping in an armchair graphene nanoribbon connected to magnetic
and/or nonmagnetic leads at zero bias. They used thereby a pumping current
formula based on time-reversal symmetry. In their appendix they made, based on
their formulas, a number of claims concerning our recent works [K. -H. Ding, Z.
-G. Zhu, and J. Berakdar, Phys. Rev. B 84, 115433 (2011)] on the laser
modification of the spin-dependent current in an extended graphene monolayer
contacted to two magnetic leads under a finite bias. Below we show in detail
that the physical system considered by us is conceptually different from that
of Zhou and Wu (arXiv:1206.3435v1) and cannot be treated with their theory for
fundamental reasons (e.g., the time-reversal symmetry is inherently broken in
our case due to the presence of the magnetic leads and the dc current generated
by the finite bias). Hence, the statements of Zhou and Wu based on a comparison
of their results with ours are scientifically groundless.
","[{""version"":""v1"",""created"":""Sat, 14 Jul 2012 20:05:15 GMT""}]","2012-07-17"
"1207.3458","Teresa Marrodan Undagoitia","The XENON100 Collaboration: E. Aprile, M. Alfonsi, K. Arisaka, F.
  Arneodo, C. Balan, L. Baudis, A. Behrens, P. Beltrame, K. Bokeloh, E. Brown,
  G. Bruno, R. Budnik, J. M. R. Cardoso, W.-T. Chen, B. Choi, D. B. Cline, H.
  Contreras, J. P. Cussonneau, M. P. Decowski, E. Duchovni, S. Fattori, A. D.
  Ferella, W. Fulgione, F. Gao, M. Garbini, K.-L. Giboni, L. W. Goetzke, C.
  Grignon, E. Gross, W. Hampel, A. Kish, J. Lamblin, H. Landsman, R. F. Lang,
  M. Le Calloch, C. Levy, K. E. Lim, Q. Lin, S. Lindemann, M. Lindner, J. A. M.
  Lopes, K. Lung, T. Marrodan Undagoitia, F. V. Massoli, Y. Mei, A. J.
  Melgarejo Fernandez, Y. Meng, A. Molinario, E. Nativ, K. Ni, U. Oberlack, S.
  E. A. Orrigo, E. Pantic, R. Persiani, G. Plante, N. Priel, A. Rizzo, S.
  Rosendahl, J. M. F. dos Santos, G. Sartorelli, J. Schreiner, M. Schumann, L.
  Scotto Lavina, P. R. Scovell, M. Selvi, P. Shagin, H. Simgen, A. Teymourian,
  D. Thers, O. Vitells, H. Wang, M. Weber, C. Weinheimer","Analysis of the XENON100 Dark Matter Search Data","18 pages, 17 figures, information for the 224.6 live days run
  included","Astropart. Phys. 54 (2014) 11-24","10.1016/j.astropartphys.2013.10.002",,"astro-ph.IM physics.ins-det","http://arxiv.org/licenses/nonexclusive-distrib/1.0/","  The XENON100 experiment, situated in the Laboratori Nazionali del Gran Sasso,
aims at the direct detection of dark matter in the form of weakly interacting
massive particles (WIMPs), based on their interactions with xenon nuclei in an
ultra low background dual-phase time projection chamber. This paper describes
the general methods developed for the analysis of the XENON100 data. These
methods have been used in the 100.9 and 224.6 live days science runs from which
results on spin-independent elastic, spin-dependent elastic and inelastic
WIMP-nucleon cross-sections have already been reported.
","[{""version"":""v1"",""created"":""Sat, 14 Jul 2012 20:12:40 GMT""},{""version"":""v2"",""created"":""Mon, 30 Jul 2012 10:01:47 GMT""},{""version"":""v3"",""created"":""Mon, 14 Oct 2013 12:09:42 GMT""}]","2018-06-06"
"1207.3459","Bertrand Guillou","Bertrand Guillou and J. P. May","Equivariant iterated loop space theory and permutative G-categories","63 pages. Final version, to appear in AGT. Section 1 is new and
  concerns E_V-operads and V-fold loop G-spaces, where V is a representation of
  G. Other sections have been reorganized. An appendix discusses pairings of
  operads, giving geometric examples with good behavior. The previous version
  mistakenly claimed that the Barrett-Eccles operad has a well-behaved
  self-pairing, and we explain the error","Algebr. Geom. Topol. 17 (2017) 3259-3339","10.2140/agt.2017.17.3259",,"math.AT math.CT","http://arxiv.org/licenses/nonexclusive-distrib/1.0/","  We set up operadic foundations for equivariant iterated loop space theory. We
start by building up from a discussion of the approximation theorem and
recognition principle for V-fold loop G-spaces to several avatars of a
recognition principle for infinite loop G-spaces. We then explain what genuine
permutative G-categories are and, more generally, what E_{\infty} G-categories
are, giving examples showing how they arise. As an application, we prove the
equivariant Barratt-Priddy-Quillen theorem as a statement about genuine
G-spectra and use it to give a new, categorical, proof of the tom Dieck
splitting theorem for suspension G-spectra. Other examples are geared towards
equivariant algebraic K-theory.
","[{""version"":""v1"",""created"":""Sat, 14 Jul 2012 20:35:24 GMT""},{""version"":""v2"",""created"":""Mon, 10 Mar 2014 18:36:24 GMT""},{""version"":""v3"",""created"":""Fri, 24 Mar 2017 20:01:21 GMT""}]","2018-03-16"
"1207.3460","William S. Burgett","William S. Burgett","PS2: Managing the next step in the Pan-STARRS wide field survey system","Paper presented at SPIE 2012 Astronomical Telescopes and
  Instrumentation, to be published in conference proceedings (8449-28)",,"10.1117/12.926532",,"astro-ph.IM","http://arxiv.org/licenses/nonexclusive-distrib/1.0/","  The Panoramic Survey Telescope and Rapid Response System (Pan-STARRS) is
unique among the existing or planned major ground-based optical survey systems
as the only ""distributed aperture"" system. The concept of increasing system
\'etendue by replicating small telescopes and digital cameras presents both
management opportunities and challenges. The focus in this paper is on
management lessons learned from PS1, and how those have been used to form the
management plan for PS2. The management plan components emphasized here include
technical development, financial and schedule planning, and critical path and
risk management. Finally, the status and schedule for PS2 are presented.
","[{""version"":""v1"",""created"":""Sat, 14 Jul 2012 20:49:06 GMT""}]","2015-06-05"
"1207.3461","Srikanth Iyengar","W. G. Dwyer, J. P. C. Greenlees, and S. B. Iyengar","DG algebras with exterior homology","15 pages",,"10.1112/blms/bdt052",,"math.AT math.RA","http://arxiv.org/licenses/nonexclusive-distrib/1.0/","  We study differential graded algebras whose homology is an exterior algebra
over a commutative ring R on a generator of degree n, and also certain types of
differential modules over these DGAs. We obtain a complete classification when
R is the integers, or the prime field of characteristic p>0, and n is greater
than or equal to -1. The examples are unexpectedly interesting.
","[{""version"":""v1"",""created"":""Sat, 14 Jul 2012 21:07:41 GMT""}]","2014-02-26"
"1207.3462","Yangzhou Hu","Yangzhou Hu (Massachusetts Institute of Technology)","On the Number of Fixed-Length Semiorders","18 pages",,,,"math.CO","http://arxiv.org/licenses/nonexclusive-distrib/1.0/","  A semiorder is a partially ordered set $P$ with two certain forbidden induced
subposets. This paper establishes a bijection between $n$-element semiorders of
length $H$ and $(n+1)$-node ordered trees of height $H+1$. This bijection
preserves not only the number of elements, but also much additional structure.
Based on this correspondence, we calculate the generating functions and
explicit formulas for the numbers of labeled and unlabeled $n$-element
semiorders of length $H$. We also prove several concise recurrence relations
and provide combinatorial proofs for special cases of the explicit formulas.
","[{""version"":""v1"",""created"":""Sat, 14 Jul 2012 21:15:15 GMT""},{""version"":""v2"",""created"":""Mon, 27 May 2013 02:59:40 GMT""},{""version"":""v3"",""created"":""Wed, 26 Jun 2013 21:38:07 GMT""}]","2013-06-28"
"1207.3463","Stanislav Chadov","Stanislav Chadov, Janos Kiss, Claudia Felser, Kristina Chadova, Diemo
  K\""odderitzsch, Jan Min\'ar, Hubert Ebert","Topological phase transition induced by random substitution",,,,,"cond-mat.mtrl-sci","http://arxiv.org/licenses/nonexclusive-distrib/1.0/","  The transition from topologically nontrivial to a trivial state is studied by
first-principles calculations on bulk zinc-blende type
(Hg$_{1-x}$Zn$_x$)(Te$_{1-x}$S$_x$) disordered alloy series. The random
chemical disorder was treated by means of the Coherent Potential Approximation.
We found that although the phase transition occurs at the strongest disorder
regime (${x\approx 0.5}$), it is still manifested by well-defined Bloch states
forming a clear Dirac cone at the Fermi energy of the bulk disordered material.
The computed residual resistivity tensor confirm the topologically-nontrivial
state of the HgTe-rich (${x<0.5}$), and the trivial state of the ZnS-rich alloy
series (${x>0.5}$) by exhibiting the quantized behavior of the off-diagonal
spin-projected component, independently on the concentration $x$.
","[{""version"":""v1"",""created"":""Sat, 14 Jul 2012 21:53:11 GMT""}]","2012-07-17"
"1207.3464","Georg Mainik","Georg Mainik, Eric Schaanning","On dependence consistency of CoVaR and some other systemic risk measures","32 pages, 15 figures, 3 tables",,,,"q-fin.RM math.PR","http://arxiv.org/licenses/nonexclusive-distrib/1.0/","  This paper is dedicated to the consistency of systemic risk measures with
respect to stochastic dependence. It compares two alternative notions of
Conditional Value-at-Risk (CoVaR) available in the current literature. These
notions are both based on the conditional distribution of a random variable Y
given a stress event for a random variable X, but they use different types of
stress events. We derive representations of these alternative CoVaR notions in
terms of copulas, study their general dependence consistency and compare their
performance in several stochastic models. Our central finding is that
conditioning on X>=VaR_\alpha(X) gives a much better response to dependence
between X and Y than conditioning on X=VaR_\alpha(X). We prove general results
that relate the dependence consistency of CoVaR using conditioning on
X>=VaR_\alpha(X) to well established results on concordance ordering of
multivariate distributions or their copulas. These results also apply to some
other systemic risk measures, such as the Marginal Expected Shortfall (MES) and
the Systemic Impact Index (SII). We provide counterexamples showing that CoVaR
based on the stress event X=VaR_\alpha(X) is not dependence consistent. In
particular, if (X,Y) is bivariate normal, then CoVaR based on X=VaR_\alpha(X)
is not an increasing function of the correlation parameter. Similar issues
arise in the bivariate t model and in the model with t margins and a Gumbel
copula. In all these cases, CoVaR based on X>=VaR_\alpha(X) is an increasing
function of the dependence parameter.
","[{""version"":""v1"",""created"":""Sat, 14 Jul 2012 22:01:55 GMT""},{""version"":""v2"",""created"":""Fri, 24 Aug 2012 13:18:51 GMT""},{""version"":""v3"",""created"":""Wed, 29 Aug 2012 13:33:27 GMT""}]","2012-08-30"
"1207.3465","Philip Hackney","Julia E. Bergner and Philip Hackney","Group actions on Segal operads","Revised version. Accepted to Isr J Math","Israel J Math 202 (2014) 423-460","10.1007/s11856-014-1075-2",,"math.AT math.CT","http://arxiv.org/licenses/nonexclusive-distrib/1.0/","  We give a Quillen equivalence between model structures for simplicial
operads, described via the theory of operads, and Segal operads, thought of as
certain reduced dendroidal spaces. We then extend this result to give an
Quillen equivalence between the model structures for simplicial operads
equipped with a group action and the corresponding Segal operads.
","[{""version"":""v1"",""created"":""Sat, 14 Jul 2012 22:42:47 GMT""},{""version"":""v2"",""created"":""Sun, 8 Sep 2013 11:12:52 GMT""}]","2014-12-31"
"1207.3466","Kulumani  M. Rangaswamy","Kulumani M. Rangaswamy","Every finitely generated ideal of a Leavitt path algebra is a principal
  ideal","7 pages",,,,"math.RA math.OA","http://arxiv.org/licenses/nonexclusive-distrib/1.0/","  Let E be an arbitrary graph and K be any field. For every non-graded ideal I
of the Leavitt path algebra L_{K}(E), we give an explicit description of the
generators of I. Using this, we show that every finitely generated ideal of
L_{K}(E) must be principal. In particular, if E is a finite graph, then every
ideal of L_{K}(E) must be principal ideal.
","[{""version"":""v1"",""created"":""Sat, 14 Jul 2012 22:47:19 GMT""}]","2012-07-17"
"1207.3467","Philip Hackney","Julia E. Bergner and Philip Hackney","Reedy categories which encode the notion of category actions",,"Fund. Math. 228 (2015), 193-222","10.4064/fm228-3-1",,"math.AT math.CT","http://arxiv.org/licenses/nonexclusive-distrib/1.0/","  We study a certain type of action of categories on categories and on operads.
Using the structure of the categories {\Delta} and {\Omega} governing category
and operad structures, respectively, we define categories which instead encode
the structure of a category acting on a category, or a category acting on an
operad. We prove that the former has the structure of an elegant Reedy
category, whereas the latter has the structure of a generalized Reedy category.
In particular, this approach gives a new way to regard group actions on
categories and on operads.
","[{""version"":""v1"",""created"":""Sat, 14 Jul 2012 22:48:43 GMT""},{""version"":""v2"",""created"":""Sat, 16 Aug 2014 15:40:14 GMT""}]","2014-12-31"
"1207.3468","Mario Lomeli-Haro","Mario Lomeli-Haro","Minimal Convex Decompositions",,,,,"cs.CG math.CO math.MG","http://arxiv.org/licenses/nonexclusive-distrib/1.0/","  Let $P$ be a set of $n$ points on the plane in general position. We say that
a set $\Gamma$ of convex polygons with vertices in $P$ is a convex
decomposition of $P$ if: Union of all elements in $\Gamma$ is the convex hull
of $P,$ every element in $\Gamma$ is empty, and for any two different elements
of $\Gamma$ their interiors are disjoint. A minimal convex decomposition of $P$
is a convex decomposition $\Gamma'$ such that for any two adjacent elements in
$\Gamma'$ its union is a non convex polygon. It is known that $P$ always has a
minimal convex decomposition with at most $\frac{3n}{2}$ elements. Here we
prove that $P$ always has a minimal convex decomposition with at most
$\frac{10n}{7}$ elements.
","[{""version"":""v1"",""created"":""Sat, 14 Jul 2012 23:19:27 GMT""}]","2012-07-19"
"1207.3469","Pankaj S. Joshi","Ravindra V. Saraykar and Pankaj S. Joshi","A Note on Genericity and Stability of Black Holes and Naked
  Singularities in Dust Collapse","6 pages, LaTex",,,,"gr-qc astro-ph.HE hep-th","http://arxiv.org/licenses/nonexclusive-distrib/1.0/","  We comment here on the results in Ref [4] that showed naked singularities in
dynamical gravitational collapse of inhomogeneous dust to be stable but
non-generic. The definition of genericity used there is reconsidered. We point
out that genericity in terms of an open set, with a positive measure defined
suitably on the space of initial data, is physically more appropriate compared
to the dynamical systems theory definition used in [4] which makes both black
holes and naked singularities non-generic as collapse outcomes.
","[{""version"":""v1"",""created"":""Sat, 14 Jul 2012 23:57:25 GMT""}]","2012-07-17"
"1207.3470","Luis Arenas-Carmona","Luis Arenas-Carmona","Computing quaternion quotient graphs via representation of orders","24 pages",,,,"math.NT","http://arxiv.org/licenses/nonexclusive-distrib/1.0/","  We study the correspondence assigning the vertices of a certain quotient of
the local Bruhat-Tits tree for the general linear group over a global function
field, to conjugacy classes of maximal orders in some quaternion algebras. The
interplay between quotient graphs and orders can be used to study
representation of orders if the quotient graphs are known and conversely. We
use this converse to find a reciprocity law between quotient graph at diferent
places that suffices to compute, recursively, all local quotient graphs for a
matrix algebra over a rational function field.
","[{""version"":""v1"",""created"":""Sun, 15 Jul 2012 00:27:25 GMT""}]","2012-07-17"
"1207.3471","Alexei M. Frolov","Alexei M. Frolov and David M. Wardlaw","On the nuclear $(n;t)-$reaction in the three-electron ${}^{6}$Li atom","arXiv admin note: substantial text overlap with arXiv:1107.3816",,"10.1103/PhysRevA.87.042702",,"physics.atom-ph physics.atm-clus quant-ph","http://arxiv.org/licenses/nonexclusive-distrib/1.0/","  The nuclear $(n;t)-$reaction of the three-electron ${}^{6}$Li atom with
thermal/slow neutrons is considered. An effective method has been developed for
determining the probabilities of formation of various atoms and ions in
different bound states. We discuss a number of fundamental questions directly
related to numerical computations of the final state atomic probabilities. A
few appropriate variational expansions for atomic wave functions of the
incident lithium atom and final helium atom and/or tritium negatively charged
ion are discussed. It appears that the final ${}^4$He atom arising during the
nuclear $(n,{}^{6}$Li; ${}^4$He$,t)$-reaction in the three-electron Li atom can
also be created in its triplet states. The formation of the quasi-stable
three-electron $e^{-}_3$ during the nuclear $(n; t)-$reaction at the Li atom is
briefly discussed. Bremsstrahlung emitted by atomic electrons accelerated by
the rapidly moving nuclear fragments from this reaction is analyzed. The
frequency spectrum of the emitted radiation is investigated.
","[{""version"":""v1"",""created"":""Sun, 15 Jul 2012 01:25:00 GMT""},{""version"":""v2"",""created"":""Sun, 16 Sep 2012 15:45:28 GMT""},{""version"":""v3"",""created"":""Thu, 27 Sep 2012 00:03:30 GMT""},{""version"":""v4"",""created"":""Mon, 1 Oct 2012 06:07:47 GMT""},{""version"":""v5"",""created"":""Thu, 1 Nov 2012 00:04:50 GMT""},{""version"":""v6"",""created"":""Tue, 4 Dec 2012 20:00:07 GMT""},{""version"":""v7"",""created"":""Fri, 4 Jan 2013 05:26:58 GMT""}]","2013-04-17"
"1207.3472","Gol Kim","Gol Kim, Ri Suk Yun","Optimal Selection of Assets Investing Composition Plan based on Grey
  Multi Objective Programming method",,,,,"cs.CE math.OC","http://arxiv.org/licenses/nonexclusive-distrib/1.0/","  The problem for selection of appropriate assets investing composition
projects such as assets rationalization plays an important role in promotion of
business systems. We consider the assets investing composition plan problems
subject to grey multiobjective programming with the grey inequality
constraints. In this paper, we show in detail the entire process of the
application from modeling the case problem to generating its solution. To solve
the grey multi objective programming problem, we then develop and apply an
algorithm of grey multiple objective programming by weighting method and an
algorithm of grey multiple objective programming based on q -positioned
programming method. These algorithms all regard as of great importance
uncertainty (greyness) at grey multiobjective programming and simple and easy
the calculating process. The calculating examples of paper also show ability
and effectiveness of algorithms.
","[{""version"":""v1"",""created"":""Sun, 15 Jul 2012 01:30:56 GMT""}]","2012-07-25"
