"1202.6510","Ralf Diener","Ralf Diener (1), Ties Behnke (1), Stefano Caiazza (1), Isa Heinze (1),
  Volker Prahl (1), Christoph Rosemann (1), Oliver Sch\""afer (1,2), Jan
  Timmermans (1,3), Robert Volkenborn (1) and Klaus Zenker (1) ((1) Deutsches
  Elektronen-Synchrotron DESY, A Research Centre of the Helmholtz Association,
  Hamburg, Germany, (2) Universit\""at Rostock, Fachbereich Physik, Rostock,
  Germany, (3) Nikhef, National Institute for Subatomic Physics, Amsterdam,
  Netherlands)","Beam Test with a GridGEM TPC Prototype Module","6 pages, 11 figures, prepared for LCWS 2011 proceedings",,,,"physics.ins-det","http://arxiv.org/licenses/nonexclusive-distrib/1.0/","  The International Large Detector (ILD) --a detector concept for the
International Linear Collider (ILC)-- foresees a Time Projection Chamber (TPC)
as its main tracking detector. Currently, the R&D efforts for such a TPC focus
on studies using a large prototype that can accommodate up to seven read-out
modules which are comparable to the ones that would be used in the final ILD
TPC. The DESY TPC group has developed such a module using GEMs for the gas
amplification, which are mounted on thin ceramic frames. The module design and
first results of a test beam campaign are presented.
","[{""version"":""v1"",""created"":""Wed, 29 Feb 2012 10:57:46 GMT""}]","2012-03-01"
"1202.6511","Lau Gatignon","Lau Gatignon","CLIC MDI Overview","LCWS11 Granada",,,,"physics.acc-ph","http://arxiv.org/licenses/nonexclusive-distrib/1.0/","  This paper gives an introduction to the layout of the CLIC Machine Detector
Interface as it has been defined for the CLIC Conceptual Design Report. We
concentrate on the specific case of the CLIC_SiD detector, although the
push-pull concept for two detectors has been included in the design. Some
recent work and developments are described as well. However, for the details we
refer to the detailed technical talks at this conference.
","[{""version"":""v1"",""created"":""Wed, 29 Feb 2012 10:59:51 GMT""}]","2012-03-01"
"1202.6512","Markus Fasel","Markus Fasel (for the ALICE Collaboration)","Measurement of the nuclear modification factor of electrons from
  heavy-flavour hadron decays in Pb-Pb collisions at {\surd}sNN = 2.76 TeV with
  ALICE at the LHC","6 pages, 5 figures, EPIC@LHC - International Workshop on Early
  Physics with Heavy Ion Collisions at the LHC; Published by American Institute
  of Physics (AIP) in the Conference Proceedings Series (2011)",,"10.1063/1.3692208",,"nucl-ex","http://arxiv.org/licenses/nonexclusive-distrib/1.0/","  We present a measurement of the nuclear modification factor of electrons from
heavy- flavour hadron decays at midrapidity in Pb-Pb collisions at {\surd}sNN =
2.76 TeV. Electrons are identified in the pt range 1.5 GeV/c < pt < 6 GeV/c. A
suppression is seen for pt larger than 3.5 GeV/c in the most central
collisions.
","[{""version"":""v1"",""created"":""Wed, 29 Feb 2012 11:11:06 GMT""}]","2019-08-13"
"1202.6513","Mariusz Slonina","Mariusz Slonina, Krzysztof Gozdziewski, Cezary Migaszewski","Mechanic: a new numerical MPI framework for the dynamical astronomy","4 pages, 7 figures, in GREAT-ESF Workshop 'Orbital Couples: ""Pas de
  Deux"" in the Solar System and the Milky Way', Paris, IMCCE proceedings, in
  press",,,,"astro-ph.IM astro-ph.EP cs.DC","http://arxiv.org/licenses/nonexclusive-distrib/1.0/","  We develop the Mechanic package, which is a new numerical framework for
dynamical astronomy. The aim of our software is to help in massive numerical
simulations by efficient task management and unified data storage. The code is
built on top of the Message Passing Interface (MPI) and Hierarchical Data
Format (HDF5) standards and uses the Task Farm approach to manage numerical
tasks. It relies on the core-module approach. The numerical problem implemented
in the user-supplied module is separated from the host code (core). The core is
designed to handle basic setup, data storage and communication between nodes in
a computing pool. It has been tested on large CPU-clusters, as well as desktop
computers. The Mechanic may be used in computing dynamical maps, data
optimization or numerical integration. The code and sample modules are freely
available at http://git.astri.umk.pl/projects/mechanic.
","[{""version"":""v1"",""created"":""Wed, 29 Feb 2012 11:11:45 GMT""}]","2012-03-01"
"1202.6514","Tapio Rajala","Tapio Rajala","Improved geodesics for the reduced curvature-dimension condition in
  branching metric spaces","10 pages",,,,"math.DG math.AP math.FA math.MG","http://arxiv.org/licenses/nonexclusive-distrib/1.0/","  In this note we show that in metric measure spaces satisfying the reduced
curvature-dimension condition CD*(K,N) we always have geodesics in the
Wasserstein space of probability measures that satisfy the critical convexity
inequality of CD*(K,N) also for intermediate times and in addition the measures
along these geodesics have an upper-bound on their densities. This upper-bound
depends on the bounds for the densities of the end-point measures, the
lower-bound K for the Ricci-curvature, the upper-bound N for the dimension, and
on the diameter of the union of the supports of the end-point measures.
","[{""version"":""v1"",""created"":""Wed, 29 Feb 2012 11:12:29 GMT""}]","2012-03-01"
"1202.6515","Jianxin Yin","Jianxin Yin, Hongzhe Li","A sparse conditional Gaussian graphical model for analysis of genetical
  genomics data","Published in at http://dx.doi.org/10.1214/11-AOAS494 the Annals of
  Applied Statistics (http://www.imstat.org/aoas/) by the Institute of
  Mathematical Statistics (http://www.imstat.org)","Annals of Applied Statistics 2011, Vol. 5, No. 4, 2630-2650","10.1214/11-AOAS494","IMS-AOAS-AOAS494","stat.AP q-bio.QM","http://arxiv.org/licenses/nonexclusive-distrib/1.0/","  Genetical genomics experiments have now been routinely conducted to measure
both the genetic markers and gene expression data on the same subjects. The
gene expression levels are often treated as quantitative traits and are subject
to standard genetic analysis in order to identify the gene expression
quantitative loci (eQTL). However, the genetic architecture for many gene
expressions may be complex, and poorly estimated genetic architecture may
compromise the inferences of the dependency structures of the genes at the
transcriptional level. In this paper we introduce a sparse conditional Gaussian
graphical model for studying the conditional independent relationships among a
set of gene expressions adjusting for possible genetic effects where the gene
expressions are modeled with seemingly unrelated regressions. We present an
efficient coordinate descent algorithm to obtain the penalized estimation of
both the regression coefficients and the sparse concentration matrix. The
corresponding graph can be used to determine the conditional independence among
a group of genes while adjusting for shared genetic effects. Simulation
experiments and asymptotic convergence rates and sparsistency are used to
justify our proposed methods. By sparsistency, we mean the property that all
parameters that are zero are actually estimated as zero with probability
tending to one. We apply our methods to the analysis of a yeast eQTL data set
and demonstrate that the conditional Gaussian graphical model leads to a more
interpretable gene network than a standard Gaussian graphical model based on
gene expression data alone.
","[{""version"":""v1"",""created"":""Wed, 29 Feb 2012 11:14:12 GMT""}]","2012-03-01"
"1202.6516","Ulrich Langenfeld","Christoph Bartels, Olaf Kittel, Ulrich Langenfeld, Jenny List","Model-independent WIMP Characterisation using ISR","7 pages, 4 figures, International Workshop on Future Linear Colliders
  LCWS11",,,,"hep-ex","http://arxiv.org/licenses/nonexclusive-distrib/1.0/","  The prospects of measuring the parameters of WIMP dark matter in a model
independent way at the International Linear Collider are investigated. The
signal under study is direct WIMP pair production with associated initial state
radiation. The analysis is performed in full simulation of the ILD detector
concept. With an integrated luminosity of L = 500 fb-1 and realistic beam
polarizations the helicity structure of the WIMP couplings to electrons can be
determined, and the masses and cross sections can be measured to the percent
level. The systematic uncertainties are dominated by the polarization
measurement and the luminosity spectrum.
","[{""version"":""v1"",""created"":""Wed, 29 Feb 2012 11:14:19 GMT""},{""version"":""v2"",""created"":""Thu, 1 Mar 2012 09:43:12 GMT""}]","2012-03-02"
"1202.6517","Michal Ciesla","Michal Ciesla, Przemyslaw Koziol","Eye Pupil Location Using Webcam","11 pages, 11 figures",,,,"cs.HC cs.CV","http://arxiv.org/licenses/nonexclusive-distrib/1.0/","  Three different algorithms used for eye pupil location were described and
tested. Algorithm efficiency comparison was based on human faces images taken
from the BioID database. Moreover all the eye localisation methods were
implemented in a dedicated application supporting eye movement based computer
control. In this case human face images were acquired by a webcam and processed
in a real-time.
","[{""version"":""v1"",""created"":""Wed, 29 Feb 2012 11:17:10 GMT""}]","2012-03-01"
"1202.6518","Norbert Hoffmann","Indranil Biswas and Tom\'as L. G\'omez and Norbert Hoffmann","Torelli theorem for the Deligne--Hitchin moduli space, II","10 pages",,,,"math.AG","http://arxiv.org/licenses/nonexclusive-distrib/1.0/","  Let X and X' be compact Riemann surfaces of genus at least three. Let G and
G' be nontrivial connected semisimple linear algebraic groups over C. If some
components $M_{DH}^d(X,G)$ and $M_{DH}^{d'}(X',G')$ of the associated
Deligne--Hitchin moduli spaces are biholomorphic, then X' is isomorphic to X or
to the conjugate Riemann surface $\bar{X}$.
","[{""version"":""v1"",""created"":""Wed, 29 Feb 2012 11:23:10 GMT""}]","2012-03-01"
"1202.6519","Paramita Dutta","Paramita Dutta, Santanu K. Maiti, and S. N. Karmakar","Magneto-transport in a binary alloy ring","7 pages, 8 figures","Physics Letters A, Volume 376, Issue 18, 2 April 2012, Pages
  1567-1572","10.1016/j.physleta.2012.03.043",,"cond-mat.mes-hall","http://arxiv.org/licenses/nonexclusive-distrib/1.0/","  Magneto-transport properties are investigated in a binary alloy ring
subjected to an Aharonov-Bohm (AB) flux \phi within a single-band
non-interacting tight-binding framework. In the first part, we expose
analytically the behavior of persistent current in an isolated ordered binary
alloy ring as functions of electron concentration N_e and AB flux \phi. While,
in the second part of the article, we discuss electron transport properties
through a binary alloy ring attached to two semi-infinite one-dimensional
metallic electrodes. The effect of impurities is also analyzed. From our study
we propose that under suitable choices of the parameter values the system can
act as a p-type or an n-type semiconductor.
","[{""version"":""v1"",""created"":""Wed, 29 Feb 2012 11:38:39 GMT""},{""version"":""v2"",""created"":""Thu, 22 Mar 2012 10:13:29 GMT""},{""version"":""v3"",""created"":""Fri, 23 Mar 2012 06:12:12 GMT""}]","2012-04-10"
"1202.6520","Ido Schaefer","Ido Schaefer","Quantum Optimal Control Theory of Harmonic Generation","Master's thesis; 108 pages",,,,"quant-ph physics.chem-ph","http://arxiv.org/licenses/nonexclusive-distrib/1.0/","  A new method for controlling harmonic generation, in the framework of quantum
optimal control theory (QOCT), is developed. The problem is formulated in the
frequency domain using a new maximization functional. The relaxation method is
used as the optimization procedure. The new formulation is generalized to other
control problems with requirements in the frequency domain. The method is
applied to several simple problems. The results are analysed and discussed.
General conclusions on harmonic generation mechanisms are obtained.
","[{""version"":""v1"",""created"":""Wed, 29 Feb 2012 12:02:54 GMT""},{""version"":""v2"",""created"":""Mon, 27 Aug 2012 09:22:54 GMT""}]","2012-08-28"
"1202.6521","Xavier Pellegrin","Khashayar Pakdaman and Xavier Pellegrin","Coherence transition in degenerate diffusion equations with mean field
  coupling","20 pages, 10 figures",,,,"nlin.AO","http://arxiv.org/licenses/nonexclusive-distrib/1.0/","  We introduce non-linear diffusion in a classical diffusion advection model
with non local aggregative coupling on the circle, that exhibits a transition
from an uncoherent state to a coherent one when the coupling strength is
increased. We show first that all solutions of the equation converge to the set
of equilibria, second that the set of equilibria undergoes a bifurcation
representing the transition to coherence when the coupling strength is
increased. These two properties are similar to the situation with linear
diffusion. Nevertheless nonlinear diffusion alters the transition scenari,
which are different when the diffusion is sub-quadratic and when the diffusion
is super-quadratic. When the diffusion is super-quadratic, it results in a
multistability region that preceeds the pitchfork bifurcation at which the
uncoherent equilibrium looses stability. When the diffusion is quadratic the
pitchfork bifurcation at the onset of coherence is infinitely degenerate and a
disk of equilibria exist for the critical value of the coupling strength.
Another impact of nonlinear diffusion is that coherent equilibria become
localized when advection is strong enough, a phenomenon that is preculded when
the diffusion is linear.
","[{""version"":""v1"",""created"":""Wed, 29 Feb 2012 12:04:41 GMT""}]","2012-03-01"
"1202.6522","Nathana\""el Schaeffer","Nathana\""el Schaeffer","Efficient Spherical Harmonic Transforms aimed at pseudo-spectral
  numerical simulations","8 pages","Geochemistry, Geophysics, Geosystems, American Geophysical Union
  (AGU), 2013, 14 (3), pp.751-758","10.1002/ggge.20071",,"physics.comp-ph cs.MS cs.NA cs.PF","http://arxiv.org/licenses/nonexclusive-distrib/1.0/","  In this paper, we report on very efficient algorithms for the spherical
harmonic transform (SHT). Explicitly vectorized variations of the algorithm
based on the Gauss-Legendre quadrature are discussed and implemented in the
SHTns library which includes scalar and vector transforms. The main
breakthrough is to achieve very efficient on-the-fly computations of the
Legendre associated functions, even for very high resolutions, by taking
advantage of the specific properties of the SHT and the advanced capabilities
of current and future computers. This allows us to simultaneously and
significantly reduce memory usage and computation time of the SHT. We measure
the performance and accuracy of our algorithms. Even though the complexity of
the algorithms implemented in SHTns are in $O(N^3)$ (where N is the maximum
harmonic degree of the transform), they perform much better than any third
party implementation, including lower complexity algorithms, even for
truncations as high as N=1023. SHTns is available at
https://bitbucket.org/nschaeff/shtns as open source software.
","[{""version"":""v1"",""created"":""Wed, 29 Feb 2012 12:05:12 GMT""},{""version"":""v2"",""created"":""Sun, 9 Dec 2012 13:37:52 GMT""},{""version"":""v3"",""created"":""Tue, 29 Jan 2013 13:20:31 GMT""},{""version"":""v4"",""created"":""Thu, 20 Nov 2014 15:14:32 GMT""},{""version"":""v5"",""created"":""Wed, 7 Jan 2015 14:40:46 GMT""}]","2015-01-08"
"1202.6523","Jerome Pety","H. S. Liszt (NRAO), J. Pety (IRAM, OP)","Imaging diffuse clouds: Bright and dark gas mapped in CO","23 pages, 22 PostScript figures. Accepted for publication in
  Astronomy \& Astrophysics. Uses aa LaTeX macros",,"10.1051/0004-6361/201218771",,"astro-ph.GA","http://arxiv.org/licenses/nonexclusive-distrib/1.0/","  We wish to relate the degree scale structure of galactic diffuse clouds to
sub-arcsecond atomic and molecular absorption spectra obtained against
extragalactic continuum background sources. To do this, we used the ARO 12m
telescope to map J=1-0 CO emission at 1' resolution over 30' fields around the
positions of 11 background sources occulted by 20 molecular absorption line
components, of which 11 had CO emission counterparts. We compare maps of CO
emission to sub-arcsec atomic and molecular absorption spectra and to the
large-scale distribution of interstellar reddening. The main results are: 1)
Typical covering factors of individual features at the 1 K.km/s level were 20%.
2) CO-H2 conversion factors as much as 4-5 times below the mean value N(H2)/Wco
= 2e20 H2 cm^-2 /(K.km/s) are required to explain the luminosity of CO emission
at/above the level of 1 K.km/s. Small conversion factors and sharp variability
of the conversion factor on arcminute scales are due primarily to CO chemistry
and need not represent unresolved variations in reddening or total column
density. Hence, like FERMI and PLANCK we see some gas that is dark in CO and
other gas in which CO is overluminous per H2. A standard CO-H2 conversion
factor applies overall owing to balance between the luminosities per H2 and
surface covering factors of bright and dark CO., but with wide variations.
","[{""version"":""v1"",""created"":""Wed, 29 Feb 2012 12:07:18 GMT""}]","2015-06-04"
"1202.6524","Enrique F. Schisterman","Enrique F. Schisterman, Albert Vexler, Aijun Ye, Neil J. Perkins","A combined efficient design for biomarker data subject to a limit of
  detection due to measuring instrument sensitivity","Published in at http://dx.doi.org/10.1214/11-AOAS490 the Annals of
  Applied Statistics (http://www.imstat.org/aoas/) by the Institute of
  Mathematical Statistics (http://www.imstat.org)","Annals of Applied Statistics 2011, Vol. 5, No. 4, 2651-2667","10.1214/11-AOAS490","IMS-AOAS-AOAS490","stat.AP","http://arxiv.org/licenses/nonexclusive-distrib/1.0/","  Pooling specimens, a well-accepted sampling strategy in biomedical research,
can be applied to reduce the cost of studying biomarkers. Even if the cost of a
single assay is not a major restriction in evaluating biomarkers, pooling can
be a powerful design that increases the efficiency of estimation based on data
that is censored due to an instrument's lower limit of detection (LLOD).
However, there are situations when the pooling design strongly aggravates the
detection limit problem. To combine the benefits of pooled assays and
individual assays, hybrid designs that involve taking a sample of both pooled
and individual specimens have been proposed. We examine the efficiency of these
hybrid designs in estimating parameters of two systems subject to a LLOD: (1)
normally distributed biomarker with normally distributed measurement error and
pooling error; (2) Gamma distributed biomarker with double exponentially
distributed measurement error and pooling error. Three-assay design and
two-assay design with replicates are applied to estimate the measurement and
pooling error. The Maximum likelihood method is used to estimate the
parameters. We found that the simple one-pool design, where all assays but one
are random individuals and a single pooled assay includes the remaining
specimens, under plausible conditions, is very efficient and can be recommended
for practical use.
","[{""version"":""v1"",""created"":""Wed, 29 Feb 2012 12:10:19 GMT""}]","2012-03-01"
"1202.6525","J\""org Arndt","J\""org Arndt","On computing the generalized Lambert series","8 pages; now mentioned that identity (1) appears in a 1993 paper by
  R. P. Agarwal",,,,"math.CA","http://arxiv.org/licenses/nonexclusive-distrib/1.0/","  We show how the generalized Lambert series sum(n>=1, x*q^n/(1-x*q^n)) can be
computed with Theta convergence. This allows the computation of the sum of the
inverse Fibonacci numbers without splitting the sum into even and odd part. The
method is a special case of an expression for the more general series sum(n>=0,
t^n/(1-x*q^n)), which can be obtained from either the Rogers-Fine identity or
an identity by Osler and Hassen.
","[{""version"":""v1"",""created"":""Wed, 29 Feb 2012 12:10:54 GMT""},{""version"":""v2"",""created"":""Thu, 22 Mar 2012 15:56:12 GMT""},{""version"":""v3"",""created"":""Sun, 24 Jun 2012 11:26:04 GMT""}]","2012-06-26"
"1202.6526","Naoki Masuda Dr.","Shun-ichi Amari, Hiroyasu Ando, Taro Toyoizumi, Naoki Masuda","State Concentration Exponent as a Measure of Quickness in Kauffman-type
  Networks","6 figures","Physical Review E, 87, 022814 (2013)","10.1103/PhysRevE.87.022814",,"cond-mat.dis-nn nlin.AO","http://arxiv.org/licenses/nonexclusive-distrib/1.0/","  We study the dynamics of randomly connected networks composed of binary
Boolean elements and those composed of binary majority vote elements. We
elucidate their differences in both sparsely and densely connected cases. The
quickness of large network dynamics is usually quantified by the length of
transient paths, an analytically intractable measure. For discrete-time
dynamics of networks of binary elements, we address this dilemma with an
alternative unified framework by using a concept termed state concentration,
defined as the exponent of the average number of t-step ancestors in state
transition graphs. The state transition graph is defined by nodes corresponding
to network states and directed links corresponding to transitions. Using this
exponent, we interrogate the dynamics of random Boolean and majority vote
networks. We find that extremely sparse Boolean networks and majority vote
networks with arbitrary density achieve quickness, owing in part to long-tailed
in-degree distributions. As a corollary, only relatively dense majority vote
networks can achieve both quickness and robustness.
","[{""version"":""v1"",""created"":""Wed, 29 Feb 2012 12:14:00 GMT""},{""version"":""v2"",""created"":""Tue, 3 Apr 2012 13:32:33 GMT""},{""version"":""v3"",""created"":""Tue, 5 Mar 2013 01:46:10 GMT""}]","2013-03-06"
"1202.6527","Janne Holma","Janne Holma, Mike Barnes, Caroline Belver-Aguilar, Angeles Faus-Golfe
  and Fernando Toral","Present status of development of damping ring extraction kicker system
  for CLIC","Proceedings of LCWS'11, International Workshop on Future Linear
  Colliders, Granada, Spain 26-30 Sept 2011",,,,"physics.acc-ph","http://arxiv.org/licenses/nonexclusive-distrib/1.0/","  The CLIC damping rings will produce ultra-low emittance beam, with high bunch
charge, necessary for the luminosity performance of the collider. To limit the
beam emittance blow-up due to oscillations, the pulse power modulators for the
damping ring kickers must provide extremely flat, high-voltage pulses:
specifications call for a 160 ns duration and a flattop of 12.5 kV, 250 A, with
a combined ripple and droop of not more than \pm0.02 %. The stripline design is
also extremely challenging: the field for the damping ring kicker system must
be homogenous to within \pm0.01 % over a 1 mm radius, and low beam coupling
impedance is required. The solid-state modulator, the inductive adder, is a
very promising approach to meeting the demanding specifications for the field
pulse ripple and droop. This paper describes the initial design of the
inductive adder and the striplines of the kicker system.
","[{""version"":""v1"",""created"":""Wed, 29 Feb 2012 12:22:02 GMT""}]","2012-03-01"
"1202.6528","Malte Wandel","Malte Wandel","Stability of tautological bundles on the Hilbert scheme of two points on
  a surface","14 pages, minors corrections of typos, replaced Lemma 2.2 by Def 2.2
  and Prop. 2.3, to appear in Nag. Math. J","Nagoya Math. J. 214 (2014), 79-94","10.1215/00277630-2416410",,"math.AG","http://arxiv.org/licenses/nonexclusive-distrib/1.0/","  Let (X,H) be a polarized smooth projective surface satisfying H^1(X,O_X)=0
and let F be either a rank one torsion-free sheaf or a rank two {\mu}H-stable
vector bundle on X. Assume that c_1(F)/=0. In this article it is shown that the
rank two, respectively rank four tautological sheaf F^{[2]} associated with F
on the Hilbert square X^{[2]} is {\mu}-stable with respect to a certain
polarization.
","[{""version"":""v1"",""created"":""Wed, 29 Feb 2012 12:27:26 GMT""},{""version"":""v2"",""created"":""Tue, 13 Mar 2012 12:36:22 GMT""},{""version"":""v3"",""created"":""Wed, 22 May 2013 12:56:48 GMT""}]","2015-01-14"
