"1202.6334","Antonio Bartalesi","Antonio Bartalesi","Finite Elements Magnetic Analysis of the CLIC MDI Region","7 pages, LCWS11 Granada",,,,"physics.acc-ph physics.ins-det","http://arxiv.org/licenses/nonexclusive-distrib/1.0/","  Considering the current CLIC SiD detector design and the machine parameter
L*, the final focus quadrupole QD0 will be placed inside the experiment itself.
This configuration is very challenging from an integration point of view. Among
several other aspects, the iron-dominated QD0 will need an active magnetic
shielding to avoid undesired interactions with the magnetic field generated by
the main solenoid of the detector. This shielding will be provided by a
superconducting anti-solenoid, and this paper aims to describe the method used
to design such device, the results obtained and the issues still to be solved.
","[{""version"":""v1"",""created"":""Tue, 28 Feb 2012 19:57:01 GMT""}]","2012-02-29"
"1202.6335","Sanjiv Kumar Tiwari Dr","Sanjiv Kumar Tiwari","Defect related photoluminescence and EPR study of sintered
  polycrystalline ZnO","16 pages, 6 figures, submitted to Journal of Physics D",,,,"cond-mat.mtrl-sci","http://creativecommons.org/licenses/publicdomain/","  We report on low temperature photoluminescence (PL) and EPR study of bulk
polycrystalline ZnO . Variation of peak position of donor bound exciton
transition (D1XA) and FXAn=1-1LO with pump intensity show red shift and blue
shift respectively due to exciton-exciton scattering. EPR spectra reveals three
peaks at g value of 1.985, 1.956 and 1.939 respectively, g=1.956 and g=1.985 is
due to shallow donors Zn interstitial and oxygen vacancy respectively An EPR
spectrum at 100 K reveals higher degree of asymmetry and hyperfine splitting
due to crystal field and inhomogeneous relaxation of paramagnetic centers.
Strength of crystal field splitting (CFS) and spin orbit coupling (SOC) in
sample is discussed using PL peak position of various excitonic emissions.
Whereas, inhomogeneous relaxation of paramagnetic centers is discussed in terms
of their activation energy during thermal quenching process.
","[{""version"":""v1"",""created"":""Tue, 28 Feb 2012 19:57:38 GMT""}]","2012-02-29"
"1202.6336","Pier Francesco Monni","Pier Francesco Monni","Thrust distribution resummation in e^{+}e^{-} collisions","10 pages, 9 figures. Talk presented at ""LCWS 2011: International
  Workshop on Future Linear Colliders"", 26-30 September 2011, Granada, Spain",,,,"hep-ph","http://arxiv.org/licenses/nonexclusive-distrib/1.0/","  In this talk we report on the recent progresses on IR logarithms resummation
for the Thrust distribution in e^{+}e^{-} collisions. Using renormalisation
group (RG) evolution in Laplace space, the resummation of logarithmically
enhanced corrections is performed to next-to-next-to-leading logarithmic (NNLL)
accuracy. To combine the resummed expressions with the fixed-order results, we
derive the log(R)-matching and R-matching of the NNLL approximation to the
fixed-order NNLO distribution.
","[{""version"":""v1"",""created"":""Tue, 28 Feb 2012 20:01:21 GMT""}]","2012-02-29"
"1202.6338","Sanjiv Kumar Tiwari Dr","Sanjiv Kumar Tiwari","Study of amplified emission in polycrystalline ZnO below characteristic
  temperature","18 pages, 6 figures, to be submitted",,,,"physics.optics cond-mat.mtrl-sci","http://creativecommons.org/licenses/publicdomain/","  We report on amplified emission in polycrystalline ZnO below 100K. At 6K
emission is due to free exciton FXn=1 A (3.378 eV), bound exciton D1XA (3.347
eV), donor acceptor pair DAP (3.275 eV) and longitudinal phonon replica of free
excitons (FXn=1 A -mLO, m= 1,2,3) respectively. Peak intensity of D1XA and
FXn=1 A -1LO transition increases non-linearly with increase of excitation
intensity due to exciton-exciton scattering. Peak position of D1XA shows red
shift while FXn=1 A -1LO shows blue shift with increase of excitation
intensity. Fraction of exciton taking part in emission process and radiative
lifetime of exciton decreases with decrease of temperature .Threshold value of
excitation for D1XA decreases exponentially with decrease of temperature upto
100K. Whereas, below 100K no functional behaviour is observed. Threshold for
FXn=1A-1LO emission was observed up to 75K, at higher temperature it is mixed
with D1XA. Time delayed photoluminescence measurement reveals that amplified
emission decay faster than spontaneous emission.
","[{""version"":""v1"",""created"":""Tue, 28 Feb 2012 20:05:15 GMT""}]","2012-02-29"
"1202.6339","Hannes Roberts","Grant Larsen, Yasunori Nomura, Hannes L.L. Roberts","Supersymmetry with Light Stops","27 pages, 7 figures",,"10.1007/JHEP06(2012)032","UCB-PTH-12/03","hep-ph","http://arxiv.org/licenses/nonexclusive-distrib/1.0/","  Recent LHC data, together with the electroweak naturalness argument, suggest
that the top squarks may be significantly lighter than the other sfermions. We
present supersymmetric models in which such a split spectrum is obtained
through ""geometries"": being ""close to"" electroweak symmetry breaking implies
being ""away from"" supersymmetry breaking, and vice versa. In particular, we
present models in 5D warped spacetime, in which supersymmetry breaking and
Higgs fields are located on the ultraviolet and infrared branes, respectively,
and the top multiplets are localized to the infrared brane. The hierarchy of
the Yukawa matrices can be obtained while keeping near flavor degeneracy
between the first two generation sfermions, avoiding stringent constraints from
flavor and CP violation. Through the AdS/CFT correspondence, the models can be
interpreted as purely 4D theories in which the top and Higgs multiplets are
composites of some strongly interacting sector exhibiting nontrivial dynamics
at a low energy. Because of the compositeness of the Higgs and top multiplets,
Landau pole constraints for the Higgs and top couplings apply only up to the
dynamical scale, allowing for a relatively heavy Higgs boson, including m_h =
125 GeV as suggested by the recent LHC data. We analyze electroweak symmetry
breaking for a well-motivated subset of these models, and find that fine-tuning
in electroweak symmetry breaking is indeed ameliorated. We also discuss a flat
space realization of the scenario in which supersymmetry is broken by boundary
conditions, with the top multiplets localized to a brane while other matter
multiplets delocalized in the bulk.
","[{""version"":""v1"",""created"":""Tue, 28 Feb 2012 20:05:18 GMT""}]","2015-06-04"
"1202.6340","Benjamin Howard","Benjamin Howard","The Heegner point Kolyvagin system",,"Compos. Math. 141, No 6 (2004), 1439-1472",,,"math.NT","http://arxiv.org/licenses/nonexclusive-distrib/1.0/","  Perrin-Riou has formulated a form of the Iwasawa main conjecture, which
relates Heegner points to the Selmer group of an elliptic curve as one goes up
the anticyclotomic Z_p extension of a quadratic imaginary field K. Building on
the earlier work of Bertolini on this conjecture, and making use of the recent
work of Mazur and Rubin on Kolyvagin's theory of Euler systems, we prove one
divisibility of Perrin-Riou's conjectured equality. As a consequence, one
obtains an upper bound on the rank of the Mordell-Weil group E(K) in terms of
Heegner points.
","[{""version"":""v1"",""created"":""Tue, 28 Feb 2012 20:05:56 GMT""}]","2012-03-01"
"1202.6342","Benjamin Howard","Benjamin Howard","Iwasawa theory of Heegner points on abelian varieties of GL_2 type",,"Duke Math. J. 124, No. 1 (2004), 1-45",,,"math.NT","http://arxiv.org/licenses/nonexclusive-distrib/1.0/","  In an earlier paper the author proved one divisibility of Perrin- Riou's
Iwasawa main conjecture for Heegner points on elliptic curves. In the present
paper, that result is generalized to abelian varieties of GL2-type (i.e.
abelian varieties with real multiplication defined over totally real fields)
under the hypothesis that the abelian variety is associated to a Hilbert
modular form via a construction of Zhang.
","[{""version"":""v1"",""created"":""Tue, 28 Feb 2012 20:09:40 GMT""}]","2012-02-29"
"1202.6343","Benjamin Howard","Benjamin Howard","Derived p-adic heights and p-adic L-functions",,"Amer. J. Math. 126, No. 6 (2004), 1315-1340",,,"math.NT","http://arxiv.org/licenses/nonexclusive-distrib/1.0/","  If E is an elliptic curve defined over a number field and p is a prime of
good ordinary reduction for E, a theorem of Rubin relates the p-adic height
pairing on the p-power Selmer group of E to the first derivative of a
cohomologically defined p-adic L-function attached to E. Bertolini and Darmon
have defined a sequence of ""derived"" p-adic heights. In this paper we give an
alternative definition of the p-adic height pairing and prove a generalization
of Rubin's result, relating the derived heights to higher derivatives of p-adic
L-functions. We also relate degeneracies in the derived heights to the failure
of the Selmer group of E over a Z_p-extension to be ""semi-simple"" as an Iwasawa
module, generalizing results of Perrin-Riou.
","[{""version"":""v1"",""created"":""Tue, 28 Feb 2012 20:13:40 GMT""}]","2012-02-29"
"1202.6344","Gabriela Jeronimo","Lisi D'Alfonso, Gabriela Jeronimo and Pablo Solern\'o","Effective Differential L\""uroth's Theorem",,,,,"math.AC cs.SC","http://arxiv.org/licenses/nonexclusive-distrib/1.0/","  This paper focuses on effectivity aspects of the L\""uroth's theorem in
differential fields. Let $\mathcal{F}$ be an ordinary differential field of
characteristic 0 and $\mathcal{F}<u>$ be the field of differential rational
functions generated by a single indeterminate $u$. Let be given non constant
rational functions $v_1,...,v_n\in \mathcal{F}<u>$ generating a differential
subfield $\mathcal{G}\subseteq \mathcal{F}<e u>$. The differential L\""uroth's
theorem proved by Ritt in 1932 states that there exists $v\in \mathcal G$ such
that $\mathcal{G}= \mathcal{F}<v>$. Here we prove that the total order and
degree of a generator $v$ are bounded by $\min_j \textrm{ord} (v_j)$ and
$(nd(e+1)+1)^{2e+1}$, respectively, where $e:=\max_j \textrm{ord} (v_j)$ and
$d:=\max_j \textrm{deg} (v_j)$. As a byproduct, our techniques enable us to
compute a L\""uroth generator by dealing with a polynomial ideal in a polynomial
ring in finitely many variables.
","[{""version"":""v1"",""created"":""Tue, 28 Feb 2012 20:19:21 GMT""},{""version"":""v2"",""created"":""Mon, 1 Jul 2013 21:36:47 GMT""}]","2013-07-03"
"1202.6345","Hernan A. Makse","Lazaros K. Gallos, Pablo Barttfeld, Shlomo Havlin, Mariano Sigman,
  Hernan A. Makse","Collective behavior in the spatial spreading of obesity","9 pages, 4 figures","Sci. Rep. 2, 454 (2012)",,,"physics.soc-ph cs.SI","http://arxiv.org/licenses/nonexclusive-distrib/1.0/","  Non-communicable diseases like diabetes, obesity and certain forms of cancer
have been increasing in many countries at alarming levels. A difficulty in the
conception of policies to reverse these trends is the identification of the
drivers behind the global epidemics. Here, we implement a spatial spreading
analysis to investigate whether diabetes, obesity and cancer show spatial
correlations revealing the effect of collective and global factors acting above
individual choices. We adapt a theoretical framework for critical physical
systems displaying collective behavior to decipher the laws of spatial
spreading of diseases. We find a regularity in the spatial fluctuations of
their prevalence revealed by a pattern of scale-free long-range correlations.
The fluctuations are anomalous, deviating in a fundamental way from the weaker
correlations found in the underlying population distribution. This collective
behavior indicates that the spreading dynamics of obesity, diabetes and some
forms of cancer like lung cancer are analogous to a critical point of
fluctuations, just as a physical system in a second-order phase transition.
According to this notion, individual interactions and habits may have
negligible influence in shaping the global patterns of spreading. Thus, obesity
turns out to be a global problem where local details are of little importance.
Interestingly, we find the same critical fluctuations in obesity and diabetes,
and in the activities of economic sectors associated with food production such
as supermarkets, food and beverage stores--- which cluster in a different
universality class than other generic sectors of the economy. These results
motivate future interventions to investigate the causality of this relation
providing guidance for the implementation of preventive health policies.
","[{""version"":""v1"",""created"":""Tue, 28 Feb 2012 20:21:11 GMT""},{""version"":""v2"",""created"":""Mon, 28 Mar 2016 00:57:25 GMT""}]","2016-03-29"
"1202.6346","Daping Du","Jon A. Bailey, A. Bazavov, C. Bernard, C.M. Bouchard, C. DeTar, Daping
  Du, A.X. El-Khadra, J. Foley, E.D. Freeland, E. Gamiz, Steven Gottlieb, U.M.
  Heller, Jongjeong Kim, A.S. Kronfeld, J. Laiho, L. Levkova, P.B. Mackenzie,
  Y. Meurice, E. Neil, M.B. Oktay, Si-Wei Qiu, J.N. Simone, R. Sugar, D.
  Toussaint, R.S. Van de Water and Ran Zhou","B_s->D_s/B->D Semileptonic Form-Factor Ratios and Their Application to
  BR(B^0_s->\mu^+\mu^-)","30 pages, 11 figures. Fig. 1 updated. Table II added. Conforms with
  version published in Physical Review D, except typos fixed, as in the PRD
  Erratum, in Table V (previously Table IV in arXiv v1). Results unchanged",,"10.1103/PhysRevD.85.114502",,"hep-lat hep-ex","http://arxiv.org/licenses/nonexclusive-distrib/1.0/","  We calculate form-factor ratios between the semileptonic decays
\bar{B}->D^+\ell^-\bar{\nu} and \bar{B}_s->D_s^+\ell^-\bar{\nu} with lattice
QCD. These ratios are a key theoretical input in a new strategy to determine
the fragmentation fractions of the neutral B decays, which are needed for
measurements of BR(B^0_s-> \mu^+\mu^-). We use the MILC ensembles of gauge
configurations with 2+1 flavors of sea quarks at two lattice spacings of
approximately 0.12 fm and 0.09 fm. We use the model-independent
z-parametrization to extrapolate our simulation results at small recoil toward
maximum recoil. Our results for the form-factor ratios are
$f_0^{(s)}(M^2_\pi)/f_0^{(d)}(M^2_K) =1.046(44)_{stat.}(15)_{syst.}$ and
$f_0^{(s)}(M^2_\pi)/f_0^{(d)}(M^2_\pi)=1.054(47)_{stat.}(17)_{syst.}$. In
contrast to a QCD sum-rule calculation, no significant departure from U-spin
(d<->s) symmetry is observed.
","[{""version"":""v1"",""created"":""Tue, 28 Feb 2012 20:21:28 GMT""},{""version"":""v2"",""created"":""Tue, 24 Jul 2012 20:27:56 GMT""}]","2012-07-26"
"1202.6347","Lie Wang","Lie Wang","L1 penalized LAD estimator for high dimensional linear",,,,,"stat.ME","http://arxiv.org/licenses/nonexclusive-distrib/1.0/","  In this paper, the high-dimensional sparse linear regression model is
considered, where the overall number of variables is larger than the number of
observations. We investigate the L1 penalized least absolute deviation method.
Different from most of other methods, the L1 penalized LAD method does not need
any knowledge of standard deviation of the noises or any moment assumptions of
the noises. Our analysis shows that the method achieves near oracle
performance, i.e. with large probability, the L2 norm of the estimation error
is of order $O(\sqrt{k \log p/n})$. The result is true for a wide range of
noise distributions, even for the Cauchy distribution. Numerical results are
also presented.
","[{""version"":""v1"",""created"":""Tue, 28 Feb 2012 20:27:55 GMT""}]","2012-02-29"
"1202.6348","Aris L. Moustakas","Aris L. Moustakas, Panayotis Mertikopoulos and Nicholas Bambos","Power Optimization in Random Wireless Networks","Submitted to IEEE Trans. Inform. Theory",,,,"cs.IT cond-mat.stat-mech cs.SI math.IT","http://arxiv.org/licenses/nonexclusive-distrib/1.0/","  Consider a wireless network of transmitter-receiver pairs where the
transmitters adjust their powers to maintain a target SINR level in the
presence of interference. In this paper, we analyze the optimal power vector
that achieves this target in large, random networks obtained by ""erasing"" a
finite fraction of nodes from a regular lattice of transmitter-receiver pairs.
We show that this problem is equivalent to the so-called Anderson model of
electron motion in dirty metals which has been used extensively in the analysis
of diffusion in random environments. A standard approximation to this model is
the so-called coherent potential approximation (CPA) method which we apply to
evaluate the first and second order intra-sample statistics of the optimal
power vector in one- and two-dimensional systems. This approach is equivalent
to traditional techniques from random matrix theory and free probability, but
while generally accurate (and in agreement with numerical simulations), it
fails to fully describe the system: in particular, results obtained in this way
fail to predict when power control becomes infeasible. In this regard, we find
that the infinite system is always unstable beyond a certain value of the
target SINR, but any finite system only has a small probability of becoming
unstable. This instability probability is proportional to the tails of the
eigenvalue distribution of the system which are calculated to exponential
accuracy using methodologies developed within the Anderson model and its ties
with random walks in random media. Finally, using these techniques, we also
calculate the tails of the system's power distribution under power control and
the rate of convergence of the Foschini-Miljanic power control algorithm in the
presence of random erasures. Overall, in the paper we try to strike a balance
between intuitive arguments and formal proofs.
","[{""version"":""v1"",""created"":""Tue, 28 Feb 2012 20:28:11 GMT""},{""version"":""v2"",""created"":""Tue, 17 Dec 2013 18:44:01 GMT""}]","2014-01-16"
"1202.6349","Benjamin Howard","Benjamin Howard","The Iwasawa-theoretic Gross-Zagier theorem",,"Compos. Math. 141, No. 4 (2005), 811-846",,,"math.NT","http://arxiv.org/licenses/nonexclusive-distrib/1.0/","  We prove Mazur and Rubin's Iwasawa-theoretic Gross-Zagier conjecture (under
some restrictive hypotheses), which relates Heegner points in towers of number
fields to the 2-variable p-adic L-function. The result generalizes
Perrin-Riou's p-adic Gross-Zagier theorem.
","[{""version"":""v1"",""created"":""Tue, 28 Feb 2012 20:28:19 GMT""}]","2012-02-29"
"1202.6350","Jakob Lemvig","Jakob Lemvig, Christopher Miller, and Kasso A. Okoudjou","Prime tight frames",,,,,"math.FA cs.IT math.IT","http://arxiv.org/licenses/nonexclusive-distrib/1.0/","  We introduce a class of finite tight frames called prime tight frames and
prove some of their elementary properties. In particular, we show that any
finite tight frame can be written as a union of prime tight frames. We then
characterize all prime harmonic tight frames and use this characterization to
suggest effective analysis and synthesis computation strategies for such
frames. Finally, we describe all prime frames constructed from the spectral
tetris method, and, as a byproduct, we obtain a characterization of when the
spectral tetris construction works for redundancies below two.
","[{""version"":""v1"",""created"":""Tue, 28 Feb 2012 20:28:46 GMT""},{""version"":""v2"",""created"":""Thu, 12 Apr 2012 19:48:14 GMT""},{""version"":""v3"",""created"":""Sun, 29 Jul 2012 21:55:50 GMT""}]","2012-07-31"
"1202.6351","Kannan Premnath","Yang Ning and Kannan N. Premnath","Numerical Study of the Properties of the Central Moment Lattice
  Boltzmann Method","42 pages, 19 figures",,,,"physics.comp-ph nlin.CG","http://creativecommons.org/licenses/by/3.0/","  Central moment lattice Boltzmann method (LBM) is one of the more recent
developments among the lattice kinetic schemes for computational fluid
dynamics. A key element in this approach is the use of central moments to
specify collision process and forcing, and thereby naturally maintaining
Galilean invariance, an important characteristic of fluid flows. When the
different central moments are relaxed at different rates like in a standard
multiple relaxation time (MRT) formulation based on raw moments, it is endowed
with a number of desirable physical and numerical features. Since the collision
operator exhibits a cascaded structure, this approach is also known as the
cascaded LBM. While the cascaded LBM has been developed sometime ago, a
systematic study of its numerical properties, such as accuracy, grid
convergence and stability for well defined canonical problems is lacking and
the present work is intended to fulfill this need. We perform a quantitative
study of the performance of the cascaded LBM for a set of benchmark problems of
differing complexity, viz., Poiseuille flow, decaying Taylor-Green vortex flow
and lid-driven cavity flow. We first establish its grid convergence and
demonstrate second order accuracy under diffusive scaling for both the velocity
field and its derivatives, i.e. components of the strain rate tensor, as well.
The method is shown to quantitatively reproduce steady/unsteady analytical
solutions or other numerical results with excellent accuracy. Numerical
experiments further demonstrate that the central moment MRT LBM results in
significant stability improvements when compared with certain existing
collision models at moderate additional computational cost.
","[{""version"":""v1"",""created"":""Tue, 28 Feb 2012 20:37:42 GMT""}]","2012-02-29"
"1202.6352","Matthias Baaz","Matthias Baaz (Department of Discrete Mathematics and Geometry, TU
  Vienna), Agata Ciabattoni (Department of Computer Languages, TU Vienna),
  Christian G Ferm\""uller (Department of Computer Languages, TU Vienna)","Theorem proving for prenex G\""odel logic with Delta: checking validity
  and unsatisfiability","23 pages, accepted for LMCS (Logical Methods in Computer Science)","Logical Methods in Computer Science, Volume 8, Issue 1 (March 6,
  2012) lmcs:833","10.2168/LMCS-8(1:20)2012",,"cs.LO","http://arxiv.org/licenses/nonexclusive-distrib/1.0/","  G\""odel logic with the projection operator Delta (G_Delta) is an important
many-valued as well as intermediate logic. In contrast to classical logic, the
validity and the satisfiability problems of G_Delta are not directly dual to
each other. We nevertheless provide a uniform, computational treatment of both
problems for prenex formulas by describing appropriate translations into sets
of order clauses that can be subjected to chaining resolution. For validity a
version of Herbrand's Theorem allows us to show the soundness of standard
Skolemization. For satisfiability the translation involves a novel, extended
Skolemization method.
","[{""version"":""v1"",""created"":""Tue, 28 Feb 2012 20:38:20 GMT""},{""version"":""v2"",""created"":""Mon, 5 Mar 2012 15:58:01 GMT""}]","2015-07-01"
"1202.6353","Benjamin Howard","Benjamin Howard","Bipartite Euler systems",,"J. Reine Angew. Math. 597, (2006), 1-25",,,"math.NT","http://arxiv.org/licenses/nonexclusive-distrib/1.0/","  If E is an elliptic curve over Q and K is an imaginary quadratic field, there
is an Iwasawa main conjecture predicting the behavior of the Selmer group of E
over the anticyclotomic Z_p-extension of K. The main conjecture takes different
forms depending on the sign of the functional equation of L(E/K,s). In the
present work we combine ideas of Bertolini and Darmon with those of Mazur and
Rubin to shown that the main conjecture, regardless of the sign of the
functional equation, can be reduced to proving the nonvanishing of sufficiently
many p-adic L-functions attached to a family of congruent modular forms.
","[{""version"":""v1"",""created"":""Tue, 28 Feb 2012 20:42:51 GMT""}]","2012-02-29"
"1202.6354","Bernhard Haslhofer","Bernhard Haslhofer, Robert Sanderson, Rainer Simon, Herbert van de
  Sompel","Open Annotations on Multimedia Web Resources","20 pages",,,,"cs.DL","http://creativecommons.org/licenses/publicdomain/","  Many Web portals allow users to associate additional information with
existing multimedia resources such as images, audio, and video. However, these
portals are usually closed systems and user-generated annotations are almost
always kept locked up and remain inaccessible to the Web of Data. We believe
that an important step to take is the integration of multimedia annotations and
the Linked Data principles. We present the current state of the Open Annotation
Model, explain our design rationale, and describe how the model can represent
user annotations on multimedia Web resources. Applying this model in Web
portals and devices, which support user annotations, should allow clients to
easily publish and consume, thus exchange annotations on multimedia Web
resources via common Web standards.
","[{""version"":""v1"",""created"":""Tue, 28 Feb 2012 20:46:54 GMT""}]","2012-02-29"
"1202.6355","Benjamin Howard","Benjamin Howard","Special cohomology classes for modular Galois representations",,"J. Number Theory 117, No. 2 (2006), 406-438",,,"math.NT","http://arxiv.org/licenses/nonexclusive-distrib/1.0/","  Building on ideas of Vatsal, Cornut proved a conjecture of Mazur asserting
the generic nonvanishing of Heegner points on an elliptic curve E as one
ascends the anticyclotomic Z_p-extension of a quadratic imaginary extension
K/Q. In the present article Cornut's result is extended by replacing the
elliptic curve E with the Galois cohomology of Deligne's 2-dimensional l-adic
representation attached to a modular form of weight 2k>2, and replacing the
family of Heegner points with an analogous family of special cohomology
classes.
","[{""version"":""v1"",""created"":""Tue, 28 Feb 2012 20:47:35 GMT""}]","2012-02-29"
