"1202.6413","David Pitts","David R. Pitts","Structure for Regular Inclusions","62 pages, proof of Theorem 4.8 corrected, references added",,,,"math.OA","http://arxiv.org/licenses/nonexclusive-distrib/1.0/","  We study pairs (C,D) of unital C*-algebras where D is a regular abelian
C*-subalgebra of C. When D is a MASA in C, we prove the existence and
uniqueness of a completely positive unital map E of C into the injective
envelope I(D) of D whose restriction to D is the identity on D. We show that
the left kernel of E, L(C,D), is the unique closed two-sided ideal of C maximal
with respect to having trivial intersection with D. When L(C,D)=0, we show the
MASA D norms C. We apply these results to extend existing results in the
literature on isometric isomorphisms of norm-closed subalgebras which lie
between D and C.
  The map E can be used as a substitute for a conditional expectation in the
construction of coordinates for C relative to D. Coordinate constructions of
Kumjian and Renault may partially be extended to settings where no conditional
expectation exists.
  As an example, we consider the situation in which C is the reduced crossed
product of a unital abelian C*-algebra D by an arbitrary discrete group acting
as automorphisms of D. We characterize when the relative commutant, D', of D in
C is abelian in terms of the dynamics of the action of the group and show that
when D' is abelian, L(C,D')=0. This setting produces examples where no
conditional expectation of C onto D' exists.
  When C is separable, and D is a regular MASA in C, we show the set of pure
states on D with unique state extensions to C is dense in D. We introduce a new
class of well behaved state extensions, the compatible states; we identify
compatible states when D is a MASA in C in terms of groups constructed from
local dynamics near a pure state on D.
  A particularly nice class of regular inclusions is the class of C*-diagonals.
We show that the pair (C,D) regularly embeds into a C*-diagonal precisely when
the intersection of the left kernels of the compatible states is trivial.
","[{""version"":""v1"",""created"":""Tue, 28 Feb 2012 23:55:58 GMT""},{""version"":""v2"",""created"":""Sat, 7 Apr 2012 19:41:11 GMT""}]","2012-04-10"
"1202.6414","Koji Momihara","Koji Momihara","Strongly Regular Cayley Graphs, Skew Hadamard Difference Sets, and
  Rationality of Relative Gauss Sums","19 pages",,,,"math.CO math.NT","http://arxiv.org/licenses/nonexclusive-distrib/1.0/","  In this paper, we give constructions of strongly regular Cayley graphs and
skew Hadamard difference sets. Both constructions are based on choosing
cyclotomic classes in finite fields, and our results generalize ten of the
eleven sporadic examples of cyclotomic strongly regular graphs given by Schmidt
and White [24] and several of subfield examples into infinite families. These
infinite families of strongly regular graphs have new parameters. The main
tools that we employed are relative Gauss sums instead of explicit evaluations
of Gauss sums.
","[{""version"":""v1"",""created"":""Tue, 28 Feb 2012 23:56:08 GMT""}]","2012-03-01"
"1202.6415","Kimball A. Milton","Kimball A. Milton, E. K. Abalo, Prachi Parashar, Nima Pourtolami, Iver
  Brevik, and Simen A. Ellingsen","Repulsive Casimir and Casimir-Polder Forces","24 pages, 14 figures, contribution to the special issue of J. Phys. A
  honoring Stuart Dowker. This revision corrects typos and adds additional
  references and discussion","J. Phys. A 45, 374006 (2012)","10.1088/1751-8113/45/37/374006",,"hep-th quant-ph","http://arxiv.org/licenses/nonexclusive-distrib/1.0/","  Casimir and Casimir-Polder repulsion have been known for more than 50 years.
The general ""Lifshitz"" configuration of parallel semi-infinite dielectric slabs
permits repulsion if they are separated by a dielectric fluid that has a value
of permittivity that is intermediate between those of the dielectric slabs.
This was indirectly confirmed in the 1970s, and more directly by Capasso's
group recently. It has also been known for many years that electrically and
magnetically polarizable bodies can experience a repulsive quantum vacuum
force. More amenable to practical application are situations where repulsion
could be achieved between ordinary conducting and dielectric bodies in vacuum.
The status of the field of Casimir repulsion with emphasis on recent
developments will be surveyed. Here, stress will be placed on analytic
developments, especially of Casimir-Polder (CP) interactions between
anisotropically polarizable atoms, and CP interactions between anisotropic
atoms and bodies that also exhibit anisotropy, either because of anisotropic
constituents, or because of geometry. Repulsion occurs for wedge-shaped and
cylindrical conductors, provided the geometry is sufficiently asymmetric, that
is, either the wedge is sufficiently sharp or the atom is sufficiently far from
the cylinder.
","[{""version"":""v1"",""created"":""Wed, 29 Feb 2012 00:30:07 GMT""},{""version"":""v2"",""created"":""Wed, 25 Apr 2012 18:35:11 GMT""}]","2018-03-09"
"1202.6416","Peter Tingley","Pierre Baumann, Thomas Dunlap, Joel Kamnitzer, and Peter Tingley","Rank 2 affine MV polytopes","24 pages",,,,"math.CO math.QA","http://arxiv.org/licenses/nonexclusive-distrib/1.0/","  We give a realization of the infinity crystal for affine sl(2) using
decorated polygons. The construction and proof are combinatorial, making use of
Kashiwara and Saito's characterization of the infinity crystal in terms of the
* involution. The polygons we use have combinatorial properties suggesting they
are the analogues in this case of the Mirkovic-Vilonen polytopes defined by
Anderson and the third author in finite type. Using Kashiwara's similarity of
crystals we also give MV polytopes for $A_2^{(2)}$, the only other rank two
affine Kac-Moody algebra.
","[{""version"":""v1"",""created"":""Wed, 29 Feb 2012 00:32:10 GMT""}]","2012-03-01"
"1202.6417","Shancai Wang","Z.-H. Liu, P. Richard, N. Xu, G. Xu, Y. Li, X.-C. Fang, L.-L. Jia,
  G.-F. Chen, D.-M. Wang, J.-B. He, T. Qian, J.-P. Hu, H. Ding, S.-C. Wang","Three-dimensionality and orbital characters of Fermi surface in
  (Tl,Rb)$_y$Fe$_{2-x}$Se$_2$","4 pages, 4 figures","Phys. Rev. Lett. 109, 037003 (2012)","10.1103/PhysRevLett.109.037003",,"cond-mat.supr-con cond-mat.str-el","http://arxiv.org/licenses/nonexclusive-distrib/1.0/","  We report a comprehensive angle-resolved photoemission spectroscopy study of
the tridimensional electronic bands in the recently discovered Fe selenide
superconductor (Tl,Rb)$_y$Fe$_{2-x}$Se$_2$ ($T_c=32$ K). We determined the
orbital characters and the $k_z$ dependence of the low energy electronic
structure by tuning the polarization and the energy of the incident photons. We
observed a small 3D electron Fermi surface pocket near the Brillouin zone
center and a 2D like electron Fermi surface pocket near the zone boundary. The
photon energy dependence, the polarization analysis and the local-density
approximation calculations suggest a significant contribution from the Se
4$p_z$ and Fe 3$d_{xy}$ orbitals to the small electron pocket. We argue that
the emergence of Se 4$p_z$ states might be the cause of the different magnetic
properties between Fe chalcogenides and Fe pnictides.
","[{""version"":""v1"",""created"":""Wed, 29 Feb 2012 00:43:10 GMT""},{""version"":""v2"",""created"":""Thu, 1 Mar 2012 22:01:24 GMT""},{""version"":""v3"",""created"":""Wed, 1 Aug 2012 15:16:50 GMT""}]","2012-08-02"
"1202.6418","Douglas Cochran","Bill Moran, Stephen D. Howard, Douglas Cochran","An Information-geometric Approach to Sensor Management","4 pages, 3 figures, to appear in Proceedings of the IEEE
  International Conference on Acoustics, Speech, and Signal Processing, March
  2012",,"10.1109/ICASSP.2012.6289107",,"stat.AP","http://arxiv.org/licenses/nonexclusive-distrib/1.0/","  An information-geometric approach to sensor management is introduced that is
based on following geodesic curves in a manifold of possible sensor
configurations. This perspective arises by observing that, given a parameter
estimation problem to be addressed through management of sensor assets, any
particular sensor configuration corresponds to a Riemannian metric on the
parameter manifold. With this perspective, managing sensors involves navigation
on the space of all Riemannian metrics on the parameter manifold, which is
itself a Riemannian manifold. Existing work assumes the metric on the parameter
manifold is one that, in statistical terms, corresponds to a Jeffreys prior on
the parameter to be estimated. It is observed that informative priors, as arise
in sensor management, can also be accommodated. Given an initial sensor
configuration, the trajectory along which to move in sensor configuration space
to gather most information is seen to be locally defined by the geodesic
structure of this manifold. Further, divergences based on Fisher and Shannon
information lead to the same Riemannian metric and geodesics.
","[{""version"":""v1"",""created"":""Wed, 29 Feb 2012 00:49:44 GMT""}]","2016-11-15"
"1202.6419","Philippe Lalanne","Choon How Gan, Jean-Paul Hugonin, and Philippe Lalanne","Proposal for compact solid-state III-V single-plasmon sources","8 pages, 4 figures","Phys. Rev. X 2, 021008 (2012)",,,"physics.optics cond-mat.mes-hall","http://arxiv.org/licenses/nonexclusive-distrib/1.0/","  We propose a compact single-plasmon source operating at near-infrared
wavelengths on an integrated III-V semiconductor platform, with a thin ridge
waveguide serving as the plasmon channel. By attaching an ultra-small cavity to
the channel, it is shown that both the plasmon generation efficiency ({\beta})
and the spontaneous-decay rate into the channel can be significantly enhanced.
An analytical model derived with the Lorentz reciprocity theorem captures the
main physics involved in the design of the source and yields results in good
agreement with fully-vectorial simulations of the device. At resonance, it is
predicted that the ultra-small cavity increases the {\beta}-factor by 70% and
boosts the spontaneous decay rate by a factor 20. The proposed design could
pave the way towards integrated and scalable plasmonic quantum networks.
Comparison of the present design with other fully-dielectric competing
approaches is addressed.
","[{""version"":""v1"",""created"":""Wed, 29 Feb 2012 01:02:37 GMT""}]","2013-06-25"
"1202.6420","Douglas Cochran","Douglas Cochran, Stephen D. Howard, Bill Moran, Harry A. Schmitt","Maximum-entropy Surrogation in Network Signal Detection","4 pages, submitted to IEEE Statistical Signal Processing Workshop,
  August 2012",,"10.1109/SSP.2012.6319686",,"stat.AP","http://arxiv.org/licenses/nonexclusive-distrib/1.0/","  Multiple-channel detection is considered in the context of a sensor network
where raw data are shared only by nodes that have a common edge in the network
graph. Established multiple-channel detectors, such as those based on
generalized coherence or multiple coherence, use pairwise measurements from
every pair of sensors in the network and are thus directly applicable only to
networks whose graphs are completely connected. An approach introduced here
uses a maximum-entropy technique to formulate surrogate values for missing
measurements corresponding to pairs of nodes that do not share an edge in the
network graph. The broader potential merit of maximum-entropy baselines in
quantifying the value of information in sensor network applications is also
noted.
","[{""version"":""v1"",""created"":""Wed, 29 Feb 2012 01:05:02 GMT""}]","2016-11-15"
"1202.6421","David Turton","Samir D. Mathur, David Turton","Momentum-carrying waves on D1-D5 microstate geometries","24 pages, 4 figures","Nucl.Phys. B862 (2012) 764-780","10.1016/j.nuclphysb.2012.05.014",,"hep-th gr-qc","http://arxiv.org/licenses/nonexclusive-distrib/1.0/","  If one attempts to add momentum-carrying waves to a black string then the
solution develops a singularity at the horizon; this is a manifestation of the
'no hair theorem' for black objects. However individual microstates of a black
string do not have a horizon, and so the above theorem does not apply. We
construct a perturbation that adds momentum to a family of microstates of the
extremal D1-D5 string. This perturbation is analogous to the 'singleton' mode
localized at the boundary of AdS; to leading order it is pure gauge in the AdS
interior of the geometry.
","[{""version"":""v1"",""created"":""Wed, 29 Feb 2012 01:28:58 GMT""}]","2012-08-10"
"1202.6422","Lei Guo","Su Ji-Juan, Guo Lei, Ma Wen-Gan, Zhang Ren-You, Ling Liu-Sheng, Han
  Liang","Next-to-leading order QCD predictions for $Z^0 H^0 + {\rm jet}$
  production at LHC","18 pages, 7 figures","JHEP 03 (2012) 059","10.1007/JHEP03(2012)059",,"hep-ph hep-ex","http://arxiv.org/licenses/nonexclusive-distrib/1.0/","  We calculate the complete next-to-leading order (NLO) QCD corrections to the
$Z^0H^0$ production in association with a jet at the LHC. We study the impacts
of the NLO QCD radiative corrections to the integrated and differential cross
sections and the dependence of the cross section on the
factorization/renormalization scale. We present the transverse momentum
distributions of the final $Z^0$-, Higgs-boson and leading-jet. We find that
the NLO QCD corrections significantly modify the physical observables, and
obviously reduce the scale uncertainty of the LO cross section. The QCD
K-factors can be 1.183 and 1.180 at the $\sqrt{s}=14 TeV$ and $\sqrt{s}=7 TeV$
LHC respectively, when we adopt the inclusive event selection scheme with
$p_{T,j}^{cut}=50 GeV$, $m_H=120 GeV$ and $\mu=\mu_r=\mu_f=\mu_0 \equiv
1/2(m_Z+m_H)$. Furthermore, we make the comparison between the two scale
choices, $\mu=\mu_0$ and $\mu=\mu_1=1/2(E_{T}^{Z}+E_{T}^{H}+
\sum_{j}E_{T}^{jet})$, and find the scale choice $\mu=\mu_1$ seems to be more
appropriate than the fixed scale $\mu=\mu_0$.
","[{""version"":""v1"",""created"":""Wed, 29 Feb 2012 01:33:31 GMT""},{""version"":""v2"",""created"":""Wed, 28 Mar 2012 06:58:18 GMT""}]","2012-03-29"
"1202.6423","Boulat Bash","Boulat A. Bash and Dennis Goeckel and Don Towsley","Limits of Reliable Communication with Low Probability of Detection on
  AWGN Channels","Major revision in v2. Context, esp. the relationship to steganography
  updated. Also, added discussion on secret key length. Results are unchanged
  from previous version. Minor revision in v3. Major revision in v4, Clarified
  derivations (adding appendix), also context, esp. relationship to previous
  work in communication updated. Results are unchanged from previous revisions","IEEE Journal on Selected Areas in Communications 31.9 (2013)
  1921-1930","10.1109/JSAC.2013.130923","UM-CS-2012-003","cs.IT cs.NI math.IT","http://arxiv.org/licenses/nonexclusive-distrib/1.0/","  We present a square root limit on the amount of information transmitted
reliably and with low probability of detection (LPD) over additive white
Gaussian noise (AWGN) channels. Specifically, if the transmitter has AWGN
channels to an intended receiver and a warden, both with non-zero noise power,
we prove that $o(\sqrt{n})$ bits can be sent from the transmitter to the
receiver in $n$ channel uses while lower-bounding $\alpha+\beta\geq1-\epsilon$
for any $\epsilon>0$, where $\alpha$ and $\beta$ respectively denote the
warden's probabilities of a false alarm when the sender is not transmitting and
a missed detection when the sender is transmitting. Moreover, in most practical
scenarios, a lower bound on the noise power on the channel between the
transmitter and the warden is known and $O(\sqrt{n})$ bits can be sent in $n$
LPD channel uses. Conversely, attempting to transmit more than $O(\sqrt{n})$
bits either results in detection by the warden with probability one or a
non-zero probability of decoding error at the receiver as $n\rightarrow\infty$.
","[{""version"":""v1"",""created"":""Wed, 29 Feb 2012 02:07:35 GMT""},{""version"":""v2"",""created"":""Tue, 28 Aug 2012 06:13:06 GMT""},{""version"":""v3"",""created"":""Wed, 9 Jan 2013 06:05:23 GMT""},{""version"":""v4"",""created"":""Wed, 20 Mar 2013 05:34:36 GMT""}]","2013-10-18"
"1202.6424","Zhonglue Wen","Z. L. Wen, J. L. Han, F. S. Liu","A catalog of 132,684 clusters of galaxies identified from Sloan Digital
  Sky Survey III","12 pages, 20 figures, 1 table; updated to match the published version","Astrophys.J.Suppl.,199:34(12pp),2012","10.1088/0067-0049/199/2/34",,"astro-ph.CO","http://arxiv.org/licenses/nonexclusive-distrib/1.0/","  Using the photometric redshifts of galaxies from the Sloan Digital Sky Survey
III (SDSS-III), we identify 132,684 clusters in the redshift range of
0.05<z<0.8. Monte Carlo simulations show that the false detection rate is less
than 6% for the whole sample. The completeness is more than 95% for clusters
with a mass of M_{200}>1.0*10^{14} M_{\odot} in the redshift range of
0.05<z<0.42, while clusters of z>0.42 are less complete and have a biased
smaller richness than the real one due to incompleteness of member galaxies. We
compare our sample with other cluster samples, and find that more than 90% of
previously known rich clusters of 0.05<z<0.42 are matched with clusters in our
sample. Richer clusters tend to have more luminous brightest cluster galaxies
(BCGs). Correlating with X-ray and the Planck data, we show that the cluster
richness is closely related to the X-ray luminosity, temperature and
Sunyaev-Zel'dovich measurements. Comparison of the BCGs with the SDSS luminous
red galaxy (LRG) sample shows that 25% of LRGs are BCGs of our clusters and 36%
of LRGs are cluster member galaxies. In our cluster sample, 63% of BCGs of
r_{petro}<19.5 satisfy the SDSS LRG selection criteria.
","[{""version"":""v1"",""created"":""Wed, 29 Feb 2012 02:08:47 GMT""},{""version"":""v2"",""created"":""Wed, 21 Mar 2012 08:38:07 GMT""},{""version"":""v3"",""created"":""Sat, 28 Apr 2012 07:46:21 GMT""}]","2012-05-01"
"1202.6425","Joe S. Wang","Joe S. Wang","Legendrian Gronwall conjecture","15 pages",,,,"math.DG","http://arxiv.org/licenses/nonexclusive-distrib/1.0/","  The Gronwall conjecture states that a planar 3-web of foliations which admits
more than one distinct linearizations is locally equivalent to an algebraic
web. We propose an analogue of the Gronwall conjecture for the 3-web of
foliations by Legendrian curves in a contact three manifold. The Legendrian
Gronwall conjecture states that a Legendrian 3-web admits at most one distinct
local linearization, with the only exception when it is locally equivalent to
the dual linear Legendrian 3-web of the Legendrian twisted cubic in $\,\PP^3$.
We give a partial answer to the conjecture in the affirmative for the class of
Legendrian 3-webs of maximum rank. We also show that a linear Legendrian 3-web
which is sufficiently flat at a reference point is rigid under local linear
Legendrian deformation.
","[{""version"":""v1"",""created"":""Wed, 29 Feb 2012 02:14:21 GMT""}]","2012-03-01"
"1202.6426","Felix Lawrence","Patrick Blown, Caitlin Fisher, Felix J. Lawrence, Nadav Gutman and C.
  Martijn de Sterke","Semi-analytic method for slow light photonic crystal waveguide design","Accepted by Photonics and Nanostructures - Fundamentals and
  Applications",,"10.1016/j.photonics.2012.02.005",,"physics.optics","http://arxiv.org/licenses/nonexclusive-distrib/1.0/","  We present a semi-analytic method to calculate the dispersion curves and the
group velocity of photonic crystal waveguide modes in two-dimensional
geometries. We model the waveguide as a homogenous strip, surrounded by
photonic crystal acting as diffracting mirrors. Following conventional
guided-wave optics, the properties of the photonic crystal waveguide may be
calculated from the phase upon propagation over the strip and the phase upon
reflection. The cases of interest require a theory including the specular order
and one other diffracted reflected order. The computational advantages let us
scan a large parameter space, allowing us to find novel types of solutions.
","[{""version"":""v1"",""created"":""Wed, 29 Feb 2012 02:50:55 GMT""}]","2012-03-23"
"1202.6427","Yaakov Malinovsky","Abram M. Kagan and Yaakov Malinovsky","Monotonicity in the Sample Size of the Length of Classical Confidence
  Intervals",,,,,"math.ST stat.TH","http://arxiv.org/licenses/nonexclusive-distrib/1.0/","  It is proved that the average length of standard confidence intervals for
parameters of gamma and normal distributions monotonically decrease with the
sample size. The proofs are based on fine properties of the classical gamma
function.
","[{""version"":""v1"",""created"":""Wed, 29 Feb 2012 02:51:03 GMT""},{""version"":""v2"",""created"":""Thu, 19 Jul 2012 16:12:12 GMT""},{""version"":""v3"",""created"":""Tue, 28 Aug 2012 23:54:59 GMT""}]","2012-08-30"
"1202.6428","Mingjun Xing","M.-J. Xing, M. B. A. Jalil, Seng Ghee Tan and Y. Jiang","Inverse Spin Hall Effect in Ferromagnetic Metal with Rashba Spin Orbit
  Coupling","4 pages, 5 figures",,,,"cond-mat.mes-hall","http://creativecommons.org/licenses/by/3.0/","  We report an intrinsic form of the inverse spin Hall effect (ISHE) in
ferromagnetic (FM) metal with Rashba spin orbit coupling (RSOC), which is
driven by a normal charge current. Unlike the conventional form, the ISHE can
be induced without the need for spin current injection from an external source.
Our theoretical results show that Hall voltage is generated when the FM moment
is perpendicular to the ferromagnetic layer. The polarity of the Hall voltage
is reversed upon switching the FM moment to the opposite direction, thus
promising a useful readback mechanism for memory or logic applications.
","[{""version"":""v1"",""created"":""Wed, 29 Feb 2012 03:09:51 GMT""}]","2012-03-01"
"1202.6429","Rachel Ward","Deanna Needell, Rachel Ward","Stable image reconstruction using total variation minimization","25 pages",,,,"cs.CV cs.IT math.IT math.NA","http://arxiv.org/licenses/nonexclusive-distrib/1.0/","  This article presents near-optimal guarantees for accurate and robust image
recovery from under-sampled noisy measurements using total variation
minimization. In particular, we show that from O(slog(N)) nonadaptive linear
measurements, an image can be reconstructed to within the best s-term
approximation of its gradient up to a logarithmic factor, and this factor can
be removed by taking slightly more measurements. Along the way, we prove a
strengthened Sobolev inequality for functions lying in the null space of
suitably incoherent matrices.
","[{""version"":""v1"",""created"":""Wed, 29 Feb 2012 03:43:01 GMT""},{""version"":""v2"",""created"":""Sat, 3 Mar 2012 01:51:12 GMT""},{""version"":""v3"",""created"":""Tue, 6 Mar 2012 22:32:53 GMT""},{""version"":""v4"",""created"":""Tue, 13 Mar 2012 22:37:39 GMT""},{""version"":""v5"",""created"":""Wed, 9 May 2012 19:39:08 GMT""},{""version"":""v6"",""created"":""Thu, 31 May 2012 22:28:12 GMT""},{""version"":""v7"",""created"":""Thu, 11 Oct 2012 19:05:15 GMT""},{""version"":""v8"",""created"":""Tue, 16 Oct 2012 23:23:58 GMT""},{""version"":""v9"",""created"":""Tue, 12 Mar 2013 17:07:21 GMT""}]","2015-03-20"
"1202.6430","Juan V\'iquez","Richard Eden and Juan V\'iquez","Nourdin-Peccati analysis on Wiener and Wiener-Poisson space for general
  distributions","38 pages, 1 table","Stochastic Processes and their Applications - Volume 125 - 2015",,,"math.PR","http://arxiv.org/licenses/nonexclusive-distrib/1.0/","  Given a reference random variable, we study the solution of its Stein
equation and obtain universal bounds on its first and second derivatives. We
then extend the analysis of Nourdin and Peccati by bounding the Fortet-Mourier
and Wasserstein distances from more general random variables such as members of
the Exponential and Pearson families. Using these results, we obtain
non-central limit theorems, generalizing the ideas applied to their analysis of
convergence to Normal random variables. We do these in both Wiener space and
the more general Wiener-Poisson space. In the former, we study conditions for
convergence under several particular cases and characterize when two random
variables have the same distribution. As an example, we apply this tool to
bilinear functionals of Gaussian subordinated fields where the underlying
process is a fractional Brownian motion with Hurst parameter bigger than 1/2.
In the latter space we give suficient conditions for a sequence of multiple
(Wiener-Poisson) integrals to converge to a Normal random variable.
","[{""version"":""v1"",""created"":""Wed, 29 Feb 2012 03:51:33 GMT""}]","2017-12-13"
"1202.6431","Liping Zhang","Liping Zhang, Liqun Qi, Guanglu Zhou","M-tensors and The Positive Definiteness of a Multivariate Form",,,,,"math.NA","http://arxiv.org/licenses/nonexclusive-distrib/1.0/","  We study M-tensors and various properties of M-tensors are given. Specially,
we show that the smallest real eigenvalue of M-tensor is positive corresponding
to a nonnegative eigenvector. We propose an algorithm to find the smallest
positive eigenvalue and then apply the property to study the positive
definiteness of a multivariate form.
","[{""version"":""v1"",""created"":""Wed, 29 Feb 2012 03:56:45 GMT""}]","2012-03-01"
