"1204.0184","Youssef Bassil","Youssef Bassil","Parallel Spell-Checking Algorithm Based on Yahoo! N-Grams Dataset","LACSC - Lebanese Association for Computational Sciences,
  http://www.lacsc.org/; International Journal of Research and Reviews in
  Computer Science (IJRRCS), Vol. 3, No. 1, February 2012",,,,"cs.CL","http://arxiv.org/licenses/nonexclusive-distrib/1.0/","  Spell-checking is the process of detecting and sometimes providing
suggestions for incorrectly spelled words in a text. Basically, the larger the
dictionary of a spell-checker is, the higher is the error detection rate;
otherwise, misspellings would pass undetected. Unfortunately, traditional
dictionaries suffer from out-of-vocabulary and data sparseness problems as they
do not encompass large vocabulary of words indispensable to cover proper names,
domain-specific terms, technical jargons, special acronyms, and terminologies.
As a result, spell-checkers will incur low error detection and correction rate
and will fail to flag all errors in the text. This paper proposes a new
parallel shared-memory spell-checking algorithm that uses rich real-world word
statistics from Yahoo! N-Grams Dataset to correct non-word and real-word errors
in computer text. Essentially, the proposed algorithm can be divided into three
sub-algorithms that run in a parallel fashion: The error detection algorithm
that detects misspellings, the candidates generation algorithm that generates
correction suggestions, and the error correction algorithm that performs
contextual error correction. Experiments conducted on a set of text articles
containing misspellings, showed a remarkable spelling error correction rate
that resulted in a radical reduction of both non-word and real-word errors in
electronic text. In a further study, the proposed algorithm is to be optimized
for message-passing systems so as to become more flexible and less costly to
scale over distributed machines.
","[{""version"":""v1"",""created"":""Sun, 1 Apr 2012 09:28:20 GMT""}]","2012-04-03"
"1204.0185","Youssef Bassil","Youssef Bassil","Service-Oriented Architecture for Space Exploration Robotic Rover
  Systems","LACSC - Lebanese Association for Computational Sciences,
  http://www.lacsc.org/; International Journal of Science & Emerging
  Technologies (IJSET), Vol. 3, No. 2, February 2012",,,,"cs.RO","http://arxiv.org/licenses/nonexclusive-distrib/1.0/","  Currently, industrial sectors are transforming their business processes into
e-services and component-based architectures to build flexible, robust, and
scalable systems, and reduce integration-related maintenance and development
costs. Robotics is yet another promising and fast-growing industry that deals
with the creation of machines that operate in an autonomous fashion and serve
for various applications including space exploration, weaponry, laboratory
research, and manufacturing. It is in space exploration that the most common
type of robots is the planetary rover which moves across the surface of a
planet and conducts a thorough geological study of the celestial surface. This
type of rover system is still ad-hoc in that it incorporates its software into
its core hardware making the whole system cohesive, tightly-coupled, more
susceptible to shortcomings, less flexible, hard to be scaled and maintained,
and impossible to be adapted to other purposes. This paper proposes a
service-oriented architecture for space exploration robotic rover systems made
out of loosely-coupled and distributed web services. The proposed architecture
consists of three elementary tiers: the client tier that corresponds to the
actual rover; the server tier that corresponds to the web services; and the
middleware tier that corresponds to an Enterprise Service Bus which promotes
interoperability between the interconnected entities. The niche of this
architecture is that rover's software components are decoupled and isolated
from the rover's body and possibly deployed at a distant location. A
service-oriented architecture promotes integrate-ability, scalability,
reusability, maintainability, and interoperability for client-to-server
communication.
","[{""version"":""v1"",""created"":""Sun, 1 Apr 2012 09:37:00 GMT""}]","2012-04-03"
"1204.0186","Youssef Bassil","Youssef Bassil, Paul Semaan","Semantic-Sensitive Web Information Retrieval Model for HTML Documents","LACSC - Lebanese Association for Computational Sciences,
  http://www.lacsc.org/; European Journal of Scientific Research, Vol. 69, No.
  4, February 2012",,,,"cs.IR","http://arxiv.org/licenses/nonexclusive-distrib/1.0/","  With the advent of the Internet, a new era of digital information exchange
has begun. Currently, the Internet encompasses more than five billion online
sites and this number is exponentially increasing every day. Fundamentally,
Information Retrieval (IR) is the science and practice of storing documents and
retrieving information from within these documents. Mathematically, IR systems
are at the core based on a feature vector model coupled with a term weighting
scheme that weights terms in a document according to their significance with
respect to the context in which they appear. Practically, Vector Space Model
(VSM), Term Frequency (TF), and Inverse Term Frequency (IDF) are among other
long-established techniques employed in mainstream IR systems. However, present
IR models only target generic-type text documents, in that, they do not
consider specific formats of files such as HTML web documents. This paper
proposes a new semantic-sensitive web information retrieval model for HTML
documents. It consists of a vector model called SWVM and a weighting scheme
called BTF-IDF, particularly designed to support the indexing and retrieval of
HTML web documents. The chief advantage of the proposed model is that it
assigns extra weights for terms that appear in certain pre-specified HTML tags
that are correlated to the semantics of the document. Additionally, the model
is semantic-sensitive as it generates synonyms for every term being indexed and
later weights them appropriately to increase the likelihood of retrieving
documents with similar context but different vocabulary terms. Experiments
conducted, revealed a momentous enhancement in the precision of web IR systems
and a radical increase in the number of relevant documents being retrieved. As
further research, the proposed model is to be upgraded so as to support the
indexing and retrieval of web images in multimedia-rich web documents.
","[{""version"":""v1"",""created"":""Sun, 1 Apr 2012 09:50:42 GMT""}]","2012-04-03"
"1204.0187","Victor J. W. Guo","Victor J. W. Guo and Jiang Zeng","On Zudilin's q-question about Schmidt's problem","5 pages","Electron. J. Combin. 19(3) (2012), #P4",,,"math.CO","http://arxiv.org/licenses/nonexclusive-distrib/1.0/","  We propose an elemantary approach to Zudilin's q-question about Schmidt's
problem [Electron. J. Combin. 11 (2004), #R22], which has been solved in a
previous paper [Acta Arith. 127 (2007), 17--31]. The new approach is based on a
q-analogue of our recent result in [J. Number Theory 132 (2012), 1731--1740]
derived from q-Pfaff-Saalschutz identity.
","[{""version"":""v1"",""created"":""Sun, 1 Apr 2012 10:02:17 GMT""},{""version"":""v2"",""created"":""Sun, 8 Apr 2012 11:28:25 GMT""},{""version"":""v3"",""created"":""Thu, 19 Jul 2012 16:27:15 GMT""}]","2012-07-20"
"1204.0188","Youssef Bassil","Youssef Bassil, Mohammad Alwani","OCR Context-Sensitive Error Correction Based on Google Web 1T 5-Gram
  Data Set","LACSC - Lebanese Association for Computational Sciences,
  http://www.lacsc.org/; American Journal of Scientific Research, Issue. 50,
  February 2012",,,,"cs.CL cs.IR","http://arxiv.org/licenses/nonexclusive-distrib/1.0/","  Since the dawn of the computing era, information has been represented
digitally so that it can be processed by electronic computers. Paper books and
documents were abundant and widely being published at that time; and hence,
there was a need to convert them into digital format. OCR, short for Optical
Character Recognition was conceived to translate paper-based books into digital
e-books. Regrettably, OCR systems are still erroneous and inaccurate as they
produce misspellings in the recognized text, especially when the source
document is of low printing quality. This paper proposes a post-processing OCR
context-sensitive error correction method for detecting and correcting non-word
and real-word OCR errors. The cornerstone of this proposed approach is the use
of Google Web 1T 5-gram data set as a dictionary of words to spell-check OCR
text. The Google data set incorporates a very large vocabulary and word
statistics entirely reaped from the Internet, making it a reliable source to
perform dictionary-based error correction. The core of the proposed solution is
a combination of three algorithms: The error detection, candidate spellings
generator, and error correction algorithms, which all exploit information
extracted from Google Web 1T 5-gram data set. Experiments conducted on scanned
images written in different languages showed a substantial improvement in the
OCR error correction rate. As future developments, the proposed algorithm is to
be parallelised so as to support parallel and distributed computing
architectures.
","[{""version"":""v1"",""created"":""Sun, 1 Apr 2012 10:06:55 GMT""}]","2012-04-03"
"1204.0189","Taotao  Qiu","Taotao Qiu","Reconstruction of a Nonminimal Coupling Theory with Scale-invariant
  Power Spectrum","31 pages, 4 figures","JCAP06(2012)041","10.1088/1475-7516/2012/06/041",,"hep-ph astro-ph.CO gr-qc hep-th","http://arxiv.org/licenses/nonexclusive-distrib/1.0/","  A nonminimal coupling single scalar field theory, when transformed from
Jordan frame to Einstein frame, can act like a minimal coupling one. Making use
of this property, we investigate how a nonminimal coupling theory with
scale-invariant power spectrum could be reconstructed from its minimal coupling
counterpart, which can be applied in the early universe. Thanks to the coupling
to gravity, the equation of state of our universe for a scale-invariant power
spectrum can be relaxed, and the relation between the parameters in the action
can be obtained. This approach also provides a means to address the Big-Bang
puzzles and anisotropy problem in the nonminimal coupling model within Jordan
frame. Due to the equivalence between the two frames, one may be able to find
models that are free of the horizon, flatness, singularity as well as
anisotropy problems.
","[{""version"":""v1"",""created"":""Sun, 1 Apr 2012 10:09:17 GMT""},{""version"":""v2"",""created"":""Thu, 28 Jun 2012 11:26:16 GMT""}]","2015-06-04"
"1204.0190","Keita Deguchi","K. Deguchi, D. Sato, M. Sugimoto, H. Hara, Y. Kawasaki, S. Demura, T.
  Watanabe, S. J. Denholme, H. Okazaki, T. Ozaki, T. Yamaguchi, H. Takeya, T.
  Soga, M. Tomita, Y. Takano","Clarification as to why alcoholic beverages have the ability to induce
  superconductivity in Fe_{1+d}Te_{1-x}S_x","9 pages, 5 figures","Supercond. Sci. Technol. 25 (2012) 084025","10.1088/0953-2048/25/8/084025",,"cond-mat.supr-con","http://arxiv.org/licenses/nonexclusive-distrib/1.0/","  To elucidate the mechanism as to why alcoholic beverages can induce
superconductivity in Fe_{1+d}Te_{1-x}S_x samples, we performed component
analysis and found that weak acid such as organic acid has the ability to
induce superconductivity. Inductively-coupled plasma spectroscopy was performed
on weak acid solutions post annealing. We found that the mechanism of
inducement of superconductivity in Fe_{1+d}Te_{1-x}S_x is the deintercalation
of excess Fe from the interlayer sites.
","[{""version"":""v1"",""created"":""Sun, 1 Apr 2012 10:12:45 GMT""}]","2012-10-01"
"1204.0191","Youssef Bassil","Youssef Bassil, Mohammad Alwani","OCR Post-Processing Error Correction Algorithm using Google Online
  Spelling Suggestion","LACSC - Lebanese Association for Computational Sciences,
  http://www.lacsc.org/; Journal of Emerging Trends in Computing and
  Information Sciences, Vol. 3, No. 1, January 2012",,,,"cs.CL","http://arxiv.org/licenses/nonexclusive-distrib/1.0/","  With the advent of digital optical scanners, a lot of paper-based books,
textbooks, magazines, articles, and documents are being transformed into an
electronic version that can be manipulated by a computer. For this purpose,
OCR, short for Optical Character Recognition was developed to translate scanned
graphical text into editable computer text. Unfortunately, OCR is still
imperfect as it occasionally mis-recognizes letters and falsely identifies
scanned text, leading to misspellings and linguistics errors in the OCR output
text. This paper proposes a post-processing context-based error correction
algorithm for detecting and correcting OCR non-word and real-word errors. The
proposed algorithm is based on Google's online spelling suggestion which
harnesses an internal database containing a huge collection of terms and word
sequences gathered from all over the web, convenient to suggest possible
replacements for words that have been misspelled during the OCR process.
Experiments carried out revealed a significant improvement in OCR error
correction rate. Future research can improve upon the proposed algorithm so
much so that it can be parallelized and executed over multiprocessing
platforms.
","[{""version"":""v1"",""created"":""Sun, 1 Apr 2012 10:34:38 GMT""}]","2012-04-03"
"1204.0192","Simone Meloni Simone Meloni","Pierre-Antoine Geslin, Giovanni Ciccotti, Eric Vanden-Eijnden and
  Simone Meloni","An observable for vacancy characterization and diffusion in crystals",,,"10.1063/1.4796322",,"cond-mat.mtrl-sci math-ph math.MP","http://arxiv.org/licenses/nonexclusive-distrib/1.0/","  To locate the position and characterize the dynamics of a vacancy in a
crystal, we propose to represent it by the ground state density of a quantum
probe quasi-particle for the Hamiltonian associated to the potential energy
field generated by the atoms in the sample. In this description, the h^2/2mu
coefficient of the kinetic energy term is a tunable parameter controlling the
density localization in the regions of relevant minima of the potential energy
field. Based on this description, we derive a set of collective variables that
we use in rare event simulations to identify some of the vacancy diffusion
paths in a 2D crystal. Our simulations reveal, in addition to the simple and
expected nearest neighbor hopping path, a collective migration mechanism of the
vacancy. This mechanism involves several lattice sites and produces a long
range migration of the vacancy. Finally, we also observed a vacancy induced
crystal reorientation process.
","[{""version"":""v1"",""created"":""Sun, 1 Apr 2012 10:44:23 GMT""},{""version"":""v2"",""created"":""Tue, 20 Nov 2012 11:01:12 GMT""}]","2013-06-04"
"1204.0193","Youssef Bassil","Youssef Bassil","Communication Language Specifications For Digital Ecosystems","LACSC - Lebanese Association for Computational Sciences,
  http://www.lacsc.org/","International Journal of Advanced Research in Computer Science,
  Vol. 3, No. 1, Jan-Feb 2012",,,"cs.SE","http://arxiv.org/licenses/nonexclusive-distrib/1.0/","  Service-based IT infrastructures are today's trend and the future for every
enterprise willing to support dynamic and agile business to contend with the
ever changing e-demands and requirements. A digital ecosystem is an emerging
business IT model for developing agile e-enterprises made out of
self-adaptable, self-manageable, self-organizing, and sustainable service
components. This paper defines the specifications of a communication language
for exchanging data between connecting entities in digital ecosystems. It is
called ECL short for Ecosystem Communication Language and is based on XML to
format its request and response messages. An ECU short for Ecosystem
Communication Unit is also presented which interprets, validates, parses ECL
messages and routes them to their destination entities. ECL is open and
provides transparent, portable, and interoperable communication between the
different heterogeneous distributed components to send requests, and receive
responses from each other, regardless of their incompatible protocols,
standards, and technologies. As future research, digital signature for ECL is
to be investigated so as to deliver data integrity as well as message
authenticity for the digital ecosystem.
","[{""version"":""v1"",""created"":""Sun, 1 Apr 2012 10:46:00 GMT""}]","2012-04-03"
"1204.0194","Konstantin Vasil'evich Andreev","K. V. Andreev","Spinor formalism and the geometry of six-dimensional Riemannian spaces","MiKTeX v2.9, 214 pages, 2 tables, 2 figures. English and Russian
  editions",,,,"math-ph math.DG math.MP math.QA","http://arxiv.org/licenses/nonexclusive-distrib/1.0/","  The article consists of the Russian and English variants of Ph.D. Thesis in
which the answers is given on the following questions:
  1. how to construct the spinor formalism for n=6;
  2. how to construct the spinor formalism for n=8;
  3. how to prolong the Riemannian connection from the tangent bundle into the
spinor one with the base: a complex analytical 6-dimensional Riemannian space;
  4. how to construct the real and complex representations of this bundles;
  5. how to construct the curvature spinors and to investigate its properties;
  6. how to obtain the canonical form of a bilinear form for the 6-dimensional
pseudo-Euclidean space with the even index of the metric;
  7. how to construct the geometric interpretation of isotropic twistors on the
isotropic cone of the 6-dimensional pseudo-Euclidean space with the index equal
to 4;
  8. how to construct the generalization of the Cartan triality principle to
the Klein correspondence;
  9. how to construct the structural constants of the octonion algebra for the
initial induction step?
  In this article, the initial induction step for the induction constructions,
presented in arXiv:1110.4737 and arXiv:1202.0941, is constructed.
","[{""version"":""v1"",""created"":""Sun, 1 Apr 2012 10:59:16 GMT""}]","2012-04-03"
"1204.0195","Youssef Bassil","Youssef Bassil","Management Language Specifications For Digital Ecosystems","LACSC - Lebanese Association for Computational Sciences,
  http://www.lacsc.org/; Journal of Global Research in Computer Science, Vol.
  3, No. 1, January 2012",,,,"cs.SE","http://arxiv.org/licenses/nonexclusive-distrib/1.0/","  This paper defines the specifications of a management language intended to
automate the control and administration of various service components connected
to a digital ecosystem. It is called EML short for Ecosystem Management
Language and it is based on proprietary syntax and notation and contains a set
of managerial commands issued by the system's administrator via a command
console. Additionally, EML is shipped with a collection of self-adaptation
procedures called SAP. Their purpose is to provide self-adaptation properties
to the ecosystem allowing it to self-optimize itself based on the state of its
execution environment. On top of that, there exists the EMU short for Ecosystem
Management Unit which interprets, validates, parses, and executes EML commands
and SAP procedures. Future research can improve upon EML so much so that it can
be extended to support a larger set of commands in addition to a larger set of
SAP procedures.
","[{""version"":""v1"",""created"":""Sun, 1 Apr 2012 10:59:37 GMT""}]","2012-04-03"
"1204.0196","Hideto Asashiba","Hideto Asashiba","Gluing derived equivalences together","28 pages. 2nd version: many changes with oplax --> colax. 3rd
  version: minor changes including ""The k-flatness assumption was added to
  apply Keller's theorem on derived equivalences of categories.""",,,,"math.RT math.CT","http://arxiv.org/licenses/nonexclusive-distrib/1.0/","  The Grothendieck construction of a diagram $X$ of categories can be seen as a
process to construct a single category $\Gr(X)$ by gluing categories in the
diagram together. Here we formulate diagrams of categories as colax functors
from a small category $I$ to the 2-category $\kCat$ of small $\k$-categories
for a fixed commutative ring $\k$. In our previous paper we defined derived
equivalences of those colax functors. Roughly speaking two colax functors $X,
X' \colon I \to \kCat$ are derived equivalent if there is a derived equivalence
from $X(i)$ to $X'(i)$ for all objects $i$ in $I$ satisfying some
""$I$-equivariance"" conditions. In this paper we glue the derived equivalences
between $X(i)$ and $X'(i)$ together to obtain a derived equivalence between
Grothendieck constructions $\Gr(X)$ and $\Gr(X')$, which shows that if colax
functors are derived equivalent, then so are their Grothendieck constructions.
This generalizes and well formulates the fact that if two $\k$-categories with
a $G$-action for a group $G$ are ""$G$-equivariantly"" derived equivalent, then
their orbit categories are derived equivalent. As an easy application we see by
a unified proof that if two $\Bbbk$-algebras $A$ and $A'$ are derived
equivalent, then so are the path categories $AQ$ and $A'Q$ for any quiver $Q$;
so are the incidence categories $AS$ and $A'S$ for any poset $S$; and so are
the monoid algebras $AG$ and $A'G$ for any monoid $G$. Also we will give
examples of gluing of many smaller derived equivalences together to have a
larger derived equivalence.
","[{""version"":""v1"",""created"":""Sun, 1 Apr 2012 11:01:22 GMT""},{""version"":""v2"",""created"":""Sat, 21 Jul 2012 13:52:07 GMT""},{""version"":""v3"",""created"":""Tue, 6 Nov 2012 15:18:34 GMT""}]","2012-11-07"
"1204.0197","Youssef Bassil","Youssef Bassil","Windows And Linux Operating Systems From A Security Perspective","LACSC - Lebanese Association for Computational Sciences,
  http://www.lacsc.org/; Journal of Global Research in Computer Science, Vol.
  3, No. 2, February 2012",,,,"cs.OS","http://arxiv.org/licenses/nonexclusive-distrib/1.0/","  Operating systems are vital system software that, without them, humans would
not be able to manage and use computer systems. In essence, an operating system
is a collection of software programs whose role is to manage computer resources
and provide an interface for client applications to interact with the different
computer hardware. Most of the commercial operating systems available today on
the market have buggy code and they exhibit security flaws and vulnerabilities.
In effect, building a trusted operating system that can mostly resist attacks
and provide a secure computing environment to protect the important assets of a
computer is the goal of every operating system manufacturer. This paper deeply
investigates the various security features of the two most widespread and
successful operating systems, Microsoft Windows and Linux. The different
security features, designs, and components of the two systems are to be covered
elaborately, pin-pointing the key similarities and differences between them. In
due course, a head-to-head comparison is to be drawn for each security aspect,
exposing the advantage of one system over the other.
","[{""version"":""v1"",""created"":""Sun, 1 Apr 2012 11:05:34 GMT""}]","2012-04-03"
"1204.0198","Alexander Shen","Andrej Muchnik, Alexander Shen, Mikhail Vyugin","Game arguments in computability theory and algorithmic information
  theory","Extended version of a talk given at CiE2012 (Turing centennial)
  conference [see previous version for conference text]",,,,"math.LO cs.GT cs.IT math.IT","http://arxiv.org/licenses/nonexclusive-distrib/1.0/","  We provide some examples showing how game-theoretic arguments can be used in
computability theory and algorithmic information theory: unique numbering
theorem (Friedberg), the gap between conditional complexity and total
conditional complexity, Epstein--Levin theorem and some (yet unpublished)
result of Muchnik and Vyugin
","[{""version"":""v1"",""created"":""Sun, 1 Apr 2012 11:34:49 GMT""},{""version"":""v2"",""created"":""Fri, 27 Apr 2012 15:24:13 GMT""},{""version"":""v3"",""created"":""Fri, 29 Jun 2012 11:33:58 GMT""},{""version"":""v4"",""created"":""Mon, 10 Sep 2012 15:54:32 GMT""}]","2012-09-11"
