"1204.0150","Alexander Petrovic","A. P. Petrovic, Y. Kato, S. S. Sunku, T. Ito, P. Sengupta, L. Spalek,
  M. Shimuta, T. Katsufuji, C. D. Batista, S. Saxena, C. Panagopoulos","Intrinsic Structural Disorder and the Magnetic Ground State in Bulk
  EuTiO3","5 pages, 4 figures","Physical Review B 87, 064103 (2013)","10.1103/PhysRevB.87.064103",,"cond-mat.str-el","http://arxiv.org/licenses/nonexclusive-distrib/1.0/","  The magnetic properties of single-crystal EuTiO3 are suggestive of nanoscale
disorder below its cubic-tetragonal phase transition. We demonstrate that
electric field cooling acts to restore monocrystallinity, thus confirming that
emergent structural disorder is an intrinsic low-temperature property of this
material. Using torque magnetometry, we deduce that tetragonal EuTiO3 enters an
easy-axis antiferromagnetic phase at 5.6 K, with a first-order transition to an
easy-plane ground state below 3 K. Our data is reproduced by a 3D anisotropic
Heisenberg spin model.
","[{""version"":""v1"",""created"":""Sun, 1 Apr 2012 00:13:49 GMT""}]","2013-03-06"
"1204.0151","M Taghizadeh-Popp Dr.","M. Taghizadeh-Popp, K. Ozogany, Z. Racz, E. Regoes, A. S. Szalay","Distribution of Maximal Luminosity of Galaxies in the Sloan Digital Sky
  Survey","Accepted for publication in ApJ",,"10.1088/0004-637X/759/2/100",,"astro-ph.CO stat.AP","http://arxiv.org/licenses/nonexclusive-distrib/1.0/","  Extreme value statistics (EVS) is applied to the distribution of galaxy
luminosities in the Sloan Digital Sky Survey (SDSS). We analyze the DR8 Main
Galaxy Sample (MGS), as well as the Luminous Red Galaxies (LRG). Maximal
luminosities are sampled from batches consisting of elongated pencil beams in
the radial direction of sight. For the MGS, results suggest a small and
positive tail index $\xi$, effectively ruling out the possibility of having a
finite maximum cutoff luminosity, and implying that the luminosity distribution
function may decay as a power law at the high luminosity end. Assuming,
however, $\xi=0$, a non-parametric comparison of the maximal luminosities with
the Fisher-Tippett-Gumbel distribution (limit distribution for variables
distributed by the Schechter fit) indicates a good agreement provided
uncertainties arising both from the finite batch size and from the batch size
distribution are accounted for. For a volume limited sample of LRGs, results
show that they can be described as being the extremes of a luminosity
distribution with an exponentially decaying tail, provided the uncertainties
related to batch-size distribution are taken care of.
","[{""version"":""v1"",""created"":""Sun, 1 Apr 2012 00:43:49 GMT""},{""version"":""v2"",""created"":""Fri, 21 Sep 2012 19:19:48 GMT""}]","2015-06-04"
"1204.0152","Daijiro Nozaki","Daijiro Nozaki, Claudia Gomes da Rocha, Horacio M. Pastawski,
  Gianaurelio Cuniberti","Disorder and dephasing effect on electron transport through conjugated
  molecular wires in molecular junctions","6 pages, 7 figures, accepted for publication in Phys. Rev. B","Phys. Rev. B 85, 155327 (2012)","10.1103/PhysRevB.85.155327",,"cond-mat.mes-hall cond-mat.mtrl-sci","http://arxiv.org/licenses/nonexclusive-distrib/1.0/","  Understanding electron transport processes in molecular wires connected
between contacts is a central focus in the field of molecular electronics.
Especially, the dephasing effect causing tunneling-to-hopping transition has
great importance from both applicational and fundamental points of view. We
analyzed coherent and incoherent electron transmission through conjugated
molecular wires by means of density-functional tight-binding theory within the
D'Amato-Pastawski model. Our approach can study explicitly the
structure/transport relationship in molecular junctions in a dephasing
environmental condition using only single dephasing parameter. We investigated
the length dependence and the influence of thermal fluctuations on transport
and reproduced the well-known tunneling-to-hopping transition. This approach
will be a powerful tool for the interpretation of recent conductance
measurements of molecular wires.
","[{""version"":""v1"",""created"":""Sun, 1 Apr 2012 01:29:45 GMT""}]","2012-06-26"
"1204.0153","Yahya Sowti Khiabai","Yahya S. Khiabani, Shuangqing Wei, Jian Yuan and Jian Wang","Enhancement of Secrecy of Block Ciphered Systems by Deliberate Noise","11 pages, 8 figures, journal",,,,"cs.CR","http://arxiv.org/licenses/nonexclusive-distrib/1.0/","  This paper considers the problem of end-end security enhancement by resorting
to deliberate noise injected in ciphertexts. The main goal is to generate a
degraded wiretap channel in application layer over which Wyner-type secrecy
encoding is invoked to deliver additional secure information. More
specifically, we study secrecy enhancement of DES block cipher working in
cipher feedback model (CFB) when adjustable and intentional noise is introduced
into encrypted data in application layer. A verification strategy in exhaustive
search step of linear attack is designed to allow Eve to mount a successful
attack in the noisy environment. Thus, a controllable wiretap channel is
created over multiple frames by taking advantage of errors in Eve's
cryptanalysis, whose secrecy capacity is found for the case of known channel
states at receivers. As a result, additional secure information can be
delivered by performing Wyner type secrecy encoding over super-frames ahead of
encryption, namely, our proposed secrecy encoding-then-encryption scheme. These
secrecy bits could be taken as symmetric keys for upcoming frames. Numerical
results indicate that a sufficiently large secrecy rate can be achieved by
selective noise addition.
","[{""version"":""v1"",""created"":""Sun, 1 Apr 2012 01:52:36 GMT""}]","2012-04-03"
"1204.0154","Baoli Liu","H. Q. Ye, G. Wang, B. L. Liu, Z. W. Shi, W. X. Wang, C. Fontaine, A.
  Balocchi, T. Amand, D. Lagarde, P. Renucci, and X. Marie","Growth Direction Dependence of the Electron Spin Dynamics in {111} GaAs
  Quantum Wells","11 pages, 5 figures",,"10.1063/1.4737007",,"cond-mat.mes-hall","http://arxiv.org/licenses/nonexclusive-distrib/1.0/","  The electron spin dynamics is studied by time-resolved Kerr rotation in
GaAs/AlGaAs quantum wells embedded in a negatively doped-intrinsic-positively
doped structures grown on (111)A or (111)B-oriented substrates. In both cases
the spin lifetimes are significantly increased by applying an external electric
field but this field has to point along the growth direction for structures
grown on (111)A and opposite to it for the ones grown on (111)B. This extended
electron spin lifetime is the result of the suppression of the D'yakonov-Perel
spin relaxation mechanism [Sov. Phys. Solid State 13, 3023 (1972)] due to the
cancellation effect of the internal Dresselhaus term [Phys. Rev. 100, 580
(1955)] with the external electric field induced Rashba one [J. Phys. C 17,
6039 (1984)], both governing the conduction band spin-orbit splitting. These
results demonstrate the key role played by the growth direction in the design
of spintronic devices.
","[{""version"":""v1"",""created"":""Sun, 1 Apr 2012 02:04:28 GMT""},{""version"":""v2"",""created"":""Mon, 14 May 2012 04:03:40 GMT""}]","2015-06-04"
"1204.0155","Jacob Lynn","Jacob W. Lynn, Ian J. Parrish, Eliot Quataert, Benjamin D. G. Chandran","Resonance Broadening and Heating of Charged Particles in
  Magnetohydrodynamic Turbulence","20 pages, 15 figures; accepted by The Astrophysical Journal; added
  clarifying appendices, but no major changes to results",,"10.1088/0004-637X/758/2/78",,"astro-ph.SR","http://arxiv.org/licenses/nonexclusive-distrib/1.0/","  The heating, acceleration, and pitch-angle scattering of charged particles by
MHD turbulence are important in a wide range of astrophysical environments,
including the solar wind, accreting black holes, and galaxy clusters. We
simulate the interaction of high-gyrofrequency test particles with fully
dynamical simulations of subsonic MHD turbulence, focusing on the parameter
regime with beta ~ 1, where beta is the ratio of gas to magnetic pressure. We
use the simulation results to calibrate analytical expressions for test
particle velocity-space diffusion coefficients and provide simple fits that can
be used in other work.
  The test particle velocity diffusion in our simulations is due to a
combination of two processes: interactions between particles and magnetic
compressions in the turbulence (as in linear transit-time damping; TTD) and
what we refer to as Fermi Type-B (FTB) interactions, in which charged particles
moving on field lines may be thought of as beads spiralling around moving
wires. We show that test particle heating rates are consistent with a TTD
resonance which is broadened according to a decorrelation prescription that is
Gaussian in time. TTD dominates the heating for v_s >> v_A (e.g. electrons),
where v_s is the thermal speed of species s and v_A is the Alfven speed, while
FTB dominates for v_s << v_A (e.g. minor ions). Proton heating rates for beta ~
1 are comparable to the turbulent cascade rate. Finally, we show that velocity
diffusion of collisionless, large gyrofrequency particles due to large-scale
MHD turbulence does not produce a power-law distribution function.
","[{""version"":""v1"",""created"":""Sun, 1 Apr 2012 02:14:21 GMT""},{""version"":""v2"",""created"":""Thu, 6 Sep 2012 16:18:35 GMT""}]","2013-08-26"
"1204.0156","Raju Balakrishnan","Srijith Ravikumar, Raju Balakrishnan, Subbarao Kambhampati","Ranking Tweets Considering Trust and Relevance","four pages short paper",,,,"cs.SI cs.IR","http://arxiv.org/licenses/nonexclusive-distrib/1.0/","  The increasing popularity of Twitter and other microblogs makes improved
trustworthiness and relevance assessment of microblogs evermore important. We
propose a method of ranking of tweets considering trustworthiness and content
based popularity. The analysis of trustworthiness and popularity exploits the
implicit relationships between the tweets. We model microblog ecosystem as a
three-layer graph consisting of : (i) users (ii) tweets and (iii) web pages. We
propose to derive trust and popularity scores of entities in these three
layers, and propagate the scores to tweets considering the inter-layer
relations. Our preliminary evaluations show improvement in precision and
trustworthiness over the baseline methods and acceptable computation timings.
","[{""version"":""v1"",""created"":""Sun, 1 Apr 2012 02:30:00 GMT""}]","2012-04-03"
"1204.0157","Tsvetana Stoyanova","Tsvetana Lyubenova Stoyanova","A note on the R. Fuchs's problem for the Painlev\'e equations","16 pages",,,,"math.CA nlin.SI","http://creativecommons.org/licenses/by-nc-sa/3.0/","  In this article we consider a first-order completely integrable system of
partial differential equations $\partial \Fi/partial x=A(x, t) \Fi, \partial
\Fi/partial t=B(x, t) \Fi$ with $\Fi=(\fi_1, \fi_2)^{\tau}$ where $A(x, t)$ and
$B(x, t)$ are 2 by 2 holomorphic matrices functions. Under some assumptions we
find a variable change by which the system $\partial \Fi/\partial x=A(x, t)
\Fi$ is reduced to an equation independent on the variable $t$. As an
application we show that the R. Fuchs's conjecture for the Painlev\'e equations
is true for some algebraic solutions.
","[{""version"":""v1"",""created"":""Sun, 1 Apr 2012 03:06:16 GMT""}]","2012-04-03"
"1204.0158","Adam Micolich","A. M. See, I. Pilgrim, B. C. Scannell, R. D. Montgomery, O. Klochan,
  A. M. Burke, M. Aagesen, P. E. Lindelof, I. Farrer, D. A. Ritchie, R. P.
  Taylor, A. R. Hamilton and A. P. Micolich","The Impact of Small-Angle Scattering on Ballistic Transport in Quantum
  Dots","In press for Phys. Rev. Lett","Physical Review Letters 108, 196807 (2012)","10.1103/PhysRevLett.108.196807",,"cond-mat.mes-hall quant-ph","http://arxiv.org/licenses/nonexclusive-distrib/1.0/","  Disorder increasingly affects performance as electronic devices are reduced
in size. The ionized dopants used to populate a device with electrons are
particularly problematic, leading to unpredictable changes in the behavior of
devices such as quantum dots each time they are cooled for use. We show that a
quantum dot can be used as a highly sensitive probe of changes in disorder
potential, and that by removing the ionized dopants and populating the dot
electrostatically, its electronic properties become reproducible with high
fidelity after thermal cycling to room temperature. Our work demonstrates that
the disorder potential has a significant, perhaps even dominant, influence on
the electron dynamics, with important implications for `ballistic' transport in
quantum dots.
","[{""version"":""v1"",""created"":""Sun, 1 Apr 2012 03:11:39 GMT""}]","2012-05-24"
"1204.0159","Qiqi Wang","Qiqi Wang, Rui Hu and Patrick Blonigan","Least Squares Shadowing sensitivity analysis of chaotic limit cycle
  oscillations","submitted to JCP in revised form",,"10.1016/j.jcp.2014.03.002",,"physics.comp-ph nlin.CD physics.flu-dyn","http://arxiv.org/licenses/nonexclusive-distrib/1.0/","  The adjoint method, among other sensitivity analysis methods, can fail in
chaotic dynamical systems. The result from these methods can be too large,
often by orders of magnitude, when the result is the derivative of a long time
averaged quantity. This failure is known to be caused by ill-conditioned
initial value problems. This paper overcomes this failure by replacing the
initial value problem with the well-conditioned ""least squares shadowing (LSS)
problem"". The LSS problem is then linearized in our sensitivity analysis
algorithm, which computes a derivative that converges to the derivative of the
infinitely long time average. We demonstrate our algorithm in several dynamical
systems exhibiting both periodic and chaotic oscillations.
","[{""version"":""v1"",""created"":""Sun, 1 Apr 2012 04:12:11 GMT""},{""version"":""v2"",""created"":""Wed, 25 Jul 2012 07:54:12 GMT""},{""version"":""v3"",""created"":""Sun, 10 Mar 2013 15:16:22 GMT""},{""version"":""v4"",""created"":""Mon, 26 Aug 2013 02:25:00 GMT""},{""version"":""v5"",""created"":""Thu, 24 Oct 2013 18:58:33 GMT""},{""version"":""v6"",""created"":""Fri, 25 Oct 2013 20:31:37 GMT""},{""version"":""v7"",""created"":""Wed, 26 Feb 2014 13:48:21 GMT""}]","2015-03-20"
"1204.0160","Antonio Martins Figueiredo Neto","Erol Akpinar, Dennys Reis and Antonio Martins Figueiredo Neto","Effect of the alkyl chain length of the alcohols on the nematic
  uniaxial-to-biaxial phase transitions in the potassium
  laurate/alcohol/K2SO4/water lyotropic mixture",,,,,"cond-mat.soft","http://arxiv.org/licenses/nonexclusive-distrib/1.0/","  Lyotropic liquid crystalline quaternary mixtures of potassium laurate (KL),
potassium sulphate (K2SO4)/alcohol (n-OH)/water, with the alcohols having
different number of carbon atoms in the alkyl chain (n), from 1 octanol to
1-hexadecanol, were investigated by optical techniques (optical microscopy and
laser conoscopy). The biaxial nematic phase domain is present in a window of
values of n = nKL \pm 2, where nKL = 11 is the number of carbon atoms in the
alkyl chain of KL. The biaxial phase domain got smaller and the
uniaxial-to-biaxial phase transition temperatures shifted to the relatively
higher temperatures on going from 1-nonanol to 1-tridecanol. Moreover, these
new mixtures present high values of the birefringences comparing to other
lyotropic mixtures. This result is expected to be related to the micellar shape
anisotropy. Our results are interpreted assuming that alcohol molecules tend to
segregate in the micelles in a way that depends on the relative value of n with
respect to nKL . The larger the value of n, the more alcohol molecules tend to
be located in the curved parts of the micelle, favoring the uniaxial nematic
calamitic phase with respect to the biaxial and uniaxial discotic nematic
phases.
","[{""version"":""v1"",""created"":""Sun, 1 Apr 2012 04:20:45 GMT""}]","2012-04-03"
"1204.0161","Zhigang Cao","Zhigang Cao, Mingmin Yang, Xinglong Qu, Xiaoguang Yang","Rebels Lead to the Doctrine of the Mean: Opinion Dynamic in a
  Heterogeneous DeGroot Model","7 pages, Proceedings of The 6th International Conference on
  Knowledge, Information and Creativity Support Systems, Beijing, 2011",,,,"cs.SI physics.soc-ph","http://arxiv.org/licenses/nonexclusive-distrib/1.0/","  We study an extension of the DeGroot model where part of the players may be
rebels. The updating rule for rebels is quite different with that of normal
players (which are referred to as conformists): at each step a rebel first
takes the opposite value of the weighted average of her neighbors' opinions,
i.e. 1 minus that average (the opinion space is assumed to be [0,1] as usual),
and then updates her opinion by taking another weighted average between that
value and her own opinion in the last round. We find that the effect of rebels
is rather significant: as long as there is at least one rebel in every closed
and strongly connected group, under very weak conditions, the opinion of each
player in the whole society will eventually tend to 0.5.
","[{""version"":""v1"",""created"":""Sun, 1 Apr 2012 04:23:28 GMT""}]","2012-04-03"
"1204.0162","Dmitri Krioukov","Dmitri Krioukov","The Proof of Innocence",,"Annals of Improbable Research, v.18, n.4, p.12, 2012",,,"physics.pop-ph physics.data-an","http://arxiv.org/licenses/nonexclusive-distrib/1.0/","  A way to fight your traffic tickets. The paper was awarded a special prize of
$400 that the author did not have to pay to the state of California.
  In view of enormous, extremely surprising and completely unexpected public
interest to this work, we have added an appendix answering the two most common
questions.
","[{""version"":""v1"",""created"":""Sun, 1 Apr 2012 04:26:58 GMT""},{""version"":""v2"",""created"":""Fri, 20 Apr 2012 06:24:20 GMT""}]","2012-12-27"
"1204.0163","Zhigang Cao","Zhigang Cao, Haoyu Gao, Xinglong Qu, Mingmin Yang, Xiaoguang Yang","Fashion, Cooperation, and Social Interactions","21 pages, 12 figures","PLoS ONE 8(1): e49441. 2013","10.1371/journal.pone.0049441",,"cs.MA cs.SI physics.soc-ph","http://arxiv.org/licenses/nonexclusive-distrib/1.0/","  Fashion plays such a crucial rule in the evolution of culture and society
that it is regarded as a second nature to the human being. Also, its impact on
economy is quite nontrivial. On what is fashionable, interestingly, there are
two viewpoints that are both extremely widespread but almost opposite:
conformists think that what is popular is fashionable, while rebels believe
that being different is the essence. Fashion color is fashionable in the first
sense, and Lady Gaga in the second. We investigate a model where the population
consists of the afore-mentioned two groups of people that are located on social
networks (a spatial cellular automata network and small-world networks). This
model captures two fundamental kinds of social interactions (coordination and
anti-coordination) simultaneously, and also has its own interest to game
theory: it is a hybrid model of pure competition and pure cooperation. This is
true because when a conformist meets a rebel, they play the zero sum matching
pennies game, which is pure competition. When two conformists (rebels) meet,
they play the (anti-) coordination game, which is pure cooperation. Simulation
shows that simple social interactions greatly promote cooperation: in most
cases people can reach an extraordinarily high level of cooperation, through a
selfish, myopic, naive, and local interacting dynamic (the best response
dynamic). We find that degree of synchronization also plays a critical role,
but mostly on the negative side. Four indices, namely cooperation degree,
average satisfaction degree, equilibrium ratio and complete ratio, are defined
and applied to measure people's cooperation levels from various angles. Phase
transition, as well as emergence of many interesting geographic patterns in the
cellular automata network, is also observed.
","[{""version"":""v1"",""created"":""Sun, 1 Apr 2012 04:40:26 GMT""},{""version"":""v2"",""created"":""Sun, 29 Apr 2012 05:42:23 GMT""},{""version"":""v3"",""created"":""Thu, 18 Oct 2012 23:33:06 GMT""}]","2015-03-20"
"1204.0164","Alkan Kabak\c{c}io\u{g}lu","Alkan Kabakcioglu, Amir Bar, David Mukamel","Macroscopic loop formation in circular DNA denaturation","5 pages, 3 figures, submitted for publication","Physical Review E, 85(5), 051919 (2012)","10.1103/PhysRevE.85.051919",,"cond-mat.stat-mech q-bio.BM","http://arxiv.org/licenses/nonexclusive-distrib/1.0/","  The statistical mechanics of DNA denaturation under fixed linking number is
qualitatively different from that of the unconstrained DNA. Quantitatively
different melting scenarios are reached from two alternative assumptions,
namely, that the denatured loops are formed in expense of 1) overtwist, 2)
supercoils. Recent work has shown that the supercoiling mechanism results in a
BEC-like picture where a macroscopic loop appears at Tc and grows steadily with
temperature, while the nature of the denatured phase for the overtwisting case
has not been studied. By extending an earlier result, we show here that a
macroscopic loop appears in the overtwisting scenario as well. We calculate its
size as a function of temperature and show that the fraction of the total sum
of microscopic loops decreases above Tc, with a cusp at the critical point.
","[{""version"":""v1"",""created"":""Sun, 1 Apr 2012 04:44:01 GMT""}]","2015-08-06"
"1204.0165","Deepjyoti Deka","Deepjyoti Deka and Sriram Vishwanath","Analytical Models for Power Networks: The case of the Western US and
  ERCOT grids",,,,,"cs.SI physics.soc-ph stat.OT","http://arxiv.org/licenses/nonexclusive-distrib/1.0/","  The topological structure of the power grid plays a key role in the reliable
delivery of electricity and price settlement in the electricity market.
Incorporation of new energy sources and loads into the grid over time has led
to its structural and geographical expansion and can affect its stable
operation. This paper presents an intuitive analytical model for the temporal
evolution of large grids and uses it to understand common structural features
observed in grids across America. In particular, key graph parameters like
degree distribution, graph diameter, betweenness centralities, eigen-spread and
clustering coefficients, as well as graph processes like infection propagation
are used to quantify the model's benefits through comparison with the Western
US and ERCOT power grids. The most significant contribution of the developed
model is its analytical tractability, that provides a closed form expression
for the nodal degree distribution observed in large grids. The discussed model
can be used to generate realistic test cases to analyze topological effects on
grid functioning and new grid technologies.
","[{""version"":""v1"",""created"":""Sun, 1 Apr 2012 05:03:25 GMT""},{""version"":""v2"",""created"":""Tue, 14 Jan 2014 20:08:08 GMT""},{""version"":""v3"",""created"":""Fri, 27 Feb 2015 01:36:58 GMT""}]","2015-03-02"
"1204.0166","Tsung-Hui Chang","Tsung-Hui Chang, Wing-Kin Ma and Chong-Yung Chi","Worst-Case Robust Multiuser Transmit Beamforming Using Semidefinite
  Relaxation: Duality and Implications","2011 IEEE Asilomar Conference on Signals, Systems, and Computers",,"10.1109/ACSSC.2011.6190285",,"cs.IT math.IT","http://arxiv.org/licenses/nonexclusive-distrib/1.0/","  This paper studies a downlink multiuser transmit beamforming design under
spherical channel uncertainties, using a worst-case robust formulation. This
robust design problem is nonconvex. Recently, a convex approximation
formulation based on semidefinite relaxation (SDR) has been proposed to handle
the problem. Curiously, simulation results have consistently indicated that SDR
can attain the global optimum of the robust design problem. This paper intends
to provide some theoretical insights into this important empirical finding. Our
main result is a dual representation of the SDR formulation, which reveals an
interesting linkage to a different robust design problem, and the possibility
of SDR optimality.
","[{""version"":""v1"",""created"":""Sun, 1 Apr 2012 05:08:08 GMT""}]","2016-11-17"
"1204.0167","Arup Chattopadhyay","Arup Chattopadhyay and Kalyan B. Sinha","Koplienko Trace Formula","16 pages",,,,"math.FA","http://arxiv.org/licenses/nonexclusive-distrib/1.0/","  Koplienko gave a trace formula for perturbations of self-adjoint operators by
operators of Hilbert-Schmidt class $\mathcal{B}_2(\mathcal{H})$. Recently
Gesztesy, Pushnitski and Simon gave an alternative proof of the trace formula
when the operators involved are bounded. In this article, we give a still
another proof and extend the formula for unbounded case by reducing the problem
to a finite dimensional one as in the proof of Krein trace formula by
Voiculescu, Sinha and Mohapatra.
","[{""version"":""v1"",""created"":""Sun, 1 Apr 2012 05:16:25 GMT""}]","2012-04-03"
