"1204.0168","Wen Dong","Wen Dong, Katherine A. Heller and Alex Sandy Pentland","Modeling Infection with Multi-agent Dynamics",,,"10.1007/978-3-642-29047-3_21",,"stat.AP cs.MA cs.SI physics.soc-ph","http://arxiv.org/licenses/nonexclusive-distrib/1.0/","  Developing the ability to comprehensively study infections in small
populations enables us to improve epidemic models and better advise individuals
about potential risks to their health. We currently have a limited
understanding of how infections spread within a small population because it has
been difficult to closely track an infection within a complete community. The
paper presents data closely tracking the spread of an infection centered on a
student dormitory, collected by leveraging the residents' use of cellular
phones. The data are based on daily symptom surveys taken over a period of four
months and proximity tracking through cellular phones. We demonstrate that
using a Bayesian, discrete-time multi-agent model of infection to model
real-world symptom reports and proximity tracking records gives us important
insights about infec-tions in small populations.
","[{""version"":""v1"",""created"":""Sun, 1 Apr 2012 05:24:32 GMT""},{""version"":""v2"",""created"":""Sat, 11 Oct 2014 13:44:06 GMT""}]","2014-10-14"
"1204.0169","Qing Wan","Jie Jiang, Qing Wan, Jia Sun, Wei Dou, and Qing Zhang","Gated Conductance of Thin Indium Tin Oxide - The Simplest Transistor","25 pages, 7 figures",,,,"cond-mat.mtrl-sci physics.chem-ph","http://arxiv.org/licenses/nonexclusive-distrib/1.0/","  Transistors are the fundamental building block of modern electronic devices.
So far, all transistors are based on various types of semiconductor junctions.
The most common bipolar-junction transistors and metal-oxide-semiconductor
field-effect transistors contain p-n junctions to control the current,
depending on applied biases across the junctions. Thin-film transistors need
metal-semiconductor junctions for injecting and extracting electrons from their
channels. Here, by coating a heavily-doped thin indium-tin-oxide (ITO) film
through a shadow mask onto a biopolymer chitosan/ITO/glass substrate, we can
have a high-performance junctionless transparent organic-inorganic hybrid thin
film transistor. This could be the simplest transistor in the world, to our
knowledge, not only in its structure, but also its fabrication process. In
addition, the device performance is found to be greatly enhanced using a
reinforced chitosan/SiO2 hybrid bilayer dielectric stack. Our results clearly
show that this architecture can lead to a new class of low-cost transistors.
","[{""version"":""v1"",""created"":""Sun, 1 Apr 2012 06:35:15 GMT""}]","2012-04-03"
"1204.0170","Jia Zeng","Jia Zeng, Zhi-Qiang Liu and Xiao-Qin Cao","A New Approach to Speeding Up Topic Modeling","14 pages, 12 figures",,,,"cs.LG cs.IR","http://arxiv.org/licenses/nonexclusive-distrib/1.0/","  Latent Dirichlet allocation (LDA) is a widely-used probabilistic topic
modeling paradigm, and recently finds many applications in computer vision and
computational biology. In this paper, we propose a fast and accurate batch
algorithm, active belief propagation (ABP), for training LDA. Usually batch LDA
algorithms require repeated scanning of the entire corpus and searching the
complete topic space. To process massive corpora having a large number of
topics, the training iteration of batch LDA algorithms is often inefficient and
time-consuming. To accelerate the training speed, ABP actively scans the subset
of corpus and searches the subset of topic space for topic modeling, therefore
saves enormous training time in each iteration. To ensure accuracy, ABP selects
only those documents and topics that contribute to the largest residuals within
the residual belief propagation (RBP) framework. On four real-world corpora,
ABP performs around $10$ to $100$ times faster than state-of-the-art batch LDA
algorithms with a comparable topic modeling accuracy.
","[{""version"":""v1"",""created"":""Sun, 1 Apr 2012 07:07:27 GMT""},{""version"":""v2"",""created"":""Tue, 8 Apr 2014 02:17:47 GMT""}]","2014-04-09"
"1204.0171","Mete Ozay","Mete Ozay, Fatos T. Yarman Vural","A New Fuzzy Stacked Generalization Technique and Analysis of its
  Performance",,,,,"cs.LG cs.CV","http://arxiv.org/licenses/nonexclusive-distrib/1.0/","  In this study, a new Stacked Generalization technique called Fuzzy Stacked
Generalization (FSG) is proposed to minimize the difference between N -sample
and large-sample classification error of the Nearest Neighbor classifier. The
proposed FSG employs a new hierarchical distance learning strategy to minimize
the error difference. For this purpose, we first construct an ensemble of
base-layer fuzzy k- Nearest Neighbor (k-NN) classifiers, each of which receives
a different feature set extracted from the same sample set. The fuzzy
membership values computed at the decision space of each fuzzy k-NN classifier
are concatenated to form the feature vectors of a fusion space. Finally, the
feature vectors are fed to a meta-layer classifier to learn the degree of
accuracy of the decisions of the base-layer classifiers for meta-layer
classification. Rather than the power of the individual base layer-classifiers,
diversity and cooperation of the classifiers become an important issue to
improve the overall performance of the proposed FSG. A weak base-layer
classifier may boost the overall performance more than a strong classifier, if
it is capable of recognizing the samples, which are not recognized by the rest
of the classifiers, in its own feature space. The experiments explore the type
of the collaboration among the individual classifiers required for an improved
performance of the suggested architecture. Experiments on multiple feature
real-world datasets show that the proposed FSG performs better than the state
of the art ensemble learning algorithms such as Adaboost, Random Subspace and
Rotation Forest. On the other hand, compatible performances are observed in the
experiments on single feature multi-attribute datasets.
","[{""version"":""v1"",""created"":""Sun, 1 Apr 2012 07:16:47 GMT""},{""version"":""v2"",""created"":""Sun, 28 Oct 2012 19:32:21 GMT""},{""version"":""v3"",""created"":""Tue, 30 Oct 2012 06:39:31 GMT""},{""version"":""v4"",""created"":""Thu, 1 Nov 2012 14:53:55 GMT""},{""version"":""v5"",""created"":""Mon, 12 Aug 2013 21:13:37 GMT""}]","2013-08-14"
"1204.0172","Yossi Cohen","Yossi Cohen, Smarajit Karmakar, Itamar Procaccia and Konrad Samwer","The nature of the \beta-peak in the loss modulus of amorphous solids","4 pages, 6 figures","EPL 100 36003 (2012)","10.1209/0295-5075/100/36003",,"cond-mat.mtrl-sci cond-mat.stat-mech physics.atom-ph","http://arxiv.org/licenses/nonexclusive-distrib/1.0/","  Glass formers exhibit, upon an oscillatory excitation, a response function
whose imaginary and real parts are known as the loss and storage moduli
respectively. The loss modulus typically peaks at a frequency known as the
\alpha frequency which is associated with the main relaxation mechanism of the
super-cooled liquid. In addition, the loss modulus is decorated by a smaller
peak, shoulder or wing which is referred to as the \beta-peak. The physical
origin of this secondary peak had been debated for decades, with proposed
mechanisms ranging from highly localized relaxations to entirely cooperative
ones. Using numerical simulations we bring an end to the debate, exposing a
clear and unique cooperative mechanism for the said \beta-peak which is
distinct from that of the $\alpha$-peak.
","[{""version"":""v1"",""created"":""Sun, 1 Apr 2012 07:18:20 GMT""},{""version"":""v2"",""created"":""Tue, 3 Apr 2012 05:44:34 GMT""},{""version"":""v3"",""created"":""Wed, 19 Dec 2012 14:55:05 GMT""}]","2014-06-30"
"1204.0173","Hamid G. Bafghi G.","Hamid G. Bafghi, Babak Seyfe, Mahtab Mirmohseni, M. Reza Aref","On The Achievable Rate Region of a New Wiretap Channel With Side
  Information",,,,"Rep. No. 1, March 22, 2012","cs.IT math.IT","http://arxiv.org/licenses/nonexclusive-distrib/1.0/","  A new applicable wiretap channel with separated side information is
considered here which consist of a sender, a legitimate receiver and a
wiretapper. In the considered scenario, the links from the transmitter to the
legitimate receiver and the eavesdropper experience different conditions or
channel states. So, the legitimate receiver and the wiretapper listen to the
transmitted signal through the channels with different channel states which may
have some correlation to each other. It is assumed that the transmitter knows
the state of the main channel non-causally and uses this knowledge to encode
its message. The state of the wiretap channel is not known anywhere. An
achievable equivocation rate region is derived for this model and is compared
to the existing works. In some special cases, the results are extended to the
Gaussian wiretap channel.
","[{""version"":""v1"",""created"":""Sun, 1 Apr 2012 07:27:17 GMT""}]","2012-04-03"
"1204.0174","Vera Kartak","Vera V. Kartak","Point classification of the second order ODE's by Ruslan Sharipov and
  its application to Painleve equations","20 pages, 1 figure",,,,"math.CA math.DG nlin.SI","http://arxiv.org/licenses/nonexclusive-distrib/1.0/","  This is an review on the point classification of second order ODE's by Ruslan
Sharipov. His works were published in 1997-1998 at the Electronic Archive at
LANL and undeservedly forgotten. Last chapter is an application of this
classification to the investigation of Painleve equations.
","[{""version"":""v1"",""created"":""Sun, 1 Apr 2012 08:03:25 GMT""},{""version"":""v2"",""created"":""Wed, 10 Jul 2013 07:05:57 GMT""}]","2013-07-11"
"1204.0175","Mircea Petrache","Mircea Petrache","Notes on a slice distance for singular Lp-bundles","26 pages, 2 figures",,,,"math.DG math.AP math.FA","http://arxiv.org/licenses/nonexclusive-distrib/1.0/","  A slice distance for the class of weak abelian Lp-bundles in 3 dimensions was
introduced in a previous article in collaboration with Tristan Rivi\`ere, where
it was used to prove the closure of such class of bundles for the weak
Lp-convergence. We further investigate this distance here, and we prove more
properties of it, for example we show that it is H\""older-continuous on the
slices. Using the same distance, we give here a notion of a boundary trace,
giving a suitable setting for minimization problems on weak bundles. We then
state some conjectures and some open questions.
","[{""version"":""v1"",""created"":""Sun, 1 Apr 2012 08:17:13 GMT""}]","2012-04-03"
"1204.0176","M. Rizwan Jameel Qureshi Dr.","M. Rizwan Jameel Qureshi, Mehboob Sharif and Nayyar Iqbal","Using Fuzzy Logic to Evaluate Normalization Completeness for An Improved
  Database Design","8 Pages","International Journal of Information Technology and Computer
  Science (IJTCS), Hong Kong, Vol. 4/2, pp. 48-55, March 2012","10.5815/ijitcs.2012.02.07",,"cs.DB","http://arxiv.org/licenses/nonexclusive-distrib/1.0/","  A new approach, to measure normalization completeness for conceptual model,
is introduced using quantitative fuzzy functionality in this paper. We measure
the normalization completeness of the conceptual model in two steps. In the
first step, different normalization techniques are analyzed up to Boyce Codd
Normal Form (BCNF) to find the current normal form of the relation. In the
second step, fuzzy membership values are used to scale the normal form between
0 and 1. Case studies to explain schema transformation rules and measurements.
Normalization completeness is measured by considering completeness attributes,
preventing attributes of the functional dependencies and total number of
attributes such as if the functional dependency is non-preventing then the
attributes of that functional dependency are completeness attributes. The
attributes of functional dependency which prevent to go to the next normal form
are called preventing attributes.
","[{""version"":""v1"",""created"":""Sun, 1 Apr 2012 08:17:47 GMT""}]","2012-04-03"
"1204.0177","Eugene Kamenetskii","M. Berezin, E. O. Kamenetskii, and R. Shavit","Topological-phase effects and path-dependent interference in microwave
  structures with magnetic-dipolar-mode ferrite particles","Submitted to Phys. Rev. A","J. Opt. 14 (2012) 125602","10.1088/2040-8978/14/12/125602",,"physics.optics","http://arxiv.org/licenses/nonexclusive-distrib/1.0/","  Different ways exist in optics to realize photons carrying nonzero orbital
angular momentum. Such photons with rotating wave fronts are called twisted
photons. In microwaves, twisted fields can be produced based on small ferrite
particles with magnetic-dipolar-mode (MDM) oscillations. Recent studies showed
strong localization of the electric and magnetic energies of microwave fields
by MDM ferrite disks. For electromagnetic waves irradiating MDM disks, these
small ferrite samples appear as singular subwavelength regions with time and
space symmetry breakings. The fields scattered by a MDM disk are characterized
by topologically distinctive power-flow vortices and helicity structures. In
this paper we analyze twisted states of microwave fields scattered by MDM
ferrite disks. We show that in a structure of the fields scattered by MDM
particles, one can clearly distinguish rotating topological-phase dislocations.
Specific long-distance topological properties of the fields are exhibited
clearly in the effects of path-dependent interference with two coupled MDM
particles. Such double-twisted scattering is characterized by topologically
originated split-resonance states. Our studies of topological-phase effects and
path-dependent interference in microwave structures with MDM ferrite particles
are based on numerical analysis and recently developed analytical models. We
present preliminary experimental results aimed to support basic statements of
our studies.
","[{""version"":""v1"",""created"":""Sun, 1 Apr 2012 08:22:56 GMT""}]","2015-06-04"
"1204.0178","Daniele De Martino","Daniele De Martino","On the Clausius formulation of the second law in stationary chemical
  networks through the theorems of the alternative",,,"10.1103/PhysRevE.87.052108",,"cond-mat.stat-mech physics.bio-ph physics.chem-ph q-bio.MN","http://creativecommons.org/licenses/by/3.0/","  In this article the Gordan theorem is applied to the thermodynamics of a
chemical reaction network at steady state. From a theoretical viewpoint it is
equivalent to the Clausius formulation of the second law for the out of
equilibrium steady states of chemical networks, i.e. it states that the
exclusion (presence) of closed reactions loops makes possible (impossible) the
definition of a thermodynamic potential and vice versa. On the computational
side, it reveals that calculating reactions free energy and searching
infeasible loops in flux states are dual problems whose solutions are
alternatively inconsistent. The relevance of this result for applications is
discussed with an example in the field of constraints-based modeling of
cellular metabolism where it leads to efficient and scalable methods to afford
the energy balance analysis.
","[{""version"":""v1"",""created"":""Sun, 1 Apr 2012 08:25:54 GMT""},{""version"":""v2"",""created"":""Thu, 14 Jun 2012 07:59:08 GMT""}]","2013-05-15"
"1204.0179","Youssef Bassil","Youssef Bassil","Service-Oriented Architecture for Weaponry and Battle Command and
  Control Systems in Warfighting","LACSC - Lebanese Association for Computational Sciences,
  http://www.lacsc.org/; International Journal of Information and Communication
  Technology Research, Vol. 2, No. 2, February 2012",,,,"cs.RO","http://arxiv.org/licenses/nonexclusive-distrib/1.0/","  Military is one of many industries that is more computer-dependent than ever
before, from soldiers with computerized weapons, and tactical wireless devices,
to commanders with advanced battle management, command and control systems.
Fundamentally, command and control is the process of planning, monitoring, and
commanding military personnel, weaponry equipment, and combating vehicles to
execute military missions. In fact, command and control systems are
revolutionizing as war fighting is changing into cyber, technology,
information, and unmanned warfare. As a result, a new design model that
supports scalability, reusability, maintainability, survivability, and
interoperability is needed to allow commanders, hundreds of miles away from the
battlefield, to plan, monitor, evaluate, and control the war events in a
dynamic, robust, agile, and reliable manner. This paper proposes a
service-oriented architecture for weaponry and battle command and control
systems, made out of loosely-coupled and distributed web services. The proposed
architecture consists of three elementary tiers: the client tier that
corresponds to any computing military equipment; the server tier that
corresponds to the web services that deliver the basic functionalities for the
client tier; and the middleware tier that corresponds to an enterprise service
bus that promotes interoperability between all the interconnected entities. A
command and control system was simulated and experimented and it successfully
exhibited the desired features of SOA. Future research can improve upon the
proposed architecture so much so that it supports encryption for securing the
exchange of data between the various communicating entities of the system.
","[{""version"":""v1"",""created"":""Sun, 1 Apr 2012 09:04:14 GMT""}]","2012-04-03"
"1204.0180","Alexei Buzulutskov","A. Bondar, A. Buzulutskov, A. Dolgov, A. Grebenuk, E. Shemyakina and
  A. Sokolov","Study of infrared scintillations in gaseous and liquid argon - Part I:
  methodology and time measurements","17 pages, 15 figures. Submitted to JINST","JINST 7:P06015,2012","10.1088/1748-0221/7/06/P06015",,"physics.ins-det hep-ex","http://arxiv.org/licenses/nonexclusive-distrib/1.0/","  A methodology to measure Near Infrared (NIR) scintillations in gaseous and
liquid Ar, using Geiger-mode APDs (GAPDs) sensitive in the NIR and pulsed X-ray
irradiation, is described. This study has been triggered by the development of
Cryogenic Avalanche Detectors (CRADs) with optical readout in the NIR using
combined THGEM/GAPD multiplier, which may come to be in demand in coherent
neutrino-nucleus scattering and dark matter search experiments. A new approach
to measure the NIR scintillation yield at cryogenic temperatures has been
developed, namely using GAPDs in single photoelectron counting mode with time
resolution. The time structure of NIR scintillations and their light yield were
measured both for primary scintillations and that of secondary at moderate
electric fields (electroluminescence), in gaseous and liquid Ar.
","[{""version"":""v1"",""created"":""Sun, 1 Apr 2012 09:04:53 GMT""}]","2015-03-18"
"1204.0181","Youssef Bassil","Youssef Bassil","Expert PC Troubleshooter With Fuzzy-Logic And Self-Learning Support","LACSC - Lebanese Association for Computational Sciences,
  http://www.lacsc.org/; International Journal of Artificial Intelligence &
  Applications (IJAIA), Vol.3, No.2, March 2012",,,,"cs.AI","http://arxiv.org/licenses/nonexclusive-distrib/1.0/","  Expert systems use human knowledge often stored as rules within the computer
to solve problems that generally would entail human intelligence. Today, with
information systems turning out to be more pervasive and with the myriad
advances in information technologies, automating computer fault diagnosis is
becoming so fundamental that soon every enterprise has to endorse it. This
paper proposes an expert system called Expert PC Troubleshooter for diagnosing
computer problems. The system is composed of a user interface, a rule-base, an
inference engine, and an expert interface. Additionally, the system features a
fuzzy-logic module to troubleshoot POST beep errors, and an intelligent agent
that assists in the knowledge acquisition process. The proposed system is meant
to automate the maintenance, repair, and operations (MRO) process, and free-up
human technicians from manually performing routine, laborious, and
timeconsuming maintenance tasks. As future work, the proposed system is to be
parallelized so as to boost its performance and speed-up its various
operations.
","[{""version"":""v1"",""created"":""Sun, 1 Apr 2012 09:08:21 GMT""}]","2012-04-03"
"1204.0182","Youssef Bassil","Youssef Bassil","Hybrid Information Retrieval Model For Web Images","LACSC - Lebanese Association for Computational Sciences,
  http://www.lacsc.org/; International Journal of Computer Science & Emerging
  Technologies (IJCSET), Vol. 3, No. 1, February 2012",,,,"cs.IR","http://arxiv.org/licenses/nonexclusive-distrib/1.0/","  The Bing Bang of the Internet in the early 90's increased dramatically the
number of images being distributed and shared over the web. As a result, image
information retrieval systems were developed to index and retrieve image files
spread over the Internet. Most of these systems are keyword-based which search
for images based on their textual metadata; and thus, they are imprecise as it
is vague to describe an image with a human language. Besides, there exist the
content-based image retrieval systems which search for images based on their
visual information. However, content-based type systems are still immature and
not that effective as they suffer from low retrieval recall/precision rate.
This paper proposes a new hybrid image information retrieval model for indexing
and retrieving web images published in HTML documents. The distinguishing mark
of the proposed model is that it is based on both graphical content and textual
metadata. The graphical content is denoted by color features and color
histogram of the image; while textual metadata are denoted by the terms that
surround the image in the HTML document, more particularly, the terms that
appear in the tags p, h1, and h2, in addition to the terms that appear in the
image's alt attribute, filename, and class-label. Moreover, this paper presents
a new term weighting scheme called VTF-IDF short for Variable Term
Frequency-Inverse Document Frequency which unlike traditional schemes, it
exploits the HTML tag structure and assigns an extra bonus weight for terms
that appear within certain particular HTML tags that are correlated to the
semantics of the image. Experiments conducted to evaluate the proposed IR model
showed a high retrieval precision rate that outpaced other current models.
","[{""version"":""v1"",""created"":""Sun, 1 Apr 2012 09:12:40 GMT""}]","2012-04-03"
"1204.0183","Youssef Bassil","Youssef Bassil","Neural Network Model for Path-Planning of Robotic Rover Systems","LACSC - Lebanese Association for Computational Sciences,
  http://www.lacsc.org/; International Journal of Science and Technology
  (IJST), Vol. 2, No. 2, February 2012",,,,"cs.NE","http://arxiv.org/licenses/nonexclusive-distrib/1.0/","  Today, robotics is an auspicious and fast-growing branch of technology that
involves the manufacturing, design, and maintenance of robot machines that can
operate in an autonomous fashion and can be used in a wide variety of
applications including space exploration, weaponry, household, and
transportation. More particularly, in space applications, a common type of
robots has been of widespread use in the recent years. It is called planetary
rover which is a robot vehicle that moves across the surface of a planet and
conducts detailed geological studies pertaining to the properties of the
landing cosmic environment. However, rovers are always impeded by obstacles
along the traveling path which can destabilize the rover's body and prevent it
from reaching its goal destination. This paper proposes an ANN model that
allows rover systems to carry out autonomous path-planning to successfully
navigate through challenging planetary terrains and follow their goal location
while avoiding dangerous obstacles. The proposed ANN is a multilayer network
made out of three layers: an input, a hidden, and an output layer. The network
is trained in offline mode using back-propagation supervised learning
algorithm. A software-simulated rover was experimented and it revealed that it
was able to follow the safest trajectory despite existing obstacles. As future
work, the proposed ANN is to be parallelized so as to speed-up the execution
time of the training process.
","[{""version"":""v1"",""created"":""Sun, 1 Apr 2012 09:24:19 GMT""}]","2012-04-03"
