"1203.6902","Daniel Schoch","Daniel Schoch","Gods as Topological Invariants","Please note that the publication date is April 1st 2012",,,,"physics.pop-ph gr-qc math-ph math.GN math.MP","http://arxiv.org/licenses/nonexclusive-distrib/1.0/","  We show that the number of gods in a universe must equal the Euler
characteristics of its underlying manifold. By incorporating the classical
cosmological argument for creation, this result builds a bridge between
theology and physics and makes theism a testable hypothesis. Theological
implications are profound since the theorem gives us new insights in the
topological structure of heavens and hells. Recent astronomical observations
can not reject theism, but data are slightly in favor of atheism.
","[{""version"":""v1"",""created"":""Sun, 1 Apr 2012 10:11:34 GMT""}]","2012-04-02"
"1204.0111","Jack Poulson","Jack Poulson, Bj\""orn Engquist, Siwei Li, and Lexing Ying","A parallel sweeping preconditioner for heterogeneous 3D Helmholtz
  equations","Final version of document",,"10.1137/120871985",,"cs.NA math.NA","http://arxiv.org/licenses/nonexclusive-distrib/1.0/","  A parallelization of a sweeping preconditioner for 3D Helmholtz equations
without large cavities is introduced and benchmarked for several challenging
velocity models. The setup and application costs of the sequential
preconditioner are shown to be O({\gamma}^2 N^{4/3}) and O({\gamma} N log N),
where {\gamma}({\omega}) denotes the modestly frequency-dependent number of
grid points per Perfectly Matched Layer. Several computational and memory
improvements are introduced relative to using black-box sparse-direct solvers
for the auxiliary problems, and competitive runtimes and iteration counts are
reported for high-frequency problems distributed over thousands of cores. Two
open-source packages are released along with this paper: ""Parallel Sweeping
Preconditioner (PSP)"" and the underlying distributed multifrontal solver,
""Clique"".
","[{""version"":""v1"",""created"":""Sat, 31 Mar 2012 16:00:50 GMT""},{""version"":""v2"",""created"":""Tue, 3 Apr 2012 02:42:16 GMT""},{""version"":""v3"",""created"":""Wed, 12 Sep 2012 14:58:33 GMT""},{""version"":""v4"",""created"":""Tue, 5 Feb 2013 23:01:44 GMT""}]","2013-11-26"
"1204.0112","Danyu Yang Miss","Danyu Yang","Notes on area operator, geometric 2-rough paths and Young integral when
  p^-1+q^-1=1",,,,,"math.CA","http://arxiv.org/licenses/nonexclusive-distrib/1.0/","  1.When equipped with 2-rough norm and restricted to continuous paths with
bounded variation, the area operator is a closable unbounded operator. 2.The
area defined through Riemann-Stieltjes integral is the only possible candidate
to enhance a path with vanishing 2-variation into a geometric 2-rough path.
3.Young integral is extended to p^-1+q^-1=1 by assigning a finer scale
continuity.
","[{""version"":""v1"",""created"":""Sat, 31 Mar 2012 16:07:37 GMT""}]","2012-04-03"
"1204.0113","Yizhuang You","Yi-Zhuang You, Xiao-Gang Wen","Projective non-Abelian Statistics of Dislocation Defects in a Z_N Rotor
  Model","4 pages + refs, 4 figures. RevTeX4","Phys. Rev. B 86, 161107(R) (2012)","10.1103/PhysRevB.86.161107",,"cond-mat.str-el quant-ph","http://arxiv.org/licenses/nonexclusive-distrib/1.0/","  Non-Abelian statistics is a phenomenon of topologically protected non-Abelian
Berry phases as we exchange quasiparticle excitations. In this paper, we
construct a Z_N rotor model that realizes a self-dual Z_N Abelian gauge theory.
We find that lattice dislocation defects in the model produce topologically
protected degeneracy. Even though dislocations are not quasiparticle
excitations, they resemble non-Abelian anyons with quantum dimension sqrt(N).
Exchanging dislocations can produces topologically protected projective
non-Abelian Berry phases. The dislocations, as projective non-Abelian anyons
can be viewed as a generalization of the Majorana zero modes.
","[{""version"":""v1"",""created"":""Sat, 31 Mar 2012 16:40:35 GMT""},{""version"":""v2"",""created"":""Sat, 7 Apr 2012 16:08:29 GMT""},{""version"":""v3"",""created"":""Thu, 26 Apr 2012 19:50:52 GMT""}]","2012-10-19"
"1204.0114","Tomislav Ivezic","Tomislav Ivezic","The Constitutive Relations and the Magnetoelectric Effect for Moving
  Media","18 pages, In Ref. [10] here, which corresponds to Ref. [18] in the
  published paper in IJMPB, Z. Oziewicz's published paper is added. arXiv admin
  note: text overlap with arXiv:1101.3292","International Journal of Modern Physics B, Vol. 26, No. 8 (2012)
  1250040","10.1142/S0217979212500403",,"physics.gen-ph","http://arxiv.org/licenses/nonexclusive-distrib/1.0/","  In this paper the constitutive relations for moving media with homogeneous
and isotropic electric and magnetic properties are presented as the connections
between the generalized magnetization-polarization bivector $%\mathcal{M}$ and
the electromagnetic field F. Using the decompositions of F and $\mathcal{M}$,
it is shown how the polarization vector P(x) and the magnetization vector M(x)
depend on E, B and two different velocity vectors, u - the bulk velocity vector
of the medium, and v - the velocity vector of the observers who measure E and B
fields. These constitutive relations with four-dimensional geometric
quantities, which correctly transform under the Lorentz transformations (LT),
are compared with Minkowski's constitutive relations with the 3-vectors and
several essential differences are pointed out. They are caused by the fact
that, contrary to the general opinion, the usual transformations of the
3-vectors $% \mathbf{E}$, $\mathbf{B}$, $\mathbf{P}$, $\mathbf{M}$, etc. are
not the LT. The physical explanation is presented for the existence of the
magnetoelectric effect in moving media that essentially differs from the
traditional one.
","[{""version"":""v1"",""created"":""Sat, 31 Mar 2012 16:55:22 GMT""}]","2012-04-03"
"1204.0115","Yi-Jen Lee","Cagatay Kutluhan, Yi-Jen Lee, Cliff H. Taubes","HF=HM V: Seiberg-Witten-Floer homology and handle addition","276 pages",,,,"math.GT math.SG","http://arxiv.org/licenses/nonexclusive-distrib/1.0/","  This is the last of five papers that construct an isomorphism between the
Seiberg-Witten Floer homology and the Heegaard Floer homology of a given
compact, oriented 3-manifold.
","[{""version"":""v1"",""created"":""Sat, 31 Mar 2012 16:59:59 GMT""},{""version"":""v2"",""created"":""Mon, 21 May 2012 23:41:39 GMT""},{""version"":""v3"",""created"":""Fri, 8 Sep 2017 05:24:08 GMT""}]","2017-09-11"
"1204.0116","Marcone Pereira Ph. D.","Gleiciane S. Arag\~ao, Ant\^onio L. Pereira and Marcone C. Pereira","A nonlinear elliptic problem with terms concentrating in the boundary",,,"10.1002/mma.2525",,"math.AP","http://arxiv.org/licenses/nonexclusive-distrib/1.0/","  In this paper we investigate the behavior of a family of steady state
solutions of a nonlinear reaction diffusion equation when some reaction and
potential terms are concentrated in a $\epsilon$-neighborhood of a portion
$\Gamma$ of the boundary. We assume that this $\epsilon$-neighborhood shrinks
to $\Gamma$ as the small parameter $\epsilon$ goes to zero. Also, we suppose
the upper boundary of this $\epsilon$-strip presents a highly oscillatory
behavior. Our main goal here is to show that this family of solutions converges
to the solutions of a limit problem, a nonlinear elliptic equation that
captures the oscillatory behavior. Indeed, the reaction term and concentrating
potential are transformed into a flux condition and a potential on $\Gamma$,
which depends on the oscillating neighborhood.
","[{""version"":""v1"",""created"":""Sat, 31 Mar 2012 17:17:21 GMT""}]","2015-06-04"
"1204.0117","Marcone Pereira Ph. D.","Gleiciane S. Arag\~ao, Ant\^onio L. Pereira and Marcone C. Pereira","Continuity of attractors for a nonlinear parabolic problem with terms
  concentrating in the boundary",,,,,"math.AP","http://arxiv.org/licenses/nonexclusive-distrib/1.0/","  We analyze the dynamics of the flow generated by a nonlinear parabolic
problem when some reaction and potential terms are concentrated in a
neighborhood of the boundary. We assume that this neighborhood shrinks to the
boundary as a parameter \epsilon goes to zero. Also, we suppose that the ""inner
boundary"" of this neighborhood presents a highly oscillatory behavior. Our main
goal here is to show the continuity of the family of attractors with respect to
\epsilon. Indeed, we prove upper semicontinuity under the usual properties of
regularity and dissipativeness and, assuming hyperbolicity of the equilibria,
we also show the lower semicontinuity of the attractors at \epsilon=0.
","[{""version"":""v1"",""created"":""Sat, 31 Mar 2012 17:24:49 GMT""}]","2012-04-03"
"1204.0118","Sujata Tarafdar","Moutushi Dutta Choudhury, Sayanee Jana, Sruti Dutta and Sujata
  Tarafdar","Pattern Formation in a Drying Drop of Starch Gel with Sodium Chloride","1 figure",,,,"cond-mat.soft","http://arxiv.org/licenses/nonexclusive-distrib/1.0/","  A drop of aqueous potato starch gel with a certain mole fraction of NaCl,
when dried on a glass slide, exhibits strong segregation and intricate pattern
formation phenomena. The salt forms radial dendritic crystalline aggregates
near the centre, with the starch separating out in the form of a transparent
band at the periphery. Photographs and micrographs show a series of concentric
rings with different texture.
","[{""version"":""v1"",""created"":""Sat, 31 Mar 2012 17:41:58 GMT""}]","2012-04-03"
"1204.0119","Leonardo L. Gollo","Leonardo L. Gollo, Claudio Mirasso and V\'ictor M. Egu\'iluz","Signal integration enhances the dynamic range in neuronal systems","5 pages, 4 figures","Phys. Rev. E, 85, 040902 (2012)","10.1103/PhysRevE.85.040902",,"q-bio.NC cond-mat.dis-nn cond-mat.stat-mech nlin.CG physics.bio-ph","http://arxiv.org/licenses/nonexclusive-distrib/1.0/","  The dynamic range measures the capacity of a system to discriminate the
intensity of an external stimulus. Such an ability is fundamental for living
beings to survive: to leverage resources and to avoid danger. Consequently, the
larger is the dynamic range, the greater is the probability of survival. We
investigate how the integration of different input signals affects the dynamic
range, and in general the collective behavior of a network of excitable units.
By means of numerical simulations and a mean-field approach, we explore the
nonequilibrium phase transition in the presence of integration. We show that
the firing rate in random and scale-free networks undergoes a discontinuous
phase transition depending on both the integration time and the density of
integrator units. Moreover, in the presence of external stimuli, we find that a
system of excitable integrator units operating in a bistable regime largely
enhances its dynamic range.
","[{""version"":""v1"",""created"":""Sat, 31 Mar 2012 17:46:07 GMT""},{""version"":""v2"",""created"":""Fri, 27 Apr 2012 17:34:37 GMT""}]","2012-05-02"
"1204.0120","Yuxin Yang","K. D. Elworthy and Y. Yang","The vanishing of L2 harmonic one-forms on based path spaces",,"Journal of Functional Analysis 264 (2013), pp. 1168-1196","10.1016/j.jfa.2012.12.008",,"math.PR","http://arxiv.org/licenses/nonexclusive-distrib/1.0/","  We prove the triviality of the first L2 cohomology class of based path spaces
of Riemannian manifolds furnished with Brownian motion measure, and the
consequent vanishing of L2 harmonic one-forms. We give explicit formulae for
closed and co-closed one-forms expressed as differentials of functions and
co-differentials of L2 two-forms, respectively; these are considered as
extended Clark-Ocone formulae. A feature of the proof is the use of the
temporal structure of path spaces to relate a rough exterior derivative
operator on one-forms to the exterior differentiation operator used to
construct the de Rham complex and the self-adjoint Laplacian on L2 one-forms.
This Laplacian is shown to have a spectral gap.
","[{""version"":""v1"",""created"":""Sat, 31 Mar 2012 18:00:59 GMT""},{""version"":""v2"",""created"":""Fri, 1 Jun 2012 17:24:54 GMT""}]","2013-02-25"
"1204.0121","Vladimir Skalozub","V. V. Skalozub","Effective mass of W-boson in a magnetic field","12 pages, 2 figures",,,,"hep-ph","http://arxiv.org/licenses/nonexclusive-distrib/1.0/","  Simple representation for the average value of the W-boson one-loop
polarization tensor in a magnetic field B=const, calculated in the ground state
of the tree-level spectrum, is derived. It corresponds to Demeur's formula for
electron in QED. The energy of this state, describing effective particle mass,
is computed by solving the Schwinger-Dyson equation. As application, we
investigate the effective mass squared at the threshold of the tree-level
instability, $B \to B_c = m^2/e$, and show that it is positive. In this way the
stability of the W-boson spectrum is established. Some peculiarities of the
results obtained and other applications are discussed.
","[{""version"":""v1"",""created"":""Sat, 31 Mar 2012 18:05:47 GMT""},{""version"":""v2"",""created"":""Thu, 19 Sep 2013 09:38:55 GMT""}]","2013-09-20"
"1204.0122","Wichean Kriwattanawong","W. Kriwattanawong and P. Pooseekheaw","CCD Photometric Investigation of A W UMa-Type Binary GSC 0763-0572",,,"10.1088/1674-4527/12/9/009",,"astro-ph.GA astro-ph.SR","http://arxiv.org/licenses/nonexclusive-distrib/1.0/","  A photometric solution of an A-type W UMa binary, GSC 0763-0572 is examined
with a revised orbital period. The overcontact degree is found to be $f$ =
40.66%, with a low mass ratio of $q$ = 0.2554. The result demonstrates an
unambiguous increase in the orbital period with a relative period change of
$\Delta P\slash P = +5.69\times10^{-7} $d yr$^{-1}$. This indicates that GSC
0763-0572 is undergoing a process of mass transfer from the secondary component
to the primary one with a rate of relative mass change of
$\Delta$$m_1$$\slash$$m$ $=+5.18\times10^{-8}$ yr$^{-1}$, for a conservative
model of mass transfer. We find that GSC 0763-0572 might transform into a
rapidly rotating star, if total spin angular momentum increases until it is
greater than one-third of the orbital angular momentum, without breaking the
contact configuration.
","[{""version"":""v1"",""created"":""Sat, 31 Mar 2012 18:20:48 GMT""},{""version"":""v2"",""created"":""Sat, 2 Jun 2012 04:19:17 GMT""},{""version"":""v3"",""created"":""Tue, 14 Aug 2012 08:51:58 GMT""}]","2015-06-04"
"1204.0123","Xin Zhou","Xin Zhou","Effective Non-vanishing of Asymptotic Adjoint Syzygies",,,,,"math.AG","http://arxiv.org/licenses/nonexclusive-distrib/1.0/","  The purpose of this paper is to establish an effective non-vanishing theorem
for the syzygies of an adjoint-type line bundle on a smooth variety, as the
positivity of the embedding increases. Our purpose here is to show that for an
adjoint type divisor $B = K_X+ bA$ with $b \geq n+1$, one can obtain an
effective statement for arbitrary $X$ which specializes to the statement for
Veronese syzygies in the paper ""Asymptotic Syzygies of Algebraic Varieties"" by
Ein and Lazarsfeld. We also give an answer to Problem 7.9 in that paper in this
setting.
","[{""version"":""v1"",""created"":""Sat, 31 Mar 2012 19:02:02 GMT""},{""version"":""v2"",""created"":""Tue, 8 Apr 2014 14:49:14 GMT""}]","2014-04-09"
"1204.0124","Jonathan  Tennyson","Jonathan Tennyson and Sergei N. Yurchenko","ExoMol: molecular line lists for exoplanet and other atmospheres","MNRAS (in press)","MNRAS, 425 (2012) 21--33","10.1111/j.1365-2966.2012.21440.x",,"astro-ph.EP astro-ph.SR","http://arxiv.org/licenses/nonexclusive-distrib/1.0/","  The discovery of extrasolar planets is one of the major scientific advances
of the last two decades. Hundreds of planets have now been detected and
astronomers are beginning to characterise their composition and physical
characteristics. To do this requires a huge quantity of spectroscopic data most
of which is not available from laboratory studies. The ExoMol project will
offer a comprehensive solution to this problem by providing spectroscopic data
on all the molecular transitions of importance in the atmospheres of
exoplanets. These data will be widely applicable to other problems and will be
used for studies on cool stars, brown dwarfs and circumstellar environments.
This paper lays out the scientific foundations of this project and reviews
previous work in this area.
  A mixture of first principles and empirically-tuned quantum mechanical
methods will be used to compute comprehensive and very large rotation-vibration
and rotation-vibration-electronic (rovibronic) line lists. Methodologies will
be developed for treating larger molecules such as methane and nitric acid.
ExoMol will rely on these developments and the use of state-of-the-art
computing.
","[{""version"":""v1"",""created"":""Sat, 31 Mar 2012 19:32:41 GMT""},{""version"":""v2"",""created"":""Sun, 27 May 2012 20:27:32 GMT""}]","2015-03-20"
"1204.0125","Xuwen Chen","Xuwen Chen","On the Rigorous Derivation of the 3D Cubic Nonlinear Schr\""odinger
  Equation with A Quadratic Trap","Revised according to the referee report. Accepted to appear in
  Archive for Rational Mechanics and Analysis","Archive for Rational Mechanics and Analysis, Vol. 210 (2013),
  365-408","10.1007/s00205-013-0645-5",,"math-ph math.AP math.MP","http://arxiv.org/licenses/nonexclusive-distrib/1.0/","  We consider the dynamics of the 3D N-body Schr\""{o}dinger equation in the
presence of a quadratic trap. We assume the pair interaction potential is
N^{3{\beta}-1}V(N^{{\beta}}x). We justify the mean-field approximation and
offer a rigorous derivation of the 3D cubic NLS with a quadratic trap. We
establish the space-time bound conjectured by Klainerman and Machedon [30] for
{\beta} in (0,2/7] by adapting and simplifying an argument in Chen and
Pavlovi\'c [7] which solves the problem for {\beta} in (0,1/4) in the absence
of a trap.
","[{""version"":""v1"",""created"":""Sat, 31 Mar 2012 19:38:11 GMT""},{""version"":""v2"",""created"":""Wed, 2 Jan 2013 00:22:53 GMT""},{""version"":""v3"",""created"":""Tue, 23 Apr 2013 16:25:30 GMT""}]","2013-09-13"
"1204.0126","Daniel Kabat","Daniel Kabat, Gilad Lifschytz, Shubho Roy, Debajyoti Sarkar","Holographic representation of bulk fields with spin in AdS/CFT","45 pages, LaTeX, 1 figure. v2: corrected typo in equation (75)",,"10.1103/PhysRevD.86.026004","NSF-KITP-12-045","hep-th","http://arxiv.org/licenses/nonexclusive-distrib/1.0/","  We develop the representation of bulk fields with spin one and spin two in
anti-de Sitter space, as non-local observables in the dual CFT. Working in
holographic gauge in the bulk, at leading order in 1/N bulk gauge fields are
obtained by smearing boundary currents over a sphere on the complexified
boundary, while linearized metric fluctuations are obtained by smearing the
boundary stress tensor over a ball. This representation respects AdS covariance
up to a compensating gauge transformation. We also consider massive vector
fields, where the bulk field is obtained by smearing a non-conserved current.
We compute bulk two-point functions and show that bulk locality is respected.
We show how to include interactions of massive vectors using 1/N perturbation
theory, and we comment on the issue of general backgrounds.
","[{""version"":""v1"",""created"":""Sat, 31 Mar 2012 19:45:02 GMT""},{""version"":""v2"",""created"":""Fri, 20 Jul 2012 17:30:50 GMT""}]","2013-05-30"
"1204.0127","Sta\v{s}a Milojevi\'c","Sta\v{s}a Milojevi\'c","Multidisciplinary Cognitive Content of Nanoscience and Nanotechnology",,"J Nanopart Res (2012) 14:685 Journal of Nanoparticle Research,
  Volume 14, Number 1, 685","10.1007/s11051-011-0685-4",,"physics.soc-ph cs.DL","http://arxiv.org/licenses/nonexclusive-distrib/1.0/","  This article examines the cognitive evolution and disciplinary diversity of
nanotechnology as expressed through the terminology used in titles of nano
journal articles. The analysis is based on the NanoBank bibliographic database
of 287,106 nano articles published between 1981 and 2004. We perform
multifaceted analyses of title words, focusing on 100 most frequent terms.
Hierarchical clustering of title terms reveals three distinct time periods of
cognitive development of nano research: formative (1981-1990), early
(1991-1998), and current (after 1998). Early period is characterized by the
introduction of thin film deposition techniques, while the current period is
characterized by the increased focus on carbon nanotube and nanoparticle
research. We introduce a method to identify disciplinary components of
nanotechnology. It shows that the nano research is being carried out in a
number of diverse parent disciplines. Currently only 5% of articles are
published in dedicated nano-only journals. We find that some 85% of nano
research today is multidisciplinary. Hierarchical clustering of disciplinary
components reveals that the cognitive content of current nanoscience can be
divided into nine clusters. Some clusters account for a large fraction of nano
research and are identified with such parent disciplines as the condensed
matter and applied physics, materials science, and analytical chemistry. Other
clusters represent much smaller parts of nano research, but are as cognitively
distinct. In the decreasing order of size, these fields are: polymer science,
biotechnology, general chemistry, surface science, and pharmacology. Cognitive
content of research published in nano-only journals is closest to nano research
published in condensed matter and applied physics journals.
","[{""version"":""v1"",""created"":""Sat, 31 Mar 2012 19:52:30 GMT""}]","2012-04-03"
"1204.0128","Bernardo Huberman","Chunyan Wang, Mao Ye and Bernardo A. Huberman","From User Comments to On-line Conversations",,,,,"cs.CY cs.SI physics.soc-ph","http://arxiv.org/licenses/nonexclusive-distrib/1.0/","  We present an analysis of user conversations in on-line social media and
their evolution over time. We propose a dynamic model that accurately predicts
the growth dynamics and structural properties of conversation threads. The
model successfully reconciles the differing observations that have been
reported in existing studies. By separating artificial factors from user
behaviors, we show that there are actually underlying rules in common for
on-line conversations in different social media websites. Results of our model
are supported by empirical measurements throughout a number of different social
media websites.
","[{""version"":""v1"",""created"":""Sat, 31 Mar 2012 19:56:09 GMT""}]","2012-04-03"
"1204.0129","Steen H. Hansen","Steen H. Hansen","Accelerated expansion and the virial theorem","4 pages, no figure. Comments are welcome. Inspirational movies at
  http://www.astro.ku.dk/~hansen/accelerate/",,,,"astro-ph.CO","http://arxiv.org/licenses/nonexclusive-distrib/1.0/","  When dark matter structures form and equilibrate they have to release a
significant amount of energy in order to obey the virial theorem. Since dark
matter is believed to be unable to radiate, this implies that some of the
accreted dark matter particles must be ejected with high velocities. These
ejected particles may then later hit other cosmological structures and deposit
their momentum within these structures. This induces a pressure between the
cosmological structures which opposes the effect of gravity and may therefore
mimic a cosmological constant. We estimate the magnitude of this effect and
find that it may be as large as the observed accelerated expansion. Our
estimate is accurate only within a few orders of magnitude. It is therefore
important to make a much more careful calculation of this redshift dependent
effect, before beginning to interpret the observed accelerated expansion as a
time dependent generalization of a cosmological constant.
","[{""version"":""v1"",""created"":""Sat, 31 Mar 2012 20:03:12 GMT""}]","2012-04-03"
"1204.0130","Wei Dai","Wei Dai","Continuous dependence for $H^{2}$ critical nonlinear Schr\""{o}dinger
  equations in high dimensions","12 pages, no figure",,,,"math.AP math-ph math.MP","http://arxiv.org/licenses/nonexclusive-distrib/1.0/","  The global existence of solutions in $H^{2}$ is well known for $H^{2}$
critical nonlinear Schr\""{o}dinger equations with small initial data in high
dimensions $d\geq8$. However, even though the solution is constructed by a
fixed-point technique, continuous dependence in $H^{2}$ does not follow from
the contraction mapping argument. Comparing with the low dimension cases
$4<d<8$, there is an obstruction to this approach because of the sub-quadratic
nature of the nonlinearity(which makes the derivative of the nonlinearity
non-Lipschitz). In this paper, we resolve this difficulty by applying exotic
Strichartz spaces of lower order instead and show that the solution depends
continuously on the initial value in the sense that the local flow is
continuous $H^{2}\rightarrow H^{2}$.
","[{""version"":""v1"",""created"":""Sat, 31 Mar 2012 20:07:45 GMT""}]","2012-04-03"
