"1211.5634","Hitoshi Nakada","H. Nakada, K. Sugiura, J. Margueron","Tensor-force effects on single-particle levels and proton bubble
  structure around the $Z$ or $N=20$ magic number","5 pages, including 3 figures; to appear in PRC (Brief Report)","Phys. Rev. C 87(2013)067305","10.1103/PhysRevC.87.067305",,"nucl-th","http://arxiv.org/licenses/nonexclusive-distrib/1.0/","  Applying the semi-realistic $NN$ interactions that include realistic tensor
force to the Hartree-Fock calculations, we investigate tensor-force effects on
the single-particle levels in the Ca isotopes. The semi-realistic interaction
successfully describes the experimental difference between
$\varepsilon(p1s_{1/2})$ and $\varepsilon(p0d_{3/2})$ (denoted by
$\mathit{\Delta}\varepsilon_{13}$) both at $^{40}$Ca and $^{48}$Ca, confirming
importance of the tensor force. The tensor force plays a role in the
$N$-dependence of $\mathit{\Delta}\varepsilon_{13}$ also in neutron-rich Ca
nuclei. While the $p1s_{1/2}$-$p0d_{3/2}$ inversion is predicted in heavier Ca
nuclei as in $^{48}$Ca, it takes place only in $N\geq 46$, delayed by the
tensor force. We further investigate possibility of proton bubble structure in
Ar, which is suggested by the $p1s_{1/2}$-$p0d_{3/2}$ inversion in $^{48}$Ca
and more neutron-rich Ca nuclei, by the spherical Hartree-Fock-Bogolyubov
calculations. Even with the inversion at $^{48}$Ca the pair correlation
prohibits prominent bubble distribution in $^{46}$Ar. Bubble in Ar is unlikely
also near neutron drip line because either of unboundness or of deformation.
However, $^{34}$Si remains a candidate for proton bubble structure, owing to
large shell gap between $p1s_{1/2}$ and $p0d_{5/2}$.
","[{""version"":""v1"",""created"":""Sat, 24 Nov 2012 01:56:35 GMT""},{""version"":""v2"",""created"":""Wed, 5 Jun 2013 01:15:07 GMT""}]","2013-06-27"
"1211.5635","Yves de Cornulier","Yves de Cornulier","Semisimple Zariski closure of Coxeter groups","This unpublished note was written in 2005. 6 pages, no figure",,,,"math.GR","http://arxiv.org/licenses/nonexclusive-distrib/1.0/","  Let W be an irreducible, finitely generated Coxeter group. The geometric
representation provides an discrete embedding in the orthogonal group of the
so-called Tits form. One can look at the representation modulo the kernel of
this form; we give a new proof of the following result of Vinberg: if W is
non-affine, then this representation remains faithful. Our proof uses relative
Kazhdan Property (T).
  The following corollary was only known to hold when the Tits form is
non-degenerate: the reduced C*-algebra of W is simple with a unique normalized
trace. Some other corollaries are pointed out.
","[{""version"":""v1"",""created"":""Sat, 24 Nov 2012 02:10:08 GMT""}]","2012-11-27"
"1211.5636","Ashok Singal","Ashok K. Singal","Comment on ""Exact Expression for Radiation of an Accelerated Charge in
  Classical Electrodynamics""","5 pages, 1 figure","Found.Phys.43:267-270,2013","10.1007/s10701-012-9694-0",,"physics.class-ph gr-qc","http://arxiv.org/licenses/nonexclusive-distrib/1.0/","  It is shown that a newly derived ""exact expression"" for radiation of an
accelerated charge in the recent literature is simply incorrect, having arisen
because of a wrong relativistic transformation of the distance parameter. The
ensuing claim that the newly derived expression alone that satisfies the energy
conservation for the electromagnetic radiation, is based on a wrong reasoning
where a proper distinction between the time during which the radiation is
received and the time for emission (retarded time of the charge) was not
maintained.
","[{""version"":""v1"",""created"":""Sat, 24 Nov 2012 02:17:22 GMT""}]","2013-06-11"
"1211.5637","Motomu Tsuda","Kazunari Shima, Motomu Tsuda and Takeshi Okano","Chiral Symmetry","7 pages, some arguments revised, conclusions unchanged",,,,"hep-th hep-ph","http://arxiv.org/licenses/nonexclusive-distrib/1.0/","  The exact classical solution of the equation of the motion for the
Nambu-Goldstone fermion of the nonlinear representation of supersymmetry and
its physical significance are discussed, which gives a new insight into the
chiral symmetry of the standard model for the low energy particle physics.
","[{""version"":""v1"",""created"":""Sat, 24 Nov 2012 02:33:38 GMT""},{""version"":""v2"",""created"":""Sun, 17 Feb 2013 06:03:55 GMT""},{""version"":""v3"",""created"":""Mon, 22 Apr 2013 07:56:22 GMT""}]","2013-04-23"
"1211.5638","Peter Petreczky","A. Bazavov, P. Petreczky","Static quark correlators and quarkonium properties at non-zero
  temperature","To appear in the proceedings of xQCD 2012, 10 pages LaTeX, uses
  iopams.sty",,"10.1088/1742-6596/432/1/012003","BNL-98814-2012-JA","hep-lat","http://arxiv.org/licenses/nonexclusive-distrib/1.0/","  We discuss different static quark correlators, including Wilson loops in 2+1
flavor QCD at non-zero temperature and their relation to in-medium quarkonium
properties. We present lattice results on static correlation functions obtained
with highly improved staggered fermion action and their implications for
potential models.
","[{""version"":""v1"",""created"":""Sat, 24 Nov 2012 02:48:38 GMT""}]","2015-06-12"
"1211.5639","Farruh Shahidi","Farruh Shahidi and Rasul Ganikhodzhaev","The dynamics of doubly stochastic operators on finite dimensional
  simplex","This paper has been withdrawn by the author since the counter-example
  is contained in the book: A. Marshall, I. Olkin, B. Arnold, Inequaliies:
  Theory of Majorization and its applications, 2nd Ed. Springer,2011. Page 72
  example I.5",,,,"math.DS","http://arxiv.org/licenses/nonexclusive-distrib/1.0/","  We define a doubly stochastic operator on a finite dimensional simplex and
study the limit behavior of the trajectories under doubly stochastic operators.
We prove that except for certain points, the trajectory of a point, under the
doubly stochastic operator, tends to the center of the simplex.
","[{""version"":""v1"",""created"":""Sat, 24 Nov 2012 02:53:50 GMT""},{""version"":""v2"",""created"":""Wed, 6 Nov 2013 08:28:26 GMT""},{""version"":""v3"",""created"":""Fri, 2 Nov 2018 18:33:20 GMT""}]","2018-11-06"
"1211.5640","Heping  Zhang","Rui Yang, Heping Zhang","2-Resonant fullerenes","34 pages, 25 figures",,,,"math.CO","http://arxiv.org/licenses/nonexclusive-distrib/1.0/","  A fullerene graph $F$ is a planar cubic graph with exactly 12 pentagonal
faces and other hexagonal faces. A set $\mathcal{H}$ of disjoint hexagons of
$F$ is called a resonant pattern (or sextet pattern) if $F$ has a perfect
matching $M$ such that every hexagon in $\mathcal{H}$ is $M$-alternating. $F$
is said to be $k$-resonant if any $i$ ($0\leq i\leq k$) disjoint hexagons of
$F$ form a resonant pattern. It was known that each fullerene graph is
1-resonant and all 3-resonant fullerenes are only the nine graphs. In this
paper, we show that the fullerene graphs which do not contain the subgraph $L$
or $R$ as illustrated in Fig. 1 are 2-resonant except for the specific eleven
graphs. This result implies that each IPR fullerene is 2-resonant.
","[{""version"":""v1"",""created"":""Sat, 24 Nov 2012 03:15:00 GMT""}]","2012-11-27"
"1211.5641","Aimin Guo","Ai-Min Guo, Shi-Jie Xiong, X. C. Xie, and Qing-feng Sun","Universal scheme to generate metal-insulator transition in disordered
  systems","5 ages, 4 figures","Journal of Physics: Condensed Matter 25, 415501 (2013)","10.1088/0953-8984/25/41/415501",,"cond-mat.dis-nn","http://arxiv.org/licenses/nonexclusive-distrib/1.0/","  We propose a scheme to generate metal-insulator transition in random binary
layer (RBL) model, which is constructed by randomly assigning two types of
layers. Based on a tight-binding Hamiltonian, the localization length is
calculated for a variety of RBLs with different cross section geometries by
using the transfer-matrix method. Both analytical and numerical results show
that a band of extended states could appear in the RBLs and the systems behave
as metals by properly tuning the model parameters, due to the existence of a
completely ordered subband, leading to a metal-insulator transition in
parameter space. Furthermore, the extended states are irrespective of the
diagonal and off-diagonal disorder strengths. Our results can be generalized to
two- and three-dimensional disordered systems with arbitrary layer structures,
and may be realized in Bose-Einstein condensates.
","[{""version"":""v1"",""created"":""Sat, 24 Nov 2012 03:17:49 GMT""}]","2015-06-12"
"1211.5642","Liqun Qi","Liqun Qi","Symmetric Nonnegative Tensors and Copositive Tensors",,,,,"math.SP","http://arxiv.org/licenses/nonexclusive-distrib/1.0/","  We first prove two new spectral properties for symmetric nonnegative tensors.
We prove a maximum property for the largest H-eigenvalue of a symmetric
nonnegative tensor, and establish some bounds for this eigenvalue via row sums
of that tensor. We show that if an eigenvalue of a symmetric nonnegative tensor
has a positive H-eigenvector, then this eigenvalue is the largest H-eigenvalue
of that tensor. We also give a necessary and sufficient condition for this. We
then introduce copositive tensors. This concept extends the concept of
copositive matrices. Symmetric nonnegative tensors and positive semi-definite
tensors are examples of copositive tensors. The diagonal elements of a
copositive tensor must be nonnegative. We show that if each sum of a diagonal
element and all the negative off-diagonal elements in the same row of a real
symmetric tensor is nonnegative, then that tensor is a copositive tensor. Some
further properties of copositive tensors are discussed.
","[{""version"":""v1"",""created"":""Sat, 24 Nov 2012 04:09:24 GMT""}]","2012-11-27"
"1211.5643","Ladislau B\""ol\""oni","Ladislau Boloni","Shadows and headless shadows: a worlds-based, autobiographical approach
  to reasoning",,,,,"cs.AI","http://arxiv.org/licenses/nonexclusive-distrib/1.0/","  Many cognitive systems deploy multiple, closed, individually consistent
models which can represent interpretations of the present state of the world,
moments in the past, possible futures or alternate versions of reality. While
they appear under different names, these structures can be grouped under the
general term of worlds. The Xapagy architecture is a story-oriented cognitive
system which relies exclusively on the autobiographical memory implemented as a
raw collection of events organized into world-type structures called {\em
scenes}. The system performs reasoning by shadowing current events with events
from the autobiography. The shadows are then extrapolated into headless shadows
corresponding to predictions, hidden events or inferred relations.
","[{""version"":""v1"",""created"":""Sat, 24 Nov 2012 04:11:37 GMT""}]","2012-11-27"
"1211.5644","Ladislau B\""ol\""oni","Ladislau Boloni","Modeling problems of identity in Little Red Riding Hood","arXiv admin note: text overlap with arXiv:1105.3486",,,,"cs.AI","http://arxiv.org/licenses/nonexclusive-distrib/1.0/","  This paper argues that the problem of identity is a critical challenge in
agents which are able to reason about stories. The Xapagy architecture has been
built from scratch to perform narrative reasoning and relies on a somewhat
unusual approach to represent instances and identity. We illustrate the
approach by a representation of the story of Little Red Riding Hood in the
architecture, with a focus on the problem of identity raised by the narrative.
","[{""version"":""v1"",""created"":""Sat, 24 Nov 2012 04:21:42 GMT""}]","2012-11-27"
"1211.5645","S. Kalyana Rama","S. Kalyana Rama","Remarks on Black Hole Evolution a la Firewalls and Fuzzballs","13 pages. Version 2: A footnote + a few minor changes added,
  mentioning a point which was left implicit. Version 3: A reference added.
  Version 4: d dependence is restored in formulas where d = 4 was assumed
  implicitly",,,"IMSc/2012/11/18","hep-th gr-qc","http://arxiv.org/licenses/nonexclusive-distrib/1.0/","  Assume that there exists a fundamental theory of gravity which has a
fundamental length scale and which is capable of explaining black hole
evolution process fully in terms of fundamental microscopic degrees of freedom.
The resultant evolution will clearly be unitary and will have no information
loss. Carrying this assumption to its logical conclusion and, in particular, by
considering the size of the region obtained by resolving the black hole
singularity in such a theory, we arrive at a scenario very similar to that in
Mathur's fuzz ball proposal where there is no horizon. We also comment on the
consistency of such a picture with the recent results of Almheiri et al.
","[{""version"":""v1"",""created"":""Sat, 24 Nov 2012 04:21:48 GMT""},{""version"":""v2"",""created"":""Sat, 8 Dec 2012 04:07:03 GMT""},{""version"":""v3"",""created"":""Tue, 19 Mar 2013 12:30:31 GMT""},{""version"":""v4"",""created"":""Sun, 2 Feb 2014 06:31:31 GMT""}]","2014-02-04"
"1211.5646","Michael Deem","Jeong-Man Park, Liang Ren Niestemski, and Michael W. Deem","Quasispecies Theory for Evolution of Modularity","21 pages, 4 figures; presentation reordered; to appear in Phys. Rev.
  E",,,,"q-bio.PE","http://arxiv.org/licenses/nonexclusive-distrib/1.0/","  Biological systems are modular, and this modularity evolves over time and in
different environments. A number of observations have been made of increased
modularity in biological systems under increased environmental pressure. We
here develop a quasispecies theory for the dynamics of modularity in
populations of these systems. We show how the steady-state fitness in a
randomly changing environment can be computed. We derive a fluctuation
dissipation relation for the rate of change of modularity and use it to derive
a relationship between rate of environmental changes and rate of growth of
modularity. We also find a principle of least action for the evolved modularity
at steady state. Finally, we compare our predictions to simulations of protein
evolution and find them to be consistent.
","[{""version"":""v1"",""created"":""Sat, 24 Nov 2012 04:37:20 GMT""},{""version"":""v2"",""created"":""Fri, 1 Aug 2014 22:33:43 GMT""},{""version"":""v3"",""created"":""Fri, 29 Aug 2014 20:35:54 GMT""},{""version"":""v4"",""created"":""Mon, 5 Jan 2015 23:34:19 GMT""}]","2015-01-07"
"1211.5647","Jan van der Kuur","Jan van der Kuur, Mikko Kiviranta","Operation of transition edge sensors in a resistance locked loop","4 pages, 2 figures",,"10.1063/1.4788683",,"physics.ins-det","http://arxiv.org/licenses/nonexclusive-distrib/1.0/","  We propose to operate a superconducting transition edge sensor (TES) using a
different type of biasing, in which the resistance of the TES is kept constant
by means of feedback on the bias voltage and is independent of the incoming
signal power. By combining a large negative electrothermal feedback with a load
independent resistance, this approach can significantly linearise the response
of the detector in the large signal limit. The electrothermal feedback is
enhanced in comparison with the commonly applied voltage biasing, which further
increases the speed of the detector. Furthermore, in frequency domain
multiplexed (FDM) readout, the sinusoidal bias voltages for each TES can be
generated cryogenically with the readout SQUIDs.
","[{""version"":""v1"",""created"":""Sat, 24 Nov 2012 05:57:13 GMT""}]","2015-06-12"
"1211.5648","Alfred Coleman DR","Alfred Coleman, Marlien E Herselman, Mary Coleman","Improving Computer-Mediated Synchronous Communication of Doctors in
  Rural Communities through Cloud Computing: A Case Study of Rural Hospitals in
  South Africa","10",,,,"cs.CY cs.HC","http://arxiv.org/licenses/nonexclusive-distrib/1.0/","  This paper investigated how doctors in remote rural hospitals in South Africa
use computer-mediated tool to communicate with experienced and specialist
doctors for professional advice to improve on their clinical practices. A case
study approach was used. Ten doctors were purposively selected from ten
hospitals in the North West Province. Data was collected using semi-structured
open ended interview questions. The interviewees were asked to tell in their
own words the average number of patients served per week, processes used in
consultation with other doctors, communication practices using
computer-mediated tool, transmission speed of the computer-mediated tool and
satisfaction in using the computer-mediated communication tool. The findings
revealed that an average of 15 consultations per doctor to a specialist doctor
per week was done through face to face or through telephone conversation
instead of using a computer-mediated tool. Participants cited reasons for not
using computer-mediated tool for communication due to slow transmission speed
of the Internet and regular down turn of the Internet connectivity, constant
electricity power outages and lack of e-health application software to support
real time computer-mediated communication. The results led to the
recommendation of a hybrid cloud computing architecture for improving
communication between doctors in hospitals.
","[{""version"":""v1"",""created"":""Sat, 24 Nov 2012 06:46:47 GMT""}]","2012-11-27"
"1211.5649","Yong-il Shin","Jae-yoon Choi, Sang Won Seo, Yong-il Shin","Observation of Thermally Activated Vortex Pairs in a Quasi-2D Bose Gas","8 pages, 7 figures, publication version","Physical Review Letters 110, 175302 (2013)","10.1103/PhysRevLett.110.175302",,"cond-mat.quant-gas","http://arxiv.org/licenses/nonexclusive-distrib/1.0/","  We measure the in-plane distribution of thermally activated vortices in a
trapped quasi-2D Bose gas, where we enhance the visibility of density-depleted
vortex cores by radially compressing the sample before releasing the trap. The
pairing of vortices is revealed by the two-vortex spatial correlation function
obtained from the vortex distribution. The vortex density decreases gradually
as temperature is lowered, and below a certain temperature, a vortex-free
region emerges in the center of the sample. This shows the crossover from a
Berezinskii-Kosterlitz-Thouless phase containing vortex-pair excitations to a
vortex-free Bose-Einstein condensate in a finite-size 2D system.
","[{""version"":""v1"",""created"":""Sat, 24 Nov 2012 07:08:16 GMT""},{""version"":""v2"",""created"":""Mon, 1 Apr 2013 02:04:31 GMT""}]","2015-06-12"
"1211.5650","Peng Wang","Jun Tao, Peng Wang, Haitang Yang","Homogeneous Field and WKB Approximation In Deformed Quantum Mechanics
  with Minimal Length","31 pages; v2: a new subsection about applications of WKB
  approximation and references added, published version","Adv.High Energy Phys. 2015 (2015) 718359",,"CTP-SCU/2012002","hep-th gr-qc hep-ph","http://arxiv.org/licenses/nonexclusive-distrib/1.0/","  In the framework of the deformed quantum mechanics with minimal length, we
consider the motion of a non-relativistic particle in a homogeneous external
field. We find the integral representation for the physically acceptable wave
function in the position representation. Using the method of steepest descent,
we obtain the asymptotic expansions of the wave function at large positive and
negative arguments. We then employ the leading asymptotic expressions to derive
the WKB connection formula, which proceeds from classically forbidden region to
classically allowed one through a turning point. By the WKB connection formula,
we prove the Bohr-Sommerfeld quantization rule up to $\mathcal{O}(\beta)$. We
also show that, if the slope of the potential at a turning point is too steep,
the WKB connection formula fall apart around the turning point.
","[{""version"":""v1"",""created"":""Sat, 24 Nov 2012 07:34:02 GMT""},{""version"":""v2"",""created"":""Fri, 11 Dec 2015 09:02:55 GMT""}]","2015-12-14"
"1211.5651","Oussama Hijazi","Oussama Hijazi and Sebasti\'an Montiel","Uniqueness of the AdS Spacetime among Static Vacua with prescribed Null
  infinity",,,,,"math.DG","http://arxiv.org/licenses/nonexclusive-distrib/1.0/","  We prove that an $(n+1)$-dimensional spin static vacuum with negative
cosmological constant whose null infinity has a boundary admitting a
non-trivial Killing spinor field is the AdS spacetime. As a consequence, we
generalize previous uniqueness results by X. Wang \cite{Wa2} and by
Chru{\'s}ciel-Herzlich \cite{CH} and introduce, for this class of spin static
vacua, some Lorentzian manifolds which are prohibited as null infinities.
","[{""version"":""v1"",""created"":""Sat, 24 Nov 2012 08:17:31 GMT""}]","2012-11-27"
"1211.5652","Stanley Alama","Stan Alama and Qi Gao","Symmetric vortices for two-component Ginzburg-Landau systems","32 pages",,,,"math.AP","http://arxiv.org/licenses/nonexclusive-distrib/1.0/","  We study Ginzburg--Landau equations for a complex vector order parameter
Psi=(psi_+,psi_-). We consider symmetric (equivariant) vortex solutions in the
plane R^2 with given degrees n_\pm, and prove existence, uniqueness, and
asymptotic behavior of solutions for large r. We also consider the monotonicity
properties of solutions, and exhibit parameter ranges in which both vortex
profiles |psi_+|, |psi_i| are monotone, as well as parameter regimes where one
component is non-monotone. The qualitative results are obtained by means of a
sub- and supersolution construction and a comparison theorem for elliptic
systems.
","[{""version"":""v1"",""created"":""Sat, 24 Nov 2012 09:05:53 GMT""},{""version"":""v2"",""created"":""Wed, 1 May 2013 02:51:28 GMT""}]","2013-05-02"
"1211.5653","Hongliang Shi","Hongliang Shi, Hui Pan, Yong-Wei Zhang, and Boris I. Yakobson","Quasiparticle band structures and optical properties of strained
  monolayer MoS2 and WS2","8 pages, 7 figures (submitted to PRB)","Phys. Rev. B 87, 155304 (2013)","10.1103/PhysRevB.87.155304",,"cond-mat.mtrl-sci","http://arxiv.org/licenses/nonexclusive-distrib/1.0/","  The quasiparticle (QP) band structures of both strainless and strained
monolayer MoS$_{2}$ are investigated using more accurate many body perturbation
\emph{GW} theory and maximally localized Wannier functions (MLWFs) approach. By
solving the Bethe-Salpeter equation (BSE) including excitonic effects on top of
the partially self-consistent \emph{GW$_{0}$} (sc\emph{GW$_{0}$}) calculation,
the predicted optical gap magnitude is in a good agreement with available
experimental data. With increasing strain, the exciton binding energy is nearly
unchanged, while optical gap is reduced significantly. The sc\emph{GW$_{0}$}
and BSE calculations are also performed on monolayer WS$_{2}$, similar
characteristics are predicted and WS$_{2}$ possesses the lightest effective
mass at the same strain among monolayers Mo(S,Se) and W(S,Se). Our results also
show that the electron effective mass decreases as the tensile strain
increases, resulting in an enhanced carrier mobility. The present calculation
results suggest a viable route to tune the electronic properties of monolayer
transition-metal dichalcogenides (TMDs) using strain engineering for potential
applications in high performance electronic devices.
","[{""version"":""v1"",""created"":""Sat, 24 Nov 2012 09:22:23 GMT""},{""version"":""v2"",""created"":""Sat, 2 Mar 2013 13:13:54 GMT""}]","2013-04-10"
"1211.5654","Muhammed Yonac","Muhammed Y\""ona\c{c} and J. H. Eberly","Effects of Quantum Error Correction on Entanglement Sudden Death","10 pages, 10 figures; references added; journal reference added","Quantum Information and Computation, Vol. 14, No. 1&2 (2014)
  0039-0055",,,"quant-ph","http://arxiv.org/licenses/nonexclusive-distrib/1.0/","  We investigate the effects of error correction on non-local quantum coherence
as a function of time, extending the study by Sainz and Bj\""ork. We consider
error correction of amplitude damping, pure phase damping and combinations of
amplitude and phase damping as they affect both fidelity and quantum
entanglement. Initial two-qubit entanglement is encoded in arbitrary real
superpositions of both \Phi-type and \Psi-type Bell states. Our main focus is
on the possibility of delay or prevention of ESD (early stage decoherence, or
entanglement sudden death). We obtain the onset times for ESD as a function of
the state-superposition mixing angle. Error correction affects entanglement and
fidelity differently, and we exhibit initial entangled states for which error
correction increases fidelity but decreases entanglement, and vice versa.
","[{""version"":""v1"",""created"":""Sat, 24 Nov 2012 09:36:39 GMT""},{""version"":""v2"",""created"":""Tue, 3 Sep 2013 08:08:36 GMT""}]","2013-09-12"
