"1211.5616","Magnus Ogren","F. Kh. Abdullaev, M. Ogren, M. P. Soerensen","Faraday waves in quasi-one-dimensional superfluid Fermi-Bose mixtures","Final published version","Phys. Rev. A 87, 023616 (2013)","10.1103/PhysRevA.87.023616",,"nlin.PS cond-mat.quant-gas","http://arxiv.org/licenses/nonexclusive-distrib/1.0/","  Generation of Faraday waves in superfluid Fermi-Bose mixtures in elongated
traps is investigated. The generation of waves is achieved by periodically
changing a parameter of the system in time. Two types of modulations of
parameters are considered, first a variation of the fermion-bosons scattering
length, and secondly the boson-boson scattering length. We predict the
properties of the generated Faraday patterns and study the parameter regions
where they can be excited.
","[{""version"":""v1"",""created"":""Fri, 23 Nov 2012 22:12:00 GMT""},{""version"":""v2"",""created"":""Sun, 17 Feb 2013 10:55:14 GMT""}]","2013-02-19"
"1211.5617","Joshua Combes","Srinivas Sridharan, Masahiro Yanagisawa, Joshua Combes","Optimal rotation control for a qubit subject to continuous measurement","6 pages, 3 figures",,,,"math.OC cs.SY quant-ph","http://arxiv.org/licenses/nonexclusive-distrib/1.0/","  In this article we analyze the optimal control strategy for rotating a
monitored qubit from an initial pure state to an orthogonal state in minimum
time. This strategy is described for two different cost functions of interest
which do not have the usual regularity properties. Hence, as classically smooth
cost functions may not exist, we interpret these functions as viscosity
solutions to the optimal control problem. Specifically we prove their existence
and uniqueness in this weak-solution setting. In addition, we also give bounds
on the time optimal control to prepare any pure state from a mixed state.
","[{""version"":""v1"",""created"":""Fri, 23 Nov 2012 22:15:52 GMT""}]","2012-11-27"
"1211.5618","Emrah Birsin","E. Birsin, J. Colom\'e, D. Hoffmann, H. Koeppel, G. Lamanna, T. Le
  Flour, A. Lopatin, E. Lyard, D. Melkumyan, I. Oya, J-L. Panazol, S.
  Schlenstedt, T. Schmidt, U. Schwanke, R. Walter and P. Wegner (for the CTA
  Consortium)","Towards a Flexible Array Control and Operation Framework for CTA","In Proceedings of the 2012 Heidelberg Symposium on High Energy
  Gamma-Ray Astronomy. All CTA contributions at arXiv:1211.1840",,"10.1063/1.4772371",,"astro-ph.IM hep-ex physics.ins-det","http://arxiv.org/licenses/nonexclusive-distrib/1.0/","  The Cherenkov Telescope Array (CTA) \cite{CTA:2010} will be the successor to
current Imaging Atmospheric Cherenkov Telescopes (IACT) like H.E.S.S., MAGIC
and VERITAS. CTA will improve in sensitivity by about an order of magnitude
compared to the current generation of IACTs. The energy range will extend from
well below 100 GeV to above 100 TeV. To accomplish these goals, CTA will
consist of two arrays, one in each hemisphere, consisting of 50-80 telescopes
and composed of three different telescope types with different mirror sizes. It
will be the first open observatory for very high energy $\gamma$-ray astronomy.
  The Array Control working group of CTA is currently evaluating existing
technologies which are best suited for a project like CTA. The considered
solutions comprise the ALMA Common Software (ACS), the OPC Unified Architecture
(OPC UA) and the Data Distribution Service (DDS) for bulk data transfer. The
first applications, like an automatic observation scheduler and the control
software for some prototype instrumentation have been developed.
","[{""version"":""v1"",""created"":""Fri, 23 Nov 2012 22:24:25 GMT""}]","2019-08-14"
"1211.5619","Subodh Patil","Ana Ach\'ucarro, Jinn-Ouk Gong, Gonzalo A. Palma and Subodh P. Patil","Correlating features in the primordial spectra","5 pages, 1 figure; matches published version",,"10.1103/PhysRevD.87.121301","CERN-PH-TH/2012-315, APCTP-Pre2012-016","astro-ph.CO hep-th","http://arxiv.org/licenses/nonexclusive-distrib/1.0/","  Heavy fields coupled to the inflaton reduce the speed of sound in the
effective theory of the adiabatic mode each time the background inflationary
trajectory deviates from a geodesic. This can result in features in the
primordial spectra. We compute the corresponding bispectrum and show that if a
varying speed of sound induces features in the power spectrum, the change in
the bispectrum is given by a simple formula involving the change in the power
spectrum and its derivatives. In this manner, we provide a uniquely
discriminable signature of a varying sound speed for the adiabatic mode during
inflation that indicates the influence of heavy fields. We find that features
in the bispectrum peak in the equilateral limit and, in particular, in the
squeezed limit we find considerable enhancement entirely consistent with the
single field consistency relation. From the perspective of the underlying
effective theory, our results generalize to a wide variety of inflationary
models where features are sourced by the time variation of background
quantities. A positive detection of such correlated features would be
unambiguous proof of the inflaton's nature as a single light scalar degree of
freedom embedded in a theory that is UV completable.
","[{""version"":""v1"",""created"":""Fri, 23 Nov 2012 22:24:46 GMT""},{""version"":""v2"",""created"":""Thu, 30 May 2013 00:20:13 GMT""}]","2013-06-12"
"1211.5620","Alexander Bauer","Alexander Bauer, Claudia Czado","Pair-copula Bayesian networks",,,,,"stat.ME","http://arxiv.org/licenses/nonexclusive-distrib/1.0/","  Pair-copula Bayesian networks (PCBNs) are a novel class of multivariate
statistical models, which combine the distributional flexibility of pair-copula
constructions (PCCs) with the parsimony of conditional independence models
associated with directed acyclic graphs (DAG). We are first to provide generic
algorithms for random sampling and likelihood inference in arbitrary PCBNs as
well as for selecting orderings of the parents of the vertices in the
underlying graphs. Model selection of the DAG is facilitated using a version of
the well-known PC algorithm which is based on a novel test for conditional
independence of random variables tailored to the PCC framework. A simulation
study shows the PC algorithm's high aptitude for structure estimation in
non-Gaussian PCBNs. The proposed methods are finally applied to modelling
financial return data.
","[{""version"":""v1"",""created"":""Fri, 23 Nov 2012 22:28:54 GMT""}]","2012-11-27"
"1211.5621","Leonid Krop","Leonid Krop","Isomorphism Types of Hopf Algebras in a Class of Abelian Extensions.I","44pages",,,,"math.QA math.RA","http://arxiv.org/licenses/nonexclusive-distrib/1.0/","  There is no systematic general procedure by which isomorphism classes of Hopf
algebras that are extensions of $\k F$ by ${\k}^G$ can be found. We develop the
general procedure for classification of isomorphism classes of Hopf algebras
which are extensions of the group algebra $\k C_p$ by ${\k}^G$ where $C_p$ is a
cyclic group of prime order $p$ and ${\k}^G$ is the Hopf algebra dual of $\k
G$, $G$ a finite abelian $p$-group and $\k$ is an algebraically closed field of
characteristic $0$. We apply the method to calculate the number of isoclasses
of commutative extensions and certain extensions of this kind of dimension $\le
p^4$.
","[{""version"":""v1"",""created"":""Fri, 23 Nov 2012 22:32:12 GMT""},{""version"":""v2"",""created"":""Mon, 20 Jan 2014 22:53:18 GMT""},{""version"":""v3"",""created"":""Wed, 21 May 2014 20:51:08 GMT""}]","2014-05-23"
"1211.5622","Xiaojin Zhang","Xiaojin Zhang","\tau-rigid modules for algebras with radical square zero",,,,,"math.RT math.RA","http://creativecommons.org/licenses/by/3.0/","  In this paper, we show that for an algebra $\Lambda$ with radical square zero
and an indecomposable $\Lambda$-module $M$ such that $\Lambda$ is Gorenstein of
finite type or $\tau M$ is $\tau$-rigid, $M$ is $\tau$-rigid if and only if the
first two projective terms of a minimal projective resolution of $M$ have no
on-zero direct summands in common. We also determined all $\tau$-tilting
modules for Nakayama algebras with radical square zero. Moreover, by giving a
construction theorem we show that a basic connected radical square zero algebra
admitting a unique $\tau$-tilting module is local.
","[{""version"":""v1"",""created"":""Fri, 23 Nov 2012 22:48:47 GMT""},{""version"":""v2"",""created"":""Mon, 25 Mar 2013 12:51:11 GMT""},{""version"":""v3"",""created"":""Wed, 3 Jul 2013 06:01:50 GMT""},{""version"":""v4"",""created"":""Sun, 11 Aug 2013 07:55:14 GMT""},{""version"":""v5"",""created"":""Thu, 19 Dec 2013 07:56:28 GMT""}]","2013-12-20"
"1211.5623","Jerome Cayssol","J\'er\^ome Cayssol, Bal\'azs D\'ora, Ferenc Simon, and Roderich
  Moessner","Floquet topological insulators","7 pages, 4 figures, comments are welcome","Phys. Status Solidi RRL, 7, 101-108 (2013)","10.1002/pssr.201206451",,"cond-mat.mes-hall","http://arxiv.org/licenses/nonexclusive-distrib/1.0/","  Topological insulators represent unique phases of matter with insulating bulk
and conducting edge or surface states, immune to small perturbations such as
backscattering due to disorder. This stems from their peculiar band structure,
which provides topological protections. While conventional tools (pressure,
doping etc.) to modify the band structure are available, time periodic
perturbations can provide tunability by adding time as an extra dimension
enhanced to the problem. In this short review, we outline the recent research
on topological insulators in non equilibrium situations. Firstly, we introduce
briefly the Floquet formalism that allows to describe steady states of the
electronic system with an effective time-independent Hamiltonian. Secondly, we
summarize recent theoretical work on how light irradiation drives semi-metallic
graphene or a trivial semiconducting system into a topological phase. Finally,
we show how photons can be used to probe topological edge or surface states.
","[{""version"":""v1"",""created"":""Fri, 23 Nov 2012 23:05:01 GMT""},{""version"":""v2"",""created"":""Thu, 13 Dec 2012 17:32:48 GMT""}]","2013-10-01"
"1211.5624","Xiaojin Zhang","Xiaojin Zhang","A Note on Gorenstein Projective Conjecture II","7pages,Section 3 is deleted and We use the notion ""Auslander-Reiten
  Conjecture""",,"10.3969/j.issn.0469-5097",,"math.RA","http://creativecommons.org/licenses/by/3.0/","  In this paper, we prove that Gorenstein projective conjecture is left and
right symmetric and the co-homology vanishing condition can not be reduced in
general. Moreover, the Gorenstein projective conjecture is proved to be true
for CM-finite algebras.
","[{""version"":""v1"",""created"":""Fri, 23 Nov 2012 23:11:08 GMT""},{""version"":""v2"",""created"":""Thu, 20 Dec 2012 02:20:32 GMT""},{""version"":""v3"",""created"":""Mon, 18 Feb 2013 01:38:26 GMT""}]","2016-02-17"
"1211.5625","Sriganesh Srihari Dr","Sriganesh Srihari, Hon Wai Leong","A survey of computational methods for protein complex prediction from
  protein interaction networks","27 pages, 5 figures, 4 tables","Srihari, S., Leong, HW., J Bioinform Comput Biol 11(2): 1230002,
  2013","10.1142/S021972001230002X",,"cs.CE q-bio.MN","http://arxiv.org/licenses/nonexclusive-distrib/1.0/","  Complexes of physically interacting proteins are one of the fundamental
functional units responsible for driving key biological mechanisms within the
cell. Their identification is therefore necessary not only to understand
complex formation but also the higher level organization of the cell. With the
advent of high-throughput techniques in molecular biology, significant amount
of physical interaction data has been cataloged from organisms such as yeast,
which has in turn fueled computational approaches to systematically mine
complexes from the network of physical interactions among proteins (PPI
network). In this survey, we review, classify and evaluate some of the key
computational methods developed till date for the identification of protein
complexes from PPI networks. We present two insightful taxonomies that reflect
how these methods have evolved over the years towards improving automated
complex prediction. We also discuss some open challenges facing accurate
reconstruction of complexes, the crucial ones being presence of high proportion
of errors and noise in current high-throughput datasets and some key aspects
overlooked by current complex detection methods. We hope this review will not
only help to condense the history of computational complex detection for easy
reference, but also provide valuable insights to drive further research in this
area.
","[{""version"":""v1"",""created"":""Sat, 24 Nov 2012 00:30:33 GMT""}]","2012-11-27"
"1211.5626","Yury Bliokh P","Yury P. Bliokh, Joshua Felsteiner, and Yakov Z. Slutsker","Physical limitations in ferromagnetic inductively coupled plasma sources","7 pages, 5 figures",,"10.1063/1.4793280",,"physics.plasm-ph","http://arxiv.org/licenses/nonexclusive-distrib/1.0/","  The Ferromagnetic Inductively Coupled Plasma (FICP) source, which is a
version of the common inductively coupled plasma sources, has a number of well
known advantages such as high efficiency, high level of ionization, low minimal
gas pressure, very low required driver frequency, and even a possibility to be
driven by single current pulses. We present an experimental study of such an
FICP source which showed that above a certain value of the driving pulse power
the properties of this device changed rather drastically. Namely, the plasma
became non-stationary and non-uniform contrary to the stationary and uniform
plasmas typical for this kind of plasma sources. In this case the plasma
appeared as a narrow dense spike which was short compared to the driving pulse.
The local plasma density could exceed the neutral atoms density by a few orders
of magnitude. When that happened, the afterglow plasma decay time after the end
of the pulse was long compared to an ordinary case with no plasma spike.
Experiments were performed with various gases and in a wide range of pressures
which enabled us to understand the physical mechanism and derive the parameters
responsible for such plasma behavior. A qualitative model of this phenomenon is
discussed.
","[{""version"":""v1"",""created"":""Sat, 24 Nov 2012 00:41:41 GMT""}]","2015-06-12"
"1211.5627","Francois David","Francois David","A short introduction to the quantum formalism[s]","Lectures notes for a course given at IPhT-Saclay and Ecole Doctorale
  ED107 de Physique de la Region Parisienne",,,"t12/042","math-ph hep-th math.MP quant-ph","http://arxiv.org/licenses/nonexclusive-distrib/1.0/","  These notes are an elaboration on: (i) a short course that I gave at the
IPhT-Saclay in May-June 2012; (ii) a previous letter on reversibility in
quantum mechanics. They present an introductory, but hopefully coherent, view
of the main formalizations of quantum mechanics, of their interrelations and of
their common physical underpinnings: causality, reversibility and
locality/separability. The approaches covered are mainly: (ii) the canonical
formalism; (ii) the algebraic formalism; (iii) the quantum logic formulation.
Other subjects: quantum information approaches, quantum correlations,
contextuality and non-locality issues, quantum measurements, interpretations
and alternate theories, quantum gravity, are only very briefly and
superficially discussed. Most of the material is not new, but is presented in
an original, homogeneous and hopefully not technical or abstract way. I try to
define simply all the mathematical concepts used and to justify them
physically. These notes should be accessible to young physicists (graduate
level) with a good knowledge of the standard formalism of quantum mechanics,
and some interest for theoretical physics (and mathematics). These notes do not
cover the historical and philosophical aspects of quantum physics.
","[{""version"":""v1"",""created"":""Sat, 24 Nov 2012 00:41:53 GMT""}]","2012-11-27"
"1211.5628","Tianyu Hao","Tianyu Hao","Optimal portfolio model based on WVAR",,,,,"q-fin.RM","http://arxiv.org/licenses/nonexclusive-distrib/1.0/","  This article is focused on using a new measurement of risk-- Weighted Value
at Risk to develop a new method of constructing initiate from the TVAR solving
problem, based on MATLAB software, using the historical simulation method
(avoiding income distribution will be assumed to be normal), the results of
previous studies also based on, study the U.S. Nasdaq composite index,
combining the Simpson formula for the solution of TVAR and its deeply study;
then, through the representation of WVAR formula discussed and indispensable
analysis, also using the Simpson formula and the numerical calculations, we
have done the empirical analysis and review test. this paper is based on WVAR
which possesses better properties, taking the idea of portfolio into the
multi-index comprehensive evaluation, to build innovative WVAR based portfolio
selection under the framework of a theoretical model; in this framework, a
description of risks is designed by WVAR, its advantage is no influence by
income distribution, meanwhile various optimization problems have a unique
solution; then take AHP weights to different indicators deal on this basis,
after that we put a nonlinear satisfaction portfolio selected model forward and
conduct tests of empirical analysis, finally we use weighted linear approach to
convert the portfolio model into a single-objective problem, which is easier to
solve, then we use the data of two ETFs to construct portfolio, and compare the
performance of portfolio constructed by Mean-Weighted V@R and by Mean-Variance.
","[{""version"":""v1"",""created"":""Sat, 24 Nov 2012 00:47:33 GMT""}]","2012-11-27"
"1211.5629","Wook-Sung Yoo","Wook-Sung Yoo","Prototype for Extended XDB Using Wiki","8 pages","International Journal of Database Management Systems (IJDMS)
  Vol.4, No.5, October 2012",,,"cs.DB cs.SE","http://arxiv.org/licenses/nonexclusive-distrib/1.0/","  This paper describes a prototype of extended XDB. XDB is an open-source and
extensible database architecture developed by National Aeronautics and Space
Administration (NASA) to provide integration of heterogeneous and distributed
information resources for scientific and engineering applications. XDB enables
an unlimited number of desktops and distributed information sources to be
linked seamlessly and efficiently into an information grid using Data Access
and Retrieval Composition (DARC) protocol which provides a contextual search
and retrieval capability useful for lightweight web applications. This paper
shows the usage of XDB on common data management in the enterprise without
burdening users and application developers with unnecessary complexity and
formal schemas. Supported by NASA Ames Research Center through NASA Exploration
System Mission Directorate (ESMD) Higher Education grant, a project team at
Fairfield University extended this concept and developed an extended XDB
protocol and a prototype providing text-searches for Wiki. The technical
specification of the protocol was posted to Source Forge (sourceforge.net) and
a prototype providing text-searches for Wiki was developed. The prototype was
created for 16 tags of the MediaWiki dialect. As part of future works, the
prototype will be further extended to the complete Wiki markups and other
dialects of Wiki.
","[{""version"":""v1"",""created"":""Sat, 24 Nov 2012 00:58:19 GMT""}]","2012-11-27"
"1211.5630","Adam Parker","Amanda Furness and Adam E. Parker","Real Quadratic Fields In Which Every Non-Maximal Order Has Relative
  Class Number Greater Than One","8 pages",,,,"math.NT","http://arxiv.org/licenses/nonexclusive-distrib/1.0/","  Cohn asks if for every real quadratic field Q(m) with discriminant d there
exists a non-maximal order corresponding to f > 1 such that the relative class
number Hd(f) = h(f2d)/h(d) is one. We prove that when m = 46 (and in seven
other cases) there is no such order.
","[{""version"":""v1"",""created"":""Sat, 24 Nov 2012 01:05:03 GMT""},{""version"":""v2"",""created"":""Fri, 31 May 2013 15:06:18 GMT""}]","2013-06-03"
"1211.5631","Cong Geng","BESIII Collaboration","Measurements of psi'-> pbar K+ sigma0 and chi_cj->pbar K+ Lambda","12 pages, 19 figures","Phys. Rev. D 87, 012007 (2013)","10.1103/PhysRevD.87.012007",,"hep-ex","http://arxiv.org/licenses/nonexclusive-distrib/1.0/","  Using a sample of $1.06\times10^8$ $\psi^\prime$ mesons collected with the
BESIII detector at the BEPCII $e^+e^-$ collider and $\chi_{cJ}$ mesons produced
via radiative transitions from the $\psi^\prime$, we report the first
observation for $\psi^\prime\to \bar{p}K^+\Sigma^0 +c.c.$ (charge-conjugate),
as well as improved measurements for the $\chi_{cJ}$ hyperon decays
$\chi_{cJ}\to\bar{p}K^+\Lambda+c.c.$. The branching fractions are measured to
be $\mathcal{B}(\psi^\prime\to \bar{p}K^+\Sigma^0+c.c)=
(1.67\pm0.13\pm0.12)\times10^{-5}$,
$\mathcal{B}(\chi_{c0}\to\bar{p}K^+\Lambda+c.c.)=
(13.2\pm0.3\pm1.0)\times10^{-4}$,
$\mathcal{B}(\chi_{c1}\to\bar{p}K^+\Lambda+c.c.)=
(4.5\pm0.2\pm0.4)\times10^{-4}$ and
$\mathcal{B}(\chi_{c2}\to\bar{p}K^+\Lambda+c.c)=
(8.4\pm0.3\pm0.6)\times10^{-4}$, where the first error is statistical, and the
second is systematic. In the decay of $\chi_{c0} \to \bar{p}K^+\Lambda + c.c.$,
an anomalous enhancement near threshold is observed in the invariant mass
distribution of $\bar{p}\Lambda+c.c.$, which cannot be explained by phase
space.
","[{""version"":""v1"",""created"":""Sat, 24 Nov 2012 01:10:35 GMT""},{""version"":""v2"",""created"":""Tue, 24 Feb 2015 07:10:31 GMT""}]","2015-02-25"
"1211.5632","Antonio Di Lorenzo","Antonio Di Lorenzo","Modified Kubo formula with a complex force term for weak measurement","v1: 11 pages, 1 figure; v2: focus and title changed",,,,"quant-ph cond-mat.mes-hall hep-th","http://arxiv.org/licenses/nonexclusive-distrib/1.0/","  In a seminal work, Aharonov, Albert, and Vaidman showed that by having a weak
interaction between a system and a detecting apparatus, the average output of
the latter could be much larger than the maximum eigenvalue of the observed
quantity (times the amplification factor). This does not always happen,
however: the observed system must subsequently undergo a second measurement, on
the output of which the result of the first one is conditioned. This procedure
is known as postselection. On the other hand, linear response theory describes
how the observables of a quan- tum system change upon perturbation by a weak
classical external force. In a measurement, the measured system applies a
generalized force to the measuring apparatus, leading to an observable change
in the latter. It appears natural, then, to unify the treatment of weak
measurements with an extended version of linear response theory that accounts
for a force introduced by an external quantum system. Here, we show how the
postselection introduces a complex force term and we provide a modified Kubo
formula working in the non-linear regime.
","[{""version"":""v1"",""created"":""Sat, 24 Nov 2012 01:13:25 GMT""},{""version"":""v2"",""created"":""Thu, 30 May 2013 01:21:15 GMT""}]","2013-05-31"
"1211.5633","Alan Veliz Cuba","Alan Veliz-Cuba, Kristina Buschur, Rose Hamershock, Ariel Kniss,
  Esther Wolff, Reinhard Laubenbacher","AND-NOT logic framework for steady state analysis of Boolean network
  models",,,,,"q-bio.MN q-bio.QM","http://arxiv.org/licenses/nonexclusive-distrib/1.0/","  Finite dynamical systems (e.g. Boolean networks and logical models) have been
used in modeling biological systems to focus attention on the qualitative
features of the system, such as the wiring diagram. Since the analysis of such
systems is hard, it is necessary to focus on subclasses that have the
properties of being general enough for modeling and simple enough for
theoretical analysis. In this paper we propose the class of AND-NOT networks
for modeling biological systems and show that it provides several advantages.
Some of the advantages include: Any finite dynamical system can be written as
an AND-NOT network with similar dynamical properties. There is a one-to-one
correspondence between AND-NOT networks, their wiring diagrams, and their
dynamics. Results about AND-NOT networks can be stated at the wiring diagram
level without losing any information. Results about AND-NOT networks are
applicable to any Boolean network. We apply our results to a Boolean model of
Th-cell differentiation.
","[{""version"":""v1"",""created"":""Sat, 24 Nov 2012 01:39:40 GMT""}]","2012-11-27"
