"1211.5574","Fernando Delgado Acosta","F. Delgado, K. Lopez, R. Ferreira, and J. Fernandez-Rossier","Intrinsic spin noise in MgO magnetic tunnel junctions","4 pages, 3 figures","Appl. Phys. Lett. 102, 063102 (2013)","10.1063/1.4791594",,"cond-mat.mes-hall","http://arxiv.org/licenses/nonexclusive-distrib/1.0/","  We consider two intrinsic sources of noise in ultra-sensitive magnetic field
sensors based on MgO magnetic tunnel junctions, coming both from $^{25}$Mg
nuclear spins ($I=5/2$, 10% natural abundance), and S=1 Mg-vacancies. While
nuclear spins induce noise peaked in the MHz frequency range, the vacancies
noise peaks in the GHz range. We find that the nuclear noise in submicron
devices has a similar magnitude than the $1/f$ noise, while the vacancy-induced
noise dominates in the GHz range. Interestingly, the noise spectrum under a
finite magnetic field gradient may provide spatial information about the spins
in the MgO layer.
","[{""version"":""v1"",""created"":""Fri, 23 Nov 2012 19:02:29 GMT""},{""version"":""v2"",""created"":""Fri, 30 Nov 2012 15:25:01 GMT""}]","2013-08-19"
"1211.5575","Cornelia Metzig","Cornelia Metzig and Mirta Gordon","Heterogeneous Enterprises in a Macroeconomic Agent-Based Model",,,,,"q-fin.GN physics.soc-ph","http://arxiv.org/licenses/nonexclusive-distrib/1.0/","  We present a macroeconomic agent-based model that combines several mechanisms
operating at the same timescale, while remaining mathematically tractable. It
comprises enterprises and workers who compete in a job market and a commodity
goods market. The model is stock-flow consistent; a bank lends money charging
interest rates, and keeps track of equities. Important features of the model
are heterogeneity of enterprises, existence of bankruptcies and creation of new
enterprises, as well as productivity increase. The model's evolution reproduces
empirically found regularities for firm size and growth rate distributions. It
combines probabilistic elements and deterministic dynamics, with relative
weights that may be modified according to the considered problem or the belief
of the modeler. We discuss statistical regularities on enterprises, the origin
and the amplitude of endogeneous fluctuations of the system's steady state, as
well as the role of the interest rate and the credit volume. We also summarize
obtained results which are not discussed in detail in this paper.
","[{""version"":""v1"",""created"":""Fri, 23 Nov 2012 19:03:22 GMT""}]","2012-11-26"
"1211.5576","Julyan Cartwright","Julyan H. E. Cartwright, Antonio G. Checa, Julian D. Gale, Denis
  Gebauer, C. Ignacio Sainz-D\'iaz","Calcium Carbonate Polyamorphism and Its Role in Biomineralization: How
  Many Amorphous Calcium Carbonates Are There?",,"Angew. Chem. Int. Ed., 51, 11960-11970, 2012","10.1002/anie.201203125",,"cond-mat.mtrl-sci physics.chem-ph q-bio.BM","http://arxiv.org/licenses/nonexclusive-distrib/1.0/","  Although the polymorphism of calcium carbonate is well known, and its
polymorphs-calcite, aragonite, and vaterite-have been highly studied in the
context of biomineralization, polyamorphism is a much more recently discovered
phenomenon, and the existence of more than one amorphous phase of calcium
carbonate in biominerals has only very recently been understood. Here we
summarize what is known about polyamorphism in calcium carbonate as well as
what is under- stood about the role of amorphous calcium carbonate in
biominerals. We show that consideration of the amorphous forms of calcium
carbonate within the physical notion of polyamorphism leads to new insights
when it comes to the mechanisms by which polymorphic structures can evolve in
the first place. This not only has implications for our understanding of
biomineralization, but also of the means by which crystallization may be
controlled in medical, pharmaceutical, and industrial contexts.
","[{""version"":""v1"",""created"":""Fri, 23 Nov 2012 19:06:58 GMT""}]","2012-11-26"
"1211.5577","Federico Cabitza","Federico Cabitza and Carla Simone","Design Ltd.: Renovated Myths for the Development of Socially Embedded
  Technologies","This is the peer-unreviewed of a manuscript that is to appear in D.
  Randall, K. Schmidt, & V. Wulf (Eds.), Designing Socially Embedded
  Technologies: A European Challenge (2013, forthcoming) with the title
  ""Building Socially Embedded Technologies: Implications on Design"" within an
  EUSSET editorial initiative (www.eusset.eu/)",,,,"cs.HC","http://arxiv.org/licenses/nonexclusive-distrib/1.0/","  This paper argues that traditional and mainstream mythologies, which have
been continually told within the Information Technology domain among designers
and advocators of conceptual modelling since the 1960s in different fields of
computing sciences, could now be renovated or substituted in the mould of more
recent discourses about performativity, complexity and end-user creativity that
have been constructed across different fields in the meanwhile. In the paper,
it is submitted that these discourses could motivate IT professionals in
undertaking alternative approaches toward the co-construction of
socio-technical systems, i.e., social settings where humans cooperate to reach
common goals by means of mediating computational tools. The authors advocate
further discussion about and consolidation of some concepts in design research,
design practice and more generally Information Technology (IT) development,
like those of: task-artifact entanglement, universatility (sic) of End-User
Development (EUD) environments, bricolant/bricoleur end-user, logic of
bricolage, maieuta-designers (sic), and laissez-faire method to socio-technical
construction. Points backing these and similar concepts are made to promote
further discussion on the need to rethink the main assumptions underlying IT
design and development some fifty years later the coming of age of software and
modern IT in the organizational domain.
","[{""version"":""v1"",""created"":""Fri, 23 Nov 2012 19:10:20 GMT""},{""version"":""v2"",""created"":""Fri, 21 Dec 2012 12:15:08 GMT""},{""version"":""v3"",""created"":""Thu, 14 Mar 2013 10:12:03 GMT""}]","2013-03-15"
"1211.5578","Trilochan Bagarti","Trilochan Bagarti, Anupam Roy, K. Kundu and B. N. Dev","The effect of exclusion on nonlinear reaction diffusion system in
  inhomogeneous media",,"Physica A 405, 52(2014)","10.1016/j.physa.2014.03.018",,"cond-mat.mtrl-sci","http://arxiv.org/licenses/nonexclusive-distrib/1.0/","  We study a minimal model to understand the formation of clusters on surfaces
in the presence of surface defects. We consider reaction diffusion model in
which atoms undergoes reactions at the defect centers to form clusters. Volume
exclusion between particles is introduced through a drift term in the reaction
diffusion equation that arises due the repulsive force field produced by the
clustering atoms. The volume exclusion terms can be derived from master
equation with a concentration dependent hopping rate. Perturbative analysis is
performed for both cross-exclusion and self-exclusion one dimensional system.
For two dimension numerical analysis is performed. We have found that the
clusterization process slows down due to exclusion. As a result the size of the
clusters reduces. In this model reaction scheme has algebraic nonlinearity and
plausible mechanism is also given.
","[{""version"":""v1"",""created"":""Fri, 23 Nov 2012 19:11:08 GMT""}]","2015-06-12"
"1211.5579","Romain Aza\""is","Romain Aza\""is","A recursive nonparametric estimator for the transition kernel of a
  piecewise-deterministic Markov process",,,,,"math.ST stat.TH","http://arxiv.org/licenses/nonexclusive-distrib/1.0/","  In this paper, we investigate a nonparametric approach to provide a recursive
estimator of the transition density of a non-stationary piecewise-deterministic
Markov process, from only one observation of the path within a long time. In
this framework, we do not observe a Markov chain with transition kernel of
interest. Fortunately, one may write the transition density of interest as the
ratio of the invariant distributions of two embedded chains of the process. Our
method consists in estimating these invariant measures. We state a result of
consistency and a central limit theorem under some general assumptions about
the main features of the process. A simulation study illustrates the well
asymptotic behavior of our estimator.
","[{""version"":""v1"",""created"":""Fri, 23 Nov 2012 19:15:16 GMT""},{""version"":""v2"",""created"":""Mon, 6 May 2013 15:32:37 GMT""}]","2013-05-07"
"1211.5580","Dmitry Pikulin","Dmitry I. Pikulin and Yuli V. Nazarov","Two types of topological transitions in finite Majorana wires","5 pages, 3 figures. Version 2: typo corrected","Phys. Rev. B 87, 235421 (2013)","10.1103/PhysRevB.87.235421",,"cond-mat.mes-hall cond-mat.supr-con","http://arxiv.org/licenses/nonexclusive-distrib/1.0/","  Motivated by the recent advances in studying Majorana states in nanowires
under conditions of superconducting proximity effect, we address the
correspondence between the common topological transition in infinite system and
the topological transition of other type that manifests itself in the positions
of the poles of the scattering matrices. We establish a universal dependence of
the pole positions in the vicinity of the common transition on the parameter
controlling the transition, and discuss the manifestations of the pole
transitions in the differential conductance.
","[{""version"":""v1"",""created"":""Fri, 23 Nov 2012 19:22:30 GMT""},{""version"":""v2"",""created"":""Mon, 10 Dec 2012 13:44:03 GMT""}]","2015-06-12"
"1211.5581","Octavi Fors","O. Fors, J. N\'u\~nez, J. L. Mui\~nos, F. J. Montojo, R.
  Baena-Gall\'e, J. Boloix, R. Morcillo, M. T. Merino, E. C. Downey, M. J.
  Mazur","Telescope Fabra ROA Montsec: a new robotic wide-field Baker-Nunn
  facility","Accepted for publication in PASP. Scheduled to be published for the
  May 2013 issue. 34 pages, 19 figures",,"10.1086/670941",,"astro-ph.IM astro-ph.EP","http://arxiv.org/licenses/nonexclusive-distrib/1.0/","  A Baker-Nunn Camera (BNC), originally installed at the Real Instituto y
Observatorio de la Armada (ROA) in 1958, was refurbished and robotized. The new
facility, called Telescope Fabra ROA Montsec (TFRM), was installed at the
Observatori Astron\`omic del Montsec (OAdM).
  The process of refurbishment is described in detail. Most of the steps of the
refurbishment project were accomplished by purchasing commercial components,
which involve little posterior engineering assembling work. The TFRM is a 0.5m
aperture f/0.96 optically modified BNC, which offers a unique combination of
instrumental specifications: fully robotic and remote operation, wide-field of
view (4.4 deg x 4.4 deg), moderate limiting magnitude (V~19.5mag), ability of
tracking at arbitrary right ascension and declination rates, as well as opening
and closing CCD shutter at will during an exposure.
  Nearly all kind of image survey programs can benefit from those
specifications. Apart from other less time consuming programs, since the
beginning of science TFRM operations we have been conducting two specific and
distinct surveys: super-Earths transiting around M-type dwarfs stars, and
geostationary debris in the context of Space Situational Awareness / Space
Surveillance and Tracking (SSA/SST) programs. Preliminary results for both
cases will be shown.
","[{""version"":""v1"",""created"":""Fri, 23 Nov 2012 19:24:19 GMT""},{""version"":""v2"",""created"":""Fri, 1 Mar 2013 19:45:53 GMT""},{""version"":""v3"",""created"":""Mon, 8 Apr 2013 11:58:15 GMT""},{""version"":""v4"",""created"":""Tue, 9 Apr 2013 10:56:06 GMT""}]","2015-06-12"
"1211.5582","Pedro Agust\'in Gim\'enez Molinelli Lic.","C. O. Dorso, P. A. Gim\'enez Molinelli, J. I. Nichols and J. A.
  L\'opez","Cold nuclear matter",,,,,"nucl-th","http://arxiv.org/licenses/nonexclusive-distrib/1.0/","  The behavior of nuclear matter is studied at low densities and temperatures
using classical molecular dynamics with three different sets of potentials with
different compressibility. Nuclear matter is found to arrange in crystalline
structures around the saturation density and in non-homogeneous (i.e.
pasta-like) structures at lower densities. Similar results were obtained with a
simple Lennard-Jones potential. Finite size effects are analysed and the
existence of the non-homogeneous structures is shown to be inherent to the use
of periodic boundary conditions and the finitude of the system. For large
enough systems the non-homogeneous structures are limited to one sphere, one
rod or one slab per simulation cell, which are shown to be minimal surface
structures under cubic periodic boundary conditions at the corresponding volume
fraction. The relevance of these findings to the simulations of neutron star
and supernovae matter is discussed.
","[{""version"":""v1"",""created"":""Fri, 23 Nov 2012 19:24:39 GMT""},{""version"":""v2"",""created"":""Thu, 9 May 2013 23:51:24 GMT""}]","2013-05-13"
"1211.5583","Jonathan Meair","Jonathan Meair and Philippe Jacquod","Scattering Theory of Nonlinear Thermoelectricity in Quantum Coherent
  Conductors","10+ pages","J. Phys.: Condens. Matter 25 (2013) 082201","10.1088/0953-8984/25/8/082201",,"cond-mat.mes-hall","http://arxiv.org/licenses/nonexclusive-distrib/1.0/","  We construct a scattering theory of weakly nonlinear thermoelectric transport
through sub-micron scale conductors. The theory incorporates the leading
nonlinear contributions in temperature and voltage biases to the charge and
heat currents. Because of the finite capacitances of sub-micron scale
conducting circuits, fundamental conservation laws such as gauge invariance and
current conservation require special care to be preserved. We do this by
extending the approach of Christen and B\""uttiker [Europhys. Lett. 35, 523
(1996)] to coupled charge and heat transport. In this way we write relations
connecting nonlinear transport coefficients in a manner similar to Mott's
relation between the linear thermopower and the linear conductance. We derive
sum rules that nonlinear transport coefficients must satisfy to preserve gauge
invariance and current conservation. We illustrate our theory by calculating
the efficiency of heat engines and the coefficient of performance of
thermoelectric refrigerators based on quantum point contacts and resonant
tunneling barriers. We identify in particular rectification effects that
increase device performance.
","[{""version"":""v1"",""created"":""Fri, 23 Nov 2012 19:54:48 GMT""},{""version"":""v2"",""created"":""Thu, 24 Jan 2013 20:39:26 GMT""}]","2015-06-12"
"1211.5584","Jan Hajer","S. Bobrovskyi, J. Hajer and S. Rydbeck","Long-lived higgsinos as probes of gravitino dark matter at the LHC","published version, 34 pages, 10 figures, 9 tables","Journal of High Energy Physics, February 2013, 2013:133","10.1007/JHEP02(2013)133","DESY 12-175","hep-ph astro-ph.CO hep-ex","http://arxiv.org/licenses/nonexclusive-distrib/1.0/","  We investigate the LHC sensitivity to supersymmetric models with light
higgsinos, small R-parity breaking and gravitino dark matter. The limits on
decaying gravitino dark matter from gamma-ray searches with the Fermi-LAT put a
lower bound on the higgsino-like neutralino NLSP decay length, giving rise to a
displaced-vertex collider signature. Using publicly available tools for
simulation of signal, background and detector response, we find that higgsinos
with masses of 100-400 GeV and R-parity violation of approximately 10^-8 to
10^-9 can show up in the 8 TeV LHC data with 10-30 fb^-1 of integrated
luminosity. We demonstrate that in the case of a signal, the higgsino mass can
be determined by reconstruction of the dimuon mass edge.
","[{""version"":""v1"",""created"":""Fri, 23 Nov 2012 19:56:48 GMT""},{""version"":""v2"",""created"":""Tue, 5 Mar 2013 12:08:25 GMT""}]","2013-03-06"
"1211.5585","Carl Tipler","Yuji Sano and Carl Tipler","Extremal metrics and lower bound of the modified K-energy","19 pages, few typos corrected. More details are given in some proofs.
  To be published in JEMS",,,,"math.DG math.AG","http://arxiv.org/licenses/nonexclusive-distrib/1.0/","  We provide a new proof of a result of X.X.Chen and G.Tian : for a polarized
extremal K\""ahler manifold, an extremal metric attains the minimum of the
modified K-energy. The proof uses an idea of C.Li adapted to the extremal
metrics using some weighted balanced metrics.
","[{""version"":""v1"",""created"":""Fri, 23 Nov 2012 19:57:09 GMT""},{""version"":""v2"",""created"":""Mon, 29 Jul 2013 16:16:41 GMT""}]","2013-07-30"
"1211.5586","Gilad Gour","Gilad Gour and Nolan R. Wallach","On Symmetric SL-Invariant Polynomials in Four Qubits","5 pages, submitted to ""Symmetry: In Representation Theory and Its
  Applications."" In Honor of Nolan R. Wallach,"" a volume in Progress in
  Mathematics (Birkhauser)",,,,"math-ph math.MP quant-ph","http://arxiv.org/licenses/nonexclusive-distrib/1.0/","  We find the generating set of SL-invariant polynomials in four qubits that
are also invariant under permutations of the qubits. The set consists of four
polynomials of degrees 2,6,8, and 12, for which we find an elegant expression
in the space of critical states. In addition, we show that the Hyperdeterminant
in four qubits is the only SL-invariant polynomial (up to powers of itself)
that is non-vanishing precisely on the set of generic states.
","[{""version"":""v1"",""created"":""Fri, 23 Nov 2012 19:57:16 GMT""}]","2013-08-15"
"1211.5587","Michael Abbott","Michael C. Abbott","Comment on Strings in AdS3 x S3 x S3 x S1 at One Loop","16+12 pages. v2 improves comparison to S-matrices, and adds
  references. v3 has small textual changes to match published version","JHEP 02 (2013) 102","10.1007/JHEP02(2013)102","TIFR/TH/12-35","hep-th","http://arxiv.org/licenses/nonexclusive-distrib/1.0/","  This paper studies semiclassical strings in AdS3 x S3 x S3 x S1 using the
algebraic curve. Calculating one-loop corrections to the energy of the giant
magnon fixes the constant term c in the expansion of the coupling h(\lambda).
Comparing these to similar corrections for long spinning strings gives a
prediction for the one-loop term f_1 in the expansion of the cusp anomalous
dimension f(h), for all \alpha (where \alpha --> 1 is the AdS3 x S3 x T4
limit). For these semiclassical mode sums there is a similar choice of
regularisation prescriptions to that encountered in AdS4 x CP3. However at
\alpha \neq 1/2 they lead to different values of f_1 and are therefore not
related by a simple change of the coupling. The algebraic curve is also used to
calculate various finite-size corrections for giant magnons, which are
well-behaved as \alpha --> 1, and can be compared to the recently published
S-matrices.
","[{""version"":""v1"",""created"":""Fri, 23 Nov 2012 20:06:00 GMT""},{""version"":""v2"",""created"":""Wed, 5 Dec 2012 15:02:55 GMT""},{""version"":""v3"",""created"":""Tue, 19 Feb 2013 22:38:00 GMT""}]","2013-02-21"
"1211.5588","Abd El-Nasser Ghareeb Abd El-Rahman","Naveed Yaqoob and Piergiulio Corsini and Faisal","On Intra-Regular Left Almost Semihypergroups with Pure Left Identity",,,,,"math.GR","http://arxiv.org/licenses/nonexclusive-distrib/1.0/","  In this paper, we characterize intra-regular LA-semihypergroups by using the
properties of their left and right hyperideals and we investigate some useful
conditions for an LA-semihypergroup to become an intra-regular
LA-semihypergroup.
","[{""version"":""v1"",""created"":""Fri, 23 Nov 2012 20:29:49 GMT""}]","2012-11-26"
"1211.5589","Sean Passmoor","Sean Passmoor, Catherine Cress, Andreas Faltenbacher, Russell
  Johnston, Mathew Smith, Ando Ratsimbazafy and Ben Hoyle","Probing the bias of radio sources at high redshift","9 Pages, 5 figures, Accepted to MNRAS",,"10.1093/mnras/sts488",,"astro-ph.CO","http://arxiv.org/licenses/nonexclusive-distrib/1.0/","  The relationship between the clustering of dark matter and that of luminous
matter is often described using the bias parameter. Here, we provide a new
method to probe the bias of intermediate to high-redshift radio continuum
sources for which no redshift information is available. We matched radio
sources from the Faint Images of the Radio Sky at Twenty centimetres (FIRST)
survey data to their optical counterparts in the Sloan Digital Sky Survey
(SDSS) to obtain photometric redshifts for the matched radio sources. We then
use the publicly available semi-empirical simulation of extragalactic radio
continuum sources (S3) to infer the redshift distribution for all FIRST sources
and estimate the redshift distribution of unmatched sources by subtracting the
matched distribution from the distribution of all sources. We infer that the
majority of unmatched sources are at higher redshifts than the optically
matched sources and demonstrate how the angular scales of the angular two-point
correlation function can be used to probe different redshift ranges. We compare
the angular clustering of radio sources with that expected for dark matter and
estimate the bias of different samples.
","[{""version"":""v1"",""created"":""Fri, 23 Nov 2012 20:41:13 GMT""}]","2015-06-12"
"1211.5590","Pascal Lamblin","Fr\'ed\'eric Bastien, Pascal Lamblin, Razvan Pascanu, James Bergstra,
  Ian Goodfellow, Arnaud Bergeron, Nicolas Bouchard, David Warde-Farley, Yoshua
  Bengio","Theano: new features and speed improvements","Presented at the Deep Learning Workshop, NIPS 2012",,,,"cs.SC cs.LG","http://arxiv.org/licenses/nonexclusive-distrib/1.0/","  Theano is a linear algebra compiler that optimizes a user's
symbolically-specified mathematical computations to produce efficient low-level
implementations. In this paper, we present new features and efficiency
improvements to Theano, and benchmarks demonstrating Theano's performance
relative to Torch7, a recently introduced machine learning library, and to
RNNLM, a C++ library targeted at recurrent neural networks.
","[{""version"":""v1"",""created"":""Fri, 23 Nov 2012 20:42:41 GMT""}]","2012-11-26"
"1211.5592","Elena del Valle","A. Gonzalez-Tudela, F. P. Laussy, C. Tejedor, M. J. Hartmann, E. del
  Valle","Two-photon spectra of quantum emitters","27 pages, 8 figures","New J. Phys. 15, 033036 (2013)","10.1088/1367-2630/15/3/033036",,"quant-ph cond-mat.mes-hall","http://arxiv.org/licenses/nonexclusive-distrib/1.0/","  We apply our recently developed theory of frequency-filtered and
time-resolved N-photon correlations to study the two-photon spectra of a
variety of systems of increasing complexity: single mode emitters with two
limiting statistics (one harmonic oscillator or a two-level system) and the
various combinations that arise from their coupling. We consider both the
linear and nonlinear regimes under incoherent excitation. We find that even the
simplest systems display a rich dynamics of emission, not accessible by simple
single photon spectroscopy. In the strong coupling regime, novel two-photon
emission processes involving virtual states are revealed. Furthermore, two
general results are unraveled by two-photon correlations with narrow linewidth
detectors: i) filtering induced bunching and ii) breakdown of the
semi-classical theory. We show how to overcome this shortcoming in a
fully-quantized picture.
","[{""version"":""v1"",""created"":""Fri, 23 Nov 2012 20:57:27 GMT""}]","2014-03-06"
"1211.5600","Moshe Rozali","Moshe Rozali, Darren Smyth, Evgeny Sorkin and Jared B. Stang","Holographic Stripes","5 pages (APS style), 5 figures. Expanded analysis including
  additional values of the axion coupling and spatial periodicities, which
  reveals the appearance of sharp second order transitions for sufficiently
  large axion couplings",,"10.1103/PhysRevLett.110.201603",,"hep-th cond-mat.str-el gr-qc","http://arxiv.org/licenses/nonexclusive-distrib/1.0/","  We construct inhomogeneous asymptotically AdS black hole solutions
corresponding to the spontaneous breaking of translational invariance and the
formation of striped order in the boundary field theory. We find that the
system undergoes a second order phase transition in both the fixed density and
fixed chemical potential ensembles, for sufficiently large values of the axion
coupling. We investigate the phase structure as function of the temperature,
axion coupling and the stripe width. The bulk solutions have striking
geometrical features related to a magnetoelectric effect associated with the
existence of a near horizon topological insulator. At low temperatures the
horizon becomes highly inhomogeneous and tends to pinch off.}
","[{""version"":""v1"",""created"":""Fri, 23 Nov 2012 21:00:00 GMT""},{""version"":""v2"",""created"":""Tue, 2 Apr 2013 19:59:16 GMT""}]","2013-05-22"
