"1211.5534","Achill Sch\""urmann","Achill Sch\""urmann","Strict Periodic Extreme Lattices","6 pages; to appear in AMS Contemporary Mathematics issue on
  ""Diophantine Methods, Lattices, and Arithmetic Theory of Quadratic Forms"",
  edited by Wai Kiu Chan, Lenny Fukshansky, Rainer Schulze-Pillot, and Jeff
  Vaaler","in Proceedings of the BIRS Workshop on Diophantine Methods,
  Lattices, and Arithmetic Theory of Quadratic Forms, AMS Contemporary
  Mathematics, 587 (2013), 185-190",,,"math.MG math.NT","http://arxiv.org/licenses/nonexclusive-distrib/1.0/","  A lattice is called periodic extreme if it cannot locally be modified to
yield a better periodic sphere packing. It is called strict periodic extreme if
its sphere packing density is an isolated local optimum among periodic point
sets. In this note we show that a lattice is periodic extreme if and only if it
is extreme, that is, locally optimal among lattices. Moreover, we show that a
lattice is strict periodic extreme if and only if it is extreme and
non-floating.
","[{""version"":""v1"",""created"":""Fri, 23 Nov 2012 16:04:22 GMT""}]","2014-06-23"
"1211.5535","Ryuichi Fujita","Ryuichi Fujita","Gravitational Waves from a Particle in Circular Orbits around a
  Schwarzschild Black Hole to the 22nd Post-Newtonian Order","22 pages, additional datafiles are available at <a
  href=""http://www2.yukawa.kyoto-u.ac.jp/~misao/BHPC/calcs.html"">this http
  URL</a>","Prog. Theor. Phys. 128 (2012) pp. 971-992","10.1143/PTP.128.971",,"gr-qc","http://arxiv.org/licenses/nonexclusive-distrib/1.0/","  We extend our previous results of the 14th post-Newtonian (PN) order
expansion of gravitational waves for a test particle in circular orbits around
a Schwarzschild black hole to the 22PN order, i.e. $v^{44}$ beyond the leading
Newtonian approximation where $v$ is the orbital velocity of a test particle.
Comparing our 22PN formula for the energy flux with high precision numerical
results, we find that the relative error of the 22PN flux at the innermost
stable circular orbit is about $10^{-5}$. We also estimate the phase difference
between the 22PN waveforms and numerical waveforms after a two-year inspiral.
We find that the dephase is about $10^{-9}$ for $\mu/M=10^{-4}$ and $10^{-2}$
for $\mu/M=10^{-5}$ where $\mu$ is the mass of the compact object and $M$ the
mass of the central supermassive black hole. Finally, we construct a hybrid
formula of the energy flux by supplementing the 4PN formula of the energy flux
for circular and equatorial orbits around a Kerr black hole with all the
present 22PN terms for the case of a Schwarzschild black hole. Comparing the
hybrid formula with the the full numerical results, we examine the performance
of the hybrid formula for the case of Kerr black hole.
","[{""version"":""v1"",""created"":""Fri, 23 Nov 2012 16:04:44 GMT""}]","2012-11-26"
"1211.5536","Vyacheslav Yukalov","S. Gluzman, V. I. Yukalov","Self-similar continued root approximants","Latex file, 13 pages","Phys. Lett. A 377 (2012) 124-128","10.1016/j.physleta.2012.11.005",,"math-ph cond-mat.stat-mech math.MP","http://arxiv.org/licenses/nonexclusive-distrib/1.0/","  A novel method of summing asymptotic series is advanced. Such series
repeatedly arise when employing perturbation theory in powers of a small
parameter for complicated problems of condensed matter physics, statistical
physics, and various applied problems. The method is based on the self-similar
approximation theory involving self-similar root approximants. The constructed
self-similar continued roots extrapolate asymptotic series to finite values of
the expansion parameter. The self-similar continued roots contain, as a
particular case, continued fractions and Pad\'{e} approximants. A theorem on
the convergence of the self-similar continued roots is proved. The method is
illustrated by several examples from condensed-matter physics.
","[{""version"":""v1"",""created"":""Fri, 23 Nov 2012 16:04:56 GMT""}]","2015-06-12"
"1211.5537","Harald Dorn","Harald Dorn, Hagen M\""unkler and Christian Spielvogel","Conformal geometry of null hexagons for Wilson loops and scattering
  amplitudes","21 pages, 4 figures, comments on parity and on conformal anomaly
  added",,,"Humboldt University, HU-EP-12/49","hep-th hep-ph","http://arxiv.org/licenses/nonexclusive-distrib/1.0/","  The cross-ratios do not uniquely fix the class of conformally equivalent
configurations of null polygons. In view of applications to Wilson loops and
scattering amplitudes we characterise all conformal classes of null hexagon
configurations belonging to given points in cross-ratio space. At first this is
done for the ordered set of vertices. Including the edges, we then investigate
the equivalence classes under conformal transformations for null hexagons. This
is done both for the set of null hexagons closed in finite domains of Minkowski
space as well as for the set including those closed via infinity.
","[{""version"":""v1"",""created"":""Fri, 23 Nov 2012 16:16:09 GMT""},{""version"":""v2"",""created"":""Tue, 16 Apr 2013 08:40:00 GMT""}]","2013-04-17"
"1211.5538","Ehsan Hatefi","Ehsan Hatefi","On D-brane anti D-brane effective actions and their corrections to all
  orders in alpha-prime","32 pages, no figure, CERN-PH-TH/2012-341,V3. Acknowledgments, refs
  and some comments in the conclusion section are added. The version that has
  been accepted in JCAP","JCAP 1309 (2013) 011","10.1088/1475-7516/2013/09/011","CERN-PH-TH/2012-341","hep-th gr-qc hep-ph","http://arxiv.org/licenses/nonexclusive-distrib/1.0/","  Based on a four point function, the S-matrix elements at disk level of the
scattering amplitude of one closed string Ramond-Ramond field ($C$), two
tachyons and one scalar field, we find out new couplings in brane anti brane
effective actions for $p=n,p+2=n$ cases. Using the infinite corrections of the
vertex of one RR, one gauge and one scalar field and applying the correct
expansion, it is investigated in detail how we produce the infinite gauge poles
of the amplitude for $p = n$ case. By discovering new higher derivative
corrections of two tachyon-two scalar couplings in brane anti brane systems to
all orders in $\alpha'$, we also obtain the infinite scalar poles in
$t'+s'+u$-channel in field theory. Working with the complete form of the
amplitude with the closed form of the expansion and comparing all the infinite
contact terms of this amplitude, we derive several new Wess-Zumino couplings
with all their infinite higher derivative corrections in the world volume of
brane anti brane systems. In particular, in producing all the infinite scalar
poles of $<V_C V_{\phi} V_T V_T>$, one has to consider the fact that scalar 's
vertex operator in $(-1)$-picture must carry the internal $\sigma_3$ Chan-Paton
matrix. The symmetric trace effective action has a non-zero coupling between
$D\phi^{(1)i}$ and $D\phi^{(2)}_i$ while this coupling does not exist in
ordinary trace effective action.
","[{""version"":""v1"",""created"":""Fri, 23 Nov 2012 16:19:49 GMT""},{""version"":""v2"",""created"":""Thu, 16 May 2013 12:27:23 GMT""},{""version"":""v3"",""created"":""Sat, 10 Aug 2013 19:35:31 GMT""}]","2013-09-10"
"1211.5539","Vladimir Saleev","M. A. Nefedov, N. N. Nikolaev, V. A. Saleev","Drell-Yan lepton pair production at high energies in the Parton
  Reggeization Approach","16 pages, 11 figures","Phys.Rev. D87 (2013) 014022","10.1103/PhysRevD.87.014022","DESY 12-220","hep-ph","http://arxiv.org/licenses/nonexclusive-distrib/1.0/","  According to extensive theoretical studies of the high energy limit of QCD,
inelastic interactions are dominated by the multi-Regge final states. The
appropriate gauge-invariant objects, which simultaneously incorporate the
transverse momentum degrees of freedom, are Reggeized gluons, quarks and
antiquarks. In the present communication we extend parton Reggeization approach
to Drell-Yan production of massive lepton pairs. The basic ingredient is a
process of Reggeized quark-antiquark annihilation, which is described by the
Reggeon-Reggeon-photon effective vertex. We calculate transverse-momentum and
invariant-mass distributions of Drell-Yan lepton pairs measured at the CERN
SPS, FNAL Tevatron and CERN LHC in the different ranges of energy and rapidity.
We focus on angular distributions of Drell-Yan leptons in different kinematical
ranges. The obtained results are compared with the existing data and a good
agreement is found. The predictions for future experiments for Drell-Yan lepton
pair production at the CERN LHC have been made.
","[{""version"":""v1"",""created"":""Fri, 23 Nov 2012 16:24:00 GMT""},{""version"":""v2"",""created"":""Tue, 27 Nov 2012 10:52:28 GMT""}]","2013-04-22"
"1211.5540","Triloki","Triloki, P. Garg, R. Rai, B. K. Singh","Structural characterization of as-deposited cesium iodide films studied
  by X-ray diffraction and transmission electron microscopy techniques","This paper has been accepted for publication in Nuclear Inst. and
  Methods in Physics Research, A",,,,"cond-mat.mtrl-sci physics.ins-det","http://arxiv.org/licenses/nonexclusive-distrib/1.0/","  In the present work, cesium iodide (CsI) thin films of different thickness
have been prepared by thermal evaporation technique. The crystallite size and
grain size of these films are compared by using X-ray diffraction (XRD) profile
analysis as well as by transmission electron microscopy (TEM) counting,
respectively. These two methods provide less deviation between crystallite size
and grain size in the case of thin CsI films of 4 nm, but there is
comparatively large difference in case of thicker CsI films (20 nm, 100 nm and
500 nm). It indicates that dislocations are arranged in a configuration which
causes small orientational difference between two adjacent coherent regions.
The size obtained from XRD corresponds to two separate regions, whereas in the
TEM micrograph the two regions may seem to correspond one region particularly
in case of thicker films. Other physical parameters such as strain, stress and
deformation energy density are also estimated precisely for the prominent XRD
peaks of thicker CsI films in the range $2\theta = 20^{0}-80^{0}$ by using a
modified Williamson-Hall (W-H) analysis assuming uniform deformation model
(UDM), uniform deformation stress model (UDSM) and uniform deformation energy
density model (UDEDM).
","[{""version"":""v1"",""created"":""Fri, 23 Nov 2012 16:25:54 GMT""},{""version"":""v2"",""created"":""Wed, 19 Jun 2013 06:50:43 GMT""},{""version"":""v3"",""created"":""Sat, 2 Nov 2013 07:14:18 GMT""}]","2013-11-05"
"1211.5541","Ingo Barth","Ingo Barth and Olga Smirnova","Nonadiabatic tunneling in circularly polarized laser fields: Derivation
  of formulas","42 pages, 3 figures",,"10.1103/PhysRevA.87.013433",,"physics.atom-ph","http://arxiv.org/licenses/nonexclusive-distrib/1.0/","  We provide detailed analysis of strong field ionization of degenerate valence
p orbitals by circularly polarized fields. Our analytical approach is
conceptually equivalent to the Perelomov, Popov, and Terent'ev (PPT) theory and
is virtually exact for short range potentials. After benchmarking our results
against the PPT theory for s orbitals, we obtain the results for p orbitals. We
also show that, as long as the dipole approximation is valid, both the PPT
method and our results are gauge invariant, in contrast with widely used strong
field approximation (SFA). Our main result, which has already been briefly
outlined in [I. Barth and O. Smirnova, Phys. Rev. A 84, 063415 (2011)], is that
strong field ionization preferentially removes electrons counter-rotating to
the circularly polarized laser field. The result is illustrated using the
example of Kr atom. Strong, up to one order of magnitude, sensitivity of strong
field ionization to the sense of electron rotation in the initial state is one
of the key signatures of non-adiabatic regime of strong field ionization.
","[{""version"":""v1"",""created"":""Fri, 23 Nov 2012 16:28:18 GMT""}]","2013-05-30"
"1211.5542","Devendra Ojha K","M. B. Naik, D. K. Ojha, S. K. Ghosh, S. S. Poojary, R. B. Jadhav, G.
  S. Meshram, P. R. Sandimani, S. B. Bhagat, S. L. A. D'Costa, S. M. Gharat, C.
  B. Bakalkar, J. P. Ninan and J. S. Joshi","TIRCAM2: The TIFR Near Infrared Imaging Camera","15 pages, 14 figures, Accepted for publication in Bull. Astr. Soc.
  India",,,,"astro-ph.IM","http://arxiv.org/licenses/nonexclusive-distrib/1.0/","  TIRCAM2 (TIFR Near Infrared Imaging Camera - II) is a closed cycle cooled
imager that has been developed by the Infrared Astronomy Group at the Tata
Institute of Fundamental Research for observations in the near infrared band of
1 to 3.7 microns with existing Indian telescopes. In this paper, we describe
some of the technical details of TIRCAM2 and report its observing capabilities,
measured performance and limiting magnitudes with the 2-m IUCAA Girawali
telescope and the 1.2-m PRL Gurushikhar telescope. The main highlight is the
camera's capability of observing in the nbL (3.59 microns) band enabling our
primary motivation of mapping of Polycyclic Aromatic Hydrocarbon (PAH) emission
at 3.3 microns.
","[{""version"":""v1"",""created"":""Fri, 23 Nov 2012 16:33:20 GMT""}]","2012-11-26"
"1211.5543","Slava Rychkov","Axel Orgogozo, Slava Rychkov","The S parameter for a Light Composite Higgs: a Dispersion Relation
  Approach","21 pages, no figures; v2: references added, typos corrected; v3:
  accuracy estimate revised, comparison with gauge formalism made more precise,
  other minor improvements, version to appear in JHEP; v4: misprints corrected,
  footnote added",,"10.1007/JHEP06(2013)014","LPTENS-12/35; CERN-PH-TH/2012-324","hep-ph","http://arxiv.org/licenses/nonexclusive-distrib/1.0/","  We derive a dispersion relation for the S parameter in the SO(5)/SO(4)
Minimal Composite Higgs model. This generalizes the Peskin-Takeuchi formula to
the case when a light Higgs boson is present in the spectrum. Our result
combines an IR effect due to the reduction in the Higgs boson couplings with a
UV contribution from the strong sector. It also includes a finite matching
term, achieving a very good relative accuracy O(m_h/m_\rho). We apply our
formula in several toy examples, modeling the UV spectral density via Vector
Meson Dominance.
","[{""version"":""v1"",""created"":""Fri, 23 Nov 2012 16:35:25 GMT""},{""version"":""v2"",""created"":""Fri, 7 Dec 2012 14:18:33 GMT""},{""version"":""v3"",""created"":""Sun, 19 May 2013 13:46:19 GMT""},{""version"":""v4"",""created"":""Fri, 24 Apr 2015 11:36:08 GMT""}]","2015-06-12"
"1211.5544","Holger Petersen","Holger Petersen","A Note on Kolmogorov-Uspensky Machines",,,,,"cs.CC cs.FL","http://arxiv.org/licenses/nonexclusive-distrib/1.0/","  Solving an open problem stated by Shvachko, it is shown that a language which
is not real-time recognizable by some variants of pointer machines can be
accepted by a Kolmogorov-Uspensky machine in real-time.
","[{""version"":""v1"",""created"":""Fri, 23 Nov 2012 16:37:37 GMT""}]","2012-11-26"
"1211.5545","Daan Krammer","Daan Krammer","An asymmetric generalisation of Artin monoids","24 pages",,,,"math.GR","http://arxiv.org/licenses/nonexclusive-distrib/1.0/","  We propose a slight weakening of the definitions of Artin monoids and Coxeter
monoids. We study one `infinite series' in detail.
","[{""version"":""v1"",""created"":""Fri, 23 Nov 2012 16:38:07 GMT""}]","2012-11-26"
"1211.5546","Tony Lyons","Tony Lyons","The 2-component dispersionless Burgers equation arising in the modelling
  of blood flow","13 pages, 2 figures. arXiv admin note: text overlap with
  arXiv:1009.5374 by other authors","Comm. Pure App. Anal. 11 (2012), no. 4, 1563-1576","10.3934/cpaa.2012.11.1563",,"nlin.SI","http://arxiv.org/licenses/nonexclusive-distrib/1.0/","  This article investigates the properties of the solutions of the
dispersionless two-component Burgers (B2) equation, derived as a model for
blood-flow in arteries with elastic walls. The phenomenon of wave breaking is
investigated as well as applications of the model to clinical conditions.
","[{""version"":""v1"",""created"":""Fri, 23 Nov 2012 16:38:13 GMT""}]","2013-05-02"
"1211.5547","Michele Vergne","Mich\`ele Vergne","Formal equivariant $\hat A$ class, splines and multiplicities of the
  index of transversally elliptic operators","An example and a reference are added. Some misprints have been
  corrected",,,,"math.DG","http://arxiv.org/licenses/nonexclusive-distrib/1.0/","  Let G be a connected compact Lie group acting on a manifold M and let D be a
transversally elliptic operator on M. The multiplicity of the index of D is a
function on the set of irreducible representations of G. Let T be a maximal
torus of G with Lie algebra Lie(T). We construct a finite number of piecewise
polynomial functions on the dual vector space Lie(T)*, and give a formula for
the multiplicity in term of these functions. The main new concept is the formal
equivariant $\hat A$ class.
","[{""version"":""v1"",""created"":""Fri, 23 Nov 2012 16:44:10 GMT""},{""version"":""v2"",""created"":""Sat, 24 Oct 2015 17:02:17 GMT""},{""version"":""v3"",""created"":""Tue, 9 Feb 2016 16:17:07 GMT""}]","2016-02-10"
"1211.5548","Andrea Giuliani","J. W. Beeman, A. Gentils, A. Giuliani, M. Mancuso, G. Pessina, O.
  Plantevin and C. Rusconi","Effect of SiO2 coating in bolometric Ge light detectors for rare event
  searches",,,"10.1016/j.nima.2013.01.019",,"physics.ins-det nucl-ex","http://arxiv.org/licenses/nonexclusive-distrib/1.0/","  In germanium-based light detectors for scintillating bolometers, a SiO$_2$
anti-reflective coating is often applied on the side of the germanium wafer
exposed to light with the aim to improve its light collection efficiency. In
this paper, we report about a measurement, performed in the temperature range
25-35 mK, of the light-collection increase obtained thanks to this method,
which resulted to be of the order of 20%. The procedure followed has been
carefully selected in order to minimize systematic effects. The employed light
sources have the same spectral features (peaking at $\sim 630$ nm wavelength)
that will characterise future neutrinoless double beta decay experiments on the
isotope $^{82}$Se and based on ZnSe crystals, such as LUCIFER. The coupling
between source and light detector reproduces the configuration used in
scintillating bolometers. The present measurement clarifies the role of SiO$_2$
coating and describes a method and a set-up that can be extended to the study
of other types of coatings and luminescent materials.
","[{""version"":""v1"",""created"":""Fri, 23 Nov 2012 16:45:09 GMT""},{""version"":""v2"",""created"":""Sat, 1 Dec 2012 05:58:25 GMT""}]","2015-06-12"
"1211.5549","Takuro Tanaka","Takuro Tanaka and Hiroshi Kontani","Extrinsic Spin Hall Effect Due to Transition-Metal Impurities","Invited paper","Prog. Theor. Phys. Vol. 128 No. 5 (2012) pp. 805-828","10.1143/PTP.128.805",,"cond-mat.str-el cond-mat.mes-hall","http://arxiv.org/licenses/nonexclusive-distrib/1.0/","  We investigate the extrinsic spin Hall effect in the electron gas model due
to transition-metal impurities based on the single-impurity Anderson model with
orbital degrees of freedom. Both the skew scattering and side jump mechanisms
are analyzed in a unified way, and the significant role of orbital degrees of
freedom are clarified. The obtained spin Hall conductivities are in proportion
to the spin-orbit polarization at the Fermi level ($R = <l \cdot s>$) as is the
case with the intrinsic spin Hall effect: skew scattering term $\sigma^{ss} ~ R
\delta_1/\rho$, and side jump term $\sigma^{sj} ~ R$, where $\delta_1$ is the
phase shift for $p$ ($l=1$) partial wave. Furthermore, the present study
indicates the existence of a nontrivial close relationship between the
intrinsic term $\sigma^{int}$ and the extrinsic side jump term $\sigma^{sj}$.
","[{""version"":""v1"",""created"":""Fri, 23 Nov 2012 16:50:20 GMT""}]","2012-11-26"
"1211.5550","Paolo Bolzoni","P. Bolzoni","Timelike structure functions and hadron multiplicities","Talk given at the XXI International Baldin Seminar on High Energy
  Physics Problems,September 10-15, 2012, JINR, Dubna, Russia",,,,"hep-ph hep-ex","http://arxiv.org/licenses/nonexclusive-distrib/1.0/","  In this talk we discuss the results obtained in the new approach that we
recently introduced to consider and include both the perturbative and
nonperturbative contributions to the evolution of the gluon and quark avarage
multiplicities. We report on our progresses in solving a longstanding puzzle of
QCD. The new formalism is motivated by recent important theoretical
developments in timelike small-x resummation which are also discussed mostly
from an historical point of view. We have extended our global analysis to fit
the available data adding the strong coupling constant as a fit parameter. In
this way our best fit gives $\alpha_s(M_z)=0.124\pm 0.005$ and for the
corresponding $\chi^2$ we have obtained a further improvement.
","[{""version"":""v1"",""created"":""Fri, 23 Nov 2012 16:50:57 GMT""}]","2012-11-26"
"1211.5551","Constantinos Valagiannopoulos Dr.","Constantinos A. Valagiannopoulos, Pekka Alitalo and Sergei A.
  Tretyakov","On the Minimal Scattering Response of PEC Cylinders in a Dielectric
  Cloak","17 Pages, 18 Figures, Journal",,,,"math-ph math.MP physics.optics","http://arxiv.org/licenses/nonexclusive-distrib/1.0/","  Recently, it was shown that an infinite perfectly conducting (PEC) cylinder
can be nearly perfectly cloaked from normally incident electromagnetic waves
using a single-layer homogeneous dielectric cladding. Here we study the
electromagnetic response of such structures with the goal to understand the
main mechanisms underpinning this cloaking phenomenon. We introduce a simple
model of the cloaked PEC cylinder, replacing it by an omnidirectional
electric-line scatterer and a bipolar magnetic one; accordingly, the far field
is determined in a compact closed form. The analysis of the results shows that
the optimal cloaking regime corresponds to the frequency point where the total
electric moment is drastically mitigated and thus the radiation pattern of the
device resembles that of a magnetic-dipole line. In the vicinity of the optimal
cloaking frequency we observe the response close to that of Huygens' pairs of
electric and magnetic line scatterers.
","[{""version"":""v1"",""created"":""Fri, 23 Nov 2012 16:51:45 GMT""}]","2012-11-26"
"1211.5552","Maksym Piotr","P. A. Maksym and H. Aoki","Magnetic field controlled vacuum charge in graphene quantum dots with a
  mass gap","5 pages, 4 figures",,"10.1088/1742-6596/456/1/012026",,"cond-mat.mes-hall physics.atom-ph quant-ph","http://arxiv.org/licenses/nonexclusive-distrib/1.0/","  The effect of a magnetic field on the charged vacuum is investigated. The
field dependence of the energy levels causes jumps in the total vacuum charge
that occur whenever an energy level crosses the Fermi level and this leads to
re-entrant cycles of vacuum charging and discharging. In atomic systems these
effects require astrophysical magnetic fields of around 10^8 T but in graphene
with a mass gap they occur in laboratory fields of about 1 T or lower. It is
suggested that an electrostatic graphene quantum dot defined by a gate
electrode provides a solid state model of the as yet unobserved charged vacuum
as well as a model of an atomic system in an extreme astrophysical environment.
Phase diagrams are computed to show how the total vacuum charge depends on the
confining potential strength and applied magnetic field. In addition the field
dependence of the vacuum charge density is investigated and experimental
consequences are discussed.
","[{""version"":""v1"",""created"":""Fri, 23 Nov 2012 16:53:38 GMT""}]","2015-06-12"
"1211.5553","Jacopo Bellazzini","Jacopo Bellazzini, Vieri Benci, Claudio Bonanno, Edoardo Sinibaldi","On the existence of hylomorphic vortices in the nonlinear Klein-Gordon
  equation","23 pages, 5 figures",,,,"math.AP math-ph math.MP","http://arxiv.org/licenses/nonexclusive-distrib/1.0/","  In this paper we prove the existence of vortices, namely standing waves with
non null angular momentum, for the nonlinear Klein-Gordon equation in dimension
$N\geq 3$. We show with variational methods that the existence of these kind of
solutions, that we have called \emph{hylomorphic vortices}, depends on a
suitable energy-charge ratio. Our variational approach turns out to be useful
for numerical investigations as well. In particular, some results in dimension
N=2 are reported, namely exemplificative vortex profiles by varying charge and
angular momentum, together with relevant trends for vortex frequency and
energy-charge ratio. The stability problem for hylomorphic vortices is also
addressed. In the absence of conclusive analytical results, vortex evolution is
numerically investigated: the obtained results suggest that, contrarily to
solitons with null angular momentum, vortex are unstable.
","[{""version"":""v1"",""created"":""Fri, 23 Nov 2012 17:01:33 GMT""}]","2012-11-26"
