"1211.5827","Darryl D. Holm","Darryl D. Holm","Euler-Poincar\'{e} equations for anelastic fluid flows","12 pages, rescuing and old draft for the arXiv that may be updated
  later. Comments welcome!",,,,"physics.flu-dyn physics.class-ph","http://arxiv.org/licenses/nonexclusive-distrib/1.0/","  We show that the ideal (nondissipative) form of the dynamical equations for
the Lipps-Hemler formulation of the anelastic fluid model follow as
Euler-Poincar\'{e} equations, obtained from a constrained Hamilton's principle
expressed in the Eulerian fluid description. This establishes the mathematical
framework for the following properties of these anelastic equations: the
Kelvin-Noether circulation theorem, conservation of potential vorticity on
fluid parcels, and the Lie-Poisson Hamiltonian formulation possessing conserved
Casimirs, conserved domain integrated energy and an associated variational
principle satisfied by the equilibrium solutions. We then introduce a modified
set of anelastic equations that represent the mean anelastic motion, averaged
over subgrid scale rapid fluctuations, while preserving the mathematical
properties of the Euler-Poincar\'{e} framework.
","[{""version"":""v1"",""created"":""Mon, 26 Nov 2012 00:40:36 GMT""}]","2012-11-27"
"1211.5828","Ying Zong","Ying Zong","A going-up theorem","The first version was originally intended as an appendix to
  R.Gurjar's paper ""Cyclic multiple planes, branched covers of S^n and a result
  of D.L.Smith""",,,,"math.AG","http://arxiv.org/licenses/nonexclusive-distrib/1.0/","  We generalize certain arguments in Zariski's irregularity theorem on cyclic
multiple planes.
","[{""version"":""v1"",""created"":""Mon, 26 Nov 2012 01:01:45 GMT""},{""version"":""v2"",""created"":""Sun, 20 Nov 2016 19:59:28 GMT""}]","2016-11-22"
"1211.5829","Reza Oji","Reza Oji","An Automatic Algorithm for Object Recognition and Detection Based on
  ASIFT Keypoints","11 pages - 8 figures. arXiv admin note: substantial text overlap with
  arXiv:1210.7038","Signal & Image Processing : An International Journal (SIPIJ)
  Vol.3, No.5, 2012, pp 29-39","10.5121/sipij.2012.3503",,"cs.AI cs.CV","http://arxiv.org/licenses/nonexclusive-distrib/1.0/","  Object recognition is an important task in image processing and computer
vision. This paper presents a perfect method for object recognition with full
boundary detection by combining affine scale invariant feature transform
(ASIFT) and a region merging algorithm. ASIFT is a fully affine invariant
algorithm that means features are invariant to six affine parameters namely
translation (2 parameters), zoom, rotation and two camera axis orientations.
The features are very reliable and give us strong keypoints that can be used
for matching between different images of an object. We trained an object in
several images with different aspects for finding best keypoints of it. Then, a
robust region merging algorithm is used to recognize and detect the object with
full boundary in the other images based on ASIFT keypoints and a similarity
measure for merging regions in the image. Experimental results show that the
presented method is very efficient and powerful to recognize the object and
detect it with high accuracy.
","[{""version"":""v1"",""created"":""Mon, 26 Nov 2012 01:10:15 GMT""}]","2012-11-27"
"1211.5830","Oleg Lunin","Oleg Lunin, Samir D. Mathur","A toy black hole S-matrix in the D1-D5 CFT","41 pages",,"10.1007/JHEP02(2013)083",,"hep-th","http://arxiv.org/licenses/nonexclusive-distrib/1.0/","  To model the process of absorption and emission of quanta by an extremal
D1-D5 black hole in the dual CFT, we consider transitions between different
Ramond vacua via absorption and emission of chiral primaries. We compute the
probabilities to reach different CFT states starting with a special Ramond
vacuum, using techniques of the orbifold CFT. It is found that the processes
involving the change of angular momentum by $k$ units are suppressed as 1/N^k
","[{""version"":""v1"",""created"":""Mon, 26 Nov 2012 01:21:15 GMT""}]","2015-06-12"
"1211.5831","Dawei Shen","Dawei Shen","A note on resolution quivers",,,,,"math.RT","http://arxiv.org/licenses/nonexclusive-distrib/1.0/","  Recently, Ringel introduced the resolution quiver for a connected Nakayama
algebra. It is known that each connected component of the resolution quiver has
a unique cycle. We prove that all cycles in the resolution quiver are of the
same size. We introduce the notion of weight for a cycle in the resolution
quiver. It turns out that all cycles have the same weight.
","[{""version"":""v1"",""created"":""Mon, 26 Nov 2012 01:21:37 GMT""}]","2012-11-27"
"1211.5832","Beomdu Lim","Beomdu Lim, Moo-Young Chun, Hwankyung Sung, Byeong-Gon Park, Jae-Joon
  Lee, Sangmo T. Sohn, Hyeonoh Hur, and Michael S. Bessell","The Starburst Cluster Westerlund 1: The Initial Mass Function and Mass
  Segregation","67 pages, 15 figures, 4 tables Accepted for publication in the
  Astronomical Journal",,"10.1088/0004-6256/145/2/46",,"astro-ph.SR astro-ph.GA","http://arxiv.org/licenses/nonexclusive-distrib/1.0/","  Westerlund 1 is the most important starburst cluster in the Galaxy due to its
massive star content. We have performed BVIc and JKs photometry to investigate
the initial mass function (IMF). By comparing the observed color with the
spectral type - intrinsic color relation, we obtain the mean interstellar
reddening of <E(B-V)>=4.19+/-0.23 and <E(J-Ks)>=1.70+/-0.21. Due to the heavy
extinction toward the cluster, the zero-age main sequence fitting method based
on optical photometry proved to be inappropriate for the distance
determination, while the near-infrared photometry gave a reliable distance to
the cluster -- 3.8 kpc from the empirical relation. Using the recent
theoretical stellar evolution models with rotation, the age of the cluster is
estimated to be 5.0+/-1.0 Myr. We derived the IMF in the massive part and
obtained a fairly shallow slope of {\Gamma} = -0.8 +/- 0.1. The integration of
the IMF gave a total mass for the cluster in excess of 5.0 x 10^4 solar mass.
The IMF shows a clear radial variation indicating the presence of mass
segregation. We also discuss the possible star formation history of Westerlund
1 from the presence of red supergiants and relatively low-luminosity yellow
hypergiants.
","[{""version"":""v1"",""created"":""Mon, 26 Nov 2012 01:23:43 GMT""}]","2015-06-12"
"1211.5833","Rene Pannekoek MSc","Ren\'e Pannekoek","On p-torsion of p-adic elliptic curves with additive reduction","13 pages",,,,"math.AG math.NT","http://arxiv.org/licenses/nonexclusive-distrib/1.0/","  Let E be an elliptic curve with additive reduction over the p-adic numbers,
and let G be the group of p-adic points on E that have good reduction. This
paper gives necessary and sufficient conditions for G to contain non-trivial
p-torsion.
","[{""version"":""v1"",""created"":""Mon, 26 Nov 2012 01:26:06 GMT""},{""version"":""v2"",""created"":""Wed, 30 Jan 2013 16:43:47 GMT""}]","2013-01-31"
"1211.5834","Evgeny Sevostyanov","Evgeny Sevost'yanov","The Miniowitz and Vuorinen theorems for the mappings with non-bounded
  characteristics","16 pages",,,,"math.CV","http://arxiv.org/licenses/nonexclusive-distrib/1.0/","  The present paper is devoted to the study of classes of mappings with
non--bounded characteristics of quasiconformality. It is proved that the normal
families of mappings distorting the families of mappings in ${\Bbb R}^n$ by
special way, have the logarithmic order of growth in the neighborhood of every
point. There are proved some sufficient conditions of normality of such
mappings $f:D\rightarrow \bar{{\Bbb R}^n},$ $n\ge 2,$ omitting the values of
some set $E_f$ with some constraints of the type $c(E_f)\ge \delta,$ $\delta\in
{\Bbb R},$ where $c(\cdot)$ is the special set function.
","[{""version"":""v1"",""created"":""Mon, 26 Nov 2012 01:27:05 GMT""},{""version"":""v2"",""created"":""Tue, 27 Nov 2012 08:16:51 GMT""},{""version"":""v3"",""created"":""Sun, 16 Dec 2012 20:46:18 GMT""},{""version"":""v4"",""created"":""Sun, 27 Jan 2013 20:55:40 GMT""},{""version"":""v5"",""created"":""Mon, 26 Aug 2013 08:29:29 GMT""},{""version"":""v6"",""created"":""Mon, 2 Sep 2013 20:15:13 GMT""}]","2013-09-04"
"1211.5835","Keiichi Maeda","keiichi Maeda","Young Supernovae as Experimental Sites to Study Electron Acceleration
  Mechanism","5 pages, 3 figures, accepted for publication in ApJL",,"10.1088/2041-8205/762/2/L24","IPMU12-0207","astro-ph.HE astro-ph.SR","http://arxiv.org/licenses/nonexclusive-distrib/1.0/","  Radio emissions from young supernovae (~ 1 year after the explosion) show a
peculiar feature in the relativistic electron population at a shock wave, where
their energy distribution is steeper than typically found in supernova remnants
(SNRs) and than the prediction from the standard diffusive shock acceleration
(DSA) mechanism. This is especially established for a class of stripped
envelope supernovae (SNe IIb/Ib/Ic) where a combination of high shock velocity
and low circumstellar material (CSM) density makes it easier to derive the
intrinsic energy distribution than in other classes of SNe. We suggest that
this apparent discrepancy reflects the situation that the low energy electrons
before accelerated by the DSA-like mechanism are responsible for the radio
synchrotron emission from young SNe, and that studying young SNe sheds light on
the still-unresolved electron injection problem in the acceleration theory of
cosmic rays. We suggest that electron's energy distribution could be flattened
toward the high energy, most likely around 100 MeV, which marks a transition
from inefficient to efficient acceleration. Identifying this feature will be a
major advance in understanding the electron acceleration mechanism. We suggest
two further probes: (1) mm/sub-mm observations in the first year after the
explosion, and (2) X-ray observations at about 1 year and thereafter. We show
that these are reachable by ALMA and Chandra for nearby SNe.
","[{""version"":""v1"",""created"":""Mon, 26 Nov 2012 01:30:21 GMT""}]","2015-06-12"
"1211.5836","Ilya Kapovich","Ilya Kapovich","An integral weight realization theorem for subset currents on free
  groups","Revised final version, to appear in Topology Proceedings","Topology Proceedings 50 (2017), pp. 213-236",,,"math.GR math.GT","http://arxiv.org/licenses/nonexclusive-distrib/1.0/","  We prove that if $N\ge 2$ and $\alpha: F_N\to \pi_1(\Gamma)$ is a marking on
$F_N$, then for any integer $r\ge 2$ and any $F_N$-invariant collection of
non-negative integral ""weights"" associated to all subtrees $K$ of $\widetilde
\Gamma$ of radius $\le r$ satisfying some natural ""switch"" conditions, there
exists a finite cyclically reduced folded $\Gamma$-graph $\Delta$ realizing
these weights as numbers of ""occurrences"" of $K$ in $\Delta$. As an
application, we give a new, more direct and explicit, proof of one of the main
results of our paper with Nagnibeda \cite{KN3} stating that for any $N\ge 2$
the set $\gcnr$ of all rational subset currents is dense in the space $\gcn$ of
subset currents on $F_N$. We also answer one of the questions (Problem 10.11)
posed in \cite{KN3}. Thus we prove that if a nonzero $\mu\in \gcn$ has all
weights with respect to some marking being integers, then $\mu$ is the sum of
finitely many ""counting"" currents corresponding to nontrivial finitely
generated subgroups of $F_N$.
","[{""version"":""v1"",""created"":""Mon, 26 Nov 2012 01:33:27 GMT""},{""version"":""v2"",""created"":""Mon, 23 Sep 2013 03:02:29 GMT""},{""version"":""v3"",""created"":""Tue, 29 Apr 2014 21:56:08 GMT""},{""version"":""v4"",""created"":""Mon, 18 Jul 2016 14:11:54 GMT""}]","2016-12-08"
"1211.5837","Yves van Gennip","Yves van Gennip, Huiyi Hu, Blake Hunter, Mason A. Porter","Geosocial Graph-Based Community Detection","5 pages, 4 figures Workshop paper for the IEEE International
  Conference on Data Mining 2012: Workshop on Social Media Analysis and Mining",,"10.1109/ICDMW.2012.63",,"cs.SI physics.soc-ph","http://arxiv.org/licenses/nonexclusive-distrib/1.0/","  We apply spectral clustering and multislice modularity optimization to a Los
Angeles Police Department field interview card data set. To detect communities
(i.e., cohesive groups of vertices), we use both geographic and social
information about stops involving street gang members in the LAPD district of
Hollenbeck. We then compare the algorithmically detected communities with known
gang identifications and argue that discrepancies are due to sparsity of social
connections in the data as well as complex underlying sociological factors that
blur distinctions between communities.
","[{""version"":""v1"",""created"":""Mon, 26 Nov 2012 01:35:42 GMT""}]","2019-07-11"
"1211.5838","Chanyong Park","Bum-Hoon Lee, Bogeun Gwak, and Chanyong Park","Correlation functions of the ABJM model","16 pages, no figure",,"10.1103/PhysRevD.87.086002",,"hep-th","http://arxiv.org/licenses/nonexclusive-distrib/1.0/","  In the ABJM model, we study the three-point function of two heavy operators
and an (ir)relevant one. Following the AdS/CFT correspondence, the structure
constant in the large 't Hooft coupling limit can be factorized into two parts.
One is the structure constant with a marginal operator, which is fully
determined by the physical quantities of heavy operator and gives rise to the
consistent result with the RG analysis. The other can be expressed as the
universal form depending only on the conformal dimension of an (ir)relevant
operator. We also investigate the new size effect of a circular string dual to
a certain closed spin chain.
","[{""version"":""v1"",""created"":""Mon, 26 Nov 2012 01:46:27 GMT""},{""version"":""v2"",""created"":""Thu, 14 Feb 2013 04:38:07 GMT""}]","2013-04-17"
"1211.5839","Aaron Warren","Aaron R. Warren","The K-Theoretic Formulation of D-Brane Aharonov-Bohm Phases","14 pages, 2 figures",,,,"hep-th quant-ph","http://arxiv.org/licenses/nonexclusive-distrib/1.0/","  The topological calculation of Aharonov-Bohm phases associated with D-branes
in the absence of a Neveu-Schwarz B-field is explored. The K-theoretic
classification of Ramond-Ramond fields in Type II and Type I theories is used
to produce formulae for the Aharonov-Bohm phase associated with a torsion flux.
A topological construction shows that K-theoretic pairings to calculate such
phases exist and are well-defined. An analytic perspective is then taken,
obtaining a means for determining Aharonov-Bohm phases by way of the reduced
eta-invariant. This perspective is used to calculate the phase for an
experiment involving the $(-1)-8$ system in Type I theory, and compared with
previous calculations performed using different methods.
","[{""version"":""v1"",""created"":""Mon, 26 Nov 2012 01:49:41 GMT""}]","2012-11-27"
"1211.5840","Kiyoshi Shiraishi","Kiyoshi Shiraishi","Bose-Einstein Condensation in Compactified Spaces","10 pages, no figure","Progress of Theoretical Physics 77 (1987) pp. 975-982","10.1143/PTP.77.975",,"hep-th","http://arxiv.org/licenses/nonexclusive-distrib/1.0/","  We discuss the thermodynamic potential of a charged Bose gas with the
chemical potential in arbitrary dimensions. The critical temperature for
Bose-Einstein condensation is investigated. In the case of the compactified
background metric, it is shown that the critical temperature depends on the
size of the extra spaces. The asymmetry of the ""Kaluza-Klein charge"" is also
discussed.
","[{""version"":""v1"",""created"":""Mon, 26 Nov 2012 02:02:33 GMT""}]","2012-11-27"
"1211.5841","Andrii Salii","Laszlo Jenkovszky, Oleg Kuprash, Risto Orava, and Andrii Salii","Low missing mass, single- and double diffraction dissociation at the LHC",,,,,"hep-ph","http://arxiv.org/licenses/nonexclusive-distrib/1.0/","  Low missing mass, single- and double diffraction dissociation is calculated
for the LHC energies from a dual-Regge model, dominated by a Pomeron Regge pole
exchange. The model reproduces the rich resonance structure in the low missing
mass Mx region. The diffractionly excited states lie on the nucleon trajectory,
appended by the isolated Roper resonance. Detailed predictions for the squared
momentum transfer and missing mass dependence of the differential and
integrated single- and double diffraction dissociation in the kinematical range
of present and future LHC measurements are given. The model predicts a possible
turn-down of the cross section towards, t -> 0 in a region probably accessible
in future experiments in the nearly forward direction.
  The present work is a continuation and extension (e.g. with double
diffraction) of a previous work using the dual Regge approach.
","[{""version"":""v1"",""created"":""Mon, 26 Nov 2012 02:12:45 GMT""}]","2012-11-27"
"1211.5842","Maysam Mirahmadi","Maysam Mirahmadi, Abdallah Shami","A Novel Algorithm for Real-time Procedural Generation of Building Floor
  Plans",,,,,"cs.GR","http://creativecommons.org/licenses/by-nc-sa/3.0/","  Real-time generation of natural-looking floor plans is vital in games with
dynamic environments. This paper presents an algorithm to generate suburban
house floor plans in real-time. The algorithm is based on the work presented in
[1]. However, the corridor placement is redesigned to produce floor plans
similar to real houses. Moreover, an optimization stage is added to find a
corridor placement with the minimum used space, an approach that is designed to
mimic the real-life practices to minimize the wasted spaces in the design. The
results show very similar floor plans to the ones designed by an architect.
","[{""version"":""v1"",""created"":""Mon, 26 Nov 2012 02:13:52 GMT""}]","2012-11-27"
"1211.5843","Novaes Camila","Camila Paiva Novaes and Carlos Alexandre Wuensche","Identification of galaxy clusters in cosmic microwave background maps
  using the Sunyaev-Zel'dovich effect","12 pages, 9 figures","(2012) A&A, 545, A34","10.1051/0004-6361/201118482",,"astro-ph.CO","http://arxiv.org/licenses/nonexclusive-distrib/1.0/","  The Planck satellite was launched in 2009 by the European Space Agency to
study the properties of the cosmic microwave background (CMB). An expected
result of the Planck data analysis is the distinction of the various
contaminants of the CMB signal. Among these contaminants is the
Sunyaev-Zel'dovich (SZ) effect, which is caused by the inverse Compton
scattering of CMB photons by high energy electrons in the intracluster medium
of galaxy clusters. We modify a public version of the JADE (Joint Approximate
Diagonalization of Eigenmatrices) algorithm, to deal with noisy data, and then
use this algorithm as a tool to search for SZ clusters in two simulated
datasets. The first dataset is composed of simple ""homemade"" simulations and
the second of full sky simulations of high angular resolution, available at the
LAMBDA (Legacy Archive for Microwave Background Data Analysis) website. The
process of component separation can be summarized in four main steps: (1)
pre-processing based on wavelet analysis, which performs an initial cleaning
(denoising) of data to minimize the noise level; (2) the separation of the
components by JADE; (3) the calibration of the recovered SZ map; and (4) the
identification of the positions and intensities of the clusters using the
SExtractor software. The results show that our JADE-based algorithm is
effective in identifying the position and intensity of the SZ clusters, with
the purities being higher then 90% for the extracted ""catalogues"". This value
changes slightly according to the characteristics of noise and the number of
components included in the input maps. The main highlight of our developed work
is the effective recovery rate of SZ sources from noisy data, with no a priori
assumptions. This powerful algorithm can be easily implemented and become an
interesting complementary option to the ""matched filter"" algorithm widely used
in SZ data analysis.
","[{""version"":""v1"",""created"":""Mon, 26 Nov 2012 02:19:33 GMT""}]","2012-11-27"
"1211.5844","Shiliang Li","Guotai Tan, Ping Zheng, Xiancheng Wang, Yanchao Chen, Xiaotian Zhang,
  Jianlin Luo, Tucker Netherton, Yu Song, Pengcheng Dai, Chenglin Zhang, and
  Shiliang Li","Strong-Coupling Superconductivity in NaFe$_{1-x}$Co$_x$As: the
  Eliashberg Theory and Beyond","5 pages, 4 figures","Phys. Rev. B 87, 144512 (2013)","10.1103/PhysRevB.87.144512",,"cond-mat.supr-con","http://arxiv.org/licenses/nonexclusive-distrib/1.0/","  We study the normal-state and superconducting properties of
NaFe$_{1-x}$Co$_x$As system by specific heat measurements. Both the
normal-state Sommerfeld coefficient and superconducting condensation energy are
strongly suppressed in the underdoped and heavily overdoped samples. The
low-temperature electronic specific heat can be well fitted by either an
one-gap or a two-gap BCS-type function for all the superconducting samples. The
ratio $\gamma_NT_c^2/H_c^2(0)$ can nicely associate the neutron spin resonance
as the bosons in the standard Eliashberg model. However, the value of $\Delta
C/T_c\gamma_N$ near optimal doping is larger than the maximum value the model
can obtain. Our results suggest that the high-$T_c$ superconductivity in the
Fe-based superconductors may be understood within the framework of
boson-exchange mechanism but significant modification may be needed to account
for the finite-temperature properties.
","[{""version"":""v1"",""created"":""Mon, 26 Nov 2012 02:34:22 GMT""}]","2015-06-12"
"1211.5845","E. T. Tomboulis","X. Cheng and E. T. Tomboulis","Critical couplings and string tensions from two-lattice matching of RG
  decimations","7 pages, 2 figures, 3 tables, presented at Lattice 2012, June 24-29,
  2012, Cairns, Australia",,,,"hep-lat","http://arxiv.org/licenses/nonexclusive-distrib/1.0/","  Critical couplings and string tensions in SU(2) and SU(3) lattice gauge
theory are calculated by two-lattice matching of RG block transformations. The
transformations are of the potential moving type generating plaquette actions
with large number of group characters and exhibit rapid approach to a unique
renormalized trajectory. Fixing the critical coupling $\beta(N_\tau)$ at one
value of temporal lattice extent $N_\tau$ by MC simulation, the critical
couplings for other values of $N_\tau$ are then obtained by lattice matching of
these decimations. $\beta(N_\tau)$ values are thus obtained for a range of
$N_\tau$ and found to be in agreement with MC simulation results to within a
few percent in all cases. A similar procedure allows the calculation of string
tensions for a range of $\beta$ values with similarly good agreement with MC
data.
","[{""version"":""v1"",""created"":""Mon, 26 Nov 2012 02:50:55 GMT""}]","2012-11-27"
"1211.5846","Jayita Banerjee","Jayita Banerjee, David Rahmlow, Ryan Carollo, Michael Bellos, Edward
  E. Eyler, Phillip L. Gould and William C. Stwalley","Direct Photoassociative Formation of Ultracold KRb Molecules in the
  Lowest Vibrational Levels of the Ground State","6 pages, 7 figures, Accepted for publication in Physical Review A",,"10.1103/PhysRevA.86.053428",,"physics.atom-ph physics.chem-ph physics.optics","http://arxiv.org/licenses/nonexclusive-distrib/1.0/","  We report continuous direct photoassociative formation of ultracold KRb
molecules in the lowest vibrational levels $(v""=0 -10)$ of the electronic
ground state $(X ^1\Sigma^+)$, starting from $^{39}$K and $^{85}$Rb atoms in a
magneto-optical trap. The process exploits a newfound resonant coupling between
the $2(1), v'=165$ and $4(1), v'=61$ levels, which exhibit an almost equal
admixture of the uncoupled eigenstates. The production rate of the
$X^1\Sigma^+$ ($v""$=0) level is estimated to be $5\times10^3$ molecules/sec.
","[{""version"":""v1"",""created"":""Mon, 26 Nov 2012 02:58:15 GMT""}]","2015-06-12"
"1211.5847","Todor Milanov E","Todor Milanov","The Eynard--Orantin recursion for the total ancestor potential","18 pages. arXiv admin note: text overlap with arXiv:1203.3414","Duke Math. J. 163, no. 9 (2014), 1795-1824","10.1215/00127094-2690805",,"math.AG hep-th","http://arxiv.org/licenses/nonexclusive-distrib/1.0/","  It was proved recently that the correlation functions of a semi-simple
cohomological field theory satisfy the so called Eynard--Orantin topological
recursion. We prove that in the settings of singularity theory, the relations
can be expressed in terms of periods integrals and the so called phase forms.
In particular, we prove that the Eynard-Orantin recursion is equivalent to $N$
copies of Virasoro constraints for the ancestor potential, which follow easily
from the definition of the potential.
","[{""version"":""v1"",""created"":""Mon, 26 Nov 2012 02:59:13 GMT""}]","2015-01-14"
"1211.5848","Yong Xu","Yong Xu, Zhu Chen, Hongwei Xiong, W. Vincent Liu, and Biao Wu","Stability of $p$-orbital Bose-Einstein condensates in optical
  checkerboard and square lattices","7 pages, 7 figures","Physical Review A 87, 013635 (2013)","10.1103/PhysRevA.87.013635",,"cond-mat.quant-gas","http://arxiv.org/licenses/nonexclusive-distrib/1.0/","  We investigate $p$-orbital Bose-Einstein condensates in both the square and
checkerboard lattice by numerically solving the Gross-Pitaevskii equation. The
periodic potential for the latter lattice is taken exactly from the recent
experiment [Nature Phys. 7, 147 (2011)]. It is confirmed that the staggered
orbital-current state is the lowest-energy state in the $p$ band. Our numerical
calculation further reveals that for both lattices the staggered $p$-orbital
state suffers Landau instability but the situation is remarkably different for
dynamical instability. A dynamically stable parameter region is found for the
checkerboard lattice, but not for the square.
","[{""version"":""v1"",""created"":""Mon, 26 Nov 2012 03:05:29 GMT""},{""version"":""v2"",""created"":""Wed, 30 Jan 2013 02:07:55 GMT""}]","2013-01-31"
