"1211.5885","Gerhard Keller","Tobias J\""ager and Gerhard Keller","Random minimality and continuity of invariant graphs in random dynamical
  systems","As one of the three main results of the first version was partially
  known (Y. Cao, 2006), we reorganized the material and changed the title of
  the submission in order to emphasize the other results and some new concepts
  introduced in this paper. (15 pages)","Transactions Amer. Math. Soc. 368 (2016) ,6643--6662",,,"math.DS","http://arxiv.org/licenses/nonexclusive-distrib/1.0/","  We study dynamical systems forced by a combination of random and
deterministic noise and provide criteria, in terms of Lyapunov exponents, for
the existence of random attractors with continuous structure in the fibres. For
this purpose, we provide suitable random versions of the semiuniform ergodic
theorem and also introduce and discuss some basic concepts of random
topological dynamics.
","[{""version"":""v1"",""created"":""Mon, 26 Nov 2012 08:40:53 GMT""},{""version"":""v2"",""created"":""Fri, 3 May 2013 15:28:36 GMT""}]","2017-01-16"
"1211.5886","O-Kab Kwon","Gyungchoon Go, Chanju Kim, Yoonbai Kim, O-Kab Kwon, Hiroaki Nakajima","BPS Vortices, $Q$-balls, and $Q$-vortices in ${\cal N}=6$} Chern-Simons
  Matter Theory","38 pages, 1 figure",,"10.1007/JHEP02(2013)058",,"hep-th","http://arxiv.org/licenses/nonexclusive-distrib/1.0/","  We investigate the vortex-type BPS equations in the ABJM theory without and
with mass-deformation. We systematically classify the BPS equations in terms of
the number of supersymmetry and the R-symmetries of the undeformed and
mass-deformed ABJM theories. For the undeformed case, we analyze the ${\cal
N}=2$ BPS equations for U(2)$\times$U(2) gauge symmetry and obtain a coupled
differential equation which can be reduced to either Liouville- or
Sinh-Gordon-type vortex equations according to the choice of scalar functions.
For the mass-deformed case with U($N$)$\times$U($N$) gauge symmetry, we obtain
some number of pairs of coupled differential equations from the ${\cal N}=1,2$
BPS equations, which can be reduced to the vortex equations in Maxwell-Higgs
theory or Chern-Simons matter theories as special cases. We discuss the
solutions. In ${\cal N}=3$ vortex equations Chern-Simons-type vortex equation
is not allowed. We also show that ${\cal N}=\frac52, \frac32, \frac12$ BPS
equations are equivalent to those with higher integer supersymmetries.
","[{""version"":""v1"",""created"":""Mon, 26 Nov 2012 08:41:52 GMT""}]","2015-06-12"
"1211.5887","Michael Keith","M. J. Keith, W. Coles, R. M. Shannon, G. B. Hobbs, R. N. Manchester,
  M. Bailes, N. D. R. Bhat, S. Burke-Spolaor, D. J. Champion, A. Chaudhary, A.
  W. Hotan, J. Khoo, J. Kocz, S. Oslowski, V. Ravi, J. E. Reynolds, J.
  Sarkissian, W. van Straten and D. R. B. Yardley","Measurement and correction of variations in interstellar dispersion in
  high-precision pulsar timing","16 pages, 8 figures. Accepted for publication in MNRAS",,"10.1093/mnras/sts486",,"astro-ph.GA astro-ph.IM astro-ph.SR","http://arxiv.org/licenses/nonexclusive-distrib/1.0/","  Signals from radio pulsars show a wavelength-dependent delay due to
dispersion in the interstellar plasma. At a typical observing wavelength, this
delay can vary by tens of microseconds on five-year time scales, far in excess
of signals of interest to pulsar timing arrays, such as that induced by a
gravitational-wave background. Measurement of these delay variations is not
only crucial for the detection of such signals, but also provides an
unparallelled measurement of the turbulent interstellar plasma at au scales. In
this paper we demonstrate that without consideration of wavelength- independent
red-noise, 'simple' algorithms to correct for interstellar dispersion can
attenuate signals of interest to pulsar timing arrays. We present a robust
method for this correction, which we validate through simulations, and apply it
to observations from the Parkes Pulsar Timing Array. Correction for dispersion
variations comes at a cost of increased band-limited white noise. We discuss
scheduling to minimise this additional noise, and factors, such as
scintillation, that can exacerbate the problem. Comparison with scintillation
measurements confirms previous results that the spectral exponent of electron
density variations in the interstellar medium often appears steeper than
expected. We also find a discrete change in dispersion measure of PSR
J1603-7202 of ~2x10^{-3} cm^{-3}pc for about 250 days. We speculate that this
has a similar origin to the 'extreme scattering events' seen in other sources.
In addition, we find that four pulsars show a wavelength-dependent annual
variation, indicating a persistent gradient of electron density on an au
spatial scale, which has not been reported previously.
","[{""version"":""v1"",""created"":""Mon, 26 Nov 2012 08:48:51 GMT""}]","2015-06-12"
"1211.5888","Dimitrios Christopoulos","Dimitrios Christopoulos and Symeon Chatzinotas and Bjorn Ottersten","User Scheduling for Coordinated Dual Satellite Systems with Linear
  Precoding","6 pages, 4 figures, conference paper submitted to the IEEE",,,,"cs.IT math.IT","http://arxiv.org/licenses/nonexclusive-distrib/1.0/","  The constantly increasing demand for interactive broadband satellite
communications is driving current research to explore novel system
architectures that reuse frequency in a more aggressive manner. To this end,
the topic of dual satellite systems, in which satellites share spatial (i.e.
same coverage area) and spectral (i.e. full frequency reuse) degrees of freedom
is introduced. In each multibeam satellite, multiuser interferences are
mitigated by employing zero forcing precoding with realistic per antenna power
constraints. However, the two sets of users that the transmitters are
separately serving, interfere. The present contribution, proposes the partial
cooperation, namely coordination between the two coexisting transmitters in
order to reduce interferences and enhance the performance of the whole system,
while maintaining moderate system complexity. In this direction, a heuristic,
iterative, low complexity algorithm that allocates users in the two interfering
sets is proposed. This novel algorithm, improves the performance of each
satellite and of the overall system, simultaneously. The first is achieved by
maximizing the orthogonality between users allocated in the same set, hence
optimizing the zero forcing performance, whilst the second by minimizing the
level of interferences between the two sets. Simulation results show that the
proposed method, compared to conventional techniques, significantly increases
spectral efficiency.
","[{""version"":""v1"",""created"":""Mon, 26 Nov 2012 08:49:48 GMT""}]","2012-11-27"
"1211.5889","Miroslav Pardy","Miroslav Pardy","Electron spin motion in the delta-function pulse","12 pages. arXiv admin note: substantial text overlap with
  arXiv:1208.0488, arXiv:hep-ph/0207274, arXiv:1109.1716, arXiv:0809.3888",,,,"physics.gen-ph quant-ph","http://arxiv.org/licenses/nonexclusive-distrib/1.0/","  We formulate the Bargman-Michel-Telegdi (BMT) equation for electron spin
motion in a plane wave and in the Dirac delta-function pulse. We compare the
BMT solution with the Wolkow solution of the Dirac equation. The Wolkow
solution for the spin is not identical with the solution following from the BMT .
","[{""version"":""v1"",""created"":""Mon, 26 Nov 2012 09:07:38 GMT""}]","2015-03-13"
"1211.5890","Yuriy Ostapov","Yuriy Ostapov","Adaptive Control of Enterprise",,,,,"cs.CE","http://arxiv.org/licenses/nonexclusive-distrib/1.0/","  Modern progress in artificial intelligence permits to realize algorithms of
adaptation for critical events (in addition to ERP). A production emergence, an
appearance of new competitive goods, a major change in financial state of
partners, a radical change in exchange rate, a change in custom and tax
legislation, a political and energy crisis, an ecocatastrophe can lead up to a
decrease of profit or bankruptcy of enterprise. Therefore it is necessary to
assess a probability of threat and to take preventive actions. If a critical
event took place, one must estimate restoration expenses and possible
consequences as well as to prepare appropriate propositions. This is provided
using modern methods of diagnostics, prediction, and decision making as well as
an inference engine and semantic analysis. Mathematical methods in use are
called in algorithms of adaptation automatically. Because the enterprise is a
complex system, to overcome complexity of control it is necessary to apply
semantic representations. Such representations are formed from descriptions of
events, facts, persons, organizations, goods, operations, scripts on a natural
language. Semantic representations permit as well to formulate actual problems
and to find ways to resolve these problems.
","[{""version"":""v1"",""created"":""Mon, 26 Nov 2012 09:09:21 GMT""}]","2012-11-27"
"1211.5891","Willem Van den Heuvel","Willem Van den Heuvel and Alessandro Soncini","NMR chemical shift as analytical derivative of the Helmholtz free energy",,"J. Chem. Phys. 138, 054113 (2013)","10.1063/1.4789398",,"physics.chem-ph","http://arxiv.org/licenses/nonexclusive-distrib/1.0/","  We present a theory for the temperature-dependent nuclear magnetic shielding
tensor of molecules with arbitrary electronic structure. The theory is a
generalization of Ramsey's theory for closed-shell molecules. The shielding
tensor is defined as a second derivative of the Helmholtz free energy of the
electron system in equilibrium with the applied magnetic field and the nuclear
magnetic moments. This derivative is analytically evaluated and expressed as a
sum over states formula. Special consideration is given to a system with an
isolated degenerate ground state for which the size of the degeneracy and the
composition of the wave functions are arbitrary. In this case the paramagnetic
part of the shielding tensor is expressed in terms of the $g$ and $A$ tensors
of the EPR spin Hamiltonian of the degenerate state. As an illustration of the
proposed theory, we provide an explicit formula for the paramagnetic shift of
the central lanthanide ion in endofullerenes Ln@C$_{60}$, with Ln=Ce$^{3+}$,
Nd$^{3+}$, Sm$^{3+}$, Dy$^{3+}$, Er$^{3+}$ and Yb$^{3+}$, where the ground
state can be a strongly spin-orbit coupled icosahedral sextet for which the
paramagnetic shift cannot be described by previous theories.
","[{""version"":""v1"",""created"":""Mon, 26 Nov 2012 09:11:31 GMT""}]","2014-03-12"
"1211.5892","St\'ephane Blondin","St\'ephane Blondin, Luc Dessart, D. John Hillier, Alexei M. Khokhlov","One-dimensional delayed-detonation models of Type Ia supernovae:
  Confrontation to observations at bolometric maximum","25 pages, 16 figures; accepted for publication in MNRAS",,"10.1093/mnras/sts484",,"astro-ph.SR astro-ph.CO","http://arxiv.org/licenses/nonexclusive-distrib/1.0/","  The delayed-detonation explosion mechanism applied to a Chandrasekhar-mass
white dwarf offers a very attractive model to explain the inferred
characteristics of Type Ia supernovae (SNe Ia). The resulting ejecta are
chemically stratified, have the same mass and roughly the same asymptotic
kinetic energy, but exhibit a range in 56Ni mass. We investigate the
contemporaneous photometric and spectroscopic properties of a sequence of
delayed-detonation models, characterized by 56Ni masses between 0.18 and 0.81
Msun. Starting at 1d after explosion, we perform the full non-LTE,
time-dependent radiative transfer with the code CMFGEN, with an accurate
treatment of line blanketing, and compare our results to SNe Ia at bolometric
maximum. Despite the 1D treatment, our approach delivers an excellent agreement
to observations. We recover the range of SN Ia luminosities, colours, and
spectral characteristics from the near-UV to 1 micron, for standard as well as
low-luminosity 91bg-like SNe Ia. Our models predict an increase in rise time to
peak with increasing 56Ni mass, from ~15 to ~21d, yield peak bolometric
luminosities that match Arnett's rule to within 10%, and reproduce the much
smaller scatter in near-IR magnitudes compared to the optical. We reproduce the
morphology of individual spectral features, the stiff dependence of the R(Si)
spectroscopic ratio on 56Ni mass, and the onset of blanketing from TiII/ScII in
low-luminosity SNe Ia with a 56Ni mass <0.3 Msun. We find that ionization
effects, which often dominate over abundance variations, can produce
high-velocity features in CaII lines, even in 1D. Distinguishing between
different SN Ia explosion mechanisms is a considerable challenge but the
results presented here provide additional support to the viability of the
delayed-detonation model.
","[{""version"":""v1"",""created"":""Mon, 26 Nov 2012 09:11:38 GMT""}]","2015-06-12"
"1211.5893","Ragnar Winther","Richard S. Falk and Ragnar Winther","Local bounded cochain projection","26 pages",,,,"math.NA","http://arxiv.org/licenses/nonexclusive-distrib/1.0/","  We construct projections from the space of differential k-forms which belong
to L2 and whose exterior derivative also belongs to L2, to finite dimensional
subspaces of piecewise polynomial differential forms defined on a simplicial
mesh. These projections have the properties that they commute with the exterior
derivative and are bounded independent of the mesh size. Unlike some other
recent work in this direction, the projections are also locally defined in the
sense that they are defined by local operators on overlapping macroelements, in
the spirit of the Clement interpolant.
","[{""version"":""v1"",""created"":""Mon, 26 Nov 2012 09:14:23 GMT""}]","2012-11-27"
"1211.5894","Akhlesh Lakhtakia","Akhlesh Lakhtakia and Tom G. Mackay","Vector spherical wavefunctions for orthorhombic dielectric-magnetic
  material with gyrotropic-like magnetoelectric properties",,"Journal of Optics (India), Vol. 41, No. 4, pp. 201-213 (2012)","10.1007/s12596-012-0084-y",,"physics.optics","http://arxiv.org/licenses/nonexclusive-distrib/1.0/","  Vector spherical wavefunctions were derived in closed-form to represent
time-harmonic electromagnetic fields in an orthorhombic dielectric-magnetic
material with gyrotropic-like magnetoelectric properties. These wavefunctions
were used to formulate the T matrix for scattering by a three-dimensional
object composed of the chosen material. Furthermore, a closed-form,
coordinate-free expression of the dyadic Green function for the chosen material
was derived. Expressions ascertained for the singularity behavior will be
useful for formulating volume integral equations for scattering inside the
chosen material. A bilinear expansion of the dyadic Green function was obtained
in terms of the derived vector spherical wavefunctions.
","[{""version"":""v1"",""created"":""Mon, 26 Nov 2012 09:14:24 GMT""}]","2012-11-27"
"1211.5895","Valeriy Timofeev P.","V. Yu. Monarkha, V. A. Pashchenko, and V. P. Timofeev","Low density flux pinning in YBCO single crystals","3 pages, 4 figures",,,,"cond-mat.supr-con","http://arxiv.org/licenses/nonexclusive-distrib/1.0/","  The Abricosov vortex and bundles dynamics was experimentally investigated in
Earth's magnetic field range. Isothermal relaxation features in YBCO single
crystal samples with strong pinning centers were studied for different
sample-field orientation. The normalized relaxation rate S obtained allowed to
estimate the effective pinning potential U in the bulk of the YBCO sample and
its temperature dependence, as well as the critical current density Jc. A
comparison between the data obtained and the results for similar measurements
in significantly higher magnetic fields was performed. To compare different Jc
measuring techniques magnetization loop M(H) measurements, were made. These
measurements provide many important parameters of the sample under study
(penetration field Hp, first critical field Hc1, etc.) that contain the
geometrical configuration of the samples.
","[{""version"":""v1"",""created"":""Mon, 26 Nov 2012 09:14:58 GMT""}]","2012-11-27"
"1211.5896","Hermine Bierm\'{e}","Hermine Bierm\'e, Agn\`es Desolneux","Crossings of smooth shot noise processes","Published in at http://dx.doi.org/10.1214/11-AAP807 the Annals of
  Applied Probability ( http://www.imstat.org/aap/ ) by the Institute of
  Mathematical Statistics (http://www.imstat.org)","Annals of Applied Probability 2012, Vol. 22, No. 6, 2240-2281","10.1214/11-AAP807","IMS-AAP-AAP807","math.PR","http://arxiv.org/licenses/nonexclusive-distrib/1.0/","  In this paper, we consider smooth shot noise processes and their expected
number of level crossings. When the kernel response function is sufficiently
smooth, the mean number of crossings function is obtained through an integral
formula. Moreover, as the intensity increases, or equivalently, as the number
of shots becomes larger, a normal convergence to the classical Rice's formula
for Gaussian processes is obtained. The Gaussian kernel function, that
corresponds to many applications in physics, is studied in detail and two
different regimes are exhibited.
","[{""version"":""v1"",""created"":""Mon, 26 Nov 2012 09:28:25 GMT""}]","2012-11-27"
"1211.5897","Barbara Betz","Barbara Betz","Jet Quenching in Heavy-Ion Collisions - The Transition Era from RHIC to
  LHC","12 pages, 7 figures, review article in the ""Topical Issue on
  Relativistic Hydro- and Thermodynamics"" EPJA","Eur. Phys. J. A 48, 164 (2012)","10.1140/epja/i2012-12164-8",,"nucl-th","http://arxiv.org/licenses/nonexclusive-distrib/1.0/","  A status report on the jet quenching physics in heavy-ion collisions is given
as it appears after more than 10 years of collecting and analysing data at the
Relativistic Heavy Ion Collider (RHIC) and ~1.5 years of physics at the Large
Hadron Collider (LHC). The (theoretical) predictions and expectations before
the start of the LHC program are contrasted with the most recent experimental
results, focussing on the nuclear modification factor R_{AA}, the elliptic flow
v_2 of high-p_T particles, and on the problem of initial conditions.
","[{""version"":""v1"",""created"":""Mon, 26 Nov 2012 09:30:56 GMT""}]","2012-11-27"
"1211.5898","Bata Das","Tirthankar Bhattacharyya, Bata Krishna Das and Santanu Sarkar","The Defect Sequence for Contractive Tuples","16 Pages. To appear in Linear Algebra and its Applications",,,,"math.FA","http://arxiv.org/licenses/nonexclusive-distrib/1.0/","  We introduce the defect sequence for a contractive tuple of Hilbert space
operators and investigate its properties. The defect sequence is a sequence of
numbers, called defect dimensions associated with a contractive tuple. We show
that there are upper bounds for the defect dimensions. The tuples for which
these upper bounds are obtained, are called maximal contractive tuples. The
upper bounds are different in the non-commutative and in the com- mutative
case. We show that the creation operators on the full Fock space and the co
ordinate multipliers on the Drury-Arveson space are maximal. We also study pure
tuples and see how the defect dimensions play a role in their irreducibility.
","[{""version"":""v1"",""created"":""Mon, 26 Nov 2012 09:31:49 GMT""}]","2012-11-27"
"1211.5899","Ulrich Ott","Karl-Ludwig Kratz, Khalil Farouqi, Ulrich Ott","Origin of anomalous Xe-H in presolar diamonds: Indications of a ""cold""
  r-process","6 pages, 2 figures XII International Symposium on Nuclei in the
  Cosmos, August 5-12, 2012, Cairns, Australia",,"10.22323/1.146.0131",,"astro-ph.EP astro-ph.SR","http://arxiv.org/licenses/nonexclusive-distrib/1.0/","  We report on a concerted effort aimed at understanding the nucleosynthesis
origin of Xe-H in presolar nanodiamonds. Previously explored possible
explanations have included a secondary neutron-burst process occurring in the
He-shell of a type II supernova (SN), as well as a rapid separation, between
unstable precursor isobars of a primary r-process, and stable Xe isotopes. Here
we present results from the investigation of a rapid neutron-capture scenario
in core-collapse SNe with different non-standard r-process variants. Our
calculations are performed in the framework of the high-entropy-wind (HEW)
scenario using updated nuclear-physics input. We explore the consequences of
varying the wind expansion velocity (Vexp) for selected electron fractions (Ye)
with their correlated entropy ranges (S), and neutron-freezeout temperatures
(T9(freeze)) and timescales (tau-r(freeze). We draw several conclusions: For
Xe-H a ""cold"" r-process with a fast freezeout seems to be the favored scenario.
Furthermore, eliminating the low-S range (i.e. the ""weak"" r-process component)
and maintaining a pure ""main"" or even ""strong"" r-process leads to an optimum
overall agreement with the measured iXe/136Xe abundance ratios. Our results can
provide valuable additional insight into overall astrophysical conditions of
producing the r-process part of the total SS heavy elements in explosive
nucleosynthesis scenarios.
","[{""version"":""v1"",""created"":""Mon, 26 Nov 2012 09:38:44 GMT""}]","2022-10-26"
"1211.5900","Anuj Parikh","A. Parikh, J. Jos\'e, G. Sala, C. Iliadis","Nucleosynthesis in Type I X-ray Bursts","Accepted by Prog. Part. Nucl. Phys., 45 pages, 14 figures",,"10.1016/j.ppnp.2012.11.002",,"astro-ph.SR astro-ph.HE nucl-ex","http://arxiv.org/licenses/nonexclusive-distrib/1.0/","  Type I X-ray bursts are thermonuclear explosions that occur in the envelopes
of accreting neutron stars. Detailed observations of these phenomena have
prompted numerous studies in theoretical astrophysics and experimental nuclear
physics since their discovery over 35 years ago. In this review, we begin by
discussing key observational features of these phenomena that may be sensitive
to the particular patterns of nucleosynthesis from the associated thermonuclear
burning. We then summarize efforts to model type I X-ray bursts, with emphasis
on determining the nuclear physics processes involved throughout these bursts.
We discuss and evaluate limitations in the models, particularly with regard to
key uncertainties in the nuclear physics input. Finally, we examine recent,
relevant experimental measurements and outline future prospects to improve our
understanding of these unique environments from observational, theoretical and
experimental perspectives.
","[{""version"":""v1"",""created"":""Mon, 26 Nov 2012 09:43:15 GMT""}]","2012-11-27"
"1211.5901","Nicolas Chopin","Sumeetpal S. Singh and Nicolas Chopin and Nick Whiteley","Bayesian learning of noisy Markov decision processes",,,,,"stat.ML cs.LG stat.CO","http://arxiv.org/licenses/nonexclusive-distrib/1.0/","  We consider the inverse reinforcement learning problem, that is, the problem
of learning from, and then predicting or mimicking a controller based on
state/action data. We propose a statistical model for such data, derived from
the structure of a Markov decision process. Adopting a Bayesian approach to
inference, we show how latent variables of the model can be estimated, and how
predictions about actions can be made, in a unified framework. A new Markov
chain Monte Carlo (MCMC) sampler is devised for simulation from the posterior
distribution. This step includes a parameter expansion step, which is shown to
be essential for good convergence properties of the MCMC sampler. As an
illustration, the method is applied to learning a human controller.
","[{""version"":""v1"",""created"":""Mon, 26 Nov 2012 09:55:27 GMT""}]","2012-11-27"
"1211.5902","Oliver Pfaffel","Richard A. Davis and Oliver Pfaffel","Eigenvalues of sample covariance matrices of non-linear processes with
  infinite variance",,,,,"math.PR math.ST stat.TH","http://arxiv.org/licenses/nonexclusive-distrib/1.0/","  We study the $k$-largest eigenvalues of heavy-tailed sample covariance
matrices of the form $\bX\bX^\T$ in an asymptotic framework, where the
dimension of the data and the sample size tend to infinity. To this end, we
assume that the rows of $\bX$ are given by independent copies of some
stationary process with regularly varying marginals with index $\alpha\in(0,2)$
satisfying large deviation and mixing conditions. We apply these general
results to stochastic volatility and GARCH processes.
","[{""version"":""v1"",""created"":""Mon, 26 Nov 2012 09:56:00 GMT""},{""version"":""v2"",""created"":""Wed, 11 Sep 2013 21:56:51 GMT""}]","2013-09-13"
"1211.5903","Dimitrios Christopoulos","Dimitrios Christopoulos and Jesus Arnau and Symeon Chatzinotas and
  Carlos Mosquera and Bjorn Ottersten","MMSE Performance Analysis of Generalized Multibeam Satellite Channels","4 pages, 2 figures, submitted to the IEEE",,,,"cs.IT math.IT","http://arxiv.org/licenses/nonexclusive-distrib/1.0/","  Aggressive frequency reuse in the return link (RL) of multibeam satellite
communications (SatComs) is crucial towards the implementation of next
generation, interactive satellite services. In this direction, multiuser
detection has shown great potential in mitigating the increased intrasystem
interferences, induced by a tight spectrum reuse. Herein we present an analytic
framework to describe the linear Minimum Mean Square Error (MMSE) performance
of multiuser channels that exhibit full receive correlation: an inherent
attribute of the RL of multibeam SatComs. Analytic, tight approximations on the
MMSE performance are proposed for cases where closed form solutions are not
available in the existing literature. The proposed framework is generic, thus
providing a generalized solution straightforwardly extendable to various fading
models over channels that exhibit full receive correlation. Simulation results
are provided to show the tightness of the proposed approximation with respect
to the available transmit power.
","[{""version"":""v1"",""created"":""Mon, 26 Nov 2012 10:07:56 GMT""}]","2012-11-27"
