"1211.5946","Zhenzhou Cheng","Zhenzhou Cheng, Hon Ki Tsang, Xiaomu Wang, Chi Yan Wong, Xia Chen, Ke
  Xu, Zerui Shi, Jian-Bin Xu","Polarization Dependent Loss and All-Optical Modulation in Graphene on
  Suspended Membrane Waveguides","16 pages, 6 figures",,,,"physics.optics","http://arxiv.org/licenses/nonexclusive-distrib/1.0/","  We observe a strong polarization dependent optical loss of in-plane light
propagation in silicon waveguide due to the presence of graphene. Both
transverse-electric (TE) and transverse-magnetic (TM) modes are efficiently (~3
dB) coupled to the graphene on suspended membrane waveguides using an apodized
focusing subwavelength grating. The TE mode has 7.7 dB less excess optical loss
than the TM mode at 1.5 {\mu}m for a 150 {\mu}m long waveguide in good
agreement with a theoretical model. All-optical modulation of light is
demonstrated. There is also a large thermally induced change in waveguide
effective index because of optical absorption in graphene.
","[{""version"":""v1"",""created"":""Mon, 26 Nov 2012 13:34:03 GMT""}]","2012-11-27"
"1211.5947","Lech Maligranda","Sergey V. Astashkin and Lech Maligranda","Interpolation of Ces{\`a}ro sequence and function spaces","28 pages",,,,"math.FA","http://arxiv.org/licenses/nonexclusive-distrib/1.0/","  The interpolation property of Ces{\`a}ro sequence and function spaces is
investigated. It is shown that $Ces_p(I)$ is an interpolation space between
$Ces_{p_0}(I)$ and $Ces_{p_1}(I)$ for $1 < p_0 < p_1 \leq \infty$ and $1/p = (1
- \theta)/p_0 + \theta /p_1$ with $0 < \theta < 1$, where $I = [0, \infty)$ or
$[0, 1]$. The same result is true for Ces{\`a}ro sequence spaces. On the other
hand, $Ces_p[0, 1]$ is not an interpolation space between $Ces_1[0, 1]$ and
$Ces_{\infty}[0, 1]$.
","[{""version"":""v1"",""created"":""Mon, 26 Nov 2012 13:35:00 GMT""}]","2012-11-27"
"1211.5948","Weizhe Zheng","Yifeng Liu and Weizhe Zheng","Enhanced six operations and base change theorem for higher Artin stacks","105 pages. v3: reformulation; v2: minor improvements",,,,"math.AG","http://arxiv.org/licenses/nonexclusive-distrib/1.0/","  In this article, we develop a theory of Grothendieck's six operations for
derived categories in \'etale cohomology of Artin stacks. We prove several
desired properties of the operations, including the base change theorem in
derived categories. This extends all previous theories on this subject,
including the recent one developed by Laszlo and Olsson, in which the
operations are subject to more assumptions and the base change isomorphism is
only constructed on the level of sheaves. Moreover, our theory works for higher
Artin stacks as well.
  Our method differs from all previous approaches, as we exploit the theory of
stable $\infty$-categories developed by Lurie. We enhance derived categories,
functors, and natural isomorphisms to the level of $\infty$-categories and
introduce $\infty$-categorical (co)homological descent. To handle the ""homotopy
coherence"", we apply the results of our previous article arXiv:1211.5294 and
develop several other $\infty$-categorical techniques.
","[{""version"":""v1"",""created"":""Mon, 26 Nov 2012 13:41:18 GMT""},{""version"":""v2"",""created"":""Mon, 7 Apr 2014 04:45:54 GMT""},{""version"":""v3"",""created"":""Tue, 26 Sep 2017 15:35:52 GMT""}]","2017-09-27"
"1211.5949","Masaki Murata","Koji Hashimoto and Masaki Murata","A Landscape in Boundary String Field Theory: New Class of Solutions with
  Massive State Condensation","22 pages, 12 figures, v2: minor change, reference added",,"10.1093/ptep/ptt010","OU-HET-770; RIKEN-MP-60","hep-th gr-qc hep-ph","http://arxiv.org/licenses/nonexclusive-distrib/1.0/","  We solve the equation of motion of boundary string field theory allowing
generic boundary operators quadratic in $X$, and explore string theory
non-perturbative vacua with massive state condensation. Using numerical
analysis, a large number of new solutions are found. Their energies turn out to
distribute densely in the range between the D-brane tension and the energy of
the tachyon vacuum. We discuss an interpretation of these solutions as
perturbative closed string states. From the cosmological point of view, the
distribution of the energies can be regarded as the so-called landscape of
string theory, as we have a vast number of non-perturbative string theory
solutions including one with small vacuum energy.
","[{""version"":""v1"",""created"":""Mon, 26 Nov 2012 13:43:05 GMT""},{""version"":""v2"",""created"":""Fri, 7 Dec 2012 13:47:57 GMT""}]","2016-06-21"
"1211.5950","Eli Kraisler","Eli Kraisler and Leeor Kronik","Piecewise Linearity of Approximate Density Functionals Revisited:
  Implications for Frontier Orbital Energies","Minor correction to Eqs. (10) and (III.7), information added to the
  Supplementary Material, typos corrected","Phys. Rev. Lett. 110, 126403 (2013)","10.1103/PhysRevLett.110.126403",,"cond-mat.mtrl-sci physics.chem-ph","http://arxiv.org/licenses/nonexclusive-distrib/1.0/","  In the exact Kohn-Sham density-functional theory (DFT), the total energy
versus the number of electrons is a series of linear segments between integer
points. However, commonly used approximate density functionals produce total
energies that do not exhibit this piecewise-linear behavior. As a result, the
ionization potential theorem, equating the highest occupied eigenvalue with the
ionization potential, is grossly disobeyed. Here, we show that, contrary to
conventional wisdom, most of the required piecewise-linearity of an arbitrary
approximate density functional can be restored by careful consideration of the
ensemble generalization of DFT. Furthermore, the resulting formulation
introduces the desired derivative discontinuity to any approximate
exchange-correlation functional, even one that is explicitly density-dependent.
This opens the door to calculations of the ionization potential and electron
affinity even without explicit electron removal or addition. All these advances
are achieved while neither introducing empiricism nor changing the underlying
functional form. The power of the approach is demonstrated on benchmark systems
using the local density approximation as an illustrative example.
","[{""version"":""v1"",""created"":""Mon, 26 Nov 2012 13:44:20 GMT""},{""version"":""v2"",""created"":""Tue, 2 Apr 2013 07:27:25 GMT""}]","2013-04-03"
"1211.5951","Andreas Helzel","A. Helzel, L. V. Litvin, I. P. Levkivskyi, E. V. Sukhorukov, W.
  Wegscheider, C. Strunk","Counting Statistics and Dephasing Transition in an Electronic
  Mach-Zehnder Interferometer","7 pages, 4 figures (+Supplement 8 pages, 9 figures)","Phys. Rev. B 91, 245419 (2015)","10.1103/PhysRevB.91.245419",,"cond-mat.mes-hall","http://arxiv.org/licenses/nonexclusive-distrib/1.0/","  It was recently suggested that a novel type of phase transition may occur in
the visibility of electronic Mach-Zehnder Interferometers. Here, we present
experimental evidence for the existence of this transition. The transition is
induced by strongly non-Gaussian noise that originates from the strong coupling
of a quantum point contact to the interferometer. We provide a transparent
physical picture of the effect, by exploiting a close analogy to the
neutrino-oscillations of particle physics. In addition, our experiment
constitutes a probe of the singularity of the elusive full counting statistics
of a quantum point contact.
","[{""version"":""v1"",""created"":""Mon, 26 Nov 2012 13:45:26 GMT""},{""version"":""v2"",""created"":""Thu, 22 Jan 2015 14:53:51 GMT""}]","2015-07-01"
"1211.5952","Matthew Strom Borman","Matthew Strom Borman, Tian-Jun Li, Weiwei Wu","Spherical Lagrangians via ball packings and symplectic cutting","25 pages, 2 figures; v2: minor corrections and clarifications, added
  discussion after Corollary 1.2. To appear in Selecta Mathematica","Selecta Math. (N.S.) 20(1):261-283, 2014","10.1007/s00029-013-0120-z",,"math.SG","http://arxiv.org/licenses/nonexclusive-distrib/1.0/","  In this paper we prove the connectedness of symplectic ball packings in the
complement of a spherical Lagrangian, S^2 or RP^2, in symplectic manifolds that
are rational or ruled. Via a symplectic cutting construction this is a natural
extension of McDuff's connectedness of ball packings in other settings and this
result has applications to several different questions: smooth knotting and
unknottedness results for spherical Lagrangians, the transitivity of the action
of the symplectic Torelli group, classifying Lagrangian isotopy classes in the
presence of knotting, and detecting Floer-theoretically essential Lagrangian
tori in the del Pezzo surfaces.
","[{""version"":""v1"",""created"":""Mon, 26 Nov 2012 13:46:52 GMT""},{""version"":""v2"",""created"":""Sun, 27 Jan 2013 17:12:25 GMT""}]","2014-02-20"
"1211.5953","Taiki Takahashi","Keigo Inukai and Taiki Takahashi","Decision under ambiguity: Effects of sign and magnitude","1 figure, 16 pages","International Journal of Neuroscience Vol. 119, No. 8 , Pages
  1170-1178",,,"q-bio.NC physics.bio-ph","http://arxiv.org/licenses/nonexclusive-distrib/1.0/","  Decision under ambiguity (uncertainty with unknown probabilities) has been
attracting attention in behavioral and neuroeconomics. However, recent
neuroimaging studies have mainly focused on gain domains while little attention
has been paid to the magnitudes of outcomes. In this study, we examined the
effects of the sign (i.e. gain and loss) and magnitude of outcomes on ambiguity
aversion and the additivity of subjective probabilities in Ellsberg's urn
problem. We observed that (i) ambiguity aversion was observed in both signs,
and (ii) subadditivity of subjective probability was not observed in negative
outcomes.
","[{""version"":""v1"",""created"":""Mon, 26 Nov 2012 13:53:04 GMT""}]","2012-11-27"
"1211.5954","Patrick Henning","Patrick Henning, Daniel Peterseim","Oversampling for the Multiscale Finite Element Method",,"SIAM Multiscale Mod. Simul. pages 1149--1175 vol. 11 num. 4 - 2013","10.1137/120900332",,"math.NA","http://arxiv.org/licenses/nonexclusive-distrib/1.0/","  This paper reviews standard oversampling strategies as performed in the
Multiscale Finite Element Method (MsFEM). Common to those approaches is that
the oversampling is performed in the full space restricted to a patch but
including coarse finite element functions. We suggest, by contrast, to perform
local computations with the additional constraint that trial and test functions
are linear independent from coarse finite element functions. This approach
re-interprets the Variational Multiscale Method in the context of computational
homogenization. This connection gives rise to a general fully discrete error
analysis for the proposed multiscale method with constrained oversampling
without any resonance effects. In particular, we are able to give the first
rigorous proof of convergence for a MsFEM with oversampling.
","[{""version"":""v1"",""created"":""Mon, 26 Nov 2012 13:53:11 GMT""},{""version"":""v2"",""created"":""Wed, 3 Jul 2013 12:28:46 GMT""}]","2014-04-16"
"1211.5955","Kouji Yano","Kouji Yano","On harmonic function for the killed process upon hitting zero of
  asymmetric L\'evy processes",,,,,"math.PR","http://arxiv.org/licenses/nonexclusive-distrib/1.0/","  For a certain class of asymmetric L\'evy processes where the origin is
regular for itself, the renormalized zero resolvent is proved to be harmonic
for the killed process upon hitting zero.
","[{""version"":""v1"",""created"":""Mon, 26 Nov 2012 13:55:11 GMT""}]","2012-11-27"
"1211.5956","Grzegorz Kwiatkowski","Grzegorz Kwiatkowski, Sergey Leble","Quantum corrections to phi^4 model solutions and applications to
  Heisenberg chain dynamics","9 pages",,"10.2478/s11534-013-0267-4",,"math-ph math.MP quant-ph","http://arxiv.org/licenses/nonexclusive-distrib/1.0/","  The Heisenberg spin chain is considered in phi^4 model approximation. Quantum
corrections to classical solutions of the one-dimensional phi^4 model within
the correspondent physics are evaluated with account of rest $d-1$ dimensions
of a d-dimensional theory. A quantization of the models is considered in terms
of space-time functional integral. The generalized zeta-function formalism is
used to renormalize and evaluate the functional integral and quantum
corrections to energy in quasiclassical approximation. The results are applied
to appropriate conditions of the spin chain models and its dynamics, which
elementary solutions, energy and the quantum corrections are calculated.
","[{""version"":""v1"",""created"":""Mon, 26 Nov 2012 13:59:32 GMT""}]","2015-06-12"
"1211.5957","Harvey S. Reall","Harvey S. Reall, Alexander A. H. Graham and Carl P. Turner","On algebraically special vacuum spacetimes in five dimensions","25 pages. v2: typos corrected",,"10.1088/0264-9381/30/5/055004",,"gr-qc hep-th","http://arxiv.org/licenses/nonexclusive-distrib/1.0/","  Vacuum solutions admitting a hypersurface-orthogonal repeated principal null
direction are an important class of 4d algebraically special spacetimes. We
investigate the 5d analogues of such solutions: vacuum spacetimes admitting a
hypersurface-orthogonal multiple Weyl aligned null direction (WAND). Such
spacetimes fall into 4 families determined by the rank of the 3X3 matrix that
defines the expansion and shear of the multiple WAND. The rank 3 and rank 0
cases have been studied previously. We investigate the 2 remaining families. We
show how to define coordinates which lead to a considerable simplification of
the Einstein equation with cosmological constant. The rank 2 case gives warped
product and Kaluza-Klein versions of the 4d Robinson-Trautman solutions as well
as some new solutions. The rank 1 case gives product, or analytically continued
Schwarzschild, spacetimes.
","[{""version"":""v1"",""created"":""Mon, 26 Nov 2012 14:10:23 GMT""},{""version"":""v2"",""created"":""Fri, 25 Jan 2013 11:02:16 GMT""}]","2015-06-12"
"1211.5958","Francisco Fernandez Dr.","Francisco M. Fern\'andez","On the Hellmann-Feynman theorem for statistical averages",,,,,"math-ph math.MP","http://arxiv.org/licenses/nonexclusive-distrib/1.0/","  We discuss the Hellmann-Feynman theorem for degenerate states and its
application to the calculation of the derivatives of statistical averages with
respect to external parameters.
","[{""version"":""v1"",""created"":""Mon, 26 Nov 2012 14:11:56 GMT""}]","2012-11-27"
"1211.5959","Michal Doucha","Michal Doucha","$F_\sigma$ equivalence relations and Laver forcing",,,,,"math.LO math.CO","http://arxiv.org/licenses/nonexclusive-distrib/1.0/","  Following the topic of the book Canonical Ramsey Theory on Polish Spaces by
V. Kanovei, M. Sabok and J. Zapletal we study Borel equivalences on Laver
trees. Here we prove that equivalence relations Borel reducible to an
equivalence relation on $2^\omega$ given by some $F_\sigma$ $P$-ideal on
$\omega$ can be canonized to the full equivalence relation or to the identity
relation.
  This has several corollaries, e.g. Silver type dichotomy for the Laver ideal
and equivalences Borel reducible to equivalence relations given by $F_\sigma$
$P$-ideals.
","[{""version"":""v1"",""created"":""Mon, 26 Nov 2012 14:12:35 GMT""}]","2012-11-27"
"1211.5960","Luis Peralta","Luis Peralta, Alina Louro","AlfaMC: a fast alpha particle transport Monte Carlo code","39 pages, 14 figures","Nucl. Instr. and Meth. in Phys. Res. A, Vol 737 (2014) 163-169","10.1016/j.nima.2013.11.026",,"physics.comp-ph physics.ins-det physics.med-ph","http://arxiv.org/licenses/nonexclusive-distrib/1.0/","  AlfaMC is a Monte Carlo simulation code for the transport of alpha particles.
The code is based on the Continuous Slowing Down Approximation and uses the
NIST/ASTAR stopping-power database. The code uses a powerful geometrical
package allowing the coding of complex geometries. A flexible histogramming
package is used which greatly easies the scoring of results. The code is
tailored for microdosimetric applications where speed is a key factor.
Comparison with the SRIM code is made for transmitted energy in thin layers and
range for air, mylar, aluminum and gold. The general agreement between the two
codes is good for beam energies between 1 and 12 MeV. The code is open-source
and released under the General Public Licence.
","[{""version"":""v1"",""created"":""Mon, 26 Nov 2012 14:13:53 GMT""},{""version"":""v2"",""created"":""Wed, 28 Nov 2012 18:36:11 GMT""},{""version"":""v3"",""created"":""Thu, 21 Nov 2013 14:21:28 GMT""}]","2017-11-07"
"1211.5961","Amelia Carolina Sparavigna","Amelia Carolina Sparavigna","Translation and discussion of the De Iride, a treatise on optics by
  Robert Grosseteste","Robert Grosseteste, De Iride, Latin text, English translation,
  discussion","On the Rainbow, a Robert Grosseteste's Treatise on Optics,
  International Journal of Sciences, 2013, Volume 2, Issue 9, pp. 108-113","10.18483/ijSci.296",,"physics.hist-ph","http://arxiv.org/licenses/nonexclusive-distrib/1.0/","  Here I am proposing a translation and discussion of the De Iride, one of the
short scientific treatise written by Robert Grosseteste. In the first part of
his Latin text we find reflection and refraction of light, described in a
geometrical optics. In the second part, Grosseteste is discussing the rainbow
and how the colors are created.
","[{""version"":""v1"",""created"":""Mon, 26 Nov 2012 14:14:46 GMT""}]","2015-08-13"
"1211.5962","Pascal Demoulin","P. Demoulin, D. Baker, C. H. Mandrini, L. van Driel-Gesztelyi","The 3D geometry of active region upflows deduced from their limb-to-limb
  evolution",,,"10.1007/s11207-013-0234-7",,"astro-ph.SR physics.flu-dyn physics.space-ph","http://arxiv.org/licenses/nonexclusive-distrib/1.0/","  We analyse the evolution of coronal plasma upflows from the edges of AR
10978, which has the best limb-to-limb data coverage with Hinode's EUV Imaging
Spectrometer (EIS). We find that the observed evolution is largely due to the
solar rotation progressively changing the viewpoint of nearly stationary flows.
From the systematic changes in the upflow regions as a function of distance
from disc centre, we deduce their 3D geometrical properties as inclination and
angular spread in three coronal lines (SiVII, FeXII, FeXV). In agreement with
magnetic extrapolations, we find that the flows are thin, fan-like structures
rooted in quasi separatrix layers (QSLs). The fans are tilted away from the AR
centre. The highest plasma velocities in these three spectral lines have
similar magnitudes and their heights increase with temperature. The spatial
location and extent of the upflow regions in the SiVII, FeXII and FeXV lines
are different owing to (i) temperature stratification and (ii) line of sight
integration of the spectral profiles with significantly different backgrounds.
We conclude that we sample the same flows at different temperatures. Further,
we find that the evolution of line widths during the disc passage is compatible
with a broad range of velocities in the flows. Everything considered, our
results are compatible with the AR upflows originating from reconnections along
QSLs between over-pressure AR loops and neighboring under-pressure loops. The
flows are driven along magnetic field lines by a pressure gradient in a
stratified atmosphere. We propose that, at any given time, we observe the
superposition of flows created by successive reconnections, leading to a broad
velocity distribution.
","[{""version"":""v1"",""created"":""Mon, 26 Nov 2012 14:14:56 GMT""}]","2015-06-12"
"1211.5963","Hiroshi Takeuchi","Hiroshi Takeuchi","Spinning exact solutions with Sasakian structure in Gauss-Bonnet Maxwell
  gravity","16 pages, no figures",,"10.1093/ptep/ptt005",,"hep-th gr-qc","http://arxiv.org/licenses/nonexclusive-distrib/1.0/","  We obtain new exact solutions in Einstein Gauss-Bonnet gravity of every odd
dimension higher than three. These new spacetimes are stationary but
non-static, coupled with the Maxwell field, and asymptotic AdS at least
locally. In order to investigate such new solutions, we adopt the
characteristic ansatz for the metric form. It is presented that the local
expression of our metric possesses some interesting properties, in which the
most peculiar one is what is called Sasakian structure. Somewhat intricate
relationship is unveiled between our solution and the already-known rotating
solution which has been only one so far in that purely gravitational theory. We
confirm the validity of the rotating spacetime with the evaluation of the
finite angular momentum.
","[{""version"":""v1"",""created"":""Mon, 26 Nov 2012 14:16:06 GMT""}]","2016-06-21"
"1211.5964","Maciej Borodzik","Maciej Borodzik, Andr\'as N\'emethi, Andrew Ranicki","Codimension 2 embeddings, algebraic surgery and Seifert forms","The paper contains an error. Main Theorem 2 is false. We are
  currently working on fixing the result (it will be more subtle), but it might
  take time. To the best of our knowledge Main Theorem 1 is correct and Main
  Theorem 3 should be restated in an appropriate way to work",,,,"math.GT math.AT","http://arxiv.org/licenses/nonexclusive-distrib/1.0/","  We study the cobordism of manifolds with boundary, and its applications to
codimension 2 embeddings $M^m\subset N^{m+2}$, using the method of the
algebraic theory of surgery. The first main result is a splitting theorem for
cobordisms of algebraic Poincar\'e pairs, which is then applied to describe the
behaviour on the chain level of Seifert surfaces of embeddings $M^{2n-1}
\subset S^{2n+1}$ under isotopy and cobordism. The second main result (update:
which is false) is that the $S$-equivalence class of a Seifert form is an
isotopy invariant of the embedding, generalizing the Murasugi--Levine result
for knots and links. The third main result is a generalized Murasugi--Kawauchi
inequality giving an upper bound on the difference of the Levine--Tristram
signatures of cobordant embeddings.
","[{""version"":""v1"",""created"":""Mon, 26 Nov 2012 14:16:48 GMT""},{""version"":""v2"",""created"":""Sat, 19 May 2018 17:57:51 GMT""}]","2018-05-22"
"1211.5965","Anton S. Galaev Dr.","Anton S. Galaev","About the classification of the holonomy algebras of Lorentzian
  manifolds","9 pages, the final version","Siberian Mathematical Journal 54 (2013), no. 5, pp. 798--804","10.1134/S0037446613050042",,"math.DG","http://arxiv.org/licenses/nonexclusive-distrib/1.0/","  The classification of the holonomy algebras of Lorentzian manifolds can be
reduced to the classification of irreducible subalgebras
$\mathfrak{h}\subset\mathfrak{so}(n)$ that are spanned by the images of linear
maps from $\mathbb{R}^n$ to $\mathfrak{h}$ satisfying an identity similar to
the Bianchi one. T. Leistner found all such subalgebras and it turned out that
the obtained list coincides with the list of irreducible holonomy algebras of
Riemannian manifolds. The natural problem is to give a simple direct proof to
this fact. We give such proof for the case of semisimple not simple Lie
algebras $\mathfrak{h}$.
","[{""version"":""v1"",""created"":""Mon, 26 Nov 2012 14:18:28 GMT""},{""version"":""v2"",""created"":""Mon, 9 Dec 2013 19:54:39 GMT""}]","2018-08-21"
"1211.5966","Yuichi Higuchi","Yuichi Higuchi, Masamune Oguri, Takashi Hamana","Measuring the mass distribution of voids with stacked weak lensing","12 pages, 8 figures, 4 tables. Accepted for publication in MNRAS",,"10.1093/mnras/stt521",,"astro-ph.CO","http://arxiv.org/licenses/nonexclusive-distrib/1.0/","  We study the prospects for measuring the dark matter distribution of voids
with stacked weak lensing. We select voids from a large set of $N$-body
simulations, and explore their lensing signals with the full ray-tracing
simulations including the effect of the large-scale structure along the
line-of-sight. The lensing signals are compared with simple void model
predictions to infer the three-dimensional mass distribution of voids. We show
that the stacked weak lensing signals are detected at significant level
(S/N$\geq5$) for a 5000 degree$^2$ survey area, for a wide range of void radii
up to $\sim50$ Mpc. The error from the galaxy shape noise little affects
lensing signals at large scale. It is also found that dense ridges around voids
have a great impact on the weak lensing signals, suggesting that proper
modeling of the void density profile including surrounding ridges is essential
for extracting the average total underdens mass of voids.
","[{""version"":""v1"",""created"":""Mon, 26 Nov 2012 14:18:55 GMT""},{""version"":""v2"",""created"":""Sun, 24 Mar 2013 02:50:01 GMT""}]","2015-06-12"
