"1211.5593","Evan Kang Mr","Evan S. H. Kang, Hongkee Yoon, and Eunseong Kim","Microscopic description of stress- and temperature-dependent shear
  modulus in solid 4He","Evan S. H. Kang and Hongkee Yoon contributed equally to this work",,,,"cond-mat.other cond-mat.supr-con","http://arxiv.org/licenses/nonexclusive-distrib/1.0/","  We developed a detailed microscopic method that describes the shear modulus
anomaly of solid helium at low temperature. The shear modulus was calculated
using the pinning length of dislocations determined in detail for both crossing
network nodes and 3He impurities. The strong suppression of the shear modulus
is reproduced well as the temperature or stress increases. The shear modulus at
low temperatures depends strongly on how the state was prepared. All the key
features in the stress hysteresis can be quantitatively explained in terms of
the thermomechanical path-dependent pinning length of dislocation networks.
","[{""version"":""v1"",""created"":""Mon, 26 Nov 2012 15:58:02 GMT""}]","2012-11-27"
"1211.5771","Brandon Hanson","Brandon Hanson","Capturing Forms in Dense Subsets of Finite Fields","Corrected typos. Added reference to other work on the subject",,,,"math.NT math.CO","http://arxiv.org/licenses/nonexclusive-distrib/1.0/","  An open problem of arithmetic Ramsey theory asks if given a finite
$r$-colouring $c:\mathbb{N}\to\{1,...,r\}$ of the natural numbers, there exist
$x,y\in \mathbb{N}$ such that $c(xy)=c(x+y)$ apart from the trivial solution
$x=y=2$. More generally, one could replace $x+y$ with a binary linear form and
$xy$ with a binary quadratic form. In this paper we examine the analogous
problem in a finite field $\mathbb{F}_q$. Specifically, given a linear form $L$
and a quadratic from $Q$ in two variables, we provide estimates on the
necessary size of $A\subset \mathbb{F}_q$ to guarantee that $L(x,y)$ and
$Q(x,y)$ are elements of $A$ for some $x,y\in\mathbb{F}_q$.
","[{""version"":""v1"",""created"":""Sun, 25 Nov 2012 16:09:32 GMT""},{""version"":""v2"",""created"":""Thu, 29 Nov 2012 14:33:00 GMT""}]","2012-11-30"
"1211.5772","Ana Lopez-Sepulcre","Ana L\'opez-Sepulcre, Mihkel Kama, Cecilia Ceccarelli, Carsten
  Dominik, Emmanuel Caux, Asunci\'on Fuente, Tom\'as Alonso-Albi","Herschel CHESS discovery of the fossil cloud that gave birth to the
  Trapezium and Orion KL","10 pages, 6 figures, accepted by Astronomy and Astrophysics",,"10.1051/0004-6361/201219416",,"astro-ph.GA","http://arxiv.org/licenses/nonexclusive-distrib/1.0/","  As part of the Herschel Guaranteed Time Key Programme CHESS, we present the
discovery of a diffuse gas component in the foreground of the intermediate-mass
protostar OMC-2 FIR 4, located in the Orion A region. Making use of the full
HIFI spectrum of OMC-2 FIR 4 obtained in CHESS, we detected several
ground-state lines from OH+, H2O+, HF, and CH+, all of them seen in absorption
against the dust continuum emission of the protostar's envelope. The lines peak
at a velocity of 9 km/s, which is blue-shifted by 2 km/s with respect to the
systemic velocity of OMC-2 FIR 4 (V = 11.4 km/s). We derived column densities
for each species, as well as an upper limit to the column density of the
undetected H3O+. In order to model and characterise the foreground cloud, we
used the Meudon PDR code to run a homogeneous grid of models that spans a
reasonable range of densities, visual extinctions, cosmic ray ionisation rates
and far-ultraviolet (FUV) radiation fields. The results of our modelling
indicate that the foreground cloud is composed of predominantly neutral diffuse
gas (n(H) = 100 cm-3) and is heavily irradiated by an external source of FUV
that most likely arises from the nearby Trapezium OB association. The cloud is
6 pc thick and bears many similarities with the so-called C+ interface between
Orion-KL and the Trapezium cluster, 2 pc south of OMC-2 FIR 4. We conclude that
the foreground cloud we detected is an extension of the C+ interface seen in
the direction of Orion KL, and interpret it to be the remains of the parental
cloud of OMC-1, which extends from OMC-1 up to OMC-2.
","[{""version"":""v1"",""created"":""Sun, 25 Nov 2012 16:10:54 GMT""}]","2015-06-12"
"1211.5773","Koji Kobayashi","Koji Kobayashi","Circuit complexity and Problem structure in Hamming space","14 pages, 9 figures",,,,"cs.CC","http://arxiv.org/licenses/nonexclusive-distrib/1.0/","  This paper describes about relation between circuit complexity and accept
inputs structure in Hamming space by using almost all monotone circuit that
emulate deterministic Turing machine (DTM).
  Circuit family that emulate DTM are almost all monotone circuit family except
some NOT-gate which connect input variables (like negation normal form (NNF)).
Therefore, we can analyze DTM limitation by using this NNF Circuit family.
  NNF circuit have symmetry of OR-gate input line, so NNF circuit cannot
identify from OR-gate output line which of OR-gate input line is 1. So NNF
circuit family cannot compute sandwich structure effectively (Sandwich
structure is two accept inputs that sandwich reject inputs in Hamming space).
NNF circuit have to use unique AND-gate to identify each different vector of
sandwich structure. That is, we can measure problem complexity by counting
different vectors.
  Some decision problem have characteristic in sandwich structure. Different
vectors of Negate HornSAT problem are at most constant length because we can
delete constant part of each negative literal in Horn clauses by using definite
clauses. Therefore, number of these different vector is at most polynomial
size. The other hand, we can design high complexity problem with almost perfct
nonlinear (APN) function.
","[{""version"":""v1"",""created"":""Sun, 25 Nov 2012 16:22:03 GMT""},{""version"":""v2"",""created"":""Sun, 25 Mar 2018 00:48:27 GMT""},{""version"":""v3"",""created"":""Sun, 27 May 2018 12:22:44 GMT""},{""version"":""v4"",""created"":""Tue, 29 May 2018 01:41:20 GMT""}]","2018-05-30"
"1211.5774","Soma Maity","Atreyee Bhattacharya and Soma Maity","Some Unstable Critical Metrics for $L^{\frac{n}{2}}$-norm of the
  Curvature Tensor","contains 5 pages",,,,"math.DG","http://arxiv.org/licenses/nonexclusive-distrib/1.0/","  We consider the Riemannian functional defined on the space of Riemannian
metrics with unit volume on a closed smooth manifold $M$ given by
$\mathcal{R}_{\frac{n}{2}}(g):= \int_M |R(g)|^{\frac{n}{2}}dv_g$ where $R(g)$,
$dv_g$ denote the Riemannian curvature and volume form corresponding to $g$. We
show that there are locally symmetric spaces which are unstable critical points
for this functional.
","[{""version"":""v1"",""created"":""Sun, 25 Nov 2012 16:25:07 GMT""}]","2012-11-27"
"1211.5775","Eugene Kogan","E. Kogan","RKKY interaction in gapped or doped graphene","LaTeX, 4 pages. arXiv admin note: substantial text overlap with
  arXiv:1211.3369","Graphene, v.2, 8 (2013)","10.4236/graphene.2013.21002",,"cond-mat.mes-hall cond-mat.stat-mech","http://arxiv.org/licenses/nonexclusive-distrib/1.0/","  In our previous work (E. Kogan, Phys. Rev. B {\bf 84}, 115119 (2011)) we
calculated RKKY interaction between two magnetic impurities in pristine
graphene using the Green's functions (GF) in the coordinate -- imaginary time
representation. Now we show that the calculations of the GF in this
representation can be simplified by using the Feynman's trick, which allows to
easily calculate RKKY interaction in gapped graphene. We also present
calculations of the RKKY interaction in gapped or doped graphene using the
coordinate -- imaginary frequency representation. Both representations,
corresponding to calculation of the bubble diagram in Euclidean space, have an
important advantage over those corresponding to calculation in Minkowskii
space, which are very briefly reviewed in the Appendix to the present work. The
former, in distinction to the latter, operate only with the convergent
integrals from the start to the end of the calculation.
","[{""version"":""v1"",""created"":""Sun, 25 Nov 2012 16:30:32 GMT""}]","2013-01-29"
"1211.5776","Jaime de la Cruz Rodriguez","G.B. Scharmer, J. de la Cruz Rodr\'iguez, P. S\""utterlin, V.M.J.
  Henriques","Opposite polarity field with convective downflow and its relation to
  magnetic spines in a sunspot penumbra","Accepted for publication in A&A (06-March-2013). Minor corrections
  made in this versions",,"10.1051/0004-6361/201220899",,"astro-ph.SR astro-ph.IM","http://arxiv.org/licenses/nonexclusive-distrib/1.0/","  We discuss NICOLE inversions of Fe I 630.15 nm and 630.25 nm Stokes spectra
from a sunspot penumbra recorded with the CRISP imaging spectropolarimeter on
the Swedish 1-m Solar Telescope at a spatial resolution close to 0.15"". We
report on narrow radially extended lanes of opposite polarity field, located at
the boundaries between areas of relatively horizontal magnetic field (the
intra-spines) and much more vertical field (the spines). These lanes harbor
convective downflows of about 1 km/s. The locations of these downflows close to
the spines agree with predictions from the convective gap model (the ""gappy
penumbra"") proposed six years ago, and more recent 3D MHD simulations. We also
confirm the existence of strong convective flows throughout the entire
penumbra, showing the expected correlation between temperature and vertical
velocity, and having vertical RMS velocities of about 1.2 km/s.
","[{""version"":""v1"",""created"":""Sun, 25 Nov 2012 16:31:04 GMT""},{""version"":""v2"",""created"":""Mon, 4 Mar 2013 14:06:50 GMT""},{""version"":""v3"",""created"":""Thu, 4 Apr 2013 08:12:07 GMT""}]","2015-06-12"
"1211.5777","Sharvari Nadkarni-Ghosh","Sharvari Nadkarni-Ghosh and David F. Chernoff","Modelling non-linear evolution using Lagrangian Perturbation Theory
  (LPT) re-expansions","31 pages, 8 figrues, 2 tables. Accepted in MNRAS","MNRAS, Volume 431, Issue 1, p.799-823, May 2013","10.1093/mnras/stt217",,"astro-ph.CO","http://arxiv.org/licenses/nonexclusive-distrib/1.0/","  We present a new method to calculate formation of cosmological structure in
the Newtonian limit. The method is based on Lagrangian perturbation theory plus
two key theoretical extensions. One advance involves identifying and fixing a
previously ignored gauge-like degree of freedom relating quantities calculated
in LPT to those measured by a preferred Friedmann-Robertson-Walker (FRW)
observer. Handling this connection between calculational and observer frames is
physically essential and ensures a momentum conserving description. The second
extension is to systematically re-expand the equations of motion to increase
LPT's radius of convergence to the maximum future time prior to orbit crossing.
The paper implements a complete algorithm and performs extensive ""proof of
principle"" tests of the new method, including direct comparison to known
solutions, evaluation of conserved quantities and formal convergence studies.
All are satisfactory. We show convergence is exponential in grid size and
Lagrangian order and polynomial in step size. There are three {\it powerful
advantages} afforded by the new technique: (1) it employs a smooth
representation of all fields and the results are not limited by particle
induced shot-noise errors, (2) it permits the numerical error to be controlled
by changing Lagrangian order and/or number of steps allowing, in principle,
arbitrarily small errors to be achieved prior to orbit crossing and (3) it
handles generic cold initial data (any periodic density and velocity fields,
including those with initial rotational components). Together, these properties
make the new technique well-suited to handle quasi-linear scales where analytic
methods and/or numerical simulations fail to provide suitably accurate answers.
","[{""version"":""v1"",""created"":""Sun, 25 Nov 2012 16:35:02 GMT""},{""version"":""v2"",""created"":""Thu, 28 Feb 2013 07:35:39 GMT""}]","2014-12-15"
"1211.5778","Neal Jackson","Neal Jackson and I.W.A. Browne (University of Manchester, School of
  Physics & Astronomy, Jodrell Bank Centre for Astrophysics)","Quasar emission lines, radio structures and radio unification","12 pages, 9 figures: accepted by MNRAS",,"10.1093/mnras/sts468",,"astro-ph.CO","http://arxiv.org/licenses/nonexclusive-distrib/1.0/","  Unified schemes of radio sources, which account for different types of radio
AGN in terms of anisotropic radio and optical emission, together with different
orientations of the ejection axis to the line of sight, have been invoked for
many years. Recently, large samples of optical quasars, mainly from the Sloan
Digital Sky Survey, together with large radio samples, such as FIRST, have
become available. These hold the promise of providing more stringent tests of
unified schemes but, compared to previous samples, lack high resolution radio
maps. Nevertheless they have been used to investigate unified schemes, in some
cases yielding results which appear inconsistent with such theories. Here we
investigate using simulations how the selection effects to which such
investigations are subject can influence the conclusions drawn. In particular,
we find that the effects of limited resolution do not allow core-dominated
radio sources to be fully represented in the samples, that the effects of
limited sensitivity systematically exclude some classes of sources and the lack
of deep radio data make it difficult to decide to what extent closely separated
radio sources are associated. Nevertheless, we conclude that relativistic
unified schemes are entirely compatible with the current observational data.
For a sample selected from SDSS and FIRST which includes weak-cored triples we
find that the equivalent width of the [OIII] emission line decreases as
core-dominance increases, as expected, and also that core-dominated quasars are
optically brighter than weak-cored quasars.
","[{""version"":""v1"",""created"":""Sun, 25 Nov 2012 16:50:13 GMT""}]","2015-06-12"
"1211.5779","Cms Collaboration","CMS Collaboration","Search for exotic resonances decaying into WZ/ZZ in pp collisions at
  sqrt(s) = 7 TeV","Replaced with published version. Added journal reference and DOI","JHEP 02 (2013) 036","10.1007/JHEP02(2013)036","CMS-EXO-12-014, CERN-PH-EP-2012-312","hep-ex","http://arxiv.org/licenses/nonexclusive-distrib/1.0/","  A search for new exotic particles decaying to the VZ final state is
performed, where V is either a W or a Z boson decaying into two overlapping
jets and the Z decays into a pair of electrons, muons or neutrinos. The
analysis uses a data sample of pp collisions corresponding to an integrated
luminosity of 5 inverse femtobarns collected by the CMS experiment at the LHC
at sqrt(s) = 7 TeV in 2011. No significant excess is observed in the mass
distribution of the VZ candidates compared with the background expectation from
standard model processes. Model-dependent upper limits at the 95% confidence
level are set on the product of the cross section times the branching fraction
of hypothetical particles decaying to the VZ final state as a function of mass.
Sequential standard model W' bosons with masses between 700 and 940 GeV are
excluded. In the Randall-Sundrum model for graviton resonances with a coupling
parameter of 0.05, masses between 750 and 880 GeV are also excluded.
","[{""version"":""v1"",""created"":""Sun, 25 Nov 2012 16:58:09 GMT""},{""version"":""v2"",""created"":""Wed, 13 Mar 2013 10:14:38 GMT""}]","2013-03-14"
"1211.5780","Wei Yi","Fan Wu, Guang-Can Guo, Wei Zhang, Wei Yi","Unconventional superfluid in a two-dimensional Fermi gas with
  anisotropic spin-orbit coupling and Zeeman fields","7 pages, 6 figures. with updated figures and discussions","Phys. Rev. Lett. 110, 110401 (2013)","10.1103/PhysRevLett.110.110401",,"cond-mat.quant-gas cond-mat.str-el","http://arxiv.org/licenses/nonexclusive-distrib/1.0/","  We study the phase diagram of a two-dimensional ultracold Fermi gas with the
synthetic spin-orbit coupling (SOC) that has recently been realized at NIST.
Due to the coexistence of anisotropic SOC and effective Zeeman fields in the
NIST scheme, the system shows rich structure of phase separation involving
exotic gapless superfluid and Fulde-Ferrell-Larkin-Ovchinnikov (FFLO) pairing
states with different center-of-mass momentum. In particular, we characterize
the stability region of FFLO states and demonstrate their unique features under
SOC. We then show that the effective transverse Zeeman field in the NIST scheme
can qualitatively change the landscape of the thermodynamic potential which
leads to intriguing effects such as the disappearance of pairing instability,
the competition between different FFLO states, and the stabilization of a fully
gapped FFLO state. These interesting features may be probed for example by
measuring the in-situ density profiles or by the momentum-resolved
radio-frequency spectroscopy.
","[{""version"":""v1"",""created"":""Sun, 25 Nov 2012 17:02:45 GMT""},{""version"":""v2"",""created"":""Wed, 5 Dec 2012 09:57:29 GMT""},{""version"":""v3"",""created"":""Mon, 4 Feb 2013 19:49:40 GMT""}]","2013-03-15"
"1211.5781","Riccardo Benini","Giovanni Montani and Riccardo Benini","Crystalline Structure of Accretion Disks: Features of the Global Model","13 pages, 8 figures","Phys. Rev. E 84, 026406 (2011)","10.1103/PhysRevE.84.026406",,"astro-ph.HE physics.plasm-ph","http://arxiv.org/licenses/nonexclusive-distrib/1.0/","  In this paper, we develop the analysis of a two-dimensional
magnetohydrodynamical configuration for an axially symmetric and rotating
plasma (embedded in a dipole like magnetic field), modeling the structure of a
thin accretion disk around a compact astrophysical object. Our study
investigates the global profile of the disk plasma, in order to fix the
conditions for the existence of a crystalline morphology and ring sequence, as
outlined by the local analysis pursued in [1, 2]. In the linear regime, when
the electromagnetic back-reaction of the plasma is small enough, we show the
existence of an oscillating radial behavior for the flux surface function which
very closely resembles the one outlined in the local model, apart from a radial
modulation of the amplitude. In the opposite limit, corresponding to a dominant
back-reaction in the magnetic structure over the field of central object, we
can recognize the existence of a ring-like decomposition of the disk, according
to the same modulation of the magnetic flux surface, and a smoother radial
decay of the disk density, with respect to the linear case. In this extreme
non-linear regime, the global model seems to predict a configuration very close
to that of the local analysis, but here the thermostatic pressure, crucial for
the equilibrium setting, is also radially modulated. Among the conditions
requested for the validity of such a global model, the confinement of the
radial coordinate within a given value sensitive to the disk temperature and to
the mass of the central objet, stands; however, this condition corresponds to
dealing with a thin disk configuration.
","[{""version"":""v1"",""created"":""Sun, 25 Nov 2012 17:03:12 GMT""}]","2015-06-12"
"1211.5782","Jaroslav Chovan","J. Chovan, M. Marder and N. Papanicolaou","Field induced phase transitions in the helimagnet Ba2CuGe2O7","17 pages, 14 figures. Corrected typos in the abstract","Physical Review B 88, 064421 (2013)","10.1103/PhysRevB.88.064421",,"cond-mat.str-el","http://arxiv.org/licenses/nonexclusive-distrib/1.0/","  We present a theoretical study of the two-dimensional spiral antiferromagnet
Ba2CuGe2O7 in the presence of an external magnetic field. We employ a suitable
nonlinear sigma model to calculate the T=0 phase diagram and the associated
low-energy spin dynamics for arbitrary canted fields, in general agreement with
experiment. In particular, when the field is applied parallel to the c axis, a
previously anticipated Dzyaloshinskii-type incommensurate-to-commensurate phase
transition is actually mediated by an intermediate phase, in agreement with our
earlier theoretical prediction confirmed by the recent observation of the
so-called double-k structure. The sudden pi/2 rotations of the magnetic
structures observed in experiment are accounted for by a weakly broken U(1)
symmetry of our model. Finally, our analysis suggests a nonzero
weak-ferromagnetic component in the underlying Dzyaloshinskii-Moriya
anisotropy, which is important for quantitative agreement with experiment.
","[{""version"":""v1"",""created"":""Sun, 25 Nov 2012 17:06:05 GMT""},{""version"":""v2"",""created"":""Sat, 29 Jun 2013 19:10:58 GMT""},{""version"":""v3"",""created"":""Thu, 4 Jul 2013 18:43:50 GMT""}]","2013-09-02"
"1211.5783","Marcus A. C. Torres","Henrique Boschi-Filho, Nelson R. F. Braga, Matthias Ihl, Marcus A. C.
  Torres","Towards Relativistic Skyrmions","7 pages, 7th Conference Mathematical Methods in Physics - Londrina
  2012, Rio de Janeiro, Brazil",,,,"hep-th","http://arxiv.org/licenses/nonexclusive-distrib/1.0/","  We revisit baryons in the Skyrme model. Starting from static baryons in the
helicity eigenstates, we generalize their wavefunctions to the non-static and
relativistic regime. A new representation for gamma matrices in the soliton
collective space is constructed and the corresponding Dirac equation is
obtained. As an example, we draw consideration on how to apply this new
representation on the calculus of vector current vacuum expectation values for
baryon states of spin and isospin half and arbitrary momenta and we show how
elastic form factors can be derived.
","[{""version"":""v1"",""created"":""Sun, 25 Nov 2012 17:06:43 GMT""}]","2012-11-27"
"1211.5784","Maria Barbero-Li\~nan","M. Barbero-Li\~n\'an, B. Jakubczyk","Second order conditions for optimality and local controllability of
  discrete-time systems","22 pages. 2nd version",,,,"math.OC","http://arxiv.org/licenses/nonexclusive-distrib/1.0/","  We study local controllability and optimal control problems for invertible
discrete-time control systems. We present second order necessary conditions for
optimality and sufficient conditions for local controllability. The conditions
are stated in geometric terms, using vector fields naturally associated to the
system. The Hessian of the optimal problem is computed in terms of Lie brackets
of vector fields of the system.
","[{""version"":""v1"",""created"":""Sun, 25 Nov 2012 17:22:14 GMT""},{""version"":""v2"",""created"":""Mon, 28 Jan 2013 22:11:01 GMT""}]","2013-01-30"
"1211.5785","Michael Gronau","Michael Gronau, David London and Jonathan L. Rosner","Rescattering Contributions to rare B-Meson Decays","Note, two references and acknowledgement added",,"10.1103/PhysRevD.87.036008",,"hep-ph hep-ex","http://arxiv.org/licenses/nonexclusive-distrib/1.0/","  Several $B$ and $B_s$ decays have been observed which have been cited as
evidence for exchange ($E$), penguin annihilation ($PA$) and annihilation ($A$)
processes, such as $\bar b d \to \bar u u$, $\bar b s \to \bar u u$ and $\bar b
u \to W^* \to \bar c s$, respectively. These amplitudes are normally thought to
be suppressed, as they involve the spectator quark in the weak interaction and
thus should be proportional to the $B$-meson decay constant $f_B$. However, as
pointed out a number of years ago, they can also be generated by rescattering
from processes whose amplitudes do not involve $f_B$, such as color-favored
tree amplitudes. In this paper we investigate a number of processes such as
$B^0 \to K^+ K^-$, $B_s \to \pi^+ \pi^-$, and $B^+ \to D_s^+ \phi$, and
identify promising states from which they can be generated by rescattering. We
find that $E$ and $PA$-type processes are characterized respectively by
amplitudes ranging from 5% to 10% and from 15% to 20% with respect to the
largest amplitude from which they can rescatter. Based on this regularity,
using approximate flavor SU(3) symmetry in some cases and time-reversal
invariance in others, we predict the branching fractions for a large number of
as-yet-unseen $B$ and $B_s$ decays in an extensive range from order $10^{-9}$
to $10^{-4}$.
","[{""version"":""v1"",""created"":""Sun, 25 Nov 2012 17:32:01 GMT""},{""version"":""v2"",""created"":""Sat, 1 Dec 2012 07:53:13 GMT""}]","2015-06-12"
"1211.5786","Konstantin Pankrashkin","Denis Borisov and Konstantin Pankrashkin","Quantum waveguides with small periodic perturbations: gaps and edges of
  Brillouin zones","15 pages","J. Phys. A: Math. Theor. 46 (2013) 235203","10.1088/1751-8113/46/23/235203",,"math-ph math.MP","http://arxiv.org/licenses/nonexclusive-distrib/1.0/","  We consider small perturbations of the Laplace operator in a
multi-dimensional cylindrical domain by second order differential operators
with periodic coefficients. We show that under certain non-degeneracy
conditions such perturbations can open a gap in the continuous spectrum and
give the leading asymptotic terms for the gap edges. We also estimate the
values of quasi-momentum at which the spectrum edges are attained. The general
machinery is illustrated by several new examples in two- and three-dimensional
structures.
","[{""version"":""v1"",""created"":""Sun, 25 Nov 2012 17:40:32 GMT""},{""version"":""v2"",""created"":""Mon, 8 Apr 2013 09:56:03 GMT""}]","2013-05-29"
