"1209.2269","Ignasi Rosell","Ignasi Rosell","The oblique S parameter in higgsless electroweak models","5 pages, 2 figures. Talk given at QCD@work 2012, International
  Workshop on Quantum Chromodynamics: Theory and Experiment, 18-21th June
  (2012), Lecce (Italy)",,"10.1063/1.4763490","IFIC/12-64","hep-ph","http://arxiv.org/licenses/nonexclusive-distrib/1.0/","  We present a one-loop calculation of the oblique S parameter within Higgsless
models of electroweak symmetry breaking. We have used a general effective
Lagrangian with at most two derivatives, implementing the chiral symmetry
breaking SU(2)_L x SU(2)_R -> SU(2)_{L+R} with Goldstones, gauge bosons and one
multiplet of vector and axial-vector resonances. The estimation is based on the
short-distance constraints and the dispersive approach proposed by Peskin and
Takeuchi.
","[{""version"":""v1"",""created"":""Tue, 11 Sep 2012 09:30:50 GMT""}]","2015-06-11"
"1209.2270","Marcello Baldo Dr.","M. Baldo and H.R. Moshfegh","Correlations in Nuclear Matter","11 figures","PRC86, 024306(2012)","10.1103/PhysRevC.86.024306",,"nucl-th astro-ph.HE","http://arxiv.org/licenses/nonexclusive-distrib/1.0/","  We analyze the nuclear matter correlation properties in terms of the pair
correlation function. To this aim we systematically compare the results for the
variational method in the Lowest Order Constrained Variational (LOCV)
approximation and for the Bruekner-Hartree-Fock (BHF) scheme. A formal link
between the Jastrow correlation factor of LOCV and the Defect Function (DF) of
BHF is established and it is shown under which conditions and approximations
the two approaches are equivalent. From the numerical comparison it turns out
that the two correlation functions are quite close, which indicates in
particular that the DF is approximately local and momentum independent. The
Equations of State (EOS) of Nuclear Matter in the two approaches are also
compared. It is found that once the three-body forces (TBF) are introduced the
two EOS are fairly close, while the agreement between the correlation functions
holds with or without TBF.
","[{""version"":""v1"",""created"":""Tue, 11 Sep 2012 09:34:24 GMT""}]","2015-06-11"
"1209.2271","Reza Rashidi","Reza Rashidi","Removing the Big Bang Singularity: The role of the generalized
  uncertainty principle in quantum gravity","8 pages, Accepted for publication in Astrophysics & Space Science","Astrophysics and Space Science, 343 (2013) 383-390","10.1007/s10509-012-1248-6",,"astro-ph.CO gr-qc","http://arxiv.org/licenses/nonexclusive-distrib/1.0/","  The possibility of avoiding the big bang singularity by means of a
generalized uncertainty principle is investigated. In relation with this
matter, the statistical mechanics of a free-particle system obeying the
generalized uncertainty principle is studied and it is shown that the entropy
of the system has a finite value in the infinite temperature limit. It is then
argued that negative temperatures and negative pressures are possible in this
system. Finally, it is shown that this model can remove the big bang
singularity.
","[{""version"":""v1"",""created"":""Tue, 11 Sep 2012 09:35:05 GMT""}]","2017-01-17"
"1209.2272","Stefan Gillessen","S. Gillessen, R. Genzel, T.K. Fritz, F. Eisenhauer, O. Pfuhl, T. Ott,
  J. Cuadra, M. Schartmann, and A. Burkert","New observations of the gas cloud G2 in the Galactic Center","submitted to ApJ",,"10.1088/0004-637X/763/2/78",,"astro-ph.GA","http://arxiv.org/licenses/nonexclusive-distrib/1.0/","  We present new observations of the recently discovered gas cloud G2 currently
falling towards the massive black hole in the Galactic Center. The new data
confirm that G2 is on a highly elliptical orbit with a predicted pericenter
passage mid 2013. The updated orbit has an even larger eccentricity of 0.966,
an epoch of pericenter two months later than estimated before, and a nominal
minimum distance of 2200 Schwarzschild radii only. The velocity gradient of G2
has developed further to 600 km/s FWHM in summer 2012. We also detect the tail
of similar total flux and on the same orbit as G2 along the trajectory at high
significance. No hydrodynamic effects are detected yet, since the simple model
of a tidally shearing gas cloud still describes the data very well. The flux of
G2 has not changed by more than 10% between 2008 and 2012, disfavoring models
where additional gas from a reservoir is released to the disrupting diffuse gas
component.
","[{""version"":""v1"",""created"":""Tue, 11 Sep 2012 09:43:27 GMT""}]","2015-06-11"
"1209.2273","Jose A. Pons","Jose A. Pons, Daniele Vigano, and Ulrich Geppert","Pulsar timing irregularities and the imprint of magnetic field evolution","7 pages, 5 figures, accepted for publication in Astronomy &
  Astrophysics (submitted July 24, 2012)","Astronomy & Astrophysics, 547 (2012) A9","10.1051/0004-6361/201220091",,"astro-ph.SR","http://arxiv.org/licenses/nonexclusive-distrib/1.0/","  (Abridged) The rotational evolution of isolated neutron stars is dominated by
the magnetic field anchored to the solid crust of the star. Assuming that the
core field evolves on much longer timescales, the crustal field evolves mainly
though Ohmic dissipation and the Hall drift, and it may be subject to
relatively rapid changes with remarkable effects on the observed timing
properties. We investigate whether changes of the magnetic field structure and
strength during the star evolution may have observable consequences in the
braking index, which is the most sensitive quantity to reflect small variations
of the timing properties that are caused by magnetic field rearrangements. By
performing axisymmetric, long-term simulations of the magneto-thermal evolution
of neutron stars with state-of-the-art microphysical inputs, we find that the
effect of the magnetic field evolution on the braking index can be divided into
three qualitatively different stages depending on the age and the internal
temperature: a first stage that may be different for standard pulsars (with
n~3) or low field neutron stars that accreted fallback matter during the
supernova explosion (systematically n<3); in a second stage, the evolution is
governed by almost pure Ohmic field decay, and a braking index n>3 is expected;
in the third stage, at late times, when the interior temperature has dropped to
very low values, Hall oscillatory modes in the neutron star crust result in
braking indices of high absolute value and both positive and negative signs.
Models with strong (1e14 G) multipolar or toroidal components, even with a weak
(~1e12 G) dipolar field are consistent with the observed trend of the timing
properties.
","[{""version"":""v1"",""created"":""Tue, 11 Sep 2012 09:56:32 GMT""}]","2013-06-11"
"1209.2274","Reza Tavoli","Reza Tavoli, Fariborz Mahmoudi","PCA-Based Relevance Feedback in Document Image Retrieval",,"IJCSI International Journal of Computer Science Issues, Vol. 9,
  Issue 4, No 2, July 2012",,,"cs.IR","http://arxiv.org/licenses/nonexclusive-distrib/1.0/","  Research has been devoted in the past few years to relevance feedback as an
effective solution to improve performance of information retrieval systems.
Relevance feedback refers to an interactive process that helps to improve the
retrieval performance. In this paper we propose the use of relevance feedback
to improve document image retrieval System (DIRS) performance. This paper
compares a variety of strategies for positive and negative feedback. In
addition, feature subspace is extracted and updated during the feedback process
using a Principal Component Analysis (PCA) technique and based on user's
feedback. That is, in addition to reducing the dimensionality of feature
spaces, a proper subspace for each type of features is obtained in the feedback
process to further improve the retrieval accuracy. Experiments show that using
relevance Feedback in DIR achieves better performance than common DIR.
","[{""version"":""v1"",""created"":""Tue, 11 Sep 2012 10:02:47 GMT""}]","2012-09-12"
"1209.2275","Jingwei Liu","Jingwei Liu","Inequality for Variance of Weighted Sum of Correlated Random Variables
  and WLLN",,,,,"math.PR math.ST stat.TH","http://arxiv.org/licenses/nonexclusive-distrib/1.0/","  The upper bound inequality for variance of weighted sum of correlated random
variables is derived according to Cauchy-Schwarz's inequality, while the
weights are non-negative with sum of 1. We also give a novel proof with
positive semidefinite matrix method. And the variance inequality of sum of
correlated random variable with general weights is also obtained. Then, the
variance inequalities are applied to the Chebyshev's inequality and sufficient
condition of weak law of large numbers (WLLN) for sum of correlated random
variables .
","[{""version"":""v1"",""created"":""Tue, 11 Sep 2012 10:04:33 GMT""},{""version"":""v2"",""created"":""Tue, 25 Sep 2012 18:24:41 GMT""},{""version"":""v3"",""created"":""Wed, 3 Oct 2012 15:27:22 GMT""},{""version"":""v4"",""created"":""Thu, 4 Oct 2012 11:40:25 GMT""},{""version"":""v5"",""created"":""Sat, 13 Oct 2012 15:28:18 GMT""},{""version"":""v6"",""created"":""Sun, 23 Dec 2012 14:17:45 GMT""},{""version"":""v7"",""created"":""Sat, 29 Dec 2012 16:39:47 GMT""},{""version"":""v8"",""created"":""Wed, 17 Dec 2014 00:34:33 GMT""}]","2014-12-18"
"1209.2276","Danilo Babusci","D. Babusci, G. Dattoli, M. Quattromini, P. E. Ricci","Dirac factorization and fractional calculus","7 pages",,,,"math-ph hep-th math.MP","http://arxiv.org/licenses/nonexclusive-distrib/1.0/","  We show that the Dirac factorization method can be successfully employed to
treat problems involving operators raised to a fractional power. The technique
we adopt is based on an extension of the Pauli matrices and the properties of
the roots of unity. We also comment about the possibility of using the method
to linearize evolution equations containing the $n$-th root of differential
operators and make a comparison with other techniques involving suitable
transforms.
","[{""version"":""v1"",""created"":""Tue, 11 Sep 2012 10:06:18 GMT""}]","2012-09-12"
"1209.2277","Qing-Guo Huang","Ki-Young Choi and Qing-Guo Huang","Can Standard Model Higgs Seed the Formation of Structures in Our
  Universe?","12 pages; version accepted for publication in Phys.Rev.D","Physical Review D 87, 043501(2013)","10.1103/PhysRevD.87.043501",,"hep-ph astro-ph.CO hep-th","http://arxiv.org/licenses/nonexclusive-distrib/1.0/","  We study the Standard Model Higgs field as a source for the primordial
curvature perturbation, particularly in the curvaton and modulated reheating
scenario. We conclude that the Higgs cannot play as a curvaton due to the small
energy density when it decays, however the modulated reheating by Higgs can be
a viable scenario. In the latter case, the non-Gaussianity is inevitably
generated and strongly constrains the type of potential of inflaton field and
Higgs-dependent interaction term. For the quadratic potential of the inflaton
field with decay rate which non-linearly depends on the Higgs vacuum
expectation value, the contribution of Higgs field to the primordial curvature
perturbation must be less than 8%.
","[{""version"":""v1"",""created"":""Tue, 11 Sep 2012 10:08:50 GMT""},{""version"":""v2"",""created"":""Sat, 19 Jan 2013 01:17:46 GMT""}]","2015-06-11"
"1209.2278","Juan Poyatos","Djordje Baji\'c and Juan F. Poyatos","Balancing noise and plasticity in eukaryotic gene expression",,"BMC Genomics. 2012 Jul 27;13(1):343",,,"q-bio.GN q-bio.MN","http://arxiv.org/licenses/nonexclusive-distrib/1.0/","  Coupling the control of expression stochasticity (noise) to the ability of
expression change (plasticity) can alter gene function and influence
adaptation. A number of factors, such as transcription re-initiation, strong
chromatin regulation or genome neighboring organization, underlie this
coupling. However, these factors do not necessarily combine in equivalent ways
and strengths in all genes. Can we identify then alternative architectures that
modulate in distinct ways the linkage of noise and plasticity? Here we first
show that strong chromatin regulation, commonly viewed as a source of coupling,
can lead to plasticity without noise. The nature of this regulation is relevant
too, with plastic but noiseless genes being subjected to general activators
whereas plastic and noisy genes experience more specific repression.
Contrarily, in genes exhibiting poor transcriptional control, it is
translational efficiency what separates noise from plasticity, a pattern
related to transcript length. This additionally implies that genome neighboring
organization -as modifier- appears only effective in highly plastic genes. In
this class, we confirm bidirectional promoters (bipromoters) as a configuration
capable to reduce coupling by abating noise but also reveal an important
trade-off, since bipromoters also decrease plasticity. This presents ultimately
a paradox between intergenic distances and modulation, with short intergenic
distances both associated and disassociated to noise at different plasticity
levels. Balancing the coupling among different types of expression variability
appears as a potential shaping force of genome regulation and organization.
This is reflected in the use of different control strategies at genes with
different sets of functional constraints.
","[{""version"":""v1"",""created"":""Tue, 11 Sep 2012 10:15:10 GMT""}]","2012-09-12"
"1209.2279","Chris Parker","Chris Parker","The commuting graph of a soluble group",,,"10.1112/blms/bdt005",,"math.GR","http://arxiv.org/licenses/nonexclusive-distrib/1.0/","  The commuting graph of a finite soluble group with trivial centre is
investigated. It is shown that the diameter of such a graph is at most 8 or the
graph is disconnected. Examples of soluble groups with trivial centre and
commuting graph of diameter 8 are provided.
","[{""version"":""v1"",""created"":""Tue, 11 Sep 2012 10:20:06 GMT""}]","2014-02-26"
"1209.2280","Andrey Pryamikov","Andrey D. Pryamikov","The core modes of all solid photonic band gap fibers as bound states in
  the continuum",,,,,"physics.optics","http://arxiv.org/licenses/nonexclusive-distrib/1.0/","  In this paper we propose a new hypothesis of out of plane band gap formation
in all solid photonic band gap (PBG) fibers. At first, one considers the
process of the core modes formation as a result of excitation of continuous
mode spectrum of single dielectric rod of the cladding. It is shown that the
core modes can be considered as transverse resonance of a set of the radiation
modes decoupled from the continuum provided that the phase matching condition
for the propagation constants are fulfilled. An analogy between the core mode
formation in all solid PBG fibers and formation of bound states in the
continuum in photonics are drawn. Based on these conclusions, the light guiding
in all solid PBG fiber with disordered cladding structure and quasi 3D photonic
band gap formation in all solid PBG fibers with a small index (1%) can be
explained.
","[{""version"":""v1"",""created"":""Tue, 11 Sep 2012 10:21:52 GMT""}]","2012-09-12"
"1209.2281","Aurelio Hierro-Rodriguez A. Hierro-Rodriguez","A. Hierro-Rodriguez, R. Cid, M. V\'elez, G. Rodriguez-Rodriguez, J. I.
  Mart\'in, L. M. \'Alvarez-Prado and J. M. Alameda","Topological defects and misfit strain in magnetic stripe domains of
  lateral multilayers with perpendicular magnetic anisotropy",,"PRL 109, 117202 (2012)","10.1103/PhysRevLett.109.117202",,"cond-mat.mtrl-sci","http://arxiv.org/licenses/nonexclusive-distrib/1.0/","  Stripe domains are studied in perpendicular magnetic anisotropy films
nanostructured with a periodic thickness modulation that induces the lateral
modulation of both stripe periods and inplane magnetization. The resulting
system is the 2D equivalent of a strained superlattice with properties
controlled by interfacial misfit strain within the magnetic stripe structure
and shape anisotropy. This allows us to observe, experimentally for the first
time, the continuous structural transformation of a grain boundary in this 2D
magnetic crystal in the whole angular range. The magnetization reversal process
can be tailored through the effect of misfit strain due to the coupling between
disclinations in the magnetic stripe pattern and domain walls in the in-plane
magnetization configuration.
","[{""version"":""v1"",""created"":""Tue, 11 Sep 2012 10:23:16 GMT""}]","2012-09-13"
"1209.2282","Maxim Lyutikov","Maxim Lyutikov (Purdue University, Osservatorio Astrofisico di
  Arcetri)","IC model of pulsar high energy emission","Proceedings, 5th International Symposium on High-Energy Gamma-Ray
  Astronomy, (Gamma2012) Heidelberg, Germany, July 9-13th, 2012",,"10.1063/1.4772260",,"astro-ph.HE","http://arxiv.org/licenses/nonexclusive-distrib/1.0/","  We discuss growing evidence that pulsar high energy is emission is generated
via Inverse Compton mechanism. We reproduce the broadband spectrum of Crab
pulsar, from UV to very high energy gamma-rays - nearly ten decades in energy,
within the framework of the cyclotron-self-Compton model. Emission is produced
by two counter-streaming beams within the outer gaps, at distances above ~ 20
NS radii. The outward moving beam produces UV-X-ray photons via Doppler-booster
cyclotron emission, and GeV photons by Compton scattering the cyclotron photons
produced by the inward going beam. The scattering occurs in the deep
Klein-Nishina regime, whereby the IC component provides a direct measurement of
particle distribution within the magnetosphere. The required plasma
multiplicity is high, ~ 10^6-10^7, but is consistent with the average particle
flux injected into the pulsar wind nebula.
","[{""version"":""v1"",""created"":""Tue, 11 Sep 2012 10:28:56 GMT""}]","2015-06-11"
"1209.2283","Seamus O'Shea Msci","Seamus O'Shea","Stably free modules over virtually free groups","9 pages. The final publication is available at
  http://www.springerlink.com doi:10.1007/s00013-012-0432-9","S. O'Shea, Arch. Math. (2012)","10.1007/s00013-012-0432-9",,"math.RA","http://arxiv.org/licenses/nonexclusive-distrib/1.0/","  Let $F_m$ be the free group on $m$ generators and let $G$ be a finite
nilpotent group of non square-free order; we show that for each $m\ge 2$ the
integral group ring ${\bf Z}[G\times F_m]$ has infinitely many stably free
modules of rank 1.
","[{""version"":""v1"",""created"":""Tue, 11 Sep 2012 10:40:17 GMT""}]","2012-09-12"
"1209.2284","Anatoliy Ostapenko","A.I. Liutuy, L.N. Glushko, A.A. Ostapenko","Calculation of real gas pressures using modified functions of
  probability distributions",,,,,"cond-mat.stat-mech","http://arxiv.org/licenses/nonexclusive-distrib/1.0/","  We have improved the procedure for calculating distribution functions and the
thermal equation of state for real gases by introducing modified functions of
probability distributions into the gas phase state sum. Calculation of real gas
pressure and the grand canonical partition function using the improved
procedure demonstrate that numerical difficulties arising from a large number
of state variables can be circumvented. We have also calculated real gas
isotherms and probability of vaporization in phase equilibrium.
","[{""version"":""v1"",""created"":""Tue, 11 Sep 2012 11:17:04 GMT""}]","2012-09-12"
"1209.2285","Duanlu Zhou","Yang Liu, Yu Guo, D.L. Zhou","Optimal transfer of an unknown state via a bipartite operation","6 pages, 1 figure","EPL 102 (2013) 50003","10.1209/0295-5075/102/50003",,"quant-ph","http://arxiv.org/licenses/nonexclusive-distrib/1.0/","  A fundamental task in quantum information science is to transfer an unknown
state from particle $A$ to particle $B$ (often in remote space locations) by
using a bipartite quantum operation $\mathcal{E}^{AB}$. We suggest the power of
$\mathcal{E}^{AB}$ for quantum state transfer (QST) to be the maximal average
probability of QST over the initial states of particle $B$ and the
identifications of the state vectors between $A$ and $B$. We find the QST power
of a bipartite quantum operations satisfies four desired properties between two
$d$-dimensional Hilbert spaces. When $A$ and $B$ are qubits, the analytical
expressions of the QST power is given. In particular, we obtain the exact
results of the QST power for a general two-qubit unitary transformation.
","[{""version"":""v1"",""created"":""Tue, 11 Sep 2012 11:18:28 GMT""}]","2015-06-11"
"1209.2286","Meysam Bagheri Tagani","M. Bagheri Tagani, H. Rahimpour Soleimani","Phonon-assisted thermoelectric effects in a two-level molecule","13 pages, 6 figures",,"10.1016/j.physb.2013.01.007",,"cond-mat.mes-hall","http://arxiv.org/licenses/nonexclusive-distrib/1.0/","  Thermoelectric properties of a two-level molecule attached to the metallic
electrodes are analyzed using the equation of motion technique within the Green
function formalism. Results show that the electrical conductance is strongly
dependent on the electron and phonon temperatures and the electron-phonon
coupling strength. In addition, it is observed that the thermal conductance
peaks in the electron-hole symmetry points are vanished in the presence of the
strong electron-phonon interaction. It is also found that the figure of merit
is strongly suppressed in the strong electron-phonon interaction. The violation
of the Wiedemann-Franz law is also observed coming from the Coulomb
interactions.
","[{""version"":""v1"",""created"":""Tue, 11 Sep 2012 11:21:24 GMT""}]","2015-06-11"
"1209.2287","Gerhard Keller","Gerhard Keller","Stability index for chaotically driven concave maps",,"Journal of the London Mathematical Society 89 (2014), 603-622","10.1112/jlms/jdt070",,"math.DS nlin.CD","http://arxiv.org/licenses/nonexclusive-distrib/1.0/","  We study skew product systems driven by a hyperbolic base map S (e.g. a baker
map or an Anosov surface diffeomorphism) and with simple concave fibre maps on
an interval [0,a] like h(x)=g(\theta) tanh(x) where g(\theta) is a factor
driven by the base map. The fibre-wise attractor is the graph of an upper
semicontinuous function \phi(\theta). For many choices of the function g, \phi
has a residual set of zeros but \phi>0 almost everywhere w.r.t. the
Sinai-Ruelle-Bowen measure of S^(-1).
  In such situations we evaluate the stability index of the global attractor of
the system, which is the subgraph of \phi, at all regular points (\theta,0) in
terms of the local exponents \Gamma(\theta):=\lim_{n\to\infty} 1/n log
g_n(\theta) and \Lambda(\theta):=\lim_{n\to\infty} 1/n\log|D_u S^{-n}(\theta)|
and of the positive zero s_* of a certain thermodynamic pressure function
associated with S^(-1) and g. (In queuing theory, an analogon of s_* is known
as Loyne's exponent.)
  The stability index was introduced by Podvigina and Ashwin in 2011 to
quantify the local scaling of basins of attraction.
","[{""version"":""v1"",""created"":""Tue, 11 Sep 2012 11:24:38 GMT""}]","2017-01-16"
"1209.2288","Mauricio  Martinez","N\'estor Armesto, Hao Ma, Mauricio Martinez, Yacine Mehtar-Tani,
  Carlos A. Salgado","Coherence and broadening effects in medium induced gluon radiation","4 pages. To appear in the Proceedings of the conference Hard Probes
  2012 - Sardinia - Italy - May 27 -June 1 2012",,,,"hep-ph","http://arxiv.org/licenses/nonexclusive-distrib/1.0/","  Interferences between different emitters in the multi-parton shower is the
building block of QCD jet physics in vacuum. The presence of a hot medium made
of quarks and gluons is expected to alter this interference pattern. To study
such effects, we derive the gluon emission spectrum off an ""asymptotic quark""
traversing a hot and dense QCD medium at first order in the medium density. The
resulting induced gluon distribution gets modified when the new interference
terms between the initial and final quark are included. We comment on the
possible phenomenological consequences of this new contribution for jet
observables in heavy-ion collisions.
","[{""version"":""v1"",""created"":""Tue, 11 Sep 2012 11:27:43 GMT""},{""version"":""v2"",""created"":""Fri, 21 Sep 2012 16:54:13 GMT""}]","2012-09-24"
"1209.2289","Vadim Malyshev","V. A. Malyshev","Self-organized circular flow of classical point particles",,"Journal of Mathematical Physics, 2013, v. 54, No. 023301","10.1063/1.4789542",,"math-ph math.CA math.MP","http://arxiv.org/licenses/nonexclusive-distrib/1.0/","  We consider newtonian dynamics of $N$ charged particles on the circle with
nearest neigbour interaction with Coulomb repulsive potential $r^{-1}$ . Also
there is an external accelerating force which is nonzero only on a small part
of the circle. We construct homogeneous solutions where the velocities of all
particles are approximately equal and their density is approximately uniform.
This gives a qualitative mathematical model for some features of the direct
electric current (DC), in agreement with a suggestion by R. Feynman.
","[{""version"":""v1"",""created"":""Tue, 11 Sep 2012 11:38:37 GMT""}]","2016-11-02"
