"1209.2128","Hyosun Kim","Hyosun Kim (ASIAA), and Ronald E. Taam (ASIAA, Northwestern
  University)","Wide Binary Effects on Asymmetries in Asymptotic Giant Branch
  Circumstellar Envelopes","33 pages, 11 figures, 4 tables, accepted for publication in the
  Astrophysical Journal",,"10.1088/0004-637X/759/1/59",,"astro-ph.SR","http://arxiv.org/licenses/nonexclusive-distrib/1.0/","  Observations of increasingly higher spatial resolution reveal the existence
of asymmetries in the circumstellar envelopes of a small fraction of asymptotic
giant branch (AGB) stars. Although there is no general consensus for their
origin, a binary companion star may be responsible. Within this framework, we
investigate the gravitational effects associated with a sufficiently wide
binary system, where Roche lobe overflow is unimportant, on the outflowing
envelopes of AGB stars using three dimensional hydrodynamic simulations. The
effects due to individual binary components are separately studied, enabling
investigation of the stellar and circumstellar characteristics in detail. The
reflex motion of the AGB star alters the wind velocity distribution, thereby,
determining the overall shape of the outflowing envelope. On the other hand,
the interaction of the companion with the envelope produces a gravitational
wake, which exhibits a vertically thinner shape. The two patterns overlap and
form clumpy structures. To illustrate the diversity of shapes, we present the
numerical results as a function of inclination angle. Not only is spiral
structure produced by the binary interaction, but arc patterns are also found
that represent the former structure when viewed at different inclinations. The
arcs reveal a systematic shift of their centers of curvature for cases when the
orbital speed of the AGB star is comparable to its wind speed. They take on the
shape of a peanut for inclinations nearly edge-on. In the limit of slow orbital
motion of the AGB star relative to the wind speed, the arc pattern becomes
nearly spherically symmetric. We find that the aspect ratio of the overall
oblate shape of the pattern is an important diagnostic probe of the binary as
it can be used to constrain the orbital velocity of the AGB star, and moreover
the binary mass ratio.
","[{""version"":""v1"",""created"":""Mon, 10 Sep 2012 20:00:14 GMT""}]","2015-06-11"
"1209.2129","Aaron Boley","M. Galvagni, T. Hayfield, A. C. Boley, L. Mayer, R. Roskar, and P.
  Saha","The collapse of protoplanetary clumps formed through disc instability:
  3D simulations of the pre-dissociation phase","Accepted for publication in MNRAS",,"10.1111/j.1365-2966.2012.22096.x",,"astro-ph.EP","http://arxiv.org/licenses/nonexclusive-distrib/1.0/","  We present 3D smoothed particle hydrodynamics simulations of the collapse of
clumps formed through gravitational instability in the outer part of a
protoplanetary disc. The initial conditions are taken directly from a global
disc simulation, and a realistic equation of state is used to follow the clumps
as they contract over several orders of magnitude in density, approaching the
molecular hydrogen dissociation stage. The effects of clump rotation,
asymmetries, and radiative cooling are studied. Rotation provides support
against fast collapse, but non-axisymmetric modes develop and efficiently
transport angular momentum outward, forming a circumplanetary disc. This
transport helps the clump reach the dynamical collapse phase, resulting from
molecular hydrogen dissociation, on a thousand-year timescale, which is smaller
than timescales predicted by some previous spherical 1D collapse models.
Extrapolation to the threshold of the runaway hydrogen dissociation indicates
that the collapse timescales can be shorter than inward migration timescales,
suggesting that clumps could survive tidal disruption and deliver a proto-gas
giant to distances of even a few AU from the central star.
","[{""version"":""v1"",""created"":""Mon, 10 Sep 2012 20:00:20 GMT""}]","2015-06-11"
"1209.2130","Alberto Buzzoni","S. Perina (1), M. Bellazzini (1), A. Buzzoni (1), C. Cacciari (1), L.
  Federici (1), F. Fusi Pecci (1) and S. Galleti (1) ((1) INAF - Osservatorio
  Astronomico di Bologna, Italy)","The horizontal branch morphology of M31 globular clusters. Extreme
  second parameter effect in outer halo clusters","13 pages, pdflatex, 7 figures (9 jpg files). Accepted for publication
  in Astronomy & Astrophysics",,"10.1051/0004-6361/201220037",,"astro-ph.GA astro-ph.SR","http://arxiv.org/licenses/nonexclusive-distrib/1.0/","  We use deep, high quality colour magnitude diagrams obtained with the Hubble
Space Telescope to compute a simplified version of the Mironov index [SMI;
B/(B+R)] to parametrize the horizontal branch (HB) morphology for 23 globular
clusters in the M31 galaxy (Sample-A), all located in the outer halo at
projected distances between 10 kpc and 100 kpc. This allows us to compare them
with their Galactic counterparts, for which we estimated the SMI exactly in the
same way, in the SMI vs. [Fe/H] plane. We find that the majority of the
considered M31 clusters lie in a significantly different locus, in this plane,
with respect to Galactic clusters lying at any distance from the center of the
Milky Way. In particular they have redder HB morphologies at a given
metallicity, or, in other words, clusters with the same SMI value are ~0.4 dex
more metal rich in the Milky Way than in M31. We discuss the possible origin of
this difference and we conclude that the most likely explanation is that many
globular clusters in the outer halo of M31 formed ~1-2 Gyr later than their
counterparts in the outer halo of the Milky Way, while differences in the
cluster-to-cluster distribution of He abundance of individual stars may also
play a role. The analysis of another sample of 25 bright M31 clusters (eighteen
of them with M_V<= -9.0, Sample-B), whose SMI estimates are much more uncertain
as they are computed on shallow colour magnitude diagrams, suggests that
extended blue HB tails can be relatively frequent among the most massive M31
globular clusters, possibly hinting at the presence of multiple populations.
","[{""version"":""v1"",""created"":""Mon, 10 Sep 2012 20:00:34 GMT""}]","2015-06-11"
"1209.2131","Vineet Abhishek","Vineet Abhishek and Bruce Hajek","On the Incentive to Deviate in Core Selecting Combinatorial Auctions","8 pages, 2 figures. This work was presented at the Workshop on
  Telecom Economics, Engineering and Policy 2012, Krakow, Poland",,,,"cs.GT","http://arxiv.org/licenses/nonexclusive-distrib/1.0/","  Recent spectrum auctions in the United Kingdom, and some proposals for future
auctions of spectrum in the United States, are based on preliminary price
discovery rounds, followed by calculation of final prices for the winning
buyers. For example, the prices could be the projection of Vikrey prices onto
the core of reported prices. The use of Vikrey prices should lead to more
straightforward bidding, but the projection reverses some of the incentive for
bidders to report truthfully. Still, we conjecture that the price paid by a
winning buyer increases no faster than the bid, as in a first price auction. It
would be rather disturbing if the conjecture is false. The conjecture is
established for a buyer interacting with disjoint groups of other buyers in a
star network setting. It is also shown that for any core-selecting payment rule
and any integer w greater than or equal to two, there is a market setting with
w winning buyers such that the price paid by some winning buyer increases at
least (1-1/w) times as fast as the price bid.
","[{""version"":""v1"",""created"":""Mon, 10 Sep 2012 20:04:32 GMT""}]","2012-09-12"
"1209.2132","Steven Ehlert","S. Ehlert, S. W. Allen, W. N. Brandt, Y. Q. Xue, B. Luo, A. von der
  Linden, A. Mantz, R. G. Morris","X-ray Bright Active Galactic Nuclei in Massive Galaxy Clusters I: Number
  Counts and Spatial Distribution","18 Pages, 10 Figures, Submitted to MNRAS. Please contact Steven
  Ehlert (sehlert@stanford.edu) for higher resolution figures. Updated to
  reflect small changes requested by referee. This version has been accepted
  into MNRAS",,"10.1093/mnras/sts288",,"astro-ph.CO","http://arxiv.org/licenses/nonexclusive-distrib/1.0/","  We present an analysis of the X-ray bright point source population in 43
massive clusters of galaxies observed with the Chandra X-ray Observatory. We
have constructed a catalog of 4210 rigorously selected X-ray point sources in
these fields, which span a survey area of 4.2 square degrees. This catalog
reveals a clear excess of sources when compared to deep blank-field surveys,
which amounts to roughly 1 additional source per cluster, likely Active
Galactic Nuclei (AGN) associated with the clusters. The excess sources are
concentrated within the virial radii of the clusters, with the largest excess
observed near the cluster centers. The average radial profile of the excess
X-ray sources of the cluster are well described by a power law (N(r) ~ r^\beta)
with an index of \beta ~ -0.5. An initial analysis using literature results on
the mean profile of member galaxies in massive X-ray selected clusters
indicates that the fraction of galaxies hosting X-ray AGN rises with increasing
clustercentric radius, being approximately 5 to 10 times higher near the virial
radius than in the central regions. This trend is qualitatively similar to that
observed for star formation in cluster member galaxies.
","[{""version"":""v1"",""created"":""Mon, 10 Sep 2012 20:05:06 GMT""},{""version"":""v2"",""created"":""Sat, 27 Oct 2012 23:20:42 GMT""},{""version"":""v3"",""created"":""Fri, 14 Dec 2012 18:56:22 GMT""}]","2015-06-11"
"1209.2133","Cecilia Cormick","Cecilia Cormick, Giovanna Morigi","Ion chains in high-finesse cavities","14 pages, 8 figures. Minor changes, matches the published version","Phys. Rev. A 87, 013829 (2013)","10.1103/PhysRevA.87.013829",,"quant-ph cond-mat.quant-gas physics.atom-ph","http://arxiv.org/licenses/nonexclusive-distrib/1.0/","  We analyze the dynamics of a chain of singly-charged ions confined in a
linear Paul trap and which couple with the mode of a high-finesse optical
resonator. In these settings the ions interact via the Coulomb repulsion and
are subject to the mechanical forces due to scattering of cavity photons. We
show that the interplay of these interactions can give rise to bistable
equilibrium configurations, into which the chain can be cooled by
cavity-enhanced photon scattering. We characterize the resulting equilibrium
structures by determining the stationary state in the semiclassical limit for
both cavity field and crystal motion. The mean occupation of the vibrational
modes at steady state is evaluated, showing that the vibrational modes coupled
to the cavity can be simultaneously cooled to low occupation numbers. It is
also found that at steady state the vibrations are entangled with the cavity
field fluctuations. The entanglement is quantified by means of the logarithmic
negativity. The spectrum of the light at the cavity output is evaluated and the
features signaling entanglement are here identified.
","[{""version"":""v1"",""created"":""Mon, 10 Sep 2012 20:06:21 GMT""},{""version"":""v2"",""created"":""Fri, 8 Feb 2013 12:32:15 GMT""}]","2015-06-11"
"1209.2134","R\'emi Leclercq","Vincent Humili\`ere, R\'emi Leclercq, Sobhan Seyfaddini","New energy-capacity-type inequalities and uniqueness of continuous
  Hamiltonians","18 pages. v2. Several minor changes. Reference list updated. To
  appear in Commentarii Mathematici Helvetici",,"10.4171/CMH/343",,"math.SG","http://arxiv.org/licenses/nonexclusive-distrib/1.0/","  We prove a new variant of the energy-capacity inequality for closed rational
symplectic manifolds (as well as certain open manifolds such as cotangent
bundle of closed manifolds...) and we derive some consequences to
C^0-symplectic topology. Namely, we prove that a continuous function which is a
uniform limit of smooth Hamiltonians whose flows converge to the identity for
the spectral (or Hofer's) distance must vanish. This gives a new proof of
uniqueness of continuous generating Hamiltonian for hameomorphisms. This also
allows us to improve a result by Cardin and Viterbo on the C^0-rigidity of the
Poisson bracket.
","[{""version"":""v1"",""created"":""Mon, 10 Sep 2012 20:06:22 GMT""},{""version"":""v2"",""created"":""Mon, 16 Feb 2015 16:05:31 GMT""}]","2021-11-30"
"1209.2135","Stephen Williams","S.J. Williams, D.R. Gies, T.C. Hillwig, M.V. McSwain, W. Huang","Radial Velocities of Galactic O-Type Stars. II. Single-lined
  Spectroscopic Binaries","26 pages, 6 figures, accepted to AJ",,"10.1088/0004-6256/145/2/29",,"astro-ph.SR","http://arxiv.org/licenses/nonexclusive-distrib/1.0/","  We report on new radial velocity measurements of massive stars that are
either suspected binaries or lacking prior observations. This is part of a
survey to identify and characterize spectroscopic binaries among O-type stars
with the goal of comparing the binary fraction of field and runaway stars with
those in clusters and associations. We present orbits for HDE 308813, HD
152147, HD 164536, BD-16 4826 and HDE 229232, Galactic O-type stars exhibiting
single-lined spectroscopic variation. By fitting model spectra to our observed
spectra we obtain estimates for effective temperature, surface gravity, and
rotational velocity. We compute orbital periods and velocity semiamplitudes for
each system and note the lack of photometric variation for any system. These
binaries probably appear single-lined because the companions are faint and
because their orbital Doppler shifts are small compared to the width of the
rotationally broadened lines of the primary.
","[{""version"":""v1"",""created"":""Mon, 10 Sep 2012 20:06:31 GMT""}]","2015-06-11"
"1209.2136","Maria de Juan Ovelar","M. de Juan Ovelar, J. M. D. Kruijssen, E. Bressert, L. Testi, N.
  Bastian and H. Canovas Cabrera","Can habitable planets form in clustered environments?","6 pages (including appendices), 4 figures, 2 tables; A&A Letters","Astronomy & Astrophysics, Volume 546, id.L1, 10/2012","10.1051/0004-6361/201219627",,"astro-ph.SR astro-ph.EP","http://arxiv.org/licenses/nonexclusive-distrib/1.0/","  We present observational evidence of environmental effects on the formation
and evolution of planetary systems. We combine catalogues of resolved
protoplanetary discs (PPDs) and young stellar objects in the solar
neighbourhood to analyse the PPD size distribution as a function of ambient
stellar density. By running Kolmogorov-Smirnov tests between the PPD radii at
different densities, we find empirical evidence, at the >97% confidence level,
for a change in the PPD radius distribution at ambient stellar densities \Sigma
> 10^{3.5} pc^{-2}. This coincides with a simple theoretical estimate for the
truncation of PPDs or planetary systems by dynamical encounters. If this
agreement is causal, the ongoing disruption of PPDs and planetary systems
limits the possible existence of planets in the habitable zone, with shorter
lifetimes at higher host stellar masses and ambient densities. Therefore,
habitable planets are not likely to be present in long-lived stellar clusters,
and may have been ejected altogether to form a population of unbound,
free-floating planets. We conclude that, while highly suggestive, our results
should be verified through other methods. Our simple model shows that
truncations should lead to a measurable depletion of the PPD mass function that
can be detected with ALMA observations of the densest nearby and young
clusters.
","[{""version"":""v1"",""created"":""Mon, 10 Sep 2012 20:06:58 GMT""},{""version"":""v2"",""created"":""Sun, 14 Oct 2012 16:55:02 GMT""}]","2012-10-16"
"1209.2137","Daniel Lemire","Daniel Lemire and Leonid Boytsov","Decoding billions of integers per second through vectorization","For software, see https://github.com/lemire/FastPFor, For data, see
  http://boytsov.info/datasets/clueweb09gap/","Software: Practice & Experience 45 (1), 2015","10.1002/spe.2203",,"cs.IR cs.DB","http://creativecommons.org/licenses/by/4.0/","  In many important applications -- such as search engines and relational
database systems -- data is stored in the form of arrays of integers. Encoding
and, most importantly, decoding of these arrays consumes considerable CPU time.
Therefore, substantial effort has been made to reduce costs associated with
compression and decompression. In particular, researchers have exploited the
superscalar nature of modern processors and SIMD instructions. Nevertheless, we
introduce a novel vectorized scheme called SIMD-BP128 that improves over
previously proposed vectorized approaches. It is nearly twice as fast as the
previously fastest schemes on desktop processors (varint-G8IU and PFOR). At the
same time, SIMD-BP128 saves up to 2 bits per integer. For even better
compression, we propose another new vectorized scheme (SIMD-FastPFOR) that has
a compression ratio within 10% of a state-of-the-art scheme (Simple-8b) while
being two times faster during decoding.
","[{""version"":""v1"",""created"":""Mon, 10 Sep 2012 20:08:03 GMT""},{""version"":""v2"",""created"":""Wed, 12 Sep 2012 15:01:28 GMT""},{""version"":""v3"",""created"":""Tue, 16 Oct 2012 14:18:36 GMT""},{""version"":""v4"",""created"":""Tue, 19 Feb 2013 21:16:35 GMT""},{""version"":""v5"",""created"":""Fri, 19 Apr 2013 02:27:52 GMT""},{""version"":""v6"",""created"":""Thu, 15 May 2014 15:02:22 GMT""},{""version"":""v7"",""created"":""Sat, 30 Jan 2021 18:23:38 GMT""}]","2021-02-02"
"1209.2138","Emil Bj\""ornson","Emil Bj\""ornson, Niklas Jald\'en, Mats Bengtsson, Bj\""orn Ottersten","Optimality Properties, Distributed Strategies, and Measurement-Based
  Evaluation of Coordinated Multicell OFDMA Transmission","Published in IEEE Transactions on Signal Processing, 15 pages, 7
  figures. This version corrects typos related to Eq. (4) and Eq. (28)","IEEE Transactions on Signal Processing, vol. 59, no. 12, pp.
  6086-6101, December 2011","10.1109/TSP.2011.2165706",,"cs.IT math.IT","http://arxiv.org/licenses/nonexclusive-distrib/1.0/","  The throughput of multicell systems is inherently limited by interference and
the available communication resources. Coordinated resource allocation is the
key to efficient performance, but the demand on backhaul signaling and
computational resources grows rapidly with number of cells, terminals, and
subcarriers. To handle this, we propose a novel multicell framework with
dynamic cooperation clusters where each terminal is jointly served by a small
set of base stations. Each base station coordinates interference to neighboring
terminals only, thus limiting backhaul signalling and making the framework
scalable. This framework can describe anything from interference channels to
ideal joint multicell transmission.
  The resource allocation (i.e., precoding and scheduling) is formulated as an
optimization problem (P1) with performance described by arbitrary monotonic
functions of the signal-to-interference-and-noise ratios (SINRs) and arbitrary
linear power constraints. Although (P1) is non-convex and difficult to solve
optimally, we are able to prove: 1) Optimality of single-stream beamforming; 2)
Conditions for full power usage; and 3) A precoding parametrization based on a
few parameters between zero and one. These optimality properties are used to
propose low-complexity strategies: both a centralized scheme and a distributed
version that only requires local channel knowledge and processing. We evaluate
the performance on measured multicell channels and observe that the proposed
strategies achieve close-to-optimal performance among centralized and
distributed solutions, respectively. In addition, we show that multicell
interference coordination can give substantial improvements in sum performance,
but that joint transmission is very sensitive to synchronization errors and
that some terminals can experience performance degradations.
","[{""version"":""v1"",""created"":""Mon, 10 Sep 2012 20:10:57 GMT""}]","2012-09-12"
"1209.2139","Sen Yang","Sen Yang, Zhaosong Lu, Xiaotong Shen, Peter Wonka, Jieping Ye","Fused Multiple Graphical Lasso",,,,,"cs.LG stat.ML","http://arxiv.org/licenses/nonexclusive-distrib/1.0/","  In this paper, we consider the problem of estimating multiple graphical
models simultaneously using the fused lasso penalty, which encourages adjacent
graphs to share similar structures. A motivating example is the analysis of
brain networks of Alzheimer's disease using neuroimaging data. Specifically, we
may wish to estimate a brain network for the normal controls (NC), a brain
network for the patients with mild cognitive impairment (MCI), and a brain
network for Alzheimer's patients (AD). We expect the two brain networks for NC
and MCI to share common structures but not to be identical to each other;
similarly for the two brain networks for MCI and AD. The proposed formulation
can be solved using a second-order method. Our key technical contribution is to
establish the necessary and sufficient condition for the graphs to be
decomposable. Based on this key property, a simple screening rule is presented,
which decomposes the large graphs into small subgraphs and allows an efficient
estimation of multiple independent (small) subgraphs, dramatically reducing the
computational cost. We perform experiments on both synthetic and real data; our
results demonstrate the effectiveness and efficiency of the proposed approach.
","[{""version"":""v1"",""created"":""Mon, 10 Sep 2012 20:13:42 GMT""},{""version"":""v2"",""created"":""Tue, 31 Dec 2013 03:19:45 GMT""}]","2014-01-03"
"1209.2140","Thomas Eichner","Thomas Eichner, Stella Seitz, Anne Bauer","Golden gravitational lensing systems from the Sloan Lens ACS Survey. II.
  SDSS J1430+4105: A precise inner total mass profile from lensing alone","24 pages, 21 figures, 11 tables, accepted for publication by MNRAS",,"10.1111/j.1365-2966.2012.22003.x",,"astro-ph.CO","http://arxiv.org/licenses/nonexclusive-distrib/1.0/","  We study the SLACS strong lensing system SDSSJ1430+4105 at z=0.285. The
lensed source (z=0.575) of this system has a complex morphology with several
subcomponents. Its subcomponents span a radial range from 4 to 10kpc in the
lens plane. Therefore we can constrain the slope of the total projected mass
profile around the Einstein radius (R_E) from lensing alone. We measure a
density profile that is slightly but not significantly shallower than
isothermal at R_E. We decompose the mass of the lensing galaxy into a de
Vaucouleurs (deV) component to trace the stars and an additional dark
component. The spread of multiple image components over a large radial range
also allows us to determine the amplitude of the deV and dark matter components
separately. We get a mass to light ratio of M_deV/L_B~5.5\pm1.5M/L_sun,B and a
dark matter fraction within R_E of ~20 to 40%. Modelling the star formation
history assuming composite stellar populations at solar metallicity to the
galaxy's photometry yields a mass to light ratio of
M_star,salp/L_B~4.0_{-1.3}^{+0.6}M/L_sun,B and
M_star,chab/L_B~2.3_{-0.8}^{+0.3}M/L_sun,B for Salpeter and Chabrier IMFs,
respectively. Hence, the mass to light ratio derived from lensing is more
Salpeter-like, in agreement with results for massive Coma galaxies and other
nearby massive early type galaxies. We examine the consequences of the galaxy
group in which the lensing galaxy is embedded, showing that it has little
influence on the mass to light ratio obtained for the deV component of the
lensing galaxy. Finally, we decompose the projected, azimuthally averaged 2D
density distribution of the deV and dark matter component of the lensing signal
into spherically averaged 3D density profiles. We can show that the 3D dark and
luminous matter density within R_E~0.6R_eff of this SLACS galaxy is similar to
the values of Coma galaxies with the same velocity dispersions.
","[{""version"":""v1"",""created"":""Mon, 10 Sep 2012 20:14:09 GMT""}]","2013-06-24"
