"1209.2196","Reinout van Weeren","R. J. van Weeren, H. J. A. Rottgering, H. T. Intema, L. Rudnick, M.
  Bruggen, M. Hoeft, J. B. R. Oonk","The ""toothbrush-relic"": evidence for a coherent linear 2-Mpc scale shock
  wave in a massive merging galaxy cluster?","22 pages, 22 figures, accepted for publication in A\&A on September
  3, 2012",,"10.1051/0004-6361/201219000",,"astro-ph.CO","http://arxiv.org/licenses/nonexclusive-distrib/1.0/","  Some merging galaxy clusters host diffuse extended radio emission, so-called
radio halos and relics. Here we present observations between 147 MHz and 4.9
GHz of a new radio-selected galaxy cluster 1RXS J0603.3+4214 (z=0.225). The
cluster is also detected as an extended X-ray source in the RASS. It hosts a
large bright 1.9 Mpc radio relic, an elongated ~2 Mpc radio halo, and two
smaller radio relics. The large radio relic has a peculiar linear morphology.
For this relic we observe a clear spectral index gradient, in the direction
towards the cluster center. We performed Rotation Measure (RM) Synthesis
between 1.2 and 1.7 GHz. The results suggest that for the west part of the
large relic some of the Faraday rotation is caused by ICM and is not only due
to galactic foregrounds. We also carried out a detailed spectral analysis of
this radio relic and created radio color-color diagrams. We find (i) an
injection spectral index of -0.6 to -0.7, (ii) steepening spectral index and
increasing spectral curvature in the post-shock region, and (iii) an overall
power-law spectrum between 74 MHz and 4.9 GHz with \alpha=-1.10 \pm 0.02.
Mixing of emission in the beam from regions with different spectral ages is
probably the dominant factor that determines the shape of the radio spectra.
Changes in the magnetic field, total electron content, or adiabatic
gains/losses do not play a major role. A model in which particles are
(re)accelerated in a first order Fermi process at the front of the relic
provides the best match to the observed spectra. We speculate that in the
post-shock region particles are re-accelerated by merger induced turbulence to
form the radio halo as the relic and halo are connected. The 1RXS J0603.3+4214
merger is probably more complex than the ""simple'"" binary merger events that
are thought to give rise to symmetric double radio relics.
","[{""version"":""v1"",""created"":""Tue, 11 Sep 2012 01:51:49 GMT""},{""version"":""v2"",""created"":""Fri, 14 Sep 2012 17:40:36 GMT""}]","2015-06-11"
"1209.2197","Vagson Luiz Carvalho-Santos","Clenilda F Dias, and Vagson L Carvalho-Santos","Adapting the Euler-Lagrange equation to study one-dimensional motions
  under the action of a constant force","10 pages, 2 figures",,,,"physics.class-ph physics.ed-ph","http://arxiv.org/licenses/nonexclusive-distrib/1.0/","  The Euler-Lagrange equations (EL) are very important in the theoretical
description of several physical systems. In this work we have used a simplified
form of EL to study one-dimensional motions under the action of a constant
force. From using the definition of partial derivative, we have proposed two
operators, here called \textit{mean delta operators}, which may be used to
solve the EL in a simplest way. We have applied this simplification to solve
three simple mechanical problems under the action of the gravitational field: a
free fall body, the Atwood's machine and the inclined plan. The proposed
simplification can be used to introducing the lagrangian formalism to teach
classical mechanics in introductory physics courses.
","[{""version"":""v1"",""created"":""Tue, 11 Sep 2012 01:53:36 GMT""},{""version"":""v2"",""created"":""Wed, 23 Aug 2017 20:17:32 GMT""}]","2017-08-25"
"1209.2198","Jacob Sturm","D.H. Phong and J. Sturm","On the singularities of the pluricomplex Green's function",,,,,"math.DG math.CV","http://arxiv.org/licenses/nonexclusive-distrib/1.0/","  It is shown that, on a compact Kahler manifold with boundary, the
singularities of the pluricomplex Green's function with multiple poles can be
prescribed to be of the form $\log\sum_{j=1}^n|f_j(z)|^2$ at each pole, where
$f_j(z)$ are arbitrary local holomorphic functions with the pole as their only
common zero. The proof is a combination of blow-ups and recent a priori
estimates for the degenerate complex Monge-Ampere equation, and particularly
the $C^1$ estimates away from a divisor.
","[{""version"":""v1"",""created"":""Tue, 11 Sep 2012 02:06:37 GMT""}]","2012-09-12"
"1209.2199","Edward Witten","Edward Witten","Notes On Supermanifolds and Integration","42 pp, minor corrections in this version",,,,"hep-th math.DG","http://arxiv.org/licenses/nonexclusive-distrib/1.0/","  These are notes on the theory of supermanifolds and integration on them,
aiming to collect results that are useful for a better understanding of
superstring perturbation theory in the RNS formalism.
","[{""version"":""v1"",""created"":""Tue, 11 Sep 2012 02:09:14 GMT""},{""version"":""v2"",""created"":""Thu, 1 Nov 2012 13:46:26 GMT""},{""version"":""v3"",""created"":""Sun, 25 Dec 2016 00:40:42 GMT""}]","2016-12-28"
"1209.2200","Victor Flambaum","V.A. Dzuba, V.V. Flambaum","Parity violation and electric dipole moments in atoms and molecules","Review, Accepted to Int.J.Mod.Phys",,"10.1142/S021830131230010X",,"physics.atom-ph hep-ph nucl-th","http://arxiv.org/licenses/nonexclusive-distrib/1.0/","  We review the current status of the study of parity and time invariance
violation in atoms, nuclei and molecules. We focus on parity non-conservation
in cesium and three of the most promising areas of research: (i) parity
non-conservation in a chain of isotopes, (ii) search for nuclear anapole
moments, and (iii) search for permanent electric dipole moments (EDMs) of atoms
and molecules, which in turn are caused by either an electron EDM or nuclear
$T,P$-odd moments such as a nuclear EDM or nuclear Schiff moment.
","[{""version"":""v1"",""created"":""Tue, 11 Sep 2012 02:11:22 GMT""}]","2015-06-11"
"1209.2201","Chuan Liu","Ning Li and Chuan Liu","Generalized L\""uscher Formula in Multi-channel Baryon-Meson Scattering","One reference added",,"10.1103/PhysRevD.87.014502",,"hep-lat","http://arxiv.org/licenses/nonexclusive-distrib/1.0/","  L\""uscher's formula relates the elastic scattering phase shifts to the
two-particle energy levels in a finite cubic box. The original formula was
obtained for elastic scattering of two massive spinless particles in the center
of mass frame. In this paper, we consider the case for the scattering of a spin
1/2 particle with a spinless particle in multi-channel scattering. A
generalized relation between the energy of two particle system and the
scattering matrix elements is established. We first obtain this relation using
quantum-mechanics in both center-of-mass frame and in a general moving frame.
The result is then generalized to quantum field theory using methods outlined
in Ref. \cite{Hansen:2012tf}. We verify that the results obtained using both
methods are equivalent up to terms that are exponentially suppressed in the box
size.
","[{""version"":""v1"",""created"":""Tue, 11 Sep 2012 02:16:02 GMT""},{""version"":""v2"",""created"":""Fri, 14 Sep 2012 05:58:52 GMT""},{""version"":""v3"",""created"":""Tue, 16 Oct 2012 01:34:43 GMT""}]","2013-05-30"
"1209.2202","Ko-Wei Lih","Kuo-Ching Huang, Ko-Wei Lih","Nordhaus-Guddam Type Relations of Three Graph Coloring Parameters",,,,,"math.CO","http://arxiv.org/licenses/nonexclusive-distrib/1.0/","  Let G be a simple graph. A coloring of vertices of G is called (i) a 2-proper
coloring if vertices at distance 2 receive distinct colors; (ii) an injective
coloring if vertices possessing a common neighbor receive distinct colors;
(iii) a square coloring if vertices at distance at most 2 receive distinct
colors. In this paper, we study inequalities of Nordhaus-Guddam type for the
2-proper chromatic number, the injective chromatic number, and the square
chromatic number.
","[{""version"":""v1"",""created"":""Tue, 11 Sep 2012 02:21:36 GMT""}]","2012-09-12"
"1209.2203","Jacob Sturm","D. H. Phong, Jian Song and J. Sturm","Complex Monge Ampere Equations","References added, misprints corrected","Surveys in Differential Geomety, vol. 17, 327-411 (2012)",,,"math.DG math.CV","http://arxiv.org/licenses/nonexclusive-distrib/1.0/","  This is a survey of some of the recent developments in the theory of complex
Monge-Ampere equations. The topics discussed include refinements and
simplifications of classical a priori estimates, methods from pluripotential
theory, variational methods for big cohomology classes, semiclassical
constructions of solutions of homogeneous equations, and envelopes.
","[{""version"":""v1"",""created"":""Tue, 11 Sep 2012 02:26:02 GMT""},{""version"":""v2"",""created"":""Mon, 1 Oct 2012 03:47:38 GMT""}]","2012-10-02"
"1209.2204","Henk van Elst","Ekaterina Svetlova and Henk van Elst (Karlshochschule International
  University)","How is non-knowledge represented in economic theory?","18 pages, LaTeX2e, hyperlinked references",,,,"q-fin.GN cs.AI stat.AP","http://arxiv.org/licenses/nonexclusive-distrib/1.0/","  In this article, we address the question of how non-knowledge about future
events that influence economic agents' decisions in choice settings has been
formally represented in economic theory up to date. To position our discussion
within the ongoing debate on uncertainty, we provide a brief review of
historical developments in economic theory and decision theory on the
description of economic agents' choice behaviour under conditions of
uncertainty, understood as either (i) ambiguity, or (ii) unawareness.
Accordingly, we identify and discuss two approaches to the formalisation of
non-knowledge: one based on decision-making in the context of a state space
representing the exogenous world, as in Savage's axiomatisation and some
successor concepts (ambiguity as situations with unknown probabilities), and
one based on decision-making over a set of menus of potential future
opportunities, providing the possibility of derivation of agents' subjective
state spaces (unawareness as situation with imperfect subjective knowledge of
all future events possible). We also discuss impeding challenges of the
formalisation of non-knowledge.
","[{""version"":""v1"",""created"":""Mon, 10 Sep 2012 19:55:46 GMT""}]","2012-09-12"
"1209.2205","Dinakar Muthiah","Dinakar Muthiah, Peter Tingley","Affine PBW Bases and MV Polytopes in Rank 2","23 pages",,,,"math.RT math.QA","http://arxiv.org/licenses/nonexclusive-distrib/1.0/","  Mirkovic-Vilonen (MV) polytopes have proven to be a useful tool in
understanding and unifying many constructions of crystals for finite-type
Kac-Moody algebras. These polytopes arise naturally in many places, including
the affine Grassmannian, pre-projective algebras, PBW bases, and KLR algebras.
There has recently been progress in extending this theory to the affine
Kac-Moody algebras. A definition of MV polytopes in symmetric affine cases has
been proposed using pre-projective algebras. In the rank-2 affine cases, a
combinatorial definition has also been proposed. Additionally, the theory of
PBW bases has been extended to affine cases, and, at least in rank-2, we show
that this can also be used to define MV polytopes. The main result of this
paper is that these three notions of MV polytope all agree in the relevant
rank-2 cases. Our main tool is a new characterization of rank-2 affine MV
polytopes.
","[{""version"":""v1"",""created"":""Tue, 11 Sep 2012 02:32:21 GMT""},{""version"":""v2"",""created"":""Sun, 16 Dec 2012 20:54:30 GMT""}]","2012-12-18"
"1209.2206","Saurav Dhital","Saurav Dhital, Andrew A. West, Keivan G. Stassun, Nicholas M. Law","The SLoWPoKES Catalog of Low-mass Ultra-wide Binaries: A Cool Stars
  Resource for Testing Fundamental Properties and for Constraining Binary
  Formation Theory","To appear in Cool Star XVII proceedings",,"10.1002/asna.201211773",,"astro-ph.SR","http://arxiv.org/licenses/nonexclusive-distrib/1.0/","  We present results from the Sloan Low-mass Wide Pairs of Kinematically
Equivalent Stars (SLoWPoKES) catalog of ultra-wide (10^3-10^5.5 AU), low-mass
(K5-M7) common proper motion binaries. We constructed a Galactic model, based
on empirical stellar number density and 3D velocity distributions, to select
bona fide pairs with probability of chance alignment <5%, making SLoWPoKES an
efficient sample for followup observations. Our initial catalog contains 1342
disk dwarf, subdwarf, and white dwarf-red dwarf systems and is the largest
collection of low-mass, wide binaries ever assembled. The diversity---in mass,
metallicity, age, and evolutionary states---of SLoWPoKES pairs makes it a
valuable resource of coeval laboratories to examine and constrain the physical
properties of low-mass stars. SLoWPoKES pairs show signatures of two (or more)
formation modes in the distribution of the physical separation and higher-order
multiplicity. Neither dynamical dissipation of primordial triples/quadruples or
dynamical capture of ejected stars can explain the observed populations by
itself. We use followup spectroscopic observations to recalibrate the
metallicity-sensitive {\zeta}_(TiO/CaH) index by assuming that both members of
the binary system have the same composition. Our new formulation is a
significantly better tracer of absolute metallicity, particularly for the
early-type M dwarfs. The SLoWPoKES catalog is publicly available on a custom
data visualization portal.
","[{""version"":""v1"",""created"":""Tue, 11 Sep 2012 02:42:11 GMT""}]","2015-06-11"
"1209.2207","Chaowei Jiang","Chaowei Jiang, Xueshang Feng, S. T. Wu, Qiang Hu","Study of the 3D Coronal Magnetic Field of Active Region 11117 Around the
  Time of a Confined Flare Using a Data-Driven CESE--MHD Model","27 pages, 11 figures, Accepted by ApJ",,"10.1088/0004-637X/759/2/85",,"astro-ph.SR","http://arxiv.org/licenses/nonexclusive-distrib/1.0/","  We apply a data-driven MHD model to investigate the three-dimensional (3D)
magnetic field of NOAA active region (AR) 11117 around the time of a C-class
confined flare occurred on 2010 October 25. The MHD model, based on the
spacetime conservation-element and solution-element (CESE) scheme, is designed
to focus on the magnetic-field evolution and to consider a simplified solar
atomsphere with finite plasma $\beta$. Magnetic vector-field data derived from
the observations at the photoshpere is inputted directly to constrain the
model. Assuming that the dynamic evolution of the coronal magnetic field can be
approximated by successive equilibria, we solve a time sequence of MHD
equilibria basing on a set of vector magnetograms for AR 11117 taken by the
Helioseismic and Magnetic Imager (HMI) on board the {\it Solar Dynamic
Observatory (SDO)} around the time of flare. The model qualitatively reproduces
the basic structures of the 3D magnetic field, as supported by the visual
similarity between the field lines and the coronal loops observed by the
Atmospheric Imaging Assembly (AIA), which shows that the coronal field can
indeed be well characterized by the MHD equilibrium in most time. The magnetic
configuration changes very limited during the studied time interval of two
hours. A topological analysis reveals that the small flare is correlated with a
bald patch (BP, where the magnetic field is tangent to the photoshpere),
suggesting that the energy release of the flare can be understood by magnetic
reconnection associated with the BP separatrices. The total magnetic flux and
energy keep increasing slightly in spite of the flare, while the computed
magnetic free energy drops during the flare with an amount of $\sim 10^{30}$
erg, which seems to be adequate to provide the energy budget of the minor
C-class confined flare.
","[{""version"":""v1"",""created"":""Tue, 11 Sep 2012 02:59:34 GMT""}]","2015-06-11"
"1209.2208","Victor Grechnev","I. M. Chertok, V. V. Grechnev, A. V. Belov, A. A. Abunin","Magnetic Flux of EUV Arcade and Dimming Regions as a Relevant Parameter
  for Early Diagnostics of Solar Eruptions - Sources of Non-Recurrent
  Geomagnetic Storms and Forbush Decreases","27 pages, 5 figures. Accepted for publication in Solar Physics","Solar Physics, 2012. The final publication is available at
  www.springerlink.com","10.1007/s11207-012-0127-1",,"astro-ph.SR","http://arxiv.org/licenses/nonexclusive-distrib/1.0/","  This study aims at the early diagnostics of geoeffectiveness of coronal mass
ejections (CMEs) from quantitative parameters of the accompanying EUV dimming
and arcade events. We study events of the 23th solar cycle, in which major
non-recurrent geomagnetic storms (GMS) with Dst <-100 nT are sufficiently
reliably identified with their solar sources in the central part of the disk.
Using the SOHO/EIT 195 A images and MDI magnetograms, we select significant
dimming and arcade areas and calculate summarized unsigned magnetic fluxes in
these regions at the photospheric level. The high relevance of this eruption
parameter is displayed by its pronounced correlation with the Forbush decrease
(FD) magnitude, which, unlike GMSs, does not depend on the sign of the Bz
component but is determined by global characteristics of ICMEs. Correlations
with the same magnetic flux in the solar source region are found for the GMS
intensity (at the first step, without taking into account factors determining
the Bz component near the Earth), as well as for the temporal intervals between
the solar eruptions and the GMS onset and peak times. The larger the magnetic
flux, the stronger the FD and GMS intensities are and the shorter the ICME
transit time is. The revealed correlations indicate that the main quantitative
characteristics of major non-recurrent space weather disturbances are largely
determined by measurable parameters of solar eruptions, in particular, by the
magnetic flux in dimming areas and arcades, and can be tentatively estimated in
advance with a lead time from 1 to 4 days. For GMS intensity, the revealed
dependencies allow one to estimate a possible value, which can be expected if
the Bz component is negative.
","[{""version"":""v1"",""created"":""Tue, 11 Sep 2012 03:11:36 GMT""}]","2012-11-09"
"1209.2209","Q. H. Liu","Q. H. Liu","Momentum spectrometry of spherical harmonics and a probe of geometric
  embedding effect","11 pages, 3 figures",,,,"quant-ph math-ph math.MP","http://arxiv.org/licenses/nonexclusive-distrib/1.0/","  As a submanifold is embedded into higher dimensional flat space, quantum
mechanics gives various embedding quantities, e.g., the geometric momentum and
geometric potential, etc. For a particle moving on a two-dimensional sphere or
a free rotation of a spherical top, the projections of the geometric momentum p
and the angular momentum L onto a certain Cartesian axis form a complete set of
commuting observables as [p_{i},L_{i}]=0 (i=1,2,3). We have therefore a
(p_{i},L_{i}) representation for the states on the two-dimensional spherical
surface. The geometric momentum distribution of the ground states for a freely
rotating rigid rotor seems within the resolution power of present momentum
spectrometer and can be measured to probe the embedding effect.
","[{""version"":""v1"",""created"":""Tue, 11 Sep 2012 03:22:28 GMT""},{""version"":""v2"",""created"":""Thu, 1 Nov 2012 10:40:38 GMT""},{""version"":""v3"",""created"":""Mon, 25 Feb 2013 12:24:53 GMT""}]","2013-02-26"
"1209.2210","Jan Kleyna","Jan Kleyna, Olivier Hainaut, and Karen Meech","P/2010 A2 LINEAR II: dynamical dust modelling","14 pages, 25 figures; accepted by Astronomy and Astrophysics",,"10.1051/0004-6361/201118428",,"astro-ph.EP","http://arxiv.org/licenses/nonexclusive-distrib/1.0/","  P/2010 A2 is an object on an asteroidal orbit that was observed to have an
extended tail or debris trail in January 2010. In this work, we fit the
outburst of P/2010 A2 with a conical burst model, and verify previous
suspicions that this was a one--time collisional event rather than an sustained
cometary outburst, implying that P/2010 A2 is not a new Main Belt Comet driven
by ice sublimation. We find that the best--fit cone opening angle is about 40
to 50 degrees, in agreement with numerical and laboratory simulations of
cratering events. Mapping debris orbits to sky positions suggests that the
distinctive arc features in the debris correspond to the same debris cone
inferred from the extended dust. From the velocity of the debris, and from the
presence of a velocity maximum at around 15 cm/s, we infer that the surface of
A2 probably has a very low strength (<1 kPa), comparable to lunar regolith.
","[{""version"":""v1"",""created"":""Tue, 11 Sep 2012 03:24:37 GMT""}]","2015-06-11"
"1209.2211","Swapan Konar Dr.","S.Konar and Anjan Biswas","Some Aspects of Optical Spatial Solitons in Photorefractive Crystals","51 pages, 20 figures",,,,"physics.optics","http://arxiv.org/licenses/nonexclusive-distrib/1.0/","  We have reviewed recent developments of some aspects of optical spatial
solitons in photorefractive media. Underlying principles governing the dynamics
of photorefractive nonlinearity have been discussed using band transport model.
Nonlinear dynamical equations for propagating solitons have been derived
considering single as well as two-photon photorefractive processes. Fundamental
properties of three types of solitons, particularly, screening, photovoltaic
and screening photovoltaic solitons have been considered. For each type of
solitons, three different configurations i.e., bright, dark and gray varieties
have been considered. Mechanisms of formation of these solitons due to single
as well as two-photon photorefractive processes have been considered and their
self bending discussed. Vector solitons, particularly, incoherently coupled
solitons due to single photon and two-photon photorefractive phenomena have
been highlighted. Existence of some missing solitons have been also pointed
out.
","[{""version"":""v1"",""created"":""Tue, 11 Sep 2012 03:25:27 GMT""}]","2012-09-12"
"1209.2212","Q. H. Liu","D. M. Xun, and Q. H. Liu","Geometric momentum in the Monge parametrization of two dimensional
  sphere","6 pages, no figure","International Journal of Geometric Methods in Modern Physics, v10
  n3 (March, 2013)",,,"math-ph math.MP quant-ph","http://arxiv.org/licenses/nonexclusive-distrib/1.0/","  A two dimensional surface can be considered as three dimensional shell whose
thickness is negligible in comparison with the dimension of the whole system.
The quantum mechanics on surface can be first formulated in the bulk and the
limit of vanishing thickness is then taken. The gradient operator and the
Laplace operator originally defined in bulk converges to the geometric ones on
the surface, and the so-called geometric momentum and geometric potential are
obtained. On the surface of two dimensional sphere the geometric momentum in
the Monge parametrization is explicitly explored. Dirac's theory on
second-class constrained motion is resorted to for accounting for the
commutator [x_{i},p_{j}]=i \hbar({\delta}_{ij}-x_{i}x_{j}/r^2) rather than
[x_{i},p_{j}]=i\hbar{\delta}_{ij} that does not hold true any more. This
geometric momentum is geometric invariant under parameters transformation, and
self-adjoint.
","[{""version"":""v1"",""created"":""Tue, 11 Sep 2012 03:33:48 GMT""}]","2012-09-12"
"1209.2213","Jan M. Tomczak","Jan M. Tomczak, M. van Schilfgaarde, G. Kotliar","Many-body effects in iron pnictides and chalcogenides -- non-local vs
  dynamic origin of effective masses","4+ pages, 3 figures","Phys. Rev. Lett. 109, 237010 (2012)","10.1103/PhysRevLett.109.237010",,"cond-mat.str-el","http://arxiv.org/licenses/nonexclusive-distrib/1.0/","  We apply the quasi-particle self-consistent GW (QSGW) approximation to some
of the iron pnictide and chalcogenide superconductors. We compute Fermi
surfaces and density of states, and find excellent agreement with experiment,
substantially improving over standard band-structure methods. Analyzing the
QSGW self-energy we discuss non-local and dynamic contributions to effective
masses. We present evidence that the two contributions are mostly separable,
since the quasi-particle weight is found to be essentially independent of
momentum. The main effect of non locality is captured by the static but
non-local QSGW effective potential. Moreover, these non-local self-energy
corrections, absent in e.g. dynamical mean field theory (DMFT), can be
relatively large. We show, on the other hand, that QSGW only partially accounts
for dynamic renormalizations at low energies. These findings suggest that QSGW
combined with DMFT will capture most of the many-body physics in the iron
pnictides and chalcogenides.
","[{""version"":""v1"",""created"":""Tue, 11 Sep 2012 03:39:38 GMT""}]","2012-12-19"
"1209.2214","YaJin Zhou","Hao Sun and Ya-Jin Zhou","Neutral Triple Gauge Boson production in the large extra dimensions
  model at linear colliders","17 pages,8 figures, accepted by Phys. Rev. D",,"10.1103/PhysRevD.86.075003",,"hep-ph","http://creativecommons.org/licenses/by/3.0/","  We consider the neutral triple gauge boson production process in the context
of large extra dimensions (LED) model including the Kaluza-Klein (KK) excited
gravitons at future linear colliders, say ILC(CLIC). We consider
$\gamma\gamma\gamma, \gamma\gamma Z, \gamma Z Z$ and $ZZZ$ production
processes, and analyse their impacts on both the total cross section and some
key distributions. These processes are important for new physics searches at
linear colliders. Our results show that KK graviton exchange has the most
significant effect on \eerzz among the four processes with relatively small
$M_S$, while it has the largest effect on \eerrr with larger $M_S$. By using
the neutral triple gauge boson production we could set the discovery limit on
the fundamental Plank scale $M_S$ up to around 6-9 TeV for $\delta$ = 4 at the
3 TeV CLIC.
","[{""version"":""v1"",""created"":""Tue, 11 Sep 2012 03:42:25 GMT""}]","2015-06-11"
