"1209.2045","Martin Guest","Martin A. Guest, Alexander R. Its, Chang-Shou Lin","Isomonodromy aspects of the tt* equations of Cecotti and Vafa I. Stokes
  data","35 pages, 3 figures. Minor revisions for compatibility with the
  recently posted Part II (arXiv:1312.4825)",,,,"math.DG hep-th","http://arxiv.org/licenses/nonexclusive-distrib/1.0/","  We describe all smooth solutions of the two-function tt*-Toda equations (a
version of the tt* equations, or equations for harmonic maps into
SL(n,R)/SO(n)) in terms of (i) asymptotic data, (ii) holomorphic data, and
(iii) monodromy data. This allows us to find all solutions with integral Stokes
data. These include solutions associated to nonlinear sigma models (quantum
cohomology) or Landau-Ginzburg models (unfoldings of singularities), as
conjectured by Cecotti and Vafa.
","[{""version"":""v1"",""created"":""Mon, 10 Sep 2012 16:00:42 GMT""},{""version"":""v2"",""created"":""Tue, 7 Jan 2014 12:01:20 GMT""}]","2014-01-08"
"1209.2046","George Dedkov","A. A. Kyasov, G. V. Dedkov","Fluctuation Electromagnetic Interaction Between Rotating Nanoparticle
  and Near-Field of the Surface","16 pages,4 figures",,,,"cond-mat.other quant-ph","http://arxiv.org/licenses/nonexclusive-distrib/1.0/","  Fluctuation electromagnetic interaction between a small rotating particle and
a polarizable surface produces the friction torque on the particle, changes the
attraction force (van -der -Waals force) and the rate of heat exchange in this
system. In this paper we consider the case where the rotation axis is parallel
to the surface. We present general theoretical basis allowing to obtain
characteristics of the interaction at an arbitrary orientation of the rotation
axis. In comparison to the case where the rotation axis is perpendicular to the
surface (arXiv: 1208.2603), the obtained integral expressions for the friction
torque, interaction energy and heating rate have different numerical
coefficients. Numerical estimations are given in the case Au (particle)-
Au(surface) and SiC (particle)-SiC (surface).
","[{""version"":""v1"",""created"":""Mon, 10 Sep 2012 16:04:15 GMT""}]","2012-09-11"
"1209.2047","Francesco Russo","Paltin Ionescu and Francesco Russo","Manifolds covered by lines and the Hartshorne Conjecture for quadratic
  manifolds","11 pages; this was part of math.AG/0909.2763, which has been
  withdrawn and divided into two parts. To appear in American Journal of Math.
  (accepted October 2011)","American Journal of Mathematics 135 (2013), 349-360","10.1353/ajm.2013.0020",,"math.AG","http://arxiv.org/licenses/nonexclusive-distrib/1.0/","  Small codimensional embedded manifolds defined byequations of small degree
are Fano and covered by lines. They are complete intersections exactly when the
variety of lines through a general point is so and has the right codimension.
This allows us to prove the Hartshorne Conjecture for manifolds defined by
quadratic equations and to obtain the list of such Hartshorne manifolds.
","[{""version"":""v1"",""created"":""Mon, 10 Sep 2012 16:09:56 GMT""}]","2014-11-25"
"1209.2048","Annalisa Buffa Dr.","A. Buffa, G. Sangalli, R. Vazquez","Isogeometric Methods for Computational Electromagnetics: B-spline and
  T-spline discretizations",,,,,"math.NA","http://arxiv.org/licenses/nonexclusive-distrib/1.0/","  In this paper we introduce methods for electromagnetic wave propagation,
based on splines and on T-splines. We define spline spaces which form a De Rham
complex and, following the isogeometric paradigm, we map them on domains which
are (piecewise) spline or NURBS geometries. We analyse their geometric
structure, as related to the connectivity of the underlying mesh, and we give a
physical interpretation of the fields degrees-of-freedom through the concept of
control fields. The theory is then extended to the case of meshes with
T-junctions, leveraging on the recent theory of T-splines. The use of T-splines
enhance our spline methods with local refinement capability and numerical tests
show the efficiency and the accuracy of the techniques we propose.
","[{""version"":""v1"",""created"":""Mon, 10 Sep 2012 16:11:34 GMT""}]","2012-09-11"
"1209.2049","Francesco Russo","Paltin Ionescu and Francesco Russo","On dual defective manifolds","13 pages; published version; to appear in Math. Res. Lett. arXiv
  admin note: substantial text overlap with arXiv:0909.2763","Math. Res. Lett. 21 (2014), 1-18",,,"math.AG","http://arxiv.org/licenses/nonexclusive-distrib/1.0/","  An embedded manifold is dual defective if its dual variety is not a
hypersurface. Using the geometry of the variety of lines through a general
point, we characterize scrolls among dual defective manifolds. This leads to an
optimal bound for the dual defect, which improves results due to Ein. Among
other things we also provide a short and easy proof of the famous Landman
Parity Theorem for dual defective manifolds based on our approach to the
subject. We also discuss our conjecture that every dual defective manifold with
cyclic Picard group should be secant defective, of a very special type, namely
a local quadratic entry locus variety.
","[{""version"":""v1"",""created"":""Mon, 10 Sep 2012 16:16:30 GMT""},{""version"":""v2"",""created"":""Sun, 23 Nov 2014 18:36:24 GMT""}]","2014-11-25"
"1209.2051","Nathan Goldman","Nathan Goldman, Jerome Beugnon and Fabrice Gerbier","Identifying topological edge states in 2D optical lattices using light
  scattering","17 pages, 10 figures. Revised and extended version, to appear in EJP
  Special Topic for the special issue on ""Novel Quantum Phases and Mesoscopic
  Physics in Quantum Gases"". Extended version of arXiv:1203.1246","Eur. Phys. J. Special Topics 217, 135-152 (2013)","10.1140/epjst/e2013-01762-x",,"cond-mat.quant-gas quant-ph","http://arxiv.org/licenses/nonexclusive-distrib/1.0/","  We recently proposed in a Letter [Physical Review Letters 108 255303] a novel
scheme to detect topological edge states in an optical lattice, based on a
generalization of Bragg spectroscopy. The scope of the present article is to
provide a more detailed and pedagogical description of the system - the
Hofstadter optical lattice - and probing method. We first show the existence of
topological edge states, in an ultra-cold gas trapped in a 2D optical lattice
and subjected to a synthetic magnetic field. The remarkable robustness of the
edge states is verified for a variety of external confining potentials. Then,
we describe a specific laser probe, made from two lasers in Laguerre-Gaussian
modes, which captures unambiguous signatures of these edge states. In
particular, the resulting Bragg spectra provide the dispersion relation of the
edge states, establishing their chiral nature. In order to make the Bragg
signal experimentally detectable, we introduce a ""shelving method"", which
simultaneously transfers angular momentum and changes the internal atomic
state. This scheme allows to directly visualize the selected edge states on a
dark background, offering an instructive view on topological insulating phases,
not accessible in solid-state experiments.
","[{""version"":""v1"",""created"":""Mon, 10 Sep 2012 16:22:40 GMT""},{""version"":""v2"",""created"":""Mon, 11 Feb 2013 18:29:06 GMT""}]","2013-03-11"
"1209.2053","Amanda Dotson","Amanda Dotson, Markos Georganopoulos, Demosthenes Kazanas, Eric S.
  Perlman","A method for localizing energy dissipation in blazars using Fermi
  variability","Accepted by Astrophysical Journal Letters",,"10.1088/2041-8205/758/1/L15",,"astro-ph.HE","http://arxiv.org/licenses/nonexclusive-distrib/1.0/","  The distance of the Fermi-detected blazar gamma-ray emission site from the
supermassive black hole is a matter of active debate. Here we present a method
for testing if the GeV emission of powerful blazars is produced within the
sub-pc scale broad line region (BLR) or farther out in the pc-scale molecular
torus (MT) environment. If the GeV emission takes place within the BLR, the
inverse Compton (IC) scattering of the BLR ultraviolet (UV) seed photons that
produces the gamma-rays takes place at the onset of the Klein-Nishina regime.
This causes the electron cooling time to become practically energy independent
and the variation of the gamma-ray emission to be almost achromatic. If on the
other hand the gamma-ray emission is produced farther out in the pc-scale MT,
the IC scattering of the infrared (IR) MT seed photons that produces the
gamma-rays takes place in the Thomson regime, resulting to energy-dependent
electron cooling times, manifested as faster cooling times for higher Fermi
energies. We demonstrate these characteristics and discuss the applicability
and limitations of our method.
","[{""version"":""v1"",""created"":""Mon, 10 Sep 2012 16:24:43 GMT""}]","2015-06-11"
"1209.2054","Benjamin Dudson","Ben Dudson, Sean Farley, Lois Curfman McInnes","Improved Nonlinear Solvers in BOUT++","15 pages, 4 figures. Submitted to Comp. Phys. Comm",,,,"physics.plasm-ph physics.comp-ph","http://arxiv.org/licenses/nonexclusive-distrib/1.0/","  Challenging aspects of large-scale turbulent edge simulations in plasma
physics include robust nonlinear solvers and efficient preconditioners. This
paper presents recent advances in the scalable solution of nonlinear partial
differential equations in BOUT++, with emphasis on simulations of edge
localized modes in tokamaks. A six-field, nonlinear, reduced
magnetohydrodynamics model containing the fast shear Alfven wave and electron
and ion heat conduction along magnetic fields is solved by using Jacobian-free
Newton-Krylov (JFNK) methods and nonlinear GMRES (NGMRES). Physics-based
preconditioning based on analytic Schur factorization of a simplified Jacobian
is found to result in an order of magnitude reduction in runtime over
unpreconditioned JFNK, and NGMRES is shown to significantly reduce runtime
while requiring only the nonlinear function evaluation. We describe in detail
the preconditioning algorithm, and we discuss parallel performance of NGMRES
and Newton-Krylov methods using the PETSc library.
","[{""version"":""v1"",""created"":""Mon, 10 Sep 2012 16:28:05 GMT""}]","2012-09-11"
"1209.2055","Jian-Huang She","Jian-Huang She, Jonas Fransson, A. R. Bishop, Alexander V. Balatsky","Inelastic Electron Tunneling Spectroscopy for Topological Insulators","5 pages, 5 figures","Phys. Rev. Lett. 110, 026802 (2013)","10.1103/PhysRevLett.110.026802",,"cond-mat.mes-hall cond-mat.str-el","http://arxiv.org/licenses/nonexclusive-distrib/1.0/","  Inelastic Electron Tuneling Spectroscopy (IETS) is a powerful spectroscopy
that allows one to investigate the nature of local excitations and energy
transfer in the system of interest. We study IETS for Topological Insulators
(TI) and investigate the role of inelastic scattering on the Dirac node states
on the surface of TIs. Local inelastic scattering is shown to significantly
modify the Dirac node spectrum. In the weak coupling limit, peaks and steps are
induced in second derivative $d^2I/dV^2$. In the strong coupling limit, the
local negative U centers are formed at impurity sites, and the Dirac cone
structure is fully destroyed locally. At intermediate coupling resonance peaks
emerge. We map out the evolution of the resonance peaks from weak to strong
coupling, which interpolate nicely between the two limits. There is a sudden
qualitative change of behavior at intermediate coupling, indicating the
possible existence of a local quantum phase transition. We also find that even
for a simple local phonon mode the inherent coupling of spin and orbital
degrees in TI leads to the spin polarized texture in inelastic Friedel
oscillations induced by local mode.
","[{""version"":""v1"",""created"":""Mon, 10 Sep 2012 16:32:14 GMT""}]","2013-01-11"
"1209.2056","Bayram Tekin","Cetin Senturk, Tahsin Cagri Sisman, Bayram Tekin","Energy and Angular Momentum in Generic F(Riemann) Theories","7 pages","Phys. Rev. D 86, 124030 (2012)","10.1103/PhysRevD.86.124030",,"hep-th gr-qc","http://arxiv.org/licenses/nonexclusive-distrib/1.0/","  We construct the conserved charge of generic gravity theories built on
arbitrary contractions of the Riemann tensor (but not on its derivatives) for
asymptotically (anti)-de Sitter spacetimes. Our construction is a
generalization of the ADT charges of linear and quadratic gravity theories in
cosmological backgrounds. As an explicit example we find the energy and angular
momentum of the BTZ black hole in the 2+1 dimensional Born-Infeld gravity.
","[{""version"":""v1"",""created"":""Mon, 10 Sep 2012 16:34:30 GMT""},{""version"":""v2"",""created"":""Tue, 11 Sep 2012 13:16:44 GMT""}]","2012-12-20"
"1209.2057","Fran\c{c}ois Genoud","Fran\c{c}ois Genoud","Orbitally stable standing waves for the asymptotically linear
  one-dimensional NLS","21 pages; minor amendments: more details added to the proof of
  Proposition 3.3 and to Example 3.4","Evolution Equations and Control Theory 2 (2013), 81-100",,,"math.AP nlin.PS","http://arxiv.org/licenses/nonexclusive-distrib/1.0/","  In this article we study the one-dimensional, asymptotically linear,
non-linear Schr\""odinger equation (NLS). We show the existence of a global
smooth curve of standing waves for this problem, and we prove that these
standing waves are orbitally stable. As far as we know, this is the first
rigorous stability result for the asymptotically linear NLS. We also discuss an
application of our results to self-focusing waveguides with a saturable
refractive index.
","[{""version"":""v1"",""created"":""Mon, 10 Sep 2012 16:41:16 GMT""},{""version"":""v2"",""created"":""Tue, 20 Nov 2012 09:57:41 GMT""}]","2013-05-29"
"1209.2058","Taylor T Johnson","Taylor T. Johnson and Sayan Mitra","Safe and Stabilizing Distributed Multi-Path Cellular Flows","An earlier version of this paper appeared in the 30th IEEE
  International Conference on Distributed Computing Systems (ICDCS 2010)",,,,"cs.RO cs.DC cs.MA cs.SY","http://arxiv.org/licenses/nonexclusive-distrib/1.0/","  We study the problem of distributed traffic control in the partitioned plane,
where the movement of all entities (robots, vehicles, etc.) within each
partition (cell) is coupled. Establishing liveness in such systems is
challenging, but such analysis will be necessary to apply such distributed
traffic control algorithms in applications like coordinating robot swarms and
the intelligent highway system. We present a formal model of a distributed
traffic control protocol that guarantees minimum separation between entities,
even as some cells fail. Once new failures cease occurring, in the case of a
single target, the protocol is guaranteed to self-stabilize and the entities
with feasible paths to the target cell make progress towards it. For multiple
targets, failures may cause deadlocks in the system, so we identify a class of
non-deadlocking failures where all entities are able to make progress to their
respective targets. The algorithm relies on two general principles: temporary
blocking for maintenance of safety and local geographical routing for
guaranteeing progress. Our assertional proofs may serve as a template for the
analysis of other distributed traffic control protocols. We present simulation
results that provide estimates of throughput as a function of entity velocity,
safety separation, single-target path complexity, failure-recovery rates, and
multi-target path complexity.
","[{""version"":""v1"",""created"":""Mon, 10 Sep 2012 16:45:01 GMT""},{""version"":""v2"",""created"":""Thu, 11 Oct 2012 15:38:32 GMT""}]","2015-03-13"
"1209.2059","Gilles Pisier","Gilles Pisier","Quantum Expanders and Geometry of Operator Spaces","v7: Paper now shortened: part on subexponential spaces now included
  in a different paper, see ""Random Matrices and Subexponential Operator
  Spaces"" on arxiv. v8,v9: minor corrections and references added. v10:
  Improvement of main result: now valid for any value of delta in (0,1). v11,
  March 2014: Improvement to function appearing in Lemma 1.12. To appear in the
  Journal of the European Math. Soc","J. Eur. Math. Soc. (JEMS) 16 (2014), 1183--1219",,,"math.OA math-ph math.FA math.MP","http://arxiv.org/licenses/nonexclusive-distrib/1.0/","  We show that there are well separated families of quantum expanders with
asymptotically the maximal cardinality allowed by a known upper bound. This has
applications to the ""growth"" of certain operator spaces: It implies
asymptotically sharp estimates for the growth of the multiplicity of
$M_N$-spaces needed to represent (up to a constant $C>1$) the $M_N$-version of
the $n$-dimensional operator Hilbert space $OH_n$ as a direct sum of copies of
$M_N$. We show that, when $C$ is close to 1, this multiplicity grows as
$\exp{\beta n N^2}$ for some constant $\beta>0$. The main idea is to relate
quantum expanders with ""smooth"" points on the matricial analogue of the
Euclidean unit sphere. This generalizes to operator spaces a classical
geometric result on $n$-dimensional Hilbert space (corresponding to N=1). In an
appendix, we give a quick proof of an inequality (related to Hastings's
previous work) on random unitary matrices that is crucial for this paper.
","[{""version"":""v1"",""created"":""Mon, 10 Sep 2012 16:57:53 GMT""},{""version"":""v10"",""created"":""Tue, 15 Oct 2013 20:52:51 GMT""},{""version"":""v11"",""created"":""Mon, 3 Mar 2014 11:32:51 GMT""},{""version"":""v2"",""created"":""Tue, 11 Sep 2012 07:42:35 GMT""},{""version"":""v3"",""created"":""Wed, 19 Sep 2012 16:10:30 GMT""},{""version"":""v4"",""created"":""Thu, 11 Oct 2012 20:30:16 GMT""},{""version"":""v5"",""created"":""Sat, 20 Oct 2012 20:00:04 GMT""},{""version"":""v6"",""created"":""Thu, 8 Nov 2012 00:26:17 GMT""},{""version"":""v7"",""created"":""Mon, 10 Dec 2012 13:37:00 GMT""},{""version"":""v8"",""created"":""Mon, 11 Mar 2013 17:40:38 GMT""},{""version"":""v9"",""created"":""Wed, 12 Jun 2013 11:18:23 GMT""}]","2014-12-23"
"1209.2060","Caterina Stoppato","Cinzia Bisi, Caterina Stoppato","The Schwarz-Pick lemma for slice regular functions","to appear in Indiana Univ. Math. J., 21 pages","Indiana Univ. Math. J., 61(1):297--317 (2012)","10.1512/iumj.2012.61.5076",,"math.CV","http://arxiv.org/licenses/nonexclusive-distrib/1.0/","  The celebrated Schwarz-Pick lemma for the complex unit disk is the basis for
the study of hyperbolic geometry in one and in several complex variables. In
the present paper, we turn our attention to the quaternionic unit ball B. We
prove a version of the Schwarz-Pick lemma for self-maps of B that are slice
regular, according to the definition of Gentili and Struppa. The lemma has
interesting applications in the fixed-point case, and it generalizes to the
case of vanishing higher order derivatives.
","[{""version"":""v1"",""created"":""Mon, 10 Sep 2012 16:59:22 GMT""}]","2013-02-12"
"1209.2061","Sinya Aoki","Sinya Aoki, Hidenori Fukaya and Yusuke Taniguchi","Chiral symmetry restoration, eigenvalue density of Dirac operator and
  axial U(1) anomaly at finite temperature","39 pages, 1 figure(2 eps files), a version published in PRD","Physical Review D86 (2012) 114512","10.1103/PhysRevD.86.114512","UTHEP-603; OU-HET-755","hep-lat hep-ph hep-th nucl-th","http://arxiv.org/licenses/nonexclusive-distrib/1.0/","  We reconsider constraints on the eigenvalue density of the Dirac operator in
the chiral symmetric phase of 2 flavor QCD at finite temperature. To avoid
possible ultra-violet(UV) divergences, we work on a lattice, employing the
overlap Dirac operator, which ensures the exact ""chiral"" symmetry at finite
lattice spacings. Studying multi-point correlation functions in various
channels and taking their thermodynamical limit (and then taking the chiral
limit), we obtain stronger constraints than those found in the previous
studies: both the eigenvalue density at the origin and its first and second
derivatives vanish in the chiral limit of 2 flavor QCD. In addition we show
that the axial U(1) anomaly becomes invisible in susceptibilities of scalar and
pseudo scalar mesons, suggesting that the 2nd order chiral phase transition
with the O(4) scaling is not realized in 2 flavor QCD. Possible lattice
artifacts when non-chiral lattice Dirac operator is employed are briefly
discussed.
","[{""version"":""v1"",""created"":""Mon, 10 Sep 2012 17:01:40 GMT""},{""version"":""v2"",""created"":""Mon, 17 Sep 2012 12:12:04 GMT""},{""version"":""v3"",""created"":""Mon, 8 Apr 2013 01:08:45 GMT""}]","2013-05-30"
"1209.2062","Andreas Weichselbaum","Andreas Weichselbaum","Tensor networks and the numerical renormalization group","20 pages, 11 figures (adapted from habilitation thesis)",,"10.1103/PhysRevB.86.245124",,"cond-mat.str-el quant-ph","http://arxiv.org/licenses/nonexclusive-distrib/1.0/","  The full-density-matrix numerical renormalization group (NRG) has evolved as
a systematic and transparent setting for the cal- culation of thermodynamical
quantities at arbitrary temperatures within the NRG framework. It directly
evaluates the relevant Lehmann representations based on the complete basis sets
intro- duced by Anders and Schiller (2005). In addition, specific attention is
given to the possible feedback from low energy physics to high energies by the
explicit and careful construction of the full thermal density matrix, naturally
generated over a distribution of energy shells. Specific examples are given in
terms of spectral functions (fdmNRG), time-dependent NRG (tdmNRG), Fermi-Golden
rule calculations (fgrNRG), as well as the calculation of plain thermodynamic
expectation values. Furthermore, based on the very fact that, by its iterative
nature, the NRG eigenstates are naturally described in terms of matrix product
states, the language of tensor networks has proven enormously convenient in the
description of the underlying algorithmic procedures. This paper therefore also
provides a detailed introduction and discussion of the prototypical NRG
calculations in terms of their corresponding tensor networks.
","[{""version"":""v1"",""created"":""Mon, 10 Sep 2012 17:06:11 GMT""}]","2013-05-30"
"1209.2063","Justin Moore","Justin Tatch Moore","Nonassociative Ramsey Theory and the amenability of Thompson's group","Over the weekend of September 29-30, 2012, Azer Akhmedov pointed out
  a serious error in Lemma 4.13. This error appears to be both serious and
  irreparable. I therefore withdraw my claim of a proof that F is amenable",,,,"math.GR math.CO math.FA math.LO math.RT","http://arxiv.org/licenses/nonexclusive-distrib/1.0/","  The purpose of this article is prove that Thompson's group F is amenable. The
methods developed will then be used to prove a generalization of Hindman's
theorem for the free nonassociative binary system on one generator.
","[{""version"":""v1"",""created"":""Mon, 10 Sep 2012 17:06:32 GMT""},{""version"":""v2"",""created"":""Tue, 18 Sep 2012 12:44:48 GMT""},{""version"":""v3"",""created"":""Mon, 24 Sep 2012 23:02:35 GMT""},{""version"":""v4"",""created"":""Mon, 1 Oct 2012 16:21:58 GMT""}]","2012-10-02"
"1209.2064","Tyler J. Jarvis","Dan Edidin, Tyler J. Jarvis, and Takashi Kimura","Chern Classes and Compatible Power Operations in Inertial K-theory","Many improvements. Special thanks to the referee for helpful
  suggestions. To appear in Annals of K-Theory. arXiv admin note: text overlap
  with arXiv:1202.0603","AKT 2 (2017) 73-130","10.2140/akt.2017.2.73",,"math.AG math.AT","http://arxiv.org/licenses/nonexclusive-distrib/1.0/","  Let [X/G] be a smooth Deligne-Mumford quotient stack. In a previous paper the
authors constructed a class of exotic products called inertial products on
K(I[X/G]), the Grothendieck group of vector bundles on the inertia stack
I[X/G]. In this paper we develop a theory of Chern classes and compatible power
operations for inertial products. When G is diagonalizable these give rise to
an augmented $\lambda$-ring structure on inertial K-theory.
  One well-known inertial product is the virtual product. Our results show that
for toric Deligne-Mumford stacks there is a $\lambda$-ring structure on
inertial K-theory. As an example, we compute the $\lambda$-ring structure on
the virtual K-theory of the weighted projective lines P(1,2) and P(1,3). We
prove that after tensoring with C, the augmentation completion of this
$\lambda$-ring is isomorphic as a $\lambda$-ring to the classical K-theory of
the crepant resolutions of singularities of the coarse moduli spaces of the
cotangent bundles $T^*P(1,2)$ and $T^*P(1,3)$, respectively. We interpret this
as a manifestation of mirror symmetry in the spirit of the Hyper-Kaehler
Resolution Conjecture.
","[{""version"":""v1"",""created"":""Mon, 10 Sep 2012 17:09:24 GMT""},{""version"":""v2"",""created"":""Sat, 6 Jun 2015 14:59:09 GMT""},{""version"":""v3"",""created"":""Mon, 26 Oct 2015 17:21:56 GMT""}]","2016-11-23"
