"1209.3017","Thomas Grimm","Federico Bonetti, Thomas W. Grimm and Stefan Hohenegger","Non-Abelian Tensor Towers and (2,0) Superconformal Theories","55 pages, 5 figures; v2: minus sign in eq. (4.13) fixed, final action
  (4.20) adjusted, references added",,"10.1007/JHEP05(2013)129",,"hep-th","http://arxiv.org/licenses/nonexclusive-distrib/1.0/","  With the aim to study six-dimensional (2,0) superconformal theories with
non-Abelian tensor multiplets we propose a five-dimensional superconformal
action with eight supersymmetries for an infinite tower of non-Abelian vector,
tensor and hypermultiplets. It describes the dynamics of the complete spectrum
of the (2,0) theories compactified on a circle coupled to an additional vector
multiplet containing the circle radius and the Kaluza-Klein vector arising from
the six-dimensional metric. All couplings are only given in terms of group
theoretical constants and the Kaluza-Klein levels. After superconformal
symmetry is reduced to Poincare supersymmetry we find a Kaluza-Klein inspired
action coupling super-Yang-Mills theory to an infinite tower of massive
non-Abelian tensors. We explore the possibility to restore sixteen
supersymmetries by using techniques known from harmonic superspace. Namely,
additional bosonic coordinates on a four-sphere are introduced to enhance the
R-symmetry group. Maximally supersymmetric Yang-Mills theories and the Abelian
(2,0) tensor theories are recovered as special cases of our construction.
Finally, we comment on the generation of an anomaly balancing Wess-Zumino term
for the R-symmetry vector at one loop.
","[{""version"":""v1"",""created"":""Thu, 13 Sep 2012 20:00:02 GMT""},{""version"":""v2"",""created"":""Tue, 6 Nov 2012 18:53:03 GMT""}]","2015-06-11"
"1209.3018","Andrew Benson","Andrew J. Benson (1), Arya Farahi (2), Shaun Cole (3), Leonidas A.
  Moustakas (4), Adrian Jenkins (3), Mark Lovell (3), Rachel Kennedy (3), John
  Helly (3), Carlos Frenk (3) ((1) Carnegie Observatories, Pasadena, CA, U.S.A,
  (2) Michigan Center for Theoretical Physics, The University of Michigan, Ann
  Arbor, MI, USA, (3) Institute for Computational Cosmology, University of
  Durham, Durham, UK, (4) Jet Propulsion Laboratory, California Institute of
  Technology, Pasadena, CA, USA)","Dark Matter Halo Merger Histories Beyond Cold Dark Matter: I - Methods
  and Application to Warm Dark Matter","19 pages, 14 figures, MNRAS in press. Comments welcome",,"10.1093/mnras/sts159",,"astro-ph.CO","http://arxiv.org/licenses/nonexclusive-distrib/1.0/","  We describe a methodology to accurately compute halo mass functions,
progenitor mass functions, merger rates and merger trees in non-cold dark
matter universes using a self-consistent treatment of the generalized extended
Press-Schechter formalism. Our approach permits rapid exploration of the
subhalo population of galactic halos in dark matter models with a variety of
different particle properties or universes with rolling, truncated, or more
complicated power spectra. We make detailed comparisons of analytically derived
mass functions and merger histories with recent warm dark matter cosmological
N-body simulations, and find excellent agreement. We show that, once the
accretion of smoothly distributed matter is accounted for, coarse-grained
statistics such as the mass accretion history of halos can be almost
indistinguishable between cold and warm dark matter cases. However, the halo
mass function and progenitor mass functions differ significantly, with the warm
dark matter cases being strongly suppressed below the free-streaming scale of
the dark matter. We demonstrate the importance of using the correct solution
for the excursion set barrier first-crossing distribution in warm dark matter -
if the solution for a flat barrier is used instead the truncation of the halo
mass function is much slower, leading to an overestimate of the number of low
mass halos.
","[{""version"":""v1"",""created"":""Thu, 13 Sep 2012 20:00:03 GMT""},{""version"":""v2"",""created"":""Sun, 7 Oct 2012 19:50:26 GMT""}]","2015-06-11"
"1209.3019","Wouter Waalewijn","Wouter J. Waalewijn","Calculating the Charge of a Jet","15 pages, 11 figures; v2: extension to pp collisions added and
  discussion of soft radiation expanded, journal version, v3: updated plots
  with new value of alpha_s to match Pythia default","Phys.Rev., D86, 094030 (2012)","10.1103/PhysRevD.86.094030",,"hep-ph nucl-th","http://arxiv.org/licenses/nonexclusive-distrib/1.0/","  Jet charge has played an important role in experimentally testing the Parton
Model and the Standard Model, and has many potential LHC applications. The
energy-weighted charge of a jet is not an infrared-safe quantity, so
hadronization must be taken into account. Here we develop the formalism to
calculate it, cleanly separating the nonperturbative from the perturbative
physics, which we compute at one-loop order. We first study the average and
width of the jet charge distribution, for which the nonperturbative input is
related to (dihadron) fragmentation functions. In an alternative and novel
approach, we consider the full nonperturbative jet charge distribution and
calculate its evolution and jet algorithm corrections, which has a natural
Monte Carlo-style implementation. Our numerical results are compared to Pythia
and agree well in almost all cases. This calculation can directly be extended
to similar track-based observables, such as the total track momentum generated
by an energetic parton.
","[{""version"":""v1"",""created"":""Thu, 13 Sep 2012 20:00:03 GMT""},{""version"":""v2"",""created"":""Mon, 3 Dec 2012 22:09:43 GMT""},{""version"":""v3"",""created"":""Fri, 29 Mar 2013 00:04:29 GMT""}]","2013-04-01"
"1209.3020","Ana Leonor Chies-Santos","A. L. Chies-Santos (Nottingham), S. S. Larsen (Nijmegen), M.
  Kissler-Patig (Gemini)","The old globular cluster system of NGC 4365: new VLT/FORS2 spectra","accepted by MNRAS, 11 pages, 10 figures, 4 tables",,"10.1111/j.1365-2966.2012.22135.x",,"astro-ph.CO","http://arxiv.org/licenses/nonexclusive-distrib/1.0/","  We present new spectroscopic observations of a sample of globular clusters
(GCs) in the Virgo Cluster elliptical NGC4365. The great majority of the
objects analysed here, overlap on purpose with objects presented in two
previous studies that came to contradictory conclusions. We measure Lick
indices for the GCs and infer ages, abundances and alpha-enhancement values by
comparing to population synthesis models. Our results do not support the
existence of numerous intermediate-age GCs in this galaxy as suggested by some
of the past studies. Instead, we find ages, consistent with the range ~8-14
Gyrs (model dependent and with large uncertainties). We also find that the
newly observed GCs have [Fe/H]\sim-1.3 to 0.3 dex and the majority are
consistent with [alpha/Fe]\sim0.3 dex, independent of metallicity. By comparing
the metal sensitive index [MgFe] with optical colours, we find that our data is
consistent with 14Gyr models. However for optical/near-infrared colours we find
that the same models would have to be redder by ~0.2 mag in order to be
consistent with our data. This offset is not found to be consistent with an age
effect as it is even larger for younger models.
","[{""version"":""v1"",""created"":""Thu, 13 Sep 2012 20:00:03 GMT""}]","2015-06-11"
"1209.3021","Alessia Gualandris","Alessia Gualandris, Michela Mapelli, Hagai B. Perets","Eccentric disc instability in stellar discs formed from inspiraling gas
  clouds in the Galactic Centre","7 pages, 8 figures, accepted for publication in MNRAS",,"10.1111/j.1365-2966.2012.22133.x",,"astro-ph.GA","http://arxiv.org/licenses/nonexclusive-distrib/1.0/","  The inspiral of a turbulent molecular cloud in the Galactic Centre may result
in the formation of a small, dense and moderately eccentric gas disc around the
supermassive black hole (SMBH). Such a disc is unstable to fragmentation and
may lead to the formation of young massive stars in the central parsec of the
Galaxy. Here we perform high-accuracy direct summation N-body simulations of a
ring of massive stars (with initial semi-major axes 0.1 < a/pc < 0.4 and
eccentricities 0.2 < e < 0.4), subject to the potential of the SMBH, a stellar
cusp, and the parent gas disc, to study how the orbital elements of the ring
evolve in time. The initial conditions for the stellar ring are drawn from the
results of previous simulations of molecular cloud infall and disruption in the
SMBH potential. While semi-major axes do not evolve significantly, the
distribution of eccentricities spreads out very fast (~1 Myr) as a consequence
of cusp precession. In particular, stellar orbits with initial eccentricity
e>0.3 (e<0.3) tend to become even more (less) eccentric, resulting in a bimodal
eccentricity distribution. The distribution is qualitatively consistent with
that of the massive stars observed in the Galactic Centre's clockwise disc.
","[{""version"":""v1"",""created"":""Thu, 13 Sep 2012 20:00:06 GMT""}]","2015-06-11"
"1209.3022","Rashmish Mishra","Zackaria Chacko and Rashmish K. Mishra","Effective Theory of a Light Dilaton","Version to appear in Phys. Rev. D",,"10.1103/PhysRevD.87.115006",,"hep-ph hep-th","http://arxiv.org/licenses/nonexclusive-distrib/1.0/","  We consider scenarios where strong conformal dynamics constitutes the
ultraviolet completion of the physics that drives electroweak symmetry
breaking. We show that in theories where the operator responsible for the
breaking of conformal symmetry is close to marginal at the breaking scale, the
dilaton mass can naturally lie below the scale of the strong dynamics. However,
in general this condition is not satisfied in the scenarios of interest for
electroweak symmetry breaking, and so the presence of a light dilaton in these
theories is associated with mild tuning. We construct the effective theory of
the light dilaton in this framework, and determine the form of its couplings to
Standard Model states. We show that corrections to the form of the dilaton
interactions arising from conformal symmetry violating effects are suppressed
by the square of the ratio of the dilaton mass to the strong coupling scale,
and are under good theoretical control. These corrections are generally
subleading, except in the case of dilaton couplings to marginal operators, when
symmetry violating effects can sometimes dominate. We investigate the
phenomenological implications of these results for models of technicolor, and
for models of the Higgs as a pseudo-Nambu-Goldstone boson, that involve strong
conformal dynamics in the ultraviolet.
","[{""version"":""v1"",""created"":""Thu, 13 Sep 2012 20:00:07 GMT""},{""version"":""v2"",""created"":""Wed, 3 Apr 2013 19:31:33 GMT""},{""version"":""v3"",""created"":""Mon, 24 Jun 2013 04:54:31 GMT""}]","2013-06-25"
"1209.3023","Michele Maltoni","M. C. Gonzalez-Garcia, Michele Maltoni, Jordi Salvado, Thomas Schwetz","Global fit to three neutrino mixing: critical look at present precision","23 pages, 7 figures. v3: final version to appear in JHEP. Updated
  results will be provided at http://www.nu-fit.org","JHEP 1212:123, 2012","10.1007/JHEP12(2012)123","IFT-UAM/CSIC-12-88; YITP-SB-12-33","hep-ph hep-ex","http://arxiv.org/licenses/nonexclusive-distrib/1.0/","  We present an up-to-date global analysis of solar, atmospheric, reactor, and
accelerator neutrino data in the framework of three-neutrino oscillations. We
provide results on the determination of theta_13 from global data and discuss
the dependence on the choice of reactor fluxes. We study in detail the
statistical significance of a possible deviation of theta_23 from maximal
mixing, the determination of its octant, the ordering of the mass states, and
the sensitivity to the CP violating phase, and discuss the role of various
complementary data sets in those respects.
","[{""version"":""v1"",""created"":""Thu, 13 Sep 2012 20:00:20 GMT""},{""version"":""v2"",""created"":""Mon, 17 Sep 2012 19:05:57 GMT""},{""version"":""v3"",""created"":""Wed, 19 Dec 2012 13:38:27 GMT""}]","2013-01-04"
"1209.3024","Tim Johannsen","Tim Johannsen (Waterloo, Perimeter, Arizona)","Testing General Relativity in the Strong-Field Regime with Observations
  of Black Holes in the Electromagnetic Spectrum","6 pages (preprint), dissertation summary, to appear in PASP",,"10.1086/668409",,"astro-ph.HE gr-qc","http://arxiv.org/licenses/nonexclusive-distrib/1.0/","  General relativity has been tested by many experiments, which, however,
almost exclusively probe weak spacetime curvatures. In this thesis, I create
two frameworks for testing general relativity in the strong-field regime with
observations of black holes in the electromagnetic spectrum using current or
near-future instruments. In the first part of this thesis, I design tests of
the no-hair theorem, which uniquely characterizes the nature of black holes in
general relativity in terms of their masses and spins and which states that
these compact objects are described by the Kerr metric. I investigate a
quasi-Kerr metric and construct a Kerr-like spacetime, both of which contain an
independent parameter in addition to mass and spin. If the no-hair theorem is
correct, then any deviation from the Kerr metric has to be zero. I show that
already moderate changes of the deviation parameters in either metric lead to
significant modifications of the observed signals. I apply this framework to
the imaging of supermassive black holes using very-long baseline interferometry
as well as to the quasi-periodic variability and relativistically broadened
iron lines observed in both galactic and supermassive black holes. In the
second part of this thesis, I devise a method to test the predicted evaporation
of black holes in Randall-Sundrum-type braneworld gravity through the orbital
evolution of black-hole X-ray binaries and obtain constraints on the size of
the extra dimension from A0620-00 and XTE J1118+480.
","[{""version"":""v1"",""created"":""Thu, 13 Sep 2012 20:00:58 GMT""}]","2015-06-11"
"1209.3025","Phillip Szepietowski","Phillip Szepietowski","Comments on a-maximization from gauged supergravity","v2: Generalized reduction to include cases of two-sphere and torus.
  Added references, fixed typos",,"10.1007/JHEP12(2012)018",,"hep-th","http://arxiv.org/licenses/nonexclusive-distrib/1.0/","  In this paper we study the holographic dual to a-maximization in
five-dimensional N = 2 gauged supergravity. In particular, we apply the
procedure described by Tachikawa to specific examples consisting of holographic
duals to gauge theories arising as the IR limit of N M5-branes wrapping a
Riemann surface. A key element of this analysis is a consistent truncation of
seven-dimensional N = 4 SO(5) gauged supergravity reduced on a Riemann surface.
We demonstrate the consistency of this truncation and match to a sector of
five-dimensional matter-coupled N = 2 gauged supergravity. We determine the
U(1)_R symmetry and central charge of these theories and find agreement with
the literature. The final results provide a nontrivial illustration of the
holographic interpretation of a-maximization.
","[{""version"":""v1"",""created"":""Thu, 13 Sep 2012 20:07:20 GMT""},{""version"":""v2"",""created"":""Fri, 2 Nov 2012 18:22:16 GMT""}]","2012-12-24"
"1209.3026","Hany SalahEldeen","Hany M. SalahEldeen and Michael L. Nelson","Losing My Revolution: How Many Resources Shared on Social Media Have
  Been Lost?","12 pages, Theory and Practice of Digital Libraries (TPDL) 2012",,,,"cs.DL cs.IR","http://arxiv.org/licenses/nonexclusive-distrib/1.0/","  Social media content has grown exponentially in the recent years and the role
of social media has evolved from just narrating life events to actually shaping
them. In this paper we explore how many resources shared in social media are
still available on the live web or in public web archives. By analyzing six
different event-centric datasets of resources shared in social media in the
period from June 2009 to March 2012, we found about 11% lost and 20% archived
after just a year and an average of 27% lost and 41% archived after two and a
half years. Furthermore, we found a nearly linear relationship between time of
sharing of the resource and the percentage lost, with a slightly less linear
relationship between time of sharing and archiving coverage of the resource.
From this model we conclude that after the first year of publishing, nearly 11%
of shared resources will be lost and after that we will continue to lose 0.02%
per day.
","[{""version"":""v1"",""created"":""Thu, 13 Sep 2012 20:08:07 GMT""}]","2012-09-17"
"1209.3027","Luke Zoltan Kelley","Luke Zoltan Kelley, Ilya Mandel and Enrico Ramirez-Ruiz","Electromagnetic transients as triggers in searches for gravitational
  waves from compact binary mergers","17 pages, 2 figures, 9 tables. Matches content of published PRD
  article","Phys. Rev. D 87, 123004 (2013)","10.1103/PhysRevD.87.123004",,"astro-ph.IM astro-ph.HE gr-qc","http://arxiv.org/licenses/nonexclusive-distrib/1.0/","  The detection of an electromagnetic transient which may originate from a
binary neutron star merger can increase the probability that a given segment of
data from the LIGO-Virgo ground-based gravitational-wave detector network
contains a signal from a binary coalescence. Additional information contained
in the electromagnetic signal, such as the sky location or distance to the
source, can help rule out false alarms, and thus lower the necessary threshold
for a detection. Here, we develop a framework for determining how much
sensitivity is added to a gravitational-wave search by triggering on an
electromagnetic transient. We apply this framework to a variety of relevant
electromagnetic transients, from short GRBs to signatures of r-process heating
to optical and radio orphan afterglows. We compute the expected rates of
multi-messenger observations in the Advanced detector era, and find that
searches triggered on short GRBs --- with current high-energy instruments, such
as Fermi --- and nucleosynthetic `kilonovae' --- with future optical surveys,
like LSST --- can boost the number of multi-messenger detections by 15% and
40%, respectively, for a binary neutron star progenitor model. Short GRB
triggers offer precise merger timing, but suffer from detection rates decreased
by beaming and the high a priori probability that the source is outside the
LIGO-Virgo sensitive volume. Isotropic kilonovae, on the other hand, could be
commonly observed within the LIGO-Virgo sensitive volume with an instrument
roughly an order of magnitude more sensitive than current optical surveys. We
propose that the most productive strategy for making multi-messenger
gravitational-wave observations is using triggers from future deep, optical
all-sky surveys, with characteristics comparable to LSST, which could make as
many as ten such coincident observations a year.
","[{""version"":""v1"",""created"":""Thu, 13 Sep 2012 20:11:10 GMT""},{""version"":""v2"",""created"":""Wed, 26 Jun 2013 19:50:55 GMT""}]","2013-06-27"
"1209.3028","Jeff Thompson","J. D. Thompson, T. G. Tiecke, A. S. Zibrov, V. Vuleti\'c, M. D. Lukin","Coherence and Raman sideband cooling of a single atom in an optical
  tweezer","5 pages, 4 figures",,"10.1103/PhysRevLett.110.133001",,"physics.atom-ph quant-ph","http://arxiv.org/licenses/nonexclusive-distrib/1.0/","  We investigate quantum control of a single atom in an optical tweezer trap
created by a tightly focused optical beam. We show that longitudinal
polarization components in the dipole trap arising from the breakdown of the
paraxial approximation give rise to significant internal-state decoherence. We
show that this effect can be mitigated by appropriate choice of magnetic bias
field, enabling Raman sideband cooling of a single atom close to its
three-dimensional ground state in an optical trap with a beam waist as small as
$w=900$ nm. We achieve vibrational occupation numbers of $\bar{n}_r = 0.01$ and
$\bar{n}_a = 8$ in the radial and axial directions of the trap, corresponding
to an rms size of the atomic wavepacket of 24 nm and 270 nm, respectively. This
represents a promising starting point for future hybrid quantum systems where
atoms are placed in close proximity to surfaces.
","[{""version"":""v1"",""created"":""Thu, 13 Sep 2012 20:23:26 GMT""}]","2015-06-11"
"1209.3029","Graham Coop","Torsten G\""unther and Graham Coop","Robust identification of local adaptation from allele frequencies","27 pages, 7 figures",,,,"q-bio.PE stat.AP","http://arxiv.org/licenses/nonexclusive-distrib/1.0/","  Comparing allele frequencies among populations that differ in environment has
long been a tool for detecting loci involved in local adaptation. However, such
analyses are complicated by an imperfect knowledge of population allele
frequencies and neutral correlations of allele frequencies among populations
due to shared population history and gene flow. Here we develop a set of
methods to robustly test for unusual allele frequency patterns, and
correlations between environmental variables and allele frequencies while
accounting for these complications based on a Bayesian model previously
implemented in the software Bayenv. Using this model, we calculate a set of
`standardized allele frequencies' that allows investigators to apply tests of
their choice to multiple populations, while accounting for sampling and
covariance due to population history. We illustrate this first by showing that
these standardized frequencies can be used to calculate powerful tests to
detect non-parametric correlations with environmental variables, which are also
less prone to spurious results due to outlier populations. We then demonstrate
how these standardized allele frequencies can be used to construct a test to
detect SNPs that deviate strongly from neutral population structure. This test
is conceptually related to FST but should be more powerful as we account for
population history. We also extend the model to next-generation sequencing of
population pools, which is a cost-efficient way to estimate population allele
frequencies, but it implies an additional level of sampling noise. The utility
of these methods is demonstrated in simulations and by re-analyzing human SNP
data from the HGDP populations. An implementation of our method will be
available from http://gcbias.org.
","[{""version"":""v1"",""created"":""Thu, 13 Sep 2012 20:27:09 GMT""}]","2012-09-17"
"1209.3031","Ravi Kuchimanchi","Ravi Kuchimanchi","P stabilizes dark matter and with CP can predict leptonic phases","Updated version with better formatting. Results unchanged","Eur. Phys. J. C 74, 2726 (2014)","10.1140/epjc/s10052-014-2726-5",,"hep-ph astro-ph.CO hep-ex","http://arxiv.org/licenses/nonexclusive-distrib/1.0/","  We find that spontaneously broken parity (P) or left-right symmetry
stabilizes dark matter in a beautiful way. If dark matter has a non-real
intrinsic parity \pm i (e.g. Majorana fermions), parity can ensure that it
cannot decay to all normal particles with real intrinsic parities. However if
Majorana couplings are absent either in the Lepton or the dark sector, P
symmetry can be redefined to remove relative non-real intrinsic phases. It is
therefore predicted that neutrinos and dark matter fermions must have Majorana
masses if dark matter is stable due to parity. We also consider vectorlike
doublet fermions with intrinsic parity \pm i. Strong CP problem is solved by
additionally imposing CP. Leptonic CP phases vanish at the tree level in the
minimal strong CP solving model, which is a testable prediction. Experimentally
if leptonic CP phases are not found (they are found to be consistent with 0 or
\pi) it can be evidence for the type of models in this work where CP is
spontaneously or softly broken and there is also a second hidden or softly
broken symmetry such as P, Z_2 or Z_4. However leptonic CP violation can be
present in closely related or some non-minimal versions of these models.
","[{""version"":""v1"",""created"":""Thu, 13 Sep 2012 20:29:00 GMT""},{""version"":""v2"",""created"":""Thu, 4 Oct 2012 19:50:15 GMT""},{""version"":""v3"",""created"":""Sun, 19 May 2013 18:22:24 GMT""},{""version"":""v4"",""created"":""Wed, 16 Oct 2013 20:10:55 GMT""}]","2014-02-07"
"1209.3032","Alessandro Giuliani","Alessandro Giuliani","The nematic phase of a system of long hard rods - ICMP12 talk, Aalborg,
  August 2012","Contribution to the proceedings of the International Congress on
  Mathematical Physics, Aalborg, Denmark, August 6-11, 2012",,,,"math-ph cond-mat.stat-mech math.MP","http://arxiv.org/licenses/nonexclusive-distrib/1.0/","  In this talk I consider a two-dimensional lattice model for liquid crystals
consisting of long rods interacting via purely hard core interactions, with two
allowed orientations defined by the underlying lattice. I report a rigorous
proof of the existence of a nematic phase: by this I mean that at intermediate
densities the system exhibits orientational order, either horizontal or
vertical, but no positional order. The proof is based on a two-scales cluster
expansion: first the system is coarse-grained on a scale comparable with the
rods' length; then the resulting effective theory is re-expressed as a
contours' model, which can be treated by Pirogov-Sinai methods. The talk is
based on joint work with Margherita Disertori.
","[{""version"":""v1"",""created"":""Thu, 13 Sep 2012 20:39:36 GMT""}]","2012-09-17"
