"1209.3095","Kimin Park","Kimin Park, Seung-Woo Lee, and Hyunseok Jeong","Quantum teleportation between ""particle-like"" and ""field-like"" qubits
  using hybrid entanglement under decoherence effects","10 pages, 5 figures, a section has been added to discuss the
  postselection issue for teleportation, to be published in Phys. Rev. A","Phys. Rev. A 86, 062301 (2012)","10.1103/PhysRevA.86.062301",,"quant-ph","http://arxiv.org/licenses/nonexclusive-distrib/1.0/","  We study quantum teleportation between two different types of optical qubits,
one of which is ""particle-like"" and the other ""field-like,"" via hybrid
entangled states under the effects of decoherence.
  We find that teleportation from particle-like to field-like qubits can be
achieved with a higher fidelity than that in the opposite direction. However,
teleportation from field-like to particle-like qubits is found to be more
efficient in terms of the success probabilities. Our study shows that the
direction of teleportation should be considered an important factor in
developing optical hybrid architectures for quantum information processing.
","[{""version"":""v1"",""created"":""Fri, 14 Sep 2012 05:48:33 GMT""},{""version"":""v2"",""created"":""Fri, 16 Nov 2012 07:14:18 GMT""}]","2012-12-05"
"1209.3096","Changxing Miao","Changxing Miao, Junyong Zhang and Jiqiang Zheng","The Defocusing Energy-Critical Wave Equation with a Cubic Convolution","19 pages, In this version, we prove the result in Proposition 4.1 in
  an averaged-in-time sense, and we utilize the potential energy concentration
  in an averaged-in-time sense and the Morawetz estimate to kill finite time
  blow up solutions in Section 6","Indiana University Mathematics Journal, Vol. 63,
  No.4(2014)993-1015","10.1512/iumj.2014.63.5271",,"math.AP math-ph math.MP","http://arxiv.org/licenses/nonexclusive-distrib/1.0/","  In this paper, we study the theory of the global well-posedness and
scattering for the energy-critical wave equation with a cubic convolution
nonlinearity $u_{tt}-\Delta u+(|x|^{-4}\ast|u|^2)u=0$ in spatial dimension $d
\geq 5$. The main difficulties are the absence of the classical finite speed of
propagation (i.e. the monotonic local energy estimate on the light cone), which
is a fundamental property to show the global well-posedness and then to obtain
scattering for the wave equations with the local nonlinearity $u_{tt}-\Delta
u+|u|^\frac4{d-2}u=0$. To compensate it, we resort to the extended causality
and utilize the strategy derived from concentration compactness ideas. Then,
the proof of the global well-posedness and scattering is reduced to show the
nonexistence of the three enemies: finite time blowup; soliton-like solutions
and low-to-high cascade. We will utilize the Morawetz estimate, the extended
causality and the potential energy concentration to preclude the above three
enemies.
","[{""version"":""v1"",""created"":""Fri, 14 Sep 2012 05:57:06 GMT""},{""version"":""v2"",""created"":""Wed, 16 Jan 2013 01:49:42 GMT""},{""version"":""v3"",""created"":""Fri, 10 Oct 2014 11:25:14 GMT""}]","2020-05-08"
"1209.3097","Takafumi Suzuki","Takafumi Suzuki and Masahiro Sato","Gapless edge states and their stability in two-dimensional quantum
  magnets","8 pages, 7 figures","Phys. Rev. B 86, 224411 (2012)","10.1103/PhysRevB.86.224411",,"cond-mat.str-el","http://arxiv.org/licenses/nonexclusive-distrib/1.0/","  We study the nature of edge states in extrinsically and spontaneously
dimerized states of two-dimensional spin-1/2 antiferromagnets, by performing
quantum Monte Carlo simulation. We show that a gapless edge mode emerges in the
wide region of the dimerized phases, and the critical exponent of spin
correlators along the edge deviates from the value of Tomonaga-Luttinger (TL)
liquid universality in large but finite systems at low temperatures. We also
demonstrate that the gapless nature at edges is stable against several
perturbations such as external magnetic field, easy-plane XXZ anisotropy,
Dzyaloshinskii-Moriya interaction, and further-neighbor exchange interactions.
The edge states exhibit non TL-liquid behavior, depending strongly on model
parameters and kinds of perturbations. Possible ways of detecting these edge
states are discussed. Properties of edge states we show in this paper could
also be used as reference points to study other edge states of more exotic
gapped magnetic phases such as spin liquids.
","[{""version"":""v1"",""created"":""Fri, 14 Sep 2012 06:00:58 GMT""},{""version"":""v2"",""created"":""Wed, 19 Dec 2012 10:06:20 GMT""}]","2012-12-20"
"1209.3098","Solesne Bourguin","Solesne Bourguin (FSTC), Giovanni Peccati (FSTC)","Portmanteau inequalities on the Poisson space: mixed regimes and
  multidimensional clustering",,"Electron. J. Probab. 19 (2014), no. 66, 1-42",,,"math.PR","http://arxiv.org/licenses/nonexclusive-distrib/1.0/","  Using Malliavin operators together with an interpolation technique inspired
by Arratia, Goldstein and Gordon (1989), we prove a new inequality on the
Poisson space, allowing one to measure the distance between the laws of a
general random vector, and of a target random element composed of Gaussian and
Poisson random variables. Several consequences are deduced from this result, in
particular: (1) new abstract criteria for multidimensional stable convergence
on the Poisson space, (2) a class of mixed limit theorems, involving both
Poisson and Gaussian limits, (3) criteria for the asymptotic independence of
$U$-statistics obeying to Gaussian and Poisson asymptotic regimes. Our results
generalize and unify several previous findings in the field. We provide an
application to joint sub-graph counting in random geometric graphs.
","[{""version"":""v1"",""created"":""Fri, 14 Sep 2012 06:08:46 GMT""},{""version"":""v2"",""created"":""Wed, 26 Sep 2012 12:51:54 GMT""},{""version"":""v3"",""created"":""Tue, 18 Jun 2013 16:54:25 GMT""}]","2014-09-05"
"1209.3099","Jalil Boukhobza","Jalil Boukhobza (Lab-STICC), Pierre Olivier (Lab-STICC), St\'ephane
  Rubini (LISYC)","A Cache Management Strategy to Replace Wear Leveling Techniques for
  Embedded Flash Memory","Ce papier a obtenu le ""Best Paper Award"" dans le ""Computer System
  track"" nombre de page: 8; International Symposium on Performance Evaluation
  of Computer & Telecommunication Systems, La Haye : Netherlands (2011)",,,,"cs.AR","http://arxiv.org/licenses/nonexclusive-distrib/1.0/","  Prices of NAND flash memories are falling drastically due to market growth
and fabrication process mastering while research efforts from a technological
point of view in terms of endurance and density are very active. NAND flash
memories are becoming the most important storage media in mobile computing and
tend to be less confined to this area. The major constraint of such a
technology is the limited number of possible erase operations per block which
tend to quickly provoke memory wear out. To cope with this issue,
state-of-the-art solutions implement wear leveling policies to level the wear
out of the memory and so increase its lifetime. These policies are integrated
into the Flash Translation Layer (FTL) and greatly contribute in decreasing the
write performance. In this paper, we propose to reduce the flash memory wear
out problem and improve its performance by absorbing the erase operations
throughout a dual cache system replacing FTL wear leveling and garbage
collection services. We justify this idea by proposing a first performance
evaluation of an exclusively cache based system for embedded flash memories.
Unlike wear leveling schemes, the proposed cache solution reduces the total
number of erase operations reported on the media by absorbing them in the cache
for workloads expressing a minimal global sequential rate.
","[{""version"":""v1"",""created"":""Fri, 14 Sep 2012 06:09:10 GMT""}]","2012-09-17"
"1209.3100","Thomas Cass","Thomas Cass, Martin Hairer, Christian Litterer, Samy Tindel","Smoothness of the density for solutions to Gaussian rough differential
  equations","Published in at http://dx.doi.org/10.1214/13-AOP896 the Annals of
  Probability (http://www.imstat.org/aop/) by the Institute of Mathematical
  Statistics (http://www.imstat.org)","Annals of Probability 2015, Vol. 43, No. 1, 188-239","10.1214/13-AOP896","IMS-AOP-AOP896","math.PR","http://arxiv.org/licenses/nonexclusive-distrib/1.0/","  We consider stochastic differential equations of the form
$dY_t=V(Y_t)\,dX_t+V_0(Y_t)\,dt$ driven by a multi-dimensional Gaussian
process. Under the assumption that the vector fields $V_0$ and
$V=(V_1,\ldots,V_d)$ satisfy H\""{o}rmander's bracket condition, we demonstrate
that $Y_t$ admits a smooth density for any $t\in(0,T]$, provided the driving
noise satisfies certain nondegeneracy assumptions. Our analysis relies on
relies on an interplay of rough path theory, Malliavin calculus and the theory
of Gaussian processes. Our result applies to a broad range of examples
including fractional Brownian motion with Hurst parameter $H>1/4$, the
Ornstein-Uhlenbeck process and the Brownian bridge returning after time $T$.
","[{""version"":""v1"",""created"":""Fri, 14 Sep 2012 06:16:12 GMT""},{""version"":""v2"",""created"":""Tue, 20 Jan 2015 07:52:23 GMT""}]","2015-01-21"
"1209.3101","Zeki Kasap","Zeki Kasap and Mehmet Tekkoyun","Mechanical Equations on Bi-Para Conformal Geometry",,,,,"math.GM","http://arxiv.org/licenses/nonexclusive-distrib/1.0/","  This study is an extented analogue to conformal geometry of the paper given
by [14]. Also, the geometric and physical results related to
bi-para-conformal-dynamical systems are also presented.
","[{""version"":""v1"",""created"":""Fri, 14 Sep 2012 06:17:52 GMT""},{""version"":""v2"",""created"":""Sat, 22 Sep 2012 11:27:28 GMT""}]","2015-03-13"
"1209.3102","Octavio Andres Gonzalez Estrada","Octavio Andr\'es Gonz\'alez Estrada (IMAM), E. Nadal (CITV), J.J.
  R\'odenas (CITV), Pierre Kerfriden, St\'ephane Pierre-Alain Bordas (IMAM),
  F.J. Fuenmayor (CITV)","Mesh adaptivity driven by goal-oriented locally equilibrated
  superconvergent patch recovery","in Computational Mechanics",,,,"math.NA cs.NA physics.class-ph","http://arxiv.org/licenses/nonexclusive-distrib/1.0/","  During the last decade there has been an increase on the use of goal-oriented
error estimates which help to quantify and control the local error on a
quantity of interest (QoI) that might result relevant for design purposes (e.g.
the mean stress or mean displacement in a particular area, the stress intensity
factor for fracture problems,...). Residual-based error estimators have been
used to estimate the error in quantities of interest for finite element
approximations. This work presents a recovery-based error estimation technique
for QoI whose main characteristic is the use of an enhanced version of the
Superconvergent Patch Recovery (SPR) technique developed by Zienkiewicz and
Zhu. This enhanced version of the SPR technique, used to recover the primal and
dual solutions, provides a nearly statically admissible stress field that
results in accurate estimations of the error in the QoI.
","[{""version"":""v1"",""created"":""Fri, 14 Sep 2012 06:27:44 GMT""},{""version"":""v2"",""created"":""Sat, 24 Nov 2012 06:30:05 GMT""},{""version"":""v3"",""created"":""Tue, 15 Oct 2013 04:57:05 GMT""}]","2013-10-16"
"1209.3103","Francis Filbet","Francis Filbet, Chang Yang","Inverse Lax-Wendroff method for boundary conditions of Boltzmann type
  models",,,"10.1016/j.jcp.2013.03.015",,"math.NA","http://arxiv.org/licenses/nonexclusive-distrib/1.0/","  In this paper we present a new algorithm based on a Cartesian mesh for the
numerical approximation of kinetic models on complex geometry boundary. Due to
the high dimensional property, numerical algorithms based on unstructured
meshes for a complex geometry are not appropriate. Here we propose to develop
an inverse Lax-Wendroff pro- cedure, which was recently introduced for
conservation laws [S. Tan & C.W. Shu, JCP (2010)], to the kinetic equations.
Applications in 1Dx3D and 2Dx3D of this algorithm for Boltzmann type operators
(BGK, ES-BGK models) are then presented and numerical results illustrate the
accuracy properties of this algorithm.
","[{""version"":""v1"",""created"":""Fri, 14 Sep 2012 06:28:59 GMT""}]","2015-06-11"
"1209.3104","Davood Momeni Dr","D. Momeni, M. R. Setare, Ratbay Myrzakulov","Condensation of the scalar field with Stuckelberg and Weyl Corrections
  in the background of a planar AdS-Schwarzschild black hole","Matched with published version,Replaced to remove text overlaps with
  previous work by the same authors. arXiv admin note: substantial text overlap
  with arXiv:1106.0431","Int. J. Mod. Phys. A27, 1250128 (2012)","10.1142/S0217751X1250128X",,"physics.gen-ph hep-th","http://arxiv.org/licenses/nonexclusive-distrib/1.0/","  We study analytical properties of the Stuckelberg holographic superconductors
with Weyl corrections. We obtain the minimum critical temperature as a function
of the mass of the scalar field $m^2$. We show that in limit of the
$m^2=-3$,$T^{Min}_c\approx0.158047\sqrt[3]{\rho}$ which is close to the
numerical estimate $T_c^{Numerical}\approx 0.170\sqrt[3]{\rho}$. Further we
show that the mass of the scalar field in bounded from below by the $
m^2>m_c^2$ where $m_c^2=-5.40417$. This lower bound is weaker and different
from the previous lower bound $m^2=-3$ predicted by stability analysis. We show
that in the Breitenlohner-Freedman bound, the critical temperature remains
finite. Explicitly, we prove that here there is exist a linear relation between
$<O_{\Delta}>$ and the chemical potential.
","[{""version"":""v1"",""created"":""Fri, 14 Sep 2012 06:35:49 GMT""},{""version"":""v2"",""created"":""Tue, 5 Aug 2014 07:08:59 GMT""}]","2014-08-06"
"1209.3105","Yuan Liu Yuan Liu","Meixia Tao and Yuan Liu","Spectrum Leasing and Cooperative Resource Allocation in Cognitive OFDMA
  Networks","to appear in IEEE/KICS Journal of Communications and Networks",,,,"cs.IT math.IT","http://arxiv.org/licenses/nonexclusive-distrib/1.0/","  This paper considers a cooperative OFDMA-based cognitive radio network where
the primary system leases some of its subchannels to the secondary system for a
fraction of time in exchange for the secondary users (SUs) assisting the
transmission of primary users (PUs) as relays. Our aim is to determine the
cooperation strategies among the primary and secondary systems so as to
maximize the sum-rate of SUs while maintaining quality-of-service (QoS)
requirements of PUs. We formulate a joint optimization problem of PU
transmission mode selection, SU (or relay) selection, subcarrier assignment,
power control, and time allocation. By applying dual method, this mixed integer
programming problem is decomposed into parallel per-subcarrier subproblems,
with each determining the cooperation strategy between one PU and one SU. We
show that, on each leased subcarrier, the optimal strategy is to let a SU
exclusively act as a relay or transmit for itself. This result is fundamentally
different from the conventional spectrum leasing in single-channel systems
where a SU must transmit a fraction of time for itself if it helps the PU's
transmission. We then propose a subgradient-based algorithm to find the
asymptotically optimal solution to the primal problem in polynomial time.
Simulation results demonstrate that the proposed algorithm can significantly
enhance the network performance.
","[{""version"":""v1"",""created"":""Fri, 14 Sep 2012 06:45:58 GMT""}]","2012-09-17"
"1209.3106","Paolo Cea","Paolo Cea","Comment on the evidence of the Higgs boson at LHC","9 pages, 1 figure",,,,"hep-ph hep-ex","http://arxiv.org/licenses/nonexclusive-distrib/1.0/","  We comment on the Standard Model Higgs boson evidence from LHC. We propose
that the new resonance at 125 GeV could be interpreted as a pseudoscalar meson
with quantum number $J^{PC} = 0^{- +}$. We show that this pseudoscalar could
mimic the decays of the Standard Model Higgs boson in all channels with the
exception of the decay into two leptons that is strongly suppressed due to
charge-conjugation invariance.
","[{""version"":""v1"",""created"":""Fri, 14 Sep 2012 06:50:30 GMT""}]","2012-09-17"
"1209.3107","Chiu Man Ho","Chiu Man Ho and Thomas J. Weiler","Physical and Stable Closed Timelike Curves","7 pages, 2 figures, v2: version to appear in MPLA","Mod. Phys. Lett. A28, 1250237 (2013)","10.1142/S0217732312502379",,"gr-qc","http://arxiv.org/licenses/nonexclusive-distrib/1.0/","  We construct a class of closed timelike curves (CTCs) using a compactified
extra dimension $u$. A nonzero metric element $g_{tu}(u)$ enables particles to
travel backwards in global time $t$. The compactified dimension guarantees that
the geodesic curve closes in $u$. The effective 2D ($t$ and $u$) nature of the
metric ensures that spacetime is flat, therein satisfying all the classical
stability conditions as expressed by the energy conditions. Finally,
stationarity of the metric guarantees that a particle's energy is conserved.
The pathologies that plague many hypothesized metrics admitting CTCs, e.g. an
infinite cylinder of matter, a negative energy-distribution, particle
acceleration/blue-shifting along the CTC, do not occur within our metric class.
","[{""version"":""v1"",""created"":""Fri, 14 Sep 2012 06:59:28 GMT""},{""version"":""v2"",""created"":""Tue, 4 Dec 2012 20:57:06 GMT""}]","2015-06-11"
"1209.3108","Alexander Cholach","A. R. Cholach and V. M. Tapilin","The general traits of inelastic electron scattering by the adsorbed
  system","Fundamental peculiarities of electron-solid interaction: 17 pages and
  6 figures",,,,"cond-mat.mtrl-sci physics.chem-ph","http://arxiv.org/licenses/nonexclusive-distrib/1.0/","  Inelastic electron scattering by the adsorbate covered Pt(100) single crystal
surface is studied by Disappearance Potential Spectroscopy and density of
states (DOS) calculations. Two peculiar channels of elastic electron
consumption are highlighted, both related to the substrate core level
excitation coupled separately with two particular electron transitions. The
first channel affects the adsorbed layer and enables to reveal the valence
state structure of the adsorbed species as well as the substrate DOS. The
second one includes the multiple plasmon oscillations. The proposed mechanism
of electron transitions assumes that one-dimensional DOS at the vacuum level is
an additional spot for location of excited electrons, along with vacant DOS at
the Fermi level. Observed phenomena are supposed to be a general regularity of
electron-solid interaction and a useful tool for fingerprinting the adsorbed
layer at molecular level.
","[{""version"":""v1"",""created"":""Fri, 14 Sep 2012 07:07:13 GMT""}]","2012-09-17"
"1209.3109","Hari Prakash","Manoj K. Mishra and Hari Prakash","Long Distance Atomic Teleportation using Entangled Coherent States and
  Cavity Assisted Interaction","12 Pages, 2 Figures and 1 Table",,,,"quant-ph physics.optics","http://arxiv.org/licenses/nonexclusive-distrib/1.0/","  The schemes proposed by S. Bose et al [Phys. Rev. Lett. 83, 5158 (1999)] and
others for long distance atomic teleportation using cavity decay, gives message
state dependent fidelity on successful attempt and in case of failure message
state destroys. We propose a different scheme for teleportation of an atomic
state from one cavity to a distant cavity by reflecting optical-pulse modes of
an entangled coherent state (ECS) from single atom-cavity systems and detecting
whether light is on or off. Unit success with unit fidelity is obtained for
large mean photon number (|{\alpha}|^2). For small |{\alpha}|^2, however, there
is some probability of failure but message state does not destroy, and this
allows us to achieve unit success in a few repeated attempts. Unlike previous
schemes, our scheme also enjoys advantages of deterministic generation of ECS,
robustness of ECS against de-coherence due to photon absorption, and it does
not require many-stage cavity interactions and single photon detection ability.
","[{""version"":""v1"",""created"":""Fri, 14 Sep 2012 07:18:07 GMT""}]","2012-09-17"
"1209.3110","Hirokazu Kobayashi","Hirokazu Kobayashi, Graciana Puentes, and Yutaka Shikano","Extracting joint weak values from two-dimensional spatial displacements","4 pages, no figures","Phys. Rev. A 86, 053805 (2012)","10.1103/PhysRevA.86.053805",,"quant-ph","http://arxiv.org/licenses/nonexclusive-distrib/1.0/","  The joint weak value is a counterfactual quantity related to quantum
correlations and quantum dynamics, which can be retrieved via weak
measurements, as initiated by Aharonov and colleagues. In this Rapid
Communication, we provide a full analytical extension of the method described
by Puentes et al. [Phys. Rev. Lett. 109, 040401 (2012)], to extract the joint
weak values of single-particle operators from two-dimensional spatial
displacements of Laguerre-Gauss probe states, for the case of azimuthal index
|l|>1. This method has a statistical advantage over previous ones since
information about the conjugate observable, i.e., the momentum displacement of
the probe, is not required. Moreover, we demonstrate that under certain
conditions, the joint weak value can be extracted directly from spatial
displacements without any additional data processing.
","[{""version"":""v1"",""created"":""Fri, 14 Sep 2012 07:18:12 GMT""},{""version"":""v2"",""created"":""Tue, 6 Nov 2012 02:07:26 GMT""}]","2012-11-07"
"1209.3111","Regine Frank","Andreas Lubatsch, Regine Frank","Coherent Transport and Symmetry Breaking - Laser Dynamics of Constrained
  Granular Matter","New Journal of Physics (accepted 2014)","New J. Phys. 16 083043 (2014)","10.1088/1367-2630/16/8/083043",,"physics.optics cond-mat.dis-nn cond-mat.mes-hall cond-mat.mtrl-sci quant-ph","http://arxiv.org/licenses/nonexclusive-distrib/1.0/","  We present diagrammatic transport theory including self-consistent nonlinear
enhancement and dissipation in the multiple scattering regime. Our model of
Vollhardt-W\""olfle transport of photons is fit-parameter-free and raises the
claim that the results hold up to the closest packed volume of randomly
arranged ZnO Mie scatterers. We find that a symmetry breaking caused by
dissipative effects of a lossy underlying substrate leads to qualitatively
different physics of coherence and lasing in granular amplifying media.
According to our results, confined and extended mode and their laser thresholds
can be clearly attributed to unbroken and broken spatial symmetry. The
diameters and emission profiles of random laser modes, as well as their
thresholds and the positional-dependent degree of coherence can be checked
experimentally.
","[{""version"":""v1"",""created"":""Fri, 14 Sep 2012 07:39:38 GMT""},{""version"":""v2"",""created"":""Tue, 26 Feb 2013 14:05:00 GMT""},{""version"":""v3"",""created"":""Fri, 25 Apr 2014 20:28:37 GMT""},{""version"":""v4"",""created"":""Fri, 1 Aug 2014 09:30:11 GMT""},{""version"":""v5"",""created"":""Thu, 14 Aug 2014 23:24:22 GMT""}]","2014-08-29"
"1209.3112","Eviatar B. Procaccia","Noam Berger, Jacob J. Kagan, Eviatar B. Procaccia","Stretch IDLA",,,,,"math.PR","http://arxiv.org/licenses/nonexclusive-distrib/1.0/","  We consider a new IDLA - particle system model, on the upper half planar
lattice, resulting in an infinite forest covering the half plane. We prove that
almost surely all trees are finite.
","[{""version"":""v1"",""created"":""Fri, 14 Sep 2012 07:40:54 GMT""},{""version"":""v2"",""created"":""Thu, 25 Sep 2014 17:17:45 GMT""}]","2014-09-26"
"1209.3113","Baran Tander","Baran Tander, Atilla \""Ozmen, Murat Ba\c{s}kan","Detection and Classification of Viewer Age Range Smart Signs at TV
  Broadcast","11 pages, 13 figures, 2 tables",,"10.5121/sipij.2012.3410",,"cs.CV","http://arxiv.org/licenses/nonexclusive-distrib/1.0/","  In this paper, the identification and classification of Viewer Age Range
Smart Signs, designed by the Radio and Television Supreme Council of Turkey, to
give age range information for the TV viewers, are realized. Therefore, the
automatic detection at the broadcast will be possible, enabling the
manufacturing of TV receivers which are sensible to these signs. The most
important step at this process is the pattern recognition. Since the symbols
that must be identified are circular, various circle detection techniques can
be employed. In our study, first, two different circle segmentation methods for
still images are analyzed, their advantages and drawbacks are discussed. A
popular neural network structure called Multilayer Perceptron is employed for
the classification. Afterwards, the same procedures are carried out for
streaming video. All of the steps depicted above are realized on a standard PC.
","[{""version"":""v1"",""created"":""Fri, 14 Sep 2012 07:52:09 GMT""}]","2012-09-17"
