"1209.3154","Roman Baluev","Roman V. Baluev","The impact of red noise in radial velocity planet searches: Only three
  planets orbiting GJ581?","19 pages, 12 figures, 3 tables; accepted to MNRAS","MNRAS, V. 429 (3), Pp. 2052-2068","10.1093/mnras/sts476",,"astro-ph.EP astro-ph.IM","http://arxiv.org/licenses/nonexclusive-distrib/1.0/","  We perform a detailed analysis of the latest HARPS and Keck radial velocity
data for the planet-hosting red dwarf GJ581, which attracted a lot of attention
in recent time. We show that these data contain important correlated noise
component (""red noise"") with the correlation timescale of the order of 10 days.
This red noise imposes a lot of misleading effects while we work in the
traditional white-noise model. To eliminate these misleading effects, we
propose a maximum-likelihood algorithm equipped by an extended model of the
noise structure. We treat the red noise as a Gaussian random process with
exponentially decaying correlation function.
  Using this method we prove that: (i) planets b and c do exist in this system,
since they can be independently detected in the HARPS and Keck data, and
regardless of the assumed noise models; (ii) planet e can also be confirmed
independently by the both datasets, although to reveal it in the Keck data it
is mandatory to take the red noise into account; (iii) the recently announced
putative planets f and g are likely just illusions of the red noise; (iv) the
reality of the planet candidate GJ581 d is questionable, because it cannot be
detected from the Keck data, and its statistical significance in the HARPS data
(as well as in the combined dataset) drops to a marginal level of $\sim
2\sigma$, when the red noise is taken into account.
  Therefore, the current data for GJ581 really support existence of no more
than four (or maybe even only three) orbiting exoplanets. The planet candidate
GJ581 d requests serious observational verification.
","[{""version"":""v1"",""created"":""Fri, 14 Sep 2012 11:04:22 GMT""},{""version"":""v2"",""created"":""Thu, 22 Nov 2012 12:01:46 GMT""}]","2013-02-01"
"1209.3155","Rui Alves","Rui Alves, Veranika Lim, Evangelos Niforatos, Monchu Chen, Evangelos
  Karapanos and Nuno Jardim Nunes","Augmenting Customer Journey Maps with quantitative empirical data: a
  case on EEG and eye tracking","2 pages, 3 figures. Published in DIS2012, in Newcastle, UK",,,,"cs.HC","http://arxiv.org/licenses/nonexclusive-distrib/1.0/","  This paper introduces the use of electroencephalography (EEG) and eye
tracking in exploring customer experiences in service design. These tools are
expected to allow designers to generate customer journeys from empirical data
leading to new visualization methods and therefore improvements in service
design deliverables.
","[{""version"":""v1"",""created"":""Fri, 14 Sep 2012 11:27:30 GMT""}]","2012-09-17"
"1209.3156","Andrew Odell","Andrew P. Odell","Karl Rakos - Obituary",,,,,"astro-ph.IM physics.hist-ph","http://arxiv.org/licenses/nonexclusive-distrib/1.0/","  Professor Dr. Karl Dragutin Rakos passed away on October 31, 2011 one day
before his 86th birthday. With that the Vienna astronomical community lost a
valued researcher, university teacher and co-founder of modern astrophysical
research at the Institut f\""ur Astronomie of the University of Vienna.
","[{""version"":""v1"",""created"":""Fri, 14 Sep 2012 11:29:22 GMT""}]","2012-09-17"
"1209.3157","Kenan Kaygisiz","Kenan Kaygisiz","Normal Soft int-Group",,,,,"math.GR","http://arxiv.org/licenses/nonexclusive-distrib/1.0/","  In this paper, we define normal soft int-groups and derive their some basic
properties. We also investigate some relations on {\alpha}-inclusion, soft
product and normal soft int-groups. Then we define normalizer, quotient group
and give some theorems concerning these concepts.
","[{""version"":""v1"",""created"":""Fri, 14 Sep 2012 11:35:07 GMT""}]","2012-09-17"
"1209.3158","Morten Bache","Morten Bache, Hairun Guo, Binbin Zhou and Xianglong Zeng","The anisotropic Kerr nonlinear refractive index of the beta-barium
  borate (\beta-BaB2O4) nonlinear crystal","Updated version, comments on experiments from the literature welcome","Optical Materials Express, Vol. 3, Issue 3, pp. 357-382 (2013)","10.1364/OME.3.000357",,"physics.optics","http://arxiv.org/licenses/nonexclusive-distrib/1.0/","  We study the anisotropic nature of the Kerr nonlinear response in a
beta-barium borate (\beta-BaB2O4, BBO) nonlinear crystal. The focus is on
determining the relevant $\chi^{(3)}$ cubic tensor components that affect
interaction of type I cascaded second-harmonic generation. Various experiments
in the literature are analyzed and we correct the data from some of the
experiments for contributions from cascading as well as for updated material
parameters. We find that the Kerr nonlinear tensor component responsible for
self-phase modulation in cascading is considerably larger than what has been
used to date. We evaluate the impact of using such a cubic anisotropic response
in ultrafast cascading experiments.
","[{""version"":""v1"",""created"":""Fri, 14 Sep 2012 11:49:57 GMT""},{""version"":""v2"",""created"":""Mon, 29 Oct 2012 14:30:25 GMT""},{""version"":""v3"",""created"":""Thu, 21 Feb 2013 14:25:32 GMT""}]","2013-02-22"
"1209.3159","Eli Owens","Eli T. Owens and Karen E. Daniels","Acoustic measurement of a granular density of modes",,,,,"cond-mat.soft cond-mat.mtrl-sci","http://arxiv.org/licenses/nonexclusive-distrib/1.0/","  In glasses and other disordered materials, measurements of the vibrational
density of states reveal that an excess number of long-wavelength
(low-frequency) modes, as compared to the Debye scaling seen in crystalline
materials, is associated with a loss of mechanical rigidity. In this paper, we
present a novel technique for measuring the density of modes (DOM) in a real
granular material, in which we mimic thermal excitations using white noise
acoustic waves. The resulting vibrations are detected with piezoelectric
sensors embedded inside a subset of the particles, from which we are able to
compute the DOM via the spectrum of the velocity autocorrelation function, a
technique previously applied in thermal systems. The velocity distribution for
individual particles is observed to be Gaussian, but the ensemble distribution
is non-Gaussian due to varying widths of the individual distributions. In spite
of this deviation from a true thermal system, we find that the DOM exhibits
several thermal-like features, including Debye scaling in a compressed
hexagonally ordered packing, and an increase in low-frequency modes as the
confining pressure is decreased. In disordered packings, we find that a
characteristic frequency $f_c$ increases with pressure, but more weakly than
has been observed in simulations of frictionless packings.
","[{""version"":""v1"",""created"":""Fri, 14 Sep 2012 11:50:33 GMT""}]","2012-09-17"
"1209.3160","Ajneet Dhillon","Indranil Biswas and Ajneet Dhillon","A construction of Chern classes of parabolic vector bundles","arXiv admin note: substantial text overlap with arXiv:1103.1190",,,,"math.AG","http://arxiv.org/licenses/nonexclusive-distrib/1.0/","  Given a parabolic vector bundle, we construct for it a projectivization and
tautological line bundle. These are analogs of the projectivization and
tautological line bundle for an usual vector bundle. Using these we give a
construction of the parabolic Chern classes.
","[{""version"":""v1"",""created"":""Fri, 14 Sep 2012 11:51:03 GMT""}]","2012-09-17"
"1209.3161","Matthieu Tissier","Gilles Tarjus, Maxime Baczyk and Matthieu Tissier","Avalanches and dimensional reduction breakdown in the critical behavior
  of disordered systems","10 pages, 3 figures",,"10.1103/PhysRevLett.110.135703",,"cond-mat.dis-nn","http://arxiv.org/licenses/nonexclusive-distrib/1.0/","  We investigate the connection between a formal property of the critical
behavior of several systems in the presence of quenched disorder, known as
""dimensional reduction"", and the presence in the same systems at zero
temperature of collective events known as ""avalanches"". Avalanches generically
produce nonanalyticities in the functional dependence of the cumulants of the
renormalized disorder. We show that this leads to a breakdown of the
dimensional reduction predictions if and only if the fractal dimension
characterizing the scaling properties of the avalanches is exactly equal to the
difference between the dimension of space and the scaling dimension of the
primary field, e.g. the magnetization in a random field model. This is proven
by combining scaling theory and functional renormalization group. We therefore
clarify the puzzle of why dimensional reduction remains valid in random field
systems above a nontrivial dimension (but fails below), always applies to the
statistics of branched polymer and is always wrong in elastic models of
interfaces in a random environment.
","[{""version"":""v1"",""created"":""Fri, 14 Sep 2012 11:51:47 GMT""}]","2015-06-11"
"1209.3162","Hajime Ishikawa","Hajime Ishikawa, Jun-ichi Yamaura, Yoshihiko Okamoto, Hiroyuki
  Yoshida, G{\o}ran J. Nilsen and Zenji Hiroi","A novel crystal polymorph of volborthite, Cu3V2O7(OH)2 2H2O","7pages, 2figures","Acta Cryst. C68, i41-i44 (2012)","10.1107/S010827011202536X",,"cond-mat.mtrl-sci","http://arxiv.org/licenses/nonexclusive-distrib/1.0/","  A new polymorph of volborthite [tricopper(II) divanadium(V) heptaoxide
dihydroxide dihydrate], Cu3V2O7(OH)2 2H2O, has been discovered in a single
crystal prepared by hydrothermal synthesis. X-ray analysis reveals that the
monoclinic structure has the space group C2/c at room temperature, which is
different from that of the previously reported C2/m structure. Both structures
have Cu3O6(OH)2 layers composed of edge-sharing CuO4(OH)2 octahedra, with V2O7
pillars and water molecules between the layers. The Cu atoms occupy two and
three independent crystallographic sites in the C2/m and C2/c structures,
respectively, likely giving rise to different magnetic interactions between
CuII spins in the kagome lattices embedded in the Cu3O6(OH)2 layers.
","[{""version"":""v1"",""created"":""Fri, 14 Sep 2012 11:51:54 GMT""}]","2012-09-17"
"1209.3163","Jean-Luc Marichal","Jean-Luc Marichal, Pierre Mathonet","Computing system signatures through reliability functions",,"Statistics and Probability Letters 83 (3) (2013) 710-717","10.1016/j.spl.2012.11.018",,"math.PR math.OC","http://arxiv.org/licenses/nonexclusive-distrib/1.0/","  It is known that the Barlow-Proschan index of a system with i.i.d. component
lifetimes coincides with the Shapley value, a concept introduced earlier in
cooperative game theory. Due to a result by Owen, this index can be computed
efficiently by integrating the first derivatives of the reliability function of
the system along the main diagonal of the unit hypercube. The Samaniego
signature of such a system is another important index that can be computed for
instance by Boland's formula, which requires the knowledge of every value of
the associated structure function. We show how the signature can be computed
more efficiently from the diagonal section of the reliability function via
derivatives. We then apply our method to the computation of signatures for
systems partitioned into disjoint modules with known signatures.
","[{""version"":""v1"",""created"":""Fri, 14 Sep 2012 12:01:48 GMT""}]","2012-12-21"
"1209.3164","Song Wang","Qifen Jiang, Song Wang","Derivations and automorphism groups of the original deformative
  Schr\""odinger-Virasoro algebras","33 pages",,,,"math.RA","http://arxiv.org/licenses/nonexclusive-distrib/1.0/","  In this paper, we determine the derivation algebra and the automorphism group
of the original deformative ${\rm Schr\ddot{o}dinger}$-{\rm Virasoro} algebras
which is the semi-direct product Lie algebra of the Witt algebra and its tensor
density module ${\rm I^g}(a,b)$.
","[{""version"":""v1"",""created"":""Fri, 14 Sep 2012 12:05:35 GMT""}]","2012-09-17"
"1209.3165","Ramin Zahedi","Ramin Zahedi","On algebraic structure of the set of prime numbers","8 pages, LaTeX version; previous versions include PDF, PostScript,
  and LaTeX/TeX files","AFSIL(Logic).Hokkaido.University.Pubs.JAPAN 9(1) (2008) 1-9",,,"math.GM","http://creativecommons.org/licenses/by-nc-sa/3.0/","  The set of prime numbers has been analyzed, based on their algebraic and
arithmetical structure. Here by obtaining a sort of linear formula for the set
of prime numbers, they are redefined and identified; under a systematic
procedure it has been shown that the set of prime numbers is combinations
(unions and intersections) of some subsets of natural numbers, with more
primary structures. In fact generally, the logical essence of obtained formula
for prime numbers is similar to formula 2n - 1 for odd numbers, and so on.
Subsequently, using obtained formula we can define all composite numbers.
Finally specified examples for obtained formula are presented.
","[{""version"":""v1"",""created"":""Fri, 14 Sep 2012 12:14:10 GMT""},{""version"":""v2"",""created"":""Mon, 17 Sep 2012 12:56:09 GMT""},{""version"":""v3"",""created"":""Tue, 18 Sep 2012 13:13:54 GMT""},{""version"":""v4"",""created"":""Mon, 24 Sep 2012 17:17:56 GMT""},{""version"":""v5"",""created"":""Thu, 27 Sep 2012 17:55:53 GMT""}]","2014-12-30"
"1209.3166","Yongyao Li","Yongyao Li, Wei Pang, and Boris A. Malomed","Wave modes trapped in rotating nonlinear potentials",,,,,"nlin.PS cond-mat.quant-gas","http://arxiv.org/licenses/nonexclusive-distrib/1.0/","  We study modes trapped in a rotating ring with the local strength of the
nonlinearity modulated as cos(2\theta), where \theta is the azimuthal angle.
This modulation pattern may be of three different types: self-focusing (SF),
self-defocusing (SDF), and alternating SF-SDF. The model, based on the
nonlinear Schrodinger (NLS) equation with periodic boundary conditions, applies
to the light propagation in a twisted pipe waveguide, and to a Bose-Einstein
condensate (BEC) loaded into a toroidal trap, under the action of the rotating
nonlinear pseudopotential induced by means of the Feshbach resonance in an
inhomogeneous external field. In the SF, SDF, and alternating regimes, four,
three, and five different types of stable trapped modes are identified,
respectively: even, odd, second-harmonic (2H), symmetry-breaking, and
2H-breaking ones. The shapes and stability of these modes, together with
transitions between them, are investigated in the first rotational Brillouin
zone. Ground-state modes are identified in each regime. Boundaries between
symmetric and asymmetric modes are also obtained in an analytical form, by of a
two-mode approximation.
","[{""version"":""v1"",""created"":""Fri, 14 Sep 2012 12:21:23 GMT""}]","2012-09-17"
"1209.3167","Michael Williams","Michael J. Williams (1), Martin Bureau (2) and Harald Kuntschner (3)
  ((1) MPE, (2) Oxford, (3) ESO)","Secular evolution in action: central values and radial trends in the
  stellar populations of boxy bulges","MNRAS Letters accepted. 5 pages",,"10.1111/j.1745-3933.2012.01353.x",,"astro-ph.CO","http://arxiv.org/licenses/nonexclusive-distrib/1.0/","  We determine central values and radial trends in the stellar populations of
the bulges of a sample of 28 edge-on S0-Sb disk galaxies, 22 of which are
boxy/peanut-shaped (and therefore barred). Our principal findings are the
following. (1) At a given velocity dispersion, the central stellar populations
of galaxies with boxy/peanut-shaped bulges are indistinguishable from those of
early-type (elliptical and S0) galaxies. Either secular evolution affects
stellar populations no differently to monolithic collapse or mergers, or
secular evolution is not important in the central regions of these galaxies,
despite the fact that they are barred. (2) The radial metallicity gradients of
boxy/peanut-shaped bulges are uncorrelated with velocity dispersion and are, on
average, shallower than those of unbarred early-type galaxies. This is
qualitatively consistent with chemodynamical models of bar formation, in which
radial inflow and outflow smears out pre-existing gradients.
","[{""version"":""v1"",""created"":""Fri, 14 Sep 2012 12:24:10 GMT""}]","2015-06-11"
"1209.3168","Jonathan Fraser","Rich\'ard Balka, \'Abel Farkas, Jonathan M. Fraser and James T. Hyde","Dimension and measure for generic continuous images","14 pages","Ann. Acad. Sci. Fenn. Math., 38, (2013), 389-404",,,"math.CA math.GN math.MG","http://arxiv.org/licenses/nonexclusive-distrib/1.0/","  We consider the Banach space consisting of continuous functions from an
arbitrary uncountable compact metric space, $X$, into $\mathbb{R}^n$. The key
question is `what is the generic dimension of $f(X)$?' and we consider two
different approaches to answering it: Baire category and prevalence. In the
Baire category setting we prove that typically the packing and upper box
dimensions are as large as possible, $n$, but find that the behaviour of the
Hausdorff, lower box and topological dimensions is considerably more subtle. In
fact, they are typically equal to the minimum of $n$ and the topological
dimension of $X$. We also study the typical Hausdorff and packing measures of
$f(X)$ and, in particular, give necessary and sufficient conditions for them to
be zero, positive and finite, or infinite.
  It is interesting to compare the Baire category results with results in the
prevalence setting. As such we also discuss a result of Dougherty on the
prevalent topological dimension of $f(X)$ and give some simple applications
concerning the prevalent dimensions of graphs of real-valued continuous
functions on compact metric spaces, allowing us to extend a recent result of
Bayart and Heurteaux.
","[{""version"":""v1"",""created"":""Fri, 14 Sep 2012 12:30:02 GMT""},{""version"":""v2"",""created"":""Fri, 7 Jun 2019 14:00:59 GMT""}]","2019-06-10"
"1209.3169","Partha Ghose Professor","Partha Ghose","Entangling successive single-photons from quantum dots","10 pages, 1 figure",,,,"quant-ph","http://arxiv.org/licenses/nonexclusive-distrib/1.0/","  A method is proposed for generating and discriminating Bell states of high
fidelity from consecutive single-photons generated in a semiconductor quantum
dot. The use of a non-symmetric beam splitter is found to be essential and
sufficient, and no nonlinear optical process such as SPDC is required at any
stage. This should be of considerable importance for testing the foundations of
quantum mechanics.
","[{""version"":""v1"",""created"":""Fri, 14 Sep 2012 12:41:40 GMT""}]","2012-09-17"
"1209.3170","Philip Gerlee Dr","P. Gerlee","The model muddle: in search of tumour growth laws",,,"10.1158/0008-5472.CAN-12-4355",,"q-bio.TO","http://arxiv.org/licenses/nonexclusive-distrib/1.0/","  In this article we shall trace the historical development of tumour growth
laws, which in a quantitative fashion describe the increase in tumour
mass/volume over time. These models are usually formulated in terms of
differential equations that relate the growth rate of the tumour to its current
state, and range from the simple one-parameter exponential growth model, to
more advanced models that contain a large number of parameters. Understanding
the assumptions and consequences of such models is important, since they often
underpin more complex models of tumour growth. The conclusion of this brief
survey is that although much improvement has occurred over the last century,
more effort and new models are required if we are to understand the intricacies
of tumour growth.
","[{""version"":""v1"",""created"":""Fri, 14 Sep 2012 12:48:55 GMT""},{""version"":""v2"",""created"":""Fri, 8 Feb 2013 09:25:15 GMT""}]","2013-02-11"
"1209.3171","Alain Sacuto Pr","Alain Sacuto, Siham Benhabib, Yann Gallais, S\'ebastien Blanc,
  Maximilien Cazayous, Marie-Aude M\'easson, Jin Sheng Wen, Zhi Jun Xu, Genda
  Gu","Pseudogap in Cuprates by Electronic Raman Scattering","12 pages, 10 figures, JPCS conferences series 2013",,,,"cond-mat.supr-con","http://arxiv.org/licenses/nonexclusive-distrib/1.0/","  We present Raman experiments on underdoped and overdoped Bi2Sr2CaCu2O(8+d)
(Bi-2212) single crystals. We reveal the pseudogap in the electronic Raman
spectra in the B1g and B2g geometries. In these geometries we probe
respectively, the antinodal (AN) and nodal (N) regions corresponding to the
principal axes and the diagonal of the Brillouin zone. The pseudogap appears in
underdoped regime and manifests itself in the B1g spectra by a strong depletion
of the low energy electronic continuum as the temperature decreases. We define
a temperature T* below which the depletion appears and the pseudogap energy,
omegaPG the energy at which the depeletion closes.
  The pseudogap is also present in the B2g spectra but the depletion opens at
higher energy than in the B1g spectra. We observe the creation of new
electronic states inside the depletion as we enter the superconducting phase.
This leads us to conclude (as proposed by S. Sakai et al.) that the pseudogap
has a different structure than the superconducting gap and competes with it. We
show that the nodal quasiparticle dynamic is very robust and almost insensitive
to the pseudogap phase contrary to the antinodal quasiparticle dynamic. We
finally reveal, in contrast to what it is usually admitted,an increase of the
nodal quasiparticle spectral weight with underdoping. We interpret this result
as the consequence of a possible Fermi surface disturbances in the doping range
p=0.1-0.2.
","[{""version"":""v1"",""created"":""Fri, 14 Sep 2012 12:51:32 GMT""}]","2012-09-17"
"1209.3172","Preda Mihailescu","Preda Mih\u{a}ilescu","The Gross-Kuz'min Connjecture for CM fields","Version 4.0, with improved exposition and minor corrections, thanks
  to seminar discussions and remarks of Jens Franke",,,,"math.NT","http://arxiv.org/licenses/nonexclusive-distrib/1.0/","  Let $A' = \varprojlim_n A'_n$ be the projective limit of the $p$-parts of the
ideal class groups of the $p$ integers in the $\mathbb{Z}_p$-cyclotomic
extension $K_{\infty}/K$ of a CM number field $K$. We prove in this paper that
the $T$-part $(A')^-(T) = \{ 1 \}$ for CM extensions $K/\mathbb{Q}$. This fact
has been conjectured for arbitrary fields $K$ by Kuz'min in 1972 and was proved
by Greenberg in 1973, for abelian extensions $K/\mathbb{Q}$. Federer and Gross
had shown in 1981 that $(A')^-(T) = \{ 1 \}$ is equivalent to the non-vanishing
of the $p$-adic regulator of the $p$-units of $K$.
","[{""version"":""v1"",""created"":""Fri, 14 Sep 2012 12:55:26 GMT""},{""version"":""v2"",""created"":""Mon, 17 Sep 2012 15:52:38 GMT""},{""version"":""v3"",""created"":""Mon, 17 Dec 2012 10:36:15 GMT""},{""version"":""v4"",""created"":""Tue, 17 Feb 2015 15:01:06 GMT""},{""version"":""v5"",""created"":""Wed, 18 Feb 2015 22:24:34 GMT""}]","2015-02-20"
"1209.3173","Charles J. Horowitz","C. J. Horowitz, G. Shen, Evan O'Connor, Christian Ott","Charged current neutrino interactions in core-collapse supernovae in a
  virial expansion","8 pages, 4 figures, minor corrections, Phys. Rev. C in press","Phys. Rev. C 86, 065806 (2012)","10.1103/PhysRevC.86.065806","INT-PUB-12-036","astro-ph.HE nucl-th","http://arxiv.org/licenses/nonexclusive-distrib/1.0/","  Core-collapse supernovae may depend sensitively on charged current neutrino
interactions in warm, low density neutron rich matter. A proton in neutron rich
matter is more tightly bound than is a neutron. This energy shift \Delta U
increases the electron energy in \nu_e + n --> p + e, increasing the available
phase space and absorption cross section. Likewise \Delta U decreases the
positron energy in \bar \nu_e + p --> n + e^+, decreasing the phase space and
cross section. We have calculated \Delta U using a model independent virial
expansion and we find \Delta U is much larger, at low densities, than the
predictions of many mean field models. Therefore \Delta U could have a
significant impact on charged current neutrino interactions in supernovae.
Preliminary simulations of the accretion phase of core-collapse supernovae find
that \Delta U increases \bar \nu_e energies and decreases the \nu_e luminosity.
","[{""version"":""v1"",""created"":""Fri, 14 Sep 2012 13:00:44 GMT""},{""version"":""v2"",""created"":""Tue, 18 Dec 2012 14:29:59 GMT""}]","2012-12-21"
"1209.3174","Sunil Kumar","Sunil Kumar, L. Harnagea, S. Wurmehl, B. Buchner, and A. K. Sood","Acoustic and optical phonon dynamics from femtosecond time-resolved
  optical spectroscopy of superconducting iron pnictide
  Ca(Fe_0.944Co_0.056)_2As_2","6 pages, 4 figures (revised manuscript)","EPL 100, 57007 (2012)","10.1209/0295-5075/100/57007",,"cond-mat.str-el cond-mat.supr-con","http://arxiv.org/licenses/nonexclusive-distrib/1.0/","  We report temperature evolution of coherently excited acoustic and optical
phonon dynamics in superconducting iron pnictide single crystal
Ca(Fe_0.944Co_0.056)_2As_2 across the spin density wave transition at T_SDW ~
85 K and superconducting transition at T_SC ~20 K. Strain pulse propagation
model applied to the generation of the acoustic phonons yields the temperature
dependence of the optical constants, and longitudinal and transverse sound
velocities in the temperature range of 3.1 K to 300 K. The frequency and
dephasing times of the phonons show anomalous temperature dependence below T_SC
indicating a coupling of these low energy excitations with the Cooper-pair
quasiparticles. A maximum in the amplitude of the acoustic modes at T ~ 170 is
seen, attributed to spin fluctuations and strong spin-lattice coupling before
T_SDW.
","[{""version"":""v1"",""created"":""Fri, 14 Sep 2012 13:12:15 GMT""},{""version"":""v2"",""created"":""Wed, 19 Sep 2012 17:21:34 GMT""}]","2012-12-14"
