"1209.5396","Alejandra Castro","Shamik Banerjee, Alejandra Castro, Simeon Hellerman, Eliot Hijano,
  Arnaud Lepage-Jutier, Alexander Maloney and Stephen Shenker","Smoothed Transitions in Higher Spin AdS Gravity","23 pages, LaTeX, 2 figures; v2: refs added",,"10.1088/0264-9381/30/10/104001","IPMU-12-0175, NSF-KITP-12-164","hep-th","http://arxiv.org/licenses/nonexclusive-distrib/1.0/","  We consider CFTs conjectured to be dual to higher spin theories of gravity in
AdS_3 and AdS_4. Two dimensional CFTs with W_N symmetry are considered in the
lambda=0 (k --> infinity) limit, where they are conjectured to be described by
continuous orbifolds. The torus partition function is computed, using
reasonable assumptions, and equals that of a free field theory. We find no
phase transition at temperatures of order one; the usual Hawking-Page phase
transition is removed by the highly degenerate light states associated with
conical defect states in the bulk. Three dimensional Chern-Simons-matter CFTs
with vector-like matter are considered on T^3, where the dynamics is described
by an effective theory for the eigenvalues of the holonomies. Likewise, we find
no evidence for a Hawking-Page phase transition at large level k.
","[{""version"":""v1"",""created"":""Mon, 24 Sep 2012 20:00:05 GMT""},{""version"":""v2"",""created"":""Thu, 11 Oct 2012 00:24:17 GMT""}]","2015-06-11"
"1209.5397","Ji-Ming Shi","Ji-Ming Shi and Eugene Chiang","From Dust to Planetesimals: Criteria for Gravitational Instability of
  Small Particles in Gas","19 pages, 13 figures, and 5 tables. ApJ accepted",,"10.1088/0004-637X/764/1/20",,"astro-ph.EP astro-ph.GA","http://arxiv.org/licenses/nonexclusive-distrib/1.0/","  Dust particles sediment toward the midplanes of protoplanetary disks, forming
dust-rich sublayers encased in gas. What densities must the particle sublayer
attain before it can fragment by self-gravity? We describe various candidate
threshold densities. One of these is the Roche density, which is that required
for a strengthless satellite to resist tidal disruption by its primary. Another
is the Toomre density, which is that required for de-stabilizing self-gravity
to defeat the stabilizing influences of pressure and rotation. We show that for
sublayers containing aerodynamically well-coupled dust, the Toomre density
exceeds the Roche density by many (up to about 4) orders of magnitude. We
present 3D shearing box simulations of self-gravitating, stratified, dust-gas
mixtures to test which of the candidate thresholds is relevant for collapse.
All our simulations indicate that the larger Toomre density is required for
collapse. This result is sensible because sublayers are readily stabilized by
pressure. Sound-crossing times for thin layers are easily shorter than
free-fall times, and the effective sound speed in dust-gas suspensions
decreases only weakly with the dust-to-gas ratio (as the inverse square root).
Our findings assume that particles are small enough that their stopping times
in gas are shorter than all other timescales. Relaxing this assumption may
lower the threshold for gravitational collapse back down to the Roche
criterion. In particular, if the particle stopping time becomes longer than the
sound-crossing time, sublayers may lose pressure support and become
gravitationally unstable.
","[{""version"":""v1"",""created"":""Mon, 24 Sep 2012 20:00:05 GMT""},{""version"":""v2"",""created"":""Sat, 15 Dec 2012 05:20:16 GMT""}]","2015-06-11"
"1209.5398","Antonis Georgakakis","A. Akylas, A. Georgakakis, I. Georgantopoulos, M. Brightman, K. Nandra","Constraining the fraction of Compton-thick AGN in the Universe by
  modelling the diffuse X-ray background spectrum","To appear in A&A",,"10.1051/0004-6361/201219387",,"astro-ph.HE astro-ph.CO","http://arxiv.org/licenses/nonexclusive-distrib/1.0/","  This paper investigates what constraints can be placed on the fraction of
Compton-thick (CT) AGN in the Universe from the modeling of the spectrum of the
diffuse X-ray background (XRB). We present a model for the synthesis of the XRB
that uses as input a library of AGN X-ray spectra generated by the Monte Carlo
simulations described by Brightman & Nandra. This is essential to account for
the Compton scattering of X-ray photons in a dense medium and the impact of
that process on the spectra of obscured AGN. We identify a small number of
input parameters to the XRB synthesis code which encapsulate the minimum level
of uncertainty in reconstructing the XRB spectrum. These are the power-law
index and high energy cutoff of the intrinsic X-ray spectra of AGN, the level
of the reflection component in AGN spectra and the fraction of CT AGN in the
Universe. We then map the volume of the space allowed to these parameters by
current observations of the XRB spectrum in the range 3-100 keV. One of the
least constrained parameters is the fraction of CT AGN. Statistically
acceptable fits to the XRB spectrum at the 68% confidence level can be obtained
for CT fractions in the range 5-50%. This is because of degeneracies among
input parameters to the XRB synthesis code and uncertainties in the modeling of
AGN spectra (e.g. reflection). The most promising route for constraining the
fraction of CT AGN in the Universe is via the direct detection of those sources
in high energy (>10keV) surveys. It is shown that the observed fraction of CT
sources identified in the SWIFT/BAT survey, limits the intrinsic fraction of CT
AGN, at least at low redshift, to 10-20% (68% confidence level). We also make
predictions on the number density of CT sources that current and future X-ray
missions are expected to discover. Testing those predictions will constrain the
intrinsic fraction of CT AGN as a function of redshift.
","[{""version"":""v1"",""created"":""Mon, 24 Sep 2012 20:00:21 GMT""}]","2015-06-11"
"1209.5399","Guillaume Drouart","G. Drouart, C. De Breuck, J. Vernet, R. A. Laing, N. Seymour, D.
  Stern, M. Haas, E. A. Pier, B. Rocca-Volmerange","Jet and Torus Orientations in High Redshift Radio Galaxies","18 pages, 12 figures, 6 tables",,"10.1051/0004-6361/201220059",,"astro-ph.CO","http://arxiv.org/licenses/nonexclusive-distrib/1.0/","  We examine the relative orientation of radio jets and dusty tori surrounding
the AGN in powerful radio galaxies at z > 1. The radio core dominance R = P(20
GHz) /P(500 MHz) serves as an orientation indicator, measuring the ratio
between the anisotropic Doppler-beamed core extended core emission and the
isotropic lobe emission. Assuming a fixed cylindrical geometry for the hot,
dusty torus, we derive its inclination i by fitting optically-thick radiative
transfer models to spectral energy distributions obtained with the Spitzer
Space Telescope. We find a highly significant anti-correlation (p < 0.0001)
between R and i in our sample of 35 type 2 AGN combined with a sample of 18 z =
1 3CR sources containing both type 1 and 2 AGN. This analysis provides
observational evidence both for the Unified scheme of AGN and for the common
assumption that radio jets are in general perpendicular to the plane of the
torus. The use of inclinations derived from mid-infrared photometry breaks
several degeneracies which have been problematic in earlier analyses. We
illustrate this by deriving the core Lorentz factor Gamma from the R-i
anti-correlation, finding Gamma > 1.3.
","[{""version"":""v1"",""created"":""Mon, 24 Sep 2012 20:00:45 GMT""}]","2015-06-11"
"1209.5400","Alexander Hobbs","Alexander Hobbs","Growing supermassive black holes: sub-grid modelling and
  intermediate-scale processes","8 pages, 3 figures. Published in the proceedings of 'The Central
  Kiloparsec in Galactic Nuclei', Astronomy at High Angular Resolution,
  Cologne, Germany, August 2011",,"10.1088/1742-6596/372/1/012003",,"astro-ph.CO astro-ph.HE astro-ph.IM","http://arxiv.org/licenses/nonexclusive-distrib/1.0/","  The sheer range of scales in the Universe makes it impossible to model all at
once. It is necessary, therefore, when conducting numerical experiments, that
we employ sub-resolution prescriptions that can represent the scales we are
unable to model directly. In this article we present a prescription for black
hole growth that incorporates a different accretion regime from the standard
approach used in the literature, and discuss the results of dedicated
simulations of intermediate processes between small-scale accretion flows and
large-scale cosmological volumes that can strongly enhance the accretion rate
onto the black hole at the centre of a galaxy.
","[{""version"":""v1"",""created"":""Mon, 24 Sep 2012 20:01:09 GMT""}]","2012-09-26"
"1209.5401","Adis Medic Adis Medic","Adis Medic and Adis Golubovic","P2P Appliance Calculation Method For Trust between Nodes",,"IJCSI International Journal of Computer Science Issues, Vol. 9,
  Issue 4, No 2, July 2012, ISSN (Online): 1694-0814",,,"cs.CY","http://arxiv.org/licenses/nonexclusive-distrib/1.0/","  Modern ways of communications, such as in a web services environment, also
influences trust relationships between organisations. This concept of web-based
(way towards semantic web services) trust is new and has as yet not been
resolved. We hope that some of the trust properties mentioned above can be
successfully employed to improve the understanding of trust between machines.
So, trust is a vital ingredient of any successful interaction between
individuals, among organizations and/or in society at large. In this paper, we
suggested a trust model using fuzzy logic in semantic network of nodes. Trust
is an aggregation of consensus given a set of past interaction among nodes
(semantic network based on machines, agents etc.). We applied our suggested
model to semantic networks in order to show how trust mechanisms are involved
in communicating algorithm to choose the proper path from source to
destination. Authors use the terms untrust and distrust as synonyms for the
condition opposite to the trust.
","[{""version"":""v1"",""created"":""Mon, 24 Sep 2012 20:01:29 GMT""}]","2012-09-26"
"1209.5402","Michael McQuillan","Michael McQuillan","The Bloch Principle",,,,,"math.CV math.AG","http://arxiv.org/licenses/nonexclusive-distrib/1.0/","  We formulate and prove an optimal version for quasi-projective surfaces of A.
Bloch's dictum, ""Nihil est in infinito quod prius non fuerit in finito"" by way
of a complement to a theorem of J. Duval.
","[{""version"":""v1"",""created"":""Mon, 24 Sep 2012 20:02:12 GMT""}]","2012-09-26"
"1209.5403","Christoph Adam","C. Adam, J. Sanchez-Guillen, A. Wereszczynski, W. J. Zakrzewski","Topological duality between vortices and planar skyrmions in BPS
  theories with APD symmetries","Latex, 18 pages, references added, typos corrected",,"10.1103/PhysRevD.87.027703",,"hep-th math-ph math.MP","http://arxiv.org/licenses/nonexclusive-distrib/1.0/","  The BPS baby Skyrme models are submodels of baby Skyrme models, where the
nonlinear sigma model term is suppressed. They have skyrmion solutions
saturating a BPS bound, and the corresponding static energy functional is
invariant under area-preserving diffeomorphisms (APDs). Here we show that the
solitons in the BPS baby Skyrme model, which carry a nontrivial topological
charge $Q_{b} \in \pi_2(S^2)$ (a winding number), are dual to vortices in a BPS
vortex model with a topological charge $Q_{v}\in \pi_1(S^1)$ (a vortex number),
in the sense that there is a map between the BPS solutions of the two models.
The corresponding energy densities of the BPS solutions of the two models are
identical. A further consequence of the duality is that the dual BPS vortex
models inherit the BPS property and the infinitely many symmetries (APDs) of
the BPS baby Skyrme models. Finally, we demonstrate that the same topological
duality continues to hold for the U(1) gauged versions of the models.
","[{""version"":""v1"",""created"":""Mon, 24 Sep 2012 20:02:31 GMT""},{""version"":""v2"",""created"":""Wed, 3 Oct 2012 18:53:09 GMT""}]","2013-05-30"
"1209.5404","Thomas Creutzig","Thomas Creutzig, Yasuaki Hikida, Peter B. Ronne","N=1 supersymmetric higher spin holography on AdS_3","31 pages, 1 figure",,"10.1007/JHEP02(2013)019",,"hep-th","http://arxiv.org/licenses/nonexclusive-distrib/1.0/","  We propose a duality between a higher spin N=1 supergravity on AdS_3 and a
large N limit of a family of N=(1,1) superconformal field theories. The gravity
theory is an N=1 truncation of the N=2 supergravity found by Prokushkin and
Vasiliev, and the dual conformal field theory is defined by a supersymmetric
coset model. We check this conjecture by comparing one loop partition functions
and find agreement. Moreover, we study the symmetry of the dual coset model and
in particular compute fields of the coset algebra of dimension 3/2, 2, 2 and
5/2 explicitely.
","[{""version"":""v1"",""created"":""Mon, 24 Sep 2012 20:03:28 GMT""},{""version"":""v2"",""created"":""Mon, 15 Apr 2013 17:28:58 GMT""}]","2015-06-11"
"1209.5405","Shanshan Cao","Shanshan Cao, Guang-You Qin and Steffen A. Bass","Heavy quark energy loss and thermalization in hot and dense nuclear
  matter","9 pages, 11 figures, talk given by Shanshan Cao at the 11th
  International Conference on Nucleus-Nucleus Collisions (NN2012), San Antonio,
  Texas, USA, May 27-June 1, 2012. To appear in the NN2012 Proceedings in
  Journal of Physics: Conference Series (JPCS)",,"10.1088/1742-6596/420/1/012022",,"nucl-th nucl-ex","http://arxiv.org/licenses/nonexclusive-distrib/1.0/","  We study heavy quark energy loss and thermalization in hot and dense nuclear
medium. The diffusion of heavy quarks is calculated via a Langevin equation,
both for a static medium as well as for a quark-gluon plasma (QGP) medium
generated by a (3+1)-dimensional hydrodynamic model. We investigate how the
initial configuration of the QGP and its properties affect the final state
spectra and elliptic flow of heavy flavor mesons and non-photonic electrons. It
is observed that both the geometric anisotropy of the initial profile and the
flow profile of the hydrodynamic medium play important roles in the heavy quark
energy loss process and the development of elliptic flow. Within our definition
of the thermalization criterion and for reasonable values of the diffusion
constant, we observe thermalization times that are longer than the lifetime of
the QGP phase.
","[{""version"":""v1"",""created"":""Mon, 24 Sep 2012 20:05:40 GMT""}]","2015-06-11"
"1209.5406","Stephan Roche","Dinh Van Tuan, Avishek Kumar, Stephan Roche, Frank Ortmann, M. F.
  Thorpe, Pablo Ordejon","Insulating Behavior of an Amorphous Graphene Membrane",,"Physical Review B, 86, 121408 (2012)","10.1103/PhysRevB.86.121408",,"cond-mat.mes-hall","http://arxiv.org/licenses/nonexclusive-distrib/1.0/","  We investigate the charge transport properties of planar amorphous graphene
that is fully topologically disordered, in the form of sp2 three-fold
coordinated networks consisting of hexagonal rings, but also including many
pentagons and heptagons distributed in a random fashion. Using the Kubo
transport methodology and the Lanczos method, the density of states, mean free
paths and semiclassical conductivities of such amorphous graphene membranes are
computed. Despite a large increase in the density of states close to the charge
neutrality point, all electronic properties are dramatically degraded,
evidencing an Anderson insulating state caused by topological disorder alone.
These results are supported by Landauer-Buttiker conductance calculations,
which show a localization length as short as 5 nanometers
","[{""version"":""v1"",""created"":""Mon, 24 Sep 2012 20:10:30 GMT""}]","2012-09-27"
"1209.5407","Alexei Lisitsa","Alexei Lisitsa and Andrei P. Nemytykh","A Note on Program Specialization. What Can Syntactical Properties of
  Residual Programs Reveal?",,,,,"cs.PL cs.FL","http://arxiv.org/licenses/nonexclusive-distrib/1.0/","  The paper presents two examples of non-traditional using of program
specialization by Turchin's supercompilation method. In both cases we are
interested in syntactical properties of residual programs produced by
supercompilation. In the first example we apply supercompilation to a program
encoding a word equation and as a result we obtain a program representing a
graph describing the solution set of the word equation. The idea of the second
example belongs to Alexandr V. Korlyukov. He considered an interpreter
simulating the dynamic of the well known missionaries-cannibals puzzle.
Supercompilation of the interpreter allows us to solve the puzzle. The
interpreter may also be seen as an encoding of a non-deterministic protocol.
","[{""version"":""v1"",""created"":""Mon, 24 Sep 2012 20:14:27 GMT""}]","2012-09-26"
"1209.5408","Guido Festuccia","Thomas T. Dumitrescu, Guido Festuccia","Exploring Curved Superspace (II)","34 pages; reference added","JHEP 1301 (2013) 072","10.1007/JHEP01(2013)072","PUPT-2425","hep-th math.DG","http://arxiv.org/licenses/nonexclusive-distrib/1.0/","  We extend our previous analysis of Riemannian four-manifolds M admitting
rigid supersymmetry to N=1 theories that do not possess a U(1)_R symmetry. With
one exception, we find that M must be a Hermitian manifold. However, the
presence of supersymmetry imposes additional restrictions. For instance, a
supercharge that squares to zero exists, if the canonical bundle of the
Hermitian manifold M admits a nowhere vanishing, holomorphic section. This
requirement can be slightly relaxed if M is a torus bundle over a Riemann
surface, in which case we obtain a supercharge that squares to a complex
Killing vector. We also analyze the conditions for the presence of more than
one supercharge. The exceptional case occurs when M is a warped product S^3 x
R, where the radius of the round S^3 is allowed to vary along R. Such manifolds
admit two supercharges that generate the superalgebra OSp(1|2). If the S^3
smoothly shrinks to zero at two points, we obtain a squashed four-sphere, which
is not a Hermitian manifold.
","[{""version"":""v1"",""created"":""Mon, 24 Sep 2012 20:16:32 GMT""},{""version"":""v2"",""created"":""Thu, 18 Oct 2012 14:50:58 GMT""}]","2013-10-24"
"1209.5409","David E. Speyer","David E Speyer","Schubert problems with respect to osculating flags of stable rational
  curves",,,,,"math.AG math.CO","http://arxiv.org/licenses/nonexclusive-distrib/1.0/","  Given a point z in P^1, let F(z) be the osculating flag to the rational
normal curve at point z. The study of Schubert problems with respect to such
flags F(z_1), F(z_2), ..., F(z_r) has been studied both classically and
recently, especially when the points z_i are real. Since the rational normal
curve has an action of PGL_2, it is natural to consider the points (z_1, ...,
z_r) as living in the moduli space of r distinct point in P^1 -- the famous
M_{0,r}. One can then ask to extend the results on Schubert intersections to
the compactification \bar{M}_{0,r}.
  The first part of this paper achieves this goal. We construct a flat,
Cohen-Macaulay family over \bar{M}_{0,r}, whose fibers over M_{0,r} are
isomorphic to G(d,n) and, given partitions lambda_1, ..., lambda_r, we
construct a flat Cohen-Macualay family over \bar{M}_{0,r} whose fiber over
(z_1, ..., z_r) in M_{0,r} is the intersection of the Schubert varieties
indexed by lambda_i with respect to the osculating flags F(z_i).
  In the second part of the paper, we investigate the topology of the real
points of our family, in the case that sum |lambda_i| = dim G(d,n). We show
that our family is a finite covering space of \bar{M}_{0,r}, and give an
explicit CW decomposition of this cover whose faces are indexed by objects from
the theory of Young tableaux.
","[{""version"":""v1"",""created"":""Mon, 24 Sep 2012 20:18:26 GMT""}]","2012-09-26"
"1209.5410","Shanshan Cao","Shanshan Cao, Guang-You Qin, Steffen A. Bass and Berndt M\""uller","Collisional vs. Radiative Energy Loss of Heavy Quark in a Hot and Dense
  Nuclear Matter","4 pages, 6 figures, talk given by Shanshan Cao at Quark Matter 2012",,"10.1016/j.nuclphysa.2013.02.100",,"nucl-th hep-ph nucl-ex","http://arxiv.org/licenses/nonexclusive-distrib/1.0/","  We study the heavy quark evolution in a quark-gluon plasma medium within the
framework of Langevin equation coupled to a (2+1)-dimensional viscous
hydrodynamic model. We modify the current Langevin algorithm such that apart
from quasi-elastic scattering, medium-induced radiative energy loss is
incorporated as well by treating gluon radiation as an extra force term. We
find a significant effect of gluon radiation on heavy quark energy loss at LHC
energies. Our calculation provides a good description of the D meson
suppression measured by ALICE experiment, and makes a prediction for B meson
suppression and flow.
","[{""version"":""v1"",""created"":""Mon, 24 Sep 2012 20:19:04 GMT""}]","2015-06-11"
"1209.5411","Diego  Amancio Raphael","Diego R. Amancio, Osvaldo N. Oliveira Jr. and Luciano da F. Costa","A decaying factor accounts for contained activity in neuronal networks
  with no need of hierarchical or modular organization",,"J. Stat. Mech. (2012) P11018","10.1088/1742-5468/2012/11/P11018",,"physics.bio-ph physics.soc-ph q-bio.NC","http://arxiv.org/licenses/nonexclusive-distrib/1.0/","  The mechanisms responsible for contention of activity in systems represented
by networks are crucial in various phenomena, as in diseases such as epilepsy
that affects the neuronal networks, and for information dissemination in social
networks. The first models to account for contained activity included
triggering and inhibition processes, but they cannot be applied to social
networks where inhibition is clearly absent. A recent model showed that
contained activity can be achieved with no need of inhibition processes
provided that the network is subdivided in modules (communities). In this
paper, we introduce a new concept inspired in the Hebbian theory through which
activity contention is reached by incorporating a dynamics based on a decaying
activity in a random walk mechanism preferential to the node activity. Upon
selecting the decay coefficient within a proper range, we observed sustained
activity in all the networks tested, viz. random, Barabasi-Albert and
geographical networks. The generality of this finding was confirmed by showing
that modularity is no longer needed if the dynamics based on the
integrate-and-fire dynamics incorporated the decay factor. Taken together,
these results provide a proof of principle that persistent, restrained network
activation might occur in the absence of any particular topological structure.
This may be the reason why neuronal activity does not outspread to the entire
neuronal network, even when no special topological organization exists.
","[{""version"":""v1"",""created"":""Mon, 24 Sep 2012 20:23:06 GMT""}]","2013-02-20"
"1209.5412","Mouchira Zaiter","Mouchira Zaiter","On some subvarieties of the cartesian powers of a semisimple algebra
  related to a parabolic subalgebra","15 pages",,,,"math.RT math.AG","http://arxiv.org/licenses/nonexclusive-distrib/1.0/","  In this note, we describe some desingularizations of some subvarieties of the
cartesian powers of a semisimple Lie algebra of finite dimension.
","[{""version"":""v1"",""created"":""Mon, 24 Sep 2012 20:26:49 GMT""},{""version"":""v2"",""created"":""Fri, 28 Sep 2012 13:21:34 GMT""}]","2012-10-01"
"1209.5413","Jie Qing","Vincent Bonini, Jose Espinar and Jie Qing","Hypersurfaces in hyperbolic space with support function","39 pages and one figure",,,,"math.DG","http://arxiv.org/licenses/nonexclusive-distrib/1.0/","  In this paper we develop a global correspondence between immersed
horospherically convex hypersurfaces in hyperbolic space and complete conformal
metrics on domains in the sphere. We establish results on when the hyperbolic
Gauss map is injective and when an immersed horospherically convex hypersurface
can be unfolded along the normal flow into an embedded one. These results allow
us to establish general Alexandrov reflection principles of elliptic problems
of both Weingarten hypersurfaces and complete conformal metrics and relations
between them. Consequently, we are able to obtain, for instance, a strong
Bernstein theorem for a complete, immersed, horospherically convex hypersurface
of constant mean curvature in hyperbolic space.
","[{""version"":""v1"",""created"":""Mon, 24 Sep 2012 20:31:01 GMT""},{""version"":""v2"",""created"":""Thu, 6 Dec 2012 19:44:28 GMT""}]","2012-12-07"
"1209.5414","Morten Ring Eskildsen","P. Das, J. M. Densmore, C. Rastovski, K. J. Schlesinger, M. Laver, C.
  D. Dewhurst, K. Littrell, S. L. Bud'ko, P. C. Canfield, and M. R. Eskildsen","Field Dependence of the Superconducting Basal Plane Anisotropy of
  TmNi2B2C","8 pages, 6 figures, 1 table","Phys. Rev. B 86, 144501 (2012)","10.1103/PhysRevB.86.144501",,"cond-mat.supr-con","http://arxiv.org/licenses/nonexclusive-distrib/1.0/","  The superconductor TmNi2B2C possesses a significant four-fold basal plane
anisotropy, leading to a square Vortex Lattice (VL) at intermediate fields.
However, unlike other members of the borocarbide superconductors, the
anisotropy in TmNi2B2C appears to decrease with increasing field, evident by a
reentrance of the square VL phase. We have used Small Angle Neutron Scattering
measurements of the VL to study the field dependence of the anisotropy. Our
results provide a direct, quantitative measurement of the decreasing
anisotropy. We attribute this reduction of the basal plane anisotropy to the
strong Pauli paramagnetic effects observed in TmNi2B2C and the resulting
expansion of vortex cores near Hc2.
","[{""version"":""v1"",""created"":""Mon, 24 Sep 2012 20:31:36 GMT""}]","2012-10-02"
