"1209.5314","Maxim Y. Reshetnyak","P. Hejda, M. Reshetnyak","Domino model in geodynamo",,,,,"physics.flu-dyn","http://arxiv.org/licenses/nonexclusive-distrib/1.0/","  Using Lagrangian formalism we consider evolution of the ensemble of
interacting magnetohydrodynamic cyclones governed with Langevin type equations
in the rotating medium. This problem is relevant to the planetary cores where
the Rossby numbers are small and geostrophic balance takes place. We show that
variations of the heat flux at the outer boundary of the spherical shell
modulates frequency of the reversals of the mean magnetic field that is in
accordance with the 3D dynamo simulations. Two scenarios of reversals were
bserved. Either the axial dipole decreases in favour of quadrupole and then
grows in opposite direction or the mean dipole tilts and reverses without
decrease of its amplitude.
","[{""version"":""v1"",""created"":""Mon, 24 Sep 2012 16:00:08 GMT""}]","2012-09-25"
"1209.5315","Klaus Reygers","H. J. Pirner, K. Reygers, B. Z. Kopeliovich","Universal Centrality Dependence of Particle Multiplicities in Heavy-Ion
  Collisions","10 pages, 7 figures, version as published in Phys. Rev. C","Phys. Rev. C87 (2013) 054906","10.1103/PhysRevC.87.054906",,"nucl-th","http://arxiv.org/licenses/nonexclusive-distrib/1.0/","  Starting from the light-cone plasma (LCP) distribution of gluons produced in
proton-proton collisions, we derive the invariant charged-particle yield
dN/dyd^2pT in heavy-ion collisions. Multiple scattering of partons in the other
nucleus leads to pT broadening, which depends on the centrality of the
collision. The resulting change of the LCP parameters determines the
distributions of charged particles. The charged-particle multiplicity dN/deta
at eta=0 normalized to the number of participating nucleons has a universal
centrality dependence, common to RHIC and LHC. This universal increase is of
geometrical origin. Such a universality can be broken by the energy dependent
coherence effect, shadowing and mutual boosting of the saturation scales.
However, we found these effects to essentially compensate each other, leaving
the centrality dependence of multiplicity approximately universal.
","[{""version"":""v1"",""created"":""Mon, 24 Sep 2012 16:02:29 GMT""},{""version"":""v2"",""created"":""Wed, 15 May 2013 15:03:30 GMT""}]","2013-05-16"
"1209.5316","Katia Biazzo Dr","K. Biazzo (1), J. M. Alcal\'a (1), E. Covino (1), A. Frasca (2), F.
  Getman (1), L. Spezzi (3) ((1) INAF - Capodimonte Astronomical Observatory,
  (2) INAF - Catania Astrophysical Observatory, (3) ESO - European Southern
  Observatory)","The Chamaeleon II low-mass star-forming region: radial velocities,
  elemental abundances, and accretion properties","21 Pages, 15 Figures, 7 Tables. Accepted for publication in Astronomy
  and Astrophysics. Abstract shortened",,"10.1051/0004-6361/201219680",,"astro-ph.SR","http://arxiv.org/licenses/nonexclusive-distrib/1.0/","  Radial velocities, elemental abundances, and accretion properties of members
of star-forming regions (SFRs) are important for understanding star and planet
formation. While infrared observations reveal the evolutionary status of the
disk, optical spectroscopy is fundamental to acquire information on the
properties of the central star and on the accretion characteristics. 2MASS
archive data and the Spitzer c2d survey of the Chamaeleon II dark cloud have
provided disk properties of a large number of young stars. We complement these
data with spectroscopy with the aim of providing physical stellar parameters
and accretion properties. We use FLAMES/UVES+GIRAFFE observations of 40 members
of Cha II to measure radial velocities through cross-correlation technique, Li
abundances by means of curves of growth, and for a suitable star elemental
abundances of Fe, Al, Si, Ca, Ti, and Ni using the code MOOG. From the
equivalent widths of the Halpha, Hbeta, and the HeI-5876, 6678, 7065 Angstrom
emission lines, we estimate the mass accretion rates, dMacc/dt, for all the
objects. We derive a radial velocity distribution for the Cha II stars
(<Vrad>=11.4+-2.0 km/s). We find dMacc/dt prop. to Mstar^1.3 and to Age^(-0.82)
in the 0.1-1.0 Msun mass regime, and a mean dMacc/dt for Cha II of ~7*10^(-10)
Msun/yr. We also establish a relationship between the HeI-7065 Angstrom line
emission and the accretion luminosity. The radial velocity distributions of
stars and gas in Cha II are consistent. The spread in dMacc/dt at a given
stellar mass is about one order of magnitude and can not be ascribed entirely
to short timescale variability. Analyzing the relation between dMacc/dt and the
colors in Spitzer and 2MASS bands, we find indications that the inner disk
changes from optically thick to optically thin at dMacc/dt~10^(-10) Msun/yr.
Finally, the disk fraction is consistent with the age of Cha II.
","[{""version"":""v1"",""created"":""Mon, 24 Sep 2012 16:05:07 GMT""}]","2015-06-11"
"1209.5317","Ant\^onio Ribeiro de Moura Ph.D.","Ant\^onio R. Moura and Afr\^anio R. Pereira","Study of the bilinear biquadratic Heisenberg model on a honeycomb
  lattice via Schwinger bosons","14 pages, 5 figures",,"10.1016/j.jmmm.2013.04.017",,"cond-mat.str-el","http://arxiv.org/licenses/nonexclusive-distrib/1.0/","  We analyze the biquadratic bilinear Heisenberg magnet on a honeycomb lattice
via Schwinger boson formalism. Due to their vulnerability to quantum
fluctuations, non conventional lattices (kagome, triangular and honeycomb for
example) have been cited as candidates to support spin liquid states. Such
states without long range order at zero temperature are known in
one-dimensional spin models but their existence in higher dimensional systems
is still under debate. Biquadratic interaction is responsible for various
possibilities and phases as it is well-founded for one-dimensional systems.
Here we have used a bosonic representation to study the properties at zero and
finite low temperatures of the biquadratic term in the two-dimensional
hexagonal honeycomb lattice. The results show a ordered state at zero
temperature but much more fragile than that of a square lattice; the behavior
at finite low temperatures is in accordance with expectations.
","[{""version"":""v1"",""created"":""Mon, 24 Sep 2012 16:07:26 GMT""},{""version"":""v2"",""created"":""Wed, 23 Jan 2013 14:54:25 GMT""}]","2015-06-11"
"1209.5318","Reinhard Diestel","Reinhard Diestel","Forcing finite minors in sparse infinite graphs by large-degree
  assumptions",,,,,"math.CO","http://arxiv.org/licenses/nonexclusive-distrib/1.0/","  Developing further Stein's recent notion of relative end degrees in infinite
graphs, we investigate which degree assumptions can force a locally finite
graph to contain a given finite minor, or a finite subgraph of given minimum
degree. This is part of a wider project which seeks to develop an extremal
theory of sparse infinite graphs.
","[{""version"":""v1"",""created"":""Mon, 24 Sep 2012 16:11:34 GMT""}]","2012-09-25"
"1209.5319","Nourah Al-Angari","Nourah Al-Angari, Abdullatif ALAbdullatif","Multiprocessor Scheduling Using Parallel Genetic Algorithm","5 pages, 5 figures, published in (IJCSI, Volume 9, Issue 4, July
  2012)",,,,"cs.DC","http://arxiv.org/licenses/nonexclusive-distrib/1.0/","  Tasks scheduling is the most challenging problem in the parallel computing.
Hence, the inappropriate scheduling will reduce or even abort the utilization
of the true potential of the parallelization. Genetic algorithm (GA) has been
successfully applied to solve the scheduling problem. The fitness evaluation is
the most time consuming GA operation for the CPU time, which affect the GA
performance. The proposed synchronous master-slave algorithm outperforms the
sequential algorithm in case of complex and high number of generations problem.
","[{""version"":""v1"",""created"":""Mon, 24 Sep 2012 16:12:20 GMT""}]","2012-09-25"
"1209.5320","Armando Relano","Ricardo Puebla, Armando Rela\~no, and Joaqu\'in Retamosa","Excited-state phase transition leading to symmetry-breaking steady
  states in the Dicke model","5 pages, 4 figures, PRL format","Phys. Rev. A 87, 023819 (2013)","10.1103/PhysRevA.87.023819",,"quant-ph cond-mat.quant-gas","http://arxiv.org/licenses/nonexclusive-distrib/1.0/","  We study the phase diagram of the Dicke model in terms of the excitation
energy and the radiation-matter coupling constant $\lambda$. Below a certain
critical value $\lambda_c$ of the coupling constant $\lambda$ all the energy
levels have a well-defined parity. For $\lambda > \lambda_c$ the energy
spectrum exhibits two different phases separated by a critical energy $E_c$
that proves to be independent of $\lambda$. In the upper phase, the energy
levels have also a well defined parity, but below $E_c$ the energy levels are
doubly degenerated. We show that the long-time behavior of appropriate
parity-breaking observables distinguishes between the different phases of the
energy spectrum of the Dicke model. Steady states reached from
symmetry-breaking initial conditions restore the symmetry only if their
expected energies are above the critical. This fact makes it possible to
experimentally explore the complete phase diagram of the excitation spectrum of
the Dicke model.
","[{""version"":""v1"",""created"":""Mon, 24 Sep 2012 16:13:13 GMT""}]","2022-02-08"
"1209.5321","Cl\'elio Brasil Gomes C. B. Gomes","C. B. Gomes, F. A. G. Almeida and A. M. C. Souza","The influence of the Kerr effect in Mott insulator to superfluid
  transition from the point of view of the Jaynes-Cummings-Hubbard model","8 pages, 7 figures",,,,"quant-ph","http://arxiv.org/licenses/nonexclusive-distrib/1.0/","  We have studied the Jaynes-Cummings-Hubbard model for a chain with the Kerr
effect (nonlinear optical effect) through fermionic approximation. We have
observed that the Kerr effec does not cause major changes in the energy
spectrum. However, the phase transition properties from Mott insulator to
superfluid undergoes significant changes due to the Kerr effect.
","[{""version"":""v1"",""created"":""Mon, 24 Sep 2012 16:17:21 GMT""}]","2012-09-25"
"1209.5322","Larbi Alili","L. Alili, P. Graczyk and T. Zak","On inversions and Doob $h$-transforms of linear diffusions","19 pages",,,,"math.PR","http://arxiv.org/licenses/nonexclusive-distrib/1.0/","  Let $X$ be a regular linear diffusion whose state space is an open interval
$E\subseteq\mathbb{R}$. We consider a diffusion $X^*$ which probability law is
obtained as a Doob $h$-transform of the law of $X$, where $h$ is a positive
harmonic function for the infinitesimal generator of $X$ on $E$. This is the
dual of $X$ with respect to $h(x)m(dx)$ where $m(dx)$ is the speed measure of
$X$. Examples include the case where $X^*$ is $X$ conditioned to stay above
some fixed level. We provide a construction of $X^*$ as a deterministic
inversion of $X$, time changed with some random clock. The study involves the
construction of some inversions which generalize the Euclidean inversions.
Brownian motion with drift and Bessel processes are considered in details.
","[{""version"":""v1"",""created"":""Mon, 24 Sep 2012 16:24:39 GMT""},{""version"":""v2"",""created"":""Mon, 8 Oct 2012 16:51:40 GMT""},{""version"":""v3"",""created"":""Tue, 13 Jan 2015 14:31:22 GMT""}]","2015-01-14"
"1209.5323","Ren\'e Heller","Ren\'e Heller (1), Rory Barnes (2,3) ((1) Leibniz Institute for
  Astrophysics Potsdam (AIP), Germany, (2) University of Washington, Seattle,
  USA, (3) NASA Astrobiology Institute, VPL Lead Team, USA)","Exomoon habitability constrained by illumination and tidal heating","typos in Eqs. (11) and (B.3) corrected; runaway greenhouse flux for
  Super-Ganymede corrected to 266W/m^2; contours in Figs. 8, 10, and 13
  adjusted; 35 pages; 16 figures (7 colored)","Astrobiology, Vol. 13, Issue 1, pp. 18-46, January 2013","10.1089/ast.2012.0859",,"astro-ph.EP","http://arxiv.org/licenses/nonexclusive-distrib/1.0/","  The detection of moons orbiting extrasolar planets (""exomoons"") has now
become feasible. Once they are discovered in the circumstellar habitable zone,
questions about their habitability will emerge. Exomoons are likely to be
tidally locked to their planet and hence experience days much shorter than
their orbital period around the star and have seasons, all of which works in
favor of habitability. These satellites can receive more illumination per area
than their host planets, as the planet reflects stellar light and emits thermal
photons. On the contrary, eclipses can significantly alter local climates on
exomoons by reducing stellar illumination. In addition to radiative heating,
tidal heating can be very large on exomoons, possibly even large enough for
sterilization. We identify combinations of physical and orbital parameters for
which radiative and tidal heating are strong enough to trigger a runaway
greenhouse. By analogy with the circumstellar habitable zone, these constraints
define a circumplanetary ""habitable edge"". We apply our model to hypothetical
moons around the recently discovered exoplanet Kepler-22b and the giant planet
candidate KOI211.01 and describe, for the first time, the orbits of habitable
exomoons. If either planet hosted a satellite at a distance greater than 10
planetary radii, then this could indicate the presence of a habitable moon.
","[{""version"":""v1"",""created"":""Mon, 24 Sep 2012 16:31:28 GMT""},{""version"":""v2"",""created"":""Mon, 4 Feb 2013 15:32:50 GMT""},{""version"":""v3"",""created"":""Wed, 30 Oct 2013 19:07:32 GMT""}]","2013-10-31"
"1209.5324","Jorge Yanez","Jorge Yanez Escanciano, Andreas G. Class","A mathematical model for three dimensional detonation as pure
  gas-dynamic discontinuity",,,,,"math-ph math.MP","http://arxiv.org/licenses/nonexclusive-distrib/1.0/","  A model for three dimensional detonation is proposed based on the
approximation that the detonation thickness is small compared to the
characteristic scales of the fluid motion. In this framework detonations are
treated as a modified hydrodynamic discontinuity. The altered Rankine-Hugoniot
jump conditions take into account the internal structure of the detonation
including the chemical reaction. The position of the discontinuity surface and
the corresponding jump conditions are derived from first principles. The final
modified conditions are dependent on curvature, flame thickness and stretching
and allow for simple physical interpretation.
","[{""version"":""v1"",""created"":""Mon, 24 Sep 2012 16:32:52 GMT""}]","2012-09-25"
"1209.5325","Radu Grigore","Radu Grigore, Dino Distefano, Rasmus Lerchedahl Petersen, Nikos
  Tzevelekos","Runtime Verification Based on Register Automata","TACAS 2013 (plus proofs)",,,,"cs.FL cs.SE","http://arxiv.org/licenses/nonexclusive-distrib/1.0/","  We propose TOPL automata as a new method for runtime verification of systems
with unbounded resource generation. Paradigmatic such systems are
object-oriented programs which can dynamically generate an unbounded number of
fresh object identities during their execution. Our formalism is based on
register automata, a particularly successful approach in automata over infinite
alphabets which administers a finite-state machine with boundedly many
input-storing registers. We show that TOPL automata are equally expressive to
register automata and yet suitable to express properties of programs. Compared
to other runtime verification methods, our technique can handle a class of
properties beyond the reach of current tools. We show in particular that
properties which require value updates are not expressible with current
techniques yet are naturally captured by TOPL machines. On the practical side,
we present a tool for runtime verification of Java programs via TOPL
properties, where the trade-off between the coverage and the overhead of the
monitoring system is tunable by means of a number of parameters. We validate
our technique by checking properties involving multiple objects and chaining of
values on large open source projects.
","[{""version"":""v1"",""created"":""Mon, 24 Sep 2012 16:33:13 GMT""},{""version"":""v2"",""created"":""Mon, 25 Feb 2013 09:08:17 GMT""},{""version"":""v3"",""created"":""Tue, 20 Jan 2015 07:57:18 GMT""}]","2015-01-21"
"1209.5326","Anna Bodrova","Awadhesh Kumar Dubey, Anna Bodrova, Sanjay Puri, and Nikolai
  Brilliantov","Velocity distribution function and effective constant restitution
  coefficient for granular gas of viscoelastic particles",,,"10.1103/PhysRevE.87.062202",,"cond-mat.stat-mech cond-mat.soft","http://arxiv.org/licenses/nonexclusive-distrib/1.0/","  We perform large-scale event-driven Molecular dynamics (MD) simulations for
granular gases of particles interacting with the impact-velocity dependent
restitution coefficient. We use the simplest first-principle collision model of
viscoelastic spheres. Both cases of force-free and uniformly heated gases are
studied. We formulate a simplified model of an effective constant restitution
coefficient, which depends on a current granular temperature and compute the
effective constant restitution coefficient, using the kinetic theory. We
develop a theory of the velocity distribution function for driven gases of
viscoelastic particles and analyze evolution of granular temperature and of the
Sonine coefficients, which characterize the form of the velocity distribution
function. We observe that for not large dissipation the simulation results are
in an excellent agreement with the theory for both, homogeneous cooling state
and uniformly heated gases. At the same time a noticeable discrepancy between
the theory and MD results for the Sonine coefficients is detected for large
dissipation. We analyze the accuracy of the simplified model, based on the
effective restitution coefficient and conclude that this model can accurately
describe granular temperature. It provides also an acceptable accuracy for the
velocity distribution function for small dissipation, but fails when
dissipation is large.
","[{""version"":""v1"",""created"":""Mon, 24 Sep 2012 16:34:07 GMT""},{""version"":""v2"",""created"":""Sun, 17 Feb 2013 18:00:33 GMT""},{""version"":""v3"",""created"":""Mon, 27 May 2013 20:28:30 GMT""},{""version"":""v4"",""created"":""Wed, 29 May 2013 11:18:12 GMT""}]","2015-06-11"
"1209.5327","Ping Xiang","Ping Xiang, Marina Litinskaya, Evgeny A. Shapiro, and Roman V. Krems","Non-adiabatic control of quantum energy transfer in ordered and
  disordered arrays","25 pages, 9 figures","New J. Phys. 15, 063015 (2013)","10.1088/1367-2630/15/6/063015",,"quant-ph physics.atom-ph","http://arxiv.org/licenses/nonexclusive-distrib/1.0/","  An elementary excitation in an aggregate of coupled particles generates a
collective excited state. We show that the dynamics of these excitations can be
controlled by applying a transient external potential which modifies the phase
of the quantum states of the individual particles. The method is based on an
interplay of adiabatic and sudden time scales in the quantum evolution of the
many-body states. We show that specific phase transformations can be used to
accelerate or decelerate quantum energy transfer and spatially focus
delocalized excitations onto different parts of arrays of quantum particles. We
consider possible experimental implementations of the proposed technique and
study the effect of disorder due to the presence of impurities on its fidelity.
We further show that the proposed technique can allow control of energy
transfer in completely disordered systems.
","[{""version"":""v1"",""created"":""Mon, 24 Sep 2012 16:39:36 GMT""},{""version"":""v2"",""created"":""Sat, 2 Mar 2013 00:10:22 GMT""}]","2013-06-14"
"1209.5328","Kenichi Konishi","Simone Giacomelli and Kenichi Konishi","Singular SQCD Vacua and Confinement","27 pages",,"10.1007/JHEP12(2012)083","IFUP-TH/2012-18","hep-th","http://arxiv.org/licenses/nonexclusive-distrib/1.0/","  We revisit the study of confining vacua in the softly broken N=2
supersymmetric QCD, in the light of some recent developments in our
understanding of the dynamics of N=2 gauge theories. These vacua are
characterized by an effective magnetic $SU(r)$ gauge group ($0\leq r\leq
N_f/2$) and are referred to sometimes as the $r$ vacua. We further clarify the
meaning of $r \leftrightarrow N_{f}-r$ duality arising from the matching of
semi-classical and quantum vacua. A particular attention is paid to certain
singular SCFT's of N=2 SQCD, driven into confinement phase by the adjoint mass
deformation $\mu\, \Phi^{2}$. In some cases they occur as a result of
coalescence of different $r$ vacua as the bare mass is tuned to a critical
value.
","[{""version"":""v1"",""created"":""Mon, 24 Sep 2012 16:45:23 GMT""},{""version"":""v2"",""created"":""Thu, 1 Nov 2012 18:24:17 GMT""}]","2015-06-11"
"1209.5329","Gopal Chandra Shit G C Shit","G. C. Shit, M. Roy","Pulsatile flow and heat transfer of a magneto-micropolar fluid through a
  stenosed artery under the influence of body acceleration","24 pages, 22 figures","Journal of Mechanics in Medicine and Biology, vol-11, pp. 643-661
  (2011)",,,"math.NA physics.flu-dyn q-bio.TO","http://arxiv.org/licenses/nonexclusive-distrib/1.0/","  With an aim to investigate the effect of externally imposed body acceleration
and magnetic field on pulsatile flow of blood through an arterial segment
having stenosis is under consideration in this paper. The flow of blood is
presented by a unsteady micropolar fluid and the heat transfer characteristics
have been taken into account. The non-linear equations that governing the flow
are solved numerically using finite difference technique by employing a
suitable coordinate transformation. The numerical results have been observed
for axial and microrotation component of velocity, fluid acceleration, wall
shear stress(WSS), flow resistance, temperature and the volumetric flow rate.
It thus turns out that the rate of heat transfer increases with the increase of
Hartmann number $H$, while the wall shear stress has a reducing effect on the
Hartmann number $H$ and an enhancing effect on microrotation parameter $K$ as
well as the constriction height $\delta$.
","[{""version"":""v1"",""created"":""Mon, 24 Sep 2012 16:45:58 GMT""}]","2012-09-25"
"1209.5330","Mukul Gupta","S. M. Amir, Mukul Gupta, Ajay Gupta and J. Stahn","Surfactant enhanced antiferromagnetic coupling in magnetron sputtered
  Cu/Co multilayers: A neutron reflectivity study","6 Pages, 6 Figs",,,,"cond-mat.mes-hall cond-mat.mtrl-sci","http://arxiv.org/licenses/nonexclusive-distrib/1.0/","  In this work we studied Cu/Co multilayers prepared using dc-magnetron
sputtering technique with Ag surfactant. It was found that Ag balances the
difference in the surface free energy of Cu and Co and this results in removing
the asymmetry in the interface roughness of Cu-on-Co and Co-on-Cu interfaces.
As the interfaces become symmetric, we observe a significant enhancement in
antiferromagnetic coupling and magneto resistance. Further, a correlation of
spin-dependent scattering with the interface roughness is brought by comparing
Cu/Co multilayer prepared using different deposition methods. It was found that
as interface roughness increases spin-dependent scattering decreases.
","[{""version"":""v1"",""created"":""Mon, 24 Sep 2012 16:47:30 GMT""}]","2012-09-25"
"1209.5331","Steven Senger","Steven Senger","Reliability of swarming algorithms for mobile sensor network
  applications","Handout for poster given at the 2012 February Fourier Talks",,,,"cs.MA","http://arxiv.org/licenses/nonexclusive-distrib/1.0/","  There are many well-studied swarming algorithms which are often suited to
very specific purposes. As mobile sensor networks become increasingly complex,
and are comprised of more and more agents, it makes sense to consider swarming
algorithms for movement control. We introduce a natural way to measure the
reliability of various swarming algorithms so a balance can be struck between
algorithmic complexity and sampling accuracy.
","[{""version"":""v1"",""created"":""Mon, 24 Sep 2012 16:53:41 GMT""}]","2012-09-25"
"1209.5332","Simon Phoenix","Simon J. D. Phoenix and Faisal Shah Khan","The Role of Correlation in Quantum and Classical Games","To appear in Fluctuation and Noise Letters",,,,"quant-ph","http://arxiv.org/licenses/nonexclusive-distrib/1.0/","  We use the example of playing a 2-player game with entangled quantum objects
to investigate the effect of quantum correlation. We find that for simple game
scenarios it is classical correlation that is the central feature and that
these simple quantum games are not sensitive to the quantum part of the
correlation. In these games played with quantum objects it is possible to
transform a game such as Prisoner's Dilemma into the game of Chicken. We show
that this behaviour, and the associated enhanced equilibrium payoff over
playing the game with quantum objects in non-entangled states, is entirely due
to the classical part of the correlation. Generalizing these games to the pure
strategy 2-player quantum game where the players have finite strategy sets and
a projective joint measurement is made on the output state produced by the
players, we show that a given quantum game of this form can always be
reproduced by a classical model, such as a communication channel. Where
entanglement is a feature of the these 2-player quantum games the matrix of
expected outcomes for the players can be reproduced by a classical channel with
correlated noise.
","[{""version"":""v1"",""created"":""Mon, 24 Sep 2012 16:53:50 GMT""},{""version"":""v2"",""created"":""Mon, 29 Oct 2012 00:34:18 GMT""},{""version"":""v3"",""created"":""Sun, 19 May 2013 04:44:38 GMT""}]","2013-05-21"
