"1209.5469","Matthew Doty","Sophia E. Economou, Juan I. Climente, Antonio Badolato, Allan S.
  Bracker, Daniel Gammon, Matthew F. Doty","Scalable qubit architecture based on holes in quantum dot molecules","13 pages, 9 figures","Physical Review B 86, 085319 (2012)","10.1103/PhysRevB.86.085319",,"cond-mat.mes-hall cond-mat.mtrl-sci quant-ph","http://arxiv.org/licenses/nonexclusive-distrib/1.0/","  Spins confined in quantum dots are a leading candidate for solid-state
quantum bits that can be coherently controlled by optical pulses. There are,
however, many challenges to developing a scalable multibit information
processing device based on spins in quantum dots, including the natural
inhomogeneous distribution of quantum dot energy levels, the difficulty of
creating all-optical spin manipulation protocols compatible with nondestructive
readout, and the substantial electron-nuclear hyperfine interaction-induced
decoherence. Here, we present a scalable qubit design and device architecture
based on the spin states of single holes confined in a quantum dot molecule.
The quantum dot molecule qubit enables a new strategy for optical coherent
control with dramatically enhanced wavelength tunability. The use of hole spins
allows the suppression of decoherence via hyperfine interactions and enables
coherent spin rotations using Raman transitions mediated by a hole-spin-mixed
optically excited state. Because the spin mixing is present only in the
optically excited state, dephasing and decoherence are strongly suppressed in
the ground states that define the qubits and nondestructive readout is
possible. We present the qubit and device designs and analyze the wavelength
tunability and fidelity of gate operations that can be implemented using this
strategy. We then present experimental and theoretical progress toward
implementing this design.
","[{""version"":""v1"",""created"":""Tue, 25 Sep 2012 01:56:12 GMT""}]","2012-09-26"
"1209.5470","Bin Yang","Bin Yang and William Zhu","Matroidal structure of generalized rough sets based on symmetric and
  transitive relations","5 pages",,,,"cs.AI","http://arxiv.org/licenses/nonexclusive-distrib/1.0/","  Rough sets are efficient for data pre-process in data mining. Lower and upper
approximations are two core concepts of rough sets. This paper studies
generalized rough sets based on symmetric and transitive relations from the
operator-oriented view by matroidal approaches. We firstly construct a
matroidal structure of generalized rough sets based on symmetric and transitive
relations, and provide an approach to study the matroid induced by a symmetric
and transitive relation. Secondly, this paper establishes a close relationship
between matroids and generalized rough sets. Approximation quality and
roughness of generalized rough sets can be computed by the circuit of matroid
theory. At last, a symmetric and transitive relation can be constructed by a
matroid with some special properties.
","[{""version"":""v1"",""created"":""Tue, 25 Sep 2012 02:14:19 GMT""},{""version"":""v2"",""created"":""Mon, 17 Dec 2012 02:30:43 GMT""}]","2012-12-18"
"1209.5471","Muhammad Sharif","M. Sharif and Neelum Bashir","Effects of Electromagnetic Field on Energy Density Inhomogeneity in
  Self-Gravitating Fluids","16 pages, no figure","Gen. Relativ. Gravit. 44(2012)1725-1737","10.1007/s10714-012-1362-3",,"gr-qc","http://arxiv.org/licenses/nonexclusive-distrib/1.0/","  This paper is devoted to study the effects of electromagnetic field on the
energy density inhomogeneity in the relativistic self-gravitating fluids for
spherically symmetric spacetime. Two important equations of the Weyl tensor are
formulated which help to analyze the energy density inhomogeneity in this
scenario. We investigate two types of fluids, i.e., non-dissipative and
dissipative. The non-dissipative fluid further includes dust, locally
isotropic, and locally anisotropic charged fluids. We explore the effects of
different factors on energy density inhomogeneity in all these cases, in
particular, the effect of charge.
","[{""version"":""v1"",""created"":""Tue, 25 Sep 2012 02:23:58 GMT""}]","2015-06-11"
"1209.5472","Zhongxiang Wang","Xuebing Wang, Zhongxiang Wang (SHAO, China), Nidia Morrell (LCO,
  Chile)","Infrared Observations of The Millisecond Pulsar Binary J1023+0038:
  Evidence for Short-Term Nature of Its Interacting Phase in 2000--2001","7 page, 1 figure, 2 tables, accepted for publication in ApJ",,"10.1088/0004-637X/764/2/144",,"astro-ph.HE","http://arxiv.org/licenses/nonexclusive-distrib/1.0/","  We report our multi-band infrared (IR) imaging of the transitional
millisecond pulsar system J1023+0038, a rare pulsar binary known to have an
accretion disk in 2000--2001. The observations were carried out with
ground-based and space telescopes from near-IR to far-IR wavelengths. We
detected the source in near-IR JH bands and Spitzer 3.6 and 4.5 $\mu$m mid-IR
channels. Combined with the previously-reported optical spectrum of the source,
the IR emission is found to arise from the companion star, with no excess
emission detected in the wavelength range. Because our near-IR fluxes are
nearly equal to those obtained by the 2MASS all-sky survey in 2000 Feb., the
result indicates that the binary did not contain the accretion disk at the
time, whose existence would have raised the near-IR fluxes to 2-times larger
values. Our observations have thus established the short-term nature of the
interacting phase seen in 2000--2001: the accretion disk at most existed for
2.5 yrs. The binary was not detected by the WISE all-sky survey carried out in
2010 at its 12 and 22 $\mu$m bands and our Herschel far-IR imaging at 70 and
160 $\mu$m. Depending on the assumed properties of the dust, the resulting flux
upper limits provide a constraint of <3x10^{22}--3x10^{25} g on the mass of the
dust grains that possibly exist as the remnant of the previously-seen accretion
disk.
","[{""version"":""v1"",""created"":""Tue, 25 Sep 2012 02:33:08 GMT""},{""version"":""v2"",""created"":""Thu, 24 Jan 2013 02:06:36 GMT""}]","2015-06-11"
"1209.5473","Lirun Su","Lirun Su and William Zhu","Some characteristics of matroids through rough sets","13 pages",,,,"cs.AI","http://arxiv.org/licenses/nonexclusive-distrib/1.0/","  At present, practical application and theoretical discussion of rough sets
are two hot problems in computer science. The core concepts of rough set theory
are upper and lower approximation operators based on equivalence relations.
Matroid, as a branch of mathematics, is a structure that generalizes linear
independence in vector spaces. Further, matroid theory borrows extensively from
the terminology of linear algebra and graph theory. We can combine rough set
theory with matroid theory through using rough sets to study some
characteristics of matroids. In this paper, we apply rough sets to matroids
through defining a family of sets which are constructed from the upper
approximation operator with respect to an equivalence relation. First, we prove
the family of sets satisfies the support set axioms of matroids, and then we
obtain a matroid. We say the matroids induced by the equivalence relation and a
type of matroid, namely support matroid, is induced. Second, through rough
sets, some characteristics of matroids such as independent sets, support sets,
bases, hyperplanes and closed sets are investigated.
","[{""version"":""v1"",""created"":""Tue, 25 Sep 2012 02:35:13 GMT""}]","2012-09-26"
"1209.5474","Iair Arcavi Mr.","Iair Arcavi","The Flavours of SN II Light Curves","Published in the Proceedings of IAU Symposium No. 279, 2012 (Death of
  Massive Stars: Supernovae and Gamma-Ray Bursts). Based on Arcavi et al. 2012,
  ApJL 756, 30A","IAUS, 279, 34A, 2012","10.1017/S1743921312012653",,"astro-ph.CO","http://arxiv.org/licenses/nonexclusive-distrib/1.0/","  We present R-Band light curves of Type II supernovae (SNe) from the Caltech
Core Collapse Program (CCCP). With the exception of interacting (Type IIn) SNe
and rare events with long rise times, we find that most light curve shapes
belong to one of three distinct classes: plateau, slowly declining and rapidly
declining events. The latter class is composed solely of Type IIb SNe which
present similar light curve shapes to those of SNe Ib, suggesting, perhaps,
similar progenitor channels. We do not find any intermediate light curves,
implying that these subclasses are unlikely to reflect variance of continuous
parameters, but rather might result from physically distinct progenitor
systems, strengthening the suggestion of a binary origin for at least some
stripped SNe. We find a large plateau luminosity range for SNe IIP, while the
plateau lengths seem rather uniform at approximately 100 days. We present also
host galaxy trends from the Palomar Transient Factory (PTF) core collapse SN
sample, which augment some of the photometric results.
","[{""version"":""v1"",""created"":""Tue, 25 Sep 2012 02:37:56 GMT""}]","2015-06-11"
"1209.5475","Ramakrishna  Podila","Ramakrishna Podila, Ran Chen, Pu Chun Ke, Apparao M. Rao","Effects of surface functional groups on the formation of
  nanoparticle-protein corona","14 pages, 3 figures","Appl. Phys. Lett. 101, 263701 (2012)","10.1063/1.4772509",,"cond-mat.soft cond-mat.mes-hall cond-mat.mtrl-sci physics.bio-ph","http://arxiv.org/licenses/nonexclusive-distrib/1.0/","  Herein, we examined the dependence of protein adsorption on the nanoparticle
surface in the presence of functional groups. Our UV-visible spectrophotometry,
transmission electron microscopy, infrared spectroscopy and dynamic light
scattering measurements evidently suggested that the functional groups play an
important role in the formation of nanoparticle-protein corona. We found that
uncoated and surfactant-free silver nanoparticles derived from a laser ablation
process promoted a maximum protein (bovine serum albumin) coating due to
increased changes in entropy. On the other hand, BSA displayed a lower affinity
for electrostatically stabilized nanoparticles due to the constrained entropy
changes.
","[{""version"":""v1"",""created"":""Tue, 25 Sep 2012 02:41:24 GMT""}]","2016-10-18"
"1209.5476","Oswaldo Monteiro Del Cima","O.M. Del Cima","The Jackiw-Pi model: classical theory","In honor of the 70th birthday of Prof. Olivier Piguet. 11 pages","Phys. Lett. B720 (2013) 254-261","10.1016/j.physletb.2013.02.016",,"hep-th math-ph math.MP","http://arxiv.org/licenses/nonexclusive-distrib/1.0/","  The massive even-parity non-Abelian gauge model in three space-time
dimensions proposed by Jackiw and Pi is studied at the tree-level. The
propagators are computed and the spectrum consistency is analyzed, besides, the
symmetries of the model are collected and established through BRS invariance
and Slavnov-Taylor identity. In the Landau gauge, thanks to the antighost
equations and the Slavnov-Taylor identity, two rigid symmetries are identified
by means of Ward identities. It is presented here a promising path for
perturbatively quantization of the Jackiw-Pi model and a hint concerning its
possible quantum scale invariance is also pointed out.
","[{""version"":""v1"",""created"":""Tue, 25 Sep 2012 02:41:31 GMT""},{""version"":""v2"",""created"":""Thu, 7 Mar 2013 21:36:38 GMT""}]","2013-03-11"
"1209.5477","Yichao Lu","Yichao Lu and Dean P. Foster","Optimal Weighting of Multi-View Data with Low Dimensional Hidden States",,,,,"stat.ML cs.LG","http://arxiv.org/licenses/nonexclusive-distrib/1.0/","  In Natural Language Processing (NLP) tasks, data often has the following two
properties: First, data can be chopped into multi-views which has been
successfully used for dimension reduction purposes. For example, in topic
classification, every paper can be chopped into the title, the main text and
the references. However, it is common that some of the views are less noisier
than other views for supervised learning problems. Second, unlabeled data are
easy to obtain while labeled data are relatively rare. For example, articles
occurred on New York Times in recent 10 years are easy to grab but having them
classified as 'Politics', 'Finance' or 'Sports' need human labor. Hence less
noisy features are preferred before running supervised learning methods. In
this paper we propose an unsupervised algorithm which optimally weights
features from different views when these views are generated from a low
dimensional hidden state, which occurs in widely used models like Mixture
Gaussian Model, Hidden Markov Model (HMM) and Latent Dirichlet Allocation
(LDA).
","[{""version"":""v1"",""created"":""Tue, 25 Sep 2012 02:54:49 GMT""},{""version"":""v2"",""created"":""Wed, 26 Sep 2012 05:15:07 GMT""}]","2012-09-27"
"1209.5478","Jason Rute","Kenshi Miyabe, Jason Rute","Van Lambalgen's Theorem for uniformly relative Schnorr and computable
  randomness",,,,,"math.LO","http://arxiv.org/licenses/nonexclusive-distrib/1.0/","  We correct Miyabe's proof of van Lambalgen's Theorem for truth-table Schnorr
randomness (which we will call uniformly relative Schnorr randomness). An
immediate corollary is one direction of van Lambalgen's theorem for Schnorr
randomness. It has been claimed in the literature that this corollary (and the
analogous result for computable randomness) is a ""straightforward modification
of the proof of van Lambalgen's Theorem."" This is not so, and we point out why.
We also point out an error in Miyabe's proof of van Lambalgen's Theorem for
truth-table reducible randomness (which we will call uniformly relative
computable randomness). While we do not fix the error, we do prove a weaker
version of van Lambalgen's Theorem where each half is computably random
uniformly relative to the other.
","[{""version"":""v1"",""created"":""Tue, 25 Sep 2012 02:55:35 GMT""},{""version"":""v2"",""created"":""Wed, 1 May 2013 19:08:26 GMT""}]","2013-05-02"
"1209.5479","Natasa Sesum","Manuel del Pino, Panagiota Daskalopoulos, Natasa Sesum","Type II ancient compact solutions to the Yamabe flow",,,,,"math.DG math.AP","http://arxiv.org/licenses/nonexclusive-distrib/1.0/","  We construct new type II ancient compact solutions to the Yamabe flow. Our
solutions are rotationally symmetric and converge, as $t \to -\infty$, to a
tower of two spheres. Their curvature operator changes sign. We allow two
time-dependent parameters in our ansatz. We use perturbation theory, via fixed
point arguments, based on sharp estimates on ancient solutions of the
approximated linear equation and careful estimation of the error terms which
allow us to make the right choice of parameters. Our technique may be viewed as
a parabolic analogue of gluing two exact solutions to the rescaled equation,
that is the spheres, with narrow cylindrical necks to obtain a new ancient
solution to the Yamabe flow. The techniques in this article may be generalized
to the gluing of $n$ spheres.
","[{""version"":""v1"",""created"":""Tue, 25 Sep 2012 02:56:27 GMT""},{""version"":""v2"",""created"":""Mon, 22 Oct 2012 15:09:12 GMT""}]","2012-10-23"
"1209.5480","Hua Yao","Hua Yao and William Zhu","Condition for neighborhoods in covering based rough sets to form a
  partition","12 pages",,,,"cs.AI","http://arxiv.org/licenses/nonexclusive-distrib/1.0/","  Neighborhood is an important concept in covering based rough sets. That under
what condition neighborhoods form a partition is a meaningful issue induced by
this concept. Many scholars have paid attention to this issue and presented
some necessary and sufficient conditions. However, there exists one common
trait among these conditions, that is they are established on the basis of all
neighborhoods have been obtained. In this paper, we provide a necessary and
sufficient condition directly based on the covering itself. First, we
investigate the influence of that there are reducible elements in the covering
on neighborhoods. Second, we propose the definition of uniform block and obtain
a sufficient condition from it. Third, we propose the definitions of repeat
degree and excluded number. By means of the two concepts, we obtain a necessary
and sufficient condition for neighborhoods to form a partition. In a word, we
have gained a deeper and more direct understanding of the essence over that
neighborhoods form a partition.
","[{""version"":""v1"",""created"":""Tue, 25 Sep 2012 03:03:41 GMT""}]","2012-09-26"
"1209.5481","JeongHyeong Park","P. Gilkey, J.H. Park, and K. Sekigawa","Universal curvature identities III","16 pages",,,,"math.DG","http://arxiv.org/licenses/nonexclusive-distrib/1.0/","  We examine universal curvature identities for pseudo-Riemannian manifolds
with boundary. We determine the Euler-Lagrange equations associated to the
Chern-Gauss-Bonnet formula and show that they are given solely in terms of
curvature {and the second fundamental form and do not involve covariant
derivatives thus generalizing a conjecture of Berger to this context.
","[{""version"":""v1"",""created"":""Tue, 25 Sep 2012 03:03:46 GMT""}]","2012-09-26"
"1209.5482","Jingqian Wang","Jingqian Wang and William Zhu","Rough sets and matroidal contraction","11 pages",,,,"cs.AI","http://arxiv.org/licenses/nonexclusive-distrib/1.0/","  Rough sets are efficient for data pre-processing in data mining. As a
generalization of the linear independence in vector spaces, matroids provide
well-established platforms for greedy algorithms. In this paper, we apply rough
sets to matroids and study the contraction of the dual of the corresponding
matroid. First, for an equivalence relation on a universe, a matroidal
structure of the rough set is established through the lower approximation
operator. Second, the dual of the matroid and its properties such as
independent sets, bases and rank function are investigated. Finally, the
relationships between the contraction of the dual matroid to the complement of
a single point set and the contraction of the dual matroid to the complement of
the equivalence class of this point are studied.
","[{""version"":""v1"",""created"":""Tue, 25 Sep 2012 03:07:31 GMT""}]","2012-09-26"
"1209.5483","Youngki Yoon","Youngki Yoon and Sayeef Salahuddin","Dissipative Transport in Rough Edge Graphene Nanoribbon Tunnel
  Transistors","Accepted for publication in Applied Physics Letters",,"10.1063/1.4772532",,"cond-mat.mes-hall","http://arxiv.org/licenses/nonexclusive-distrib/1.0/","  We have studied quantum transport in Graphene Nanoribbon Tunnel Field-Effect
Transistors. Unlike other studies on similar structures, we have included
dissipative processes induced by inelastic electron-phonon scattering and edge
roughness in the nanoribbon self-consistently within a non-equilibrium
transport simulation. Our results show that the dissipative scattering imposes
a limit to the minimum OFF current and a minimum subthreshold swing that can be
obtained even for long channel lengths where direct source-drain tunneling is
inhibited. The edge roughness, in presence of dissipative scattering, somewhat
surprisingly, shows a classical behavior where it mostly reduces the maximum ON
current achievable in this structure.
","[{""version"":""v1"",""created"":""Tue, 25 Sep 2012 03:13:59 GMT""}]","2015-06-11"
"1209.5484","Hua Yao","Hua Yao and William Zhu","Condition for neighborhoods induced by a covering to be equal to the
  covering itself","11 pages",,,,"cs.AI","http://arxiv.org/licenses/nonexclusive-distrib/1.0/","  It is a meaningful issue that under what condition neighborhoods induced by a
covering are equal to the covering itself. A necessary and sufficient condition
for this issue has been provided by some scholars. In this paper, through a
counter-example, we firstly point out the necessary and sufficient condition is
false. Second, we present a necessary and sufficient condition for this issue.
Third, we concentrate on the inverse issue of computing neighborhoods by a
covering, namely giving an arbitrary covering, whether or not there exists
another covering such that the neighborhoods induced by it is just the former
covering. We present a necessary and sufficient condition for this issue as
well. In a word, through the study on the two fundamental issues induced by
neighborhoods, we have gained a deeper understanding of the relationship
between neighborhoods and the covering which induce the neighborhoods.
","[{""version"":""v1"",""created"":""Tue, 25 Sep 2012 03:14:39 GMT""}]","2012-09-26"
"1209.5485","Danil Boukhvalov W","R. J. Green, A. Hunt, D. A. Zatsepin, D. W. Boukhvalov, J. A. McLeod,
  E. Z. Kurmaev, N. A. Skorikov, N. V. Gavrilov, A. Moewes","Interplay of ballistic and chemical effects in the formation of
  structural defects for Sn and Pb implanted silica","7 two column pages, 4 figures, accepted in J. Non-Crystalline Solids","Journal of Non-Crystalline Solids 358, 3187-3192 (2012)","10.1016/j.jnoncrysol.2012.09.014",,"cond-mat.mtrl-sci","http://arxiv.org/licenses/nonexclusive-distrib/1.0/","  The electronic structures of Sn and Pb implanted SiO2 are studied using soft
X-ray absorption (XAS) and emission (XES) spectroscopy. We show, using
reference compounds and ab initio calculations, that the presence of Pb-O and
Sn-O interactions can be detected in the pre-edge region of the oxygen K-edge
XAS. Via analysis of this interaction-sensitive pre-edge region, we find that
Pb implantation results primarily in the clustering of Pb atoms. Conversely,
with Sn implantation using identical conditions, strong Sn-O interactions are
present, showing that Sn is coordinated with oxygen. The varying results
between the two ion types are explained using both ballistic considerations and
density functional theory calculations. We find that the substitution of Pb
into Si sites in SiO2 requires much more energy than substituting Sn in these
same sites, primarily due to the larger size of the Pb ions. From these
calculated formation energies it is evident that Pb requires far higher
temperatures than Sn to be soluble in SiO2. These results help explain the
complex processes which take place upon implantation and determine the final
products.
","[{""version"":""v1"",""created"":""Tue, 25 Sep 2012 03:18:39 GMT""}]","2012-11-13"
"1209.5486","Jeremy Brazas","Jeremy Brazas","Open subgroups of free topological groups","19 pages, 1 figure","Fundamenta Mathematicae 226 (2014) 17-40",,,"math.AT math.GN","http://arxiv.org/licenses/nonexclusive-distrib/1.0/","  The theory of covering spaces is often used to prove the Nielsen-Schreier
theorem, which states that every subgroup of a free group is free. We apply the
more general theory of semicovering spaces to obtain analogous subgroup
theorems for topological groups: Every open subgroup of a free Graev
topological group is a free Graev topological group. An open subgroup of a free
Markov topological group is a free Markov topological group if and only if it
is disconnected.
","[{""version"":""v1"",""created"":""Tue, 25 Sep 2012 03:19:12 GMT""},{""version"":""v2"",""created"":""Fri, 1 Feb 2013 04:20:46 GMT""}]","2014-06-17"
"1209.5487","Minho Choi","Minho Choi, Miju Kang, Do-Young Byun, Jeong-Eun Lee","Water and Methanol Maser Activities in the NGC 2024 FIR 6 Region","To appear in the Astrophysical Journal",,"10.1088/0004-637X/759/2/136",,"astro-ph.GA","http://arxiv.org/licenses/nonexclusive-distrib/1.0/","  The NGC 2024 FIR 6 region was observed in the water maser line at 22 GHz and
the methanol class I maser lines at 44, 95, and 133 GHz. The water maser
spectra displayed several velocity components and month-scale time
variabilities. Most of the velocity components may be associated with FIR 6n,
while one component was associated with FIR 4. A typical life time of the
water-maser velocity-components is about 8 months. The components showed
velocity fluctuations with a typical drift rate of about 0.01 km/s/day. The
methanol class I masers were detected toward FIR 6. The methanol emission is
confined within a narrow range around the systemic velocity of the FIR 6 cloud
core. The methanol masers suggest the existence of shocks driven by either the
expanding H II region of FIR 6c or the outflow of FIR 6n.
","[{""version"":""v1"",""created"":""Tue, 25 Sep 2012 03:29:41 GMT""}]","2015-06-11"
"1209.5488","W-Y. P. Hwang","W-Y. Pauchy Hwang","An Anatomy of Neutrino Oscillations","4 figures",,,,"hep-ph","http://arxiv.org/licenses/nonexclusive-distrib/1.0/","  We ponder about neutrino oscillations; a particle without a clear identity, a
neutrino of a given flavor in fact does not satisfy the Dirac equation (which
is used to define the mass eigen-states and mass eigen-values). This alters the
basic treatment of neutrino oscillations, in that the Dirac spinors are defined
as the mass eigen-states while the flavor states can only be given as linear
combinations of the mass eigen-states (of Dirac equations). Even though
neutrino masses are tiny, the impacts of several neutrino masses in a single
reaction or a single decay, such as possible violation of the energy-momentum
conservation, should not be overlooked.
  Among those sources of oscillating neutrinos, we point out that the ultra
high energy cosmic rays (UHECR's) such as the proton of energy $10^{18}\, eV$
or higher, used to think of being rather stable, can capture, in the matter
media, an electron to convert into an electron-like neutrino and a spectator
neutron. This would be the most important neutrino source of the UHECR origin.
","[{""version"":""v1"",""created"":""Tue, 25 Sep 2012 03:44:46 GMT""},{""version"":""v2"",""created"":""Mon, 12 Aug 2013 08:29:09 GMT""},{""version"":""v3"",""created"":""Mon, 3 Nov 2014 04:43:37 GMT""},{""version"":""v4"",""created"":""Tue, 3 Nov 2015 05:14:30 GMT""}]","2015-11-04"
