"1204.6676","Martin Herrmann","Martin Herrmann, Dennis Sebastian and Wilderich Tuschmann","Manifolds with almost nonnegative curvature operator and principal
  bundles",,"Ann. Global Anal. Geom. 44 (2013), no. 4, 391-399","10.1007/s10455-013-9372-2",,"math.DG","http://arxiv.org/licenses/nonexclusive-distrib/1.0/","  We study manifolds with almost nonnegative curvature operator (ANCO) and
provide first examples of closed simply connected ANCO mannifolds that do not
admit nonnegative curvature operator.
","[{""version"":""v1"",""created"":""Mon, 30 Apr 2012 16:00:00 GMT""}]","2014-09-30"
"1204.6677","John Lott","John Lott","Collapsing with a lower bound on the curvature operator","final version",,,,"math.DG","http://arxiv.org/licenses/nonexclusive-distrib/1.0/","  Cheeger and Gromov showed that F-structures are related to collapse with a
double-sided curvature bound. We define fibered F-structures and extend some of
the Cheeger-Gromov results to the setting of collapse with a lower bound on the
curvature operator.
","[{""version"":""v1"",""created"":""Mon, 30 Apr 2012 16:00:02 GMT""},{""version"":""v2"",""created"":""Mon, 25 Jun 2012 03:15:47 GMT""},{""version"":""v3"",""created"":""Fri, 7 Feb 2014 23:51:16 GMT""}]","2014-02-11"
"1204.6678","Mihai Gherase R","Mihai R. Gherase","Analysis of theoretical NMR spectra generated by exact solutions of the
  Bloch-McConnell and the Bloch-Torrey equations for a two-compartment radial
  diffusive exchange model","23 pages, 10 figures, 1 table",,,,"physics.med-ph physics.bio-ph","http://arxiv.org/licenses/nonexclusive-distrib/1.0/","  Diffusive spin exchange is one of the most important relaxation mechanisms in
the Nuclear Magnetic Resonance (NMR) applications to medicine and biology. Two
models based on the Bloch-McConnell (B-M) and the Bloch-Torrey (B-T) equations
are commonly used for modelling the physical processes which determine the NMR
lineshapes. Qualitative arguments for each of the two methods can be found in
various studies in the literature. However, there is a lack of systematic
quantitative investigations of the diffusive exchange spectra calculated with
the two methods for the same physical system or model. In this work exact
frequency-domain transverse magnetization solutions of the B-M and the B-T
equations with boundary conditions for a two-compartment radial diffusive
exchange model are presented. Theoretical spectra and the two corresponding
metrics were computed by varying three different parameters: diffusive
permeability of the separating membrane between the two compartments (P), the
radius of the inner spherical compartment (a), and the chemical shift between
the two compartments (\Deltaf). In general, the two models predicted different
spectral broadening for the same parameters in agreement with the different
analytical solutions. However, the numerical analysis of the spectral
broadening demonstrated that the two models converge to the same results in the
limit of large chemical shift on the scale of the exchange rate. The results
were qualitatively interpreted based on the difference between the two models:
the B-M model assumes a single average exchange time constant while the B-T
model implies a more realistic continuous distribution of diffusive exchange
times.
","[{""version"":""v1"",""created"":""Mon, 30 Apr 2012 16:01:04 GMT""}]","2012-05-01"
"1204.6679","Anatoly Nekrasov","A. K. Nekrasov and F. Z. Feygin","Nonlinear plasma density modification by the ponderomotive force of ULF
  pulsations at the dayside magnetosphere","Accepted for publication in Astrophysics & Space Science",,"10.1007/s10509-012-1095-5",,"astro-ph.EP","http://arxiv.org/licenses/nonexclusive-distrib/1.0/","  We investigate analytically and numerically a nonlinear modification of the
magnetospheric plasma density under the action of the ponderomotive force
induced by ULF traveling waves, using the nonlinear stationary force balance
equation. This equation is applied to both the dipole and dayside magnetosphere
having one and two minima of the geomagnetic field near the magnetospheric
boundary. The separate and joint actions of the ponderomotive, centrifugal, and
gravitational forces on the density distribution are shown.
","[{""version"":""v1"",""created"":""Mon, 30 Apr 2012 16:03:09 GMT""}]","2015-06-04"
"1204.6680","Marc Masdeu","Xavier Guitart and Marc Masdeu","Computation of ATR Darmon points on non-geometrically modular elliptic
  curves","18 pages, to appear in Experimental Math. Revised version to be
  published",,,,"math.NT","http://arxiv.org/licenses/nonexclusive-distrib/1.0/","  ATR points were introduced by Darmon as a conjectural construction of
algebraic points on certain elliptic curves for which in general the Heegner
point method is not available. So far the only numerical evidence, provided by
Darmon--Logan and G\""artner, concerned curves arising as quotients of Shimura
curves. In those special cases the ATR points can be obtained from the already
existing Heegner points, thanks to results of Zhang and Darmon--Rotger--Zhao.
  In this paper we compute for the first time an algebraic ATR point on a curve
which is not uniformizable by any Shimura curve, thus providing the first piece
of numerical evidence that Darmon's construction works beyond geometric
modularity. To this purpose we improve the method proposed by Darmon and Logan
by removing the requirement that the real quadratic field be norm-euclidean,
and accelerating the numerical integration of Hilbert modular forms.
","[{""version"":""v1"",""created"":""Mon, 30 Apr 2012 16:09:24 GMT""},{""version"":""v2"",""created"":""Fri, 19 Oct 2012 15:14:21 GMT""}]","2012-10-22"
"1204.6681","Douglas Rall","Bert L. Hartnell and Douglas F. Rall","On the Cartesian product of non well-covered graphs",,,,,"math.CO cs.DM","http://arxiv.org/licenses/nonexclusive-distrib/1.0/","  A graph is well-covered if every maximal independent set has the same
cardinality, namely the vertex independence number. We answer a question of
Topp and Volkmann and prove that if the Cartesian product of two graphs is
well-covered, then at least one of them must be well-covered.
","[{""version"":""v1"",""created"":""Mon, 30 Apr 2012 16:09:46 GMT""}]","2012-05-01"
"1204.6682","Philippe Corboz","Philippe Corboz, Karlo Penc, Frederic Mila, Andreas M. Laeuchli","Simplex solids in SU(N) Heisenberg models on the kagome and checkerboard
  lattices","5 pages, 5 figures, and 1 page of supplemental material","Phys. Rev. B 86, 041106 (2012)","10.1103/PhysRevB.86.041106",,"cond-mat.str-el cond-mat.quant-gas","http://arxiv.org/licenses/nonexclusive-distrib/1.0/","  We present a numerical study of the SU(N) Heisenberg model with the
fundamental representation at each site for the kagome lattice (for N=3) and
the checkerboard lattice (for N=4), which are the line graphs of the honeycomb
and square lattices and thus belong to the class of bisimplex lattices. Using
infinite projected entangled-pair states (iPEPS) and exact diagonalizations, we
show that in both cases the ground state is a simplex solid state with a
two-fold ground state degeneracy, in which the N spins belonging to a simplex
(i.e. a complete graph) form a singlet. Theses states can be seen as
generalizations of valence bond solid states known to be stabilized in certain
SU(2) spin models.
","[{""version"":""v1"",""created"":""Mon, 30 Apr 2012 16:11:29 GMT""},{""version"":""v2"",""created"":""Thu, 2 Aug 2012 12:01:39 GMT""}]","2012-08-03"
"1204.6683","Zheng  Cai","Zheng Cai, Yang Zhang","Analytic Spectra of CMB Anisotropies and Polarization Generated by
  Scalar Perturbations in Synchronous Gauge","Accepted by Classical and Quantum Gravity. 43 pages, 15 figures",,"10.1088/0264-9381/29/10/105009",,"astro-ph.CO gr-qc","http://arxiv.org/licenses/nonexclusive-distrib/1.0/","  We present a detailed analytical calculation of CMB temperature anisotropies
\alpha_k and polarization \beta_k generated by scalar metric perturbations in
synchronous gauge, parallel to our previous work with RGW as a generating
source. This is realized primarily by an analytic time-integration of
Boltzmann's equation, yielding the closed forms of \alpha_k and \beta_k.
Approximations, such as the tight-coupling approximation for photons a prior to
the recombination and the long wavelength limit for scalar perturbations are
used. The residual gauge modes in scalar perturbations are analyzed and a
proper joining condition of scalar perturbations at the radiation-matter
equality is chosen, ensuring the continuity of energy perturbation.
  The resulting analytic expressions of the multipole moments of polarization
a^E_l, and of temperature anisotropies a^T_l are explicit functions of the
scalar perturbations, recombination time, recombination width, photon free
streaming damping factor, baryon fraction, initial amplitude, primordial scalar
spectral index, and the running index. These results show that a longer
recombination width yields higher amplitudes of polarization on large scales
and more damping on small scales, and that a late recombination time shifts the
peaks of C^{XX'}_l to larger angular scales.
  The analytic spectra C^{XX'}_l agree with the numerical ones and with those
observed by WMAP on large scales (l \lesssim 500), but deviate considerably
from the numerical results on smaller scales, showing the limitations of our
approximate analytic calculations. Several possible improvements are pointed
out for further studies.
","[{""version"":""v1"",""created"":""Mon, 30 Apr 2012 16:11:53 GMT""}]","2015-06-04"
"1204.6684","Claire Voisin","Claire Voisin","Symplectic involutions of K3 surfaces act trivially on CH_0",,"Documenta Math. 17 (2012) 851--860",,,"math.AG","http://arxiv.org/licenses/nonexclusive-distrib/1.0/","  Symplectic involutions of a K3 surface are those involutions which leave the
holomorphic 2-form invariant. We show, as predicted by Bloch's conjecture, that
they act trivially on the CH_0 group of the K3 surface. This was recently
proved by Huybrechts and Kemeny for one of the three types of symplectic
involutions.
","[{""version"":""v1"",""created"":""Mon, 30 Apr 2012 16:14:04 GMT""}]","2015-08-14"
"1204.6685","Christian Saemann","Derek Harland, Sam Palmer, Christian Saemann","Magnetic Domains","42 pages, minor improvements, published version","JHEP 1210:167, 2012","10.1007/JHEP10(2012)167","HWM-12-04; EMPG-12-08","hep-th math-ph math.MP","http://arxiv.org/licenses/nonexclusive-distrib/1.0/","  Recently a Nahm transform has been discovered for magnetic bags, which are
conjectured to arise in the large n limit of magnetic monopoles with charge n.
We interpret these ideas using string theory and present some partial proofs of
this conjecture. We then extend the notion of bags and their Nahm transform to
higher gauge theories and arbitrary domains. Bags in four dimensions
conjecturally describe the large n limit of n self-dual strings. We show that
the corresponding Basu-Harvey equation is the large n limit of an equation
describing n M2-branes, and that it has a natural interpretation in loop space.
We also formulate our Nahm equations using strong homotopy Lie algebras.
","[{""version"":""v1"",""created"":""Mon, 30 Apr 2012 16:18:04 GMT""},{""version"":""v2"",""created"":""Mon, 5 Nov 2012 11:20:58 GMT""}]","2012-11-06"
"1204.6686","Bernardo Barbiellini","K. B. Joshi, B. K. Sharma, U. Paliwal and B. Barbiellini","Pressure dependent electronic properties of MgO polymorphs: A
  first-principles study of Compton profiles and autocorrelation functions","19 pages, 8 figures, accepted for publication in Journal of Materials
  Science","Journal of Materials Science May 2012","10.1007/s10853-012-6521-0",,"cond-mat.mtrl-sci","http://arxiv.org/licenses/nonexclusive-distrib/1.0/","  The first-principles periodic linear combination of atomic orbitals method
within the framework of density functional theory implemented in the CRYSTAL06
code has been applied to explore effect of pressure on the Compton profiles and
autocorrelation functions of MgO. Calculations are performed for the B1, B2,
B3, B4, B8_1 and h-MgO polymorphs of MgO to compute lattice constants and bulk
moduli. The isothermal enthalpy calculations predict that B4 to B8_1, h-MgO to
B8_1, B3 to B2, B4 to B2 and h-MgO to B2 transitions take place at 2, 9, 37, 42
and 64 GPa respectively. The high pressure transitions B8_1 to B2 and B1 to B2
are found to occur at 340 and 410 GPa respectively. The pressure dependent
changes are observed largely in the valence electrons Compton profiles whereas
core profiles are almost independent of the pressure in all MgO polymorphs.
Increase in pressure results in broadening of the valence Compton profiles. The
principal maxima in the second derivative of Compton profiles shifts towards
high momentum side in all structures. Reorganization of momentum density in the
B1 to B2 structural phase transition is seen in the first and second
derivatives before and after the transition pressure. Features of the
autocorrelation functions shift towards lower r side with increment in
pressure.
","[{""version"":""v1"",""created"":""Mon, 30 Apr 2012 16:24:01 GMT""}]","2012-07-24"
"1204.6687","Jaros{\l}aw Grytczuk","Jaros{\l}aw Grytczuk, Piotr Szafruga, Micha{\l} Zmarz","Online version of the theorem of Thue",,,,,"math.CO cs.DM","http://arxiv.org/licenses/nonexclusive-distrib/1.0/","  A sequence S is nonrepetitive if no two adjacent blocks of S are the same. In
1906 Thue proved that there exist arbitrarily long nonrepetitive sequences over
3 symbols. We consider the online variant of this result in which a
nonrepetitive sequence is constructed during a play between two players: Bob is
choosing a position in a sequence and Alice is inserting a symbol on that
position taken from a fixed set A. The goal of Bob is to force Alice to create
a repetition, and if he succeeds, then the game stops. The goal of Alice is
naturally to avoid that and thereby to construct a nonrepetitive sequence of
any given length. We prove that Alice has a strategy to play arbitrarily long
provided the size of the set A is at least 12. This is the online version of
the Theorem of Thue. The proof is based on nonrepetitive colorings of
outerplanar graphs. On the other hand, one can prove that even over 4 symbols
Alice has no chance to play for too long. The minimum size of the set of
symbols needed for the online version of Thue's theorem remains unknown.
","[{""version"":""v1"",""created"":""Mon, 30 Apr 2012 16:26:07 GMT""}]","2012-05-01"
"1204.6688","Zihan Xu","Zihan Xu","Graphene Battery made of Low Cost Reduced Graphene Oxide","7 pages, 10 figures",,,,"cond-mat.mtrl-sci","http://creativecommons.org/licenses/by/3.0/","  Graphene can collect energy from the ambient heat and convert it to
electricity, which makes it an ideal candidate for the fabrication of
self-powered devices. However, this technology is suffering the high cost,
which limits the practical use of it. In this work, we demonstrated that the
cost can be reduced by using low cost reduced graphene oxide (RGO), graphite
electrodes and low cost glass substrates. The results showed that this
technology can be of practical value for the ""battery"" industry.
","[{""version"":""v1"",""created"":""Mon, 30 Apr 2012 16:26:19 GMT""}]","2012-05-01"
"1204.6689","Zhi-Wei Sun","Zhi-Wei Sun","On a pair of zeta functions","22 pages, final published version","Int. J. Number Theory 12(2016), no.8, 2323-2342",,,"math.NT","http://arxiv.org/licenses/nonexclusive-distrib/1.0/","  Let $m$ be a positive integer, and define
$$\zeta_m(s)=\sum_{n=1}^\infty\frac{(-e^{2\pi i/m})^{\omega(n)}}{n^s}\ \ \ \
\text{and} \ \ \ \ \zeta^*_m(s)=\sum_{n=1}^\infty\frac{(-e^{2\pi
i/m})^{\Omega(n)}}{n^s},$$ for $\Re(s)>1$, where $\omega(n)$ denotes the number
of distinct prime factors of $n$, and $\Omega(n)$ represents the total number
of prime factors of $n$ (counted with multiplicity). In this paper we study
these two zeta functions and related arithmetical functions. We show that
$$\sum^\infty_{n=1\atop n\ \text{is squarefree}}\frac{(-e^{2\pi
i/m})^{\omega(n)}}n=0\quad\text{if}\ \ m>4,$$ which is similar to the known
identity $\sum_{n=1}^\infty\mu(n)/n=0$ equivalent to the Prime Number Theorem.
For $m>4$, we prove that $$\zeta_m(1):=\sum_{n=1}^\infty\frac{(-e^{2\pi
i/m})^{\omega(n)}}n=0 \ \ \ \ \text{and}\ \ \ \
\zeta^*_m(1):=\sum_{n=1}^\infty\frac{(-e^{2\pi i/m})^{\Omega(n)}}n=0.$$ We also
raise a hypothesis on the parities of $\Omega(n)-n$ which implies the Riemann
Hypothesis.
","[{""version"":""v1"",""created"":""Mon, 30 Apr 2012 16:26:38 GMT""},{""version"":""v10"",""created"":""Thu, 14 Jun 2012 19:55:45 GMT""},{""version"":""v11"",""created"":""Mon, 19 May 2014 01:11:04 GMT""},{""version"":""v12"",""created"":""Wed, 23 Dec 2015 15:07:05 GMT""},{""version"":""v13"",""created"":""Thu, 20 Oct 2016 07:58:56 GMT""},{""version"":""v2"",""created"":""Fri, 4 May 2012 19:57:20 GMT""},{""version"":""v3"",""created"":""Tue, 8 May 2012 19:22:29 GMT""},{""version"":""v4"",""created"":""Wed, 16 May 2012 19:56:37 GMT""},{""version"":""v5"",""created"":""Thu, 17 May 2012 19:58:34 GMT""},{""version"":""v6"",""created"":""Tue, 22 May 2012 19:58:08 GMT""},{""version"":""v7"",""created"":""Wed, 23 May 2012 19:59:18 GMT""},{""version"":""v8"",""created"":""Thu, 24 May 2012 18:20:58 GMT""},{""version"":""v9"",""created"":""Thu, 7 Jun 2012 19:53:40 GMT""}]","2016-10-21"
"1204.6690","Saminathan Ponnusamy Ph.D","Sh. Chen, S. Ponnusamy, X. Wang","Weighted Lipschitz continuity, Schwarz-Pick's Lemma and Landau-Bloch's
  theorem for hyperbolic-harmonic mappings in $\mathbb{C}^{n}$","13 pages; The article is with a journal for publication",,,,"math.CV","http://arxiv.org/licenses/nonexclusive-distrib/1.0/","  In this paper, we discuss some properties on hyperbolic-harmonic mappings in
the unit ball of $\mathbb{C}^{n}$. First, we investigate the relationship
between the weighted Lipschitz functions and the hyperbolic-harmonic Bloch
spaces. Then we establish the Schwarz-Pick type theorem for hyperbolic-harmonic
mappings and apply it to prove the existence of Landau-Bloch constant for
mappings in $\alpha$-Bloch spaces.
","[{""version"":""v1"",""created"":""Mon, 30 Apr 2012 16:26:57 GMT""}]","2012-05-01"
"1204.6691","Drazen Lucanin MSc","Drazen Lucanin, Michael Maurer, Toni Mastelic, Ivona Brandic","Energy Efficient Service Delivery in Clouds in Compliance with the Kyoto
  Protocol",,,"10.1007/978-3-642-33645-4_9",,"cs.DC","http://arxiv.org/licenses/nonexclusive-distrib/1.0/","  Cloud computing is revolutionizing the ICT landscape by providing scalable
and efficient computing resources on demand. The ICT industry - especially data
centers, are responsible for considerable amounts of CO2 emissions and will
very soon be faced with legislative restrictions, such as the Kyoto protocol,
defining caps at different organizational levels (country, industry branch
etc.) A lot has been done around energy efficient data centers, yet there is
very little work done in defining flexible models considering CO2. In this
paper we present a first attempt of modeling data centers in compliance with
the Kyoto protocol. We discuss a novel approach for trading credits for
emission reductions across data centers to comply with their constraints. CO2
caps can be integrated with Service Level Agreements and juxtaposed to other
computing commodities (e.g. computational power, storage), setting a foundation
for implementing next-generation schedulers and pricing models that support
Kyoto-compliant CO2 trading schemes.
","[{""version"":""v1"",""created"":""Mon, 30 Apr 2012 16:28:19 GMT""}]","2012-10-16"
"1204.6692","Simone Ugolini","Simone Ugolini","Sequences of binary irreducible polynomials","7 pages, minor adjustments","Discrete Mathematics 313 (2013) pp. 2656-2662","10.1016/j.disc.2013.08.011",,"math.DS","http://arxiv.org/licenses/nonexclusive-distrib/1.0/","  In this paper we construct an infinite sequence of binary irreducible
polynomials starting from any irreducible polynomial $f_0 \in \F_2 [x]$. If
$f_0$ is of degree $n = 2^l \cdot m$, where $m$ is odd and $l$ is a
non-negative integer, after an initial finite sequence of polynomials $f_0,
f_1, ..., f_{s}$ with $s \leq l+3$, the degree of $f_{i+1}$ is twice the degree
of $f_i$ for any $i \geq s$.
","[{""version"":""v1"",""created"":""Mon, 30 Apr 2012 16:30:40 GMT""},{""version"":""v2"",""created"":""Sat, 1 Sep 2012 13:28:58 GMT""}]","2013-08-27"
"1204.6693","Ahmed Jellal","Mohammed El Bouziani, Rachid Houca, Ahmed Jellal","Confined System with Rashba Coupling in Constant Magnetic Field","14 pages","J. Phys. A: Math. Theor. 45 (2012), 505306","10.1088/1751-8113/45/50/505306",,"cond-mat.mes-hall hep-th math-ph math.MP quant-ph","http://arxiv.org/licenses/nonexclusive-distrib/1.0/","  We study a two dimensional system of electrons with Rashba coupling in the
constant magnetic field $B$ and confining potential. We algebraically
diagonalize the corresponding Hamiltonian to end up with the solutions of the
energy spectrum. In terms of two kinds of operator we construct two symmetries
and discuss the filling of the shells with electrons for strong and weak $B$.
Subsequently, we show that our system is sharing some common features with
quantum optics where the exact operator solutions for the basics
Jaynes-Cummings variables are derived from our results. An interesting limit is
studied and the corresponding quantum dynamics is recovered.
","[{""version"":""v1"",""created"":""Mon, 30 Apr 2012 16:31:28 GMT""},{""version"":""v2"",""created"":""Thu, 5 May 2016 10:02:13 GMT""}]","2016-05-06"
"1204.6694","D. Michael Crenshaw","D. M. Crenshaw and S. B. Kraemer","Feedback from Mass Outflows in Nearby Active Galactic Nuclei I. UV and
  X-ray Absorbers","accepted for publication in the Astrophysical Journal",,"10.1088/0004-637X/753/1/75",,"astro-ph.CO","http://arxiv.org/licenses/nonexclusive-distrib/1.0/","  We present an investigation into the impact of feedback from outflowing UV
and X-ray absorbers in nearby z < 0.04 AGN. From studies of the kinematics,
physical conditions, and variability of the absorbers in the literature, we
calculate the possible ranges in total mass outflow rate and kinetic luminosity
for each AGN, summed over all of its absorbers. These calculations make use of
values (or limits) for the radial locations of the absorbers determined from
variability, excited-state absorption, and other considerations. From a sample
of 10 Seyfert 1 galaxies with detailed photoionization models for their
absorbers, we find that 7 have sufficient constraints on the absorber locations
to determine feedback parameters. For the low-luminosity AGN NGC 4395, these
values are low, although we do not have sufficient constraints on the X-ray
absorbers to make definitive conclusions. At least 5 of the 6 Seyfert 1s with
moderate bolometric luminosities have mass outflow rates that are 10 - 1000
times the mass accretion rates needed to generate their observed luminosities,
indicating that most of the mass outflow originates from outside the inner
accretion disk. Three of these (NGC 4051, NGC 3516, and NGC 3783) have kinetic
luminosities in the range 0.5 to 5% bolometric, which is the range typically
required by feedback models for efficient self-regulation of black-hole and
galactic bulge growth. At least 2 of the other 3 (NGC 5548, NGC 4151, and NGC
7469) have kinetic luminosities > 0.1% bolometric, although these values may
increase if radial locations can be determined for more of the absorbers. We
conclude that the outflowing UV and X-ray absorbers in moderate-luminosity AGN
have the potential to deliver significant feedback to their environments.
","[{""version"":""v1"",""created"":""Mon, 30 Apr 2012 16:32:51 GMT""}]","2015-06-04"
"1204.6695","EPTCS","Aleks Kissinger (University of Oxford), Alex Merry (University of
  Oxford), Matvey Soloviev (University of Cambridge)","Pattern graph rewrite systems","In Proceedings DCM 2012, arXiv:1403.7579","EPTCS 143, 2014, pp. 54-66","10.4204/EPTCS.143.5",,"math.CT cs.LO","http://arxiv.org/licenses/nonexclusive-distrib/1.0/","  String diagrams are a powerful tool for reasoning about physical processes,
logic circuits, tensor networks, and many other compositional structures.
Dixon, Duncan and Kissinger introduced string graphs, which are a combinatoric
representations of string diagrams, amenable to automated reasoning about
diagrammatic theories via graph rewrite systems. In this extended abstract, we
show how the power of such rewrite systems can be greatly extended by
introducing pattern graphs, which provide a means of expressing infinite
families of rewrite rules where certain marked subgraphs, called !-boxes (""bang
boxes""), on both sides of a rule can be copied any number of times or removed.
After reviewing the string graph formalism, we show how string graphs can be
extended to pattern graphs and how pattern graphs and pattern rewrite rules can
be instantiated to concrete string graphs and rewrite rules. We then provide
examples demonstrating the expressive power of pattern graphs and how they can
be applied to study interacting algebraic structures that are central to
categorical quantum mechanics.
","[{""version"":""v1"",""created"":""Mon, 30 Apr 2012 16:38:20 GMT""},{""version"":""v2"",""created"":""Mon, 23 Jul 2012 12:02:24 GMT""},{""version"":""v3"",""created"":""Tue, 1 Apr 2014 00:37:41 GMT""}]","2014-04-02"
