"1205.0049","Kenneth Baker","Kenneth L Baker, Cameron Gordon, and John Luecke","Obtaining genus 2 Heegaard splittings from Dehn surgery","127 pages, 81 figures","Algebr. Geom. Topol. 13 (2013) 2471-2634","10.2140/agt.2013.13.2471",,"math.GT","http://arxiv.org/licenses/nonexclusive-distrib/1.0/","  Let K' be a hyperbolic knot in S^3 and suppose that some Dehn surgery on K'
with distance at least 3 from the meridian yields a 3-manifold M of Heegaard
genus 2. We show that if M does not contain an embedded Dyck's surface (the
closed non-orientable surface of Euler characteristic -1), then the knot dual
to the surgery is either 0-bridge or 1-bridge with respect to a genus 2
Heegaard splitting of M. In the case M does contain an embedded Dyck's surface,
we obtain similar results. As a corollary, if M does not contain an
incompressible genus 2 surface, then the tunnel number of K' is at most 2.
","[{""version"":""v1"",""created"":""Mon, 30 Apr 2012 22:59:00 GMT""}]","2014-10-01"
"1205.0050","Nicolai Krylov","N. V. Krylov","On the dynamic programming principle for uniformly nondegenerate
  stochastic differential games in domains and the Isaacs equations","28 pages. This is the second article in the series of three. Writing
  the third one required a revision of this article",,,,"math.OC","http://arxiv.org/licenses/nonexclusive-distrib/1.0/","  We prove the dynamic programming principe for uniformly nondegenerate
stochastic differential games in the framework of time-homogeneous diffusion
processes considered up to the first exit time from a domain. In contrast with
previous results established for constant stopping times we allow arbitrary
stopping times and randomized ones as well. There is no assumption about
solvability of the the Isaacs equation in any sense (classical or viscosity).
The zeroth-order ""coefficient"" and the ""free"" term are only assumed to be
measurable in the space variable. We also prove that value functions are
uniquely determined by the functions defining the corresponding Isaacs
equations and thus stochastic games with the same Isaacs equation have the same
value functions.
","[{""version"":""v1"",""created"":""Mon, 30 Apr 2012 23:03:26 GMT""},{""version"":""v2"",""created"":""Mon, 16 Jul 2012 18:27:38 GMT""}]","2012-07-17"
"1205.0051","Wei-Sheng Lee","W. S. Lee, A. P. Sorini, M. Yi, Y. D. Chuang, B. Moritz, W. L. Yang,
  J.-H. Chu, H. H. Kuo, A. G. Cruz Gonzalez, I. R. Fisher, Z. Hussain, T. P.
  Devereaux, and Z. X. Shen","Resonant Enhancement of Charge Density Wave Diffraction in the
  Rare-Earth Tritellurides","7 pages, 5 figures","Phys. Rev. B 85, 155142 (2012)","10.1103/PhysRevB.85.155142",,"cond-mat.str-el","http://arxiv.org/licenses/nonexclusive-distrib/1.0/","  We performed resonant soft X-ray diffraction on known charge density wave
(CDW) compounds, rare earth tri-tellurides. Near the $M_5$ (3d - 4f) absorption
edge of rare earth ions, an intense diffraction peak is detected at a
wavevector identical to that of CDW state hosted on Te$_2$ planes, indicating a
CDW-induced modulation on the rare earth ions. Surprisingly, the temperature
dependence of the diffraction peak intensity demonstrates an exponential
increase at low temperatures, vastly different than that of the CDW order
parameter. Assuming 4f multiplet splitting due to the CDW states,we present a
model to calculate X-ray absorption spectrum and resonant profile of the
diffraction peak, agreeing well with experimental observations. Our results
demonstrate a situation where the temperature dependence of resonant X-ray
diffraction peak intensity is not directly related to the intrinsic behavior of
the order parameter associated with the electronic order, but is dominated by
the thermal occupancy of the valence states.
","[{""version"":""v1"",""created"":""Mon, 30 Apr 2012 23:05:46 GMT""}]","2012-05-02"
"1205.0052","Tony Mroczkowski","Tony Mroczkowski, Simon Dicker, Jack Sayers, Erik D. Reese, Brian
  Mason, Nicole Czakon, Charles Romero, Alexander Young, Mark Devlin, Sunil
  Golwala, Phillip Korngut, Craig Sarazin, James Bock, Patrick M. Koch,
  Kai-Yang Lin, Sandor M. Molnar, Elena Pierpaoli, Keiichi Umetsu, Michael
  Zemcov","A Multi-wavelength Study of the Sunyaev-Zel'dovich Effect in the
  Triple-Merger Cluster MACS J0717.5+3745 with MUSTANG and Bolocam","10 Figures, 18 pages. this version corrects issues with the previous
  arXiv version","2012 ApJ, 761, 47","10.1088/0004-637X/761/1/47",,"astro-ph.CO astro-ph.HE","http://arxiv.org/licenses/nonexclusive-distrib/1.0/","  We present 90, 140, and 268GHz sub-arcminute resolution imaging of the
Sunyaev-Zel'dovich effect (SZE) in MACSJ0717.5+3745. Our 90GHz SZE data result
in a sensitive, 34uJy/bm map at 13"" resolution using MUSTANG. Our 140 and
268GHz SZE imaging, with resolutions of 58"" and 31"" and sensitivities of 1.8
and 3.3mJy/beam respectively, was obtained using Bolocam. We compare these maps
to a 2-dimensional pressure map derived from Chandra X-ray observations. Our
MUSTANG data confirm previous indications from Chandra of a pressure
enhancement due to shock-heated, >20keV gas immediately adjacent to extended
radio emission seen in low-frequency radio maps. The MUSTANG data also detect
pressure substructure that is not well-constrained by the X-ray data in the
remnant core of a merging subcluster. We find that the small-scale pressure
enhancements in the MUSTANG data amount to ~2% of the total pressure measured
in the 140GHz Bolocam observations. The X-ray template also fails on larger
scales to accurately describe the Bolocam data, particularly at the location of
a subcluster known to have a high line of sight optical velocity (~3200km/s).
Our Bolocam data are adequately described when we add an additional component -
not described by a thermal SZE spectrum - coincident with this subcluster.
Using flux densities extracted from our model fits, and marginalizing over the
temperature constraints for the region, we fit a thermal+kinetic SZE spectrum
to our data and find the subcluster has a best-fit line of sight proper
velocity of 3600+3440/-2160km/s. This agrees with the optical velocity
estimates for the subcluster. The probability of velocity<0 given our
measurements is 2.1%. Repeating this analysis using flux densities measured
non-parametrically results in a 3.4% probability of a velocity<=0. We note that
this tantalizing result for the kinetic SZE is on resolved, subcluster scales.
","[{""version"":""v1"",""created"":""Mon, 30 Apr 2012 23:06:34 GMT""},{""version"":""v2"",""created"":""Wed, 17 Oct 2012 05:23:14 GMT""},{""version"":""v3"",""created"":""Fri, 16 Nov 2012 14:58:42 GMT""},{""version"":""v4"",""created"":""Wed, 4 Dec 2019 20:56:02 GMT""}]","2019-12-06"
"1205.0053","Denis Auroux","Mohammed Abouzaid, Denis Auroux, Ludmil Katzarkov","Lagrangian fibrations on blowups of toric varieties and mirror symmetry
  for hypersurfaces","83 pages; v2: added appendix discussing the analytic structure on
  moduli of objects in the Fukaya category; v3: further clarifications in
  response to referee report; v4: further clarifications throughout, especially
  sections 4 and 7 and appendix A; added appendix B on the geometry of reduced
  spaces",,,,"math.SG math.AG","http://arxiv.org/licenses/nonexclusive-distrib/1.0/","  We consider mirror symmetry for (essentially arbitrary) hypersurfaces in
(possibly noncompact) toric varieties from the perspective of the
Strominger-Yau-Zaslow (SYZ) conjecture. Given a hypersurface $H$ in a toric
variety $V$ we construct a Landau-Ginzburg model which is SYZ mirror to the
blowup of $V\times\mathbb{C}$ along $H\times 0$, under a positivity assumption.
This construction also yields SYZ mirrors to affine conic bundles, as well as a
Landau-Ginzburg model which can be naturally viewed as a mirror to $H$. The
main applications concern affine hypersurfaces of general type, for which our
results provide a geometric basis for various mirror symmetry statements that
appear in the recent literature. We also obtain analogous results for complete
intersections.
","[{""version"":""v1"",""created"":""Mon, 30 Apr 2012 23:08:15 GMT""},{""version"":""v2"",""created"":""Thu, 24 Apr 2014 18:04:15 GMT""},{""version"":""v3"",""created"":""Tue, 13 May 2014 15:20:22 GMT""},{""version"":""v4"",""created"":""Wed, 29 Jul 2015 20:20:13 GMT""}]","2015-07-31"
"1205.0054","Benjamin Basso","Benjamin Basso","Scaling dimensions at small spin in N=4 SYM theory","25 pages",,,,"hep-th","http://arxiv.org/licenses/nonexclusive-distrib/1.0/","  In this paper, we examine scaling dimensions at small spin in the so-called
sl(2) sector of the planar maximally supersymmetric Yang-Mills theory. We find
that the Bethe ansatz equations, which control the spectrum of scaling
dimensions, greatly simplify in this limit and can be solved exactly.
","[{""version"":""v1"",""created"":""Mon, 30 Apr 2012 23:25:18 GMT""}]","2012-05-02"
"1205.0055","Glen MacLachlan","G. A. MacLachlan, A. Shenoy, E. Sonbas, K. S. Dhuga, A. Eskandarian,
  L. C. Maximon, and W. C. Parke","The Minimum Variability Time Scale and its Relation to Pulse Profiles of
  Fermi GRBs","Accepted for publication in MNRAS Letters. 4 pages, 4 figures",,"10.1111/j.1745-3933.2012.01295.x",,"astro-ph.HE","http://creativecommons.org/licenses/by/3.0/","  We present a direct link between the minimum variability time scales
extracted through a wavelet decomposition and the rise times of the shortest
pulses extracted via fits of 34 Fermi GBM GRB light curves comprised of 379
pulses. Pulses used in this study were fitted with log-normal functions whereas
the wavelet technique used employs a multiresolution analysis that does not
rely on identifying distinct pulses. By applying a corrective filter to
published data fitted with pulses we demonstrate agreement between these two
independent techniques and offer a method for distinguishing signal from noise.
","[{""version"":""v1"",""created"":""Mon, 30 Apr 2012 23:38:10 GMT""},{""version"":""v2"",""created"":""Thu, 3 May 2012 04:31:42 GMT""},{""version"":""v3"",""created"":""Tue, 29 May 2012 10:39:35 GMT""},{""version"":""v4"",""created"":""Tue, 12 Jun 2012 16:08:53 GMT""}]","2015-06-04"
"1205.0056","Kai Zheng","Simone Calamai, Kai Zheng","Geodesics in the space of K\""ahler cone metrics","Improved presentation","Amer. J. Math. 137 (2015), no. 5. 1149-1208","10.1353/ajm.2015.0036",,"math.AP math.DG","http://arxiv.org/licenses/nonexclusive-distrib/1.0/","  In this paper, we study the Dirichlet problem of the geodesic equation in the
space of K\""ahler cone metrics $\mathcal H_\b$; that is equivalent to a
homogeneous complex Monge-Amp\`ere equation whose boundary values consist of
K\""ahler metrics with cone singularities. Our approach concerns the
generalization of the space defined in Donaldson \cite{MR2975584} to the case
of K\""ahler manifolds with boundary; moreover we introduce a subspace $\mathcal
H_C$ of $\mathcal H_\b$ which we define by prescribing appropriate geometric
conditions. Our main result is the existence, uniqueness and regularity of
$C^{1,1}_\b$ geodesics whose boundary values lie in $\mathcal H_C$. Moreover,
we prove that such geodesic is the limit of a sequence of $C^{2,\a}_\b$
approximate geodesics under the $C^{1,1}_\b$-norm. As a geometric application,
we prove the metric space structure of $\mathcal H_C$.
","[{""version"":""v1"",""created"":""Mon, 30 Apr 2012 23:49:21 GMT""},{""version"":""v2"",""created"":""Sun, 5 Aug 2012 18:37:23 GMT""},{""version"":""v3"",""created"":""Fri, 18 Jan 2013 12:49:45 GMT""},{""version"":""v4"",""created"":""Mon, 8 Apr 2013 22:47:48 GMT""}]","2015-10-08"
"1205.0057","James Elliott","J. B. Elliott","Marathon pacing and elevation change","Six pages, seven figures Updated on 1-Oct-12 with better
  approximation for Eq. (2) and a reference to work supporting that formula",,,,"physics.pop-ph physics.bio-ph","http://arxiv.org/licenses/nonexclusive-distrib/1.0/","  An analysis of marathon pacing and elevation change is presented. It is based
on an empirical observation of how the pace of elite and non-elite marathon
runners change over the course of the marathon and a simple approximation of
the energy cost of ascent and decent. It was observed that the pace of the
runners slowed in a regular manner that could be broken up into four regions.
That observation can be used to project target paces for a desired marathon
finish time. However, that estimate fails to take in to account the energetic
costs of elevation changes (hills) along the marathon course. Several
approximations are made to give a coarse estimate of target paces for marathon
run on courses with significant elevation changes, i.e. a hilly course. The
2012 Oakland Marathon course is used as and example of a hilly course and the
times of 23 finishers are examined.
","[{""version"":""v1"",""created"":""Mon, 30 Apr 2012 23:56:51 GMT""},{""version"":""v2"",""created"":""Mon, 1 Oct 2012 23:32:20 GMT""}]","2012-10-03"
"1205.0058","Tsz Yan Lam","Baojiu Li (Durham), Tsz Yan Lam (Kavli IPMU)","Excursion set theory for modified gravity: Eulerian versus Lagrangian
  environments","11 pages, 7 figures. Match version accepted by MNRAS","MNRAS, 425, 730 (2012)","10.1111/j.1365-2966.2012.21592.x",,"astro-ph.CO","http://arxiv.org/licenses/nonexclusive-distrib/1.0/","  We have revisited the extended excursion set theory in modified gravity
models, taking the chameleon model as an example. Instead of specifying their
Lagrangian size, here we define the environments by the Eulerian size, chosen
to be of the same order of the Compton length of the scalar field by physical
arguments. We find that the Eulerian and Lagrangian environments have very
different environmental density contrast probability distributions, the former
more likely to have high matter density, which in turn suppressing the effect
of the fifth force in matter clustering and halo formation. The use of Eulerian
environments also evades the unphysical restriction of having an upper mass
limit in the case of Lagrangian environments.Two methods of computing the
unconditional mass functions, numerical integration and Monte Carlo simulation,
are discussed and found to give consistent predictions.
","[{""version"":""v1"",""created"":""Tue, 1 May 2012 00:04:05 GMT""},{""version"":""v2"",""created"":""Tue, 26 Jun 2012 02:11:21 GMT""}]","2013-05-24"
"1205.0059","Tsz Yan Lam","Tsz Yan Lam (Kavli IPMU), Baojiu Li (Durham)","Excursion set theory for modified gravity: correlated steps, mass
  functions and halo bias","12 pages, 13 figures. Match version accepted by MNRAS","MNRAS, 426, 3260 (2012)","10.1111/j.1365-2966.2012.21746.x",,"astro-ph.CO","http://arxiv.org/licenses/nonexclusive-distrib/1.0/","  We show how correlated steps introduces significant contributions to the
modification of the halo mass function in modified gravity models, taking the
chameleon models as an example, in the framework of the excursion set approach.
This correction applies to both Lagrangian and Eulerian environments discussed
in previous studies. Correlated steps also enhances the modifications due to
the fifth force in the conditional mass function as well as the halo bias. We
found that abundance and clustering measurements from different environments
can provide strong constraints on the chameleon models.
","[{""version"":""v1"",""created"":""Tue, 1 May 2012 00:07:02 GMT""},{""version"":""v2"",""created"":""Thu, 19 Jul 2012 04:53:03 GMT""}]","2013-05-24"
"1205.0060","Yuichiro Matsuzaki","Kazuki Koshino, Yuichiro Matsuzaki","Entangling homogeneously broadened matter qubits in the weak-coupling
  cavity-QED regime",,,"10.1103/PhysRevA.86.020305",,"quant-ph","http://arxiv.org/licenses/nonexclusive-distrib/1.0/","  In distributed quantum information processing, flying photons entangle matter
qubits confined in cavities. However, when a matter qubit is homogeneously
broadened, the strong-coupling regime of cavity QED is typically required,
which is hard to realize in actual experimental setups. Here, we show that a
high-fidelity entanglement operation is possible even in the weak-coupling
regime in which dampings (dephasing, spontaneous emission, and cavity leakage)
overwhelm the coherent coupling between a qubit and the cavity. Our proposal
enables distributed quantum information processing to be performed using much
less demanding technology than previously.
","[{""version"":""v1"",""created"":""Tue, 1 May 2012 00:25:45 GMT""}]","2015-06-04"
"1205.0061","Nandor Simanyi","Nandor Simanyi","Singularities and nonhyperbolic manifolds do not coincide","Final version, to appear in Nonlinearity","Nonlinearity 26 (2013) 1703-1717","10.1088/0951-7715/26/6/1703",,"math.DS math-ph math.MP","http://arxiv.org/licenses/nonexclusive-distrib/1.0/","  We consider the billiard flow of elastically colliding hard balls on the flat
$\nu$-torus ($\nu\ge 2$), and prove that no singularity manifold can even
locally coincide with a manifold describing future non-hyperbolicity of the
trajectories. As a corollary, we obtain the ergodicity (actually the Bernoulli
mixing property) of all such systems, i.e. the verification of the
Boltzmann-Sinai Ergodic Hypothesis.
","[{""version"":""v1"",""created"":""Tue, 1 May 2012 00:37:59 GMT""},{""version"":""v2"",""created"":""Wed, 25 Jul 2012 20:00:49 GMT""},{""version"":""v3"",""created"":""Mon, 15 Oct 2012 00:20:20 GMT""},{""version"":""v4"",""created"":""Wed, 12 Dec 2012 21:50:00 GMT""},{""version"":""v5"",""created"":""Thu, 25 Apr 2013 00:53:04 GMT""}]","2013-05-14"
"1205.0062","Mahir Bilen Can","Mahir Bilen Can, Tim Twelbeck","Lexicographic Shellability of Partial Involutions",,,,,"math.CO math.AG","http://arxiv.org/licenses/nonexclusive-distrib/1.0/","  In this manuscript we study inclusion posets of Borel orbit closures on
(symmetric) matrices. In particular, we show that the Bruhat poset of partial
involutions is a lexicographiically shellable poset. Also, studying the
embeddings of symmetric groups and involutions into rooks and partial
involutions, respectively, we find new $EL$-labelings on permutations as well
as on involutions.
","[{""version"":""v1"",""created"":""Tue, 1 May 2012 00:59:26 GMT""},{""version"":""v2"",""created"":""Thu, 21 Feb 2013 11:29:33 GMT""}]","2013-02-22"
"1205.0063","Jingzhi Yan","Jingzhi Yan, Juan Antonio Zurita Heras, Sylvain Chaty, Hui Li, and
  Qingzhong Liu","Multi-wavelength study of the Be/X-ray binary MXB 0656-072","27pages, 11figures, accepted for publication in ApJ",,"10.1088/0004-637X/753/1/73",,"astro-ph.HE","http://arxiv.org/licenses/nonexclusive-distrib/1.0/","  We present and analyze the optical photometric and spectroscopic data of the
Be/X-ray binary MXB 0656-072 from 2006 to 2009. A 101.2-day orbital period is
found, for the first time, from the present public X-ray data(Swift/BAT and
RXTE/ASM). The anti-correlation between the H$\alpha$ emission and the $UBV$
brightness of MXB 0656$-$072 during our 2007 observations indicates that a mass
ejection event took place in the system. After the mass ejection, a low-density
region might develop around the Oe star. With the outward motion of the
circumstellar disk, the outer part of the disk interacted with the neutron star
around its periastron passage and a series of the X-ray outbursts were
triggered between MJD 54350 and MJD 54850. The PCA--HEXTE spectra during the
2007-2008 X-ray outbursts could be well fitted by a cut-off power law with low
energy absorption, together with an iron line around 6.4 keV, and a broad
cyclotron resonance feature around 30 keV. The same variability of the soft and
hard X-ray colors in 2.3-21 keV indicated that there were no overall changes in
the spectral shape during the X-ray outbursts, which might be only connected
with the changes of the mass-accretion rate onto the neutron star.
","[{""version"":""v1"",""created"":""Tue, 1 May 2012 01:01:44 GMT""},{""version"":""v2"",""created"":""Thu, 17 May 2012 02:28:25 GMT""}]","2015-06-04"
"1205.0064","Saharon Shelah's Office","Saharon Shelah","On incompactness for chromatic number of graphs",,,,"Shelah [Sh:1006]","math.LO math.CO","http://arxiv.org/licenses/nonexclusive-distrib/1.0/","  We deal with incompactness. Assume the existence of non-reflecting stationary
set of cofinality kappa . We prove that one can define a graph G whose
chromatic number is > kappa, while the chromatic number of every subgraph G'
subseteq G,|G'| < |G| is <= kappa . The main case is kappa = aleph_0.
","[{""version"":""v1"",""created"":""Tue, 1 May 2012 01:05:17 GMT""},{""version"":""v2"",""created"":""Mon, 6 Aug 2012 22:32:29 GMT""}]","2012-08-08"
"1205.0065","Jeanne N. Clelland","Jeanne Clelland, Edward Estrada, Molly May, Jonah Miller, Sean
  Peneyra, Michael Schmidt","A Tale of Two Arc Lengths: Metric notions for curves in surfaces in
  equiaffine space","14 pages, 7 figures",,,,"math.DG","http://arxiv.org/licenses/nonexclusive-distrib/1.0/","  In Euclidean geometry, all metric notions (arc length for curves, the first
fundamental form for surfaces, etc.) are derived from the Euclidean inner
product on tangent vectors, and this inner product is preserved by the full
symmetry group of Euclidean space (translations, rotations, and reflections).
In equiaffine geometry, there is no invariant notion of inner product on
tangent vectors that is preserved by the full equiaffine symmetry group.
Nevertheless, it is possible to define an invariant notion of arc length for
nondegenerate curves, and an invariant first fundamental form for nondegenerate
surfaces in equiaffine space. This leads to two possible notions of arc length
for a curve contained in a surface, and these two arc length functions do not
necessarily agree. In this paper we will derive necessary and sufficient
conditions under which the two arc length functions do agree, and illustrate
with examples.
","[{""version"":""v1"",""created"":""Tue, 1 May 2012 01:15:32 GMT""}]","2012-05-02"
"1205.0066","Graeme Wong","T. J. Galvin, M. D. Filipovi\'c, E. J. Crawford, N. F. H. Tothill, G.
  F. Wong, A. Y. De Horta","20 cm VLA Radio-Continuum Study of M31 - Images and Point Source
  Catalogues","28 pages, 25 figures, accepted for publication in the Serbian
  Astronomical Journal",,"10.2298/SAJ1284041G",,"astro-ph.GA","http://arxiv.org/licenses/nonexclusive-distrib/1.0/","  We present a series of new high-sensitivity and high-resolution
radio-continuum images of M31 at \lambda=20 cm (\nu=1.4 GHz). These new images
were produced by merging archived 20 cm radio-continuum observations from the
Very Large Array (VLA) telescope. Images presented here are sensitive to rms=60
\mu Jy and feature high angular resolution (<10""). A complete sample of
discrete radio sources have been catalogued and analysed across 17 individual
VLA projects. We identified a total of 864 unique discrete radio sources across
the field of M31. One of the most prominent regions in M31 is the ring feature
for which we estimated total integrated flux of 706 mJy at \lambda=20 cm. We
compare here, detected sources to those listed in Gelfand et al. (2004) at
\lambda=92 cm and find 118 sources in common to both surveys. The majority
(61%) of these sources exhibit a spectral index of \alpha <-0.6 indicating that
their emission is predominantly non-thermal in nature. That is more typical for
background objects.
","[{""version"":""v1"",""created"":""Tue, 1 May 2012 01:19:17 GMT""}]","2015-06-04"
"1205.0067","Boris Kopeliovich","B.Z. Kopeliovich, I.K. Potashnikova, B. Povh and Ivan Schmidt","Pion structure function at small x from DIS data","17 pages, 12 figures",,"10.1103/PhysRevD.85.114025",,"hep-ph","http://arxiv.org/licenses/nonexclusive-distrib/1.0/","  Production of leading neutrons in DIS is usually considered as a tool to
measure the pion structure function at small x accessible at HERA. The main
obstacle is the lack of reliable evaluations of the absorption corrections,
which significantly suppress the cross section. We performed a parameter free
calculation within the dipole approach and found the absorption corrections to
be nearly as strong, as for neutron production in pp collisions. We also
included the significant contribution of the iso-vector Reggeons with natural
(\rho, a_2) and unnatural (a_1, \rho-\pi\ cut) parity with parameters
constrained by phenomenology. With a certain modeling for the pion-to-proton
ratio of the structure functions we reached good agreement with data from the
ZEUS and H1 experiments, successfully reproducing the observed dependence on
the fractional neutron momentum z, the photon virtuality Q^2, and the
transverse momentum transfer q_T.
","[{""version"":""v1"",""created"":""Tue, 1 May 2012 01:40:12 GMT""}]","2013-05-30"
"1205.0068","Manel Errando","M. Errando (for the VERITAS Collaboration)","Blazar observations above 100 GeV with VERITAS","6 pages, 5 figures, 2 tables, 2011 Fermi and Jansky Proceedings -
  eConf C1111101",,,,"astro-ph.HE astro-ph.CO","http://arxiv.org/licenses/nonexclusive-distrib/1.0/","  The VERITAS array of 12-m atmospheric-Cherenkov telescopes in southern
Arizona is one of the world's most-sensitive detectors of very-high-energy
(VHE, E>100 GeV) gamma rays. More than 50 extragalactic sources are known to
emit VHE photons; these include blazars, radio galaxies, and starburst
galaxies. Blazar observations are one of the VERITAS Collaboration's Key
Science Projects. More than 400 hours per year are devoted to this program and
~100 blazars have already been observed with the array, in most cases with the
deepest ever VHE exposure. These observations have resulted in 21 detections,
including 10 VHE discoveries, all of them with supporting multiwavelength
observations. Recent highlights from VERITAS extragalactic observation program
and the collaboration's long-term blazar observation strategy are presented.
","[{""version"":""v1"",""created"":""Tue, 1 May 2012 01:43:01 GMT""}]","2019-08-13"
