"1204.6738","Simon Friederich","Simon Friederich","In defence of non-ontic accounts of quantum states","35 pages, forthcoming in ""Studies in History and Philosophy of Modern
  Physics""",,,,"quant-ph physics.hist-ph","http://arxiv.org/licenses/nonexclusive-distrib/1.0/","  The paper discusses objections against non-hidden variable versions of the
epistemic conception of quantum states - the view that quantum states do not
describe the properties of quantum systems but reflect, in some way to be
specified, the epistemic conditions of agents assigning them. In the first half
of the paper, the main motivation for the epistemic conception of quantum
states is sketched, and a version of it is outlined, which combines ideas from
an earlier study of it [Friederich 2011] with elements of Richard Healey's
recent pragmatist interpretation of quantum theory [Healey 2012]. In the second
half, various objections against epistemic accounts of quantum states are
discussed in detail, which are based on criticisms found in the literature.
Possible answers by the version outlined here are compared with answers from
the quantum Bayesian point of view, which is at present the most discussed
version of the epistemic conception of quantum states.
","[{""version"":""v1"",""created"":""Mon, 30 Apr 2012 19:51:33 GMT""},{""version"":""v2"",""created"":""Thu, 7 Feb 2013 15:46:34 GMT""}]","2013-02-08"
"1204.6739","Stephen Taylor","Stephen R. Taylor, Jonathan R. Gair","Cosmology with the lights off: Standard sirens in the Einstein Telescope
  era","24 pages, 11 figures, 6 tables. Minor changes to reflect published
  version. References updated and corrected","Phys. Rev. D 86, 023502 (2012)","10.1103/PhysRevD.86.023502",,"astro-ph.CO gr-qc","http://arxiv.org/licenses/nonexclusive-distrib/1.0/","  We explore the prospects for constraining cosmology using gravitational-wave
(GW) observations of neutron-star binaries by the proposed Einstein Telescope
(ET), exploiting the narrowness of the neutron-star mass function. Double
neutron-star (DNS) binaries are expected to be one of the first sources
detected after ""first-light"" of Advanced LIGO and are expected to be detected
at a rate of a few tens per year in the advanced era. However the proposed ET
could catalog tens of thousands per year. Combining the measured source
redshift distributions with GW-network distance determinations will permit not
only the precision measurement of background cosmological parameters, but will
provide an insight into the astrophysical properties of these DNS systems. Of
particular interest will be to probe the distribution of delay times between
DNS-binary creation and subsequent merger, as well as the evolution of the
star-formation rate density within ET's detection horizon. Keeping H_0,
\Omega_{m,0} and \Omega_{\Lambda,0} fixed and investigating the precision with
which the dark-energy equation-of-state parameters could be recovered, we found
that with 10^5 detected DNS binaries we could constrain these parameters to an
accuracy similar to forecasted constraints from future CMB+BAO+SNIa
measurements. Furthermore, modeling the merger delay-time distribution as a
power-law, and the star-formation rate (SFR) density as a parametrized version
of the Porciani and Madau SF2 model, we find that the associated astrophysical
parameters are constrained to within ~ 10%. All parameter precisions scaled as
1/sqrt(N), where N is the number of cataloged detections. We also investigated
how precisions varied with the intrinsic underlying properties of the Universe
and with the distance reach of the network (which may be affected by the
low-frequency cutoff of the detector).
","[{""version"":""v1"",""created"":""Mon, 30 Apr 2012 19:57:15 GMT""},{""version"":""v2"",""created"":""Thu, 5 Jul 2012 16:04:30 GMT""}]","2012-07-06"
"1205.0003","Mahmoud Abdel-Aty","Mahmoud Abdel-Aty","Indices to Quantify the Ranking of Arabic Journals and Research Output","4 pages, 3 figures","Inf. Sci. Lett. 1, (2012)",,,"cs.DL","http://arxiv.org/licenses/nonexclusive-distrib/1.0/","  I propose two simple indices to classify journals, published in Arabic
language, and different researchers. These indices depend upon the known impact
factor and h-index. The new indices give an easy way to judge the rank of any
journal (output of any researcher) without looking for other journals (output
of other researchers).
","[{""version"":""v1"",""created"":""Mon, 30 Apr 2012 16:22:17 GMT""}]","2012-05-02"
"1205.0004","Jay Farihi","J. Farihi, B. T. G\""ansicke, M. C. Wyatt, J. Girven, J. E. Pringle, A.
  R. King","Scars of Intense Accretion Episodes at Metal-Rich White Dwarfs","9 pages, 4 figures, 2 tables, accepted to MNRAS",,"10.1111/j.1365-2966.2012.21215.x",,"astro-ph.SR astro-ph.EP","http://arxiv.org/licenses/nonexclusive-distrib/1.0/","  A re-evaluation of time-averaged accretion rates at DBZ-type white dwarfs
points to historical, time-averaged rates significantly higher than the
currently observed episodes at their DAZ counterparts. The difference between
the ongoing, instantaneous accretion rates witnessed at DAZ white dwarfs, which
often exceed 1e8 g/s, and those inferred over the past 1e5-1e6 yr for the DBZ
stars can be a few orders of magnitude, and therefore must result from
high-rate episodes of tens to hundreds of years so they remain undetected to
date. This paper explores the likelihood that such brief, intense accretion
episodes of gas-phase material can account for existing data. For reasonable
assumptions about the circumstellar gas, accretion rates approaching or
exceeding 1e15 g/s are possible, similar to rates observed in quiescent
cataclysmic variables, and potentially detectable with future x-ray missions or
wide-field monitoring facilities. Gaseous debris that is prone to such rapid
accretion may be abundant immediately following a tidal disruption event via
collisions and sublimation, or if additional bodies impinge upon an extant
disk. Particulate disk matter accretes at or near the Poynting-Robertson drag
rate for long periods between gas-producing events, consistent with rates
inferred for dusty DAZ white dwarfs. In this picture, warm DAZ stars without
infrared excesses have rates consistent with accretion from particulate disks
that remain undetected. This overall picture has implications for quasi-steady
state models of accretion and the derived chemical composition of asteroidal
debris in DBZ white dwarfs.
","[{""version"":""v1"",""created"":""Mon, 30 Apr 2012 20:00:00 GMT""},{""version"":""v2"",""created"":""Thu, 14 Jun 2012 18:37:30 GMT""}]","2012-06-15"
"1205.0005","Sho Yaida","Sho Yaida","Instanton Calculus of Lifshitz Tails","5 pages","Phys. Rev. B 93, 075120 (2016)","10.1103/PhysRevB.93.075120","MIT-CTP-4364","cond-mat.dis-nn hep-th","http://arxiv.org/licenses/nonexclusive-distrib/1.0/","  For noninteracting particles moving in a Gaussian random potential, there
exists a disagreement in the literature on the asymptotic expression for the
density of states in the tail of the band. We resolve this discrepancy. Further
we illuminate the physical facet of instantons appearing in replica and
supersymmetric derivations with another derivation employing a Lagrange
multiplier field.
","[{""version"":""v1"",""created"":""Mon, 30 Apr 2012 20:00:00 GMT""}]","2016-02-17"
"1205.0006","Julia Kamenetzky","J. Kamenetzky (1), J. Glenn (1), N. Rangwala (1), P. Maloney (1), M.
  Bradford (2), C. D. Wilson (3), G. J. Bendo (4), M. Baes (5), A. Boselli (6),
  A. Cooray (7), K. G. Isaak (8), V. Lebouteiller (9), S. Madden (9), P.
  Panuzzo (9), M. R. P. Schirm (3), L. Spinoglio (10), R. Wu (9) ((1) Center
  for Astrophysics and Space Astronomy, University of Colorado Boulder, (2)
  NASA Jet Propulsion Laboratory, (3) McMaster University, (4) UK ALMA Regional
  Centre Node, University of Manchester, (5) Sterrenkundig Observatorium,
  Universiteit Gent, (6) Laboratoire d'Astrophysique de Marseille, (7)
  University of California, Irvine (8) ESA Astrophysics Missions Division, The
  Netherlands, (9) CEA, Laboratoire AIM, Irfu/SAp, (10) Istituto di Fisica
  dello Spazio Interplanetario, INAF)","Herschel-SPIRE Imaging Spectroscopy of Molecular Gas in M82","Accepted to The Astrophysical Journal. 17 pages + 20 pages of
  appendix figures",,"10.1088/0004-637X/753/1/70",,"astro-ph.GA","http://arxiv.org/licenses/nonexclusive-distrib/1.0/","  We present new Herschel-SPIRE imaging spectroscopy (194-671 microns) of the
bright starburst galaxy M82. Covering the CO ladder from J=4-3 to J=13-12,
spectra were obtained at multiple positions for a fully sampled ~ 3 x 3
arcminute map, including a longer exposure at the central position. We present
measurements of 12CO, 13CO, [CI], [NII], HCN, and HCO+ in emission, along with
OH+, H2O+ and HF in absorption and H2O in both emission and absorption, with
discussion. We use a radiative transfer code and Bayesian likelihood analysis
to model the temperature, density, column density, and filling factor of
multiple components of molecular gas traced by 12CO and 13CO, adding further
evidence to the high-J lines tracing a much warmer (~ 500 K), less massive
component than the low-J lines. The addition of 13CO (and [CI]) is new and
indicates that [CI] may be tracing different gas than 12CO. No
temperature/density gradients can be inferred from the map, indicating that the
single-pointing spectrum is descriptive of the bulk properties of the galaxy.
At such a high temperature, cooling is dominated by molecular hydrogen.
Photon-dominated region (PDR) models require higher densities than those
indicated by our Bayesian likelihood analysis in order to explain the high-J CO
line ratios, though cosmic-ray enhanced PDR models can do a better job
reproducing the emission at lower densities. Shocks and turbulent heating are
likely required to explain the bright high-J emission.
","[{""version"":""v1"",""created"":""Mon, 30 Apr 2012 20:00:02 GMT""}]","2015-06-04"
"1205.0007","Miguel Pato","Alejandro Ibarra, Sergio L\'opez Gehler, Miguel Pato","Dark matter constraints from box-shaped gamma-ray features","17 pages, 5 figures","JCAP07(2012)043","10.1088/1475-7516/2012/07/043",,"hep-ph astro-ph.HE","http://arxiv.org/licenses/nonexclusive-distrib/1.0/","  The observation of a sharp spectral feature in the gamma-ray sky would be one
of the cleanest ways to identify dark matter and pinpoint its properties. Over
the years a lot of attention has been paid to two specific features, namely
gamma-ray lines and internal bremsstrahlung. Here, we explore a third class of
spectral signatures, box-shaped gamma-ray spectra, that naturally arise in dark
matter cascade annihilations or decays into intermediate particles that in turn
decay into photons. Using Fermi-LAT data, we derive constraints on the dark
matter parameter space for both annihilating and decaying dark matter, and show
explicitly that our limits are competitive to strategies employing standard
spectral features. More importantly, we find robust limits even in the case of
non-degenerate dark matter and intermediate particle masses. This result is
particularly relevant in constraining dark matter frameworks with gamma-ray
data. We conclude by illustrating the power of box-shaped gamma-ray constraints
on concrete particle physics scenarios.
","[{""version"":""v1"",""created"":""Mon, 30 Apr 2012 20:00:02 GMT""},{""version"":""v2"",""created"":""Tue, 24 Jul 2012 00:19:22 GMT""}]","2012-07-25"
"1205.0008","Alexander Merle","Romain Bouchand and Alexander Merle","Running of Radiative Neutrino Masses: The Scotogenic Model","35 pages, 10 figures, 2 tables",,"10.1007/JHEP07(2012)084",,"hep-ph","http://arxiv.org/licenses/nonexclusive-distrib/1.0/","  We study the renormalization group equations of Ma's scotogenic model, which
generates an active neutrino mass at 1-loop level. In addition to other
benefits, the main advantage of the mechanism exploited in this model is to
lead to a natural loop-suppression of the neutrino mass, and therefore to an
explanation for its smallness. However, since the structure of the neutrino
mass matrix is altered compared to the ordinary type I seesaw case, the
corresponding running is altered as well. We have derived the full set of
renormalization group equations for the scotogenic model which, to our
knowledge, had not been presented previously in the literature. This set of
equations reflects some interesting structural properties of the model, and it
is an illustrative example for how the running of neutrino parameters in
radiative models is modified compared to models with tree-level mass
generation. We also study a simplified numerical example to illustrate some
general tendencies of the running. Interestingly, the structure of the RGEs can
be exploited such that a bimaximal leptonic mixing pattern at the high-energy
scale is translated into a valid mixing pattern at low energies, featuring a
large value of \theta_{13}. This suggests very interesting connections to
flavour symmetries.
","[{""version"":""v1"",""created"":""Mon, 30 Apr 2012 20:00:03 GMT""}]","2015-06-04"
"1205.0009","Conor Mancone","Conor Mancone and Anthony Gonzalez","EzGal: A Flexible Interface for Stellar Population Synthesis Models","10 pages, 5 figures, accepted for publication in PASP",,"10.1086/666502",,"astro-ph.IM astro-ph.CO","http://arxiv.org/licenses/nonexclusive-distrib/1.0/","  We present EzGal, a flexible python program designed to easily generate
observable parameters (magnitudes, colors, mass-to-light ratios) for any
stellar population synthesis (SPS) model. As has been demonstrated by various
authors, the choice of input SPS models can be a significant source of
systematic uncertainty. A key strength of EzGal is that it enables simple,
direct comparison of different models sets. EzGal is also capable of generating
composite stellar population models (CSPs) and can interpolate between
metallicities for a given model set. We have created a web interface to run
EzGal and generate observables for a variety of star formation histories and
model sets. We make many commonly used SPS models available from this
interface; the BC03 models, an updated version of these models, the Maraston
models, the BaSTI models, and finally the FSPS models. We use EzGal to compare
magnitude predictions for the model sets as a function of wavelength, age,
metallicity, and star formation history. We recover the well-known result that
the models agree best in the optical for old, solar metallicity models, with
differences at the ~0.1 magnitude level. The most problematic regime for SPS
modeling is for young ages (<2 Gyrs) and long wavelengths (lambda >7500
Angstroms) where scatter between models can vary from 0.3 mags (Sloan i) to 0.7
mags (Ks). We find that these differences are best understood as general
uncertainties in SPS modeling. Finally we explore a more physically motivated
example by generating CSPs with a star formation history matching the global
star formation history of the universe. We demonstrate that the wavelength and
age dependence of SPS model uncertainty translates into a redshift dependent
model uncertainty, highlighting the importance of a quantitative understanding
of model differences when comparing observations to models as a function of
redshift.
","[{""version"":""v1"",""created"":""Mon, 30 Apr 2012 20:00:04 GMT""},{""version"":""v2"",""created"":""Thu, 17 May 2012 16:57:11 GMT""}]","2015-06-04"
"1205.0010","Eric Lopez","Eric D. Lopez, Jonathan J. Fortney, and Neil K. Miller","How Thermal Evolution and Mass Loss Sculpt Populations of Super-Earths
  and Sub-Neptunes: Application to the Kepler-11 System and Beyond","17 pages, 7 figures. Accepted for publication in ApJ. Compared to the
  submitted version we made modest modifications to our mass loss model
  including reducing our default mass loss efficiency. However, the central
  conclusions of the paper are unchanged",,"10.1088/0004-637X/761/1/59",,"astro-ph.EP","http://arxiv.org/licenses/nonexclusive-distrib/1.0/","  We use models of thermal evolution and XUV-driven mass loss to explore the
composition and history of low-mass low-density transiting planets. We
investigate the Kepler-11 system in detail and provide estimates of both the
current and past planetary compositions. We find that a H/He atmosphere on
Kepler-11b is highly vulnerable to mass loss. By comparing to formation models,
we show that in situ formation of the system is unlikely. Instead we propose
that it is a water-rich system of sub-Neptunes that migrated from beyond the
snow line. For the broader population of observed planets, we show that there
is a threshold in bulk planet density and incident flux above which no low-mass
transiting planets have been observed. We suggest that this threshold is due to
the instability of H/He atmospheres to XUV-driven mass loss. Importantly, we
find that this flux-density threshold is well reproduced by our thermal
evolution/contraction models that incorporate a standard mass loss
prescription. Treating the planets' contraction history is essential because
the planets have significantly larger radii during the early era of high XUV
fluxes. Over time low mass planets with H/He envelopes can be transformed into
water-dominated worlds with steam atmospheres or rocky super-Earths. Finally,
we use this threshold to provide likely minimum masses and radial velocity
amplitudes for the general population of Kepler candidates. Likewise, we use
this threshold to provide constraints on the maximum radii of low-mass planets
found by radial velocity surveys.
","[{""version"":""v1"",""created"":""Mon, 30 Apr 2012 20:00:04 GMT""},{""version"":""v2"",""created"":""Mon, 22 Oct 2012 05:30:09 GMT""}]","2015-06-04"
"1205.0011","Marco Farina","Marco Farina, Christophe Grojean, Ennio Salvioni","(Dys)Zphilia or a custodial breaking Higgs at the LHC","16 pages, 10 figures",,"10.1007/JHEP07(2012)012","CERN-PH-TH/2012-086","hep-ph hep-ex","http://arxiv.org/licenses/nonexclusive-distrib/1.0/","  Electroweak precision measurements established that custodial symmetry is
preserved to a good accuracy in the gauge sector after electroweak symmetry
breaking. However, recent LHC results might be interpreted as pointing towards
Higgs couplings that do not respect such symmetry. Motivated by this
possibility, we reconsider the presence of an explicitly custodial breaking
coupling in a generic Higgs parameterization. After briefly commenting on the
large UV sensitivity of the T parameter to such a coupling, we perform a fit to
results of Higgs searches at LHC and Tevatron, and find that the apparent
enhancement of the ZZ channel with respect to WW can be accommodated. Two
degenerate best-fit points are present, which we label `Zphilic' and
`dysZphilic' depending on the sign of the hZZ coupling. Finally we highlight
some measurements at future linear colliders that may remove such degeneracy.
","[{""version"":""v1"",""created"":""Mon, 30 Apr 2012 20:00:04 GMT""}]","2015-06-04"
"1205.0012","David Henley","David B. Henley (1), Kyujin Kwak (1,2), Robin L. Shelton (1) ((1)
  University of Georgia, (2) Korea Astronomy and Space Science Institute)","Simulations of High-Velocity Clouds. II. Ablation from High-Velocity
  Clouds as a Source of Low-Velocity High Ions","17 pages, 8 figures. Accepted for publication in the Astrophysical
  Journal",,"10.1088/0004-637X/753/1/58",,"astro-ph.GA","http://arxiv.org/licenses/nonexclusive-distrib/1.0/","  In order to determine if the material ablated from high-velocity clouds
(HVCs) is a significant source of low-velocity high ions (C IV, N V, and O VI)
such as those found in the Galactic halo, we simulate the hydrodynamics of the
gas and the time-dependent ionization evolution of its carbon, nitrogen, and
oxygen ions. Our suite of simulations examines the ablation of warm material
from clouds of various sizes, densities, and velocities as they pass through
the hot Galactic halo. The ablated material mixes with the environmental gas,
producing an intermediate-temperature mixture that is rich in high ions and
that slows to the speed of the surrounding gas. We find that the slow mixed
material is a significant source of the low-velocity O VI that is observed in
the halo, as it can account for at least ~1/3 of the observed O VI column
density. Hence, any complete model of the high ions in the halo should include
the contribution to the O VI from ablated HVC material. However, such material
is unlikely to be a major source of the observed C IV, presumably because the
observed C IV is affected by photoionization, which our models do not include.
We discuss a composite model that includes contributions from HVCs, supernova
remnants, a cooling Galactic fountain, and photoionization by an external
radiation field. By design, this model matches the observed O VI column
density. This model can also account for most or all of the observed C IV, but
only half of the observed N V.
","[{""version"":""v1"",""created"":""Mon, 30 Apr 2012 20:00:06 GMT""}]","2015-06-04"
"1205.0013","Jay Hubisz","Joshua Berger, Jay Hubisz, and Maxim Perelstein","A Fermionic Top Partner: Naturalness and the LHC","30 pages, 8 figures, 1 table; v2: Minor changes. Final version to
  appear in JHEP; v3: References added",,"10.1007/JHEP07(2012)016",,"hep-ph","http://arxiv.org/licenses/nonexclusive-distrib/1.0/","  Naturalness demands that the quadratic divergence of the one-loop top
contribution to the Higgs mass be cancelled at a scale below 1 TeV. This can be
achieved by introducing a fermionic (spin-1/2) top partner, as in, for example,
Little Higgs models. In this paper, we study the phenomenology of a simple
model realizing this mechanism. We present the current bounds on the model from
precision electroweak fits, flavor physics, and direct searches at the LHC. The
lower bound on the top partner mass from precision electroweak data is
approximately 500 GeV, while the LHC bound with 5/fb of data at sqrt(s)=7 TeV
is about 450 GeV. Given these bounds, the model can incorporate a 125 GeV Higgs
with minimal fine-tuning of about 20%. We conclude that natural electroweak
symmetry breaking with a fermionic top partner remains a viable possibility. We
also compute the Higgs decay rates into gauge bosons, and find that
significant, potentially observable deviations from the Standard Model
predictions may occur.
","[{""version"":""v1"",""created"":""Mon, 30 Apr 2012 20:00:06 GMT""},{""version"":""v2"",""created"":""Fri, 29 Jun 2012 18:36:00 GMT""},{""version"":""v3"",""created"":""Fri, 4 Jan 2013 14:46:21 GMT""}]","2015-06-04"
"1205.0014","Sarang Gopalakrishnan","Sarang Gopalakrishnan, Pouyan Ghaemi, Shinsei Ryu","Non-Abelian SU(2) gauge fields through density-wave order and strain in
  graphene","5 pages, 3 figures","Phys. Rev. B 86, 081403(R) (2012)","10.1103/PhysRevB.86.081403",,"cond-mat.mes-hall","http://arxiv.org/licenses/nonexclusive-distrib/1.0/","  Spatially varying strain patterns can qualitatively alter the electronic
properties of graphene, acting as effective valley-dependent magnetic fields
and giving rise to pseudo-Landau-level (PLL) quantization. Here, we show that
the strain-induced magnetic field is one component of an SU(2) non-Abelian
gauge field within the low-energy theory of graphene, and identify the other
two components as period-3 charge-density waves. We show that these
density-waves, if spatially varied, give rise to PLL quantization. We also
argue that strain-induced magnetic fields can induce density-wave order in
graphene, thus dynamically gapping out the lowest PLL; moreover, the ordering
should generically be accompanied by dislocations. We discuss experimental
signatures of these effects.
","[{""version"":""v1"",""created"":""Mon, 30 Apr 2012 20:00:12 GMT""}]","2012-08-15"
