"1205.0129","Justin Feuto","Justin Feuto","Intrinsic square functions on functions spaces including weighted Morrey
  spaces","14 pages, we have corrected some mistakes and change the title of the
  paper. (To appear in BKMS)",,,,"math.CA","http://arxiv.org/licenses/nonexclusive-distrib/1.0/","  We prove that the intrinsic square functions including Lusin area integral
and Littlewood-Paley $g^{\ast}_{\lambda}$-function as defined by Wilson, are
bounded in a class of function spaces include weighted Morrey spaces. The
corresponding commutators generated by $BMO$ functions are also considered.
","[{""version"":""v1"",""created"":""Tue, 1 May 2012 10:39:13 GMT""},{""version"":""v2"",""created"":""Thu, 3 May 2012 16:41:10 GMT""},{""version"":""v3"",""created"":""Tue, 16 Apr 2013 15:33:09 GMT""}]","2013-04-17"
"1205.0130","Rafayel Kamalian","R.R. Kamalian","On one-sided interval edge colorings of biregular bipartite graphs","6 pages, no figures",,,,"cs.DM math.CO","http://arxiv.org/licenses/nonexclusive-distrib/1.0/","  A proper edge $t$-coloring of a graph $G$ is a coloring of edges of $G$ with
colors $1,2,...,t$ such that all colors are used, and no two adjacent edges
receive the same color. The set of colors of edges incident with a vertex $x$
is called a spectrum of $x$. An arbitrary nonempty subset of consecutive
integers is called an interval. We say that a proper edge $t$-coloring of a
graph $G$ is interval in the vertex $x$ if the spectrum of $x$ is an interval.
We say that a proper edge $t$-coloring $\varphi$ of a graph $G$ is interval on
a subset $R_0$ of vertices of $G$, if for an arbitrary $x\in R_0$, $\varphi$ is
interval in $x$. We say that a subset $R$ of vertices of $G$ has an
$i$-property if there is a proper edge $t$-coloring of $G$ which is interval on
$R$. If $G$ is a graph, and a subset $R$ of its vertices has an $i$-property,
then the minimum value of $t$ for which there is a proper edge $t$-coloring of
$G$ interval on $R$ is denoted by $w_R(G)$.
  In this paper, for some bipartite graphs, we estimate the value of this
parameter in that cases when $R$ coincides with the set of all vertices of one
part of the graph.
","[{""version"":""v1"",""created"":""Tue, 1 May 2012 10:47:49 GMT""}]","2012-05-02"
"1205.0131","Rafayel Kamalian","R.R. Kamalian","Estimates for the number of vertices with an interval spectrum in proper
  edge colorings of some graphs","10 pages, no figures",,,,"cs.DM math.CO","http://arxiv.org/licenses/nonexclusive-distrib/1.0/","  A proper edge $t$-coloring of a graph $G$ is a coloring of edges of $G$ with
colors $1,2,...,t$ such that each of $t$ colors is used, and adjacent edges are
colored differently. The set of colors of edges incident with a vertex $x$ of
$G$ is called a spectrum of $x$. A proper edge $t$-coloring of a graph $G$ is
interval for its vertex $x$ if the spectrum of $x$ is an interval of integers.
A proper edge $t$-coloring of a graph $G$ is persistent-interval for its vertex
$x$ if the spectrum of $x$ is an interval of integers beginning from the color
1.
  For graphs $G$ from some classes of graphs, we obtain estimates for the
possible number of vertices for which a proper edge $t$-coloring of $G$ can be
interval or persistent-interval.
","[{""version"":""v1"",""created"":""Tue, 1 May 2012 10:52:09 GMT""}]","2012-05-02"
"1205.0132","Partha Goswami","Partha Goswami","Change in Stacking Order and Lifshitz transition in Bi-layer Graphene","6 pages, 4 figures",,,,"cond-mat.mes-hall","http://arxiv.org/licenses/nonexclusive-distrib/1.0/","  We consider the AB-(Bernal) stacking for the bi-layer graphene (BLG) system
and assume that a perpendicular electric field is created by the external gates
deposited on the BLG surface. In the basis (A1, B2, A2, B1) for the valley K
and the basis (B2, A1, B1, A2) for the valley K', we show the occurrence of
trigonal warping [ see A. S. N\'u\~nez et al.,arXiv:1012.4318], that is,
splitting of the energy bands or the density of states on the kx - ky plane
into four pockets comprising of the central part and three legs due to a (skew)
interlayer hopping between A1 and B2. The hopping between A1 - B2 leads to a
concurrent velocity v3in addition to the Fermi velocity vF. Our noteworthy
outcome is that the above-mentioned topological change, referred to as the
Lifshitz transition [I. M. Lishitz, Zh. Exp. Teor. Fiz., 38, 1565 (1960) (Sov.
Phys. JETP 11, 1130 (1960));Y. Lemonik, I.L. Aleiner, C. Toke, and V.I. Fal'ko;
arXiv:1006.1399], is entirely bias-tunable. Furthermore, the many-body effects,
which is known to yield logarithmic renormalizations [C. Hwang, D. A. Siegel,
Sung-Kwan Mo, W. Regan, A. Ismach, Y. Zhang, A. Zettl and A. Lanzara,
arXiv:1208.0567] in the band dispersions of monolayer graphene, is found to
have significant effect on the bias-tunability of this transition. We also
consider the system where the A atoms of the two layers are over each other and
the B atoms of the layers are displaced with respect to each other. The
trigonal warping is found to be absent in this case. Instead, the Fermi energy
density of states for zero bias corresponds to the inverted sombrero-like
structure. The structure is found to get deformed due to the increase in the
bias.
","[{""version"":""v1"",""created"":""Tue, 1 May 2012 10:54:13 GMT""},{""version"":""v2"",""created"":""Wed, 8 Aug 2012 03:38:41 GMT""}]","2012-08-09"
"1205.0133","Chi-Yong Lin","Jen-Tsung Hsiang, Chi-Yong Lin, Da-Shin Lee, and Ray J. Rivers","The role of Causality in Tunable Fermi Gas Condensates","9 pages, 2 figures. In v.3 the formalism is different from the
  existing arXiv versions, but the final results are unchanged. Title changed,
  one author added. The article will be published in the special edition of
  Journal of Physics: Condensed Matter on ""Condensed matter analogues of
  cosmology""","J. Phys.: Condens. Matter 25 (2013) 404211","10.1088/0953-8984/25/40/404211",,"gr-qc cond-mat.quant-gas","http://arxiv.org/licenses/nonexclusive-distrib/1.0/","  We develop a new formalism for the description of the condensates of cold
Fermi atoms whose speed of sound can be tuned with the aid of a narrow Feshbach
resonance. We use this to look for spontaneous phonon creation that mimics
spontaneous particle creation in curved space-time in
Friedmann-Robertson-Walker and other model universes.
","[{""version"":""v1"",""created"":""Tue, 1 May 2012 11:03:28 GMT""},{""version"":""v2"",""created"":""Fri, 4 May 2012 09:30:40 GMT""},{""version"":""v3"",""created"":""Sun, 11 Aug 2013 01:50:14 GMT""},{""version"":""v4"",""created"":""Tue, 17 Sep 2013 01:56:34 GMT""}]","2013-09-18"
"1205.0134","Jure Zupan","Juan Herrero-Garcia, Thomas Schwetz, Jure Zupan","Astrophysics independent bounds on the annual modulation of dark matter
  signals","4 pages, 4 figures",,"10.1103/PhysRevLett.109.141301","UCHEP-12-04","hep-ph astro-ph.CO","http://arxiv.org/licenses/nonexclusive-distrib/1.0/","  We show how constraints on the time integrated event rate from a given dark
matter (DM) direct detection experiment can be used to set a stringent
constraint on the amplitude of the annual modulation signal in another
experiment. The method requires only very mild assumptions about the properties
of the local DM distribution: that it is temporally stable on the scale of
months and spatially homogeneous on the ecliptic. We apply the method to the
annual modulation signal in DAMA/LIBRA, which we compare to the bounds derived
from the constraints on the time-averaged rates from XENON10, XENON100, CDMS
and SIMPLE. Assuming a DM mass of 10 GeV, we show that a DM interpretation of
the DAMA/LIBRA signal is excluded at 6.3sigma (4.6sigma) for isospin conserving
(violating) spin-independent interactions, and at 4.9sigma for spin-dependent
interactions on protons.
","[{""version"":""v1"",""created"":""Tue, 1 May 2012 11:09:41 GMT""}]","2013-05-30"
"1205.0135","Mustafa Sarisaman","Mustafa Sarisaman","Euclidean Pseudoduality and Boundary Conditions in Sigma Models","17 pages, v2: References added, slightly revised; To appear in Nucl.
  Phys. B","Nucl.Phys. B868 (2013) 314-327","10.1016/j.nuclphysb.2012.11.014",,"hep-th math-ph math.MP","http://arxiv.org/licenses/nonexclusive-distrib/1.0/","  We discuss pseudoduality transformations in two dimensional conformally
invariant classical sigma models, and extend our analysis to a given boundaries
of world-sheet, which gives rise to an appropriate framework for the discussion
of the pseudoduality between D-branes. We perform analysis using the Euclidean
spacetime and show that structures on the target space can be transformed into
pseudodual manifold identically. This map requires that torsions and curvatures
related to individual spaces are the same when connections are riemannian.
Boundary pseudoduality imposes locality condition.
","[{""version"":""v1"",""created"":""Tue, 1 May 2012 11:11:18 GMT""},{""version"":""v2"",""created"":""Wed, 21 Nov 2012 23:21:25 GMT""}]","2013-06-20"
"1205.0136","Seonja Kim","Seonja Kim","Explicit presentations of nonspecial line bundles and secant spaces",,,,,"math.AG","http://arxiv.org/licenses/nonexclusive-distrib/1.0/","  A line bundle L on a smooth curve X is nonspecial if and only if L admits a
presentation L=K_X -D +E for some effective divisors D and E>0 on X with gcd
(D, E)=0 and h^0 (X, O_X (D))=1. In this work, we define a minimal presentation
of L which is minimal with respect to the degree of E among the presentations.
If L=K_X -D +E with degE>2 is a minimal, then L is very ample and any q-points
of X with q <degE are embedded in general position but the points of E are not.
We investigate sufficient conditions on divisors D and E for L=K_X -D +E to be
minimal. Through this, for a number n in some range, it is possible to
construct a nonspecial very ample line bundle L=K_X -D +E on X with/without an
n-secant (n-2)-plane of the embedded curve by taking divisors D and E on X. As
its applications, we construct nonspecial line bundles which show the sharpness
of Green and Lazarsfeld's Conjecture on property (N_p) for general n-gonal
curves and simple multiple coverings of smooth plane curves.
","[{""version"":""v1"",""created"":""Tue, 1 May 2012 11:18:55 GMT""}]","2012-05-02"
"1205.0137","Robert D. Pisarski","Adrian Dumitru, Yun Guo, Yoshimasa Hidaka, Christiaan P. Korthals
  Altes, and Robert D. Pisarski","Effective matrix model for deconfinement in pure gauge theories","80 pages, 26 figures",,"10.1103/PhysRevD.86.105017","BNL-96946-2012-JA, NIKHEF-2012-002, RBRC-943, RIKEN-MP-40,
  RIKEN-QHP-20","hep-ph hep-lat nucl-th","http://arxiv.org/licenses/nonexclusive-distrib/1.0/","  We construct matrix models for the deconfining phase transition in SU(N)
gauge theories, without dynamical quarks, at a nonzero temperature T. We
generalize models with zero and one free parameter to study a model with two
free parameters: besides perturbative terms ~T^4, we introduce terms ~T^2 and
~T^0. The two N-dependent parameters are determined by fitting to data from
numerical simulations on the lattice for the pressure, including the latent
heat. Good agreement is found for the pressure in the semi-quark gluon plasma
(QGP), which is the region from Tc, the critical temperature, to about ~4 Tc.
Above ~1.2 Tc, the pressure is a sum of a perturbative term, ~ +T^4, and a
simple non-perturbative term, essentially just a constant times ~ -Tc^2 T^2.
For the pressure, the details of the matrix model only enter within a very
narrow window, from Tc to ~1.2 Tc, whose width does not change significantly
with N. Without further adjustment, the model also agrees well with lattice
data for the 't Hooft loop. This is notable, because in contrast to the
pressure, the 't Hooft loop is sensitive to the details of the matrix model
over the entire semi-QGP. For the (renormalized) Polyakov loop, though, our
results disagree sharply with those from the lattice. Matrix models provide a
natural and generic explanation for why the deconfining phase transition in
SU(N) gauge theories is of first order not just for three, but also for four or
more colors. Lastly, we consider gauge theories where there is no strict order
parameter for deconfinement, such as for a G(2) gauge group. To agree with
lattice measurements, in the G(2) matrix model it is essential to add terms
which generate complete eigenvalue repulsion in the confining phase.
","[{""version"":""v1"",""created"":""Tue, 1 May 2012 11:28:02 GMT""}]","2013-05-30"
"1205.0138","Tanumoy Pramanik","T. Pramanik, P. Chowdhury, and A. S. Majumdar","Fine-grained lower limit of entropic uncertainty in the presence of
  quantum memory","Latex, 5 pages, one encapsulated figure, accepted for publication in
  Physical Review Letters","Phys. Rev. Lett. 110, 020402 (2013)","10.1103/PhysRevLett.110.020402",,"quant-ph","http://arxiv.org/licenses/nonexclusive-distrib/1.0/","  The limitation on obtaining precise outcomes of measurements performed on two
non-commuting observables of a particle as set by the uncertainty principle in
its entropic form, can be reduced in the presence of quantum memory. We derive
a new entropic uncertainty relation based on fine- graining, which leads to an
ultimate limit on the precision achievable in measurements performed on two
incompatible observables in the presence of quantum memory. We show that our
derived uncertainty relation tightens the lower bound set by entropic
uncertainty for members of the class of two-qubit states with maximally mixed
marginals, while accounting for the recent experimental results using maximally
entangled pure states and mixed Bell-diagonal states. An implication of our
uncertainty relation on the security of quantum key generation protocols is
pointed out.
","[{""version"":""v1"",""created"":""Tue, 1 May 2012 11:29:31 GMT""},{""version"":""v2"",""created"":""Mon, 17 Dec 2012 11:32:08 GMT""}]","2013-01-16"
"1205.0139","Marius Buliga","Marius Buliga","$\lambda$-Scale, a lambda calculus for spaces with dilations","massively re-written version, condensed, relative calculus introduced",,,,"cs.LO math.LO math.MG math.RA","http://arxiv.org/licenses/nonexclusive-distrib/1.0/","  $\lambda$-Scale is an enrichment of lambda calculus which is adapted to
emergent algebras. It can be used therefore in metric spaces with dilations.
","[{""version"":""v1"",""created"":""Tue, 1 May 2012 11:30:27 GMT""},{""version"":""v2"",""created"":""Sun, 6 May 2012 12:37:06 GMT""},{""version"":""v3"",""created"":""Wed, 23 May 2012 10:21:56 GMT""}]","2012-05-25"
"1205.0140","Keiko Matsuta","Keiko Matsuta, Poshak Gandhi, Tadayasu Dotani, Takao Nakagawa, Naoki
  Isobe, Yoshihiro Ueda, Kohei Ichikawa, Yuichi Terashima, Shinki Oyabu, Issei
  Yamamura, and {\L}ukasz Stawarz","Infrared and hard X-ray diagnostics of AGN identification from the
  Swift/BAT and AKARI all-sky surveys","17 pages, 5 figures, 5 tables. Accepted for publication in the
  Astrophysical Journal",,"10.1088/0004-637X/753/2/104",,"astro-ph.HE","http://arxiv.org/licenses/nonexclusive-distrib/1.0/","  We combine data from two all-sky surveys in order to study the connection
between the infrared and hard X-ray (>10keV) properties for local active
galactic nuclei (AGN). The Swift/Burst Alert Telescope all-sky survey provides
an unbiased, flux-limited selection of hard X-ray detected AGN.
Cross-correlating the 22-month hard X-ray survey with the AKARI all-sky survey,
we studied 158 AGN detected by the AKARI instruments. We find a strong
correlation for most AGN between the infrared (9, 18, and 90 micron) and hard
X-ray (14-195 keV) luminosities, and quantify the correlation for various
subsamples of AGN. Partial correlation analysis confirms the intrinsic
correlation after removing the redshift contribution. The correlation for radio
galaxies has a slope and normalization identical to that for Seyfert 1s,
implying similar hard X-ray/infrared emission processes in both. In contrast,
Compton-thick sources show a large deficit in the hard X-ray band, because high
gas column densities diminish even their hard X-ray luminosities. We propose
two photometric diagnostics for source classification: one is an X-ray
luminosity vs. infrared color diagram, in which type 1 radio-loud AGN are well
isolated from the others in the sample. The other uses the X-ray vs. infrared
color as a useful redshift-independent indicator for identifying Compton-thick
AGN. Importantly, Compton-thick AGN and starburst galaxies in composite systems
can also be differentiated in this plane based upon their hard X-ray fluxes and
dust temperatures. This diagram may be useful as a new indicator to classify
objects in new and upcoming surveys such as WISE and NuSTAR.
","[{""version"":""v1"",""created"":""Tue, 1 May 2012 11:35:21 GMT""}]","2015-06-04"
"1205.0141","Hiroshi Noguchi","Hiroshi Noguchi","Structure formation in binary mixtures of surfactants: vesicle
  opening-up to bicelles and octopus-like micelles","11 pages, 13 figures","Soft Matter 8, 8926-8935 (2012)","10.1039/C2SM26015H",,"cond-mat.soft","http://arxiv.org/licenses/nonexclusive-distrib/1.0/","  Micelle formation in binary mixtures of surfactants is studied using a
coarse-grained molecular simulation. When a vesicle composed of lipid and
detergent types of molecules is ruptured, a disk-shaped micelle, the bicelle,
is typically formed. It is found that cup-shaped vesicles and bicelles
connected with worm-like micelles are also formed depending on the surfactant
ratio and critical micelle concentration. The obtained octopus shape of
micelles agree with those observed in the cryo-TEM images reported in [S. Jain
and F. S. Bates, Macromol. 37, 1511 (2004).]. Two types of connection
structures between the worm-like micelles and the bicelles are revealed.
","[{""version"":""v1"",""created"":""Tue, 1 May 2012 11:37:36 GMT""}]","2012-08-10"
"1205.0142","Serge Tabachnikov","J. Jeronimo-Castro, G. Ruiz-Hernandez, S. Tabachnikov","The equal tangents property","a typo corrected",,,,"math.MG","http://arxiv.org/licenses/nonexclusive-distrib/1.0/","  Let M be a smooth strictly convex closed surface in space and denote by H the
set of points x in the exterior of M such that all the tangent segments from x
to M have equal lengths. In this note we prove that if H is either a closed
surface containing M or a plane then M is an Euclidean sphere. Moreover, we
shall see that the situation in the Euclidean plane is very different.
","[{""version"":""v1"",""created"":""Tue, 1 May 2012 11:38:04 GMT""},{""version"":""v2"",""created"":""Fri, 4 May 2012 11:36:01 GMT""}]","2012-05-07"
"1205.0143","Ren\'e Hartung","Ren\'e Hartung","A Note on Invariantly Finitely $L$-Presented Groups",,,,,"math.GR","http://arxiv.org/licenses/nonexclusive-distrib/1.0/","  In the first part of this note, we introduce Tietze transformations for
$L$-presentations. These transformations enable us to generalize Tietze's
theorem for finitely presented groups to invariantly finitely $L$-presented
groups. Moreover, they allow us to prove that `being invariantly finitely
$L$-presented' is an abstract property of a group which does not depend on the
generating set.
  In the second part of this note, we consider finitely generated normal
subgroups of finitely presented groups. Benli proved that a finitely generated
normal subgroup of a finitely presented group is invariantly finitely
$L$-presented whenever its quotient is infinite cyclic. We generalize this
result to the case where the finitely presented group splits over its finitely
generated subgroup and to the case where the quotient is abelian with
torsion-free rank at most two.
","[{""version"":""v1"",""created"":""Tue, 1 May 2012 11:49:57 GMT""}]","2012-05-02"
"1205.0144","Michael Dinitz","Eden Chlamtac, Michael Dinitz, Robert Krauthgamer","Everywhere-Sparse Spanners via Dense Subgraphs","39 pages",,,,"cs.DS","http://arxiv.org/licenses/nonexclusive-distrib/1.0/","  The significant progress in constructing graph spanners that are sparse
(small number of edges) or light (low total weight) has skipped spanners that
are everywhere-sparse (small maximum degree). This disparity is in line with
other network design problems, where the maximum-degree objective has been a
notorious technical challenge. Our main result is for the Lowest Degree
2-Spanner (LD2S) problem, where the goal is to compute a 2-spanner of an input
graph so as to minimize the maximum degree. We design a polynomial-time
algorithm achieving approximation factor $\tilde O(\Delta^{3-2\sqrt{2}})
\approx \tilde O(\Delta^{0.172})$, where $\Delta$ is the maximum degree of the
input graph. The previous $\tilde O(\Delta^{1/4})$ -approximation was proved
nearly two decades ago by Kortsarz and Peleg [SODA 1994, SICOMP 1998].
  Our main conceptual contribution is to establish a formal connection between
LD2S and a variant of the Densest k-Subgraph (DkS) problem. Specifically, we
design for both problems strong relaxations based on the Sherali-Adams linear
programming (LP) hierarchy, and show that ""faithful"" randomized rounding of the
DkS-variant can be used to round LD2S solutions. Our notion of faithfulness
intuitively means that all vertices and edges are chosen with probability
proportional to their LP value, but the precise formulation is more subtle.
  Unfortunately, the best algorithms known for DkS use the Lov\'asz-Schrijver
LP hierarchy in a non-faithful way [Bhaskara, Charikar, Chlamtac, Feige, and
Vijayaraghavan, STOC 2010]. Our main technical contribution is to overcome this
shortcoming, while still matching the gap that arises in random graphs by
planting a subgraph with same log-density.
","[{""version"":""v1"",""created"":""Tue, 1 May 2012 11:52:11 GMT""}]","2012-05-02"
"1205.0145","Ulrich Jentschura","U. D. Jentschura","Tachyonic Field Theory and Neutrino Mass Running","13 pages; RevTeX; to appear in Cent. Eur. J. Phys","Cent. Eur. J. Phys. 10 (2012) 749-762","10.2478/s11534-012-0031-1",,"physics.gen-ph hep-ph","http://arxiv.org/licenses/nonexclusive-distrib/1.0/","  In this paper three things are done. (i) We investigate the analogues of
Cerenkov radiation for the decay of a superluminal neutrino and calculate the
Cerenkov angles for the emission of a photon through a W loop, and for a
collinear electron-positron pair, assuming the tachyonic dispersion relation
for the superluminal neutrino. The decay rate of a freely propagating neutrino
is found to depend on the shape of the assumed dispersion relation, and is
found to decrease with decreasing tachyonic mass of the neutrino. (ii) We
discuss a few properties of the tachyonic Dirac equation (symmetries and
plane-wave solutions), which may be relevant for the description of
superluminal neutrinos seen by the OPERA experiment, and discuss the
calculation of the tachyonic propagator. (iii) In the absence of a commonly
accepted tachyonic field theory, and in view of an apparent ""running"" of the
observed neutrino mass with the energy, we write down a model Lagrangian, which
describes a Yukawa-type interaction of a neutrino coupling to a scalar
background field via a scalar-minus-pseudoscalar interaction. This constitutes
an extension of the standard model. If the interaction is strong, then it leads
to a substantial renormalization-group ""running"" of the neutrino mass and could
potentially explain the experimental observations.
","[{""version"":""v1"",""created"":""Tue, 1 May 2012 11:59:00 GMT""}]","2012-08-06"
"1205.0146","Bibhas Majhi Ranjan","Bibhas Ranjan Majhi, Dibakar Roychowdhury","Phase transition and scaling behavior of topological charged black holes
  in Horava-Lifshitz gravity","Minor corrections, refs. added, to appear in Class. Quant. Grav.
  arXiv admin note: text overlap with arXiv:1111.0973 by other authors","Class. Quantum Grav. 29: 245012, 2012","10.1088/0264-9381/29/24/245012",,"gr-qc hep-th","http://creativecommons.org/licenses/by/3.0/","  Gravity can be thought as an emergent phenomenon and it has a nice
""thermodynamic"" structure. In this context, it is then possible to study the
thermodynamics without knowing the details of the underlying microscopic
degrees of freedom. Here, based on the ordinary thermodynamics, we investigate
the phase transition of the static, spherically symmetric charged black hole
solution with arbitrary scalar curvature $2k$ in Ho\v{r}ava-Lifshitz gravity at
the Lifshitz point $z=3$. The analysis is done using the canonical ensemble
frame work; i.e. the charge is kept fixed. We find (a) for both $k=0$ and
$k=1$, there is no phase transition, (b) while $k=-1$ case exhibits the second
order phase transition within the {\it physical region} of the black hole. The
critical point of second order phase transition is obtained by the divergence
of the heat capacity at constant charge. Near the critical point, we find the
various critical exponents. It is also observed that they satisfy the usual
thermodynamic scaling laws.
","[{""version"":""v1"",""created"":""Tue, 1 May 2012 12:00:18 GMT""},{""version"":""v2"",""created"":""Sun, 11 Nov 2012 10:30:48 GMT""}]","2012-11-27"
