"1206.3674","Songhao Li","Marco Gualtieri, Songhao Li","Symplectic groupoids of log symplectic manifolds","45 pages, minor corrections",,,,"math.SG math.AG math.DG","http://arxiv.org/licenses/nonexclusive-distrib/1.0/","  A log symplectic manifold is a Poisson manifold which is generically
nondegenerate. We develop two methods for constructing the symplectic groupoids
of log symplectic manifolds. The first is a blow-up construction, corresponding
to the notion of an elementary modification of a Lie algebroid along a
subalgebroid. The second is a gluing construction, whereby groupoids defined on
the open sets of an appropriate cover may be combined to obtain global
integrations.
  This allows us to classify all Hausdorff symplectic groupoids of log
symplectic manifolds in a combinatorial fashion, in terms of a certain graph of
fundamental groups associated to the manifold. Using the same ideas, and as a
first step, we also construct and classify the groupoids integrating the Lie
algebroid of vector fields tangent to a smooth hypersurface.
","[{""version"":""v1"",""created"":""Sat, 16 Jun 2012 16:24:51 GMT""},{""version"":""v2"",""created"":""Mon, 24 Sep 2012 01:33:33 GMT""}]","2015-03-20"
"1206.3675","Sergio Ulhoa","S. C. Ulhoa and P. M. M. Rocha","Neutron Stars in Teleparallel Gravity","19 pages, 14 figures. arXiv admin note: text overlap with
  arXiv:1206.3317","Brazilian Journal of Physics, June 2013, Volume 43, Issue 3, pp
  162-171","10.1007/s13538-013-0121-6",,"gr-qc","http://arxiv.org/licenses/nonexclusive-distrib/1.0/","  In this paper we deal with neutron stars, which are described by a perfect
fluid model, in the context of the teleparallel equivalent of general
relativity. We use numerical simulations to find the relationship between the
angular momentum of the field and the angular momentum of the source. Such a
relation was established for each stable star reached by the numerical
simulation once the code is fed with an equation of state, the central energy
density and the ratio between polar and equatorial radii. We also find a regime
where linear relation between gravitational angular momentum and moment of
inertia (as well as angular velocity of the fluid) is valid. We give the
spatial distribution of the gravitational energy and show that it has a linear
dependence with the squared angular velocity of the source.
","[{""version"":""v1"",""created"":""Sat, 16 Jun 2012 16:39:47 GMT""},{""version"":""v2"",""created"":""Mon, 4 Mar 2013 14:43:06 GMT""}]","2013-12-06"
"1206.3676","Igor Tanatarov","I.N. Adamenko, K.E. Nemchenko, I.V. Tanatarov, and A.F.G. Wyatt","Pressure of thermal excitations in superfluid helium","14 pages, 4 figures","J. Phys.: Condens. Matter 20, 245103 (2008)","10.1088/0953-8984/20/24/245103",,"cond-mat.other","http://arxiv.org/licenses/nonexclusive-distrib/1.0/","  We find the pressure, due to the thermal excitations of superfluid helium, at
the interface with a solid. The separate contributions of phonons, $R^-$ rotons
and $R^+$ rotons are derived. The pressure due to $R^-$ rotons is shown to be
negative and partially compensates the positive contribution of $R^+$ rotons,
so the total roton pressure is positive but several times less than the
separate $R^-$ and $R^+$ roton contributions. The pressure of the quasiparticle
gas is shown to account for the fountain effect in $HeI I$. An experiment is
proposed to observe the negative pressure due to $R^-$ rotons.
","[{""version"":""v1"",""created"":""Sat, 16 Jun 2012 17:10:45 GMT""}]","2012-06-19"
"1206.3677","Alexander Komech","Alexander Komech","On Dynamical Justification of Quantum Scattering Cross Section","22 pages, 3 figures",,,,"math-ph math.MP math.SP quant-ph","http://arxiv.org/licenses/nonexclusive-distrib/1.0/","  A~dynamical justification of quantum differential cross section in the
context of long time transition to stationary regime for the Schr\""odinger
equation is suggested. The problem has been stated by Reed and Simon. Our
approach is based on spherical incident waves produced by a harmonic source and
the long-range asymptotics for the corresponding spherical limiting amplitudes.
The main results are as follows: i)~the convergence of spherical limiting
amplitudes to the limit as the source increases to infinity, and ii) the
universally recognized formula for the differential cross section corresponding
to the limiting flux. The main technical ingredients are the
Agmon--Jensen--Kato's analytical theory of the Green function, Ikebe's
uniqueness theorem for the Lippmann--Schwinger equation, and some adjustments
of classical asymptotics for the Coulomb potentials.
","[{""version"":""v1"",""created"":""Sat, 16 Jun 2012 17:25:53 GMT""},{""version"":""v2"",""created"":""Sat, 2 Nov 2013 15:17:31 GMT""},{""version"":""v3"",""created"":""Sat, 6 Sep 2014 12:31:15 GMT""}]","2014-09-09"
"1206.3678","Igor Tanatarov","I.N. Adamenko, K.E. Nemchenko, and I.V. Tanatarov","Transmission and reflection of phonons and rotons at the superfluid
  helium-solid interface","12 pages, 9 figures","Phys. Rev. B 77, 174510 (2008) (12 pages)","10.1103/PhysRevB.77.174510",,"cond-mat.other cond-mat.soft","http://arxiv.org/licenses/nonexclusive-distrib/1.0/","  We solve the problem of the transmission and reflection of phonons and rotons
at the interface between superfluid helium and a solid, for all angles of
incidence and in both directions. A consistent solution of the problem is
presented which allows us to rigorously describe the simultaneous creation of
phonons, $R^-$, and $R^+$ rotons in helium by either a phonon from the solid or
a helium quasiparticle incident on the interface. The interaction of all $HeII$
quasiparticles with the interface, and their transmission, reflection and
conversion into each other, is described in a unified way. The angles of
propagation and the probabilities of creating quasiparticles are obtained for
all cases. Andreev reflection of helium phonons and rotons is predicted. The
energy flows through the interface due to phonons, $R^-$, and $R^+$ rotons are
derived. The small contribution of the $R^-$ rotons is due to the small
probability of an $R^-$ roton being created by a phonon in the solid, and vice
versa. This explains the failure to directly create beams of $R^-$ rotons prior
to the experiments of Tucker and Wyatt in 1999. New experiments for creating
$R^-$ rotons, by beams of high-energy phonons (h-phonons), are suggested.
","[{""version"":""v1"",""created"":""Sat, 16 Jun 2012 17:30:02 GMT""}]","2012-06-19"
"1206.3679","G\'abor Cz\'edli","G\'abor Cz\'edli","The asymptotic number of planar, slim, semimodular lattice diagrams","7 pages, 2 figures",,,,"math.RA","http://arxiv.org/licenses/nonexclusive-distrib/1.0/","  A lattice L is slim if it is finite and the set of its join-irreducible
elements contains no three-element antichain. We prove that there exists a
positive constant C such that, up to similarity, the number of planar diagrams
of these lattices of size n is asymptotically C times 2 to the n.
","[{""version"":""v1"",""created"":""Sat, 16 Jun 2012 17:33:55 GMT""}]","2012-06-19"
"1206.3680","Alexander Komech","Alexander Komech","On wave theory of the photoeffect","9 oages, 0 figures",,,,"quant-ph math-ph math.MP math.SP","http://arxiv.org/licenses/nonexclusive-distrib/1.0/","  The photoelectric effect has been discovered by H. Hertz, and studied
experimentally by P. Lenard. First theoretical explanation has been done by A.
Einstein who suggested the corpuscular theory of light introducing the
""photons"" which are particles of the light. In the framework of the
Schr\""odinger theory the effect has been described first by G. Wentzel who
calculated the angulardistribution of the photocurrent. The calculation relies
on the perturbation procedure applied to the coupled Maxwell-Schr\""odinger
equations.
","[{""version"":""v1"",""created"":""Sat, 16 Jun 2012 17:37:57 GMT""}]","2012-06-19"
"1206.3681","Nikolai Sinitsyn","N. A. Sinitsyn, Yan Li, S. A. Crooker, A. Saxena, and D. L. Smith","Role of Nuclear Quadrupole Coupling on Decoherence and Relaxation of
  Central Spins in Quantum Dots","6 pages, 7 figures","Phys. Rev. Lett. 109, 166605 (2012)","10.1103/PhysRevLett.109.166605",,"cond-mat.mes-hall quant-ph","http://arxiv.org/licenses/nonexclusive-distrib/1.0/","  Strain-induced gradients of local electric fields in semiconductor quantum
dots can couple to the quadrupole moments of nuclear spins. We develop a theory
describing the influence of this quadrupolar coupling (QC) on the spin
correlators of electron and hole ""central"" spins localized in such dots. We
show that when the QC strength is comparable to or larger than the hyperfine
coupling strength between nuclei and the central spin, the relaxation rate of
the central spin is strongly enhanced and can be exponential. We demonstrate a
good agreement with recent experiments on spin relaxation in hole-doped
(In,Ga)As self-assembled quantum dots.
","[{""version"":""v1"",""created"":""Sat, 16 Jun 2012 17:47:19 GMT""},{""version"":""v2"",""created"":""Wed, 12 Sep 2012 00:38:51 GMT""}]","2015-06-05"
"1206.3682","Bertfried Fauser","Rafal Ablamowicz and Bertfried Fauser","On parallelizing the Clifford algebra product for CLIFFORD","paper accepted for presentation @ AGACSE12, La Rochelle",,,"TTU Math Department Tech Report No. 2012-2, TNTech Cookeville, TN","math-ph math.MP","http://arxiv.org/licenses/nonexclusive-distrib/1.0/","  We present, as a proof of concept, a way to parallelize the Clifford product
in CL_{p,q} for a diagonalized quadratic form as a new procedure `cmulWpar' in
the \Clifford package for \Maple(R). The procedure uses a new `Threads' module
available under Maple 15 (and later) and a new \Clifford procedure `cmulW'
which computes the Clifford product of any two Grassmann monomials in \CL_{p,q}
with a help of Walsh functions. We benchmark `cmulWpar' and compare it to two
other procedures `cmulNUM' and `cmulRS' from \Clifford. We comment on how to
improve `cmulWpar' by taking advantage of multi-core processors and
multithreading available in modern processors.
","[{""version"":""v1"",""created"":""Sat, 16 Jun 2012 18:05:32 GMT""}]","2012-06-19"
"1206.3683","Bertfried Fauser","Rafal Ablamowicz and Bertfried Fauser","Symbolic Computations in Higher Dimensional Clifford Algebras","paper accepted for presentation @ AGACSE12, La Rochelle",,,"TTU Mathematics Tech Report No. 2012-1, TNTech Cookeville, TN","math-ph math.MP","http://arxiv.org/licenses/nonexclusive-distrib/1.0/","  We present different methods for symbolic computer algebra computations in
higher dimensional (\ge9) Clifford algebras using the \Clifford\ and \Bigebra\
packages for \Maple(R). This is achieved using graded tensor decompositions,
periodicity theorems and matrix spinor representations over Clifford numbers.
We show how to code the graded algebra isomorphisms and the main involutions,
and we provide some benchmarks.
","[{""version"":""v1"",""created"":""Sat, 16 Jun 2012 18:06:04 GMT""}]","2012-06-19"
"1206.3684","S. Twareque Ali","K. Thirulogasanthar and S. Twareque Ali","Regular subspaces of a quaternionic Hilbert space from quaternionic
  Hermite polynomials and associated coherent states",,,"10.1063/1.4774963",,"math-ph math.MP quant-ph","http://arxiv.org/licenses/nonexclusive-distrib/1.0/","  We define quaternionic Hermite polynomials by analogy with two families of
complex Hermite polynomials. As in the complex case, these polynomials
consatitute orthogonal families of vectors in ambient quaternionic
$L^2$-spaces. Using these polynomials, we then define regular and anti-regular
subspaces of these $L^2$-spaces, the associated reproducing kernels and the
ensuing quaternionic coherent states.
","[{""version"":""v1"",""created"":""Sat, 16 Jun 2012 18:07:30 GMT""}]","2015-06-05"
"1206.3685","Joseph A. Wolf","Shaoqiang Deng and Joseph A. Wolf","Locally symmetric homogeneous Finsler spaces","Extends homogeneity criterion (known for Riemannian locally symmetric
  spaces) to Finsler locally symmetric spaces",,,,"math.DG","http://arxiv.org/licenses/nonexclusive-distrib/1.0/","  Let $(M,F)$ be a connected Finsler space and $d$ the distance function of
$(M,F)$. A Clifford translation is an isometry $\rho$ of $(M,F)$ of constant
displacement, in other words such that $d(x,\rho(x))$ is a constant function on
$M$. In this paper we consider a connected simply connected symmetric Finsler
space and a discrete subgroup $\Gamma$ of the full group of isometries. We
prove that the quotient manifold $(M, F)/\Gamma$ is a homogeneous Finsler space
if and only if $\Gamma$ consists of Clifford translations of $(M,F)$. In the
process of the proof of the main theorem, we classify all the Clifford
translations of symmetric Finsler spaces.
","[{""version"":""v1"",""created"":""Sat, 16 Jun 2012 18:26:05 GMT""}]","2012-06-19"
"1206.3686","Dorit Aharonov","Dorit Aharonov and Umesh Vazirani","Is Quantum Mechanics Falsifiable? A computational perspective on the
  foundations of Quantum Mechanics","12 pages, no figures. This paper is to appear in the Philosophy of
  Science anthology ""Computability: Godel, Turing, Church, and beyond"",
  Editors: Copeland, Posy, Shagrir, MIT press, 2012",,,,"quant-ph","http://arxiv.org/licenses/nonexclusive-distrib/1.0/","  Quantum computation teaches us that quantum mechanics exhibits exponential
complexity. We argue that the standard scientific paradigm of ""predict and
verify"" cannot be applied to testing quantum mechanics in this limit of high
complexity. We describe how QM can be tested in this regime by extending the
usual scientific paradigm to include {\it interactive experiments}.
","[{""version"":""v1"",""created"":""Sat, 16 Jun 2012 18:30:07 GMT""}]","2012-06-19"
"1206.3687","David Guery-Odelin","Pierrick Cheiney (LCAR), Charlotte Fabre (LCAR), Fran\c{c}ois
  Vermersch (LCAR), Giovanni Luca Gattobigio (LCAR), Renaud Mathevet (LCAR),
  Thierry Lahaye (LCAR), David Guery-Odelin (LCAR)","Matter wave scattering on an amplitude-modulated optical lattice",,"Physical Review A 87 (2013) 013623","10.1103/PhysRevA.87.013623",,"cond-mat.quant-gas cond-mat.other quant-ph","http://arxiv.org/licenses/nonexclusive-distrib/1.0/","  We experimentally study the scattering of guided matter waves on an
amplitude-modulated optical lattice. We observe different types of
frequency-dependent dips in the asymptotic output density distribution. Their
positions are compared quantitatively with numerical simulations. A
semiclassical model that combines \emph{local} Floquet-Bloch bands analysis and
Landau-Zener transitions provides a simple picture of the observed phenomena in
terms of elementary \emph{Floquet photon} absorption-emission processes and
envelope-induced reflections. Finally, we propose and demonstrate the use of
this technique with a bichromatic modulation to design a tunable sub-recoil
velocity filter. Such a filter can be transposed to all species since it does
not rely on a specific internal level configuration of the atoms.
","[{""version"":""v1"",""created"":""Sat, 16 Jun 2012 18:35:44 GMT""},{""version"":""v2"",""created"":""Sat, 12 Jan 2013 07:51:40 GMT""}]","2013-01-30"
"1206.3688","Stavros Vakeroudis","Stavros Vakeroudis (ULB), Marc Yor (LPMA, IUF)","A scaling proof for Walsh's Brownian motion extended arc-sine law",,,,,"math.PR","http://arxiv.org/licenses/nonexclusive-distrib/1.0/","  We present a new proof of the extended arc-sine law related to Walsh's
Brownian motion, known also as Brownian spider. The main argument mimics the
scaling property used previously, in particular by D. Williams in the
1-dimensional Brownian case, which can be generalized to the multivariate case.
A discussion concerning the time spent positive by a skew Bessel process is
also presented.
","[{""version"":""v1"",""created"":""Sat, 16 Jun 2012 18:36:38 GMT""},{""version"":""v2"",""created"":""Tue, 18 Sep 2012 06:12:46 GMT""},{""version"":""v3"",""created"":""Sat, 29 Dec 2012 15:20:20 GMT""}]","2013-01-01"
"1206.3689","Lorenzo Fatibene","L. Fatibene, M. Francaviglia, S.Garruto","Do Barbero-Immirzi connections exist in different dimensions and
  signatures?","8 pages",,,,"gr-qc","http://arxiv.org/licenses/nonexclusive-distrib/1.0/","  We shall show that no reductive splitting of the spin group exists in
dimension 3 \leq m \leq 20 other than in dimension m = 4. In dimension 4 there
are reductive splittings in any signature. Euclidean and Lorentzian signatures
are reviewed in particular and signature (2, 2) is investigated explicitly in
detail. Reductive splittings allow to define a global SU(2)-connection over
spacetime which encodes in an weird way the holonomy of the standard spin
connection. The standard Barbero-Immirzi (BI) connection used in LQG is then
obtained by restriction to a spacelike slice. This mechanism provides a good
control on globality and covariance of BI connection showing that in dimension
other than 4 one needs to provide some other mechanism to define the analogous
of BI connection and control its globality.
","[{""version"":""v1"",""created"":""Sat, 16 Jun 2012 18:44:21 GMT""}]","2012-06-19"
"1206.3690","Didier Fraix-Burnet","Didier Fraix-Burnet (IPAG), Tanuka Chattopadhyay, Asis Kumar
  Chattopadhyay, Emmanuel Davoust (IRAP), Marc Thuillard","A six-parameter space to describe galaxy diversification","Accepted for publicationin A\&A","Astronomy and Astrophysics (2012) --","10.1051/0004-6361/201218769",,"astro-ph.CO astro-ph.IM","http://arxiv.org/licenses/nonexclusive-distrib/1.0/","  Galaxy diversification proceeds by transforming events like accretion,
interaction or mergers. These explain the formation and evolution of galaxies
that can now be described with many observables. Multivariate analyses are the
obvious tools to tackle the datasets and understand the differences between
different kinds of objects. However, depending on the method used,
redundancies, incompatibilities or subjective choices of the parameters can
void the usefulness of such analyses. The behaviour of the available parameters
should be analysed before an objective reduction of dimensionality and
subsequent clustering analyses can be undertaken, especially in an evolutionary
context. We study a sample of 424 early-type galaxies described by 25
parameters, ten of which are Lick indices, to identify the most structuring
parameters and determine an evolutionary classification of these objects. Four
independent statistical methods are used to investigate the discriminant
properties of the observables and the partitioning of the 424 galaxies:
Principal Component Analysis, K-means cluster analysis, Minimum Contradiction
Analysis and Cladistics. (abridged)
","[{""version"":""v1"",""created"":""Sat, 16 Jun 2012 18:45:37 GMT""},{""version"":""v2"",""created"":""Wed, 4 Jul 2012 09:28:42 GMT""}]","2015-06-05"
"1206.3691","Sylvie Meleard","Pierre Collet (CPHT), Servet Martinez, Sylvie Meleard (CMAP), Jaime
  San Martin","Stochastic models for a chemostat and long time behavior",,,,,"math.PR","http://arxiv.org/licenses/nonexclusive-distrib/1.0/","  We introduce two stochastic chemostat models consisting in a coupled
population-nutrient process reflecting the interaction between the nutrient and
the bacterias in the chemostat with finite volume. The nutrient concentration
evolves continuously but depending on the population size, while the population
size is a birth and death process with coefficients depending on time through
the nutrient concentration. The nutrient is shared by the bacteria and creates
a regulation of the bacterial population size. The latter and the fluctuations
due to the random births and deaths of individuals make the population go
almost surely to extinction. Therefore, we are interested in the long time
behavior of the bacterial population conditioned to the non-extinction. We
prove the global existence of the process and its almost sure extinction. The
existence of quasi-stationary distributions is obtained based on a general
fixed point argument. Moreover, we prove the absolute continuity of the
nutrient distribution when conditioned to a fixed number of individuals and the
smoothness of the corresponding densities.
","[{""version"":""v1"",""created"":""Sat, 16 Jun 2012 18:47:47 GMT""}]","2012-06-19"
"1206.3692","Arnaud Moncet","Arnaud Moncet (IRMAR)","Sur la dynamique des diff\'eomorphismes birationnels des surfaces
  alg\'ebriques r\'eelles : ensemble de Fatou et lieu r\'eel",,,,,"math.DS math.AG","http://arxiv.org/licenses/nonexclusive-distrib/1.0/","  This text deals with birationnal diffeomorphisms of real algebraic surfaces
which have simple real dynamics and rich complex dynamics. We give an example
of such a transformation on P^1xP^1, then we show that this situation is
exceptional and implies strong conditions on both the topology of the real
locus and the real dynamics.
","[{""version"":""v1"",""created"":""Sat, 16 Jun 2012 18:48:57 GMT""}]","2012-06-19"
"1206.3693","Thomas Lim","Idris Kharroubi (CEREMADE), Thomas Lim (ENSIIE), Armand Ngoupeyou
  (LPMA)","Mean-Variance Hedging on uncertain time horizon in a market with a jump",,,,,"math.OC","http://arxiv.org/licenses/nonexclusive-distrib/1.0/","  In this work, we study the problem of mean-variance hedging with a random
horizon T ^ tau, where T is a deterministic constant and is a jump time of the
underlying asset price process. We rst formulate this problem as a stochastic
control problem and relate it to a system of BSDEs with jumps. We then provide
a veri cation theorem which gives the optimal strategy for the mean-variance
hedging using the solution of the previous system of BSDEs. Finally, we prove
that this system of BSDEs admits a solution via a decomposition approach coming
from ltration enlargement theory.
","[{""version"":""v1"",""created"":""Sat, 16 Jun 2012 18:50:37 GMT""},{""version"":""v2"",""created"":""Wed, 24 Jul 2013 08:38:03 GMT""}]","2013-07-25"
"1206.3694","Gisella Croce","Lucio Boccardo, Gisella Croce (LMAH), Luigi Orsina","Existence of solutions for some noncercive elliptic problems involving
  derivatives of nonlinear terms",,,,,"math.AP","http://arxiv.org/licenses/nonexclusive-distrib/1.0/","  We study a nonlinear equation with an elliptic operator having degenerate
coercivity. We prove the existence of a W^{1,1}_0 solution which is
distributional or entropic, according to the growth assumptions on a lower
order term in divergence form.
","[{""version"":""v1"",""created"":""Sat, 16 Jun 2012 18:52:17 GMT""}]","2012-06-19"
"1206.3695","Carlos Palazuelos","Carlos Palazuelos","On the largest Bell violation attainable by a quantum state","23 pages, no figures. Comments are welcome. v2: Modified abstract.
  Refs added. Same results. v3: A constant has been added in Thm 0.1. Minor
  corrections. Same main results",,,,"quant-ph math.FA","http://arxiv.org/licenses/nonexclusive-distrib/1.0/","  We study the projective tensor norm as a measure of the largest Bell
violation of a quantum state. In order to do this, we consider a truncated
version of a well-known SDP relaxation for the quantum value of a two-prover
one-round game, one which has extra restrictions on the dimension of the SDP
solutions. Our main result provides a quite accurate upper bound for the
distance between the classical value of a Bell inequality and the corresponding
value of the relaxation. Along the way, we give a simple proof that the best
complementation constant of $\ell_2^n$ in $\ell_1(\ell_\infty)$ is of order
$\sqrt{\ln n}$. As a direct consequence, we show that we cannot remove a
logarithmic factor when we are computing the largest Bell violation attainable
by the maximally entangled state.
","[{""version"":""v1"",""created"":""Sat, 16 Jun 2012 18:54:08 GMT""},{""version"":""v2"",""created"":""Thu, 21 Jun 2012 19:28:14 GMT""},{""version"":""v3"",""created"":""Fri, 8 Aug 2014 16:28:10 GMT""}]","2014-08-11"
"1206.3696","Gisella Croce","Lucio Boccardo, Gisella Croce (LMAH), Luigi Orsina","A semilinear problem with a W^{1,1}_0 solution",,"Note Accademia Lincei (2012) ?",,,"math.AP","http://arxiv.org/licenses/nonexclusive-distrib/1.0/","  We study a degenerate elliptic equation, proving the existence of a W^{1,1}_0
distributional solution.
","[{""version"":""v1"",""created"":""Sat, 16 Jun 2012 18:55:23 GMT""}]","2012-06-19"
