"1206.3739","Salvador Miracle-Sole","Salvador Miracle-Sole and Jean Ruiz","On the Wulff construction as a problem of equivalence of statistical
  ensembles","11 pages, 1 figure","On Three Levels: Micro, Meso and Macroscopic Approaches in
  Physics, M. Fannes and A. Verbeure Eds., Plenum Press, New York, 1994, pp.
  295--302",,,"cond-mat.stat-mech math-ph math.MP","http://arxiv.org/licenses/nonexclusive-distrib/1.0/","  The statistical mechanics of SOS (solid-on-solid) 1-dimensional models under
the global constraint of having a specified area between the interface and the
horizontal axis, is studied. We prove the existence of the thermodynamic limits
and the equivalence of the corresponding statistical mechanics. This gives a
simple alternative microscopic proof of the validity of the Wulff construction
for such models.
","[{""version"":""v1"",""created"":""Sun, 17 Jun 2012 09:55:15 GMT""}]","2012-06-19"
"1206.3740","Shigenori Matsumoto","Shigenori Matsumoto","Orbit equivalence types of circle diffeomorphisms with a Liouville
  rotation number","14 pages, 2 figures","Nonlinearity 26(2013) 1401-","10.1088/0951-7715/26/5/1401",,"math.DS","http://arxiv.org/licenses/nonexclusive-distrib/1.0/","  This paper is concerned about the orbit equivalence types of $C^\infty$
diffeomorphisms of $S^1$ seen as nonsingular automorphisms of $(S^1,m)$, where
$m$ is the Lebesgue measure. Given any Liouville number $\alpha$, it is shown
that each of the subspace formed by type ${\rm II}_1$, ${\rm II}_\infty$, ${\rm
III}_\lambda$ ($\lambda>1$), ${\rm III}_\infty$ and ${\rm III}_0$
diffeomorphisms are $C^\infty$-dense in the space of the orientation preserving
$C^\infty$ diffeomorphisms with rotation number $\alpha$.
","[{""version"":""v1"",""created"":""Sun, 17 Jun 2012 10:10:04 GMT""}]","2015-06-05"
"1206.3741","Boris Kazarnovskii","Boris Kazarnovskii","On piecewise pluriharmonic functions","Four tipos corrected",,,,"math.CV","http://arxiv.org/licenses/nonexclusive-distrib/1.0/","  We extend some results on piecewise linear functions on $\C^n$ to piecewise
pluriharmonic functions on any complex manifold.
  We construct a ring generated by currents $h$ and $dd^ch$, where $\{h\}$ is a
finite set of piecewise pluriharmonic functions.
  We prove that, with some restrictions on the set $\{h\}$, the map $\{h\mapsto
dd^ch,\ dd^ch\mapsto0\}$ can be continued to the derivation on the ring.
  As a corollary, the current $dd^cg_1\wedge...\wedge dd^cg_k$ depends on the
product of piecewise pluriharmonic functions $g_1,...,g_k$ only.
","[{""version"":""v1"",""created"":""Sun, 17 Jun 2012 10:24:05 GMT""},{""version"":""v2"",""created"":""Mon, 16 Jul 2012 16:03:31 GMT""}]","2012-07-17"
"1206.3742","Hong Duc Nguyen","Gert-Martin Greuel and Nguyen Hong Duc","Right simple singularities in positive characteristic","26 pages, final version","J. Reine Angew. Math. 712 (2016), 81-106",,,"math.AG","http://arxiv.org/licenses/nonexclusive-distrib/1.0/","  We classify isolated hypersurface singularities $f\in K[[x_1,..., x_n]]$, $K$
an algebraically closed field of characteristic $p>0$, which are simple w.r.t.
right equivalence, that is, which have no moduli up to analytic coordinate
change. For $K=\mathbb R$ or $\mathbb C$ this classification was initiated by
Arnol'd, resulting in the famous ADE-series. The classification w.r.t. contact
equivalence for $p>0$ was done by Greuel and Kr\""oning with a result similar to
Arnol'd's. It is surprising that w.r.t. right equivalence and for any given
$p>0$ we have only finitely many simple singularities, i.e. there are only
finitely many $k$ such that $A_k$ and $D_k$ are right simple, all the others
have moduli. A major point of this paper is the generalization of the notion of
modality to the algebraic setting, its behaviour under morphisms, and its
relations to formal deformation theory. As an application we show that the
modality is semicontinuous in any characteristic.
","[{""version"":""v1"",""created"":""Sun, 17 Jun 2012 10:39:09 GMT""},{""version"":""v2"",""created"":""Fri, 3 Aug 2012 11:30:48 GMT""},{""version"":""v3"",""created"":""Fri, 29 Nov 2013 15:38:54 GMT""},{""version"":""v4"",""created"":""Mon, 4 Apr 2016 13:16:41 GMT""}]","2016-04-05"
"1206.3743","Aurelien Manchon","Y. Yuan A. Manchon","Spin Transfer Torque in Fully Insulating Magnetic Tunnel Junctions","7 pages, 6 figures, submitted to Phys. Rev. B",,,,"cond-mat.mes-hall cond-mat.mtrl-sci","http://arxiv.org/licenses/nonexclusive-distrib/1.0/","  Voltage-driven spin transfer torque in a magnetic tunnel junction comprising
magnetic insulating electrodes is studied theoretically. In contrast with the
conventional magnetic tunnel junctions comprising transition metal
ferromagnets, the spin transfer torque presents unconventional bias
dependencies, related to the presence of spin-dependent Fowler-Nordheim
tunneling processes. In particular, we find that (i) the out-of-plane torque
generally dominates the in-plane torque, (ii) out-of-plane torque and in-plane
torque are symmetric and asymmetric at low bias voltage, respectively, and
(iii) both of torques show a dramatic enhancement at large bias voltage.
Materials consideration are discussed and we show that due to the low damping
parameter expected in magnetic insulators a spin transfer torque can be
experimentally observed in such systems.
","[{""version"":""v1"",""created"":""Sun, 17 Jun 2012 11:15:05 GMT""}]","2012-06-19"
"1206.3744","Dragomir Z. Djokovic","Dragomir Z. Djokovic","Generalization of Mirsky's theorem on diagonals and eigenvalues of
  matrices","3 pages","Linear Algebra and its Applications 437 (2012) 2680--2682","10.1016/j.laa.2012.06.040",,"math.RA","http://arxiv.org/licenses/nonexclusive-distrib/1.0/","  Mirsky proved that, for the existence of a complex matrix with given
eigenvalues and diagonal entries, the obvious necessary condition is also
sufficient. We generalize this theorem to matrices over any field and provide a
short proof. Moreover, we show that there is a unique companion-matrix-type
solution for this problem.
","[{""version"":""v1"",""created"":""Sun, 17 Jun 2012 11:44:33 GMT""}]","2013-01-22"
"1206.3745","Chang-Woo Lee","Chang-Woo Lee, Jinhyoung Lee, Hyunchul Nha, and Hyunseok Jeong","Generating a Schr\""odinger-cat-like state via a coherent superposition
  of photonic operations",,"Phys. Rev. A 85, 063815 (2012)","10.1103/PhysRevA.85.063815",,"quant-ph physics.optics","http://arxiv.org/licenses/nonexclusive-distrib/1.0/","  We propose an optical scheme to generate a superposition of coherent states
with enhanced size adopting an interferometric setting at the single-photon
level currently available in the laboratory. Our scheme employs a nondegenerate
optical parametric amplifier together with two beam splitters so that the
detection of single photons at the output conditionally implements the desired
superposition of second-order photonic operations. We analyze our proposed
scheme by considering realistic on-off photodetectors with nonideal efficiency
in heralding the success of conditional events. A high-quality performance of
our scheme is demonstrated in view of various criteria such as quantum
fidelity, mean output energy, and measure of quantum interference.
","[{""version"":""v1"",""created"":""Sun, 17 Jun 2012 11:44:55 GMT""}]","2012-06-19"
"1206.3746","Loet Leydesdorff","Loet Leydesdorff","Science Visualization and Discursive Knowledge","forthcoming: Pp. 167-185 in: Blaise Cronin and Cassidy R. Sugimoto
  (Eds.), Beyond Bibliometrics: Harnessing Multidimensional Indicators of
  Scholarly Impact. Cambridge MA/ London, UK: the MIT Press, 2014",,,,"cs.CY cs.DL","http://arxiv.org/licenses/nonexclusive-distrib/1.0/","  Positional and relational perspectives on network data have led to two
different research traditions in textual analysis and social network analysis,
respectively. Latent Semantic Analysis (LSA) focuses on the latent dimensions
in textual data; social network analysis (SNA) on the observable networks. The
two coupled topographies of information-processing in the network space and
meaning-processing in the vector space operate with different (nonlinear)
dynamics. The historical dynamics of information processing in observable
networks organizes the system into instantiations; the systems dynamics,
however, can be considered as self-organizing in terms of fluxes of
communication along the various dimensions that operate with different codes.
The development over time adds evolutionary differentiation to the historical
integration; a richer structure can process more complexity.
","[{""version"":""v1"",""created"":""Sun, 17 Jun 2012 11:47:31 GMT""},{""version"":""v2"",""created"":""Sun, 24 Jun 2012 09:31:55 GMT""},{""version"":""v3"",""created"":""Tue, 4 Sep 2012 08:55:47 GMT""},{""version"":""v4"",""created"":""Sat, 13 Aug 2016 12:44:44 GMT""}]","2016-08-16"
"1206.3747","Loet Leydesdorff","Loet Leydesdorff","Statistics for the Dynamic Analysis of Scientometric Data: The evolution
  of the sciences in terms of trajectories and regimes","Scientometrics, in press (Nov. 2012)",,,,"cs.DL","http://arxiv.org/licenses/nonexclusive-distrib/1.0/","  The gap in statistics between multi-variate and time-series analysis can be
bridged by using entropy statistics and recent developments in
multi-dimensional scaling. For explaining the evolution of the sciences as
non-linear dynamics, the configurations among variables can be important in
addition to the statistics of individual variables and trend lines. Animations
enable us to combine multiple perspectives (based on configurations of
variables) and to visualize path-dependencies in terms of trajectories and
regimes. Path-dependent transitions and systems formation can be tested using
entropy statistics.
","[{""version"":""v1"",""created"":""Sun, 17 Jun 2012 11:51:13 GMT""},{""version"":""v2"",""created"":""Sat, 10 Nov 2012 14:34:39 GMT""}]","2012-11-13"
"1206.3748","Zihan Xu","Zihan Xu, Guo'an Tai","Electricity generated from Ambient Heat by Pencils","9 pagers, 5 figures",,,,"cond-mat.mtrl-sci cond-mat.mes-hall","http://arxiv.org/licenses/nonexclusive-distrib/1.0/","  The idea of generating electricity from ambient heat has significant meanings
for both science and engineering. Here, we present an interesting idea of using
pencil leads, which are made of graphite and clay, to generate electricity from
the thermal motion of ions in aqueous electrolyte solution at room temperature.
When two pencil leads were placed in parallel in the solutions, output power of
0.655, 1.023, 1.023 and 1.828 nW were generated in 3 M KCl, NaCl, NiCl2 and
CuCl2 solutions, respectively. Besides, we also demonstrate that two pieces of
reduced graphene oxide films and /or few-layer graphene films can generate much
more electricity when dipped into the solutions, while there was no electrodes
contact with the solution. This finding further verified that the electricity
was not resulted from the chemical reaction between the electrodes and the
solutions. The results also demonstrate that ambient thermal energy can be
harvested with low dimensional materials, such as graphene, or with the surface
of solid material without the presence of temperature gradient. However, the
mechanism is still unclear.
","[{""version"":""v1"",""created"":""Sun, 17 Jun 2012 11:51:26 GMT""}]","2012-06-19"
"1206.3749","Anton Khoroshkin","Anton Khoroshkin, Nikita Markarian, Sergey Shadrin","Hypercommutative operad as a homotopy quotient of BV","minor corrections added, to appear in Comm.Math.Phys","Communications in Mathematical Physics 322, 697-729 (2013)","10.1007/s00220-013-1737-7",,"math.QA math-ph math.AG math.MP","http://arxiv.org/licenses/nonexclusive-distrib/1.0/","  We give an explicit formula for a quasi-isomorphism between the operads
Hycomm (the homology of the moduli space of stable genus 0 curves) and
BV/$\Delta$ (the homotopy quotient of Batalin-Vilkovisky operad by the
BV-operator). In other words we derive an equivalence of Hycomm-algebras and
BV-algebras enhanced with a homotopy that trivializes the BV-operator.
  These formulas are given in terms of the Givental graphs, and are proved in
two different ways. One proof uses the Givental group action, and the other
proof goes through a chain of explicit formulas on resolutions of Hycomm and
BV. The second approach gives, in particular, a homological explanation of the
Givental group action on Hycomm-algebras.
","[{""version"":""v1"",""created"":""Sun, 17 Jun 2012 11:59:47 GMT""},{""version"":""v2"",""created"":""Tue, 4 Dec 2012 14:37:42 GMT""}]","2017-02-16"
"1206.3750","Yu-Peng Yang","Yupeng Yang, Guilin Yang, Xiaoyuan Huang, Xuelei Chen, Tan Lu, Hongshi
  Zong","The contribution of ultracompact dark matter minihalos to the isotropic
  radio background","6 pages, 8 figures, Comments Welcome! Some Refs. are added, some
  presentation have been corrected. The conclusions remain unchanged. One
  important reference has been corrected. Some presentations are changed and
  added according to the referee's comments. Accepted for publication in PRD",,"10.1103/PhysRevD.87.083519",,"astro-ph.HE astro-ph.CO","http://arxiv.org/licenses/nonexclusive-distrib/1.0/","  The ultracompact minihalos could be formed during the earlier epoch of the
universe. The dark matter annihilation within them is very strong due to the
steep density profile, $\rho \sim r^{-2.25}$. The high energy electrons and
positrons from the dark matter annihilation can inverse Compton scatter (ICS)
with the background photons, such as CMB photons, to acquire higher energy. On
the other hand, the synchrotron radiation can also be produced when they meet
the magnetic field. In this paper, we study the signals from the UCMHs due to
the dark matter annihilation for the radio, X-ray and $\gamma$-ray band. We
found that for the radio emission the UCMHs can provide one kind of source for
the radio excess observed by ARCADE 2.
  But the X-ray signals due to the ICS effect or the $\gamma$-ray signals
mainly due to the prompt emission from dark matter would exceed the present
observations, such as Fermi, COMPTEL and CHANDRA. We found that the strongest
limits on the fraction of UCMHs come from the X-ray observations and the
constraints from the radio data are the weakest.
","[{""version"":""v1"",""created"":""Sun, 17 Jun 2012 12:40:21 GMT""},{""version"":""v2"",""created"":""Wed, 18 Jul 2012 02:43:39 GMT""},{""version"":""v3"",""created"":""Wed, 22 Aug 2012 00:59:14 GMT""},{""version"":""v4"",""created"":""Fri, 14 Sep 2012 01:13:42 GMT""},{""version"":""v5"",""created"":""Fri, 12 Apr 2013 05:03:15 GMT""}]","2013-05-01"
"1206.3751","Jen-Hsu Chang","Jen-Hsu Chang","On the N-Solitons Solutions in the Novikov-Veselov Equation",,"SIGMA 9 (2013), 006, 13 pages","10.3842/SIGMA.2013.006",,"nlin.SI","http://creativecommons.org/licenses/by-nc-sa/3.0/","  We construct the $N$-solitons solution in the Novikov-Veselov equation from
the extended Moutard transformation and the Pfaffian structure. Also, the
corresponding wave functions are obtained explicitly. As a result, the property
characterizing the $N$-solitons wave function is proved using the Pfaffian
expansion. This property corresponding to the discrete scattering data for
$N$-solitons solution is obtained in [arXiv:0912.2155] from the
$\bar\partial$-dressing method.
","[{""version"":""v1"",""created"":""Sun, 17 Jun 2012 12:46:46 GMT""},{""version"":""v2"",""created"":""Sun, 20 Jan 2013 08:19:37 GMT""}]","2015-03-20"
"1206.3752","Thomas Kalinowski","Thomas Kalinowski, Uwe Leck, Christian Reiher, Ian T. Roberts","Minimizing the regularity of maximal regular antichains of 2- and 3-sets","7 pages, updated references","Australasian Journal of Combinatorics 64 (2016), 277-288",,,"math.CO","http://arxiv.org/licenses/nonexclusive-distrib/1.0/","  Let $n\geqslant 3$ be a natural number. We study the problem to find the
smallest $r$ such that there is a family $\mathcal{A}$ of 2-subsets and
3-subsets of $[n]=\{1,2,...,n\}$ with the following properties: (1)
$\mathcal{A}$ is an antichain, i.e. no member of $\mathcal A$ is a subset of
any other member of $\mathcal A$, (2) $\mathcal A$ is maximal, i.e. for every
$X\in 2^{[n]}\setminus\mathcal A$ there is an $A\in\mathcal A$ with $X\subseteq
A$ or $A\subseteq X$, and (3) $\mathcal A$ is $r$-regular, i.e. every point
$x\in[n]$ is contained in exactly $r$ members of $\mathcal A$. We prove lower
bounds on $r$, and we describe constructions for regular maximal antichains
with small regularity.
","[{""version"":""v1"",""created"":""Sun, 17 Jun 2012 12:49:39 GMT""},{""version"":""v2"",""created"":""Wed, 20 Jun 2012 11:14:44 GMT""},{""version"":""v3"",""created"":""Sun, 2 Mar 2014 21:23:09 GMT""}]","2015-12-15"
"1206.3753","Aavishkar Patel","Aavishkar A. Patel, Nathan Davies, Vadim Cheianov and Vladimir I.
  Fal'ko","Classical and quantum magneto-oscillations of current flow near a p-n
  junction in graphene","5 pages, 4 figures","Phys. Rev. B 86, 081413(R) (2012)","10.1103/PhysRevB.86.081413",,"cond-mat.mes-hall","http://arxiv.org/licenses/nonexclusive-distrib/1.0/","  The proposed semiclassical theory predicts two types of oscillations in the
flow of current injected from a point source near a ballistic p-n junction in
graphene in a strong magnetic field. One originates from the classical effect
of bunching of cyclotron orbits of electrons passing back and forth across the
p-n interface, which displays a pronounced dependence on the commensurability
between the cyclotron radii in the n- and p-regions. The other effect is caused
by the interference of monochromatic electron waves in p-n junctions with equal
carrier densities on the two sides and it consists in magneto-oscillations in
the current transmission through the interface with periodicity similar to
Shubnikov-de Haas oscillations.
","[{""version"":""v1"",""created"":""Sun, 17 Jun 2012 12:51:41 GMT""}]","2012-08-21"
"1206.3754","Andrey Piatnitski","Andrey Piatnitski, Volodymyr Rybalko","On the first eigenpair of singularly perturbed operators with
  oscillating coefficients",,,,,"math.AP","http://arxiv.org/licenses/nonexclusive-distrib/1.0/","  The paper deals with a Dirichlet spectral problem for a singularly perturbed
second order elliptic operator with rapidly oscillating locally periodic
coefficients. We study the limit behaviour of the first eigenpair (ground
state) of this problem. The main tool in deriving the limit (effective) problem
is the viscosity solutions technique for Hamilton-Jacobi equations. The
effective problem need not have a unique solution. We study the non-uniqueness
issue in a particular case of zero potential and construct the higher order
term of the ground state asymptotics.
","[{""version"":""v1"",""created"":""Sun, 17 Jun 2012 13:01:54 GMT""},{""version"":""v2"",""created"":""Thu, 30 Aug 2012 09:52:56 GMT""}]","2012-08-31"
"1206.3755","Jeehye Choi","Jeehye Choi, Jang-Il Sohn, K.-I. Goh, I.-M. Kim","Modeling the mobility with memory","6 pages, 6 figures","EPL 99, 50001 (2012)","10.1209/0295-5075/99/50001",,"physics.soc-ph cond-mat.stat-mech","http://arxiv.org/licenses/nonexclusive-distrib/1.0/","  We study a random walk model in which the jumping probability to a site is
dependent on the number of previous visits to the site, as a model of the
mobility with memory. To this end we introduce two parameters called the memory
parameter alpha and the impulse parameter p. From extensive numerical
simulations, we found that various limited mobility patterns such as
sub-diffusion, trapping, and logarithmic diffusion could be observed. By the
memory, a long-ranged directional anti-correlation kinetically-induces
anomalous sub-diffusive and trapping behaviors, and transition between them.
With random jumps by the impulse parameter, a trapped walker can escape from
the trap very slowly, resulting in an ultraslow logarithmic diffusive behavior.
Our results suggest that the memory of walker's has-beens can be one mechanism
explaining many of empirical characteristics of the mobility of animated
objects.
","[{""version"":""v1"",""created"":""Sun, 17 Jun 2012 13:21:11 GMT""}]","2016-11-11"
"1206.3756","Mahendra Panthee","Felipe Linares, Mahendra Panthee, Jorge Drumond Silva","On the Cauchy problem for a Boussinesq type system","16 pages",,,,"math.AP","http://arxiv.org/licenses/nonexclusive-distrib/1.0/","  We consider the initial value problem (IVP) associated to a Boussinesq type
system. After rewriting the system in an equivalent form of coupled KdV-type
equations, we prove that this is locally well-posed in $(H^s(\R^2))^4$,
$s>3/2$, using sharp smoothing estimates. Consequently we obtain the local
well-posedness result for the original system in $H^s\times \mathcal{V}^{s+1}$
for $s>3/2$ (see below for the definition of $\mathcal{V}^{s}$).
","[{""version"":""v1"",""created"":""Sun, 17 Jun 2012 13:44:42 GMT""}]","2012-06-19"
"1206.3757","Shaoyu Dai","Yifei Pan","On local solvability of nonlinear elliptic partial differential systems
  of principle type: the second order",,,,,"math.AP","http://arxiv.org/licenses/nonexclusive-distrib/1.0/","  We prove results on solvability of nonlinear elliptic partial differential
systems of principle type of second order. They are consequences of existence
of non-radial solutions for nonlinear partial differential systems of Poisson
type. As applications to geometry, we prove the exsitence of local harmonic
maps with given tangent plane at a point between any Riemannan manifolds. More
generally geometric objects defined by Beltrami-Laplace always exist locally.
","[{""version"":""v1"",""created"":""Sun, 17 Jun 2012 13:47:28 GMT""},{""version"":""v2"",""created"":""Wed, 6 Mar 2013 14:18:21 GMT""},{""version"":""v3"",""created"":""Sat, 29 Jun 2013 08:42:54 GMT""}]","2013-07-02"
"1206.3758","A. de Visser","T.V. Bay, T. Naka, Y.K. Huang and A. de Visser","Superconductivity in non-centrosymmetric YPtBi under pressure","5 pages, 5 figures; submitted for publication","Phys. Rev. B 86, 064515 (2012)","10.1103/PhysRevB.86.064515",,"cond-mat.supr-con","http://arxiv.org/licenses/nonexclusive-distrib/1.0/","  We report a high-pressure single-crystal study of the non-centrosymmetric
superconductor YPtBi ($T_c = 0.77$ K). Magnetotransport measurements show a
weak metallic behavior with a carrier concentration $n \simeq 2.2 \times
10^{19}$ cm$^{-3}$. Resistivity measurements up to $p = 2.51$ GPa reveal
superconductivity is promoted by pressure. The reduced upper critical field
$B_{c2}(T)$ curves collapse onto a single curve, with values that exceed the
model values for spin-singlet superconductivity. The $B_{c2}$ data point to an
odd-parity component in the superconducting order parameter, in accordance with
predictions for non-centrosymmetric superconductors.
","[{""version"":""v1"",""created"":""Sun, 17 Jun 2012 13:50:25 GMT""}]","2015-06-05"
"1206.3759","Emil J. Bergholtz","Zhao Liu, Emil J. Bergholtz, Heng Fan, Andreas M. Laeuchli","Fractional Chern Insulators in Topological Flat bands with Higher Chern
  Number","5+4 pages. Final version. Main text as published, some extra data in
  the supplementary material","Physical Review Letters 109, 186805 (2012)","10.1103/PhysRevLett.109.186805",,"cond-mat.str-el hep-th math-ph math.MP quant-ph","http://arxiv.org/licenses/nonexclusive-distrib/1.0/","  Lattice models forming bands with higher Chern number offer an intriguing
possibility for new phases of matter with no analogue in continuum Landau
levels. Here, we establish the existence of a number of new bulk insulating
states at fractional filling in flat bands with Chern number $C=N>1$, forming
in a recently proposed pyrochlore model with strong spin-orbit coupling. In
particular, we find compelling evidence for a series of stable states at
$\nu=1/(2N+1)$ for fermions as well as bosonic states at $\nu=1/(N+1)$. By
examining the topological ground state degeneracies and the excitation
structure as well as the entanglement spectrum, we conclude that these states
are Abelian. We also explicitly demonstrate that these states are nevertheless
qualitatively different from conventional quantum Hall (multilayer) states due
to the novel properties of the underlying band structure.
","[{""version"":""v1"",""created"":""Sun, 17 Jun 2012 14:39:09 GMT""},{""version"":""v2"",""created"":""Sun, 29 Jul 2012 20:15:40 GMT""},{""version"":""v3"",""created"":""Sat, 3 Nov 2012 13:52:15 GMT""}]","2012-11-06"
"1206.3760","Diptimoy Ghosh","Alakabha Datta, Murugeswaran Duraisamy, Diptimoy Ghosh","Diagnosing New Physics in $b \to c \, \tau \, \nu_\tau$ decays in the
  light of the recent BaBar result","Some typos corrected (not updated in journal)","PhysRevD.86.034027(2012)","10.1103/PhysRevD.86.034027",,"hep-ph","http://arxiv.org/licenses/nonexclusive-distrib/1.0/","  The BaBar Collaboration has recently reported the measurement of the ratio of
the branching fractions of $\bar{B} \to D(D^{*}) \tau^{-} \bar{\nu_\tau}$ to
$\bar{B} \to D(D^{*}) \ell^{-} \bar{\nu_\ell}$ which deviates from the Standard
Model prediction by 2$\sigma$(2.7$\sigma$). This deviation goes up to
3.4$\sigma$ level when the two measurements in the $D$ and $D^*$ modes are
taken together and could indicate new physics. Using an effective Lagrangian
for the new physics we study the implication of these results and calculate
other observables that can shed light on the nature of the new physics. We show
that the measurements of the forward-backward asymmetries and the $\tau$ and
$D^*$ polarization fractions can distinguish among the various couplings of the
new physics operators.
","[{""version"":""v1"",""created"":""Sun, 17 Jun 2012 15:12:39 GMT""},{""version"":""v2"",""created"":""Sun, 22 Jul 2012 15:48:18 GMT""},{""version"":""v3"",""created"":""Mon, 22 Oct 2012 06:53:00 GMT""},{""version"":""v4"",""created"":""Mon, 12 Mar 2018 16:48:54 GMT""}]","2018-03-13"
