"1206.3697","Paul Smolen","Paul Smolen, Douglas A. Baxter, John H. Byrne","Molecular Constraints on Synaptic Tagging and Maintenance of Long-Term
  Potentiation: A Predictive Model","v3. Minor text edits to reflect published version","PLoS Comput Biol 8(8): e1002620, 2012","10.1371/journal.pcbi.1002620",,"q-bio.NC q-bio.MN q-bio.SC","http://arxiv.org/licenses/nonexclusive-distrib/1.0/","  Protein synthesis-dependent, late long-term potentiation (LTP) and depression
(LTD) at glutamatergic hippocampal synapses are well characterized examples of
long-term synaptic plasticity. Persistent increased activity of the enzyme
protein kinase M (PKM) is thought essential for maintaining LTP. Additional
spatial and temporal features that govern LTP and LTD induction are embodied in
the synaptic tagging and capture (STC) and cross capture hypotheses. Only
synapses that have been ""tagged"" by an stimulus sufficient for LTP and learning
can ""capture"" PKM. A model was developed to simulate the dynamics of key
molecules required for LTP and LTD. The model concisely represents
relationships between tagging, capture, LTD, and LTP maintenance. The model
successfully simulated LTP maintained by persistent synaptic PKM, STC, LTD, and
cross capture, and makes testable predictions concerning the dynamics of PKM.
The maintenance of LTP, and consequently of at least some forms of long-term
memory, is predicted to require continual positive feedback in which PKM
enhances its own synthesis only at potentiated synapses. This feedback
underlies bistability in the activity of PKM. Second, cross capture requires
the induction of LTD to induce dendritic PKM synthesis, although this may
require tagging of a nearby synapse for LTP. The model also simulates the
effects of PKM inhibition, and makes additional predictions for the dynamics of
CaM kinases. Experiments testing the above predictions would significantly
advance the understanding of memory maintenance.
","[{""version"":""v1"",""created"":""Sat, 16 Jun 2012 19:11:27 GMT""},{""version"":""v2"",""created"":""Mon, 25 Jun 2012 23:36:22 GMT""},{""version"":""v3"",""created"":""Fri, 3 Aug 2012 20:13:55 GMT""}]","2015-03-13"
"1206.3698","Ivan Favero","L. Ding, P. Senellart, A. Lemaitre, S. Ducci, G. Leo and I. Favero","Miniature GaAs disk resonators probed by a looped fiber taper for
  optomechanics applications",,"Proc. SPIE 7712, 771211 (2010)","10.1117/12.853985",,"physics.optics","http://arxiv.org/licenses/nonexclusive-distrib/1.0/","  GaAs disk resonators (typical disk size 5 \mum * 200 nm in our work) are good
candidates for boosting optomechanical coupling thanks to their ability to
confine both optical and mechanical energy in a sub-micron interaction volume.
We present results of optomechanical characterization of GaAs disks by
near-field optical coupling from a tapered silica nano-waveguide. Whispering
gallery modes with optical Q factor up to a few 10^5 are observed. Critical
coupling, optical resonance doublet splitting and mode identification are
discussed. We eventually show an optomechanical phenomenon of optical force
attraction of the silica taper to the disk. This phenomenon shows that
mechanical and optical degrees of freedom naturally couple at the
micro-nanoscale.
","[{""version"":""v1"",""created"":""Sat, 16 Jun 2012 19:12:52 GMT""}]","2012-06-19"
"1206.3699","Stefan Karpitschka","Stefan Karpitschka and Hans Riegler","Non-coalescence of sessile drops from different but miscible liquids:
  Hydrodynamic analysis of the twin drop contour as self stabilizing, traveling
  wave","5 pages, 5 figures","Phys. Rev. Lett. 109, 066103 (2012)","10.1103/PhysRevLett.109.066103",,"physics.flu-dyn","http://arxiv.org/licenses/nonexclusive-distrib/1.0/","  Capillarity always favors drop fusion. Nevertheless sessile drops from
different but completely miscible liquids often do not fuse instantaneously
upon contact. Rather, intermediate non-coalescence is observed. Two separate
drop bodies, connected by a thin liquid neck move over the substrate. Supported
by new experimental data a thin film hydrodynamic analysis of this state is
presented. Presumably advective and diffusive volume fluxes in the neck region
establish a localized and temporarily stable surface tension gradient. This
induces a local surface (Marangoni) flow that stabilizes a traveling wave i.e.,
the observed moving twin drop configuration. The theoretical predictions are in
excellent agreement with the experimental findings.
","[{""version"":""v1"",""created"":""Sat, 16 Jun 2012 19:13:24 GMT""}]","2016-03-25"
"1206.3700","Juergen Reuter","W. Kilian, T. Ohl, J. Reuter, C. Speckner","QCD in the Color-Flow Representation","37 pages","JHEP 1210 (2012) 022","10.1007/JHEP10(2012)022","DESY-12-103; SI-HEP-2012-11","hep-ph hep-th","http://arxiv.org/licenses/nonexclusive-distrib/1.0/","  For many practical purposes, it is convenient to formulate unbroken
non-abelian gauge theories like QCD in a color-flow basis. We present a new
derivation of SU(N) interactions in the color-flow basis by extending the gauge
group to U(N)xU(1)' in such a way that the two U(1) factors cancel each other.
We use the quantum action principles to show the equivalence to the usual basis
to all orders in perturbation theory. We extend the known Feynman rules to
exotic color representations (e.g. sextets) and interactions (e.g.
$\epsilon_{ijk}$). We discuss practical applications as they occur in automatic
computation programs.
","[{""version"":""v1"",""created"":""Sat, 16 Jun 2012 19:28:51 GMT""},{""version"":""v2"",""created"":""Tue, 9 Oct 2012 14:21:53 GMT""}]","2012-10-10"
"1206.3701","Ramadevi Pichai","Siddharth Dwivedi and P. Ramadevi","Partial resolution of complex cones over Fano ${\cal{B}}$","22 pages, 8 figures","Adv.High Energy Phys. 2013 (2013) 295842","10.1155/2013/295842",,"hep-th","http://arxiv.org/licenses/nonexclusive-distrib/1.0/","  In our recent paper arXiv:1108.2387, we systematized inverse algorithm to
obtain quiver gauge theory living on the M2-branes probing the singularities of
special kind of Calabi-Yau four-folds which were complex cones over toric Fano
$\mathbb{P}^3$, ${\cal{B}}_1$, ${\cal{B}}_2$, ${\cal{B}}_3$. These quiver gauge
theories cannot be given a dimer tiling presentation. We use the method of
partial resolution to show that the toric data of $\mathbb{C}^4$ and Fano
$\mathbb{P}^3$ can be embedded inside the toric data of Fano ${\cal{B}}$
theories. This method indirectly justfies that the two node quiver Chern-Simons
theories corresponding to $\mathbb{C}^4$, Fano $\mathbb{P}^3$ and their
orbifolds can be obtained by higgsing matter fields of the three node parent
quiver corresponding to Fano ${\cal{B}}_1$, ${\cal{B}}_2$, ${\cal{B}}_3$,
${\cal{B}}_4$ three-folds.
","[{""version"":""v1"",""created"":""Sat, 16 Jun 2012 19:47:46 GMT""},{""version"":""v2"",""created"":""Wed, 23 Oct 2013 05:53:45 GMT""}]","2013-10-24"
"1206.3702","Khanh Tran Vu","Tran Vu Khanh","Supnorm and f-Holder estimates for di-bar on convex domains of general
  type in C^2","convex domain of finite/infinite type","Journal of Mathematical Analysis and Applications 403 (2013),
  522--531",,,"math.CV","http://arxiv.org/licenses/nonexclusive-distrib/1.0/","  In this paper, we study supnorm and modified H\""{o}lder estimates for the
integral solution of the di-bar-equation on a class of convex domains of
general type in $\C^2$ that includes many infinite type examples.
","[{""version"":""v1"",""created"":""Sat, 16 Jun 2012 20:08:29 GMT""}]","2017-04-17"
"1206.3703","Joel David Hamkins","Arthur W. Apter, James Cummings, Joel David Hamkins","Singular cardinals and strong extenders","8 pages",,,,"math.LO","http://arxiv.org/licenses/nonexclusive-distrib/1.0/","  We investigate the circumstances under which there exist a singular cardinal
$\mu$ and a short $(\kappa, \mu)$-extender $E$ witnessing ""$\kappa$ is
$\mu$-strong"", such that $\mu$ is singular in $\Ult(V, E)$.
","[{""version"":""v1"",""created"":""Sat, 16 Jun 2012 20:37:14 GMT""}]","2012-06-19"
"1206.3704","Hugo Bacard","Hugo V. Bacard","Lax Diagrams and Enrichment","131 pages; comments are welcome",,,,"math.CT math.AT","http://arxiv.org/licenses/nonexclusive-distrib/1.0/","  We introduce a new type of weakly enriched categories over a given symmetric
monoidal model category M; these are called Co-Segal categories. Their
definition derives from the philosophy of classical (enriched) Segal
categories. We study their homotopy theory by giving a model structure on them.
One of the motivations of introducing these structure was to have an
alternative definition of higher linear categories following Segal-like
methods.
","[{""version"":""v1"",""created"":""Sat, 16 Jun 2012 20:57:08 GMT""}]","2012-06-19"
"1206.3705","Tamas Vertse Prof. Dr.","J. Darai, A. R\'acz, P. Salamon, and R. G. Lovas","Antibound poles in cutoff Woods-Saxon and in Salamon-Vertse potentials",,,"10.1103/PhysRevC.86.014314",,"nucl-th","http://arxiv.org/licenses/nonexclusive-distrib/1.0/","  The motion of l=0 antibound poles of the S-matrix with varying potential
strength is calculated in a cutoff Woods-Saxon (WS) potential and in the
Salamon-Vertse (SV) potential, which goes to zero smoothly at a finite
distance. The pole position of the antibound states as well as of the
resonances depend on the cutoff radius, especially for higher node numbers. The
starting points (at potential zero) of the pole trajectories correlate well
with the range of the potential. The normalized antibound radial wave functions
on the imaginary k-axis below and above the coalescence point have been found
to be real and imaginary, respectively.
","[{""version"":""v1"",""created"":""Sat, 16 Jun 2012 21:00:14 GMT""}]","2015-06-05"
"1206.3706","Lingyun Qiu","Maarten V. de Hoop and Lingyun Qiu and Otmar Scherzer","A convergence analysis of a multi-level projected steepest descent
  iteration for nonlinear inverse problems in Banach spaces subject to
  stability constraints",,,,,"math.NA math.FA","http://arxiv.org/licenses/nonexclusive-distrib/1.0/","  We consider nonlinear inverse problems described by operator equations in
Banach spaces. Assuming conditional stability of the inverse problem, that is,
assuming that stability holds on a closed, convex subset of the domain of the
operator, we introduce a novel nonlinear projected steepest descent iteration
and analyze its convergence to an approximate solution given limited accuracy
data. We proceed with developing a multi-level algorithm based on a nested
family of closed, convex subsets on which stability holds and the stability
constants are ordered. Growth of the stability constants is coupled to the
increase in accuracy of approximation between neighboring levels to ensure that
the algorithm can continue from level to level until the iterate satisfies a
desired discrepancy criterion, after a finite number of steps.
","[{""version"":""v1"",""created"":""Sat, 16 Jun 2012 21:06:27 GMT""}]","2012-06-19"
"1206.3707","Leonid Polterovich","Leonid Polterovich","Symplectic geometry of quantum noise","Revised version, 57 pages, 3 figures. Incorporates arXiv:1203.2348","Communications in Mathematical Physics 327 (2014), 481-519","10.1007/s00220-014-1937-9",,"math.SG math-ph math.MP quant-ph","http://arxiv.org/licenses/nonexclusive-distrib/1.0/","  We discuss a quantum counterpart, in the sense of the Berezin-Toeplitz
quantization, of certain constraints on Poisson brackets coming from ""hard""
symplectic geometry. It turns out that they can be interpreted in terms of the
quantum noise of observables and their joint measurements in operational
quantum mechanics. Our findings include various geometric mechanisms of quantum
noise production and a noise-localization uncertainty relation. The methods
involve Floer theory and Poisson bracket invariants originated in function
theory on symplectic manifolds.
","[{""version"":""v1"",""created"":""Sat, 16 Jun 2012 21:40:40 GMT""},{""version"":""v2"",""created"":""Sat, 30 Apr 2016 19:58:09 GMT""}]","2016-05-11"
"1206.3708","Jean-Pierre Magnot","Jean-Pierre Magnot","Infinite dimensional integrals beyond Monte Carlo methods: yet another
  approach to normalized infinite dimensional integrals","Submitted as a communication in the ICMSQUARE conference, september
  2012",,"10.1088/1742-6596/410/1/012003",,"math-ph math.MP math.PR","http://arxiv.org/licenses/nonexclusive-distrib/1.0/","  An approach to (normalized) infinite dimensional integrals, including
normalized oscillatory integrals, through a sequence of evaluations in the
spirit of the Monte Carlo method for probability measures is proposed. in this
approach the normalization through the partition function is included in the
definition. For suitable sequences of evaluations, the (""classical"")
expectation values of cylinder functions are recovered
","[{""version"":""v1"",""created"":""Sat, 16 Jun 2012 21:50:26 GMT""}]","2015-06-05"
"1206.3709","Ana Sofia Nunes","P. Bordalo, A. S. Nunes, C. Pires, C. Quintans and S. Ramos","Control Systems: an Application to a High Energy Physics Experiment
  (COMPASS)","6 pages, 3 figures, to appear on the proceedings of the 2012 IEEE
  International Conference on Automation, Quality and Testing, Robotics (AQTR
  2012), Cluj-Napoca, May 24-27, 2012","Proceedings of the 2012 IEEE International Conference on
  Automation, Quality and Testing, Robotics (AQTR 2012), p. 20-25","10.1109/AQTR.2012.6237669",,"cs.SY hep-ex physics.ins-det","http://arxiv.org/licenses/nonexclusive-distrib/1.0/","  The Detector Control System (DCS) of the COMPASS experiment at CERN is
presented. The experiment has a high level of complexity and flexibility and a
long time of operation, that constitute a challenge for its full monitorisation
and control. A strategy to use a limited number of standardised,
cost-effective, industrial solutions of hardware and software was pursued. When
such solutions were not available or could not be used, customised solutions
were developed.
","[{""version"":""v1"",""created"":""Sat, 16 Jun 2012 21:57:07 GMT""}]","2013-07-05"
"1206.3710","Tuomas Lunttila","T. Lunttila and M. Juvela","Radiative transfer on hierarchial grids","Accepted to A&A; 13 pages, 8 figures; (v2: minor typos corrected)",,"10.1051/0004-6361/201219220",,"astro-ph.IM","http://arxiv.org/licenses/nonexclusive-distrib/1.0/","  We present new methods for radiative transfer on hierarchial grids. We
develop a new method for calculating the scattered flux that employs the grid
structure to speed up the computation. We describe a novel subiteration
algorithm that can be used to accelerate calculations with strong dust
temperature self-coupling. We compute two test models, a molecular cloud and a
circumstellar disc, and compare the accuracy and speed of the new algorithms
against existing methods. An adaptive model of the molecular cloud with less
than 8 % of the cells in the uniform grid produced results in good agreement
with the full resolution model. The relative RMS error of the surface
brightness <4 % at all wavelengths, and in regions of high column density the
relative RMS error was only 10^{-4}. Computation with the adaptive model was
faster by a factor of ~5. The new method for calculating the scattered flux is
faster by a factor of ~4 in large models with a deep hierarchy structure, when
images of the scattered light are computed towards several observing
directions. The efficiency of the subiteration algorithm is highly dependent on
the details of the model. In the circumstellar disc test the speed-up was a
factor of two, but much larger gains are possible. The algorithm is expected to
be most beneficial in models where a large number of small, dense regions are
embedded in an environment with a lower mean density.
","[{""version"":""v1"",""created"":""Sat, 16 Jun 2012 22:30:35 GMT""},{""version"":""v2"",""created"":""Thu, 26 Jul 2012 09:47:30 GMT""}]","2015-06-05"
"1206.3711","Paul Krapivsky","Yoshiaki Itoh, P. L. Krapivsky","Continuum Cascade Model of Directed Random Graphs: Traveling Wave
  Analysis","12 pages, 2 figures; figure added","J. Phys. A 45, 455002 (2012)",,,"math.PR cond-mat.stat-mech q-bio.PE","http://arxiv.org/licenses/nonexclusive-distrib/1.0/","  We study a class of directed random graphs. In these graphs, the interval
[0,x] is the vertex set, and from each y\in [0,x], directed links are drawn to
points in the interval (y,x] which are chosen uniformly with density one. We
analyze the length of the longest directed path starting from the origin. In
the large x limit, we employ traveling wave techniques to extract the
asymptotic behavior of this quantity. We also study the size of a cascade tree
composed of vertices which can be reached via directed paths starting at the
origin.
","[{""version"":""v1"",""created"":""Sat, 16 Jun 2012 22:46:00 GMT""},{""version"":""v2"",""created"":""Tue, 2 Oct 2012 10:43:57 GMT""}]","2012-10-31"
"1206.3712","Kazuhiko Kurano","Kazuhiko Kurano","The divisor class groups and the graded canonical modules of
  multi-section rings","15 pages","Nagoya Math. J. 212 (2013), 139-157","10.1215/00277630-2366323",,"math.AC math.AG","http://arxiv.org/licenses/nonexclusive-distrib/1.0/","  We shall describe the divisor class group and the graded canonical module of
the multi-section ring for a normal projective variety X and Weil divisors
D_1,..., D_s on X under a mild condition. In the proof, we use the theory of
Krull domain and the equivariant twisted inverse functor due to Hashimoto.
","[{""version"":""v1"",""created"":""Sat, 16 Jun 2012 22:47:53 GMT""}]","2015-01-14"
"1206.3713","Jean Honorio","Jean Honorio and Luis Ortiz","Learning the Structure and Parameters of Large-Population Graphical
  Games from Behavioral Data","Journal of Machine Learning Research. (accepted, pending
  publication.) Last conference version: submitted March 30, 2012 to UAI 2012.
  First conference version: entitled, Learning Influence Games, initially
  submitted on June 1, 2010 to NIPS 2010","Journal of Machine Learning Research (JMLR), 16(Jul):1249--1274,
  2015",,,"cs.LG cs.GT stat.ML","http://arxiv.org/licenses/nonexclusive-distrib/1.0/","  We consider learning, from strictly behavioral data, the structure and
parameters of linear influence games (LIGs), a class of parametric graphical
games introduced by Irfan and Ortiz (2014). LIGs facilitate causal strategic
inference (CSI): Making inferences from causal interventions on stable behavior
in strategic settings. Applications include the identification of the most
influential individuals in large (social) networks. Such tasks can also support
policy-making analysis. Motivated by the computational work on LIGs, we cast
the learning problem as maximum-likelihood estimation (MLE) of a generative
model defined by pure-strategy Nash equilibria (PSNE). Our simple formulation
uncovers the fundamental interplay between goodness-of-fit and model
complexity: good models capture equilibrium behavior within the data while
controlling the true number of equilibria, including those unobserved. We
provide a generalization bound establishing the sample complexity for MLE in
our framework. We propose several algorithms including convex loss minimization
(CLM) and sigmoidal approximations. We prove that the number of exact PSNE in
LIGs is small, with high probability; thus, CLM is sound. We illustrate our
approach on synthetic data and real-world U.S. congressional voting records. We
briefly discuss our learning framework's generality and potential applicability
to general graphical games.
","[{""version"":""v1"",""created"":""Sat, 16 Jun 2012 23:20:09 GMT""},{""version"":""v2"",""created"":""Fri, 25 Oct 2013 18:55:36 GMT""},{""version"":""v3"",""created"":""Fri, 24 Oct 2014 20:47:46 GMT""},{""version"":""v4"",""created"":""Mon, 4 May 2015 02:04:26 GMT""}]","2016-02-22"
"1206.3714","Santosh Kumar Divvala","Santosh K. Divvala and Alexei A. Efros and Martial Hebert","How important are Deformable Parts in the Deformable Parts Model?",,,,,"cs.CV cs.AI cs.LG","http://arxiv.org/licenses/nonexclusive-distrib/1.0/","  The main stated contribution of the Deformable Parts Model (DPM) detector of
Felzenszwalb et al. (over the Histogram-of-Oriented-Gradients approach of Dalal
and Triggs) is the use of deformable parts. A secondary contribution is the
latent discriminative learning. Tertiary is the use of multiple components. A
common belief in the vision community (including ours, before this study) is
that their ordering of contributions reflects the performance of detector in
practice. However, what we have experimentally found is that the ordering of
importance might actually be the reverse. First, we show that by increasing the
number of components, and switching the initialization step from their
aspect-ratio, left-right flipping heuristics to appearance-based clustering,
considerable improvement in performance is obtained. But more intriguingly, we
show that with these new components, the part deformations can now be
completely switched off, yet obtaining results that are almost on par with the
original DPM detector. Finally, we also show initial results for using multiple
components on a different problem -- scene classification, suggesting that this
idea might have wider applications in addition to object detection.
","[{""version"":""v1"",""created"":""Sat, 16 Jun 2012 23:26:38 GMT""}]","2012-06-19"
"1206.3715","Mohammad Sadek","Mohammad Sadek","On elliptic curves whose conductor is a product of two prime powers","18 pages","Math. Comp. 83 (2014), 447-460",,,"math.NT","http://arxiv.org/licenses/nonexclusive-distrib/1.0/","  We find all elliptic curves defined over $\mathbb{Q}$ that have a rational
point of order $N$, $N\ge 4$, and whose conductor is of the form $p^aq^b$,
where p, q are two distinct primes, a, b are two positive integers. In
particular, we prove that Szpiro's conjecture holds for these elliptic curves.
","[{""version"":""v1"",""created"":""Sat, 16 Jun 2012 23:53:35 GMT""},{""version"":""v2"",""created"":""Sun, 14 Oct 2012 18:57:51 GMT""}]","2013-10-30"
"1206.3716","Yang Jiao","Salvatore Torquato and Yang Jiao","Organizing Principles for Dense Packings of Nonspherical Hard Particles:
  Not All Shapes Are Created Equal","37 pages, 14 figures","Physical Review E 86, 011102 (2012)","10.1103/PhysRevE.86.011102",,"cond-mat.stat-mech cond-mat.mtrl-sci","http://arxiv.org/licenses/nonexclusive-distrib/1.0/","  We have recently devised organizing principles to obtain maximally dense
packings of the Platonic and Archimedean solids, and certain smoothly-shaped
convex nonspherical particles [Torquato and Jiao, Phys. Rev. E 81, 041310
(2010)]. Here we generalize them in order to guide one to ascertain the densest
packings of other convex nonspherical particles as well as concave shapes. Our
generalized organizing principles are explicitly stated as four distinct
propositions. We apply and test all of these organizing principles to the most
comprehensive set of both convex and concave particle shapes to date, including
Catalan solids, prisms, antiprisms, cylinders, dimers of spheres and various
concave polyhedra. We demonstrate that all of the densest known packings
associated with this wide spectrum of nonspherical particles are consistent
with our propositions. Among other applications, our general organizing
principles enable us to construct analytically the densest known packings of
certain convex nonspherical particles, including spherocylinders, ""lens-shaped""
particles, square pyramids and rhombic pyramids. Moreover, we show how to apply
these principles to infer the high-density equilibrium crystalline phases of
hard convex and concave particles. We also discuss the unique packing
attributes of maximally random jammed packings of nonspherical particles.
","[{""version"":""v1"",""created"":""Sun, 17 Jun 2012 02:20:53 GMT""},{""version"":""v2"",""created"":""Tue, 24 Jul 2012 20:06:01 GMT""}]","2012-07-26"
"1206.3717","Qingji Zheng","Qingji Zheng and Xinwen Zhang","Multiparty Cloud Computation",,,,,"cs.CR","http://arxiv.org/licenses/nonexclusive-distrib/1.0/","  With the increasing popularity of the cloud, clients oursource their data to
clouds in order to take advantage of unlimited virtualized storage space and
the low management cost. Such trend prompts the privately oursourcing
computation, called \emph{multiparty cloud computation} (\MCC): Given $k$
clients storing their data in the cloud, how can they perform the joint
functionality by contributing their private data as inputs, and making use of
cloud's powerful computation capability. Namely, the clients wish to oursource
computation to the cloud together with their private data stored in the cloud,
which naturally happens when the computation is involved with large datasets,
e.g., to analyze malicious URLs. We note that the \MCC\ problem is different
from widely considered concepts, e.g., secure multiparty computation and
multiparty computation with server aid.
  To address this problem, we introduce the notion of \emph{homomorphic
threshold proxy re-encryption} schemes, which are encryption schemes that enjoy
three promising properties: proxy re-encryption -- transforming encrypted data
of one user to encrypted data of target user, threshold decryption --
decrypting encrypted data by combining secret key shares obtained by a set of
users, and homomorphic computation -- evaluating functions on the encrypted
data. To demonstrate the feasibility of the proposed approach, we present an
encryption scheme which allows anyone to compute arbitrary many additions and
at most one multiplications.
","[{""version"":""v1"",""created"":""Sun, 17 Jun 2012 02:33:22 GMT""}]","2012-06-19"
