"1206.3718","Thomas Rothvoss","Thomas Rothvoss","A simpler proof for O(congestion + dilation) packet routing",,,,,"cs.DS cs.DM math.CO","http://arxiv.org/licenses/nonexclusive-distrib/1.0/","  In the store-and-forward routing problem, packets have to be routed along
given paths such that the arrival time of the latest packet is minimized. A
groundbreaking result of Leighton, Maggs and Rao says that this can always be
done in time O(congestion + dilation), where the congestion is the maximum
number of paths using an edge and the dilation is the maximum length of a path.
However, the analysis is quite arcane and complicated and works by iteratively
improving an infeasible schedule. Here, we provide a more accessible analysis
which is based on conditional expectations. Like [LMR94], our easier analysis
also guarantees that constant size edge buffers suffice.
  Moreover, it was an open problem stated e.g. by Wiese, whether there is any
instance where all schedules need at least (1 + epsilon)*(congestion +
dilation) steps, for a constant epsilon > 0. We answer this question
affirmatively by making use of a probabilistic construction.
","[{""version"":""v1"",""created"":""Sun, 17 Jun 2012 03:03:57 GMT""},{""version"":""v2"",""created"":""Mon, 2 Jul 2012 22:25:56 GMT""}]","2012-07-04"
"1206.3719","Mahdi Zamani","Mahdi Zamani and Amir K. Khandani","Broadcast Approaches to the Diamond Channel","30 pages, 6 figures, Submitted to Trans. on Inform. Theory",,,,"cs.IT math.IT","http://arxiv.org/licenses/nonexclusive-distrib/1.0/","  The problem of dual-hop transmission from a source to a destination via two
parallel full-duplex relays in block Rayleigh fading environment is
investigated. All nodes in the network are assumed to be oblivious to their
forward channel gains; however, they have perfect information about their
backward channel gains. The focus of this paper is on simple, efficient, and
practical relaying schemes to increase the expected-rate at the destination.
For this purpose, various combinations of relaying protocols and the broadcast
approach (multi-layer coding) are proposed. For the decode-forward (DF)
relaying, the maximum finite-layer expected-rate as well as two upper-bounds on
the continuous-layer expected-rate are obtained. The main feature of the
proposed DF scheme is that the layers being decoded at both relays are added
coherently at the destination although each relay has no information about the
number of layers being successfully decoded by the other relay. It is proved
that the optimal coding scheme is transmitting uncorrelated signals via the
relays. Next, the maximum expected-rate of ON/OFF based amplify-forward (AF)
relaying is analytically derived. For further performance improvement, a hybrid
decode-amplify-forward (DAF) relaying strategy, adopting the broadcast approach
at the source and relays, is proposed and its maximum throughput and maximum
finite-layer expected-rate are presented. Moreover, the maximum throughput and
maximum expected-rate in the compress-forward (CF) relaying adopting the
broadcast approach, using optimal quantizers and Wyner-Ziv compression at the
relays, are fully derived. All theoretical results are illustrated by numerical
simulations. As it turns out from the results, when the ratio of the relay
power to the source power is high, the CF relaying outperforms DAF (and hence
outperforms both DF and AF relaying); otherwise, DAF scheme is superior.
","[{""version"":""v1"",""created"":""Sun, 17 Jun 2012 03:27:35 GMT""}]","2012-06-19"
"1206.3720","Daniel Klein","Anna Bershteyn, Daniel J. Klein, Edward Wenger, Philip A. Eckhoff","Description of the EMOD-HIV Model v0.7","16 pages, 5 figures",,,,"q-bio.QM q-bio.PE stat.AP","http://arxiv.org/licenses/nonexclusive-distrib/1.0/","  The expansion of tools against HIV transmission has brought increased
interest in epidemiological models that can predict the impact of these
interventions. The EMOD-HIV model was recently compared to eleven other
independently developed mathematical models of HIV transmission to determine
the extent to which they agree about the potential impact of expanded use of
antiretroviral therapy in South Africa. Here we describe in detail the modeling
methodology used to produce the results in this comparison, which we term
EMOD-HIV v0.7. We include a discussion of the structure and a full list of
model parameters. We also discuss the architecture of the model, and its
potential utility in comparing structural assumptions within a single modeling
framework.
","[{""version"":""v1"",""created"":""Sun, 17 Jun 2012 03:36:48 GMT""}]","2012-06-19"
"1206.3721","Kazuya Takabatake","Kazuya Takabatake and Shotaro Akaho","Constraint-free Graphical Model with Fast Learning Algorithm","9 pages, 11 figures, submitted to UAI2012",,,,"cs.LG stat.ML","http://arxiv.org/licenses/nonexclusive-distrib/1.0/","  In this paper, we propose a simple, versatile model for learning the
structure and parameters of multivariate distributions from a data set.
Learning a Markov network from a given data set is not a simple problem,
because Markov networks rigorously represent Markov properties, and this rigor
imposes complex constraints on the design of the networks. Our proposed model
removes these constraints, acquiring important aspects from the information
geometry. The proposed parameter- and structure-learning algorithms are simple
to execute as they are based solely on local computation at each node.
Experiments demonstrate that our algorithms work appropriately.
","[{""version"":""v1"",""created"":""Sun, 17 Jun 2012 04:40:09 GMT""}]","2012-06-19"
"1206.3722","Saurabh  Pal","Umesh Kumar Pandey, Surjeet Kumar Yadav, Saurabh Pal","Data Mining Application to Attract Students in HEI","6 pages","International Journal on Computer Science and Engineering
  (IJCSE)Vol. 4 No. 06 June 2012",,,"cs.CY","http://arxiv.org/licenses/nonexclusive-distrib/1.0/","  In the last two decades, number of Higher Education Institutions (HEI) grows
in leaps and bounds. This causes a cut throat competition among these
institutions while attracting the student get admission in these institutions.
To make reach up to the students institution makes effort of advertisement.
Similarly developing and developed both type of institution launch several
services also to attract students. Most of the institutions are opened in self
finance mode. So all time they feel short hand in expenditure. Now a day a
number of advertisement methods are available. So it is difficult for an
institution to make advertisement through all modes and launch all services at
the same time due to different constraints. In this paper we use support and
confidence method to find out the best way of advertisement.
","[{""version"":""v1"",""created"":""Sun, 17 Jun 2012 05:04:16 GMT""}]","2012-06-19"
"1206.3723","Dong Lai","Dong Lai","DC Circuit Powered by Orbital Motion: Magnetic Interactions in Compact
  Object Binaries and Exoplanetary Systems","5 pages, one figure",,"10.1088/2041-8205/757/1/L3",,"astro-ph.HE astro-ph.EP astro-ph.SR gr-qc","http://arxiv.org/licenses/nonexclusive-distrib/1.0/","  The unipolar induction DC circuit model, originally developed by Goldreich &
Lynden-Bell for the Jupiter-Io system, has been applied to different types of
binary systems in recent years. We show that there exists an upper limit to the
magnetic interaction torque and energy dissipation rate in such model. This
arises because when the resistance of the circuit is too small, the large
current flow severely twists the magnetic flux tube connecting the two binary
components, leading to breakdown of the circuit. Applying this limit, we find
that in coalescing neutron star binaries, magnetic interactions produce
negligible correction to the phase evolution of the gravitational waveform,
even for magnetar-like field strengths. However, energy dissipation in the
binary magnetosphere may still give rise to electromagnetic radiation prior to
the final merger. For ultra-compact white dwarf binaries, we find that DC
circuit does not provide adequate energy dissipation to explain the observed
X-ray luminosities of several sources. For exoplanetary systems containing
close-in Jupiters or super-Earths, magnetic torque and dissipation are
negligible, except possibly during the early T Tauri phase, when the stellar
magnetic field is stronger than 10^3G.
","[{""version"":""v1"",""created"":""Sun, 17 Jun 2012 05:05:14 GMT""}]","2015-06-05"
"1206.3724","Quoc Hung Phan","Raul Manasevich, Quoc Hung Phan, Philippe Souplet","Global existence of solutions for a chemotaxis-type system arising in
  crime modeling",,,,,"math.AP","http://arxiv.org/licenses/nonexclusive-distrib/1.0/","  We consider a nonlinear, strongly coupled, parabolic system arising in the
modeling of burglary in residential areas. The system is of chemotaxis-type and
involves a logarithmic sensivity function and specific interaction and
relaxation terms. Under suitable assumptions on the data of the problem, we
give a rigorous proof of the existence of a global and bounded, classical
solution, thereby solving a problem left open in previous work on this model.
Our proofs are based on the construction of approximate entropies and on the
use of various functional inequalities. We also provide explicit numerical
conditions for global existence when the domain in a square, including concrete
cases involving values of the parameters which are expected to be physically
relevant
","[{""version"":""v1"",""created"":""Sun, 17 Jun 2012 05:33:22 GMT""}]","2012-06-19"
"1206.3725","Alexander Dolgov","A.D. Dolgov","Cosmic antigravity","Lectures presented for particle physicists at International ITEP
  Winter School, Moscow, feb. 2012; 28 pages",,,,"astro-ph.CO gr-qc hep-ph","http://arxiv.org/licenses/nonexclusive-distrib/1.0/","  Possibility of gravitational repulsion in General Relativity is discussed and
astronomical data in favor of cosmological acceleration are described. The
problem of vacuum energy is emphasized and possible ways of its solution are
indicated. The main attention is payed to adjustment mechanism which in
principle could compensate originally huge vacuum energy down to cosmologically
acceptable value and to solve the coincidence problem of a close magnitudes of
the non-compensated remnants of vacuum energy and the energy density of the
universe at the present time. Finally possible modifications of gravity at
large scales which could induce accelerated cosmological expansion are
considered.
","[{""version"":""v1"",""created"":""Sun, 17 Jun 2012 05:34:33 GMT""}]","2012-06-19"
"1206.3726","Atabey Kaygun","M\""uge Kanuni and Atabey Kaygun","Global Dimensions of Some Artinian Algebras",,,,,"math.RA math.KT","http://arxiv.org/licenses/nonexclusive-distrib/1.0/","  In this article we obtain lower and upper bounds for global dimensions of a
class of artinian algebras in terms of global dimensions of a finite subset of
their artinian subalgebras. Finding these bounds for the global dimension of an
artinian algebra $A$ is realized via an explicit algorithm we develop. This
algorithm is based on a directed graph (not the Auslander-Reiten quiver) we
construct, and it allows us to decide whether an artinian algebra has finite
global dimension in good number of cases.
","[{""version"":""v1"",""created"":""Sun, 17 Jun 2012 05:49:50 GMT""},{""version"":""v2"",""created"":""Mon, 5 Nov 2012 19:17:42 GMT""}]","2012-11-06"
"1206.3727","David Cebron","David C\'ebron (IRPHE), Michael Le Bars (IRPHE), J. Noir (ETHZ), J. M.
  Aurnou","Libration driven elliptical instability",,"Physics of Fluids 24, 061703 (2012) 7p","10.1063/1.4729296",,"physics.flu-dyn physics.geo-ph","http://arxiv.org/licenses/nonexclusive-distrib/1.0/","  The elliptical instability is a generic instability which takes place in any
rotating flow whose streamlines are elliptically deformed. Up to now, it has
been widely studied in the case of a constant, non-zero differential rotation
between the fluid and the elliptical distortion with applications in
turbulence, aeronautics, planetology and astrophysics. In this letter, we
extend previous analytical studies and report the first numerical and
experimental evidence that elliptical instability can also be driven by
libration, i.e. periodic oscillations of the differential rotation between the
fluid and the elliptical distortion, with a zero mean value. Our results
suggest that intermittent, space-filling turbulence due to this instability can
exist in the liquid cores and sub-surface oceans of so-called synchronized
planets and moons.
","[{""version"":""v1"",""created"":""Sun, 17 Jun 2012 06:16:41 GMT""}]","2012-06-19"
"1206.3728","Xiaochuan Zhao","Xiaochuan Zhao and Ali H. Sayed","Performance Limits for Distributed Estimation Over LMS Adaptive Networks","39 pages, 7 figures, to appear in IEEE Transactions on Signal
  Processing, 2012",,"10.1109/TSP.2012.2204985",,"cs.IT cs.DC cs.SY math.IT","http://arxiv.org/licenses/nonexclusive-distrib/1.0/","  In this work we analyze the mean-square performance of different strategies
for distributed estimation over least-mean-squares (LMS) adaptive networks. The
results highlight some useful properties for distributed adaptation in
comparison to fusion-based centralized solutions. The analysis establishes
that, by optimizing over the combination weights, diffusion strategies can
deliver lower excess-mean-square-error than centralized solutions employing
traditional block or incremental LMS strategies. We first study in some detail
the situation involving combinations of two adaptive agents and then extend the
results to generic N-node ad-hoc networks. In the later case, we establish
that, for sufficiently small step-sizes, diffusion strategies can outperform
centralized block or incremental LMS strategies by optimizing over
left-stochastic combination weighting matrices. The results suggest more
efficient ways for organizing and processing data at fusion centers, and
present useful adaptive strategies that are able to enhance performance when
implemented in a distributed manner.
","[{""version"":""v1"",""created"":""Sun, 17 Jun 2012 06:24:08 GMT""}]","2015-06-05"
"1206.3729","Ian Crossfield","Ian J. M. Crossfield","ACME Stellar Spectra. I. Absolutely Calibrated, Mostly Empirical Flux
  Densities of 55 Cancri and its Transiting Planet 55 Cancri e","Accepted to A&A. 6 pages, 1 figure, 1 electronic table. See
  http://irtfweb.ifa.hawaii.edu/~spex/IRTF_Spectral_Library/ for an alternative
  spectrum","A&A 2012 545 A97","10.1051/0004-6361/201219826",,"astro-ph.EP astro-ph.SR","http://arxiv.org/licenses/nonexclusive-distrib/1.0/","  The ACME Spectra project provides absolutely calibrated, mostly empirical
spectra of exoplanet host stars for use in analysis of the stars and their
planets. Spectra are obtained from ground-based telescopes and are tied
directly to calibrated ground- and space-based photometry. The spectra remain
only ""mostly"" empirical because of telluric absorption, but interpolation of
stellar models over the gaps in wavelength coverage provides continuous stellar
spectra. Among other uses, the spectra are suitable for precisely converting
observed secondary eclipses (occultations) into absolute flux units with
minimal recourse to models. In this letter I introduce ACME's methods and
present a calibrated spectrum of the nearby, super-Earth hosting star 55 Cancri
that spans the range from 0.81-5.05 micron. This spectrum is well-suited for
interpreting near- and thermal-infrared eclipse observations. With this
spectrum I show that the brightness temperature of the small, low-mass
transiting planet 55 Cnc e is 1950 +260/-190 K at 4.5 micron (cooler than
previously reported), which corresponds to a planetary flux of 0.44 +0.12/-0.08
mJy. This result suggests the planet has some combination of a nonzero albedo,
a moderately efficient redistribution of absorbed stellar irradiation, and/or
an optically thick atmosphere, but more precise eclipse measurements are
required to distinguish between these scenarii.
","[{""version"":""v1"",""created"":""Sun, 17 Jun 2012 07:04:26 GMT""},{""version"":""v2"",""created"":""Mon, 6 Aug 2012 14:51:12 GMT""},{""version"":""v3"",""created"":""Sun, 11 Nov 2012 18:52:35 GMT""}]","2015-03-13"
"1206.3730","Mehdi Nadjafikhah","Mehdi Nadjafikhah and Mehdi Jafari","Some general new Einstein Walker manifolds","14 pages","Advanced in Mathematical Physics, Vol. 2013, Article ID 591852
  (2013)","10.1155/2013/591852",,"math.DG math-ph math.MP","http://arxiv.org/licenses/nonexclusive-distrib/1.0/","  In this paper, Lie symmetry group method is applied to find the lie point
symmetries group of a PDE system that is determined general form of
four-dimensional Einstein Walker manifold. Also we will construct the optimal
system of one-dimensional Lie subalgebras and investigate some of its group
invariant solutions.
","[{""version"":""v1"",""created"":""Sun, 17 Jun 2012 07:24:06 GMT""}]","2014-08-01"
"1206.3731","Michael Giudici","Michael Giudici and Aedan Pope","On Bounding the Diameter of the Commuting Graph of a Group",,,,,"math.GR math.CO","http://arxiv.org/licenses/nonexclusive-distrib/1.0/","  The commuting graph of a group $G$ is the simple undirected graph whose
vertices are the non-central elements of $G$ and two distinct vertices are
adjacent if and only if they commute. It is conjectured by Jafarzadeh and
Iranmanesh that there is a universal upper bound on the diameter of the
commuting graphs of finite groups when the commuting graph is connected. In
this paper we determine upper bounds on the diameter of the commuting graph for
some classes of groups to rule them out as possible counterexamples to this
conjecture. We also give an example of an infinite family of groups with
trivial centre and diameter 6, the previously largest known diameter for an
infinite family was 5 for $S_n$.
","[{""version"":""v1"",""created"":""Sun, 17 Jun 2012 07:40:10 GMT""},{""version"":""v2"",""created"":""Tue, 19 Jun 2012 01:06:06 GMT""}]","2012-06-20"
"1206.3732","Nina Daskalova","Nina Daskalova","EM Algorithm for Estimation of the Offspring Distribution in Multitype
  Branching Processes with Terminal Types",,,,,"stat.CO","http://arxiv.org/licenses/nonexclusive-distrib/1.0/","  Multitype branching processes (MTBP) model branching structures, where the
nodes of the resulting tree are objects of different types. One field of
application of such models in biology is in studies of cell proliferation. A
sampling scheme that appears frequently is observing the cell count in several
independent colonies at discrete time points (sometimes only one). Thus, the
process is not observable in the sense of the whole tree, but only as the
""generation"" at given moment in time, which consist of the number of cells of
every type. This requires an EM-type algorithm to obtain a maximum likelihood
(ML) estimation of the parameters of the branching process. A computational
approach for obtaining such estimation of the offspring distribution is
presented in the class of Markov branching processes with terminal types.
","[{""version"":""v1"",""created"":""Sun, 17 Jun 2012 08:01:32 GMT""}]","2012-06-19"
"1206.3733","Liana Zamtaradze","I.G. Margvelashvili, M.D. Zviadadze, L.A. Zamtaradze","The efficiency and power of the martensite rotor heat engine. I","11 pages, 14 figures",,,,"physics.class-ph cond-mat.other","http://arxiv.org/licenses/nonexclusive-distrib/1.0/","  The physical aspects - mechanics and thermodynamics - of operation of
martensite rotor heat engine (MRHE) on the basis of martensite-austenite
structural phase transition with the transition temperature in the region of
low-potential water temperatures have been studied. The engine converts the
thermal energy of low-potential water into the elastic energy of working body
(spring, ribbon or wire) made of the material with shape memory effect. At some
simplifying assumptions, the analytical expressions are obtained for the
thermal efficiency and the power of MRHE of different type. The registration of
head hydraulic resistance and heat conductivity of working body material is
made and the maximum value of power produced by the engine at the given
mechanical and heat conditions is calculated.
  The recommendations are given on the optimal choice of engine parameters. On
the basis of numerical estimations for nitinol, the possibility of application
of MRHE is shown for efficient and ecologically pure production of electric
energy both on local (geothermal waters, waste water of industrial enterprises,
etc.) and global (warm ocean stream) scales.
","[{""version"":""v1"",""created"":""Sun, 17 Jun 2012 09:00:09 GMT""}]","2012-06-19"
"1206.3734","Salvador Miracle-Sole","Salvador Miracle-Sole","A roughening transition indicated by the behaviour of ground states","7 pages, 2 figures","VIIIth International Congress of the International Association of
  Mathematical Physics, M. Mebkhout and R. Seneor eds., World Scientific,
  Singapore, 1987, pp. 331-337",,,"cond-mat.stat-mech math-ph math.MP","http://arxiv.org/licenses/nonexclusive-distrib/1.0/","  We present some illustrations for the claim that already by looking at the
ground states of classical lattice models, one may meet some interesting and
non-trivial structures.
","[{""version"":""v1"",""created"":""Sun, 17 Jun 2012 09:20:19 GMT""}]","2012-06-19"
"1206.3735","Amir Zait","Micha Berkooz, Anna Frishman and Amir Zait","Degenerate Rotating Black Holes, Chiral CFTs and Fermi Surfaces I -
  Analytic Results for Quasinormal Modes","41 pages, 1 figure, LaTeX; v2: typos corrected, references added",,"10.1007/JHEP08(2012)109",,"hep-th gr-qc","http://arxiv.org/licenses/nonexclusive-distrib/1.0/","  In this work we discuss charged rotating black holes in $AdS_5 \times S^5$
that degenerate to extremal black holes with zero entropy. These black holes
have scaling properties between charge and angular momentum similar to those of
Fermi surface operators in a subsector of $\mathcal{N}=4$ SYM. We add a
massless uncharged scalar to the five dimensional supergravity theory, such
that it still forms a consistent truncation of the type IIB ten dimensional
supergravity and analyze its quasinormal modes. Separating the equation of
motion to a radial and angular part, we proceed to solve the radial equation
using the asymptotic matching expansion method applied to a Heun equation with
two nearby singularities. We use the continued fraction method for the angular
Heun equation and obtain numerical results for the quasinormal modes. In the
case of the supersymmetric black hole we present some analytic results for the
decay rates of the scalar perturbations. The spectrum of quasinormal modes
obtained is similar to that of a chiral 1+1 CFT, which is consistent with the
conjectured field-theoretic dual. In addition, some of the modes can be found
analytically.
","[{""version"":""v1"",""created"":""Sun, 17 Jun 2012 09:30:33 GMT""},{""version"":""v2"",""created"":""Thu, 28 Jun 2012 14:19:21 GMT""}]","2015-06-05"
"1206.3736","Salvador Miracle-Sole","Salvador Miracle-Sole","Facet shapes in a Wulff crystal","23 pages, 5 figures","Proceedings of the Satellite Colloquium of STATPHYS 20, S.
  Miracle-Sole, J. Ruiz, V. Zagrebnov (eds.), World Scientific, Singapore,
  1999, pp. 83-101",,,"cond-mat.stat-mech math-ph math.MP","http://arxiv.org/licenses/nonexclusive-distrib/1.0/","  According to the Wulff construction the shape of the equilibrium crystal is
determined by the surface tension considered as a function of the interface
orientation. We present some (conjectured) approximate solutions and some
rigorous results concerning this function, in the case of a lattice gas, and
apply them to study the shape of the equilibrium crystal and, in particular,
the shape of the facets of this crystal.
","[{""version"":""v1"",""created"":""Sun, 17 Jun 2012 09:42:50 GMT""}]","2012-06-19"
"1206.3737","Wu Xiaosheng","Wu Xiaosheng","Distinct zeros of the Riemann zeta-functions",,,,,"math.NT","http://arxiv.org/licenses/nonexclusive-distrib/1.0/","  In this paper, we prove that there are more than 66.036% of zeros of the
Riemann zeta-function are distinct.
","[{""version"":""v1"",""created"":""Sun, 17 Jun 2012 09:52:16 GMT""},{""version"":""v2"",""created"":""Tue, 18 Sep 2012 17:48:52 GMT""}]","2012-09-19"
"1206.3738","Georg Hager","Jan Treibig, Georg Hager, Gerhard Wellein","Best practices for HPM-assisted performance engineering on modern
  multicore processors","10 pages, 2 figures",,"10.1007/978-3-642-36949-0_50",,"cs.PF cs.DC","http://arxiv.org/licenses/nonexclusive-distrib/1.0/","  Many tools and libraries employ hardware performance monitoring (HPM) on
modern processors, and using this data for performance assessment and as a
starting point for code optimizations is very popular. However, such data is
only useful if it is interpreted with care, and if the right metrics are chosen
for the right purpose. We demonstrate the sensible use of hardware performance
counters in the context of a structured performance engineering approach for
applications in computational science. Typical performance patterns and their
respective metric signatures are defined, and some of them are illustrated
using case studies. Although these generic concepts do not depend on specific
tools or environments, we restrict ourselves to modern x86-based multicore
processors and use the likwid-perfctr tool under the Linux OS.
","[{""version"":""v1"",""created"":""Sun, 17 Jun 2012 09:53:53 GMT""}]","2013-02-20"
