"1206.3973","Mikhail Zubkov","M. I. Katsnelson, G. E. Volovik, M. A. Zubkov","Euler - Heisenberg effective action and magnetoelectric effect in
  multilayer graphene","Latex, 24 pages, accepted for publication in Annals of Physics","Annals of Physics, 331 (2013), 160-187","10.1016/j.aop.2012.12.010","ITEP-LAT/2012-07","cond-mat.mes-hall hep-lat hep-ph hep-th","http://arxiv.org/licenses/nonexclusive-distrib/1.0/","  The low energy effective field model for the multilayer graphene (at ABC
stacking) is considered. We calculate the effective action in the presence of
constant external magnetic field $B$ (normal to the graphene sheet). We also
calculate the first two corrections to this effective action caused by the
in-plane electric field $E$ at $E/B \ll 1$ and discuss the magnetoelectric
effect. In addition, we calculate the imaginary part of the effective action in
the presence of constant electric field $E$ and the lowest order correction to
it due to the magnetic field ($B/E \ll 1$).
","[{""version"":""v1"",""created"":""Mon, 18 Jun 2012 16:03:24 GMT""},{""version"":""v2"",""created"":""Mon, 17 Sep 2012 11:39:54 GMT""},{""version"":""v3"",""created"":""Mon, 24 Dec 2012 16:19:39 GMT""},{""version"":""v4"",""created"":""Thu, 24 Jan 2013 20:19:02 GMT""}]","2013-02-01"
"1206.3974","Antonio Punzo","Salvatore Ingrassia and Simona C. Minotti and Antonio Punzo","Model-based clustering via linear cluster-weighted models",,"Computational Statistics and Data Analysis, 71(4): 159-182, 2014","10.1016/j.csda.2013.02.012",,"stat.CO","http://arxiv.org/licenses/nonexclusive-distrib/1.0/","  A novel family of twelve mixture models with random covariates, nested in the
linear $t$ cluster-weighted model (CWM), is introduced for model-based
clustering. The linear $t$ CWM was recently presented as a robust alternative
to the better known linear Gaussian CWM. The proposed family of models provides
a unified framework that also includes the linear Gaussian CWM as a special
case. Maximum likelihood parameter estimation is carried out within the EM
framework, and both the BIC and the ICL are used for model selection. A simple
and effective hierarchical random initialization is also proposed for the EM
algorithm. The novel model-based clustering technique is illustrated in some
applications to real data. Finally, a simulation study for evaluating the
performance of the BIC and the ICL is presented.
","[{""version"":""v1"",""created"":""Mon, 18 Jun 2012 16:04:25 GMT""},{""version"":""v2"",""created"":""Mon, 9 Mar 2015 17:06:13 GMT""}]","2015-03-10"
"1206.3975","Ivan Viola","{\AA}smund Birkeland, Veronika Solteszova, Dieter H\""onigmann, Odd
  Helge Gilja, Svein Brekke, Timo Ropinski and Ivan Viola","The Ultrasound Visualization Pipeline - A Survey",,,"10.1007/978-1-4471-6497-5_24",,"cs.GR cs.CV","http://arxiv.org/licenses/nonexclusive-distrib/1.0/","  Ultrasound is one of the most frequently used imaging modality in medicine.
The high spatial resolution, its interactive nature and non-invasiveness makes
it the first choice in many examinations. Image interpretation is one of
ultrasound's main challenges. Much training is required to obtain a confident
skill level in ultrasound-based diagnostics. State-of-the-art graphics
techniques is needed to provide meaningful visualizations of ultrasound in
real-time. In this paper we present the process-pipeline for ultrasound
visualization, including an overview of the tasks performed in the specific
steps. To provide an insight into the trends of ultrasound visualization
research, we have selected a set of significant publications and divided them
into a technique-based taxonomy covering the topics pre-processing,
segmentation, registration, rendering and augmented reality. For the different
technique types we discuss the difference between ultrasound-based techniques
and techniques for other modalities.
","[{""version"":""v1"",""created"":""Mon, 18 Jun 2012 16:05:47 GMT""}]","2020-10-15"
"1206.3976","Salom\'e Dibi","Salom\'e Dibi, Samia Drappeau, P. Chris Fragile, Sera Markoff, Jason
  Dexter","GRMHD simulations of accretion onto Sgr A*: How important are radiative
  losses?","Resubmitted to MNRAS, including modifications in response to referee
  report. 13 pages, 15 figures",,"10.1111/j.1365-2966.2012.21857.x","NSF-KITP-12-053","astro-ph.HE astro-ph.GA","http://arxiv.org/licenses/nonexclusive-distrib/1.0/","  We present general relativistic magnetohydrodynamic (GRMHD) numerical
simulations of the accretion flow around the supermassive black hole in the
Galactic centre, Sagittarius A* (Sgr A*). The simulations include for the first
time radiative cooling processes (synchrotron, bremsstrahlung, and inverse
Compton) self-consistently in the dynamics, allowing us to test the common
simplification of ignoring all cooling losses in the modeling of Sgr A*. We
confirm that for Sgr A*, neglecting the cooling losses is a reasonable
approximation if the Galactic centre is accreting below ~10^{-8} Msun/yr i.e.
Mdot < 10^{-7} Mdot_Edd. But above this limit, we show that radiative losses
should be taken into account as significant differences appear in the dynamics
and the resulting spectra when comparing simulations with and without cooling.
This limit implies that most nearby low-luminosity active galactic nuclei are
in the regime where cooling should be taken into account.
  We further make a parameter study of axisymmetric gas accretion around the
supermassive black hole at the Galactic centre. This approach allows us to
investigate the physics of gas accretion in general, while confronting our
results with the well studied and observed source, Sgr A*, as a test case. We
confirm that the nature of the accretion flow and outflow is strongly dependent
on the initial geometry of the magnetic field. For example, we find it
difficult, even with very high spins, to generate powerful outflows from discs
threaded with multiple, separate poloidal field loops.
","[{""version"":""v1"",""created"":""Mon, 18 Jun 2012 16:08:26 GMT""}]","2015-06-05"
"1206.3977","Dorin Popescu","Dorin Popescu","Upper bounds of depth of monomial ideals",,,,,"math.AC","http://creativecommons.org/licenses/publicdomain/","  Let $J\subsetneq I$ be two ideals of a polynomial ring $S$ over a field,
generated by square free monomials.
  We show that some inequalities among the numbers of square free monomials of
$I\setminus J$ of different degrees give upper bounds of $\depth_SI/J$.
","[{""version"":""v1"",""created"":""Mon, 18 Jun 2012 16:12:23 GMT""}]","2012-06-19"
"1206.3978","Sandro Mereghetti","S. Mereghetti, N. Sartore, A. Tiengo, A. De Luca, R. Turolla, and F.
  Haberl","A study of the long term variability of RX J1856.5-3754 with XMM-Newton","4 pages, to appear in the proceedings of the ERPM conference, Zielona
  Gora, April 2012",,,,"astro-ph.HE","http://arxiv.org/licenses/nonexclusive-distrib/1.0/","  We report on a detailed spectral analysis of all the available XMM-Newton
data of RX J1856.5-3754, the brightest and most extensively observed nearby,
thermally emitting neutron star. Very small variations (~1-2%) in the
single-blackbody temperature are detected, but are probably due to an
instrumental effect, since they correlate with the position of the source on
the detector. Restricting the analysis to a homogeneous subset of observations,
with the source at the same detector position, we place strong limits on
possible spectral or flux variations from March 2005 to present-day. A slightly
higher temperature (kT~61.5 eV, compared to the average value kT~61 eV) was
instead measured in April 2002. If this difference is not of instrumental
origin, it implies a rate of variation of about 0.15 eV/yr between April 2002
and March 2005. The high-statistics spectrum from the selected observations is
well fit by the sum of two blackbody models, which extrapolate to an optical
flux level in agreement with the observed value.
","[{""version"":""v1"",""created"":""Mon, 18 Jun 2012 16:19:37 GMT""}]","2012-06-19"
"1206.3979","Pedro Jimenez-Delgado","Pedro Jimenez-Delgado","Progress in the dynamical parton distributions","4 pages, 1 figure, Talk given at the XX International Workshop on
  Deep-Inelastic Scattering and Related Subjects (DIS2012)",,,"JLAB-THY-12-1576","hep-ph","http://arxiv.org/licenses/nonexclusive-distrib/1.0/","  The present status of the (JR) dynamical parton distribution functions is
reported. Different theoretical improvements, including the determination of
the strange sea input distribution, the treatment of correlated errors and the
inclusion of alternative data sets, are discussed. Highlights in the ongoing
developments as well as (very) preliminary results in the determination of the
strong coupling constant are presented.
","[{""version"":""v1"",""created"":""Mon, 18 Jun 2012 16:19:39 GMT""},{""version"":""v2"",""created"":""Wed, 20 Jun 2012 20:09:29 GMT""}]","2012-06-22"
"1206.3980","Yifan Hu","Emden Gansner, Yifan Hu and Stephen North","Visualizing Streaming Text Data with Dynamic Maps",,,,,"cs.DM","http://arxiv.org/licenses/nonexclusive-distrib/1.0/","  The many endless rivers of text now available present a serious challenge in
the task of gleaning, analyzing and discovering useful information. In this
paper, we describe a methodology for visualizing text streams in real time. The
approach automatically groups similar messages into ""countries,"" with keyword
summaries, using semantic analysis, graph clustering and map generation
techniques. It handles the need for visual stability across time by dynamic
graph layout and Procrustes projection techniques, enhanced with a novel stable
component packing algorithm. The result provides a continuous, succinct view of
evolving topics of interest. It can be used in passive mode for overviews and
situational awareness, or as an interactive data exploration tool. To make
these ideas concrete, we describe their application to an online service called
TwitterScope.
","[{""version"":""v1"",""created"":""Mon, 18 Jun 2012 16:20:30 GMT""}]","2015-03-20"
"1206.3981","Jesus Guillera","Jes\'us Guillera and Mathew Rogers","Ramanujan series upside-down","28 pages","J. Aust. Math. Soc. 97 (2014) 78-106","10.1017/S1446788714000147",,"math.NT","http://arxiv.org/licenses/nonexclusive-distrib/1.0/","  We prove that there is a correspondence between Ramanujan-type formulas for
1/\pi, and formulas for Dirichlet L-values. The same method also allows us to
resolve certain values of the Epstein zeta function in terms of rapidly
converging hypergeometric functions. The Epstein zeta functions were previously
studied by Glasser and Zucker.
","[{""version"":""v1"",""created"":""Mon, 18 Jun 2012 16:23:30 GMT""}]","2019-02-20"
"1206.3982","Ion Vasile Vancea","M. C. B. Abdalla, L. Holender, M. A. Santos, I. V. Vancea","Noncommutative fluid dynamics in the Snyder space-time","12 pages. Version published by Phys. Rev. D",,"10.1103/PhysRevD.86.045019","ICTP-SAIFR/2012-004","hep-th gr-qc physics.flu-dyn","http://arxiv.org/licenses/nonexclusive-distrib/1.0/","  In this paper, we construct for the first time the non-commutative fluid with
the deformed Poincare invariance. To this end, the realization formalism of the
noncommutative spaces is employed and the results are particularized to the
Snyder space. The non-commutative fluid generalizes the fluid model in the
action functional formulation to the noncommutative space. The fluid equations
of motion and the conserved energy-momentum tensor are obtained.
","[{""version"":""v1"",""created"":""Mon, 18 Jun 2012 16:24:13 GMT""},{""version"":""v2"",""created"":""Tue, 21 Aug 2012 12:36:51 GMT""}]","2016-11-11"
"1206.3983","Kuo-Wei Huang","Kuo-Wei Huang","Non-Abelian Chiral 2-Form and M5-Branes","Master Thesis, 80 pages. v2: references and footnotes added. minor
  modification",,,,"hep-th","http://arxiv.org/licenses/nonexclusive-distrib/1.0/","  We first review self-dual (chiral) gauge field theories by studying their
Lorentz non-covariant and Lorentz covariant formulations. We next construct a
non-Abelian self-dual two-form gauge theory in six dimensions with a spatial
direction compactified on a circle. This model reduces to the Yang-Mills theory
in five dimensions for a small compactified radius R. The model also reduces to
the Lorentz-invariant Abelian self-dual two-form theory when the gauge group is
Abelian. The model is expected to describe multiple 5-branes in M-theory. We
also discuss its decompactified limit, covariant formulation, BRST-antifield
quantization and other generalizations.
","[{""version"":""v1"",""created"":""Mon, 18 Jun 2012 16:26:29 GMT""},{""version"":""v2"",""created"":""Wed, 17 Sep 2014 21:56:11 GMT""}]","2014-09-19"
"1206.3984","Sebastiano Peotta","Sebastiano Peotta, Davide Rossini, Marco Polini, Francesco Minardi,
  Rosario Fazio","Quantum Breathing of an Impurity in a One-dimensional Bath of
  Interacting Bosons","10 pages, 7 figures, main text and supplementary material merged in a
  single PRB style document","Phys. Rev. Lett. 110, 015302 (2013)","10.1103/PhysRevLett.110.015302",,"cond-mat.quant-gas cond-mat.stat-mech","http://arxiv.org/licenses/nonexclusive-distrib/1.0/","  By means of time-dependent density-matrix renormalization-group (TDMRG) we
are able to follow the real-time dynamics of a single impurity embedded in a
one-dimensional bath of interacting bosons. We focus on the impurity breathing
mode, which is found to be well-described by a single oscillation frequency and
a damping rate. If the impurity is very weakly coupled to the bath, a
Luttinger-liquid description is valid and the impurity suffers an
Abraham-Lorentz radiation-reaction friction. For a large portion of the
explored parameter space, the TDMRG results fall well beyond the
Luttinger-liquid paradigm.
","[{""version"":""v1"",""created"":""Mon, 18 Jun 2012 16:38:30 GMT""}]","2013-01-11"
"1206.3985","Marcelo Pereyra","Marcelo Pereyra, Nicolas Dobigeon, Hadj Batatia and Jean-Yves
  Tourneret","Computing the Cramer-Rao bound of Markov random field parameters:
  Application to the Ising and the Potts models",,,,,"stat.CO stat.ME","http://arxiv.org/licenses/nonexclusive-distrib/1.0/","  This report considers the problem of computing the Cramer-Rao bound for the
parameters of a Markov random field. Computation of the exact bound is not
feasible for most fields of interest because their likelihoods are intractable
and have intractable derivatives. We show here how it is possible to formulate
the computation of the bound as a statistical inference problem that can be
solve approximately, but with arbitrarily high accuracy, by using a Monte Carlo
method. The proposed methodology is successfully applied on the Ising and the
Potts models.% where it is used to assess the performance of three state-of-the
art estimators of the parameter of these Markov random fields.
","[{""version"":""v1"",""created"":""Mon, 18 Jun 2012 16:49:47 GMT""},{""version"":""v2"",""created"":""Fri, 12 Jul 2013 08:27:46 GMT""},{""version"":""v3"",""created"":""Tue, 17 Sep 2013 13:14:54 GMT""}]","2013-09-18"
"1206.3986","Matteo Sala","Matteo Sala, Cesar Manchein and Roberto Artuso","Estimating hyperbolicity of chaotic bidimensional maps","14 pages, 23 figures (This paper is for the IJBC Special Issue edited
  by Prof. Gregoire Nicolis, Prof. Marko Robnik, Dr. Vassilis Rothos and Dr.
  Haris Skokos)",,"10.1142/S0218127412502173","IJBC-D-10-00458","nlin.CD","http://arxiv.org/licenses/nonexclusive-distrib/1.0/","  We apply to bidimensional chaotic maps the numerical method proposed by
Ginelli et al. to approximate the associated Oseledets splitting, i.e. the set
of linear subspaces spanned by the so called covariant Lyapunov vectors (CLV)
and corresponding to the Lyapunov spectrum. These subspaces are the analog of
linearized invariant manifolds for non-periodic points, so the angles between
them can be used to quantify the degree of hyperbolicity of generic orbits;
however, being such splitting non invariant under smooth transformations of
phase space, it is interesting to investigate the properties of transversality
when coordinates change, e.g. to study it in distinct dynamical systems. To
illustrate this issue on the Chirikov-Taylor standard map we compare the
probability densities of transversality for two different coordinate systems;
these are connected by a linear transformation that deforms splitting angles
through phase space, changing also the probability density of almost-zero
angles although complete tangencies are in fact invariant. This is completely
due to the PDF transformation law and strongly suggests that any statistical
inference from such distributions must be generally taken with care.
","[{""version"":""v1"",""created"":""Mon, 18 Jun 2012 16:59:06 GMT""}]","2016-12-21"
"1206.3987","Kenji Nishiwaki","AseshKrishna Datta, Kenji Nishiwaki and Saurabh Niyogi","Non-minimal Universal Extra Dimensions: The strongly interacting sector
  at the Large Hadron Collider","45 pages, 11 figures, 3 tables (v1); 39 pages, 8 figures, 4 tables
  (v2): Version accepted in JHEP. Some sections are added/modified",,"10.1007/JHEP11(2012)154","HRI-P-12-06-001; RECAPP-HRI-2012-007","hep-ph","http://arxiv.org/licenses/nonexclusive-distrib/1.0/","  We work out the strongly interacting sector of a non-minimal Universal Extra
Dimension (nmUED) scenario with one flat extra spatial dimension orbifolded on
S^1/Z_2 in the presence of brane-localized kinetic and Yukawa terms. On
compactification, these terms are known to have significant, nontrivial impact
on the masses and the couplings of the Kaluza-Klein (KK) excitations. We study
the masses of the level `1' KK gluon and the quarks and find the modified
strong interaction vertices involving these particles. The scenario conserves
KK parity. Possibility of significant level-mixing among the quarks from
different KK-levels is pointed out with particular reference to the top quark
sector. Cross sections for various generic final states involving level `1'
KK-gluon and KK-quarks from first two generations are estimated at the Large
Hadron Collider (LHC) via an implementation of the scenario in MadGraph-5 with
the help of FeynRules. The decay branching fractions of both strong and weakly
interacting KK excitations are studied to estimate yields in various different
final states involving jets, leptons and missing energy. These are used to put
some conservative constraints on the nmUED parameter space using the latest LHC
data. Nuances of the scenario are elucidated with reference to the minimal
Universal Extra Dimension (mUED) and Supersymmetry (SUSY) and their
implications for the LHC are discussed.
","[{""version"":""v1"",""created"":""Mon, 18 Jun 2012 17:01:28 GMT""},{""version"":""v2"",""created"":""Sun, 16 Dec 2012 14:57:55 GMT""}]","2015-06-05"
"1206.3988","Bharath Ananthasubramaniam","Bharath Ananthasubramaniam and Upamanyu Madhow","Cooperative localization using angle of arrival measurements: sequential
  algorithms and non-line-of-sight suppression","31 pages, 11 figures, related to MELT'08 Workshop proceeding",,,,"cs.NI cs.MA","http://arxiv.org/licenses/nonexclusive-distrib/1.0/","  We investigate localization of a source based on angle of arrival (AoA)
measurements made at a geographically dispersed network of cooperating
receivers. The goal is to efficiently compute accurate estimates despite
outliers in the AoA measurements due to multipath reflections in
non-line-of-sight (NLOS) environments. Maximal likelihood (ML) location
estimation in such a setting requires exhaustive testing of estimates from all
possible subsets of ""good"" measurements, which has exponential complexity in
the number of measurements. We provide a randomized algorithm that approaches
ML performance with linear complexity in the number of measurements. The
building block for this algorithm is a low-complexity sequential algorithm for
updating the source location estimates under line-of-sight (LOS) environments.
Our Bayesian framework can exploit the ability to resolve multiple paths in
wideband systems to provide significant performance gains over narrowband
systems in NLOS environments, and easily extends to accommodate additional
information such as range measurements and prior information about location.
","[{""version"":""v1"",""created"":""Mon, 18 Jun 2012 17:01:59 GMT""}]","2012-06-19"
"1206.3989","Jinfeng Liao","Jinfeng Liao and Edward Shuryak","Effect of Light Fermions on the Confinement Transition in QCD-like
  Theories","4 pages, 1 figure; few references added; close to the final published
  version",,"10.1103/PhysRevLett.109.152001",,"hep-ph hep-lat hep-th nucl-th","http://arxiv.org/licenses/nonexclusive-distrib/1.0/","  Dependence of the confinement transition parameters on the fermion content
provides information on the mechanism of confinement. Recent progress in
lattice gauge theories has allowed to study it for light flavor number $N_f\sim
O(10)$ and found this transition to shift toward significantly stronger
coupling. We propose an explanation for that: light fermions can occupy the
chromo-magnetic monopoles, via zero modes, making them ""distinguishable"" and
unsuitable for Bose-Einstein Condensation. Such dilution of unoccuplied
monopoles is compensated by stronger coupling that makes them lighter and more
numerous. We also suggest that flavor-carrying quark-monopole objects account
for the density beyond quark Fermi sphere seen in cold dense phase of $N_c=2$
lattice QCD.
","[{""version"":""v1"",""created"":""Mon, 18 Jun 2012 17:04:03 GMT""},{""version"":""v2"",""created"":""Mon, 12 Nov 2012 21:52:03 GMT""}]","2015-06-05"
"1206.3990","Kurusch Ebrahimi-Fard","Michel Bauer, Raphael Chetrite, Kurusch Ebrahimi-Fard, Frederic Patras","Time-ordering and a generalized Magnus expansion",,"Letters in Mathematical Physics 103, (2013), 331","10.1007/s11005-012-0596-z",,"math-ph math.CA math.CO math.MP","http://arxiv.org/licenses/nonexclusive-distrib/1.0/","  Both the classical time-ordering and the Magnus expansion are well-known in
the context of linear initial value problems. Motivated by the noncommutativity
between time-ordering and time derivation, and related problems raised recently
in statistical physics, we introduce a generalization of the Magnus expansion.
Whereas the classical expansion computes the logarithm of the evolution
operator of a linear differential equation, our generalization addresses the
same problem, including however directly a non-trivial initial condition. As a
by-product we recover a variant of the time ordering operation, known as
T*-ordering. Eventually, placing our results in the general context of
Rota-Baxter algebras permits us to present them in a more natural algebraic
setting. It encompasses, for example, the case where one considers linear
difference equations instead of linear differential equations.
","[{""version"":""v1"",""created"":""Mon, 18 Jun 2012 17:04:21 GMT""}]","2013-03-12"
"1206.3991","Bityukov Sergey","Sergey Bitioukov and Nikolai Krasnikov","On the relation between frequentist and Bayesian approaches for the case
  of Poisson statistics","9 pages",,,,"physics.data-an stat.ME","http://arxiv.org/licenses/nonexclusive-distrib/1.0/","  We propose modified frequentist definition for the determination of
confidence intervals for the case of Poisson statistics. Namely, we require
that 1-\beta' \geq \sum_{n=o}^{n_{obs}+k} P(n|\lambda) \geq \alpha'. We show
that this definition is equivalent to the Bayesian method with prior
\pi(\lambda) \sim \lambda^{k}. We also propose modified frequentist definition
for the case of nonzero background.
","[{""version"":""v1"",""created"":""Mon, 18 Jun 2012 17:06:18 GMT""}]","2012-06-19"
"1206.3992","Frank Havemann","Frank Havemann, Jochen Gl\""aser, Michael Heinz, Alexander Struck","Evaluating Overlapping Communities with the Conductance of their
  Boundary Nodes","9 pages, 7 figures, corrected version, two sections and some
  sentences deleted, footnote 7 (p. 7) added",,,,"cs.SI physics.soc-ph","http://creativecommons.org/licenses/by-nc-sa/3.0/","  Usually the boundary of a community in a network is drawn between nodes and
thus crosses its outgoing links. If we construct overlapping communities by
applying the link-clustering approach nodes and links interchange their roles.
Therefore, boundaries must drawn through the nodes shared by two or more
communities. For the purpose of community evaluation we define a conductance of
boundary nodes of overlapping communities analogously to the graph conductance
of boundary-crossing links used to partition a graph into disjoint communities.
We show that conductance of boundary nodes (or normalised node cut) can be
deduced from ordinary graph conductance of disjoint clusters in the network's
weighted line graph introduced by Evans and Lambiotte (2009) to get overlapping
communities of nodes in the original network. We test whether our definition
can be used to construct meaningful overlapping communities with a local greedy
algorithm of link clustering. In this note we present encouraging results we
obtained for Zachary's karate-club network.
","[{""version"":""v1"",""created"":""Mon, 18 Jun 2012 17:06:52 GMT""},{""version"":""v2"",""created"":""Thu, 20 Dec 2012 17:31:48 GMT""},{""version"":""v3"",""created"":""Sun, 13 Oct 2013 20:58:50 GMT""}]","2013-10-15"
