"1206.4155","Rajdeep Borgohain","Rajdeep Borgohain","Data Hiding Techniques using number decompositions","5 pages, 1 figure, 4 tables",,,,"cs.CR","http://arxiv.org/licenses/nonexclusive-distrib/1.0/","  Data hiding is the art of embedding data into digital media in a way such
that the existence of data remains concealed from everyone except the intended
recipient. In this paper, we discuss the various Least Significant Bit (LSB)
data hiding techniques. We first look at the classical LSB data hiding
technique and the method to embed secret data into cover media by bit
manipulation. We also take a look at the data hiding technique by bit plane
decomposition based on Fibonacci numbers. This method generates more bit planes
which allows users to embed more data into the cover image without causing
significant distortion. We also discuss the data hiding technique based on bit
plane decomposition by prime numbers and natural numbers. These methods are
based on mapping the sequence of image bit size to the decomposed bit number to
hide the intended information. Finally we present a comparative analysis of
these data hiding techniques.
","[{""version"":""v1"",""created"":""Tue, 19 Jun 2012 09:14:22 GMT""}]","2012-06-20"
"1206.4156","Alberto Rodriguez","Alberto Rodriguez, Arunava Chakrabarti, Rudolf A. R\""omer","Controlled engineering of extended states in disordered systems","14 pages, 11 figures","Phys. Rev. B 86, 085119-12 (2012)","10.1103/PhysRevB.86.085119",,"cond-mat.dis-nn","http://arxiv.org/licenses/nonexclusive-distrib/1.0/","  We describe how to engineer wavefunction delocalization in disordered systems
modelled by tight-binding Hamiltonians in d>1 dimensions. We show analytically
that a simple product structure for the random onsite potential energies,
together with suitably chosen hopping strengths, allows a resonant scattering
process leading to ballistic transport along one direction, and a controlled
coexistence of extended Bloch states and anisotropically localized states in
the spectrum. We demonstrate that these features persist in the thermodynamic
limit for a continuous range of the system parameters. Numerical results
support these findings and highlight the robustness of the extended regime with
respect to deviations from the exact resonance condition for finite systems.
The localization and transport properties of the system can be engineered
almost at will and independently in each direction. This study gives rise to
the possibility of designing disordered potentials that work as switching
devices and band-pass filters for quantum waves, such as matter waves in
optical lattices.
","[{""version"":""v1"",""created"":""Tue, 19 Jun 2012 09:22:28 GMT""},{""version"":""v2"",""created"":""Tue, 7 Aug 2012 14:16:28 GMT""}]","2012-08-21"
"1206.4157","Feng Yuan","Feng Yuan, Maochun Wu, and Defu Bu (SHAO)","Numerical Simulation of Hot Accretion Flows (I): A Large Radial
  Dynamical Range and the Density Profile of Accretion Flow","11 emulateapj pages, 4 figures; minor changes, ApJ in press",,"10.1088/0004-637X/761/2/129",,"astro-ph.HE","http://arxiv.org/licenses/nonexclusive-distrib/1.0/","  Numerical simulations of hot accretion flow have shown that the mass
accretion rate decreases with decreasing radius; consequently the density
profile of accretion flow becomes flatter compared to the case of a constant
accretion rate. This result has important theoretical and observational
implications. However, because of technical difficulties, the radial dynamic
range in almost all previous simulations usually spans at most two orders of
magnitude. This small dynamical range, combined with the effects of boundary
conditions, makes the simulation results suspectable. Especially, the radial
profiles of density and accretion rate may not be precise enough to be used to
compare with observations. In this paper we present a ""two-zone"" approach to
expand the radial dynamical range from two to four orders of magnitude. We
confirm previous results and find that from $r_s$ to $ 10^4r_s$ the radial
profiles of accretion rate and density can be well described by
$\dot{M}(r)\propto r^s$ and $\rho\propto r^{-p}$. The values of (s, p) are
(0.48, 0.65) and (0.4, 0.85), for viscous parameter $\alpha=0.001$ and 0.01,
respectively. We have looked up numerical simulation works in the literature
and found that the values of $s$ and $p$ are all similar, no matter a magnetic
field is included or not and what kind of initial conditions are adopted. The
density profile we obtain is in good quantitative agreement with that obtained
from the detailed observations and modeling to Sgr A* and NGC 3115. The origin
of such a accretion rate profile will be investigated in a subsequent paper.
","[{""version"":""v1"",""created"":""Tue, 19 Jun 2012 09:26:58 GMT""},{""version"":""v2"",""created"":""Wed, 10 Oct 2012 02:08:32 GMT""}]","2015-06-05"
"1206.4158","Thierry Cazenave","Thierry Cazenave, Fl\'avio Dickstein and Fred B. Weissler","Finite-time blowup for a complex Ginzburg-Landau equation","22 pages",,"10.1137/120878690",,"math.AP","http://arxiv.org/licenses/nonexclusive-distrib/1.0/","  We prove that negative energy solutions of the complex Ginzburg-Landau
equation $e^{-i\theta} u_t = \Delta u+ |u|^{\alpha} u$ blow up in finite time,
where \alpha >0 and \pi /2<\theta <\pi /2. For a fixed initial value $u(0)$, we
obtain estimates of the blow-up time $T_{max}^\theta $ as $\theta \to \pm \pi
/2 $. It turns out that $T_{max}^\theta $ stays bounded (respectively, goes to
infinity) as $\theta \to \pm \pi /2 $ in the case where the solution of the
limiting nonlinear Schr\""odinger equation blows up in finite time
(respectively, is global).
","[{""version"":""v1"",""created"":""Tue, 19 Jun 2012 09:28:22 GMT""}]","2015-11-10"
"1206.4159","Vincenzo Vitelli","William Irvine and Vincenzo Vitelli","Geometric background charge: dislocations on capillary bridges","7 pages, 4 figures","Soft Matter, 8, 10123, (2012)",,,"cond-mat.soft","http://arxiv.org/licenses/nonexclusive-distrib/1.0/","  Recent experiments have shown that colloidal crystals confined to weakly
curved capillary bridges introduce groups of dislocations organized into
`pleats' as means to relieve the stress caused by the Gaussian curvature of the
surface. We consider the onset of this curvature-screening mechanism, by
examining the energetics of isolated dislocations and interstitials on
capillary bridges with free boundaries. The boundary provides an essential
contribution to the problem, akin to a background charge that ""neutralizes"" the
unbalanced integrated curvature of the surface. This makes it favorable for
topologically neutral dislocations and groups of dislocations - rather than
topologically charged disclinations and scars - to relieve the stress caused by
the unbalanced gaussian curvature of the surface. This effect applies to any
crystal on a surface with non-vanishing integrated Gaussian curvature and
stress-free boundary conditions.
  We corroborate the analytic results by numerically computing the energetics
of a defected lattice of springs confined to surfaces with weak positive and
negative curvature
","[{""version"":""v1"",""created"":""Tue, 19 Jun 2012 09:34:30 GMT""}]","2012-12-11"
"1206.4160","Yair Daon","Yair Daon","Bernoullicity of equilibrium measures on countable Markov shifts",,,,,"math.DS","http://arxiv.org/licenses/nonexclusive-distrib/1.0/","  We study the equilibrium behaviour of a two-sided topological Markov shift
with a countable number of states. We assume the potential associated with this
shift is Walters with finite first variation and that the shift is
topologically transitive. We show the equilibrium measure of the system is
Bernoulli up to a period. In the process we generalize several theorems on
countable Markov shifts. We prove a variational principle and the uniqueness of
equilibrium measures. A key step is to show that functions with Walters
property on a two-sided shift are cohomologous to one-sided functions with the
Walters property. Then we turn to show that functions with summable variations
on two-sided CMS are cohomologous to one-sided functions, also with summable
variations.
","[{""version"":""v1"",""created"":""Tue, 19 Jun 2012 09:39:15 GMT""}]","2012-06-20"
"1206.4161","Andrew Brooke-Taylor","Andrew D. Brooke-Taylor","Small u_kappa and large 2^kappa for supercompact kappa","Expository article going through a specific application of the
  technique introduced in arXiv:math/0102043. 11 pages","RIMS Ko-kyu-roku 1851 (2013), pp 14-24",,,"math.LO","http://arxiv.org/licenses/nonexclusive-distrib/1.0/","  In a recent preprint, Garti and Shelah state that the techniques of a paper
of Dzamonja and Shelah can be used to force u_kappa to be kappa^+ for
supercompact kappa with 2^kappa arbitrarily large. In this expository article
we spell out the details of how this can be done.
","[{""version"":""v1"",""created"":""Tue, 19 Jun 2012 09:40:05 GMT""}]","2014-09-26"
"1206.4162","Franck Vermet","M. Ebbers, H. Kn\""opfel, M. L\""owe, F. Vermet","Mixing times for the Swapping Algorithm on the Blume-Emery-Griffiths
  Model","35 pages, to be published in Random Structures and Algorithms",,,,"math.PR","http://arxiv.org/licenses/nonexclusive-distrib/1.0/","  We analyze the so called Swapping Algorithm, a parallel version of the
well-known Metropolis-Hastings algorithm, on the mean-field version of the
Blume-Emery-Griffiths model in statistical mechanics. This model has two
parameters and depending on their choice, the model exhibits either a first, or
a second order phase transition. In agreement with a conjecture by Bhatnagar
and Randall we find that the Swapping Algorithm mixes rapidly in presence of a
second order phase transition, while becoming slow when the phase transition is
first order.
","[{""version"":""v1"",""created"":""Tue, 19 Jun 2012 09:42:23 GMT""}]","2012-06-20"
"1206.4163","Zhi Hui Guo","Zhi-Hui Guo, J. A. Oller and J. Ruiz de Elvira","Chiral dynamics in form factors, spectral-function sum rules,
  meson-meson scattering and semilocal duality","45 pages, 17 figures and 4 tables. To match the published version in
  PRD: a new paragraph is added in the Introduction and two new references are
  included","Phys. Rev. D86, 054006 (2012)","10.1103/PhysRevD.86.054006",,"hep-ph nucl-th","http://arxiv.org/licenses/nonexclusive-distrib/1.0/","  In this work, we perform the one-loop calculation of the scalar and
pseudoscalar form factors in the framework of U(3) chiral perturbation theory
with explicit tree level exchanges of resonances. The meson-meson scattering
calculation from Ref.[1] is extended as well. The spectral functions of the
nonet scalar-scalar (SS) and pseudoscalar-pseudoscalar (PP) correlators are
constructed by using the corresponding form factors. After fitting the unknown
parameters to the scattering data, we discuss the resonance content of the
resulting scattering amplitudes. We also study spectral-function sum rules in
the SS-SS, PP-PP and SS-PP sectors as well as semi-local duality from
scattering. The former relate the scalar and pseudoscalar spectra between
themselves while the latter mainly connects the scalar spectrum with the vector
one. Finally we investigate these items as a function of Nc for Nc > 3. All
these results pose strong constraints on the scalar dynamics and spectroscopy
that are discussed. They are successfully fulfilled by our meson-meson
scattering amplitudes and spectral functions.
","[{""version"":""v1"",""created"":""Tue, 19 Jun 2012 09:44:40 GMT""},{""version"":""v2"",""created"":""Mon, 17 Sep 2012 15:52:49 GMT""}]","2013-05-30"
"1206.4164","Ilya Razenshteyn","Ilya Razenshteyn","On Epsilon-Nets, Distance Oracles, and Metric Embeddings","7 pages",,,,"cs.DS math.CO math.MG","http://arxiv.org/licenses/nonexclusive-distrib/1.0/","  We give two new applications of an observation from \cite{ADFGW11}. The first
is an almost linear sized constant time data structure for reporting very large
distances in undirected graphs. The second is a generic transformation of
results about $\ell_1$-embeddability of metrics to a setting, where we are
interested in preservation of large distances only.
","[{""version"":""v1"",""created"":""Tue, 19 Jun 2012 09:58:20 GMT""}]","2012-06-20"
"1206.4165","Alberto De Sole","Sylvain Carpentier, Alberto De Sole and Victor G. Kac","Rational matrix pseudodifferential operators","20 pages","Selecta Mathematica (2013)","10.1007/s00029-013-0127-5","Roma01.Math.RT","math.RA math-ph math.MP nlin.SI","http://arxiv.org/licenses/nonexclusive-distrib/1.0/","  The skewfield K(d) of rational pseudodifferential operators over a
differential field K is the skewfield of fractions of the algebra of
differential operators K[d]. In our previous paper we showed that any H from
K(d) has a minimal fractional decomposition H=AB^(-1), where A,B are elements
of K[d], B is non-zero, and any common right divisor of A and B is a non-zero
element of K. Moreover, any right fractional decomposition of H is obtained by
multiplying A and B on the right by the same non-zero element of K[d]. In the
present paper we study the ring M_n(K(d)) of nxn matrices over the skewfield
K(d). We show that similarly, any H from M_n(K(d)) has a minimal fractional
decomposition H=AB^(-1), where A,B are elements of M_n(K[d]), B is
non-degenerate, and any common right divisor of A and B is an invertible
element of the ring M_n(K[d]). Moreover, any right fractional decomposition of
H is obtained by multiplying A and B on the right by the same non-degenerate
element of M_n(K [d]). We give several equivalent definitions of the minimal
fractional decomposition. These results are applied to the study of maximal
isotropicity property, used in the theory of Dirac structures.
","[{""version"":""v1"",""created"":""Tue, 19 Jun 2012 10:03:53 GMT""}]","2015-12-18"
"1206.4166","Rapha\""el Fournier","Matthieu Latapy, Cl\'emence Magnien, Rapha\""el Fournier","Quantifying Paedophile Activity in a Large P2P System","In press Information Processing and Management, 2012",,"10.1016/j.ipm.2012.02.008",,"cs.CY cs.NI","http://arxiv.org/licenses/nonexclusive-distrib/1.0/","  Increasing knowledge of paedophile activity in P2P systems is a crucial
societal concern, with important consequences on child protection, policy
making, and internet regulation. Because of a lack of traces of P2P exchanges
and rigorous analysis methodology, however, current knowledge of this activity
remains very limited. We consider here a widely used P2P system, eDonkey, and
focus on two key statistics: the fraction of paedophile queries entered in the
system and the fraction of users who entered such queries. We collect hundreds
of millions of keyword-based queries; we design a paedophile query detection
tool for which we establish false positive and false negative rates using
assessment by experts; with this tool and these rates, we then estimate the
fraction of paedophile queries in our data; finally, we design and apply
methods for quantifying users who entered such queries. We conclude that
approximately 0.25% of queries are paedophile, and that more than 0.2% of users
enter such queries. These statistics are by far the most precise and reliable
ever obtained in this domain.
","[{""version"":""v1"",""created"":""Tue, 19 Jun 2012 10:23:14 GMT""}]","2012-06-20"
"1206.4167","Rapha\""el Fournier","Rapha\""el Fournier, Thibault Cholez, Matthieu Latapy, Cl\'emence
  Magnien, Isabelle Chrisment, Ivan Daniloff, Olivier Festor","Comparing paedophile activity in different P2P systems","Submitted",,,,"cs.CY cs.NI","http://arxiv.org/licenses/nonexclusive-distrib/1.0/","  Peer-to-peer (P2P) systems are widely used to exchange content over the
Internet. Knowledge on paedophile activity in such networks remains limited
while it has important social consequences. Moreover, though there are
different P2P systems in use, previous academic works on this topic focused on
one system at a time and their results are not directly comparable.
  We design a methodology for comparing \kad and \edonkey, two P2P systems
among the most prominent ones and with different anonymity levels. We monitor
two \edonkey servers and the \kad network during several days and record
hundreds of thousands of keyword-based queries. We detect paedophile-related
queries with a previously validated tool and we propose, for the first time, a
large-scale comparison of paedophile activity in two different P2P systems. We
conclude that there are significantly fewer paedophile queries in \kad than in
\edonkey (approximately 0.09% \vs 0.25%).
","[{""version"":""v1"",""created"":""Tue, 19 Jun 2012 10:23:33 GMT""}]","2012-06-20"
"1206.4168","Alex Greilich","Valerii S. Zapasskii, Alex Greilich, Scott A. Crooker, Yan Li, Gleb G.
  Kozlov, Dmitri R. Yakovlev, Dirk Reuter, Andreas D. Wieck, and Manfred Bayer","Optical measurements of spin noise as a high resolution spectroscopic
  tool","4 pages, 4 figures","Phys. Rev. Lett. 110, 176601 (2013)","10.1103/PhysRevLett.110.176601",,"cond-mat.mes-hall physics.optics","http://arxiv.org/licenses/nonexclusive-distrib/1.0/","  The intrinsic fluctuations of electron spins in semiconductors and atomic
vapors generate a small, randomly-varying ""spin noise"" that can be detected by
sensitive optical methods such as Faraday rotation. Recent studies have
demonstrated that the frequency, linewidth, and lineshape of this spin noise
directly reveals dynamical spin properties such as dephasing times, relaxation
mechanisms and g-factors without perturbing the spins away from equilibrium.
Here we demonstrate that spin noise measurements using wavelength-tunable probe
light forms the basis of a powerful and novel spectroscopic tool to provide
unique information that is fundamentally inaccessible via conventional linear
optics. In particular, the wavelength dependence of the detected spin noise
power can reveal homogeneous linewidths buried within inhomogeneously-broadened
optical spectra, and can resolve overlapping optical transitions belonging to
different spin systems. These new possibilities are explored both theoretically
and via experiments on spin systems in opposite limits of inhomogeneous
broadening (alkali atom vapors and semiconductor quantum dots).
","[{""version"":""v1"",""created"":""Tue, 19 Jun 2012 10:26:40 GMT""}]","2013-07-29"
"1206.4169","Loc Bui","Loc Bui, Ramesh Johari, Shie Mannor","Clustered Bandits","19 pages, 2 figures, under review",,,,"cs.LG","http://arxiv.org/licenses/nonexclusive-distrib/1.0/","  We consider a multi-armed bandit setting that is inspired by real-world
applications in e-commerce. In our setting, there are a few types of users,
each with a specific response to the different arms. When a user enters the
system, his type is unknown to the decision maker. The decision maker can
either treat each user separately ignoring the previously observed users, or
can attempt to take advantage of knowing that only few types exist and cluster
the users according to their response to the arms. We devise algorithms that
combine the usual exploration-exploitation tradeoff with clustering of users
and demonstrate the value of clustering. In the process of developing
algorithms for the clustered setting, we propose and analyze simple algorithms
for the setup where a decision maker knows that a user belongs to one of few
types, but does not know which one.
","[{""version"":""v1"",""created"":""Tue, 19 Jun 2012 10:26:45 GMT""}]","2015-03-20"
"1206.4170","Vsevolod Adler","V. E. Adler, A. B. Shabat","Towards the theory of integrable hyperbolic equations of third order","22 p","J. Phys. A: Math. Theor. 45 (2012) 395207","10.1088/1751-8113/45/39/395207",,"nlin.SI math-ph math.AP math.MP","http://arxiv.org/licenses/nonexclusive-distrib/1.0/","  The examples are considered of integrable hyperbolic equations of third order
with two independent variables. In particular, an equation is found which
admits as evolutionary symmetries the Krichever--Novikov equation and the
modified Landau--Lifshitz system. The problem of choice of dynamical variables
for the hyperbolic equations is discussed.
","[{""version"":""v1"",""created"":""Tue, 19 Jun 2012 10:28:03 GMT""}]","2012-09-13"
"1206.4171","Jens Baltrusch","Jens D. Baltrusch, Cecilia Cormick and Giovanna Morigi","Quantum quenches of ion Coulomb crystals across structural instabilities","14 pages, 8 figures; added a paragraph in the introduction providing
  more background, added paragraph at the end of Sec. IV discussing
  experimental parameters","Phys. Rev. A 86, 032104 (2012)","10.1103/PhysRevA.86.032104",,"quant-ph cond-mat.quant-gas physics.atom-ph","http://arxiv.org/licenses/nonexclusive-distrib/1.0/","  Quenches in an ion chain can create coherent superpositions of motional
states across the linear-zigzag structural transition. The procedure has been
described in [Phys. Rev. A 84, 063821 (2011)] and makes use of spin-dependent
forces, so that a coherent superposition of the electronic states of one ion
evolves into an entangled state between the chain's internal and external
degrees of freedom. The properties of the crystalline state so generated are
theoretically studied by means of Ramsey interferometry on one ion of the
chain. An analytical expression for the visibility of the interferometric
measurement is obtained for a chain of arbitrary number of ions and as a
function of the time elapsed after the quench. Sufficiently close to the
linear-zigzag instability the visibility decays very fast, but exhibits
revivals at the period of oscillation of the mode that drives the structural
instability. These revivals have a periodicity that is independent of the
crystal size, and they signal the creation of entanglement by the quantum
quench.
","[{""version"":""v1"",""created"":""Tue, 19 Jun 2012 10:32:02 GMT""},{""version"":""v2"",""created"":""Fri, 10 Aug 2012 11:06:31 GMT""}]","2012-09-10"
"1206.4172","Benjamin Rosenbaum","Benjamin Rosenbaum and Volker Schulz","Efficient response surface methods based on generic surrogate models",,,,,"math.NA","http://arxiv.org/licenses/nonexclusive-distrib/1.0/","  Surrogate models are used for global approximation of responses generated by
expensive computer experiments like CFD applications. In this paper, we make
use of structural similarities which are shared by a class of related problems.
We identify these structures by applying statistical shape models. They are
used to build a generic surrogate model approximation to sample data of a new
problem of the same class. In a variable fidelity framework the generic
surrogate model is combined with the sample data to generate an efficient and
globally accurate interpolation model, which requires less costly sample
evaluations than ordinary response surface methods. We demonstrate our method
with an aerodynamic test case and show that it significantly improves the
approximation quality.
","[{""version"":""v1"",""created"":""Tue, 19 Jun 2012 10:34:40 GMT""}]","2012-06-20"
"1206.4173","Feng Yuan","Feng Yuan, Defu Bu, and Maochun Wu (SHAO)","Numerical Simulation of Hot Accretion Flows (II): Nature, Origin, and
  Properties of Outflow and Their Possible Observational Applications","24 emulateapj pages, 15 figures; one figure and some references
  added, conclusion unchanged; ApJ in press",,"10.1088/0004-637X/761/2/130",,"astro-ph.HE","http://arxiv.org/licenses/nonexclusive-distrib/1.0/","  Previous hydrodynamical (HD) and magnetohydrodynamical (MHD) numerical
simulations of hot accretion flows have shown that the mass accretion rate
decreases with decreasing radius. Two models have been proposed to explain this
result. In the ADIOS model, the inward decrease of accretion rate is because of
the loss of gas in the outflow. In the CDAF model, the gas is assumed to be
locked in convective eddies, which results in the inward decrease of the
accretion rate. We investigate the nature of inward decrease of accretion rate
using HD and MHD simulations. We calculate various properties of inflow and
outflow, including the mass flux, radial and rotational velocities,
temperature, and the Bernoulli parameter ($Be$). Systematic and significant
differences between inflow and outflow are found. These results suggest that
the inflow and outflow are not dominated by convective turbulence, but are
systematic inward and outward motion. We have also analyzed the convective
stability of MHD accretion flow and found that they are convectively stable.
These results indicate that the ADIOS scenario is favored. The different
properties of inflow and outflow also suggest that the mechanisms of producing
outflow in HD and MHD flows are buoyancy and centrifugal force associated with
the magnetic field, respectively. The latter mechanism is similar to the
Blandford & Payne mechanism. We also study the effect of initial conditions in
the simulations. We find that the value of $Be$ is mainly determined by the
value of $Be$ of the initial condition. We discuss some possible observational
applications of our outflow model. These observations include the Fermi bubble
observed in the Galaxy center, and winds widely observed in AGNs and black hole
X-ray binaries.
","[{""version"":""v1"",""created"":""Tue, 19 Jun 2012 10:35:41 GMT""},{""version"":""v2"",""created"":""Wed, 10 Oct 2012 02:09:09 GMT""}]","2015-06-05"
