"1206.4097","Percy Wong","Percy Wong","Global wellposedness for a certain class of large initial data for the
  3D Navier-Stokes Equations","13 pages, updated references for v2",,"10.1007/s00023-013-0255-7",,"math.AP","http://arxiv.org/licenses/nonexclusive-distrib/1.0/","  In this article, we consider a special class of initial data to the 3D
Navier-Stokes equations on the torus, in which there is a certain degree of
orthogonality in the components of the initial data. We showed that, under such
conditions, the Navier-Stokes equations are globally wellposed. We also showed
that there exists large initial data, in the sense of the critical norm
$B^{-1}_{\infty,\infty}$ that satisfies the conditions that we considered.
","[{""version"":""v1"",""created"":""Mon, 18 Jun 2012 23:09:01 GMT""},{""version"":""v2"",""created"":""Wed, 27 Jun 2012 16:29:05 GMT""}]","2013-10-29"
"1206.4098","David Meier","David S. Meier and Jean L. Turner","Spatially Resolved Chemistry in Nearby Galaxies II. The Nuclear Bar in
  Maffei 2","26 pages, 11 figures; Accepted to the Astrophysical Journal",,"10.1088/0004-637X/755/2/104",,"astro-ph.CO astro-ph.GA","http://arxiv.org/licenses/nonexclusive-distrib/1.0/","  We present 2"" - 10"" imaging of eleven transitions from nine molecular species
across the nuclear bar in Maffei 2. The data were obtained with the BIMA and
OVRO interferometers. The ten detected transitions are compared with existing
CO isotopologues, HCN, CS and millimeter continuum data. Dramatic spatial
variations among the mapped species are observed across the nuclear bar. A
principle component analysis is performed to characterize correlations between
the transitions, star formation and molecular column density. The analysis
reveals that HCN, HNC, HCO+ and 3 mm continuum are tightly correlated,
indicating a direct connection to massive star formation. We find two main
morphologically distinct chemical groups, CH3OH, SiO and HNCO comprising the
grain chemistry molecules, versus HCN, HNC, HCO+ and C2H, molecules strong in
the presence of star formation. The grain chemistry molecules, HNCO, CH3OH and
SiO, trace hydrodynamical bar shocks. The near constancy of the HNCO/CH3OH,
SiO/CH3OH and SiO/HNCO ratios argue that shock properties are uniform across
the nucleus. HCN/HCO+, HCN/HNC, HCN/CS and HCN/CO ratios are explained
primarily by variations in density. High HCO+/N2H+ ratios are correlated with
the C2H line, suggesting that this ratio may be a powerful new dense
photon-dominated region (PDR) probe in external galaxies. C2H reveals a
molecular outflow along the minor axis. The morphology and kinematics of the
outflow are consistent with an outflow age of 6-7 Myrs.
","[{""version"":""v1"",""created"":""Mon, 18 Jun 2012 23:16:41 GMT""}]","2015-06-05"
"1206.4099","Marcel Ausloos","Nikolay K. Vitanov (Bas, Sofia, BG), Marcel Ausloos (Grapes, Liege,
  BE), and Giulia Rotundo (U. Tuscia, Viterbo, IT)","Discrete Model of Ideological Struggle Accounting for Migration","24 pages, with 5 figures and 52 refs.; prepared for a Special issue
  of Advances in Complex Systems","Advances in Complex Systems, 15, Suppl. No. 1 (2012) 1250049","10.1142/S021952591250049X",,"physics.soc-ph cond-mat.stat-mech","http://arxiv.org/licenses/nonexclusive-distrib/1.0/","  A discrete in time model of ideological competition is formulated taking into
account population migration. The model is based on interactions between global
populations of non-believers and followers of different ideologies. The complex
dynamics of the attracting manifolds is investigated.
  Conversion from one ideology to another by means of (i) mass media influence
and (ii) interpersonal relations is considered. Moreover a different birth rate
is assumed for different ideologies, the rate being assumed to be positive for
the reference population, made of initially non-believers. Ideological
competition can happen in one or several regions in space. In the latter case,
migration of non-believers and adepts is allowed; this leads to an enrichment
of the ideological dynamics. Finally, the current ideological situation in the
Arab countries and China is commented upon from the point of view of the
presently developed mathematical model. The massive forced conversion by
Ottoman Turks in the Balkans is briefly discussed.
","[{""version"":""v1"",""created"":""Mon, 18 Jun 2012 23:28:34 GMT""}]","2012-08-31"
"1206.4100","Jonathan Kozaczuk","Jonathan Kozaczuk, Stefano Profumo, Michael J. Ramsey-Musolf, Carroll
  L. Wainwright","Supersymmetric Electroweak Baryogenesis Via Resonant Sfermion Sources","35 pages, 9 figures; v2: several revisions, but conclusions
  unchanged. Matches version published in PRD","Phys. Rev. D. 86, (2012) 096001","10.1103/PhysRevD.86.096001","NPAC 12-09","hep-ph astro-ph.CO hep-th","http://arxiv.org/licenses/nonexclusive-distrib/1.0/","  We calculate the baryon asymmetry produced at the electroweak phase
transition by quasi-degenerate third generation sfermions in the minimal
supersymmetric extension of the Standard Model. We evaluate constraints from
Higgs searches, from collider searches for supersymmetric particles, and from
null searches for the permanent electric dipole moment (EDM) of the electron,
of the neutron and of atoms. We find that resonant sfermion sources can in
principle provide a large enough baryon asymmetry in various corners of the
sfermion parameter space, and we focus, in particular, on the case of large
$\tan\beta$, where third-generation down-type (s)fermions become relevant. We
show that in the case of stop and sbottom sources, the viable parameter space
is ruled out by constraints from the non-observation of the Mercury EDM. We
introduce a new class of CP violating sources, quasi-degenerate staus, that
escapes current EDM constraints while providing large enough net chiral
currents to achieve successful ""slepton-mediated"" electroweak baryogenesis.
","[{""version"":""v1"",""created"":""Tue, 19 Jun 2012 00:28:37 GMT""},{""version"":""v2"",""created"":""Thu, 15 Nov 2012 20:45:31 GMT""}]","2013-05-30"
"1206.4101","Karen E. Daniels","Matthias Schr\""oter and Karen E. Daniels","Granular segregation in dense systems: the role of statistical mechanics
  and entropy",,,,,"cond-mat.soft","http://arxiv.org/licenses/nonexclusive-distrib/1.0/","  Granular segregation is ubiquitous in industrial, geological or daily-life
context, but there is still no unifying theoretical approach. In this review,
we examine two examples of granular segregation -- shallow rapid flows and
rotating drums -- which suggest that the dynamics of systems at intermediate
and high density might be amenable to a statistical mechanics approach.
","[{""version"":""v1"",""created"":""Tue, 19 Jun 2012 01:11:37 GMT""}]","2015-03-13"
"1206.4102","Bi-Qing For","Bi-Qing For, B\""arbel Koribalski, Tom Jarrett","Gas and Star Formation in the Circinus Galaxy","18 pages, 14 figures. All figures have been compressed. Contact
  authors for original figures. Accepted by MNRAS",,"10.1111/j.1365-2966.2012.21416.x",,"astro-ph.GA","http://arxiv.org/licenses/nonexclusive-distrib/1.0/","  We present a detailed study of the Circinus Galaxy, investigating its star
formation, dust and gas properties both in the inner and outer disk. To achieve
this, we obtained high-resolution Spitzer mid-infrared images with the IRAC
(3.6, 5.8, 4.5, 8.0 micron) and MIPS (24 and 70 micron) instruments and
sensitive HI data from the Australia Telescope Compact Array (ATCA) and the
64-m Parkes telescope. These were supplemented by CO maps from the Swedish-ESO
Submillimetre Telescope (SEST). Because Circinus is hidden behind the Galactic
Plane, we demonstrate the careful removal of foreground stars as well as large-
and small-scale Galactic emission from the Spitzer images. We derive a visual
extinction of Av = 2.1 mag from the Spectral Energy Distribution of the
Circinus Galaxy and total stellar and gas masses of 9.5 x 10^{10} Msun and 9 x
10^9 Msun, respectively. Using various wavelength calibrations, we find
obscured global star formation rates between 3 and 8 Msun yr^{-1}. Star forming
regions in the inner spiral arms of Circinus, which are rich in HI, are
beautifully unveiled in the Spitzer 8 micron image. The latter is dominated by
polycyclic aromatic hydrocarbon (PAH) emission from heated interstellar dust.
We find a good correlation between the 8 micron emission in the arms and
regions of dense HI gas. The (PAH 8 micron) / 24 micron surface brightness
ratio shows significant variations across the disk of Circinus.
","[{""version"":""v1"",""created"":""Tue, 19 Jun 2012 01:22:13 GMT""}]","2015-06-05"
"1206.4103","Max Leandro Nobre  Goncalves","Max L. N. Gon\c{c}alves and Paulo R. Oliveira","Convergence of the Gauss-Newton method for a special class of systems of
  equations under a majorant condition",,,,,"math.OC","http://arxiv.org/licenses/nonexclusive-distrib/1.0/","  In this paper, we study the Gauss-Newton method for a special class of
systems of nonlinear equation. Under the hypothesis that the derivative of the
function under consideration satisfies a majorant condition, semi-local
convergence analysis is presented. In this analysis the conditions and proof of
convergence are simplified by using a simple majorant condition to define
regions where the Gauss-Newton sequence is ""well behaved"". Moreover, special
cases of the general theory are presented as applications.
","[{""version"":""v1"",""created"":""Tue, 19 Jun 2012 01:41:23 GMT""},{""version"":""v2"",""created"":""Wed, 20 Jun 2012 02:07:00 GMT""}]","2012-06-21"
"1206.4104","Jane Kaczmarek","Jane F. Kaczmarek and Eric M. Wilcots","High Resolution H I Distributions and Multi-Wavelength Analyses of
  Magellanic Spirals NGC 4618 and NGC 4625",,"2012 AJ, 144, 67","10.1088/0004-6256/144/2/67",,"astro-ph.CO","http://arxiv.org/licenses/nonexclusive-distrib/1.0/","  We present a detailed analysis of high resolution H I observations of the
Magellanic spiral galaxies NGC 4618 and NGC 4625. While the H I disk of NGC
4625 is remarkably quiescent with a nearly uniform velocity dispersion and no
evidence of H I holes, there is a dynamic interplay between star formation and
the distribution of neutral hydrogen in NGC 4618. We calculate the critical
density for widespread star formation in each galaxy and find that star
formation proceeds even where the surface density of the atomic gas is well
below the critical density necessary for global star formation. There are
strong spatial correlations in NGC 4618 between UV emission, 1.4 GHz radio
continuum emission, and peaks in the H I column density. Despite the apparent
overlap of the outer disks of the two galaxies, we find that they are
kinematically distinct, indicating that NGC 4618 and NGC 4625 are not
interacting. The structure of NGC 4618 and, in particular, the nature of its
outer ring, are highly suggestive of an interaction, but the timing and nature
of such an interaction remain unclear.
","[{""version"":""v1"",""created"":""Tue, 19 Jun 2012 01:41:32 GMT""}]","2012-07-18"
"1206.4105","Xiaowang Zhou","X. W. Zhou, D. K. Ward, B. M. Wong, F. P. Doty","Melt-growth dynamics in CdTe crystals",,"Physical Review Letters, 108, 245503 (2012)","10.1103/PhysRevLett.108.245503",,"cond-mat.mtrl-sci","http://arxiv.org/licenses/nonexclusive-distrib/1.0/","  We use a new, quantum-mechanics-based bond-order potential (BOP) to reveal
melt-growth dynamics and fine-scale defect formation mechanisms in CdTe
crystals. Previous molecular dynamics simulations of semiconductors have shown
qualitatively incorrect behavior due to the lack of an interatomic potential
capable of predicting both crystalline growth and property trends of many
transitional structures encountered during the melt $\rightarrow$ crystal
transformation. Here we demonstrate successful molecular dynamics simulations
of melt-growth in CdTe using a BOP that significantly improves over other
potentials on property trends of different phases. Our simulations result in a
detailed understanding of defect formation during the melt-growth process.
Equally important, we show that the new BOP enables defect formation mechanisms
to be studied at a scale level comparable to empirical molecular dynamics
simulation methods with a fidelity level approaching quantum-mechanical methods
","[{""version"":""v1"",""created"":""Tue, 19 Jun 2012 02:05:39 GMT""}]","2012-06-20"
"1206.4106","Ying Li","Ying Li, En-Lei Wang","Branching Fractions and CP Asymmetries of B --> K_0*(1430) rho and B -->
  K_0^*(1430) phi Decays in the Family Nonuniversal Z' Model","arXiv admin note: text overlap with arXiv:hep-ph/0508104",,,,"hep-ph","http://arxiv.org/licenses/nonexclusive-distrib/1.0/","  In this work, within the QCD factorization approach, we investigate the
branching fractions and CP asymmetries of decays $B \to K_0^*(1430)\rho$ and $B
\to K_0^*(1430)\phi$ under two different scenarios both in the standard model
and the family nonuniversal $Z^\prime$ model. We find that the annihilation
terms play crucial roles in these decays and lead to the main uncertainties.
For decays $B^- \to \bar K_0^{*-} (1430)\rho^0 (\omega)$, the new $Z^\prime$
boson could change branching fractions remarkably. However, for other decays,
its contribution might be clouded by large uncertainties from annihilations.
Unfortunately, neither the standard model nor $Z^\prime$ model can reproduce
all experimental data under one certain scenario. We also noted that the CP
asymmetries of $B^-\to \bar K_0^{*-}(1430) \rho^0 (\omega)$ could be used to
identify the$K_0^*(1430)$ meson and search for the new physics contribution.
","[{""version"":""v1"",""created"":""Tue, 19 Jun 2012 02:07:11 GMT""}]","2012-06-20"
"1206.4107","Dragomir Z. Djokovic","D. Best, D. Z. Djokovic, H. Kharaghani and H. Ramp","Turyn-type sequences: Classification, Enumeration and Construction","14 pages, 3 tables","J. Combin. Designs 21: 24--35, 2013","10.1002/jcd.21318",,"math.CO","http://arxiv.org/licenses/nonexclusive-distrib/1.0/","  Turyn-type sequences, TT(n), are quadruples of {+,-1}-sequences (A;B;C;D),
with lengths n,n,n,n-1 respectively, where the sum of the nonperiodic
autocorrelation functions of A,B and twice that of C,D is a delta-function
(i.e., vanishes everywhere except at 0). Turyn-type sequences TT(n) are known
to exist for all even n not larger than 36. We introduce a definition of
equivalence to construct a canonical form for TT(n) in general. By using this
canonical form, we enumerate the equivalence classes of TT(n) for n up to and
including 32. We also construct the first example of Turyn-type sequences
TT(38).
","[{""version"":""v1"",""created"":""Tue, 19 Jun 2012 02:09:24 GMT""}]","2013-01-22"
"1206.4108","German Lugones","C. H. Lenzi and G. Lugones","Hybrid stars in the light of the massive pulsar PSR J1614-2230","7 pages, 5 figures; typos in Table 1 have been corrected","Astrophys. J. 759 (2012) 57","10.1088/0004-637X/759/1/57",,"astro-ph.SR hep-ph nucl-th","http://arxiv.org/licenses/nonexclusive-distrib/1.0/","  We perform a systematic study of hybrid star configurations using several
parametrizations of a relativistic mean-field hadronic EoS and the NJL model
for three-flavor quark matter. For the hadronic phase we use the stiff GM1 and
TM1 parametrizations, as well as the very stiff NL3 model. In the NJL
Lagrangian we include scalar, vector and 't Hooft interactions. The vector
coupling constant $g_v$ is treated as a free parameter. We also consider that
there is a split between the deconfinement and the chiral phase transitions
which is controlled by changing the conventional value of the vacuum pressure
$- \Omega_0$ in the NJL thermodynamic potential by $- (\Omega_0 + \delta
\Omega_0)$, being $\delta \Omega_0$ a free parameter. We find that, as we
increase the value of $\delta \Omega_0$, hybrid stars have a larger maximum
mass but are less stable, i.e. hybrid configurations are stable within a
smaller range of central densities. For large enough $\delta \Omega_0$, stable
hybrid configurations are not possible at all. The effect of increasing the
coupling constant $g_v$ is very similar. We show that stable hybrid
configurations with a maximum mass larger than the observed mass of the pulsar
PSR J1614-2230 are possible for a large region of the parameter space of $g_v$
and $\delta \Omega_0$ provided the hadronic equation of state contains nucleons
only. When the baryon octet is included in the hadronic phase, only a very
small region of the parameter space allows to explain the mass of PSR
J1614-2230. We compare our results with previous calculations of hybrid stars
within the NJL model. We show that it is possible to obtain stable hybrid
configurations also in the case $\delta \Omega_0=0$ that corresponds to the
conventional NJL model for which the pressure and density vanish at zero
temperature and chemical potential.
","[{""version"":""v1"",""created"":""Tue, 19 Jun 2012 02:10:55 GMT""},{""version"":""v2"",""created"":""Thu, 28 Jun 2012 01:51:02 GMT""}]","2013-08-21"
"1206.4109","Lin Zhang","Lin Zhang and Shao-Ming Fei and Jun Zhu","Unifying Treatment of Discord via Relative Entropy","12 pages, LaTeX. Some parts are deleted. Any comments are welcome!","Int. J. Theor. Phys. 52(6): 1946-1955(2013)","10.1007/s10773-012-1361-x",,"quant-ph math-ph math.MP","http://arxiv.org/licenses/nonexclusive-distrib/1.0/","  A new form of zero-discord state via Petz's monotonicity condition on
relative entropy with equality has been derived systematically. A
generalization of symmetric zero-discord states is presented and the related
physical implications are discussed.
","[{""version"":""v1"",""created"":""Tue, 19 Jun 2012 02:23:57 GMT""},{""version"":""v2"",""created"":""Wed, 20 Jun 2012 23:57:52 GMT""},{""version"":""v3"",""created"":""Sat, 30 Jun 2012 04:03:39 GMT""}]","2013-05-08"
"1206.4110","Duc Son Pham","Truyen T. Tran and Duc Son Pham","ConeRANK: Ranking as Learning Generalized Inequalities",,,,,"cs.LG cs.IR","http://creativecommons.org/licenses/by/3.0/","  We propose a new data mining approach in ranking documents based on the
concept of cone-based generalized inequalities between vectors. A partial
ordering between two vectors is made with respect to a proper cone and thus
learning the preferences is formulated as learning proper cones. A pairwise
learning-to-rank algorithm (ConeRank) is proposed to learn a non-negative
subspace, formulated as a polyhedral cone, over document-pair differences. The
algorithm is regularized by controlling the `volume' of the cone. The
experimental studies on the latest and largest ranking dataset LETOR 4.0 shows
that ConeRank is competitive against other recent ranking approaches.
","[{""version"":""v1"",""created"":""Tue, 19 Jun 2012 02:24:55 GMT""}]","2012-06-21"
"1206.4111","Ben Adcock","Ben Adcock, Daan Huybrechs and Jesus Martin-Vaquero","On the numerical stability of Fourier extensions",,,,,"math.NA","http://arxiv.org/licenses/nonexclusive-distrib/1.0/","  An effective means to approximate an analytic, nonperiodic function on a
bounded interval is by using a Fourier series on a larger domain. When
constructed appropriately, this so-called Fourier extension is known to
converge geometrically fast in the truncation parameter. Unfortunately,
computing a Fourier extension requires solving an ill-conditioned linear
system, and hence one might expect such rapid convergence to be destroyed when
carrying out computations in finite precision. The purpose of this paper is to
show that this is not the case. Specifically, we show that Fourier extensions
are actually numerically stable when implemented in finite arithmetic, and
achieve a convergence rate that is at least superalgebraic. Thus, in this
instance, ill-conditioning of the linear system does not prohibit a good
approximation.
  In the second part of this paper we consider the issue of computing Fourier
extensions from equispaced data. A result of Platte, Trefethen & Kuijlaars
states that no method for this problem can be both numerically stable and
exponentially convergent. We explain how Fourier extensions relate to this
theoretical barrier, and demonstrate that they are particularly well suited for
this problem: namely, they obtain at least superalgebraic convergence in a
numerically stable manner.
","[{""version"":""v1"",""created"":""Tue, 19 Jun 2012 02:32:45 GMT""},{""version"":""v2"",""created"":""Tue, 19 Mar 2013 20:22:08 GMT""},{""version"":""v3"",""created"":""Sun, 12 May 2013 22:32:25 GMT""}]","2013-05-14"
"1206.4112","Timothy Atherton","Nicole Ackerman, Timothy J. Atherton, Wouter Deconinck, Michael L.
  Falk, Savannah Garmon, Edward Henry, Elena Long","Gender and Sexual Diversity Issues in Physics: The Audience Speaks","10 figures, report of the session on ""Gender and Sexual Diversity
  Issues in Physics"" at the American Physical Society March Meeting 2012",,,,"physics.soc-ph","http://arxiv.org/licenses/nonexclusive-distrib/1.0/","  An account is presented of the special session on ""Gender and Sexual
Diversity Issues in Physics"" which took place at the American Physical Society
March Meeting 2012. The opinions of those who attended this session were
solicited via an anonymous survey, the results of which are reported here.
Drawing both upon ideas put forward by the speakers and audience from the
meeting, a set of recommended actions is proposed for the Physics community to
become more inclusive of LGBT+ people.
","[{""version"":""v1"",""created"":""Tue, 19 Jun 2012 02:34:52 GMT""}]","2012-06-20"
"1206.4113","Seung-Sup Lee Mr.","Sungguen Ryu, Seung-Sup B. Lee, H.-S. Sim","Minimax optimization of entanglement witness operator for the
  quantification of three-qubit mixed-state entanglement",,"Phys. Rev. A 86, 042324 (2012)","10.1103/PhysRevA.86.042324",,"quant-ph","http://arxiv.org/licenses/nonexclusive-distrib/1.0/","  We develop a numerical approach for quantifying entanglement in mixed quantum
states by convex-roof entanglement measures, based on the optimal entanglement
witness operator and the minimax optimization method. Our approach is
applicable to general entanglement measures and states and is an efficient
alternative to the conventional approach based on the optimal pure-state
decomposition. Compared with the conventional one, it has two important merits:
(i) that the global optimality of the solution is quantitatively verifiable,
and (ii) that the optimization is considerably simplified by exploiting the
common symmetry of the target state and measure. To demonstrate the merits, we
quantify Greenberger-Horne-Zeilinger (GHZ) entanglement in a class of
three-qubit full-rank mixed states composed of the GHZ state, the W state, and
the white noise, the simplest mixtures of states with different genuine
multipartite entanglement, which have not been quantified before this work. We
discuss some general properties of the form of the optimal witness operator and
of the convex structure of mixed states, which are related to the symmetry and
the rank of states.
","[{""version"":""v1"",""created"":""Tue, 19 Jun 2012 02:35:03 GMT""},{""version"":""v2"",""created"":""Tue, 23 Oct 2012 05:54:54 GMT""}]","2012-10-24"
"1206.4114","Shek Yeung","S. Yeung, M. H. Chan, M.-C. Chu","Cosmic Microwave Background constraints of decaying dark matter particle
  properties","17 pages, 3 figures",,"10.1088/0004-637X/755/2/108",,"astro-ph.CO","http://arxiv.org/licenses/nonexclusive-distrib/1.0/","  If a component of cosmological dark matter is made up of massive particles -
such as sterile neutrinos - that decay with cosmological lifetime to emit
photons, the reionization history of the universe would be affected, and cosmic
microwave background anisotropies can be used to constrain such a decaying
particle model of dark matter. The optical depth depends rather sensitively on
the decaying dark matter particle mass m_{dm}, lifetime tau_{dm}, and the mass
fraction of cold dark matter f that they account for in this model. Assuming
that there are no other sources of reionization and using the WMAP 7-year data,
we find that 250 eV < m_{dm} < 1 MeV, whereas 2.23*10^3 yr < tau_{dm} <
1.23*10^18 yr. The best fit values for m_{dm} and tau_{dm}/f are 17.3 keV and
2.03*10^16 yr respectively.
","[{""version"":""v1"",""created"":""Tue, 19 Jun 2012 02:53:32 GMT""}]","2015-06-05"
"1206.4115","Ryan Porter","R. L. Porter, G. J. Ferland, P. J. Storey, M. J. Detisch","Improved He I Emissivities in the Case B Approximation","Accepted to MNRAS Letters; 4 pages, 4 figures, 2 tables, 1
  supplemental file",,"10.1111/j.1745-3933.2012.01300.x",,"astro-ph.CO astro-ph.GA","http://arxiv.org/licenses/nonexclusive-distrib/1.0/","  We update our prior work on the case B collisional-recombination spectrum of
He I to incorporate \textit{ab initio} photoionisation cross-sections. This
large set of accurate, self-consistent cross-sections represents a significant
improvement in He I emissivity calculations because it largely obviates the
piecemeal nature that has marked all modern works. A second, more recent set of
\textit{ab initio} cross-sections is also available, but we show that those are
less consistent with bound-bound transition probabilities than our adopted set.
We compare our new effective recombination coefficients with our prior work and
our new emissivities with those by other researchers, and we conclude with
brief remarks on the effects of the present work on the He I error budget. Our
calculations cover temperatures $5000 \le T_e \le 25000$ K and densities $10^1
\le n_e \le 10^{14}$ cm$^{-3}$. Full results are available online.
","[{""version"":""v1"",""created"":""Tue, 19 Jun 2012 02:55:51 GMT""}]","2015-06-05"
