"1206.4049","Alex Merson","Alexander I. Merson (1,2), Carlton M. Baugh (1), John C. Helly (1),
  Violeta Gonzalez-Perez (1), Shaun Cole (1), Richard Bielby (1), Peder Norberg
  (1), Carlos S. Frenk (1), Andrew J. Benson (3), Richard G. Bower (1), Cedric
  G. Lacey (1), Claudia del P. Lagos (1) ((1) Institute for Computational
  Cosmology, Durham, (2) University College London, London, (3) Carnegie
  Observatories, Pasadena)","Lightcone mock catalogues from semi-analytic models of galaxy formation
  - I. Construction and application to the BzK colour selection","23 pages, 17 figures. Accepted by MNRAS. Minor corrections following
  comments from referee. Lightcone mock catalogues for various surveys will be
  made available for download at
  http://www.dur.ac.uk/a.i.merson/lightcones.html",,"10.1093/mnras/sts355",,"astro-ph.CO astro-ph.IM","http://arxiv.org/licenses/nonexclusive-distrib/1.0/","  We introduce a method for constructing end-to-end mock galaxy catalogues
using a semi-analytical model of galaxy formation, applied to the halo merger
trees extracted from a cosmological N-body simulation. The mocks that we
construct are lightcone catalogues, in which a galaxy is placed according to
the epoch at which it first enters the past lightcone of the observer, and
incorporate the evolution of galaxy properties with cosmic time. We determine
the position between the snapshot outputs at which a galaxy enters the
observer's lightcone by interpolation. As an application, we consider the
effectiveness of the BzK colour selection technique, which was designed to
isolate galaxies in the redshift interval 1.4<z<2.5. The mock catalogue is in
reasonable agreement with the observed number counts of all BzK galaxies, as
well as with the observed counts of the subsample of BzKs that are star-forming
galaxies. We predict that over 75 per cent of the model galaxies with
K_{AB}<=23, and 1.4<z<2.5, are selected by the BzK technique. Interloper
galaxies, outside the intended redshift range, are predicted to dominate bright
samples of BzK galaxies (i.e. with K_{AB}<=21). Fainter K-band cuts are
necessary to reduce the predicted interloper fraction. We also show that
shallow B-band photometry can lead to confusion in classifying BzK galaxies as
being star-forming or passively evolving. Overall, we conclude that the BzK
colour selection technique is capable of providing a sample of galaxies that is
representative of the 1.4<z<2.5 galaxy population.
","[{""version"":""v1"",""created"":""Mon, 18 Jun 2012 20:00:02 GMT""},{""version"":""v2"",""created"":""Fri, 25 Jan 2013 15:35:23 GMT""}]","2015-06-05"
"1206.4050","Edo Berger","E. Berger, R. Chornock, R. Lunnan, R. Foley, I. Czekala, A. Rest, C.
  Leibler, A. M. Soderberg, K. Roth, G. Narayan, M. E. Huber, D. Milisavljevic,
  N. E. Sanders, M. Drout, R. Margutti, R.P. Kirshner, G. H. Marion, P. J.
  Challis, A. G. Riess, S. J. Smartt, W. S. Burgett, J. N. Heasley, N. Kaiser,
  R.-P. Kudritzki, E. A. Magnier, M. McCrum, P. A. Price, K. Smith, J. L.
  Tonry, R. J. Wainscoat","Ultra-Luminous Supernovae as a New Probe of the Interstellar Medium in
  Distant Galaxies","Submitted to ApJL; 9 pages; 4 figures; 1 table",,"10.1088/2041-8205/755/2/L29",,"astro-ph.CO","http://arxiv.org/licenses/nonexclusive-distrib/1.0/","  We present the Pan-STARRS1 discovery and light curves, and follow-up MMT and
Gemini spectroscopy of an ultra-luminous supernova (ULSN; dubbed PS1-11bam) at
a redshift of z=1.566 with a peak brightness of M_UV=-22.3 mag. PS1-11bam is
one of the highest redshift spectroscopically-confirmed SNe known to date. The
spectrum is characterized by broad absorption features typical of previous
ULSNe (e.g., CII, SiIII), and by strong and narrow MgII and FeII absorption
lines from the interstellar medium (ISM) of the host galaxy, confirmed by an
[OII]3727 emission line at the same redshift. The equivalent widths of the
FeII2600 and MgII2803 lines are in the top quartile of the quasar intervening
absorption system distribution, but are weaker than those of gamma-ray burst
intrinsic absorbers (i.e., GRB host galaxies). We also detect the host galaxy
in pre-explosion Pan-STARRS1 data and find that its UV spectral energy
distribution is best fit with a young stellar population age of tau~15-45 Myr
and a stellar mass of M \sim (1.1-2.6)x10^9 M_sun (for Z=0.05-1 Z_sun). The
star formation rate inferred from the UV continuum and [OII]3727 emission line
is ~10 M_sun/yr, higher than in any previous ULSN host. PS1-11bam provides the
first direct demonstration that ULSNe can serve as probes of the interstellar
medium in distant galaxies. At the present, the depth and red sensitivity of
PS1 are uniquely suited to finding such events at cosmologically interesting
redshifts (z~1-2); the future combination of LSST and 30-m class telescopes
promises to extend this technique to z~4.
","[{""version"":""v1"",""created"":""Mon, 18 Jun 2012 20:00:03 GMT""}]","2015-06-05"
"1206.4051","Jorge L. Pineda","Jorge L. Pineda (JPL), Norikazu Mizuno (ALMA-J), Markus Roellig
  (KOSMA), Juergen Stutzki (KOSMA), Carsten Kramer (IRAM), Ulrich Klein (AIFA),
  and Monica Rubio (U. Chile)","Submillimeter Line Emission from LMC 30Dor: The Impact of a Starburst on
  a Low Metallicity Environment","11 pages, 8 figures. Accepted for publication in A&A",,"10.1051/0004-6361/201118321",,"astro-ph.GA astro-ph.CO","http://arxiv.org/licenses/nonexclusive-distrib/1.0/","  (Abridged) The 30 Dor region in the Large Magellanic Cloud (LMC) is the most
vigorous star-forming region in the Local Group. Star formation in this region
is taking place in low-metallicity molecular gas that is exposed to an extreme
far--ultraviolet (FUV) radiation field powered by the massive compact star
cluster R136. We used the NANTEN2 telescope to obtain high-angular resolution
observations of the 12CO 4-3, 7-6, and 13CO 4-3 rotational lines and [CI]
3P1-3P0 and 3P2-3P1 fine-structure submillimeter transitions in 30Dor-10, the
brightest CO and FIR-emitting cloud at the center of the 30Dor region. We
derived the properties of the low-metallicity molecular gas using an
excitation/radiative transfer code and found a self-consistent solution of the
chemistry and thermal balance of the gas in the framework of a clumpy cloud PDR
model. We compared the derived properties with those in the N159W region, which
is exposed to a more moderate far-ultraviolet radiation field compared with
30Dor-10, but has similar metallicity. We also combined our CO detections with
previously observed low-J CO transitions to derive the CO spectral-line energy
distribution in 30Dor-10 and N159W. The separate excitation analysis of the
submm CO lines and the neutral carbon fine structure lines shows that the mid-J
CO and [CI]-emitting gas in the 30Dor-10 region has a temperature of about 160
K and a H2 density of about 10^4 cm^-3. We find that the molecular gas in
30Dor-10 is warmer and has a lower beam filling factor compared to that of
N159W, which might be a result of the effect of a strong FUV radiation field
heating and disrupting the low--metallicity molecular gas. We use a clumpy PDR
model (including the [CII] line intensity reported in the literature) to
constrain the FUV intensity to about chi_0 ~ 3100 and an average total H
density of the clump ensemble of about 10^5 cm^-3 in 30Dor-10.
","[{""version"":""v1"",""created"":""Mon, 18 Jun 2012 20:00:03 GMT""},{""version"":""v2"",""created"":""Mon, 25 Jun 2012 16:29:22 GMT""}]","2015-06-05"
"1206.4052","James Geach","J. E. Geach (McGill), D. Sobral (Leiden), R. C. Hickox (Dartmouth), D.
  A. Wake (Yale), Ian Smail (Durham), P. N. Best (IfA, Edinburgh), C. M. Baugh
  (Durham) and J. P. Stott (Durham)","The clustering of H-alpha emitters at z=2.23 from HiZELS","11 pages, 5 figures, submitted to MNRAS",,"10.1111/j.1365-2966.2012.21725.x",,"astro-ph.CO","http://arxiv.org/licenses/nonexclusive-distrib/1.0/","  (abridged) We present a clustering analysis of 370 high-confidence H-alpha
emitters (HAEs) at z=2.23. The HAEs are detected in the Hi-Z Emission Line
Survey (HiZELS), a large-area blank field 2.121um narrowband survey using the
United Kingdom Infrared Telescope (UKIRT) Wide Field Camera (WFCAM). Averaging
the two-point correlation function of HAEs in two ~1 degree scale fields
(United Kingdom Infrared Deep Sky Survey/Ultra Deep Survey [UDS] and
Cosmological Evolution Survey [COSMOS] fields) we find a clustering amplitude
equivalent to a correlation length of r_0=3.7+/-0.3 Mpc/h for galaxies with
star formation rates of >7 M_sun/yr. The data are well-fitted by the expected
correlation function of Cold Dark Matter, scaled by a bias factor:
omega_HAE=b^2 omega_DM where b=2.4^{+0.1}_{-0.2}. The corresponding
'characteristic' mass for the halos hosting HAEs is
log(M_h/[M_sun/h])=11.7+/-0.1. Comparing to the latest semi-analytic GALFORM
predictions for the evolution of HAEs in a LCDM cosmology, we find broad
agreement with the observations, with GALFORM predicting a HAE correlation
length of ~4 Mpc/h. Motivated by this agreement, we exploit the simulations to
construct a parametric model of the halo occupation distribution (HOD) of HAEs,
and use this to fit the observed clustering. Our best-fitting HOD can
adequately reproduce the observed angular clustering of HAEs, yielding an
effective halo mass and bias in agreement with that derived from the scaled
omega_DM fit, but with the relatively small sample size the current data
provide a poor constraint on the HOD. Our results support the broad picture
that 'typical' (~L*) star-forming galaxies have been hosted by dark matter
haloes with M_h<10^12 M_sun/h since z~2, but with a broad occupation
distribution and clustering that is likely to be a strong function of
luminosity.
","[{""version"":""v1"",""created"":""Mon, 18 Jun 2012 20:00:07 GMT""}]","2015-06-05"
"1206.4053","Yuichiro Nakai","Ryuichiro Kitano, Markus A. Luty, Yuichiro Nakai","Partially Composite Higgs in Supersymmetry","31 pages",,"10.1007/JHEP08(2012)111","TU-913","hep-ph hep-th","http://arxiv.org/licenses/nonexclusive-distrib/1.0/","  We propose a framework for natural breaking of electroweak symmetry in
supersymmetric models, where elementary Higgs fields are semi-perturbatively
coupled to a strong superconformal sector. The Higgs VEVs break conformal
symmetry in the strong sector at the TeV scale, and the strong sector in turn
gives important contributions to the Higgs potential, giving rise to a kind of
Higgs bootstrap. A Higgs with mass $125\GeV$ can be accommodated without any
fine tuning. A Higgsino mass of order the Higgs mass is also dynamically
generated in these models. The masses in the strong sector generically violate
custodial symmetry, and a good precision electroweak fit requires tuning of
order $\sim 10%$. The strong sector has an approximately supersymmetric
spectrum of hadrons at the TeV scale that can be observed by looking for a peak
in the $WZ$ invariant mass distribution, as well as final states containing
multiple $W$, $Z$, and Higgs bosons. The models also generically predict large
corrections (either enhancement or suppression) to the $h \to \ga\ga$ width.
","[{""version"":""v1"",""created"":""Mon, 18 Jun 2012 20:00:07 GMT""}]","2015-06-05"
"1206.4054","Rodolfo Barniol Duran","R. Barniol Duran, Z. Bosnjak, P. Kumar","Inverse Compton cooling in Klein-Nishina regime and GRB prompt spectrum","10 pages (single column), 2 figures, MNRAS in press","Mon. Not. Roy. Astron. Soc. 424 (2012) 3192-3200","10.1111/j.1365-2966.2012.21533.x",,"astro-ph.HE","http://arxiv.org/licenses/nonexclusive-distrib/1.0/","  Synchrotron radiation mechanism, when electrons are accelerated in a
relativistic shock, is known to have serious problems to explain the observed
gamma-ray spectrum below the peak for most Gamma-Ray Bursts (GRBs); the
synchrotron spectrum below the peak is much softer than observed spectra.
Recently, the possibility that electrons responsible for the radiation cool via
Inverse Compton, but in the Klein-Nishina regime, has been proposed as a
solution to this problem. We provide an analytical study of this effect and
show that it leads to a hardening of the low energy spectrum but not by enough
to make it consistent with the observed spectra for most GRBs (this is assuming
that electrons are injected continuously over a time scale comparable to the
dynamical time scale, as is expected for internal shocks of GRBs). In
particular, we find that it is not possible to obtain a spectrum with
\alpha>-0.1 (f_{\nu} \propto \nu^{\alpha}) whereas the typical observed value
is \alpha\sim0. Moreover, extreme values for a number of parameters are
required in order that \alpha\sim-0.1: the energy fraction in magnetic field
needs to be less than about 10^{-4}, the thermal Lorentz factor of electrons
should be larger than 10^6, and the radius where gamma-rays are produced should
be not too far away from the deceleration radius. These difficulties suggest
that the synchrotron radiation mechanism in internal shocks does not provide a
self-consistent solution when \alpha>-0.2.
","[{""version"":""v1"",""created"":""Mon, 18 Jun 2012 20:00:08 GMT""}]","2012-11-02"
"1206.4055","Perivolaropoulos Leandros","Antonio Mariano and Leandros Perivolaropoulos","Is there Correlation between Fine Structure and Dark Energy Cosmic
  Dipoles?","14 pages 11 figures (two column revtex). Aceepted in Phys. Rev. D (to
  appear). Significant extensions (mostly on section 4 on the theoretical
  model), added references, corrected typos. The data, updated mathematica and
  C program files used for the numerical analysis may be downloaded from
  http://leandros.physics.uoi.gr/defsdipoles",,"10.1103/PhysRevD.86.083517",,"astro-ph.CO gr-qc hep-ph hep-th","http://arxiv.org/licenses/nonexclusive-distrib/1.0/","  We present a detailed analysis (including redshift tomography) of the cosmic
dipoles in the Keck+VLT quasar absorber and in the Union2 SnIa samples. We show
that the fine structure constant cosmic dipole obtained through the Keck+VLT
quasar absorber sample at $4.1\sigma$ level is anomalously aligned with the
corresponding dark energy dipole obtained through the Union2 sample at
$2\sigma$ level. The angular separation between the two dipole directions is
$11.3^\circ \pm 11.8^\circ$. We use Monte Carlo simulations to find the
probability of obtaining the observed dipole magnitudes with the observed
alignment, in the context of an isotropic cosmological model with no
correlation between dark energy and fine structure constant $\alpha$. We find
that this probability is less than one part in $10^6$. We propose a simple
physical model (extended topological quintessence) which naturally predicts a
spherical inhomogeneous distribution for both dark energy density and fine
structure constant values. The model is based on the existence of a recently
formed giant global monopole with Hubble scale core which also couples
non-minimally to electromagnetism. Aligned dipole anisotropies would naturally
emerge for an off-centre observer for both the fine structure constant and for
dark energy density. This model smoothly reduces to \lcdm for proper limits of
its parameters. Two predictions of this model are (a) a correlation between the
existence of strong cosmic electromagnetic fields and the value of $\alpha$ and
(b) the existence of a dark flow on Hubble scales due to the repulsive gravity
of the global defect core (`Great Repulser') aligned with the dark energy and
$\alpha$ dipoles. The direction of the dark flow is predicted to be towards the
spatial region of lower accelerating expansion. Existing data about the dark
flow are consistent with this prediction.
","[{""version"":""v1"",""created"":""Mon, 18 Jun 2012 20:00:29 GMT""},{""version"":""v2"",""created"":""Sun, 24 Jun 2012 16:08:42 GMT""},{""version"":""v3"",""created"":""Wed, 5 Sep 2012 15:34:04 GMT""}]","2013-05-30"
"1206.4056","Andrei Osipov","Andrei Osipov","Certain inequalities involving prolate spheroidal wave functions and
  associated quantities","48 pages, 5 figures. See also technical report at
  http://www.cs.yale.edu/publications/techreports/tr1449.pdf","Appl. Comput. Harmon. Anal. (2012)","10.1016/j.acha.2012.10.002",,"math.CA math.NA","http://arxiv.org/licenses/nonexclusive-distrib/1.0/","  Prolate spheroidal wave functions (PSWFs) play an important role in various
areas, from physics (e.g. wave phenomena, fluid dynamics) to engineering (e.g.
signal processing, filter design). Even though the significance of PSWFs was
realized at least half a century ago, and they frequently occur in
applications, their analytical properties have not been investigated as much as
those of many other special functions. In particular, despite some recent
progress, the gap between asymptotic expansions and numerical experience, on
the one hand, and rigorously proven explicit bounds and estimates, on the other
hand, is still rather wide.
  This paper attempts to improve the current situation. We analyze the
differential operator associated with PSWFs, to derive fairly tight estimates
on its eigenvalues. By combining these inequalities with a number of standard
techniques, we also obtain several other properties of the PSFWs. The results
are illustrated via numerical experiments.
","[{""version"":""v1"",""created"":""Mon, 18 Jun 2012 20:00:54 GMT""}]","2012-12-14"
"1206.4057","Warren R. Brown","Warren R. Brown (1), Judith G. Cohen (2), Margaret J. Geller (1),
  Scott J. Kenyon (1) ((1) Smithsonian, (2) Caltech)","The Nature of Hypervelocity Stars and the Time Between Their Formation
  and Ejection","6 pages, accepted to ApJ Letters",,"10.1088/2041-8205/754/1/L2",,"astro-ph.GA astro-ph.SR","http://arxiv.org/licenses/nonexclusive-distrib/1.0/","  We obtain Keck HIRES spectroscopy of HVS5, one of the fastest unbound stars
in the Milky Way halo. We show that HVS5 is a 3.62 +- 0.11 Msun main sequence B
star at a distance of 50 +- 5 kpc. The difference between its age and its
flight time from the Galactic center is 105 +-18(stat)+-30(sys) Myr; flight
times from locations elsewhere in the Galactic disk are similar. This 10^8 yr
`arrival time' between formation and ejection is difficult to reconcile with
any ejection scenario involving massive stars that live for only 10^7 yr. For
comparison, we derive arrival times of 10^7 yr for two unbound runaway B stars,
consistent with their disk origin where ejection results from a supernova in a
binary system or dynamical interactions between massive stars in a dense star
cluster. For HVS5, ejection during the first 10^7 yr of its lifetime is ruled
out at the 3-sigma level. Together with the 10^8 yr arrival times inferred for
three other well-studied hypervelocity stars (HVSs), these results are
consistent with a Galactic center origin for the HVSs. If the HVSs were indeed
ejected by the central black hole, then the Galactic center was forming stars
~200 Myr ago, and the progenitors of the HVSs took ~100 Myr to enter the black
hole's loss cone.
","[{""version"":""v1"",""created"":""Mon, 18 Jun 2012 20:00:59 GMT""}]","2015-06-05"
"1206.4058","Ond\v{r}ej Pejcha","P. Cagas, O. Pejcha","Discovery of a double eclipsing binary with periods near a 3:2 ratio","4 pages, 3 figures, 2 tables. Accepted to A&A Letters","Astronomy&Astrophysics, 544 (2012), L3","10.1051/0004-6361/201219815",,"astro-ph.SR","http://arxiv.org/licenses/nonexclusive-distrib/1.0/","  The evolution of multiple stellar systems can be driven by Kozai cycles and
tidal friction (KCTF), which shrink the orbit of the inner binary. There is an
interesting possibility that two close binaries on a common long-period orbit
experience mutually-induced KCTF. We present the discovery of a possible new
quadruple system composed of two unresolved eclipsing binaries (EBs), CzeV343
(V~13.5 mag). We obtained photometric observations of CzeV343 that completely
cover the two orbital periods and we successfully model the light curves as the
sum of two detached EBs. We provide confidence intervals for the model
parameters and minima timings by bootstrap resampling of our data. One of the
EBs shows a distinctly eccentric orbit with a total eccentricity of about 0.18.
The two orbital periods, 1.20937 and 0.80693 days, are within 0.1% of a 3:2
ratio. We speculate that this might be the result of KCTF-driven evolution of a
quadruple system and we discuss this hypothesis in the context of other
quadruple systems composed of two EBs. We make our double EB fitting code
publicly available to provide a tool for long-term monitoring of the mutual
orbit in such systems.
","[{""version"":""v1"",""created"":""Mon, 18 Jun 2012 20:01:14 GMT""}]","2012-07-31"
"1206.4059","Jason Li","Jason Li, Jeremiah Ostriker, and Rashid Sunyaev","Rotating Accretion Flows: From Infinity to the Black Hole","accepted for publication in ApJ",,"10.1088/0004-637X/767/2/105",,"astro-ph.GA astro-ph.HE","http://arxiv.org/licenses/nonexclusive-distrib/1.0/","  Accretion onto a supermassive black hole of a rotating inflow is a
particularly difficult problem to study because of the wide range of length
scales involved. There have been broadly utilized analytic and numerical
treatments of the global properties of accretion flows, but detailed numerical
simulations are required to address certain critical aspects. We use the ZEUS
code to run hydrodynamical simulations of rotating, axisymmetric accretion
flows with Bremsstrahlung cooling, considering solutions for which the
centrifugal balance radius significantly exceeds the Schwarzschild radius, with
and without viscous angular momentum transport. Infalling gas is followed from
well beyond the Bondi radius down to the vicinity of the black hole. We produce
a continuum of solutions with respect to the single parameter
Mdot_Bondi/Mdot_Edd, and there is a sharp transition between two general
classes of solutions at an Eddington ratio of Mdot_Bondi/Mdot_Edd ~ few x
10^(-2). Our high inflow solutions are very similar to the standard Shakura &
Sunyaev (1973) results. But our low inflow results are to zeroth order the
stationary Papaloizou and Pringle (1984) solution, which has no accretion. To
next order in the small, assumed viscosity they show circulation, with disk and
conical wind outflows almost balancing inflow. These solutions are
characterized by hot, vertically extended disks, and net accretion proceeds at
an extremely low rate, only of order alpha times the inflow rate. Our
simulations have converged with respect to spatial resolution and temporal
duration, and they do not depend strongly on our choice of boundary conditions.
","[{""version"":""v1"",""created"":""Mon, 18 Jun 2012 20:02:04 GMT""},{""version"":""v2"",""created"":""Thu, 8 Nov 2012 03:53:46 GMT""},{""version"":""v3"",""created"":""Sat, 26 Jan 2013 02:55:33 GMT""},{""version"":""v4"",""created"":""Wed, 27 Mar 2013 01:07:24 GMT""}]","2015-06-05"
"1206.4060","Jean-Christophe Mauduit","J.-C. Mauduit, M. Lacy, D. Farrah, J. A. Surace, M. Jarvis, S. Oliver,
  C. Maraston, M. Vaccari, L. Marchetti, G. Zeimann, E. A. Gonzalez-Solares, J.
  Pforr, A. O. Petric, B. Henriques, P. A. Thomas, J. Afonso, A. Rettura, G.
  Wilson, J. T. Falder, J. E. Geach, M. Huynh, R. P. Norris, N. Seymour, G. T.
  Richards, S. A. Stanford, D. M. Alexander, R. H. Becker, P. N. Best, L.
  Bizzocchi, D. Bonfield, N. Castro, A. Cava, S. Chapman, N. Christopher, D. L.
  Clements, G. Covone, N. Dubois, J. S. Dunlop, E. Dyke, A. Edge, H. C.
  Ferguson, S. Foucaud, A. Franceschini, R. R. Gal, J. K. Grant, M. Grossi, E.
  Hatziminaoglou, S. Hickey, J. A. Hodge, J.-S. Huang, R. J. Ivison, M. Kim, O.
  LeFevre, M. Lehnert, C. J. Lonsdale, L. M. Lubin, R. J. McLure, H. Messias,
  A. Martinez-Sansigre, A. M. J. Mortier, D. M. Nielsen, M. Ouchi, G. Parish,
  I. Perez-Fournon, M. Pierre, S. Rawlings, A. Readhead, S. E. Ridgway, D.
  Rigopoulou, A. K. Romer, I. G. Rosebloom, H. J. A. Rottgering, M.
  Rowan-Robinson, A. Sajina, C. J. Simpson, I. Smail, G. K. Squires, J. A.
  Stevens, R. Taylor, M. Trichas, T. Urrutia, E. van Kampen, A. Verma, C. K. Xu","The Spitzer Extragalactic Representative Volume Survey (SERVS): survey
  definition and goals","21 pages, 23 figures, published in PASP. This version differs
  slightly from PASP, mainly due to formatting issues. Figure 2 was also
  corrected from the previous version","Publications of the Astronomical Society of the Pacific, 2012,
  Volume 124, issue 917, pp.714-736","10.1086/666945",,"astro-ph.CO","http://arxiv.org/licenses/nonexclusive-distrib/1.0/","  We present the Spitzer Extragalactic Representative Volume Survey (SERVS), an
18 square degrees medium-deep survey at 3.6 and 4.5 microns with the
post-cryogenic Spitzer Space Telescope to ~2 microJy (AB=23.1) depth of five
highly observed astronomical fields (ELAIS-N1, ELAIS-S1, Lockman Hole, Chandra
Deep Field South and XMM-LSS). SERVS is designed to enable the study of galaxy
evolution as a function of environment from z~5 to the present day, and is the
first extragalactic survey both large enough and deep enough to put rare
objects such as luminous quasars and galaxy clusters at z>1 into their
cosmological context. SERVS is designed to overlap with several key surveys at
optical, near- through far-infrared, submillimeter and radio wavelengths to
provide an unprecedented view of the formation and evolution of massive
galaxies. In this paper, we discuss the SERVS survey design, the data
processing flow from image reduction and mosaicing to catalogs, as well as
coverage of ancillary data from other surveys in the SERVS fields. We also
highlight a variety of early science results from the survey.
","[{""version"":""v1"",""created"":""Mon, 18 Jun 2012 20:03:24 GMT""},{""version"":""v2"",""created"":""Mon, 17 Sep 2012 23:04:52 GMT""}]","2015-03-20"
