"1201.3086","Natalia Khotkevych","N. V. Khotkevych, Yu. A. Kolesnichenko and J. M. van Ruitenbeek","Conductance of a STM contact on the surface of a thin film","15 pages, 5 figures","Low Temp. Phys. 38, 503 (2012)","10.1063/1.4723673",,"cond-mat.mes-hall","http://arxiv.org/licenses/nonexclusive-distrib/1.0/","  The conductance of a contact, having a radius smaller than the Fermi wave
length, on the surface of a thin metal film is investigated theoretically. It
is shown that quantization of the electron energy spectrum in the film leads to
a step-like dependence of differential conductance G(V) as a function of
applied bias eV. The distance between neighboring steps in eV equals the energy
level spacing due to size quantization. We demonstrate that a study of G(V) for
both signs of the voltage maps the spectrum of energy levels above and below
Fermi surface in scanning tunneling experiments.
","[{""version"":""v1"",""created"":""Sun, 15 Jan 2012 11:59:08 GMT""}]","2014-01-16"
"1201.3087","Peter Klimek","Peter Klimek, Yuri Yegorov, Rudolf Hanel, Stefan Thurner","Statistical detection of systematic election irregularities","For data see also
  http://www.complex-systems.meduniwien.ac.at/elections/election.html","Proceedings of the National Academy of Sciences USA 109,
  16469-16473, 2012","10.1073/pnas.1210722109",,"physics.soc-ph physics.data-an stat.AP","http://arxiv.org/licenses/nonexclusive-distrib/1.0/","  Democratic societies are built around the principle of free and fair
elections, that each citizen's vote should count equal. National elections can
be regarded as large-scale social experiments, where people are grouped into
usually large numbers of electoral districts and vote according to their
preferences. The large number of samples implies certain statistical
consequences for the polling results which can be used to identify election
irregularities. Using a suitable data collapse, we find that vote distributions
of elections with alleged fraud show a kurtosis of hundred times more than
normal elections on certain levels of data aggregation. As an example we show
that reported irregularities in recent Russian elections are indeed well
explained by systematic ballot stuffing and develop a parametric model
quantifying to which extent fraudulent mechanisms are present. We show that if
specific statistical properties are present in an election, the results do not
represent the will of the people. We formulate a parametric test detecting
these statistical properties in election results. Remarkably, this technique
produces similar outcomes irrespective of the data resolution and thus allows
for cross-country comparisons.
","[{""version"":""v1"",""created"":""Sun, 15 Jan 2012 12:48:16 GMT""},{""version"":""v2"",""created"":""Thu, 26 Jan 2012 21:25:41 GMT""},{""version"":""v3"",""created"":""Wed, 27 Feb 2013 10:02:07 GMT""},{""version"":""v4"",""created"":""Thu, 27 Jun 2013 12:57:54 GMT""}]","2013-06-28"
"1201.3088","B.Sundar Rajan","Sudipta Kundu and B. Sundar Rajan","An Adaptive Modulation Scheme for Two-user Fading MAC with Quantized
  Fade State Feedback","12 pages; 11 figures",,,,"cs.IT math.IT","http://arxiv.org/licenses/nonexclusive-distrib/1.0/","  With no CSI at the users, transmission over the two-user Gaussian Multiple
Access Channel with fading and finite constellation at the input, is not
efficient because error rates will be high when the channel conditions are
poor. However, perfect CSI at the users is an unrealistic assumption in the
wireless scenario, as it would involve massive feedback overheads. In this
paper we propose a scheme which uses only quantized knowledge of CSI at the
transmitters with the overhead being nominal. The users rotate their
constellation without varying their transmit power to adapt to the existing
channel conditions, in order to meet certain pre-determined minimum Euclidean
distance requirement in the equivalent constellation at the destination. The
optimal modulation scheme has been described for the case when both the users
use symmetric M-PSK constellations at the input, where $ M=2^\lambda $, $
\lambda $ being a positive integer. The strategy has been illustrated by
considering examples where both users use QPSK or 8-PSK signal sets at the
input. It is shown that the proposed scheme has better throughput and error
performance compared to the conventional non-adaptive scheme, at the cost of a
feedback overhead of just $\lceil \log_2(\frac{M^2}{8}-\frac{M}{4}+2)\rceil + 1
$ bits, for the M-PSK case.
","[{""version"":""v1"",""created"":""Sun, 15 Jan 2012 13:32:37 GMT""}]","2012-01-17"
"1201.3089","Martin Hairer","Martin Hairer and Marc D. Ryser and Hendrik Weber","Triviality of the 2D stochastic Allen-Cahn equation",,,"10.1214/EJP.v17-1731",,"math.PR math-ph math.AP math.MP","http://arxiv.org/licenses/nonexclusive-distrib/1.0/","  We consider the stochastic Allen-Cahn equation driven by mollified space-time
white noise. We show that, as the mollifier is removed, the solutions converge
weakly to 0, independently of the initial condition. If the intensity of the
noise simultaneously converges to 0 at a sufficiently fast rate, then the
solutions converge to those of the deterministic equation. At the critical
rate, the limiting solution is still deterministic, but it exhibits an
additional damping term.
","[{""version"":""v1"",""created"":""Sun, 15 Jan 2012 13:49:37 GMT""}]","2016-06-02"
"1201.3090","Theodore Kolokolnikov","Theodore Kolokolnikov, Michael Ward, Juncheng Wei","The Stability of Steady-State Hot-Spot Patterns for a Reaction-Diffusion
  Model of Urban Crime",,,,,"nlin.PS","http://arxiv.org/licenses/nonexclusive-distrib/1.0/","  The existence and stability of localized patterns of criminal activity are
studied for the reaction-diffusion model of urban crime that was introduced by
Short et. al. [Math. Models. Meth. Appl. Sci., 18, Suppl. (2008), pp.
1249--1267]. Such patterns, characterized by the concentration of criminal
activity in localized spatial regions, are referred to as hot-spot patterns and
they occur in a parameter regime far from the Turing point associated with the
bifurcation of spatially uniform solutions. Singular perturbation techniques
are used to construct steady-state hot-spot patterns in one and two-dimensional
spatial domains, and new types of nonlocal eigenvalue problems are derived that
determine the stability of these hot-spot patterns to ${\mathcal O}(1)$
time-scale instabilities. From an analysis of these nonlocal eigenvalue
problems, a critical threshold $K_c$ is determined such that a pattern
consisting of $K$ hot-spots is unstable to a competition instability if
$K>K_c$. This instability, due to a positive real eigenvalue, triggers the
collapse of some of the hot-spots in the pattern. Furthermore, in contrast to
the well-known stability results for spike patterns of the Gierer-Meinhardt
reaction-diffusion model, it is shown for the crime model that there is only a
relatively narrow parameter range where oscillatory instabilities in the
hot-spot amplitudes occur. Such an instability, due to a Hopf bifurcation, is
studied explicitly for a single hot-spot in the shadow system limit, for which
the diffusivity of criminals is asymptotically large. Finally, the parameter
regime where localized hot-spots occur is compared with the parameter regime,
studied in previous works, where Turing instabilities from a spatially uniform
steady-state occur.
","[{""version"":""v1"",""created"":""Sun, 15 Jan 2012 14:22:43 GMT""}]","2012-01-17"
"1201.3091","Robert Ganian","Robert Ganian","Using Neighborhood Diversity to Solve Hard Problems",,,,,"cs.DS cs.CC","http://arxiv.org/licenses/nonexclusive-distrib/1.0/","  Parameterized algorithms are a very useful tool for dealing with NP-hard
problems on graphs. Yet, to properly utilize parameterized algorithms it is
necessary to choose the right parameter based on the type of problem and
properties of the target graph class. Tree-width is an example of a very
successful graph parameter, however it cannot be used on dense graph classes
and there also exist problems which are hard even on graphs of bounded
tree-width. Such problems can be tackled by using vertex cover as a parameter,
however this places severe restrictions on admissible graph classes.
  Michael Lampis has recently introduced neighborhood diversity, a new graph
parameter which generalizes vertex cover to dense graphs. Among other results,
he has shown that simple parameterized algorithms exist for a few problems on
graphs of bounded neighborhood diversity. Our article further studies this area
and provides new algorithms parameterized by neighborhood diversity for the
p-Vertex-Disjoint Paths, Graph Motif and Precoloring Extension problems -- the
latter two being hard even on graphs of bounded tree-width.
","[{""version"":""v1"",""created"":""Sun, 15 Jan 2012 14:52:50 GMT""},{""version"":""v2"",""created"":""Tue, 17 Jan 2012 13:13:47 GMT""}]","2012-01-18"
"1201.3092","Raju Baddi","Raju Baddi","High Voltage Electrostatic Pendulum","5 pages, 2 figures",,,,"physics.pop-ph physics.ins-det","http://arxiv.org/licenses/nonexclusive-distrib/1.0/","  A pendulum powered by high voltage electricity is described. The pendulum
consists of two conducting plates(thin foil) separated by copper rods and are
insulated from each other. High voltage is applied to these plates through the
connecting copper rods. Another stationary aluminum plate(thin foil) is placed
in front of the pendulum such that it serves to attract the pendulum plates and
makes electrical contact with them enabling charge transfer between the
stationary plate and the pendulum plates. The pendulum is powered by the energy
stored in the capacitance between the stationary aluminum plate and the
pendulum plate. Attempt has been made to obtain the time period of oscillations
as a function of applied voltage and other parameters. The derived formula for
the time period has been verified experimentally. This apparatus can be used to
demonstrate electrical phenomena in general and in particular electrical energy
stored in conductors of small dimensions.
","[{""version"":""v1"",""created"":""Sun, 15 Jan 2012 14:56:09 GMT""}]","2012-01-17"
"1201.3093","Cms Collaboration","CMS Collaboration","Measurement of isolated photon production in pp and PbPb collisions at
  sqrt(sNN) = 2.76 TeV","Submitted to Physics Letters B","Phys. Lett. B 710 (2012) 256","10.1016/j.physletb.2012.02.077","CMS-HIN-11-002; CERN-PH-EP-2011-221","nucl-ex hep-ex","http://arxiv.org/licenses/nonexclusive-distrib/1.0/","  Isolated photon production is measured in proton-proton and lead-lead
collisions at nucleon-nucleon centre-of-mass energies of 2.76 TeV in the
pseudorapidity range |eta|<1.44 and transverse energies ET between 20 and 80
GeV with the CMS detector at the LHC. The measured ET spectra are found to be
in good agreement with next-to-leading-order perturbative QCD predictions. The
ratio of PbPb to pp isolated photon ET-differential yields, scaled by the
number of incoherent nucleon-nucleon collisions, is consistent with unity for
all PbPb reaction centralities.
","[{""version"":""v1"",""created"":""Sun, 15 Jan 2012 15:02:53 GMT""},{""version"":""v2"",""created"":""Tue, 22 Jan 2013 12:32:24 GMT""}]","2013-01-23"
"1201.3094","Zhenbo Qin","Wei-Ping Li, Zhenbo Qin","The Cohomological Crepant Resolution Conjecture for the Hilbert-Chow
  morphisms","40 pages. Clarified the role of non-separated spaces used the proofs,
  and adjusted related notations accordingly",,,,"math.AG math.RT","http://arxiv.org/licenses/nonexclusive-distrib/1.0/","  In this paper, we prove that Ruan's Cohomological Crepant Resolution
Conjecture holds for the Hilbert-Chow morphisms. There are two main ideas in
the proof. The first one is to use the representation theoretic approach
proposed in [QW] which involves vertex operator techniques. The second is to
prove certain universality structures about the 3-pointed genus-0 extremal
Gromov-Witten invariants of the Hilbert schemes by using the indexing
techniques from [LiJ], the product formula from [Beh2] and the co-section
localization from [KL1, KL2, LL]. We then reduce Ruan's Conjecture from the
case of an arbitrary surface to the case of smooth projective toric surfaces
which has already been proved in [Che].
","[{""version"":""v1"",""created"":""Sun, 15 Jan 2012 15:09:37 GMT""},{""version"":""v2"",""created"":""Fri, 7 Jun 2013 02:19:17 GMT""}]","2013-06-10"
"1201.3095","Savvas Gitzenis","S. Gitzenis, G. S. Paschos, L. Tassiulas","Asymptotic Laws for Joint Content Replication and Delivery in Wireless
  Networks",,,"10.1109/TIT.2012.2235905",,"cs.NI","http://arxiv.org/licenses/nonexclusive-distrib/1.0/","  We investigate on the scalability of multihop wireless communications, a
major concern in networking, for the case that users access content replicated
across the nodes. In contrast to the standard paradigm of randomly selected
communicating pairs, content replication is efficient for certain regimes of
file popularity, cache and network size. Our study begins with the detailed
joint content replication and delivery problem on a 2D square grid, a hard
combinatorial optimization. This is reduced to a simpler problem based on
replication density, whose performance is of the same order as the original.
Assuming a Zipf popularity law, and letting the size of content and network
both go to infinity, we identify the scaling laws and regimes of the required
link capacity, ranging from O(\sqrt{N}) down to O(1).
","[{""version"":""v1"",""created"":""Sun, 15 Jan 2012 15:17:20 GMT""},{""version"":""v2"",""created"":""Tue, 8 Jan 2013 17:24:56 GMT""}]","2015-03-20"
"1201.3096","Anne Ersbak Bang Nielsen","Anne E. B. Nielsen, J. Ignacio Cirac and German Sierra","Laughlin spin liquid states on lattices obtained from conformal field
  theory","5+6 pages, 4 figures","Phys. Rev. Lett. 108, 257206 (2012)","10.1103/PhysRevLett.108.257206",,"cond-mat.str-el quant-ph","http://arxiv.org/licenses/nonexclusive-distrib/1.0/","  We propose a set of spin system wavefunctions that are very similar to
lattice versions of the Laughlin states. The wavefunction are conformal blocks
of conformal field theories, and for filling factor \nu=1/2 we provide a parent
Hamiltonian, which is valid for any even number of spins and is at the same
time a 2D generalization of the Haldane-Shastry model. We also demonstrate that
the Kalmeyer-Laughlin state is reproduced as a particular case of this model.
Finally, we discuss various properties of the spin states and point out several
analogies to known results for the Laughlin states.
","[{""version"":""v1"",""created"":""Sun, 15 Jan 2012 15:34:35 GMT""},{""version"":""v2"",""created"":""Mon, 28 May 2012 12:03:52 GMT""}]","2012-06-21"
"1201.3097","Odemir Bruno PhD","Jo\~ao B. Florindo, Odemir M. Bruno","Closed Contour Fractal Dimension Estimation by the Fourier Transform",,"Chaos, Solitons and Fractals, Volume 44, Issue 10, October 2011,
  Pages 851--861","10.1016/j.chaos.2011.07.008",,"physics.data-an cs.DM math.DS","http://arxiv.org/licenses/nonexclusive-distrib/1.0/","  This work proposes a novel technique for the numerical calculus of the
fractal dimension of fractal objects which can be represented as a closed
contour. The proposed method maps the fractal contour onto a complex signal and
calculates its fractal dimension using the Fourier transform. The Fourier power
spectrum is obtained and an exponential relation is verified between the power
and the frequency. From the parameter (exponent) of the relation, it is
obtained the fractal dimension. The method is compared to other classical
fractal dimension estimation methods in the literature, e. g.,
Bouligand-Minkowski, box-couting and classical Fourier. The comparison is
achieved by the calculus of the fractal dimension of fractal contours whose
dimensions are well-known analytically. The results showed the high precision
and robustness of the proposed technique.
","[{""version"":""v1"",""created"":""Sun, 15 Jan 2012 15:40:31 GMT""}]","2012-01-17"
"1201.3098","Cristian Stelea","Yves Brihaye, Eugen Radu, and Cristian Stelea","Charged squashed black holes with negative cosmological constant in odd
  dimensions","11 pages, 3 figures, v2 added references",,"10.1016/j.physletb.2012.02.035",,"hep-th gr-qc","http://arxiv.org/licenses/nonexclusive-distrib/1.0/","  We construct new electrically charged solutions of the Einstein-Maxwell
equations with negative cosmological constant in general odd dimensions $d=2n+3
\geq 5$. They correspond to higher dimensional generalizations of the squashed
black hole solutions, which were known so far only in five dimensions. We
explore numerically the general properties of such classical solutions and,
using a counterterm prescription, we compute their conserved charges and
discuss their thermodynamics.
","[{""version"":""v1"",""created"":""Sun, 15 Jan 2012 15:57:34 GMT""},{""version"":""v2"",""created"":""Wed, 25 Jan 2012 11:32:01 GMT""}]","2015-06-03"
"1205.2353","Thomas Larsson","T. A. Larsson","Covariant Mickelsson-Faddeev extensions of gauge and diffeomorphism
  algebras","Minor corrections",,,,"physics.gen-ph math-ph math.MP","http://arxiv.org/licenses/nonexclusive-distrib/1.0/","  We construct new extensions of current and diffeomorphism algebras in N>3
dimensions, which are related to the Mickelsson-Faddeev algebra. The result is
compatible with Dzhumadil'daev's classification of diffeomorphism cocycles. We
also construct an extension of the current algebra in N>=5 dimensions which
depends on the fourth Casimir operator.
","[{""version"":""v1"",""created"":""Sun, 15 Jan 2012 05:19:44 GMT""},{""version"":""v2"",""created"":""Fri, 11 Apr 2014 13:47:13 GMT""}]","2014-04-14"
