"1201.3026","Ivan Feshchenko","Ivan Feshchenko","On the closedness of the sum of n subspaces of a Hilbert space","46 pages","Ukrainian Mathematical Journal 2011",,,"math.FA","http://arxiv.org/licenses/nonexclusive-distrib/1.0/","  We give necessary and sufficient conditions for the sum of n subspaces of a
Hilbert space to be closed. We also present various properties of n-tuples of
subspaces with closed sum.
","[{""version"":""v1"",""created"":""Sat, 14 Jan 2012 16:25:28 GMT""}]","2012-01-17"
"1201.3027","Anna Lytova","Anna Lytova","On Non-Gaussian Limiting Laws for the Certain Statistics of the Wigner
  Matrices","arXiv admin note: text overlap with arXiv:1103.2345",,,,"math-ph math.MP","http://arxiv.org/licenses/nonexclusive-distrib/1.0/","  We continue investigations of our previous papers, in which there were proved
central limit theorems (CLT) for linear eigenvalue statistics Tr f(M_n) and
there were found the limiting probability laws for the normalised matrix
elements of differential functions f(M_n) of nxn real symmetric Wigner matrices
M_n. Here we consider another spectral characteristic of Wigner matrices,
namely, Tr f(M_n)A_n, where {A_n, n=1,2,...} is a certain sequence of
non-random matrices. We show first that if M_n belongs to the Gaussian
Orthogonal Ensemble, then Tr f(M_n)A_n satisfies CLT. Then we consider Wigner
matrices with i.i.d. entries possessing entire characteristic function and find
the limiting probability law for Tr f(M_n)A_n, which in general is not
Gaussian.
","[{""version"":""v1"",""created"":""Sat, 14 Jan 2012 16:44:17 GMT""}]","2012-01-17"
"1201.3028","Hyeyoun Chung","Hyeyoun Chung","Tunneling between single and multi-centered black hole configurations","8 pages, 4 figures. v4: final version accepted for publication in
  Phys. Rev. D",,"10.1103/PhysRevD.86.064036",,"gr-qc hep-th","http://arxiv.org/licenses/nonexclusive-distrib/1.0/","  We find a gravitational instanton that connects an initial state
corresponding to a single-centered extremal Reissner-Nordstrom (ERN) black hole
configuration, to a final state corresponding to a multi-centered
configuration. This instanton is interpreted as describing quantum tunneling
between the two different black hole solutions. We evaluate the Euclidean
action for this instanton and find that the amplitude for the tunneling process
is equal to half the difference in entropy between the initial and final
configurations.
","[{""version"":""v1"",""created"":""Sat, 14 Jan 2012 17:06:05 GMT""},{""version"":""v2"",""created"":""Thu, 19 Jan 2012 14:00:07 GMT""},{""version"":""v3"",""created"":""Thu, 15 Mar 2012 19:55:39 GMT""},{""version"":""v4"",""created"":""Mon, 20 Aug 2012 17:22:47 GMT""}]","2013-05-30"
"1201.3029","Junhan Kim","Junhan Kim, Masateru Ishiguro, Hidekazu Hanayama, Sunao Hasegawa,
  Fumihiko Usui, Kenshi Yanagisawa, Yuki Sarugaku, Jun-ichi Watanabe,
  Michitoshi Yoshida","Multiband Optical Observation of P/2010 A2 Dust Tail","4 figures, 1 table, accepted for publication in ApJL",,"10.1088/2041-8205/746/1/L11",,"astro-ph.EP","http://arxiv.org/licenses/nonexclusive-distrib/1.0/","  An inner main-belt asteroid, P/2010 A2, was discovered on January 6th, 2010.
Based on its orbital elements, it is considered that the asteroid belongs to
the Flora collisional family, where S-type asteroids are common, whilst showing
a comet-like dust tail. Although analysis of images taken by the Hubble Space
Telescope and Rosetta spacecraft suggested that the dust tail resulted from a
recent head-on collision between asteroids (Jewitt et al. 2010; Snodgrass et
al. 2010), an alternative idea of ice sublimation was suggested based on the
morphological fitting of ground-based images (Moreno et al. 2010). Here, we
report a multiband observation of P/2010 A2 made on January 2010 with a 105 cm
telescope at the Ishigakijima Astronomical Observatory. Three broadband
filters, $g'$, $R_c$, and $I_c$, were employed for the observation. The unique
multiband data reveals that the reflectance spectrum of the P/2010 A2 dust tail
resembles that of an Sq-type asteroid or that of ordinary chondrites rather
than that of an S-type asteroid. Due to the large error of the measurement, the
reflectance spectrum also resembles the spectra of C-type asteroids, even
though C-type asteroids are uncommon in the Flora family. The reflectances
relative to the $g'$-band (470 nm) are 1.096$\pm$0.046 at the $R_c$-band (650
nm) and 1.131$\pm$0.061 at the $I_c$-band (800 nm). We hypothesize that the
parent body of P/2010 A2 was originally S-type but was then shattered upon
collision into scaterring fresh chondritic particles from the interior, thus
forming the dust tail.
","[{""version"":""v1"",""created"":""Sat, 14 Jan 2012 17:09:14 GMT""}]","2015-06-03"
"1201.3030","Dai Aoki","Dai Aoki, Mathieu Taupin, Carley Paulsen, Frederic Hardy, Valentin
  Taufour, Hisashi Kotegawa, Elena Hassinger, Liam Malone, Tatsuma D. Matsuda,
  Atsushi Miyake, Ilya Sheikin, William Knafo, Georg Knebel, Ludovic Howald,
  Jean-Pascal Brison and Jacques Flouquet","Field-induced Phenomena in Ferromagnetic Superconductors UCoGe and URhGe","6 pages, 4 figures, proceedings of TOKIMEKI2011, to be published in
  J. Phys. Soc. Jpn. Suppl",,"10.1143/JPSJS.81SB.SB002",,"cond-mat.str-el cond-mat.supr-con","http://arxiv.org/licenses/nonexclusive-distrib/1.0/","  We review our recent studies on ferromagnetic superconductors, UGe2, URhGe
and UCoGe, where the spin-triplet state with the so-called equal spin pairing
is realized. We focus on experimental results of URhGe and UCoGe in which the
superconductivity occurs already at ambient pressure. The huge upper critical
field Hc2 on UCoGe for the field along the hard magnetization axis (b-axis) is
confirmed by the AC susceptibility measurements by the fine tuning of field
angle. Contrary to the huge Hc2 along the hard-magnetization axis, Hc2 along
the easy-magnetization axis (c-axis) is relatively small in value. However, the
initial slope of Hc2, namely dHc2/dT (H -> 0) both in UCoGe and in URhGe
indicates the large value, which can be explained by the magnetic domain effect
detected in the magnetization measurements. The specific heat measurements
using a high quality single crystal of UCoGe demonstrate the bulk
superconductivity, which is extended under magnetic field for the field along
c-axis.
","[{""version"":""v1"",""created"":""Sat, 14 Jan 2012 17:13:00 GMT""}]","2015-06-03"
"1201.3031","Manimala Mitra","Sandhya Choubey, Michael Duerr, Manimala Mitra, Werner Rodejohann","Lepton Number and Lepton Flavor Violation through Color Octet States","17 pages, 16 figures","JHEP 1205, 017 (2012)","10.1007/JHEP05(2012)017",,"hep-ph","http://arxiv.org/licenses/nonexclusive-distrib/1.0/","  We discuss neutrinoless double beta decay and lepton flavor violating decays
such as $\mu-> e\gamma$ in the colored seesaw scenario. In this mechanism,
neutrino masses are generated at one-loop via the exchange of TeV-scale
fermionic and scalar color octets. The same particles mediate lepton number and
flavor violating processes. We show that within this framework a dominant color
octet contribution to neutrinoless double beta decay is possible without being
in conflict with constraints from lepton flavor violating processes. We
furthermore compare the ""direct"" color octet contribution to neutrinoless
double beta decay with the ""indirect"" contribution, namely the usual standard
light Majorana neutrino exchange. For degenerate color octet fermionic states
both contributions are proportional to the usual effective mass, while for
non-degenerate octet fermions this feature is not present. Depending on the
model parameters, either of the contributions can be dominant.
","[{""version"":""v1"",""created"":""Sat, 14 Jan 2012 17:22:34 GMT""},{""version"":""v2"",""created"":""Tue, 29 May 2012 10:31:56 GMT""}]","2012-05-30"
"1201.3032","Victor H. Robles","Victor H. Robles and Tonatiuh Matos","Flat Central Density Profile and Constant DM Surface Density in Galaxies
  from Scalar Field Dark Matter","Submitted to MNRAS, 9 pages, 32 Figures, 2 Tables.The paper with
  better resolution figures can be downloaded at
  ""http://estudiantes.fis.cinvestav.mx/vrobles/SFDMfile.pdf","MNRAS, 2012, 422, 282-289","10.1111/j.1365-2966.2012.20603.x",,"astro-ph.CO gr-qc","http://arxiv.org/licenses/nonexclusive-distrib/1.0/","  The scalar field dark matter (SFDM) model proposes that galaxies form by
condensation of a scalar field (SF) very early in the universe forming
Bose-Einstein Condensates (BEC) drops, i.e., in this model haloes of galaxies
are gigantic drops of SF. Here big structures form like in the LCDM model, by
hierarchy, thus all the predictions of the LCDM model at big scales are
reproduced by SFDM. This model predicts that all galaxies must be very similar
and exist for bigger redshifts than in the LCDM model. In this work we show
that BEC dark matter haloes fit high-resolution rotation curves of a sample of
thirteen low surface brightness galaxies. We compare our fits to those obtained
using a Navarro-Frenk-White and Pseudo-Isothermal (PI) profiles and found a
better agreement with the SFDM and PI profiles. The mean value of the
logarithmic inner density slopes is -0.27 +/- 0.18. As a second result we find
a natural way to define the core radius with the advantage of being
model-independent. Using this new definition in the BEC density profile we find
that the recent observation of the constant dark matter central surface density
can be reproduced. We conclude that in light of the difficulties that the
standard model is currently facing the SFDM model can be a worthy alternative
to keep exploring further.
","[{""version"":""v1"",""created"":""Sat, 14 Jan 2012 17:36:40 GMT""}]","2012-07-26"
"1201.3033","Michael Kinyon","Michael Kinyon and Jonathan Leech","Categorical skew lattices","v2: minor changes suggested by referee; to appear in Order",,,,"math.RA","http://arxiv.org/licenses/nonexclusive-distrib/1.0/","  Categorical skew lattices are a variety of skew lattices on which the natural
partial order is especially well behaved. While most skew lattices of interest
are categorical, not all are. They are characterized by a countable family of
forbidden subalgebras. We also consider the subclass of strictly categorical
skew lattices.
","[{""version"":""v1"",""created"":""Sat, 14 Jan 2012 17:57:17 GMT""},{""version"":""v2"",""created"":""Wed, 17 Oct 2012 18:24:16 GMT""}]","2012-10-18"
"1201.3034","Francesco Banfi Dr","Francesco Banfi, Vincent Juv\'e, Damiano Nardi, Stefano Dal Conte,
  Claudio Giannetti, Gabriele Ferrini, Natalia Del Fatti, and Fabrice Vall\'ee","Temperature dependence of the thermal boundary resistivity of
  glass-embedded metal nanoparticles","4 pages, 3 figures","Appl. Phys. Lett. 100, 011902 (2012)","10.1063/1.3673559",,"cond-mat.mtrl-sci cond-mat.mes-hall","http://arxiv.org/licenses/nonexclusive-distrib/1.0/","  The temperature dependence of the thermal boundary resistivity is
investigated in glass-embedded Ag particles of radius 4.5 nm, in the
temperature range from 300 to 70 K, using all-optical time-resolved
nanocalorimetry. The present results provide a benchmark for theories aiming at
explaining the thermal boundary resistivity at the interface between metal
nanoparticles and their environment, a topic of great relevance when tailoring
thermal energy delivery from nanoparticles as for applications in nanomedicine
and thermal management at the nanoscale
","[{""version"":""v1"",""created"":""Sat, 14 Jan 2012 18:35:04 GMT""}]","2012-01-17"
"1201.3035","David Ketcheson","David I. Ketcheson and Aron J. Ahmadia","Optimal stability polynomials for numerical integration of initial value
  problems",,"CAMCoS 7-2: 247-271 (2012)","10.2140/camcos.2012.7.247",,"math.NA math.OC","http://arxiv.org/licenses/nonexclusive-distrib/1.0/","  We consider the problem of finding optimally stable polynomial approximations
to the exponential for application to one-step integration of initial value
ordinary and partial differential equations. The objective is to find the
largest stable step size and corresponding method for a given problem when the
spectrum of the initial value problem is known. The problem is expressed in
terms of a general least deviation feasibility problem. Its solution is
obtained by a new fast, accurate, and robust algorithm based on convex
optimization techniques. Global convergence of the algorithm is proven in the
case that the order of approximation is one and in the case that the spectrum
encloses a starlike region. Examples demonstrate the effectiveness of the
proposed algorithm even when these conditions are not satisfied.
","[{""version"":""v1"",""created"":""Sat, 14 Jan 2012 18:48:48 GMT""},{""version"":""v2"",""created"":""Wed, 1 Feb 2012 10:48:14 GMT""},{""version"":""v3"",""created"":""Thu, 12 Jul 2012 10:02:32 GMT""}]","2013-01-10"
"1201.3036","Javier Junquera","Marcos Verissimo-Alves, Pablo Garc\'ia-Fern\'andez, Daniel I. Bilc,
  Philippe Ghosez, and Javier Junquera","Highly-confined spin-polarized two-dimensional electron gas in
  SrTiO$_{3}$/SrRuO$_{3}$ superlattices","5 pages, 4 figures",,"10.1103/PhysRevLett.108.107003",,"cond-mat.mtrl-sci","http://arxiv.org/licenses/nonexclusive-distrib/1.0/","  We report first principles characterization of the structural and electronic
properties of (SrTiO$_{3}$)$_{5}$/(SrRuO$_{3}$)$_{1}$ superlattices. We show
that the system exhibits a spin-polarized two-dimensional electron gas,
extremely confined to the 4$d$ orbitals of Ru in the SrRuO$_{3}$ layer. Every
interface in the superlattice behaves as a minority-spin half-metal
ferromagnet, with a magnetic moment of $\mu$ = 2.0 $\mu_{\rm B}$/SrRuO$_{3}$
unit. The shape of the electronic density of states, half metallicity and
magnetism are explained in terms of a simplified tight-binding model,
considering only the $t_{2g}$ orbitals plus (i) the bi-dimensionality of the
system, and (ii) strong electron correlations.
","[{""version"":""v1"",""created"":""Sat, 14 Jan 2012 19:04:28 GMT""}]","2015-06-03"
"1201.3037","Sean Sather-Wagstaff","Sean Sather-Wagstaff","Embedding modules of finite homological dimension","12 pages, to appear in Glasgow Math. J",,,,"math.AC","http://arxiv.org/licenses/nonexclusive-distrib/1.0/","  This paper builds on work of Hochster and Yao that provides nice embeddings
for finitely generated modules of finite G-dimension, finite projective
dimension, or locally finite injective dimension. We extend these results by
providing similar embeddings in the relative setting, that is, for certain
modules of finite G_C-dimension, finite P_C-projective dimension, locally
finite GI_C-injective dimension, or locally finite I_C-injective dimension
where C is a semidualizing module. Along the way, we extend some results for
modules of finite homological dimension to modules of locally finite
homological dimension in the relative setting.
","[{""version"":""v1"",""created"":""Sat, 14 Jan 2012 19:28:03 GMT""}]","2012-01-17"
"1201.3038","Gerald Gabrielse","J. DiSciacca and G. Gabrielse","Direct Measurement of the Proton Magnetic Moment",,,"10.1103/PhysRevLett.108.153001",,"physics.atom-ph hep-ex nucl-ex","http://arxiv.org/licenses/nonexclusive-distrib/1.0/","  The proton magnetic moment in nuclear magnetons is measured to be
$\mu_p/\mu_N \equiv g/2 = 2.792\,846 \pm 0.000\,007$, a 2.5 ppm (parts per
million) uncertainty. The direct determination, using a single proton in a
Penning trap, demonstrates the first method that should work as well with an
antiproton as with a proton. This opens the way to measuring the antiproton
magnetic moment (whose uncertainty has essentially not been reduced for 20
years) at least $10^3$ times more precisely.
","[{""version"":""v1"",""created"":""Sat, 14 Jan 2012 19:35:23 GMT""},{""version"":""v2"",""created"":""Tue, 31 Jan 2012 22:24:24 GMT""}]","2015-06-03"
"1201.3039","Sean Sather-Wagstaff","Benjamin J. Anderson, Sean Sather-Wagstaff","NAK for Ext and Ascent of module structures","9 pages, revised for publication in Proceedings of the AMS",,,,"math.AC","http://arxiv.org/licenses/nonexclusive-distrib/1.0/","  We investigate the interplay between properties of Ext modules and ascent of
module structures along local ring homomorphisms. Specifically, let f: (R,m,k)
-> (S,mS,k) be a flat local ring homomorphism. We show that if M is a finitely
generated R-module such that Ext^i(S,M) satisfies NAK (e.g. if Ext^i(S,M) is
finitely generated over S) for i=1,...,dim_R(M), then Ext^i(S,M)=0 for all
i\neq 0 and M has an S-module structure that is compatible with its R-module
structure via f. We provide explicit computations of Ext^1(S,M) to indicate how
large it can be when M does not have a compatible S-module structure.
","[{""version"":""v1"",""created"":""Sat, 14 Jan 2012 19:36:15 GMT""},{""version"":""v2"",""created"":""Mon, 14 May 2012 18:31:41 GMT""}]","2012-05-15"
"1201.3040","Sean Sather-Wagstaff","Daniel Ingebretson, Sean Sather-Wagstaff","Decompositions of Monomial Ideals in Real Semigroup Rings","13 pages, minor revision according to referee's comments",,,,"math.AC","http://arxiv.org/licenses/nonexclusive-distrib/1.0/","  Irreducible decompositions of monomial ideals in polynomial rings over a
field are well-understood. In this paper, we investigate decompositions in the
set of monomial ideals in the semigroup ring A[\mathbb{R}_{\geq 0}^d] where A
is an arbitrary commutative ring with identity. We classify the irreducible
elements of this set, which we call m-irreducible, and we classify the elements
that admit decompositions into finite intersections of m-irreducible ideals.
","[{""version"":""v1"",""created"":""Sat, 14 Jan 2012 19:43:15 GMT""},{""version"":""v2"",""created"":""Fri, 18 May 2012 17:20:07 GMT""}]","2012-05-21"
"1201.3041","Filippo Miatto","Filippo M. Miatto, Henrique Di Lorenzo Pires, Stephen M. Barnett and
  Martin P. van Exter","Schmidt modes generated in parametric downconversion","11 pages, 13 figures","Eur. Phys. J. D 66, 263 (2012)","10.1140/epjd/e2012-30035-3",,"quant-ph","http://arxiv.org/licenses/nonexclusive-distrib/1.0/","  This paper presents the general Schmidt decomposition of two-photon fields
generated in spontaneous parametric down-conversion (SPDC). It discusses in
particular the separation of the radial and azimuthal degrees of freedom, the
role of projection in modal analysis, and the benefits of collinear phase
mismatch. The paper is written in a review style and presents a wealth of
numerical results. It aims at emphasising the physics beyond the mathematics,
through discussions and graphical representations of key results.
","[{""version"":""v1"",""created"":""Sat, 14 Jan 2012 19:43:51 GMT""},{""version"":""v2"",""created"":""Wed, 1 Aug 2012 12:18:26 GMT""}]","2013-07-16"
"1201.3042","Doron Bergman","Doron L. Bergman, and Gil Refael","A thermodynamic measure of the Magneto-electric coupling in the 3D
  topological insulator",,"Phys. Rev. B 87, 024202 (2013)","10.1103/PhysRevB.87.024202",,"cond-mat.mes-hall","http://arxiv.org/licenses/nonexclusive-distrib/1.0/","  We show that the magneto-electric coupling in 3D (strong) topological
insulators is related to a second derivative of the bulk magnetization. The
formula we derive is the non-linear response analog of the Streda formula for
Hall conductivity (P. Streda, J. Phys. C: Solid State Physics, 15, 22 (1982)),
which relates the Hall conductivity to the derivative of the magnetization with
respect to chemical potential. Our finding allows one to extract the
magneto-electric coefficient by measuring the magnetization, while varying the
chemical potential and one more perturbing field. Such an experimental setup
could circumvent many of the current difficulties with measuring the
magneto-electric response in 3D topological insulators. The relation we find
also makes transparent the effect of disorder on the magneto-electric response,
which occurs only through the density of states, and has no effect when the
system is gapped.
","[{""version"":""v1"",""created"":""Sat, 14 Jan 2012 20:24:55 GMT""},{""version"":""v2"",""created"":""Sun, 4 Nov 2012 02:14:57 GMT""}]","2013-01-31"
"1201.3043","Xianglin Ke","X. Ke, B. Qian, H. Cao, J. Hu, G. C. Wang, and Z. Q. Mao","Magnetic structure of quasi-1D antiferromagnetic TaFe1+yTe3 with two-leg
  zigzag ladders",,,,,"cond-mat.mtrl-sci cond-mat.str-el cond-mat.supr-con","http://arxiv.org/licenses/nonexclusive-distrib/1.0/","  We report the magnetic structure of TaFe1+yTe3 single crystals by means of
neutron diffraction measurements. TaFe1+yTe3 possesses a layered structure with
a formation of two-leg zigzag ladders along the b-axis. We find that TaFe1+yTe3
undergoes an antiferromagnetic transition at 178 K with Fe1 spins of the
intra-ladders ferromagnetically aligned while spins of the inter-ladders
antiferromagneitcally coupled. Furthermore, spins of the neighboring
interstitial Fe2 (y) ions order parallel to the Fe1 spins of each ladder. These
findings are distinct from the magnetic structure of the recently-discovered
spin-ladder compound BaFe2Se3. TaFe1+yTe3 may serve as an interesting quasi-one
dimensional ferromagnetic system.
","[{""version"":""v1"",""created"":""Sat, 14 Jan 2012 20:55:30 GMT""}]","2012-01-17"
"1201.3044","Mohamed E. Kelabi","Mohamed E. Kelabi","Time Delay Plot for Pion-Nucleon Elastic Scattering","6 pages, 3 figures",,,,"nucl-th","http://arxiv.org/licenses/nonexclusive-distrib/1.0/","  We evaluated the time delay plot in the established region of the Delta(1232)
resonance through the use of elastic scattering phase shift analysis of the
partial wave amplitude P33. The pole position and width of the Delta(1232)
resonance were obtained and found in agreement with earlier calculations.
","[{""version"":""v1"",""created"":""Sat, 14 Jan 2012 20:58:04 GMT""}]","2012-01-17"
"1201.3045","Ralf Lehnert","Mauro Cambiaso, Ralf Lehnert, and Robertus Potting","Massive photons and Lorentz violation","12 pages, 1 figure",,"10.1103/PhysRevD.85.085023",,"hep-th","http://arxiv.org/licenses/nonexclusive-distrib/1.0/","  All quadratic translation- and gauge-invariant photon operators for Lorentz
breakdown are included into the Stueckelberg Lagrangian for massive photons in
a generalized \xi-gauge. The corresponding dispersion relation and tree-level
propagator are determined exactly, and some leading-order results are derived.
The question of how to include such Lorentz-violating effects into a
perturbative quantum-field expansion is addressed. Applications of these
results within Lorentz-breaking quantum field theories include the
regularization of infrared divergences as well as the free propagation of
massive vector bosons.
","[{""version"":""v1"",""created"":""Sat, 14 Jan 2012 21:07:29 GMT""}]","2015-06-03"
"1201.3046","Francesco Banfi Dr","Emanuele Pedersoli, Francesco Banfi, Barbara Ressel, Stefania
  Pagliara, Claudio Giannetti, Gianluca Galimberti, Steve Lidia, John Corlett,
  Gabriele Ferrini, and Fulvio Parmigiani","Evidence of vectorial photoelectric effect on Copper","3 pages, 3 figures","Appl. Phys. Lett. 87, 081112 (2005)","10.1063/1.2031949",,"cond-mat.mtrl-sci","http://arxiv.org/licenses/nonexclusive-distrib/1.0/","  Quantum Efficiency (QE) measurements of single photon photoemission from a
Cu(111) single crystal and a Cu polycrystal photocathodes, irradiated by 150
fs-6.28 eV laser pulses, are reported over a broad range of incidence angle,
both in s and p polarizations. The maximum QE (\simeq 4\times10^{-4}) for
polycrystalline Cu is obtained in p polarization at an angle of incidence
{\theta} = 65deg. We observe a QE enhancement in p polarization which can not
be explained in terms of optical absorption, a phenomenon known as vectorial
photoelectric effect. Issues concerning surface roughness and symmetry
considerations are addressed. An explanation in terms of non local conductivity
tensor is proposed.
","[{""version"":""v1"",""created"":""Sat, 14 Jan 2012 21:19:59 GMT""}]","2012-01-17"
"1201.3047","Rathin Adhikari","Rathin Adhikari, Sabyasachi Chakraborty, Arnab Dasgupta, Sourov Roy","Non-standard interaction in neutrino oscillations and recent Daya Bay,
  T2K experiments","13 pages, RevTex4, 6 figures (12 eps files) Significant changes after
  incorporating Daya Bay result",,"10.1103/PhysRevD.86.073010",,"hep-ph hep-ex","http://arxiv.org/licenses/nonexclusive-distrib/1.0/","  We study the possible constraints on non-standard interaction(NSIs) in a
model independent way by considering the recent results from T2K and Daya Bay
neutrino oscillations experiments. Using perturbation method we present generic
formulas (suitable for T2K baseline and for large $\theta_{13}$ as evident from
Daya Bay) for the probability of oscillation for $\nu_\mu \rightarrow \nu_e$,
taking into account NSIs at source ($\epsilon^s$), detector ($\epsilon^d$) and
during propagation ($\epsilon^m$) of neutrinos through matter. Two separate
cases of perturbation with small (slightly large) NSI
($\epsilon_{\alpha\beta}^m \sim 0.03(0.18)$) are discussed in detail. Using
various possible presently allowed NSI values we reanalyze numerically the
$\theta_{13} - \delta$ allowed region given by recent T2K experimental data. We
obtain model independent constraints on NSIs in the
$\delta-\epsilon_{\alpha\beta}^m$ plane using the $\theta_{13}$ value as
measured by Daya Bay, where $\delta$ is the CP violating phase. Depending on
$\delta$ values significant constraints on $\epsilon_{e\tau}$ and
$\epsilon_{\tau\tau}$, in particular, are possible for both hierarchies of
neutrino masses. Corresponding to T2K's 66% confidence level result, the
constraints on $\epsilon_{\tau\tau}$ is shown to be independent of any $\delta$
value.
","[{""version"":""v1"",""created"":""Sat, 14 Jan 2012 21:36:02 GMT""},{""version"":""v2"",""created"":""Thu, 30 Aug 2012 20:12:13 GMT""}]","2013-05-30"
