"1201.3048","John McLeod","J. A. McLeod and A. Buling and E. Z. Kurmaev and P. V. Sushko and M.
  Neumann and L. D. Finkelstein and S.-W. Kim and H. Hosono and A. Moewes","Experimental Evidence of Cage Conduction Bands in Superconducting Cement
  12CaO$\cdot$7Al$_2$O$_3$","20 pages, 6 figures","Phys. Rev. B 85, 045204 (2012)","10.1103/PhysRevB.85.045204",,"cond-mat.supr-con","http://arxiv.org/licenses/nonexclusive-distrib/1.0/","  Natural 12CaO$\cdot$7Al$_2$O$_3$ (C12A7) is a wide bandgap insulator, but
conductivity can be realized by introducing oxygen deficiency. Currently, there
are two competing models explaining conductivity in oxygen-deficient C12A7, one
involving the electron transfer via a ""cage conduction band"" inside the nominal
band gap, the other involving electron hopping along framework lattice sites.
To help resolve this debate, we probe insulating and conducting C12A7 with
X-ray emission, X-ray absorption, and X-ray photoemission spectroscopy, which
provide a full picture of both the valence and conduction band edges in these
materials. These measurements suggest the existence of a narrow conduction band
between the main conduction and valence bands common in both conducting and
insulating C12A7 and support the theory that free electrons in oxygen-deficient
C12A7 occupy the low-energy states of this narrow band. Our measurements are
corroborated with density functional theory calculations.
","[{""version"":""v1"",""created"":""Sat, 14 Jan 2012 21:51:44 GMT""}]","2012-01-17"
"1201.3049","Francesco Banfi Dr","Francesco Banfi, Claudio Giannetti, Gabriele Ferrini, Gianluca
  Galimberti, Stefania Pagliara, Daniele Fausti, and Fulvio Parmigiani","Experimental evidence of above-threshold photoemission in solids","5 pages, 4 figures","Phys. Rev. Lett. 94, 37601 (2005)","10.1103/PhysRevLett.94.037601",,"cond-mat.mtrl-sci","http://arxiv.org/licenses/nonexclusive-distrib/1.0/","  Nonlinear photoemission from a silver single crystal is investigated by
femtosecond laser pulses in a perturbative regime. A clear observation of
above-threshold photoemission in solids is reported for the first time. The
ratio between the three-photon above-threshold and the two-photon Fermi edges
is found to be 10^{-4}. This value constitutes the only available benchmark for
theories aimed at understanding the mechanism responsible for above-threshold
photoemission in solids.
","[{""version"":""v1"",""created"":""Sat, 14 Jan 2012 22:02:46 GMT""}]","2012-01-17"
"1201.3050","Karel Knizek","K. Kn\'i\v{z}ek (1), J. Hejtm\'anek (1), M. Mary\v{s}ko (1), Z.
  Jir\'ak (1), J. Bur\v{s}\'ik (2) ((1) Institute of Physics ASCR, Prague,
  Czech Republic, (2) Institute of Inorganic Chemistry ASCR, \v{R}e\v{z} near
  Prague, Czech Republic)","Stabilization of the high-spin state of Co$^{3+}$ in
  LaCo$_{1-x}$Rh$_{x}$O$_3$","8 pages, 8 figures","Phys. Rev. B 85, 134401 (2012)","10.1103/PhysRevB.85.134401",,"cond-mat.mtrl-sci","http://arxiv.org/licenses/nonexclusive-distrib/1.0/","  The rhodium doping in the LaCo$_{1-x}$Rh$_{x}$O$_3$ perovskite series
($x=0.02-0.5$) has been studied by X-ray diffraction, electric transport and
magnetization measurements, complemented by electronic structure GGA+U
calculations in supercell for different concentration regimes. No charge
transfer between Co$^{3+}$ and Rh$^{3+}$ is evidenced. The diamagnetic ground
state of LaCoO$_3$, based on Co$^{3+}$ in low-spin (LS) state, is disturbed
even by a small doping of Rh. The driving force is the elastic energy connected
with incorporation of a large Rh$^{3+}$ cation into the matrix of small LS
Co$^{3+}$ cations, which is relaxed by formation of large Co$^{3+}$ in
high-spin (HS) state in the next-nearest sites to the inserted Rh atom. With
increasing temperature, the population of Co$^{3+}$ in HS state increases
through thermal excitation, and a saturated phase is obtained close to room
temperature, consisting of a nearest-neighbor correlation of small (LS
Co$^{3+}$) and large (HS Co$^{3+}$ and LS Rh$^{3+}$) cations in a kind of
double perovskite structure. The stabilizing role of elastic and electronic
energy contributions is demonstrated in supercell calculations for dilute Rh
concentration compared to other dopants with various trivalent ionic radius.
","[{""version"":""v1"",""created"":""Sat, 14 Jan 2012 22:06:44 GMT""}]","2012-04-04"
"1201.3051","Aleksandr Zheltukhin","A. A. Zheltukhin","Generalized Hooke Law for Relativistic Membranes and p-branes","8 pages; Talk given at the 3rd Int. Conference ""Quantum
  Electrodynamics and Statistical Physics"" (QEDSP2011), August 29-September 2,
  2011, Kharkov, Ukraine","Problems of Atomic Science and Technology, 2012, N 1., Series:
  Nuclear Physics Investigations (57), p. 7-10",,"NORDITA-2012-04","hep-th astro-ph.CO cond-mat.stat-mech","http://arxiv.org/licenses/nonexclusive-distrib/1.0/","  The character of elastic forces of relativistic membranes and $p$-branes
encoded in their nonlinear equations is studied. The toroidal brane equations
are reduced to the classical equations of anharmonic elastic media described by
monomial potentials. Integrability of the equations is discussed and some of
their exact solutions are constructed.
","[{""version"":""v1"",""created"":""Sat, 14 Jan 2012 22:30:04 GMT""}]","2012-01-24"
"1201.3052","Bartlomiej Dybiec","Bartlomiej Dybiec, Namiko Mitarai and Kim Sneppen","Information spreading and development of cultural centers","7 pages, 5 figures","Phys. Rev. E 85, 056116 (2012)","10.1103/PhysRevE.85.056116",,"physics.soc-ph cs.SI","http://arxiv.org/licenses/nonexclusive-distrib/1.0/","  The historical interplay between societies are governed by many factors,
including in particular spreading of languages, religion and other symbolic
traits. Cultural development, in turn, is coupled to emergence and maintenance
of information spreading. Strong centralized cultures exist thanks to attention
from their members, which faithfulness in turn relies on supply of information.
Here, we discuss a culture evolution model on a planar geometry that takes into
account aspects of the feedback between information spreading and its
maintenance. Features of model are highlighted by comparing it to cultural
spreading in ancient and medieval Europe, where it in particular suggests that
long lived centers should be located in geographically remote regions.
","[{""version"":""v1"",""created"":""Sat, 14 Jan 2012 22:40:02 GMT""},{""version"":""v2"",""created"":""Wed, 6 Jun 2012 09:58:30 GMT""}]","2012-06-07"
"1201.3053","Yutaka Akagi","Yutaka Akagi, Masafumi Udagawa, and Yukitoshi Motome","Hidden Multiple-spin Interactions as an Origin of Spin Scalar Chiral
  Order in Frustrated Kondo Lattice Models","5 pages, 4 figures, accepted for publication in Physical Review
  Letters","Phys. Rev. Lett. 108, 096401 (2012)","10.1103/PhysRevLett.108.096401",,"cond-mat.str-el","http://arxiv.org/licenses/nonexclusive-distrib/1.0/","  We reveal the significance of kinetic-driven multiple-spin interactions
hidden in geometrically-frustrated Kondo lattice models. Carefully examining
the perturbation in terms of the spin-charge coupling up to the fourth order,
we find that a positive biquadratic interaction is critically enhanced and
plays a crucial role on stabilizing a spin scalar chiral order near 1/4 filling
in a triangular lattice case. This is a generalized Kohn anomaly, appearing
only when the second-order perturbation is inefficient because of the
degeneracy under frustration. The mechanism is potentially common to frustrated
spin-charge coupled systems, leading to emergence of unusual magnetic orders.
","[{""version"":""v1"",""created"":""Sat, 14 Jan 2012 22:53:01 GMT""}]","2015-06-03"
"1201.3054","Jiuning Hu","Jiuning Hu and Yong P. Chen","Existence of negative differential thermal conductance in
  one-dimensional diffusive thermal transport",,,"10.1103/PhysRevE.87.062104",,"cond-mat.mtrl-sci cond-mat.mes-hall","http://arxiv.org/licenses/nonexclusive-distrib/1.0/","  We show that in a finite one-dimensional (1D) system with diffusive thermal
transport described by the Fourier's law, negative differential thermal
conductance (NDTC) cannot occur when the temperature at one end is fixed. We
demonstrate that NDTC in this case requires the presence of junction(s) with
temperature dependent thermal contact resistance (TCR). We derive a necessary
and sufficient condition for the existence of NDTC in terms of the properties
of the TCR for systems with a single junction. We show that under certain
circumstances we even could have infinite (negative or positive) differential
thermal conductance in the presence of the TCR. Our predictions provide
theoretical basis for constructing NDTC-based devices, such as thermal
amplifiers, oscillators and logic devices.
","[{""version"":""v1"",""created"":""Sat, 14 Jan 2012 23:44:13 GMT""},{""version"":""v2"",""created"":""Sun, 30 Dec 2012 20:55:19 GMT""}]","2015-06-03"
"1201.3055","Peter Forrester","Peter J. Forrester","Large deviation eigenvalue density for the soft edge Laguerre and Jacobi
  $\beta$-ensembles","18 pages","J. Phys. A, 45, 145201 (2012)","10.1088/1751-8113/45/14/145201",,"math-ph math.MP","http://arxiv.org/licenses/nonexclusive-distrib/1.0/","  We analyze the eigenvalue density for the Laguerre and Jacobi
$\beta$-ensembles in the cases that the corresponding exponents are extensive.
In particular, we obtain the asymptotic expansion up to terms $o(1)$, in the
large deviation regime outside the limiting interval of support. As found in
recent studies of the large deviation density for the Gaussian
$\beta$-ensemble, and Laguerre $\beta$-ensemble with fixed exponent, there is a
scaling from this asymptotic expansion to the right tail asymptotics for the
distribution of the largest eigenvalue at the soft edge.
","[{""version"":""v1"",""created"":""Sun, 15 Jan 2012 00:36:04 GMT""}]","2015-06-16"
"1201.3056","Qian Cao","Qian Cao, H. Vicky Zhao, Yindi Jing","Power Allocation and Pricing in Multi-User Relay Networks Using
  Stackelberg and Bargaining Games",,,,,"cs.IT math.IT","http://arxiv.org/licenses/nonexclusive-distrib/1.0/","  This paper considers a multi-user single-relay wireless network, where the
relay gets paid for helping the users forward signals, and the users pay to
receive the relay service. We study the relay power allocation and pricing
problems, and model the interaction between the users and the relay as a
two-level Stackelberg game. In this game, the relay, modeled as the service
provider and the leader of the game, sets the relay price to maximize its
revenue; while the users are modeled as customers and the followers who buy
power from the relay for higher transmission rates. We use a bargaining game to
model the negotiation among users to achieve a fair allocation of the relay
power. Based on the proposed fair relay power allocation rule, the optimal
relay power price that maximizes the relay revenue is derived analytically.
Simulation shows that the proposed power allocation scheme achieves higher
network sum-rate and relay revenue than the even power allocation. Furthermore,
compared with the sum-rate-optimal solution, simulation shows that the proposed
scheme achieves better fairness with comparable network sum-rate for a wide
range of network scenarios. The proposed pricing and power allocation solutions
are also shown to be consistent with the laws of supply and demand.
","[{""version"":""v1"",""created"":""Sun, 15 Jan 2012 00:38:51 GMT""}]","2012-01-17"
"1201.3057","Zhi Chen","Zhi Chen","A Plethysm formula on the characteristic map of induced linear
  characters from $U_n(\mathbb F_q)$ to $GL_n(\mathbb F_q)$",,,,,"math.CO math.RT","http://arxiv.org/licenses/nonexclusive-distrib/1.0/","  This paper gives a plethysm formula on the characteristic map of the induced
linear characters from the unipotent upper-triangular matrices $U_n(\mathbb
F_q)$ to $GL_n(\mathbb F_q)$, the general linear group over finite field
$\mathbb F_q$. The result turns out to be a multiple of a twisted version of
the Hall-Littlewood symmetric functions $\tilde{P}_n(Y,q)$. A recurrence
relation is also given which makes it easy to carry out the computation.
","[{""version"":""v1"",""created"":""Sun, 15 Jan 2012 03:44:47 GMT""}]","2012-01-17"
"1201.3058","Io Kawaguchi","Io Kawaguchi, Takuya Matsumoto, Kentaroh Yoshida","The classical origin of quantum affine algebra in squashed sigma models","25 pages, 2 figures",,"10.1007/JHEP04(2012)115","KUNS-2379","hep-th math-ph math.MP","http://arxiv.org/licenses/nonexclusive-distrib/1.0/","  We consider a quantum affine algebra realized in two-dimensional non-linear
sigma models with target space three-dimensional squashed sphere. Its affine
generators are explicitly constructed and the Poisson brackets are computed.
The defining relations of quantum affine algebra in the sense of the Drinfeld
first realization are satisfied at classical level. The relation to the
Drinfeld second realization is also discussed including higher conserved
charges. Finally we comment on a semiclassical limit of quantum affine algebra
at quantum level.
","[{""version"":""v1"",""created"":""Sun, 15 Jan 2012 05:17:29 GMT""},{""version"":""v2"",""created"":""Wed, 8 Aug 2012 04:06:43 GMT""}]","2015-06-03"
"1201.3059","Feng Wang","Feng Wang, Jianwei Huang, and Yuping Zhao","Delay Sensitive Communications over Cognitive Radio Networks","11 pages, 8 figures",,,,"cs.SY cs.NI","http://arxiv.org/licenses/nonexclusive-distrib/1.0/","  Supporting the quality of service of unlicensed users in cognitive radio
networks is very challenging, mainly due to dynamic resource availability
because of the licensed users' activities. In this paper, we study the optimal
admission control and channel allocation decisions in cognitive overlay
networks in order to support delay sensitive communications of unlicensed
users. We formulate it as a Markov decision process problem, and solve it by
transforming the original formulation into a stochastic shortest path problem.
We then propose a simple heuristic control policy, which includes a
threshold-based admission control scheme and and a largest-delay-first channel
allocation scheme, and prove the optimality of the largest-delay-first channel
allocation scheme. We further propose an improved policy using the rollout
algorithm. By comparing the performance of both proposed policies with the
upper-bound of the maximum revenue, we show that our policies achieve
close-to-optimal performance with low complexities.
","[{""version"":""v1"",""created"":""Sun, 15 Jan 2012 05:41:19 GMT""}]","2012-01-17"
"1201.3060","Ebrahim Ghorbani","E. Ghorbani, A. Mohammadian, and B. Tayfeh-Rezaie","On Order and Rank of Graphs","Final version, to appear in Combinatorica",,,,"math.CO cs.IT math.IT","http://arxiv.org/licenses/nonexclusive-distrib/1.0/","  The rank of a graph is defined to be the rank of its adjacency matrix. A
graph is called reduced if it has no isolated vertices and no two vertices with
the same set of neighbors. Akbari, Cameron, and Khosrovshahi conjectured that
the number of vertices of every reduced graph of rank r is at most
$m(r)=2^{(r+2)/2}-2$ if r is even and $m(r) = 5\cdot2^{(r-3)/2}-2$ if r is odd.
In this article, we prove that if the conjecture is not true, then there would
be a counterexample of rank at most $46$. We also show that every reduced graph
of rank r has at most $8m(r)+14$ vertices.
","[{""version"":""v1"",""created"":""Sun, 15 Jan 2012 06:02:30 GMT""},{""version"":""v2"",""created"":""Mon, 28 Apr 2014 06:43:17 GMT""}]","2014-04-29"
"1201.3061","Rin Sugiyama","Rin Sugiyama","Lefschetz classes of simple factors of Fermat Jacobian of prime degree
  over finite fields",,"J. Number Theory 133 (2013), no.4, 1194-1206",,,"math.NT math.AG","http://arxiv.org/licenses/nonexclusive-distrib/1.0/","  We give a necessary and sufficient condition in terms of a matrix for which
all Tate classes are Lefschetz for simple abelian varieties over an algebraic
closure of a finite field. As an application, we prove under an assumption that
all Tate classes are Lefschetz for simple factors of Fermat Jacobian of prime
degree.
","[{""version"":""v1"",""created"":""Sun, 15 Jan 2012 06:15:24 GMT""},{""version"":""v2"",""created"":""Mon, 19 Mar 2012 02:57:36 GMT""}]","2014-11-12"
"1201.3062","Mika Juvela","M. Juvela, J. Harju, N. Ysard, T. Lunttila","Reliability of NH3 as the temperature probe of cold cloud cores","7 pages, accepted to A&A",,"10.1051/0004-6361/201118257",,"astro-ph.GA","http://arxiv.org/licenses/nonexclusive-distrib/1.0/","  The temperature is a central parameter affecting the chemical and physical
properties of dense cores of interstellar clouds and their evolution to star
formation. The chemistry and the dust properties are temperature dependent and
the interpretation of observation requires the knowledge of the temperature and
its variations. Measurement of the gas kinetic temperature is possible with
molecular line spectroscopy, the ammonia molecule, NH3, being the most commonly
used tracer. We want to determine the accuracy of the temperature estimates
derived from ammonia spectra. The normal interpretation of NH3 observations
assumes that all the hyperfine line components are tracing the same gas volume.
In the case of temperature gradients they may be sensitive to different layers
and cause errors in the optical depth and gas temperature estimates. We examine
a series of spherical cloud models, 1.0 and 0.5 M_Sun Bonnor-Ebert spheres,
with different radial temperature profiles. We calculate synthetic NH3 spectra
and compare the derived column densities and temperatures to the true values.
For high signal-to-noise observations, the estimated gas kinetic temperatures
are within ~0.3 K of the real mass averaged temperature and the column
densities are correct to within ~10%. When the S/N ratio of the (2,2) spectrum
decreases below 10, the temperature errors are of the order of 1K but without a
significant bias. When the density of the models is increased by a factor of a
few, the results begin to show significant bias because of the saturation of
the (1,1) main group. The ammonia spectra are found to be a reliable tracer of
the mass averaged gas temperature. Because the radial temperature profiles of
the cores are not well constrained, the central temperature could still differ
from this value. If the cores are optically very thick, there are no guarantees
of the accuracy.
","[{""version"":""v1"",""created"":""Sun, 15 Jan 2012 06:23:57 GMT""}]","2015-06-03"
"1201.3063","Shinya Tomizawa","Shun'ya Mizoguchi and Shinya Tomizawa","""Flip"" of SL(2,R)-duality in five-dimensional supergravity","16 pages",,"10.1103/PhysRevD.86.024022","KEK-TH 1515","hep-th","http://arxiv.org/licenses/nonexclusive-distrib/1.0/","  The dimensional reduction of the bosonic sector of five-dimensional minimal
supergravity to a Lorentzian four-dimensional spacetime leads to a theory with
a massless axion and a dilaton coupled to gravity and two U(1) gauge fields and
the dimensionally reduced equations of motion have SL(2,R)/SO(2)-duality
invariance. In our previous work, utilizing the duality invariance, we
formulated solution-generation techniques within five-dimensional minimal
supergravity. In this work, by choosing a timelike Killing vector, we consider
dimensional reduction to a four-dimensional Euclidean space, in which the field
equations have SL(2,R)/SO(1,1) invariance. In the timelike case, we develop a
new duality transformation technique, while in the spacelike case we have done
that in the previous work. As an example, by applying it to the Rasheed
solutions, we obtain rotating Kaluza-Klein black hole solutions in
five-dimensional minimal supergravity. In general, in contrast to the spacelike
case, the resulting dimensionally reduced solution includes the so-called NUT
parameter and therefore from a four-dimensional point of view, such a spacetime
is not asymptotically flat. However, it is shown that in some special cases, it
can describe ordinary Kaluza-Klein black holes.
","[{""version"":""v1"",""created"":""Sun, 15 Jan 2012 06:28:55 GMT""}]","2013-05-30"
"1201.3064","Prof. Dr. M. W. Wu","P. Zhang, Y. Zhou, and M. W. Wu","Electron spin relaxation in rippled graphene with low mobilities","8 pages, 7 figures","J. Appl. Phys. 112, 073709 (2012)","10.1063/1.4757417",,"cond-mat.mes-hall cond-mat.mtrl-sci","http://arxiv.org/licenses/nonexclusive-distrib/1.0/","  We investigate spin relaxation in rippled graphene where curvature induces a
Zeeman-like spin-orbit coupling with opposite effective magnetic fields along
the graphene plane in ${\bf K}$ and ${\bf K}^\prime$ valleys. The joint effect
of this Zeeman-like spin-orbit coupling and the intervalley electron-optical
phonon scattering opens a spin relaxation channel, which manifests itself in
low-mobility samples with the electron mean free path being smaller than the
ripple size. Due to this spin relaxation channel, with the increase of
temperature, the relaxation time for spins perpendicular to the effective
magnetic field first decreases and then increases, with a minimum of several
hundred picoseconds around room temperature. However, the spin relaxation along
the effective magnetic field is determined by the curvature-induced Rashba-type
spin-orbit coupling, leading to a temperature-insensitive spin relaxation time
of the order of microseconds. Therefore, the in-plane spin relaxation in
low-mobility rippled graphene is anisotropic. Nevertheless, in the presence of
a small perpendicular magnetic field, as usually applied in the Hanle spin
precession measurement, the anisotropy of spin relaxation is strongly
suppressed.
","[{""version"":""v1"",""created"":""Sun, 15 Jan 2012 06:41:22 GMT""}]","2012-10-10"
"1201.3065","Selcuk Bilir","S. Bilir, S. Karaali, S. Ak, O. Onal, N. D. Dagtekin, T. Yontan, G.
  Gilmore, G. M. Seabroke","Local stellar kinematics from RAVE data: III. Radial and Vertical
  Metallicity Gradients based on Red Clump Stars","27 pages, including 15 figures and 4 tables, accepted for publication
  in MNRAS",,"10.1111/j.1365-2966.2012.20561.x",,"astro-ph.GA","http://arxiv.org/licenses/nonexclusive-distrib/1.0/","  We investigate radial and vertical metallicity gradients for a sample of red
clump stars from the RAdial Velocity Experiment (RAVE) Data Release 3. We
select a total of 6781 stars, using a selection of colour, surface gravity and
uncertainty in the derived space motion, and calculate for each star a
probabilistic (kinematic) population assignment to a thin or thick disc using
space motion and additionally another (dynamical) assignment using stellar
vertical orbital eccentricity. We derive almost equal metallicity gradients as
a function of Galactocentric distance for the high probability thin disc stars
and for stars with vertical orbital eccentricities consistent with being
dynamically young, e_v<=0.07, i.e. d[M/H]/dR_m = -0.041(0.003) and d[M/H]/dR_m
= -0.041(0.007) dex/kpc. Metallicity gradients as a function of distance from
the Galactic plane for the same populations are steeper, i.e. d[M/H]/dz_{max} =
-0.109(0.008) and d[M/H]/dz_{max} = -0.260(0.031) dex/kpc, respectively. R_m
and z_{max} are the arithmetic mean of the perigalactic and apogalactic
distances, and the maximum distance to the Galactic plane, respectively.
Samples including more thick disc red clump giant stars show systematically
shallower abundance gradients. These findings can be used to distinguish
between different formation scenarios of the thick and thin discs.
","[{""version"":""v1"",""created"":""Sun, 15 Jan 2012 06:45:10 GMT""}]","2015-06-03"
"1201.3066","Sungsu Lim","Sungsu Lim, Kyomin Jung, Matthew Andrews","Stability of the Max-Weight Protocol in Adversarial Wireless Networks","Accepted by IEEE INFOCOM 2012",,,,"cs.NI","http://arxiv.org/licenses/nonexclusive-distrib/1.0/","  In this paper we consider the Max-Weight protocol for routing and scheduling
in wireless networks under an adversarial model. This protocol has received a
significant amount of attention dating back to the papers of Tassiulas and
Ephremides. In particular, this protocol is known to be throughput-optimal
whenever the traffic patterns and propagation conditions are governed by a
stationary stochastic process.
  However, the standard proof of throughput optimality (which is based on the
negative drift of a quadratic potential function) does not hold when the
traffic patterns and the edge capacity changes over time are governed by an
arbitrary adversarial process. Such an environment appears frequently in many
practical wireless scenarios when the assumption that channel conditions are
governed by a stationary stochastic process does not readily apply.
  In this paper we prove that even in the above adversarial setting, the
Max-Weight protocol keeps the queues in the network stable (i.e. keeps the
queue sizes bounded) whenever this is feasible by some routing and scheduling
algorithm. However, the proof is somewhat more complex than the negative
potential drift argument that applied in the stationary case. Our proof holds
for any arbitrary interference relationships among edges. We also prove the
stability of $\ep$-approximate Max-Weight under the adversarial model. We
conclude the paper with a discussion of queue sizes in the adversarial model as
well as a set of simulation results.
","[{""version"":""v1"",""created"":""Sun, 15 Jan 2012 07:58:34 GMT""}]","2012-01-17"
