"1201.3067","Kamran Divaani-Aazar","Fatemeh Mohammadi Aghjeh Mashhad and Kamran Divaani-Aazar","Local homology and Gorenstein flat modules","It will be published in the journal of algebra and its applications",,,,"math.AC","http://arxiv.org/licenses/nonexclusive-distrib/1.0/","  Let $R$ be a commutative Noetherian ring, $\fa$ an ideal of $R$ and
$\mathcal{D}(R)$ denote the derived category of $R$-modules. We investigate the
theory of local homology in conjunction with Gorenstein flat modules. Let $X$
be a homologically bounded to the right complex and $Q$ a bounded to the right
complex of Gorenstein flat $R$-modules such that $Q$ and $X$ are isomorphic in
$\mathcal{D}(R)$. We establish a natural isomorphism ${\bf
L}\Lambda^{\fa}(X)\simeq \Lambda^{\fa}(Q)$ in $\mathcal{D}(R)$ which
immediately asserts that $\sup {\bf L}\Lambda^{\fa}(X)\leq \Gfd_RX$. This
isomorphism yields several consequences. For instance, in the case $R$
possesses a dualizing complex, we show that $\Gfd_R {\bf L}\Lambda^{\fa}(X)\leq
\Gfd_RX$. Also, we establish a criterion for regularity of Gorenstein local
rings.
","[{""version"":""v1"",""created"":""Sun, 15 Jan 2012 08:10:23 GMT""}]","2012-01-17"
"1201.3068","Jerome Vanclay","Jerome K. Vanclay and Lutz Bornmann","Metrics to evaluate research performance in academic institutions: A
  critique of ERA 2010 as applied in forestry and the indirect H2 index as a
  possible alternative","19 pages, 6 figures, 7 tables, appendices","Scientometrics 91(3):751-771 (2012)","10.1007/s11192-012-0618-8",,"cs.DL","http://arxiv.org/licenses/nonexclusive-distrib/1.0/","  Excellence for Research in Australia (ERA) is an attempt by the Australian
Research Council to rate Australian universities on a 5-point scale within 180
Fields of Research using metrics and peer evaluation by an evaluation
committee. Some of the bibliometric data contributing to this ranking suffer
statistical issues associated with skewed distributions. Other data are
standardised year-by-year, placing undue emphasis on the most recent
publications which may not yet have reliable citation patterns. The
bibliometric data offered to the evaluation committees is extensive, but lacks
effective syntheses such as the h-index and its variants. The indirect H2 index
is objective, can be computed automatically and efficiently, is resistant to
manipulation, and a good indicator of impact to assist the ERA evaluation
committees and to similar evaluations internationally.
","[{""version"":""v1"",""created"":""Sun, 15 Jan 2012 08:38:28 GMT""}]","2012-08-23"
"1201.3069","Jerzy Kocik","Jerzy Kocik","Duplex numbers, diffusion systems, and generalized quantum mechanics","10 pages. Term ""hyperbolic numbers"" would be a better choice than
  ""duplex numbers"" used in the article. The formalism presented became known as
  ""hyperbolic quantum mechanics""","International Journal of Theoretical Physics, Vol. 38 No. 8, 1999
  (pp. 2221-30)",,,"math-ph math.MP quant-ph","http://arxiv.org/licenses/nonexclusive-distrib/1.0/","  We show that the relation between the Schr\""odinger equation and diffusion
processes has an algebraic nature and can be revealed via the structure of
""duplex numbers."" This helps one to clarify that quantum mechanics cannot be
reduced to diffusion theory. Also, a generalized version of quantum mechanics
where $\C$ is replaced by a normed algebra with a unit is proposed.
","[{""version"":""v1"",""created"":""Sun, 15 Jan 2012 08:52:41 GMT""}]","2012-01-17"
"1201.3070","Ning Wang","Xiaojun Sun, Chenggang Yu, and Ning Wang","Pre-neutron emission mass distributions for low-energy neutron-induced
  actinide fission","7 figures, 1 table; to appear in Phys. Rev. C",,"10.1103/PhysRevC.85.014613",,"nucl-th","http://arxiv.org/licenses/nonexclusive-distrib/1.0/","  According to the driving potential of a fissile system, we propose a
phenomenological fission potential for a description of the pre-neutron
emission mass distributions of neutron-induced actinide fission. Based on the
nucleus-nucleus potential with the Skyrme energy-density functional, the
driving potential of the fissile system is studied considering the deformations
of nuclei. The energy dependence of the potential parameters is investigated
based on the experimental data for the heights of the peak and valley of the
mass distributions. The pre-neutron emission mass distributions for reactions
238U(n, f), 237Np(n, f), 235U(n, f), 232Th(n, f) and 239Pu(n, f) can be
reasonably well reproduced. Some predictions for these reactions at unmeasured
incident energies are also presented.
","[{""version"":""v1"",""created"":""Sun, 15 Jan 2012 09:08:51 GMT""}]","2015-06-03"
"1201.3071","Peter Apell S","S. P. Apell, G. W. Hanson, C. H\""agglund","High optical absorption in graphene","3 figures",,,,"physics.optics","http://arxiv.org/licenses/nonexclusive-distrib/1.0/","  A simple analysis is performed for the absorption properties of graphene;
sandwiched between two media. For a proper choice of media and graphene
doping/gating one can approach 50-100% absorption in the GHz-THz range for the
one atom thick material. This absorption is controlled by a characteristic
chemical potential which depends only on carrier life-time and the indexes of
refraction of the dielectric embedding.
","[{""version"":""v1"",""created"":""Sun, 15 Jan 2012 09:10:43 GMT""}]","2012-01-17"
"1201.3072","Alfredo Luis","Alfredo Luis and Alfonso Rodil","Alternative measures of uncertainty in quantum metrology: Contradictions
  and limits","4 pages, 4 figures","Physical Review A 87, 034101 (2013)","10.1103/PhysRevA.87.034101",,"quant-ph","http://arxiv.org/licenses/nonexclusive-distrib/1.0/","  We examine a family of intrinsic performance measures in terms of probability
distributions that generalize Hellinger distance and Fisher information. They
are applied to quantum metrology to assess the uncertainty in the detection of
minute changes of physical quantities. We show that different measures lead to
contradictory conclusions, including the possibility of arbitrarily small
uncertainty for fixed resources. These intrinsic performances are compared with
the averaged error in the corresponding estimation problem after single-shot
measurements.
","[{""version"":""v1"",""created"":""Sun, 15 Jan 2012 09:16:01 GMT""},{""version"":""v2"",""created"":""Fri, 8 Mar 2013 08:29:10 GMT""}]","2015-03-20"
"1201.3073","Sylvain Martin","Sylvain Martin, Laurent Chiarello, Guy Leduc","DISco: a Distributed Information Store for network Challenges and their
  Outcome",,,,,"cs.NI","http://arxiv.org/licenses/nonexclusive-distrib/1.0/","  We present DISco, a storage and communication middleware designed to enable
distributed and task-centric autonomic control of networks.
  DISco is designed to enable multi-agent identification of anomalous
situations -- so-called ""challenges"" -- and assist coordinated remediation that
maintains degraded -- but acceptable -- service level, while keeping a track of
the challenge evolution in order to enable human-assisted diagnosis of flaws in
the network. We propose to use state-of-art peer-to-peer publish/subscribe and
distributed storage as core building blocks for the DISco service.
","[{""version"":""v1"",""created"":""Sun, 15 Jan 2012 09:37:08 GMT""}]","2015-03-20"
"1201.3074","Ari Laptev","A. Laptev and M. Solomyak","On spectral estimates for two-dimensional Schr\""odinger operators",,,,,"math.SP","http://arxiv.org/licenses/nonexclusive-distrib/1.0/","  For a two-dimensional Schr\""odinger operator $H_{\alpha V}=-\Delta-\alpha V,\
V\ge 0,$ we study the behavior of the number $N_-(H_{\alpha V})$ of its
negative eigenvalues (bound states), as the coupling parameter $\alpha$ tends
to infinity. A wide class of potentials is described, for which $N_-(H_{\alpha
V})$ has the semi-classical behavior, i.e., $N_-(H_{\alpha V})=O(\alpha)$. For
the potentials from this class, the necessary and sufficient condition is found
for the validity of the Weyl asymptotic law.
","[{""version"":""v1"",""created"":""Sun, 15 Jan 2012 09:43:22 GMT""}]","2012-01-17"
"1201.3075","Juan Echevarria","J. Echevarria","Doppler Tomography in Cataclysmic Variables: an historical perspective","Mem. S.A. It. in press",,,,"astro-ph.SR","http://arxiv.org/licenses/nonexclusive-distrib/1.0/","  To mark the half-century anniversary of this newly-born field of Cataclysmic
Variables, a special emphasis is made in this review, on the Doppler Effect as
a tool in astrophysics. The Doppler Effect was in fact, discovered almost 170
years ago, and has been since, one of the most important tools which helped to
develop modern astrophysics. We describe and discuss here, its use in
Cataclysmic Variables which, combined with another important tool, the
tomography, first devised for medical purposes 70 years ago, helped to devise
the astronomical Doppler Tomography, developed only two decades ago. A
discussion is made since the first trailed spectra provided a one dimensional
analysis of these binaries; on the establishment of a 2D velocity profiling of
the accretion discs; and unto modern techniques, which include Roche
Tomography, time modulation and 3D imaging.
","[{""version"":""v1"",""created"":""Sun, 15 Jan 2012 09:47:59 GMT""}]","2012-01-17"
"1201.3076","Jerome Vanclay","Jerome K. Vanclay","Impact Factor: outdated artefact or stepping-stone to journal
  certification?","25 pages, 12 figures, 6 tables","Scientometrics 92(2):211-238 (2012)","10.1007/s11192-011-0561-0",,"cs.DL","http://arxiv.org/licenses/nonexclusive-distrib/1.0/","  A review of Garfield's journal impact factor and its specific implementation
as the Thomson Reuters Impact Factor reveals several weaknesses in this
commonly-used indicator of journal standing. Key limitations include the
mismatch between citing and cited documents, the deceptive display of three
decimals that belies the real precision, and the absence of confidence
intervals. These are minor issues that are easily amended and should be
corrected, but more substantive improvements are needed. There are indications
that the scientific community seeks and needs better certification of journal
procedures to improve the quality of published science. Comprehensive
certification of editorial and review procedures could help ensure adequate
procedures to detect duplicate and fraudulent submissions.
","[{""version"":""v1"",""created"":""Sun, 15 Jan 2012 10:15:27 GMT""}]","2012-08-23"
"1201.3077","Joseph Gil","Joseph Yossi Gil and David Allen Scott","A Bijective String Sorting Transform",,,,,"cs.DS","http://arxiv.org/licenses/nonexclusive-distrib/1.0/","  Given a string of characters, the Burrows-Wheeler Transform rearranges the
characters in it so as to produce another string of the same length which is
more amenable to compression techniques such as move to front, run-length
encoding, and entropy encoders. We present a variant of the transform which
gives rise to similar or better compression value, but, unlike the original,
the transform we present is bijective, in that the inverse transformation
exists for all strings. Our experiments indicate that using our variant of the
transform gives rise to better compression ratio than the original
Burrows-Wheeler transform. We also show that both the transform and its inverse
can be computed in linear time and consuming linear storage.
","[{""version"":""v1"",""created"":""Sun, 15 Jan 2012 10:17:36 GMT""}]","2012-01-17"
"1201.3078","Joseph Gil","Joseph Gil and Maayan Goldstein and Dany Moshkovich","Empirical Confirmation (and Refutation) of Presumptions on Software",,,,,"cs.SE","http://arxiv.org/licenses/nonexclusive-distrib/1.0/","  Code metrics are easy to define, but not so easy to justify. It is hard to
prove that a metric is valid, i.e., that measured numerical values imply
anything on the vaguely defined, yet crucial software properties such as
complexity and maintainability. This paper employs statistical analysis and
tests to check some ""believable"" presumptions on the behavior of software and
metrics measured for this software. Among those are the reliability presumption
implicit in the application of any code metric, and the presumption that the
magnitude of change in a software artifact is correlated with changes to its
version number.
  Putting a suite of 36 metrics to the trial, we confirm most of the
presumptions. Unexpectedly, we show that a substantial portion of the
reliability of some metrics can be observed even in random changes to
architecture. Another surprising result is that Boolean-valued metrics tend to
flip their values more often in minor software version increments than in major
increments.
","[{""version"":""v1"",""created"":""Sun, 15 Jan 2012 10:18:01 GMT""}]","2012-01-17"
"1201.3079","Ioannis Rousochatzakis","I. Rousochatzakis, A. M. L\""auchli, R. Moessner","Quantum magnetism on the Cairo pentagonal lattice","29 pages, 19 figures; published version","Phys. Rev. B 85, 104415 (2012)","10.1103/PhysRevB.85.104415",,"cond-mat.str-el cond-mat.other","http://arxiv.org/licenses/nonexclusive-distrib/1.0/","  We present an extensive analytical and numerical study of the
antiferromagnetic Heisenberg model on the Cairo pentagonal lattice, the dual of
the Shastry-Sutherland lattice with a close realization in the S=5/2 compound
Bi2Fe4O9. We consider a model with two exchange couplings suggested by the
symmetry of the lattice, and investigate the nature of the ground state as a
function of their ratio x and the spin S. After establishing the classical
phase diagram we switch on quantum mechanics in a gradual way that highlights
the different role of quantum fluctuations on the two inequivalent sites of the
lattice. The most important findings for S=1/2 include: (i) a surprising
interplay between a collinear and a four-sublattice orthogonal phase due to an
underlying order-by-disorder mechanism at small x (related to an emergent J1-J2
effective model with J2 >> J1), and (ii) a non-magnetic and possibly
spin-nematic phase with d-wave symmetry at intermediate x.
","[{""version"":""v1"",""created"":""Sun, 15 Jan 2012 10:27:24 GMT""},{""version"":""v2"",""created"":""Sat, 24 Mar 2012 22:30:17 GMT""}]","2012-03-27"
"1201.3080","Frithjof Anders","Eitan Eidelstein, Avraham Schiller, Fabian Guettge and Frithjof B.
  Anders","Coherent control of correlated nanodevices: A hybrid time-dependent
  numerical renormalization-group approach to periodic switching","20 pager, Revtex, 10 figures, submitted to Physical Review B","Phys. Rev. B 85, 075118 (2012)","10.1103/PhysRevB.85.075118",,"cond-mat.mes-hall cond-mat.str-el quant-ph","http://arxiv.org/licenses/nonexclusive-distrib/1.0/","  The time-dependent numerical renormalization-group approach (TD-NRG),
originally devised for tracking the real-time dynamics of quantum-impurity
systems following a single quantum quench, is extended to multiple switching
events. This generalization of the TD-NRG encompasses the possibility of
periodic switching, allowing for coherent control of strongly correlated
systems by an external time-dependent field. To this end, we have embedded the
TD-NRG in a hybrid framework that combines the outstanding capabilities of the
numerical renormalization group to systematically construct the effective
low-energy Hamiltonian of the system with the prowess of complementary
approaches for calculating the real-time dynamics derived from this
Hamiltonian. We demonstrate the power of our approach by hybridizing the TD-NRG
with the Chebyshev expansion technique in order to investigate periodic
switching in the interacting resonant-level model. Although the interacting
model shares the same low-energy fixed point as its noninteracting counterpart,
we surprisingly find the gradual emergence of damped oscillations as the
interaction strength is increased. Focusing on a single quantum quench and
using a strong-coupling analysis, we reveal the origin of these
interaction-induced oscillations and provide an analytical estimate for their
frequency. The latter agrees well with the numerical results.
","[{""version"":""v1"",""created"":""Sun, 15 Jan 2012 10:52:58 GMT""}]","2012-06-12"
"1201.3081","Dimitrios Gouliermis","Dimitrios A. Gouliermis, Stefan Schmeja, Andrew E. Dolphin, Mario
  Gennaro, Emanuele Tognelli and Pier Giorgio Prada Moroni","The clustered nature of star formation. Pre--main-sequence clusters in
  the star-forming region NGC 602/N90 in the Small Magellanic Cloud","Accepted for publication by The Astrophysical Journal. 14 pages, 11
  figures, 1 table, 2-columns format",,"10.1088/0004-637X/748/1/64",,"astro-ph.SR astro-ph.GA","http://arxiv.org/licenses/nonexclusive-distrib/1.0/","  Located at the tip of the wing of the Small Magellanic Cloud (SMC), the
star-forming region NGC602/N90 is characterized by the HII nebular ring N90 and
the young cluster of pre--main-sequence (PMS) and early-type main sequence
stars NGC602. We present a thorough cluster analysis of the stellar sample
identified with HST/ACS camera in the region. We show that apart from the
central cluster, low-mass PMS stars are congregated in thirteen additional
small compact sub-clusters at the periphery of NGC602. We find that the spatial
distribution of the PMS stars is bimodal, with an unusually large fraction
(~60%) of the total population being clustered, while the remaining is
diffusely distributed in the inter-cluster area. From the corresponding
color-magnitude diagrams we disentangle an age-difference of ~2.5Myr between
NGC602 and the compact sub-clusters which appear younger. The diffuse PMS
population appears to host stars as old as those in NGC602. Almost all detected
PMS sub-clusters appear to be centrally concentrated. When the complete PMS
stellar sample, including both clustered and diffused stars, is considered in
our cluster analysis, it appears as a single centrally concentrated stellar
agglomeration, covering the whole central area of the region. Considering also
the hot massive stars of the system, we find evidence that this agglomeration
is hierarchically structured. Based on our findings we propose a scenario,
according to which the region NGC602/N90 experiences an active clustered star
formation for the last ~5Myr. The central cluster NGC602 was formed first and
rapidly started dissolving into its immediate ambient environment, possibly
ejecting also massive stars found away from its center. Star formation
continued in sub-clusters of a larger stellar agglomeration, introducing an
age-spread of the order of 2.5Myr among the PMS populations.
","[{""version"":""v1"",""created"":""Sun, 15 Jan 2012 10:55:24 GMT""}]","2015-06-03"
"1201.3082","Takashi Yokomori","Fumiya Okubo, Satoshi Kobayashi, Takashi Yokomori","On the Properties of Language Classes Defined by Bounded Reaction
  Automata","23 pages with 3 figures",,,"EMTR-12-01","cs.FL","http://arxiv.org/licenses/nonexclusive-distrib/1.0/","  Reaction automata are a formal model that has been introduced to investigate
the computing powers of interactive behaviors of biochemical reactions([14]).
Reaction automata are language acceptors with multiset rewriting mechanism
whose basic frameworks are based on reaction systems introduced in [4]. In this
paper we continue the investigation of reaction automata with a focus on the
formal language theoretic properties of subclasses of reaction automata, called
linearbounded reaction automata (LRAs) and exponentially-bounded reaction
automata (ERAs). Besides LRAs, we newly introduce an extended model (denoted by
lambda-LRAs) by allowing lambda-moves in the accepting process of reaction, and
investigate the closure properties of language classes accepted by both LRAs
and lambda-LRAs. Further, we establish new relationships of language classes
accepted by LRAs and by ERAs with the Chomsky hierarchy. The main results
include the following : (i) the class of languages accepted by lambda-LRAs
forms an AFL with additional closure properties, (ii) any recursively
enumerable language can be expressed as a homomorphic image of a language
accepted by an LRA, (iii) the class of languages accepted by ERAs coincides
with the class of context-sensitive languages.
","[{""version"":""v1"",""created"":""Sun, 15 Jan 2012 11:28:56 GMT""}]","2012-01-17"
"1201.3083","Aleksejus Kononovicius","Vygintas Gontis, Aleksejus Kononovicius, Stefan Reimann","The class of nonlinear stochastic models as a background for the bursty
  behavior in financial markets","9 pages, 5 figures","Advances in Complex Systems 15 (1), 2012, 1250071","10.1142/S0219525912500713",,"q-fin.ST","http://arxiv.org/licenses/nonexclusive-distrib/1.0/","  We investigate large changes, bursts, of the continuous stochastic signals,
when the exponent of multiplicativity is higher than one. Earlier we have
proposed a general nonlinear stochastic model which can be transformed into
Bessel process with known first hitting (first passage) time statistics. Using
these results we derive PDF of burst duration for the proposed model. We
confirm analytical expressions by numerical evaluation and discuss bursty
behavior of return in financial markets in the framework of modeling by
nonlinear SDE.
","[{""version"":""v1"",""created"":""Sun, 15 Jan 2012 11:36:06 GMT""},{""version"":""v2"",""created"":""Fri, 9 Mar 2012 09:15:25 GMT""},{""version"":""v3"",""created"":""Tue, 15 May 2012 08:24:02 GMT""}]","2012-06-18"
"1201.3084","Reisaburo Tanaka","LHC Higgs Cross Section Working Group: S. Dittmaier, C. Mariotti, G.
  Passarino and R. Tanaka (eds.), S. Alekhin, J. Alwall, E. A. Bagnaschi, A.
  Banfi, J. Blumlein, S. Bolognesi, N. Chanon, T. Cheng, L. Cieri, A. M.
  Cooper-Sarkar, M. Cutajar, S. Dawson, G. Davies, N. De Filippis, G. Degrassi,
  A. Denner, D. D'Enterria, S. Diglio, B. Di Micco, R. Di Nardo, R. K. Ellis,
  A. Farilla, S. Farrington, M. Felcini, G. Ferrera, M. Flechl, D. de Florian,
  S. Forte, S. Ganjour, M. V. Garzelli, S. Gascon-Shotkin, S. Glazov, S. Goria,
  M. Grazzini, J.-Ph. Guillet, C. Hackstein, K. Hamilton, R. Harlander, M.
  Hauru, S. Heinemeyer, S. Hoche, J. Huston, C. Jackson, P. Jimenez-Delgado, M.
  D. Jorgensen, M. Kado, S. Kallweit, A. Kardos, N. Kauer, H. Kim, M. Kovac, M.
  Kramer, F. Krauss, C.-M. Kuo, S. Lehti, Q. Li, N. Lorenzo, F. Maltoni, B.
  Mellado, S. O. Moch, A. Muck, M. Muhlleitner, P. Nadolsky, P. Nason, C. Neu,
  A. Nikitenko, C. Oleari, J. Olsen, S. Palmer, S. Paganis, C. G. Papadopoulos,
  T .C. Petersen, F. Petriello, F. Petrucci, G. Piacquadio, E. Pilon, C. T.
  Potter, J. Price, I. Puljak, W. Quayle, V. Radescu, D. Rebuzzi, L. Reina, J.
  Rojo, D. Rosco, G. P. Salam, A. Sapronov, J. Schaarschmidt, M. Schonherr, M.
  Schumacher, F. Siegert, P. Slavich, M. Spira, I. W. Stewart, W. J. Stirling,
  F. Stockli, C. Sturm, F. J. Tackmann, R. S. Thorne, D. Tommasini, P.
  Torrielli, F. Tramontano, Z. Trocsanyi, M. Ubiali, S. Uccirati, M. Vazquez
  Acosta, T. Vickey, A. Vicini, W. J. Waalewijn, D. Wackeroth, M. Warsinsky, M.
  Weber, M. Wiesemann, G. Weiglein, J. Yu and G. Zanderighi","Handbook of LHC Higgs Cross Sections: 2. Differential Distributions","275 pages, 136 figures, to be submitted to CERN Report. Working Group
  web page: https://twiki.cern.ch/twiki/bin/view/LHCPhysics/CrossSections",,"10.5170/CERN-2012-002","CERN-2012-002","hep-ph hep-ex","http://arxiv.org/licenses/nonexclusive-distrib/1.0/","  This Report summarises the results of the second year's activities of the LHC
Higgs Cross Section Working Group. The main goal of the working group was to
present the state of the art of Higgs Physics at the LHC, integrating all new
results that have appeared in the last few years. The first working group
report Handbook of LHC Higgs Cross Sections: 1. Inclusive Observables
(CERN-2011-002) focuses on predictions (central values and errors) for total
Higgs production cross sections and Higgs branching ratios in the Standard
Model and its minimal supersymmetric extension, covering also related issues
such as Monte Carlo generators, parton distribution functions, and
pseudo-observables. This second Report represents the next natural step towards
realistic predictions upon providing results on cross sections with benchmark
cuts, differential distributions, details of specific decay channels, and
further recent developments.
","[{""version"":""v1"",""created"":""Sun, 15 Jan 2012 11:52:29 GMT""}]","2013-12-02"
"1201.3085","Anton Galajinsky","Anton Galajinsky","Higher rank Killing tensors and Calogero model","V2: 12 pages, discussion extended, presentation improved, references
  added. The version to appear in PRD",,"10.1103/PhysRevD.85.085002",,"hep-th gr-qc","http://arxiv.org/licenses/nonexclusive-distrib/1.0/","  (n+2)-dimensional Lorentzian spacetime which admits irreducible Killing
tensors of rank up to n is constructed by applying the Eisenhart lift to the
Calogero model.
","[{""version"":""v1"",""created"":""Sun, 15 Jan 2012 11:59:02 GMT""},{""version"":""v2"",""created"":""Sat, 10 Mar 2012 04:21:04 GMT""}]","2013-05-30"
