"1210.1089","Sam Hall","LHCb collaboration: R. Aaij, C. Abellan Beteta, A. Adametz, B. Adeva,
  M. Adinolfi, C. Adrover, A. Affolder, Z. Ajaltouni, J. Albrecht, F. Alessio,
  M. Alexander, S. Ali, G. Alkhazov, P. Alvarez Cartelle, A. A. Alves Jr, S.
  Amato, Y. Amhis, L. Anderlini, J. Anderson, R. B. Appleby, O. Aquines
  Gutierrez, F. Archilli, A. Artamonov, M. Artuso, E. Aslanides, G. Auriemma,
  S. Bachmann, J. J. Back, C. Baesso, W. Baldini, R. J. Barlow, C. Barschel, S.
  Barsuk, W. Barter, A. Bates, Th. Bauer, A. Bay, J. Beddow, I. Bediaga, S.
  Belogurov, K. Belous, I. Belyaev, E. Ben-Haim, M. Benayoun, G. Bencivenni, S.
  Benson, J. Benton, A. Berezhnoy, R. Bernet, M.-O. Bettler, M. van Beuzekom,
  A. Bien, S. Bifani, T. Bird, A. Bizzeti, P. M. Bj{\o}rnstad, T. Blake, F.
  Blanc, C. Blanks, J. Blouw, S. Blusk, A. Bobrov, V. Bocci, A. Bondar, N.
  Bondar, W. Bonivento, S. Borghi, A. Borgia, T. J. V. Bowcock, C. Bozzi, T.
  Brambach, J. van den Brand, J. Bressieux, D. Brett, M. Britsch, T. Britton,
  N. H. Brook, H. Brown, A. B\""uchler-Germann, I. Burducea, A. Bursche, J.
  Buytaert, S. Cadeddu, O. Callot, M. Calvi, M. Calvo Gomez, A. Camboni, P.
  Campana, A. Carbone, G. Carboni, R. Cardinale, A. Cardini, L. Carson, K.
  Carvalho Akiba, G. Casse, M. Cattaneo, Ch. Cauet, M. Charles, Ph.
  Charpentier, P. Chen, N. Chiapolini, M. Chrzaszcz, K. Ciba, X. Cid Vidal, G.
  Ciezarek, P. E. L. Clarke, M. Clemencic, H. V. Cliff, J. Closier, C. Coca, V.
  Coco, J. Cogan, E. Cogneras, P. Collins, A. Comerma-Montells, A. Contu, A.
  Cook, M. Coombes, G. Corti, B. Couturier, G. A. Cowan, D. Craik, S. Cunliffe,
  R. Currie, C. D'Ambrosio, P. David, P. N. Y. David, I. De Bonis, K. De Bruyn,
  S. De Capua, M. De Cian, J. M. De Miranda, L. De Paula, P. De Simone, D.
  Decamp, M. Deckenhoff, H. Degaudenzi, L. Del Buono, C. Deplano, D. Derkach,
  O. Deschamps, F. Dettori, A. Di Canto, J. Dickens, H. Dijkstra, P. Diniz
  Batista, F. Domingo Bonal, S. Donleavy, F. Dordei, A. Dosil Su\'arez, D.
  Dossett, A. Dovbnya, F. Dupertuis, R. Dzhelyadin, A. Dziurda, A. Dzyuba, S.
  Easo, U. Egede, V. Egorychev, S. Eidelman, D. van Eijk, S. Eisenhardt, R.
  Ekelhof, L. Eklund, I. El Rifai, Ch. Elsasser, D. Elsby, D. Esperante
  Pereira, A. Falabella, C. F\""arber, G. Fardell, C. Farinelli, S. Farry, V.
  Fave, V. Fernandez Albor, F. Ferreira Rodrigues, M. Ferro-Luzzi, S. Filippov,
  C. Fitzpatrick, M. Fontana, F. Fontanelli, R. Forty, O. Francisco, M. Frank,
  C. Frei, M. Frosini, S. Furcas, A. Gallas Torreira, D. Galli, M. Gandelman,
  P. Gandini, Y. Gao, J-C. Garnier, J. Garofoli, P. Garosi, J. Garra Tico, L.
  Garrido, C. Gaspar, R. Gauld, E. Gersabeck, M. Gersabeck, T. Gershon, Ph.
  Ghez, V. Gibson, V. V. Gligorov, C. G\""obel, D. Golubkov, A. Golutvin, A.
  Gomes, H. Gordon, M. Grabalosa G\'andara, R. Graciani Diaz, L. A. Granado
  Cardoso, E. Graug\'es, G. Graziani, A. Grecu, E. Greening, S. Gregson, O.
  Gr\""unberg, B. Gui, E. Gushchin, Yu. Guz, T. Gys, C. Hadjivasiliou, G.
  Haefeli, C. Haen, S. C. Haines, S. Hall, T. Hampson, S. Hansmann-Menzemer, N.
  Harnew, S. T. Harnew, J. Harrison, P. F. Harrison, T. Hartmann, J. He, V.
  Heijne, K. Hennessy, P. Henrard, J. A. Hernando Morata, E. van Herwijnen, E.
  Hicks, D. Hill, M. Hoballah, P. Hopchev, W. Hulsbergen, P. Hunt, T. Huse, N.
  Hussain, D. Hutchcroft, D. Hynds, V. Iakovenko, P. Ilten, J. Imong, R.
  Jacobsson, A. Jaeger, M. Jahjah Hussein, E. Jans, F. Jansen, P. Jaton, B.
  Jean-Marie, F. Jing, M. John, D. Johnson, C. R. Jones, B. Jost, M. Kaballo,
  S. Kandybei, M. Karacson, T. M. Karbach, J. Keaveney, I. R. Kenyon, U.
  Kerzel, T. Ketel, A. Keune, B. Khanji, Y. M. Kim, O. Kochebina, V. Komarov,
  R. F. Koopman, P. Koppenburg, M. Korolev, A. Kozlinskiy, L. Kravchuk, K.
  Kreplin, M. Kreps, G. Krocker, P. Krokovny, F. Kruse, M. Kucharczyk, V.
  Kudryavtsev, T. Kvaratskheliya, V. N. La Thi, D. Lacarrere, G. Lafferty, A.
  Lai, D. Lambert, R. W. Lambert, E. Lanciotti, G. Lanfranchi, C. Langenbruch,
  T. Latham, C. Lazzeroni, R. Le Gac, J. van Leerdam, J.-P. Lees, R. Lef\`evre,
  A. Leflat, J. Lefran\c{c}ois, O. Leroy, T. Lesiak, Y. Li, L. Li Gioi, M.
  Liles, R. Lindner, C. Linn, B. Liu, G. Liu, J. von Loeben, J. H. Lopes, E.
  Lopez Asamar, N. Lopez-March, H. Lu, J. Luisier, A. Mac Raighne, F.
  Machefert, I. V. Machikhiliyan, F. Maciuc, O. Maev, J. Magnin, M. Maino, S.
  Malde, G. Manca, G. Mancinelli, N. Mangiafave, U. Marconi, R. M\""arki, J.
  Marks, G. Martellotti, A. Martens, L. Martin, A. Mart\'in S\'anchez, M.
  Martinelli, D. Martinez Santos, A. Massafferri, Z. Mathe, C. Matteuzzi, M.
  Matveev, E. Maurice, A. Mazurov, J. McCarthy, G. McGregor, R. McNulty, M.
  Meissner, M. Merk, J. Merkel, D. A. Milanes, M.-N. Minard, J. Molina
  Rodriguez, S. Monteil, D. Moran, P. Morawski, R. Mountain, I. Mous, F.
  Muheim, K. M\""uller, R. Muresan, B. Muryn, B. Muster, J. Mylroie-Smith, P.
  Naik, T. Nakada, R. Nandakumar, I. Nasteva, M. Needham, N. Neufeld, A. D.
  Nguyen, C. Nguyen-Mau, M. Nicol, V. Niess, N. Nikitin, T. Nikodem, A.
  Nomerotski, A. Novoselov, A. Oblakowska-Mucha, V. Obraztsov, S. Oggero, S.
  Ogilvy, O. Okhrimenko, R. Oldeman, M. Orlandea, J. M. Otalora Goicochea, P.
  Owen, B. K. Pal, A. Palano, M. Palutan, J. Panman, A. Papanestis, M.
  Pappagallo, C. Parkes, C. J. Parkinson, G. Passaleva, G. D. Patel, M. Patel,
  G. N. Patrick, C. Patrignani, C. Pavel-Nicorescu, A. Pazos Alvarez, A.
  Pellegrino, G. Penso, M. Pepe Altarelli, S. Perazzini, D. L. Perego, E. Perez
  Trigo, A. P\'erez-Calero Yzquierdo, P. Perret, M. Perrin-Terrin, G. Pessina,
  K. Petridis, A. Petrolini, A. Phan, E. Picatoste Olloqui, B. Pie Valls, B.
  Pietrzyk, T. Pila\v{r}, D. Pinci, S. Playfer, M. Plo Casasus, F. Polci, G.
  Polok, A. Poluektov, E. Polycarpo, D. Popov, B. Popovici, C. Potterat, A.
  Powell, J. Prisciandaro, V. Pugatch, A. Puig Navarro, W. Qian, J. H.
  Rademacker, B. Rakotomiaramanana, M. S. Rangel, I. Raniuk, N. Rauschmayr, G.
  Raven, S. Redford, M. M. Reid, A. C. dos Reis, S. Ricciardi, A. Richards, K.
  Rinnert, V. Rives Molina, D. A. Roa Romero, P. Robbe, E. Rodrigues, P.
  Rodriguez Perez, G. J. Rogers, S. Roiser, V. Romanovsky, A. Romero Vidal, J.
  Rouvinet, T. Ruf, H. Ruiz, G. Sabatino, J. J. Saborido Silva, N. Sagidova, P.
  Sail, B. Saitta, C. Salzmann, B. Sanmartin Sedes, M. Sannino, R.
  Santacesaria, C. Santamarina Rios, R. Santinelli, E. Santovetti, M. Sapunov,
  A. Sarti, C. Satriano, A. Satta, M. Savrie, P. Schaack, M. Schiller, H.
  Schindler, S. Schleich, M. Schlupp, M. Schmelling, B. Schmidt, O. Schneider,
  A. Schopper, M.-H. Schune, R. Schwemmer, B. Sciascia, A. Sciubba, M. Seco, A.
  Semennikov, K. Senderowska, I. Sepp, N. Serra, J. Serrano, P. Seyfert, M.
  Shapkin, I. Shapoval, P. Shatalov, Y. Shcheglov, T. Shears, L. Shekhtman, O.
  Shevchenko, V. Shevchenko, A. Shires, R. Silva Coutinho, T. Skwarnicki, N. A.
  Smith, E. Smith, M. Smith, K. Sobczak, F. J. P. Soler, F. Soomro, D. Souza,
  B. Souza De Paula, B. Spaan, A. Sparkes, P. Spradlin, F. Stagni, S. Stahl, O.
  Steinkamp, S. Stoica, S. Stone, B. Storaci, M. Straticiuc, U. Straumann, V.
  K. Subbiah, S. Swientek, M. Szczekowski, P. Szczypka, T. Szumlak, S.
  T'Jampens, M. Teklishyn, E. Teodorescu, F. Teubert, C. Thomas, E. Thomas, J.
  van Tilburg, V. Tisserand, M. Tobin, S. Tolk, D. Tonelli, S. Topp-Joergensen,
  N. Torr, E. Tournefier, S. Tourneur, M. T. Tran, A. Tsaregorodtsev, P.
  Tsopelas, N. Tuning, M. Ubeda Garcia, A. Ukleja, D. Urner, U. Uwer, V.
  Vagnoni, G. Valenti, R. Vazquez Gomez, P. Vazquez Regueiro, S. Vecchi, J. J.
  Velthuis, M. Veltri, G. Veneziano, M. Vesterinen, B. Viaud, I. Videau, D.
  Vieira, X. Vilasis-Cardona, J. Visniakov, A. Vollhardt, D. Volyanskyy, D.
  Voong, A. Vorobyev, V. Vorobyev, H. Voss, C. Vo{\ss}, R. Waldi, R. Wallace,
  S. Wandernoth, J. Wang, D. R. Ward, N. K. Watson, A. D. Webber, D. Websdale,
  M. Whitehead, J. Wicht, D. Wiedner, L. Wiggers, G. Wilkinson, M. P. Williams,
  M. Williams, F. F. Wilson, J. Wishahi, M. Witek, W. Witzeling, S. A. Wotton,
  S. Wright, S. Wu, K. Wyllie, Y. Xie, F. Xing, Z. Xing, Z. Yang, R. Young, X.
  Yuan, O. Yushchenko, M. Zangoli, M. Zavertyaev, F. Zhang, L. Zhang, W. C.
  Zhang, Y. Zhang, A. Zhelezov, L. Zhong, A. Zvyagin","First evidence for the annihilation decay mode $B^{+} \to D_{s}^{+}
  \phi$","19 Pages, 3 figures and 4 tables","JHEP02(2013)043","10.1007/JHEP02(2013)043","CERN-PH-EP-2012-286; LHCb-PAPER-2012-025","hep-ex","http://creativecommons.org/licenses/by/3.0/","  Evidence for the hadronic annihilation decay mode $B^{+} \to D_s^{+}\phi$ is
found with greater than $3\sigma$ significance. The branching fraction and \CP
asymmetry are measured to be \mathcal{B}(B^{+} \to D_s^{+}\phi) &=&
(1.87^{+1.25}_{-0.73}({\rm stat}) \pm 0.19 ({\rm syst}) \pm 0.32 ({\rm norm}))
\times 10^{-6}, \mathcal{A}_{CP}(B^{+} \to D_s^{+}\phi) &=& -0.01 \pm 0.41
({\rm stat}) \pm 0.03 ({\rm syst}). The last uncertainty on $\mathcal{B}(B^{+}
\to D_s^{+}\phi)$ is from the branching fractions of the $B^+ \to D_s^+ \kern
0.2em\bar{\kern -0.2em D}{}^0$ normalization mode and intermediate resonance
decays. Upper limits are also set for the branching fractions of the related
decay modes $B^{+}_{(c)} \to D^{+}_{(s)} K^{*0}$, $B^{+}_{(c)} \to D^{+}_{(s)}
\kern 0.2em\bar{\kern -0.2em K}{}^{*0}$ and ${B_c^{+} \to D^{+}_{s}\phi}$,
including the result ${\mathcal{B}(B^+ \to D^+ K^{*0})} < 1.8 \times 10^{-6}$
at the 90% credibility level.
","[{""version"":""v1"",""created"":""Wed, 3 Oct 2012 12:42:32 GMT""},{""version"":""v2"",""created"":""Mon, 10 Dec 2012 09:49:39 GMT""},{""version"":""v3"",""created"":""Tue, 8 Jan 2013 15:05:22 GMT""}]","2013-05-14"
"1210.1090","Pavel A. Andreev","P. A. Andreev, L. S. Kuz'menkov","Waves of spin-current in magnetized dielectrics","10 pages, 2 figures","Int. J. Mod. Phys. B Vol. 29, p. 1550077, (2015)","10.1142/S0217979215500770",,"cond-mat.mes-hall physics.plasm-ph","http://arxiv.org/licenses/nonexclusive-distrib/1.0/","  Spin-current is an important physical quantity in present day spintronics and
it might be very usefull in the physics of quantum plasma of spinning
particles. Thus it is important to have an equation of the spin-current
evolution. This equation naturally appears as a part of a set of the quantum
hydrodynamics (QHD) equations. Consequently, we present the set of the QHD
equations derived from the many-particle microscopic Schrodinger equation,
which consists of the continuity equation, the Euler equation, the Bloch
equation and equation of the spin-current evolution. We use these equations to
study dispersion of the collective excitations in the three dimensional samples
of the magnetized dielectrics. We show that dynamics of the spin-current leads
to formation of new type of the collective excitations in the magnetized
dielectrics, which we called spin-current waves.
","[{""version"":""v1"",""created"":""Wed, 3 Oct 2012 12:43:03 GMT""},{""version"":""v2"",""created"":""Mon, 17 Jun 2013 20:26:57 GMT""}]","2015-04-10"
"1210.1091","Vincent Tan","Vincent Y. F. Tan","A Formula for the Capacity of the General Gel'fand-Pinsker Channel","Accepted to the IEEE Transactions on Communications",,,,"cs.IT math.IT","http://arxiv.org/licenses/nonexclusive-distrib/1.0/","  We consider the Gel'fand-Pinsker problem in which the channel and state are
general, i.e., possibly non-stationary, non-memoryless and non-ergodic. Using
the information spectrum method and a non-trivial modification of the piggyback
coding lemma by Wyner, we prove that the capacity can be expressed as an
optimization over the difference of a spectral inf- and a spectral sup-mutual
information rate. We consider various specializations including the case where
the channel and state are memoryless but not necessarily stationary.
","[{""version"":""v1"",""created"":""Wed, 3 Oct 2012 12:43:26 GMT""},{""version"":""v2"",""created"":""Wed, 24 Oct 2012 04:48:04 GMT""},{""version"":""v3"",""created"":""Mon, 22 Apr 2013 03:59:38 GMT""},{""version"":""v4"",""created"":""Tue, 3 Dec 2013 01:45:22 GMT""},{""version"":""v5"",""created"":""Wed, 16 Apr 2014 08:58:44 GMT""}]","2014-04-17"
"1210.1092","Stephen Portnoy","Stephen Portnoy","Nearly root-n approximation for regression quantile processes","Published in at http://dx.doi.org/10.1214/12-AOS1021 the Annals of
  Statistics (http://www.imstat.org/aos/) by the Institute of Mathematical
  Statistics (http://www.imstat.org)","Annals of Statistics 2012, Vol. 40, No. 3, 1714-1736","10.1214/12-AOS1021","IMS-AOS-AOS1021","math.ST stat.TH","http://arxiv.org/licenses/nonexclusive-distrib/1.0/","  Traditionally, assessing the accuracy of inference based on regression
quantiles has relied on the Bahadur representation. This provides an error of
order $n^{-1/4}$ in normal approximations, and suggests that inference based on
regression quantiles may not be as reliable as that based on other (smoother)
approaches, whose errors are generally of order $n^{-1/2}$ (or better in
special symmetric cases). Fortunately, extensive simulations and empirical
applications show that inference for regression quantiles shares the smaller
error rates of other procedures. In fact, the ""Hungarian"" construction of
Koml\'{o}s, Major and Tusn\'{a}dy [Z. Wahrsch. Verw. Gebiete 32 (1975) 111-131,
Z. Wahrsch. Verw. Gebiete 34 (1976) 33-58] provides an alternative expansion
for the one-sample quantile process with nearly the root-$n$ error rate
(specifically, to within a factor of $\log n$). Such an expansion is developed
here to provide a theoretical foundation for more accurate approximations for
inference in regression quantile models. One specific application of
independent interest is a result establishing that for conditional inference,
the error rate for coverage probabilities using the Hall and Sheather [J. R.
Stat. Soc. Ser. B Stat. Methodol. 50 (1988) 381-391] method of sparsity
estimation matches their one-sample rate.
","[{""version"":""v1"",""created"":""Wed, 3 Oct 2012 12:43:33 GMT""}]","2012-10-04"
"1210.1093","Jelle de Plaa","J. de Plaa","The origin of the chemical elements in cluster cores","6 pages, 6 figures, accepted for publication in Astronomische
  Nachrichten (AN) as part of the proceedings of the XMM-Newton Science
  Workshop: ""Galaxy Clusters as Giant Cosmic Laboratories"" at ESAC, Madrid,
  Spain, 21-23 May 2012",,"10.1002/asna.201211870",,"astro-ph.CO astro-ph.HE","http://arxiv.org/licenses/nonexclusive-distrib/1.0/","  Metals play a fundamental role in ICM cooling processes in cluster cores
through the emission of spectral lines. But when and how were these metals
formed and distributed through the ICM? The X-ray band has the unique property
of containing emission lines from all elements from carbon to zinc within the
0.1-10 keV band. Using XMM-Newton, the abundances of about 11 elements are
studied, which contain valuable information about their origin. Most elements
were formed in type Ia and core-collapse supernovae, which have very different
chemical yields. Massive stars and AGB stars also contribute by providing most
of the carbon and nitrogen in the ICM. Because feedback processes suppress star
formation in the cluster centre, the element abundances allow us to directly
probe the star formation history of the majority of stars that are thought to
have formed between z=2-3. The spatial distribution in the core and the
evolution with redshift also provide information about how these elements are
transported from the member galaxies to the ICM. I review the current progress
in chemical enrichment studies of the ICM and give an outlook to the future
opportunities provided by XMM-Newton's successors, like Astro-H.
","[{""version"":""v1"",""created"":""Wed, 3 Oct 2012 12:55:53 GMT""}]","2013-05-13"
"1210.1094","Shitao Liu","Shitao Liu and Lauri Oksanen","A Lipschitz stable reconstruction formula for the inverse problem for
  the wave equation",,,,,"math.AP","http://arxiv.org/licenses/nonexclusive-distrib/1.0/","  We consider the problem to reconstruct a wave speed $c \in C^\infty(M)$ in a
domain $M \subset \R^n$ from acoustic boundary measurements modelled by the
hyperbolic Dirichlet-to-Neumann map $\Lambda$. We introduce a reconstruction
formula for $c$ that is based on the Boundary Control method and incorporates
features also from the complex geometric optics solutions approach. Moreover,
we show that the reconstruction formula is locally Lipschitz stable for a low
frequency component of $c^{-2}$ under the assumption that the Riemannian
manifold $(M, c^{-2} dx^2)$ has a strictly convex function with no critical
points. That is, we show that for all bounded $C^2$ neighborhoods $U$ of $c$,
there is a $C^1$ neighborhood $V$ of $c$ and constants $C, R > 0$ such that
|\F\ll(\tilde c^{-2} - c^{-2}\rr)(\xi)| \le C e^{2R |\xi|} \norm{\tilde \Lambda
- \Lambda}_*, \quad \xi \in \R^n, for all $\tilde c \in U \cap V$, where
$\tilde \Lambda$ is the Dirichlet-to-Neumann map corresponding to the wave
speed $\tilde c$ and $\norm{\cdot}_*$ is a norm capturing certain regularity
properties of the Dirichlet-to-Neumann maps.
","[{""version"":""v1"",""created"":""Wed, 3 Oct 2012 12:59:52 GMT""}]","2012-10-04"
"1210.1095","Francesco Vezzi","Francesco Vezzi, Giuseppe Narzisi and Bud Mishra","Reevaluating Assembly Evaluations with Feature Response Curves: GAGE and
  Assemblathons","Submitted to PLoS One. Supplementary material available at
  http://www.nada.kth.se/~vezzi/publications/supplementary.pdf and
  http://cs.nyu.edu/mishra/PUBLICATIONS/12.supplementaryFRC.pdf",,"10.1371/journal.pone.0052210",,"q-bio.GN cs.DS","http://arxiv.org/licenses/nonexclusive-distrib/1.0/","  In just the last decade, a multitude of bio-technologies and software
pipelines have emerged to revolutionize genomics. To further their central
goal, they aim to accelerate and improve the quality of de novo whole-genome
assembly starting from short DNA reads. However, the performance of each of
these tools is contingent on the length and quality of the sequencing data, the
structure and complexity of the genome sequence, and the resolution and quality
of long-range information. Furthermore, in the absence of any metric that
captures the most fundamental ""features"" of a high-quality assembly, there is
no obvious recipe for users to select the most desirable assembler/assembly.
International competitions such as Assemblathons or GAGE tried to identify the
best assembler(s) and their features. Some what circuitously, the only
available approach to gauge de novo assemblies and assemblers relies solely on
the availability of a high-quality fully assembled reference genome sequence.
Still worse, reference-guided evaluations are often both difficult to analyze,
leading to conclusions that are difficult to interpret. In this paper, we
circumvent many of these issues by relying upon a tool, dubbed FRCbam, which is
capable of evaluating de novo assemblies from the read-layouts even when no
reference exists. We extend the FRCurve approach to cases where lay-out
information may have been obscured, as is true in many deBruijn-graph-based
algorithms. As a by-product, FRCurve now expands its applicability to a much
wider class of assemblers -- thus, identifying higher-quality members of this
group, their inter-relations as well as sensitivity to carefully selected
features, with or without the support of a reference sequence or layout for the
reads. The paper concludes by reevaluating several recently conducted assembly
competitions and the datasets that have resulted from them.
","[{""version"":""v1"",""created"":""Wed, 3 Oct 2012 13:02:30 GMT""}]","2015-06-11"
"1210.1096","Thomas Bourdel","Thomas Bourdel (LCFIO)","Phase diagrams of 2D and 3D disordered Bose gases in the local density
  approximation","LCF-OA","Physical Review A 86, 6 (2012) 063626","10.1103/PhysRevA.86.063626",,"cond-mat.quant-gas","http://arxiv.org/licenses/nonexclusive-distrib/1.0/","  We study the superfluid transitions in bidimensional (2D) and tridimensional
(3D) disordered and interacting Bose gases. We work in the limit of long-range
correlated disorder such that it can be treated in the local density
approximation. We present the superfluid transition curves both in the
disorder-temperature plane well as in the disorder-entropy plane in 2D and 3D
Bose gases. Surprisingly, we find that a small amount of disorder is always
favorable to the apparition of a superfluid. Our results offer a quantitative
comparison with recent experiments in 2D disordered ultra-cold gases, for which
no exact theory exists.
","[{""version"":""v1"",""created"":""Wed, 3 Oct 2012 13:10:07 GMT""}]","2013-02-22"
"1210.1098","Emmanuil Saridakis","Salvatore Capozziello (Naples U. and INFN, Naples), P. A. Gonzalez
  (Chile U., Santiago and Diego Portales U.), Emmanuel N. Saridakis (Natl.
  Tech. U., Athens and Baylor U. and Paris, Inst. Astrophys.), Yerko Vasquez
  (Frontera U.)","Exact charged black-hole solutions in D-dimensional f(T) gravity:
  torsion vs curvature analysis","24 pages, 3 figures. arXiv admin note: text overlap with
  arXiv:1110.4024","JHEP 1302 (2013) 039","10.1007/JHEP02(2013)039",,"hep-th gr-qc","http://arxiv.org/licenses/nonexclusive-distrib/1.0/","  We extract exact charged black-hole solutions with flat transverse sections
in the framework of D-dimensional Maxwell-f(T) gravity, and we analyze the
singularities and horizons based on both torsion and curvature invariants.
Interestingly enough, we find that in some particular solution subclasses there
appear more singularities in the curvature scalars than in the torsion ones.
This difference disappears in the uncharged case, or in the case where f(T)
gravity becomes the usual linear-in-T teleparallel gravity, that is General
Relativity. Curvature and torsion invariants behave very differently when
matter fields are present, and thus f(R) gravity and f(T) gravity exhibit
different features and cannot be directly re-casted each other.
","[{""version"":""v1"",""created"":""Wed, 3 Oct 2012 13:11:02 GMT""}]","2013-03-21"
"1210.1099","Juncheol Pyo","Juncheol Pyo, Magdalena Rodriguez","Simply-connected minimal surfaces with finite total curvature in
  $\H^2\times\R$","11 pages, 3 figures, Comments welcome",,,,"math.DG","http://creativecommons.org/licenses/publicdomain/","  Laurent Hauswirth and Harold Rosenberg developed the theory of minimal
surfaces with finite total curvature in $\H^2\times\R$. They showed that the
total curvature of one such a surface must be a non-negative integer multiple
of $-2\pi$. The first examples appearing in this context are vertical geodesic
planes and Scherk minimal graphs over ideal polygonal domains. Other non
simply-connected examples have been constructed recently. In the present paper,
we show that the only complete minimal surfaces in $\H^2\times\R$ of total
curvature $-2\pi$ are Scherk minimal graphs over ideal quadrilaterals. We also
construct properly embedded simply-connected minimal surfaces with total
curvature $-4k\pi$, for any integer $k\geq 1$, which are not Scherk minimal
graphs over ideal polygonal domains.
","[{""version"":""v1"",""created"":""Wed, 3 Oct 2012 13:14:37 GMT""}]","2012-10-04"
"1210.1101","Simone Antoniucci","Andrea La Camera, Simone Antoniucci, Mario Bertero, Patrizia Boccacci,
  Dario Lorenzetti, Brunella Nisini","Image reconstruction for observations with a high dynamic range:
  LINC-NIRVANA simulations of a stellar jet","From the proceedings of the SPIE 2012 conference, 11 pages, 7 figures","2012, Proc. SPIE, Vol. 8445, Optical and Infrared Interferometry
  III, 84453D","10.1117/12.925539",,"astro-ph.IM","http://arxiv.org/licenses/nonexclusive-distrib/1.0/","  We report the results of a simulation and reconstruction of observations of a
young stellar object (YSO) jet with the LINC-NIRVANA (LN) interferometric
instrument, which will be mounted on the Large Binocular Telescope (LBT). This
simulation has been performed in order to investigate the ability of observing
the weak diffuse jet line emission against the strong IR stellar continuum
through narrow band images in the H and K atmospheric windows. In general, this
simulation provides clues on the image quality that could be achieved in
observations with a high dynamic range. In these cases, standard deconvolution
methods, such as Richardson-Lucy, do not provide satisfactory results: we
therefore propose here a new method of image reconstruction. It consists in
considering the image to be reconstructed as the sum of two terms: one
corresponding to the star (whose position is assumed to be known) and the other
to the jet. A regularization term is introduced for this second component and
the reconstruction is obtained with an iterative method alternating between the
two components. An analysis of the results shows that the image quality
obtainable with this method is significantly improved with respect to standard
deconvolution methods, reducing the number of artifacts and allowing us to
reconstruct the original jet intensity distribution with an error smaller than
10%.
","[{""version"":""v1"",""created"":""Wed, 3 Oct 2012 13:28:23 GMT""}]","2015-06-11"
