"1210.0994","Mrutunjaya Bhuyan Mr","Shakeb Ahamad, M. Bhuyan and S. K. Patra","Properties of Z=120 nuclei and the \alpha-decay chains of the
  (292,304)120 isotopes using relativistic and non-relativistic formalisms","25 pages, 10 figures, 4 Tables. arXiv admin note: text overlap with
  arXiv:0906.0066, arXiv:1010.5050",,,,"nucl-th","http://arxiv.org/licenses/nonexclusive-distrib/1.0/","  The ground state and first intrinsic excited state of superheavy nuclei with
Z=120 and N=160-204 are investigated using both non-relativistic
Skyrme-Hartree-Fock and the axially deformed Relativistic Mean Field
formalisms. We employ a simple BCS pairing approach for calculating the energy
contribution from pairing interaction. The results for isotopic chain of
binding energy, quadrupole deformation parameter, two neutron separation
energies and some other observables are compared with the FRDM and some recent
macroscopic-microscopic calculations. We predict superdeformed ground state
solutions for almost all the isotopes. Considering the possibility of magic
neutron number, two different mode of \alpha-decay chains (292)120 and (304)120
are also studied within these frameworks. The Q_{\alpha}-values and the
half-life T^{\alpha}_{1/2} for these two different mode of decay chains are
compared with FRDM and recent macroscopic-microscopic calculations. The
calculation is extended for the \alpha-decay chains of 292120 and 304120 from
their exited state configuration to respective configuration, which predicts
long half-life T^{\alpha}_{1/2}(sec.).
","[{""version"":""v1"",""created"":""Wed, 3 Oct 2012 06:11:41 GMT""}]","2012-10-04"
"1210.0995","Tomohisa Inoue","Tomohisa Inoue, Juno Mukai","The 2-components of the 31-stem homotopy groups of the 9 and 10-spheres","15 pages",,,,"math.AT","http://arxiv.org/licenses/nonexclusive-distrib/1.0/","  Group structures of the 2-primary components of the 31-stem homotopy groups
of spheres were studied by Oda in 1979. There are, however, two incompletely
determined groups. In this paper, our investigation with Toda's composition
method gives structures of them.
","[{""version"":""v1"",""created"":""Wed, 3 Oct 2012 06:13:24 GMT""}]","2012-10-04"
"1210.0996","Syunji Moriya","Syunji Moriya","Multiplicative formality of operads and Sinha's spectral sequence for
  long knots","9 pages. Formerly named ""Sinha's spectral sequence and homotopical
  algebra of operads"". published version","Kyoto J. Math. 55 (2015), no.1, 17-27",,,"math.AT","http://arxiv.org/licenses/nonexclusive-distrib/1.0/","  Lambrechts, Turchin and Voli\'c proved the Bousfield-Kan type rational
homology spectral sequence associated to the $d$-th Kontsevich operad collapses
at $E^2$-page if $d\geq 4$. The key of their proof is formality of the operad.
In this paper, we simplify their proof using a model category of operads. As
byproducts we obtain two new consequences. One is collapse of the spectral
sequence in the case of $d=3$ (and the coefficients being rational numbers).
The other says there is no non-trivial extension for the Gerstenhaber algebra
structure on the spectral sequence.
","[{""version"":""v1"",""created"":""Wed, 3 Oct 2012 06:15:09 GMT""},{""version"":""v2"",""created"":""Wed, 31 Oct 2012 06:39:13 GMT""},{""version"":""v3"",""created"":""Fri, 6 Mar 2020 15:36:01 GMT""}]","2020-03-09"
"1210.0997","Martino Lobue","Martino Lobue (SATIE, IA), Vincent Loyau (SATIE), Fr\'ed\'eric
  Mazaleyrat (SATIE), Alexander Pasko (SATIE), Vittorio Basso (INRIM), Michaela
  K\""upferling (INRIM), Carlo Paolo Sasso (INRIM)","Direct calorimetric measurements of isothermal entropy change on single
  crystal W-type hexaferrites at the spin reorientation transition",,"Journal of Applied Physics 111, 7 (2012) 07A905","10.1063/1.3670062",,"cond-mat.mtrl-sci","http://arxiv.org/licenses/nonexclusive-distrib/1.0/","  We report on the magnetic field induced isothermal entropy change, \Delta
s(Ha, T), of W-type ferrite with CoZn substitution. Entropy measurements are
performed by direct calorimetry. Single crystals of the composition
BaCo$_0.62$Zn$_1.38$Fe$_16$O$_27$, prepared by the flux method, are measured at
different fixed temperatures under an applied field perpendicular and parallel
to the c axis. At 296 K one deduces a value of K$_1$ = 8.7 \times 10^{4} J
m$^-3$ for the first anisotropy constant, which is in good agreement with the
literature. The spin reorientation transition temperature is estimated to take
place between 200 and 220 K.
","[{""version"":""v1"",""created"":""Wed, 3 Oct 2012 06:16:16 GMT""}]","2012-10-04"
"1210.0998","Yang Guo","Y. Guo, M. D. Ding, Y. Liu, X. D. Sun, M. L. DeRosa, T. Wiegelmann","Modeling Magnetic Field Structure of a Solar Active Region Corona using
  Nonlinear Force-Free Fields in Spherical Geometry","34 pages, 8 figures, accepted for publication in ApJ",,"10.1088/0004-637X/760/1/47",,"astro-ph.SR","http://arxiv.org/licenses/nonexclusive-distrib/1.0/","  We test a nonlinear force-free field (NLFFF) optimization code in spherical
geometry using an analytical solution from Low and Lou. Several tests are run,
ranging from idealized cases where exact vector field data are provided on all
boundaries, to cases where noisy vector data are provided on only the lower
boundary (approximating the solar problem). Analytical tests also show that the
NLFFF code in the spherical geometry performs better than that in the Cartesian
one when the field of view of the bottom boundary is large, say, $20^\circ
\times 20^\circ$. Additionally, We apply the NLFFF model to an active region
observed by the Helioseismic and Magnetic Imager (HMI) on board the Solar
Dynamics Observatory (SDO) both before and after an M8.7 flare. For each
observation time, we initialize the models using potential field source surface
(PFSS) extrapolations based on either a synoptic chart or a flux-dispersal
model, and compare the resulting NLFFF models. The results show that NLFFF
extrapolations using the flux-dispersal model as the boundary condition have
slightly lower, therefore better, force-free and divergence-free metrics, and
contain larger free magnetic energy. By comparing the extrapolated magnetic
field lines with the extreme ultraviolet (EUV) observations by the Atmospheric
Imaging Assembly (AIA) on board SDO, we find that the NLFFF performs better
than the PFSS not only for the core field of the flare productive region, but
also for large EUV loops higher than 50 Mm.
","[{""version"":""v1"",""created"":""Wed, 3 Oct 2012 06:20:16 GMT""}]","2015-06-11"
"1210.0999","Pierrick Tranouez","Thomas Palfray (LITIS), David H\'ebert (LITIS), St\'ephane Nicolas
  (LITIS), Pierrick Tranouez (LITIS), Thierry Paquet (LITIS)","Logical segmentation for article extraction in digitized old newspapers","ACM Document Engineering, France (2012)",,,,"cs.IR cs.CV cs.DL","http://arxiv.org/licenses/nonexclusive-distrib/1.0/","  Newspapers are documents made of news item and informative articles. They are
not meant to be red iteratively: the reader can pick his items in any order he
fancies. Ignoring this structural property, most digitized newspaper archives
only offer access by issue or at best by page to their content. We have built a
digitization workflow that automatically extracts newspaper articles from
images, which allows indexing and retrieval of information at the article
level. Our back-end system extracts the logical structure of the page to
produce the informative units: the articles. Each image is labelled at the
pixel level, through a machine learning based method, then the page logical
structure is constructed up from there by the detection of structuring entities
such as horizontal and vertical separators, titles and text lines. This logical
structure is stored in a METS wrapper associated to the ALTO file produced by
the system including the OCRed text. Our front-end system provides a web high
definition visualisation of images, textual indexing and retrieval facilities,
searching and reading at the article level. Articles transcriptions can be
collaboratively corrected, which as a consequence allows for better indexing.
We are currently testing our system on the archives of the Journal de Rouen,
one of France eldest local newspaper. These 250 years of publication amount to
300 000 pages of very variable image quality and layout complexity. Test year
1808 can be consulted at plair.univ-rouen.fr.
","[{""version"":""v1"",""created"":""Wed, 3 Oct 2012 06:24:25 GMT""}]","2012-10-04"
"1210.1000","Frederic Klopp","Fr\'ed\'eric Klopp (IMJ)","Resonances for large one-dimensional ""ergodic"" systems","Many typos were corrected","Anal. PDE 9 (2016) 259-352","10.2140/apde.2016.9.259",,"math-ph math.MP","http://arxiv.org/licenses/nonexclusive-distrib/1.0/","  The present paper is devoted to the study of resonances for one-dimensional
quantum systems with a potential that is the restriction to some large box of
an ergodic potential. For discrete models both on a half-line and on the whole
line, we study the distributions of the resonances in the limit when the size
of the box where the potential does not vanish goes to infinity. For periodic
and random potentials, we analyze how the spectral theory of the limit operator
influences the distribution of the resonances.
","[{""version"":""v1"",""created"":""Wed, 3 Oct 2012 06:25:06 GMT""},{""version"":""v2"",""created"":""Wed, 27 Feb 2013 16:28:23 GMT""},{""version"":""v3"",""created"":""Fri, 5 Jun 2015 12:47:25 GMT""}]","2016-06-22"
"1210.1001","Jaime Medina","Jaime Medina, Dmitry Green and Claudio Chamon","Networks of quantum wire junctions: a system with quantized integer Hall
  resistance without vanishing longitudinal resistivity","8 pages, 8 figures","Physical Review B 87.4 (2013): 045128","10.1103/PhysRevB.87.045128",,"cond-mat.str-el cond-mat.mes-hall","http://arxiv.org/licenses/nonexclusive-distrib/1.0/","  We consider a honeycomb network built of quantum wires, with each node of the
network having a Y-junction of three wires with a ring through which flux can
be inserted. The junctions are the basic circuit elements for the network, and
they are characterized by 3 x 3 conductance tensors. The low energy stable
fixed point tensor conductances result from quantum effects, and are determined
by the strength of the interactions in each wire and the magnetic flux through
the ring. We consider the limit where there is decoherence in the wires between
any two nodes, and study the array as a network of classical 3-lead circuit
elements whose characteristic conductance tensors are determined by the quantum
fixed point. We show that this network has some remarkable transport properties
in a range of interaction parameters: it has a Hall resistance quantized at
Rxy=h/e^2, although the longitudinal resistivity is non-vanishing. We show that
these results are robust against disorder, in this case non-homogeneous
interaction parameters g for the different wires in the network.
","[{""version"":""v1"",""created"":""Wed, 3 Oct 2012 06:27:27 GMT""},{""version"":""v2"",""created"":""Mon, 14 Jan 2013 19:43:02 GMT""},{""version"":""v3"",""created"":""Tue, 12 Feb 2013 11:18:22 GMT""}]","2013-02-13"
"1210.1002","Geertrui Van de Voorde","Stefan Dodunekov, Leo Storme, Geertrui Van de Voorde","Partial covers of PG(n,q)",,"European J. Combin., 31 (6) (2010), 1611-1616",,,"math.CO","http://arxiv.org/licenses/nonexclusive-distrib/1.0/","  In this paper, we show that a set of q+a hyperplanes, q>13, a<(q-10)/4, that
does not cover PG(n,q), does not cover at least q^(n-1)-aq^(n-2) points, and
show that this lower bound is sharp. If the number of non- covered points is at
most q^(n-1), then we show that all non-covered points are contained in one
hyperplane. Finally, using a recent result of Blokhuis, Brouwer, and Szonyi
[3], we remark that the bound on a for which these results are valid can be
improved to a<(q-2)/3 and that this upper bound on a is sharp
","[{""version"":""v1"",""created"":""Wed, 3 Oct 2012 06:31:09 GMT""}]","2012-10-04"
"1210.1003","Geertrui Van de Voorde","Peter Sziklai, Geertrui Van de Voorde","A small minimal blocking set in PG(n,p^t), spanning a (t-1)-space, is
  linear",,,"10.1007/s10623-012-9751-x.",,"math.CO","http://arxiv.org/licenses/nonexclusive-distrib/1.0/","  In this paper, we show that a small minimal blocking set with exponent e in
PG(n,p^t), p prime, spanning a (t/e-1)-dimensional space, is an F_p^e-linear
set, provided that p>5(t/e)-11. As a corollary, we get that all small minimal
blocking sets in PG(n,p^t), p prime, p>5t-11, spanning a (t-1)-dimensional
space, are F_p-linear, hence confirming the linearity conjecture for blocking
sets in this particular case.
","[{""version"":""v1"",""created"":""Wed, 3 Oct 2012 06:36:11 GMT""}]","2012-10-04"
"1210.1004","Amir Abbass Varshovi","Amir Abbass Varshovi","Groenewold-Moyal Product, \alpha^\star-Cohomology, and Classification of
  Translation-Invariant Non-Commutative Structures","11 Pages",,,,"math-ph hep-th math.MP","http://arxiv.org/licenses/nonexclusive-distrib/1.0/","  The theory of alpha_star-cohomology is studied thoroughly and it is shown
that in each cohomology class there exists a unique 2-cocycle, the harmonic
form, which generates a particular Groenewold-Moyal star product. This leads to
an algebraic classification of translation-invariant non-commutative structures
and shows that any general translationinvariant non-commutative quantum field
theory is physically equivalent to a Groenewold- Moyal non-commutative quantum
field theory.
","[{""version"":""v1"",""created"":""Wed, 3 Oct 2012 06:36:25 GMT""},{""version"":""v2"",""created"":""Tue, 26 Feb 2013 10:43:01 GMT""}]","2013-02-27"
"1210.1005","Romain Gicquaud","Romain Gicquaud, Dandan Ji and Yuguang Shi","On the asymptotic behavior of Einstein manifolds with an integral bound
  on the Weyl curvature","25 pages",,,,"math.DG gr-qc math.AP","http://arxiv.org/licenses/nonexclusive-distrib/1.0/","  In this paper we consider the geometric behavior near infinity of some
Einstein manifolds $(X^n, g)$ with Weyl curvature belonging to a certain $L^p$
space. Namely, we show that if $(X^n, g)$, $n \geq 7$, admits an essential set
and has its Weyl curvature in $L^p$ for some $1<p<\frac{n-1}{2}$, then $(X^n,
g)$ must be asymptotically locally hyperbolic. One interesting application of
this theorem is to show a rigidity result for the hyperbolic space under an
integral condition for the curvature.
","[{""version"":""v1"",""created"":""Wed, 3 Oct 2012 06:48:23 GMT""}]","2012-10-04"
"1210.1006","J. P. Ma","J. P. Ma, Q. Wang and G. P. Zhang","QCD Evolutions of Twist-3 Chirality-Odd Operators","9 pages, 2 figures",,"10.1016/j.physletb.2012.12.007",,"hep-ph","http://arxiv.org/licenses/nonexclusive-distrib/1.0/","  We study the scale dependence of twist-3 distributions defined with
chirality-odd quark-gluon operators. To derive the scale dependence we
explicitly calculate these distributions of multi-parton states instead of a
hadron. Taking one-loop corrections into account we obtain the leading
evolution kernel in the most general case. In some special cases the evolutions
are simplified. We observe that the obtained kernel in general does not get
simplified in the large-$N_c$ limit in contrast to the case of those twist-3
distributions defined only with chirality-odd quark operators. In the later,
the simplification is significant.
","[{""version"":""v1"",""created"":""Wed, 3 Oct 2012 06:49:56 GMT""}]","2015-06-11"
"1210.1007","Laura Tolos","L. Tolos, C. Garcia-Recio, J. Nieves, O. Romanets and L. L. Salcedo","Charmed mesons in nuclei with heavy-quark spin symmetry","8 pages, 5 figures, to appear in the proceedings of the 20th
  International IUPAP Conference on Few-Body Problems in Physics (FB20),
  Fukuoka, Japan, August 20th to 25th, 2012",,"10.1007/s00601-012-0533-9",,"nucl-th hep-ph nucl-ex","http://arxiv.org/licenses/nonexclusive-distrib/1.0/","  We study the properties of charmed pseudoscalar and vector mesons in dense
matter within a unitary meson-baryon coupled-channel model which incorporates
heavy-quark spin symmetry. This is accomplished by extending the SU(3)
Weinberg-Tomozawa Lagrangian to SU(8) spin-flavor symmetry and implementing a
suitable flavor symmetry breaking. Several resonances with negative parity are
generated dynamically by the s-wave interaction between pseudoscalar and vector
meson multiplets with $1/2^+$ and $3/2^+$ baryons. Those states are then
compared to experimental data as well as theoretical models. Next,
Pauli-blocking effects and meson self-energies are introduced in a
self-consistent manner to obtain the open-charm meson spectral functions in a
dense nuclear environment. We finally discuss the formation of $D$-mesic
nuclei.
","[{""version"":""v1"",""created"":""Wed, 3 Oct 2012 06:57:47 GMT""}]","2015-06-11"
"1210.1008","Michael Francis","Michael Francis","Two Topological Uniqueness Theorems for Spaces of Real Numbers","11 pages",,,,"math.GN","http://arxiv.org/licenses/nonexclusive-distrib/1.0/","  A 1910 theorem of Brouwer characterizes the Cantor set as the unique totally
disconnected, compact metric space without isolated points. A 1920 theorem of
Sierpinski characterizes the rationals as the unique countable metric space
without isolated points. The purpose of this exposition is to give an
accessible overview of this celebrated pair of uniqueness results. It is
illuminating to treat the problems simultaneously because of commonalities in
their proofs. Some of the more counterintuitive implications of these results
are explored through examples. Additionally, near-examples are provided which
thwart various attempts to relax hypotheses.
","[{""version"":""v1"",""created"":""Wed, 3 Oct 2012 07:03:51 GMT""}]","2012-10-04"
"1210.1009","Dr. Georgios M. Nikolopoulos","Matthieu Bellec, Georgios M. Nikolopoulos, and Stelios Tzortzakis","A Faithful Communication Hamiltonian in Photonic Lattices","4 pages, 2 figures, to be published in Optics Letters","Optics Letters vol. 37, 4504 (2012)","10.1364/OL.37.004504",,"quant-ph cond-mat.other physics.optics","http://arxiv.org/licenses/nonexclusive-distrib/1.0/","  Faithful communication is a necessary precondition for large scale
all-optical networking and quantum information processing. Related theoretical
investigations in different areas of physics have led to various proposals in
which finite discrete lattices are used as channels for short-distance
communication tasks. Here, in the framework of femtosecond-laser-written
waveguide arrays, we present the first experimental realization of such a
channel with judiciously engineered couplings.
","[{""version"":""v1"",""created"":""Wed, 3 Oct 2012 07:04:38 GMT""}]","2016-04-13"
"1210.1010","Chih-Hung Wang","Yu-Huei Wu and Chih-Hung Wang","Brans-Dicke theory of gravity with torsion: A possible solution of the
  $\omega$-problem","6 pages, 1 figure, English grammars are corrected, Accepted by
  Physical Review D","Phys. Rev. D 86, 123519 (2012)","10.1103/PhysRevD.86.123519",,"gr-qc astro-ph.CO hep-th","http://arxiv.org/licenses/nonexclusive-distrib/1.0/","  We study the Brans-Dicke theory of gravity in Riemann-Cartan space-times, and
obtain general torsion solutions, which are completely determined by
Brans-Dicke scalar field $\Phi$, in the false vacuum energy dominated epoch.
The substitution of the torsion solutions back to our action gives the original
Brans-Dicke action with $\Phi$-dependent Brans-Dicke parameter $\omega(\Phi)$.
The evolution of $\omega(\Phi)$ during the inflation is studied and it is found
that $\omega$ approaches to infinity at the end of inflation. This may solve
the $\omega$-problem in the extended inflation model.
","[{""version"":""v1"",""created"":""Wed, 3 Oct 2012 07:08:43 GMT""},{""version"":""v2"",""created"":""Mon, 8 Oct 2012 17:03:20 GMT""},{""version"":""v3"",""created"":""Thu, 15 Nov 2012 05:46:31 GMT""}]","2012-12-27"
"1210.1011","Helmut Abels","Helmut Abels, Daniel Depner, Harald Garcke","On an Incompressible Navier-Stokes/Cahn-Hilliard System with Degenerate
  Mobility","22 pages",,"10.1016/j.anihpc.2013.01.002",,"math.AP","http://arxiv.org/licenses/nonexclusive-distrib/1.0/","  We prove existence of weak solutions for a diffuse interface model for the
flow of two viscous incompressible Newtonian fluids in a bounded domain by
allowing for a degenerate mobility. The model has been developed by Abels,
Garcke and Gr\""un for fluids with different densities and leads to a solenoidal
velocity field. It is given by a non-homogeneous Navier-Stokes system with a
modified convective term coupled to a Cahn-Hilliard system, such that an energy
estimate is fulfilled which follows from the fact that the model is
thermodynamically consistent.
","[{""version"":""v1"",""created"":""Wed, 3 Oct 2012 07:25:10 GMT""}]","2015-06-11"
"1210.1012","Johannes Maximilian Meckbach","J. M. Meckbach, M. Merker, S. J. Buehler, K. Ilin, B. Neumeier, U.
  Kienzle, E. Goldobin, R. Kleiner, D. Koelle, M. Siegel","Sub-\mu m Josephson Junctions for Superconducting Quantum Devices",,,"10.1109/TASC.2012.2231719",,"cond-mat.supr-con","http://arxiv.org/licenses/nonexclusive-distrib/1.0/","  For high-performance superconducting quantum devices based on Josephson
junctions (JJs) decreasing lateral sizes is of great importance. Fabrication of
sub-\mu m JJs is challenging due to non-flat surfaces with step heights of up
to several 100 nm generated during the fabrication process. We have refined a
fabrication process with significantly decreased film thicknesses, resulting in
almost flat surfaces at intermediate steps during the JJ definition. In
combination with a mix-&-match process, combining electron-beam lithography
(EBL) and conventional photolithography, we can fabricate JJs with lateral
dimensions down to 0.023 \mu m^2. We propose this refined process as an
alternative to the commonly used chemical-mechanical polishing (CMP) procedure.
We present transport measurements of JJs at 4.2 K that yield critical-current
densities in the range from 50 to 10^4 A/cm^2. Our JJ process yields excellent
quality parameters, Rsg/Rn up to ~50 and Vgap up to 2.81 mV, and also allows
the fabrication of high-quality sub-\mu m wide long JJs (LJJs) for the study of
Josephson vortex behavior. The developed technique can also be used for similar
multilayer processes and is very promising for fabricating sub-\mu m JJs for
quantum devices such as SQUIDs, qubits and SIS mixers.
","[{""version"":""v1"",""created"":""Wed, 3 Oct 2012 07:25:45 GMT""},{""version"":""v2"",""created"":""Sun, 14 Oct 2012 15:58:29 GMT""}]","2013-03-28"
"1210.1013","Tao Wang Dr.","Tao Wang and Luc Vandendorpe","On the SCALE Algorithm for Multiuser Multicarrier Power Spectrum
  Management","8 pages, 5 figures; IEEE Transactions on Signal Processing, vol. 60,
  no. 9, Sep. 2012",,"10.1109/TSP.2012.2199986",,"cs.IT math.IT","http://arxiv.org/licenses/nonexclusive-distrib/1.0/","  This paper studies the successive convex approximation for low complexity
(SCALE) algorithm, which was proposed to address the weighted sum rate (WSR)
maximized dynamic power spectrum management (DSM) problem for multiuser
multicarrier systems. To this end, we first revisit the algorithm, and then
present geometric interpretation and properties of the algorithm. A geometric
programming (GP) implementation approach is proposed and compared with the
low-complexity approach proposed previously. In particular, an analytical
method is proposed to set up the default lower-bound constraints added by a GP
solver. Finally, numerical experiments are used to illustrate the analysis and
compare the two implementation approaches.
","[{""version"":""v1"",""created"":""Wed, 3 Oct 2012 07:48:23 GMT""}]","2012-10-04"
"1210.1014","Frederic Magniez","Troy Lee and Frederic Magniez and Miklos Santha","Improved Quantum Query Algorithms for Triangle Finding and Associativity
  Testing",,,,,"quant-ph","http://arxiv.org/licenses/nonexclusive-distrib/1.0/","  We show that the quantum query complexity of detecting if an $n$-vertex graph
contains a triangle is $O(n^{9/7})$. This improves the previous best algorithm
of Belovs making $O(n^{35/27})$ queries. For the problem of determining if an
operation $\circ : S \times S \rightarrow S$ is associative, we give an
algorithm making $O(|S|^{10/7})$ queries, the first improvement to the trivial
$O(|S|^{3/2})$ application of Grover search.
  Our algorithms are designed using the learning graph framework of Belovs. We
give a family of algorithms for detecting constant-sized subgraphs, which can
possibly be directed and colored. These algorithms are designed in a simple
high-level language; our main theorem shows how this high-level language can be
compiled as a learning graph and gives the resulting complexity.
  The key idea to our improvements is to allow more freedom in the parameters
of the database kept by the algorithm. As in our previous work, the edge slots
maintained in the database are specified by a graph whose edges are the union
of regular bipartite graphs, the overall structure of which mimics that of the
graph of the certificate. By allowing these bipartite graphs to be unbalanced
and of variable degree we obtain better algorithms.
","[{""version"":""v1"",""created"":""Wed, 3 Oct 2012 07:57:01 GMT""}]","2012-10-04"
