"1210.0890","Steven L. Liebling","Alex Buchel, Luis Lehner, Steven L. Liebling","Scalar Collapse in AdS","34 pages, 11 figures; Revised to be more consistent with published
  version: updated references, an added paragraph, and a subsection removed",,"10.1103/PhysRevD.86.123011","UWO-TH-12/10","gr-qc hep-th","http://arxiv.org/licenses/nonexclusive-distrib/1.0/","  Recently, studies of the gravitational collapse of a scalar field within
spherically symmetric AdS spacetimes was presented in
\cite{Bizon:2011gg,Jalmuzna:2011qw} which showed an instability of pure AdS to
black hole formation. In particular, the work showed that arbitrarily small
initial configurations of scalar field evolved through some number of
reflections off the AdS boundary until a black hole forms. We consider this
same system, extended to include a complex scalar field, and reproduce this
phenomena. We present tests of our numerical code that demonstrate convergence
and consistency. We study the properties of the evolution as the scalar pulse
becomes more compact examining the asymptotic behavior of the scalar field, an
observable in the corresponding boundary CFT. We demonstrate that such BH
formation occurs even when one places a reflecting boundary at finite radius
indicating that the sharpening is a property of gravity in a bounded domain,
not of AdS itself. We examine how the initial energy is transferred to higher
frequencies --which leads to black hole formation-- and uncover interesting
features of this transfer.
","[{""version"":""v1"",""created"":""Tue, 2 Oct 2012 19:33:47 GMT""},{""version"":""v2"",""created"":""Mon, 10 Dec 2012 22:46:02 GMT""}]","2013-05-30"
"1210.0891","George Alexandropoulos","George C. Alexandropoulos and Constantinos B. Papadias","A Reconfigurable Distributed Algorithm for K-user MIMO Interference
  Networks","5 pages, 4 figures, accepted for IEEE ICC 2013",,,,"cs.IT math.IT","http://arxiv.org/licenses/nonexclusive-distrib/1.0/","  It is already well-known that interference alignment (IA) achieves the sum
capacity of the K-user interference channel at the high interference regime. On
the other hand, it is intuitively clear that when the interference levels are
very low, a sum-rate scaling of K (as opposed to K/2 for IA) should be accessed
at high signal-to-noise ratio values by simple (""myopic"") single-link
multiple-input multiple-output (MIMO) techniques such as waterfilling. Recent
results have indicated that in certain low-to-moderate interference cases,
treating interference as noise may in fact be preferable. In this paper, we
present a distributed iterative algorithm for K-user MIMO interference networks
which attempts to adjust itself to the interference regime at hand, in the
above sense, as well as to the channel conditions. The proposed algorithm
combines the system-wide mean squared error minimization with the waterfilling
solution to adjust to the interference levels and channel conditions and
maximize accordingly each user's transmission rate. Sum-rate computer
simulations for the proposed algorithm over Ricean fading channels show that,
in the interference-limited regime, the proposed algorithm reconfigures itself
in order to achieve the IA scaling whereas, in the low-to-moderate interference
regime, it leads itself towards interference-myopic MIMO transmissions.
","[{""version"":""v1"",""created"":""Tue, 2 Oct 2012 19:42:31 GMT""},{""version"":""v2"",""created"":""Tue, 26 Feb 2013 00:47:32 GMT""}]","2013-02-27"
"1210.0892","Serkan Zorba","Serkan Zorba","A Modified FRW Metric to Explain the Cosmological Constant",,"Mod. Phys. Lett. A, 27, 1250106 (2012)","10.1142/S0217732312501064",,"physics.gen-ph astro-ph.CO","http://arxiv.org/licenses/nonexclusive-distrib/1.0/","  One of the most outstanding problems of the standard model of cosmology today
is the problem of cosmological constant/dark energy. It corresponds to about 73
per cent of the energy content of the universe gone missing. I hereby postulate
a modified FRW metric for our universe, which animates a universe spinning
rigidly but very slowly with an angular frequency that is equal to the Hubble
constant. It is shown by a simple argument that in such a universe there will
be an overlooked rotational energy whose average value is identically equal to
the matter-energy content of this universe as observed by a coordinate
observer.
","[{""version"":""v1"",""created"":""Tue, 2 Oct 2012 19:44:50 GMT""},{""version"":""v2"",""created"":""Fri, 5 Oct 2012 17:02:28 GMT""}]","2012-10-08"
"1210.0893","Tyson Littenberg","Tyson B. Littenberg, John G. Baker, Alessandra Buonanno, Bernard J.
  Kelly","Systematic biases in parameter estimation of binary black-hole mergers","16 Pages, 7 figures",,"10.1103/PhysRevD.87.104003",,"gr-qc","http://arxiv.org/licenses/nonexclusive-distrib/1.0/","  Parameter estimation of binary-black-hole merger events in gravitational-wave
data relies on matched-filtering techniques, which, in turn, depend on accurate
model waveforms. Here we characterize the systematic biases introduced in
measuring astrophysical parameters of binary black holes by applying the
currently most accurate effective-one-body templates to simulated data
containing non-spinning numerical-relativity waveforms. For advanced
ground-based detectors, we find that the systematic biases are well within the
statistical error for realistic signal-to-noise ratio (SNR). These biases grow
to be comparable to the statistical errors at high ground-based-instrument SNRs
(SNR=50), but never dominate the error budget. At the much larger
signal-to-noise ratios expected for space-based detectors, these biases will
become large compared to the statistical errors, but for astrophysical black
hole mass estimates the absolute biases (of at most a few percent) are still
fairly small.
","[{""version"":""v1"",""created"":""Tue, 2 Oct 2012 19:47:23 GMT""}]","2013-05-08"
"1210.0894","Emilio Lauret","Emilio A. Lauret","Representation equivalent Bieberbach groups and strongly isospectral
  flat manifolds","To appear in Canadian Mathematical Bulletin","Canad. Math. Bull. 57 (2014), 357-363","10.4153/CMB-2013-013-2",,"math.DG math.RT math.SP","http://arxiv.org/licenses/nonexclusive-distrib/1.0/","  Let $\Gamma_1$ and $\Gamma_2$ be Bieberbach groups contained in the full
isometry group $G$ of $\mathbb{R}^n$. We prove that if the compact flat
manifolds $\Gamma_1\backslash\mathbb{R}^n$ and $\Gamma_2\backslash\mathbb{R}^n$
are strongly isospectral then the Bieberbach groups $\Gamma_1$ and $\Gamma_2$
are representation equivalent, that is, the right regular representations
$L^2(\Gamma_1\backslash G)$ and $L^2(\Gamma_2\backslash G)$ are unitarily
equivalent.
","[{""version"":""v1"",""created"":""Tue, 2 Oct 2012 19:48:30 GMT""},{""version"":""v2"",""created"":""Mon, 15 Apr 2013 18:33:21 GMT""}]","2014-04-22"
"1210.0895","Serge Parnovsky","S. L. Parnovsky and A. S. Parnowski","Yet another sample of RFGC galaxies","9 pages, 4 figures, accepted for publication in Astrophysics & Space
  Science",,"10.1007/s10509-012-1267-3",,"astro-ph.CO","http://arxiv.org/licenses/nonexclusive-distrib/1.0/","  We present a new version of a sample of galaxies from the Revised Flat Galaxy
Catalogue (RFGC), which have redshift and HI line width data. We also give the
parameters of the collective motion model determined upon this sample. The
considered models of motion include the dipole (bulk flow), the quadrupole
(cosmic shear) and the octupole components. We also considered higher-order
multipoles. In all cases the obtained parameters matched the {\Lambda}CDM
cosmology.
","[{""version"":""v1"",""created"":""Tue, 2 Oct 2012 19:52:24 GMT""}]","2015-06-11"
"1210.0896","James Gainer","Paul Avery, Dimitri Bourilkov, Mingshui Chen, Tongguang Cheng, Alexey
  Drozdetskiy, James S. Gainer, Andrey Korytov, Konstantin T. Matchev, Predrag
  Milenovic, Guenakh Mitselmakher, Myeonghun Park, Aurelijus Rinkevicius,
  Matthew Snowball","Precision studies of the Higgs boson decay channel H -> ZZ -> 4l with
  MEKD","Major revision: added new sections discussing spin/ parity
  determination and the importance of using the full matrix element for the
  same flavor final state (involving both pairings of the leptons). Also added
  new functionality, including the most general couplings of a spin-0 or spin-2
  boson to gluons and Zs, to the publicly-available code, MEKD, presented in
  this paper. 43 pages, 15 figures",,"10.1103/PhysRevD.87.055006","CERN-PH-TH/2012-251","hep-ph hep-ex","http://arxiv.org/licenses/nonexclusive-distrib/1.0/","  The importance of the H -> ZZ -> 4l ""golden"" channel was shown by its major
role in the discovery, by the ATLAS and CMS collaborations, of a Higgs-like
boson with mass near 125 GeV. We analyze the discrimination power of the matrix
element method both for separating the signal from the irreducible ZZ
background and for distinguishing various spin and parity hypotheses describing
a signal in this channel. We show that the proper treatment of interference
effects associated with permutations of identical leptons in the four electron
and four muon final states plays an important role in achieving the best
sensitivity in measuring the properties of the newly discovered boson. We
provide a code, MEKD, that calculates kinematic discriminants based on the full
leading order matrix elements and which will aid experimentalists and
phenomenologists in their continuing studies of the H -> ZZ -> 4l channel.
","[{""version"":""v1"",""created"":""Tue, 2 Oct 2012 19:52:56 GMT""},{""version"":""v2"",""created"":""Mon, 24 Dec 2012 22:21:07 GMT""}]","2013-03-14"
"1210.0898","Yong Tao","Yong Tao","Spontaneous Economic Order","49 pages, 6 figures",,,,"q-fin.GN","http://arxiv.org/licenses/nonexclusive-distrib/1.0/","  This paper provides an attempt to formalize Hayek's notion of spontaneous
order within the framework of the Arrow-Debreu economy. Our study shows that if
a competitive economy is enough fair and free, then a spontaneous economic
order shall emerge in long-run competitive equilibria so that social members
together occupy an optimal distribution of income. Despite this, the
spontaneous order might degenerate in the form of economic crises whenever an
equilibrium economy approaches the extreme competition. Remarkably, such a
theoretical framework of spontaneous order provides a bridge linking Austrian
economics and Neoclassical economics, where we shall comprehend a truth:
""Freedom promotes technological progress"".
","[{""version"":""v1"",""created"":""Tue, 2 Oct 2012 16:28:11 GMT""},{""version"":""v2"",""created"":""Mon, 9 Sep 2013 04:48:29 GMT""}]","2013-09-10"
"1210.0899","Rachael Livermore","R. C. Livermore (ICC, Durham), A. M. Swinbank (ICC, Durham), I. Smail
  (ICC, Durham), R. G. Bower (ICC, Durham), K. E. K. Coppin (McGill), R. A.
  Crain (Leiden), A. C. Edge (ICC, Durham), J. E. Geach (McGill) and J. Richard
  (CRAL, Lyon)","Observational limits on the gas mass of a z=4.9 galaxy","14 pages, 4 figures, published in ApJL","ApJ 2012 758 L35","10.1088/2041-8205/758/2/L35",,"astro-ph.CO","http://arxiv.org/licenses/nonexclusive-distrib/1.0/","  We present the results of a search for molecular gas emission from a
star-forming galaxy at z = 4.9. The galaxy benefits from magnification of 22
+/- 5x due to strong gravitational lensing by the foreground cluster MS1358+62.
We target the CO(5-4) emission at a known position and redshift from existing
Hubble Space Telescope/ACS imaging and Gemini/NIFS [OII]3727 imaging
spectroscopy, and obtain a tentative detection at the 4.3sigma level with a
flux of 0.104 +/- 0.024Jkm/s. From the CO line luminosity and assuming a
CO-to-H2 conversion factor alpha=2, we derive a gas mass M_gas ~ 1^{+1}_{-0.6}
x 10^9 M_sun. Combined with the existing data, we derive a gas fraction
Mgas/(Mgas + M*) = 0.59^{+0.11}_{-0.06}. The faint line flux of this galaxy
highlights the difficulty of observing molecular gas in representative galaxies
at this epoch, and suggests that routine detections of similar galaxies in the
absence of gravitational lensing will remain challenging even with ALMA in full
science operations.
","[{""version"":""v1"",""created"":""Tue, 2 Oct 2012 20:00:00 GMT""}]","2015-06-11"
"1210.0900","Sean Tulin","Sean Tulin, Hai-Bo Yu, and Kathryn M. Zurek","Resonant Dark Forces and Small Scale Structure","5 pages, 3 figures",,"10.1103/PhysRevLett.110.111301","MCTP-12-27","hep-ph astro-ph.CO","http://arxiv.org/licenses/nonexclusive-distrib/1.0/","  A dark force can impact the cosmological history of dark matter (DM), both
explaining observed cores in dwarf galaxies and setting the DM relic density
through annihilation to dark force bosons. For GeV - TeV DM mass, DM
self-scattering in dwarf galaxy halos exhibits quantum mechanical resonances,
analogous to a Sommerfeld enhancement for annihilation. We show that a simple
model of DM with a dark force can accommodate all astrophysical bounds on
self-interactions in halos and explain the observed relic density, through a
single coupling constant.
","[{""version"":""v1"",""created"":""Tue, 2 Oct 2012 20:00:00 GMT""}]","2013-03-27"
"1210.0901","Jay Strader","Jay Strader (Michigan State), Laura Chomiuk (NRAO/Michigan State),
  Thomas Maccarone (Southampton), James Miller-Jones (ICRAR-Curtin), Anil Seth
  (Utah)","Two stellar-mass black holes in the globular cluster M22","Nature, in press for October 4 issue",,"10.1038/nature11490",,"astro-ph.HE astro-ph.GA astro-ph.SR","http://arxiv.org/licenses/nonexclusive-distrib/1.0/","  Hundreds of stellar-mass black holes likely form in a typical globular star
cluster, with all but one predicted to be ejected through dynamical
interactions. Some observational support for this idea is provided by the lack
of X-ray-emitting binary stars comprising one black hole and one other star
(""black-hole/X-ray binaries"") in Milky Way globular clusters, even though many
neutron-star/X-ray binaries are known. Although a few black holes have been
seen in globular clusters around other galaxies, the masses of these cannot be
determined, and some may be intermediate-mass black holes that form through
exotic mechanisms. Here we report the presence of two flat-spectrum radio
sources in the Milky Way globular cluster M22, and we argue that these objects
are black holes of stellar mass (each ~ 10-20 times more massive than the Sun)
that are accreting matter. We find a high ratio of radio-to-X-ray flux for
these black holes, consistent with the larger predicted masses of black holes
in globular clusters compared to those outside. The identification of two black
holes in one cluster shows that the ejection of black holes is not as efficient
as predicted by most models, and we argue that M22 may contain a total
population of ~ 5-100 black holes. The large core radius of M22 could arise
from heating produced by the black holes.
","[{""version"":""v1"",""created"":""Tue, 2 Oct 2012 20:00:00 GMT""}]","2015-06-11"
"1210.0902","Mikko Stenlund","Mikko Stenlund","A vector-valued almost sure invariance principle for Sinai billiards
  with random scatterers","35 pages, 6 figures. (Some added references in this version;
  Discussion of results improved; To appear in Communications in Mathematical
  Physics.)",,,,"math.DS math-ph math.MP math.PR","http://arxiv.org/licenses/nonexclusive-distrib/1.0/","  Understanding the statistical properties of the aperiodic planar Lorentz gas
stands as a grand challenge in the theory of dynamical systems. Here we study a
greatly simplified but related model, proposed by Arvind Ayyer and popularized
by Joel Lebowitz, in which a scatterer configuration on the torus is randomly
updated between collisions. Taking advantage of recent progress in the theory
of time-dependent billiards on the one hand and in probability theory on the
other, we prove a vector-valued almost sure invariance principle for the model.
Notably, the configuration sequence can be weakly dependent and non-stationary.
We provide an expression for the covariance matrix, which in the non-stationary
case differs from the traditional one. We also obtain a new invariance
principle for Sinai billiards (the case of fixed scatterers) with
time-dependent observables, and improve the accuracy and generality of existing
results.
","[{""version"":""v1"",""created"":""Tue, 2 Oct 2012 20:00:01 GMT""},{""version"":""v2"",""created"":""Thu, 4 Oct 2012 18:10:31 GMT""},{""version"":""v3"",""created"":""Wed, 12 Jun 2013 18:32:07 GMT""}]","2013-06-13"
"1210.0903","Philip Hopkins","Philip F. Hopkins (Caltech/Berkeley)","A General Theory of Turbulent Fragmentation","28 pages, 12 figures (+appendices); MNRAS accepted (revised to match
  published version)","Mon.Not.Roy.Astron.Soc., Volume 430, Issue 3, p.1653-1693, 2013","10.1093/mnras/sts704",,"astro-ph.CO astro-ph.EP astro-ph.GA physics.flu-dyn","http://arxiv.org/licenses/nonexclusive-distrib/1.0/","  We develop an analytic framework to understand fragmentation in turbulent,
self-gravitating media. Previously, we showed some properties of turbulence can
be predicted with the excursion-set formalism. Here, we generalize to fully
time-dependent gravo-turbulent fragmentation & collapse. We show that turbulent
systems are always gravitationally unstable (in a probabilistic sense). The
fragmentation mass spectra, size/mass relations, correlation functions, range
of scales over which fragmentation occurs, & time-dependent rates of
fragmentation are predictable. We show how this depends on bulk turbulent
properties (Mach numbers & power spectra). We also generalize to include
rotation, complicated equations of state, collapsing/expanding backgrounds,
magnetic fields, intermittency, & non-normal statistics. We derive how
fragmentation is suppressed with 'stiffer' equations of state or different
driving mechanisms. Suppression appears at an 'effective sonic scale' where
Mach(R,rho)~1. Gas becomes stable below this scale for polytropic gamma>4/3,
but fragmentation still occurs on larger scales. The scale-free nature of
turbulence and gravity generically drives mass spectra and correlation
functions towards universal shapes, with weak dependence on many properties of
the media. Correlated fluctuation structures, non-Gaussian density
distributions, & intermittency have surprisingly small effects on the
fragmentation process. This is because fragmentation cascades on small scales
are 'frozen in' when large-scale modes push the 'parent' region above the
collapse threshold; though they collapse, their statistics are only weakly
modified by the collapse process. With thermal support, structure develops
'top-down' in time via fragmentation cascades; but strong rotational support
reverses this to 'bottom-up' growth via mergers & introduces a maximal
instability scale distinct from the Toomre scale.
","[{""version"":""v1"",""created"":""Tue, 2 Oct 2012 20:00:01 GMT""},{""version"":""v2"",""created"":""Thu, 6 Dec 2012 18:23:58 GMT""},{""version"":""v3"",""created"":""Mon, 1 Jul 2013 09:42:48 GMT""}]","2013-07-02"
"1210.0904","Thomas Uehlinger","Thomas Uehlinger, Daniel Greif, Gregor Jotzu, Leticia Tarruell, Tilman
  Esslinger, Lei Wang, Matthias Troyer","Double transfer through Dirac points in a tunable honeycomb optical
  lattice","11 pages, 8 figures. Submitted to EPJ Special Topics for the special
  issue on ""Novel Quantum Phases and Mesoscopic Physics in Quantum Gases""","Eur. Phys. J. Special Topics 217, 121-133 (2013)","10.1140/epjst/e2013-01761-y",,"cond-mat.quant-gas","http://arxiv.org/licenses/nonexclusive-distrib/1.0/","  We report on Bloch-Zener oscillations of an ultracold Fermi gas in a tunable
honeycomb lattice. The quasi-momentum distribution of the atoms is measured
after sequentially passing through two Dirac points. We observe a double-peak
feature in the transferred fraction to the second band, both as a function of
the band gap at the Dirac points and the quasi-momentum of the trajectory. Our
results are in good agreement with a simple analytical model based on two
successive Landau-Zener transitions. Owing to the variation of the potential
gradient over the cloud size, coherent St\""uckelberg oscillations are not
visible in our measurements. This effect of the harmonic confinement is
confirmed by a numerical simulation of the dynamics of a trapped 2D system.
","[{""version"":""v1"",""created"":""Tue, 2 Oct 2012 20:00:03 GMT""}]","2013-03-13"
"1210.0905","Neil Crighton","Neil H. M. Crighton, Jill Bechtold, Robert F. Carswell, Romeel Dav\'e,
  Craig B. Foltz, Buell T. Jannuzi, Simon L. Morris, John M. O'Meara, J. Xavier
  Prochaska, Joop Schaye and Nicolas Tejos","A high molecular fraction in a sub-damped absorber at z=0.56","Final version accepted by MNRAS. Several minor changes compared to
  the first submitted version, and the conclusions remain unchanged. The data
  and code used are available here: https://github.com/nhmc/H2",,"10.1093/mnras/stt714",,"astro-ph.CO","http://arxiv.org/licenses/nonexclusive-distrib/1.0/","  Measuring rest-frame ultraviolet rotational transitions from the Lyman and
Werner bands in absorption against a bright background continuum is one of the
few ways to directly measure molecular hydrogen (H2). Here we report the
detection of Lyman-Werner absorption from H2 at z=0.56 in a sub-damped Ly-alpha
system with neutral hydrogen column density N(HI) = 10^(19.5 +/- 0.2) cm^-2.
This is the first H2 system analysed at a redshift < 1.5 beyond the Milky Way
halo. It has a surprisingly high molecular fraction: log f(H2) > -1.93 +/- 0.36
based on modelling the line profiles, with a robust model-independent lower
limit of f(H2) > 10^-3. This is higher than f(H2) values seen along sightlines
with similar N(HI) through the Milky Way disk and the Magellanic clouds. The
metallicity of the absorber is 0.19 +0.21 -0.10 solar, with a dust-to-gas ratio
< 0.36 times the value in the solar neighbourhood. Absorption from associated
low-ionisation metal transitions such as OI and FeII is observed in addition to
OVI. Using Cloudy models we show that there are three phases present; a ~100 K
phase giving rise to H2, a ~10^4 K phase where most of the low-ionisation metal
absorption is produced; and a hotter phase associated with OVI. Based on
similarities to high velocity clouds in the Milky Way halo showing H2 and the
presence of two nearby galaxy candidates with impact parameters of ~10 kpc, we
suggest that the absorber may be produced by a tidally-stripped structure
similar to the Magellanic Stream.
","[{""version"":""v1"",""created"":""Tue, 2 Oct 2012 20:00:03 GMT""},{""version"":""v2"",""created"":""Wed, 24 Apr 2013 20:08:32 GMT""}]","2015-06-11"
"1210.0906","Yue Zhang","Weicong Huang, Jing Shu, Yue Zhang","On the Higgs Fit and Electroweak Phase Transition","15 pages, 5 figures","JHEP 1303 (2013) 164","10.1007/JHEP03(2013)164",,"hep-ph astro-ph.CO hep-ex","http://arxiv.org/licenses/nonexclusive-distrib/1.0/","  We consider the Higgs portal through which light scalars contribute both to
the Higgs production and decay and Higgs effective potential at finite
temperature via quantum loops. The positive Higgs portal coupling required by a
strongly first order electroweak phase transition is disfavored by the current
Higgs data if we consider one such scalar. We observe that by introducing a
second scalar with negative Higgs portal coupling, one can not only improve the
Higgs fits, but also enhance the strength of first order EWPT. We apply this
mechanism to the light stop scenario for electroweak baryogenesis in the MSSM
and find a light sbottom could play the role as the second scalar, which allows
the stop to be relatively heavier. Non-decoupled effects on the Higgs or
sbottom self-interactions from physics beyond MSSM is found to be indispensable
for this scenario to work. A clear prediction from the picture is the existence
of a light sbottom (below 200 GeV) and a light stop (can be as heavy as 140
GeV), which can be directly tested in the near future.
","[{""version"":""v1"",""created"":""Tue, 2 Oct 2012 20:00:05 GMT""},{""version"":""v2"",""created"":""Thu, 27 Jun 2013 00:43:06 GMT""}]","2015-06-11"
"1210.0907","Tarun Grover","Tarun Grover and Ashvin Vishwanath","Quantum Phase Transition between Integer Quantum Hall States of Bosons","11 pages, 3 figures","Phys. Rev. B 87, 045129 (2013)","10.1103/PhysRevB.87.045129",,"cond-mat.str-el cond-mat.mes-hall hep-th","http://arxiv.org/licenses/nonexclusive-distrib/1.0/","  Bosonic Integer Quantum Hall (IQH) phases are a class of symmetry protected
topological (SPT) phases that, similar to the fermionic IQH states, support a
quantized Hall conductance. They, however, require interactions for their
realization. Here we study quantum Hall plateau transitions between a trivial
insulator and a bosonic IQH phase, in a clean system. Generically, we find an
intervening superfluid phase. The presence of additional symmetries, however,
can potentially lead to a direct transition between these phases. We employ a
fermionic parton description that captures both the insulating phases as well
as the transition between them. The critical theory is massless QED-3 with Nf =
2 fermion flavors. The fermions have a surprisingly simple interpretation -
they are vortices of the superfluid. Therefore the universal conductivity at
the transition, assuming it is continuous, equals the universal resistivity of
Dirac fermions in QED-3. We also briefly comment on sigma model descriptions of
the transition and the surface states of related 3D SPT phases.
","[{""version"":""v1"",""created"":""Tue, 2 Oct 2012 20:00:05 GMT""}]","2013-03-05"
