"1208.0599","Alessandro Faimali","A. Faimali, M. A. Thompson, L. Hindson, J. S. Urquhart, M. Pestalozzi,
  S. Carey, S. Shenoy, M. Veneziani, S. Molinari, and J. S. Clark","The G305 star-forming complex: Embedded Massive Star Formation
  Discovered by Herschel Hi-GAL","Accepted by MNRAS, 16 pages, 8 figures, 3 tables",,"10.1111/j.1365-2966.2012.21765.x",,"astro-ph.GA","http://arxiv.org/licenses/nonexclusive-distrib/1.0/","  We present a Herschel far-infrared study towards the rich massive star-
forming complex G305, utilising PACS 70, 160 {\mu}m and SPIRE 250, 350, and 500
{\mu}m observations from the Hi-GAL survey of the Galactic plane. The focus of
this study is to identify the embedded massive star-forming population within
G305, by combining far-infrared data with radio continuum, H2O maser, methanol
maser, MIPS, and Red MSX Source survey data available from previous studies. By
applying a frequentist technique we are able to identify a sample of the most
likely associations within our multi-wavelength dataset, that can then be
identified from the derived properties obtained from fitted spectral energy
distributions (SEDs). By SED modelling using both a simple modified blackbody
and fitting to a comprehensive grid of model SEDs, some 16 candidate
associations are identified as embedded massive star-forming regions. We derive
a two-selection colour criterion from this sample of log(F70/F500)\geq 1 and
log(F160/F350)\geq 1.6 to identify an additional 31 embedded massive star
candidates with no associated star-formation tracers. Using this result we can
build a picture of the present day star-formation of the complex, and by
extrapolating an initial mass function, suggest a current population of \approx
2 \times 10^4 young stellar objects (YSOs) present, corresponding to a star
formation rate (SFR) of 0.01-0.02 M\odot yr^-1. Comparing this resolved star
formation rate, to extragalactic star formation rate tracers (based on the
Kennicutt-Schmidt relation), we find the star formation activity is
underestimated by a factor of \geq 2 in comparison to the SFR derived from the
YSO population.
","[{""version"":""v1"",""created"":""Thu, 2 Aug 2012 20:00:04 GMT""}]","2015-06-11"
"1208.0600","Alexandre Barreira","Alexandre Barreira (ICC&IPPP, Durham), Baojiu Li (ICC, Durham),
  Carlton Baugh (ICC, Durham), Silvia Pascoli (IPPP, Durham)","Linear perturbations in Galileon gravity models","version 2. Minor changes to figures and text, and typo corrected in
  Eq. (A7). References added. Published in PRD","Phys.Rev. D86 (2012) 124016","10.1103/PhysRevD.86.124016",,"astro-ph.CO gr-qc hep-ph","http://arxiv.org/licenses/nonexclusive-distrib/1.0/","  We study the cosmology of Galileon modified gravity models in the linear
perturbation regime. We derive the fully covariant and gauge invariant
perturbed field equations using two different methods, which give consistent
results, and solve them using a modified version of the {\tt CAMB} code. We
find that, in addition to modifying the background expansion history and
therefore shifting the positions of the acoustic peaks in the cosmic microwave
background (CMB) power spectrum, the Galileon field can cluster strongly from
early times, and causes the Weyl gravitational potential to grow, rather than
decay, at late times. This leaves clear signatures in the low-$l$ CMB power
spectrum through the modified integrated Sachs-Wolfe effect, strongly enhances
the linear growth of matter density perturbations and makes distinctive
predictions for other cosmological signals such as weak lensing and the power
spectrum of density fluctuations. The quasi-static approximation is shown to
work quite well from small to the near-horizon scales. We demonstrate that
Galileon models display a rich phenomenology due to the large parameter space
and the sensitive dependence of the model predictions on the Galileon
parameters. Our results show that some Galileon models are already ruled out by
present data and that future higher significance galaxy clustering, ISW and
lensing measurements will place strong constraints on Galileon gravity.
","[{""version"":""v1"",""created"":""Thu, 2 Aug 2012 20:00:04 GMT""},{""version"":""v2"",""created"":""Sun, 20 Jan 2013 18:16:21 GMT""}]","2013-01-22"
"1208.0601","Richard Hill","Johannes Heinonen, Richard J. Hill and Mikhail P. Solon","Lorentz invariance in heavy particle effective theories","24 pages",,"10.1103/PhysRevD.86.094020","EFI Preprint 12-16","hep-ph hep-th","http://arxiv.org/licenses/nonexclusive-distrib/1.0/","  Employing induced representations of the Lorentz group (Wigner's little group
construction), formalism for constructing heavy particle effective Lagrangians
is developed, and Lagrangian constraints enforcing Lorentz invariance of the S
matrix are derived. The relationship between Lorentz invariance and
reparameterization invariance is established and it is shown why a standard
ansatz for implementing reparameterization invariance in heavy fermion
effective Lagrangians breaks down at order 1/M^4. Formalism for fields of
arbitrary spin and for self-conjugate fields is presented, and the extension to
effective theories of massless fields is discussed.
","[{""version"":""v1"",""created"":""Thu, 2 Aug 2012 20:00:06 GMT""}]","2013-05-30"
"1208.0602","Patrick Kelly","Patrick L. Kelly (1), Anja von der Linden (1), Douglas E. Applegate
  (1), Mark T. Allen (1), Steven W. Allen (1), Patricia R. Burchat (1), David
  L. Burke (1), Harald Ebeling (2), Peter Capak (3), Oliver Czoske (4), David
  Donovan (2), Adam Mantz (5), and R. Glenn Morris (1) ((1) KIPAC
  Stanford/SLAC, (2) IfA Hawaii, (3) Caltech, (4) IfA Vienna, (5) KICP Chicago)","Weighing the Giants II: Improved Calibration of Photometry from Stellar
  Colors and Accurate Photometric Redshifts","Accepted by MNRAS with only minor revisions. Code available:
  http://big-macs-calibrate.googlecode.com (v2 latex symbols removed from
  abstract)","Kelly et al. 2014, MNRAS, 439, 28-47","10.1093/mnras/stt1946",,"astro-ph.CO astro-ph.IM","http://arxiv.org/licenses/nonexclusive-distrib/1.0/","  We present improved methods for using stars found in astronomical exposures
to calibrate both star and galaxy colors as well as to adjust the instrument
flat field. By developing a spectroscopic model for the SDSS stellar locus in
color-color space, synthesizing an expected stellar locus, and simultaneously
solving for all unknown zeropoints when fitting to the instrumental locus, we
increase the calibration accuracy of stellar locus matching. We also use a new
combined technique to estimate improved flat-field models for the Subaru
SuprimeCam camera, forming `star flats' based on the magnitudes of stars
observed in multiple positions or through comparison with available SDSS
magnitudes. These techniques yield galaxy magnitudes with reliable color
calibration (< 0.01 - 0.02 mag accuracy) that enable us to estimate photometric
redshift probability distributions without spectroscopic training samples. We
test the accuracy of our photometric redshifts using spectroscopic redshifts
z_s for ~5000 galaxies in 27 cluster fields with at least five bands of
photometry, as well as galaxies in the COSMOS field, finding sigma((z_p -
z_s)/(1 + z_s)) ~ 0.03 for the most probable redshift z_p. We show that the
full posterior probability distributions for the redshifts of galaxies with
five-band photometry exhibit good agreement with redshifts estimated from
thirty-band photometry in the COSMOS field. The growth of shear with increasing
distance behind each galaxy cluster shows the expected redshift-distance
relation for a flat Lambda-CDM cosmology. Photometric redshifts and calibrated
colors are used in subsequent papers to measure the masses of 51 galaxy
clusters from their weak gravitational shear. We make our Python code for
stellar locus matching available at http://big-macs-calibrate.googlecode.com;
the code requires only a catalog and filter functions.
","[{""version"":""v1"",""created"":""Thu, 2 Aug 2012 20:00:06 GMT""},{""version"":""v2"",""created"":""Mon, 6 Aug 2012 00:29:13 GMT""},{""version"":""v3"",""created"":""Sat, 19 Apr 2014 01:18:06 GMT""}]","2014-04-22"
"1208.0603","Soeren Schlichting","Y. Hori, T. Gunji, H. Hamagaki and S. Schlichting","Collective flow effects on charge balance correlations and local
  parity-violation observables in $\sqrt{s_{NN}}=2.76$ TeV Pb+Pb collisions at
  the LHC","6 pages, 6 figures",,,,"nucl-th hep-ex hep-ph nucl-ex","http://arxiv.org/licenses/nonexclusive-distrib/1.0/","  We study the effects of collective flow on charge dependent azimuthal
correlations at LHC energies. We propose a series of correlations as a
signature of the combined effects of azimuthal collective flow and local charge
conservation and perform an analysis within a statistical freeze-out model. We
find that present LHC measurements of charge dependent azimuthal correlations
are consistent with local charge conservation on the kinetic freeze-out
surface. In view of experimental searches for signatures of the chiral-magnetic
effect, we provide an alternative explanation of the charge dependence of the
observed signal and propose additional measurements to disentangle the effects.
","[{""version"":""v1"",""created"":""Thu, 2 Aug 2012 20:00:08 GMT""}]","2012-08-06"
"1208.0604","No\'e Kains","N. Kains, P. Browne, K. Horne, M. Hundertmark and A. Cassan","A Bayesian algorithm for model selection applied to caustic-crossing
  binary-lens microlensing events","13 pages, 9 figures, 3 tables, MNRAS in press",,"10.1111/j.1365-2966.2012.21813.x",,"astro-ph.IM astro-ph.SR","http://arxiv.org/licenses/nonexclusive-distrib/1.0/","  We present a full Bayesian algorithm designed to perform automated searches
of the parameter space of caustic-crossing binary-lens microlensing events.
This builds on previous work implementing priors derived from Galactic models
and geometrical considerations. The geometrical structure of the priors divides
the parameter space into well-defined boxes that we explore with multiple Monte
Carlo Markov Chains. We outline our Bayesian framework and test our automated
search scheme using two data sets: a synthetic lightcurve, and the observations
of OGLE-2007-BLG-472 that we analysed in previous work. For the synthetic data,
we recover the input parameters. For OGLE-2007-BLG-472 we find that while
\chi^2 is minimised for a planetary mass-ratio model with extremely long
timescale, the introduction of priors and minimisation of BIC, rather than
\chi^2, favours a more plausible lens model, a binary star with components of
0.78 and 0.11 M_Sun at a distance of 6.3 kpc, compared to our previous result
of 1.50 and 0.12 M_Sun at a distance of 1 kpc.
","[{""version"":""v1"",""created"":""Thu, 2 Aug 2012 20:00:10 GMT""}]","2015-06-11"
"1208.0605","Douglas Applegate","Douglas E. Applegate (1,4), Anja von der Linden (1), Patrick L. Kelly
  (1), Mark T. Allen (1), Steven W. Allen (1), Patricia R. Burchat (1), David
  L. Burke (1), Harald Ebeling (2), Adam Mantz (3), R. Glenn Morris (1) ((1)
  KIPAC Stanford/SLAC, (2) IfA Hawaii, (3) KICP Chicago, (4) AIfA Bonn)","Weighing the Giants - III. Methods and Measurements of Accurate Galaxy
  Cluster Weak-Lensing Masses","25 pages, 14 figures. Accepted after minor revision. Lensing masses
  (table 4) and other data will be made available at
  http://www.slac.stanford.edu/~dapple/work/wtg.html","Mon.Not.Roy.Astron.Soc.439:48-72,2014","10.1093/mnras/stt2129",,"astro-ph.CO","http://arxiv.org/licenses/nonexclusive-distrib/1.0/","  We report weak-lensing masses for 51 of the most X-ray luminous galaxy
clusters known. This cluster sample, introduced earlier in this series of
papers, spans redshifts 0.15 < z_cl < 0.7, and is well suited to calibrate mass
proxies for current cluster cosmology experiments. Cluster masses are measured
with a standard `color-cut' lensing method from three-filter photometry of each
field. Additionally, for 27 cluster fields with at least five-filter
photometry, we measure high-accuracy masses using a new method that exploits
all information available in the photometric redshift posterior probability
distributions of individual galaxies. Using simulations based on the COSMOS-30
catalog, we demonstrate control of systematic biases in the mean mass of the
sample with this method, from photometric redshift biases and associated
uncertainties, to better than 3%. In contrast, we show that the use of
single-point estimators in place of the full photometric redshift posterior
distributions can lead to significant redshift-dependent biases on cluster
masses. The performance of our new photometric redshift-based method allows us
to calibrate `color-cut` masses for all 51 clusters in the present sample to a
total systematic uncertainty of ~7% on the mean mass, a level sufficient to
significantly improve current cosmology constraints from galaxy clusters. Our
results bode well for future cosmological studies of clusters, potentially
reducing the need for exhaustive spectroscopic calibration surveys as compared
to other techniques, when deep, multi-filter optical and near-IR imaging
surveys are coupled with robust photometric redshift methods.
","[{""version"":""v1"",""created"":""Thu, 2 Aug 2012 20:00:10 GMT""},{""version"":""v2"",""created"":""Fri, 18 Apr 2014 09:17:31 GMT""}]","2014-04-21"
"1208.0606","Henk Hoekstra","Henk Hoekstra, Andisheh Mahdavi, Arif Babul, Chris Bildfell","The Canadian Cluster Comparison Project: weak lensing masses and SZ
  scaling relations","14 pages, 5 figures, submitted to MNRAS",,"10.1111/j.1365-2966.2012.22072.x",,"astro-ph.CO","http://arxiv.org/licenses/nonexclusive-distrib/1.0/","  The Canadian Cluster Comparison Project is a comprehensive multi-wavelength
survey targeting 50 massive X-ray selected clusters of galaxies to examine
baryonic tracers of cluster mass and to probe the cluster-to-cluster variation
in the thermal properties of the hot intracluster medium. In this paper we
present the weak lensing masses, based on the analysis of deep wide-field
imaging data obtained using the Canada-France-Hawaii-Telescope. The final
sample includes two additional clusters that were located in the field-of-view.
We take these masses as our reference for the comparison of cluster properties
at other wavelengths. In this paper we limit the comparison to published
measurements of the Sunyaev-Zel'dovich effect. We find that this signal
correlates well with the projected lensing mass, with an intrinsic scatter of
12\pm5% at ~r_2500, demonstrating it is an excellent proxy for cluster mass.
","[{""version"":""v1"",""created"":""Thu, 2 Aug 2012 20:00:16 GMT""}]","2015-06-11"
"1208.0607","Fuyan Bian","Fuyan Bian (1), Xiaohui Fan (1), Linhua Jiang (1), Arjun Dey (2),
  Richard F. Green (3), Roberto Maiolino (4), Fabian Walter (5), Ian McGreer
  (1), Ran Wang (1), Yen-Ting Lin (6) ((1) Steward Observatory, (2) NOAO, (3)
  LBTO, (4) Cavendish Laboratory, University of Cambridge, (5) MPIA, (6)
  Institute of Astronomy and Astrophysics, Academia Sinica, Taipei, Taiwan)","A UV Ultra-luminous Lyman Break Galaxy at Z=2.78 in NDWFS Bootes Field","9 pages, 5 figures, and 2 tables, accepted for publication in ApJ",,"10.1088/0004-637X/757/2/139",,"astro-ph.CO","http://arxiv.org/licenses/nonexclusive-distrib/1.0/","  We present one of the most ultraviolet (UV) luminous Lyman Break Galaxies
(LBGs) (J1432+3358) at z=2.78, discovered in the NOAO Deep Wide-Field Survey
(NDWFS) Bootes field. The R-band magnitude of J1432+3358 is 22.29 AB, more than
two magnitudes brighter than typical L* LBGs at this redshift. The deep z-band
image reveals two components of J1432+3358 separated by 1.0"" with flux ratio of
3:1. The high signal-to-noise ratio (S/N) rest-frame UV spectrum shows Lya
emission line and interstellar medium absorption lines. The absence of NV and
CIV emission lines, the non-detection in X-ray and radio wavelengths and
mid-infrared (MIR) colors indicate no or weak active galactic nuclei (AGN)
(<10%) in this galaxy. The galaxy shows broader line profile with the full
width half maximum (FWHM) of about 1000 km/s and larger outflow velocity (~500
km/s) than those of typical z~3 LBGs. The physical properties are derived by
fitting the spectral energy distribution (SED) with stellar synthesis models.
The dust extinction, E(B-V)=0.12, is similar to that in normal LBGs. The star
formation rates (SFRs) derived from the SED fitting and the dust-corrected UV
flux are consistent with each other, ~300 Msun/yr, and the stellar mass is
1.3e11 Msun. The SFR and stellar mass in J1432+3358 are about an order of
magnitude higher than those in normal LBGs. The SED-fitting results support
that J1432+3358 has a continuous star formation history with the star formation
episode of 630 Myr. The morphology of J1432+3358 and its physical properties
suggest that J1432+3358 is in an early phase of 3:1 merger process. The unique
properties and the low space number density (~1e-7 Mpc^{-3})are consistent with
the interpretation that such galaxies are either found in a short unobscured
phase of the star formation or that small fraction of intensive star-forming
galaxies are unobscured.
","[{""version"":""v1"",""created"":""Thu, 2 Aug 2012 20:03:00 GMT""}]","2015-06-11"
"1208.0608","Predrag Nikolic","Predrag Nikolic, Zlatko Tesanovic","Pairing instabilities in topological insulator quantum wells","13 pages, 6 figures; typos corrected, published version","Physical Review B 87, 104514 (2013)","10.1103/PhysRevB.87.104514",,"cond-mat.str-el","http://arxiv.org/licenses/nonexclusive-distrib/1.0/","  Topological insulator quantum wells with induced attractive interactions
between electrons are candidate systems for the realization of novel vortex
lattice states with time-reversal symmetry, and incompressible quantum vortex
liquids with fractional excitations. We analyze the competition between
different pairing channels stimulated by the superconducting proximity effect
in these quantum wells, and calculate the helical triplet pairing instability
that can produce the mentioned phases using perturbation theory. We discuss the
phase diagram tunable by gate voltage.
","[{""version"":""v1"",""created"":""Thu, 2 Aug 2012 20:03:27 GMT""},{""version"":""v2"",""created"":""Wed, 21 Aug 2013 04:16:14 GMT""}]","2013-08-22"
"1208.0609","Christopher Erven","C. Erven, B. Heim, E. Meyer-Scott, J. P. Bourgoin, R. Laflamme, G.
  Weihs, and T. Jennewein","Studying Free-Space Transmission Statistics and Improving Free-Space QKD
  in the Turbulent Atmosphere","9 pages, 6 figures","New J. Phys. 14, 123018 (2012)","10.1088/1367-2630/14/12/123018",,"quant-ph","http://arxiv.org/licenses/nonexclusive-distrib/1.0/","  The statistical fluctuations in free-space links in the turbulent atmosphere
are important for the distribution of quantum signals. To that end, we first
study statistics generated by the turbulent atmosphere in an entanglement based
free-space quantum key distribution (QKD) system. Using the insights gained
from this analysis, we study the effect of link fluctuations on the security
and key generation rate of decoy state QKD concluding that it has minimal
effect in the typical operating regimes. We then investigate the novel idea of
using these turbulent fluctuations to our advantage in QKD experiments. We
implement a signal-to-noise ratio filter (SNRF) in our QKD system which rejects
measurements during periods of low transmission efficiency, where the measured
quantum bit error rate (QBER) is temporarily elevated. Using this, we increase
the total secret key generated by the system from 78,009 bits to 97,678 bits,
representing an increase of 25.2% in the final secure key rate, generated from
the same raw signals. Lastly, we present simulations of a QKD exchange with an
orbiting LEO satellite and show that an SNRF will be extremely useful in such a
situation, allowing many more passes to extract a secret key than would
otherwise be possible.
","[{""version"":""v1"",""created"":""Thu, 2 Aug 2012 20:03:54 GMT""},{""version"":""v2"",""created"":""Wed, 24 Oct 2012 18:25:20 GMT""}]","2013-02-01"
"1208.0610","Martin C. Weisskopf","Ronald F. Elsner, Stephen L. O'Dell, and Martin C. Weisskopf","Measuring x-ray polarization in the presence of systematic effects:
  Known background","12 pages, 4 figures, for SPIE conference proceedings",,"10.1117/12.924889",,"astro-ph.IM hep-ex","http://creativecommons.org/licenses/publicdomain/","  The prospects for accomplishing x-ray polarization measurements of
astronomical sources have grown in recent years, after a hiatus of more than 37
years. Unfortunately, accompanying this long hiatus has been some confusion
over the statistical uncertainties associated with x-ray polarization
measurements of these sources. We have initiated a program to perform the
detailed calculations that will offer insights into the uncertainties
associated with x-ray polarization measurements. Here we describe a
mathematical formalism for determining the 1- and 2-parameter errors in the
magnitude and position angle of x-ray (linear) polarization in the presence of
a (polarized or unpolarized) background. We further review relevant
statistics-including clearly distinguishing between the Minimum Detectable
Polarization (MDP) and the accuracy of a polarization measurement.
","[{""version"":""v1"",""created"":""Thu, 2 Aug 2012 20:09:15 GMT""}]","2015-06-11"
"1208.0611","Cl\'ement Jause-Labert","Cl\'ement Jause-Labert and Fabien S. Godeferd","Influence of the impellers' geometry on turbulent von K\'arm\'an
  swirling flows","5 pages, 6 figures, submitted to Physical Review Letters",,,,"physics.flu-dyn","http://arxiv.org/licenses/nonexclusive-distrib/1.0/","  We report numerical evidences of the influence of the blades' shape and of
their direction of rotation on turbulent flows generated by counter-rotating
bladed-disks enclosed in a cylinder, known as the von K\'arm\'an swirling flow.
We show that, although the mean flows generated by stirrers with straight or
curved blades can be topologically similar, turbulence production occurs in
different zones. The structure and intensity of the turbulent fluctuating field
also varies with the geometry, and retains significant anisotropy. From the
direct numerical simulations fields, we analyse the dynamics of enstrophy and
we show that the distribution of relative helicity h depends on the forcing
mecanism of turbulence.
","[{""version"":""v1"",""created"":""Thu, 2 Aug 2012 20:14:45 GMT""},{""version"":""v2"",""created"":""Mon, 6 Aug 2012 13:54:43 GMT""}]","2012-08-07"
"1208.0612","Nader Zaki","Nader Zaki, Chris A. Marianetti, Danda P. Acharya, Percy Zahl, Peter
  Sutter, Junichi Okamoto, Peter D. Johnson, Andrew J. Millis, Richard M.
  Osgood","Spin-exchange-induced dimerization of an atomic 1-D system","Includes Supplementary Information","Phys. Rev. B 87, 161406 (2013)","10.1103/PhysRevB.87.161406",,"cond-mat.str-el cond-mat.mes-hall cond-mat.mtrl-sci","http://arxiv.org/licenses/nonexclusive-distrib/1.0/","  Using low-temperature scanning tunneling microscopy, we demonstrate an
unambiguous 1-D system that surprisingly undergoes a CDW instability on a
metallic substrate. Our ability to directly and quantitatively measure the
structural distortion of this system provides an accurate reference for
comparison with first principles theory. In comparison to previously proposed
physical mechanisms, we attribute this particular 1-D CDW instability to a
ferromagnetic state. We show that though the linear arrayed dimers are not
electronically isolated, they are magnetically independent, and hence can
potentially serve as a binary spin-memory system.
","[{""version"":""v1"",""created"":""Thu, 2 Aug 2012 20:22:48 GMT""}]","2013-04-22"
"1208.0613","Maxim Berezovski","Mahmoud Labib, Anna S. Zamay, Olga S. Kolovskaya, Irina T. Reshetneva,
  Galina S. Zamay, Richard J. Kibbee, Syed A. Sattar, Tatiana N. Zamay, Maxim
  V. Berezovski","Aptamer-based Impedimetric Sensor for Bacterial Typing","This paper has been withdrawn by the author due to errors","Analytical Chemistry 2012 84 (19), 8114-8117","10.1021/ac302217u",,"q-bio.BM physics.bio-ph q-bio.QM","http://arxiv.org/licenses/nonexclusive-distrib/1.0/","  The development of an aptamer-based impedimetric sensor for typing of
bacteria (AIST-B) is presented. Highly specific DNA aptamers to Salmonella
enteritidis were selected via Cell-SELEX technique. Twelve rounds of selection
were performed; each comprises a positive selection step against S. enteritidis
and a negative selection step against a mixture of related pathogens, including
Salmonella typhimurium, Escherichia coli, Staphylococcus aureus, Pseudomonas
aeruginosa, and Citrobacter freundii to ensure the species-specificity of the
selected aptamers. After sequencing of the pool showing the highest binding
affinity to S. enteritidis, a DNA aptamer sequence of high affinity to the
bacteria was integrated into an impedimetric sensor via self-assembly onto a
gold nanoparticles-modified screen-printed carbon electrode (GNPs-SPCE).
Remarkably, this aptasensor is highly selective and can successfully detect S.
enteritidis down to 600 CFU 1/mL (equivalent to 18 CFU in 30 \muL assay volume)
in 10 minutes and distinguish it from other salmonella species, including S.
typhimurium and S. choleraesuis. This report is envisaged to open a new venue
for the aptamer-based typing of a variety of microorganisms using a rapid,
economic, label-free electrochemical platform.
","[{""version"":""v1"",""created"":""Thu, 2 Aug 2012 20:32:51 GMT""},{""version"":""v2"",""created"":""Wed, 22 Aug 2012 19:27:44 GMT""}]","2012-10-11"
