"1208.0651","Muhammad Salman Asif","M. Salman Asif, Justin Romberg","Fast and Accurate Algorithms for Re-Weighted L1-Norm Minimization","Submitted to IEEE Trans. Signal Process",,,,"stat.CO cs.IT math.IT stat.ML","http://creativecommons.org/licenses/by-nc-sa/3.0/","  To recover a sparse signal from an underdetermined system, we often solve a
constrained L1-norm minimization problem. In many cases, the signal sparsity
and the recovery performance can be further improved by replacing the L1 norm
with a ""weighted"" L1 norm. Without any prior information about nonzero elements
of the signal, the procedure for selecting weights is iterative in nature.
Common approaches update the weights at every iteration using the solution of a
weighted L1 problem from the previous iteration.
  In this paper, we present two homotopy-based algorithms that efficiently
solve reweighted L1 problems. First, we present an algorithm that quickly
updates the solution of a weighted L1 problem as the weights change. Since the
solution changes only slightly with small changes in the weights, we develop a
homotopy algorithm that replaces the old weights with the new ones in a small
number of computationally inexpensive steps. Second, we propose an algorithm
that solves a weighted L1 problem by adaptively selecting the weights while
estimating the signal. This algorithm integrates the reweighting into every
step along the homotopy path by changing the weights according to the changes
in the solution and its support, allowing us to achieve a high quality signal
reconstruction by solving a single homotopy problem. We compare the performance
of both algorithms, in terms of reconstruction accuracy and computational
complexity, against state-of-the-art solvers and show that our methods have
smaller computational cost. In addition, we will show that the adaptive
selection of the weights inside the homotopy often yields reconstructions of
higher quality.
","[{""version"":""v1"",""created"":""Fri, 3 Aug 2012 04:06:32 GMT""}]","2012-08-06"
"1208.0652","Paul Munger","David Damanik, Paul Munger, William Yessen","Orthogonal polynomials on the unity circle with Fibonacci Verblunsky
  coefficients, I. The essential support of the measure",,"J. Approx. Theory 173 (2013), 56-88",,,"math.SP","http://arxiv.org/licenses/nonexclusive-distrib/1.0/","  We study probability measures on the unit circle corresponding to orthogonal
polynomials whose sequence of Verblunsky coefficients is invariant under the
Fibonacci substitution. We focus in particular on the fractal properties of the
essential support of these measures.
","[{""version"":""v1"",""created"":""Fri, 3 Aug 2012 04:22:09 GMT""}]","2015-02-24"
"1208.0653","Kenneth Herner","The D0 Collaboration","Search for the standard model Higgs boson in associated $WH$ production
  in 9.7 fb$^{-1}$ of $p\bar{p}$ collisions with the D0 detector","8 pages, 3 figures, published in PRL","Phys. Rev. Lett. 109, 121804 (2012)","10.1103/PhysRevLett.109.121804","FERMILAB-PUB-12-405-E","hep-ex","http://arxiv.org/licenses/nonexclusive-distrib/1.0/","  We present a search for the standard model Higgs boson in final states with a
charged lepton (electron or muon), missing transverse energy, and two or three
jets, at least one of which is identified as a $b$-quark jet. The search is
primarily sensitive to $WH\to\ell\nu b\bar{b}$ production and uses data
corresponding to 9.7 fb$^{-1}$ of integrated luminosity collected with the D0
detector at the Fermilab Tevatron $p\bar{p}$ Collider at $\sqrt{s}=1.96$ TeV.
We observe agreement between data and the expected background. For a Higgs
boson mass of 125 GeV, we set a 95% C.L. upper limit on the production of a
standard model Higgs boson of 5.2$\times\sigma_{\rm SM}$, where $\sigma_{\rm
SM}$ is the standard model Higgs boson production cross section, while the
expected limit is 4.7$\times\sigma_{\rm SM}$.
","[{""version"":""v1"",""created"":""Fri, 3 Aug 2012 04:30:14 GMT""},{""version"":""v2"",""created"":""Fri, 21 Sep 2012 22:30:00 GMT""}]","2015-03-20"
"1208.0654","Ken-Ichiro Imura","Ken-Ichiro Imura, Mayuko Okamoto, Yukinori Yoshimura, Yositake Takane,
  Tomi Ohtsuki","Finite-size energy gap in weak and strong topological insulators","16 pages, 18 figures","Phys. Rev. B 86, 245436 (2012)","10.1103/PhysRevB.86.245436",,"cond-mat.mes-hall","http://arxiv.org/licenses/nonexclusive-distrib/1.0/","  The non-trivialness of a topological insulator (TI) is characterized either
by a bulk topological invariant or by the existence of a protected metallic
surface state. Yet, in realistic samples of finite size this non-trivialness
does not necessarily guarantee the gaplessness of the surface state. Depending
on the geometry and on the topological indices, a finite-size energy gap of
different nature can appear, and correspondingly, exhibits various scaling
behaviors of the gap. The spin-to-surface locking provides one of such
gap-opening mechanisms, resulting in a power-law scaling of the energy gap.
Weak and strong TI's show different degrees of sensitivity to the geometry of
the sample. As a noteworthy example, a strong TI nanowire of a rectangular
prism shape is shown to be more gapped than that of a weak TI of precisely the
same geometry.
","[{""version"":""v1"",""created"":""Fri, 3 Aug 2012 04:44:02 GMT""},{""version"":""v2"",""created"":""Wed, 26 Sep 2012 07:33:04 GMT""}]","2013-01-08"
"1208.0655","Robin Tucker-Drob","Robin Tucker-Drob","Mixing actions of countable groups are almost free",,,,,"math.DS math.GR","http://arxiv.org/licenses/nonexclusive-distrib/1.0/","  A measure preserving action of a countably infinite group \Gamma is called
totally ergodic if every infinite subgroup of \Gamma acts ergodically. For
example, all mixing and mildly mixing actions are totally ergodic. This note
shows that if an action of \Gamma is totally ergodic then there exists a finite
normal subgroup N of \Gamma such that the stabilizer of almost every point is
equal to N. Surprisingly the proof relies on the group theoretic fact (proved
by Hall and Kulatilaka as well as by Kargapolov) that every infinite locally
finite group contains an infinite abelian subgroup, of which all known proofs
rely on the Feit-Thompson theorem.
  As a consequence we deduce a group theoretic characterization of countable
groups whose non-trivial Bernoulli factors are all free: these are precisely
the groups that posses no finite normal subgroup other than the trivial
subgroup.
","[{""version"":""v1"",""created"":""Fri, 3 Aug 2012 05:03:48 GMT""}]","2012-08-06"
"1208.0656","Yasushi Muraki","Y. Muraki, K. Koga, T. Goka, H. Matsumoto, T. Obara, O. Okudaira, S.
  Shibata, and T. Yamamoto","Measurement by FIB on the ISS: Two Emissions of Solar Neutrons Detected?","36 pages, 16 figures, and 3 Tables; Advanced in Astronmy, 2012,
  Special issue on Cosmic Ray Variablity:Century of Its Obseravtions","Advances in Astronomy, 2012, ID379304, 14 pages","10.1155/2012/379304",,"astro-ph.SR astro-ph.IM","http://creativecommons.org/licenses/by/3.0/","  A new type of solar neutron detector (FIB) was launched onboard the Space
Shuttle Endeavour on July 16, 2009, and it began collecting data at the
International Space Station (ISS) on August 25, 2009. This paper summarizes the
three years of observations obtained by the solar neutron detector FIB until
the end of July 2012. The solar neutron detector FIB can determine both the
energy and arrival direction of neutrons. We measured the energy spectra of
background neutrons over the SAA region and elsewhere, and found the typical
trigger rates to be 20 counts/sec and 0.22 counts/sec, respectively. It is
possible to identify solar neutrons to within a level of 0.028 counts/sec,
provided that directional information is applied. Solar neutrons were observed
in association with the M-class solar flares that occurred on March 7 (M3.7)
and June 7 (M2.5) of 2011. This marked the first time that neutrons were
observed in M-class solar flares. A possible interpretaion of the prodcution
process is provided.
","[{""version"":""v1"",""created"":""Fri, 3 Aug 2012 05:20:45 GMT""},{""version"":""v2"",""created"":""Mon, 15 Oct 2012 12:17:19 GMT""},{""version"":""v3"",""created"":""Mon, 31 Dec 2012 05:54:32 GMT""}]","2016-11-30"
"1208.0657","Michael Taylor Mr","Michael A. Taylor, Joachim Knittel and Warwick P. Bowen","Fundamental constraints on particle tracking with optical tweezers",,"New Journal of Physics 15 023018 (2013)","10.1088/1367-2630/15/2/023018",,"physics.optics","http://arxiv.org/licenses/nonexclusive-distrib/1.0/","  A general quantum limit to the sensitivity of particle position measurements
is derived following the simple principle of the Heisenberg microscope. The
value of this limit is calculated for particles in the Rayleigh and Mie
scattering regimes, and with parameters which are relevant to optical tweezers
experiments. The minimum power required to observe the zero-point motion of a
levitating bead is also calculated, with the optimal particle diameter always
smaller than the wavelength. We show that recent optical tweezers experiments
are within two orders of magnitude of quantum limited sensitivity, suggesting
that quantum optical resources may soon play an important role in high
sensitivity tracking applications.
","[{""version"":""v1"",""created"":""Fri, 3 Aug 2012 05:35:09 GMT""}]","2014-09-04"
"1208.0658","Yong-Hui Qi","Rong-Gen Cai, Tian-Jun Li, Yong-Hui Qi, Yun-Long Zhang","Incompressible Navier-Stokes Equations from Einstein Gravity with
  Chern-Simons Term","22 pages, published version","Phys. Rev. D 86, 086008 (2012)","10.1103/PhysRevD.86.086008",,"hep-th gr-qc","http://arxiv.org/licenses/nonexclusive-distrib/1.0/","  In (2+1)-dimensional hydrodynamic systems with broken parity, the shear and
bulk viscosity is joined by the Hall viscosity and curl viscosity. The dual
holographic model has been constructed by coupling a pseudo scalar to the
gravitational Chern-Simons term in (3+1)-dimensional bulk gravity. In this
paper, we investigate the non-relativistic fluid with Hall viscosity and curl
viscosity living on a finite radial cutoff surface in the bulk. Employing the
non-relativistic hydrodynamic expansion method, we obtain the incompressible
Navier-Stokes equations with Hall viscosity and curl viscosity. Unlike the
shear viscosity, the ratio of the Hall viscosity over entropy density is found
to be cutoff scale dependent, and it tends to zero when the cutoff surface
approaches to the horizon of the background spacetime.
","[{""version"":""v1"",""created"":""Fri, 3 Aug 2012 05:49:43 GMT""},{""version"":""v2"",""created"":""Fri, 14 Dec 2012 09:51:18 GMT""}]","2012-12-17"
"1208.0659","Gregory Crosswhite","Gregory Crosswhite","Embracing divergence: a formalism for when your semiring is simply not
  complete, with applications in quantum simulation","54 pages, 5 figures; submitted to the special issue of Theoretical
  Computer Science A for the 2012 workshop Weighted Automata: Theory and
  Applications; v2 simplifies the formalism allowing the presentation to be
  streamlined, and fixes some problems",,,,"cs.FL","http://arxiv.org/licenses/nonexclusive-distrib/1.0/","  There is a fundamental difficulty in generalizing weighted automata to the
case of infinite words: in general the infinite sum-of-products from which the
weight of a given word is derived will diverge. Many solutions to this problem
have been proposed, including restricting the type of weights used and
employing a different valuation function that forces convergence. In this paper
we describe an alternative approach that, rather than seeking to avoid the
inevitable divergences, instead embraces them as a source of useful
information. Specifically, rather than taking coefficients from an arbitrary
semiring S we instead take them from S^N. Doing this is useful because it gives
us information about how the weight of an infinite word does or does not
diverge, and if it does diverge what form the divergence takes --- e.g.,
polynomial, exponential, etc. This approach has proved to be incredibly useful
in the field of quantum simulation because when studying infinite systems,
information about how quantities of interest, such as energy or magnetization,
diverge is exactly what we want.
  In this paper we introduce a new kind of automaton which we call a diverging
automaton that maps infinite words to sequences of weights from a semiring and
which employs a Buchi-like boundary condition. We then develop a theory for
diverging power series and prove a Kleene Theorem connecting rational diverging
power series to diverging automata. Afterward we repeat this process by
introducing bidiverging automata which map biinfinite words to elements in S^(Z
x N), developing a theory for bidiverging power series, and proving another
Kleene Theorem. We conclude by describing how bidiverging automata are applied
to simulate biinfinite quantum systems.
","[{""version"":""v1"",""created"":""Fri, 3 Aug 2012 06:00:55 GMT""},{""version"":""v2"",""created"":""Wed, 5 Dec 2012 15:29:13 GMT""}]","2012-12-06"
"1208.0660","Camell Kachour","Camell Kachour","Algebraic Definition of weak ($\infty$; n)-Categories","38 pages",,,,"math.KT math.CT","http://arxiv.org/licenses/nonexclusive-distrib/1.0/","  In this paper we define a sequence of monads $\mathbb{T}^(\infty;n)$
$(n\in\mathbb{N})$ on $\infty$-$\mathbb{G}\text{r}$, the category of the
$\infty$-graphs. We conjecture that algebras for $\mathbb{T}^(0;n)$ which are
defined in a purely algebraic setting, are models of weak $\infty$-groupoids.
And for all $n>1$ we conjecture that algebras for $\mathbb{T}^(\infty;n)$ which
are defined in a purely algebraic setting, are models of weak $(\infty;
n)$-categories.
","[{""version"":""v1"",""created"":""Fri, 3 Aug 2012 06:03:39 GMT""}]","2012-08-06"
"1208.0661","Laszlo Gyongyosi","Laszlo Gyongyosi, Sandor Imre","Private Quantum Coding for Quantum Relay Networks","15 pages, 3 figures, Journal-ref: Lecture Notes in Computer Science,
  Vol. 7479, pp. 239-250. Springer-Verlag, 2012, presented in part at the 11th
  Intl. Conference on Quantum Communication, Measurement and Computing
  (QCMC2012), v2: minor formatting changes",,,,"quant-ph cs.IT math.IT","http://arxiv.org/licenses/nonexclusive-distrib/1.0/","  The relay encoder is an unreliable probabilistic device which is aimed at
helping the communication between the sender and the receiver. In this work we
show that in the quantum setting the probabilistic behavior can be completely
eliminated. We also show how to combine quantum polar encoding with
superactivation-assistance in order to achieve reliable and capacity-achieving
private communication over noisy quantum relay channels.
","[{""version"":""v1"",""created"":""Fri, 3 Aug 2012 06:22:37 GMT""},{""version"":""v2"",""created"":""Sun, 26 May 2013 13:52:44 GMT""}]","2013-05-28"
"1208.0662","Chul Kim","Junegone Chay and Chul Kim","Structure of divergences in Drell-Yan process with small transverse
  momentum","26 pages, 2 figures. Version published in PRD",,"10.1103/PhysRevD.86.074011",,"hep-ph","http://arxiv.org/licenses/nonexclusive-distrib/1.0/","  We consider the structure of divergences in Drell-Yan process with small
transverse momentum. The factorization proof is not trivial because various
kinds of divergences are intertwined in the collinear and soft parts at high
orders. We prescribe a method to disentangle the divergences in the framework
of the soft-collinear effective theory. The rapidity divergence is handled by
introducing the $\delta$ regulator in the collinear Wilson lines. The collinear
part, which consists of the transverse-momentum-dependent parton distribution
function (TMDPDF), is free of the rapidity divergence after the soft zero-bin
subtraction. There still remains the problem of mixing between the ultraviolet
and infrared divergences, which forbids the renormalization group description.
We show that the mixing is cancelled by the soft function. This suggests that
the collinear and soft parts should be treated as a whole in constructing a
consistent factorization theorem. The renormalization group behavior of the
combined collinear and soft parts is presented explicitly at one loop. We also
show that the integrated PDF can be obtained by integrating the TMDPDF over the
transverse momentum.
","[{""version"":""v1"",""created"":""Fri, 3 Aug 2012 06:28:22 GMT""},{""version"":""v2"",""created"":""Thu, 27 Sep 2012 09:12:09 GMT""}]","2013-05-30"
"1208.0663","Gael Sent\'is Herrera","G. Sent\'is, J. Calsamiglia, R. Munoz-Tapia and E. Bagan","Robust optimal quantum learning without quantum memory","Extended version of Scientific Reports publication. Typos corrected","Sci. Rep. 2, 708 (2012)",,,"quant-ph","http://arxiv.org/licenses/nonexclusive-distrib/1.0/","  A quantum learning machine for binary classification of qubit states that
does not require quantum memory is introduced and shown to perform with the
minimum error rate allowed by quantum mechanics for any size of the training
set. This result is shown to be robust under (an arbitrary amount of) noise and
under (statistical) variations in the composition of the training set, provided
it is large enough. This machine can be used an arbitrary number of times
without retraining. Its required classical memory grows only logarithmically
with the number of training qubits, while its excess risk decreases as the
inverse of this number, and twice as fast as the excess risk of an
estimate-and-discriminate machine, which estimates the states of the training
qubits and classifies the data qubit with a discrimination protocol tailored to
the obtained estimates.
","[{""version"":""v1"",""created"":""Fri, 3 Aug 2012 06:28:57 GMT""},{""version"":""v2"",""created"":""Mon, 8 Oct 2012 09:45:25 GMT""}]","2012-10-09"
"1208.0664","Yin Wang","Yin Wang, Yuan He, Dapeng Cheng, Yunhao Liu, Xiang-yang Li","Triggercast: Enabling Wireless Collisions Constructive","10 pages, 18 figures",,,,"cs.DC cs.NI","http://arxiv.org/licenses/nonexclusive-distrib/1.0/","  It is generally considered that concurrent transmissions should be avoided in
order to reduce collisions in wireless sensor networks. Constructive
interference (CI) envisions concurrent transmissions to positively interfere at
the receiver. CI potentially allows orders of magnitude reductions in energy
consumptions and improvements on link quality. In this paper, we theoretically
introduce a sufficient condition to construct CI with IEEE 802.15.4 radio for
the first time. Moreover, we propose Triggercast, a distributed middleware, and
show it is feasible to generate CI in TMote Sky sensor nodes. To synchronize
transmissions of multiple senders at the chip level, Triggercast effectively
compensates propagation and radio processing delays, and has $95^{th}$
percentile synchronization errors of at most 250ns. Triggercast also
intelligently decides which co-senders to participate in simultaneous
transmissions, and aligns their transmission time to maximize the overall link
PRR, under the condition of maximal system robustness. Extensive experiments in
real testbeds reveal that Triggercast significantly improves PRR from 5% to 70%
with 7 concurrent senders. We also demonstrate that Triggercast provides on
average $1.3\times$ PRR performance gains, when integrated with existing data
forwarding protocols.
","[{""version"":""v1"",""created"":""Fri, 3 Aug 2012 06:34:25 GMT""}]","2012-08-06"
"1208.0665","Kazuharu Bamba","Kazuharu Bamba, Chao-Qiang Geng and Ling-Wei Luo","Generation of large-scale magnetic fields from inflation in
  teleparallelism","18 pages, no figure, version accepted for publication in JCAP","JCAP 10 (2012) 058","10.1088/1475-7516/2012/10/058",,"astro-ph.CO gr-qc","http://arxiv.org/licenses/nonexclusive-distrib/1.0/","  We explore the generation of large-scale magnetic fields from inflation in
teleparallelism, in which the gravitational theory is described by the torsion
scalar instead of the scalar curvature in general relativity. In particular, we
examine the case that the conformal invariance of the electromagnetic field
during inflation is broken by a non-minimal gravitational coupling between the
torsion scalar and the electromagnetic field. It is shown that for a power-law
type coupling, the magnetic field on 1 Mpc scale with its strength of $\sim
10^{-9}$ G at the present time can be generated.
","[{""version"":""v1"",""created"":""Fri, 3 Aug 2012 06:39:53 GMT""},{""version"":""v2"",""created"":""Fri, 28 Sep 2012 02:55:18 GMT""}]","2012-11-02"
"1208.0666","Georgios Katsaros","Jianjun Zhang, Georgios Katsaros, Francesco Montalenti, Daniele
  Scopece, Roman O. Rezaev, Christine Mickel, Bernd Rellinghaus, Leo Miglio,
  Silvano De Franceschi, Armando Rastelli and Oliver G. Schmidt","Monolithic growth of ultra-thin Ge nanowires on Si(001)","23 pages, 5 figures","Phys. Rev. Lett. 109, 085502 (2012)","10.1103/PhysRevLett.109.085502",,"cond-mat.mtrl-sci cond-mat.mes-hall","http://arxiv.org/licenses/nonexclusive-distrib/1.0/","  Self-assembled Ge wires with a height of only 3 unit cells and a length of up
to 2 micrometers were grown on Si(001) by means of a catalyst-free method based
on molecular beam epitaxy. The wires grow horizontally along either the [100]
or the [010] direction. On atomically flat surfaces, they exhibit a highly
uniform, triangular cross section. A simple thermodynamic model accounts for
the existence of a preferential base width for longitudinal expansion, in
quantitative agreement with the experimental findings. Despite the absence of
intentional doping, first transistor-type devices made from single wires show
low-resistive electrical contacts and single hole transport at sub-Kelvin
temperatures. In view of their exceptionally small and self-defined cross
section, these Ge wires hold promise for the realization of hole systems with
exotic properties and provide a new development route for silicon-based
nanoelectronics.
","[{""version"":""v1"",""created"":""Fri, 3 Aug 2012 06:40:04 GMT""}]","2015-06-11"
"1208.0667","Kevin A. Pimbblet","Kevin A. Pimbblet, Peter C. Jensen","The role of stellar mass and environment for cluster blue fraction, AGN
  fraction and star-formation indicators from a targeted analysis of Abell 1691","17 pages, 14 figures (one degraded due to size constraints), accepted
  for publication in MNRAS",,"10.1111/j.1365-2966.2012.21855.x",,"astro-ph.CO","http://arxiv.org/licenses/nonexclusive-distrib/1.0/","  We present an analysis of the galaxy population of the intermediate X-ray
luminosity galaxy cluster, Abell 1691, from SDSS and Galaxy Zoo data to
elucidate the relationships between environment and galaxy stellar mass for a
variety of observationally important cluster populations that include the
Butcher-Oemler blue fraction, the active galactic nucleus (AGN) fraction and
other spectroscopic classifications of galaxies. From 342 cluster members, we
determine a cluster recession velocity of 21257+/-54 km/s and velocity
dispersion of 1009^+40_-36 km/s and show that although the cluster is fed by
multiple filaments of galaxies it does not possess significant sub-structure in
its core. We identify the AGN population of the cluster from a BPT diagram and
show that there is a mild increase in the AGN fraction with radius from the
cluster centre that appears mainly driven by high mass galaxies (log(stellar
mass)>10.8). Although the cluster blue fraction follows the same radial trend,
it is caused primarily by lower mass galaxies (log(stellar mass)<10.8).
Significantly, the galaxies that have undergone recent star-bursts or are
presently star-bursting but dust-shrouded (spectroscopic e(a) class galaxies)
are also nearly exclusively driven by low mass galaxies. We therefore suggest
that the Butcher-Oemler effect may be a mass-dependant effect. We also examine
red and passive spiral galaxies and show that the majority are massive
galaxies, much like the rest of the red and spectroscopically passive cluster
population. We further demonstrate that the velocity dispersion profiles of low
and high mass cluster galaxies are different. Taken together, we infer that the
duty cycle of high and low mass cluster galaxies are markedly different, with a
significant departure in star formation and specific star formation rates
observed beyond r_200 and we discuss these findings.
","[{""version"":""v1"",""created"":""Fri, 3 Aug 2012 06:56:19 GMT""}]","2015-06-11"
"1208.0668","Pawel Blasiak Prof.","Pawel Blasiak","Quantum cube: A toy model of a qubit","5 pages, 4 figures; Final version as published in Physics Letters A","Phys. Lett. A 377, 847-850 (2013)","10.1016/j.physleta.2013.01.045",,"quant-ph","http://arxiv.org/licenses/nonexclusive-distrib/1.0/","  Account of a system may depend on available methods of gaining information.
We discuss a simple discrete system whose description is affected by a specific
model of measurement and transformations. It is shown that the limited means of
investigating the system make the epistemic account of the model
indistinguishable from a constrained version of a qubit corresponding to the
convex hull of eigenstates of Pauli operators, Clifford transformations and
Pauli observables.
","[{""version"":""v1"",""created"":""Fri, 3 Aug 2012 06:57:24 GMT""},{""version"":""v2"",""created"":""Tue, 19 Feb 2013 13:17:21 GMT""}]","2013-02-20"
