"1208.0701","Pith Xie","Pith Peishu Xie","Numerical Computations For Operator Axioms","15 pages, 1 figures","[J]. AIMS Mathematics, 2021, 6(4): 4011-4024","10.3934/math.2021238",,"cs.NA math.NA","http://arxiv.org/licenses/nonexclusive-distrib/1.0/","  The Operator axioms have produced new real numbers with new operators. New
operators naturally produce new equations and thus extend the traditional
mathematical models which are selected to describe various scientific rules. So
new operators help to describe complex scientific rules which are difficult
described by traditional equations and have an enormous application potential.
As to the equations including new operators, engineering computation often need
the approximate solutions reflecting an intuitive order relation and
equivalence relation. However, the order relation and equivalence relation of
real numbers are not as intuitive as those of base-b expansions. Thus, this
paper introduces numerical computations to approximate all real numbers with
base-b expansions.
","[{""version"":""v1"",""created"":""Fri, 3 Aug 2012 10:31:20 GMT""},{""version"":""v10"",""created"":""Mon, 22 Sep 2014 11:28:44 GMT""},{""version"":""v11"",""created"":""Sun, 16 Jun 2019 14:47:40 GMT""},{""version"":""v12"",""created"":""Sat, 7 Sep 2019 11:44:45 GMT""},{""version"":""v13"",""created"":""Tue, 5 Nov 2019 14:02:44 GMT""},{""version"":""v14"",""created"":""Tue, 2 Feb 2021 13:46:06 GMT""},{""version"":""v2"",""created"":""Sun, 2 Sep 2012 03:32:56 GMT""},{""version"":""v3"",""created"":""Tue, 4 Dec 2012 14:01:15 GMT""},{""version"":""v4"",""created"":""Thu, 24 Jan 2013 09:34:13 GMT""},{""version"":""v5"",""created"":""Mon, 26 May 2014 13:29:49 GMT""},{""version"":""v6"",""created"":""Tue, 27 May 2014 12:15:55 GMT""},{""version"":""v7"",""created"":""Thu, 19 Jun 2014 14:33:48 GMT""},{""version"":""v8"",""created"":""Sat, 6 Sep 2014 15:13:48 GMT""},{""version"":""v9"",""created"":""Wed, 10 Sep 2014 14:37:49 GMT""}]","2021-02-08"
"1208.0702","Loredana Spezzi","L. Spezzi, C. Alves de Oliveira, E. Moraux, J. Bouvier, E. Winston, P.
  Hudelot, H. Bouy and J.-C. Cuillandre","Searching for planetary-mass T-dwarfs in the core of Serpens","11 Pages, 7 Figures, Accepted for publication on A&A",,"10.1051/0004-6361/201219559",,"astro-ph.SR astro-ph.GA","http://arxiv.org/licenses/nonexclusive-distrib/1.0/","  We searched for isolated planetary-mass T-dwarfs in the 3Myr old Serpens Core
cluster. We performed a deep imaging survey of the central part of this cluster
using the WIRCam camera at the CFHT. Observations were performed through the
narrow-band CH4_off and CH4_on filters, to identify young T-dwarfs from their
1.6micr methane absorption bands, and the broad-band JHK filters, to better
characterize the selected candidates. We complemented our WIRCam photometry
with optical imaging data from MegaCam at CFHT and Suprime-Cam at the Subaru
telescope and mid-IR flux measurements from the Spitzer c2d Legacy Survey. We
report four faint T-dwarf candidates in the direction of the Serpens Core with
CH4_on-CH4_off above 0.2 mag, estimated visual extinction in the range 1-9 mag
and spectral type in the range T1-T5 based on their dereddened CH4_on-CH4_off
colors. Comparisons with T-dwarf spectral models and optical to mid-IR
color-color and color-magnitude diagrams, indicate that two of our candidates
(ID1 and 2) are background contaminants (most likely heavily reddened
low-redshift quasars). The properties of the other two candidates (ID3 and 4)
are consistent with them being young members of the Serpens Core cluster,
although our analysis can not be considered conclusive. In particular, ID3 may
also be a foreground T-dwarf. It is detected by the Spitzer c2d survey but only
flux upper limits are available above 5.8 microns and, hence, we can not assess
the presence of a possible disk around this object. However, it presents some
similarities with other young T-dwarf candidates (SOri70 in the Sigma Ori
cluster and CFHTJ0344+3206 in the direction of IC348). If ID3 and 4 belong to
Serpens, they would have a mass of a few Jupiter masses and would be amongst
the youngest, lowest mass objects detected in a star-forming region so far.
","[{""version"":""v1"",""created"":""Fri, 3 Aug 2012 10:33:14 GMT""}]","2015-06-11"
"1208.0703","Claus Sorensen Mazanti","Claus M. Sorensen","Eigenvarieties and invariant norms: Towards p-adic Langlands for U(n)","Comments and suggestions are very welcome","Pacific J. Math. 275 (2015) 191-230","10.2140/pjm.2015.275.191",,"math.NT math.RT","http://arxiv.org/licenses/nonexclusive-distrib/1.0/","  We give a proof of the Breuil-Schneider conjecture in a large number of
cases, which complement the indecomposable case, which we dealt with earlier in
[Sor]. In some sense, only the Steinberg representation lies at the
intersection of the two approaches. In this paper, we view the conjecture from
a broader global perspective. If $U_{/F}$ is any definite unitary group, which
is an inner form of $\GL(n)$ over $\K$, we point out how the eigenvariety
$\X(K^p)$ parametrizes a global $p$-adic Langlands correspondence between
certain $n$-dimensional $p$-adic semisimple representations $\rho$ of
$\Gal(\bar{\Q}|\K)$ (or what amounts to the same, pseudo-representations) and
certain Banach-Hecke modules $\mathcal{B}$ with an admissible unitary action of
$U(F\otimes \Q_p)$, when $p$ splits. We express the locally regular-algebraic
vectors of $\mathcal{B}$ in terms of the Breuil-Schneider representation of
$\rho$. Upon completion, this produces a candidate for the $p$-adic local
Langlands correspondence in this context. As an application, we give a weak
form of local-global compatibility in the crystalline case, showing that the
Banach space representations $B_{\xi,\zeta}$ of Schneider-Teitelbaum [ScTe] fit
the picture as predicted. There is a compatible global mod $p$ (semisimple)
Langlands correspondence parametrized by $\X(K^p)$. We introduce a natural
notion of refined Serre weights, and link them to the existence of crystalline
lifts of prescribed Hodge type and Frobenius eigenvalues. At the end, we give a
rough candidate for a local mod $p$ correspondence, formulate a local-global
compatibility conjecture, and explain how it implies the conjectural Ihara
lemma in [CHT].
","[{""version"":""v1"",""created"":""Fri, 3 Aug 2012 10:33:20 GMT""}]","2016-01-20"
"1208.0704","Roberto Valandro","Wilfried Buchmuller, Jan Louis, Jonas Schmidt, Roberto Valandro","Voisin-Borcea Manifolds and Heterotic Orbifold Models","52 pages, 9 figures",,"10.1007/JHEP10(2012)114",,"hep-th","http://arxiv.org/licenses/nonexclusive-distrib/1.0/","  We study the relation between a heterotic T^6/Z6 orbifold model and a
compactification on a smooth Voisin-Borcea Calabi-Yau three-fold with
non-trivial line bundles. This orbifold can be seen as a Z2 quotient of T^4/Z3
x T^2. We consider a two-step resolution, whose intermediate step is (K3 x
T^2)/Z2. This allows us to identify the massless twisted states which
correspond to the geometric Kaehler and complex structure moduli. We work out
the match of the two models when non-zero expectation values are given to all
twisted geometric moduli. We find that even though the orbifold gauge group
contains an SO(10) factor, a possible GUT group, the subgroup after higgsing
does not even include the standard model gauge group. Moreover, after higgsing,
the massless spectrum is non-chiral under the surviving gauge group.
","[{""version"":""v1"",""created"":""Fri, 3 Aug 2012 10:33:54 GMT""}]","2015-06-11"
"1208.0705","Marco Monteno","W. M. Alberico, A. Beraudo, A. De Pace, M. Monteno, A. Molinari, M.
  Nardi, F. Prino","Heavy flavor production in pp and AA collisions at the LHC","4 pages, 6 figures (eps files), submitted for publication in the
  proceedings of ""Hard Probes 2012"", 27 May - 1 June 2012, Cagliari (Italy)",,,,"hep-ph hep-ex","http://arxiv.org/licenses/nonexclusive-distrib/1.0/","  A refined version of a multi-step calculation of heavy-flavor observables in
pp and AA collisions has been developed, based on pQCD at NLO accuracy followed
by parton shower evolution to describe heavy-quark production and on the
relativistic Langevin equation to describe their stochastic evolution in the
QCD plasma. Then, hadronization is modeled through an implementation of
fragmentation functions based on pQCD and constrained by $e^{+}e^{-}$ collider
data. Results of our calculations can be compared with recent measurements
performed at the LHC in Pb--Pb collisions at $\sqrt{s_{NN}}$=2.76 TeV: nuclear
modification factor $R_{AA}$ of the $p_{T}$ spectra at mid-rapidity of
heavy-flavor decay electrons and of exclusively reconstructed open-charm mesons
at different centralities, as well as their elliptic-flow $v_{2}$($p_{T}$) in
semi-central collisions. To test the validity of our setup for such studies,
its predictions are also checked against the $p_{T}$ spectra measured in pp
collisions at $\sqrt{s}$=7 TeV and 2.76 TeV.
","[{""version"":""v1"",""created"":""Fri, 3 Aug 2012 10:34:14 GMT""}]","2012-08-06"
"1208.0706","Shaon Sahoo","V. M. L. Durga Prasad Goli, Shaon Sahoo, S. Ramasesha, Diptiman Sen","Quantum phases of dimerized and frustrated Heisenberg spin chains with s
  = 1/2, 1 and 3/2: an entanglement entropy and fidelity study","12 pages, 15 figures; provided some finite size analysis results,
  some changes in text accordingly; to appear in J. Phys.: Condens. Matter","J. Phys.: Condens. Matter 25, 125603 (2013)","10.1088/0953-8984/25/12/125603",,"cond-mat.str-el cond-mat.stat-mech","http://arxiv.org/licenses/nonexclusive-distrib/1.0/","  We study here different regions in phase diagrams of the spin-1/2, spin-1 and
spin-3/2 one dimensional antiferromagnetic Heisenberg systems with frustration
(next-nearest-neighbor interaction $J_2$) and dimerization ($\delta$). In
particular, we analyze the behaviors of the bipartite entanglement entropy and
fidelity at the gapless to gapped phase transitions and across the lines
separating different phases in the $J_2-\delta$ plane. All the calculations in
this work are based on numerical exact diagonalizations of finite systems.
","[{""version"":""v1"",""created"":""Fri, 3 Aug 2012 10:44:22 GMT""},{""version"":""v2"",""created"":""Fri, 1 Feb 2013 18:17:59 GMT""}]","2013-02-21"
"1208.0707","Alicia V\'azquez Carpentier","A. V. Carpentier, Y. H. Fung, P. Sompet, A. J. Hilliard, T. G. Walker,
  and M. F. Andersen","High efficiency preparation of single trapped atoms using blue detuned
  light assisted collisions","5 pages, 4 figures",,,,"physics.atom-ph quant-ph","http://arxiv.org/licenses/nonexclusive-distrib/1.0/","  We report on a procedure by which we obtain a 91% loading efficiency of
single 85Rb atoms in an optical microtrap. This can be achieved within a total
preparation time of 542 ms. We employ blue detuned light assisted collisions to
realize a process in which only one of the collision partners is lost. We
explain the mechanism for efficiently loading a single atom and discuss the
factors that limit the final efficiency.
","[{""version"":""v1"",""created"":""Fri, 3 Aug 2012 10:47:15 GMT""}]","2012-08-06"
"1208.0708","Davide Penazzi","Davide Penazzi","One-basedness and reductions of elliptic curves over real closed fields",,,,,"math.LO math.AG","http://arxiv.org/licenses/nonexclusive-distrib/1.0/","  Building on the positive solution of Pillay's conjecture we present a notion
of ""intrinsic"" reduction for elliptic curves over a real closed field K. We
compare such notion with the traditional algebro-geometric reduction and
produce a classification of the group of K-points of an elliptic curve E with
three ""real"" roots according to the way E reduces (algebro-geometrically) and
the geometric complexity of the ""intrinsically"" reduced curve.
","[{""version"":""v1"",""created"":""Fri, 3 Aug 2012 10:48:06 GMT""}]","2012-08-06"
"1208.0709","Jean-Marc Bouclet","Jean-Marc Bouclet","Absence of eigenvalue at the bottom of the continuous spectrum on
  asymptotically hyperbolic manifolds","20 pages",,,,"math.SP","http://arxiv.org/licenses/nonexclusive-distrib/1.0/","  For a class of asymptotically hyperbolic manifolds, we show that the bottom
of the continuous spectrum of the Laplace-Beltrami operator is not an
eigenvalue. Our approach only uses properties of the operator near infinity
and, in particular, does not require any global assumptions on the topology or
the curvature, unlike previous papers on the same topic.
","[{""version"":""v1"",""created"":""Fri, 3 Aug 2012 10:58:50 GMT""}]","2012-08-06"
"1208.0710","Mart\'i Cuquet","Mart\'i Cuquet, John Calsamiglia","Growth of graph states in quantum networks","16 pages, 7 figures","Phys. Rev. A 86, 042304 (2012)","10.1103/PhysRevA.86.042304",,"quant-ph","http://arxiv.org/licenses/nonexclusive-distrib/1.0/","  We propose a scheme to distribute graph states over quantum networks in the
presence of noise in the channels and in the operations. The protocol can be
implemented efficiently for large graph sates of arbitrary (complex) topology.
We benchmark our scheme with two protocols where each connected component is
prepared in a node belonging to the component and subsequently distributed via
quantum repeaters to the remaining connected nodes. We show that the fidelity
of the generated graphs can be written as the partition function of a classical
Ising-type Hamiltonian. We give exact expressions of the fidelity of the linear
cluster and results for its decay rate in random graphs with arbitrary
(uncorrelated) degree distributions.
","[{""version"":""v1"",""created"":""Fri, 3 Aug 2012 11:06:02 GMT""}]","2012-12-12"
"1208.0711","Sang-Woo Kim","Sang-Woo Kim, Jun Nishimura, Asato Tsuchiya","Late time behaviors of the expanding universe in the IIB matrix model","25 pages, 3 figures",,"10.1007/JHEP10(2012)147","OU-HET-752-2012; KEK-TH-1563","hep-th astro-ph.CO gr-qc hep-lat","http://arxiv.org/licenses/nonexclusive-distrib/1.0/","  Recently we have studied the Lorentzian version of the IIB matrix model as a
nonperturbative formulation of superstring theory. By Monte Carlo simulation,
we have shown that the notion of time ---as well as space---emerges dynamically
from this model, and that we can uniquely extract the real-time dynamics, which
turned out to be rather surprising: after some ""critical time"", the SO(9)
rotational symmetry of the nine-dimensional space is spontaneously broken down
to SO(3) and the three-dimensional space starts to expand rapidly. In this
paper, we study the same model based on the classical equations of motion,
which are expected to be valid at later times. After providing a general
prescription to solve the equations, we examine a class of solutions, which
correspond to manifestly commutative space. In particular, we find a solution
with an expanding behavior that naturally solves the cosmological constant
problem.
","[{""version"":""v1"",""created"":""Fri, 3 Aug 2012 11:13:08 GMT""}]","2015-06-11"
"1208.0712","Bojan Marinkovi\'c","Bojan Marinkovi\'c, Paola Glavan, Zoran Ognjanovi\'c","Description of the Chord Protocol using ASMs Formalism",,,,,"cs.DC","http://arxiv.org/licenses/nonexclusive-distrib/1.0/","  This paper describes the overlay protocol Chord using the formalism of
Abstract State Machines. The formalization concerns Chord actions that maintain
ring topology and manipulate distributed keys. We define a class of runs and
prove the correctness of our formalization with respect to it.
","[{""version"":""v1"",""created"":""Fri, 3 Aug 2012 11:17:57 GMT""},{""version"":""v2"",""created"":""Mon, 23 Sep 2013 13:23:08 GMT""}]","2013-09-24"
"1208.0713","J\""urgen Koslowski","Manfred Kufleitner (Institut f), Pascal Weil (LaBRI, Universit\'e de
  Bordeaux and CNRS)","On logical hierarchies within FO^2-definable languages","arXiv admin note: text overlap with arXiv:0904.2894","Logical Methods in Computer Science, Volume 8, Issue 3 (August 14,
  2012) lmcs:1212","10.2168/LMCS-8(3:11)2012",,"cs.LO cs.FL","http://arxiv.org/licenses/nonexclusive-distrib/1.0/","  We consider the class of languages defined in the 2-variable fragment of the
first-order logic of the linear order. Many interesting characterizations of
this class are known, as well as the fact that restricting the number of
quantifier alternations yields an infinite hierarchy whose levels are varieties
of languages (and hence admit an algebraic characterization). Using this
algebraic approach, we show that the quantifier alternation hierarchy inside
FO^{2}[<] is decidable within one unit. For this purpose, we relate each level
of the hierarchy with decidable varieties of languages, which can be defined in
terms of iterated deterministic and co-deterministic products. A crucial notion
in this process is that of condensed rankers, a refinement of the rankers of
Weis and Immerman and the turtle languages of Schwentick, Th\'erien and
Vollmer.
","[{""version"":""v1"",""created"":""Fri, 3 Aug 2012 11:19:10 GMT""},{""version"":""v2"",""created"":""Sat, 11 Aug 2012 16:30:34 GMT""},{""version"":""v3"",""created"":""Tue, 14 Aug 2012 09:51:11 GMT""}]","2018-01-03"
"1208.0714","Bing Guo","B. Guo, Z. H. Li, M. Lugaro, J. Buntain, D. Y. Pang, Y. J. Li, J. Su,
  S. Q. Yan, X. X. Bai, Y. S. Chen, Q. W. Fan, S. J. Jin, A. I. Karakas, E. T.
  Li, Z. C. Li, G. Lian, J. C. Liu, X. Liu, J. R. Shi, N. C. Shu, B. X. Wang,
  Y. B. Wang, S. Zeng and W. P. Liu","New determination of the 13C(a, n)16O reaction rate and its influence on
  the s-process nucleosynthesis in AGB stars",,"Astrophys. J. 756, 193, 2012","10.1088/0004-637X/756/2/193",,"astro-ph.SR nucl-ex","http://arxiv.org/licenses/nonexclusive-distrib/1.0/","  We present a new measurement of the $\alpha$-spectroscopic factor
($S_\alpha$) and the asymptotic normalization coefficient (ANC) for the 6.356
MeV 1/2$^+$ subthreshold state of $^{17}$O through the $^{13}$C($^{11}$B,
$^{7}$Li)$^{17}$O transfer reaction and we determine the $\alpha$-width of this
state. This is believed to have a strong effect on the rate of the
$^{13}$C($\alpha$, $n$)$^{16}$O reaction, the main neutron source for {\it
slow} neutron captures (the $s$-process) in asymptotic giant branch (AGB)
stars. Based on the new width we derive the astrophysical S-factor and the
stellar rate of the $^{13}$C($\alpha$, $n$)$^{16}$O reaction. At a temperature
of 100 MK our rate is roughly two times larger than that by \citet{cau88} and
two times smaller than that recommended by the NACRE compilation. We use the
new rate and different rates available in the literature as input in
simulations of AGB stars to study their influence on the abundances of selected
$s$-process elements and isotopic ratios. There are no changes in the final
results using the different rates for the $^{13}$C($\alpha$, $n$)$^{16}$O
reaction when the $^{13}$C burns completely in radiative conditions. When the
$^{13}$C burns in convective conditions, as in stars of initial mass lower than
$\sim$2 $M_\sun$ and in post-AGB stars, some changes are to be expected, e.g.,
of up to 25% for Pb in our models. These variations will have to be carefully
analyzed when more accurate stellar mixing models and more precise
observational constraints are available.
","[{""version"":""v1"",""created"":""Fri, 3 Aug 2012 11:22:29 GMT""}]","2012-08-29"
"1208.0715","Helge Glockner","Helge Glockner","Regularity properties of infinite-dimensional Lie groups, and
  semiregularity","68 pages; v5: update of references, added two useful lemmas (Lemma
  7.8, Lemma 7.10)",,,,"math.FA","http://arxiv.org/licenses/nonexclusive-distrib/1.0/","  Let G be a Lie group modelled on a locally convex space, with Lie algebra g,
and k be a non-negative integer or infinity. We say that G is C^k-semiregular
if each C^k-curve c in g admits a left evolution Evol(c) in G. If, moreover,
the map taking c to evol(c):=Evol(c)(1) is smooth, then G is called
C^k-regular. For G a C^k-semiregular Lie group and m an order of
differentiability, we show that evol is C^m if and only if Evol is C^m. If evol
is continuous at 0, then evol is continuous. If G is a C^0-semiregular Lie
group, then continuity of evol implies its smoothness (so that G will be
C^0-regular), if smooth homomorphisms from G to C^0-regular Lie groups separate
points on G and g is (e.g.) sequentially complete. Further criteria for
regularity properties are provided, and used to prove regularity for several
important classes of Lie groups. Notably, we find that the Lie group Diff(M) of
smooth diffeomorphisms of a paracompact finite-dimensional smooth manifold M
(which need not be sigma-compact) is C^1-regular. We also provide tools which
enable to show that the Lie group of analytic diffeomorphisms of a compact real
analytic manifold is C^1-regular.
","[{""version"":""v1"",""created"":""Fri, 3 Aug 2012 11:25:27 GMT""},{""version"":""v2"",""created"":""Sat, 27 Dec 2014 06:10:41 GMT""},{""version"":""v3"",""created"":""Sat, 17 Jan 2015 13:52:54 GMT""},{""version"":""v4"",""created"":""Wed, 21 Jan 2015 20:46:22 GMT""},{""version"":""v5"",""created"":""Sat, 6 Feb 2016 18:27:10 GMT""}]","2016-02-09"
"1208.0716","Jacques Laskar","Ariadna Farr\'es, Jacques Laskar, Sergio Blanes, Fernando Casas,
  Joseba Makazaga, Ander Murua","High precision Symplectic Integrators for the Solar System","35 pages, 11 figures, submitted",,"10.1007/s10569-013-9479-6",,"astro-ph.EP math.NA","http://arxiv.org/licenses/nonexclusive-distrib/1.0/","  Using a Newtonian model of the Solar System with all 8 planets, we perform
extensive tests on various symplectic integrators of high orders, searching for
the best splitting scheme for long term studies in the Solar System. These
comparisons are made in Jacobi and Heliocentric coordinates and the
implementation of the algorithms is fully detailed for practical use. We
conclude that high order integrators should be privileged, with a preference
for the new $(10,6,4)$ method of (Blanes et al., 2012)
","[{""version"":""v1"",""created"":""Fri, 3 Aug 2012 11:27:44 GMT""}]","2015-06-11"
"1208.0717","Detlef Beckmann","F. H\""ubler, M. J. Wolf, D. Beckmann and H. V. L\""ohneysen","Long-range spin-polarized quasiparticle transport in mesoscopic Al
  superconductors with a Zeeman splitting","5 pages, 4 figures, revtex","Phys. Rev. Lett. 109, 207001 (2012)","10.1103/PhysRevLett.109.207001",,"cond-mat.supr-con cond-mat.mes-hall","http://arxiv.org/licenses/nonexclusive-distrib/1.0/","  We report on nonlocal transport in multiterminal superconductor-ferromagnet
structures, which were fabricated by means of e-beam lithography and shadow
evaporation techniques. In the presence of a significant Zeeman splitting of
the quasiparticle states, we find signatures of spin transport over distances
of several {\mu}m, exceeding other length scales such as the coherence length,
the normal-state spin-diffusion length, and the charge-imbalance length. The
relaxation length of the spin signal shows a nearly linear increase with
magnetic field, hinting at a freeze-out of relaxation by the Zeeman splitting.
We propose that the relaxation length is given by the recombination length of
the quasiparticles rather than a renormalized spin-diffusion length.
","[{""version"":""v1"",""created"":""Fri, 3 Aug 2012 11:33:57 GMT""},{""version"":""v2"",""created"":""Wed, 14 Nov 2012 08:12:28 GMT""}]","2012-11-15"
"1208.0718","Marcin Daszkiewicz","Marcin Daszkiewicz","Generating of additional force terms in Newton equation by
  twist-deformed Hopf algebras and classical symmetries","to appear in Proceedings of the 29th Max Born Symposium, no figures,
  10 pages, Latex source","Int. J. Geom. Methods Mod. Phys., 09, 1261003 (2012)","10.1142/S0219887812610038",,"math-ph hep-th math.MP","http://arxiv.org/licenses/nonexclusive-distrib/1.0/","  We compare two ways of force terms generating in the model of nonrelativistic
particle moving in the presence of constant field force $\vec{F}$. First of
them uses the twist-deformed acceleration-enlarged Newton-Hooke quantum
space-times while the second one incorporates the doubly enlarged Newton-Hooke
transformations of classical space. Particulary, we find the conditions for
which the both treatments provide the same force terms.
","[{""version"":""v1"",""created"":""Fri, 3 Aug 2012 11:35:45 GMT""}]","2012-11-30"
