"1208.1197","Ji\v{r}\'i Chaloupka","Ji\v{r}\'i Chaloupka and Giniyat Khaliullin","Spin-state Crossover Model for the Magnetism of Iron Pnictides","9 pages, 7 figures, references updated, to be published in PRL","Phys. Rev. Lett. 110, 207205 (2013)","10.1103/PhysRevLett.110.207205",,"cond-mat.str-el","http://arxiv.org/licenses/nonexclusive-distrib/1.0/","  We propose a minimal model describing magnetic behavior of Fe-based
superconductors. The key ingredient of the model is a dynamical mixing of
quasi-degenerate spin states of Fe2+ ion by intersite electron hoppings,
resulting in an effective local spin Seff. The moments Seff tend to form
singlet pairs, and may condense into a spin nematic phase due to the emergent
biquadratic exchange couplings. The long-range ordered part m of Seff varies
widely, 0<=m<=Seff, but magnon spectra are universal and scale with Seff,
resolving the puzzle of large but fluctuating Fe-moments. Unusual temperature
dependences of a local moment and spin susceptibility are also explained.
","[{""version"":""v1"",""created"":""Mon, 6 Aug 2012 16:06:45 GMT""},{""version"":""v2"",""created"":""Thu, 21 Mar 2013 09:29:40 GMT""},{""version"":""v3"",""created"":""Thu, 25 Apr 2013 06:05:00 GMT""}]","2013-05-31"
"1208.1198","Geordie Williamson","Kari Vilonen, Geordie Williamson","Characteristic cycles and decomposition numbers","7 pages, v3: final version","Math. Res. Lett. 20 (2013), no. 2, 359-366",,,"math.AG","http://arxiv.org/licenses/nonexclusive-distrib/1.0/","  We observe that the characteristic cycle of a D-module gives bounds for
decomposition numbers of intersection cohomology complexes.
","[{""version"":""v1"",""created"":""Mon, 6 Aug 2012 16:07:43 GMT""},{""version"":""v2"",""created"":""Wed, 8 Aug 2012 11:56:22 GMT""},{""version"":""v3"",""created"":""Mon, 17 Feb 2014 18:06:20 GMT""}]","2016-11-18"
"1208.1199","Huanyao Wen","Huanyao Wen, Changjiang Zhu","Global solutions to the three-dimensional full compressible
  Navier-Stokes equations with vacuum at infinity in some classes of large data","57 pages","SIAM J. Math. Anal. 49, no. 1, 162-221 (2017)",,,"math.AP","http://arxiv.org/licenses/nonexclusive-distrib/1.0/","  We consider the Cauchy problem for the full compressible Navier-Stokes
equations with vanishing of density at infinity in R3. Our main purpose is to
prove the existence (and uniqueness) of global strong and classical solutions
and study the large-time behavior of the solutions as well as the decay rates
in time. Our main results show that the strong solution exists globally in time
if the initial mass is small for the fixed coefficients of viscosity and heat
conduction, and can be large for the large coefficients of viscosity and heat
conduction. Moreover, large-time behavior and a surprisingly exponential decay
rate of the strong solution are obtained. Finally, we show that the global
strong solution can become classical if the initial data is more regular. Note
that the assumptions on the initial density do not exclude that the initial
density may vanish in a subset of R3 and that it can be of a non trivially
compact support.To our knowledge, this paper contains the first result so far
for the global existence of solutions to the full compressible Navier-Stokes
equations when density vanishes at infinity (in space). In addition, the
exponential decay rate of the strong solution is of independent interest.
","[{""version"":""v1"",""created"":""Mon, 6 Aug 2012 16:12:19 GMT""},{""version"":""v2"",""created"":""Tue, 21 Feb 2017 14:02:04 GMT""}]","2017-02-22"
"1208.1200","Ulrich Heinz","Zhi Qiu and Ulrich W. Heinz","Hydrodynamic event-plane correlations in Pb+Pb collisions at
  sqrt(s)=2.76ATeV","5 pages, 4 figures. Two footnotes added, slight editions of text in
  response to referee comments. This version accepted by Physics Letters B. The
  figures in v2 are based on 11-fold statistics compared to v1, for both
  MC-Glauber and MC-KLN initial conditions; the figures in the journal version
  have such high statistics only for the MC-Glauber model","Physics Letters B 717, 261 (2012)","10.1016/j.physletb.2012.09.030",,"nucl-th hep-ph nucl-ex","http://arxiv.org/licenses/nonexclusive-distrib/1.0/","  The recently measured correlations between the flow angles associated with
higher harmonics in the anisotropic flow generated in relativistic heavy-ion
collisions are shown to be of hydrodynamic origin. The correlation strength is
found to be sensitive to both the initial conditions and the shear viscosity of
the expanding fireball medium.
","[{""version"":""v1"",""created"":""Mon, 6 Aug 2012 16:14:48 GMT""},{""version"":""v2"",""created"":""Sat, 15 Sep 2012 00:59:36 GMT""}]","2015-03-20"
"1208.1201","Vadim Mogilevskii","Seppo Hassi, Mark Malamud and Vadim Mogilevskii","Unitary equivalence of proper extensions of a symmetric operator and the
  Weyl function",,,,,"math.FA","http://arxiv.org/licenses/nonexclusive-distrib/1.0/","  Let $A$ be a densely defined simple symmetric operator in $\gH$, let
$\Pi=\bt$ be a boundary triplet for $A^*$ and let $M(\cd)$ be the corresponding
Weyl function. It is known that the Weyl function $M(\cd)$ determines the
boundary triplet $\Pi$, in particular, the pair ${A,A_0}$, where $A_0:=
A^*\lceil\ker\G_0 (= A^*_0)$, uniquely up to unitary similarity. At the same
time the Weyl function corresponding to a boundary triplet for a dual pair of
operators defines it uniquely only up to weak similarity.
  In this paper we consider symmetric dual pairs ${A,A}$ generated by $A\subset
A^*$ and special boundary triplets $\wt\Pi$ for ${A,A}$. We are interested
whether the result on unitary similarity remains valid provided that the Weyl
function corresponding to $\wt\Pi$ is $\wt M(z)= K^*(B-M(z))^{-1} K,$ where $B$
is some non-self-adjoint bounded operator in $\cH$. We specify some conditions
in terms of the operators $A_0$ and $A_B= A^*\lceil \ker(\G_1-B\G_0)$, which
determine uniquely (up to unitary equivalence) the pair ${A,A_B}$ by the Weyl
function $\wt M(\cd)$. Moreover, it is shown that under some additional
assumptions the Weyl function $M_\Pi(\cdot)$ of the boundary triplet $\Pi$ for
the dual pair $\DA$ determines the triplet $\Pi$ uniquely up to unitary
similarity. We obtain also some negative results demonstrating that in general
the Weyl function $\wt M(\cd)$ does not determine the operator $A_B$ even up to
similarity.
","[{""version"":""v1"",""created"":""Mon, 6 Aug 2012 16:18:47 GMT""}]","2012-08-07"
"1208.1202","Yuriy Kuzovlev E.","G. N. Bochkov and Yu. E. Kuzovlev","Fluctuation-dissipation relations: achievements and misunderstandings","44 pages, no figures, LaTeX2e amsart; this v.3 contains more physical
  examples and explanations in comparison with v.2 and besides several new
  references, at principally same formal contents; the preprint represents
  revised submission to UFN (Physics-Uspekhi) whose Russian text also is
  included into the source tex file",,"10.3367/UFNe.0183.201306d.0617","DonPTI-12-YUK-11","cond-mat.stat-mech physics.hist-ph","http://arxiv.org/licenses/nonexclusive-distrib/1.0/","  We discuss the ""generalized fluctuation-dissipation relations (theorems)"" for
the first time suggested by us in 1977-1984 as statistical-thermodynamical
consequences of time symmetry (reversibility) of microscopic dynamics. It is
shown, in particular, that our old results in essence contain, as alternative
formulations or special cases, various similar relations, including the
""fluctuation theorems"", what appeared after 1990.
","[{""version"":""v1"",""created"":""Mon, 6 Aug 2012 16:23:07 GMT""},{""version"":""v2"",""created"":""Sun, 26 Aug 2012 19:17:21 GMT""},{""version"":""v3"",""created"":""Mon, 29 Apr 2013 20:40:43 GMT""}]","2015-06-11"
"1208.1203","Savchuk Yurii","Mark M. Malamud and Konrad Schm\""udgen","Spectral theory of Schr\""odinger operators with infinitely many point
  interactions and radial positive definite functions","to appear in Journal of Functional Analysis",,,,"math.FA","http://arxiv.org/licenses/nonexclusive-distrib/1.0/","  A number of results on radial positive definite functions on ${\mathbb R^n}$
related to Schoenberg's integral representation theorem are obtained. They are
applied to the study of spectral properties of self-adjoint realizations of
two- and three-dimensional Schr\""odinger operators with countably many point
interactions. In particular, we find conditions on the configuration of point
interactions such that any self-adjoint realization has purely absolutely
continuous non-negative spectrum. We also apply some results on Schr\""odinger
operators to obtain new results on completely monotone functions.
","[{""version"":""v1"",""created"":""Mon, 6 Aug 2012 16:29:47 GMT""}]","2012-08-07"
"1208.1204","Haroldo Ribeiro","H. V. Ribeiro, Satyam Mukherjee, Xiao Han T. Zeng","Anomalous Diffusion and Long-range Correlations in the Score Evolution
  of the Game of Cricket","Accepted for Publication in Physical Review E","Phys. Rev. E 86, 022102 (2012)","10.1103/PhysRevE.86.022102",,"physics.data-an cond-mat.stat-mech","http://arxiv.org/licenses/nonexclusive-distrib/1.0/","  We investigate the time evolution of the scores of the second most popular
sport in world: the game of cricket. By analyzing the scores event-by-event of
more than two thousand matches, we point out that the score dynamics is an
anomalous diffusive process. Our analysis reveals that the variance of the
process is described by a power-law dependence with a super-diffusive exponent,
that the scores are statistically self-similar following a universal Gaussian
distribution, and that there are long-range correlations in the score
evolution. We employ a generalized Langevin equation with a power-law
correlated noise that describe all the empirical findings very well. These
observations suggest that competition among agents may be a mechanism leading
to anomalous diffusion and long-range correlation.
","[{""version"":""v1"",""created"":""Mon, 6 Aug 2012 16:40:02 GMT""}]","2012-12-27"
"1208.1205","Thomas Curtright","Thomas L. Curtright","Galileons and Naked Singularities","References and acknowledgements added, and corrections made to Figure
  1",,"10.1016/j.physletb.2012.08.047","UMTG-27","hep-th gr-qc","http://arxiv.org/licenses/nonexclusive-distrib/1.0/","  A simple trace-coupled Galileon model is shown to admit spherically symmetric
static solutions with naked spacetime curvature singularities.
","[{""version"":""v1"",""created"":""Mon, 6 Aug 2012 16:40:55 GMT""},{""version"":""v2"",""created"":""Tue, 28 Aug 2012 16:28:04 GMT""},{""version"":""v3"",""created"":""Sun, 23 Sep 2012 18:26:43 GMT""}]","2015-06-11"
"1208.1206","Catherine Searle","Karsten Grove and Catherine Searle","Positively curved manifolds with maximal symmetry rank",,"Journal of Pure and Applied Algebra, 91 (1994), pp. 137--142",,,"math.DG","http://arxiv.org/licenses/nonexclusive-distrib/1.0/","  The symmetry-rank of a riemannian manifold is by definition the rank of its
isometry group. We determine precisely which smooth closed manifolds admit a
positively curved metric with maximal symmetry-rank.
","[{""version"":""v1"",""created"":""Mon, 6 Aug 2012 16:45:00 GMT""}]","2012-08-07"
"1208.1207","Reza Farahbakhsh","Reza Farahbakhsh, Naser Movahhedinia","Seamless Handover for IMS over Mobile-IPv6 Using Context Transfer","ISSN 1673-5447","China Communications, Vol. 6 Issue (3): 122-133, 2009",,,"cs.NI","http://creativecommons.org/licenses/by/3.0/","  Mobility support for the next generation IPv6 networks has been one of the
recent research issues due to the growing demand for wireless services over
internet. In the other hand, 3GPP has introduced IP Multimedia Subsystem as the
next generation IP based infrastructure for wireless and wired multimedia
services. In this paper we present two context transfer mechanisms based on
predictive and reactive schemes, to support seamless handover in IMS over
Mobile IPv6. Those schemes reduce handover latency by transferring appropriate
session information between the old and the new access networks. Moreover, we
present two methods for QoS parameters negotiations to preserve service quality
along the mobile user movement path. The performances of the proposed
mechanisms are evaluated by simulations.
","[{""version"":""v1"",""created"":""Mon, 6 Aug 2012 16:51:48 GMT""}]","2012-08-07"
"1208.1208","Joachim Kaldasch","Joachim Kaldasch, Bernhard Senge, Jos Laven","Structural transitions in sheared electrically stabilized colloidal
  crystals","7 pages","Journal of Applied Chemistry Volume 2013 (2013), Article ID 909841","10.1155/2013/909841",,"cond-mat.mtrl-sci cond-mat.soft","http://arxiv.org/licenses/nonexclusive-distrib/1.0/","  A Landau theory is presented for the structural transition of electrically
stabilized colloidal crystals under shear. The model suggests that a structural
transition from an ordered layered colloidal crystal into a disordered
structure occurs at a critical shear stress. The shear induced structural
transition is related to a change of the rheological properties caused by the
variation of the microstructure which can be verified by scattering
experiments. The theory is used to establish the shape of the flow curves. A
good qualitative agreement with experimental results can be achieved, while a
scaling relation similar to the elastic scaling is established.
","[{""version"":""v1"",""created"":""Mon, 6 Aug 2012 16:55:03 GMT""},{""version"":""v2"",""created"":""Tue, 7 Aug 2012 05:41:15 GMT""},{""version"":""v3"",""created"":""Sun, 29 Dec 2013 10:38:58 GMT""}]","2013-12-31"
"1208.1209","Yuri Makeenko","Yuri Makeenko (ITEP)","Scattering Amplitudes of QCD String","Talk: 21pp., 6 figs; v2: polished",,,"ITEP-TH-39/12","hep-th hep-ph","http://arxiv.org/licenses/nonexclusive-distrib/1.0/","  I review the derivation of large-N QCD meson scattering amplitudes in the
Regge regime, where the effective theory of long strings applies in d=4. A
special attention is payed to the reparametrization path integral which plays a
crucial role in the consistency of off-shell amplitudes. I show how the linear
Reggeon trajectory is obtained for QCD string in the mean-field approximation,
which turns out to be exact for the Nambu-Goto string, and discuss the
interrelation with perturbative QCD.
","[{""version"":""v1"",""created"":""Mon, 6 Aug 2012 16:58:48 GMT""},{""version"":""v2"",""created"":""Mon, 11 Feb 2013 08:30:20 GMT""}]","2013-02-12"
"1208.1210","George Svetlichny","George Svetlichny","Life thrives on abundance (quantum included)","LaTeX, 4 pages",,,,"quant-ph","http://arxiv.org/licenses/nonexclusive-distrib/1.0/","  I present a short and almost irrefutable arguments that life does use quantum
mechanical correlations in an essential way. The very same argument applies,
mutatis mutandis, in relation to any abundant resource, and observations bears
this out.
","[{""version"":""v1"",""created"":""Mon, 6 Aug 2012 17:01:48 GMT""}]","2012-08-07"
"1208.1211","Benjamin Guedj","Benjamin Guedj and Pierre Alquier","PAC-Bayesian Estimation and Prediction in Sparse Additive Models","28 pages","Electronic Journal of Statistics, volume 7, 2013, 264--291","10.1214/13-EJS771",,"stat.ME math.ST stat.TH","http://arxiv.org/licenses/nonexclusive-distrib/1.0/","  The present paper is about estimation and prediction in high-dimensional
additive models under a sparsity assumption ($p\gg n$ paradigm). A PAC-Bayesian
strategy is investigated, delivering oracle inequalities in probability. The
implementation is performed through recent outcomes in high-dimensional MCMC
algorithms, and the performance of our method is assessed on simulated data.
","[{""version"":""v1"",""created"":""Mon, 6 Aug 2012 17:13:23 GMT""},{""version"":""v2"",""created"":""Fri, 21 Dec 2012 14:36:19 GMT""},{""version"":""v3"",""created"":""Fri, 1 Feb 2013 15:09:39 GMT""}]","2018-05-22"
"1208.1212","Pablo Roig","Daniel G\'omez Dumm, Pablo Roig","Resonance Chiral Lagrangian analysis of $\tau^- \to \eta^{(\prime)}
  \pi^- \pi^0 \nu_\tau$ decays","21 pages, 5 figures, v2: Title changed, references added and
  rewriting of some sentences. It matches the published version in PRD",,"10.1103/PhysRevD.86.076009","UAB-FT-716","hep-ph hep-ex","http://arxiv.org/licenses/nonexclusive-distrib/1.0/","  The hadronization structure of $\tau^- \to \eta \pi^- \pi^0 \nu_\tau$ decays
is analyzed using Chiral Perturbation Theory with resonances, considering only
the contribution of the lightest meson resonances at leading order in the
$1/N_C$ expansion. After imposing the asymptotic behavior of vector spectral
functions ruled by QCD, unknown effective couplings are determined by fitting
the $\tau^- \to \eta \pi^- \pi^0 \nu_\tau$ branching ratio and decay spectrum
to recent data. Predictions for the partner decay $\tau^- \to \eta^\prime \pi^-
\pi^0 \nu_\tau$ and the low-energy behavior of the cross section $\sigma
(e^+e^-\to \eta\pi^+\pi^-)$ are also discussed.
","[{""version"":""v1"",""created"":""Mon, 6 Aug 2012 17:16:39 GMT""},{""version"":""v2"",""created"":""Mon, 5 Nov 2012 09:05:39 GMT""}]","2013-05-30"
"1208.1213","David Snoke","David W. Snoke","Dipole excitons in coupled quantum wells: toward an equilibrium exciton
  condensate","14 pages, 66 references. To be published in Quantum Gases: Finite
  Temperature and Non-Equilibrium Dynamics (Cold Atoms Series), Nick Proukakis,
  Simon Gardiner, Matthew Davis, Marzena Szymanska and Nicolai Nygaard (eds.),
  (Imperial College Press: London, in press)",,,,"cond-mat.quant-gas","http://arxiv.org/licenses/nonexclusive-distrib/1.0/","  In recent years, experiments by several groups have demonstrated spontaneous
coherence in polariton systems, which can be viewed as a type of nonequilibrium
Bose-Einstein condensation. In these systems, the polariton lifetime is longer
than, but not much longer than, the polariton-polariton scattering time which
leads to the thermalization. By contrast, over the past twenty years several
groups have pursued experiments in a different system, which has very long
exciton lifetime, up to 30 microseconds or more, essentially infinite compared
to the thermalization time of the excitons. Thermal equilibrium of this type of
exciton in a trap has been demonstrated experimentally. In this system, the
interactions between the excitons are not short-range contact interactions, but
instead are dipole-dipole interactions, with the force at long range going as
$1/r^{3}$. Up to now there has not been a universally accepted demonstration of
BEC in this type of system, and the way forward will require better
understanding of the many-body effects of the excitons. I review what has been
learned and accomplished in the past two decades in the search for an
equilibrium BEC in this promising system.
","[{""version"":""v1"",""created"":""Mon, 6 Aug 2012 17:25:01 GMT""}]","2012-08-07"
"1208.1214","Luc Dessart","Luc Dessart, D. John Hillier, Roni Waldman, Eli Livne, Stephane
  Blondin","Super-luminous supernovae: 56Ni power versus magnetar radiation","5 pages, 4 figures, paper accepted to MNRAS letter",,"10.1111/j.1745-3933.2012.01329.x",,"astro-ph.SR astro-ph.CO","http://arxiv.org/licenses/nonexclusive-distrib/1.0/","  Much uncertainty surrounds the origin of super-luminous supernovae (SNe).
Motivated by the discovery of the Type Ic SN2007bi, we study its proposed
association with a pair-instability SN (PISN). We compute stellar-evolution
models for primordial ~200Msun stars, simulating the implosion/explosion due to
the pair-production instability, and use them as inputs for detailed non-LTE
time-dependent radiative-transfer simulations that include non-local energy
deposition and non-thermal processes. We retrieve the basic morphology of PISN
light curves from red-supergiant, blue-supergiant, and Wolf-Rayet (WR) star
progenitors. Although we confirm that a progenitor 100Msun helium core (PISN
model He100) fits well the SN2007bi light curve, the low ratios of its kinetic
energy and 56Ni mass to the ejecta mass, similar to standard core-collapse SNe,
conspire to produce cool photospheres, red spectra subject to strong line
blanketing, and narrow line profiles, all conflicting with SN2007bi
observations. He-core models of increasing 56Ni-to-ejecta mass ratio have bluer
spectra, but still too red to match SN2007bi, even for model He125 -- the
effect of 56Ni heating is offset by the associated increase in blanketing. In
contrast, the delayed injection of energy by a magnetar represents a more
attractive alternative to reproduce the blue, weakly-blanketed, and broad-lined
spectra of super-luminous SNe. The extra heat source is free of blanketing and
is not explicitly tied to the ejecta. Experimenting with a ~9Msun WR-star
progenitor, initially exploded to yield a ~1.6B SN Ib/c ejecta but later
influenced by tunable magnetar-like radiation, we produce a diversity of blue
spectral morphologies reminiscent of SN2007bi, the peculiar Type Ib SN2005bf,
and super-luminous SN2005ap-like events.
","[{""version"":""v1"",""created"":""Mon, 6 Aug 2012 17:26:57 GMT""}]","2015-06-11"
"1208.1215","Andrzej Staszczak","A. Staszczak, A. Baran and W. Nazarewicz","Spontaneous fission modes and lifetimes of super-heavy elements in the
  nuclear density functional theory","6 pages, 4 figures",,"10.1103/PhysRevC.87.024320",,"nucl-th nucl-ex","http://arxiv.org/licenses/nonexclusive-distrib/1.0/","  Lifetimes of super-heavy (SH) nuclei are primarily governed by alpha decay
and spontaneous fission (SF). Here we study the competing decay modes of
even-even SH isotopes with 108 <= Z <= 126 and 148 <= N <= 188 using the
state-of-the-art self-consistent nuclear density functional theory framework
capable of describing the competition between nuclear attraction and
electrostatic repulsion. The collective mass tensor of the fissioning
superfluid nucleus is computed by means of the cranking approximation to the
adiabatic time-dependent Hartree-Fock-Bogoliubov approach. Along the path to
fission, our calculations allow for the simultaneous breaking of axial and
space inversion symmetries; this may result in lowering SF lifetimes by more
than seven orders of magnitude in some cases. We predict two competing SF
modes: reflection-symmetric and reflection-asymmetric.The shortest-lived SH
isotopes decay by SF; they are expected to lie in a narrow corridor formed by
$^{280}$Hs, $^{284}$Fl, and $^{284}_{118}$Uuo that separates the regions of SH
nuclei synthesized in ""cold fusion"" and ""hot fusion"" reactions. The region of
long-lived SH nuclei is expected to be centered on $^{294}$Ds with a total
half-life of ?1.5 days.
","[{""version"":""v1"",""created"":""Mon, 6 Aug 2012 17:33:30 GMT""}]","2015-06-11"
"1208.1216","G. S. Bisnovatyi-Kogan","G. S. Bisnovatyi-Kogan, A. S. Klepnev, R. V. E. Lovelace","Accretion into black holes with magnetic fields, and relativistic jets","6 pages, 4 figures","Odessa Astronomical Publications vol. 24, pp. 54-58 (2011)",,,"astro-ph.HE","http://arxiv.org/licenses/nonexclusive-distrib/1.0/","  We discuss the problem of the formation of a large-scale magnetic field in
the accretion disks around black holes, taking into account the non-uniform
vertical structure of the disk. The high electrical conductivity of the outer
layers of the disk prevents the outward diffusion of the magnetic field. This
implies a stationary state with a strong magnetic field in the inner parts of
the accretion disk close to the black hole, and zero radial velocity at the
surface of the disk. Structure of advective accretion disks is investigated,
and conditions for formation of optically thin regions in central parts of the
accretion disk are found. The problem of jet collimation by magneto-torsion
oscillations is considered.
","[{""version"":""v1"",""created"":""Mon, 6 Aug 2012 17:39:36 GMT""}]","2012-08-07"
"1208.1217","Rkia Aouinatou","Rkia Aouinatou, Mostafa Belkasmi","An efficient classification in IBE Provide with an improvement of BB2 to
  an efficient Commutative Blinding scheme","Pages: 34 No figures 6 Tales",,,,"cs.CR","http://creativecommons.org/licenses/by/3.0/","  Because of the revolution and the success of the technique IBE
(Identification Based Encryption) in the recent years. The need is growing to
have a standardization to this technology to streamline communication based on
it. But this requires a thorough study to extract the strength and weakness of
the most recognized cryptosystems. Our first goal in this work is to approach
to this standardization, by applying a study which permit to extract the best
cryptosystems. As we will see in this work and as Boneh and Boyen said in 2011
(Journal of Cryptology) the BB1 and BB2 are the most efficient schemes in the
model selective ID and without random oracle (they are the only schemes traced
in this model). This is right as those schemes are secure (under this model),
efficient and useful for some applications. Our second goal behind this work is
to make an approvement in BB2 to admit a more efficient schemes. We will study
the security of our schemes, which is basing on an efficient strong
Diffie-Hellman problem compared to BB1 and BB2. More than that our HIBE support
s+ID-HIBE compared to BBG (Boneh Boyen Goh). Additionally the ID in our scheme
will be in Zp instead of Zp* as with BBG. We will cite more clearly all these
statements in in this article.
","[{""version"":""v1"",""created"":""Mon, 6 Aug 2012 17:41:01 GMT""}]","2012-08-07"
