"1208.1317","Thiago Castilho de Mello","Thiago Castilho de Mello and Plamen Koshlukov","The centre of generic algebras of small PI algebras","15 pages. Misprints corrected. Provisionally accepted to publication
  in Journal of Algebra","Journal of Algebra 375 (2013) 109--120","10.1016/j.jalgebra.2012.11.018",,"math.RA","http://arxiv.org/licenses/nonexclusive-distrib/1.0/","  Verbally prime algebras are important in PI theory. They are well known over
a field $K$ of characteristic zero: 0 and $K<T>$ (the trivial ones), $M_n(K)$,
$M_n(E)$, $M_{ab}(E)$. Here $K<T>$ is the free associative algebra with free
generators $T$, $E$ is the infinite dimensional Grassmann algebra over $K$,
$M_n(K)$ and $M_n(E)$ are the $n\times n$ matrices over $K$ and over $E$,
respectively. Moreover $M_{ab}(E)$ are certain subalgebras of $M_{a+b}(E)$,
defined below. The generic algebras of these algebras have been studied
extensively. Procesi gave a very tight description of the generic algebra of
$M_n(K)$. The situation is rather unclear for the remaining nontrivial verbally
prime algebras.
  In this paper we study the centre of the generic algebra of $M_{11}(E)$ in
two generators. We prove that this centre is a direct sum of the field and a
nilpotent ideal (of the generic algebra). We describe the centre of this
algebra. As a corollary we obtain that this centre contains nonscalar elements
thus we answer a question posed by Berele.
","[{""version"":""v1"",""created"":""Tue, 7 Aug 2012 01:33:16 GMT""},{""version"":""v2"",""created"":""Fri, 16 Nov 2012 16:46:35 GMT""}]","2013-11-11"
"1208.1318","Takeshi Mizushima","Takeshi Mizushima","Superfluid 3He in a restricted geometry with a perpendicular magnetic
  field","18 pages, 12 figures","Phys. Rev. B 86, 094518 (2012)","10.1103/PhysRevB.86.094518",,"cond-mat.supr-con","http://arxiv.org/licenses/nonexclusive-distrib/1.0/","  We theoretically investigate the role of surface Andreev bound states (SABSs)
on the phase diagram and spin susceptibilities of superfluid 3He confined to a
restricted geometry. We first explicitly derive the dispersion of the SABS in
3He-B in the presence of a magnetic field, where the Majorana Ising spin and
the spin susceptibility contributed from the SABS are associated with the SO(3)
order parameter manifold. Subsequently, based on the quasiclassical Eilenberger
theory with Fermi liquid corrections, we discuss the nonlinear effect of a
magnetic field on the SABS, where the magnetic field is perpendicular to the
specular surface. It is directly demonstrated that a gapped SABS strongly
enhances the magnetization density and spin susceptibility at the surface,
compared with that in the normal 3He. To capture the characteristics of the
SABS, we show the field- and temperature-dependences of the spatially averaged
susceptibility which is detectable through NMR experiments. It turns out that
the contribution of the SABS leads to nonmonotonic temperature-dependence of
the spin susceptibility. Furthermore, we present the superfluid phase diagram,
where the B-phase undergoes a first-order (second-order) phase transition to
A-phase or planar phase at low (high) temperatures.
","[{""version"":""v1"",""created"":""Tue, 7 Aug 2012 01:35:59 GMT""},{""version"":""v2"",""created"":""Tue, 25 Sep 2012 07:05:52 GMT""}]","2012-09-26"
"1208.1319","Jin Young Kim","Jin Young Kim","Bending of electromagnetic wave in an ultra-strong magnetic field","9 pages, 2 figures","JCAP 1210 (2012) 056","10.1088/1475-7516/2012/10/056",,"hep-ph astro-ph.HE","http://arxiv.org/licenses/nonexclusive-distrib/1.0/","  We consider the bending of light by nonlinear electrodynamics when the
magnetic field $B$ exceeds the critical value $B_{\rm c}$. Using the index of
refraction derived from the analytic series representation in one-loop
effective action of QED, we found the trajectory and the bending angle of light
in geometric optics. The angle bent by ultra-strong magnetic field of magnetar
was estimated and compared with the gravitational bending. The result may be
useful in studying the lensing, birefringence, and other nonlinear quantum
electrodynamic effects above $B_{\rm c}$.
","[{""version"":""v1"",""created"":""Tue, 7 Aug 2012 01:41:11 GMT""}]","2015-06-11"
"1208.1320","Veronica Dexheimer Dr.","V. Dexheimer, R. Negreiros, S. Schramm and M. Hempel","Deconfinement to Quark Matter in Neutron Stars - The Influence of Strong
  Magnetic Fields","To appear in the proceedings of conference XII HADRON PHYSICS April,
  22-27, 2012, Bento Goncalves, Wineyards Valley Region, Rio Grande do Sul,
  Brazil Revised version with corrections made to the text in page 4",,"10.1063/1.4795968",,"astro-ph.HE astro-ph.SR nucl-th","http://arxiv.org/licenses/nonexclusive-distrib/1.0/","  We use an extended version of the hadronic SU(3) non-linear realization of
the sigma model that also includes quarks to study hybrid stars. Within this
approach, the degrees of freedom change naturally as the temperature/density
increases. Different prescriptions of charge neutrality, local and global, are
tested and the influence of strong magnetic fields and the anomalous magnetic
moment on the particle population is discussed.
","[{""version"":""v1"",""created"":""Tue, 7 Aug 2012 01:42:18 GMT""},{""version"":""v2"",""created"":""Wed, 19 Jul 2017 19:55:00 GMT""}]","2017-07-21"
"1208.1321","Pingbing Ming","Xiantao Li and Pingbing Ming","On the effect of ghost force in the quasicontinuum method: dynamic
  problems in one dimension","28 pages",,,,"math.NA","http://arxiv.org/licenses/nonexclusive-distrib/1.0/","  Numerical error induced by the ""ghost forces"" in the quasicontinuum method is
studied in the context of dynamic problems. The error in the ({W}^{1,\infty})
norm is analyzed for the time scale (\mc{O}(\eps)) and the time scale
(\mc{O}(1)) with $\eps$ being the lattice spacing.
","[{""version"":""v1"",""created"":""Tue, 7 Aug 2012 01:50:32 GMT""}]","2012-08-08"
"1208.1322","Greg\'orio Pacelli F. Bessa","G. Pacelli Bessa, Leandro F. Pessoa","Maximum principle for semi-elliptic trace operators and geometric
  applications",,,,,"math.DG","http://arxiv.org/licenses/nonexclusive-distrib/1.0/","  Based on ideas of L. Al\'ias, D. Impera and M. Rigoli developed in
""Hypersurfaces of constant higher order mean curvature in warped products"", we
develope a fairly general weak/Omori-Yau maximum principle for trace operators.
We apply this version of maximum principle to generalize several higher order
mean curvature estimates and to give an extension of Alias-Impera-Rigoli Slice
Theorem
","[{""version"":""v1"",""created"":""Tue, 7 Aug 2012 01:59:39 GMT""}]","2012-08-08"
"1208.1323","Tomohiro Takesako","Masahiro Kawasaki and Tomohiro Takesako","Remarks on Hubble Induced Mass from Fermion Kinetic Term","8 pages, v2: minor corrections made, published in PLB",,"10.1016/j.physletb.2012.10.080","ICRR-Report-618-2012-7; IPMU 12-0148","hep-ph astro-ph.CO","http://arxiv.org/licenses/nonexclusive-distrib/1.0/","  We evaluate the effective mass of a scalar field which interacts with visible
sector via Planck-suppressed coupling in supergravity framework. We focus on
the radiation-dominated (RD) era after inflation and the contribution from a
fermionic field in the thermal bath. We find that, in RD era, the fermion
kinetic term gives the effective mass of the order of Hubble scale to the
scalar field.
","[{""version"":""v1"",""created"":""Tue, 7 Aug 2012 02:01:51 GMT""},{""version"":""v2"",""created"":""Wed, 7 Nov 2012 22:47:16 GMT""}]","2015-06-11"
"1208.1324","Markus Sch\""offler S.","M. S. Sch\""offler (1), O. Chuluunbaatar (2,3), Yu. V. Popov (4), S.
  Houamer (5), J. Titze (1), T. Jahnke (1), L. Ph. H. Schmidt (1), O. Jagutzki
  (1), A. G. Galstyan (6), A. A. Gusev (2) ((1) Institut f\""ur Kernphysik,
  Universit\""at Frankfurt, Frankfurt, Germany, (2) Laboratory of Information
  Technologies, Joint Institute for Nuclear Research, Dubna, Moscow, Russia,
  (3) School of Mathematics and Computer Sciences, National University of
  Mongolia, UlaanBaatar, Mongolia, (4) Skobeltsyn Institute of Nuclear Physics,
  Lomonosov Moscow State University, Moscow, Russia, (5) Laboratoire de
  Physique Quantique et Syst\'emes Dynamiques, D\'epartement de Physique,
  Facult\'e des Sciences, Universit\'e Ferhat Abbas, S\'etif, Algeria, (6)
  Faculty of Physics, Lomonosov Moscow State University, Moscow, Russia)","Transfer ionization and its sensitivity to the ground-state wave
  function",,"Phys. Rev. A 87, 032715 (2013)","10.1103/PhysRevA.87.032715",,"physics.atom-ph","http://arxiv.org/licenses/nonexclusive-distrib/1.0/","  We present kinematically complete theoretical calculations and experiments
for transfer ionization in H$^++$He collisions at 630 keV/u. Experiment and
theory are compared on the most detailed level of fully differential cross
sections in the momentum space. This allows us to unambiguously identify
contributions from the shake-off and two-step-2 mechanisms of the reaction. It
is shown that the simultaneous electron transfer and ionization is highly
sensitive to the quality of a trial initial-state wave function.
","[{""version"":""v1"",""created"":""Tue, 7 Aug 2012 02:25:58 GMT""},{""version"":""v2"",""created"":""Fri, 22 Feb 2013 11:33:40 GMT""}]","2022-01-26"
"1208.1325","Humberto R. Guti\'errez","Humberto R. Guti\'errez, Nestor Perea-L\'opez, Ana Laura El\'ias, Ayse
  Berkdemir, Bei Wang, Ruitao Lv, Florentino L\'opez-Ur\'ias, Vincent H.
  Crespi, Humberto Terrones and Mauricio Terrones","Extraordinary room-temperature photoluminescence in WS2 monolayers",,,"10.1021/nl3026357",,"cond-mat.mes-hall","http://arxiv.org/licenses/nonexclusive-distrib/1.0/","  Individual monolayers of metal dichalcogenides are atomically thin
two-dimensional crystals with attractive physical properties different from
their bulk layered counterpart. Here we describe the direct synthesis of WS2
monolayers with triangular morphologies and strong room-temperature
photoluminescence (PL). Bulk WS2 does not present PL due to its indirect band
gap nature. The edges of these monolayers exhibit PL signals with extraordinary
intensity, around 25 times stronger than the platelets center. The structure
and composition of the platelet edges appear to be critical for the PL
enhancement effect. Electron diffraction revealed that platelets present zigzag
edges, while first-principles calculations indicate that sulfur-rich zigzag WS2
edges possess metallic edge states, which might tailor the optical response
reported here. These novel 2D nanoscale light sources could find diverse
applications including the fabrication of flexible/transparent/low-energy
optoelectronic devices.
","[{""version"":""v1"",""created"":""Tue, 7 Aug 2012 02:34:36 GMT""}]","2015-06-11"
"1208.1326","Brian Butler","Brian K. Butler and Paul H. Siegel","Numerical Issues Affecting LDPC Error Floors","7 pages, 5 figures. Submitted to IEEE Globecom (Selected Area of
  Communications Data Storage Track)",,,,"cs.IT cs.NA math.IT math.NA","http://arxiv.org/licenses/nonexclusive-distrib/1.0/","  Numerical issues related to the occurrence of error floors in floating-point
simulations of belief propagation (BP) decoders are examined. Careful
processing of messages corresponding to highly-certain bit values can sometimes
reduce error floors by several orders of magnitude. Computational solutions for
properly handling such messages are provided for the sum-product algorithm
(SPA) and several variants.
","[{""version"":""v1"",""created"":""Tue, 7 Aug 2012 02:41:54 GMT""}]","2012-08-08"
"1208.1327","Mauricio Junca","Mauricio Junca and Mauricio Sanchez-Silva","Optimal Maintenance Policy for a Compound Poisson Shock Model",,"IEEE Transactions on Reliability.62 (1):66-72 (2013)",,,"math.OC","http://arxiv.org/licenses/nonexclusive-distrib/1.0/","  Engineered and infrastructure systems deteriorate (e.g., loss capacity) as a
result of adverse environmental or external conditions. Modeling deterioration
is essential to define optimum design strategies and inspection and maintenance
(intervention) programs. In particular, the main purpose of maintenance is to
increase the system availability by extending the life of the system. Most
strategies for maintenance optimization focus on defining long term strategies
based on the system's condition at the decision time (e.g., $t=0$). However,
due to the large uncertainty in the system's performance through life, an
optimal maintenance policy requires both permanent monitoring and a
cost-efficient plan of interventions. This paper presents a model to define an
optimal maintenance policy of systems that deteriorate as a result of shocks.
Deterioration caused by shocks is modeled as a compound Poisson process and the
optimal maintenance strategy is based on an impulse control model. In the model
the optimal time and size of interventions are executed according the the
system state, which is obtained from permanent monitoring.
","[{""version"":""v1"",""created"":""Tue, 7 Aug 2012 02:58:14 GMT""}]","2014-09-19"
"1208.1328","Dean Lee J","Evgeny Epelbaum, Hermann Krebs, Timo L\""ahde, Dean Lee, Ulf-G.
  Mei{\ss}ner","Structure and rotations of the Hoyle state","4 pages, 3 figures, 4 tables, version to be published in Physical
  Review Letters","Phys. Rev. Lett. 109, 252501 (2012)","10.1103/PhysRevLett.109.252501",,"nucl-th astro-ph.SR hep-lat nucl-ex","http://arxiv.org/licenses/nonexclusive-distrib/1.0/","  The excited state of the 12C nucleus known as the ""Hoyle state"" constitutes
one of the most interesting, difficult and timely challenges in nuclear
physics, as it plays a key role in the production of carbon via fusion of three
alpha particles in red giant stars. In this letter, we present ab initio
lattice calculations which unravel the structure of the Hoyle state, along with
evidence for a low-lying spin-2 rotational excitation. For the 12C ground state
and the first excited spin-2 state, we find a compact triangular configuration
of alpha clusters. For the Hoyle state and the second excited spin-2 state, we
find a ""bent-arm"" or obtuse triangular configuration of alpha clusters. We also
calculate the electromagnetic transition rates between the low-lying states of
12C.
","[{""version"":""v1"",""created"":""Tue, 7 Aug 2012 03:08:36 GMT""},{""version"":""v2"",""created"":""Wed, 28 Nov 2012 05:31:43 GMT""}]","2012-12-20"
"1208.1329","Kent Morrison","Kent E. Morrison","The multiplication game","14 pages","Mathematics Magazine 83 (2010) 100-110","10.4169/002557010X482862",,"cs.GT math.PR","http://arxiv.org/licenses/nonexclusive-distrib/1.0/","  The multiplication game is a two-person game in which each player chooses a
positive integer without knowledge of the other player's number. The two
numbers are then multiplied together and the first digit of the product
determines the winner. Rather than analyzing this game directly, we consider a
closely related game in which the players choose positive real numbers between
1 and 10, multiply them together, and move the decimal point, if necessary, so
that the result is between 1 and 10. The mixed strategies are probability
distributions on this interval, and it is shown that for both players it is
optimal to choose their numbers from the Benford distribution. Furthermore,
this strategy is optimal for any winning set, and the probability of winning is
the Benford measure of the player's winning set. Using these results we prove
that the original game in which the players choose integers has a well-defined
value and that strategies exist that are arbitrarily close to optimal. Finally,
we consider generalizations of the game in which players choose elements from a
compact topological group and show that choosing them according to Haar measure
is an optimal strategy.
","[{""version"":""v1"",""created"":""Tue, 7 Aug 2012 03:27:16 GMT""}]","2016-07-11"
"1208.1330","Eric Mortenson","Eric Mortenson","On three third order mock theta functions and Hecke-type double sums",,"Ramanujan Journal, 30 (2013), no. 2, pp. 279-308","10.1007/s11139-012-9376-8",,"math.NT","http://arxiv.org/licenses/nonexclusive-distrib/1.0/","  We obtain four Hecke-type double sums for three of Ramanujan's third order
mock theta functions. We discuss how these four are related to the new mock
theta functions of Andrews' work on $q$-orthogonal polynomials and Bringmann,
Hikami, and Lovejoy's work on unified Witten-Reshetikhin-Turaev invariants of
certain Seifert manifolds. We then prove identities between these new mock
theta functions by first expressing them in terms of the universal mock theta
function.
","[{""version"":""v1"",""created"":""Tue, 7 Aug 2012 03:39:03 GMT""}]","2014-07-29"
"1208.1331","Nikolai Dokuchaev","Nikolai Dokuchaev","Optimal replication of random vectors by ordinary integrals",,,,,"math.OC math.PR","http://arxiv.org/licenses/nonexclusive-distrib/1.0/","  We consider a problem of replication of random vectors by ordinary integrals
in the setting when a underlying random variable is generated by a Wiener
process. The goal is to find an optimal adapted process such that its
cumulative integral at a fixed terminal time matches this variable. The optimal
process has to be minimal in an integral norm.
","[{""version"":""v1"",""created"":""Tue, 7 Aug 2012 03:48:58 GMT""},{""version"":""v2"",""created"":""Wed, 8 Aug 2012 05:59:14 GMT""}]","2012-08-09"
"1208.1332","Yin Zhong","Yin Zhong, Ke Liu, Yu-Feng Wang, Yong-Qiang Wang and Hong-Gang Luo","Half-filled Kondo lattice on the honeycomb lattice","pages, 7 figure,manuscript is heavily expanded","Eur. Phys. J. B(2013) 86: 195","10.1140/epjb/e2013-31091-7",,"cond-mat.str-el cond-mat.mes-hall cond-mat.quant-gas quant-ph","http://arxiv.org/licenses/nonexclusive-distrib/1.0/","  The unique linear density of state around the Dirac points for the honeycomb
lattice brings much novel features in strongly correlated models. Here we study
the ground-state phase diagram of the Kondo lattice model on the honeycomb
lattice at half-filling by using an extended mean-field theory. By treating
magnetic interaction and Kondo screening on an equal footing, it is found that
besides a trivial discontinuous first-order quantum phase transition between
well-defined Kondo insulator and antiferromagnetic insulating state, there can
exist a wide coexistence region with both Kondo screening and antiferromagnetic
orders in the intermediate coupling regime. In addition, the stability of Kondo
insulator requires a minimum strength of the Kondo coupling. These features are
attributed to the linear density of state, which are absent in the square
lattice. Furthermore, fluctuation effect beyond the mean-field decoupling is
analyzed and the corresponding antiferromagnetic spin-density-wave transition
falls into the O(3) universal class. Comparatively, we also discuss the Kondo
necklace and the Kane-Mele-Kondo (KMK) lattice models on the same lattice.
Interestingly, it is found that the topological insulating state is unstable to
the usual antiferromagnetic ordered states at half-filling for the KMK model.
The present work may be helpful for further studies on the interplay between
conduction electrons and the densely localized spins on the honeycomb lattice.
","[{""version"":""v1"",""created"":""Tue, 7 Aug 2012 04:02:18 GMT""},{""version"":""v2"",""created"":""Wed, 8 Aug 2012 01:59:28 GMT""},{""version"":""v3"",""created"":""Sat, 15 Sep 2012 06:32:25 GMT""},{""version"":""v4"",""created"":""Wed, 5 Dec 2012 05:56:07 GMT""},{""version"":""v5"",""created"":""Thu, 28 Feb 2013 01:55:14 GMT""}]","2013-05-02"
"1208.1333","Hwa-Long Gau","Hwa-Long Gau and Pei Yuan Wu","Higher-rank Numerical Ranges and Kippenhahn Polynomials","16 pages, 1 figure",,"10.1016/j.laa.2012.11.017",,"math.FA","http://arxiv.org/licenses/nonexclusive-distrib/1.0/","  We prove that two n-by-n matrices A and B have their rank-k numerical ranges
$\Lambda_k(A)$ and $\Lambda_k(B)$ equal to each other for all k, $1\le k\le
\lfloor n/2\rfloor+1$, if and only if their Kippenhahn polynomials
$p_A(x,y,z)\equiv\det(x Re A+y Im A+zI_n)$ and $p_B(x,y,z)\equiv\det(x Re B+y
Im B+zI_n)$ coincide. The main tools for the proof are the Li-Sze
characterization of higher-rank numerical ranges, Weyl's perturbation theorem
for eigenvalues of Hermitian matrices and Bezout's theorem for the number of
common zeros for two homogeneous polynomials.
","[{""version"":""v1"",""created"":""Tue, 7 Aug 2012 04:19:02 GMT""}]","2013-10-22"
"1208.1334","Austin Fowler","Austin G. Fowler","Analytic asymptotic performance of topological codes","4 pages, 2 figures","Phys. Rev. A 87, 040301(R) (2013)","10.1103/PhysRevA.87.040301",,"quant-ph","http://arxiv.org/licenses/nonexclusive-distrib/1.0/","  Topological quantum error correction codes are extremely practical, typically
requiring only a 2-D lattice of qubits with tunable nearest neighbor
interactions yet tolerating high physical error rates p. It is computationally
expensive to simulate the performance of such codes at low p, yet this is a
regime we wish to study as low physical error rates lead to low qubit overhead.
We present a very general method of analytically estimating the low p
performance of the most promising class of topological codes. Our method can
handle arbitrary periodic quantum circuits implementing the error detection
associated with this class of codes, and arbitrary Pauli error models for each
type of quantum gate. Our analytic expressions take only seconds to obtain,
versus hundreds of hours to perform equivalent low p simulations.
","[{""version"":""v1"",""created"":""Tue, 7 Aug 2012 04:43:14 GMT""}]","2013-05-01"
"1208.1335","Sugumi Kanno","Jaume Garriga, Sugumi Kanno, Misao Sasaki, Jiro Soda, Alexander
  Vilenkin","Observer dependence of bubble nucleation and Schwinger pair production","32 papes, 1 figure, minor corrections, references added, typos
  corrected","JCAP 1212 (2012) 006","10.1088/1475-7516/2012/12/006","YITP-12-68; KUNS-2410","hep-th gr-qc","http://arxiv.org/licenses/nonexclusive-distrib/1.0/","  Pair production in a constant electric field is closely analogous to bubble
nucleation in a false vacuum. The classical trajectories of the pairs are
Lorentz invariant, but it appears that this invariance should be broken by the
nucleation process. Here, we use a model detector, consisting of other
particles interacting with the pairs, to investigate how pair production is
seen by different Lorentzian observers. We focus on the idealized situation
where a constant external electric field is present for an infinitely long
time, and we consider the in-vacuum state for a charged scalar field that
describes the nucleating pairs. The in-vacuum is defined in terms of modes
which are positive frequency in the remote past. Even though the construction
uses a particular reference frame and a gauge where the vector potential is
time dependent, we show explicitly that the resulting quantum state is Lorentz
invariant. We then introduce a ""detector"" particle which interacts with the
nucleated pairs, and show that all Lorentzian observers will see the particles
and antiparticles nucleating preferentially at rest in the detector's rest
frame. Similar conclusions are expected to apply to bubble nucleation in a
sufficiently long lived vacuum. We also comment on certain unphysical aspects
of the Lorentz invariant in-vacuum, associated with the fact that it contains
an infinite density of particles. This can be easily remedied by considering
Lorentz breaking initial conditions.
","[{""version"":""v1"",""created"":""Tue, 7 Aug 2012 05:07:58 GMT""},{""version"":""v2"",""created"":""Tue, 21 Aug 2012 07:03:42 GMT""},{""version"":""v3"",""created"":""Wed, 24 Apr 2013 17:57:56 GMT""}]","2013-04-25"
"1208.1336","Paolo Gasti","Jeff Burke, Paolo Gasti, Naveen Nathan, Gene Tsudik","Securing Instrumented Environments over Content-Centric Networking: the
  Case of Lighting Control","arXiv admin note: text overlap with arXiv:1208.0952",,,,"cs.CR","http://arxiv.org/licenses/nonexclusive-distrib/1.0/","  Instrumented environments, such as modern building automation systems (BAS),
are becoming commonplace and are increasingly interconnected with (and
sometimes by) enterprise networks and the Internet. Regardless of the
underlying communication platform, secure control of devices in such
environments is a challenging task. The current trend is to move from
proprietary communication media and protocols to IP over Ethernet. While the
move to IP represents progress, new and different Internet architectures might
be better-suited for instrumented environments. In this paper, we consider
security of instrumented environments in the context of Content-Centric
Networking (CCN). In particular, we focus on building automation over
Named-Data Networking (NDN), a prominent instance of CCN. After identifying
security requirements in a specific BAS sub-domain (lighting control), we
construct a concrete NDN-based security architecture, analyze its properties
and report on preliminary implementation and experimental results. We believe
in securing a communication paradigm well outside of its claimed forte of
content distribution. At the same time, we provide a viable (secure and
efficient) communication platform for a class of instrumented environments
exemplified by lighting control.
","[{""version"":""v1"",""created"":""Tue, 7 Aug 2012 05:45:40 GMT""}]","2012-08-18"
