"1208.1374","Chao-Zhong Wu","Liang Chang, Chao-Zhong Wu","Tau function of the CKP hierarchy and non-linearizable Virasoro
  symmetries","29 pages, published version","Nonlinearity 26 (2013) 2577--2596","10.1088/0951-7715/26/9/2577",,"nlin.SI math-ph math.MP","http://arxiv.org/licenses/nonexclusive-distrib/1.0/","  We introduce a single tau function that represents the CKP hierarchy into a
generalized Hirota ""bilinear"" equation. The actions on the tau function by
additional symmetries for the hierarchy are calculated, which involve strictly
more than a central extension of the $w^C_\infty$-algebra. As an application,
for Drinfeld-Sokolov hierarchies of type C that are equivalent to certain
reductions of the CKP hierarchy, their Virasoro symmetries are proved to be
non-linearizable when acting on the tau function.
","[{""version"":""v1"",""created"":""Tue, 7 Aug 2012 09:07:59 GMT""},{""version"":""v2"",""created"":""Wed, 7 Aug 2013 12:45:07 GMT""}]","2015-06-11"
"1208.1375","T. Padmanabhan","T. Padmanabhan","Structural Aspects Of Gravitational Dynamics And The Emergent
  Perspective Of Gravity","Updated version of talks given at: (a) Sixth International School on
  Field Theory and Gravitation - 2012, Petropolis, Brazil; (b) Colloquium at
  Institute of Astrophysics, Paris, 2012 and (c) Discussion meeting on String
  Theory, International Centre for Theoretical Sciences, Bangalore, 2012",,"10.1063/1.4756971",,"hep-th astro-ph.CO gr-qc","http://arxiv.org/licenses/nonexclusive-distrib/1.0/","  I describe several conceptual aspects of a particular paradigm which treats
the field equations of gravity as emergent. These aspects are related to the
features of classical gravitational theories which defy explanation within the
conventional perspective. The alternative interpretation throws light on these
features and could provide better insights into possible description of quantum
structure of spacetime. This review complements the discussion in
arXiv:1207.0505, which describes space itself as emergent in the cosmological
context.
","[{""version"":""v1"",""created"":""Tue, 7 Aug 2012 09:09:33 GMT""}]","2015-06-11"
"1208.1376","Ignacio Gomez Portillo Funes","Ignacio Gomez Portillo","Building Cooperative Networks","24 pages, 8 figures",,"10.1103/PhysRevE.86.051108",,"cs.GT physics.soc-ph","http://arxiv.org/licenses/nonexclusive-distrib/1.0/","  We study the cooperation problem in the framework of evolutionary game theory
using the prisoner's dilemma as metaphor of the problem. Considering the
growing process of the system and individuals with imitation capacity, we show
conditions that allow to form highly cooperative networks of any size and
topology. Introducing general considerations of real systems, we reduce the
required conditions for cooperation to evolve approaching the benefit-cost
ratio r to the theoretical minimum r=1, when the mean connectivity of the
individuals is increased. Through the paper, we distinguish different
mechanisms that allow the system to maintain high levels of cooperation when
the system grows by incorporation of defectors. These mechanisms require
heterogeneity among individuals for cooperation to evolve. However, the
required conditions and heterogeneities are drastically reduced as compared to
those required for static networks.
","[{""version"":""v1"",""created"":""Tue, 7 Aug 2012 09:10:26 GMT""}]","2015-06-11"
"1208.1377","Krishna Prasad  S","S. Krishna Prasad, D. Banerjee, Jagdev Singh","Oscillations in active region fan loops: Observations from EIS/{\it
  Hinode} and AIA/SDO","Accepted for publication in Solar Physics",,"10.1007/s11207-012-0098-2",,"astro-ph.SR","http://arxiv.org/licenses/nonexclusive-distrib/1.0/","  Active region fan loops in AR 11076 were studied, in search of oscillations,
using high cadence spectroscopic observations from EIS on board Hinode combined
with imaging sequences from the AIA on board SDO. Spectra from EIS were
analyzed in two spectral windows, \FeXII 195.12 \AA and \FeXIII 202.04 \AA
along with the images from AIA in 171 \AA and 193 \AA channels. We find short
($<$3 min) and long ($\approx$9 min) periods at two different locations.
Shorter periods show oscillations in all the three line parameters and the
longer ones only in intensity and Doppler shift but not in line width. Line
profiles at both these locations do not show any visible blue-shifted component
and can be fitted well with a single Gaussian function along with a polynomial
background. Results using co-spatial and co-temporal data from AIA/SDO do not
show any significant peak corresponding to shorter periods, but longer periods
are clearly observed in both 171 \AA and 193 \AA channels. Space-time analysis
in these fan loops using images from AIA/SDO show alternate slanted ridges of
positive slope, indicative of outward propagating disturbances. The apparent
propagation speeds were estimated to be 83.5 $\pm$ 1.8 \kms and 100.5 $\pm$ 4.2
\kms, respectively, in the 171 \AA and 193 \AA channels. Observed short period
oscillations are suggested to be caused by the simultaneous presence of more
than one MHD mode whereas the long periods are suggested as signatures of slow
magneto-acoustic waves. In case of shorter periods, the amplitude of
oscillation is found to be higher in EIS lines with relatively higher
temperature of formation. Longer periods, when observed from AIA, show a
decrease of amplitude in hotter AIA channels which might indicate damping due
to thermal conduction owing to their acoustic nature.
","[{""version"":""v1"",""created"":""Tue, 7 Aug 2012 09:18:28 GMT""}]","2012-08-08"
"1208.1378","Bruno G. Taketani","Thom\'as Fogarty, Endre Kajari, Bruno G. Taketani, Alexander Wolf,
  Thomas Busch, Giovanna Morigi","Entangling two defects via a surrounding crystal","5 pages, 5 figures","Phys. Rev. A 87, 050304(R) (2013)","10.1103/PhysRevA.87.050304",,"cond-mat.other quant-ph","http://arxiv.org/licenses/nonexclusive-distrib/1.0/","  We theoretically show how two impurity defects in a crystalline structure can
be entangled through coupling with the crystal. We demonstrate this with a
harmonic chain of trapped ions in which two ions of a different species are
embedded. Entanglement is found for sufficiently cold chains and for a certain
class of initial, separable states of the defects. It results from the
interplay between localized modes which involve the defects and the interposed
ions, it is independent of the chain size, and decays slowly with the distance
between the impurities. These dynamics can be observed in systems exhibiting
spatial order, viable realizations are optical lattices, optomechanical
systems, or cavity arrays in circuit QED.
","[{""version"":""v1"",""created"":""Tue, 7 Aug 2012 09:24:54 GMT""},{""version"":""v2"",""created"":""Thu, 6 Dec 2012 12:20:18 GMT""}]","2015-06-11"
"1208.1379","Bin Yang","Yang Bin, Li Heling, Zhao Hongsheng, Yang Tao","All-optical Switch Based on Optical Waveguide Coupling with Micro Cavity
  Array",,,,,"physics.optics","http://arxiv.org/licenses/nonexclusive-distrib/1.0/","  This paper theoretically analyzes the optical transmission characteristics of
an optical waveguide when coupling to a micro cavity array. The results showed
that not only were there sharp peaks on the transmission and reflection
spectra, but also that a certain system configuration can produce a backward
wave to obtain a phase shift in the small detuning range between the incident
wave and the micro cavities. Based on a discussion of the relationship between
the transmission and the number and the dissipation coefficients of each
coupled micro cavity, the paper proposes a high efficiency all-optical switch
model.
","[{""version"":""v1"",""created"":""Tue, 7 Aug 2012 09:24:54 GMT""}]","2012-08-08"
"1208.1380","Kastytis Zubovas","Kastytis Zubovas and Andrew R. King","The M - \sigma relation in different environments","6 pages, 3 figures. Accepted for publication in MNRAS",,"10.1111/j.1365-2966.2012.21845.x",,"astro-ph.GA astro-ph.CO","http://arxiv.org/licenses/nonexclusive-distrib/1.0/","  Galaxies become red and dead when the central supermassive black hole (SMBH)
becomes massive enough to drive an outflow beyond the virial radius of the
halo. We show that this final SMBH mass is larger than the final SMBH mass in
the bulge of a spiral galaxy by up to an order of magnitude. The M - \sigma
relations in the two galaxy types are almost parallel (M \propto
\sigma^{4+\beta}, with \beta < 1) but offset in normalization, with the extra
SMBH mass supplied by the major merger transforming the galaxy into an
elliptical, or by mass gain in a galaxy cluster. This agrees with recent
findings that SMBH in two Brightest Cluster Galaxies are \sim 10\times the
expected M-\sigma mass. We show that these results do not strongly depend on
the assumed profile of the dark matter halo, so analytic estimates found for an
isothermal potential are approximately valid in all realistic cases.
  Our results imply that there are in practice actually {\it three} M - \sigma
relations, corresponding to spiral galaxies with evolved bulges, field
elliptical galaxies and cluster centre elliptical galaxies. A fourth relation,
corresponding to cluster spiral galaxies, is also possible, but such galaxies
are expected to be rare. All these relations have the form M_{\rm BH} =
C_n\sigma^4, with only slight difference in slope between field and cluster
galaxies, but with slightly different coefficients C_n. Conflating data from
galaxies of different types and fitting a single relation to them tends to
produce a higher power of \sigma.
","[{""version"":""v1"",""created"":""Tue, 7 Aug 2012 09:30:02 GMT""}]","2015-06-11"
"1208.1381","Stafford Withington Prof.","Stafford Withington and Christopher N. Thomas","Probing the Dynamical Behaviour of Surface Dipoles Through Energy
  Absorption Interferometry","15 pages, 17 figures",,"10.1103/PhysRevA.86.043835",,"quant-ph physics.optics","http://arxiv.org/licenses/nonexclusive-distrib/1.0/","  Spatial interferometry, based on the measurement of total absorbed power, can
be used to determine the state of coherence of the electromagnetic field to
which any energy-absorbing structure is sensitive. The measured coherence
tensor can be diagonalized to give the amplitude, phase, polarization patterns,
and responsivities of the individual electromagnetic modes through which the
structure can absorb energy. Because the electromagnetic modes are intimately
related to dynamical modes of the system, information about collective
excitations can be found. We present simulations, based on the Discrete Dipole
Approximation (DDA), showing how the dynamical modes of systems of surface
dipoles can be recovered. Interactions are taken into consideration, leading to
long-range coherent phenomena, which are revealed by the method. The use of DDA
enables the interferometric response of a wide variety of objects to be
modeled, from patterned photonic films to biological macromolecules.
","[{""version"":""v1"",""created"":""Tue, 7 Aug 2012 09:31:01 GMT""}]","2015-06-11"
"1208.1382","Yuriy Mokrousov","Bj\""orn Hardrat, Frank Freimuth, Stefan Heinze, and Yuriy Mokrousov","Conductance fingerprints of non-collinear magnetic states in single atom
  contacts: a first-principles Wannier functions study","13 pages, 5 figures",,"10.1103/PhysRevB.86.165449",,"cond-mat.mes-hall","http://arxiv.org/licenses/nonexclusive-distrib/1.0/","  We present a first-principles computational scheme for investigating the
ballistic transport properties of one-dimensional nanostructures with
non-collinear magnetic order. The electronic structure is obtained within
density functional theory as implemented in the full-potential linearized
augmented plane-wave (FLAPW) method and mapped to a tight-binding like
transport Hamiltonian via non-collinear Wannier functions. The conductance is
then computed based on the Landauer formula using the Green's function method.
As a first application we study the conductance between two ferromagnetic Co
monowires terminated by single Mn apex atoms as a function of Mn-Mn separation.
We vary the Mn-Mn separation from the contact (about 2.5 to 5 {\AA}) to the far
tunneling regime (5 to 10 {\AA}). The magnetization direction of the Co
electrodes is chosen either in parallel or antiparallel alignment and we allow
for different spin configurations of the two Mn spins. In the tunneling and
into the contact regime the conductance is dominated by $s$-$d_{z^2}$-states.
In the close contact regime (below 3.5 {\AA}) there is an additional
contribution for a parallel magnetization alignment from the $d_{xz}$- and
$d_{yz}$-states which give rise to an increase of the magnetoresistance as it
is absent for antiparallel magnetization. If we allow the Mn spins to relax a
non-collinear spin state is formed close to contact. We demonstrate that the
transition from a collinear to such a non-collinear spin structure as the two
Mn atoms approach leaves a characteristic fingerprint in the distance-dependent
conductance and magnetoresistance of the junction. We explain the effect of the
non-collinear spin state on the conductance based on the spin-dependent
hybridization between the $d_{xz,yz}$-states of the Mn spins and their coupling
to the Co electrodes.
","[{""version"":""v1"",""created"":""Tue, 7 Aug 2012 09:38:33 GMT""}]","2015-06-11"
"1208.1383","Michael A. Lomholt","Michael A. Lomholt, Ludvig Lizana, Ralf Metzler, Tobias Ambjornsson","Transition dynamics in aging systems: microscopic origin of logarithmic
  time evolution","7 pages, 4 figures, REVTeX, major rearrangements of the text",,,,"cond-mat.stat-mech","http://arxiv.org/licenses/nonexclusive-distrib/1.0/","  There exists compelling experimental evidence in numerous systems for
logarithmically slow time evolution, yet its theoretical understanding remains
elusive. We here introduce and study a generic transition process in complex
systems, based on non-renewal, aging waiting times. Each state n of the system
follows a local clock initiated at t=0. The random time \tau between clock
ticks follows the waiting time density \psi(\tau). Transitions between states
occur only at local clock ticks and are hence triggered by the local forward
waiting time, rather than by \psi(\tau). For power-law forms \psi(\tau) ~
\tau^{-1-\alpha} (0<\alpha<1) we obtain a logarithmic time evolution of the
state number <n(t)> ~ log(t/t_0), while for \alpha>2 the process becomes normal
in the sense that <n(t)> ~ t. In the intermediate range 1<\alpha<2 we find the
power-law growth <n(t)> ~ t^{\alpha-1}. Our model provides a universal
description for transition dynamics between aging and non-aging states.
","[{""version"":""v1"",""created"":""Tue, 7 Aug 2012 09:51:17 GMT""},{""version"":""v2"",""created"":""Wed, 8 Aug 2012 08:38:53 GMT""},{""version"":""v3"",""created"":""Tue, 26 Mar 2013 09:29:06 GMT""}]","2013-03-27"
"1208.1384","Maurizio Falanga Dr.","M. Falanga, L. Kuiper, J. Poutanen, D. K. Galloway, E. Bozzo, A.
  Goldwurm, W. Hermsen, L. Stella","Spectral and timing properties of the accreting X-ray millisecond pulsar
  IGR J17498-2921","9 pages, 8 figures, accepted for publication in A&A. arXiv admin
  note: text overlap with arXiv:1012.0229","A&A, 545 (2012), A26","10.1051/0004-6361/201219582",,"astro-ph.HE","http://arxiv.org/licenses/nonexclusive-distrib/1.0/","  We analyze the spectral and timing properties of IGR J17498-2921 and the
characteristics of X-ray bursts to constrain the physical processes responsible
for the X-ray production in this class of sources. The broad-band average
spectrum is well-described by thermal Comptonization with an electron
temperature of kT_e ~ 50 keV, soft seed photons of kT_bb ~ 1 keV, and Thomson
optical depth \taut ~ 1 in a slab geometry. The slab area corresponds to a
black body radius of R_bb ~9 km. During the outburst, the spectrum stays
remarkably stable with plasma and soft seed photon temperatures and scattering
optical depth that are constant within the errors. This behavior has been
interpreted as indicating that the X-ray emission originates above the neutron
star (NS) surface in a hot slab (either the heated NS surface or the accretion
shock). The INTEGRAL, RXTE, and Swift data reveal the X-ray pulsation at a
period of 2.5 milliseconds up to ~65 keV. The pulsed fraction is consistent
with being constant, i.e. energy independent and has a typical value of 6-7%.
The nearly sinusoidal pulses show soft lags that seem to saturate near 10 keV
at a rather small value of ~ -60\mu s with those observed in other accreting
pulsars. The short burst profiles indicate that there is a hydrogen-poor
material at ignition, which suggests either that the accreted material is
hydrogen-deficient, or that the CNO metallicity is up to a factor of about two
times solar. However, the variation in the burst recurrence time as a function
of \dot{m} (inferred from the X-ray flux) is much smaller than predicted by
helium-ignition models.
","[{""version"":""v1"",""created"":""Tue, 7 Aug 2012 09:55:56 GMT""}]","2013-04-19"
"1208.1385","S. Mignemi","S. Mignemi","Black brane solutions of Einstein-Maxwell-scalar theory with Liouville
  potential","17 pages, plain TeX, 1 figure; some errors have been corrected and
  the discussion of the results modified accordingly",,"10.1142/S0217751X13500802",,"gr-qc","http://arxiv.org/licenses/nonexclusive-distrib/1.0/","  We investigate the global properties of black brane solutions of a
three-parameter Einstein-Maxwell model nonminimally coupled to a scalar with
exponential potential. The black brane solutions of this model have recently
been investigated because of their relevance for holography and for the
AdS/condensed matter correspondence. We classify all the possible regular
solutions and show that they exist only for a limited range of values of the
parameters and that their asymptotic behavior either breaks hyperscaling
invariance or has the form of a domain wall. We also write down some exact
solutions in Schwarzschild coordinates.
","[{""version"":""v1"",""created"":""Tue, 7 Aug 2012 10:01:12 GMT""},{""version"":""v2"",""created"":""Wed, 10 Apr 2013 08:31:58 GMT""}]","2015-06-11"
"1208.1386","Armen Oganesian Gourgenovitcv","B. L. Ioffe","The first dozen years of the history of ITEP Theoretical Physics
  Laboratory","55 pages, 5 figs",,"10.1140/epjh/e2012-30008-3",,"physics.hist-ph hep-ph","http://arxiv.org/licenses/nonexclusive-distrib/1.0/","  The theoretical investigations at ITEP in the years 1945-1958 are reviewed.
There are exposed the most important theoretical results, obtained in the
following branches of physics: 1) the theory of nuclear reactors on thermal
neutrons; 2) the hydrogen bomb project (""Tube"" in USSR and ""Classical Super"" in
USA); 3) radiation theory; ~4) low temperature physics; 5) quantum
electrodynamics and quantum field theories; 6) parity violation in weak
interactions, the theory of $\beta$-decay and other weak processes; 7) strong
interaction and nuclear physics. To the review are added the English
translations of few papers, originally published in Russian, but unknown (or
almost unknown) to Western readers.
","[{""version"":""v1"",""created"":""Tue, 7 Aug 2012 10:04:11 GMT""}]","2015-06-11"
"1208.1387","Jaya Iyer NN","Seshadri Chintapalli and Jaya N. N. Iyer","Semistability of logarithmic cotangent bundle on some projective
  manifolds","15 p",,,,"math.AG","http://arxiv.org/licenses/nonexclusive-distrib/1.0/","  In this paper, we investigate the semistability of logarithmic de Rham
sheaves on a smooth projective variety, under suitable conditions. In
particular when the Picard number is one, we obtain results for any log Del
Pezzo surface, log Fano threefolds, and for log Fano $n$-folds of dimension
$n\leq 6$.
","[{""version"":""v1"",""created"":""Tue, 7 Aug 2012 10:19:49 GMT""}]","2012-08-08"
"1208.1388","Jian-hua He","Jian-hua He and Bin Wang","Revisiting f(R) gravity models that reproduce $\Lambda$CDM expansion","7 pages, 2 figures, revised version, accepted for publication in PRD","Phys. Rev. D 87: 023508 (2013)","10.1103/PhysRevD.87.023508",,"astro-ph.CO","http://arxiv.org/licenses/nonexclusive-distrib/1.0/","  We reconstruct an $f(R)$ gravity model that gives rise to the particular
$\Lambda$CDM background evolution of the universe. We find well-defined,
real-valued analytical forms for the $f(R)$ model to describe the universe both
in the early epoch from the radiation to matter dominated eras and the late
time acceleration period. We further examine the viability of the derived
$f(R)$ model and find that it is viable to describe the evolution of the
universe in the past and there does not exist the future singularity in the
Lagrangian.
","[{""version"":""v1"",""created"":""Tue, 7 Aug 2012 10:19:52 GMT""},{""version"":""v2"",""created"":""Mon, 31 Dec 2012 01:38:13 GMT""}]","2015-06-11"
"1208.1389","Basudeb Datta Prof.","Bhaskar Bagchi and Basudeb Datta","On $k$-stellated and $k$-stacked spheres","Revised Version. Theorem 2.24 is new. 18 pages. arXiv admin note:
  substantial text overlap with arXiv:1102.0856",,,,"math.GT math.CO","http://arxiv.org/licenses/nonexclusive-distrib/1.0/","  We introduce the class $\Sigma_k(d)$ of $k$-stellated (combinatorial) spheres
of dimension $d$ ($0 \leq k \leq d + 1$) and compare and contrast it with the
class ${\cal S}_k(d)$ ($0 \leq k \leq d$) of $k$-stacked homology $d$-spheres.
We have $\Sigma_1(d) = {\cal S}_1(d)$, and $\Sigma_k(d) \subseteq {\cal
S}_k(d)$ for $d \geq 2k - 1$. However, for each $k \geq 2$ there are
$k$-stacked spheres which are not $k$-stellated. The existence of $k$-stellated
spheres which are not $k$-stacked remains an open question.
  We also consider the class ${\cal W}_k(d)$ (and ${\cal K}_k(d)$) of
simplicial complexes all whose vertex-links belong to $\Sigma_k(d - 1)$
(respectively, ${\cal S}_k(d - 1)$). Thus, ${\cal W}_k(d) \subseteq {\cal
K}_k(d)$ for $d \geq 2k$, while ${\cal W}_1(d) = {\cal K}_1(d)$. Let
$\bar{{\cal K}}_k(d)$ denote the class of $d$-dimensional complexes all whose
vertex-links are $k$-stacked balls. We show that for $d\geq 2k + 2$, there is a
natural bijection $M \mapsto \bar{M}$ from ${\cal K}_k(d)$ onto $\bar{{\cal
K}}_k(d + 1)$ which is the inverse to the boundary map $\partial \colon
\bar{{\cal K}}_k(d + 1) \to {\cal K}_k(d)$.
","[{""version"":""v1"",""created"":""Tue, 7 Aug 2012 10:20:22 GMT""},{""version"":""v2"",""created"":""Thu, 16 May 2013 11:02:37 GMT""}]","2013-05-17"
"1208.1390","Atlas Publications","ATLAS Collaboration","Measurement of WZ production in proton-proton collisions at sqrt(s) = 7
  TeV with the ATLAS detector","12 pages plus author list (27 pages total), 7 figures, 8 tables,
  minor typo corrected, submitted to European Physical Journal C","Eur. Phys. J. C (2012) 72:2173","10.1140/epjc/s10052-012-2173-0","CERN-PH-EP-2012-179","hep-ex","http://arxiv.org/licenses/nonexclusive-distrib/1.0/","  A study of WZ production in proton-proton collisions at sqrt(s) = 7 TeV is
presented using data corresponding to an integrated luminosity of 4.6 fb^-1
collected with the ATLAS detector at the Large Hadron Collider in 2011. In
total, 317 candidates, with a background expectation of 68+/-10 events, are
observed in double-leptonic decay final states with electrons, muons and
missing transverse momentum. The total cross-section is determined to be
sigma_WZ(tot) = 19.0+1.4/-1.3(stat.)+/-0.9(syst.)+/-0.4(lumi.) pb, consistent
with the Standard Model expectation of 17.6+1.1/-1.0 pb. Limits on anomalous
triple gauge boson couplings are derived using the transverse momentum spectrum
of Z bosons in the selected events. The cross section is also presented as a
function of Z boson transverse momentum and diboson invariant mass.
","[{""version"":""v1"",""created"":""Tue, 7 Aug 2012 10:33:20 GMT""},{""version"":""v2"",""created"":""Wed, 8 Aug 2012 12:35:16 GMT""},{""version"":""v3"",""created"":""Thu, 4 Oct 2012 09:31:27 GMT""}]","2013-06-25"
"1208.1391","David Reith","D. Reith, C. Blaas-Schenner, and R. Podloucky","Density functional theory study of phase stability, vibrational and
  electronic properties of $Mo_3Al_2C$","7pages, 6 figures, to be submitted to PRB",,"10.1103/PhysRevB.86.104105",,"cond-mat.mtrl-sci","http://arxiv.org/licenses/nonexclusive-distrib/1.0/","  Based on density functional theory the noncentrosymmetric superconductor
Mo_3Al_2C in its well established {\beta}-Mn type ($P4_{1}32$) crystal
structure is investigated. In particular, its thermodynamical and dynamical
stabilities are studied by calculating lattice vibrations within the harmonic
approximation. It is found that the fully stoichiometric compound is
dynamically unstable. However, compounds with carbon vacancies, i.e.,
Mo_3Al_2C_{1-x}, can be dynamically stabilized for vacancy concentrations x >
0.09. By means of a simple thermodynamical model we estimate x ~ 0.13-0.14 for
Mo_3Al_2C_{1-x} at the experimental preparation temperatures. The influence of
the carbon vacancy concentration on the electronic structure is investigated.
","[{""version"":""v1"",""created"":""Tue, 7 Aug 2012 10:39:14 GMT""}]","2013-05-30"
