"1208.1267","Stephan Hachinger","S. Hachinger, P. A. Mazzali, M. Sullivan, R. Ellis, K. Maguire, A.
  Gal-Yam, D. A. Howell, P. E. Nugent, E. Baron, J. Cooke, I. Arcavi, D.
  Bersier, B. Dilday, P. A. James, M. M. Kasliwal, S. R. Kulkarni, E. O. Ofek,
  R. R. Laher, J. Parrent, J. Surace, O. Yaron, E. S. Walker","The UV/optical spectra of the Type Ia supernova SN 2010jn: a bright
  supernova with outer layers rich in iron-group elements","17 pages, 9 figures (v3: several small updates to content including
  models; v2: metadata fixed), MNRAS, in press",,"10.1093/mnras/sts492",,"astro-ph.SR","http://arxiv.org/licenses/nonexclusive-distrib/1.0/","  Radiative transfer studies of Type Ia supernovae (SNe Ia) hold the promise of
constraining both the time-dependent density profile of the SN ejecta and its
stratification by element abundance which, in turn, may discriminate between
different explosion mechanisms and progenitor classes. Here we present a
detailed analysis of Hubble Space Telescope ultraviolet (UV) and ground-based
optical spectra and light curves of the SN Ia SN 2010jn (PTF10ygu). SN 2010jn
was discovered by the Palomar Transient Factory (PTF) 15 days before maximum
light, allowing us to secure a time-series of four UV spectra at epochs from
-11 to +5 days relative to B-band maximum. The photospheric UV spectra are
excellent diagnostics of the iron-group abundances in the outer layers of the
ejecta, particularly those at very early times. Using the method of 'Abundance
Tomography' we have derived iron-group abundances in SN 2010jn with a precision
better than in any previously studied SN Ia. Optimum fits to the data can be
obtained if burned material is present even at high velocities, including
significant mass fractions of iron-group elements. This is consistent with the
slow decline rate (or high 'stretch') of the light curve of SN 2010jn, and
consistent with the results of delayed-detonation models. Early-phase UV
spectra and detailed time-dependent series of further SNe Ia offer a promising
probe of the nature of the SN Ia mechanism.
","[{""version"":""v1"",""created"":""Mon, 6 Aug 2012 20:00:53 GMT""},{""version"":""v2"",""created"":""Thu, 9 Aug 2012 13:03:21 GMT""},{""version"":""v3"",""created"":""Mon, 24 Dec 2012 02:14:59 GMT""}]","2015-06-11"
"1208.1268","Guillermo Torres","Guillermo Torres (1), Debra A. Fischer (2), Alessandro Sozzetti (3),
  Lars A. Buchhave (4), Joshua N. Winn (5), Matthew J. Holman (1), and Joshua
  A. Carter (1) ((1) CfA, (2) Yale University, (3) INAF, Italy, (4) Niels Bohr
  Institute, Denmark, (5) Kavli Institute, MIT)","Improved spectroscopic parameters for transiting planet hosts","13 pages in emulateapj format, including figures and tables. Accepted
  for publication in The Astrophysical Journal. The complete tables 5 and 7
  will appear in the electronic edition of the Journal. Comment added in Sect.
  4.2 about the dependence of the correlations on temperature",,"10.1088/0004-637X/757/2/161",,"astro-ph.SR","http://arxiv.org/licenses/nonexclusive-distrib/1.0/","  We report homogeneous spectroscopic determinations of the effective
temperature, metallicity, and projected rotational velocity for the host stars
of 56 transiting planets. Our analysis is based primarily on the Stellar
Parameter Classification (SPC) technique. We investigate systematic errors by
examining subsets of the data with two other methods that have often been used
in previous studies (SME and MOOG). The SPC and SME results, both based on
comparisons between synthetic spectra and actual spectra, show strong
correlations between temperature, [Fe/H], and log g when solving for all three
quantities simultaneously. In contrast the MOOG results, based on a more
traditional curve-of-growth approach, show no such correlations. To combat the
correlations and improve the accuracy of the temperatures and metallicities, we
repeat the SPC analysis with a constraint on log g based on the mean stellar
density that can be derived from the analysis of the transit light curves.
Previous studies that have not taken advantage of this constraint have been
subject to systematic errors in the stellar masses and radii of up to 20% and
10%, respectively, which can be larger than other observational uncertainties,
and which also cause systematic errors in the planetary mass and radius.
","[{""version"":""v1"",""created"":""Mon, 6 Aug 2012 20:01:03 GMT""},{""version"":""v2"",""created"":""Thu, 16 Aug 2012 16:09:20 GMT""}]","2015-06-11"
"1208.1269","Stella Offner","Stella S. R. Offner","Dust Continuum Observations of Protostars: Constraining Properties with
  Simulations","4 pages, 2 figures; to appear in The Labyrinth of Star Formation,
  (eds.) D. Stamatellos, S. Goodwin, and D. Ward-Thompson, Springer, in press",,,,"astro-ph.SR","http://arxiv.org/licenses/nonexclusive-distrib/1.0/","  The properties of unresolved protostars and their local environment (e.g.,
disk, envelope and outflow characteristics) are frequently inferred from
spectral energy distributions (SEDs) through comparison with idealized model
SEDs. However, if it is not possible to image a source and its environment
directly, it is difficult to constrain and evaluate the accuracy of these
derived properties. In this proceeding, I present a brief overview of the
reliability of SED modeling by analyzing dust continuum synthetic observations
of realistic simulations.
","[{""version"":""v1"",""created"":""Mon, 6 Aug 2012 20:02:27 GMT""}]","2012-08-08"
"1208.1270","Laszlo Gyongyosi","Laszlo Gyongyosi, Sandor Imre","Properties of the Quantum Channel","Review paper: A tribute to the inventors of the various capacity
  formulas of quantum channels. 304 pages, 5 tables, 106 figures; added new
  section",,,,"quant-ph cs.IT math.IT","http://arxiv.org/licenses/nonexclusive-distrib/1.0/","  Quantum information processing exploits the quantum nature of information. It
offers fundamentally new solutions in the field of computer science and extends
the possibilities to a level that cannot be imagined in classical communication
systems. For quantum communication channels, many new capacity definitions were
developed in comparison to classical counterparts. A quantum channel can be
used to realize classical information transmission or to deliver quantum
information, such as quantum entanglement. In this paper we overview the
properties of the quantum communication channel, the various capacity measures
and the fundamental differences between the classical and quantum channels.
","[{""version"":""v1"",""created"":""Mon, 6 Aug 2012 20:22:06 GMT""},{""version"":""v2"",""created"":""Mon, 13 Aug 2012 18:44:35 GMT""},{""version"":""v3"",""created"":""Mon, 27 Aug 2012 17:22:23 GMT""},{""version"":""v4"",""created"":""Fri, 21 Sep 2012 11:27:54 GMT""},{""version"":""v5"",""created"":""Sat, 29 Sep 2012 16:52:50 GMT""}]","2012-10-02"
"1208.1271","Serkan Araci","Serkan Araci, Mehmet Acikgoz and Erdo\u{g}an \c{S}en","New Generalization of Eulerian polynomials and their applications","10 pages, submitted","J. Ana. Num. Theor. 2, No. 2, 59-63 (2014) 59","10.12785/jant/020206",,"math.NT","http://creativecommons.org/licenses/by/3.0/","  In the present paper, we introduce Eulerian polynomials with a and b
parameters and give the definition of them. By using the definition of
generating function for our polynomials, we derive some new identities in
Theory of Analytic Numbers. Also, we give relations between Eulerian
polynomials with a and b parameters, Bernstein polynomials, Poly-logarithm
function, Bernoulli numbers and Euler numbers. Moreover, we see that our
polynomials at a =-1 are related to Euler-Zeta function at negative inetegers.
Finally, we get Witt's formula for new generalization of Eulerian polynomials
which we express in this paper.
","[{""version"":""v1"",""created"":""Mon, 6 Aug 2012 20:22:24 GMT""},{""version"":""v2"",""created"":""Tue, 28 Aug 2012 13:30:18 GMT""},{""version"":""v3"",""created"":""Thu, 7 Feb 2013 18:58:36 GMT""}]","2019-07-04"
"1208.1272","Julia Chuzhoy","Julia Chuzhoy and Shi Li","A Polylogarithimic Approximation Algorithm for Edge-Disjoint Paths with
  Congestion 2",,,,,"cs.DS","http://arxiv.org/licenses/nonexclusive-distrib/1.0/","  In the Edge-Disjoint Paths with Congestion problem (EDPwC), we are given an
undirected n-vertex graph G, a collection M={(s_1,t_1),...,(s_k,t_k)} of demand
pairs and an integer c. The goal is to connect the maximum possible number of
the demand pairs by paths, so that the maximum edge congestion - the number of
paths sharing any edge - is bounded by c. When the maximum allowed congestion
is c=1, this is the classical Edge-Disjoint Paths problem (EDP).
  The best current approximation algorithm for EDP achieves an $O(\sqrt
n)$-approximation, by rounding the standard multi-commodity flow relaxation of
the problem. This matches the $\Omega(\sqrt n)$ lower bound on the integrality
gap of this relaxation. We show an $O(poly log k)$-approximation algorithm for
EDPwC with congestion c=2, by rounding the same multi-commodity flow
relaxation. This gives the best possible congestion for a sub-polynomial
approximation of EDPwC via this relaxation. Our results are also close to
optimal in terms of the number of pairs routed, since EDPwC is known to be hard
to approximate to within a factor of $\tilde{\Omega}((\log n)^{1/(c+1)})$ for
any constant congestion c. Prior to our work, the best approximation factor for
EDPwC with congestion 2 was $\tilde O(n^{3/7})$, and the best algorithm
achieving a polylogarithmic approximation required congestion 14.
","[{""version"":""v1"",""created"":""Mon, 6 Aug 2012 20:28:20 GMT""}]","2012-08-08"
"1208.1273","Fronefield Crawford","F. Crawford, K. Stovall, A. G. Lyne, B. W. Stappers, D. J. Nice, I. H.
  Stairs, P. Lazarus, J. W. T. Hessels, P. C. C. Freire, B. Allen, N. D. R.
  Bhat, S. Bogdanov, A. Brazier, F. Camilo, D. J. Champion, S. Chatterjee, I.
  Cognard, J. M. Cordes, J. S. Deneva, G. Desvignes, F. A. Jenet, V. M. Kaspi,
  B. Knispel, M. Kramer, J. van Leeuwen, D. R. Lorimer, R. Lynch, M. A.
  McLaughlin, S. M. Ransom, P. Scholz, X. Siemens, A. Venkataraman","Four Highly Dispersed Millisecond Pulsars Discovered in the Arecibo
  PALFA Galactic Plane Survey","23 pages, including 7 figures and 2 tables. Accepted to the
  Astrophysical Journal","Astrophys.J.757:90,2012","10.1088/0004-637X/757/1/90",,"astro-ph.SR astro-ph.GA","http://arxiv.org/licenses/nonexclusive-distrib/1.0/","  We present the discovery and phase-coherent timing of four highly dispersed
millisecond pulsars (MSPs) from the Arecibo PALFA Galactic plane survey: PSRs
J1844+0115, J1850+0124, J1900+0308, and J1944+2236. Three of the four pulsars
are in binary systems with low-mass companions, which are most likely white
dwarfs, and which have orbital periods on the order of days. The fourth pulsar
is isolated. All four pulsars have large dispersion measures (DM > 100 pc
cm-3), are distant (> 3.4 kpc), faint at 1.4 GHz (< 0.2 mJy), and are fully
recycled (with spin periods P between 3.5 and 4.9 ms). The three binaries also
have very small orbital eccentricities, as expected for tidally circularized,
fully recycled systems with low-mass companions. These four pulsars have DM/P
ratios that are among the highest values for field MSPs in the Galaxy. These
discoveries bring the total number of confirmed MSPs from the PALFA survey to
fifteen. The discovery of these MSPs illustrates the power of PALFA for finding
weak, distant MSPs at low-Galactic latitudes. This is important for accurate
estimates of the Galactic MSP population and for the number of MSPs that the
Square Kilometer Array can be expected to detect.
","[{""version"":""v1"",""created"":""Mon, 6 Aug 2012 20:33:30 GMT""}]","2015-06-11"
"1208.1274","Jian Liu","Jian Liu, M. Kareev, D. Meyers, B. Gray, P. Ryan, J. W. Freeland, J.
  Chakhalian","Metal-insulator transition and orbital reconstruction in Mott quantum
  wells of NdNiO$_{3}$",,,"10.1103/PhysRevLett.109.107402",,"cond-mat.str-el","http://arxiv.org/licenses/nonexclusive-distrib/1.0/","  The metal-insulator transition (MIT) and the underlying electronic and
orbital structure in $e_{g}^{1}$ quantum wells based on NdNiO$_{3}$ was
investigated by d.c. transport and resonant soft x-ray absorption spectroscopy.
By comparing quantum wells of the same dimension but with two different
confinement structures, we explicitly demonstrate that the quantum well
boundary condition of correlated electrons is critical to selecting the
many-body ground state. In particular, the long-range orderings and the MIT are
found to be strongly enhanced under quantum confinement by sandwiching
NdNiO$_{3}$ with the wide-gap dielectric LaAlO$_{3}$, while they are suppressed
when one of the interfaces is replaced by a surface (interface with vacuum).
Resonant spectroscopy reveals that the reduced charge fluctuations in the
sandwich structure are supported by the enhanced propensity to charge ordering
due to the suppressed $e_g$ orbital splitting when interfaced with the
confining LaAlO$_{3}$ layer.
","[{""version"":""v1"",""created"":""Mon, 6 Aug 2012 20:35:21 GMT""}]","2015-06-11"
"1208.1275","Mark Newman","Raj Rao Nadakuditi and M. E. J. Newman","Spectra of random graphs with arbitrary expected degrees","14 pages, 5 figures","Phys. Rev. E 87, 012803 (2013)","10.1103/PhysRevE.87.012803",,"cs.SI cond-mat.stat-mech physics.soc-ph","http://arxiv.org/licenses/nonexclusive-distrib/1.0/","  We study random graphs with arbitrary distributions of expected degree and
derive expressions for the spectra of their adjacency and modularity matrices.
We give a complete prescription for calculating the spectra that is exact in
the limit of large network size and large vertex degrees. We also study the
effect on the spectra of hubs in the network, vertices of unusually high
degree, and show that these produce isolated eigenvalues outside the main
spectral band, akin to impurity states in condensed matter systems, with
accompanying eigenvectors that are strongly localized around the hubs. We also
give numerical results that confirm our analytic expressions.
","[{""version"":""v1"",""created"":""Mon, 6 Aug 2012 20:36:02 GMT""}]","2013-02-04"
"1208.1276","Jos\'e Su\'arez-Vargas","Jos\'e J. Su\'arez-Vargas, Bicky A. M\'arquez, Jorge A. Gonz\'alez","Highly-complex optical signal generation using electro-optical systems
  with non-linear, non-invertible transmission functions","4 pages, 5 figures. To appear in Applied Physics Letters (August
  2012)","Appl. Phys. Lett. 101, 071116 (2012)","10.1063/1.4747151",,"nlin.CD physics.optics","http://arxiv.org/licenses/nonexclusive-distrib/1.0/","  We present a scheme whereby a static non-linear, non-invertible transmission
function performed by the electro-optic Mach-Zehnder modulator produces highly
complex optical chaos. The scheme allows the deterministic transformation of
low-dimensional band-limited chaotic signals into much higher-dimensional
structures with broadband spectra and without using any delay elements or
feedback. Standard benchmark tests show that all the considered complexity
indices are highly increased due to this transformation in a controlled
fashion. This mechanism allows the design of simple optoelectronic delayed
oscillators with extremely complex chaotic output.
","[{""version"":""v1"",""created"":""Mon, 6 Aug 2012 20:40:02 GMT""}]","2012-08-22"
"1208.1277","Robert Kitt","Robert Kitt","Economic decision making: application of the theory of complex systems","Will appear as a chapter in ""Chaos Theory in Politics"", eds Santo
  Banerjee, S.Sule Ercetin, A.Tekin by Spinger",,"10.1007/978-94-017-8691-1_4",,"q-fin.GN physics.soc-ph","http://arxiv.org/licenses/nonexclusive-distrib/1.0/","  In this chapter the complex systems are discussed in the context of economic
and business policy and decision making. It will be showed and motivated that
social systems are typically chaotic, non-linear and/or non-equilibrium and
therefore complex systems. It is discussed that the rapid change in global
consumer behaviour is underway, that further increases the complexity in
business and management. For policy making under complexity, following
principles are offered: openness and international competition, tolerance and
variety of ideas, self-reliability and low dependence on external help. The
chapter contains four applications that build on the theoretical motivation of
complexity in social systems. The first application demonstrates that small
economies have good prospects to gain from the global processes underway, if
they can demonstrate production flexibility, reliable business ethics and good
risk management. The second application elaborates on and discusses the
opportunities and challenges in decision making under complexity from macro and
micro economic perspective. In this environment, the challenges for corporate
management are being also permanently changed: the balance between short term
noise and long term chaos whose attractor includes customers, shareholders and
employees must be found. The emergence of chaos in economic relationships is
demonstrated by a simple system of differential equations that relate the
stakeholders described above. The chapter concludes with two financial
applications: about debt and risk management. The non-equilibrium economic
establishment leads to additional problems by using excessive borrowing;
unexpected downturns in economy can more easily kill companies. Finally, the
demand for quantitative improvements in risk management is postulated.
","[{""version"":""v1"",""created"":""Mon, 6 Aug 2012 20:45:18 GMT""},{""version"":""v2"",""created"":""Sat, 13 Apr 2013 17:52:06 GMT""}]","2015-03-20"
"1208.1278","Robert Harron","Robert Harron and Antonio Lei","Iwasawa theory for symmetric powers of CM modular forms at non-ordinary
  primes","Submitted. 24 pages. Comments welcome!","Journal de th\'eorie des nombres de Bordeaux, 26 no. 3 (2014), p.
  673-707","10.5802/jtnb.885",,"math.NT","http://arxiv.org/licenses/nonexclusive-distrib/1.0/","  Let f be a cuspidal newform with complex multiplication (CM) and let p be an
odd prime at which f is non-ordinary. We construct admissible p-adic
L-functions for the symmetric powers of f, thus verifying general conjectures
of Dabrowski and Panchishkin in this special case. We also construct their
""mixed"" plus and minus counterparts and prove an analogue of Pollack's
decomposition of the admissible p-adic L-functions into mixed plus and minus
p-adic L-functions. On the arithmetic side, we define corresponding mixed plus
and minus Selmer groups. We unite the arithmetic with the analytic by first
formulating the Main Conjecture of Iwasawa Theory relating the plus and minus
Selmer groups with the plus and minus p-adic L-functions, and then proving the
exceptional zero conjecture for the admissible p-adic L-functions. The latter
result takes advantage of recent work of Benois, while the former uses recent
work of the second author, as well as the main conjecture of Mazur-Wiles.
","[{""version"":""v1"",""created"":""Mon, 6 Aug 2012 20:55:10 GMT""}]","2015-10-23"
"1208.1279","Olena Linnyk","O. Linnyk, W. Cassing, J. Manninen, E. L. Bratkovskaya, P. B.
  Gossiaux, J. Aichelin, T. Song, C. M. Ko","Dilepton production in proton-proton and Pb+Pb collisions at
  sqrt(s_NN)=2.76 TeV","16 pages, 10 figures","Phys. Rev. C 87, 014905 (2013)","10.1103/PhysRevC.87.014905",,"nucl-th nucl-ex","http://arxiv.org/licenses/nonexclusive-distrib/1.0/","  We study e^+e^- pair production in proton-proton and central Pb+Pb collisions
at sqrt(s_NN)=2.76 TeV within two models: an extended statistical hadronization
model (SHM) and the Parton-Hadron-String Dynamics (PHSD) transport approach. We
find that the PHSD calculations roughly agree with the dilepton spectrum from
hadronic sources with the 'cocktail' estimates from the statistical
hadronization model matched to available data at LHC energies. The dynamical
simulations within the PHSD show a moderate increase of the low mass dilepton
yield essentially due to the in-medium modification of the rho-meson.
Furthermore, pronounced traces of the partonic degrees of freedom are found in
the PHSD results in the intermediate mass regime. The dilepton production from
the strongly interacting quark-gluon plasma (sQGP) exceeds that from the
semi-leptonic decays of open charm and bottom mesons. Additionally, we observe
that a transverse momentum cut of 1 GeV/c further suppresses the relative
contribution of the heavy meson decays to the dilepton yield, such that the
sQGP radiation strongly dominates the spectrum for masses from 1 to 3 GeV,
allowing a closer look at the electromagnetic emissivity of the partonic plasma
in the early phase of Pb+Pb collisions.
","[{""version"":""v1"",""created"":""Mon, 6 Aug 2012 20:55:34 GMT""}]","2013-01-28"
"1208.1280","Michael Shara","Michael M. Shara, Trisha Mizusawa, Peter Wehinger, David Zurek,
  Christopher D. Martin, James D. Neill, Karl Forster and Mark Seibert","AT Cnc: A Second Dwarf Nova with a Classical Nova Shell","17 pages, 6 figures, submitted to AJ. arXiv admin note: text overlap
  with arXiv:1205.3531",,"10.1088/0004-637X/758/2/121",,"astro-ph.SR","http://arxiv.org/licenses/nonexclusive-distrib/1.0/","  We are systematically surveying all known and suspected Z Cam-type dwarf
novae for classical nova shells. This survey is motivated by the discovery of
the largest known classical nova shell, which surrounds the archetypal dwarf
nova Z Camelopardalis. The Z Cam shell demonstrates that at least some dwarf
novae must have undergone classical nova eruptions in the past, and that at
least some classical novae become dwarf novae long after their nova
thermonuclear outbursts, in accord with the hibernation scenario of cataclysmic
binaries. Here we report the detection of a fragmented ""shell"", 3 arcmin in
diameter, surrounding the dwarf nova AT Cancri. This second discovery
demonstrates that nova shells surrounding Z Cam-type dwarf novae cannot be very
rare. The shell geometry is suggestive of bipolar, conical ejection seen nearly
pole-on. A spectrum of the brightest AT Cnc shell knot is similar to that of
the ejecta of the classical nova GK Per, and of Z Cam, dominated by [NII]
emission. Galex FUV imagery reveals a similar-sized, FUV-emitting shell. We
determine a distance of 460 pc to AT Cnc, and an upper limit to its ejecta mass
of ~ 5 x 10^{-5} Msun, typical of classical novae.
","[{""version"":""v1"",""created"":""Mon, 6 Aug 2012 21:00:19 GMT""}]","2015-06-11"
"1208.1281","Miguel G. Echevarria","Miguel G. Echevarria, Ahmad Idilbi, Andreas Sch\""afer and Ignazio
  Scimemi","Model Independent Evolution of Transverse Momentum Dependent
  Distribution Functions (TMDs) at NNLL","To appear in EPJC. 17 pages, 7 figures",,"10.1140/epjc/s10052-013-2636-y",,"hep-ph","http://arxiv.org/licenses/nonexclusive-distrib/1.0/","  We discuss the evolution of the eight leading twist transverse momentum
dependent parton distribution functions, which turns out to be universal and
spin independent. By using the highest order perturbatively calculable
ingredients at our disposal, we perform the resummation of the large logarithms
that appear in the evolution kernel of transverse momentum distributions up to
next-to-next-to-leading logarithms (NNLL), thus obtaining an expression for the
kernel with highly reduced model dependence. Our results can also be obtained
using the standard CSS approach when a particular choice of the $b^*$
prescription is used. In this sense, and while restricted to the perturbative
domain of applicability, we consider our results as a ""prediction"" of the
correct value of $b_{\rm max}$ which is very close to $1.5 {\rm GeV}^{-1}$. We
explore under which kinematical conditions the effects of the non-perturbative
region are negligible, and hence the evolution of transverse momentum
distributions can be applied in a model independent way. The application of the
kernel is illustrated by considering the unpolarized transverse momentum
dependent parton distribution function and the Sivers function.
","[{""version"":""v1"",""created"":""Mon, 6 Aug 2012 21:03:03 GMT""},{""version"":""v2"",""created"":""Wed, 20 Feb 2013 14:55:57 GMT""},{""version"":""v3"",""created"":""Mon, 22 Jul 2013 22:23:32 GMT""},{""version"":""v4"",""created"":""Thu, 31 Oct 2013 15:55:00 GMT""}]","2015-06-11"
"1208.1282","Riccardo de Sangro","The BABAR Collaboration","Measurement of the Time-Dependent CP Asymmetry of Partially
  Reconstructed B0->D*+D*- Decays","17 pages, 7 figures, submitted to Physical Review D",,"10.1103/PhysRevD.86.112006","SLAC-PUB-15205","hep-ex","http://arxiv.org/licenses/nonexclusive-distrib/1.0/","  We present a new measurement of the time-dependent CP asymmetry of B0->D*+D*-
decays using (471+-5) million BBbar pairs collected with the BaBar detector at
the PEP-II B Factory at the SLAC National Accelerator Laboratory. Using the
technique of partial reconstruction, we measure the time-dependent CP asymmetry
parameters S=-0.34+-0.12+-0.05$ and C=+0.15+-0.09+-0.04. Using the value for
the CP-odd fraction R_perp=0.158+-0.028+-0.006, previously measured by BaBar
with fully reconstructed B0->D*+D*- events, we extract the CP-even components
S+=-0.49+-0.18+-0.07+-0.04 and C+=+0.15+-0.09+-0.04. In each case, the first
uncertainty is statistical and the second is systematic; the third uncertainty
on S+ is the contribution from the uncertainty on R_perp. The measured value of
the CP-even component S+ is consistent with the value of sin(2Beta) measured in
b->(ccbar)s transitions, and with the Standard Model expectation of small
penguin contributions.
","[{""version"":""v1"",""created"":""Mon, 6 Aug 2012 21:07:31 GMT""},{""version"":""v2"",""created"":""Wed, 31 Oct 2012 23:07:40 GMT""}]","2013-05-30"
