"1208.3554","Colin Reid","Colin D. Reid","The profinite completion of a group localised at a subgroup","Superseded by http://arxiv.org/abs/1509.00156",,,,"math.GR","http://arxiv.org/licenses/nonexclusive-distrib/1.0/","  Let $G$ be a group and let $K$ be a commensurated subgroup of $G$. Then there
is a totally disconnected, locally compact (t.d.l.c.) group $\hat{G}_K$ that
contains the profinite completion of $K$ as an open compact subgroup and also
contains $G$ (modulo the finite residual of $K$) as a dense subgroup. Moreover,
given an arbitrary group $G$, then every t.d.l.c. group containing an image of
$G$ as a dense subgroup can be realised as a quotient of $\hat{G}_K$ for some
commensurated subgroup $K$.
","[{""version"":""v1"",""created"":""Fri, 17 Aug 2012 08:32:18 GMT""},{""version"":""v2"",""created"":""Mon, 8 Oct 2012 02:20:58 GMT""},{""version"":""v3"",""created"":""Wed, 2 Sep 2015 01:26:56 GMT""}]","2015-09-03"
"1208.3555","Lingzhou Xue","Lingzhou Xue, Hui Zou, Tianxi Cai","Nonconcave penalized composite conditional likelihood estimation of
  sparse Ising models","Published in at http://dx.doi.org/10.1214/12-AOS1017 the Annals of
  Statistics (http://www.imstat.org/aos/) by the Institute of Mathematical
  Statistics (http://www.imstat.org)","Annals of Statistics 2012, Vol. 40, No. 3, 1403-1429","10.1214/12-AOS1017","IMS-AOS-AOS1017","math.ST stat.TH","http://arxiv.org/licenses/nonexclusive-distrib/1.0/","  The Ising model is a useful tool for studying complex interactions within a
system. The estimation of such a model, however, is rather challenging,
especially in the presence of high-dimensional parameters. In this work, we
propose efficient procedures for learning a sparse Ising model based on a
penalized composite conditional likelihood with nonconcave penalties.
Nonconcave penalized likelihood estimation has received a lot of attention in
recent years. However, such an approach is computationally prohibitive under
high-dimensional Ising models. To overcome such difficulties, we extend the
methodology and theory of nonconcave penalized likelihood to penalized
composite conditional likelihood estimation. The proposed method can be
efficiently implemented by taking advantage of coordinate-ascent and
minorization--maximization principles. Asymptotic oracle properties of the
proposed method are established with NP-dimensionality. Optimality of the
computed local solution is discussed. We demonstrate its finite sample
performance via simulation studies and further illustrate our proposal by
studying the Human Immunodeficiency Virus type 1 protease structure based on
data from the Stanford HIV drug resistance database. Our statistical learning
results match the known biological findings very well, although no prior
biological information is used in the data analysis procedure.
","[{""version"":""v1"",""created"":""Fri, 17 Aug 2012 08:50:54 GMT""}]","2012-08-20"
"1208.3556","Karel Lemr","Karel Lemr and Anton\'in \v{C}ernoch","Linear-optical programmable quantum router","4 pages, 3 figures","Opt. Comm. 300, 282-285 (2013)","10.1016/j.optcom.2013.02.052",,"quant-ph","http://arxiv.org/licenses/nonexclusive-distrib/1.0/","  This paper presents a scheme for linear-optical implementation of a
programmable quantum router. Polarization encoded photon qubit is coherently
routed to various spatial modes according to the state of several control
qubits. In our implementation, the polarization state of the signal photon does
not change under the routing operation. We also discuss generalization of the
scheme that would allow to obtain signal dependent routing.
","[{""version"":""v1"",""created"":""Fri, 17 Aug 2012 09:08:31 GMT""}]","2013-07-01"
"1208.3557","Dr Brij Gupta","B. B. Gupta, R. C. Joshi, Manoj Misra","Distributed Denial of Service Prevention Techniques","ISSN: 1793-8198","International Journal of Computer and Electrical Engineering
  (IJCEE), vol. 2, number 2, pp. 268-276, 2010",,,"cs.CR","http://arxiv.org/licenses/nonexclusive-distrib/1.0/","  The significance of the DDoS problem and the increased occurrence,
sophistication and strength of attacks has led to the dawn of numerous
prevention mechanisms. Each proposed prevention mechanism has some unique
advantages and disadvantages over the others. In this paper, we present a
classification of available mechanisms that are proposed in literature on
preventing Internet services from possible DDoS attacks and discuss the
strengths and weaknesses of each mechanism. This provides better understanding
of the problem and enables a security administrator to effectively equip his
arsenal with proper prevention mechanisms for fighting against DDoS threat.
","[{""version"":""v1"",""created"":""Fri, 17 Aug 2012 09:09:55 GMT""}]","2012-08-20"
"1208.3558","Gil R. Cavalcanti","Gil R. Cavalcanti","Reduced holonomy and Hodge theory","This paper was incorporated into arxiv:1203.0493v4",,,,"math.DG","http://arxiv.org/licenses/nonexclusive-distrib/1.0/","  We develop Hodge theory for a Riemannian manifold $(M,g)$ with a background
closed 3-form, H. Precisely, we prove that if the metric connections with
torsion $\pm H$ have holonomy groups $G_\pm$, then the $d^H$-Laplacian
preserves the irreducible representations of the Lie algebras of the holonomy
groups on the space of forms.
","[{""version"":""v1"",""created"":""Fri, 17 Aug 2012 09:14:08 GMT""},{""version"":""v2"",""created"":""Mon, 9 Sep 2013 11:05:33 GMT""}]","2013-09-10"
"1208.3559","D. Cooley","D. Cooley, S. R. Sain","Discussion of ""Statistical Modeling of Spatial Extremes"" by A. C.
  Davison, S. A. Padoan and M. Ribatet","Published in at http://dx.doi.org/10.1214/12-STS376A the Statistical
  Science (http://www.imstat.org/sts/) by the Institute of Mathematical
  Statistics (http://www.imstat.org)","Statistical Science 2012, Vol. 27, No. 2, 187-188","10.1214/12-STS376A","IMS-STS-STS376A","stat.ME","http://arxiv.org/licenses/nonexclusive-distrib/1.0/","  Discussion of ""Statistical Modeling of Spatial Extremes"" by A. C. Davison, S.
A. Padoan and M. Ribatet [arXiv:1208.3378].
","[{""version"":""v1"",""created"":""Fri, 17 Aug 2012 09:42:28 GMT""}]","2012-08-20"
"1208.3560","George Hobbs","G. Hobbs, W. Coles, R. N. Manchester, M. J. Keith, R. M. Shannon, D.
  Chen, M. Bailes, N. D. R. Bhat, S. Burke-Spolaor, D. Champion, A. Chaudhary,
  A. Hotan, J. Khoo, J. Kocz, Y. Levin, S. Oslowski, B. Preisig, V. Ravi, J. E.
  Reynolds, J. Sarkissian, W. van Straten, J. P. W. Verbiest, D. Yardley, X. P.
  You","Development of a pulsar-based timescale","Accepted for publication in MNRAS",,"10.1111/j.1365-2966.2012.21946.x",,"astro-ph.IM astro-ph.SR","http://arxiv.org/licenses/nonexclusive-distrib/1.0/","  Using observations of pulsars from the Parkes Pulsar Timing Array (PPTA)
project we develop the first pulsar-based timescale that has a precision
comparable to the uncertainties in international atomic timescales. Our
ensemble of pulsars provides an Ensemble Pulsar Scale (EPS) analogous to the
free atomic timescale Echelle Atomique Libre (EAL). The EPS can be used to
detect fluctuations in atomic timescales and therefore can lead to a new
realisation of Terrestrial Time, TT(PPTA11). We successfully follow features
known to affect the frequency of the International Atomic Timescale (TAI) and
we find marginally significant differences between TT(PPTA11) and TT(BIPM11).
We discuss the various phenomena that lead to a correlated signal in the pulsar
timing residuals and therefore limit the stability of the pulsar timescale.
","[{""version"":""v1"",""created"":""Fri, 17 Aug 2012 09:49:27 GMT""}]","2015-06-11"
"1208.3561","Alon Gonen","Alon Gonen, Sivan Sabato, Shai Shalev-Shwartz","Efficient Active Learning of Halfspaces: an Aggressive Approach","Full version of: Gonen, Sabato and Shalev-Shwartz, ""Efficient Active
  Learning of Halfspaces: an Aggressive Approach"", ICML 2013","Journal of Machine Learning Research, 14(Sep):2487-2519, 2013",,,"cs.LG","http://arxiv.org/licenses/nonexclusive-distrib/1.0/","  We study pool-based active learning of half-spaces. We revisit the aggressive
approach for active learning in the realizable case, and show that it can be
made efficient and practical, while also having theoretical guarantees under
reasonable assumptions. We further show, both theoretically and experimentally,
that it can be preferable to mellow approaches. Our efficient aggressive active
learner of half-spaces has formal approximation guarantees that hold when the
pool is separable with a margin. While our analysis is focused on the
realizable setting, we show that a simple heuristic allows using the same
algorithm successfully for pools with low error as well. We further compare the
aggressive approach to the mellow approach, and prove that there are cases in
which the aggressive approach results in significantly better label complexity
compared to the mellow approach. We demonstrate experimentally that substantial
improvements in label complexity can be achieved using the aggressive approach,
for both realizable and low-error settings.
","[{""version"":""v1"",""created"":""Fri, 17 Aug 2012 09:49:31 GMT""},{""version"":""v2"",""created"":""Wed, 19 Dec 2012 15:38:37 GMT""},{""version"":""v3"",""created"":""Sat, 25 May 2013 19:23:14 GMT""}]","2015-03-20"
"1208.3562","Joseph Conlon","Michele Cicoli, Joseph P. Conlon, Fernando Quevedo","Dark Radiation in LARGE Volume Models","6 pages; v2. refs updated",,"10.1103/PhysRevD.87.043520","DAMTP-2012-59","hep-ph astro-ph.CO hep-th","http://arxiv.org/licenses/nonexclusive-distrib/1.0/","  We consider reheating driven by volume modulus decays in the LARGE Volume
Scenario. Such reheating always generates non-zero dark radiation through the
decays to the axion partner, while the only competitive visible sector decays
are Higgs pairs via the Giudice-Masiero term. In the framework of sequestered
models where the cosmological moduli problem is absent, the simplest model with
a shift-symmetric Higgs sector generates 1.56 < N_{eff} - N_{eff,SM} < 1.74.
For more general cases, the known experimental bounds on N_{eff} strongly
constrain the parameters and matter content of the models.
","[{""version"":""v1"",""created"":""Fri, 17 Aug 2012 10:00:00 GMT""},{""version"":""v2"",""created"":""Fri, 21 Sep 2012 16:10:38 GMT""}]","2013-03-14"
"1208.3563","Tetsutaro Higaki","Tetsutaro Higaki, Fuminobu Takahashi","Dark Radiation and Dark Matter in Large Volume Compactifications","27 pages, 4 figures; version 3: version published in JHEP",,"10.1007/JHEP11(2012)125","RIKEN-MP-53; TU-917","hep-ph astro-ph.CO hep-th","http://arxiv.org/licenses/nonexclusive-distrib/1.0/","  We argue that dark radiation is naturally generated from the decay of the
overall volume modulus in the LARGE volume scenario. We consider both
sequestered and non-sequestered cases, and find that the axionic superpartner
of the modulus is produced by the modulus decay and it can account for the dark
radiation suggested by observations, while the modulus decay through the
Giudice-Masiero term gives the dominant contribution to the total decay rate.
In the sequestered case, the lightest supersymmetric particles produced by the
modulus decay can naturally account for the observed dark matter density. In
the non-sequestered case, on the other hand, the supersymmetric particles are
not produced by the modulus decay, since the soft masses are of order the heavy
gravitino mass. The QCD axion will then be a plausible dark matter candidate.
","[{""version"":""v1"",""created"":""Fri, 17 Aug 2012 10:00:02 GMT""},{""version"":""v2"",""created"":""Thu, 30 Aug 2012 17:54:59 GMT""},{""version"":""v3"",""created"":""Thu, 22 Nov 2012 05:10:28 GMT""}]","2015-06-11"
"1208.3564","Yuki Okura","Yuki Okura, Toshifumi Futamase","Elliptical Weighted HOLICs for Weak Lensing Shear Measurement
  part3:Random Count Noise Effect for Image's Moments in Weak Lensing Analysis","44pages, 20figures, submitted for ApJ",,"10.1088/0004-637X/771/1/37",,"astro-ph.IM astro-ph.CO","http://arxiv.org/licenses/nonexclusive-distrib/1.0/","  This is the third paper on the improvements of systematic errors in our weak
lensing analysis using an elliptical weight function, called E-HOLICs. In the
previous papers we have succeeded in avoiding error which depends on
ellipticity of background image. In this paper, we investigate the systematic
error which depends on signal to noise ratio of background image. We find that
the origin of the error is the random count noise which comes from Poisson
noise of sky counts. Random count noise makes additional moments and centroid
shift error, and those 1st orders are canceled in averaging, but 2nd orders are
not canceled. We derived the equations which corrects these effects in
measuring moments and ellipticity of the image and test their validity using
simulation image. We find that the systematic error becomes less than 1% in the
measured ellipticity for objects with $S/N>3$.
","[{""version"":""v1"",""created"":""Fri, 17 Aug 2012 10:06:16 GMT""}]","2015-06-11"
"1208.3565","Alexander Rudenko S.","A. D. Dolgov, I. B. Khriplovich, and A. S. Rudenko","Difference between radiative transition rates in atoms and antiatoms","5 pages, 5 figures","JETP Lett. 96 (2012) 421-423","10.1134/S0021364012190046",,"astro-ph.CO hep-ph","http://arxiv.org/licenses/nonexclusive-distrib/1.0/","  We demonstrate that CP violation results in a difference of the partial decay
rates of atoms and antiatoms. The magnitude of this difference is estimated.
","[{""version"":""v1"",""created"":""Fri, 17 Aug 2012 10:08:20 GMT""}]","2013-03-07"
"1208.3566","J\""urgen M\""uller","J\""urgen M\""uller and Siddhartha Sarkar","On p-groups of Gorenstein-Kulkarni type","34 pages",,,,"math.GR","http://arxiv.org/licenses/nonexclusive-distrib/1.0/","  A finite p-group is said to be of Gorenstein-Kulkarni type if the set of all
elements of non-maximal order is a maximal subgroup. 2-groups of
Gorenstein-Kulkarni type arise naturally in the study of group actions on
compact Riemann surfaces. In this paper, we proceed towards a classification of
p-groups of Gorenstein-Kulkarni type.
","[{""version"":""v1"",""created"":""Fri, 17 Aug 2012 10:12:07 GMT""}]","2012-08-20"
"1208.3567","Andrew Rushforth","D. E. Parkes, S. A. Cavill, A. T. Hindmarch, P. Wadley, F. McGee, C.
  R. Staddon, K. W. Edmonds, R. P. Campion, B. L. Gallagher and A. W. Rushforth","Non-volatile voltage control of magnetization and magnetic domain walls
  in magnetostrictive epitaxial thin films",,"Applied Physics Letters 101, 072402 (2012)","10.1063/1.4745789",,"cond-mat.mtrl-sci cond-mat.mes-hall","http://arxiv.org/licenses/nonexclusive-distrib/1.0/","  We demonstrate reproducible voltage induced non-volatile switching of the
magnetization in an epitaxial thin Fe81Ga19 film. Switching is induced at room
temperature and without the aid of an external magnetic field. This is achieved
by the modification of the magnetic anisotropy by mechanical strain induced by
a piezoelectric transducer attached to the layer. Epitaxial Fe81Ga19 is shown
to possess the favourable combination of cubic magnetic anisotropy and large
magnetostriction necessary to achieve this functionality with experimentally
accessible levels of strain. The switching of the magnetization proceeds by the
motion of magnetic domain walls, also controlled by the voltage induced strain.
","[{""version"":""v1"",""created"":""Fri, 17 Aug 2012 10:20:37 GMT""}]","2012-08-20"
"1208.3568","Asaf Shapira","Asaf Shapira, Benny Sudakov","Small Complete Minors Above the Extremal Edge Density",,,,,"math.CO cs.DM","http://arxiv.org/licenses/nonexclusive-distrib/1.0/","  A fundamental result of Mader from 1972 asserts that a graph of high average
degree contains a highly connected subgraph with roughly the same average
degree. We prove a lemma showing that one can strengthen Mader's result by
replacing the notion of high connectivity by the notion of vertex expansion.
  Another well known result in graph theory states that for every integer t
there is a smallest real c(t) so that every n-vertex graph with c(t)n edges
contains a K_t-minor. Fiorini, Joret, Theis and Wood conjectured that if an
n-vertex graph G has (c(t)+\epsilon)n edges then G contains a K_t-minor of
order at most C(\epsilon)log n. We use our extension of Mader's theorem to
prove that such a graph G must contain a K_t-minor of order at most
C(\epsilon)log n loglog n. Known constructions of graphs with high girth show
that this result is tight up to the loglog n factor.
","[{""version"":""v1"",""created"":""Fri, 17 Aug 2012 10:31:54 GMT""},{""version"":""v2"",""created"":""Sun, 19 May 2013 10:54:30 GMT""}]","2013-05-21"
"1208.3569","Gerardo Adesso","Peter Bowles, Madalin Guta, Gerardo Adesso","Asymptotically optimal quantum channel reversal for qudit ensembles and
  multimode Gaussian states","17 pages, 3 figures","New J. Phys. 14 (2012) 113041","10.1088/1367-2630/14/11/113041",,"quant-ph math-ph math.MP physics.data-an","http://arxiv.org/licenses/nonexclusive-distrib/1.0/","  We investigate the problem of optimally reversing the action of an arbitrary
quantum channel C which acts independently on each component of an ensemble of
n identically prepared d-dimensional quantum systems. In the limit of large
ensembles, we construct the optimal reversing channel R* which has to be
applied at the output ensemble state, to retrieve a smaller ensemble of m
systems prepared in the input state, with the highest possible rate m/n. The
solution is found by mapping the problem into the optimal reversal of Gaussian
channels on quantum-classical continuous variable systems, which is here solved
as well. Our general results can be readily applied to improve the
implementation of robust long-distance quantum communication. As an example, we
investigate the optimal reversal rate of phase flip channels acting on a
multi-qubit register.
","[{""version"":""v1"",""created"":""Fri, 17 Aug 2012 10:32:04 GMT""}]","2012-12-06"
"1208.3570","Darya Novopashina S","D. S. Novopashina, E. K. Apartsin, A. G. Venyaminova","Fluorecently labeled bionanotransporters of nucleic acid based on carbon
  nanotubes","http://www.ujp.bitp.kiev.ua","Ukrainian Journal of Physics, 2009, Vol. 54, no. 1-2, pp. 207-215",,,"q-bio.BM cond-mat.mtrl-sci physics.bio-ph","http://arxiv.org/licenses/nonexclusive-distrib/1.0/","  Here we propose the approach to design of the new type of hybrids of
oligonucleotides with fluorescein-functionalized single-walled carbon
nanotubes. The approach is based on stacking interactions of functionalized
nanotubes with pyrene residues in conjugates of oligonucleotides. The amino-
and fluorescein-modified single-walled carbon nanotubes were obtained, and
their physico-chemical properties were investigated. The effect of carbon
nanotubes functionalization type on the efficacy of sorption of pyrene
conjugates of oligonucleotides was examined. Proposed non-covalent hybrids of
fluorescein-labeled carbon nanotubes with oligonucleotides may be used for
intracellular transport of functional nucleic acids.
","[{""version"":""v1"",""created"":""Fri, 17 Aug 2012 10:32:53 GMT""}]","2015-03-13"
"1208.3571","Johan Segers","Johan Segers","Nonparametric Inference for Max-Stable Dependence","Published in at http://dx.doi.org/10.1214/12-STS376C the Statistical
  Science (http://www.imstat.org/sts/) by the Institute of Mathematical
  Statistics (http://www.imstat.org)","Statistical Science 2012, Vol. 27, No. 2, 193-196","10.1214/12-STS376C","IMS-STS-STS376C","stat.ME","http://arxiv.org/licenses/nonexclusive-distrib/1.0/","  Discussion of ""Statistical Modeling of Spatial Extremes"" by A. C. Davison, S.
A. Padoan and M. Ribatet [arXiv:1208.3378].
","[{""version"":""v1"",""created"":""Fri, 17 Aug 2012 10:38:21 GMT""}]","2012-08-20"
"1208.3572","Nikolaos Mavromatos","J. Bernabeu, N. E. Mavromatos, P. Villanueva-Perez","Consistent Probabilistic Description of the Neutral Kaon System","10 pages latex, non-trivial observations and clarifications made
  compared to previous version, concerning interpretation of results (relevant
  parametrization) which leads to agreement of time-dependent rates with those
  of WWA. References added. Matches version to appear in Phys. Lett. B",,"10.1016/j.physletb.2013.06.025","FTUV-12-0817; KCL-PH-TH/2012-33; LCTS/2012-16; CERN-TH-PH/2012-220","hep-ph quant-ph","http://arxiv.org/licenses/nonexclusive-distrib/1.0/","  The neutral Kaon system has both CP violation in the mass matrix and a
non-vanishing lifetime difference in the width matrix. This leads to an
effective Hamiltonian which is not a normal operator, with incompatible
(non-commuting) masses and widths. In the Weisskopf-Wigner Approach (WWA), by
diagonalizing the entire Hamiltonian, the unphysical non-orthogonal
""stationary"" states $K_{L,S}$ are obtained. These states have complex
eigenvalues whose real (imaginary) part does not coincide with the eigenvalues
of the mass (width) matrix. In this work we describe the system as an open
Lindblad-type quantum mechanical system due to Kaon decays. This approach, in
terms of density matrices for initial and final states, provides a consistent
probabilistic description, avoiding the standard problems because the width
matrix becomes a composite operator not included in the Hamiltonian. We
consider the dominant-decay channel to two pions, so that one of the Kaon
states with definite lifetime becomes stable. This new approach provides
results for the time dependent decay rates in agreement with those of the WWA.
","[{""version"":""v1"",""created"":""Fri, 17 Aug 2012 10:39:39 GMT""},{""version"":""v2"",""created"":""Fri, 5 Jul 2013 19:32:44 GMT""}]","2013-07-08"
"1208.3573","Marko  Huhtanen","Mikko Byckling and Marko Huhtanen","Preconditioning with direct approximate factoring of the inverse",,,,,"math.NA","http://arxiv.org/licenses/nonexclusive-distrib/1.0/","  To precondition a large and sparse linear system, two direct methods for
approximate factoring of the inverse are devised. The algorithms are fully
parallelizable and appear to be more robust than the iterative methods
suggested for the task. A method to compute one of the matrix subspaces
optimally is derived. Possessing a considerable amount of flexibility, these
approaches extend the approximate inverse preconditioning techniques in several
natural ways. Numerical experiments are given to illustrate the performance of
the preconditioners on a number of challenging benchmark linear systems.
","[{""version"":""v1"",""created"":""Fri, 17 Aug 2012 10:47:11 GMT""}]","2012-08-20"
"1208.3574","Benjamin Shaby","Benjamin Shaby, Brian J. Reich","Discussion of ""Statistical Modeling of Spatial Extremes"" by A. C.
  Davison, S. A. Padoan and M. Ribatet","Published in at http://dx.doi.org/10.1214/12-STS376D the Statistical
  Science (http://www.imstat.org/sts/) by the Institute of Mathematical
  Statistics (http://www.imstat.org)","Statistical Science 2012, Vol. 27, No. 2, 197-198","10.1214/12-STS376D","IMS-STS-STS376D","stat.ME","http://arxiv.org/licenses/nonexclusive-distrib/1.0/","  Discussion of ""Statistical Modeling of Spatial Extremes"" by A. C. Davison, S.
A. Padoan and M. Ribatet [arXiv:1208.3378].
","[{""version"":""v1"",""created"":""Fri, 17 Aug 2012 10:58:11 GMT""}]","2012-08-20"
"1208.3575","Jennifer Wadsworth","Darmesah Gabda, Ross Towe, Jennifer Wadsworth, Jonathan Tawn","Discussion of ""Statistical Modeling of Spatial Extremes"" by A. C.
  Davison, S. A. Padoan and M. Ribatet","Published in at http://dx.doi.org/10.1214/12-STS376B the Statistical
  Science (http://www.imstat.org/sts/) by the Institute of Mathematical
  Statistics (http://www.imstat.org)","Statistical Science 2012, Vol. 27, No. 2, 189-192","10.1214/12-STS376B","IMS-STS-STS376B","stat.ME","http://arxiv.org/licenses/nonexclusive-distrib/1.0/","  Discussion of ""Statistical Modeling of Spatial Extremes"" by A. C. Davison, S.
A. Padoan and M. Ribatet [arXiv:1208.3378].
","[{""version"":""v1"",""created"":""Fri, 17 Aug 2012 11:04:43 GMT""}]","2012-08-20"
"1208.3576","Mohammad Doomun","Zadia Codabux-Rossan, M. Razvi Doomun","AES CCMP Algorithm with N-Way Interleaved Cipher Block Chaining","18 pages, University of Mauritius Research Journal - Volume 15 - 2009",,,,"cs.CR","http://creativecommons.org/licenses/by-nc-sa/3.0/","  Nowadays, the increased use of battery-powered mobile appliances and the urge
to access time-sensitive data anytime anywhere has fuelled a high demand for
wireless networks. However, wireless networks are susceptible to intrusion and
security problems. There is an inherent need to secure the wireless data
communication to ensure the confidentiality, authenticity, integrity and non
repudiation of the data being exchanged. On the other hand, the computation and
the resultant energy consumption to achieve sufficient security can be high.
Encryption algorithms are generally computationally intensive, and consume a
significant amount of computing resources (such as CPU time, memory, and
battery power). Considering the limited resources on wireless devices, it is
crucial that security protocols be implemented efficiently. This manuscript
focuses on how energy consumption is impacted by the use of unoptimised
AES-CCMP algorithms and proposes an optimized AES CCMP algorithm using 2-way
interleaving that does not compromise the security of wireless communication
sessions. There is also analysis of the performance of AES (a.k.a. Rijndael) in
its AES-CCMP implementation. The 2-way interleaving technique is an
optimization of the CBC-MAC that is investigated using two performance metrics
(namely encryption time and throughput).
","[{""version"":""v1"",""created"":""Fri, 17 Aug 2012 11:12:58 GMT""}]","2012-08-20"
