"1208.3518","Jing Li","Jing Li","Perturbation analysis of the matrix equation X - \sum_{i=1}^m A_i^*
  X^{p_i} A_i = Q","18 pages",,,,"math.NA","http://arxiv.org/licenses/nonexclusive-distrib/1.0/","  Consider the nonlinear matrix equation
X-sum_{i=1}^{m}A_{i}^{*}X^{p_{i}}A_{i}=Q with p_{i}>0. Sufficient and necessary
conditions for the existence of positive definite solutions to the equation
with p_{i}>0 are derived. Two perturbation bounds for the unique solution to
the equation with 0<p_{i}<1 are evaluated. The backward error of an approximate
solution for the unique solution to the equation with 0<p_{i}<1 is given.
Explicit expressions of the condition number for the equation with 0<p_{i}<1
are obtained. The theoretical results are illustrated by numerical examples.
","[{""version"":""v1"",""created"":""Fri, 17 Aug 2012 01:38:11 GMT""}]","2012-08-20"
"1208.3519","Ajay D. Thakur","Pawan Kumar, M. Kar, Anup V. Sanchela, C. V. Tomy and Ajay D. Thakur","Nanostructured Zinc Oxide as a Prospective Room Temperature
  Thermoelectric Material","submitted to DAE SSPS 2012",,"10.1063/1.4791062",,"cond-mat.mtrl-sci cond-mat.mes-hall","http://arxiv.org/licenses/nonexclusive-distrib/1.0/","  Nanostructured Zinc oxide (ZnO) was synthesized via a ball milling for 10
hours using high energy planetary ball mill. Phase purity and homogeneity of
all the samples have been investigated by X-ray diffraction (XRD) and Field
Emission Scanning Electron Microscopy (FE-SEM). All the diffraction peaks can
be indexed to the hexagonal phase ZnO with hexagonal symmetry (space group
P63mc). Average crystallite size was observed to be 20 nm. There was a
remarkable suppression in thermal conductivity ({\kappa}) compared to the bulk
values by a factor of ~50 at room temperature. This suggests to the possibility
of using nanostructured ZnO as a prospective room temperature thermoelectric
material.
","[{""version"":""v1"",""created"":""Fri, 17 Aug 2012 01:57:19 GMT""}]","2015-06-11"
"1208.3520","Igor Solovyev","I. V. Solovyev, M. V. Valentyuk, and V. V. Mazurenko","Magnetic structure and ferroelectric activity in orthorhombic YMnO3:
  relative roles of magnetic symmetry breaking and atomic displacements","24 pages, 5 figures, 5 tables","Phys. Rev. B 86, 144406 (2012)","10.1103/PhysRevB.86.144406",,"cond-mat.mtrl-sci cond-mat.str-el","http://arxiv.org/licenses/nonexclusive-distrib/1.0/","  We discuss relative roles played by the magnetic inversion symmetry breaking
and the ferroelectric (FE) atomic displacements in the multiferroic state of
YMnO3. For these purposes we derive a realistic low-energy model, using results
of first-principles calculations and experimental parameters of the crystal
structure. Then, we solve this model in the Hartree-Fock approximation. We
argue that the multiferroic state in YMnO3 has a magnetic origin, and the
centrosymmetric Pbnm structure is formally sufficient for explaining details of
the noncentrosymmetric magnetic ground state. The relativistic spin-orbit
interaction lifts the degeneracy, caused by the frustration of isotropic
interactions, and stabilizes a twofold periodic magnetic state, which is
similar to the E-state apart from the spin canting. The noncentrosymmetric
atomic displacements in the P2_1nm phase reduce the spin canting, but do not
change the symmetry of the magnetic state. The effect of the P2_1nm distortion
on the FE polarization P_a is twofold: (i) it gives rise to ionic
contributions, associated with the Y and O sites; (ii) it affects the
electronic polarization, through the change of the spin canting. The relatively
small value of P_a, observed in the experiment, is caused by a partial
cancelation of the electronic and ionic contributions in the experimental
P2_1nm structure. Finally, we theoretically optimize the crystal structure, by
using the LSDA+U approach and assuming the collinear E-type alignment. We have
found that the agreement with the experimental data in this case is less
satisfactory and P_a is largely overestimated. Although the magnetic structure
can be formally tuned by varying the Coulomb repulsion U as a parameter,
apparently LSDA+U fails to reproduce some fine details of the experimental
structure, and the cancelation of different contributions in P_a does not
occur.
","[{""version"":""v1"",""created"":""Fri, 17 Aug 2012 02:12:48 GMT""}]","2012-10-12"
"1208.3521","Kei-Ichi Kondo","Kei-Ichi Kondo","A nonperturbative construction of massive Yang-Mills fields without
  Higgs fields","10 pages, no figure, sec.V is added, references updated, a version
  published in Phys.Rev.D",,"10.1103/PhysRevD.87.025008","CHIBA-EP-195","hep-th hep-ph","http://arxiv.org/licenses/nonexclusive-distrib/1.0/","  In order to understand the so-called decoupling solution for gluon and ghost
propagators in QCD, we give a nonperturbative construction of a massive vector
field describing a non-Abelian massive spin-one particle, which has the correct
physical degrees of freedom and is invariant under a modified
Becchi-Rouet-Stora-Tyutin transformation, in a massive Yang-Mills model without
the Higgs field, i.e., the Curci-Ferrari model. The resulting non-Abelian
massive vector boson field is written using a nonlinear but local
transformation from the original fields in the Curci-Ferrari model. As an
application, we write down a local mass term for the Yang-Mills field and a
dimension-two condensate, which are exactly invariant under the modified
Becchi-Rouet-Stora-Tyutin transformation, Lorentz transformation and color
rotation.
","[{""version"":""v1"",""created"":""Fri, 17 Aug 2012 02:54:02 GMT""},{""version"":""v2"",""created"":""Fri, 14 Sep 2012 07:10:13 GMT""},{""version"":""v3"",""created"":""Fri, 11 Jan 2013 12:34:39 GMT""}]","2015-06-11"
"1208.3522","Michele Cappellari","Michele Cappellari, Nicholas Scott, Katherine Alatalo, Leo Blitz,
  Maxime Bois, Frederic Bournaud, M. Bureau, Alison F. Crocker, Roger L.
  Davies, Timothy A. Davis, P. T. de Zeeuw, Pierre-Alain Duc, Eric Emsellem,
  Sadegh Khochfar, Davor Krajnovic, Harald Kuntschner, Richard M. McDermid,
  Raffaella Morganti, Thorsten Naab, Tom Oosterloo, Marc Sarzi, Paolo Serra,
  Anne-Marie Weijmans, Lisa M. Young","The Atlas3D project - XV. Benchmark for early-type galaxies scaling
  relations from 260 dynamical models: mass-to-light ratio, dark matter,
  Fundamental Plane and Mass Plane","35 pages, 18 figures, LaTeX. Accepted for publication in MNRAS.
  Includes a new data table and figures of all dynamical models. More
  information about our Atlas3D project is available at http://purl.org/atlas3d","Mon.Not.Roy.Astron.Soc. 432 (2013) 1709-1741","10.1093/mnras/stt562",,"astro-ph.CO","http://arxiv.org/licenses/nonexclusive-distrib/1.0/","  We study the volume-limited and nearly mass selected (stellar mass M>6*10^9
Msun) Atlas3D sample of 260 early-type galaxies. We construct detailed
axisymmetric dynamical models (JAM), which allow for orbital anisotropy,
include a dark matter halo, and reproduce in detail both the galaxy images and
the high-quality integral-field stellar kinematics. We derive accurate total
M/L and dark matter fractions f_DM, within a sphere of radius r=Re. We also
measure the stellar M/L and derive a median dark matter fraction f_DM=13%. We
find that the thin two-dimensional subset spanned by galaxies in the
(M_JAM,sigma_e,R_e) coordinates system, which we call the Mass Plane (MP) has
an observed rms scatter of 19% and an intrinsic one of 11%. The MP satisfies
the scalar virial relation M_JAM sigma_e^2 R_e within our tight errors.
However, the details of how both Re and sigma_e are determined are critical in
defining the precise deviation from the virial exponents. We revisit the
(M/L)-sigma_e relation, which describes most of the deviations between the MP
and the FP. The best-fitting relation is (M/L) sigma_e^0.72 (r-band). It
provides an upper limit to any systematic increase of the IMF mass
normalization with sigma_e. We study of the link between sigma_e and the
galaxies circular velocity V_circ within 1Re (where stars dominate) and find
the relation max(V_circ)~1.76*sigma_e, which has an observed scatter of 7%. The
accurate parameters described in this paper are used in the companion Paper XX
of this series to explore the variation of global galaxy properties, including
the IMF, on the projections of the MP. [Abridged]
","[{""version"":""v1"",""created"":""Fri, 17 Aug 2012 02:59:35 GMT""},{""version"":""v2"",""created"":""Wed, 27 Mar 2013 19:07:59 GMT""}]","2013-06-11"
"1208.3523","Michele Cappellari","Michele Cappellari, Richard M. McDermid, Katherine Alatalo, Leo Blitz,
  Maxime Bois, Frederic Bournaud, M. Bureau, Alison F. Crocker, Roger L.
  Davies, Timothy A. Davis, P. T. de Zeeuw, Pierre-Alain Duc, Eric Emsellem,
  Sadegh Khochfar, Davor Krajnovic, Harald Kuntschner, Raffaella Morganti,
  Thorsten Naab, Tom Oosterloo, Marc Sarzi, Nicholas Scott, Paolo Serra,
  Anne-Marie Weijmans, Lisa M. Young","The Atlas3D project - XX. Mass-size and mass-sigma distributions of
  early-type galaxies: bulge fraction drives kinematics, mass-to-light ratio,
  molecular gas fraction and stellar initial mass function","35 pages, 16 figure, LaTeX. Accepted for publication in MNRAS.
  Includes a new data table. More information about our Atlas3D project is
  available at http://purl.org/atlas3d","Mon.Not.Roy.Astron.Soc. 432 (2013) 1862-1893","10.1093/mnras/stt644",,"astro-ph.CO","http://arxiv.org/licenses/nonexclusive-distrib/1.0/","  We study the (M,sigma) and (M,Re) projections of the thin Mass Plane (MP)
(M,sigma,Re) which describes the distribution of the galaxy population. The
distribution of galaxy properties on the MP is characterized by: (i) a zone of
exclusion described by two power-laws joined by a break at M 3e10 Msun. This
results in a break in the mean M-sigma relation with Msigma^2.3 and M sigma^4.7
at small and large sigma respectively; (ii) a mass M 2e11 Msun which separates
a population dominated by flat fast rotator with disks and spiral galaxies at
lower masses, from one dominated by quite round slow rotators at larger masses;
(iii) below that mass the distribution of ETGs properties tends to be constant
along lines of constant sigma; (iv) it forms a parallel sequence with the
distribution of spiral galaxies; (v) at even lower masses, the distribution of
fast rotator ETGs and late spirals naturally extends to that of dwarf ETGs
(Sph) and dwarf irregulars (Im) respectively. We show via dynamical models that
sigma traces the bulge fraction, which drives the observed trends in M/L,
Hbeta, colour, IMF and molecular gas fraction. We interpret this as due to a
combination of two main effects: (i) an increase of the bulge fraction which
increases sigma and greatly enhances the likelihood for a galaxy to have its
star formation quenched, and (ii) dry merging, increasing galaxy mass along
lines of nearly constant sigma, while leaving the population unchanged.
[Abriged]
","[{""version"":""v1"",""created"":""Fri, 17 Aug 2012 02:59:48 GMT""},{""version"":""v2"",""created"":""Mon, 15 Apr 2013 17:20:47 GMT""}]","2013-06-11"
"1208.3524","Yogesh Virkar","Yogesh Virkar, Aaron Clauset","Power-law distributions in binned empirical data","Published in at http://dx.doi.org/10.1214/13-AOAS710 the Annals of
  Applied Statistics (http://www.imstat.org/aoas/) by the Institute of
  Mathematical Statistics (http://www.imstat.org)","Annals of Applied Statistics 2014, Vol. 8, No. 1, 89-119","10.1214/13-AOAS710","IMS-AOAS-AOAS710","physics.data-an physics.soc-ph stat.AP stat.ME","http://arxiv.org/licenses/nonexclusive-distrib/1.0/","  Many man-made and natural phenomena, including the intensity of earthquakes,
population of cities and size of international wars, are believed to follow
power-law distributions. The accurate identification of power-law patterns has
significant consequences for correctly understanding and modeling complex
systems. However, statistical evidence for or against the power-law hypothesis
is complicated by large fluctuations in the empirical distribution's tail, and
these are worsened when information is lost from binning the data. We adapt the
statistically principled framework for testing the power-law hypothesis,
developed by Clauset, Shalizi and Newman, to the case of binned data. This
approach includes maximum-likelihood fitting, a hypothesis test based on the
Kolmogorov--Smirnov goodness-of-fit statistic and likelihood ratio tests for
comparing against alternative explanations. We evaluate the effectiveness of
these methods on synthetic binned data with known structure, quantify the loss
of statistical power due to binning, and apply the methods to twelve real-world
binned data sets with heavy-tailed patterns.
","[{""version"":""v1"",""created"":""Fri, 17 Aug 2012 03:00:57 GMT""},{""version"":""v2"",""created"":""Mon, 14 Apr 2014 11:00:51 GMT""}]","2014-04-15"
"1208.3525","Hyunsoo Yang","Ajeesh M. Sahadevan, Ravi K. Tiwari, Gopinadhan Kalon, Charanjit S.
  Bhatia, Mark Saeys, and Hyunsoo Yang","Biaxial strain effect of spin dependent tunneling in MgO magnetic tunnel
  junctions",,"Applied Physics Letters 101, 042407 (2012)","10.1063/1.4738787",,"cond-mat.mtrl-sci cond-mat.mes-hall","http://arxiv.org/licenses/nonexclusive-distrib/1.0/","  We study the effect of strain on magnetic tunnel junctions (MTJ) induced by a
diamond like carbon (DLC) film. The junction resistance as well as the tunnel
magnetoresistance (TMR) reduces with the DLC film. Non-equilibrium Green's
function quantum transport calculations show that the application of biaxial
strain increases the conductance for both the parallel and anti-parallel
configurations. However, the conductance for the minority channel and for the
anti-parallel configuration is significantly more sensitive to strain, which
drastically increases transmission through a MgO tunnel barrier, therefore, the
TMR ratio decreases with biaxial strain.
","[{""version"":""v1"",""created"":""Fri, 17 Aug 2012 03:04:34 GMT""}]","2015-06-11"
"1208.3526","Hyunsoo Yang","Kulothungasagaran Narayanapillai, Mahdi Jamali, and Hyunsoo Yang","Observation of magnetocapacitance in ferromagnetic nanowires",,"Applied Physics Letters 101, 052401 (2012)","10.1063/1.4739848",,"cond-mat.mtrl-sci","http://arxiv.org/licenses/nonexclusive-distrib/1.0/","  The authors have investigated magnetic domain wall induced capacitance
variation as a tool for the detection of magnetic reversal in magnetic
nanowires for in-plane (NiFe) and out-of-plane (Co/Pd) magnetization
configurations. The switching fields in the capacitance measurements match with
that of the magnetoresistance measurements in the opposite sense. The origin of
the magnetocapacitance has been attributed to magnetoresistance. This
magnetocapacitance detection technique can be useful for magnetic domain wall
studies.
","[{""version"":""v1"",""created"":""Fri, 17 Aug 2012 03:20:26 GMT""}]","2015-06-11"
"1208.3527","Hyunsoo Yang","Mahdi Jamali, Kulothungasagaran Narayanapillai, Jae Hyun Kwon, and
  Hyunsoo Yang","Detection of domain wall eigenfrequency in infinity-shaped magnetic
  nanostructures","arXiv admin note: substantial text overlap with arXiv:1110.0113","Applied Physics Letters 101, 062401 (2012)","10.1063/1.4730997",,"cond-mat.mtrl-sci cond-mat.mes-hall","http://arxiv.org/licenses/nonexclusive-distrib/1.0/","  The dynamics of a magnetic infinity-shaped nanostructure has been
experimentally studied by two different techniques such as the sinusoidal
resonance excitation and the damped short pulse excitation to measure the
eigenfrequency of domain walls. Direct observation of the magnetic domain wall
nucleation has been measured in the frequency domain. Electrical measurements
of the domain wall dynamics in the frequency domain reveal the existence of
multi-eigenmodes for large excitation amplitudes. The time-resolved
measurements show that the frequency of the damped gyration is similar to that
of the frequency domain and coexistence of spin wave excitations.
","[{""version"":""v1"",""created"":""Fri, 17 Aug 2012 03:24:43 GMT""}]","2015-06-11"
"1208.3528","Andrei Derevianko","Andrei Derevianko, V. A. Dzuba, and V. V. Flambaum","Highly-charged ions as a basis of optical atomic clockwork of
  exceptional accuracy","5 pages, 3 figures","Phys. Rev. Lett. 109, 180801 (2012)","10.1103/PhysRevLett.109.180801",,"physics.atom-ph physics.optics quant-ph","http://arxiv.org/licenses/nonexclusive-distrib/1.0/","  We propose a novel class of atomic clocks based on highly charged ions. We
consider highly-forbidden laser-accessible transitions within the $4f^{12}$
ground-state configurations of highly charged ions. Our evaluation of
systematic effects demonstrates that these transitions may be used for building
exceptionally accurate atomic clocks which may compete in accuracy with
recently proposed nuclear clock.
","[{""version"":""v1"",""created"":""Fri, 17 Aug 2012 03:53:08 GMT""}]","2016-10-05"
"1208.3529","Daniel Stark","Daniel P. Stark, Matthew A. Schenker, Richard S. Ellis, Brant
  Robertson, Ross McLure, James Dunlop","Keck Spectroscopy of 3<z<7 Faint Lyman Break Galaxies: The Importance of
  Nebular Emission in Understanding the Specific Star Formation Rate and
  Stellar Mass Density","16 pages, 9 figures, submitted to ApJ",,"10.1088/0004-637X/763/2/129",,"astro-ph.CO","http://arxiv.org/licenses/nonexclusive-distrib/1.0/","  The physical properties inferred from the SEDs of z>3 galaxies have been
influential in shaping our understanding of early galaxy formation and the role
galaxies may play in cosmic reionization. Of particular importance is the
stellar mass density at early times which represents the integral of earlier
star formation. An important puzzle arising from the measurements so far
reported is that the specific star formation rates (sSFR) evolve far less
rapidly than expected in most theoretical models. Yet the observations
underpinning these results remain very uncertain, owing in part to the possible
contamination of rest-optical broadband light from strong nebular emission
lines. To quantify the contribution of nebular emission to broad-band fluxes,
we investigate the SEDs of 92 spectroscopically-confirmed galaxies in the
redshift range 3.8<z<5.0 chosen because the H-alpha line lies within the
Spitzer/IRAC 3.6 um filter. We demonstrate that the 3.6 um flux is
systematically in excess of that expected from stellar continuum, which we
derive by fitting the SED with population synthesis models. No such excess is
seen in a control sample at 3.1<z<3.6 in which there is no nebular
contamination in the IRAC filters. From the distribution of our 3.6 um flux
excesses, we derive an H-alpha equivalent width (EW) distribution. The mean
rest-frame H-alpha EW we infer at 3.8<z<5.0 (270 A) indicates that nebular
emission contributes at least 30% of the 3.6 um flux. Via our
empirically-derived EW distribution we correct the available stellar mass
densities and show that the sSFR evolves more rapidly at z>4 than previously
thought, supporting up to a 5x increase between z~2 and 7. Such a trend is much
closer to theoretical expectations. Given our findings, we discuss the
prospects for verifying quantitatively the nebular emission line strengths
prior to the launch of the James Webb Space Telescope.
","[{""version"":""v1"",""created"":""Fri, 17 Aug 2012 03:56:38 GMT""}]","2015-06-11"
"1208.3530","Haimonti Dutta","Haimonti Dutta, William Chan, Deepak Shankargouda, Manoj Pooleery,
  Axinia Radeva, Kyle Rego, Boyi Xie, Rebecca Passonneau, Austin Lee and
  Barbara Taranto","Leveraging Subjective Human Annotation for Clustering Historic Newspaper
  Articles",,,,,"cs.IR cs.CL cs.DL","http://arxiv.org/licenses/nonexclusive-distrib/1.0/","  The New York Public Library is participating in the Chronicling America
initiative to develop an online searchable database of historically significant
newspaper articles. Microfilm copies of the newspapers are scanned and high
resolution Optical Character Recognition (OCR) software is run on them. The
text from the OCR provides a wealth of data and opinion for researchers and
historians. However, categorization of articles provided by the OCR engine is
rudimentary and a large number of the articles are labeled editorial without
further grouping. Manually sorting articles into fine-grained categories is
time consuming if not impossible given the size of the corpus. This paper
studies techniques for automatic categorization of newspaper articles so as to
enhance search and retrieval on the archive. We explore unsupervised (e.g.
KMeans) and semi-supervised (e.g. constrained clustering) learning algorithms
to develop article categorization schemes geared towards the needs of
end-users. A pilot study was designed to understand whether there was unanimous
agreement amongst patrons regarding how articles can be categorized. It was
found that the task was very subjective and consequently automated algorithms
that could deal with subjective labels were used. While the small scale pilot
study was extremely helpful in designing machine learning algorithms, a much
larger system needs to be developed to collect annotations from users of the
archive. The ""BODHI"" system currently being developed is a step in that
direction, allowing users to correct wrongly scanned OCR and providing keywords
and tags for newspaper articles used frequently. On successful implementation
of the beta version of this system, we hope that it can be integrated with
existing software being developed for the Chronicling America project.
","[{""version"":""v1"",""created"":""Fri, 17 Aug 2012 04:48:58 GMT""}]","2012-08-20"
"1208.3531","Hideo Kubo","Soichiro Katayama, Hideo Kubo, and Sandra Lucente","Almost global existence for exterior Neumann problems of semilinear wave
  equations in 2D",,,,,"math.AP","http://arxiv.org/licenses/nonexclusive-distrib/1.0/","  The aim of this article is to prove an ""almost"" global existence result for
some semilinear wave equations in the plane outside a bounded convex obstacle
with the Neumann boundary condition.
","[{""version"":""v1"",""created"":""Fri, 17 Aug 2012 05:06:21 GMT""}]","2012-08-20"
"1208.3532","Jiang Xu","Jiang Xu, Jun Xiong and Shuichi Kawashima","Global well-posedness in critical Besov spaces for two-fluid
  Euler-Maxwell equations","28 pages","SIAM J. Math. Anal., 45, 3, 1422-1447, May, 2013",,,"math.AP","http://arxiv.org/licenses/nonexclusive-distrib/1.0/","  In this paper, we study the well-posedness in critical Besov spaces for
two-fluid Euler-Maxwell equations, which is different from the one fluid case.
We need to deal with the difficulties mainly caused by the nonlinear coupling
and cancelation between two carriers. Precisely, we first obtain the local
existence and blow-up criterion of classical solutions to the Cauchy problem
and periodic problem pertaining to data in Besov spaces with critical
regularity. Furthermore, we construct the global existence of classical
solutions with aid of a different energy estimate (in comparison with the
one-fluid case) provided the initial data is small under certain norms.
Finally, we establish the large-time asymptotic behavior of global solutions
near equilibrium in Besov spaces with relatively lower regularity.
","[{""version"":""v1"",""created"":""Fri, 17 Aug 2012 05:08:46 GMT""}]","2015-03-17"
"1208.3533","Marina Drosou","Marina Drosou, Evaggelia Pitoura","DisC Diversity: Result Diversification based on Dissimilarity and
  Coverage","To appear at the 39th International Conference on Very Large Data
  Bases (VLDB), August 26-31, 2013, Riva del Garda, Trento, Italy",,,,"cs.DB","http://arxiv.org/licenses/nonexclusive-distrib/1.0/","  Recently, result diversification has attracted a lot of attention as a means
to improve the quality of results retrieved by user queries. In this paper, we
propose a new, intuitive definition of diversity called DisC diversity. A DisC
diverse subset of a query result contains objects such that each object in the
result is represented by a similar object in the diverse subset and the objects
in the diverse subset are dissimilar to each other. We show that locating a
minimum DisC diverse subset is an NP-hard problem and provide heuristics for
its approximation. We also propose adapting DisC diverse subsets to a different
degree of diversification. We call this operation zooming. We present efficient
implementations of our algorithms based on the M-tree, a spatial index
structure, and experimentally evaluate their performance.
","[{""version"":""v1"",""created"":""Fri, 17 Aug 2012 05:45:18 GMT""},{""version"":""v2"",""created"":""Wed, 26 Jun 2013 06:02:16 GMT""}]","2013-06-27"
