"1208.3404","Tobias Kasprzik","Anastasiya Bierweiler, Tobias Kasprzik, Johann H. Kuhn","Electroweak accuracy in V-pair production at the LHC","6 pages, 4 figures; to appear in the proceedings of the 36th ICHEP",,,,"hep-ph","http://arxiv.org/licenses/nonexclusive-distrib/1.0/","  Vector-boson pair production is of great phenomenological importance at the
LHC. These processes will help to validate the Standard Model at highest
energies, and they may also open the door for the discovery of new physics
potentially showing up in subtle modifications of the non-abelian structure of
weak interactions. In this letter, we present the first full
$\mathcal{O}(\alpha^3)$ analysis of on-shell W$^\pm$Z and Z-pair production at
the LHC with all mass effects consistently included. The resulting electroweak
corrections are negative, strongly increase with increasing transverse momenta,
and lead to significant modifications of rapidity and angular distributions. In
view of the high energies accessible at the LHC, combined with considerable
event rates, our results have to be included in a proper analysis of
experimental data.
","[{""version"":""v1"",""created"":""Thu, 16 Aug 2012 16:01:36 GMT""}]","2012-08-17"
"1208.3405","Vasiliy Morozov","V. S. Morozov, Ya. S. Derbenev, F. Lin, and R. P. Johnson","Symmetric achromatic low-beta collider interaction region design concept","12 pages, 17 figures, to be submitted to Phys. Rev. ST Accel. Beams",,"10.1103/PhysRevSTAB.16.011004",,"physics.acc-ph","http://arxiv.org/licenses/nonexclusive-distrib/1.0/","  We present a new symmetry-based concept for an achromatic low-beta collider
interaction region design. A specially-designed symmetric Chromaticity
Compensation Block (CCB) induces an angle spread in the passing beam such that
it cancels the chromatic kick of the final focusing quadrupoles. Two such CCBs
placed symmetrically around an interaction point allow simultaneous
compensation of the 1st-order chromaticities and chromatic beam smear at the IP
without inducing significant 2nd-order aberrations to the particle trajectory.
We first develop an analytic description of this approach and explicitly
formulate 2nd-order aberration compensation conditions at the interaction
point. The concept is next applied to develop an interaction region design for
the ion collider ring of an electron-ion collider. We numerically evaluate
performance of the design in terms of momentum acceptance and dynamic aperture.
The advantages of the new concept are illustrated by comparing it to the
conventional distributed-sextupole chromaticity compensation scheme.
","[{""version"":""v1"",""created"":""Thu, 16 Aug 2012 16:01:40 GMT""}]","2013-05-30"
"1208.3406","Lijian Jiang","Lijian Jiang and Michael Presho","A resourceful splitting technique with applications to deterministic and
  stochastic multiscale finite element methods","32 pages, 22 figures; Multiscale Modeling and Simulation, 2012",,"10.1137/110843253",,"math.NA","http://arxiv.org/licenses/nonexclusive-distrib/1.0/","  In this paper we use a splitting technique to develop new multiscale basis
functions for the multiscale finite element method (MsFEM). The multiscale
basis functions are iteratively generated using a Green's kernel. The Green's
kernel is based on the first differential operator of the splitting. The
proposed MsFEM is applied to deterministic elliptic equations and stochastic
elliptic equations, and we show that the proposed MsFEM can considerably reduce
the dimension of the random parameter space for stochastic problems. By
combining the method with sparse grid collocation methods, the need for a
prohibitive number of deterministic solves is alleviated. We rigorously analyze
the convergence of the proposed method for both the deterministic and
stochastic elliptic equations. Computational complexity discussions are also
offered to supplement the convergence analysis. A number of numerical results
are presented to confirm the theoretical findings.
","[{""version"":""v1"",""created"":""Thu, 16 Aug 2012 16:02:28 GMT""}]","2012-08-17"
"1208.3407","Aaron Quinlan Ph.D.","Ryan M. Layer, Kevin Skadron, Gabriel Robins, Ira M. Hall, and Aaron
  R. Quinlan","Binary Interval Search (BITS): A Scalable Algorithm for Counting
  Interval Intersections",,,,,"q-bio.GN","http://arxiv.org/licenses/nonexclusive-distrib/1.0/","  Motivation: The comparison of diverse genomic datasets is fundamental to
understanding genome biology. Researchers must explore many large datasets of
genome intervals (e.g., genes, sequence alignments) to place their experimental
results in a broader context and to make new discoveries. Relationships between
genomic datasets are typically measured by identifying intervals that
intersect: that is, they overlap and thus share a common genome interval. Given
the continued advances in DNA sequencing technologies, efficient methods for
measuring statistically significant relationships between many sets of genomic
features is crucial for future discovery.
  Results: We introduce the Binary Interval Search (BITS) algorithm, a novel
and scalable approach to interval set intersection. We demonstrate that BITS
outperforms existing methods at counting interval intersections. Moreover, we
show that BITS is intrinsically suited to parallel computing architectures such
as Graphics Processing Units (GPUs) by illustrating its utility for efficient
Monte-Carlo simulations measuring the significance of relationships between
sets of genomic intervals.
","[{""version"":""v1"",""created"":""Thu, 16 Aug 2012 16:12:48 GMT""},{""version"":""v2"",""created"":""Fri, 17 Aug 2012 12:31:24 GMT""}]","2012-08-20"
"1208.3408","Sergio Mendoza","S. Mendoza","Extending cosmology: the metric approach","2012, Extending Cosmology: The Metric Approach, Open Questions in
  Cosmology; Review article for an Intech ""Open questions in cosmology"" book
  chapter (19 pages, 3 figures). Available from:
  http://www.intechopen.com/books/open-questions-in-cosmology/extending-cosmology-the-metric-approach",,"10.5772/53878",,"astro-ph.CO gr-qc","http://arxiv.org/licenses/nonexclusive-distrib/1.0/","  In this chapter it is shown how the introduction of a fundamental constant of
nature with dimensions of acceleration into the theory of gravity makes it
possible to extend gravity in a very consistent manner.
","[{""version"":""v1"",""created"":""Thu, 16 Aug 2012 16:14:13 GMT""},{""version"":""v2"",""created"":""Wed, 9 Jan 2013 04:45:48 GMT""}]","2013-01-10"
"1208.3409","Steimel, James M.","J. Steimel, R. Webber, R. Madrak, D. Wildman, R. Pasquinelli, E.
  Evans-Peoples (Fermilab)","Status and specifications of a Project X front-end accelerator test
  facility at Fermilab","3 pp. Particle Accelerator, 24th Conference (PAC'11) 2011. 28 Mar - 1
  Apr 2011. New York, USA",,,"FERMILAB-CONF-11-111-AD","physics.acc-ph","http://arxiv.org/licenses/nonexclusive-distrib/1.0/","  This paper describes the construction and operational status of an
accelerator test facility for Project X. The purpose of this facility is for
Project X component development activities that benefit from beam tests and any
development activities that require 325 MHz or 650 MHz RF power. It presently
includes an H- beam line, a 325 MHz superconducting cavity test facility, a 325
MHz (pulsed) RF power source, and a 650 MHz (CW) RF power source. The paper
also discusses some specific Project X components that will be tested in the
facility.
","[{""version"":""v1"",""created"":""Thu, 16 Aug 2012 16:15:59 GMT""}]","2012-08-17"
"1208.3410","Brett D. Wick","Sergei Treil, Brett D. Wick","Corona Solutions Depending Smoothly on Corona Data","v1: 7 pages","The corona problem, 201-209, Fields Inst. Commun., 72, Springer,
  New York, 2014",,,"math.CA math.FA","http://arxiv.org/licenses/nonexclusive-distrib/1.0/","  In this note we show that if the Corona data depends continuously (smoothly)
on a parameter, the solutions of the corresponding Bezout equations can be
chosen to have the same smoothness in the parameter.
","[{""version"":""v1"",""created"":""Thu, 16 Aug 2012 16:16:03 GMT""}]","2016-02-08"
"1208.3411","Atsushi Noguchi","Atsushi Noguchi, Kenji Toyoda, Shinji Urabe","Generation of a spin-squeezed state with trapped ions using a dressing
  field","5 pages, 4 figures",,,,"quant-ph","http://arxiv.org/licenses/nonexclusive-distrib/1.0/","  We propose a method for generating a spin-squeezed state that is a symmetric
Dicke state, with trapped ions using only global access. The eigenstates of the
ions under a strong dressing field become symmetric Dicke states and the
M$\o$lmer--S$\o$rensen interaction selectively couples one of them to an
initially populated auxiliary state. A $\mid D_{2n}^n>$ state, which is
maximally spin squeezed, can be generated with high fidelity using only square
pulses. Using an adiabatic technique, the ideal maximally spin-squeezed state
is generated.
","[{""version"":""v1"",""created"":""Thu, 16 Aug 2012 16:18:48 GMT""}]","2012-08-17"
"1208.3412","Rafael Fernandes","Rafael M. Fernandes and Andrew J. Millis","Suppression of superconductivity by Neel-type magnetic fluctuations in
  the iron pnictides","revised version accepted for publication in PRL","Phys. Rev. Lett. 110, 117004 (2013)","10.1103/PhysRevLett.110.117004",,"cond-mat.supr-con cond-mat.str-el","http://arxiv.org/licenses/nonexclusive-distrib/1.0/","  Motivated by recent experimental detection of Neel-type ($(\pi,\pi)$)
magnetic fluctuations in some iron pnictides, we study the impact of competing
$(\pi,\pi)$ and $(\pi,0)$ spin fluctuations on the superconductivity of these
materials. We show that, counter-intuitively, even short-range, weak Neel
fluctuations strongly suppress the $s^{+-}$ state, with the main effect arising
from a repulsive contribution to the $s^{+-}$ pairing interaction, complemented
by low frequency inelastic scattering. Further increasing the strength of the
Neel fluctuations leads to a low-$T_{c}$ d-wave state, with a possible
intermediate $s+id$ phase. The results suggest that the absence of
superconductivity in a series of hole-doped pnictides is due to the combination
of short-range Neel fluctuations and pair-breaking impurity scattering, and
also that $T_{c}$ of optimally doped pnictides could be further increased if
residual $(\pi,\pi)$ fluctuations were reduced.
","[{""version"":""v1"",""created"":""Thu, 16 Aug 2012 16:22:45 GMT""},{""version"":""v2"",""created"":""Fri, 8 Feb 2013 18:11:49 GMT""}]","2013-03-18"
"1208.3413","Lei Wu","Ning Liu, Lei Wu, Pei Wen Wu, Jin Min Yang","Complete one-loop effects of SUSY QCD in $b\bar{b}h$ production at the
  LHC under current experimental constraints","figures updated, references and discussions added, version accepted
  by JHEP",,"10.1007/JHEP01(2013)161",,"hep-ph","http://arxiv.org/licenses/nonexclusive-distrib/1.0/","  Inspired by the recent LHC Higgs data and null search results of
supersymmetry (SUSY), we scan the parameter space of the Minimal Supersymmetric
Standard Model (MSSM) with relatively heavy sparticles (1-3 TeV). Then in the
parameter space allowed by current collider experiments and dark matter
detections, we calculate the complete one-loop SUSY QCD corrections to $pp\to
b\bar{b}h$ at the LHC with $\sqrt{s}=14$ TeV and obtain the following
observations: (i) For the large values of $\tan\beta$ and low values of
$m_{A}$, the SUSY QCD effects can be quite large, which, however, have been
excluded by the latest results of LHC search for $H/A \to \tau^{+}\tau^{-}$;
(ii) For modest values of $\tan\beta$ and $m_{A}$ which so far survived all
experimental constraints, the SUSY QCD corrections can maximally reach about
-9%.
","[{""version"":""v1"",""created"":""Thu, 16 Aug 2012 16:23:36 GMT""},{""version"":""v2"",""created"":""Wed, 2 Jan 2013 02:26:21 GMT""}]","2015-06-11"
"1208.3414","Kourbanis, Ioanis","I. Kourbanis, P. Adamson, J. Biggs, B. Brown, D. Capista, C. C.
  Jensen, G. E. Krafczyk, D. K. Morris, D. Scott, K. Seiya, S. R. Ward, G. Wu,
  M.-J. Yang (Fermilab)","A gap clearing kicker for Main Injector","3 pp. Particle Accelerator, 24th Conference (PAC'11) 2011. 28 Mar - 1
  Apr 2011. New York, USA",,,"FERMILAB-CONF-11-085-AD","physics.acc-ph","http://arxiv.org/licenses/nonexclusive-distrib/1.0/","  Fermilab Main Injector has been operating at high Beam Power levels since
2008 when multi-batch slip stacking became operational. In order to maintain
and increase the beam power levels the localized beam loss due to beam left
over in the injection kicker gap during slip stacking needs to be addressed. A
set of gap clearing kickers that kick any beam left in the injection gap to the
beam abort have been built. The kickers were installed in the summer of 2009
and became operational in November of 2010. The kicker performance and its
effect on the beam losses will be described.
","[{""version"":""v1"",""created"":""Thu, 16 Aug 2012 16:27:40 GMT""}]","2012-08-17"
"1208.3415","Khilkevich, Andrei","Andrei Khilkevich (Belarus State U.), Lionel R. Prost, Alexander V.
  Shemyakin (Fermilab)","Effect of transverse electron velocities on the longitudinal cooling
  force in the Fermilab electron cooler","3 pp. Particle Accelerator, 24th Conference (PAC'11) 2011. 28 Mar - 1
  Apr 2011. New York, USA",,,"FERMILAB-CONF-11-076-AD","physics.acc-ph","http://arxiv.org/licenses/nonexclusive-distrib/1.0/","  In Fermilab's electron cooler, a 0.1A, 4.3MeV DC electron beam propagates
through the 20 m cooling section, which is immersed in a weak longitudinal
magnetic field. A proper adjustment of 200 dipole coils, installed in the
cooling section for correction of the magnetic field imperfections, can create
a helix-like trajectory with the wavelength of 1-10 m. The longitudinal cooling
force is measured in the presence of such helixes at different wavelengths and
amplitudes. The results are compared with a model calculating the cooling force
as a sum of collisions with small impact parameters, where the helical nature
of the coherent angle is ignored, and far collisions, where the effect of the
coherent motion is neglected. A qualitative agreement is found.
","[{""version"":""v1"",""created"":""Thu, 16 Aug 2012 16:35:22 GMT""}]","2012-08-17"
"1208.3416","Rapha\""el Clou\^atre","Rapha\""el Clou\^atre","Similarity results for operators of class $C_0$ and the algebra
  $H^\infty(T)$","21 pages. Final version. Accepted for publication in Operator and
  Matrices",,,,"math.FA math.OA","http://arxiv.org/licenses/nonexclusive-distrib/1.0/","  Given two multiplicity-free operators $T_1$ and $T_2$ of class $C_0$ having
the same finite Blaschke product as minimal function, the operator algebras
$H^\infty(T_1)$ and $H^\infty(T_2)$ are isomorphic and $T_1$ is similar to
$T_2$. We find conditions under which the norm of the similarity between the
operators can be controlled by the norm of the algebra isomorphism. As an
application, we improve upon earlier work and obtain results regarding
similarity when the minimal function is an infinite product of finite Blaschke
products satisfying the generalized Carleson condition.
","[{""version"":""v1"",""created"":""Thu, 16 Aug 2012 16:49:06 GMT""},{""version"":""v2"",""created"":""Mon, 10 Sep 2012 16:37:48 GMT""},{""version"":""v3"",""created"":""Thu, 22 May 2014 02:07:33 GMT""}]","2014-05-23"
"1208.3417","Jorge Piekarewicz","J. Piekarewicz","Pygmies, Giants, and Skins","Invited Talk given at the 11th International Conference on
  Nucleus-Nucleus Collisions (NN2012), San Antonio, Texas, USA, May 27-June 1,
  2012. To appear in the NN2012 Proceedings in Journal of Physics: Conference
  Series (JPCS)",,"10.1088/1742-6596/420/1/012143",,"nucl-th astro-ph.SR nucl-ex","http://arxiv.org/licenses/nonexclusive-distrib/1.0/","  Understanding the equation of state (EOS) of neutron-rich matter is a central
goal of nuclear physics that cuts across a variety of disciplines. Indeed, the
limits of nuclear existence, the collision of energetic heavy ions, the
structure of neutron stars, and the dynamics of core-collapse supernova all
depend critically on the nuclear-matter EOS. In this contribution I focus on
the EOS of cold baryonic matter with special emphasis on its impact on the
structure, dynamics, and composition of neutron stars. In particular, I discuss
how laboratory experiments on neutron skins as well as on Pygmy and Giant
resonances can help us elucidate the structure of these fascinating objects.
","[{""version"":""v1"",""created"":""Thu, 16 Aug 2012 17:01:59 GMT""}]","2015-06-11"
"1208.3418","Evgeny Ivanov","M. Goykhman, E. Ivanov, S. Sidorov","Super Landau Models on Odd Cosets","1 + 33 pages, some typos corrected",,"10.1103/PhysRevD.87.025026","JINR-E2-2012-89","hep-th math-ph math.MP","http://arxiv.org/licenses/nonexclusive-distrib/1.0/","  We construct d=1 sigma models of the Wess-Zumino type on the SU(n|1)/U(n)
fermionic cosets. Such models can be regarded as a particular supersymmetric
extension (with a target space supersymmetry) of the classical Landau model,
when a charged particle possesses only fermionic coordinates. We consider both
classical and quantum models, and prove the unitarity of the quantum model by
introducing the metric operator on the Hilbert space of the quantum states,
such that all their norms become positive-definite. It is remarkable that the
quantum n=2 model exhibits hidden SU(2|2) symmetry. We also discuss the planar
limit of these models. The Hilbert space in the planar n=2 case is shown to
carry SU(2|2) symmetry which is different from that of the SU(2|1)/U(1) model.
","[{""version"":""v1"",""created"":""Thu, 16 Aug 2012 17:04:43 GMT""},{""version"":""v2"",""created"":""Fri, 17 Aug 2012 16:36:23 GMT""}]","2015-06-11"
"1208.3419","Nathan Wiebe","Cozmin Ududec, Nathan Wiebe, Joseph Emerson","Information-theoretic equilibration: the appearance of irreversibility
  under complex quantum dynamics","15 pages, 7 figures. Discussion has been clarified and additional
  numerical evidence for information theoretic equilibration is provided for a
  variant of the Heisenberg model as well as one and two-dimensional random
  local Hamiltonians","Physical Review Letters 111, 080403 (2013)","10.1103/PhysRevLett.111.080403",,"quant-ph cond-mat.stat-mech","http://arxiv.org/licenses/nonexclusive-distrib/1.0/","  The question of how irreversibility can emerge as a generic phenomena when
the underlying mechanical theory is reversible has been a long-standing
fundamental problem for both classical and quantum mechanics. We describe a
mechanism for the appearance of irreversibility that applies to coherent,
isolated systems in a pure quantum state. This equilibration mechanism requires
only an assumption of sufficiently complex internal dynamics and natural
information-theoretic constraints arising from the infeasibility of collecting
an astronomical amount of measurement data. Remarkably, we are able to prove
that irreversibility can be understood as typical without assuming decoherence
or restricting to coarse-grained observables, and hence occurs under distinct
conditions and time-scales than those implied by the usual decoherence point of
view. We illustrate the effect numerically in several model systems and prove
that the effect is typical under the standard random-matrix conjecture for
complex quantum systems.
","[{""version"":""v1"",""created"":""Thu, 16 Aug 2012 17:05:42 GMT""},{""version"":""v2"",""created"":""Mon, 17 Dec 2012 20:09:41 GMT""},{""version"":""v3"",""created"":""Tue, 18 Dec 2012 17:31:25 GMT""},{""version"":""v4"",""created"":""Wed, 18 Sep 2013 21:39:54 GMT""}]","2013-09-20"
"1208.3420","Mauro Rovezzi Dr","Mauro Rovezzi","Indexing Fe-phases in/on GaN using x-ray powder diffraction","1 table and 27 references. The data are obtained from the Inorganic
  Crystal Structures Database (ICSD, http://icsd.fiz-karlsruhe.de/). The access
  to ICSD has been provided by the European Synchrotron Radiation Facility
  (ESRF)",,,,"cond-mat.mtrl-sci","http://arxiv.org/licenses/nonexclusive-distrib/1.0/","  This document reports the x-ray powder diffraction main reflections
(intensity threshold >= 100) for possible Fe-related phases forming during the
metal-organic vapor phase epitaxy (MOVPE) growth of Fe in NH_3/H_2 mixture on
wurtzite-GaN/sapphire. The 2\theta values are given for Cu K\alpha_1 radiation
(1.5406 \AA) in the range 25-100 deg (ordered by increasing 2\theta). The
GaN(000l) and Al_2O_3(000l) are also reported for reference.
","[{""version"":""v1"",""created"":""Thu, 16 Aug 2012 17:06:15 GMT""}]","2012-08-17"
"1208.3421","Oli Luiz Dors Junior","P. Freitas-Lemes, I. Rodrigues, M. Fa\'undez-Abans, O. Dors, I. F.
  Fernandes","Imagery and long-slit spectroscopy of the Polar-Ring Galaxy AM2020-504",,,"10.1111/j.1365-2966.2012.21942.x",,"astro-ph.CO","http://arxiv.org/licenses/nonexclusive-distrib/1.0/","  Interactions between galaxies are very common. There are special kinds of
interactions that produce systems called Polar Ring Galaxies (PRGs), composed
by a lenticular, elliptical, or spiral host galaxy, surrounded by a ring of
stars and gas, orbiting in an approximately polar plane. The present work aims
to study AM2020-504, a PRG with an elliptical host galaxy, and a narrow and
well defined ring, probably formed by accretion of material from a donor
galaxy, collected by the host galaxy. Our observational study was based on BVRI
broad band imagery as well as longslit spectroscopy in the wavelenght range
4100--8600\AA, performed at the 1.6m telescope at the Observat\'orio do Pico
dos Dias (OPD), Brazil. We estimated a redshift of z= 0.01683, corresponding a
heliocentric radial velocity of 5045 +/-23 km/s. The (B-R) color map shows that
the ring is bluer than the host galaxy, indicating that the ring is a younger
structure. Standard diagnostic diagrams were used to classify the main ionizing
source of selected emission-line regions (nucleus, host galaxy and ring). It
turns out that the ring regions are mainly ionized by massive stars while the
nucleus presents AGN characteristics. Using two empirical methods, we found
oxygen abundances for the HII regions located in the ring in the range
12+log(O/H)=8.3-8.8 dex, the presence of an oxygen gradient across the ring,
and that AM2020-504 follows the metallicity-luminosity relation of spiral
galaxies. These results support the accretion scenario for this object and
rules out cold accretion as source for the HI gas in the polar ring.
","[{""version"":""v1"",""created"":""Thu, 16 Aug 2012 17:08:25 GMT""}]","2015-06-11"
"1208.3422","Zhixiang Eddie Xu","Zhixiang Xu, Kilian Q. Weinberger, Olivier Chapelle","Distance Metric Learning for Kernel Machines",,,,,"stat.ML cs.LG","http://arxiv.org/licenses/nonexclusive-distrib/1.0/","  Recent work in metric learning has significantly improved the
state-of-the-art in k-nearest neighbor classification. Support vector machines
(SVM), particularly with RBF kernels, are amongst the most popular
classification algorithms that uses distance metrics to compare examples. This
paper provides an empirical analysis of the efficacy of three of the most
popular Mahalanobis metric learning algorithms as pre-processing for SVM
training. We show that none of these algorithms generate metrics that lead to
particularly satisfying improvements for SVM-RBF classification. As a remedy we
introduce support vector metric learning (SVML), a novel algorithm that
seamlessly combines the learning of a Mahalanobis metric with the training of
the RBF-SVM parameters. We demonstrate the capabilities of SVML on nine
benchmark data sets of varying sizes and difficulties. In our study, SVML
outperforms all alternative state-of-the-art metric learning algorithms in
terms of accuracy and establishes itself as a serious alternative to the
standard Euclidean metric with model selection by cross validation.
","[{""version"":""v1"",""created"":""Thu, 16 Aug 2012 17:16:18 GMT""},{""version"":""v2"",""created"":""Tue, 8 Jan 2013 20:26:55 GMT""}]","2013-01-09"
"1208.3423","Agustin Sabio Vera","Jochen Bartels, and Lev N. Lipatov, and Agustin Sabio Vera","Double-logarithms in Einstein-Hilbert gravity and supergravity",,,,,"hep-th","http://arxiv.org/licenses/nonexclusive-distrib/1.0/","  We study the interplay between graviton reggeization and double-logarithmic
in energy contributions to four-graviton scattering in theories with and
without supersymmetry. Predictions to all orders in the gravitational coupling
are given for these double-logarithms. As the number of supersymmetries grows
these terms generate a convergent behaviour for the amplitudes at very high
energies. At two-loop level, we find agreement with previous exact results for
N=8 supergravity and with those of Boucher-Veronneau and Dixon, who studied the
N=4,5,6 supergravities using a conjectured double-copy structure of gravity.
","[{""version"":""v1"",""created"":""Thu, 16 Aug 2012 17:18:58 GMT""}]","2012-08-17"
