"1208.3462","Tyler D. Groff","Tyler D. Groff and N. Jeremy Kasdin","Kalman Filter Estimation for Focal Plane Wavefront Correction","14 pages, 9 figures, SPIE Astronomical Telescopes and Instrumentation
  2012 conference proceedings. Journal version at arXiv:1301.3828",,"10.1117/12.927166",,"astro-ph.IM astro-ph.EP","http://arxiv.org/licenses/nonexclusive-distrib/1.0/","  Space-based coronagraphs for future earth-like planet detection will require
focal plane wavefront control techniques to achieve the necessary contrast
levels. These correction algorithms are iterative and the control methods
require an estimate of the electric field at the science camera, which requires
nearly all of the images taken for the correction. We demonstrate a Kalman
filter estimator that uses prior knowledge to create the estimate of the
electric field, dramatically reducing the number of exposures required to
estimate the image plane electric field. In addition to a significant reduction
in exposures, we discuss the relative merit of this algorithm to other
estimation schemes, particularly in regard to estimate error and covariance. As
part of the reduction in exposures we also discuss a novel approach to
generating the diversity required for estimating the field in the image plane.
This uses the stroke minimization control algorithm to choose the probe shapes
on the deformable mirrors, adding a degree of optimality to the problem and
once again reducing the total number of exposures required for correction.
Choosing probe shapes has been largely unexplored up to this point and is
critical to producing a well posed set of measurements for the estimate.
Ultimately the filter will lead to an adaptive algorithm which can estimate
physical parameters in the laboratory and optimize estimation.
","[{""version"":""v1"",""created"":""Thu, 16 Aug 2012 20:00:00 GMT""}]","2015-06-11"
"1208.3463","Sylvia Ploeckinger","Sylvia Ploeckinger and Gerhard Hensler","Do High-Velocity Clouds trace the Dark Matter subhalo population?","Accepted for publication in A&A",,"10.1051/0004-6361/201218767",,"astro-ph.GA","http://arxiv.org/licenses/nonexclusive-distrib/1.0/","  Within the cosmological concordance model, Cold Dark Matter (CDM) subhalos
form the building blocks which merge hierarchically to more massive galaxies.
Since intergalactic gas is accreted by massive galaxies, observable e.g. as
high- velocity clouds (HVCs) around the Milky Way, with extremely low
metallicities, these can be suggested to represent the baryonic content of
primordial Dark Matter (DM) subhalos. Another possibility of their origin is
that they stem from disrupted satellite galaxies, but in this case, these gas
clouds move unaccompanied by a bound DM structure. Since HVCs are observed with
long gas tails and with irregular substructures, numerical models are performed
aiming at exploring their structure and compare them with observations. If HVCs
are engulfed by DM subhalos, their gas must leave the DM gravitational
potential and reflect this in their dynamics. On the other hand, the evolution
and survival of pure gas models must be tested to distinguish between
DM-dominated and DM-free clouds and to allow conclusions on their origin. The
models demonstrate that purely baryonic HVCs with low masses are disrupted by
ram-pressure stripping and Kelvin-Helmholtz instabilities, while more massive
ones survive, losing their initially spherical shape and develop significant
substructures including cometary elongations in the column density distribution
(""head-tail structure""). On the contrary, HVCs with DM subhalos survive with
more than 90% of their gas mass still bound and spherically shaped, approaching
the Galactic disk like bullets. In addition, we find that velocity gradients
along the cometary head-tail structures does not necessarily offer a
possibility to distinguish between DM-dominated and purely gaseous HVCs.
Comparison of models with observations let us conclude that HVCs are not
embedded in a DM substructure and do not trace the cosmological subhalo
population.
","[{""version"":""v1"",""created"":""Thu, 16 Aug 2012 20:00:00 GMT""}]","2015-06-11"
"1208.3464","Thomas Targett","T. A. Targett, J. S. Dunlop, M. Cirasuolo, R. J. McLure, V. A. Bruce,
  A. Fontana, A. Galametz, D. Paris, R. Dav\'e, A. Dekel, S. M. Faber, H. C.
  Ferguson, N. A. Grogin, J. S. Kartaltepe, D. D. Kocevski, A. M. Koekemoer, P.
  Kurczynski, K. Lai, J. Lotz","The properties of (sub)millimetre-selected galaxies as revealed by
  CANDELS HST WFC3/IR imaging in GOODS-South","30 pages, 9 figures",,"10.1093/mnras/stt482",,"astro-ph.CO","http://arxiv.org/licenses/nonexclusive-distrib/1.0/","  We have exploited the HST CANDELS WFC3/IR imaging to study the properties of
(sub-)mm galaxies in GOODS-South. After using the deep radio and Spitzer
imaging to identify galaxy counterparts for the (sub-)mm sources, we have used
the new CANDELS data in two ways. First, we have derived improved photometric
redshifts and stellar masses, confirming that the (sub-)mm galaxies are massive
(<M*>=2.2x10^11 M_solar) galaxies at z=1-3. Second, we have exploited the depth
and resolution of the WFC3/IR imaging to determine the sizes and morphologies
of the galaxies at rest-frame optical wavelengths, fitting two-dimensional
axi-symmetric Sersic models. Crucially, the WFC3/IR H-band imaging enables
modelling of the mass-dominant galaxy, rather than the blue high-surface
brightness features which often dominate optical (rest-frame UV) images of
(sub-)mm galaxies, and can confuse visual morphological classification. As a
result of this analysis we find that >95% of the rest-frame optical light in
almost all of the (sub-)mm galaxies is well-described by either a single
exponential disk, or a multiple-component system in which the dominant
constituent is disk-like. We demonstrate that this conclusion is consistent
with the results of high-quality ground-based K-band imaging, and explain why.
The massive disk galaxies which host luminous (sub-)mm emission are reasonably
extended (r_e=4 kpc), consistent with the sizes of other massive star-forming
disks at z~2. In many cases we find evidence of blue clumps within the sources,
with the mass-dominant disk becoming more significant at longer wavelengths.
Finally, only a minority of the sources show evidence for a major galaxy-galaxy
interaction. Taken together, these results support the view that most (sub-)mm
galaxies at z~2 are simply the most extreme examples of normal star-forming
galaxies at that era.
","[{""version"":""v1"",""created"":""Thu, 16 Aug 2012 20:00:00 GMT""},{""version"":""v2"",""created"":""Mon, 6 May 2013 10:13:04 GMT""}]","2015-06-11"
"1208.3465","Kelly Denney","Kelly D. Denney (1) ((1) Dark Cosmology Centre, Copenhagen, Denmark)","Are Outflows Biasing Single-Epoch CIV Black Hole Mass Estimates?","16 pages, 10 figures, accepted for publication in the Astrophysical
  Journal (v2 addresses suggestions of the referee, which includes only minor
  text modifications compared to v1)",,"10.1088/0004-637X/759/1/44",,"astro-ph.CO","http://arxiv.org/licenses/nonexclusive-distrib/1.0/","  We use a combination of reverberation mapping data and single-epoch spectra
of the CIV emission line in a sample of both low and high-redshift active
galactic nuclei (AGNs) to investigate sources of the discrepancies between CIV-
and Hbeta-based single-epoch black hole mass estimates. We find that for all
reverberation mapped sources, there is a component of the line profile that
does not reverberate, and the velocity characteristics of this component vary
from object-to-object. The differing strength and properties of this
non-variable component are responsible for much of the scatter in CIV-based
black hole masses compared to Hbeta masses. The CIV mass bias introduced by
this non-variable component is correlated with the shape of the CIV line,
allowing us to make an empirical correction to the black hole mass estimates.
Using this correction and accounting for other sources of scatter such as poor
data quality and data inhomogeneity reduces the scatter between the CIV and
Hbeta masses in our sample by a factor of ~2, to only ~0.2 dex. We discuss the
possibility that this non-variable CIV component originates in an
orientation-dependent outflow from either the proposed broad line region (BLR)
disk-wind or the intermediate line region (ILR), a high-velocity inner
extension of the narrow line region (NLR).
","[{""version"":""v1"",""created"":""Thu, 16 Aug 2012 20:00:01 GMT""},{""version"":""v2"",""created"":""Tue, 18 Sep 2012 12:03:59 GMT""}]","2015-06-11"
"1208.3466","Sylvana Yelda","S. Yelda, A. M. Ghez, J. R. Lu, T. Do, L. Meyer, M. R. Morris","Adaptive Optics Observations of the Galactic Center Young Stars","7 pages, 4 figures, SPIE Astronomical Telescopes and Instrumentation
  2012",,"10.1117/12.927217",,"astro-ph.GA","http://arxiv.org/licenses/nonexclusive-distrib/1.0/","  Adaptive Optics observations have dramatically improved the quality and
versatility of high angular resolution measurements of the center of our
Galaxy. In this paper, we quantify the quality of our Adaptive Optics
observations and report on the astrometric precision for the young stellar
population that appears to reside in a stellar disk structure in the central
parsec. We show that with our improved astrometry and a 16 year baseline,
including 10 years of speckle and 6 years of laser guide star AO imaging, we
reliably detect accelerations in the plane of the sky as small as 70
microarcsec/yr/yr (~2.5 km/s/yr) and out to a projected radius from the
supermassive black hole of 1.5"" (~0.06 pc). With an increase in sensitivity to
accelerations by a factor of ~6 over our previous efforts, we are able to
directly probe the kinematic structure of the young stellar disk, which appears
to have an inner radius of 0.8"". We find that candidate disk members are on
eccentric orbits, with a mean eccentricity of < e > = 0.30 +/- 0.07. Such
eccentricities cannot be explained by the relaxation of a circular disk with a
normal initial mass function, which suggests the existence of a top-heavy IMF
or formation in an initially eccentric disk.
","[{""version"":""v1"",""created"":""Thu, 16 Aug 2012 20:00:02 GMT""}]","2015-06-11"
"1208.3467","Tullia Sbarrato","T. Sbarrato, G. Ghisellini, M. Nardini, G. Tagliaferri, L. Foschini,
  G. Ghirlanda, F. Tavecchio, J. Greiner, A. Rau, N. Gehrels","SDSS J102623.61+254259.5: the second most distant blazar at z=5.3","5 pages, 3 figures. Accepted for publication in MNRAS",,"10.1111/j.1745-3933.2012.01332.x",,"astro-ph.CO astro-ph.HE","http://arxiv.org/licenses/nonexclusive-distrib/1.0/","  The radio-loud quasar SDSS J102623.61+254259.5, at a redshift z=5.3, is one
of the most distant radio-loud objects. Since its radio flux exceeds 100 mJy at
a few GHz, it is also one of the most powerful radio-loud sources. We propose
that this source is a blazar, i.e. we are seeing its jet at a small viewing
angle. This claim is based on the spectral energy distribution of this source,
and especially on its strong and hard X-ray spectrum, as seen by Swift, very
typical of powerful blazars. Observations by the Gamma-Ray Burst
Optical/Near-Infrared Detector (GROND) and by theWide-field Infrared Survey
Explorer (WISE) allow to establish the thermal nature of the emission in the
near IR-optical band. Assuming that this is produced by a standard accretion
disk, we derive that it emits a luminosity of L_d \simeq 9 \times 10^46 erg
s^{-1} and that the black hole has a mass between 2 and 5 billion solar masses.
This poses interesting constraints on the mass function of heavy (> 10^9 M_sun)
black holes at high redshifts.
","[{""version"":""v1"",""created"":""Thu, 16 Aug 2012 20:00:03 GMT""}]","2015-06-11"
"1208.3468","Andrea Puhm","Iosif Bena, Andrea Puhm, Bert Vercnocke","Non-extremal Black Hole Microstates: Fuzzballs of Fire or Fuzzballs of
  Fuzz ?","34 pages, 10 figures",,"10.1007/JHEP12(2012)014",,"hep-th gr-qc","http://arxiv.org/licenses/nonexclusive-distrib/1.0/","  We construct the first family of microstate geometries of near-extremal black
holes, by placing metastable supertubes inside certain scaling supersymmetric
smooth microstate geometries. These fuzzballs differ from the classical black
hole solution macroscopically at the horizon scale, and for certain probes the
fluctuations between various fuzzballs will be visible as thermal noise far
away from the horizon. We discuss whether these fuzzballs appear to infalling
observers as fuzzballs of fuzz or as fuzzballs of fire. The existence of these
solutions suggests that the singularity of non-extremal black holes is resolved
all the way to the outer horizon and this ""backwards in time"" singularity
resolution can shed light on the resolution of spacelike cosmological
singularities.
","[{""version"":""v1"",""created"":""Thu, 16 Aug 2012 20:00:06 GMT""}]","2015-06-11"
"1208.3469","Masahiro Nozaki","Masahiro Nozaki, Shinsei Ryu and Tadashi Takayanagi","Holographic Geometry of Entanglement Renormalization in Quantum Field
  Theories","42pages, 9figures, reference added, minor change","JHEP10(2012)193","10.1007/JHEP10(2012)193","YITP-12-72; IPMU12-0159","hep-th cond-mat.str-el gr-qc quant-ph","http://arxiv.org/licenses/nonexclusive-distrib/1.0/","  We study a conjectured connection between the AdS/CFT and a real-space
quantum renormalization group scheme, the multi-scale entanglement
renormalization ansatz (MERA). By making a close contact with the holographic
formula of the entanglement entropy, we propose a general definition of the
metric in the MERA in the extra holographic direction, which is formulated
purely in terms of quantum field theoretical data. Using the continuum version
of the MERA (cMERA), we calculate this emergent holographic metric explicitly
for free scalar boson and free fermions theories, and check that the metric so
computed has the properties expected from AdS/CFT. We also discuss the cMERA in
a time-dependent background induced by quantum quench and estimate its
corresponding metric.
","[{""version"":""v1"",""created"":""Thu, 16 Aug 2012 20:00:13 GMT""},{""version"":""v2"",""created"":""Sun, 9 Sep 2012 11:24:57 GMT""},{""version"":""v3"",""created"":""Tue, 2 Oct 2012 11:07:58 GMT""}]","2015-06-11"
"1208.3470","Kostyantyn Kechedzhi","K. Kechedzhi, E. H. Hwang, S. Das Sarma","Gate tunable quantum transport in double layer graphene","14 pages, 7 figures","Phys. Rev. B 86, 165442 (2012)","10.1103/PhysRevB.86.165442",,"cond-mat.mes-hall cond-mat.mtrl-sci","http://arxiv.org/licenses/nonexclusive-distrib/1.0/","  We analyze the effect of screening provided by the additional graphene layer
in double layer graphene heterostructures (DLGs) on transport characteristics
of DLG devices in the metallic regime. The effect of gate-tunable charge
density in the additional layer is two-fold: it provides screening of the
long-range potential of charged defects in the system, and screens out Coulomb
interactions between charge carriers. We find that the efficiency of defect
charge screening is strongly dependent on the concentration and location of
defects within the DLG. In particular, only a moderate suppression of
electron-hole puddles around the Dirac point induced by the high concentration
of remote impurities in the silicon oxide substrate could be achieved. A
stronger effect is found on the elastic relaxation rate due to charged defects
resulting in mobility strongly dependent on the electron denisty in the
additional layer of DLG. We find that the quantum interference correction to
the resistivity of graphene is also strongly affected by screening in DLG. In
particular, the dephasing rate is strongly suppressed by the additional
screening that supresses the amplitude of electron-electron interaction and
reduces the diffusion time that electrons spend in proximity of each other. The
latter effect combined with screening of elastic relaxation rates results in a
peculiar gate tunable weak-localization magnetoresistance and quantum
correction to resistivity. We propose suitable experiments to test our theory
and discuss the possible relevance of our results to exisiting data.
","[{""version"":""v1"",""created"":""Thu, 16 Aug 2012 20:00:19 GMT""},{""version"":""v2"",""created"":""Thu, 15 Nov 2012 03:35:27 GMT""}]","2012-11-16"
"1208.3471","Mariano Dom\'inguez J","Mariano Javier de Le\'on Dom\'inguez Romero, Diego Garc\'ia Lambas and
  Hern\'an Muriel","An improved method for the identification of galaxy systems: Measuring
  the gravitational redshift by Dark Matter Haloes","Accepted for Publication in MNRAS Letters, 2 figures. arXiv admin
  note: text overlap with arXiv:astro-ph/0405234, arXiv:astro-ph/0406593 by
  other authors",,,,"astro-ph.CO gr-qc","http://arxiv.org/licenses/nonexclusive-distrib/1.0/","  We introduce a new method for the identification of galaxy systems in
redshift surveys based on the halo model. This method is a modified version of
the K-means identification algorithm developed by Yang et al (2005). We have
calibrated and tested our algorithms using mock catalogs generated using the
Millennium simulations (Springel et al. 2005) and applied them to the NYU-DR7
galaxy catalog (based on the SDSS datasets). Using this local sample of groups
and clusters of galaxies we have measured the effect of gravitational redshift
produced by their host dark matter haloes. Our results shows radial velocity
decrements consistent with general relativity predictions and previous
measurements by Wojtak et al (2011) in clusters of galaxies.
","[{""version"":""v1"",""created"":""Thu, 16 Aug 2012 20:00:22 GMT""}]","2012-08-20"
"1208.3472","Eli Bressert Mr","Eli Bressert, Adam Ginsburg, Cara Battersby, John Bally, Steven
  Longmore, Leonardo Testi","How to Find Young Massive Cluster Progenitors","5 pages, 1 figure, 1 table, accepted for publication in ApJL",,"10.1088/2041-8205/758/2/L28",,"astro-ph.GA astro-ph.SR","http://arxiv.org/licenses/nonexclusive-distrib/1.0/","  We propose that bound, young massive stellar clusters form from dense clouds
that have escape speeds greater than the sound speed in photo-ionized gas. In
these clumps, radiative feedback in the form of gas ionization is bottled up,
enabling star formation to proceed to sufficiently high efficiency so that the
resulting star cluster remains bound even after gas removal. We estimate the
observable properties of the massive proto-clusters (MPCs) for existing
Galactic plane surveys and suggest how they may be sought in recent and
upcoming extragalactic observations. These surveys will potentially provide a
significant sample of MPC candidates that will allow us to better understand
extreme star-formation and massive cluster formation in the Local Universe.
","[{""version"":""v1"",""created"":""Thu, 16 Aug 2012 20:01:08 GMT""},{""version"":""v2"",""created"":""Wed, 22 Aug 2012 14:39:32 GMT""}]","2015-06-11"
"1208.3473","William  East","William E. East, Fethi M. Ramazano\u{g}lu, Frans Pretorius","Conformal Thin-Sandwich Solver for Generic Initial Data","12 pages, 8 figures, PRD in production","Phys. Rev. D 86, 104053 (2012)","10.1103/PhysRevD.86.104053",,"gr-qc","http://arxiv.org/licenses/nonexclusive-distrib/1.0/","  We present a new scheme for constructing initial data for the Einstein field
equations using the conformal thin-sandwich formulation that does not assume
conformal flatness or approximate Killing vectors. This includes a method for
determining free data based on superposition, as well as a way to handle black
hole singularities without excision. We numerically solve the constraint
equations using a multigrid algorithm with mesh refinement. We demonstrate the
efficacy of the method with initial data solutions for several applications: a
quasicircular binary black hole merger, a dynamical capture black hole-neutron
star merger, and an ultrarelativistic collision.
","[{""version"":""v1"",""created"":""Thu, 16 Aug 2012 20:01:11 GMT""},{""version"":""v2"",""created"":""Tue, 6 Nov 2012 22:39:57 GMT""}]","2012-11-29"
"1208.3474","Don Colladay","Don Colladay","Low Energy Tests of Lorentz and CPT Violation","5 pages, conference proceedings for CIPANP2012, St. Petersburg, FL,
  June, 2012",,"10.1063/1.4826738",,"hep-ph","http://arxiv.org/licenses/nonexclusive-distrib/1.0/","  An overview of the theoretical framework of the Standard Model Extension
(SME) that allows for a parametrization of Lorentz and CPT violating effects
using effective field theory will be presented. A review of current bounds on
these Lorentz violating parameters using various low-energy tests will be
reviewed. State-of-the-art measurements involving the Penning Trap, atomic
clock, torsion pendulum, and resonant cavities will be discussed. Different
experiments can provide stringent bounds on a variety of parameters coupled to
various fundamental particles including electrons, protons, neutrons, and
photons.
","[{""version"":""v1"",""created"":""Thu, 16 Aug 2012 20:01:31 GMT""}]","2015-06-11"
"1208.3475","Tamas Kovacs G.","Tamas G. Kovacs (Debrecen, Inst. Nucl. Res.) and Ferenc Pittler (Pecs
  U.)","Poisson to Random Matrix Transition in the QCD Dirac Spectrum","10 pages, 9 eps figures, a few references added and typos corrected",,"10.1103/PhysRevD.86.114515",,"hep-lat cond-mat.dis-nn hep-ph hep-th","http://arxiv.org/licenses/nonexclusive-distrib/1.0/","  At zero temperature the lowest part of the spectrum of the QCD Dirac operator
is known to consist of delocalized modes that are described by random matrix
statistics. In the present paper we show that the nature of these eigenmodes
changes drastically when the system is driven through the finite temperature
cross-over. The lowest Dirac modes that are delocalized at low temperature
become localized on the scale of the inverse temperature. At the same time the
spectral statistics changes from random matrix to Poisson statistics. We
demonstrate this with lattice QCD simulations using 2+1 flavors of light
dynamical quarks with physical masses. Drawing an analogy with Anderson
transitions we also examine the mobility edge separating localized and
delocalized modes in the spectrum. We show that it scales in the continuum
limit and increases sharply with the temperature.
","[{""version"":""v1"",""created"":""Thu, 16 Aug 2012 20:01:51 GMT""},{""version"":""v2"",""created"":""Wed, 12 Sep 2012 14:14:48 GMT""}]","2013-05-30"
"1208.3476","Sameer Murthy","Kathrin Bringmann and Sameer Murthy","On the positivity of black hole degeneracies in string theory","v2: Typos corrected",,,,"hep-th math.NT","http://arxiv.org/licenses/nonexclusive-distrib/1.0/","  Certain helicity trace indices of charged states in N=4 and N=8 superstring
theory have been computed exactly using their explicit weakly coupled
microscopic description. These indices are expected to count the exact quantum
degeneracies of black holes carrying the same charges. In order for this
interpretation to be consistent, these indices should be positive integers. We
prove this positivity property for a class of four/five dimensional black holes
in type II string theory compactified on T^6/T^5 and on K3 \times T^2/S^1. The
proof relies on the mock modular properties of the corresponding generating
functions.
","[{""version"":""v1"",""created"":""Thu, 16 Aug 2012 20:06:33 GMT""},{""version"":""v2"",""created"":""Fri, 14 Sep 2012 17:27:05 GMT""}]","2012-09-17"
"1208.3477","Cms Collaboration","CMS Collaboration","Study of the dijet mass spectrum in pp to W + jets events at sqrt(s) = 7
  TeV","Replaced with published version. Added journal reference and DOI","Phys. Rev. Lett. 109 (2012) 251801","10.1103/PhysRevLett.109.251801","CMS-EWK-11-017; CERN-PH-EP-2012-226","hep-ex","http://arxiv.org/licenses/nonexclusive-distrib/1.0/","  We report an investigation of the invariant mass spectrum of the two jets
with highest transverse momentum in pp to W+2-jet and W+3-jet events to look
for resonant enhancements. The data sample corresponds to an integrated
luminosity of 5.0 inverse femtobarns collected with the CMS detector at sqrt(s)
= 7 TeV. We find no evidence for the anomalous structure reported by the CDF
Collaboration, and establish an upper limit of 5.0 pb at 95% confidence level
on the production cross section for a generic Gaussian signal with mass near
150 GeV. Additionally, we exclude two theoretical models that predict a
CDF-like dijet resonance near 150 GeV.
","[{""version"":""v1"",""created"":""Thu, 16 Aug 2012 20:12:33 GMT""},{""version"":""v2"",""created"":""Mon, 11 Mar 2013 14:13:34 GMT""}]","2013-03-12"
"1208.3478","Stijn van Tongeren","Gleb Arutyunov, Marius de Leeuw and Stijn J. van Tongeren","The Quantum Deformed Mirror TBA I","v2, 57 pages, 9 figures, as published","JHEP10(2012)090","10.1007/JHEP10(2012)090",,"hep-th","http://arxiv.org/licenses/nonexclusive-distrib/1.0/","  We derive the ground state thermodynamic Bethe ansatz equations for the
quantum deformation of the AdS_5 x S^5 mirror model, taking the deformation
parameter to be a root of unity. By virtue of the deformation, the resulting
equations show an interesting structure between a finite number of Y-functions.
","[{""version"":""v1"",""created"":""Thu, 16 Aug 2012 20:18:45 GMT""},{""version"":""v2"",""created"":""Wed, 17 Oct 2012 11:50:02 GMT""}]","2012-10-18"
