"1208.4471","David L. Clements","David L. Clements (Imperial College, London)","The AKARI Deep Field South: A New Home for Multiwavelength Extagalactic
  Astronomy","Invited review for the 2nd International AKARI Conference, accepted
  for publication in Publications of the Korean Astronomical Society",,,,"astro-ph.CO","http://arxiv.org/licenses/nonexclusive-distrib/1.0/","  The importance of multiwavelength astronomical surveys is discussed in the
context of galaxy evolution. The AKARI Deep Field South (ADF-S) is a new, well
placed survey field that is already the subject of studies at a wide range of
wavelengths. A number of ADF-S observational programmes are discussed and the
prospects for the ADF-S as a future resource for extragalactic astronomy is
explored.
","[{""version"":""v1"",""created"":""Wed, 22 Aug 2012 10:52:50 GMT""}]","2012-08-23"
"1208.4472","Cristian Bonato","Cristian Bonato, Jan Gudat, Keesjan de Vries, Hyochul Kim, Susanna M.
  Thon, Pierre M. Petroff, Martin P. van Exter and Dirk Bouwmeester","Optical modes in oxide-apertured micropillar cavities","4 pages, 3 figures",,"10.1364/OL.37.004678",,"cond-mat.mes-hall physics.optics quant-ph","http://arxiv.org/licenses/nonexclusive-distrib/1.0/","  We present a detailed experimental characterization of the spectral and
spatial structure of the confined optical modes for oxide-apertured micropillar
cavities, showing good-quality Hermite-Gaussian profiles, easily mode-matched
to external fields. We further derive a relation between the frequency
splitting of the transverse modes and the expected Purcell factor. Finally, we
describe a technique to retrieve the profile of the confining refractive index
distribution from the spatial profiles of the modes.
","[{""version"":""v1"",""created"":""Wed, 22 Aug 2012 10:53:18 GMT""},{""version"":""v2"",""created"":""Fri, 12 Oct 2012 11:09:03 GMT""}]","2015-06-11"
"1208.4473","Dipankar Chakrabarti","Jishnu Goswami, Chandan Mondal and Dipankar Chakrabarti","Series solution of a central potential problem with three-term recursion
  relation",,"JPMS 3(2), 10 (2013)",,,"math-ph math.MP quant-ph","http://arxiv.org/licenses/nonexclusive-distrib/1.0/","  The series solution of the radial part of the Schr\""odinger equation for
simultaneous coulomb and harmonic potential involves three-term recursion
relation and is thus difficult to solve for bound states. We have suggested a
simple method to solve for low lying states. Finite polynomial solutions exist
only if the coulomb and oscillator potentials are nontrivially related.
","[{""version"":""v1"",""created"":""Wed, 22 Aug 2012 10:54:18 GMT""}]","2013-08-12"
"1208.4475","Greg Ver Steeg","Greg Ver Steeg and Aram Galstyan","Information-Theoretic Measures of Influence Based on Content Dynamics","10 pages, 10 figures. In Proceedings of the 6th International
  Conference on Web Search and Data Mining. (v2: title change, v3: minor edits)",,,,"cs.SI physics.soc-ph stat.AP","http://arxiv.org/licenses/nonexclusive-distrib/1.0/","  The fundamental building block of social influence is for one person to
elicit a response in another. Researchers measuring a ""response"" in social
media typically depend either on detailed models of human behavior or on
platform-specific cues such as re-tweets, hash tags, URLs, or mentions. Most
content on social networks is difficult to model because the modes and
motivation of human expression are diverse and incompletely understood. We
introduce content transfer, an information-theoretic measure with a predictive
interpretation that directly quantifies the strength of the effect of one
user's content on another's in a model-free way. Estimating this measure is
made possible by combining recent advances in non-parametric entropy estimation
with increasingly sophisticated tools for content representation. We
demonstrate on Twitter data collected for thousands of users that content
transfer is able to capture non-trivial, predictive relationships even for
pairs of users not linked in the follower or mention graph. We suggest that
this measure makes large quantities of previously under-utilized social media
content accessible to rigorous statistical causal analysis.
","[{""version"":""v1"",""created"":""Wed, 22 Aug 2012 11:05:28 GMT""},{""version"":""v2"",""created"":""Mon, 17 Sep 2012 16:30:50 GMT""},{""version"":""v3"",""created"":""Sun, 2 Dec 2012 22:45:41 GMT""},{""version"":""v4"",""created"":""Fri, 15 Feb 2013 21:03:51 GMT""}]","2013-02-19"
"1208.4476","Ehsan Tavabi","E. Tavabi, S. Koutchmy","About the directional properties of Solar Spicules from Hough Transform
  analysis","11 pages, 2 figures",,"10.4236/jmp.2012.311223",,"astro-ph.SR","http://arxiv.org/licenses/nonexclusive-distrib/1.0/","  Spicules are intermittently rising above the surface of the Sun eruptions;
EUV jets are now also reported in immediately above layers. The variation of
spicule orientation with respect to the solar latitude, presumably reflecting
the confinement and the focusing of ejecta by the surrounding global coronal
magnetic field, is an important parameter to understand their dynamical
properties. A wealth of high resolution images of limb spicules are made
available in H CaII emission from the SOT Hinode mission. Furthermore, the
Hough transform is applied to the resulting images for making a statistical
analysis of spicule orientations in different regions around the solar limb,
from the pole to the equator. Spicules are visible in a radial direction in the
polar regions with a tilt angle (less than 200). The tilt angle is even reduced
to 10 degrees inside the coronal hole with open magnetic field lines and at the
lower latitude the tilt angle reaches values in excess of 50 degree.
","[{""version"":""v1"",""created"":""Wed, 22 Aug 2012 11:17:50 GMT""},{""version"":""v2"",""created"":""Fri, 31 Aug 2012 05:31:01 GMT""},{""version"":""v3"",""created"":""Thu, 27 Sep 2012 21:36:50 GMT""},{""version"":""v4"",""created"":""Sun, 31 Jan 2016 15:45:19 GMT""},{""version"":""v5"",""created"":""Sun, 25 Jul 2021 10:51:25 GMT""}]","2021-07-27"
"1208.4477","Pere Masjuan","P. Masjuan, E. R. Arriola, W. Broniowski","Radial and angular-momentum Regge trajectories: a systematic approach","3 pages, 9 figures, presented by PM at MESON2012 - 12th International
  Workshop on Meson Production, Properties and Interaction, Krakow, Poland, 31
  May - 5 June 2012",,"10.1051/epjconf/20123709024",,"hep-ph hep-lat nucl-th","http://arxiv.org/licenses/nonexclusive-distrib/1.0/","  We present the analysis of Ref.[1] of the radial (n) and angular-momentum (J)
Regge trajectories for all light-quark meson states listed in the Particle Data
Tables. The parameters of the trajectories are obtained with linear regression,
with weight of each resonance inversely proportional to its half-width squared,
(\Gamma/2)^2. The joint analysis in the (n,J,M^2) Regge plane indicates, at the
4.5 standard deviation level, that the slopes in n are larger from the slopes
in J. Thus no strict universality of slopes occurs in the light non-strange
meson sector. We also extend our analysis to the kaon sector.
","[{""version"":""v1"",""created"":""Wed, 22 Aug 2012 11:22:15 GMT""}]","2017-08-23"
"1208.4478","Klaus Werner","J. Adamczak, K. Werner, T. Rauch, S. Schuh, J. J. Drake, J. W. Kruk","Chandra grating spectroscopy of three hot white dwarfs","A&A, in press",,"10.1051/0004-6361/201219718",,"astro-ph.SR","http://arxiv.org/licenses/nonexclusive-distrib/1.0/","  High-resolution soft X-ray spectroscopic observations of single hot white
dwarfs are scarce. With the Chandra Low-Energy Transmission Grating, we have
observed two white dwarfs, one is of spectral type DA (LB 1919) and the other
is a non-DA of spectral type PG1159 (PG 1520+525). The spectra of both stars
are analyzed, together with an archival Chandra spectrum of another DA white
dwarf (GD 246). The soft X-ray spectra of the two DA white dwarfs are
investigated in order to study the effect of gravitational settling and
radiative levitation of metals in their photospheres. LB 1919 is of interest
because it has a significantly lower metallicity than DAs with otherwise
similar atmospheric parameters. GD 246 is the only white dwarf known that shows
identifiable individual iron lines in the soft X-ray range. For the PG1159
star, a precise effective temperature determination is performed in order to
confine the position of the blue edge of the GW Vir instability region in the
HRD. (abridged)
","[{""version"":""v1"",""created"":""Wed, 22 Aug 2012 11:25:09 GMT""}]","2015-06-11"
"1208.4479","Claudia Wulff Dr","Claudia Wulff (University of Surrey, United Kingdom) and Marcel Oliver
  (Jacobs University, Germany)","Exponentially accurate Hamiltonian embeddings of symplectic A-stable
  Runge--Kutta methods for Hamiltonian semilinear evolution equations",,,,,"math.NA math.DS","http://arxiv.org/licenses/nonexclusive-distrib/1.0/","  We prove that a class of A-stable symplectic Runge--Kutta time
semidiscretizations (including the Gauss--Legendre methods) applied to a class
of semilinear Hamiltonian PDEs which are well-posed on spaces of analytic
functions with analytic initial data can be embedded into a modified
Hamiltonian flow up to an exponentially small error. As a consequence, such
time-semidiscretizations conserve the modified Hamiltonian up to an
exponentially small error. The modified Hamiltonian is $O(h^p)$-close to the
original energy where $p$ is the order of the method and $h$ the time
step-size. Examples of such systems are the semilinear wave equation or the
nonlinear Schr\""odinger equation with analytic nonlinearity and periodic
boundary conditions. Standard Hamiltonian interpolation results do not apply
here because of the occurrence of unbounded operators in the construction of
the modified vector field. This loss of regularity in the construction can be
taken care of by projecting the PDE to a subspace where the operators occurring
in the evolution equation are bounded and by coupling the number of excited
modes as well as the number of terms in the expansion of the modified vector
field with the step size. This way we obtain exponential estimates of the form
$O(\exp(-c/h^{1/(1+q)}))$ with $c>0$ and $q \geq 0$; for the semilinear wave
equation, $q=1$, and for the nonlinear Schr\""odinger equation, $q=2$. We give
an example which shows that analyticity of the initial data is necessary to
obtain exponential estimates.
","[{""version"":""v1"",""created"":""Wed, 22 Aug 2012 11:36:17 GMT""},{""version"":""v2"",""created"":""Mon, 9 Feb 2015 19:14:07 GMT""}]","2015-02-10"
"1208.4480","Akira Endo","Yuto Kato, Akira Endo, Shingo Katsumoto, and Yasuhiro Iye","Geometric resonances in the magnetoresistance of hexagonal lateral
  superlattices","11 pages, 9 figures, minor revision","Phys. Rev. B 86, 235315 (2012)","10.1103/PhysRevB.86.235315",,"cond-mat.mes-hall","http://arxiv.org/licenses/nonexclusive-distrib/1.0/","  We have measured magnetoresistance of hexagonal lateral superlattices. We
observe three types of oscillations engendered by periodic potential modulation
having hexagonal-lattice symmetry: amplitude modulation of the Shubnikov-de
Haas oscillations, commensurability oscillations, and the geometric resonances
of open orbits generated by Bragg reflections. The latter two reveal the
presence of two characteristic periodicities, sqrt{3} a / 2 and a / 2, inherent
in a hexagonal lattice with the lattice constant a. The formation of the
hexagonal-superlattice minibands manifested by the observation of open orbits
marks the first step toward realizing massless Dirac fermions in semiconductor
2DEGs.
","[{""version"":""v1"",""created"":""Wed, 22 Aug 2012 11:36:55 GMT""},{""version"":""v2"",""created"":""Fri, 28 Dec 2012 03:22:34 GMT""}]","2013-01-01"
"1208.4481","Narayan Banerjee","Barun Majumder and Narayan Banerjee","Perfect Fluid Quantum Anisotropic Universe: Merits and Challenges","13 pages, 4 figures; Accepted for publication in Gen Relativ Gravit",,"10.1007/s10714-012-1446-0",,"gr-qc","http://arxiv.org/licenses/nonexclusive-distrib/1.0/","  The present paper deals with quantization of perfect fluid anisotropic
cosmological models. Bianchi type V and IX models are discussed following
Schutz's method of expressing fluid velocities in terms of six potentials. The
wave functions are found for several examples of equations of state. In one
case a complete wave packet could be formed analytically. The initial
singularity of a zero proper volume can be avoided in this case, but it is
plagued by the usual problem of non-unitarity of anisotropic quantum
cosmological models. It is seen that a particular operator ordering alleviates
this problem.
","[{""version"":""v1"",""created"":""Wed, 22 Aug 2012 11:47:28 GMT""}]","2015-06-11"
"1208.4482","Stephan Winnerl","S. Winnerl, R. Hubrich, M. Mittendorff, H. Schneider, M. Helm","Universal phase relation between longitudinal and transverse fields
  observed in focused terahertz beams",,,"10.1088/1367-2630/14/10/103049",,"physics.optics","http://arxiv.org/licenses/nonexclusive-distrib/1.0/","  We directly observe longitudinal electromagnetic fields in focused freely
propagating terahertz beams of radial and linear polarization. In accordance
with theory, the longitudinal fields are phase shifted by a value of pi/2 with
respect to the transverse field components. This behavior is found for all
frequency components of single cycle THz radiation pulses. Additionally we show
that the longitudinal field of a radially polarized THz beam has a smaller spot
size as compared to the transverse field of a linearly polarized beam, that is
focused under the same conditions.
","[{""version"":""v1"",""created"":""Wed, 22 Aug 2012 12:00:34 GMT""}]","2015-06-11"
"1208.4483","Hisashi Morioka","Hiroshi Isozaki and Hisashi Morioka","Inverse scattering at a fixed energy for discrere Schr\""{o}dinger
  operators on the square lattice","36 pages",,,,"math.SP math-ph math.MP","http://arxiv.org/licenses/nonexclusive-distrib/1.0/","  We study an inverse scattering problem for the discrete Schr\""{o}dinger
operator on the multi-dimensional square lattice, with compactly supported
potential. We show that the potential is uniquely reconstructed from a
scattering matrix for a fixed energy.
","[{""version"":""v1"",""created"":""Wed, 22 Aug 2012 12:09:22 GMT""},{""version"":""v2"",""created"":""Tue, 9 Oct 2012 04:35:31 GMT""}]","2012-10-10"
"1208.4484","Sruti  Gan Chaudhuri SGC","Sruti Gan Chaudhuri and Krishnendu Mukhopadhyaya","Leader Election and Gathering for Asynchronous Transparent Fat Robots
  without Chirality",,,,,"cs.DC","http://arxiv.org/licenses/nonexclusive-distrib/1.0/","  This paper proposes a distributed algorithm which deterministically gathers n
(n > 4) asynchronous, fat robots. The robots are assumed to be transparent and
they have full visibility. The robots are initially considered to be
stationary. A robot is visible in its motion. The robots do not store past
actions. They are anonymous and can not be distinguished by their appearances
and do not have common coordinate system or chirality. The robots do not
communicate through message passing. In the proposed gathering algorithm one
robot moves at a time towards its destination. The robot which moves, is
selected in such a way that, it will be the only robot eligible to move, until
it reaches its destination. In case of a tie, this paper proposes a leader
election algorithm which produces an ordering of the robots and the first robot
in the ordering becomes the leader. The ordering is unique in the sense that,
each robot, characterized by its location, agrees on the same ordering. We show
that if a set of robots can be ordered then they can gather deterministically.
The paper also characterizes the cases, where ordering is not possible. This
paper also presents an important fact that, if leader election is possible then
gathering pattern formation is possible even with no chirality.
","[{""version"":""v1"",""created"":""Wed, 22 Aug 2012 12:10:15 GMT""}]","2015-03-20"
"1208.4485","Kais  Ammari","K. Ammari, E. Feireisl and S. Nicaise","Polynomial stabilization of some dissipative hyperbolic systems",,,,,"math.AP","http://arxiv.org/licenses/nonexclusive-distrib/1.0/","  We study the problem of stabilization for the acoustic system with a
spatially distributed damping. Imposing various hypotheses on the structural
properties of the damping term, we identify either exponential or polynomial
decay of solutions with growing time. Expo- nential decay rate is shown by
means of a time domain approach, reducing the problem to an observability
inequality to be verified for solutions of the associated conservative problem.
In addition, we show a polynomial stabilization result, where the proof uses a
frequency domain method and combines a contradiction argument with the
multiplier technique to carry out a special analysis for the resolvent.
","[{""version"":""v1"",""created"":""Wed, 22 Aug 2012 12:10:53 GMT""}]","2012-08-23"
"1208.4486","James Dale","J. E. Dale, B. Ercolano, I. A. Bonnell","Ionization--induced star formation IV: Triggering in bound clusters","15 pages, 12 figures, to appear in MNRAS",,"10.1111/j.1365-2966.2012.22104.x",,"astro-ph.GA","http://arxiv.org/licenses/nonexclusive-distrib/1.0/","  We present a detailed study of star formation occurring in bound
star--forming clouds under the influence of internal ionizing feedback from
massive stars across a spectrum of cloud properties. We infer which objects are
triggered by comparing our feedback simulations with control simulations in
which no feedback was present. We find feedback always results in a lower
star--formation efficiency and usually but not always results in a larger
number of stars or clusters. Cluster mass functions are not strongly affected
by feedback, but stellar mass functions are biased towards lower masses.
Ionization also affects the geometrical distribution of stars in ways that are
robust against projection effects, but may make the stellar associations more
or less subclustered depending on the background cloud environment. We observe
a prominent pillar in one simulation which is the remains of an accretion flow
feeding the central ionizing cluster of its host cloud and suggest that this
may be a general formation mechanism for pillars such as those observed in M16.
We find that the association of stars with structures in the gas such as shells
or pillars is a good but by no means foolproof indication that those stars have
been triggered and we conclude overall that it is very difficult to deduce
which objects have been induced to form and which formed spontaneously simply
from observing the system at a single time.
","[{""version"":""v1"",""created"":""Wed, 22 Aug 2012 12:23:36 GMT""}]","2015-06-11"
"1208.4487","Xiang-Dong Li","Lei Fu and Xiang-Dong Li (NJU)","Could SXP 1062 be an Accreting Magnetar?","19 pages, 4 figures, accepted for publication in ApJ",,"10.1088/0004-637X/757/2/171",,"astro-ph.HE","http://arxiv.org/licenses/nonexclusive-distrib/1.0/","  In this work we explore the possible evolutionary track of the neutron star
in the newly discovered Be/X-ray binary SXP 1062, which is believed to be the
first X-ray pulsar associated with a supernova remnant. Although no cyclotron
feature has been detected to indicate the strength of the neutron star's
magnetic field, we show that it may be $\ga 10^{14} $G. If so SXP 1062 may
belong to the accreting magnetars in binary systems. We attempt to reconcile
the short age and long spin period of the pulsar taking account of different
initial parameters and spin-down mechanisms of the neutron star. Our calculated
results show that, to spin down to a period $\sim 1000 $s within $10-40 $kyr
requires efficient propeller mechanisms. In particular, the model for angular
momentum loss under energy conservation seems to be ruled out.
","[{""version"":""v1"",""created"":""Wed, 22 Aug 2012 12:46:49 GMT""}]","2015-06-11"
"1208.4488","Dana P. Williams","Siegfried Echterhoff and Dana P. Williams","Structure of crossed products by strictly proper actions on
  continuous-trace algebras","25 Pages",,,,"math.OA","http://arxiv.org/licenses/nonexclusive-distrib/1.0/","  We examine the ideal structure of crossed products B\rtimes G where B is a
continuous-trace C*-algebra and the induced action of G on the spectrum of B is
proper. In particular, we are able to obtain a concrete description of the
topology on the spectrum of the crossed product in the cases where either G is
discrete or G is a Lie group acting smoothly on the spectrum of B.
","[{""version"":""v1"",""created"":""Wed, 22 Aug 2012 12:49:36 GMT""}]","2012-08-23"
"1208.4489","Tomoya Hirota","Tomoya Hirota, Mi Kyoung Kim, and Mareki Honma","The first detection of the 232 GHz vibrationally excited H2O maser in
  Orion KL with ALMA","11 pages, 4 figures, accepted for publication in ApJL",,"10.1088/2041-8205/757/1/L1",,"astro-ph.SR astro-ph.GA","http://arxiv.org/licenses/nonexclusive-distrib/1.0/","  We investigated the ALMA science verification data of Orion KL and found a
spectral signature of the vibrationally excited H2O maser line at 232.68670 GHz
(nu2=1, 5,5,0-6,4,3). This line has been detected in circumstellar envelopes of
late-type stars so far but not in young stellar objects including Orion KL.
Thus, this is the first detection of the 232 GHz vibrationally excited H2O
maser in star-forming regions. The distribution of the 232 GHz maser is
concentrated at the position of the radio Source I, which is remarkably
different from other molecular lines. The spectrum shows a double-peak
structure at the peak velocities of -2.1 and 13.3 km s-1. It appears to be
consistent with the 22 GHz H2O masers and 43 GHz SiO masers observed around
Source I. Thus, the 232 GHz H2O maser around Source I would be excited by the
internal heating by an embedded protostar, being associated with either the
root of the outflows/jets or the circumstellar disk around Source I, as traced
by the 22 GHz H2O masers or 43 GHz SiO masers, respectively.
","[{""version"":""v1"",""created"":""Wed, 22 Aug 2012 12:54:55 GMT""}]","2015-06-11"
"1208.4490","Wojciech Zabo{\l}otny PhD","Wojciech M. Zabolotny","Efficient transmission of measurement data from FPGA to embedded system
  via Ethernet link",,,,,"cs.NI","http://arxiv.org/licenses/nonexclusive-distrib/1.0/","  This paper presents a system consisting of the FPGA IP core, the simple
network protocol and the Linux device driver, capable of efficient and reliable
data transmission from a low resources FPGA chip to the Linux-based embedded
computer system, via a private Ethernet network (consisting of a single segment
or a few segments connected via an Ethernet switch). The embedded system may
optionally process the acquired data, and distribute them further, using
standard network protocols. Proposed design targets cost-efficient multichannel
data acquisition systems, in which multiple FPGA based front end boards (FEB)
should transmit the stream of acquired data to the computer network,
responsible for their final processing and archiving. The presented solution
allows to minimize the cost of data concentration due to use of inexpensive
Ethernet network infrastructure. The work is mainly focused on minimization of
resources consumption in the FPGA, and minimization of acknowledge latency in
the Linux based system - which allows to achieve high throughput in spite of
use of inexpensive FPGA chips with small internal memory.
","[{""version"":""v1"",""created"":""Wed, 22 Aug 2012 12:56:36 GMT""},{""version"":""v2"",""created"":""Wed, 5 Sep 2012 07:20:20 GMT""},{""version"":""v3"",""created"":""Mon, 17 Sep 2012 18:27:37 GMT""},{""version"":""v4"",""created"":""Sun, 30 Sep 2012 13:56:43 GMT""}]","2012-10-02"
"1208.4491","Usha Devi A. R.","A. R. Usha Devi, H. S. Karthik, Sudha and A. K. Rajagopal","Macrorealism from entropic Leggett-Garg inequalities","5 pages, RevTeX, 2 eps figures, Accepted for publication in Phys.
  Rev. A","Phys. Rev. A 87, 052103 (2013)","10.1103/PhysRevA.87.052103",,"quant-ph","http://arxiv.org/licenses/nonexclusive-distrib/1.0/","  We formulate entropic Leggett-Garg inequalities, which place constraints on
the statistical outcomes of temporal correlations of observables. The
information theoretic inequalities are satisfied if macrorealism holds. We show
that the quantum statistics underlying correlations between time-separated spin
component of a quantum rotor mimics that of spin correlations in two spatially
separated spin-$s$ particles sharing a state of zero total spin. This brings
forth the violation of the entropic Leggett-Garg inequality by a rotating
quantum spin-$s$ system in similar manner as does the entropic Bell inequality
(Phys. Rev. Lett. 61, 662 (1988)) by a pair of spin-$s$ particles forming a
composite spin singlet state.
","[{""version"":""v1"",""created"":""Wed, 22 Aug 2012 12:59:53 GMT""},{""version"":""v2"",""created"":""Wed, 29 Aug 2012 15:40:00 GMT""},{""version"":""v3"",""created"":""Fri, 26 Apr 2013 16:37:54 GMT""}]","2013-05-21"
