"1208.4359","Brad Barlow","Brad N. Barlow, Richard A. Wade, Sandra E. Liss, Roy H. {\O}stensen,
  Hans Van Winckel","A Radial Velocity Study of Composite-Spectra Hot Subdwarf Stars with the
  Hobby-Eberly Telescope","Published in The Astrophysical Journal, Volume 758, Issue 1, article
  id. 58 (2012). References updated and Equation (5) corrected. 12 pages, 5
  figures, 5 tables",,"10.1088/0004-637X/758/1/58",,"astro-ph.SR","http://arxiv.org/licenses/nonexclusive-distrib/1.0/","  Many hot subdwarf stars show composite spectral energy distributions
indicative of cool main sequence companions. Binary population synthesis (BPS)
models demonstrate such systems can be formed via Roche lobe overflow or common
envelope evolution but disagree on whether the resulting orbital periods will
be long (years) or short (days). Few studies have been carried out to assess
the orbital parameters of these spectroscopic composite binaries; current
observations suggest the periods are long. To help address this problem, we
selected fifteen moderately-bright (V~13) hot subdwarfs with F-K dwarf
companions and monitored their radial velocities (RVs) from January 2005 to
July 2008 using the bench-mounted Medium Resolution Spectrograph on the
Hobby-Eberly Telescope (HET). Here we describe the details of our observing,
reduction, and analysis techniques and present preliminary results for all
targets. By combining the HET data with recent observations from the Mercator
telescope, we are able to calculate precise orbital solutions for three systems
using more than 6 years of observations. We also present an up-to-date period
histogram for all known hot subdwarf binaries, which suggests those with F-K
main sequence companions tend to have orbital periods on the order of several
years. Such long periods challenge the predictions of conventional BPS models,
although a larger sample is needed for a thorough assessment of the models'
predictive success. Lastly, one of our targets has an eccentric orbit, implying
some composite-spectrum systems might have formerly been hierarchical triple
systems, in which the inner binary merged to create the hot subdwarf.
","[{""version"":""v1"",""created"":""Tue, 21 Aug 2012 20:00:00 GMT""},{""version"":""v2"",""created"":""Wed, 17 Oct 2012 16:21:08 GMT""}]","2015-06-11"
"1208.4360","David Henley","David B. Henley, Robin L. Shelton (University of Georgia)","An XMM-Newton Survey of the Soft X-ray Background. II. An All-Sky
  Catalog of Diffuse O VII and O VIII Emission Intensities","Accepted for publication in the Astrophysical Journal Supplement
  Series. 29 pages (main body of paper) plus 85 pages (full versions of Tables
  1, 2, and 4 - these tables will be published as machine-readable tables in
  the journal, and appear in abbreviated form in the main body of the paper).
  12 figures. v2: Minor corrections, conclusions unaltered",,"10.1088/0067-0049/202/2/14",,"astro-ph.GA","http://arxiv.org/licenses/nonexclusive-distrib/1.0/","  We present an all-sky catalog of diffuse O VII and O VIII line intensities,
extracted from archival XMM observations. The O VII and O VIII intensities are
typically ~2-11 and <~3 ph/cm^2/s/sr (LU), respectively, although much brighter
intensities were also recorded. Our data set includes 217 directions observed
multiple times by XMM. The time variation of the intensities from such
directions may be used to constrain SWCX models. The O VII and O VIII
intensities typically vary by <~5 and <~2 LU between repeat observations,
although several intensity enhancements of >10 LU were observed. We compared
our measurements with SWCX models. The heliospheric SWCX intensity is expected
to vary with ecliptic latitude and solar cycle. We found that the observed
oxygen intensities generally decrease from solar maximum to solar minimum, both
at high ecliptic latitudes (as expected) and at low ecliptic latitudes (not as
expected). The geocoronal SWCX intensity is expected to depend on the solar
wind proton flux and on the sightline's path through the magnetosheath. The
intensity variations seen in directions that have been observed multiple times
are in poor agreement with the predictions of a geocoronal SWCX model. The
oxygen lines account for ~40-50% of the 3/4 keV X-ray background that is not
due to unresolved AGN, in good agreement with a previous measurement. However,
this fraction is not easily explained by a combination of SWCX emission and
emission from hot plasma in the halo. The line intensities tend to increase
with longitude toward the inner Galaxy, possibly due to an increase in the
supernova rate in that direction or the presence of a halo of accreted material
centered on the Galactic Center. The variation of intensity with Galactic
latitude differs in different octants of the sky, and cannot be explained by a
single simple plane-parallel or constant-intensity halo model. (Abridged)
","[{""version"":""v1"",""created"":""Tue, 21 Aug 2012 20:00:02 GMT""},{""version"":""v2"",""created"":""Wed, 5 Sep 2012 18:18:11 GMT""}]","2015-06-11"
"1208.4361","Yang Bai","Yang Bai and Tim M. P. Tait","Searches with Mono-Leptons","four pages; six figures; the LHC 8 TeV results have been updated;
  final version in PLB","Phys.Lett.B723:384-387,2013","10.1016/j.physletb.2013.05.057","SLAC-PUB-15221; UCI-HEP-TR-2012-11","hep-ph hep-ex","http://arxiv.org/licenses/nonexclusive-distrib/1.0/","  We explore the implications of the mono-lepton plus missing transverse energy
signature at the LHC, and point out its significance on understanding how dark
matter interacts with quarks, where the signature arises from dark matter pair
production together with a leptonically decaying W boson radiated from the
initial state quarks. We derive limits using the existing W' searches at the
LHC, and find an interesting interference between the contributions from dark
matter couplings to up-type and down-type quarks. Mono-leptons can actually
furnish the strongest current bound on dark matter interactions for axial
vector (spin-dependent) interactions and iso-spin violating couplings. Should a
signal of dark matter production be observed, this process can also help
disentangle the dark matter couplings to up- and down-type quarks.
","[{""version"":""v1"",""created"":""Tue, 21 Aug 2012 20:00:02 GMT""},{""version"":""v2"",""created"":""Wed, 19 Jun 2013 20:10:56 GMT""}]","2015-03-20"
"1208.4362","Valentino Gonzalez","Valentino Gonzalez, Rychard Bouwens, Garth llingworth, Ivo Labbe,
  Pascal Oesch, Marijn Franx, and Dan Magee","Slow Evolution of the Specific Star Formation Rate at z>2: The Impact of
  Dust, Emission Lines, and A Rising Star Formation History","15 pages, 10 figures, 2 tables. Update from v1: after second referee
  report, improved (larger) sample at z~6",,"10.1088/0004-637X/781/1/34",,"astro-ph.CO","http://arxiv.org/licenses/nonexclusive-distrib/1.0/","  We measure the evolution of the specific star formation rate (sSFR = SFR /
Mstellar) between redshift 4 and 6 to investigate the previous reports of
""constant"" sSFR at z>2. We obtain photometry on a large sample of galaxies at
z~4-6 located in the GOODS-S field that have high quality imaging from HST and
Spitzer. We have derived stellar masses and star formation rates (SFRs) through
stellar population modeling of their spectral energy distributions (SEDs). We
estimate the dust extinction from the observed UV colors. In the SED fitting
process we have studied the effects of assuming a star formation history (SFH)
both with constant SFR and one where the SFR rises exponentially with time. The
latter SFH is chosen to match the observed evolution of the UV luminosity
function. We find that neither the mean SFRs nor the mean stellar masses change
significantly when the rising SFR (RSF) model is assumed instead of the
constant SFR model. When focusing on galaxies with Mstar ~ 5x10^9 Msun, we find
that the sSFR evolves weakly with redshift (sSFR(z) \propto (1+z)^(0.6+/-0.1)
Gyr^-1), consistent with previous results and with recent estimates of the sSFR
at z~2-3 using similar assumptions. We have also investigated the impact of
optical emission lines on our results. We estimate that the contribution of
emission lines to the rest-frame optical fluxes is only modest at z~4 and 5 but
it could reach ~50% at z~6. When emission lines of this strength are taken into
account, the sSFR shows somewhat higher values at high redshifts, according to
the relation sSFR(z) \propto (1+z)^(1.0+/-0.1) Gyr^-1, i.e., ~2.3x higher at
z~6 than at z~2. However, the observed evolution is substantially weaker than
that found at z<2 or that expected from current models (which corresponds to
sSFR(z) \propto (1+z)^(2.5) Gyr^-1). -abridged-
","[{""version"":""v1"",""created"":""Tue, 21 Aug 2012 20:00:02 GMT""},{""version"":""v2"",""created"":""Sat, 21 Sep 2013 00:56:41 GMT""}]","2015-06-11"
"1208.4363","Daniel Szomoru","Daniel Szomoru, Marijn Franx, Pieter G. van Dokkum, Michele Trenti,
  Garth D. Illingworth, Ivo Labbe, Pascal Oesch","The stellar mass structure of massive galaxies from z=0 to z=2.5;
  surface density profiles and half-mass radii","11 pages, 8 figures, 3 tables, accepted for publication in ApJ",,"10.1088/0004-637X/763/2/73",,"astro-ph.CO","http://arxiv.org/licenses/nonexclusive-distrib/1.0/","  We present stellar mass surface density profiles of a mass-selected sample of
177 galaxies at 0.5 < z < 2.5, obtained using very deep HST optical and
near-infrared data over the GOODS-South field, including recent CANDELS data.
Accurate stellar mass surface density profiles have been measured for the first
time for a complete sample of high-redshift galaxies more massive than 10^10.7
M_sun. The key advantage of this study compared to previous work is that the
surface brightness profiles are deconvolved for PSF smoothing, allowing
accurate measurements of the structure of the galaxies. The surface brightness
profiles account for contributions from complex galaxy structures such as rings
and faint outer disks. Mass profiles are derived using radial rest-frame u-g
color profiles and a well-established empirical relation between these colors
and the stellar mass-to-light ratio. We derive stellar half-mass radii from the
mass profiles, and find that these are on average ~25% smaller than rest-frame
g band half-light radii. This average size difference of 25% is the same at all
redshifts, and does not correlate with stellar mass, specific star formation
rate, effective surface density, Sersic index, or galaxy size. Although on
average the difference between half-mass size and half-light size is modest,
for approximately 10% of massive galaxies this difference is more than a factor
two. These extreme galaxies are mostly extended, disk-like systems with large
central bulges. These results are robust, but could be impacted if the central
dust extinction becomes high. ALMA observations can be used to explore this
possibility. These results provide added support for galaxy growth scenarios
wherein massive galaxies at these epochs grow by accretion onto their outer
regions.
","[{""version"":""v1"",""created"":""Tue, 21 Aug 2012 20:00:02 GMT""},{""version"":""v2"",""created"":""Mon, 3 Dec 2012 17:25:38 GMT""}]","2015-06-11"
"1208.4364","Kari Helgason","Kari Helgason and Alexander Kashlinsky","Reconstructing the \gamma-ray Photon Optical Depth of the Universe to
  z~4 from Multiwavelength Galaxy Survey Data","5 pages, 5 figures. Published in ApJ Letters",,"10.1088/2041-8205/758/1/L13",,"astro-ph.CO","http://arxiv.org/licenses/nonexclusive-distrib/1.0/","  We reconstruct \gamma-ray opacity of the Universe out to z<3-4 using an
extensive library of 342 observed galaxy luminosity function surveys extending
to high redshifts. We cover the whole range from UV to mid-IR (0.15-25mic)
providing for the first time a robust empirical calculation of the
\gamma\gamma-optical depth out to several TeV. Here, we use the same database
as Helgason et al. 2012 where the EBL was reconstructed from luminosity
functions out to 4.5mic and was shown to recover observed galaxy counts to high
accuracy. We extend our earlier library of LFs to 25mic such that it covers the
energy range of pair production with \gamma-rays 1) in the entire Fermi/LAT
energy range, and 2) at higher TeV energies probed by ground-based Cherenkov
telescopes. In the absence of significant contributions to the cosmic diffuse
background from unknown populations, such as the putative Population III era
sources, the Universe appears to be largely transparent to \gamma-rays at all
Fermi/LAT energies out to z~2 whereas becoming opaque to TeV photons already at
z<0.2 and reaching \tau~10 at z=1. Comparing with the currently available
Fermi/LAT GRB and blazar data shows that there is room for significant
emissions originating in the first stars era.
","[{""version"":""v1"",""created"":""Tue, 21 Aug 2012 20:00:03 GMT""},{""version"":""v2"",""created"":""Sat, 22 Sep 2012 16:38:53 GMT""}]","2015-06-11"
"1208.4365","Alberto Sesana","Alberto Sesana, Nicola Sartore, Bernadetta Devecchi, Andrea Possenti","Halo millisecond pulsars ejected by intermediate mass black holes in
  globular clusters","13 pages, 7 figures, 2 tables, accepted for publication in MNRAS",,"10.1111/j.1365-2966.2012.21958.x",,"astro-ph.GA","http://arxiv.org/licenses/nonexclusive-distrib/1.0/","  Intermediate mass black holes (IMBHs) are among the most elusive objects in
contemporary astrophysics. Both theoretical and observational evidence of their
existence is subject of debate. Conversely, both theory and observations
confirm the presence of a large population of millisecond pulsars (MSPs) with
low mass companions residing in globular cluster (GC) centers. If IMBHs are
common in GC centers as well, then dynamical interactions will inevitably break
up many of these binaries, causing the ejection of several fast MSPs in the
Galactic halo. Such population of fast halo MSPs, hard to produce with
'standard' MSP generation mechanisms, would provide a strong, albeit indirect,
evidence of the presence of a substantial population of IMBHs in GCs. In this
paper we study in detail the dynamical formation and evolution of such fast
MSPs population, highlighting the relevant observational properties and
assessing detection prospects with forthcoming radio surveys.
","[{""version"":""v1"",""created"":""Tue, 21 Aug 2012 20:00:03 GMT""}]","2015-06-11"
"1208.4366","Molly Peeples","Molly S. Peeples and Rachel S. Somerville","An empirical prediction for stellar metallicity distributions in nearby
  galaxies","8 pages, 2 figures, 2 tables. MNRAS, in press","Mon. Not. Roy. Astron. Soc. 428:1766-1773, 2013","10.1093/mnras/sts158",,"astro-ph.CO","http://arxiv.org/licenses/nonexclusive-distrib/1.0/","  We combine star-formation histories derived from observations of high
redshift galaxies with measurements of the z~0 relation between gas-phase
metallicity, stellar mass, and star formation rate to make an explicit and
completely empirical connection between near-field and distant galaxy
observations. Our approach relies on two basic assumptions: 1) galaxies'
average paths through time in stellar mass vs. star formation rate space are
represented by a family of smooth functions that are determined by the
galaxies' final stellar mass, and 2) galaxies grow and become enriched with
heavy elements such that they always evolve along the mass--metallicity--star
formation rate relation. By integrating over these paths, we can track the
chemical evolution of stars in galaxies in a model independent way, without the
need for explicit assumptions about gas inflow, outflow, or star formation
efficiency. Using this approach, we present predictions of stellar metallicity
(i.e., O/H) distribution functions for present day star-forming galaxies of
different stellar masses and the evolution of the alpha-element stellar
metallicity-mass relation since z~1. The metallicity distribution functions are
fairly well described as Gaussians, truncated at high metallicity, with
power-law tails to low metallicity. We find that the stellar metallicity
distribution for Milky Way mass galaxies is in reasonable agreement with
observations for our Galaxy, and that the predicted stellar mass vs. mean
stellar metallicity relation at z=0 agrees quite well with results derived from
galaxy surveys. This validates the assumptions that are implicit in our simple
approach. Upcoming observations will further test these assumptions and their
range of validity, by measuring the mean stellar mass-metallicity relation up
to z~1, and by measuring the stellar metallicity distributions over a range of
galaxy masses.
","[{""version"":""v1"",""created"":""Tue, 21 Aug 2012 20:00:05 GMT""},{""version"":""v2"",""created"":""Mon, 8 Oct 2012 17:21:08 GMT""}]","2013-01-16"
"1208.4367","Kari Helgason","Kari Helgason, Massimo Ricotti and Alexander Kashlinsky","Can the Near-IR Fluctuations Arise from Known Galaxy Populations?","3 pages, 2 figures. To appear in proceedings of First Stars IV
  meeting (Kyoto, Japan; 2012)",,"10.1063/1.4754390",,"astro-ph.CO","http://arxiv.org/licenses/nonexclusive-distrib/1.0/","  Spatial Fluctuations in the Cosmic Infrared Background have now been measured
out to sub-degree scales showing a strong clustering signal from unresolved
sources. We attempt to explain these measurement by considering faint galaxy
populations at z<6 as the underlying sources for this signal using 233 measured
UV, optical and NIR luminosity functions (LF) from a variety of surveys
covering a wide range of redshifts. We populate the lightcone and calculate the
total emission redshifted into the near-IR bands in the observer frame and
recover the observed optical and near-IR galaxy counts to a good accuracy.
Using a halo model for the clustering of galaxies with an underlying LCDM
density field, we find that fluctuations from known galaxy populations are
unable to account for the large scale CIB clustering signal seen by HST/NICMOS,
Spitzer/IRAC and AKARI/IRC and continue to diverge out to larger angular
scales. Our purely empirical reconstruction shows that known galaxy populations
are not responsible for the bulk of the fluctuation signal seen in the
measurements and suggests an unknown population of very faint and highly
clustered sources dominating the signal.
","[{""version"":""v1"",""created"":""Tue, 21 Aug 2012 20:00:18 GMT""}]","2015-06-11"
"1208.4368","Kamesh Namuduri","Kamesh Namuduri, Li Li, Mahadevan Gomathisankaran, Murali Varanasi","The Chief Security Officer Problem","20 pages and 8 figures",,,,"cs.CR","http://arxiv.org/licenses/nonexclusive-distrib/1.0/","  This paper presents the chief security officer (CSO) problem, defines its
scope, and investigates several important research questions related within the
scope. The CSO problem is defined based on the concept of secrecy capacity of
wireless communication channels. It is also related to the chief
Estimation/Executive Officer (CEO) problem that has been well studied in
information theory. The CSO problem consists of a CSO, several agents capable
of having two-way communication with the CSO, and a group of eavesdroppers.
There are two scenarios in the CSO problem; one in which agents are not allowed
to cooperate with one another and the other in which agents are allowed to
cooperate with one another. While there are several research questions relevant
to the CSO problem, this paper focusses on the following and provides answers:
(1) How much information can be exchanged back and forth between the CSO and
the agents without leaking any information to the eavesdroppers? (2) What is
the power allocation strategy that the CSO needs to follow so as to maximize
the secrecy capacity? (3) How can agents cooperate with one another in order to
increase the overall secrecy capacity?.
","[{""version"":""v1"",""created"":""Tue, 21 Aug 2012 20:02:12 GMT""}]","2012-08-23"
"1208.4369","Dustin Ross","Dustin Ross","The Loop Murnaghan-Nakayama Rule","13 pages, published version","Journal of Algebraic Combinatorics 39 (2014), 3-15",,,"math.CO","http://arxiv.org/licenses/nonexclusive-distrib/1.0/","  We give a combinatorial proof of a natural generalization of the
Murnaghan-Nakayama rule to loop Schur functions. We also define shifted loop
Schur functions and prove that they satisfy a similar relation.
","[{""version"":""v1"",""created"":""Tue, 21 Aug 2012 20:04:55 GMT""},{""version"":""v2"",""created"":""Tue, 4 Sep 2012 15:00:57 GMT""},{""version"":""v3"",""created"":""Thu, 8 Jan 2015 20:31:39 GMT""}]","2015-01-09"
"1208.4370","David Polishook","D. Polishook, R. P. Binzel, M. Lockhart, F. E. DeMeo, W. Golisch, S.
  J. Bus, A. A. S. Gulbis","Spectral and Spin Measurement of Two Small and Fast-Rotating Near-Earth
  Asteroids","4 pages, 3 figures, accepted for publication in Icarus",,"10.1016/j.icarus.2012.08.013",,"astro-ph.EP","http://arxiv.org/licenses/nonexclusive-distrib/1.0/","  In May 2012 two asteroids made near-miss ""grazing"" passes at distances of a
few Earth-radii: 2012 KP24 passed at nine Earth-radii and 2012 KT42 at only
three Earth-radii. The latter passed inside the orbital distance of
geosynchronous satellites. From spectral and imaging measurements using NASA's
3-m Infrared Telescope Facility (IRTF), we deduce taxonomic, rotational, and
physical properties. Their spectral characteristics are somewhat atypical among
near-Earth asteroids: C-complex for 2012 KP24 and B-type for 2012 KT42, from
which we interpret the albedos of both asteroids to be between 0.10 and 0.15
and effective diameters of 20+-2 and 6+-1 meters, respectively. Among B-type
asteroids, the spectrum of 2012 KT42 is most similar to 3200 Phaethon and 4015
Wilson-Harrington. Not only are these among the smallest asteroids spectrally
measured, we also find they are among the fastest-spinning: 2012 KP24 completes
a rotation in 2.5008+-0.0006 minutes and 2012 KT42 rotates in 3.634+-0.001
minutes.
","[{""version"":""v1"",""created"":""Tue, 21 Aug 2012 20:04:58 GMT""}]","2015-06-11"
"1208.4371","Glenn Barnich","Glenn Barnich","Entropy of three-dimensional asymptotically flat cosmological solutions","16 pages Latex file, v2: references added, cosmetic changes, v3: 1
  reference added","HEP 1210 (2012) 095","10.1007/JHEP10(2012)095","ULB-TH/12-14","hep-th gr-qc","http://arxiv.org/licenses/nonexclusive-distrib/1.0/","  The thermodynamics of three-dimensional asymptotically flat cosmological
solutions that play the same role than the BTZ black holes in the anti-de
Sitter case is derived and explained from holographic properties of flat space.
It is shown to coincide with the flat-space limit of the thermodynamics of the
inner black hole horizon on the one hand and the semi-classical approximation
to the gravitational partition function associated to the entropy of the outer
horizon on the other. This leads to the insight that it is the Massieu function
that is universal in the sense that it can be computed at either horizon.
","[{""version"":""v1"",""created"":""Tue, 21 Aug 2012 20:10:01 GMT""},{""version"":""v2"",""created"":""Sun, 14 Oct 2012 14:25:40 GMT""},{""version"":""v3"",""created"":""Fri, 2 Nov 2012 17:23:43 GMT""}]","2012-11-05"
"1208.4372","Arjun Bagchi","Arjun Bagchi, Stephane Detournay, Reza Fareghbal, Joan Simon","Holography of 3d Flat Cosmological Horizons","5 pages; v2: Typos corrected, references updated","Phys. Rev. Lett. 110, 141302 (2013)","10.1103/PhysRevLett.110.141302","EMPG-12-18","hep-th","http://arxiv.org/licenses/nonexclusive-distrib/1.0/","  We provide a first derivation of the Bekenstein-Hawking entropy of 3d flat
cosmological horizons in terms of the counting of states in a dual field
theory. These horizons appear in the shifted-boost orbifold of R^{1,2}, the
flat limit of non-extremal rotating BTZ black holes. These 3d geometries carry
non-zero charges under the asymptotic symmetry algebra of R^{1,2}, the 3d
Bondi-Metzner-Sachs (BMS3) algebra. The dual theory has the symmetries of the
2d Galilean Conformal Algebra, a contraction of two copies of the Virasoro
algebra, which is isomorphic to BMS3. We study flat holography as a limit of
AdS3/CFT2 to semi-classically compute the density of states in the dual,
exactly reproducing the bulk entropy in the limit of large charges. Our flat
horizons, remnants of the BTZ inner horizons also satisfy a first law of
thermodynamics. We comment on how the dual theory reproduces the bulk first law
and how cosmological bulk excitations are matched with boundary quantum
numbers.
","[{""version"":""v1"",""created"":""Tue, 21 Aug 2012 20:12:23 GMT""},{""version"":""v2"",""created"":""Sat, 22 Sep 2012 11:00:00 GMT""}]","2013-06-11"
"1208.4373","Hongjie Dong","Hongjie Dong, Nicolai V. Krylov","On the existence of smooth solutions for fully nonlinear parabolic
  equations with measurable ""coefficients"" without convexity assumptions","29 pages, submitted. arXiv admin note: substantial text overlap with
  arXiv:1203.1298",,,,"math.AP","http://arxiv.org/licenses/nonexclusive-distrib/1.0/","  We show that for any uniformly parabolic fully nonlinear second-order
equation with bounded measurable ""coefficients"" and bounded ""free"" term in any
cylindrical smooth domain with smooth boundary data one can find an
approximating equation which has a unique continuous solution with the first
derivatives bounded and the second spacial derivatives locally bounded. The
approximating equation is constructed in such a way that it modifies the
original one only for large values of the unknown function and its spacial
derivatives.
","[{""version"":""v1"",""created"":""Tue, 21 Aug 2012 20:13:38 GMT""}]","2012-08-23"
