"1208.4410","Miodrag-Cristian Iovanov","S. Dascalescu, M. C. Iovanov, C. Nastasescu","Quiver Algebras, Path Coalgebras and co-reflexivity","23 pages, to appear, Pacific Journal of Mathematics",,,,"math.RT math.RA","http://arxiv.org/licenses/nonexclusive-distrib/1.0/","  We study the connection between two combinatorial notions associated to a
quiver: the quiver algebra and the path coalgebra. We show that the quiver
coalgebra can be recovered from the quiver algebra as a certain type of finite
dual, and we show precisely when the path coalgebra is the classical finite
dual of the quiver algebra, and when all finite dimensional quiver
representations arise as comodules over the path coalgebra. We discuss when the
quiver algebra can be recovered as the rational part of the dual of the path
coalgebra. Similar results are obtained for incidence (co)algebras. We also
study connections to the notion of coreflexive (co)algebras, and give a partial
answer to an open problem concerning tensor products of coreflexive coalgebras.
","[{""version"":""v1"",""created"":""Wed, 22 Aug 2012 01:45:20 GMT""}]","2012-08-23"
"1208.4411","Ahmed Hefny","Avinava Dubey, Ahmed Hefny, Sinead Williamson, Eric P. Xing","A non-parametric mixture model for topic modeling over time","9 pages",,,,"stat.ML","http://arxiv.org/licenses/nonexclusive-distrib/1.0/","  A single, stationary topic model such as latent Dirichlet allocation is
inappropriate for modeling corpora that span long time periods, as the
popularity of topics is likely to change over time. A number of models that
incorporate time have been proposed, but in general they either exhibit limited
forms of temporal variation, or require computationally expensive inference
methods. In this paper we propose non-parametric Topics over Time (npTOT), a
model for time-varying topics that allows an unbounded number of topics and
exible distribution over the temporal variations in those topics' popularity.
We develop a collapsed Gibbs sampler for the proposed model and compare against
existing models on synthetic and real document sets.
","[{""version"":""v1"",""created"":""Wed, 22 Aug 2012 02:02:40 GMT""}]","2015-03-20"
"1208.4412","Christopher Kelly","RBC Collaboration and UKQCD Collaboration: R. Arthur, T. Blum, P. A.
  Boyle, N. H. Christ, N. Garron, R. J. Hudspith, T. Izubuchi, C. Jung, C.
  Kelly, A. T. Lytle, R. D. Mawhinney, D. Murphy, S. Ohta, C. T. Sachrajda, A.
  Soni, J. Yu, J. M. Zanotti","Domain Wall QCD with Near-Physical Pions","95 pages, 23 figures. Added missing author to metadata","Phys.Rev. D87 (2013) 094514","10.1103/PhysRevD.87.094514",,"hep-lat","http://arxiv.org/licenses/nonexclusive-distrib/1.0/","  We present physical results for a variety of light hadronic quantities
obtained via a combined analysis of three 2+1 flavour domain wall fermion
ensemble sets. For two of our ensemble sets we used the Iwasaki gauge action
with beta=2.13 (a^-1=1.75(4) GeV) and beta=2.25 (a^-1=2.31(4) GeV) and lattice
sizes of 24^3 x 64 and 32^3 x 64 respectively, with unitary pion masses in the
range 293(5)-417(10) MeV. The extent L_s for the 5^th dimension of the domain
wall fermion formulation is L_s=16 in these ensembles. In this analysis we
include a third ensemble set that makes use of the novel Iwasaki+DSDR
(Dislocation Suppressing Determinant Ratio) gauge action at beta = 1.75
(a^-1=1.37(1) GeV) with a lattice size of 32^3 x 64 and L_s=32 to reach down to
partially-quenched pion masses as low as 143(1) MeV and a unitary pion mass of
171(1) MeV, while retaining good chiral symmetry and topological tunneling. We
demonstrate a significant improvement in our control over the chiral
extrapolation, resulting in much improved continuum predictions for the above
quantities. The main results of this analysis include the pion and kaon decay
constants, f_\pi=127(3)_{stat}(3)_{sys} MeV and f_K = 152(3)_{stat}(2)_{sys}
MeV respectively (f_K/f_\pi = 1.199(12)_{stat}(14)_{sys}); the average up/down
quark mass and the strange-quark mass in the MSbar-scheme at 3 GeV,
m_{ud}(MSbar, 3 GeV) = 3.05(8)_{stat}(6)_{sys} MeV and m_s(MSbar, 3 GeV) =
83.5(1.7)_{stat}(1.1)_{sys}; the neutral kaon mixing parameter in the
MSbar-scheme at 3 GeV, B_K(MSbar,3 GeV) = 0.535(8)_{stat}(13)_{sys}, and in the
RGI scheme, \hat B_K = 0.758(11)_{stat}(19)_{sys}; and the Sommer scales r_1 =
0.323(8)_{stat}(4)_{sys} fm and r_0 = 0.480(10)_{stat}(4)_{sys} (r_1/r_0 =
0.673(11)_{stat}(3)_{sys}). We also obtain values for the SU(2) ChPT effective
couplings, \bar{l_3} = 2.91(23)_{stat}(7)_{sys}$ and \bar{l_4} =
3.99(16)_{stat}(9)_{sys}.
","[{""version"":""v1"",""created"":""Wed, 22 Aug 2012 02:03:33 GMT""},{""version"":""v2"",""created"":""Thu, 2 Jan 2014 16:44:38 GMT""},{""version"":""v3"",""created"":""Fri, 18 Apr 2014 15:00:04 GMT""}]","2014-04-21"
"1208.4413","Jia-ju Zhang","Bin Chen and Jia-ju Zhang","Holographic Descriptions of Black Rings","23 pages, no figures; some text overlap with arXiv:1206.2015","JHEP 1211 (2012) 022","10.1007/JHEP11(2012)022",,"hep-th gr-qc","http://arxiv.org/licenses/nonexclusive-distrib/1.0/","  In this paper, we investigate the holographic descriptions of two kinds of
black rings, the neutral doubly rotating black ring and the dipole charged
black ring. For generic nonextremal black rings, the information of holographic
CFT duals, including the central charges and left- and right-moving
temperatures, could be read from the thermodynamics at the outer and inner
horizons, as suggested in arXiv:1206.2015. To confirm these pictures, we study
the extreme black rings in the well-established formalism. We compute the
central charges of dual CFTs by doing asymptotic symmetry group analysis in the
stretched horizon formalism, and find exact agreements. Moreover, we study the
superradiant scattering of a scalar field off the near-extremal black rings and
obtain the scattering amplitudes, which are in good match with the CFT
predictions.
","[{""version"":""v1"",""created"":""Wed, 22 Aug 2012 02:10:46 GMT""}]","2013-04-10"
"1208.4414","Paul Cuff","Paul Cuff, Thomas Cover, Gowtham Kumar, Lei Zhao","A Lattice of Gambles","ISIT 2011, 5 pages, 2 eps figures, uses IEEEtran.cls",,,,"math.PR cs.IT math.IT","http://arxiv.org/licenses/nonexclusive-distrib/1.0/","  A gambler walks into a hypothetical fair casino with a very real dollar bill,
but by the time he leaves he's exchanged the dollar for a random amount of
money. What is lost in the process? It may be that the gambler walks out at the
end of the day, after a roller-coaster ride of winning and losing, with his
dollar still intact, or maybe even with two dollars. But what the gambler loses
the moment he places his first bet is position. He exchanges one distribution
of money for a distribution of lesser quality, from which he cannot return. Our
first discussion in this work connects known results of economic inequality and
majorization to the probability theory of gambling and Martingales. We provide
a simple proof that fair gambles cannot increase the Lorenz curve, and we also
constructively demonstrate that any sequence of non-increasing Lorenz curves
corresponds to at least one Martingale.
  We next consider the efficiency of gambles. If all fair gambles are available
then one can move down the lattice of distributions defined by the Lorenz
ordering. However, the step from one distribution to the next is not unique. Is
there a sense of efficiency with which one can move down the Lorenz stream? One
approach would be to minimize the average total volume of money placed on the
table. In this case, it turns out that implementing part of the strategy using
private randomness can help reduce the need for the casino's randomness,
resulting in less money on the table that the casino cannot get its hands on.
","[{""version"":""v1"",""created"":""Wed, 22 Aug 2012 02:32:28 GMT""}]","2015-03-20"
"1208.4415","Paul Cuff","Paul Cuff","Distributed Channel Synthesis","To appear in IEEE Trans. on Information Theory (submitted Aug., 2012,
  accepted July, 2013), 26 pages, using IEEEtran.cls","IEEE Trans. on Inf. Theory, 59(11):7071-96, November, 2013","10.1109/TIT.2013.2279330",,"cs.IT math.IT","http://arxiv.org/licenses/nonexclusive-distrib/1.0/","  Two familiar notions of correlation are rediscovered as the extreme operating
points for distributed synthesis of a discrete memoryless channel, in which a
stochastic channel output is generated based on a compressed description of the
channel input. Wyner's common information is the minimum description rate
needed. However, when common randomness independent of the input is available,
the necessary description rate reduces to Shannon's mutual information. This
work characterizes the optimal trade-off between the amount of common
randomness used and the required rate of description. We also include a number
of related derivations, including the effect of limited local randomness, rate
requirements for secrecy, applications to game theory, and new insights into
common information duality.
  Our proof makes use of a soft covering lemma, known in the literature for its
role in quantifying the resolvability of a channel. The direct proof
(achievability) constructs a feasible joint distribution over all parts of the
system using a soft covering, from which the behavior of the encoder and
decoder is inferred, with no explicit reference to joint typicality or binning.
Of auxiliary interest, this work also generalizes and strengthens this soft
covering tool.
","[{""version"":""v1"",""created"":""Wed, 22 Aug 2012 02:45:28 GMT""},{""version"":""v2"",""created"":""Thu, 13 Jun 2013 19:59:37 GMT""},{""version"":""v3"",""created"":""Tue, 20 Aug 2013 17:32:37 GMT""}]","2016-11-18"
"1208.4416","Jie Zhou","Jie Zhou, Ning Ning Chung, Lock Yue Chew, Choy Heng Lai","Epidemic spreading induced by diversity of agents' mobility","8 pages, 5 figures","Physical Review E 86, 026115 (2012)","10.1103/PhysRevE.86.026115",,"physics.soc-ph","http://arxiv.org/licenses/nonexclusive-distrib/1.0/","  In this paper, we study into the impact of the preference of an individual
for public transport on the spread of infectious disease, through a quantity
known as the public mobility. Our theoretical and numerical results based on a
constructed model reveal that if the average public mobility of the agents is
fixed, an increase in the diversity of the agents' public mobility reduces the
epidemic threshold, beyond which an enhancement in the rate of infection is
observed. Our findings provide an approach to improve the resistance of a
society against infectious disease, while preserving the utilization rate of
the public transportation system.
","[{""version"":""v1"",""created"":""Wed, 22 Aug 2012 02:49:15 GMT""},{""version"":""v2"",""created"":""Thu, 23 Aug 2012 05:28:31 GMT""}]","2012-08-29"
"1208.4417","James Bolton","James S. Bolton (Nottingham), Martin G. Haehnelt (IoA/KICC, Cambridge)","On the rapid demise of Lyman-alpha emitters at z>7 due to the increasing
  incidence of optically thick absorption systems","11 pages, 6 figures, accepted to MNRAS",,"10.1093/mnras/sts455",,"astro-ph.CO","http://arxiv.org/licenses/nonexclusive-distrib/1.0/","  A variety of independent observational studies have now reported a
significant decline in the fraction of Lyman-break galaxies which exhibit Ly-a
emission over the redshift interval z=6-7. In combination with the strong
damping wing extending redward of Ly-a in the spectrum of the bright z=7.085
quasar ULAS 1120+0641, this has strengthened suggestions that the hydrogen in
the intergalactic medium (IGM) is still substantially neutral at z~7. Current
theoretical models imply HI fractions as large as 40-90 per cent may be
required to explain these data assuming there is no intrinsic evolution in the
Ly-a emitter population. We propose that such large neutral fractions are not
necessary. Based on a hydrodynamical simulation which reproduces the absorption
spectra of high-redshift (z~6-7) quasars, we demonstrate that the opacity of
the intervening IGM redward of rest-frame Ly-a can rise rapidly in average
regions of the Universe simply because of the increasing incidence of
absorption systems which are optically thick to Lyman continuum photons as the
tail-end of reionisation is approached. Our simulations suggest these data do
not require a large change in the IGM neutral fraction by several tens of per
cent from z=6-7, but may instead be indicative of the rapid decrease in the
typical mean free path for ionising photons expected during the final stages of
reionisation.
","[{""version"":""v1"",""created"":""Wed, 22 Aug 2012 02:50:45 GMT""},{""version"":""v2"",""created"":""Wed, 21 Nov 2012 11:04:50 GMT""}]","2015-06-11"
"1208.4418","Nick Cvetojevic","N. Cvetojevic, N. Jovanovic, C. Betters, J. S. Lawrence, S. C. Ellis,
  G. Robertson, and J. Bland-Hawthorn","First starlight spectrum captured using an integrated photonic
  micro-spectrograph","5 Pages, 4 Figures; A&A, Volume 544 (2012)",,"10.1051/0004-6361/201219116",,"astro-ph.IM physics.ins-det","http://arxiv.org/licenses/nonexclusive-distrib/1.0/","  Photonic technologies have received growing consideration for incorporation
into next-generation astronomical instrumentation, owing to their miniature
footprint and inherent robustness. In this paper we present results from the
first on-telescope demonstration of a miniature photonic spectrograph for
astronomy, by obtaining spectra spanning the entire H-band from several stellar
targets. The prototype was tested on the 3.9 m Anglo-Australian telescope. In
particular, we present a spectrum of the variable star Pi 01 Gru, with observed
CO molecular absorption bands, at a resolving power R = 2500 at 1600 nm.
Furthermore, we successfully demonstrate the simultaneous acquisition of
multiple spectra with a single spectrograph chip by using multiple fibre
inputs.
","[{""version"":""v1"",""created"":""Wed, 22 Aug 2012 02:57:29 GMT""}]","2012-08-23"
"1208.4419","Yb Gao","X. Xiao and Y. B. Gao","Decay process of quantum open system at finite-temperature",,"Commun. Theor. Phys. 58 (2012) 251","10.1088/0253-6102/58/2/14",,"quant-ph","http://arxiv.org/licenses/nonexclusive-distrib/1.0/","  Starting from the formal solution to the Heisenberg equation, we revisit an
universal model for a quantum open system with a harmonic oscillator linearly
coupled to a boson bath. The analysis of the decay process for a Fock state and
a coherent state demonstrate that this method is very useful in dealing with
the problems in decay process of the open system. For finite temperature, the
calculations of the reduced density matrix and the mean excitation number for
the open system show that an initial coherent state will evolve into a
temperature-dependant coherent state after tracing over the bath variables.
Also in short-time limit, a temperature-dependant effective Hamiltonian for the
open system characterizes the decay process of the open system.
","[{""version"":""v1"",""created"":""Wed, 22 Aug 2012 02:58:02 GMT""}]","2015-06-11"
"1208.4420","Stephen Eckel","S. Eckel, A. O. Sushkov, S. K. Lamoreaux","A limit on the electron electric dipole moment using paramagnetic
  ferroelectric Eu$_{0.5}$Ba$_{0.5}$TiO$_3$","5 pages, 4 figures","Phys. Rev. Lett. 109, 193003 (2012)","10.1103/PhysRevLett.109.193003",,"physics.atom-ph","http://arxiv.org/licenses/nonexclusive-distrib/1.0/","  We report on the results of a search for the electron electric dipole moment
$d_e$ using paramagnetic ferroelectric Eu$_{0.5}$Ba$_{0.5}$TiO$_3$. The
electric polarization creates an effective electric field that makes it
energetically favorable for the spins of the seven unpaired $4f$ electrons of
the Eu$^{2+}$ to orient along the polarization, provided that $d_e\neq 0$. This
interaction gives rise to sample magnetization, correlated with its electric
polarization, and is therefore equivalent to a linear magnetoelectric effect. A
SQUID magnetometer is used to search for the resulting magnetization. We obtain
$d_e = (-1.07\pm3.06_\text{stat}\pm 1.74_\text{sys})\times10^{-25}\ecm$,
implying an upper limit of $|d_e|<6.05\times10^{-25}\ecm$ (90% confidence).
","[{""version"":""v1"",""created"":""Wed, 22 Aug 2012 03:13:31 GMT""},{""version"":""v2"",""created"":""Sun, 18 Nov 2012 17:42:11 GMT""}]","2012-11-28"
"1208.4421","Samuel Rooney","S. J. Rooney, T. W. Neely, B. P. Anderson, A. S. Bradley","Persistent current formation in a high-temperature Bose-Einstein
  condensate: an experimental test for c-field theory","v2: 7 pages, 3 figures, new experimental data and numerical
  simulations","Phys. Rev. A 88, 063620 (2013)","10.1103/PhysRevA.88.063620",,"cond-mat.quant-gas","http://arxiv.org/licenses/nonexclusive-distrib/1.0/","  Experimental stirring of a toroidally trapped Bose-Einstein condensate at
high temperature generates a disordered array of quantum vortices that decays
via thermal dissipation to form a macroscopic persistent current [T. W. Neely
em et al. arXiv:1204.1102 (2012)]. We perform 3D numerical simulations of the
experimental sequence within the Stochastic Projected Gross-Pitaevskii equation
using ab initio determined reservoir parameters. We find that both damping and
noise are essential for describing the dynamics of the high-temperature Bose
field. The theory gives a quantitative account of the formation of a persistent
current, with no fitted parameters.
","[{""version"":""v1"",""created"":""Wed, 22 Aug 2012 04:43:46 GMT""},{""version"":""v2"",""created"":""Thu, 24 Oct 2013 01:55:25 GMT""}]","2014-05-08"
"1208.4422","Yuqin Yao","Yuqin Yao, Yehui Huang, Yunbo Zeng","A new $(\gamma_n,\sigma_k)-$ KP hierarchy and generalized dressing
  method","14 pages, to appear in Journal of Nonlinear Mathematical Physics",,"10.1142/S1402925112500271",,"nlin.SI","http://arxiv.org/licenses/nonexclusive-distrib/1.0/","  A new (\gamma_n,\sigma_k)-KP hierarchy with two new time series \gamma_n and
\sigma_k, which consists of \gamma_n-flow, \sigma_k-flow and mixed \gamma_n and
\sigma_k evolution equations of eigenfunctions, is proposed. Two reductions and
constrained flows of (\gamma_n,\sigma_k)-KP hierarchy are studied. The dressing
method is generalized to the (\gamma_n,\sigma_k)-KP hierarchy and some
solutions are presented.
","[{""version"":""v1"",""created"":""Wed, 22 Aug 2012 04:55:08 GMT""}]","2016-11-03"
"1208.4423","Feng Jiang","Feng Jiang and Jie Chen and A. Lee Swindlehurst","Estimation in Phase-Shift and Forward Wireless Sensor Networks","28 pages, 5 figures, accepted by IEEE Transactions on Signal
  Processing, Apr. 2013",,"10.1109/TSP.2013.2260333",,"cs.IT math.IT","http://arxiv.org/licenses/nonexclusive-distrib/1.0/","  We consider a network of single-antenna sensors that observe an unknown
deterministic parameter. Each sensor applies a phase shift to the observation
and the sensors simultaneously transmit the result to a multi-antenna fusion
center (FC). Based on its knowledge of the wireless channel to the sensors, the
FC calculates values for the phase factors that minimize the variance of the
parameter estimate, and feeds this information back to the sensors. The use of
a phase-shift-only transmission scheme provides a simplified analog
implementation at the sensor, and also leads to a simpler algorithm design and
performance analysis. We propose two algorithms for this problem, a numerical
solution based on a relaxed semidefinite programming problem, and a closed-form
solution based on the analytic constant modulus algorithm. Both approaches are
shown to provide performance close to the theoretical bound. We derive
asymptotic performance analyses for cases involving large numbers of sensors or
large numbers of FC antennas, and we also study the impact of phase errors at
the sensor transmitters. Finally, we consider the sensor selection problem, in
which only a subset of the sensors is chosen to send their observations to the
FC.
","[{""version"":""v1"",""created"":""Wed, 22 Aug 2012 05:16:18 GMT""},{""version"":""v2"",""created"":""Fri, 19 Apr 2013 07:20:40 GMT""}]","2015-06-11"
"1208.4424","Zubin Jacob","Yu Guo, Cristian L. Cortes, Sean Molesky and Zubin Jacob","Broadband super-Planckian thermal emission from hyperbolic metamaterials",,"Appl. Phys. Lett. 101, 131106 (2012)","10.1063/1.4754616",,"physics.optics cond-mat.mes-hall cond-mat.mtrl-sci","http://arxiv.org/licenses/nonexclusive-distrib/1.0/","  We develop the fluctuational electrodynamics of metamaterials with hyperbolic
dispersion and show the existence of broadband thermal emission beyond the
black body limit in the near field. This arises due to the thermal excitation
of unique bulk metamaterial modes, which do not occur in conventional media. We
consider a practical realization of the hyperbolic metamaterial and estimate
that the effect will be observable using the characteristic dispersion
(topological transitions) of the metamaterial states. Our work paves the way
for engineering the near-field thermal emission using metamaterials.
","[{""version"":""v1"",""created"":""Wed, 22 Aug 2012 05:34:30 GMT""}]","2012-09-26"
"1208.4425","Pavel M. Lushnikov","Pavel M. Lushnikov, Sergey A. Dyachenko and Natalia Vladimirova","Beyond leading order logarithmic scaling in the catastrophic
  self-focusing (collapse) of a laser beam in Kerr media","9 pages, 5 figures; extended text compare with previous version","Physical Review A, v. 88, 013845 (2013)","10.1103/PhysRevA.88.013845",,"nlin.PS math.AP physics.optics","http://arxiv.org/licenses/nonexclusive-distrib/1.0/","  We study the catastrophic stationary self-focusing (collapse) of laser beam
in nonlinear Kerr media. The width of a self-similar solutions near collapse
distance $z=z_c$ obeys $(z_c-z)^{1/2}$ scaling law with the well-known leading
order modification of loglog type $\propto (\ln|\ln(z_c-z)|)^{-1/2}$. We show
that the validity of the loglog modification requires double-exponentially
large amplitudes of the solution $\sim {10^{10}}^{100}$, which is unrealistic
to achieve in either physical experiments or numerical simulations. We derive a
new equation for the adiabatically slow parameter which determines the system
self-focusing across a large range of solution amplitudes. Based on this
equation we develop a perturbation theory for scaling modifications beyond the
leading loglog. We show that for the initial pulse with the optical power
moderately above ($\lesssim 1.2$) the critical power of self-focusing, the new
scaling agrees with numerical simulations beginning with amplitudes around only
three times above of the initial pulse.
","[{""version"":""v1"",""created"":""Wed, 22 Aug 2012 05:37:42 GMT""},{""version"":""v2"",""created"":""Tue, 19 Feb 2013 00:33:17 GMT""}]","2013-07-30"
"1208.4426","Akitaka Nakanishi","Akitaka Nakanishi and Hiroshi Katayama-Yoshida","Chemical Trend of Superconducting Transition Temperature in Hole-doped
  Delafossite of CuAlO_2, AgAlO_2 and AuAlO_2","9 pages, 6 figures, 1 tables, SSC in printing","Solid State Communications 152 (2012), pp. 2078-2081","10.1016/j.ssc.2012.08.017",,"cond-mat.supr-con","http://arxiv.org/licenses/nonexclusive-distrib/1.0/","  We have performed the first-principles calculations about the superconducting
transition temperature T_c of hole-doped delafossite CuAlO_2, AgAlO_2 and
AuAlO_2. Calculated T_c are about 50 K(CuAlO_2), 40 K(AgAlO_2) and 3 K(AuAlO_2)
at maximum in the optimum hole-doping concentration. The low T_c of AuAlO_2 is
attributed to the weak electron-phonon interaction caused by the low covalency
and heavy atomic mass.
","[{""version"":""v1"",""created"":""Wed, 22 Aug 2012 05:58:22 GMT""}]","2012-12-10"
"1208.4427","Wayne Rossman F","Wayne Rossman, Masashi Yasumoto","Weierstrass representation for semi-discrete minimal surfaces, and
  comparison of various discretized catenoids",,"J Math-for-Ind 4B (2012) 109-118",,,"math.DG","http://arxiv.org/licenses/nonexclusive-distrib/1.0/","  We give a Weierstrass type representation for semi-discrete minimal surfaces
in Euclidean 3-space. We then give explicit parametrizations of various smooth,
semi-discrete and fully-discrete catenoids, determined from either variational
or integrable systems principles. Finally, we state the shared properties that
those various catenoids have.
","[{""version"":""v1"",""created"":""Wed, 22 Aug 2012 06:05:16 GMT""}]","2017-09-22"
"1208.4428","Hiroshi Isozaki","Hiroshi Isozaki and Hisashi Morioka","A Rellich Type Theorem for Discrete Schr{\""o}dinger Operators","16 pages",,,,"math.SP","http://arxiv.org/licenses/nonexclusive-distrib/1.0/","  An analogue of Rellich's theorem is proved for discrete Laplacian on square
lattice, and applied to show unique continuation property on certain domains as
well as non-existence of embedded eigenvalues for discrete Schr{\""o}dinger
operators.
","[{""version"":""v1"",""created"":""Wed, 22 Aug 2012 06:09:16 GMT""},{""version"":""v2"",""created"":""Wed, 24 Jul 2013 04:59:29 GMT""}]","2013-07-25"
